Sheet: 寻宝配置表
A1: 序号 | B1: 类型 | C1: 值 | D1: 名称 | E1: 类型概率 | F1: 值概率 | G1: 实际概率
A2: id | B2: type | C2: value | D2: name | E2: type_rate | F2: value_rate | G2: rate
A3: 0 | B3: power | C3: 10 | D3: 体力 | E3: 30 | F3: 60 | G3: =RC[-2]*RC[-1]/100 -> 18
A4: 1 | B4: power | C4: 50 | D4: 体力 | E4: 30 | F4: 30 | G4: =RC[-2]*RC[-1]/100 -> 9
A5: 2 | B5: power | C5: 100 | D5: 体力 | E5: 30 | F5: 10 | G5: =RC[-2]*RC[-1]/100 -> 3
A6: 3 | B6: elixir | C6: 10 | D6: 仙丹 | E6: 15 | F6: 60 | G6: =RC[-2]*RC[-1]/100 -> 9
A7: 4 | B7: elixir | C7: 100 | D7: 仙丹 | E7: 15 | F7: 39 | G7: =RC[-2]*RC[-1]/100 -> 5.85
A8: 5 | B8: elixir | C8: 5000 | D8: 仙丹 | E8: 15 | F8: 1 | G8: =RC[-2]*RC[-1]/100 -> 0.15
A9: 6 | B9: spirit | C9: 50 | D9: 灵气 | E9: 10 | F9: 60 | G9: =RC[-2]*RC[-1]/100 -> 6
A10: 7 | B10: spirit | C10: 100 | D10: 灵气 | E10: 10 | F10: 39 | G10: =RC[-2]*RC[-1]/100 -> 3.9
A11: 8 | B11: spirit | C11: 1000 | D11: 灵气 | E11: 10 | F11: 1 | G11: =RC[-2]*RC[-1]/100 -> 0.1
A12: 9 | B12: skillPoint | C12: 100 | D12: 技能点 | E12: 10 | F12: 60 | G12: =RC[-2]*RC[-1]/100 -> 6
A13: 10 | B13: skillPoint | C13: 500 | D13: 技能点 | E13: 10 | F13: 39 | G13: =RC[-2]*RC[-1]/100 -> 3.9
A14: 11 | B14: skillPoint | C14: 10000 | D14: 技能点 | E14: 10 | F14: 1 | G14: =RC[-2]*RC[-1]/100 -> 0.1
A15: 12 | B15: energy | C15: 50 | D15: 活力 | E15: 10 | F15: 60 | G15: =RC[-2]*RC[-1]/100 -> 6
A16: 13 | B16: energy | C16: 100 | D16: 活力 | E16: 10 | F16: 39 | G16: =RC[-2]*RC[-1]/100 -> 3.9
A17: 14 | B17: energy | C17: 5000 | D17: 活力 | E17: 10 | F17: 1 | G17: =RC[-2]*RC[-1]/100 -> 0.1
A18: 15 | B18: money | C18: 1000 | D18: 铜板 | E18: 15 | F18: 60 | G18: =RC[-2]*RC[-1]/100 -> 9
A19: 16 | B19: money | C19: 10000 | D19: 铜板 | E19: 15 | F19: 39 | G19: =RC[-2]*RC[-1]/100 -> 5.85
A20: 17 | B20: money | C20: 200000 | D20: 铜板 | E20: 15 | F20: 1 | G20: =RC[-2]*RC[-1]/100 -> 0.15
A21: 18 | B21: gold | C21: 10 | D21: 元宝 | E21: 10 | F21: 99 | G21: =RC[-2]*RC[-1]/100 -> 9.9
A22: 19 | B22: gold | C22: 500 | D22: 元宝 | E22: 10 | F22: 1 | G22: =RC[-2]*RC[-1]/100 -> 0.1

Sheet: export
A1: sheet_name | B1: export_name | C1: merge_to
A2: 寻宝配置表 | B2: treasure_hunt