Sheet: 神仙卡牌配置表
A1: id | B1: 系列ID | C1: 名称 | D1: 星级 | E1: 等级 | F1: 攻击力 | G1: 生命值 | H1: 技能ID | I1: 卡牌组合 | J1: 组合效果(1代表攻击力，2代表生命值) | K1: 卡牌描述
A2: id | B2: number | C2: name | D2: star | E2: lv | F2: atk | G2: hp | H2: skill_id | I2: group | J2: effetc_type | K2: descrption
A3: 1 | B3: 1 | C3: 玉帝1 | D3: 1 | E3: 1 | F3: 59 | G3: 120 | H3: 1
A4: 2 | B4: 1 | C4: 玉帝2 | D4: 2 | E4: 1 | F4: 100 | G4: 195 | H4: 1
A5: 3 | B5: 1 | C5: 玉帝3 | D5: 3 | E5: 1 | F5: 149 | G5: 355 | H5: 1 | I5: 48 | J5: 1
A6: 4 | B6: 1 | C6: 玉帝4 | D6: 4 | E6: 1 | F6: 238 | G6: 516 | H6: 1 | I6: 47,49 | J6: 2
A7: 5 | B7: 1 | C7: 玉帝5 | D7: 5 | E7: 1 | F7: 378 | G7: 821 | H7: 1 | I7: 46,47,49 | J7: 1
A8: 6 | B8: 2 | C8: 悟空1 | D8: 1 | E8: 1 | F8: 45 | G8: 140 | H8: 2
A9: 7 | B9: 2 | C9: 悟空2 | D9: 2 | E9: 1 | F9: 79 | G9: 221 | H9: 2
A10: 8 | B10: 2 | C10: 悟空3 | D10: 3 | E10: 1 | F10: 118 | G10: 390 | H10: 2 | I10: 48 | J10: 1
A11: 9 | B11: 2 | C11: 悟空4 | D11: 4 | E11: 1 | F11: 199 | G11: 552 | H11: 2 | I11: 47,49 | J11: 2
A12: 10 | B12: 2 | C12: 悟空5 | D12: 5 | E12: 1 | F12: 327 | G12: 878 | H12: 2 | I12: 46,47,49 | J12: 1
A13: 11 | B13: 3 | C13: 沙僧1 | D13: 1 | E13: 1 | F13: 51 | G13: 129 | H13: 3
A14: 12 | B14: 3 | C14: 沙僧2 | D14: 2 | E14: 1 | F14: 82 | G14: 208 | H14: 3
A15: 13 | B15: 3 | C15: 沙僧3 | D15: 3 | E15: 1 | F15: 123 | G15: 357 | H15: 3 | I15: 48 | J15: 1
A16: 14 | B16: 3 | C16: 沙僧4 | D16: 4 | E16: 1 | F16: 209 | G16: 526 | H16: 3 | I16: 47,49 | J16: 2
A17: 15 | B17: 3 | C17: 沙僧5 | D17: 5 | E17: 1 | F17: 327 | G17: 825 | H17: 3 | I17: 46,47,49 | J17: 1
A18: 16 | B18: 4 | C18: 女娲1 | D18: 1 | E18: 1 | F18: 47 | G18: 131 | H18: 4
A19: 17 | B19: 4 | C19: 女娲2 | D19: 2 | E19: 1 | F19: 75 | G19: 211 | H19: 4
A20: 18 | B20: 4 | C20: 女娲3 | D20: 3 | E20: 1 | F20: 120 | G20: 367 | H20: 4 | I20: 48 | J20: 1
A21: 19 | B21: 4 | C21: 女娲4 | D21: 4 | E21: 1 | F21: 199 | G21: 530 | H21: 4 | I21: 47,49 | J21: 2
A22: 20 | B22: 4 | C22: 女娲5 | D22: 5 | E22: 1 | F22: 321 | G22: 829 | H22: 4 | I22: 46,47,49 | J22: 1
A23: 21 | B23: 5 | C23: 后裔1 | D23: 1 | E23: 1 | F23: 53 | G23: 121 | H23: 5
A24: 22 | B24: 5 | C24: 后裔2 | D24: 2 | E24: 1 | F24: 82 | G24: 195 | H24: 5
A25: 23 | B25: 5 | C25: 后裔3 | D25: 3 | E25: 1 | F25: 119 | G25: 354 | H25: 5 | I25: 48 | J25: 1
A26: 24 | B26: 5 | C26: 后裔4 | D26: 4 | E26: 1 | F26: 195 | G26: 517 | H26: 5 | I26: 47,49 | J26: 2
A27: 25 | B27: 5 | C27: 后裔5 | D27: 5 | E27: 1 | F27: 328 | G27: 822 | H27: 5 | I27: 46,47,49 | J27: 1
A28: 26 | B28: 6 | C28: 吴刚1 | D28: 1 | E28: 1 | F28: 61 | G28: 115 | H28: 6
A29: 27 | B29: 6 | C29: 吴刚2 | D29: 2 | E29: 1 | F29: 95 | G29: 186 | H29: 6
A30: 28 | B30: 6 | C30: 吴刚3 | D30: 3 | E30: 1 | F30: 141 | G30: 341 | H30: 6 | I30: 48 | J30: 1
A31: 29 | B31: 6 | C31: 吴刚4 | D31: 4 | E31: 1 | F31: 234 | G31: 519 | H31: 6 | I31: 47,49 | J31: 2
A32: 30 | B32: 6 | C32: 吴刚5 | D32: 5 | E32: 1 | F32: 375 | G32: 813 | H32: 6 | I32: 46,47,49 | J32: 1
A33: 31 | B33: 7 | C33: 玉兔1 | D33: 1 | E33: 1 | F33: 51 | G33: 130 | H33: 7
A34: 32 | B34: 7 | C34: 玉兔2 | D34: 2 | E34: 1 | F34: 82 | G34: 220 | H34: 7
A35: 33 | B35: 7 | C35: 玉兔3 | D35: 3 | E35: 1 | F35: 123 | G35: 390 | H35: 7 | I35: 48 | J35: 1
A36: 34 | B36: 7 | C36: 玉兔4 | D36: 4 | E36: 1 | F36: 204 | G36: 550 | H36: 7 | I36: 47,49 | J36: 2
A37: 35 | B37: 7 | C37: 玉兔5 | D37: 5 | E37: 1 | F37: 336 | G37: 855 | H37: 7 | I37: 46,47,49 | J37: 1
A38: 36 | B38: 8 | C38: 王母1 | D38: 1 | E38: 1 | F38: 56 | G38: 134 | H38: 8
A39: 37 | B39: 8 | C39: 王母2 | D39: 2 | E39: 1 | F39: 86 | G39: 226 | H39: 8
A40: 38 | B40: 8 | C40: 王母3 | D40: 3 | E40: 1 | F40: 129 | G40: 393 | H40: 8 | I40: 48 | J40: 1
A41: 39 | B41: 8 | C41: 王母4 | D41: 4 | E41: 1 | F41: 209 | G41: 556 | H41: 8 | I41: 47,49 | J41: 2
A42: 40 | B42: 8 | C42: 王母5 | D42: 5 | E42: 1 | F42: 333 | G42: 859 | H42: 8 | I42: 46,47,49 | J42: 1
A43: 41 | B43: 9 | C43: 玉帝1 | D43: 1 | E43: 1 | F43: 53 | G43: 139 | H43: 9
A44: 42 | B44: 9 | C44: 玉帝2 | D44: 2 | E44: 1 | F44: 86 | G44: 223 | H44: 9
A45: 43 | B45: 9 | C45: 玉帝3 | D45: 3 | E45: 1 | F45: 127 | G45: 392 | H45: 9 | I45: 48 | J45: 1
A46: 44 | B46: 9 | C46: 玉帝4 | D46: 4 | E46: 1 | F46: 206 | G46: 556 | H46: 9 | I46: 47,49 | J46: 2
A47: 45 | B47: 9 | C47: 玉帝5 | D47: 5 | E47: 1 | F47: 337 | G47: 857 | H47: 9 | I47: 46,47,49 | J47: 1
A48: 46 | B48: 10 | C48: 妲己1 | D48: 1 | E48: 1 | F48: 53 | G48: 140 | H48: 10
A49: 47 | B49: 10 | C49: 妲己2 | D49: 2 | E49: 1 | F49: 86 | G49: 227 | H49: 10
A50: 48 | B50: 10 | C50: 妲己3 | D50: 3 | E50: 1 | F50: 129 | G50: 389 | H50: 10 | I50: 48 | J50: 1
A51: 49 | B51: 10 | C51: 妲己4 | D51: 4 | E51: 1 | F51: 208 | G51: 559 | H51: 10 | I51: 47,49 | J51: 2
A52: 50 | B52: 10 | C52: 妲己5 | D52: 5 | E52: 1 | F52: 331 | G52: 860 | H52: 10 | I52: 46,47,49 | J52: 1
A53: 51 | B53: 11 | C53: 八戒1 | D53: 1 | E53: 1 | F53: 55 | G53: 120 | H53: 11
A54: 52 | B54: 11 | C54: 八戒2 | D54: 2 | E54: 1 | F54: 85 | G54: 195 | H54: 11
A55: 53 | B55: 11 | C55: 八戒3 | D55: 3 | E55: 1 | F55: 140 | G55: 354 | H55: 11 | I55: 48 | J55: 1
A56: 54 | B56: 11 | C56: 八戒4 | D56: 4 | E56: 1 | F56: 235 | G56: 516 | H56: 11 | I56: 47,49 | J56: 2
A57: 55 | B57: 11 | C57: 八戒5 | D57: 5 | E57: 1 | F57: 370 | G57: 823 | H57: 11 | I57: 46,47,49 | J57: 1
A58: 56 | B58: 12 | C58: 财神1 | D58: 1 | E58: 1 | F58: 54 | G58: 125 | H58: 12
A59: 57 | B59: 12 | C59: 财神2 | D59: 2 | E59: 1 | F59: 88 | G59: 190 | H59: 12
A60: 58 | B60: 12 | C60: 财神3 | D60: 3 | E60: 1 | F60: 145 | G60: 350 | H60: 12 | I60: 48 | J60: 1
A61: 59 | B61: 12 | C61: 财神4 | D61: 4 | E61: 1 | F61: 240 | G61: 515 | H61: 12 | I61: 47,49 | J61: 2
A62: 60 | B62: 12 | C62: 财神5 | D62: 5 | E62: 1 | F62: 375 | G62: 821 | H62: 12 | I62: 46,47,49 | J62: 1
A63: 61 | B63: 13 | C63: 巨灵神1 | D63: 1 | E63: 1 | F63: 58 | G63: 120 | H63: 13
A64: 62 | B64: 13 | C64: 巨灵神2 | D64: 2 | E64: 1 | F64: 87 | G64: 192 | H64: 13
A65: 63 | B65: 13 | C65: 巨灵神3 | D65: 3 | E65: 1 | F65: 149 | G65: 355 | H65: 13 | I65: 48 | J65: 1
A66: 64 | B66: 13 | C66: 巨灵神4 | D66: 4 | E66: 1 | F66: 241 | G66: 511 | H66: 13 | I66: 47,49 | J66: 2
A67: 65 | B67: 13 | C67: 巨灵神5 | D67: 5 | E67: 1 | F67: 379 | G67: 828 | H67: 13 | I67: 46,47,49 | J67: 1
A68: 66 | B68: 14 | C68: 夜行者1 | D68: 1 | E68: 1 | F68: 51 | G68: 130 | H68: 14
A69: 67 | B69: 14 | C69: 夜行者2 | D69: 2 | E69: 1 | F69: 81 | G69: 221 | H69: 14
A70: 68 | B70: 14 | C70: 夜行者3 | D70: 3 | E70: 1 | F70: 123 | G70: 375 | H70: 14 | I70: 48 | J70: 1
A71: 69 | B71: 14 | C71: 夜行者4 | D71: 4 | E71: 1 | F71: 202 | G71: 512 | H71: 14 | I71: 47,49 | J71: 2
A72: 70 | B72: 14 | C72: 夜行者5 | D72: 5 | E72: 1 | F72: 332 | G72: 815 | H72: 14 | I72: 46,47,49 | J72: 1
A73: 71 | B73: 15 | C73: 精卫1 | D73: 1 | E73: 1 | F73: 53 | G73: 126 | H73: 15
A74: 72 | B74: 15 | C74: 精卫2 | D74: 2 | E74: 1 | F74: 83 | G74: 224 | H74: 15
A75: 73 | B75: 15 | C75: 精卫3 | D75: 3 | E75: 1 | F75: 125 | G75: 374 | H75: 15 | I75: 48 | J75: 1
A76: 74 | B76: 15 | C76: 精卫4 | D76: 4 | E76: 1 | F76: 205 | G76: 516 | H76: 15 | I76: 47,49 | J76: 2
A77: 75 | B77: 15 | C77: 精卫5 | D77: 5 | E77: 1 | F77: 336 | G77: 820 | H77: 15 | I77: 46,47,49 | J77: 1
A78: 76 | B78: 16 | C78: 太白金星1 | D78: 1 | E78: 1 | F78: 55 | G78: 121 | H78: 16
A79: 77 | B79: 16 | C79: 太白金星2 | D79: 2 | E79: 1 | F79: 85 | G79: 228 | H79: 16
A80: 78 | B80: 16 | C80: 太白金星3 | D80: 3 | E80: 1 | F80: 126 | G80: 375 | H80: 16 | I80: 48 | J80: 1
A81: 79 | B81: 16 | C81: 太白金星4 | D81: 4 | E81: 1 | F81: 201 | G81: 520 | H81: 16 | I81: 47,49 | J81: 2
A82: 80 | B82: 16 | C82: 太白金星5 | D82: 5 | E82: 1 | F82: 330 | G82: 825 | H82: 16 | I82: 46,47,49 | J82: 1
A83: 81 | B83: 17 | C83: 土地老1 | D83: 1 | E83: 1 | F83: 56 | G83: 129 | H83: 17
A84: 82 | B84: 17 | C84: 土地老2 | D84: 2 | E84: 1 | F84: 88 | G84: 226 | H84: 17
A85: 83 | B85: 17 | C85: 土地老3 | D85: 3 | E85: 1 | F85: 122 | G85: 375 | H85: 17 | I85: 48 | J85: 1
A86: 84 | B86: 17 | C86: 土地老4 | D86: 4 | E86: 1 | F86: 203 | G86: 519 | H86: 17 | I86: 47,49 | J86: 2
A87: 85 | B87: 17 | C87: 土地老5 | D87: 5 | E87: 1 | F87: 340 | G87: 830 | H87: 17 | I87: 46,47,49 | J87: 1
A88: 86 | B88: 18 | C88: 夸父1 | D88: 1 | E88: 1 | F88: 58 | G88: 122 | H88: 18
A89: 87 | B89: 18 | C89: 夸父2 | D89: 2 | E89: 1 | F89: 88 | G89: 222 | H89: 18
A90: 88 | B90: 18 | C90: 夸父3 | D90: 3 | E90: 1 | F90: 129 | G90: 380 | H90: 18 | I90: 48 | J90: 1
A91: 89 | B91: 18 | C91: 夸父4 | D91: 4 | E91: 1 | F91: 207 | G91: 524 | H91: 18 | I91: 47,49 | J91: 2
A92: 90 | B92: 18 | C92: 夸父5 | D92: 5 | E92: 1 | F92: 339 | G92: 831 | H92: 18 | I92: 46,47,49 | J92: 1
A93: 91 | B93: 19 | C93: 盘古1 | D93: 1 | E93: 1 | F93: 53 | G93: 126 | H93: 19
A94: 92 | B94: 19 | C94: 盘古2 | D94: 2 | E94: 1 | F94: 83 | G94: 224 | H94: 19
A95: 93 | B95: 19 | C95: 盘古3 | D95: 3 | E95: 1 | F95: 125 | G95: 374 | H95: 19 | I95: 48 | J95: 1
A96: 94 | B96: 19 | C96: 盘古4 | D96: 4 | E96: 1 | F96: 205 | G96: 516 | H96: 19 | I96: 47,49 | J96: 2
A97: 95 | B97: 19 | C97: 盘古5 | D97: 5 | E97: 1 | F97: 336 | G97: 820 | H97: 19 | I97: 46,47,49 | J97: 1
A98: 96 | B98: 20 | C98: 黑无常1 | D98: 1 | E98: 1 | F98: 60 | G98: 120 | H98: 20
A99: 97 | B99: 20 | C99: 黑无常2 | D99: 2 | E99: 1 | F99: 100 | G99: 190 | H99: 20
A100: 98 | B100: 20 | C100: 黑无常3 | D100: 3 | E100: 1 | F100: 150 | G100: 345 | H100: 20 | I100: 48 | J100: 1
A101: 99 | B101: 20 | C101: 黑无常4 | D101: 4 | E101: 1 | F101: 240 | G101: 510 | H101: 20 | I101: 47,49 | J101: 2
A102: 100 | B102: 20 | C102: 黑无常5 | D102: 5 | E102: 1 | F102: 380 | G102: 801 | H102: 20 | I102: 46,47,49 | J102: 1
A103: 101 | B103: 21 | C103: 白无常1 | D103: 1 | E103: 1 | F103: 51 | G103: 140 | H103: 21
A104: 102 | B104: 21 | C104: 白无常2 | D104: 2 | E104: 1 | F104: 82 | G104: 230 | H104: 21
A105: 103 | B105: 21 | C105: 白无常3 | D105: 3 | E105: 1 | F105: 131 | G105: 408 | H105: 21 | I105: 48 | J105: 1
A106: 104 | B106: 21 | C106: 白无常4 | D106: 4 | E106: 1 | F106: 222 | G106: 572 | H106: 21 | I106: 47,49 | J106: 2
A107: 105 | B107: 21 | C107: 白无常5 | D107: 5 | E107: 1 | F107: 351 | G107: 875 | H107: 21 | I107: 46,47,49 | J107: 1
A108: 106 | B108: 22 | C108: 大黑鬼1 | D108: 1 | E108: 1 | F108: 52 | G108: 141 | H108: 22
A109: 107 | B109: 22 | C109: 大黑鬼2 | D109: 2 | E109: 1 | F109: 82 | G109: 232 | H109: 22
A110: 108 | B110: 22 | C110: 大黑鬼3 | D110: 3 | E110: 1 | F110: 135 | G110: 712 | H110: 22 | I110: 48 | J110: 1
A111: 109 | B111: 22 | C111: 大黑鬼4 | D111: 4 | E111: 1 | F111: 226 | G111: 575 | H111: 22 | I111: 47,49 | J111: 2
A112: 110 | B112: 22 | C112: 大黑鬼5 | D112: 5 | E112: 1 | F112: 353 | G112: 872 | H112: 22 | I112: 46,47,49 | J112: 1
A113: 111 | B113: 23 | C113: 玉兔1 | D113: 1 | E113: 1 | F113: 55 | G113: 144 | H113: 23
A114: 112 | B114: 23 | C114: 玉兔2 | D114: 2 | E114: 1 | F114: 85 | G114: 231 | H114: 23
A115: 113 | B115: 23 | C115: 玉兔3 | D115: 3 | E115: 1 | F115: 138 | G115: 711 | H115: 23 | I115: 48 | J115: 1
A116: 114 | B116: 23 | C116: 玉兔4 | D116: 4 | E116: 1 | F116: 227 | G116: 574 | H116: 23 | I116: 47,49 | J116: 2
A117: 115 | B117: 23 | C117: 玉兔5 | D117: 5 | E117: 1 | F117: 349 | G117: 873 | H117: 23 | I117: 46,47,49 | J117: 1
A118: 116 | B118: 24 | C118: 青蛇1 | D118: 1 | E118: 1 | F118: 48 | G118: 145 | H118: 24
A119: 117 | B119: 24 | C119: 青蛇2 | D119: 2 | E119: 1 | F119: 75 | G119: 230 | H119: 24
A120: 118 | B120: 24 | C120: 青蛇3 | D120: 3 | E120: 1 | F120: 116 | G120: 405 | H120: 24 | I120: 48 | J120: 1
A121: 119 | B121: 24 | C121: 青蛇4 | D121: 4 | E121: 1 | F121: 198 | G121: 598 | H121: 24 | I121: 47,49 | J121: 2
A122: 120 | B122: 24 | C122: 青蛇5 | D122: 5 | E122: 1 | F122: 323 | G122: 902 | H122: 24 | I122: 46,47,49 | J122: 1
A123: 121 | B123: 25 | C123: 海神1 | D123: 1 | E123: 1 | F123: 46 | G123: 146 | H123: 25
A124: 122 | B124: 25 | C124: 海神2 | D124: 2 | E124: 1 | F124: 76 | G124: 231 | H124: 25
A125: 123 | B125: 25 | C125: 海神3 | D125: 3 | E125: 1 | F125: 114 | G125: 408 | H125: 25 | I125: 48 | J125: 1
A126: 124 | B126: 25 | C126: 海神4 | D126: 4 | E126: 1 | F126: 196 | G126: 600 | H126: 25 | I126: 47,49 | J126: 2
A127: 125 | B127: 25 | C127: 海神5 | D127: 5 | E127: 1 | F127: 327 | G127: 910 | H127: 25 | I127: 46,47,49 | J127: 1
A128: 126 | B128: 26 | C128: 阎王1 | D128: 1 | E128: 1 | F128: 49 | G128: 144 | H128: 26
A129: 127 | B129: 26 | C129: 阎王2 | D129: 2 | E129: 1 | F129: 77 | G129: 238 | H129: 26
A130: 128 | B130: 26 | C130: 阎王3 | D130: 3 | E130: 1 | F130: 112 | G130: 410 | H130: 26 | I130: 48 | J130: 1
A131: 129 | B131: 26 | C131: 阎王4 | D131: 4 | E131: 1 | F131: 195 | G131: 602 | H131: 26 | I131: 47,49 | J131: 2
A132: 130 | B132: 26 | C132: 阎王5 | D132: 5 | E132: 1 | F132: 327 | G132: 908 | H132: 26 | I132: 46,47,49 | J132: 1
A133: 131 | B133: 27 | C133: 黑罗刹1 | D133: 1 | E133: 1 | F133: 42 | G133: 141 | H133: 27
A134: 132 | B134: 27 | C134: 黑罗刹2 | D134: 2 | E134: 1 | F134: 73 | G134: 238 | H134: 27
A135: 133 | B135: 27 | C135: 黑罗刹3 | D135: 3 | E135: 1 | F135: 119 | G135: 412 | H135: 27 | I135: 48 | J135: 1
A136: 134 | B136: 27 | C136: 黑罗刹4 | D136: 4 | E136: 1 | F136: 203 | G136: 604 | H136: 27 | I136: 47,49 | J136: 2
A137: 135 | B137: 27 | C137: 黑罗刹5 | D137: 5 | E137: 1 | F137: 322 | G137: 908 | H137: 27 | I137: 46,47,49 | J137: 1
A138: 136 | B138: 28 | C138: 牛魔王1 | D138: 1 | E138: 1 | F138: 43 | G138: 140 | H138: 28
A139: 137 | B139: 28 | C139: 牛魔王2 | D139: 2 | E139: 1 | F139: 72 | G139: 229 | H139: 28
A140: 138 | B140: 28 | C140: 牛魔王3 | D140: 3 | E140: 1 | F140: 111 | G140: 403 | H140: 28 | I140: 48 | J140: 1
A141: 139 | B141: 28 | C141: 牛魔王4 | D141: 4 | E141: 1 | F141: 189 | G141: 592 | H141: 28 | I141: 47,49 | J141: 2
A142: 140 | B142: 28 | C142: 牛魔王5 | D142: 5 | E142: 1 | F142: 331 | G142: 901 | H142: 28 | I142: 46,47,49 | J142: 1
A143: 141 | B143: 29 | C143: 铁扇公主1 | D143: 1 | E143: 1 | F143: 47 | G143: 150 | H143: 29
A144: 142 | B144: 29 | C144: 铁扇公主2 | D144: 2 | E144: 1 | F144: 79 | G144: 229 | H144: 29
A145: 143 | B145: 29 | C145: 铁扇公主3 | D145: 3 | E145: 1 | F145: 122 | G145: 394 | H145: 29 | I145: 48 | J145: 1
A146: 144 | B146: 29 | C146: 铁扇公主4 | D146: 4 | E146: 1 | F146: 203 | G146: 604 | H146: 29 | I146: 47,49 | J146: 2
A147: 145 | B147: 29 | C147: 铁扇公主5 | D147: 5 | E147: 1 | F147: 332 | G147: 911 | H147: 29 | I147: 46,47,49 | J147: 1
A148: 146 | B148: 30 | C148: 菩萨1 | D148: 1 | E148: 1 | F148: 40 | G148: 151 | H148: 30
A149: 147 | B149: 30 | C149: 菩萨2 | D149: 2 | E149: 1 | F149: 80 | G149: 232 | H149: 30
A150: 148 | B150: 30 | C150: 菩萨3 | D150: 3 | E150: 1 | F150: 119 | G150: 412 | H150: 30 | I150: 48 | J150: 1
A151: 149 | B151: 30 | C151: 菩萨4 | D151: 4 | E151: 1 | F151: 203 | G151: 608 | H151: 30 | I151: 47,49 | J151: 2
A152: 150 | B152: 30 | C152: 菩萨5 | D152: 5 | E152: 1 | F152: 333 | G152: 909 | H152: 30 | I152: 46,47,49 | J152: 1
A153: 151 | B153: 31 | C153: 如来1 | D153: 1 | E153: 1 | F153: 50 | G153: 145 | H153: 31
A154: 152 | B154: 31 | C154: 如来2 | D154: 2 | E154: 1 | F154: 75 | G154: 243 | H154: 31
A155: 153 | B155: 31 | C155: 如来3 | D155: 3 | E155: 1 | F155: 115 | G155: 432 | H155: 31 | I155: 48 | J155: 1
A156: 154 | B156: 31 | C156: 如来4 | D156: 4 | E156: 1 | F156: 192 | G156: 592 | H156: 31 | I156: 47,49 | J156: 2
A157: 155 | B157: 31 | C157: 如来5 | D157: 5 | E157: 1 | F157: 318 | G157: 938 | H157: 31 | I157: 46,47,49 | J157: 1
A158: 156 | B158: 32 | C158: 降龙1 | D158: 1 | E158: 1 | F158: 55 | G158: 144 | H158: 32
A159: 157 | B159: 32 | C159: 降龙2 | D159: 2 | E159: 1 | F159: 79 | G159: 242 | H159: 32
A160: 158 | B160: 32 | C160: 降龙3 | D160: 3 | E160: 1 | F160: 117 | G160: 430 | H160: 32 | I160: 48 | J160: 1
A161: 159 | B161: 32 | C161: 降龙4 | D161: 4 | E161: 1 | F161: 197 | G161: 590 | H161: 32 | I161: 47,49 | J161: 2
A162: 160 | B162: 32 | C162: 降龙5 | D162: 5 | E162: 1 | F162: 320 | G162: 940 | H162: 32 | I162: 46,47,49 | J162: 1
A163: 161 | B163: 33 | C163: 伏虎1 | D163: 1 | E163: 1 | F163: 56 | G163: 129 | H163: 33
A164: 162 | B164: 33 | C164: 伏虎2 | D164: 2 | E164: 1 | F164: 85 | G164: 208 | H164: 33
A165: 163 | B165: 33 | C165: 伏虎3 | D165: 3 | E165: 1 | F165: 135 | G165: 355 | H165: 33 | I165: 48 | J165: 1
A166: 164 | B166: 33 | C166: 伏虎4 | D166: 4 | E166: 1 | F166: 228 | G166: 518 | H166: 33 | I166: 47,49 | J166: 2
A167: 165 | B167: 33 | C167: 伏虎5 | D167: 5 | E167: 1 | F167: 352 | G167: 830 | H167: 33 | I167: 46,47,49 | J167: 1
A168: 166 | B168: 34 | C168: 蝎子妖1 | D168: 1 | E168: 1 | F168: 58 | G168: 124 | H168: 34
A169: 167 | B169: 34 | C169: 蝎子妖2 | D169: 2 | E169: 1 | F169: 89 | G169: 207 | H169: 34
A170: 168 | B170: 34 | C170: 蝎子妖3 | D170: 3 | E170: 1 | F170: 137 | G170: 253 | H170: 34 | I170: 48 | J170: 1
A171: 169 | B171: 34 | C171: 蝎子妖4 | D171: 4 | E171: 1 | F171: 230 | G171: 515 | H171: 34 | I171: 47,49 | J171: 2
A172: 170 | B172: 34 | C172: 蝎子妖5 | D172: 5 | E172: 1 | F172: 360 | G172: 824 | H172: 34 | I172: 46,47,49 | J172: 1
A173: 171 | B173: 35 | C173: 琵琶精1 | D173: 1 | E173: 1 | F173: 45 | G173: 135 | H173: 35
A174: 172 | B174: 35 | C174: 琵琶精2 | D174: 2 | E174: 1 | F174: 76 | G174: 236 | H174: 35
A175: 173 | B175: 35 | C175: 琵琶精3 | D175: 3 | E175: 1 | F175: 116 | G175: 426 | H175: 35 | I175: 48 | J175: 1
A176: 174 | B176: 35 | C176: 琵琶精4 | D176: 4 | E176: 1 | F176: 204 | G176: 587 | H176: 35 | I176: 47,49 | J176: 2
A177: 175 | B177: 35 | C177: 琵琶精5 | D177: 5 | E177: 1 | F177: 321 | G177: 934 | H177: 35 | I177: 46,47,49 | J177: 1
A178: 176 | B178: 36 | C178: 洛神1 | D178: 1 | E178: 1 | F178: 47 | G178: 132 | H178: 36
A179: 177 | B179: 36 | C179: 洛神2 | D179: 2 | E179: 1 | F179: 73 | G179: 230 | H179: 36
A180: 178 | B180: 36 | C180: 洛神3 | D180: 3 | E180: 1 | F180: 112 | G180: 430 | H180: 36 | I180: 48 | J180: 1
A181: 179 | B181: 36 | C181: 洛神4 | D181: 4 | E181: 1 | F181: 200 | G181: 585 | H181: 36 | I181: 47,49 | J181: 2
A182: 180 | B182: 36 | C182: 洛神5 | D182: 5 | E182: 1 | F182: 329 | G182: 931 | H182: 36 | I182: 46,47,49 | J182: 1
A183: 181 | B183: 37 | C183: 吕洞宾1 | D183: 1 | E183: 1 | F183: 43 | G183: 135 | H183: 37
A184: 182 | B184: 37 | C184: 吕洞宾2 | D184: 2 | E184: 1 | F184: 70 | G184: 233 | H184: 37
A185: 183 | B185: 37 | C185: 吕洞宾3 | D185: 3 | E185: 1 | F185: 110 | G185: 431 | H185: 37 | I185: 48 | J185: 1
A186: 184 | B186: 37 | C186: 吕洞宾4 | D186: 4 | E186: 1 | F186: 207 | G186: 588 | H186: 37 | I186: 47,49 | J186: 2
A187: 185 | B187: 37 | C187: 吕洞宾5 | D187: 5 | E187: 1 | F187: 331 | G187: 934 | H187: 37 | I187: 46,47,49 | J187: 1
A188: 186 | B188: 38 | C188: 铁拐李1 | D188: 1 | E188: 1 | F188: 46 | G188: 130 | H188: 38
A189: 187 | B189: 38 | C189: 铁拐李2 | D189: 2 | E189: 1 | F189: 75 | G189: 231 | H189: 38
A190: 188 | B190: 38 | C190: 铁拐李3 | D190: 3 | E190: 1 | F190: 114 | G190: 428 | H190: 38 | I190: 48 | J190: 1
A191: 189 | B191: 38 | C191: 铁拐李4 | D191: 4 | E191: 1 | F191: 202 | G191: 565 | H191: 38 | I191: 47,49 | J191: 2
A192: 190 | B192: 38 | C192: 铁拐李5 | D192: 5 | E192: 1 | F192: 324 | G192: 939 | H192: 38 | I192: 46,47,49 | J192: 1
A193: 191 | B193: 39 | C193: 何仙姑1 | D193: 1 | E193: 1 | F193: 57 | G193: 130 | H193: 39
A194: 192 | B194: 39 | C194: 何仙姑2 | D194: 2 | E194: 1 | F194: 84 | G194: 221 | H194: 39
A195: 193 | B195: 39 | C195: 何仙姑3 | D195: 3 | E195: 1 | F195: 141 | G195: 385 | H195: 39 | I195: 48 | J195: 1
A196: 194 | B196: 39 | C196: 何仙姑4 | D196: 4 | E196: 1 | F196: 230 | G196: 546 | H196: 39 | I196: 47,49 | J196: 2
A197: 195 | B197: 39 | C197: 何仙姑5 | D197: 5 | E197: 1 | F197: 360 | G197: 852 | H197: 39 | I197: 46,47,49 | J197: 1
A198: 196 | B198: 40 | C198: 张果老1 | D198: 1 | E198: 1 | F198: 58 | G198: 129 | H198: 40
A199: 197 | B199: 40 | C199: 张果老2 | D199: 2 | E199: 1 | F199: 86 | G199: 220 | H199: 40
A200: 198 | B200: 40 | C200: 张果老3 | D200: 3 | E200: 1 | F200: 145 | G200: 383 | H200: 40 | I200: 48 | J200: 1
A201: 199 | B201: 40 | C201: 张果老4 | D201: 4 | E201: 1 | F201: 233 | G201: 542 | H201: 40 | I201: 47,49 | J201: 2
A202: 200 | B202: 40 | C202: 张果老5 | D202: 5 | E202: 1 | F202: 364 | G202: 848 | H202: 40 | I202: 46,47,49 | J202: 1
A203: 201 | B203: 41 | C203: 蓝采和1 | D203: 1 | E203: 1 | F203: 53 | G203: 133 | H203: 41
A204: 202 | B204: 41 | C204: 蓝采和2 | D204: 2 | E204: 1 | F204: 82 | G204: 225 | H204: 41
A205: 203 | B205: 41 | C205: 蓝采和3 | D205: 3 | E205: 1 | F205: 141 | G205: 386 | H205: 41 | I205: 48 | J205: 1
A206: 204 | B206: 41 | C206: 蓝采和4 | D206: 4 | E206: 1 | F206: 231 | G206: 547 | H206: 41 | I206: 47,49 | J206: 2
A207: 205 | B207: 41 | C207: 蓝采和5 | D207: 5 | E207: 1 | F207: 362 | G207: 851 | H207: 41 | I207: 46,47,49 | J207: 1
A208: 206 | B208: 42 | C208: 天门守卫1 | D208: 1 | E208: 1 | F208: 51 | G208: 134 | H208: 42
A209: 207 | B209: 42 | C209: 天门守卫2 | D209: 2 | E209: 1 | F209: 86 | G209: 221 | H209: 42
A210: 208 | B210: 42 | C210: 天门守卫3 | D210: 3 | E210: 1 | F210: 149 | G210: 381 | H210: 42 | I210: 48 | J210: 1
A211: 209 | B211: 42 | C211: 天门守卫4 | D211: 4 | E211: 1 | F211: 238 | G211: 540 | H211: 42 | I211: 47,49 | J211: 2
A212: 210 | B212: 42 | C212: 天门守卫5 | D212: 5 | E212: 1 | F212: 366 | G212: 847 | H212: 42 | I212: 46,47,49 | J212: 1
A213: 211 | B213: 43 | C213: 龙王1 | D213: 1 | E213: 1 | F213: 56 | G213: 121 | H213: 43
A214: 212 | B214: 43 | C214: 龙王2 | D214: 2 | E214: 1 | F214: 87 | G214: 221 | H214: 43
A215: 213 | B215: 43 | C215: 龙王3 | D215: 3 | E215: 1 | F215: 131 | G215: 382 | H215: 43 | I215: 48 | J215: 1
A216: 214 | B216: 43 | C216: 龙王4 | D216: 4 | E216: 1 | F216: 215 | G216: 545 | H216: 43 | I216: 47,49 | J216: 2
A217: 215 | B217: 43 | C217: 龙王5 | D217: 5 | E217: 1 | F217: 342 | G217: 849 | H217: 43 | I217: 46,47,49 | J217: 1
A218: 216 | B218: 44 | C218: 南山大仙1 | D218: 1 | E218: 1 | F218: 57 | G218: 120 | H218: 44
A219: 217 | B219: 44 | C219: 南山大仙2 | D219: 2 | E219: 1 | F219: 89 | G219: 217 | H219: 44
A220: 218 | B220: 44 | C220: 南山大仙3 | D220: 3 | E220: 1 | F220: 137 | G220: 380 | H220: 44 | I220: 48 | J220: 1
A221: 219 | B221: 44 | C221: 南山大仙4 | D221: 4 | E221: 1 | F221: 220 | G221: 550 | H221: 44 | I221: 47,49 | J221: 2
A222: 220 | B222: 44 | C222: 南山大仙5 | D222: 5 | E222: 1 | F222: 347 | G222: 845 | H222: 44 | I222: 46,47,49 | J222: 1
A223: 221 | B223: 45 | C223: 东海龙王1 | D223: 1 | E223: 1 | F223: 53 | G223: 126 | H223: 45
A224: 222 | B224: 45 | C224: 东海龙王2 | D224: 2 | E224: 1 | F224: 92 | G224: 214 | H224: 45
A225: 223 | B225: 45 | C225: 东海龙王3 | D225: 3 | E225: 1 | F225: 133 | G225: 388 | H225: 45 | I225: 48 | J225: 1
A226: 224 | B226: 45 | C226: 东海龙王4 | D226: 4 | E226: 1 | F226: 224 | G226: 545 | H226: 45 | I226: 47,49 | J226: 2
A227: 225 | B227: 45 | C227: 东海龙王5 | D227: 5 | E227: 1 | F227: 343 | G227: 851 | H227: 45 | I227: 46,47,49 | J227: 1
A228: 226 | B228: 46 | C228: 六面大仙1 | D228: 1 | E228: 1 | F228: 51 | G228: 129 | H228: 46
A229: 227 | B229: 46 | C229: 六面大仙2 | D229: 2 | E229: 1 | F229: 87 | G229: 211 | H229: 46
A230: 228 | B230: 46 | C230: 六面大仙3 | D230: 3 | E230: 1 | F230: 133 | G230: 384 | H230: 46 | I230: 48 | J230: 1
A231: 229 | B231: 46 | C231: 六面大仙4 | D231: 4 | E231: 1 | F231: 226 | G231: 541 | H231: 46 | I231: 47,49 | J231: 2
A232: 230 | B232: 46 | C232: 六面大仙5 | D232: 5 | E232: 1 | F232: 344 | G232: 849 | H232: 46 | I232: 45,47,49 | J232: 1
A233: 231 | B233: 47 | C233: 托塔天王1 | D233: 1 | E233: 1 | F233: 59 | G233: 121 | H233: 47
A234: 232 | B234: 47 | C234: 托塔天王2 | D234: 2 | E234: 1 | F234: 91 | G234: 212 | H234: 47
A235: 233 | B235: 47 | C235: 托塔天王3 | D235: 3 | E235: 1 | F235: 134 | G235: 386 | H235: 47 | I235: 48 | J235: 1
A236: 234 | B236: 47 | C236: 托塔天王4 | D236: 4 | E236: 1 | F236: 222 | G236: 555 | H236: 47 | I236: 49 | J236: 2
A237: 235 | B237: 47 | C237: 托塔天王5 | D237: 5 | E237: 1 | F237: 349 | G237: 841 | H237: 47 | I237: 46,45 | J237: 1
A238: 236 | B238: 48 | C238: 哪吒1 | D238: 1 | E238: 1 | F238: 44 | G238: 130 | H238: 48
A239: 237 | B239: 48 | C239: 哪吒2 | D239: 2 | E239: 1 | F239: 72 | G239: 225 | H239: 48
A240: 238 | B240: 48 | C240: 哪吒3 | D240: 3 | E240: 1 | F240: 113 | G240: 420 | H240: 48 | I240: 40 | J240: 1
A241: 239 | B241: 48 | C241: 哪吒4 | D241: 4 | E241: 1 | F241: 193 | G241: 595 | H241: 48 | I241: 47,49 | J241: 2
A242: 240 | B242: 48 | C242: 哪吒5 | D242: 5 | E242: 1 | F242: 321 | G242: 920 | H242: 48 | I242: 46,47,49 | J242: 1
A243: 241 | B243: 49 | C243: 金吒1 | D243: 1 | E243: 1 | F243: 49 | G243: 128 | H243: 49
A244: 242 | B244: 49 | C244: 金吒2 | D244: 2 | E244: 1 | F244: 78 | G244: 221 | H244: 49
A245: 243 | B245: 49 | C245: 金吒3 | D245: 3 | E245: 1 | F245: 119 | G245: 591 | H245: 49 | I245: 42 | J245: 1
A246: 244 | B246: 49 | C246: 金吒4 | D246: 4 | E246: 1 | F246: 192 | G246: 597 | H246: 49 | I246: 47,49 | J246: 2
A247: 245 | B247: 49 | C247: 金吒5 | D247: 5 | E247: 1 | F247: 328 | G247: 915 | H247: 49 | I247: 46,47,49 | J247: 1
A248: 246 | B248: 50 | C248: 木吒1 | D248: 1 | E248: 1 | F248: 41 | G248: 132 | H248: 50
A249: 247 | B249: 50 | C249: 木吒2 | D249: 2 | E249: 1 | F249: 75 | G249: 226 | H249: 50
A250: 248 | B250: 50 | C250: 木吒3 | D250: 3 | E250: 1 | F250: 115 | G250: 597 | H250: 50 | I250: 35 | J250: 1
A251: 249 | B251: 50 | C251: 木吒4 | D251: 4 | E251: 1 | F251: 194 | G251: 593 | H251: 50 | I251: 36,37 | J251: 2
A252: 250 | B252: 50 | C252: 木吒5 | D252: 5 | E252: 1 | F252: 322 | G252: 920 | H252: 50 | I252: 32,33,25 | J252: 1

Sheet: 怪物卡牌配置表
A1: id | B1: 系列ID | C1: 名称 | D1: 星级 | E1: 等级 | F1: 攻击力 | G1: 生命值 | H1: 技能ID | I1: 卡牌组合 | J1: 组合效果 | K1: 卡牌描述
A2: id | B2: number | C2: name | D2: star | E2: lv | F2: atk | G2: hp | H2: skill_id | I2: group | J2: group_effect | K2: descrption
A3: 10000 | B3: 1000 | C3: 白熊1 | D3: 1 | E3: 1 | F3: 59 | G3: 120
A4: 10001 | B4: 1000 | C4: 白熊2 | D4: 2 | E4: 1 | F4: 100 | G4: 195
A5: 10005 | B5: 1001 | C5: 白熊3 | D5: 1 | E5: 1 | F5: 45 | G5: 140
A6: 10006 | B6: 1001 | C6: 白熊4 | D6: 2 | E6: 1 | F6: 79 | G6: 221
A7: 10010 | B7: 1002 | C7: 白熊5 | D7: 1 | E7: 1 | F7: 51 | G7: 129
A8: 10011 | B8: 1002 | C8: 白熊6 | D8: 2 | E8: 1 | F8: 82 | G8: 208
A9: 10015 | B9: 1003 | C9: 白熊7 | D9: 1 | E9: 1 | F9: 47 | G9: 131
A10: 10016 | B10: 1003 | C10: 白熊8 | D10: 2 | E10: 1 | F10: 75 | G10: 211
A11: 10020 | B11: 1004 | C11: 白熊9 | D11: 1 | E11: 1 | F11: 53 | G11: 121
A12: 10021 | B12: 1004 | C12: 白熊10 | D12: 2 | E12: 1 | F12: 82 | G12: 195
A13: 10025 | B13: 1005 | C13: 白熊11 | D13: 1 | E13: 1 | F13: 61 | G13: 115
A14: 10026 | B14: 1005 | C14: 白熊12 | D14: 2 | E14: 1 | F14: 95 | G14: 186
A15: 10030 | B15: 1006 | C15: 白熊13 | D15: 1 | E15: 1 | F15: 51 | G15: 130
A16: 10031 | B16: 1006 | C16: 白熊14 | D16: 2 | E16: 1 | F16: 82 | G16: 220
A17: 10035 | B17: 1007 | C17: 白熊15 | D17: 1 | E17: 1 | F17: 56 | G17: 134
A18: 10036 | B18: 1007 | C18: 白熊16 | D18: 2 | E18: 1 | F18: 86 | G18: 226
A19: 10040 | B19: 1008 | C19: 白熊17 | D19: 1 | E19: 1 | F19: 53 | G19: 139
A20: 10041 | B20: 1008 | C20: 白熊18 | D20: 2 | E20: 1 | F20: 86 | G20: 223
A21: 10045 | B21: 1009 | C21: 白熊19 | D21: 1 | E21: 1 | F21: 53 | G21: 140
A22: 10046 | B22: 1009 | C22: 白熊20 | D22: 2 | E22: 1 | F22: 86 | G22: 227
A23: 10050 | B23: 1010 | C23: 白熊21 | D23: 1 | E23: 1 | F23: 55 | G23: 120
A24: 10051 | B24: 1010 | C24: 白熊22 | D24: 2 | E24: 1 | F24: 85 | G24: 195
A25: 10055 | B25: 1011 | C25: 白熊23 | D25: 1 | E25: 1 | F25: 54 | G25: 125
A26: 10056 | B26: 1011 | C26: 白熊24 | D26: 2 | E26: 1 | F26: 88 | G26: 190
A27: 10060 | B27: 1012 | C27: 白熊25 | D27: 1 | E27: 1 | F27: 58 | G27: 120
A28: 10061 | B28: 1012 | C28: 白熊26 | D28: 2 | E28: 1 | F28: 87 | G28: 192
A29: 10065 | B29: 1013 | C29: 白熊27 | D29: 1 | E29: 1 | F29: 51 | G29: 130
A30: 10066 | B30: 1013 | C30: 白熊28 | D30: 2 | E30: 1 | F30: 81 | G30: 221
A31: 10070 | B31: 1014 | C31: 白熊29 | D31: 1 | E31: 1 | F31: 53 | G31: 126
A32: 10071 | B32: 1014 | C32: 白熊30 | D32: 2 | E32: 1 | F32: 83 | G32: 224
A33: 10075 | B33: 1015 | C33: 白熊31 | D33: 1 | E33: 1 | F33: 55 | G33: 121
A34: 10076 | B34: 1015 | C34: 白熊32 | D34: 2 | E34: 1 | F34: 85 | G34: 228
A35: 10080 | B35: 1016 | C35: 白熊33 | D35: 1 | E35: 1 | F35: 56 | G35: 129
A36: 10081 | B36: 1016 | C36: 白熊34 | D36: 2 | E36: 1 | F36: 88 | G36: 226
A37: 10085 | B37: 1017 | C37: 白熊35 | D37: 1 | E37: 1 | F37: 58 | G37: 122
A38: 10086 | B38: 1017 | C38: 白熊36 | D38: 2 | E38: 1 | F38: 88 | G38: 222
A39: 10090 | B39: 1018 | C39: 白熊37 | D39: 1 | E39: 1 | F39: 53 | G39: 126
A40: 10091 | B40: 1018 | C40: 白熊38 | D40: 2 | E40: 1 | F40: 83 | G40: 224
A41: 10095 | B41: 1019 | C41: 白熊39 | D41: 1 | E41: 1 | F41: 60 | G41: 120
A42: 10096 | B42: 1019 | C42: 白熊40 | D42: 2 | E42: 1 | F42: 100 | G42: 190
A43: 10100 | B43: 1020 | C43: 白熊41 | D43: 1 | E43: 1 | F43: 51 | G43: 140
A44: 10101 | B44: 1020 | C44: 白熊42 | D44: 2 | E44: 1 | F44: 82 | G44: 230
A45: 10105 | B45: 1021 | C45: 白熊43 | D45: 1 | E45: 1 | F45: 52 | G45: 141
A46: 10106 | B46: 1021 | C46: 白熊44 | D46: 2 | E46: 1 | F46: 82 | G46: 232
A47: 10110 | B47: 1022 | C47: 白熊45 | D47: 1 | E47: 1 | F47: 55 | G47: 144
A48: 10111 | B48: 1022 | C48: 白熊46 | D48: 2 | E48: 1 | F48: 85 | G48: 231
A49: 10115 | B49: 1023 | C49: 白熊47 | D49: 1 | E49: 1 | F49: 48 | G49: 145
A50: 10116 | B50: 1023 | C50: 白熊48 | D50: 2 | E50: 1 | F50: 75 | G50: 230
A51: 10120 | B51: 1024 | C51: 白熊49 | D51: 1 | E51: 1 | F51: 46 | G51: 146
A52: 10121 | B52: 1024 | C52: 白熊50 | D52: 2 | E52: 1 | F52: 76 | G52: 231
A53: 10125 | B53: 1025 | C53: 白熊51 | D53: 1 | E53: 1 | F53: 49 | G53: 144
A54: 10126 | B54: 1025 | C54: 白熊52 | D54: 2 | E54: 1 | F54: 77 | G54: 238
A55: 10130 | B55: 1026 | C55: 白熊53 | D55: 1 | E55: 1 | F55: 42 | G55: 141
A56: 10131 | B56: 1026 | C56: 白熊54 | D56: 2 | E56: 1 | F56: 73 | G56: 238
A57: 10135 | B57: 1027 | C57: 白熊55 | D57: 1 | E57: 1 | F57: 43 | G57: 140
A58: 10136 | B58: 1027 | C58: 白熊56 | D58: 2 | E58: 1 | F58: 72 | G58: 229
A59: 10140 | B59: 1028 | C59: 白熊57 | D59: 1 | E59: 1 | F59: 47 | G59: 150
A60: 10141 | B60: 1028 | C60: 白熊58 | D60: 2 | E60: 1 | F60: 79 | G60: 229
A61: 10145 | B61: 1029 | C61: 白熊59 | D61: 1 | E61: 1 | F61: 40 | G61: 151
A62: 10146 | B62: 1029 | C62: 白熊60 | D62: 2 | E62: 1 | F62: 80 | G62: 232
A63: 10150 | B63: 1030 | C63: 白熊61 | D63: 1 | E63: 1 | F63: 50 | G63: 145
A64: 10151 | B64: 1030 | C64: 白熊62 | D64: 2 | E64: 1 | F64: 75 | G64: 243
A65: 10155 | B65: 1031 | C65: 白熊63 | D65: 1 | E65: 1 | F65: 55 | G65: 144
A66: 10156 | B66: 1031 | C66: 白熊64 | D66: 2 | E66: 1 | F66: 79 | G66: 242
A67: 10160 | B67: 1032 | C67: 白熊65 | D67: 1 | E67: 1 | F67: 56 | G67: 129
A68: 10161 | B68: 1032 | C68: 白熊66 | D68: 2 | E68: 1 | F68: 85 | G68: 208
A69: 10165 | B69: 1033 | C69: 白熊67 | D69: 1 | E69: 1 | F69: 58 | G69: 124
A70: 10166 | B70: 1033 | C70: 白熊68 | D70: 2 | E70: 1 | F70: 89 | G70: 207
A71: 10170 | B71: 1034 | C71: 白熊69 | D71: 1 | E71: 1 | F71: 45 | G71: 135
A72: 10171 | B72: 1034 | C72: 白熊70 | D72: 2 | E72: 1 | F72: 76 | G72: 236
A73: 10175 | B73: 1035 | C73: 白熊71 | D73: 1 | E73: 1 | F73: 47 | G73: 132
A74: 10176 | B74: 1035 | C74: 白熊72 | D74: 2 | E74: 1 | F74: 73 | G74: 230
A75: 10180 | B75: 1036 | C75: 白熊73 | D75: 1 | E75: 1 | F75: 43 | G75: 135
A76: 10181 | B76: 1036 | C76: 白熊74 | D76: 2 | E76: 1 | F76: 70 | G76: 233
A77: 10185 | B77: 1037 | C77: 白熊75 | D77: 1 | E77: 1 | F77: 46 | G77: 130
A78: 10186 | B78: 1037 | C78: 白熊76 | D78: 2 | E78: 1 | F78: 75 | G78: 231
A79: 10190 | B79: 1038 | C79: 白熊77 | D79: 1 | E79: 1 | F79: 57 | G79: 130
A80: 10191 | B80: 1038 | C80: 白熊78 | D80: 2 | E80: 1 | F80: 84 | G80: 221
A81: 10195 | B81: 1039 | C81: 白熊79 | D81: 1 | E81: 1 | F81: 58 | G81: 129
A82: 10196 | B82: 1039 | C82: 白熊80 | D82: 2 | E82: 1 | F82: 86 | G82: 220
A83: 10200 | B83: 1040 | C83: 白熊81 | D83: 1 | E83: 1 | F83: 53 | G83: 133
A84: 10201 | B84: 1040 | C84: 白熊82 | D84: 2 | E84: 1 | F84: 82 | G84: 225
A85: 10205 | B85: 1041 | C85: 白熊83 | D85: 1 | E85: 1 | F85: 51 | G85: 134
A86: 10206 | B86: 1041 | C86: 白熊84 | D86: 2 | E86: 1 | F86: 86 | G86: 221
A87: 10210 | B87: 1042 | C87: 白熊85 | D87: 1 | E87: 1 | F87: 56 | G87: 121
A88: 10211 | B88: 1042 | C88: 白熊86 | D88: 2 | E88: 1 | F88: 87 | G88: 221
A89: 10215 | B89: 1043 | C89: 白熊87 | D89: 1 | E89: 1 | F89: 57 | G89: 120
A90: 10216 | B90: 1043 | C90: 白熊88 | D90: 2 | E90: 1 | F90: 89 | G90: 217
A91: 10220 | B91: 1044 | C91: 白熊89 | D91: 1 | E91: 1 | F91: 53 | G91: 126
A92: 10221 | B92: 1044 | C92: 白熊90 | D92: 2 | E92: 1 | F92: 92 | G92: 214
A93: 10225 | B93: 1045 | C93: 白熊91 | D93: 1 | E93: 1 | F93: 51 | G93: 129
A94: 10226 | B94: 1045 | C94: 白熊92 | D94: 2 | E94: 1 | F94: 87 | G94: 211
A95: 10230 | B95: 1046 | C95: 白熊93 | D95: 1 | E95: 1 | F95: 59 | G95: 121
A96: 10231 | B96: 1046 | C96: 白熊94 | D96: 2 | E96: 1 | F96: 91 | G96: 212
A97: 10235 | B97: 1047 | C97: 白熊95 | D97: 1 | E97: 1 | F97: 44 | G97: 130
A98: 10236 | B98: 1047 | C98: 白熊96 | D98: 2 | E98: 1 | F98: 72 | G98: 225
A99: 10240 | B99: 1048 | C99: 白熊97 | D99: 1 | E99: 1 | F99: 49 | G99: 128
A100: 10241 | B100: 1048 | C100: 白熊98 | D100: 2 | E100: 1 | F100: 78 | G100: 221
A101: 10245 | B101: 1049 | C101: 白熊99 | D101: 1 | E101: 1 | F101: 41 | G101: 132
A102: 10246 | B102: 1049 | C102: 白熊100 | D102: 2 | E102: 1 | F102: 75 | G102: 226
A103: 20000 | B103: 2000 | C103: 树精1 | D103: 1 | E103: 1 | F103: 246 | G103: 739
A104: 20001 | B104: 2001 | C104: 树精2 | D104: 1 | E104: 1 | F104: 246 | G104: 739
A105: 20002 | B105: 2002 | C105: 树精3 | D105: 1 | E105: 1 | F105: 386 | G105: 1157
A106: 20003 | B106: 2003 | C106: 树精4 | D106: 1 | E106: 1 | F106: 590 | G106: 1770
A107: 20004 | B107: 2004 | C107: 树精4 | D107: 1 | E107: 1 | F107: 881 | G107: 2644
A108: 20005 | B108: 2005 | C108: 树精5 | D108: 1 | E108: 1 | F108: 1286 | G108: 3857
A109: 20006 | B109: 2006 | C109: 树精6 | D109: 1 | E109: 1 | F109: 1952 | G109: 5856
A110: 20007 | B110: 2007 | C110: 树精7 | D110: 1 | E110: 1 | F110: 2703 | G110: 8108
A111: 20008 | B111: 2008 | C111: 树精8 | D111: 1 | E111: 1 | F111: 3653 | G111: 10959
A112: 20009 | B112: 2009 | C112: 树精9 | D112: 1 | E112: 1 | F112: 4586 | G112: 13759
A113: 20010 | B113: 2010 | C113: 树精10 | D113: 1 | E113: 1 | F113: 5664 | G113: 14727
A114: 20011 | B114: 2011 | C114: 树精11 | D114: 1 | E114: 1 | F114: 7160 | G114: 18617
A115: 20012 | B115: 2012 | C115: 树精12 | D115: 1 | E115: 1 | F115: 8913 | G115: 23173
A116: 20013 | B116: 2013 | C116: 树精13 | D116: 1 | E116: 1 | F116: 10922 | G116: 28397
A117: 20014 | B117: 2014 | C117: 树精14 | D117: 1 | E117: 1 | F117: 13177 | G117: 34261
A118: 20015 | B118: 2015 | C118: 树精15 | D118: 1 | E118: 1 | F118: 15078 | G118: 39203
A119: 20016 | B119: 2016 | C119: 树精16 | D119: 1 | E119: 1 | F119: 17322 | G119: 43304
A120: 20017 | B120: 2017 | C120: 树精17 | D120: 1 | E120: 1 | F120: 20154 | G120: 50385
A121: 20018 | B121: 2018 | C121: 树精18 | D121: 1 | E121: 1 | F121: 22305 | G121: 55763
A122: 20019 | B122: 2019 | C122: 树精19 | D122: 1 | E122: 1 | F122: 25569 | G122: 63922
A123: 20020 | B123: 2020 | C123: 树精20 | D123: 1 | E123: 1 | F123: 29049 | G123: 72624

Sheet: 基础属性成长表
A1: id | B1: 等级 | C1: 初始参考系数 | D1: 实际增量系数
A2: id | B2: lv | C2: base | D2: factor
A3: 1 | B3: 1 | C3: 1.1000000000000001 | D3: 1
A4: 2 | B4: 2 | C4: 1.099 | D4: 1.1000000000000001
A5: 3 | B5: 3 | C5: 1.0980000000000001 | D5: 1.2090000000000001
A6: 4 | B6: 4 | C6: 1.097 | D6: 1.327
A7: 5 | B7: 5 | C7: 1.0960000000000001 | D7: 1.456
A8: 6 | B8: 6 | C8: 1.095 | D8: 1.5960000000000001
A9: 7 | B9: 7 | C9: 1.0940000000000001 | D9: 1.748
A10: 8 | B10: 8 | C10: 1.093 | D10: 1.9119999999999999
A11: 9 | B11: 9 | C11: 1.0920000000000001 | D11: 2.09
A12: 10 | B12: 10 | C12: 1.091 | D12: 2.282
A13: 11 | B13: 11 | C13: 1.0900000000000001 | D13: 2.4900000000000002
A14: 12 | B14: 12 | C14: 1.089 | D14: 2.714
A15: 13 | B15: 13 | C15: 1.0880000000000001 | D15: 2.956
A16: 14 | B16: 14 | C16: 1.087 | D16: 3.2160000000000002
A17: 15 | B17: 15 | C17: 1.0860000000000001 | D17: 3.496
A18: 16 | B18: 16 | C18: 1.085 | D18: 3.7970000000000002
A19: 17 | B19: 17 | C19: 1.0840000000000001 | D19: 4.12
A20: 18 | B20: 18 | C20: 1.083 | D20: 4.4660000000000002
A21: 19 | B21: 19 | C21: 1.0820000000000001 | D21: 4.8369999999999997
A22: 20 | B22: 20 | C22: 1.081 | D22: 5.234
A23: 21 | B23: 21 | C23: 1.08 | D23: 5.6580000000000004
A24: 22 | B24: 22 | C24: 1.079 | D24: 6.1109999999999998
A25: 23 | B25: 23 | C25: 1.0780000000000001 | D25: 6.5940000000000003
A26: 24 | B26: 24 | C26: 1.077 | D26: 7.1079999999999997
A27: 25 | B27: 25 | C27: 1.0760000000000001 | D27: 7.6550000000000002
A28: 26 | B28: 26 | C28: 1.075 | D28: 8.2370000000000001
A29: 27 | B29: 27 | C29: 1.0740000000000001 | D29: 8.8550000000000004
A30: 28 | B30: 28 | C30: 1.073 | D30: 9.51
A31: 29 | B31: 29 | C31: 1.0720000000000001 | D31: 10.204000000000001
A32: 30 | B32: 30 | C32: 1.071 | D32: 10.939
A33: 31 | B33: 31 | C33: 1.07 | D33: 11.715999999999999
A34: 32 | B34: 32 | C34: 1.069 | D34: 12.536
A35: 33 | B35: 33 | C35: 1.0680000000000001 | D35: 13.401
A36: 34 | B36: 34 | C36: 1.0669999999999999 | D36: 14.311999999999999
A37: 35 | B37: 35 | C37: 1.0660000000000001 | D37: 15.271000000000001
A38: 36 | B38: 36 | C38: 1.0649999999999999 | D38: 16.279
A39: 37 | B39: 37 | C39: 1.0640000000000001 | D39: 17.337
A40: 38 | B40: 38 | C40: 1.0629999999999999 | D40: 18.446999999999999
A41: 39 | B41: 39 | C41: 1.0620000000000001 | D41: 19.609000000000002
A42: 40 | B42: 40 | C42: 1.0609999999999999 | D42: 20.824999999999999
A43: 41 | B43: 41 | C43: 1.06 | D43: 22.094999999999999
A44: 42 | B44: 42 | C44: 1.0589999999999999 | D44: 23.420999999999999
A45: 43 | B45: 43 | C45: 1.0580000000000001 | D45: 24.803000000000001
A46: 44 | B46: 44 | C46: 1.0569999999999999 | D46: 26.242000000000001
A47: 45 | B47: 45 | C47: 1.05600000000001 | D47: 27.738
A48: 46 | B48: 46 | C48: 1.0550000000000099 | D48: 29.291
A49: 47 | B49: 47 | C49: 1.05400000000001 | D49: 30.902000000000001
A50: 48 | B50: 48 | C50: 1.0530000000000099 | D50: 32.570999999999998
A51: 49 | B51: 49 | C51: 1.05200000000001 | D51: 34.296999999999997
A52: 50 | B52: 50 | C52: 1.0510000000000099 | D52: 36.08
A53: 51 | B53: 51 | C53: 1.05000000000001 | D53: 37.92
A54: 52 | B54: 52 | C54: 1.0490000000000099 | D54: 39.816000000000003
A55: 53 | B55: 53 | C55: 1.04800000000001 | D55: 41.767000000000003
A56: 54 | B56: 54 | C56: 1.0470000000000099 | D56: 43.771999999999998
A57: 55 | B57: 55 | C57: 1.04600000000001 | D57: 45.829000000000001
A58: 56 | B58: 56 | C58: 1.0450000000000099 | D58: 47.936999999999998
A59: 57 | B59: 57 | C59: 1.04400000000001 | D59: 50.094000000000001
A60: 58 | B60: 58 | C60: 1.0430000000000099 | D60: 52.298000000000002
A61: 59 | B61: 59 | C61: 1.04200000000001 | D61: 54.546999999999997
A62: 60 | B62: 60 | C62: 1.0410000000000099 | D62: 56.838000000000001

Sheet: 卡牌升级表
A1: id | B1: 卡牌等级 | C1: 升级所需经验 | D1: 升级铜板消耗 | E1: 当前等级卡牌蕴含经验
A2: id | B2: lv | C2: exp_need | D2: money_need | E2: cur_exp
A3: 0 | B3: 0 | C3: 100 | D3: 110 | E3: 0
A4: 1 | B4: 1 | C4: 110 | D4: 115 | E4: =R[-1]C+R[-1]C[-2] -> 100
A5: 2 | B5: 2 | C5: 121 | D5: 132 | E5: =R[-1]C+R[-1]C[-2] -> 210
A6: 3 | B6: 3 | C6: 133 | D6: 152 | E6: =R[-1]C+R[-1]C[-2] -> 331
A7: 4 | B7: 4 | C7: 146 | D7: 175 | E7: =R[-1]C+R[-1]C[-2] -> 464
A8: 5 | B8: 5 | C8: 161 | D8: 201 | E8: =R[-1]C+R[-1]C[-2] -> 610
A9: 6 | B9: 6 | C9: 177 | D9: 231 | E9: =R[-1]C+R[-1]C[-2] -> 771
A10: 7 | B10: 7 | C10: 195 | D10: 266 | E10: =R[-1]C+R[-1]C[-2] -> 948
A11: 8 | B11: 8 | C11: 215 | D11: 306 | E11: =R[-1]C+R[-1]C[-2] -> 1143
A12: 9 | B12: 9 | C12: 237 | D12: 352 | E12: =R[-1]C+R[-1]C[-2] -> 1358
A13: 10 | B13: 10 | C13: 261 | D13: 405 | E13: =R[-1]C+R[-1]C[-2] -> 1595
A14: 11 | B14: 11 | C14: 287 | D14: 466 | E14: =R[-1]C+R[-1]C[-2] -> 1856
A15: 12 | B15: 12 | C15: 316 | D15: 536 | E15: =R[-1]C+R[-1]C[-2] -> 2143
A16: 13 | B16: 13 | C16: 348 | D16: 616 | E16: =R[-1]C+R[-1]C[-2] -> 2459
A17: 14 | B17: 14 | C17: 383 | D17: 708 | E17: =R[-1]C+R[-1]C[-2] -> 2807
A18: 15 | B18: 15 | C18: 421 | D18: 814 | E18: =R[-1]C+R[-1]C[-2] -> 3190
A19: 16 | B19: 16 | C19: 463 | D19: 936 | E19: =R[-1]C+R[-1]C[-2] -> 3611
A20: 17 | B20: 17 | C20: 509 | D20: 1076 | E20: =R[-1]C+R[-1]C[-2] -> 4074
A21: 18 | B21: 18 | C21: 560 | D21: 1237 | E21: =R[-1]C+R[-1]C[-2] -> 4583
A22: 19 | B22: 19 | C22: 616 | D22: 1423 | E22: =R[-1]C+R[-1]C[-2] -> 5143
A23: 20 | B23: 20 | C23: 678 | D23: 1636 | E23: =R[-1]C+R[-1]C[-2] -> 5759
A24: 21 | B24: 21 | C24: 746 | D24: 1881 | E24: =R[-1]C+R[-1]C[-2] -> 6437
A25: 22 | B25: 22 | C25: 821 | D25: 2163 | E25: =R[-1]C+R[-1]C[-2] -> 7183
A26: 23 | B26: 23 | C26: 903 | D26: 2487 | E26: =R[-1]C+R[-1]C[-2] -> 8004
A27: 24 | B27: 24 | C27: 993 | D27: 2860 | E27: =R[-1]C+R[-1]C[-2] -> 8907
A28: 25 | B28: 25 | C28: 1092 | D28: 3289 | E28: =R[-1]C+R[-1]C[-2] -> 9900
A29: 26 | B29: 26 | C29: 1201 | D29: 3782 | E29: =R[-1]C+R[-1]C[-2] -> 10992
A30: 27 | B30: 27 | C30: 1321 | D30: 4349 | E30: =R[-1]C+R[-1]C[-2] -> 12193
A31: 28 | B31: 28 | C31: 1453 | D31: 5001 | E31: =R[-1]C+R[-1]C[-2] -> 13514
A32: 29 | B32: 29 | C32: 1598 | D32: 5751 | E32: =R[-1]C+R[-1]C[-2] -> 14967
A33: 30 | B33: 30 | C33: 1758 | D33: 6614 | E33: =R[-1]C+R[-1]C[-2] -> 16565
A34: 31 | B34: 31 | C34: 1934 | D34: 7606 | E34: =R[-1]C+R[-1]C[-2] -> 18323
A35: 32 | B35: 32 | C35: 2127 | D35: 8747 | E35: =R[-1]C+R[-1]C[-2] -> 20257
A36: 33 | B36: 33 | C36: 2340 | D36: 10059 | E36: =R[-1]C+R[-1]C[-2] -> 22384
A37: 34 | B37: 34 | C37: 2574 | D37: 11568 | E37: =R[-1]C+R[-1]C[-2] -> 24724
A38: 35 | B38: 35 | C38: 2831 | D38: 13303 | E38: =R[-1]C+R[-1]C[-2] -> 27298
A39: 36 | B39: 36 | C39: 3114 | D39: 15298 | E39: =R[-1]C+R[-1]C[-2] -> 30129
A40: 37 | B40: 37 | C40: 3425 | D40: 17593 | E40: =R[-1]C+R[-1]C[-2] -> 33243
A41: 38 | B41: 38 | C41: 3768 | D41: 20232 | E41: =R[-1]C+R[-1]C[-2] -> 36668
A42: 39 | B42: 39 | C42: 4145 | D42: 23267 | E42: =R[-1]C+R[-1]C[-2] -> 40436
A43: 40 | B43: 40 | C43: 4560 | D43: 26757 | E43: =R[-1]C+R[-1]C[-2] -> 44581
A44: 41 | B44: 41 | C44: 5016 | D44: 30771 | E44: =R[-1]C+R[-1]C[-2] -> 49141
A45: 42 | B45: 42 | C45: 5518 | D45: 35387 | E45: =R[-1]C+R[-1]C[-2] -> 54157
A46: 43 | B46: 43 | C46: 6070 | D46: 40695 | E46: =R[-1]C+R[-1]C[-2] -> 59675
A47: 44 | B47: 44 | C47: 6677 | D47: 46799 | E47: =R[-1]C+R[-1]C[-2] -> 65745
A48: 45 | B48: 45 | C48: 7345 | D48: 53819 | E48: =R[-1]C+R[-1]C[-2] -> 72422
A49: 46 | B49: 46 | C49: 8080 | D49: 61892 | E49: =R[-1]C+R[-1]C[-2] -> 79767
A50: 47 | B50: 47 | C50: 8888 | D50: 71176 | E50: =R[-1]C+R[-1]C[-2] -> 87847
A51: 48 | B51: 48 | C51: 9777 | D51: 81852 | E51: =R[-1]C+R[-1]C[-2] -> 96735
A52: 49 | B52: 49 | C52: 10755 | D52: 94130 | E52: =R[-1]C+R[-1]C[-2] -> 106512
A53: 50 | B53: 50 | C53: 11831 | D53: 108250 | E53: =R[-1]C+R[-1]C[-2] -> 117267
A54: 51 | B54: 51 | C54: 13014 | D54: 124488 | E54: =R[-1]C+R[-1]C[-2] -> 129098
A55: 52 | B55: 52 | C55: 14315 | D55: 143161 | E55: =R[-1]C+R[-1]C[-2] -> 142112
A56: 53 | B56: 53 | C56: 15747 | D56: 164635 | E56: =R[-1]C+R[-1]C[-2] -> 156427
A57: 54 | B57: 54 | C57: 17322 | D57: 189330 | E57: =R[-1]C+R[-1]C[-2] -> 172174
A58: 55 | B58: 55 | C58: 19054 | D58: 217730 | E58: =R[-1]C+R[-1]C[-2] -> 189496
A59: 56 | B59: 56 | C59: 20959 | D59: 250390 | E59: =R[-1]C+R[-1]C[-2] -> 208550
A60: 57 | B60: 57 | C60: 23055 | D60: 287949 | E60: =R[-1]C+R[-1]C[-2] -> 229509
A61: 58 | B61: 58 | C61: 25361 | D61: 331141 | E61: =R[-1]C+R[-1]C[-2] -> 252564
A62: 59 | B62: 59 | C62: 27897 | D62: 380812 | E62: =R[-1]C+R[-1]C[-2] -> 277925
A63: 60 | B63: 60 | C63: 30687 | D63: 437934 | E63: =R[-1]C+R[-1]C[-2] -> 305822

Sheet: export
A1: sheet_name | B1: export_name | C1: merge_to
A2: 神仙卡牌配置表 | B2: cards
A3: 基础属性成长表 | B3: factors
A4: 卡牌升级表 | B4: card_grow
A5: 怪物卡牌配置表 | B5: monster_cards | C5: cards