Sheet: 玩家升级经验表
A1: 级别 | B1: 升到下一级所需经验
A2: id | B2: exp
A3: 1 | B3: 32
A4: 2 | B4: 34
A5: 3 | B5: 37
A6: 4 | B6: 41
A7: 5 | B7: 45
A8: 6 | B8: 49
A9: 7 | B9: 54
A10: 8 | B10: 60
A11: 9 | B11: 65
A12: 10 | B12: 72
A13: 11 | B13: 79
A14: 12 | B14: 87
A15: 13 | B15: 96
A16: 14 | B16: 105
A17: 15 | B17: 116
A18: 16 | B18: 128
A19: 17 | B19: 140
A20: 18 | B20: 154
A21: 19 | B21: 170
A22: 20 | B22: 187
A23: 21 | B23: 205
A24: 22 | B24: 226
A25: 23 | B25: 249
A26: 24 | B26: 274
A27: 25 | B27: 301
A28: 26 | B28: 331
A29: 27 | B29: 364
A30: 28 | B30: 400
A31: 29 | B31: 440
A32: 30 | B32: 485
A33: 31 | B33: 533
A34: 32 | B34: 586
A35: 33 | B35: 645
A36: 34 | B36: 709
A37: 35 | B37: 780
A38: 36 | B38: 858
A39: 37 | B39: 944
A40: 38 | B40: 1039
A41: 39 | B41: 1143
A42: 40 | B42: 1257
A43: 41 | B43: 1382
A44: 42 | B44: 1521
A45: 43 | B45: 1673
A46: 44 | B46: 1840
A47: 45 | B47: 2024
A48: 46 | B48: 2226
A49: 47 | B49: 2449
A50: 48 | B50: 2694
A51: 49 | B51: 2963
A52: 50 | B52: 3260
A53: 51 | B53: 3586
A54: 52 | B54: 3944
A55: 53 | B55: 4339
A56: 54 | B56: 4773
A57: 55 | B57: 5250
A58: 56 | B58: 5775
A59: 57 | B59: 6352
A60: 58 | B60: 6988
A61: 59 | B61: 7686
A62: 60 | B62: 8455
A63: 61 | B63: 9301
A64: 62 | B64: 10231
A65: 63 | B65: 11254
A66: 64 | B66: 12379
A67: 65 | B67: 13617
A68: 66 | B68: 14979
A69: 67 | B69: 16476
A70: 68 | B70: 18124
A71: 69 | B71: 19937
A72: 70 | B72: 21930
A73: 71 | B73: 24123
A74: 72 | B74: 26535
A75: 73 | B75: 29189
A76: 74 | B76: 32108
A77: 75 | B77: 35319
A78: 76 | B78: 38851
A79: 77 | B79: 42736
A80: 78 | B80: 47009
A81: 79 | B81: 51710
A82: 80 | B82: 56881
A83: 81 | B83: 62569
A84: 82 | B84: 68826
A85: 83 | B85: 75709
A86: 84 | B86: 83280
A87: 85 | B87: 91608
A88: 86 | B88: 100769
A89: 87 | B89: 110845
A90: 88 | B90: 121930
A91: 89 | B91: 134123
A92: 90 | B92: 147535
A93: 91 | B93: 162289
A94: 92 | B94: 178518
A95: 93 | B95: 196369
A96: 94 | B96: 216006
A97: 95 | B97: 237607
A98: 96 | B98: 261368
A99: 97 | B99: 287504
A100: 98 | B100: 316255
A101: 99 | B101: 347880
A102: 100 | B102: 382668

Sheet: 任务奖励表
A1: id | B1: 章名称 | C1: 小节序号 | D1: 小节名称 | E1: 进度层数 | F1: 每次消耗体力 | G1: 每次奖励经验 | H1: 每次奖励铜板 | I1: 小节描述
A2: id | B2: chapter_id | C2: section_id | D2: section_name | E2: points | F2: power_consume | G2: exp_obtain | H2: coins_obtain | I2: description
A3: 1 | B3: 初入仙界 | C3: 1 | D3: 上帝的生活1 | E3: 5 | F3: 5 | G3: =RC[-2]*1 -> 5 | H3: =RC[-3]*10 -> 50 | I3: 待补充
A4: 2 | B4: 初入仙界 | C4: =R[-1]C+1 -> 2 | D4: 上帝的生活2 | E4: 5 | F4: =R[-1]C -> 5 | G4: =RC[-2]*1 -> 5 | H4: =RC[-3]*10 -> 50 | I4: 待补充
A5: 3 | B5: 初入仙界 | C5: =R[-1]C+1 -> 3 | D5: 上帝的生活3 | E5: 5 | F5: =R[-1]C -> 5 | G5: =RC[-2]*1 -> 5 | H5: =RC[-3]*10 -> 50 | I5: 待补充
A6: 4 | B6: 初入仙界 | C6: =R[-1]C+1 -> 4 | D6: 上帝的生活4 | E6: 5 | F6: =R[-1]C -> 5 | G6: =RC[-2]*1 -> 5 | H6: =RC[-3]*10 -> 50 | I6: 待补充
A7: 5 | B7: 初入仙界 | C7: =R[-1]C+1 -> 5 | D7: 上帝的生活5 | E7: 5 | F7: =R[-1]C -> 5 | G7: =RC[-2]*1 -> 5 | H7: =RC[-3]*10 -> 50 | I7: 待补充
A8: 6 | B8: 初入仙界 | C8: =R[-1]C+1 -> 6 | D8: 上帝的生活6 | E8: 5 | F8: =R[-1]C -> 5 | G8: =RC[-2]*1 -> 5 | H8: =RC[-3]*10 -> 50 | I8: 待补充
A9: 7 | B9: 初入仙界 | C9: =R[-1]C+1 -> 7 | D9: 上帝的生活7 | E9: 5 | F9: =R[-1]C -> 5 | G9: =RC[-2]*1 -> 5 | H9: =RC[-3]*10 -> 50 | I9: 待补充
A10: 8 | B10: 初入仙界 | C10: =R[-1]C+1 -> 8 | D10: 上帝的生活8 | E10: 5 | F10: =R[-1]C -> 5 | G10: =RC[-2]*1 -> 5 | H10: =RC[-3]*10 -> 50 | I10: 待补充
A11: 9 | B11: 初入仙界 | C11: =R[-1]C+1 -> 9 | D11: 上帝的生活9 | E11: 5 | F11: =R[-1]C -> 5 | G11: =RC[-2]*1 -> 5 | H11: =RC[-3]*10 -> 50 | I11: 待补充
A12: 10 | B12: 初入仙界 | C12: =R[-1]C+1 -> 10 | D12: 上帝的生活10 | E12: 5 | F12: =R[-1]C -> 5 | G12: =RC[-2]*1 -> 5 | H12: =RC[-3]*10 -> 50 | I12: 待补充
A13: 11 | B13: 我们的爱 | C13: =R[-1]C+1 -> 11 | D13: 上帝的生活11 | E13: 5 | F13: =R[-1]C -> 5 | G13: =RC[-2]*1 -> 5 | H13: =RC[-3]*10 -> 50 | I13: 待补充
A14: 12 | B14: 我们的爱 | C14: =R[-1]C+1 -> 12 | D14: 上帝的生活12 | E14: 5 | F14: =R[-1]C -> 5 | G14: =RC[-2]*1 -> 5 | H14: =RC[-3]*10 -> 50 | I14: 待补充
A15: 13 | B15: 我们的爱 | C15: =R[-1]C+1 -> 13 | D15: 上帝的生活13 | E15: 5 | F15: =R[-1]C -> 5 | G15: =RC[-2]*1 -> 5 | H15: =RC[-3]*10 -> 50 | I15: 待补充
A16: 14 | B16: 我们的爱 | C16: =R[-1]C+1 -> 14 | D16: 上帝的生活14 | E16: 5 | F16: =R[-1]C -> 5 | G16: =RC[-2]*1 -> 5 | H16: =RC[-3]*10 -> 50 | I16: 待补充
A17: 15 | B17: 我们的爱 | C17: =R[-1]C+1 -> 15 | D17: 上帝的生活15 | E17: 5 | F17: =R[-1]C -> 5 | G17: =RC[-2]*1 -> 5 | H17: =RC[-3]*10 -> 50 | I17: 待补充
A18: 16 | B18: 我们的爱 | C18: =R[-1]C+1 -> 16 | D18: 上帝的生活16 | E18: 5 | F18: =R[-1]C -> 5 | G18: =RC[-2]*1 -> 5 | H18: =RC[-3]*10 -> 50 | I18: 待补充
A19: 17 | B19: 我们的爱 | C19: =R[-1]C+1 -> 17 | D19: 上帝的生活17 | E19: 5 | F19: =R[-1]C -> 5 | G19: =RC[-2]*1 -> 5 | H19: =RC[-3]*10 -> 50 | I19: 待补充
A20: 18 | B20: 我们的爱 | C20: =R[-1]C+1 -> 18 | D20: 上帝的生活18 | E20: 5 | F20: =R[-1]C -> 5 | G20: =RC[-2]*1 -> 5 | H20: =RC[-3]*10 -> 50 | I20: 待补充
A21: 19 | B21: 我们的爱 | C21: =R[-1]C+1 -> 19 | D21: 上帝的生活19 | E21: 5 | F21: =R[-1]C -> 5 | G21: =RC[-2]*1 -> 5 | H21: =RC[-3]*10 -> 50 | I21: 待补充
A22: 20 | B22: 我们的爱 | C22: =R[-1]C+1 -> 20 | D22: 上帝的生活20 | E22: 5 | F22: =R[-1]C -> 5 | G22: =RC[-2]*1 -> 5 | H22: =RC[-3]*10 -> 50 | I22: 待补充
A23: 21 | B23: 猴子出世 | C23: =R[-1]C+1 -> 21 | D23: 上帝的生活21 | E23: 6 | F23: =R[-1]C -> 5 | G23: =RC[-2]*2 -> 12 | H23: =RC[-3]*10 -> 60 | I23: 待补充
A24: 22 | B24: 猴子出世 | C24: =R[-1]C+1 -> 22 | D24: 上帝的生活22 | E24: 6 | F24: =R[-1]C -> 5 | G24: =RC[-2]*2 -> 12 | H24: =RC[-3]*10 -> 60 | I24: 待补充
A25: 23 | B25: 猴子出世 | C25: =R[-1]C+1 -> 23 | D25: 上帝的生活23 | E25: 6 | F25: =R[-1]C -> 5 | G25: =RC[-2]*2 -> 12 | H25: =RC[-3]*10 -> 60 | I25: 待补充
A26: 24 | B26: 猴子出世 | C26: =R[-1]C+1 -> 24 | D26: 上帝的生活24 | E26: 6 | F26: =R[-1]C -> 5 | G26: =RC[-2]*2 -> 12 | H26: =RC[-3]*10 -> 60 | I26: 待补充
A27: 25 | B27: 猴子出世 | C27: =R[-1]C+1 -> 25 | D27: 上帝的生活25 | E27: 6 | F27: =R[-1]C -> 5 | G27: =RC[-2]*2 -> 12 | H27: =RC[-3]*10 -> 60 | I27: 待补充
A28: 26 | B28: 猴子出世 | C28: =R[-1]C+1 -> 26 | D28: 上帝的生活26 | E28: 6 | F28: =R[-1]C -> 5 | G28: =RC[-2]*2 -> 12 | H28: =RC[-3]*10 -> 60 | I28: 待补充
A29: 27 | B29: 猴子出世 | C29: =R[-1]C+1 -> 27 | D29: 上帝的生活27 | E29: 6 | F29: =R[-1]C -> 5 | G29: =RC[-2]*2 -> 12 | H29: =RC[-3]*10 -> 60 | I29: 待补充
A30: 28 | B30: 猴子出世 | C30: =R[-1]C+1 -> 28 | D30: 上帝的生活28 | E30: 6 | F30: =R[-1]C -> 5 | G30: =RC[-2]*2 -> 12 | H30: =RC[-3]*10 -> 60 | I30: 待补充
A31: 29 | B31: 猴子出世 | C31: =R[-1]C+1 -> 29 | D31: 上帝的生活29 | E31: 6 | F31: =R[-1]C -> 5 | G31: =RC[-2]*2 -> 12 | H31: =RC[-3]*10 -> 60 | I31: 待补充
A32: 30 | B32: 猴子出世 | C32: =R[-1]C+1 -> 30 | D32: 上帝的生活30 | E32: 6 | F32: =R[-1]C -> 5 | G32: =RC[-2]*2 -> 12 | H32: =RC[-3]*10 -> 60 | I32: 待补充
A33: 31 | B33: 八戒与玉帝 | C33: =R[-1]C+1 -> 31 | D33: 上帝的生活31 | E33: 6 | F33: =R[-1]C -> 5 | G33: =RC[-2]*2 -> 12 | H33: =RC[-3]*10 -> 60 | I33: 待补充
A34: 32 | B34: 八戒与玉帝 | C34: =R[-1]C+1 -> 32 | D34: 上帝的生活32 | E34: 6 | F34: =R[-1]C -> 5 | G34: =RC[-2]*2 -> 12 | H34: =RC[-3]*10 -> 60 | I34: 待补充
A35: 33 | B35: 八戒与玉帝 | C35: =R[-1]C+1 -> 33 | D35: 上帝的生活33 | E35: 6 | F35: =R[-1]C -> 5 | G35: =RC[-2]*2 -> 12 | H35: =RC[-3]*10 -> 60 | I35: 待补充
A36: 34 | B36: 八戒与玉帝 | C36: =R[-1]C+1 -> 34 | D36: 上帝的生活34 | E36: 6 | F36: =R[-1]C -> 5 | G36: =RC[-2]*2 -> 12 | H36: =RC[-3]*10 -> 60 | I36: 待补充
A37: 35 | B37: 八戒与玉帝 | C37: =R[-1]C+1 -> 35 | D37: 上帝的生活35 | E37: 6 | F37: =R[-1]C -> 5 | G37: =RC[-2]*2 -> 12 | H37: =RC[-3]*10 -> 60 | I37: 待补充
A38: 36 | B38: 八戒与玉帝 | C38: =R[-1]C+1 -> 36 | D38: 上帝的生活36 | E38: 6 | F38: =R[-1]C -> 5 | G38: =RC[-2]*2 -> 12 | H38: =RC[-3]*10 -> 60 | I38: 待补充
A39: 37 | B39: 八戒与玉帝 | C39: =R[-1]C+1 -> 37 | D39: 上帝的生活37 | E39: 6 | F39: =R[-1]C -> 5 | G39: =RC[-2]*2 -> 12 | H39: =RC[-3]*10 -> 60 | I39: 待补充
A40: 38 | B40: 八戒与玉帝 | C40: =R[-1]C+1 -> 38 | D40: 上帝的生活38 | E40: 6 | F40: =R[-1]C -> 5 | G40: =RC[-2]*2 -> 12 | H40: =RC[-3]*10 -> 60 | I40: 待补充
A41: 39 | B41: 八戒与玉帝 | C41: =R[-1]C+1 -> 39 | D41: 上帝的生活39 | E41: 6 | F41: =R[-1]C -> 5 | G41: =RC[-2]*2 -> 12 | H41: =RC[-3]*10 -> 60 | I41: 待补充
A42: 40 | B42: 八戒与玉帝 | C42: =R[-1]C+1 -> 40 | D42: 上帝的生活40 | E42: 6 | F42: =R[-1]C -> 5 | G42: =RC[-2]*2 -> 12 | H42: =RC[-3]*10 -> 60 | I42: 待补充
A43: 41 | B43: 无法无天 | C43: =R[-1]C+1 -> 41 | D43: 上帝的生活41 | E43: 7 | F43: =R[-1]C -> 5 | G43: =RC[-2]*3 -> 21 | H43: =RC[-3]*10 -> 70 | I43: 待补充
A44: 42 | B44: 无法无天 | C44: =R[-1]C+1 -> 42 | D44: 上帝的生活42 | E44: 7 | F44: =R[-1]C -> 5 | G44: =RC[-2]*3 -> 21 | H44: =RC[-3]*10 -> 70 | I44: 待补充
A45: 43 | B45: 无法无天 | C45: =R[-1]C+1 -> 43 | D45: 上帝的生活43 | E45: 7 | F45: =R[-1]C -> 5 | G45: =RC[-2]*3 -> 21 | H45: =RC[-3]*10 -> 70 | I45: 待补充
A46: 44 | B46: 无法无天 | C46: =R[-1]C+1 -> 44 | D46: 上帝的生活44 | E46: 7 | F46: =R[-1]C -> 5 | G46: =RC[-2]*3 -> 21 | H46: =RC[-3]*10 -> 70 | I46: 待补充
A47: 45 | B47: 无法无天 | C47: =R[-1]C+1 -> 45 | D47: 上帝的生活45 | E47: 7 | F47: =R[-1]C -> 5 | G47: =RC[-2]*3 -> 21 | H47: =RC[-3]*10 -> 70 | I47: 待补充
A48: 46 | B48: 无法无天 | C48: =R[-1]C+1 -> 46 | D48: 上帝的生活46 | E48: 7 | F48: =R[-1]C -> 5 | G48: =RC[-2]*3 -> 21 | H48: =RC[-3]*10 -> 70 | I48: 待补充
A49: 47 | B49: 无法无天 | C49: =R[-1]C+1 -> 47 | D49: 上帝的生活47 | E49: 7 | F49: =R[-1]C -> 5 | G49: =RC[-2]*3 -> 21 | H49: =RC[-3]*10 -> 70 | I49: 待补充
A50: 48 | B50: 无法无天 | C50: =R[-1]C+1 -> 48 | D50: 上帝的生活48 | E50: 7 | F50: =R[-1]C -> 5 | G50: =RC[-2]*3 -> 21 | H50: =RC[-3]*10 -> 70 | I50: 待补充
A51: 49 | B51: 无法无天 | C51: =R[-1]C+1 -> 49 | D51: 上帝的生活49 | E51: 7 | F51: =R[-1]C -> 5 | G51: =RC[-2]*3 -> 21 | H51: =RC[-3]*10 -> 70 | I51: 待补充
A52: 50 | B52: 无法无天 | C52: =R[-1]C+1 -> 50 | D52: 上帝的生活50 | E52: 7 | F52: =R[-1]C -> 5 | G52: =RC[-2]*3 -> 21 | H52: =RC[-3]*10 -> 70 | I52: 待补充
A53: 51 | B53: 罪孽深重 | C53: =R[-1]C+1 -> 51 | D53: 上帝的生活51 | E53: 7 | F53: =R[-1]C -> 5 | G53: =RC[-2]*3 -> 21 | H53: =RC[-3]*10 -> 70 | I53: 待补充
A54: 52 | B54: 罪孽深重 | C54: =R[-1]C+1 -> 52 | D54: 上帝的生活52 | E54: 7 | F54: =R[-1]C -> 5 | G54: =RC[-2]*3 -> 21 | H54: =RC[-3]*10 -> 70 | I54: 待补充
A55: 53 | B55: 罪孽深重 | C55: =R[-1]C+1 -> 53 | D55: 上帝的生活53 | E55: 7 | F55: =R[-1]C -> 5 | G55: =RC[-2]*3 -> 21 | H55: =RC[-3]*10 -> 70 | I55: 待补充
A56: 54 | B56: 罪孽深重 | C56: =R[-1]C+1 -> 54 | D56: 上帝的生活54 | E56: 7 | F56: =R[-1]C -> 5 | G56: =RC[-2]*3 -> 21 | H56: =RC[-3]*10 -> 70 | I56: 待补充
A57: 55 | B57: 罪孽深重 | C57: =R[-1]C+1 -> 55 | D57: 上帝的生活55 | E57: 7 | F57: =R[-1]C -> 5 | G57: =RC[-2]*3 -> 21 | H57: =RC[-3]*10 -> 70 | I57: 待补充
A58: 56 | B58: 罪孽深重 | C58: =R[-1]C+1 -> 56 | D58: 上帝的生活56 | E58: 7 | F58: =R[-1]C -> 5 | G58: =RC[-2]*3 -> 21 | H58: =RC[-3]*10 -> 70 | I58: 待补充
A59: 57 | B59: 罪孽深重 | C59: =R[-1]C+1 -> 57 | D59: 上帝的生活57 | E59: 7 | F59: =R[-1]C -> 5 | G59: =RC[-2]*3 -> 21 | H59: =RC[-3]*10 -> 70 | I59: 待补充
A60: 58 | B60: 罪孽深重 | C60: =R[-1]C+1 -> 58 | D60: 上帝的生活58 | E60: 7 | F60: =R[-1]C -> 5 | G60: =RC[-2]*3 -> 21 | H60: =RC[-3]*10 -> 70 | I60: 待补充
A61: 59 | B61: 罪孽深重 | C61: =R[-1]C+1 -> 59 | D61: 上帝的生活59 | E61: 7 | F61: =R[-1]C -> 5 | G61: =RC[-2]*3 -> 21 | H61: =RC[-3]*10 -> 70 | I61: 待补充
A62: 60 | B62: 罪孽深重 | C62: =R[-1]C+1 -> 60 | D62: 上帝的生活60 | E62: 7 | F62: =R[-1]C -> 5 | G62: =RC[-2]*3 -> 21 | H62: =RC[-3]*10 -> 70 | I62: 待补充
A63: 61 | B63: 地狱十八层 | C63: =R[-1]C+1 -> 61 | D63: 上帝的生活61 | E63: 8 | F63: =R[-1]C -> 5 | G63: =RC[-2]*4 -> 32 | H63: =RC[-3]*10 -> 80 | I63: 待补充
A64: 62 | B64: 地狱十八层 | C64: =R[-1]C+1 -> 62 | D64: 上帝的生活62 | E64: 8 | F64: =R[-1]C -> 5 | G64: =RC[-2]*4 -> 32 | H64: =RC[-3]*10 -> 80 | I64: 待补充
A65: 63 | B65: 地狱十八层 | C65: =R[-1]C+1 -> 63 | D65: 上帝的生活63 | E65: 8 | F65: =R[-1]C -> 5 | G65: =RC[-2]*4 -> 32 | H65: =RC[-3]*10 -> 80 | I65: 待补充
A66: 64 | B66: 地狱十八层 | C66: =R[-1]C+1 -> 64 | D66: 上帝的生活64 | E66: 8 | F66: =R[-1]C -> 5 | G66: =RC[-2]*4 -> 32 | H66: =RC[-3]*10 -> 80 | I66: 待补充
A67: 65 | B67: 地狱十八层 | C67: =R[-1]C+1 -> 65 | D67: 上帝的生活65 | E67: 8 | F67: =R[-1]C -> 5 | G67: =RC[-2]*4 -> 32 | H67: =RC[-3]*10 -> 80 | I67: 待补充
A68: 66 | B68: 地狱十八层 | C68: =R[-1]C+1 -> 66 | D68: 上帝的生活66 | E68: 8 | F68: =R[-1]C -> 5 | G68: =RC[-2]*4 -> 32 | H68: =RC[-3]*10 -> 80 | I68: 待补充
A69: 67 | B69: 地狱十八层 | C69: =R[-1]C+1 -> 67 | D69: 上帝的生活67 | E69: 8 | F69: =R[-1]C -> 5 | G69: =RC[-2]*4 -> 32 | H69: =RC[-3]*10 -> 80 | I69: 待补充
A70: 68 | B70: 地狱十八层 | C70: =R[-1]C+1 -> 68 | D70: 上帝的生活68 | E70: 8 | F70: =R[-1]C -> 5 | G70: =RC[-2]*4 -> 32 | H70: =RC[-3]*10 -> 80 | I70: 待补充
A71: 69 | B71: 地狱十八层 | C71: =R[-1]C+1 -> 69 | D71: 上帝的生活69 | E71: 8 | F71: =R[-1]C -> 5 | G71: =RC[-2]*4 -> 32 | H71: =RC[-3]*10 -> 80 | I71: 待补充
A72: 70 | B72: 地狱十八层 | C72: =R[-1]C+1 -> 70 | D72: 上帝的生活70 | E72: 8 | F72: =R[-1]C -> 5 | G72: =RC[-2]*4 -> 32 | H72: =RC[-3]*10 -> 80 | I72: 待补充
A73: 71 | B73: 超级魔王 | C73: =R[-1]C+1 -> 71 | D73: 上帝的生活71 | E73: 10 | F73: =R[-1]C -> 5 | G73: =RC[-2]*5 -> 50 | H73: =RC[-3]*10 -> 100 | I73: 待补充
A74: 72 | B74: 超级魔王 | C74: =R[-1]C+1 -> 72 | D74: 上帝的生活72 | E74: 10 | F74: =R[-1]C -> 5 | G74: =RC[-2]*5 -> 50 | H74: =RC[-3]*10 -> 100 | I74: 待补充
A75: 73 | B75: 超级魔王 | C75: =R[-1]C+1 -> 73 | D75: 上帝的生活73 | E75: 10 | F75: =R[-1]C -> 5 | G75: =RC[-2]*5 -> 50 | H75: =RC[-3]*10 -> 100 | I75: 待补充
A76: 74 | B76: 超级魔王 | C76: =R[-1]C+1 -> 74 | D76: 上帝的生活74 | E76: 10 | F76: =R[-1]C -> 5 | G76: =RC[-2]*5 -> 50 | H76: =RC[-3]*10 -> 100 | I76: 待补充
A77: 75 | B77: 超级魔王 | C77: =R[-1]C+1 -> 75 | D77: 上帝的生活75 | E77: 10 | F77: =R[-1]C -> 5 | G77: =RC[-2]*5 -> 50 | H77: =RC[-3]*10 -> 100 | I77: 待补充
A78: 76 | B78: 超级魔王 | C78: =R[-1]C+1 -> 76 | D78: 上帝的生活76 | E78: 10 | F78: =R[-1]C -> 5 | G78: =RC[-2]*5 -> 50 | H78: =RC[-3]*10 -> 100 | I78: 待补充
A79: 77 | B79: 超级魔王 | C79: =R[-1]C+1 -> 77 | D79: 上帝的生活77 | E79: 10 | F79: =R[-1]C -> 5 | G79: =RC[-2]*5 -> 50 | H79: =RC[-3]*10 -> 100 | I79: 待补充
A80: 78 | B80: 超级魔王 | C80: =R[-1]C+1 -> 78 | D80: 上帝的生活78 | E80: 10 | F80: =R[-1]C -> 5 | G80: =RC[-2]*5 -> 50 | H80: =RC[-3]*10 -> 100 | I80: 待补充
A81: 79 | B81: 超级魔王 | C81: =R[-1]C+1 -> 79 | D81: 上帝的生活79 | E81: 10 | F81: =R[-1]C -> 5 | G81: =RC[-2]*5 -> 50 | H81: =RC[-3]*10 -> 100 | I81: 待补充
A82: 80 | B82: 超级魔王 | C82: =R[-1]C+1 -> 80 | D82: 上帝的生活80 | E82: 10 | F82: =R[-1]C -> 5 | G82: =RC[-2]*5 -> 50 | H82: =RC[-3]*10 -> 100 | I82: 待补充
A83: 81 | B83: 嫦娥的心事 | C83: =R[-1]C+1 -> 81 | D83: 上帝的生活81 | E83: 12 | F83: =R[-1]C -> 5 | G83: =RC[-2]*5 -> 60 | H83: =RC[-3]*10 -> 120 | I83: 待补充
A84: 82 | B84: 嫦娥的心事 | C84: =R[-1]C+1 -> 82 | D84: 上帝的生活82 | E84: 12 | F84: =R[-1]C -> 5 | G84: =RC[-2]*5 -> 60 | H84: =RC[-3]*10 -> 120 | I84: 待补充
A85: 83 | B85: 嫦娥的心事 | C85: =R[-1]C+1 -> 83 | D85: 上帝的生活83 | E85: 12 | F85: =R[-1]C -> 5 | G85: =RC[-2]*5 -> 60 | H85: =RC[-3]*10 -> 120 | I85: 待补充
A86: 84 | B86: 嫦娥的心事 | C86: =R[-1]C+1 -> 84 | D86: 上帝的生活84 | E86: 12 | F86: =R[-1]C -> 5 | G86: =RC[-2]*5 -> 60 | H86: =RC[-3]*10 -> 120 | I86: 待补充
A87: 85 | B87: 嫦娥的心事 | C87: =R[-1]C+1 -> 85 | D87: 上帝的生活85 | E87: 12 | F87: =R[-1]C -> 5 | G87: =RC[-2]*5 -> 60 | H87: =RC[-3]*10 -> 120 | I87: 待补充
A88: 86 | B88: 嫦娥的心事 | C88: =R[-1]C+1 -> 86 | D88: 上帝的生活86 | E88: 12 | F88: =R[-1]C -> 5 | G88: =RC[-2]*5 -> 60 | H88: =RC[-3]*10 -> 120 | I88: 待补充
A89: 87 | B89: 嫦娥的心事 | C89: =R[-1]C+1 -> 87 | D89: 上帝的生活87 | E89: 12 | F89: =R[-1]C -> 5 | G89: =RC[-2]*5 -> 60 | H89: =RC[-3]*10 -> 120 | I89: 待补充
A90: 88 | B90: 嫦娥的心事 | C90: =R[-1]C+1 -> 88 | D90: 上帝的生活88 | E90: 12 | F90: =R[-1]C -> 5 | G90: =RC[-2]*5 -> 60 | H90: =RC[-3]*10 -> 120 | I90: 待补充
A91: 89 | B91: 嫦娥的心事 | C91: =R[-1]C+1 -> 89 | D91: 上帝的生活89 | E91: 12 | F91: =R[-1]C -> 5 | G91: =RC[-2]*5 -> 60 | H91: =RC[-3]*10 -> 120 | I91: 待补充
A92: 90 | B92: 嫦娥的心事 | C92: =R[-1]C+1 -> 90 | D92: 上帝的生活90 | E92: 12 | F92: =R[-1]C -> 5 | G92: =RC[-2]*5 -> 60 | H92: =RC[-3]*10 -> 120 | I92: 待补充
A93: 91 | B93: 女娲娘娘 | C93: =R[-1]C+1 -> 91 | D93: 上帝的生活91 | E93: 14 | F93: =R[-1]C -> 5 | G93: =RC[-2]*5 -> 70 | H93: =RC[-3]*10 -> 140 | I93: 待补充
A94: 92 | B94: 女娲娘娘 | C94: =R[-1]C+1 -> 92 | D94: 上帝的生活92 | E94: 14 | F94: =R[-1]C -> 5 | G94: =RC[-2]*5 -> 70 | H94: =RC[-3]*10 -> 140 | I94: 待补充
A95: 93 | B95: 女娲娘娘 | C95: =R[-1]C+1 -> 93 | D95: 上帝的生活93 | E95: 14 | F95: =R[-1]C -> 5 | G95: =RC[-2]*5 -> 70 | H95: =RC[-3]*10 -> 140 | I95: 待补充
A96: 94 | B96: 女娲娘娘 | C96: =R[-1]C+1 -> 94 | D96: 上帝的生活94 | E96: 14 | F96: =R[-1]C -> 5 | G96: =RC[-2]*5 -> 70 | H96: =RC[-3]*10 -> 140 | I96: 待补充
A97: 95 | B97: 女娲娘娘 | C97: =R[-1]C+1 -> 95 | D97: 上帝的生活95 | E97: 14 | F97: =R[-1]C -> 5 | G97: =RC[-2]*5 -> 70 | H97: =RC[-3]*10 -> 140 | I97: 待补充
A98: 96 | B98: 女娲娘娘 | C98: =R[-1]C+1 -> 96 | D98: 上帝的生活96 | E98: 14 | F98: =R[-1]C -> 5 | G98: =RC[-2]*5 -> 70 | H98: =RC[-3]*10 -> 140 | I98: 待补充
A99: 97 | B99: 女娲娘娘 | C99: =R[-1]C+1 -> 97 | D99: 上帝的生活97 | E99: 14 | F99: =R[-1]C -> 5 | G99: =RC[-2]*5 -> 70 | H99: =RC[-3]*10 -> 140 | I99: 待补充
A100: 98 | B100: 女娲娘娘 | C100: =R[-1]C+1 -> 98 | D100: 上帝的生活98 | E100: 14 | F100: =R[-1]C -> 5 | G100: =RC[-2]*5 -> 70 | H100: =RC[-3]*10 -> 140 | I100: 待补充
A101: 99 | B101: 女娲娘娘 | C101: =R[-1]C+1 -> 99 | D101: 上帝的生活99 | E101: 14 | F101: =R[-1]C -> 5 | G101: =RC[-2]*5 -> 70 | H101: =RC[-3]*10 -> 140 | I101: 待补充
A102: 100 | B102: 女娲娘娘 | C102: =R[-1]C+1 -> 100 | D102: 上帝的生活100 | E102: 14 | F102: =R[-1]C -> 5 | G102: =RC[-2]*5 -> 70 | H102: =RC[-3]*10 -> 140 | I102: 待补充
A103: 101 | B103: 后裔喝醉了 | C103: =R[-1]C+1 -> 101 | D103: 上帝的生活101 | E103: 15 | F103: =R[-1]C -> 5 | G103: =RC[-2]*5 -> 75 | H103: =RC[-3]*10 -> 150 | I103: 待补充
A104: 102 | B104: 后裔喝醉了 | C104: =R[-1]C+1 -> 102 | D104: 上帝的生活102 | E104: 15 | F104: =R[-1]C -> 5 | G104: =RC[-2]*5 -> 75 | H104: =RC[-3]*10 -> 150 | I104: 待补充
A105: 103 | B105: 后裔喝醉了 | C105: =R[-1]C+1 -> 103 | D105: 上帝的生活103 | E105: 15 | F105: =R[-1]C -> 5 | G105: =RC[-2]*5 -> 75 | H105: =RC[-3]*10 -> 150 | I105: 待补充
A106: 104 | B106: 后裔喝醉了 | C106: =R[-1]C+1 -> 104 | D106: 上帝的生活104 | E106: 15 | F106: =R[-1]C -> 5 | G106: =RC[-2]*5 -> 75 | H106: =RC[-3]*10 -> 150 | I106: 待补充
A107: 105 | B107: 后裔喝醉了 | C107: =R[-1]C+1 -> 105 | D107: 上帝的生活105 | E107: 15 | F107: =R[-1]C -> 5 | G107: =RC[-2]*5 -> 75 | H107: =RC[-3]*10 -> 150 | I107: 待补充
A108: 106 | B108: 后裔喝醉了 | C108: =R[-1]C+1 -> 106 | D108: 上帝的生活106 | E108: 15 | F108: =R[-1]C -> 5 | G108: =RC[-2]*5 -> 75 | H108: =RC[-3]*10 -> 150 | I108: 待补充
A109: 107 | B109: 后裔喝醉了 | C109: =R[-1]C+1 -> 107 | D109: 上帝的生活107 | E109: 15 | F109: =R[-1]C -> 5 | G109: =RC[-2]*5 -> 75 | H109: =RC[-3]*10 -> 150 | I109: 待补充
A110: 108 | B110: 后裔喝醉了 | C110: =R[-1]C+1 -> 108 | D110: 上帝的生活108 | E110: 15 | F110: =R[-1]C -> 5 | G110: =RC[-2]*5 -> 75 | H110: =RC[-3]*10 -> 150 | I110: 待补充
A111: 109 | B111: 后裔喝醉了 | C111: =R[-1]C+1 -> 109 | D111: 上帝的生活109 | E111: 15 | F111: =R[-1]C -> 5 | G111: =RC[-2]*5 -> 75 | H111: =RC[-3]*10 -> 150 | I111: 待补充
A112: 110 | B112: 后裔喝醉了 | C112: =R[-1]C+1 -> 110 | D112: 上帝的生活110 | E112: 15 | F112: =R[-1]C -> 5 | G112: =RC[-2]*5 -> 75 | H112: =RC[-3]*10 -> 150 | I112: 待补充
A113: 111 | B113: 这不是真的 | C113: =R[-1]C+1 -> 111 | D113: 上帝的生活111 | E113: 16 | F113: =R[-1]C -> 5 | G113: =RC[-2]*5 -> 80 | H113: =RC[-3]*10 -> 160 | I113: 待补充
A114: 112 | B114: 这不是真的 | C114: =R[-1]C+1 -> 112 | D114: 上帝的生活112 | E114: 16 | F114: =R[-1]C -> 5 | G114: =RC[-2]*5 -> 80 | H114: =RC[-3]*10 -> 160 | I114: 待补充
A115: 113 | B115: 这不是真的 | C115: =R[-1]C+1 -> 113 | D115: 上帝的生活113 | E115: 16 | F115: =R[-1]C -> 5 | G115: =RC[-2]*5 -> 80 | H115: =RC[-3]*10 -> 160 | I115: 待补充
A116: 114 | B116: 这不是真的 | C116: =R[-1]C+1 -> 114 | D116: 上帝的生活114 | E116: 16 | F116: =R[-1]C -> 5 | G116: =RC[-2]*5 -> 80 | H116: =RC[-3]*10 -> 160 | I116: 待补充
A117: 115 | B117: 这不是真的 | C117: =R[-1]C+1 -> 115 | D117: 上帝的生活115 | E117: 16 | F117: =R[-1]C -> 5 | G117: =RC[-2]*5 -> 80 | H117: =RC[-3]*10 -> 160 | I117: 待补充
A118: 116 | B118: 这不是真的 | C118: =R[-1]C+1 -> 116 | D118: 上帝的生活116 | E118: 16 | F118: =R[-1]C -> 5 | G118: =RC[-2]*5 -> 80 | H118: =RC[-3]*10 -> 160 | I118: 待补充
A119: 117 | B119: 这不是真的 | C119: =R[-1]C+1 -> 117 | D119: 上帝的生活117 | E119: 16 | F119: =R[-1]C -> 5 | G119: =RC[-2]*5 -> 80 | H119: =RC[-3]*10 -> 160 | I119: 待补充
A120: 118 | B120: 这不是真的 | C120: =R[-1]C+1 -> 118 | D120: 上帝的生活118 | E120: 16 | F120: =R[-1]C -> 5 | G120: =RC[-2]*5 -> 80 | H120: =RC[-3]*10 -> 160 | I120: 待补充
A121: 119 | B121: 这不是真的 | C121: =R[-1]C+1 -> 119 | D121: 上帝的生活119 | E121: 16 | F121: =R[-1]C -> 5 | G121: =RC[-2]*5 -> 80 | H121: =RC[-3]*10 -> 160 | I121: 待补充
A122: 120 | B122: 这不是真的 | C122: =R[-1]C+1 -> 120 | D122: 上帝的生活120 | E122: 16 | F122: =R[-1]C -> 5 | G122: =RC[-2]*5 -> 80 | H122: =RC[-3]*10 -> 160 | I122: 待补充
A123: 121 | B123: 从头开始 | C123: =R[-1]C+1 -> 121 | D123: 上帝的生活121 | E123: 17 | F123: =R[-1]C -> 5 | G123: =RC[-2]*5 -> 85 | H123: =RC[-3]*10 -> 170 | I123: 待补充
A124: 122 | B124: 从头开始 | C124: =R[-1]C+1 -> 122 | D124: 上帝的生活122 | E124: 17 | F124: =R[-1]C -> 5 | G124: =RC[-2]*5 -> 85 | H124: =RC[-3]*10 -> 170 | I124: 待补充
A125: 123 | B125: 从头开始 | C125: =R[-1]C+1 -> 123 | D125: 上帝的生活123 | E125: 17 | F125: =R[-1]C -> 5 | G125: =RC[-2]*5 -> 85 | H125: =RC[-3]*10 -> 170 | I125: 待补充
A126: 124 | B126: 从头开始 | C126: =R[-1]C+1 -> 124 | D126: 上帝的生活124 | E126: 17 | F126: =R[-1]C -> 5 | G126: =RC[-2]*5 -> 85 | H126: =RC[-3]*10 -> 170 | I126: 待补充
A127: 125 | B127: 从头开始 | C127: =R[-1]C+1 -> 125 | D127: 上帝的生活125 | E127: 17 | F127: =R[-1]C -> 5 | G127: =RC[-2]*5 -> 85 | H127: =RC[-3]*10 -> 170 | I127: 待补充
A128: 126 | B128: 从头开始 | C128: =R[-1]C+1 -> 126 | D128: 上帝的生活126 | E128: 17 | F128: =R[-1]C -> 5 | G128: =RC[-2]*5 -> 85 | H128: =RC[-3]*10 -> 170 | I128: 待补充
A129: 127 | B129: 从头开始 | C129: =R[-1]C+1 -> 127 | D129: 上帝的生活127 | E129: 17 | F129: =R[-1]C -> 5 | G129: =RC[-2]*5 -> 85 | H129: =RC[-3]*10 -> 170 | I129: 待补充
A130: 128 | B130: 从头开始 | C130: =R[-1]C+1 -> 128 | D130: 上帝的生活128 | E130: 17 | F130: =R[-1]C -> 5 | G130: =RC[-2]*5 -> 85 | H130: =RC[-3]*10 -> 170 | I130: 待补充
A131: 129 | B131: 从头开始 | C131: =R[-1]C+1 -> 129 | D131: 上帝的生活129 | E131: 17 | F131: =R[-1]C -> 5 | G131: =RC[-2]*5 -> 85 | H131: =RC[-3]*10 -> 170 | I131: 待补充
A132: 130 | B132: 从头开始 | C132: =R[-1]C+1 -> 130 | D132: 上帝的生活130 | E132: 17 | F132: =R[-1]C -> 5 | G132: =RC[-2]*5 -> 85 | H132: =RC[-3]*10 -> 170 | I132: 待补充
A133: 131 | B133: 七夕之日 | C133: =R[-1]C+1 -> 131 | D133: 上帝的生活131 | E133: 18 | F133: =R[-1]C -> 5 | G133: =RC[-2]*5 -> 90 | H133: =RC[-3]*10 -> 180 | I133: 待补充
A134: 132 | B134: 七夕之日 | C134: =R[-1]C+1 -> 132 | D134: 上帝的生活132 | E134: 18 | F134: =R[-1]C -> 5 | G134: =RC[-2]*5 -> 90 | H134: =RC[-3]*10 -> 180 | I134: 待补充
A135: 133 | B135: 七夕之日 | C135: =R[-1]C+1 -> 133 | D135: 上帝的生活133 | E135: 18 | F135: =R[-1]C -> 5 | G135: =RC[-2]*5 -> 90 | H135: =RC[-3]*10 -> 180 | I135: 待补充
A136: 134 | B136: 七夕之日 | C136: =R[-1]C+1 -> 134 | D136: 上帝的生活134 | E136: 18 | F136: =R[-1]C -> 5 | G136: =RC[-2]*5 -> 90 | H136: =RC[-3]*10 -> 180 | I136: 待补充
A137: 135 | B137: 七夕之日 | C137: =R[-1]C+1 -> 135 | D137: 上帝的生活135 | E137: 18 | F137: =R[-1]C -> 5 | G137: =RC[-2]*5 -> 90 | H137: =RC[-3]*10 -> 180 | I137: 待补充
A138: 136 | B138: 七夕之日 | C138: =R[-1]C+1 -> 136 | D138: 上帝的生活136 | E138: 18 | F138: =R[-1]C -> 5 | G138: =RC[-2]*5 -> 90 | H138: =RC[-3]*10 -> 180 | I138: 待补充
A139: 137 | B139: 七夕之日 | C139: =R[-1]C+1 -> 137 | D139: 上帝的生活137 | E139: 18 | F139: =R[-1]C -> 5 | G139: =RC[-2]*5 -> 90 | H139: =RC[-3]*10 -> 180 | I139: 待补充
A140: 138 | B140: 七夕之日 | C140: =R[-1]C+1 -> 138 | D140: 上帝的生活138 | E140: 18 | F140: =R[-1]C -> 5 | G140: =RC[-2]*5 -> 90 | H140: =RC[-3]*10 -> 180 | I140: 待补充
A141: 139 | B141: 七夕之日 | C141: =R[-1]C+1 -> 139 | D141: 上帝的生活139 | E141: 18 | F141: =R[-1]C -> 5 | G141: =RC[-2]*5 -> 90 | H141: =RC[-3]*10 -> 180 | I141: 待补充
A142: 140 | B142: 七夕之日 | C142: =R[-1]C+1 -> 140 | D142: 上帝的生活140 | E142: 18 | F142: =R[-1]C -> 5 | G142: =RC[-2]*5 -> 90 | H142: =RC[-3]*10 -> 180 | I142: 待补充
A143: 141 | B143: 触犯天规 | C143: =R[-1]C+1 -> 141 | D143: 上帝的生活141 | E143: 19 | F143: =R[-1]C -> 5 | G143: =RC[-2]*5 -> 95 | H143: =RC[-3]*10 -> 190 | I143: 待补充
A144: 142 | B144: 触犯天规 | C144: =R[-1]C+1 -> 142 | D144: 上帝的生活142 | E144: 19 | F144: =R[-1]C -> 5 | G144: =RC[-2]*5 -> 95 | H144: =RC[-3]*10 -> 190 | I144: 待补充
A145: 143 | B145: 触犯天规 | C145: =R[-1]C+1 -> 143 | D145: 上帝的生活143 | E145: 19 | F145: =R[-1]C -> 5 | G145: =RC[-2]*5 -> 95 | H145: =RC[-3]*10 -> 190 | I145: 待补充
A146: 144 | B146: 触犯天规 | C146: =R[-1]C+1 -> 144 | D146: 上帝的生活144 | E146: 19 | F146: =R[-1]C -> 5 | G146: =RC[-2]*5 -> 95 | H146: =RC[-3]*10 -> 190 | I146: 待补充
A147: 145 | B147: 触犯天规 | C147: =R[-1]C+1 -> 145 | D147: 上帝的生活145 | E147: 19 | F147: =R[-1]C -> 5 | G147: =RC[-2]*5 -> 95 | H147: =RC[-3]*10 -> 190 | I147: 待补充
A148: 146 | B148: 触犯天规 | C148: =R[-1]C+1 -> 146 | D148: 上帝的生活146 | E148: 19 | F148: =R[-1]C -> 5 | G148: =RC[-2]*5 -> 95 | H148: =RC[-3]*10 -> 190 | I148: 待补充
A149: 147 | B149: 触犯天规 | C149: =R[-1]C+1 -> 147 | D149: 上帝的生活147 | E149: 19 | F149: =R[-1]C -> 5 | G149: =RC[-2]*5 -> 95 | H149: =RC[-3]*10 -> 190 | I149: 待补充
A150: 148 | B150: 触犯天规 | C150: =R[-1]C+1 -> 148 | D150: 上帝的生活148 | E150: 19 | F150: =R[-1]C -> 5 | G150: =RC[-2]*5 -> 95 | H150: =RC[-3]*10 -> 190 | I150: 待补充
A151: 149 | B151: 触犯天规 | C151: =R[-1]C+1 -> 149 | D151: 上帝的生活149 | E151: 19 | F151: =R[-1]C -> 5 | G151: =RC[-2]*5 -> 95 | H151: =RC[-3]*10 -> 190 | I151: 待补充
A152: 150 | B152: 触犯天规 | C152: =R[-1]C+1 -> 150 | D152: 上帝的生活150 | E152: 19 | F152: =R[-1]C -> 5 | G152: =RC[-2]*5 -> 95 | H152: =RC[-3]*10 -> 190 | I152: 待补充
A153: 151 | B153: 蟠桃盛会 | C153: =R[-1]C+1 -> 151 | D153: 上帝的生活151 | E153: 20 | F153: =R[-1]C -> 5 | G153: =RC[-2]*5 -> 100 | H153: =RC[-3]*10 -> 200 | I153: 待补充
A154: 152 | B154: 蟠桃盛会 | C154: =R[-1]C+1 -> 152 | D154: 上帝的生活152 | E154: 20 | F154: =R[-1]C -> 5 | G154: =RC[-2]*5 -> 100 | H154: =RC[-3]*10 -> 200 | I154: 待补充
A155: 153 | B155: 蟠桃盛会 | C155: =R[-1]C+1 -> 153 | D155: 上帝的生活153 | E155: 20 | F155: =R[-1]C -> 5 | G155: =RC[-2]*5 -> 100 | H155: =RC[-3]*10 -> 200 | I155: 待补充
A156: 154 | B156: 蟠桃盛会 | C156: =R[-1]C+1 -> 154 | D156: 上帝的生活154 | E156: 20 | F156: =R[-1]C -> 5 | G156: =RC[-2]*5 -> 100 | H156: =RC[-3]*10 -> 200 | I156: 待补充
A157: 155 | B157: 蟠桃盛会 | C157: =R[-1]C+1 -> 155 | D157: 上帝的生活155 | E157: 20 | F157: =R[-1]C -> 5 | G157: =RC[-2]*5 -> 100 | H157: =RC[-3]*10 -> 200 | I157: 待补充
A158: 156 | B158: 蟠桃盛会 | C158: =R[-1]C+1 -> 156 | D158: 上帝的生活156 | E158: 20 | F158: =R[-1]C -> 5 | G158: =RC[-2]*5 -> 100 | H158: =RC[-3]*10 -> 200 | I158: 待补充
A159: 157 | B159: 蟠桃盛会 | C159: =R[-1]C+1 -> 157 | D159: 上帝的生活157 | E159: 20 | F159: =R[-1]C -> 5 | G159: =RC[-2]*5 -> 100 | H159: =RC[-3]*10 -> 200 | I159: 待补充
A160: 158 | B160: 蟠桃盛会 | C160: =R[-1]C+1 -> 158 | D160: 上帝的生活158 | E160: 20 | F160: =R[-1]C -> 5 | G160: =RC[-2]*5 -> 100 | H160: =RC[-3]*10 -> 200 | I160: 待补充
A161: 159 | B161: 蟠桃盛会 | C161: =R[-1]C+1 -> 159 | D161: 上帝的生活159 | E161: 20 | F161: =R[-1]C -> 5 | G161: =RC[-2]*5 -> 100 | H161: =RC[-3]*10 -> 200 | I161: 待补充
A162: 160 | B162: 蟠桃盛会 | C162: =R[-1]C+1 -> 160 | D162: 上帝的生活160 | E162: 20 | F162: =R[-1]C -> 5 | G162: =RC[-2]*5 -> 100 | H162: =RC[-3]*10 -> 200 | I162: 待补充
A163: 161 | B163: 师徒四人 | C163: =R[-1]C+1 -> 161 | D163: 上帝的生活161 | E163: 21 | F163: =R[-1]C -> 5 | G163: =RC[-2]*5 -> 105 | H163: =RC[-3]*10 -> 210 | I163: 待补充
A164: 162 | B164: 师徒四人 | C164: =R[-1]C+1 -> 162 | D164: 上帝的生活162 | E164: 21 | F164: =R[-1]C -> 5 | G164: =RC[-2]*5 -> 105 | H164: =RC[-3]*10 -> 210 | I164: 待补充
A165: 163 | B165: 师徒四人 | C165: =R[-1]C+1 -> 163 | D165: 上帝的生活163 | E165: 21 | F165: =R[-1]C -> 5 | G165: =RC[-2]*5 -> 105 | H165: =RC[-3]*10 -> 210 | I165: 待补充
A166: 164 | B166: 师徒四人 | C166: =R[-1]C+1 -> 164 | D166: 上帝的生活164 | E166: 21 | F166: =R[-1]C -> 5 | G166: =RC[-2]*5 -> 105 | H166: =RC[-3]*10 -> 210 | I166: 待补充
A167: 165 | B167: 师徒四人 | C167: =R[-1]C+1 -> 165 | D167: 上帝的生活165 | E167: 21 | F167: =R[-1]C -> 5 | G167: =RC[-2]*5 -> 105 | H167: =RC[-3]*10 -> 210 | I167: 待补充
A168: 166 | B168: 师徒四人 | C168: =R[-1]C+1 -> 166 | D168: 上帝的生活166 | E168: 21 | F168: =R[-1]C -> 5 | G168: =RC[-2]*5 -> 105 | H168: =RC[-3]*10 -> 210 | I168: 待补充
A169: 167 | B169: 师徒四人 | C169: =R[-1]C+1 -> 167 | D169: 上帝的生活167 | E169: 21 | F169: =R[-1]C -> 5 | G169: =RC[-2]*5 -> 105 | H169: =RC[-3]*10 -> 210 | I169: 待补充
A170: 168 | B170: 师徒四人 | C170: =R[-1]C+1 -> 168 | D170: 上帝的生活168 | E170: 21 | F170: =R[-1]C -> 5 | G170: =RC[-2]*5 -> 105 | H170: =RC[-3]*10 -> 210 | I170: 待补充
A171: 169 | B171: 师徒四人 | C171: =R[-1]C+1 -> 169 | D171: 上帝的生活169 | E171: 21 | F171: =R[-1]C -> 5 | G171: =RC[-2]*5 -> 105 | H171: =RC[-3]*10 -> 210 | I171: 待补充
A172: 170 | B172: 师徒四人 | C172: =R[-1]C+1 -> 170 | D172: 上帝的生活170 | E172: 21 | F172: =R[-1]C -> 5 | G172: =RC[-2]*5 -> 105 | H172: =RC[-3]*10 -> 210 | I172: 待补充
A173: 171 | B173: 取经失败 | C173: =R[-1]C+1 -> 171 | D173: 上帝的生活171 | E173: 22 | F173: =R[-1]C -> 5 | G173: =RC[-2]*5 -> 110 | H173: =RC[-3]*10 -> 220 | I173: 待补充
A174: 172 | B174: 取经失败 | C174: =R[-1]C+1 -> 172 | D174: 上帝的生活172 | E174: 22 | F174: =R[-1]C -> 5 | G174: =RC[-2]*5 -> 110 | H174: =RC[-3]*10 -> 220 | I174: 待补充
A175: 173 | B175: 取经失败 | C175: =R[-1]C+1 -> 173 | D175: 上帝的生活173 | E175: 22 | F175: =R[-1]C -> 5 | G175: =RC[-2]*5 -> 110 | H175: =RC[-3]*10 -> 220 | I175: 待补充
A176: 174 | B176: 取经失败 | C176: =R[-1]C+1 -> 174 | D176: 上帝的生活174 | E176: 22 | F176: =R[-1]C -> 5 | G176: =RC[-2]*5 -> 110 | H176: =RC[-3]*10 -> 220 | I176: 待补充
A177: 175 | B177: 取经失败 | C177: =R[-1]C+1 -> 175 | D177: 上帝的生活175 | E177: 22 | F177: =R[-1]C -> 5 | G177: =RC[-2]*5 -> 110 | H177: =RC[-3]*10 -> 220 | I177: 待补充
A178: 176 | B178: 取经失败 | C178: =R[-1]C+1 -> 176 | D178: 上帝的生活176 | E178: 22 | F178: =R[-1]C -> 5 | G178: =RC[-2]*5 -> 110 | H178: =RC[-3]*10 -> 220 | I178: 待补充
A179: 177 | B179: 取经失败 | C179: =R[-1]C+1 -> 177 | D179: 上帝的生活177 | E179: 22 | F179: =R[-1]C -> 5 | G179: =RC[-2]*5 -> 110 | H179: =RC[-3]*10 -> 220 | I179: 待补充
A180: 178 | B180: 取经失败 | C180: =R[-1]C+1 -> 178 | D180: 上帝的生活178 | E180: 22 | F180: =R[-1]C -> 5 | G180: =RC[-2]*5 -> 110 | H180: =RC[-3]*10 -> 220 | I180: 待补充
A181: 179 | B181: 取经失败 | C181: =R[-1]C+1 -> 179 | D181: 上帝的生活179 | E181: 22 | F181: =R[-1]C -> 5 | G181: =RC[-2]*5 -> 110 | H181: =RC[-3]*10 -> 220 | I181: 待补充
A182: 180 | B182: 取经失败 | C182: =R[-1]C+1 -> 180 | D182: 上帝的生活180 | E182: 22 | F182: =R[-1]C -> 5 | G182: =RC[-2]*5 -> 110 | H182: =RC[-3]*10 -> 220 | I182: 待补充
A183: 181 | B183: 这到底是为什么 | C183: =R[-1]C+1 -> 181 | D183: 上帝的生活181 | E183: 23 | F183: =R[-1]C -> 5 | G183: =RC[-2]*5 -> 115 | H183: =RC[-3]*10 -> 230 | I183: 待补充
A184: 182 | B184: 这到底是为什么 | C184: =R[-1]C+1 -> 182 | D184: 上帝的生活182 | E184: 23 | F184: =R[-1]C -> 5 | G184: =RC[-2]*5 -> 115 | H184: =RC[-3]*10 -> 230 | I184: 待补充
A185: 183 | B185: 这到底是为什么 | C185: =R[-1]C+1 -> 183 | D185: 上帝的生活183 | E185: 23 | F185: =R[-1]C -> 5 | G185: =RC[-2]*5 -> 115 | H185: =RC[-3]*10 -> 230 | I185: 待补充
A186: 184 | B186: 这到底是为什么 | C186: =R[-1]C+1 -> 184 | D186: 上帝的生活184 | E186: 23 | F186: =R[-1]C -> 5 | G186: =RC[-2]*5 -> 115 | H186: =RC[-3]*10 -> 230 | I186: 待补充
A187: 185 | B187: 这到底是为什么 | C187: =R[-1]C+1 -> 185 | D187: 上帝的生活185 | E187: 23 | F187: =R[-1]C -> 5 | G187: =RC[-2]*5 -> 115 | H187: =RC[-3]*10 -> 230 | I187: 待补充
A188: 186 | B188: 这到底是为什么 | C188: =R[-1]C+1 -> 186 | D188: 上帝的生活186 | E188: 23 | F188: =R[-1]C -> 5 | G188: =RC[-2]*5 -> 115 | H188: =RC[-3]*10 -> 230 | I188: 待补充
A189: 187 | B189: 这到底是为什么 | C189: =R[-1]C+1 -> 187 | D189: 上帝的生活187 | E189: 23 | F189: =R[-1]C -> 5 | G189: =RC[-2]*5 -> 115 | H189: =RC[-3]*10 -> 230 | I189: 待补充
A190: 188 | B190: 这到底是为什么 | C190: =R[-1]C+1 -> 188 | D190: 上帝的生活188 | E190: 23 | F190: =R[-1]C -> 5 | G190: =RC[-2]*5 -> 115 | H190: =RC[-3]*10 -> 230 | I190: 待补充
A191: 189 | B191: 这到底是为什么 | C191: =R[-1]C+1 -> 189 | D191: 上帝的生活189 | E191: 23 | F191: =R[-1]C -> 5 | G191: =RC[-2]*5 -> 115 | H191: =RC[-3]*10 -> 230 | I191: 待补充
A192: 190 | B192: 这到底是为什么 | C192: =R[-1]C+1 -> 190 | D192: 上帝的生活190 | E192: 23 | F192: =R[-1]C -> 5 | G192: =RC[-2]*5 -> 115 | H192: =RC[-3]*10 -> 230 | I192: 待补充
A193: 191 | B193: 天帝退位 | C193: =R[-1]C+1 -> 191 | D193: 上帝的生活191 | E193: 24 | F193: =R[-1]C -> 5 | G193: =RC[-2]*5 -> 120 | H193: =RC[-3]*10 -> 240 | I193: 待补充
A194: 192 | B194: 天帝退位 | C194: =R[-1]C+1 -> 192 | D194: 上帝的生活192 | E194: 24 | F194: =R[-1]C -> 5 | G194: =RC[-2]*5 -> 120 | H194: =RC[-3]*10 -> 240 | I194: 待补充
A195: 193 | B195: 天帝退位 | C195: =R[-1]C+1 -> 193 | D195: 上帝的生活193 | E195: 24 | F195: =R[-1]C -> 5 | G195: =RC[-2]*5 -> 120 | H195: =RC[-3]*10 -> 240 | I195: 待补充
A196: 194 | B196: 天帝退位 | C196: =R[-1]C+1 -> 194 | D196: 上帝的生活194 | E196: 24 | F196: =R[-1]C -> 5 | G196: =RC[-2]*5 -> 120 | H196: =RC[-3]*10 -> 240 | I196: 待补充
A197: 195 | B197: 天帝退位 | C197: =R[-1]C+1 -> 195 | D197: 上帝的生活195 | E197: 24 | F197: =R[-1]C -> 5 | G197: =RC[-2]*5 -> 120 | H197: =RC[-3]*10 -> 240 | I197: 待补充
A198: 196 | B198: 天帝退位 | C198: =R[-1]C+1 -> 196 | D198: 上帝的生活196 | E198: 24 | F198: =R[-1]C -> 5 | G198: =RC[-2]*5 -> 120 | H198: =RC[-3]*10 -> 240 | I198: 待补充
A199: 197 | B199: 天帝退位 | C199: =R[-1]C+1 -> 197 | D199: 上帝的生活197 | E199: 24 | F199: =R[-1]C -> 5 | G199: =RC[-2]*5 -> 120 | H199: =RC[-3]*10 -> 240 | I199: 待补充
A200: 198 | B200: 天帝退位 | C200: =R[-1]C+1 -> 198 | D200: 上帝的生活198 | E200: 24 | F200: =R[-1]C -> 5 | G200: =RC[-2]*5 -> 120 | H200: =RC[-3]*10 -> 240 | I200: 待补充
A201: 199 | B201: 天帝退位 | C201: =R[-1]C+1 -> 199 | D201: 上帝的生活199 | E201: 24 | F201: =R[-1]C -> 5 | G201: =RC[-2]*5 -> 120 | H201: =RC[-3]*10 -> 240 | I201: 待补充
A202: 200 | B202: 天帝退位 | C202: =R[-1]C+1 -> 200 | D202: 上帝的生活200 | E202: 24 | F202: =R[-1]C -> 5 | G202: =RC[-2]*5 -> 120 | H202: =RC[-3]*10 -> 240 | I202: 待补充
A203: 201 | B203: 意外事件 | C203: =R[-1]C+1 -> 201 | D203: 上帝的生活201 | E203: 25 | F203: =R[-1]C -> 5 | G203: =RC[-2]*5 -> 125 | H203: =RC[-3]*10 -> 250 | I203: 待补充
A204: 202 | B204: 意外事件 | C204: =R[-1]C+1 -> 202 | D204: 上帝的生活202 | E204: 25 | F204: =R[-1]C -> 5 | G204: =RC[-2]*5 -> 125 | H204: =RC[-3]*10 -> 250 | I204: 待补充
A205: 203 | B205: 意外事件 | C205: =R[-1]C+1 -> 203 | D205: 上帝的生活203 | E205: 25 | F205: =R[-1]C -> 5 | G205: =RC[-2]*5 -> 125 | H205: =RC[-3]*10 -> 250 | I205: 待补充
A206: 204 | B206: 意外事件 | C206: =R[-1]C+1 -> 204 | D206: 上帝的生活204 | E206: 25 | F206: =R[-1]C -> 5 | G206: =RC[-2]*5 -> 125 | H206: =RC[-3]*10 -> 250 | I206: 待补充
A207: 205 | B207: 意外事件 | C207: =R[-1]C+1 -> 205 | D207: 上帝的生活205 | E207: 25 | F207: =R[-1]C -> 5 | G207: =RC[-2]*5 -> 125 | H207: =RC[-3]*10 -> 250 | I207: 待补充
A208: 206 | B208: 意外事件 | C208: =R[-1]C+1 -> 206 | D208: 上帝的生活206 | E208: 25 | F208: =R[-1]C -> 5 | G208: =RC[-2]*5 -> 125 | H208: =RC[-3]*10 -> 250 | I208: 待补充
A209: 207 | B209: 意外事件 | C209: =R[-1]C+1 -> 207 | D209: 上帝的生活207 | E209: 25 | F209: =R[-1]C -> 5 | G209: =RC[-2]*5 -> 125 | H209: =RC[-3]*10 -> 250 | I209: 待补充
A210: 208 | B210: 意外事件 | C210: =R[-1]C+1 -> 208 | D210: 上帝的生活208 | E210: 25 | F210: =R[-1]C -> 5 | G210: =RC[-2]*5 -> 125 | H210: =RC[-3]*10 -> 250 | I210: 待补充
A211: 209 | B211: 意外事件 | C211: =R[-1]C+1 -> 209 | D211: 上帝的生活209 | E211: 25 | F211: =R[-1]C -> 5 | G211: =RC[-2]*5 -> 125 | H211: =RC[-3]*10 -> 250 | I211: 待补充
A212: 210 | B212: 意外事件 | C212: =R[-1]C+1 -> 210 | D212: 上帝的生活210 | E212: 25 | F212: =R[-1]C -> 5 | G212: =RC[-2]*5 -> 125 | H212: =RC[-3]*10 -> 250 | I212: 待补充
A213: 211 | B213: 哪吒闹海 | C213: =R[-1]C+1 -> 211 | D213: 上帝的生活211 | E213: 26 | F213: =R[-1]C -> 5 | G213: =RC[-2]*5 -> 130 | H213: =RC[-3]*10 -> 260 | I213: 待补充
A214: 212 | B214: 哪吒闹海 | C214: =R[-1]C+1 -> 212 | D214: 上帝的生活212 | E214: 26 | F214: =R[-1]C -> 5 | G214: =RC[-2]*5 -> 130 | H214: =RC[-3]*10 -> 260 | I214: 待补充
A215: 213 | B215: 哪吒闹海 | C215: =R[-1]C+1 -> 213 | D215: 上帝的生活213 | E215: 26 | F215: =R[-1]C -> 5 | G215: =RC[-2]*5 -> 130 | H215: =RC[-3]*10 -> 260 | I215: 待补充
A216: 214 | B216: 哪吒闹海 | C216: =R[-1]C+1 -> 214 | D216: 上帝的生活214 | E216: 26 | F216: =R[-1]C -> 5 | G216: =RC[-2]*5 -> 130 | H216: =RC[-3]*10 -> 260 | I216: 待补充
A217: 215 | B217: 哪吒闹海 | C217: =R[-1]C+1 -> 215 | D217: 上帝的生活215 | E217: 26 | F217: =R[-1]C -> 5 | G217: =RC[-2]*5 -> 130 | H217: =RC[-3]*10 -> 260 | I217: 待补充
A218: 216 | B218: 哪吒闹海 | C218: =R[-1]C+1 -> 216 | D218: 上帝的生活216 | E218: 26 | F218: =R[-1]C -> 5 | G218: =RC[-2]*5 -> 130 | H218: =RC[-3]*10 -> 260 | I218: 待补充
A219: 217 | B219: 哪吒闹海 | C219: =R[-1]C+1 -> 217 | D219: 上帝的生活217 | E219: 26 | F219: =R[-1]C -> 5 | G219: =RC[-2]*5 -> 130 | H219: =RC[-3]*10 -> 260 | I219: 待补充
A220: 218 | B220: 哪吒闹海 | C220: =R[-1]C+1 -> 218 | D220: 上帝的生活218 | E220: 26 | F220: =R[-1]C -> 5 | G220: =RC[-2]*5 -> 130 | H220: =RC[-3]*10 -> 260 | I220: 待补充
A221: 219 | B221: 哪吒闹海 | C221: =R[-1]C+1 -> 219 | D221: 上帝的生活219 | E221: 26 | F221: =R[-1]C -> 5 | G221: =RC[-2]*5 -> 130 | H221: =RC[-3]*10 -> 260 | I221: 待补充
A222: 220 | B222: 哪吒闹海 | C222: =R[-1]C+1 -> 220 | D222: 上帝的生活220 | E222: 26 | F222: =R[-1]C -> 5 | G222: =RC[-2]*5 -> 130 | H222: =RC[-3]*10 -> 260 | I222: 待补充
A223: 221 | B223: 精卫的烦恼 | C223: =R[-1]C+1 -> 221 | D223: 上帝的生活221 | E223: 27 | F223: =R[-1]C -> 5 | G223: =RC[-2]*5 -> 135 | H223: =RC[-3]*10 -> 270 | I223: 待补充
A224: 222 | B224: 精卫的烦恼 | C224: =R[-1]C+1 -> 222 | D224: 上帝的生活222 | E224: 27 | F224: =R[-1]C -> 5 | G224: =RC[-2]*5 -> 135 | H224: =RC[-3]*10 -> 270 | I224: 待补充
A225: 223 | B225: 精卫的烦恼 | C225: =R[-1]C+1 -> 223 | D225: 上帝的生活223 | E225: 27 | F225: =R[-1]C -> 5 | G225: =RC[-2]*5 -> 135 | H225: =RC[-3]*10 -> 270 | I225: 待补充
A226: 224 | B226: 精卫的烦恼 | C226: =R[-1]C+1 -> 224 | D226: 上帝的生活224 | E226: 27 | F226: =R[-1]C -> 5 | G226: =RC[-2]*5 -> 135 | H226: =RC[-3]*10 -> 270 | I226: 待补充
A227: 225 | B227: 精卫的烦恼 | C227: =R[-1]C+1 -> 225 | D227: 上帝的生活225 | E227: 27 | F227: =R[-1]C -> 5 | G227: =RC[-2]*5 -> 135 | H227: =RC[-3]*10 -> 270 | I227: 待补充
A228: 226 | B228: 精卫的烦恼 | C228: =R[-1]C+1 -> 226 | D228: 上帝的生活226 | E228: 27 | F228: =R[-1]C -> 5 | G228: =RC[-2]*5 -> 135 | H228: =RC[-3]*10 -> 270 | I228: 待补充
A229: 227 | B229: 精卫的烦恼 | C229: =R[-1]C+1 -> 227 | D229: 上帝的生活227 | E229: 27 | F229: =R[-1]C -> 5 | G229: =RC[-2]*5 -> 135 | H229: =RC[-3]*10 -> 270 | I229: 待补充
A230: 228 | B230: 精卫的烦恼 | C230: =R[-1]C+1 -> 228 | D230: 上帝的生活228 | E230: 27 | F230: =R[-1]C -> 5 | G230: =RC[-2]*5 -> 135 | H230: =RC[-3]*10 -> 270 | I230: 待补充
A231: 229 | B231: 精卫的烦恼 | C231: =R[-1]C+1 -> 229 | D231: 上帝的生活229 | E231: 27 | F231: =R[-1]C -> 5 | G231: =RC[-2]*5 -> 135 | H231: =RC[-3]*10 -> 270 | I231: 待补充
A232: 230 | B232: 精卫的烦恼 | C232: =R[-1]C+1 -> 230 | D232: 上帝的生活230 | E232: 27 | F232: =R[-1]C -> 5 | G232: =RC[-2]*5 -> 135 | H232: =RC[-3]*10 -> 270 | I232: 待补充
A233: 231 | B233: 盘古病了 | C233: =R[-1]C+1 -> 231 | D233: 上帝的生活231 | E233: 28 | F233: =R[-1]C -> 5 | G233: =RC[-2]*5 -> 140 | H233: =RC[-3]*10 -> 280 | I233: 待补充
A234: 232 | B234: 盘古病了 | C234: =R[-1]C+1 -> 232 | D234: 上帝的生活232 | E234: 28 | F234: =R[-1]C -> 5 | G234: =RC[-2]*5 -> 140 | H234: =RC[-3]*10 -> 280 | I234: 待补充
A235: 233 | B235: 盘古病了 | C235: =R[-1]C+1 -> 233 | D235: 上帝的生活233 | E235: 28 | F235: =R[-1]C -> 5 | G235: =RC[-2]*5 -> 140 | H235: =RC[-3]*10 -> 280 | I235: 待补充
A236: 234 | B236: 盘古病了 | C236: =R[-1]C+1 -> 234 | D236: 上帝的生活234 | E236: 28 | F236: =R[-1]C -> 5 | G236: =RC[-2]*5 -> 140 | H236: =RC[-3]*10 -> 280 | I236: 待补充
A237: 235 | B237: 盘古病了 | C237: =R[-1]C+1 -> 235 | D237: 上帝的生活235 | E237: 28 | F237: =R[-1]C -> 5 | G237: =RC[-2]*5 -> 140 | H237: =RC[-3]*10 -> 280 | I237: 待补充
A238: 236 | B238: 盘古病了 | C238: =R[-1]C+1 -> 236 | D238: 上帝的生活236 | E238: 28 | F238: =R[-1]C -> 5 | G238: =RC[-2]*5 -> 140 | H238: =RC[-3]*10 -> 280 | I238: 待补充
A239: 237 | B239: 盘古病了 | C239: =R[-1]C+1 -> 237 | D239: 上帝的生活237 | E239: 28 | F239: =R[-1]C -> 5 | G239: =RC[-2]*5 -> 140 | H239: =RC[-3]*10 -> 280 | I239: 待补充
A240: 238 | B240: 盘古病了 | C240: =R[-1]C+1 -> 238 | D240: 上帝的生活238 | E240: 28 | F240: =R[-1]C -> 5 | G240: =RC[-2]*5 -> 140 | H240: =RC[-3]*10 -> 280 | I240: 待补充
A241: 239 | B241: 盘古病了 | C241: =R[-1]C+1 -> 239 | D241: 上帝的生活239 | E241: 28 | F241: =R[-1]C -> 5 | G241: =RC[-2]*5 -> 140 | H241: =RC[-3]*10 -> 280 | I241: 待补充
A242: 240 | B242: 盘古病了 | C242: =R[-1]C+1 -> 240 | D242: 上帝的生活240 | E242: 28 | F242: =R[-1]C -> 5 | G242: =RC[-2]*5 -> 140 | H242: =RC[-3]*10 -> 280 | I242: 待补充
A243: 241 | B243: 巨灵神现身 | C243: =R[-1]C+1 -> 241 | D243: 上帝的生活241 | E243: 29 | F243: =R[-1]C -> 5 | G243: =RC[-2]*5 -> 145 | H243: =RC[-3]*10 -> 290 | I243: 待补充
A244: 242 | B244: 巨灵神现身 | C244: =R[-1]C+1 -> 242 | D244: 上帝的生活242 | E244: 29 | F244: =R[-1]C -> 5 | G244: =RC[-2]*5 -> 145 | H244: =RC[-3]*10 -> 290 | I244: 待补充
A245: 243 | B245: 巨灵神现身 | C245: =R[-1]C+1 -> 243 | D245: 上帝的生活243 | E245: 29 | F245: =R[-1]C -> 5 | G245: =RC[-2]*5 -> 145 | H245: =RC[-3]*10 -> 290 | I245: 待补充
A246: 244 | B246: 巨灵神现身 | C246: =R[-1]C+1 -> 244 | D246: 上帝的生活244 | E246: 29 | F246: =R[-1]C -> 5 | G246: =RC[-2]*5 -> 145 | H246: =RC[-3]*10 -> 290 | I246: 待补充
A247: 245 | B247: 巨灵神现身 | C247: =R[-1]C+1 -> 245 | D247: 上帝的生活245 | E247: 29 | F247: =R[-1]C -> 5 | G247: =RC[-2]*5 -> 145 | H247: =RC[-3]*10 -> 290 | I247: 待补充
A248: 246 | B248: 巨灵神现身 | C248: =R[-1]C+1 -> 246 | D248: 上帝的生活246 | E248: 29 | F248: =R[-1]C -> 5 | G248: =RC[-2]*5 -> 145 | H248: =RC[-3]*10 -> 290 | I248: 待补充
A249: 247 | B249: 巨灵神现身 | C249: =R[-1]C+1 -> 247 | D249: 上帝的生活247 | E249: 29 | F249: =R[-1]C -> 5 | G249: =RC[-2]*5 -> 145 | H249: =RC[-3]*10 -> 290 | I249: 待补充
A250: 248 | B250: 巨灵神现身 | C250: =R[-1]C+1 -> 248 | D250: 上帝的生活248 | E250: 29 | F250: =R[-1]C -> 5 | G250: =RC[-2]*5 -> 145 | H250: =RC[-3]*10 -> 290 | I250: 待补充
A251: 249 | B251: 巨灵神现身 | C251: =R[-1]C+1 -> 249 | D251: 上帝的生活249 | E251: 29 | F251: =R[-1]C -> 5 | G251: =RC[-2]*5 -> 145 | H251: =RC[-3]*10 -> 290 | I251: 待补充
A252: 250 | B252: 巨灵神现身 | C252: =R[-1]C+1 -> 250 | D252: 上帝的生活250 | E252: 29 | F252: =R[-1]C -> 5 | G252: =RC[-2]*5 -> 145 | H252: =RC[-3]*10 -> 290 | I252: 待补充
A253: 251 | B253: 绝望的修行 | C253: =R[-1]C+1 -> 251 | D253: 上帝的生活251 | E253: 30 | F253: =R[-1]C -> 5 | G253: =RC[-2]*5 -> 150 | H253: =RC[-3]*10 -> 300 | I253: 待补充
A254: 252 | B254: 绝望的修行 | C254: =R[-1]C+1 -> 252 | D254: 上帝的生活252 | E254: 30 | F254: =R[-1]C -> 5 | G254: =RC[-2]*5 -> 150 | H254: =RC[-3]*10 -> 300 | I254: 待补充
A255: 253 | B255: 绝望的修行 | C255: =R[-1]C+1 -> 253 | D255: 上帝的生活253 | E255: 30 | F255: =R[-1]C -> 5 | G255: =RC[-2]*5 -> 150 | H255: =RC[-3]*10 -> 300 | I255: 待补充
A256: 254 | B256: 绝望的修行 | C256: =R[-1]C+1 -> 254 | D256: 上帝的生活254 | E256: 30 | F256: =R[-1]C -> 5 | G256: =RC[-2]*5 -> 150 | H256: =RC[-3]*10 -> 300 | I256: 待补充
A257: 255 | B257: 绝望的修行 | C257: =R[-1]C+1 -> 255 | D257: 上帝的生活255 | E257: 30 | F257: =R[-1]C -> 5 | G257: =RC[-2]*5 -> 150 | H257: =RC[-3]*10 -> 300 | I257: 待补充
A258: 256 | B258: 绝望的修行 | C258: =R[-1]C+1 -> 256 | D258: 上帝的生活256 | E258: 30 | F258: =R[-1]C -> 5 | G258: =RC[-2]*5 -> 150 | H258: =RC[-3]*10 -> 300 | I258: 待补充
A259: 257 | B259: 绝望的修行 | C259: =R[-1]C+1 -> 257 | D259: 上帝的生活257 | E259: 30 | F259: =R[-1]C -> 5 | G259: =RC[-2]*5 -> 150 | H259: =RC[-3]*10 -> 300 | I259: 待补充
A260: 258 | B260: 绝望的修行 | C260: =R[-1]C+1 -> 258 | D260: 上帝的生活258 | E260: 30 | F260: =R[-1]C -> 5 | G260: =RC[-2]*5 -> 150 | H260: =RC[-3]*10 -> 300 | I260: 待补充
A261: 259 | B261: 绝望的修行 | C261: =R[-1]C+1 -> 259 | D261: 上帝的生活259 | E261: 30 | F261: =R[-1]C -> 5 | G261: =RC[-2]*5 -> 150 | H261: =RC[-3]*10 -> 300 | I261: 待补充
A262: 260 | B262: 绝望的修行 | C262: =R[-1]C+1 -> 260 | D262: 上帝的生活260 | E262: 30 | F262: =R[-1]C -> 5 | G262: =RC[-2]*5 -> 150 | H262: =RC[-3]*10 -> 300 | I262: 待补充
A263: 261 | B263: 五指山下 | C263: =R[-1]C+1 -> 261 | D263: 上帝的生活261 | E263: 31 | F263: =R[-1]C -> 5 | G263: =RC[-2]*5 -> 155 | H263: =RC[-3]*10 -> 310 | I263: 待补充
A264: 262 | B264: 五指山下 | C264: =R[-1]C+1 -> 262 | D264: 上帝的生活262 | E264: 31 | F264: =R[-1]C -> 5 | G264: =RC[-2]*5 -> 155 | H264: =RC[-3]*10 -> 310 | I264: 待补充
A265: 263 | B265: 五指山下 | C265: =R[-1]C+1 -> 263 | D265: 上帝的生活263 | E265: 31 | F265: =R[-1]C -> 5 | G265: =RC[-2]*5 -> 155 | H265: =RC[-3]*10 -> 310 | I265: 待补充
A266: 264 | B266: 五指山下 | C266: =R[-1]C+1 -> 264 | D266: 上帝的生活264 | E266: 31 | F266: =R[-1]C -> 5 | G266: =RC[-2]*5 -> 155 | H266: =RC[-3]*10 -> 310 | I266: 待补充
A267: 265 | B267: 五指山下 | C267: =R[-1]C+1 -> 265 | D267: 上帝的生活265 | E267: 31 | F267: =R[-1]C -> 5 | G267: =RC[-2]*5 -> 155 | H267: =RC[-3]*10 -> 310 | I267: 待补充
A268: 266 | B268: 五指山下 | C268: =R[-1]C+1 -> 266 | D268: 上帝的生活266 | E268: 31 | F268: =R[-1]C -> 5 | G268: =RC[-2]*5 -> 155 | H268: =RC[-3]*10 -> 310 | I268: 待补充
A269: 267 | B269: 五指山下 | C269: =R[-1]C+1 -> 267 | D269: 上帝的生活267 | E269: 31 | F269: =R[-1]C -> 5 | G269: =RC[-2]*5 -> 155 | H269: =RC[-3]*10 -> 310 | I269: 待补充
A270: 268 | B270: 五指山下 | C270: =R[-1]C+1 -> 268 | D270: 上帝的生活268 | E270: 31 | F270: =R[-1]C -> 5 | G270: =RC[-2]*5 -> 155 | H270: =RC[-3]*10 -> 310 | I270: 待补充
A271: 269 | B271: 五指山下 | C271: =R[-1]C+1 -> 269 | D271: 上帝的生活269 | E271: 31 | F271: =R[-1]C -> 5 | G271: =RC[-2]*5 -> 155 | H271: =RC[-3]*10 -> 310 | I271: 待补充
A272: 270 | B272: 五指山下 | C272: =R[-1]C+1 -> 270 | D272: 上帝的生活270 | E272: 31 | F272: =R[-1]C -> 5 | G272: =RC[-2]*5 -> 155 | H272: =RC[-3]*10 -> 310 | I272: 待补充
A273: 271 | B273: 悟空的心病 | C273: =R[-1]C+1 -> 271 | D273: 上帝的生活271 | E273: 32 | F273: =R[-1]C -> 5 | G273: =RC[-2]*5 -> 160 | H273: =RC[-3]*10 -> 320 | I273: 待补充
A274: 272 | B274: 悟空的心病 | C274: =R[-1]C+1 -> 272 | D274: 上帝的生活272 | E274: 32 | F274: =R[-1]C -> 5 | G274: =RC[-2]*5 -> 160 | H274: =RC[-3]*10 -> 320 | I274: 待补充
A275: 273 | B275: 悟空的心病 | C275: =R[-1]C+1 -> 273 | D275: 上帝的生活273 | E275: 32 | F275: =R[-1]C -> 5 | G275: =RC[-2]*5 -> 160 | H275: =RC[-3]*10 -> 320 | I275: 待补充
A276: 274 | B276: 悟空的心病 | C276: =R[-1]C+1 -> 274 | D276: 上帝的生活274 | E276: 32 | F276: =R[-1]C -> 5 | G276: =RC[-2]*5 -> 160 | H276: =RC[-3]*10 -> 320 | I276: 待补充
A277: 275 | B277: 悟空的心病 | C277: =R[-1]C+1 -> 275 | D277: 上帝的生活275 | E277: 32 | F277: =R[-1]C -> 5 | G277: =RC[-2]*5 -> 160 | H277: =RC[-3]*10 -> 320 | I277: 待补充
A278: 276 | B278: 悟空的心病 | C278: =R[-1]C+1 -> 276 | D278: 上帝的生活276 | E278: 32 | F278: =R[-1]C -> 5 | G278: =RC[-2]*5 -> 160 | H278: =RC[-3]*10 -> 320 | I278: 待补充
A279: 277 | B279: 悟空的心病 | C279: =R[-1]C+1 -> 277 | D279: 上帝的生活277 | E279: 32 | F279: =R[-1]C -> 5 | G279: =RC[-2]*5 -> 160 | H279: =RC[-3]*10 -> 320 | I279: 待补充
A280: 278 | B280: 悟空的心病 | C280: =R[-1]C+1 -> 278 | D280: 上帝的生活278 | E280: 32 | F280: =R[-1]C -> 5 | G280: =RC[-2]*5 -> 160 | H280: =RC[-3]*10 -> 320 | I280: 待补充
A281: 279 | B281: 悟空的心病 | C281: =R[-1]C+1 -> 279 | D281: 上帝的生活279 | E281: 32 | F281: =R[-1]C -> 5 | G281: =RC[-2]*5 -> 160 | H281: =RC[-3]*10 -> 320 | I281: 待补充
A282: 280 | B282: 悟空的心病 | C282: =R[-1]C+1 -> 280 | D282: 上帝的生活280 | E282: 32 | F282: =R[-1]C -> 5 | G282: =RC[-2]*5 -> 160 | H282: =RC[-3]*10 -> 320 | I282: 待补充
A283: 281 | B283: 土行孙火了 | C283: =R[-1]C+1 -> 281 | D283: 上帝的生活281 | E283: 33 | F283: =R[-1]C -> 5 | G283: =RC[-2]*5 -> 165 | H283: =RC[-3]*10 -> 330 | I283: 待补充
A284: 282 | B284: 土行孙火了 | C284: =R[-1]C+1 -> 282 | D284: 上帝的生活282 | E284: 33 | F284: =R[-1]C -> 5 | G284: =RC[-2]*5 -> 165 | H284: =RC[-3]*10 -> 330 | I284: 待补充
A285: 283 | B285: 土行孙火了 | C285: =R[-1]C+1 -> 283 | D285: 上帝的生活283 | E285: 33 | F285: =R[-1]C -> 5 | G285: =RC[-2]*5 -> 165 | H285: =RC[-3]*10 -> 330 | I285: 待补充
A286: 284 | B286: 土行孙火了 | C286: =R[-1]C+1 -> 284 | D286: 上帝的生活284 | E286: 33 | F286: =R[-1]C -> 5 | G286: =RC[-2]*5 -> 165 | H286: =RC[-3]*10 -> 330 | I286: 待补充
A287: 285 | B287: 土行孙火了 | C287: =R[-1]C+1 -> 285 | D287: 上帝的生活285 | E287: 33 | F287: =R[-1]C -> 5 | G287: =RC[-2]*5 -> 165 | H287: =RC[-3]*10 -> 330 | I287: 待补充
A288: 286 | B288: 土行孙火了 | C288: =R[-1]C+1 -> 286 | D288: 上帝的生活286 | E288: 33 | F288: =R[-1]C -> 5 | G288: =RC[-2]*5 -> 165 | H288: =RC[-3]*10 -> 330 | I288: 待补充
A289: 287 | B289: 土行孙火了 | C289: =R[-1]C+1 -> 287 | D289: 上帝的生活287 | E289: 33 | F289: =R[-1]C -> 5 | G289: =RC[-2]*5 -> 165 | H289: =RC[-3]*10 -> 330 | I289: 待补充
A290: 288 | B290: 土行孙火了 | C290: =R[-1]C+1 -> 288 | D290: 上帝的生活288 | E290: 33 | F290: =R[-1]C -> 5 | G290: =RC[-2]*5 -> 165 | H290: =RC[-3]*10 -> 330 | I290: 待补充
A291: 289 | B291: 土行孙火了 | C291: =R[-1]C+1 -> 289 | D291: 上帝的生活289 | E291: 33 | F291: =R[-1]C -> 5 | G291: =RC[-2]*5 -> 165 | H291: =RC[-3]*10 -> 330 | I291: 待补充
A292: 290 | B292: 土行孙火了 | C292: =R[-1]C+1 -> 290 | D292: 上帝的生活290 | E292: 33 | F292: =R[-1]C -> 5 | G292: =RC[-2]*5 -> 165 | H292: =RC[-3]*10 -> 330 | I292: 待补充
A293: 291 | B293: 妲己的美 | C293: =R[-1]C+1 -> 291 | D293: 上帝的生活291 | E293: 34 | F293: =R[-1]C -> 5 | G293: =RC[-2]*5 -> 170 | H293: =RC[-3]*10 -> 340 | I293: 待补充
A294: 292 | B294: 妲己的美 | C294: =R[-1]C+1 -> 292 | D294: 上帝的生活292 | E294: 34 | F294: =R[-1]C -> 5 | G294: =RC[-2]*5 -> 170 | H294: =RC[-3]*10 -> 340 | I294: 待补充
A295: 293 | B295: 妲己的美 | C295: =R[-1]C+1 -> 293 | D295: 上帝的生活293 | E295: 34 | F295: =R[-1]C -> 5 | G295: =RC[-2]*5 -> 170 | H295: =RC[-3]*10 -> 340 | I295: 待补充
A296: 294 | B296: 妲己的美 | C296: =R[-1]C+1 -> 294 | D296: 上帝的生活294 | E296: 34 | F296: =R[-1]C -> 5 | G296: =RC[-2]*5 -> 170 | H296: =RC[-3]*10 -> 340 | I296: 待补充
A297: 295 | B297: 妲己的美 | C297: =R[-1]C+1 -> 295 | D297: 上帝的生活295 | E297: 34 | F297: =R[-1]C -> 5 | G297: =RC[-2]*5 -> 170 | H297: =RC[-3]*10 -> 340 | I297: 待补充
A298: 296 | B298: 妲己的美 | C298: =R[-1]C+1 -> 296 | D298: 上帝的生活296 | E298: 34 | F298: =R[-1]C -> 5 | G298: =RC[-2]*5 -> 170 | H298: =RC[-3]*10 -> 340 | I298: 待补充
A299: 297 | B299: 妲己的美 | C299: =R[-1]C+1 -> 297 | D299: 上帝的生活297 | E299: 34 | F299: =R[-1]C -> 5 | G299: =RC[-2]*5 -> 170 | H299: =RC[-3]*10 -> 340 | I299: 待补充
A300: 298 | B300: 妲己的美 | C300: =R[-1]C+1 -> 298 | D300: 上帝的生活298 | E300: 34 | F300: =R[-1]C -> 5 | G300: =RC[-2]*5 -> 170 | H300: =RC[-3]*10 -> 340 | I300: 待补充
A301: 299 | B301: 妲己的美 | C301: =R[-1]C+1 -> 299 | D301: 上帝的生活299 | E301: 34 | F301: =R[-1]C -> 5 | G301: =RC[-2]*5 -> 170 | H301: =RC[-3]*10 -> 340 | I301: 待补充
A302: 300 | B302: 妲己的美 | C302: =R[-1]C+1 -> 300 | D302: 上帝的生活300 | E302: 34 | F302: =R[-1]C -> 5 | G302: =RC[-2]*5 -> 170 | H302: =RC[-3]*10 -> 340 | I302: 待补充
A303: 301 | B303: 天下大乱 | C303: =R[-1]C+1 -> 301 | D303: 上帝的生活301 | E303: 35 | F303: =R[-1]C -> 5 | G303: =RC[-2]*5 -> 175 | H303: =RC[-3]*10 -> 350 | I303: 待补充
A304: 302 | B304: 天下大乱 | C304: =R[-1]C+1 -> 302 | D304: 上帝的生活302 | E304: 35 | F304: =R[-1]C -> 5 | G304: =RC[-2]*5 -> 175 | H304: =RC[-3]*10 -> 350 | I304: 待补充
A305: 303 | B305: 天下大乱 | C305: =R[-1]C+1 -> 303 | D305: 上帝的生活303 | E305: 35 | F305: =R[-1]C -> 5 | G305: =RC[-2]*5 -> 175 | H305: =RC[-3]*10 -> 350 | I305: 待补充
A306: 304 | B306: 天下大乱 | C306: =R[-1]C+1 -> 304 | D306: 上帝的生活304 | E306: 35 | F306: =R[-1]C -> 5 | G306: =RC[-2]*5 -> 175 | H306: =RC[-3]*10 -> 350 | I306: 待补充
A307: 305 | B307: 天下大乱 | C307: =R[-1]C+1 -> 305 | D307: 上帝的生活305 | E307: 35 | F307: =R[-1]C -> 5 | G307: =RC[-2]*5 -> 175 | H307: =RC[-3]*10 -> 350 | I307: 待补充
A308: 306 | B308: 天下大乱 | C308: =R[-1]C+1 -> 306 | D308: 上帝的生活306 | E308: 35 | F308: =R[-1]C -> 5 | G308: =RC[-2]*5 -> 175 | H308: =RC[-3]*10 -> 350 | I308: 待补充
A309: 307 | B309: 天下大乱 | C309: =R[-1]C+1 -> 307 | D309: 上帝的生活307 | E309: 35 | F309: =R[-1]C -> 5 | G309: =RC[-2]*5 -> 175 | H309: =RC[-3]*10 -> 350 | I309: 待补充
A310: 308 | B310: 天下大乱 | C310: =R[-1]C+1 -> 308 | D310: 上帝的生活308 | E310: 35 | F310: =R[-1]C -> 5 | G310: =RC[-2]*5 -> 175 | H310: =RC[-3]*10 -> 350 | I310: 待补充
A311: 309 | B311: 天下大乱 | C311: =R[-1]C+1 -> 309 | D311: 上帝的生活309 | E311: 35 | F311: =R[-1]C -> 5 | G311: =RC[-2]*5 -> 175 | H311: =RC[-3]*10 -> 350 | I311: 待补充
A312: 310 | B312: 天下大乱 | C312: =R[-1]C+1 -> 310 | D312: 上帝的生活310 | E312: 35 | F312: =R[-1]C -> 5 | G312: =RC[-2]*5 -> 175 | H312: =RC[-3]*10 -> 350 | I312: 待补充
A313: 311 | B313: 妖魔盛行 | C313: =R[-1]C+1 -> 311 | D313: 上帝的生活311 | E313: 36 | F313: =R[-1]C -> 5 | G313: =RC[-2]*5 -> 180 | H313: =RC[-3]*10 -> 360 | I313: 待补充
A314: 312 | B314: 妖魔盛行 | C314: =R[-1]C+1 -> 312 | D314: 上帝的生活312 | E314: 36 | F314: =R[-1]C -> 5 | G314: =RC[-2]*5 -> 180 | H314: =RC[-3]*10 -> 360 | I314: 待补充
A315: 313 | B315: 妖魔盛行 | C315: =R[-1]C+1 -> 313 | D315: 上帝的生活313 | E315: 36 | F315: =R[-1]C -> 5 | G315: =RC[-2]*5 -> 180 | H315: =RC[-3]*10 -> 360 | I315: 待补充
A316: 314 | B316: 妖魔盛行 | C316: =R[-1]C+1 -> 314 | D316: 上帝的生活314 | E316: 36 | F316: =R[-1]C -> 5 | G316: =RC[-2]*5 -> 180 | H316: =RC[-3]*10 -> 360 | I316: 待补充
A317: 315 | B317: 妖魔盛行 | C317: =R[-1]C+1 -> 315 | D317: 上帝的生活315 | E317: 36 | F317: =R[-1]C -> 5 | G317: =RC[-2]*5 -> 180 | H317: =RC[-3]*10 -> 360 | I317: 待补充
A318: 316 | B318: 妖魔盛行 | C318: =R[-1]C+1 -> 316 | D318: 上帝的生活316 | E318: 36 | F318: =R[-1]C -> 5 | G318: =RC[-2]*5 -> 180 | H318: =RC[-3]*10 -> 360 | I318: 待补充
A319: 317 | B319: 妖魔盛行 | C319: =R[-1]C+1 -> 317 | D319: 上帝的生活317 | E319: 36 | F319: =R[-1]C -> 5 | G319: =RC[-2]*5 -> 180 | H319: =RC[-3]*10 -> 360 | I319: 待补充
A320: 318 | B320: 妖魔盛行 | C320: =R[-1]C+1 -> 318 | D320: 上帝的生活318 | E320: 36 | F320: =R[-1]C -> 5 | G320: =RC[-2]*5 -> 180 | H320: =RC[-3]*10 -> 360 | I320: 待补充
A321: 319 | B321: 妖魔盛行 | C321: =R[-1]C+1 -> 319 | D321: 上帝的生活319 | E321: 36 | F321: =R[-1]C -> 5 | G321: =RC[-2]*5 -> 180 | H321: =RC[-3]*10 -> 360 | I321: 待补充
A322: 320 | B322: 妖魔盛行 | C322: =R[-1]C+1 -> 320 | D322: 上帝的生活320 | E322: 36 | F322: =R[-1]C -> 5 | G322: =RC[-2]*5 -> 180 | H322: =RC[-3]*10 -> 360 | I322: 待补充
A323: 321 | B323: 打入凡间 | C323: =R[-1]C+1 -> 321 | D323: 上帝的生活321 | E323: 37 | F323: =R[-1]C -> 5 | G323: =RC[-2]*5 -> 185 | H323: =RC[-3]*10 -> 370 | I323: 待补充
A324: 322 | B324: 打入凡间 | C324: =R[-1]C+1 -> 322 | D324: 上帝的生活322 | E324: 37 | F324: =R[-1]C -> 5 | G324: =RC[-2]*5 -> 185 | H324: =RC[-3]*10 -> 370 | I324: 待补充
A325: 323 | B325: 打入凡间 | C325: =R[-1]C+1 -> 323 | D325: 上帝的生活323 | E325: 37 | F325: =R[-1]C -> 5 | G325: =RC[-2]*5 -> 185 | H325: =RC[-3]*10 -> 370 | I325: 待补充
A326: 324 | B326: 打入凡间 | C326: =R[-1]C+1 -> 324 | D326: 上帝的生活324 | E326: 37 | F326: =R[-1]C -> 5 | G326: =RC[-2]*5 -> 185 | H326: =RC[-3]*10 -> 370 | I326: 待补充
A327: 325 | B327: 打入凡间 | C327: =R[-1]C+1 -> 325 | D327: 上帝的生活325 | E327: 37 | F327: =R[-1]C -> 5 | G327: =RC[-2]*5 -> 185 | H327: =RC[-3]*10 -> 370 | I327: 待补充
A328: 326 | B328: 打入凡间 | C328: =R[-1]C+1 -> 326 | D328: 上帝的生活326 | E328: 37 | F328: =R[-1]C -> 5 | G328: =RC[-2]*5 -> 185 | H328: =RC[-3]*10 -> 370 | I328: 待补充
A329: 327 | B329: 打入凡间 | C329: =R[-1]C+1 -> 327 | D329: 上帝的生活327 | E329: 37 | F329: =R[-1]C -> 5 | G329: =RC[-2]*5 -> 185 | H329: =RC[-3]*10 -> 370 | I329: 待补充
A330: 328 | B330: 打入凡间 | C330: =R[-1]C+1 -> 328 | D330: 上帝的生活328 | E330: 37 | F330: =R[-1]C -> 5 | G330: =RC[-2]*5 -> 185 | H330: =RC[-3]*10 -> 370 | I330: 待补充
A331: 329 | B331: 打入凡间 | C331: =R[-1]C+1 -> 329 | D331: 上帝的生活329 | E331: 37 | F331: =R[-1]C -> 5 | G331: =RC[-2]*5 -> 185 | H331: =RC[-3]*10 -> 370 | I331: 待补充
A332: 330 | B332: 打入凡间 | C332: =R[-1]C+1 -> 330 | D332: 上帝的生活330 | E332: 37 | F332: =R[-1]C -> 5 | G332: =RC[-2]*5 -> 185 | H332: =RC[-3]*10 -> 370 | I332: 待补充
A333: 331 | B333: 无尽之海 | C333: =R[-1]C+1 -> 331 | D333: 上帝的生活331 | E333: 38 | F333: =R[-1]C -> 5 | G333: =RC[-2]*5 -> 190 | H333: =RC[-3]*10 -> 380 | I333: 待补充
A334: 332 | B334: 无尽之海 | C334: =R[-1]C+1 -> 332 | D334: 上帝的生活332 | E334: 38 | F334: =R[-1]C -> 5 | G334: =RC[-2]*5 -> 190 | H334: =RC[-3]*10 -> 380 | I334: 待补充
A335: 333 | B335: 无尽之海 | C335: =R[-1]C+1 -> 333 | D335: 上帝的生活333 | E335: 38 | F335: =R[-1]C -> 5 | G335: =RC[-2]*5 -> 190 | H335: =RC[-3]*10 -> 380 | I335: 待补充
A336: 334 | B336: 无尽之海 | C336: =R[-1]C+1 -> 334 | D336: 上帝的生活334 | E336: 38 | F336: =R[-1]C -> 5 | G336: =RC[-2]*5 -> 190 | H336: =RC[-3]*10 -> 380 | I336: 待补充
A337: 335 | B337: 无尽之海 | C337: =R[-1]C+1 -> 335 | D337: 上帝的生活335 | E337: 38 | F337: =R[-1]C -> 5 | G337: =RC[-2]*5 -> 190 | H337: =RC[-3]*10 -> 380 | I337: 待补充
A338: 336 | B338: 无尽之海 | C338: =R[-1]C+1 -> 336 | D338: 上帝的生活336 | E338: 38 | F338: =R[-1]C -> 5 | G338: =RC[-2]*5 -> 190 | H338: =RC[-3]*10 -> 380 | I338: 待补充
A339: 337 | B339: 无尽之海 | C339: =R[-1]C+1 -> 337 | D339: 上帝的生活337 | E339: 38 | F339: =R[-1]C -> 5 | G339: =RC[-2]*5 -> 190 | H339: =RC[-3]*10 -> 380 | I339: 待补充
A340: 338 | B340: 无尽之海 | C340: =R[-1]C+1 -> 338 | D340: 上帝的生活338 | E340: 38 | F340: =R[-1]C -> 5 | G340: =RC[-2]*5 -> 190 | H340: =RC[-3]*10 -> 380 | I340: 待补充
A341: 339 | B341: 无尽之海 | C341: =R[-1]C+1 -> 339 | D341: 上帝的生活339 | E341: 38 | F341: =R[-1]C -> 5 | G341: =RC[-2]*5 -> 190 | H341: =RC[-3]*10 -> 380 | I341: 待补充
A342: 340 | B342: 无尽之海 | C342: =R[-1]C+1 -> 340 | D342: 上帝的生活340 | E342: 38 | F342: =R[-1]C -> 5 | G342: =RC[-2]*5 -> 190 | H342: =RC[-3]*10 -> 380 | I342: 待补充
A343: 341 | B343: 西域神僧 | C343: =R[-1]C+1 -> 341 | D343: 上帝的生活341 | E343: 39 | F343: =R[-1]C -> 5 | G343: =RC[-2]*5 -> 195 | H343: =RC[-3]*10 -> 390 | I343: 待补充
A344: 342 | B344: 西域神僧 | C344: =R[-1]C+1 -> 342 | D344: 上帝的生活342 | E344: 39 | F344: =R[-1]C -> 5 | G344: =RC[-2]*5 -> 195 | H344: =RC[-3]*10 -> 390 | I344: 待补充
A345: 343 | B345: 西域神僧 | C345: =R[-1]C+1 -> 343 | D345: 上帝的生活343 | E345: 39 | F345: =R[-1]C -> 5 | G345: =RC[-2]*5 -> 195 | H345: =RC[-3]*10 -> 390 | I345: 待补充
A346: 344 | B346: 西域神僧 | C346: =R[-1]C+1 -> 344 | D346: 上帝的生活344 | E346: 39 | F346: =R[-1]C -> 5 | G346: =RC[-2]*5 -> 195 | H346: =RC[-3]*10 -> 390 | I346: 待补充
A347: 345 | B347: 西域神僧 | C347: =R[-1]C+1 -> 345 | D347: 上帝的生活345 | E347: 39 | F347: =R[-1]C -> 5 | G347: =RC[-2]*5 -> 195 | H347: =RC[-3]*10 -> 390 | I347: 待补充
A348: 346 | B348: 西域神僧 | C348: =R[-1]C+1 -> 346 | D348: 上帝的生活346 | E348: 39 | F348: =R[-1]C -> 5 | G348: =RC[-2]*5 -> 195 | H348: =RC[-3]*10 -> 390 | I348: 待补充
A349: 347 | B349: 西域神僧 | C349: =R[-1]C+1 -> 347 | D349: 上帝的生活347 | E349: 39 | F349: =R[-1]C -> 5 | G349: =RC[-2]*5 -> 195 | H349: =RC[-3]*10 -> 390 | I349: 待补充
A350: 348 | B350: 西域神僧 | C350: =R[-1]C+1 -> 348 | D350: 上帝的生活348 | E350: 39 | F350: =R[-1]C -> 5 | G350: =RC[-2]*5 -> 195 | H350: =RC[-3]*10 -> 390 | I350: 待补充
A351: 349 | B351: 西域神僧 | C351: =R[-1]C+1 -> 349 | D351: 上帝的生活349 | E351: 39 | F351: =R[-1]C -> 5 | G351: =RC[-2]*5 -> 195 | H351: =RC[-3]*10 -> 390 | I351: 待补充
A352: 350 | B352: 西域神僧 | C352: =R[-1]C+1 -> 350 | D352: 上帝的生活350 | E352: 39 | F352: =R[-1]C -> 5 | G352: =RC[-2]*5 -> 195 | H352: =RC[-3]*10 -> 390 | I352: 待补充
A353: 351 | B353: 上天的眷顾 | C353: =R[-1]C+1 -> 351 | D353: 上帝的生活351 | E353: 40 | F353: =R[-1]C -> 5 | G353: =RC[-2]*5 -> 200 | H353: =RC[-3]*10 -> 400 | I353: 待补充
A354: 352 | B354: 上天的眷顾 | C354: =R[-1]C+1 -> 352 | D354: 上帝的生活352 | E354: 40 | F354: =R[-1]C -> 5 | G354: =RC[-2]*5 -> 200 | H354: =RC[-3]*10 -> 400 | I354: 待补充
A355: 353 | B355: 上天的眷顾 | C355: =R[-1]C+1 -> 353 | D355: 上帝的生活353 | E355: 40 | F355: =R[-1]C -> 5 | G355: =RC[-2]*5 -> 200 | H355: =RC[-3]*10 -> 400 | I355: 待补充
A356: 354 | B356: 上天的眷顾 | C356: =R[-1]C+1 -> 354 | D356: 上帝的生活354 | E356: 40 | F356: =R[-1]C -> 5 | G356: =RC[-2]*5 -> 200 | H356: =RC[-3]*10 -> 400 | I356: 待补充
A357: 355 | B357: 上天的眷顾 | C357: =R[-1]C+1 -> 355 | D357: 上帝的生活355 | E357: 40 | F357: =R[-1]C -> 5 | G357: =RC[-2]*5 -> 200 | H357: =RC[-3]*10 -> 400 | I357: 待补充
A358: 356 | B358: 上天的眷顾 | C358: =R[-1]C+1 -> 356 | D358: 上帝的生活356 | E358: 40 | F358: =R[-1]C -> 5 | G358: =RC[-2]*5 -> 200 | H358: =RC[-3]*10 -> 400 | I358: 待补充
A359: 357 | B359: 上天的眷顾 | C359: =R[-1]C+1 -> 357 | D359: 上帝的生活357 | E359: 40 | F359: =R[-1]C -> 5 | G359: =RC[-2]*5 -> 200 | H359: =RC[-3]*10 -> 400 | I359: 待补充
A360: 358 | B360: 上天的眷顾 | C360: =R[-1]C+1 -> 358 | D360: 上帝的生活358 | E360: 40 | F360: =R[-1]C -> 5 | G360: =RC[-2]*5 -> 200 | H360: =RC[-3]*10 -> 400 | I360: 待补充
A361: 359 | B361: 上天的眷顾 | C361: =R[-1]C+1 -> 359 | D361: 上帝的生活359 | E361: 40 | F361: =R[-1]C -> 5 | G361: =RC[-2]*5 -> 200 | H361: =RC[-3]*10 -> 400 | I361: 待补充
A362: 360 | B362: 上天的眷顾 | C362: =R[-1]C+1 -> 360 | D362: 上帝的生活360 | E362: 40 | F362: =R[-1]C -> 5 | G362: =RC[-2]*5 -> 200 | H362: =RC[-3]*10 -> 400 | I362: 待补充
A363: 361 | B363: 王母娘娘 | C363: =R[-1]C+1 -> 361 | D363: 上帝的生活361 | E363: 41 | F363: =R[-1]C -> 5 | G363: =RC[-2]*5 -> 205 | H363: =RC[-3]*10 -> 410 | I363: 待补充
A364: 362 | B364: 王母娘娘 | C364: =R[-1]C+1 -> 362 | D364: 上帝的生活362 | E364: 41 | F364: =R[-1]C -> 5 | G364: =RC[-2]*5 -> 205 | H364: =RC[-3]*10 -> 410 | I364: 待补充
A365: 363 | B365: 王母娘娘 | C365: =R[-1]C+1 -> 363 | D365: 上帝的生活363 | E365: 41 | F365: =R[-1]C -> 5 | G365: =RC[-2]*5 -> 205 | H365: =RC[-3]*10 -> 410 | I365: 待补充
A366: 364 | B366: 王母娘娘 | C366: =R[-1]C+1 -> 364 | D366: 上帝的生活364 | E366: 41 | F366: =R[-1]C -> 5 | G366: =RC[-2]*5 -> 205 | H366: =RC[-3]*10 -> 410 | I366: 待补充
A367: 365 | B367: 王母娘娘 | C367: =R[-1]C+1 -> 365 | D367: 上帝的生活365 | E367: 41 | F367: =R[-1]C -> 5 | G367: =RC[-2]*5 -> 205 | H367: =RC[-3]*10 -> 410 | I367: 待补充
A368: 366 | B368: 王母娘娘 | C368: =R[-1]C+1 -> 366 | D368: 上帝的生活366 | E368: 41 | F368: =R[-1]C -> 5 | G368: =RC[-2]*5 -> 205 | H368: =RC[-3]*10 -> 410 | I368: 待补充
A369: 367 | B369: 王母娘娘 | C369: =R[-1]C+1 -> 367 | D369: 上帝的生活367 | E369: 41 | F369: =R[-1]C -> 5 | G369: =RC[-2]*5 -> 205 | H369: =RC[-3]*10 -> 410 | I369: 待补充
A370: 368 | B370: 王母娘娘 | C370: =R[-1]C+1 -> 368 | D370: 上帝的生活368 | E370: 41 | F370: =R[-1]C -> 5 | G370: =RC[-2]*5 -> 205 | H370: =RC[-3]*10 -> 410 | I370: 待补充
A371: 369 | B371: 王母娘娘 | C371: =R[-1]C+1 -> 369 | D371: 上帝的生活369 | E371: 41 | F371: =R[-1]C -> 5 | G371: =RC[-2]*5 -> 205 | H371: =RC[-3]*10 -> 410 | I371: 待补充
A372: 370 | B372: 王母娘娘 | C372: =R[-1]C+1 -> 370 | D372: 上帝的生活370 | E372: 41 | F372: =R[-1]C -> 5 | G372: =RC[-2]*5 -> 205 | H372: =RC[-3]*10 -> 410 | I372: 待补充
A373: 371 | B373: 蛟龙出海 | C373: =R[-1]C+1 -> 371 | D373: 上帝的生活371 | E373: 42 | F373: =R[-1]C -> 5 | G373: =RC[-2]*5 -> 210 | H373: =RC[-3]*10 -> 420 | I373: 待补充
A374: 372 | B374: 蛟龙出海 | C374: =R[-1]C+1 -> 372 | D374: 上帝的生活372 | E374: 42 | F374: =R[-1]C -> 5 | G374: =RC[-2]*5 -> 210 | H374: =RC[-3]*10 -> 420 | I374: 待补充
A375: 373 | B375: 蛟龙出海 | C375: =R[-1]C+1 -> 373 | D375: 上帝的生活373 | E375: 42 | F375: =R[-1]C -> 5 | G375: =RC[-2]*5 -> 210 | H375: =RC[-3]*10 -> 420 | I375: 待补充
A376: 374 | B376: 蛟龙出海 | C376: =R[-1]C+1 -> 374 | D376: 上帝的生活374 | E376: 42 | F376: =R[-1]C -> 5 | G376: =RC[-2]*5 -> 210 | H376: =RC[-3]*10 -> 420 | I376: 待补充
A377: 375 | B377: 蛟龙出海 | C377: =R[-1]C+1 -> 375 | D377: 上帝的生活375 | E377: 42 | F377: =R[-1]C -> 5 | G377: =RC[-2]*5 -> 210 | H377: =RC[-3]*10 -> 420 | I377: 待补充
A378: 376 | B378: 蛟龙出海 | C378: =R[-1]C+1 -> 376 | D378: 上帝的生活376 | E378: 42 | F378: =R[-1]C -> 5 | G378: =RC[-2]*5 -> 210 | H378: =RC[-3]*10 -> 420 | I378: 待补充
A379: 377 | B379: 蛟龙出海 | C379: =R[-1]C+1 -> 377 | D379: 上帝的生活377 | E379: 42 | F379: =R[-1]C -> 5 | G379: =RC[-2]*5 -> 210 | H379: =RC[-3]*10 -> 420 | I379: 待补充
A380: 378 | B380: 蛟龙出海 | C380: =R[-1]C+1 -> 378 | D380: 上帝的生活378 | E380: 42 | F380: =R[-1]C -> 5 | G380: =RC[-2]*5 -> 210 | H380: =RC[-3]*10 -> 420 | I380: 待补充
A381: 379 | B381: 蛟龙出海 | C381: =R[-1]C+1 -> 379 | D381: 上帝的生活379 | E381: 42 | F381: =R[-1]C -> 5 | G381: =RC[-2]*5 -> 210 | H381: =RC[-3]*10 -> 420 | I381: 待补充
A382: 380 | B382: 蛟龙出海 | C382: =R[-1]C+1 -> 380 | D382: 上帝的生活380 | E382: 42 | F382: =R[-1]C -> 5 | G382: =RC[-2]*5 -> 210 | H382: =RC[-3]*10 -> 420 | I382: 待补充
A383: 381 | B383: 六月飞雪 | C383: =R[-1]C+1 -> 381 | D383: 上帝的生活381 | E383: 43 | F383: =R[-1]C -> 5 | G383: =RC[-2]*5 -> 215 | H383: =RC[-3]*10 -> 430 | I383: 待补充
A384: 382 | B384: 六月飞雪 | C384: =R[-1]C+1 -> 382 | D384: 上帝的生活382 | E384: 43 | F384: =R[-1]C -> 5 | G384: =RC[-2]*5 -> 215 | H384: =RC[-3]*10 -> 430 | I384: 待补充
A385: 383 | B385: 六月飞雪 | C385: =R[-1]C+1 -> 383 | D385: 上帝的生活383 | E385: 43 | F385: =R[-1]C -> 5 | G385: =RC[-2]*5 -> 215 | H385: =RC[-3]*10 -> 430 | I385: 待补充
A386: 384 | B386: 六月飞雪 | C386: =R[-1]C+1 -> 384 | D386: 上帝的生活384 | E386: 43 | F386: =R[-1]C -> 5 | G386: =RC[-2]*5 -> 215 | H386: =RC[-3]*10 -> 430 | I386: 待补充
A387: 385 | B387: 六月飞雪 | C387: =R[-1]C+1 -> 385 | D387: 上帝的生活385 | E387: 43 | F387: =R[-1]C -> 5 | G387: =RC[-2]*5 -> 215 | H387: =RC[-3]*10 -> 430 | I387: 待补充
A388: 386 | B388: 六月飞雪 | C388: =R[-1]C+1 -> 386 | D388: 上帝的生活386 | E388: 43 | F388: =R[-1]C -> 5 | G388: =RC[-2]*5 -> 215 | H388: =RC[-3]*10 -> 430 | I388: 待补充
A389: 387 | B389: 六月飞雪 | C389: =R[-1]C+1 -> 387 | D389: 上帝的生活387 | E389: 43 | F389: =R[-1]C -> 5 | G389: =RC[-2]*5 -> 215 | H389: =RC[-3]*10 -> 430 | I389: 待补充
A390: 388 | B390: 六月飞雪 | C390: =R[-1]C+1 -> 388 | D390: 上帝的生活388 | E390: 43 | F390: =R[-1]C -> 5 | G390: =RC[-2]*5 -> 215 | H390: =RC[-3]*10 -> 430 | I390: 待补充
A391: 389 | B391: 六月飞雪 | C391: =R[-1]C+1 -> 389 | D391: 上帝的生活389 | E391: 43 | F391: =R[-1]C -> 5 | G391: =RC[-2]*5 -> 215 | H391: =RC[-3]*10 -> 430 | I391: 待补充
A392: 390 | B392: 六月飞雪 | C392: =R[-1]C+1 -> 390 | D392: 上帝的生活390 | E392: 43 | F392: =R[-1]C -> 5 | G392: =RC[-2]*5 -> 215 | H392: =RC[-3]*10 -> 430 | I392: 待补充
A393: 391 | B393: 夸父追日 | C393: =R[-1]C+1 -> 391 | D393: 上帝的生活391 | E393: 44 | F393: =R[-1]C -> 5 | G393: =RC[-2]*5 -> 220 | H393: =RC[-3]*10 -> 440 | I393: 待补充
A394: 392 | B394: 夸父追日 | C394: =R[-1]C+1 -> 392 | D394: 上帝的生活392 | E394: 44 | F394: =R[-1]C -> 5 | G394: =RC[-2]*5 -> 220 | H394: =RC[-3]*10 -> 440 | I394: 待补充
A395: 393 | B395: 夸父追日 | C395: =R[-1]C+1 -> 393 | D395: 上帝的生活393 | E395: 44 | F395: =R[-1]C -> 5 | G395: =RC[-2]*5 -> 220 | H395: =RC[-3]*10 -> 440 | I395: 待补充
A396: 394 | B396: 夸父追日 | C396: =R[-1]C+1 -> 394 | D396: 上帝的生活394 | E396: 44 | F396: =R[-1]C -> 5 | G396: =RC[-2]*5 -> 220 | H396: =RC[-3]*10 -> 440 | I396: 待补充
A397: 395 | B397: 夸父追日 | C397: =R[-1]C+1 -> 395 | D397: 上帝的生活395 | E397: 44 | F397: =R[-1]C -> 5 | G397: =RC[-2]*5 -> 220 | H397: =RC[-3]*10 -> 440 | I397: 待补充
A398: 396 | B398: 夸父追日 | C398: =R[-1]C+1 -> 396 | D398: 上帝的生活396 | E398: 44 | F398: =R[-1]C -> 5 | G398: =RC[-2]*5 -> 220 | H398: =RC[-3]*10 -> 440 | I398: 待补充
A399: 397 | B399: 夸父追日 | C399: =R[-1]C+1 -> 397 | D399: 上帝的生活397 | E399: 44 | F399: =R[-1]C -> 5 | G399: =RC[-2]*5 -> 220 | H399: =RC[-3]*10 -> 440 | I399: 待补充
A400: 398 | B400: 夸父追日 | C400: =R[-1]C+1 -> 398 | D400: 上帝的生活398 | E400: 44 | F400: =R[-1]C -> 5 | G400: =RC[-2]*5 -> 220 | H400: =RC[-3]*10 -> 440 | I400: 待补充
A401: 399 | B401: 夸父追日 | C401: =R[-1]C+1 -> 399 | D401: 上帝的生活399 | E401: 44 | F401: =R[-1]C -> 5 | G401: =RC[-2]*5 -> 220 | H401: =RC[-3]*10 -> 440 | I401: 待补充
A402: 400 | B402: 夸父追日 | C402: =R[-1]C+1 -> 400 | D402: 上帝的生活400 | E402: 44 | F402: =R[-1]C -> 5 | G402: =RC[-2]*5 -> 220 | H402: =RC[-3]*10 -> 440 | I402: 待补充
A403: 401 | B403: 九个太阳 | C403: =R[-1]C+1 -> 401 | D403: 上帝的生活401 | E403: 45 | F403: =R[-1]C -> 5 | G403: =RC[-2]*5 -> 225 | H403: =RC[-3]*10 -> 450 | I403: 待补充
A404: 402 | B404: 九个太阳 | C404: =R[-1]C+1 -> 402 | D404: 上帝的生活402 | E404: 45 | F404: =R[-1]C -> 5 | G404: =RC[-2]*5 -> 225 | H404: =RC[-3]*10 -> 450 | I404: 待补充
A405: 403 | B405: 九个太阳 | C405: =R[-1]C+1 -> 403 | D405: 上帝的生活403 | E405: 45 | F405: =R[-1]C -> 5 | G405: =RC[-2]*5 -> 225 | H405: =RC[-3]*10 -> 450 | I405: 待补充
A406: 404 | B406: 九个太阳 | C406: =R[-1]C+1 -> 404 | D406: 上帝的生活404 | E406: 45 | F406: =R[-1]C -> 5 | G406: =RC[-2]*5 -> 225 | H406: =RC[-3]*10 -> 450 | I406: 待补充
A407: 405 | B407: 九个太阳 | C407: =R[-1]C+1 -> 405 | D407: 上帝的生活405 | E407: 45 | F407: =R[-1]C -> 5 | G407: =RC[-2]*5 -> 225 | H407: =RC[-3]*10 -> 450 | I407: 待补充
A408: 406 | B408: 九个太阳 | C408: =R[-1]C+1 -> 406 | D408: 上帝的生活406 | E408: 45 | F408: =R[-1]C -> 5 | G408: =RC[-2]*5 -> 225 | H408: =RC[-3]*10 -> 450 | I408: 待补充
A409: 407 | B409: 九个太阳 | C409: =R[-1]C+1 -> 407 | D409: 上帝的生活407 | E409: 45 | F409: =R[-1]C -> 5 | G409: =RC[-2]*5 -> 225 | H409: =RC[-3]*10 -> 450 | I409: 待补充
A410: 408 | B410: 九个太阳 | C410: =R[-1]C+1 -> 408 | D410: 上帝的生活408 | E410: 45 | F410: =R[-1]C -> 5 | G410: =RC[-2]*5 -> 225 | H410: =RC[-3]*10 -> 450 | I410: 待补充
A411: 409 | B411: 九个太阳 | C411: =R[-1]C+1 -> 409 | D411: 上帝的生活409 | E411: 45 | F411: =R[-1]C -> 5 | G411: =RC[-2]*5 -> 225 | H411: =RC[-3]*10 -> 450 | I411: 待补充
A412: 410 | B412: 九个太阳 | C412: =R[-1]C+1 -> 410 | D412: 上帝的生活410 | E412: 45 | F412: =R[-1]C -> 5 | G412: =RC[-2]*5 -> 225 | H412: =RC[-3]*10 -> 450 | I412: 待补充
A413: 411 | B413: 月神出丧 | C413: =R[-1]C+1 -> 411 | D413: 上帝的生活411 | E413: 46 | F413: =R[-1]C -> 5 | G413: =RC[-2]*5 -> 230 | H413: =RC[-3]*10 -> 460 | I413: 待补充
A414: 412 | B414: 月神出丧 | C414: =R[-1]C+1 -> 412 | D414: 上帝的生活412 | E414: 46 | F414: =R[-1]C -> 5 | G414: =RC[-2]*5 -> 230 | H414: =RC[-3]*10 -> 460 | I414: 待补充
A415: 413 | B415: 月神出丧 | C415: =R[-1]C+1 -> 413 | D415: 上帝的生活413 | E415: 46 | F415: =R[-1]C -> 5 | G415: =RC[-2]*5 -> 230 | H415: =RC[-3]*10 -> 460 | I415: 待补充
A416: 414 | B416: 月神出丧 | C416: =R[-1]C+1 -> 414 | D416: 上帝的生活414 | E416: 46 | F416: =R[-1]C -> 5 | G416: =RC[-2]*5 -> 230 | H416: =RC[-3]*10 -> 460 | I416: 待补充
A417: 415 | B417: 月神出丧 | C417: =R[-1]C+1 -> 415 | D417: 上帝的生活415 | E417: 46 | F417: =R[-1]C -> 5 | G417: =RC[-2]*5 -> 230 | H417: =RC[-3]*10 -> 460 | I417: 待补充
A418: 416 | B418: 月神出丧 | C418: =R[-1]C+1 -> 416 | D418: 上帝的生活416 | E418: 46 | F418: =R[-1]C -> 5 | G418: =RC[-2]*5 -> 230 | H418: =RC[-3]*10 -> 460 | I418: 待补充
A419: 417 | B419: 月神出丧 | C419: =R[-1]C+1 -> 417 | D419: 上帝的生活417 | E419: 46 | F419: =R[-1]C -> 5 | G419: =RC[-2]*5 -> 230 | H419: =RC[-3]*10 -> 460 | I419: 待补充
A420: 418 | B420: 月神出丧 | C420: =R[-1]C+1 -> 418 | D420: 上帝的生活418 | E420: 46 | F420: =R[-1]C -> 5 | G420: =RC[-2]*5 -> 230 | H420: =RC[-3]*10 -> 460 | I420: 待补充
A421: 419 | B421: 月神出丧 | C421: =R[-1]C+1 -> 419 | D421: 上帝的生活419 | E421: 46 | F421: =R[-1]C -> 5 | G421: =RC[-2]*5 -> 230 | H421: =RC[-3]*10 -> 460 | I421: 待补充
A422: 420 | B422: 月神出丧 | C422: =R[-1]C+1 -> 420 | D422: 上帝的生活420 | E422: 46 | F422: =R[-1]C -> 5 | G422: =RC[-2]*5 -> 230 | H422: =RC[-3]*10 -> 460 | I422: 待补充
A423: 421 | B423: 六世轮回 | C423: =R[-1]C+1 -> 421 | D423: 上帝的生活421 | E423: 47 | F423: =R[-1]C -> 5 | G423: =RC[-2]*5 -> 235 | H423: =RC[-3]*10 -> 470 | I423: 待补充
A424: 422 | B424: 六世轮回 | C424: =R[-1]C+1 -> 422 | D424: 上帝的生活422 | E424: 47 | F424: =R[-1]C -> 5 | G424: =RC[-2]*5 -> 235 | H424: =RC[-3]*10 -> 470 | I424: 待补充
A425: 423 | B425: 六世轮回 | C425: =R[-1]C+1 -> 423 | D425: 上帝的生活423 | E425: 47 | F425: =R[-1]C -> 5 | G425: =RC[-2]*5 -> 235 | H425: =RC[-3]*10 -> 470 | I425: 待补充
A426: 424 | B426: 六世轮回 | C426: =R[-1]C+1 -> 424 | D426: 上帝的生活424 | E426: 47 | F426: =R[-1]C -> 5 | G426: =RC[-2]*5 -> 235 | H426: =RC[-3]*10 -> 470 | I426: 待补充
A427: 425 | B427: 六世轮回 | C427: =R[-1]C+1 -> 425 | D427: 上帝的生活425 | E427: 47 | F427: =R[-1]C -> 5 | G427: =RC[-2]*5 -> 235 | H427: =RC[-3]*10 -> 470 | I427: 待补充
A428: 426 | B428: 六世轮回 | C428: =R[-1]C+1 -> 426 | D428: 上帝的生活426 | E428: 47 | F428: =R[-1]C -> 5 | G428: =RC[-2]*5 -> 235 | H428: =RC[-3]*10 -> 470 | I428: 待补充
A429: 427 | B429: 六世轮回 | C429: =R[-1]C+1 -> 427 | D429: 上帝的生活427 | E429: 47 | F429: =R[-1]C -> 5 | G429: =RC[-2]*5 -> 235 | H429: =RC[-3]*10 -> 470 | I429: 待补充
A430: 428 | B430: 六世轮回 | C430: =R[-1]C+1 -> 428 | D430: 上帝的生活428 | E430: 47 | F430: =R[-1]C -> 5 | G430: =RC[-2]*5 -> 235 | H430: =RC[-3]*10 -> 470 | I430: 待补充
A431: 429 | B431: 六世轮回 | C431: =R[-1]C+1 -> 429 | D431: 上帝的生活429 | E431: 47 | F431: =R[-1]C -> 5 | G431: =RC[-2]*5 -> 235 | H431: =RC[-3]*10 -> 470 | I431: 待补充
A432: 430 | B432: 六世轮回 | C432: =R[-1]C+1 -> 430 | D432: 上帝的生活430 | E432: 47 | F432: =R[-1]C -> 5 | G432: =RC[-2]*5 -> 235 | H432: =RC[-3]*10 -> 470 | I432: 待补充
A433: 431 | B433: 五海之神 | C433: =R[-1]C+1 -> 431 | D433: 上帝的生活431 | E433: 48 | F433: =R[-1]C -> 5 | G433: =RC[-2]*5 -> 240 | H433: =RC[-3]*10 -> 480 | I433: 待补充
A434: 432 | B434: 五海之神 | C434: =R[-1]C+1 -> 432 | D434: 上帝的生活432 | E434: 48 | F434: =R[-1]C -> 5 | G434: =RC[-2]*5 -> 240 | H434: =RC[-3]*10 -> 480 | I434: 待补充
A435: 433 | B435: 五海之神 | C435: =R[-1]C+1 -> 433 | D435: 上帝的生活433 | E435: 48 | F435: =R[-1]C -> 5 | G435: =RC[-2]*5 -> 240 | H435: =RC[-3]*10 -> 480 | I435: 待补充
A436: 434 | B436: 五海之神 | C436: =R[-1]C+1 -> 434 | D436: 上帝的生活434 | E436: 48 | F436: =R[-1]C -> 5 | G436: =RC[-2]*5 -> 240 | H436: =RC[-3]*10 -> 480 | I436: 待补充
A437: 435 | B437: 五海之神 | C437: =R[-1]C+1 -> 435 | D437: 上帝的生活435 | E437: 48 | F437: =R[-1]C -> 5 | G437: =RC[-2]*5 -> 240 | H437: =RC[-3]*10 -> 480 | I437: 待补充
A438: 436 | B438: 五海之神 | C438: =R[-1]C+1 -> 436 | D438: 上帝的生活436 | E438: 48 | F438: =R[-1]C -> 5 | G438: =RC[-2]*5 -> 240 | H438: =RC[-3]*10 -> 480 | I438: 待补充
A439: 437 | B439: 五海之神 | C439: =R[-1]C+1 -> 437 | D439: 上帝的生活437 | E439: 48 | F439: =R[-1]C -> 5 | G439: =RC[-2]*5 -> 240 | H439: =RC[-3]*10 -> 480 | I439: 待补充
A440: 438 | B440: 五海之神 | C440: =R[-1]C+1 -> 438 | D440: 上帝的生活438 | E440: 48 | F440: =R[-1]C -> 5 | G440: =RC[-2]*5 -> 240 | H440: =RC[-3]*10 -> 480 | I440: 待补充
A441: 439 | B441: 五海之神 | C441: =R[-1]C+1 -> 439 | D441: 上帝的生活439 | E441: 48 | F441: =R[-1]C -> 5 | G441: =RC[-2]*5 -> 240 | H441: =RC[-3]*10 -> 480 | I441: 待补充
A442: 440 | B442: 五海之神 | C442: =R[-1]C+1 -> 440 | D442: 上帝的生活440 | E442: 48 | F442: =R[-1]C -> 5 | G442: =RC[-2]*5 -> 240 | H442: =RC[-3]*10 -> 480 | I442: 待补充
A443: 441 | B443: 土地老爷 | C443: =R[-1]C+1 -> 441 | D443: 上帝的生活441 | E443: 49 | F443: =R[-1]C -> 5 | G443: =RC[-2]*5 -> 245 | H443: =RC[-3]*10 -> 490 | I443: 待补充
A444: 442 | B444: 土地老爷 | C444: =R[-1]C+1 -> 442 | D444: 上帝的生活442 | E444: 49 | F444: =R[-1]C -> 5 | G444: =RC[-2]*5 -> 245 | H444: =RC[-3]*10 -> 490 | I444: 待补充
A445: 443 | B445: 土地老爷 | C445: =R[-1]C+1 -> 443 | D445: 上帝的生活443 | E445: 49 | F445: =R[-1]C -> 5 | G445: =RC[-2]*5 -> 245 | H445: =RC[-3]*10 -> 490 | I445: 待补充
A446: 444 | B446: 土地老爷 | C446: =R[-1]C+1 -> 444 | D446: 上帝的生活444 | E446: 49 | F446: =R[-1]C -> 5 | G446: =RC[-2]*5 -> 245 | H446: =RC[-3]*10 -> 490 | I446: 待补充
A447: 445 | B447: 土地老爷 | C447: =R[-1]C+1 -> 445 | D447: 上帝的生活445 | E447: 49 | F447: =R[-1]C -> 5 | G447: =RC[-2]*5 -> 245 | H447: =RC[-3]*10 -> 490 | I447: 待补充
A448: 446 | B448: 土地老爷 | C448: =R[-1]C+1 -> 446 | D448: 上帝的生活446 | E448: 49 | F448: =R[-1]C -> 5 | G448: =RC[-2]*5 -> 245 | H448: =RC[-3]*10 -> 490 | I448: 待补充
A449: 447 | B449: 土地老爷 | C449: =R[-1]C+1 -> 447 | D449: 上帝的生活447 | E449: 49 | F449: =R[-1]C -> 5 | G449: =RC[-2]*5 -> 245 | H449: =RC[-3]*10 -> 490 | I449: 待补充
A450: 448 | B450: 土地老爷 | C450: =R[-1]C+1 -> 448 | D450: 上帝的生活448 | E450: 49 | F450: =R[-1]C -> 5 | G450: =RC[-2]*5 -> 245 | H450: =RC[-3]*10 -> 490 | I450: 待补充
A451: 449 | B451: 土地老爷 | C451: =R[-1]C+1 -> 449 | D451: 上帝的生活449 | E451: 49 | F451: =R[-1]C -> 5 | G451: =RC[-2]*5 -> 245 | H451: =RC[-3]*10 -> 490 | I451: 待补充
A452: 450 | B452: 土地老爷 | C452: =R[-1]C+1 -> 450 | D452: 上帝的生活450 | E452: 49 | F452: =R[-1]C -> 5 | G452: =RC[-2]*5 -> 245 | H452: =RC[-3]*10 -> 490 | I452: 待补充
A453: 451 | B453: 十八罗汉 | C453: =R[-1]C+1 -> 451 | D453: 上帝的生活451 | E453: 50 | F453: =R[-1]C -> 5 | G453: =RC[-2]*5 -> 250 | H453: =RC[-3]*10 -> 500 | I453: 待补充
A454: 452 | B454: 十八罗汉 | C454: =R[-1]C+1 -> 452 | D454: 上帝的生活452 | E454: 50 | F454: =R[-1]C -> 5 | G454: =RC[-2]*5 -> 250 | H454: =RC[-3]*10 -> 500 | I454: 待补充
A455: 453 | B455: 十八罗汉 | C455: =R[-1]C+1 -> 453 | D455: 上帝的生活453 | E455: 50 | F455: =R[-1]C -> 5 | G455: =RC[-2]*5 -> 250 | H455: =RC[-3]*10 -> 500 | I455: 待补充
A456: 454 | B456: 十八罗汉 | C456: =R[-1]C+1 -> 454 | D456: 上帝的生活454 | E456: 50 | F456: =R[-1]C -> 5 | G456: =RC[-2]*5 -> 250 | H456: =RC[-3]*10 -> 500 | I456: 待补充
A457: 455 | B457: 十八罗汉 | C457: =R[-1]C+1 -> 455 | D457: 上帝的生活455 | E457: 50 | F457: =R[-1]C -> 5 | G457: =RC[-2]*5 -> 250 | H457: =RC[-3]*10 -> 500 | I457: 待补充
A458: 456 | B458: 十八罗汉 | C458: =R[-1]C+1 -> 456 | D458: 上帝的生活456 | E458: 50 | F458: =R[-1]C -> 5 | G458: =RC[-2]*5 -> 250 | H458: =RC[-3]*10 -> 500 | I458: 待补充
A459: 457 | B459: 十八罗汉 | C459: =R[-1]C+1 -> 457 | D459: 上帝的生活457 | E459: 50 | F459: =R[-1]C -> 5 | G459: =RC[-2]*5 -> 250 | H459: =RC[-3]*10 -> 500 | I459: 待补充
A460: 458 | B460: 十八罗汉 | C460: =R[-1]C+1 -> 458 | D460: 上帝的生活458 | E460: 50 | F460: =R[-1]C -> 5 | G460: =RC[-2]*5 -> 250 | H460: =RC[-3]*10 -> 500 | I460: 待补充
A461: 459 | B461: 十八罗汉 | C461: =R[-1]C+1 -> 459 | D461: 上帝的生活459 | E461: 50 | F461: =R[-1]C -> 5 | G461: =RC[-2]*5 -> 250 | H461: =RC[-3]*10 -> 500 | I461: 待补充
A462: 460 | B462: 十八罗汉 | C462: =R[-1]C+1 -> 460 | D462: 上帝的生活460 | E462: 50 | F462: =R[-1]C -> 5 | G462: =RC[-2]*5 -> 250 | H462: =RC[-3]*10 -> 500 | I462: 待补充
A463: 461 | B463: 金身不破 | C463: =R[-1]C+1 -> 461 | D463: 上帝的生活461 | E463: 51 | F463: =R[-1]C -> 5 | G463: =RC[-2]*5 -> 255 | H463: =RC[-3]*10 -> 510 | I463: 待补充
A464: 462 | B464: 金身不破 | C464: =R[-1]C+1 -> 462 | D464: 上帝的生活462 | E464: 51 | F464: =R[-1]C -> 5 | G464: =RC[-2]*5 -> 255 | H464: =RC[-3]*10 -> 510 | I464: 待补充
A465: 463 | B465: 金身不破 | C465: =R[-1]C+1 -> 463 | D465: 上帝的生活463 | E465: 51 | F465: =R[-1]C -> 5 | G465: =RC[-2]*5 -> 255 | H465: =RC[-3]*10 -> 510 | I465: 待补充
A466: 464 | B466: 金身不破 | C466: =R[-1]C+1 -> 464 | D466: 上帝的生活464 | E466: 51 | F466: =R[-1]C -> 5 | G466: =RC[-2]*5 -> 255 | H466: =RC[-3]*10 -> 510 | I466: 待补充
A467: 465 | B467: 金身不破 | C467: =R[-1]C+1 -> 465 | D467: 上帝的生活465 | E467: 51 | F467: =R[-1]C -> 5 | G467: =RC[-2]*5 -> 255 | H467: =RC[-3]*10 -> 510 | I467: 待补充
A468: 466 | B468: 金身不破 | C468: =R[-1]C+1 -> 466 | D468: 上帝的生活466 | E468: 51 | F468: =R[-1]C -> 5 | G468: =RC[-2]*5 -> 255 | H468: =RC[-3]*10 -> 510 | I468: 待补充
A469: 467 | B469: 金身不破 | C469: =R[-1]C+1 -> 467 | D469: 上帝的生活467 | E469: 51 | F469: =R[-1]C -> 5 | G469: =RC[-2]*5 -> 255 | H469: =RC[-3]*10 -> 510 | I469: 待补充
A470: 468 | B470: 金身不破 | C470: =R[-1]C+1 -> 468 | D470: 上帝的生活468 | E470: 51 | F470: =R[-1]C -> 5 | G470: =RC[-2]*5 -> 255 | H470: =RC[-3]*10 -> 510 | I470: 待补充
A471: 469 | B471: 金身不破 | C471: =R[-1]C+1 -> 469 | D471: 上帝的生活469 | E471: 51 | F471: =R[-1]C -> 5 | G471: =RC[-2]*5 -> 255 | H471: =RC[-3]*10 -> 510 | I471: 待补充
A472: 470 | B472: 金身不破 | C472: =R[-1]C+1 -> 470 | D472: 上帝的生活470 | E472: 51 | F472: =R[-1]C -> 5 | G472: =RC[-2]*5 -> 255 | H472: =RC[-3]*10 -> 510 | I472: 待补充
A473: 471 | B473: 黯然销魂 | C473: =R[-1]C+1 -> 471 | D473: 上帝的生活471 | E473: 52 | F473: =R[-1]C -> 5 | G473: =RC[-2]*5 -> 260 | H473: =RC[-3]*10 -> 520 | I473: 待补充
A474: 472 | B474: 黯然销魂 | C474: =R[-1]C+1 -> 472 | D474: 上帝的生活472 | E474: 52 | F474: =R[-1]C -> 5 | G474: =RC[-2]*5 -> 260 | H474: =RC[-3]*10 -> 520 | I474: 待补充
A475: 473 | B475: 黯然销魂 | C475: =R[-1]C+1 -> 473 | D475: 上帝的生活473 | E475: 52 | F475: =R[-1]C -> 5 | G475: =RC[-2]*5 -> 260 | H475: =RC[-3]*10 -> 520 | I475: 待补充
A476: 474 | B476: 黯然销魂 | C476: =R[-1]C+1 -> 474 | D476: 上帝的生活474 | E476: 52 | F476: =R[-1]C -> 5 | G476: =RC[-2]*5 -> 260 | H476: =RC[-3]*10 -> 520 | I476: 待补充
A477: 475 | B477: 黯然销魂 | C477: =R[-1]C+1 -> 475 | D477: 上帝的生活475 | E477: 52 | F477: =R[-1]C -> 5 | G477: =RC[-2]*5 -> 260 | H477: =RC[-3]*10 -> 520 | I477: 待补充
A478: 476 | B478: 黯然销魂 | C478: =R[-1]C+1 -> 476 | D478: 上帝的生活476 | E478: 52 | F478: =R[-1]C -> 5 | G478: =RC[-2]*5 -> 260 | H478: =RC[-3]*10 -> 520 | I478: 待补充
A479: 477 | B479: 黯然销魂 | C479: =R[-1]C+1 -> 477 | D479: 上帝的生活477 | E479: 52 | F479: =R[-1]C -> 5 | G479: =RC[-2]*5 -> 260 | H479: =RC[-3]*10 -> 520 | I479: 待补充
A480: 478 | B480: 黯然销魂 | C480: =R[-1]C+1 -> 478 | D480: 上帝的生活478 | E480: 52 | F480: =R[-1]C -> 5 | G480: =RC[-2]*5 -> 260 | H480: =RC[-3]*10 -> 520 | I480: 待补充
A481: 479 | B481: 黯然销魂 | C481: =R[-1]C+1 -> 479 | D481: 上帝的生活479 | E481: 52 | F481: =R[-1]C -> 5 | G481: =RC[-2]*5 -> 260 | H481: =RC[-3]*10 -> 520 | I481: 待补充
A482: 480 | B482: 黯然销魂 | C482: =R[-1]C+1 -> 480 | D482: 上帝的生活480 | E482: 52 | F482: =R[-1]C -> 5 | G482: =RC[-2]*5 -> 260 | H482: =RC[-3]*10 -> 520 | I482: 待补充
A483: 481 | B483: 天下太平 | C483: =R[-1]C+1 -> 481 | D483: 上帝的生活481 | E483: 53 | F483: =R[-1]C -> 5 | G483: =RC[-2]*5 -> 265 | H483: =RC[-3]*10 -> 530 | I483: 待补充
A484: 482 | B484: 天下太平 | C484: =R[-1]C+1 -> 482 | D484: 上帝的生活482 | E484: 53 | F484: =R[-1]C -> 5 | G484: =RC[-2]*5 -> 265 | H484: =RC[-3]*10 -> 530 | I484: 待补充
A485: 483 | B485: 天下太平 | C485: =R[-1]C+1 -> 483 | D485: 上帝的生活483 | E485: 53 | F485: =R[-1]C -> 5 | G485: =RC[-2]*5 -> 265 | H485: =RC[-3]*10 -> 530 | I485: 待补充
A486: 484 | B486: 天下太平 | C486: =R[-1]C+1 -> 484 | D486: 上帝的生活484 | E486: 53 | F486: =R[-1]C -> 5 | G486: =RC[-2]*5 -> 265 | H486: =RC[-3]*10 -> 530 | I486: 待补充
A487: 485 | B487: 天下太平 | C487: =R[-1]C+1 -> 485 | D487: 上帝的生活485 | E487: 53 | F487: =R[-1]C -> 5 | G487: =RC[-2]*5 -> 265 | H487: =RC[-3]*10 -> 530 | I487: 待补充
A488: 486 | B488: 天下太平 | C488: =R[-1]C+1 -> 486 | D488: 上帝的生活486 | E488: 53 | F488: =R[-1]C -> 5 | G488: =RC[-2]*5 -> 265 | H488: =RC[-3]*10 -> 530 | I488: 待补充
A489: 487 | B489: 天下太平 | C489: =R[-1]C+1 -> 487 | D489: 上帝的生活487 | E489: 53 | F489: =R[-1]C -> 5 | G489: =RC[-2]*5 -> 265 | H489: =RC[-3]*10 -> 530 | I489: 待补充
A490: 488 | B490: 天下太平 | C490: =R[-1]C+1 -> 488 | D490: 上帝的生活488 | E490: 53 | F490: =R[-1]C -> 5 | G490: =RC[-2]*5 -> 265 | H490: =RC[-3]*10 -> 530 | I490: 待补充
A491: 489 | B491: 天下太平 | C491: =R[-1]C+1 -> 489 | D491: 上帝的生活489 | E491: 53 | F491: =R[-1]C -> 5 | G491: =RC[-2]*5 -> 265 | H491: =RC[-3]*10 -> 530 | I491: 待补充
A492: 490 | B492: 天下太平 | C492: =R[-1]C+1 -> 490 | D492: 上帝的生活490 | E492: 53 | F492: =R[-1]C -> 5 | G492: =RC[-2]*5 -> 265 | H492: =RC[-3]*10 -> 530 | I492: 待补充
A493: 491 | B493: 托塔天王 | C493: =R[-1]C+1 -> 491 | D493: 上帝的生活491 | E493: 54 | F493: =R[-1]C -> 5 | G493: =RC[-2]*5 -> 270 | H493: =RC[-3]*10 -> 540 | I493: 待补充
A494: 492 | B494: 托塔天王 | C494: =R[-1]C+1 -> 492 | D494: 上帝的生活492 | E494: 54 | F494: =R[-1]C -> 5 | G494: =RC[-2]*5 -> 270 | H494: =RC[-3]*10 -> 540 | I494: 待补充
A495: 493 | B495: 托塔天王 | C495: =R[-1]C+1 -> 493 | D495: 上帝的生活493 | E495: 54 | F495: =R[-1]C -> 5 | G495: =RC[-2]*5 -> 270 | H495: =RC[-3]*10 -> 540 | I495: 待补充
A496: 494 | B496: 托塔天王 | C496: =R[-1]C+1 -> 494 | D496: 上帝的生活494 | E496: 54 | F496: =R[-1]C -> 5 | G496: =RC[-2]*5 -> 270 | H496: =RC[-3]*10 -> 540 | I496: 待补充
A497: 495 | B497: 托塔天王 | C497: =R[-1]C+1 -> 495 | D497: 上帝的生活495 | E497: 54 | F497: =R[-1]C -> 5 | G497: =RC[-2]*5 -> 270 | H497: =RC[-3]*10 -> 540 | I497: 待补充
A498: 496 | B498: 托塔天王 | C498: =R[-1]C+1 -> 496 | D498: 上帝的生活496 | E498: 54 | F498: =R[-1]C -> 5 | G498: =RC[-2]*5 -> 270 | H498: =RC[-3]*10 -> 540 | I498: 待补充
A499: 497 | B499: 托塔天王 | C499: =R[-1]C+1 -> 497 | D499: 上帝的生活497 | E499: 54 | F499: =R[-1]C -> 5 | G499: =RC[-2]*5 -> 270 | H499: =RC[-3]*10 -> 540 | I499: 待补充
A500: 498 | B500: 托塔天王 | C500: =R[-1]C+1 -> 498 | D500: 上帝的生活498 | E500: 54 | F500: =R[-1]C -> 5 | G500: =RC[-2]*5 -> 270 | H500: =RC[-3]*10 -> 540 | I500: 待补充
A501: 499 | B501: 托塔天王 | C501: =R[-1]C+1 -> 499 | D501: 上帝的生活499 | E501: 54 | F501: =R[-1]C -> 5 | G501: =RC[-2]*5 -> 270 | H501: =RC[-3]*10 -> 540 | I501: 待补充
A502: 500 | B502: 托塔天王 | C502: =R[-1]C+1 -> 500 | D502: 上帝的生活500 | E502: 54 | F502: =R[-1]C -> 5 | G502: =RC[-2]*5 -> 270 | H502: =RC[-3]*10 -> 540 | I502: 待补充

Sheet: 总章表
A1: id | B1: 总章名称
A2: id | B2: name
A3: 1 | B3: 第一大章
A4: 2 | B4: 第二大章
A5: 3 | B5: 第三大章
A6: 4 | B6: 第四大章
A7: 5 | B7: 第五大章
A8: 6 | B8: 第六大章
A9: 7 | B9: 第七大章
A10: 8 | B10: 第八大章
A11: 9 | B11: 第九大章
A12: 10 | B12: 第十大章

Sheet: 大章表
A1: id | B1: 大章名称
A2: id | B2: chapter
A3: 1 | B3: 初入仙界
A4: 2 | B4: 我们的爱
A5: 3 | B5: 猴子出世
A6: 4 | B6: 八戒与玉帝
A7: 5 | B7: 无法无天
A8: 6 | B8: 罪孽深重
A9: 7 | B9: 地狱十八层
A10: 8 | B10: 超级魔王
A11: 9 | B11: 嫦娥的心事
A12: 10 | B12: 女娲娘娘
A13: 11 | B13: 后裔喝醉了
A14: 12 | B14: 这不是真的
A15: 13 | B15: 从头开始
A16: 14 | B16: 七夕之日
A17: 15 | B17: 触犯天规
A18: 16 | B18: 蟠桃盛会
A19: 17 | B19: 师徒四人
A20: 18 | B20: 取经失败
A21: 19 | B21: 这到底是为什么
A22: 20 | B22: 天帝退位
A23: 21 | B23: 意外事件
A24: 22 | B24: 哪吒闹海
A25: 23 | B25: 精卫的烦恼
A26: 24 | B26: 盘古病了
A27: 25 | B27: 巨灵神现身
A28: 26 | B28: 绝望的修行
A29: 27 | B29: 五指山下
A30: 28 | B30: 悟空的心病
A31: 29 | B31: 土行孙火了
A32: 30 | B32: 妲己的美
A33: 31 | B33: 天下大乱
A34: 32 | B34: 妖魔盛行
A35: 33 | B35: 打入凡间
A36: 34 | B36: 无尽之海
A37: 35 | B37: 西域神僧
A38: 36 | B38: 上天的眷顾
A39: 37 | B39: 王母娘娘
A40: 38 | B40: 蛟龙出海
A41: 39 | B41: 六月飞雪
A42: 40 | B42: 夸父追日
A43: 41 | B43: 九个太阳
A44: 42 | B44: 月神出丧
A45: 43 | B45: 六世轮回
A46: 44 | B46: 五海之神
A47: 45 | B47: 土地老爷
A48: 46 | B48: 十八罗汉
A49: 47 | B49: 金身不破
A50: 48 | B50: 黯然销魂
A51: 49 | B51: 天下太平
A52: 50 | B52: 托塔天王

Sheet: 任务扫荡产出表
A1: 大章序号 | B1: 铜板产出 | C1: 经验产出
A2: id | B2: money_obtain | C2: exp_obtain
A3: 1 | B3: 550 | C3: 100
A4: 2 | B4: 660 | C4: 120
A5: 3 | B5: 770 | C5: 140
A6: 4 | B6: 880 | C6: 160
A7: 5 | B7: 990 | C7: 180
A8: 6 | B8: 1100 | C8: 200
A9: 7 | B9: 1210 | C9: 220
A10: 8 | B10: 1320 | C10: 240
A11: 9 | B11: 1430 | C11: 260
A12: 10 | B12: 1540 | C12: 280
A13: 11 | B13: 1650 | C13: 300
A14: 12 | B14: 1760 | C14: 320
A15: 13 | B15: 1870 | C15: 340
A16: 14 | B16: 1980 | C16: 360
A17: 15 | B17: 2090 | C17: 380
A18: 16 | B18: 2200 | C18: 400
A19: 17 | B19: 2310 | C19: 420
A20: 18 | B20: 2420 | C20: 440
A21: 19 | B21: 2530 | C21: 460
A22: 20 | B22: 2640 | C22: 480
A23: 21 | B23: 2750 | C23: 500
A24: 22 | B24: 2860 | C24: 520
A25: 23 | B25: 2970 | C25: 540
A26: 24 | B26: 3080 | C26: 560
A27: 25 | B27: 3190 | C27: 580
A28: 26 | B28: 3300 | C28: 600
A29: 27 | B29: 3410 | C29: 620
A30: 28 | B30: 3520 | C30: 640
A31: 29 | B31: 3630 | C31: 660
A32: 30 | B32: 3740 | C32: 680
A33: 31 | B33: 3850 | C33: 700
A34: 32 | B34: 3960 | C34: 720
A35: 33 | B35: 4070 | C35: 740
A36: 34 | B36: 4180 | C36: 760
A37: 35 | B37: 4290 | C37: 780
A38: 36 | B38: 4400 | C38: 800
A39: 37 | B39: 4510 | C39: 820
A40: 38 | B40: 4620 | C40: 840
A41: 39 | B41: 4730 | C41: 860
A42: 40 | B42: 4840 | C42: 880
A43: 41 | B43: 4950 | C43: 900
A44: 42 | B44: 5060 | C44: 920
A45: 43 | B45: 5170 | C45: 940
A46: 44 | B46: 5280 | C46: 960
A47: 45 | B47: 5390 | C47: 980
A48: 46 | B48: 5500 | C48: 1000
A49: 47 | B49: 5610 | C49: 1020
A50: 48 | B50: 5720 | C50: 1040
A51: 49 | B51: 5830 | C51: 1060
A52: 50 | B52: 5940 | C52: 1080

Sheet: 任务怪物属性表
A1: id | B1: 卡牌名称 | C1: 攻击力 | D1: 生命值 | E1: 闪避率 | F1: 暴击率 | G1: 技能ID
A2: id | B2: card_id | C2: atk | D2: hp | E2: dodge_rate | F2: crit_rate | G2: skill_id
A3: 10000 | B3: 白熊1 | C3: 50 | D3: 108 | E3: 10 | F3: 10 | G3: 1
A4: 10001 | B4: 白熊2 | C4: 92 | D4: 356 | E4: 10 | F4: 10 | G4: 26
A5: 10001 | B5: 白熊3 | C5: 102 | D5: 392 | E5: 10 | F5: 10 | G5: 41
A6: 10002 | B6: 白熊4 | C6: 111 | D6: 430 | E6: 10 | F6: 10 | G6: 32
A7: 10003 | B7: 白熊5 | C7: 122 | D7: 472 | E7: 10 | F7: 10 | G7: 35
A8: 10004 | B8: 白熊6 | C8: 134 | D8: 517 | E8: 10 | F8: 10 | G8: 47
A9: 10005 | B9: 白熊7 | C9: 147 | D9: 566 | E9: 10 | F9: 10 | G9: 29
A10: 10006 | B10: 白熊8 | C10: 161 | D10: 619 | E10: 10 | F10: 10 | G10: 45
A11: 10007 | B11: 白熊9 | C11: 176 | D11: 677 | E11: 10 | F11: 10 | G11: 38
A12: 10008 | B12: 白熊10 | C12: 192 | D12: 739 | E12: 10 | F12: 10 | G12: 49
A13: 10009 | B13: 白熊11 | C13: 209 | D13: 807 | E13: 10 | F13: 10 | G13: 1
A14: 10010 | B14: 白熊12 | C14: 228 | D14: 879 | E14: 10 | F14: 10 | G14: 1
A15: 10011 | B15: 白熊13 | C15: 248 | D15: 957 | E15: 10 | F15: 10 | G15: 1
A16: 10012 | B16: 白熊14 | C16: 270 | D16: 1042 | E16: 10 | F16: 10 | G16: 1
A17: 10013 | B17: 白熊15 | C17: 294 | D17: 1132 | E17: 10 | F17: 10 | G17: 1
A18: 10014 | B18: 白熊16 | C18: 319 | D18: 1230 | E18: 10 | F18: 10 | G18: 26
A19: 10015 | B19: 白熊17 | C19: 346 | D19: 1334 | E19: 10 | F19: 10 | G19: 41
A20: 10016 | B20: 白熊18 | C20: 375 | D20: 1446 | E20: 10 | F20: 10 | G20: 32
A21: 10017 | B21: 白熊19 | C21: 406 | D21: 1566 | E21: 10 | F21: 10 | G21: 35
A22: 10018 | B22: 白熊20 | C22: 439 | D22: 1695 | E22: 10 | F22: 10 | G22: 47
A23: 10019 | B23: 白熊21 | C23: 475 | D23: 1832 | E23: 10 | F23: 10 | G23: 29
A24: 10020 | B24: 白熊22 | C24: 513 | D24: 1979 | E24: 10 | F24: 10 | G24: 45
A25: 10021 | B25: 白熊23 | C25: 553 | D25: 2135 | E25: 10 | F25: 10 | G25: 38
A26: 10022 | B26: 白熊24 | C26: 597 | D26: 2301 | E26: 10 | F26: 10 | G26: 49
A27: 10023 | B27: 白熊25 | C27: 643 | D27: 2479 | E27: 10 | F27: 10 | G27: 1
A28: 10024 | B28: 白熊26 | C28: 691 | D28: 2667 | E28: 10 | F28: 10 | G28: 1
A29: 10025 | B29: 白熊27 | C29: 743 | D29: 2867 | E29: 10 | F29: 10 | G29: 1
A30: 10026 | B30: 白熊28 | C30: 798 | D30: 3079 | E30: 10 | F30: 10 | G30: 1
A31: 10027 | B31: 白熊29 | C31: 857 | D31: 3304 | E31: 10 | F31: 10 | G31: 1
A32: 10028 | B32: 白熊30 | C32: 918 | D32: 3542 | E32: 10 | F32: 10 | G32: 26
A33: 10029 | B33: 白熊31 | C33: 983 | D33: 3793 | E33: 10 | F33: 10 | G33: 41
A34: 10030 | B34: 白熊32 | C34: 1052 | D34: 4059 | E34: 10 | F34: 10 | G34: 32
A35: 10031 | B35: 白熊33 | C35: 1125 | D35: 4339 | E35: 10 | F35: 10 | G35: 35
A36: 10032 | B36: 白熊34 | C36: 1201 | D36: 4634 | E36: 10 | F36: 10 | G36: 47
A37: 10033 | B37: 白熊35 | C37: 1282 | D37: 4945 | E37: 10 | F37: 10 | G37: 29
A38: 10034 | B38: 白熊36 | C38: 1367 | D38: 5271 | E38: 10 | F38: 10 | G38: 45
A39: 10035 | B39: 白熊37 | C39: 1455 | D39: 5613 | E39: 10 | F39: 10 | G39: 38
A40: 10036 | B40: 白熊38 | C40: 1548 | D40: 5973 | E40: 10 | F40: 10 | G40: 49
A41: 10037 | B41: 白熊39 | C41: 1646 | D41: 6349 | E41: 10 | F41: 10 | G41: 1
A42: 10038 | B42: 白熊40 | C42: 1748 | D42: 6743 | E42: 10 | F42: 10 | G42: 1
A43: 10039 | B43: 白熊41 | C43: 1855 | D43: 7154 | E43: 10 | F43: 10 | G43: 1
A44: 10040 | B44: 白熊42 | C44: 1966 | D44: 7583 | E44: 10 | F44: 10 | G44: 1
A45: 10041 | B45: 白熊43 | C45: 2082 | D45: 8031 | E45: 10 | F45: 10 | G45: 1
A46: 10042 | B46: 白熊44 | C46: 2203 | D46: 8496 | E46: 10 | F46: 10 | G46: 26
A47: 10043 | B47: 白熊45 | C47: 2328 | D47: 8981 | E47: 10 | F47: 10 | G47: 41
A48: 10044 | B48: 白熊46 | C48: 2459 | D48: 9484 | E48: 10 | F48: 10 | G48: 32
A49: 10045 | B49: 白熊47 | C49: 2594 | D49: 10005 | E49: 10 | F49: 10 | G49: 35
A50: 10046 | B50: 白熊48 | C50: 2734 | D50: 10545 | E50: 10 | F50: 10 | G50: 47
A51: 10047 | B51: 白熊49 | C51: 2897 | D51: 11104 | E51: 10 | F51: 10 | G51: 29
A52: 10048 | B52: 白熊50 | C52: 3029 | D52: 11682 | E52: 10 | F52: 10 | G52: 45
A53: 10049 | B53: 白熊51 | C53: 3520 | D53: 12340 | E53: 10 | F53: 10 | G53: 45
A54: 10050 | B54: 白熊52 | C54: 4020 | D54: 15032 | E54: 10 | F54: 10 | G54: 45

Sheet: 任务卡牌配置表
A1: id | B1: 大章 | C1: 卡牌数量 | D1: 所有卡牌 | E1: Boss卡牌 | F1: boss技能触发概率 | G1: Boss加成效果 | H1: 阵型 | I1: 每小关攻击加成 | J1: 每小关生命加成 | K1: 掉落卡牌最大数量
A2: id | B2: chepter_id | C2: card_count | D2: cards | E2: boss_id | F2: trigger_rate | G2: boss_attr | H2: formation | I2: atk_inc | J2: hp_inc | K2: max_drop_card_number
A3: 1 | B3: 初入仙界 | C3: 2 | D3: 10000#10000 | E3: 10000 | F3: 30 | G3: 30 | H3: 1:10000,2:10000 | I3: 5 | J3: 5 | K3: 1
A4: 2 | B4: 我们的爱 | C4: 3 | D4: 10001#10001#10002 | E4: 10002 | F4: 30 | G4: 30 | H4: 1:10001,2:10001,3:10002 | I4: 5 | J4: 5 | K4: 1
A5: 3 | B5: 猴子出世 | C5: 3 | D5: 10002#10002#10003 | E5: 10003 | F5: 30 | G5: 30 | H5: 1:10002,2:10002,3:10003 | I5: 5 | J5: 5 | K5: 1
A6: 4 | B6: 八戒与玉帝 | C6: 3 | D6: 10003#10003#10004 | E6: 10004 | F6: 30 | G6: 30 | H6: 1:10003,2:10003,3:10004 | I6: 5 | J6: 5 | K6: 1
A7: 5 | B7: 无法无天 | C7: 3 | D7: 10004#10004#10005 | E7: 10005 | F7: 30 | G7: 30 | H7: 1:10004,2:10004,3:10005 | I7: 5 | J7: 5 | K7: 1
A8: 6 | B8: 罪孽深重 | C8: 4 | D8: 10005#10005#10005#10006 | E8: 10006 | F8: 30 | G8: 30 | H8: 1:10005,2:10005,3:10005,4:10006 | I8: 5 | J8: 5 | K8: 1
A9: 7 | B9: 地狱十八层 | C9: 4 | D9: 10006#10006#10006#10007 | E9: 10007 | F9: 30 | G9: 30 | H9: 1:10006,2:10006,3:10006,4:10007 | I9: 5 | J9: 5 | K9: 1
A10: 8 | B10: 超级魔王 | C10: 4 | D10: 10007#10007#10007#10008 | E10: 10008 | F10: 30 | G10: 30 | H10: 1:10007,2:10007,3:10007,4:10008 | I10: 5 | J10: 5 | K10: 1
A11: 9 | B11: 嫦娥的心事 | C11: 4 | D11: 10008#10008#10008#10009 | E11: 10009 | F11: 30 | G11: 30 | H11: 1:10008,2:10008,3:10008,4:10009 | I11: 5 | J11: 5 | K11: 1
A12: 10 | B12: 女娲娘娘 | C12: 4 | D12: 10009#10009#10009#10010 | E12: 10010 | F12: 30 | G12: 30 | H12: 1:10009,2:10009,3:10009,4:10010 | I12: 5 | J12: 5 | K12: 1
A13: 11 | B13: 后裔喝醉了 | C13: 4 | D13: 10010#10010#10010#10011 | E13: 10011 | F13: 30 | G13: 30 | H13: 1:10010,2:10010,3:10010,4:10011 | I13: 5 | J13: 5 | K13: 1
A14: 12 | B14: 这不是真的 | C14: 4 | D14: 10011#10011#10011#10012 | E14: 10012 | F14: 30 | G14: 30 | H14: 1:10011,2:10011,3:10011,4:10012 | I14: 5 | J14: 5 | K14: 1
A15: 13 | B15: 从头开始 | C15: 4 | D15: 10012#10012#10012#10013 | E15: 10013 | F15: 30 | G15: 30 | H15: 1:10012,2:10012,3:10012,4:10013 | I15: 5 | J15: 5 | K15: 1
A16: 14 | B16: 七夕之日 | C16: 4 | D16: 10013#10013#10013#10014 | E16: 10014 | F16: 30 | G16: 30 | H16: 1:10013,2:10013,3:10013,4:10014 | I16: 5 | J16: 5 | K16: 1
A17: 15 | B17: 触犯天规 | C17: 4 | D17: 10014#10014#10014#10015 | E17: 10015 | F17: 30 | G17: 30 | H17: 1:10014,2:10014,3:10014,4:10015 | I17: 5 | J17: 5 | K17: 1
A18: 16 | B18: 蟠桃盛会 | C18: 5 | D18: 10015#10015#10015#10015#10016 | E18: 10016 | F18: 30 | G18: 30 | H18: 1:10015,2:10015,3:10015,4:10015,5:10016 | I18: 5 | J18: 5 | K18: 1
A19: 17 | B19: 师徒四人 | C19: 5 | D19: 10016#10016#10016#10016#10017 | E19: 10017 | F19: 30 | G19: 30 | H19: 1:10016,2:10016,3:10016,4:10016,5:10017 | I19: 5 | J19: 5 | K19: 1
A20: 18 | B20: 取经失败 | C20: 5 | D20: 10017#10017#10017#10017#10018 | E20: 10018 | F20: 30 | G20: 30 | H20: 1:10017,2:10017,3:10017,4:10017,5:10018 | I20: 5 | J20: 5 | K20: 1
A21: 19 | B21: 这到底是为什么 | C21: 5 | D21: 10018#10018#10018#10018#10019 | E21: 10019 | F21: 30 | G21: 30 | H21: 1:10018,2:10018,3:10018,4:10018,5:10019 | I21: 5 | J21: 5 | K21: 1
A22: 20 | B22: 天帝退位 | C22: 5 | D22: 10019#10019#10019#10019#10020 | E22: 10020 | F22: 30 | G22: 30 | H22: 1:10019,2:10019,3:10019,4:10019,5:10020 | I22: 5 | J22: 5 | K22: 1
A23: 21 | B23: 意外事件 | C23: 5 | D23: 10020#10020#10020#10020#10021 | E23: 10021 | F23: 30 | G23: 30 | H23: 1:10020,2:10020,3:10020,4:10020,5:10021 | I23: 5 | J23: 5 | K23: 1
A24: 22 | B24: 哪吒闹海 | C24: 5 | D24: 10021#10021#10021#10021#10022 | E24: 10022 | F24: 30 | G24: 30 | H24: 1:10022,2:10022,3:10022,4:10022,5:10022 | I24: 5 | J24: 5 | K24: 1
A25: 23 | B25: 精卫的烦恼 | C25: 5 | D25: 10022#10022#10022#10022#10023 | E25: 10023 | F25: 30 | G25: 30 | H25: 1:10022,2:10022,3:10022,4:10022,5:10023 | I25: 5 | J25: 5 | K25: 1
A26: 24 | B26: 盘古病了 | C26: 5 | D26: 10023#10023#10023#10023#10024 | E26: 10024 | F26: 30 | G26: 30 | H26: 1:10023,2:10023,3:10023,4:10023,5:10024 | I26: 5 | J26: 5 | K26: 1
A27: 25 | B27: 巨灵神现身 | C27: 5 | D27: 10024#10024#10024#10024#10025 | E27: 10025 | F27: 30 | G27: 30 | H27: 1:10024,2:10024,3:10024,4:10024,5:10025 | I27: 5 | J27: 5 | K27: 1
A28: 26 | B28: 绝望的修行 | C28: 5 | D28: 10025#10025#10025#10025#10026 | E28: 10026 | F28: 30 | G28: 30 | H28: 1:10025,2:10025,3:10025,4:10025,5:10026 | I28: 5 | J28: 5 | K28: 1
A29: 27 | B29: 五指山下 | C29: 5 | D29: 10026#10026#10026#10026#10027 | E29: 10027 | F29: 30 | G29: 30 | H29: 1:10026,2:10026,3:10026,4:10026,5:10027 | I29: 5 | J29: 5 | K29: 1
A30: 28 | B30: 悟空的心病 | C30: 5 | D30: 10027#10027#10027#10027#10028 | E30: 10028 | F30: 30 | G30: 30 | H30: 1:10027,2:10027,3:10027,4:10027,5:10028 | I30: 5 | J30: 5 | K30: 1
A31: 29 | B31: 土行孙火了 | C31: 5 | D31: 10028#10028#10028#10028#10029 | E31: 10029 | F31: 30 | G31: 30 | H31: 1:10028,2:10028,3:10028,4:10028,5:10029 | I31: 5 | J31: 5 | K31: 1
A32: 30 | B32: 妲己的美 | C32: 5 | D32: 10029#10029#10029#10029#10030 | E32: 10030 | F32: 30 | G32: 30 | H32: 1:10029,2:10029,3:10029,4:10029,5:10030 | I32: 5 | J32: 5 | K32: 1
A33: 31 | B33: 天下大乱 | C33: 5 | D33: 10030#10030#10030#10030#10031 | E33: 10031 | F33: 30 | G33: 30 | H33: 1:10030,2:10030,3:10030,4:10030,5:10031 | I33: 5 | J33: 5 | K33: 1
A34: 32 | B34: 妖魔盛行 | C34: 5 | D34: 10031#10031#10031#10031#10032 | E34: 10032 | F34: 30 | G34: 30 | H34: 1:10031,2:10031,3:10031,4:10031,5:10032 | I34: 5 | J34: 5 | K34: 1
A35: 33 | B35: 打入凡间 | C35: 5 | D35: 10032#10032#10032#10032#10033 | E35: 10033 | F35: 30 | G35: 30 | H35: 1:10032,2:10032,3:10032,4:10032,5:10033 | I35: 5 | J35: 5 | K35: 1
A36: 34 | B36: 无尽之海 | C36: 5 | D36: 10033#10033#10033#10033#10034 | E36: 10034 | F36: 30 | G36: 30 | H36: 1:10033,2:10033,3:10033,4:10033,5:10034 | I36: 5 | J36: 5 | K36: 1
A37: 35 | B37: 西域神僧 | C37: 5 | D37: 10034#10034#10034#10034#10035 | E37: 10035 | F37: 30 | G37: 30 | H37: 1:10034,2:10034,3:10034,4:10034,5:10035 | I37: 5 | J37: 5 | K37: 1
A38: 36 | B38: 上天的眷顾 | C38: 5 | D38: 10035#10035#10035#10035#10036 | E38: 10036 | F38: 30 | G38: 30 | H38: 1:10035,2:10035,3:10035,4:10035,5:10036 | I38: 5 | J38: 5 | K38: 1
A39: 37 | B39: 王母娘娘 | C39: 5 | D39: 10036#10036#10036#10036#10037 | E39: 10037 | F39: 30 | G39: 30 | H39: 1:10036,2:10036,3:10036,4:10036,5:10037 | I39: 5 | J39: 5 | K39: 1
A40: 38 | B40: 蛟龙出海 | C40: 5 | D40: 10037#10037#10037#10037#10038 | E40: 10038 | F40: 30 | G40: 30 | H40: 1:10037,2:10037,3:10037,4:10037,5:10038 | I40: 5 | J40: 5 | K40: 1
A41: 39 | B41: 六月飞雪 | C41: 5 | D41: 10038#10038#10038#10038#10039 | E41: 10039 | F41: 30 | G41: 30 | H41: 1:10039,2:10039,3:10039,4:10039,5:10039 | I41: 5 | J41: 5 | K41: 1
A42: 40 | B42: 夸父追日 | C42: 5 | D42: 10039#10039#10039#10039#10040 | E42: 10040 | F42: 30 | G42: 30 | H42: 1:10039,2:10039,3:10039,4:10039,5:10040 | I42: 5 | J42: 5 | K42: 1
A43: 41 | B43: 九个太阳 | C43: 5 | D43: 10040#10040#10040#10040#10041 | E43: 10041 | F43: 30 | G43: 30 | H43: 1:10040,2:10040,3:10040,4:10040,5:10041 | I43: 5 | J43: 5 | K43: 1
A44: 42 | B44: 月神出丧 | C44: 5 | D44: 10041#10041#10041#10041#10042 | E44: 10042 | F44: 30 | G44: 30 | H44: 1:10041,2:10041,3:10041,4:10041,5:10042 | I44: 5 | J44: 5 | K44: 1
A45: 43 | B45: 六世轮回 | C45: 5 | D45: 10042#10042#10042#10042#10043 | E45: 10043 | F45: 30 | G45: 30 | H45: 1:10042,2:10042,3:10042,4:10042,5:10043 | I45: 5 | J45: 5 | K45: 1
A46: 44 | B46: 五海之神 | C46: 5 | D46: 10043#10043#10043#10043#10044 | E46: 10044 | F46: 30 | G46: 30 | H46: 1:10043,2:10043,3:10043,4:10043,5:10044 | I46: 5 | J46: 5 | K46: 1
A47: 45 | B47: 土地老爷 | C47: 5 | D47: 10044#10044#10044#10044#10045 | E47: 10045 | F47: 30 | G47: 30 | H47: 1:10044,2:10044,3:10044,4:10044,5:10045 | I47: 5 | J47: 5 | K47: 1
A48: 46 | B48: 十八罗汉 | C48: 5 | D48: 10045#10045#10045#10045#10046 | E48: 10046 | F48: 30 | G48: 30 | H48: 1:10045,2:10045,3:10045,4:10045,5:10046 | I48: 5 | J48: 5 | K48: 1
A49: 47 | B49: 金身不破 | C49: 5 | D49: 10046#10046#10046#10046#10047 | E49: 10047 | F49: 30 | G49: 30 | H49: 1:10046,2:10046,3:10046,4:10046,5:10047 | I49: 5 | J49: 5 | K49: 1
A50: 48 | B50: 黯然销魂 | C50: 5 | D50: 10047#10047#10047#10047#10048 | E50: 10048 | F50: 30 | G50: 30 | H50: 1:10047,2:10047,3:10047,4:10047,5:10048 | I50: 5 | J50: 5 | K50: 1
A51: 49 | B51: 天下太平 | C51: 5 | D51: 10048#10048#10048#10048#10049 | E51: 10049 | F51: 30 | G51: 30 | H51: 1:10048,2:10048,3:10048,4:10048,5:10049 | I51: 5 | J51: 5 | K51: 1
A52: 50 | B52: 托塔天王 | C52: 5 | D52: 10049#10049#10049#10049#10050 | E52: 10050 | F52: 30 | G52: 30 | H52: 1:10049,2:10049,3:10049,4:10049,5:10050 | I52: 5 | J52: 5 | K52: 1

Sheet: 关卡怪物属性表
A1: id | B1: 卡牌名称 | C1: 攻击力 | D1: 生命值 | E1: 闪避率 | F1: 暴击率 | G1: 技能ID
A2: id | B2: card_id | C2: atk | D2: hp | E2: dodge_rate | F2: crit_rate | G2: skill_id
A3: 20000 | B3: 树精1 | C3: 246 | D3: 739 | E3: 10 | F3: 10 | G3: 1
A4: 20001 | B4: 树精2 | C4: 385 | D4: 1158 | E4: 10 | F4: 10 | G4: 1
A5: 20002 | B5: 树精3 | C5: 588 | D5: 1771 | E5: 10 | F5: 10 | G5: 26
A6: 20003 | B6: 树精4 | C6: 877 | D6: 2646 | E6: 10 | F6: 10 | G6: 29
A7: 20004 | B7: 树精4 | C7: 1280 | D7: 3858 | E7: 10 | F7: 10 | G7: 41
A8: 20005 | B8: 树精5 | C8: 1944 | D8: 5859 | E8: 10 | F8: 10 | G8: 35
A9: 20006 | B9: 树精6 | C9: 2691 | D9: 8111 | E9: 10 | F9: 10 | G9: 1
A10: 20007 | B10: 树精7 | C10: 3637 | D10: 10963 | E10: 10 | F10: 10 | G10: 32
A11: 20008 | B11: 树精8 | C11: 4565 | D11: 13764 | E11: 10 | F11: 10 | G11: 47
A12: 20009 | B12: 树精9 | C12: 5686 | D12: 14769 | E12: 10 | F12: 10 | G12: 38
A13: 20010 | B13: 树精10 | C13: 7189 | D13: 18669 | E13: 10 | F13: 10 | G13: 1
A14: 20011 | B14: 树精11 | C14: 8947 | D14: 23238 | E14: 10 | F14: 10 | G14: 1
A15: 20012 | B15: 树精12 | C15: 10963 | D15: 28478 | E15: 10 | F15: 10 | G15: 29
A16: 20013 | B16: 树精13 | C16: 13227 | D16: 34359 | E16: 10 | F16: 10 | G16: 45
A17: 20014 | B17: 树精14 | C17: 15136 | D17: 39315 | E17: 10 | F17: 10 | G17: 32
A18: 20015 | B18: 树精15 | C18: 17309 | D18: 43327 | E18: 10 | F18: 10 | G18: 49
A19: 20016 | B19: 树精16 | C19: 20140 | D19: 50412 | E19: 10 | F19: 10 | G19: 1
A20: 20017 | B20: 树精17 | C20: 22289 | D20: 55793 | E20: 10 | F20: 10 | G20: 26
A21: 20018 | B21: 树精18 | C21: 25550 | D21: 63955 | E21: 10 | F21: 10 | G21: 45
A22: 20019 | B22: 树精19 | C22: 29029 | D22: 72662 | E22: 10 | F22: 10 | G22: 32
A23: 20020 | B23: 树精20 | C23: 35042 | D23: 81263 | E23: 10 | F23: 10 | G23: 38

Sheet: 关卡卡牌配置表
A1: id | B1: 层数 | C1: 名称 | D1: 卡牌数量 | E1: 所有卡牌id | F1: 阵型 | G1: boss卡牌id | H1: boos技能触发概率 | I1: boos技能加成效果 | J1: BOSS攻击加成 | K1: BOSS生命加成
A2: id | B2: layer | C2: name | D2: card_count | E2: cards | F2: formation | G2: boss_id | H2: trigger_rate | I2: boss_attr | J2: atk_inc | K2: hp_inc
A3: 1 | B3: 1 | D3: 2 | E3: 20000#20000 | F3: 1:20000,2:20000
A4: 2 | B4: 2 | D4: 2 | E4: 20000#20000 | F4: 1:20000,2:20000
A5: 3 | B5: 3 | D5: 2 | E5: 20000#20000 | F5: 1:20000,2:20000
A6: 4 | B6: 4 | D6: 2 | E6: 20000#20000 | F6: 1:20000,2:20000
A7: 5 | B7: 5 | D7: 2 | E7: 20000#20001 | F7: 1:20000,2:20001 | G7: 20001 | H7: 70 | I7: 180 | J7: 10 | K7: 10
A8: 6 | B8: 6 | D8: 3 | E8: 20001#20001#20001 | F8: 1:20001,2:20001,3:20001
A9: 7 | B9: 7 | D9: 3 | E9: 20001#20001#20001 | F9: 1:20001,2:20001,3:20001
A10: 8 | B10: 8 | D10: 3 | E10: 20001#20001#20001 | F10: 1:20001,2:20001,3:20001
A11: 9 | B11: 9 | D11: 3 | E11: 20001#20001#20001 | F11: 1:20001,2:20001,3:20001
A12: 10 | B12: 10 | D12: 3 | E12: 20001#20001#20002 | F12: 1:20001,2:20001,3:20002 | G12: 20002 | H12: 50 | I12: 180 | J12: 10 | K12: 10
A13: 11 | B13: 11 | D13: 4 | E13: 20002#20002#20002#20002 | F13: 1:20002,2:20002,3:20002,4:20002
A14: 12 | B14: 12 | D14: 4 | E14: 20002#20002#20002#20002 | F14: 1:20002,2:20002,3:20002,4:20002
A15: 13 | B15: 13 | D15: 4 | E15: 20002#20002#20002#20002 | F15: 1:20002,2:20002,3:20002,4:20002
A16: 14 | B16: 14 | D16: 4 | E16: 20002#20002#20002#20002 | F16: 1:20002,2:20002,3:20002,4:20002
A17: 15 | B17: 15 | D17: 4 | E17: 20002#20002#20002#20003 | F17: 1:20002,2:20002,3:20002,4:20003 | G17: 20003 | H17: 50 | I17: 70 | J17: 10 | K17: 10
A18: 16 | B18: 16 | D18: 4 | E18: 20003#20003#20003#20003#20003 | F18: 1:20003,2:20003,3:20003,4:20003,5:20003
A19: 17 | B19: 17 | D19: 4 | E19: 20003#20003#20003#20003#20003 | F19: 1:20003,2:20003,3:20003,4:20003,5:20003
A20: 18 | B20: 18 | D20: 4 | E20: 20003#20003#20003#20003#20003 | F20: 1:20003,2:20003,3:20003,4:20003,5:20003
A21: 19 | B21: 19 | D21: 4 | E21: 20003#20003#20003#20003#20003 | F21: 1:20003,2:20003,3:20003,4:20003,5:20003
A22: 20 | B22: 20 | D22: 4 | E22: 20003#20003#20003#20003#20004 | F22: 1:20003,2:20003,3:20003,4:20003,5:20004 | G22: 20004 | H22: 50 | I22: 50 | J22: 10 | K22: 10
A23: 21 | B23: 21 | D23: 4 | E23: 20004#20004#20004#20004#20004 | F23: 1:20004,2:20004,3:20004,4:20004,5:20004
A24: 22 | B24: 22 | D24: 4 | E24: 20004#20004#20004#20004#20004 | F24: 1:20004,2:20004,3:20004,4:20004,5:20004
A25: 23 | B25: 23 | D25: 4 | E25: 20004#20004#20004#20004#20004 | F25: 1:20004,2:20004,3:20004,4:20004,5:20004
A26: 24 | B26: 24 | D26: 4 | E26: 20004#20004#20004#20004#20004 | F26: 1:20004,2:20004,3:20004,4:20004,5:20004
A27: 25 | B27: 25 | D27: 4 | E27: 20004#20004#20004#20004#20005 | F27: 1:20004,2:20004,3:20004,4:20004,5:20005 | G27: 20005 | H27: 50 | I27: 70 | J27: 10 | K27: 10
A28: 26 | B28: 26 | D28: 5 | E28: 20005#20005#20005#20005#20005 | F28: 1:20005,2:20005,3:20005,4:20005,5:20005
A29: 27 | B29: 27 | D29: 5 | E29: 20005#20005#20005#20005#20005 | F29: 1:20005,2:20005,3:20005,4:20005,5:20005
A30: 28 | B30: 28 | D30: 5 | E30: 20005#20005#20005#20005#20005 | F30: 1:20005,2:20005,3:20005,4:20005,5:20005
A31: 29 | B31: 29 | D31: 5 | E31: 20005#20005#20005#20005#20005 | F31: 1:20005,2:20005,3:20005,4:20005,5:20005
A32: 30 | B32: 30 | D32: 5 | E32: 20005#20005#20005#20005#20006 | F32: 1:20005,2:20005,3:20005,4:20005,5:20006 | G32: 20006 | H32: 70 | I32: 180 | J32: 10 | K32: 10
A33: 31 | B33: 31 | D33: 5 | E33: 20006#20006#20006#20006#20006 | F33: 1:20006,2:20006,3:20006,4:20006,5:20006
A34: 32 | B34: 32 | D34: 5 | E34: 20006#20006#20006#20006#20006 | F34: 1:20006,2:20006,3:20006,4:20006,5:20006
A35: 33 | B35: 33 | D35: 5 | E35: 20006#20006#20006#20006#20006 | F35: 1:20006,2:20006,3:20006,4:20006,5:20006
A36: 34 | B36: 34 | D36: 5 | E36: 20006#20006#20006#20006#20006 | F36: 1:20006,2:20006,3:20006,4:20006,5:20006
A37: 35 | B37: 35 | D37: 5 | E37: 20006#20006#20006#20006#20007 | F37: 1:20006,2:20006,3:20006,4:20006,5:20007 | G37: 20007 | H37: 50 | I37: 70 | J37: 10 | K37: 10
A38: 36 | B38: 36 | D38: 5 | E38: 20007#20007#20007#20007#20007 | F38: 1:20007,2:20007,3:20007,4:20007,5:20007
A39: 37 | B39: 37 | D39: 5 | E39: 20007#20007#20007#20007#20007 | F39: 1:20007,2:20007,3:20007,4:20007,5:20007
A40: 38 | B40: 38 | D40: 5 | E40: 20007#20007#20007#20007#20007 | F40: 1:20007,2:20007,3:20007,4:20007,5:20007
A41: 39 | B41: 39 | D41: 5 | E41: 20007#20007#20007#20007#20007 | F41: 1:20007,2:20007,3:20007,4:20007,5:20007
A42: 40 | B42: 40 | D42: 5 | E42: 20007#20007#20007#20007#20008 | F42: 1:20007,2:20007,3:20007,4:20007,5:20008 | G42: 20008 | H42: 50 | I42: 50 | J42: 10 | K42: 10
A43: 41 | B43: 41 | D43: 5 | E43: 20008#20008#20008#20008#20008 | F43: 1:20008,2:20008,3:20008,4:20008,5:20008
A44: 42 | B44: 42 | D44: 5 | E44: 20008#20008#20008#20008#20008 | F44: 1:20008,2:20008,3:20008,4:20008,5:20008
A45: 43 | B45: 43 | D45: 5 | E45: 20008#20008#20008#20008#20008 | F45: 1:20008,2:20008,3:20008,4:20008,5:20008
A46: 44 | B46: 44 | D46: 5 | E46: 20008#20008#20008#20008#20008 | F46: 1:20008,2:20008,3:20008,4:20008,5:20008
A47: 45 | B47: 45 | D47: 5 | E47: 20008#20008#20008#20008#20009 | F47: 1:20008,2:20008,3:20008,4:20008,5:20009 | G47: 20009 | H47: 50 | I47: 50 | J47: 10 | K47: 10
A48: 46 | B48: 46 | D48: 5 | E48: 20009#20009#20009#20009#20009 | F48: 1:20009,2:20009,3:20009,4:20009,5:20009
A49: 47 | B49: 47 | D49: 5 | E49: 20009#20009#20009#20009#20009 | F49: 1:20009,2:20009,3:20009,4:20009,5:20009
A50: 48 | B50: 48 | D50: 5 | E50: 20009#20009#20009#20009#20009 | F50: 1:20009,2:20009,3:20009,4:20009,5:20009
A51: 49 | B51: 49 | D51: 5 | E51: 20009#20009#20009#20009#20009 | F51: 1:20009,2:20009,3:20009,4:20009,5:20009
A52: 50 | B52: 50 | D52: 5 | E52: 20009#20009#20009#20009#20010 | F52: 1:20009,2:20009,3:20009,4:20009,5:20010 | G52: 20010 | H52: 70 | I52: 180 | J52: 10 | K52: 10
A53: 51 | B53: 51 | D53: 5 | E53: 20010#20010#20010#20010#20010 | F53: 1:20010,2:20010,3:20010,4:20010,5:20010
A54: 52 | B54: 52 | D54: 5 | E54: 20010#20010#20010#20010#20010 | F54: 1:20010,2:20010,3:20010,4:20010,5:20010
A55: 53 | B55: 53 | D55: 5 | E55: 20010#20010#20010#20010#20010 | F55: 1:20010,2:20010,3:20010,4:20010,5:20010
A56: 54 | B56: 54 | D56: 5 | E56: 20010#20010#20010#20010#20010 | F56: 1:20010,2:20010,3:20010,4:20010,5:20010
A57: 55 | B57: 55 | D57: 5 | E57: 20010#20010#20010#20010#20011 | F57: 1:20010,2:20010,3:20010,4:20010,5:20011 | G57: 20011 | H57: 70 | I57: 180 | J57: 10 | K57: 10
A58: 56 | B58: 56 | D58: 5 | E58: 20011#20011#20011#20011#20011 | F58: 1:20011,2:20011,3:20011,4:20011,5:20011
A59: 57 | B59: 57 | D59: 5 | E59: 20011#20011#20011#20011#20011 | F59: 1:20011,2:20011,3:20011,4:20011,5:20011
A60: 58 | B60: 58 | D60: 5 | E60: 20011#20011#20011#20011#20011 | F60: 1:20011,2:20011,3:20011,4:20011,5:20011
A61: 59 | B61: 59 | D61: 5 | E61: 20011#20011#20011#20011#20011 | F61: 1:20011,2:20011,3:20011,4:20011,5:20011
A62: 60 | B62: 60 | D62: 5 | E62: 20011#20011#20011#20011#20012 | F62: 1:20011,2:20011,3:20011,4:20011,5:20012 | G62: 20012 | H62: 50 | I62: 70 | J62: 10 | K62: 10
A63: 61 | B63: 61 | D63: 5 | E63: 20012#20012#20012#20012#20012 | F63: 1:20012,2:20012,3:20012,4:20012,5:20012
A64: 62 | B64: 62 | D64: 5 | E64: 20012#20012#20012#20012#20012 | F64: 1:20012,2:20012,3:20012,4:20012,5:20012
A65: 63 | B65: 63 | D65: 5 | E65: 20012#20012#20012#20012#20012 | F65: 1:20012,2:20012,3:20012,4:20012,5:20012
A66: 64 | B66: 64 | D66: 5 | E66: 20012#20012#20012#20012#20012 | F66: 1:20012,2:20012,3:20012,4:20012,5:20012
A67: 65 | B67: 65 | D67: 5 | E67: 20012#20012#20012#20012#20013 | F67: 1:20012,2:20012,3:20012,4:20012,5:20013 | G67: 20013 | H67: 50 | I67: 50 | J67: 10 | K67: 10
A68: 66 | B68: 66 | D68: 5 | E68: 20013#20013#20013#20013#20013 | F68: 1:20013,2:20013,3:20013,4:20013,5:20013
A69: 67 | B69: 67 | D69: 5 | E69: 20013#20013#20013#20013#20013 | F69: 1:20013,2:20013,3:20013,4:20013,5:20013
A70: 68 | B70: 68 | D70: 5 | E70: 20013#20013#20013#20013#20013 | F70: 1:20013,2:20013,3:20013,4:20013,5:20013
A71: 69 | B71: 69 | D71: 5 | E71: 20013#20013#20013#20013#20013 | F71: 1:20013,2:20013,3:20013,4:20013,5:20013
A72: 70 | B72: 70 | D72: 5 | E72: 20013#20013#20013#20013#20014 | F72: 1:20013,2:20013,3:20013,4:20013,5:20014 | G72: 20014 | H72: 50 | I72: 50 | J72: 10 | K72: 10
A73: 71 | B73: 71 | D73: 5 | E73: 20014#20014#20014#20014#20014 | F73: 1:20014,2:20014,3:20014,4:20014,5:20014
A74: 72 | B74: 72 | D74: 5 | E74: 20014#20014#20014#20014#20014 | F74: 1:20014,2:20014,3:20014,4:20014,5:20014
A75: 73 | B75: 73 | D75: 5 | E75: 20014#20014#20014#20014#20014 | F75: 1:20014,2:20014,3:20014,4:20014,5:20014
A76: 74 | B76: 74 | D76: 5 | E76: 20014#20014#20014#20014#20014 | F76: 1:20014,2:20014,3:20014,4:20014,5:20014
A77: 75 | B77: 75 | D77: 5 | E77: 20014#20014#20014#20014#20015 | F77: 1:20014,2:20014,3:20014,4:20014,5:20015 | G77: 20015 | H77: 50 | I77: 50 | J77: 10 | K77: 10
A78: 76 | B78: 76 | D78: 5 | E78: 20015#20015#20015#20015#20015 | F78: 1:20015,2:20015,3:20015,4:20015,5:20015
A79: 77 | B79: 77 | D79: 5 | E79: 20015#20015#20015#20015#20015 | F79: 1:20015,2:20015,3:20015,4:20015,5:20015
A80: 78 | B80: 78 | D80: 5 | E80: 20015#20015#20015#20015#20015 | F80: 1:20015,2:20015,3:20015,4:20015,5:20015
A81: 79 | B81: 79 | D81: 5 | E81: 20015#20015#20015#20015#20015 | F81: 1:20015,2:20015,3:20015,4:20015,5:20015
A82: 80 | B82: 80 | D82: 5 | E82: 20015#20015#20015#20015#20016 | F82: 1:20015,2:20015,3:20015,4:20015,5:20016 | G82: 20016 | H82: 70 | I82: 180 | J82: 10 | K82: 10
A83: 81 | B83: 81 | D83: 5 | E83: 20016#20016#20016#20016#20016 | F83: 1:20016,2:20016,3:20016,4:20016,5:20016
A84: 82 | B84: 82 | D84: 5 | E84: 20016#20016#20016#20016#20016 | F84: 1:20016,2:20016,3:20016,4:20016,5:20016
A85: 83 | B85: 83 | D85: 5 | E85: 20016#20016#20016#20016#20016 | F85: 1:20016,2:20016,3:20016,4:20016,5:20016
A86: 84 | B86: 84 | D86: 5 | E86: 20016#20016#20016#20016#20016 | F86: 1:20016,2:20016,3:20016,4:20016,5:20016
A87: 85 | B87: 85 | D87: 5 | E87: 20016#20016#20016#20016#20017 | F87: 1:20016,2:20016,3:20016,4:20016,5:20017 | G87: 20017 | H87: 50 | I87: 70 | J87: 10 | K87: 10
A88: 86 | B88: 86 | D88: 5 | E88: 20017#20017#20017#20017#20017 | F88: 1:20017,2:20017,3:20017,4:20017,5:20017
A89: 87 | B89: 87 | D89: 5 | E89: 20017#20017#20017#20017#20017 | F89: 1:20017,2:20017,3:20017,4:20017,5:20017
A90: 88 | B90: 88 | D90: 5 | E90: 20017#20017#20017#20017#20017 | F90: 1:20017,2:20017,3:20017,4:20017,5:20017
A91: 89 | B91: 89 | D91: 5 | E91: 20017#20017#20017#20017#20017 | F91: 1:20017,2:20017,3:20017,4:20017,5:20017
A92: 90 | B92: 90 | D92: 5 | E92: 20017#20017#20017#20017#20018 | F92: 1:20017,2:20017,3:20017,4:20017,5:20018 | G92: 20018 | H92: 50 | I92: 50 | J92: 10 | K92: 10
A93: 91 | B93: 91 | D93: 5 | E93: 20018#20018#20018#20018#20018 | F93: 1:20018,2:20018,3:20018,4:20018,5:20018
A94: 92 | B94: 92 | D94: 5 | E94: 20018#20018#20018#20018#20018 | F94: 1:20018,2:20018,3:20018,4:20018,5:20018
A95: 93 | B95: 93 | D95: 5 | E95: 20018#20018#20018#20018#20018 | F95: 1:20018,2:20018,3:20018,4:20018,5:20018
A96: 94 | B96: 94 | D96: 5 | E96: 20018#20018#20018#20018#20018 | F96: 1:20018,2:20018,3:20018,4:20018,5:20018
A97: 95 | B97: 95 | D97: 5 | E97: 20018#20018#20018#20018#20019 | F97: 1:20018,2:20018,3:20018,4:20018,5:20019 | G97: 20019 | H97: 50 | I97: 50 | J97: 10 | K97: 10
A98: 96 | B98: 96 | D98: 5 | E98: 20019#20019#20019#20019#20019 | F98: 1:20019,2:20019,3:20019,4:20019,5:20019
A99: 97 | B99: 97 | D99: 5 | E99: 20019#20019#20019#20019#20019 | F99: 1:20019,2:20019,3:20019,4:20019,5:20019
A100: 98 | B100: 98 | D100: 5 | E100: 20019#20019#20019#20019#20019 | F100: 1:20019,2:20019,3:20019,4:20019,5:20019
A101: 99 | B101: 99 | D101: 5 | E101: 20019#20019#20019#20019#20019 | F101: 1:20019,2:20019,3:20019,4:20019,5:20019
A102: 100 | B102: 100 | D102: 5 | E102: 20019#20019#20019#20019#20020 | F102: 1:20019,2:20019,3:20019,4:20019,5:20020 | G102: 20020 | H102: 50 | I102: 50 | J102: 10 | K102: 10

Sheet: 关卡产出表
A1: 层数 | B1: 经验 | C1: 铜板 | D1: 技能点
A2: id | B2: exp | C2: money | D2: skill_point
A3: 1 | B3: 1.5 | C3: 20 | D3: 10
A4: 2 | B4: 1.575 | C4: 30 | D4: 15
A5: 3 | B5: 1.7324999999999999 | C5: 40 | D5: 20
A6: 4 | B6: 1.9057500000000001 | C6: 50 | D6: 25
A7: 5 | B7: 2.0963250000000002 | C7: 60 | D7: 30
A8: 6 | B8: 2.3059574999999999 | C8: 70 | D8: 35
A9: 7 | B9: 2.5365532499999999 | C9: 80 | D9: 40
A10: 8 | B10: 2.7902085749999999 | C10: 90 | D10: 45
A11: 9 | B11: 3.0692294324999998 | C11: 100 | D11: 50
A12: 10 | B12: 3.3761523757499998 | C12: 110 | D12: 55
A13: 11 | B13: 3.7137676133249999 | C13: 120 | D13: 60
A14: 12 | B14: 4.0851443746575002 | C14: 130 | D14: 65
A15: 13 | B15: 4.4936588121232504 | C15: 140 | D15: 70
A16: 14 | B16: 4.9430246933355804 | C16: 150 | D16: 75
A17: 15 | B17: 5.4373271626691402 | C17: 160 | D17: 80
A18: 16 | B18: 5.9810598789360503 | C18: 170 | D18: 85
A19: 17 | B19: 6.5791658668296602 | C19: 180 | D19: 90
A20: 18 | B20: 7.2370824535126301 | C20: 190 | D20: 95
A21: 19 | B21: 7.9607906988638897 | C21: 200 | D21: 100
A22: 20 | B22: 8.7568697687502794 | C22: 210 | D22: 105
A23: 21 | B23: 9.6325567456253101 | C23: 220 | D23: 110
A24: 22 | B24: 10.5958124201878 | C24: 230 | D24: 115
A25: 23 | B25: 11.655393662206601 | C25: 240 | D25: 120
A26: 24 | B26: 12.8209330284273 | C26: 250 | D26: 125
A27: 25 | B27: 14.10302633127 | C27: 260 | D27: 130
A28: 26 | B28: 15.513328964396999 | C28: 270 | D28: 135
A29: 27 | B29: 17.064661860836701 | C29: 280 | D29: 140
A30: 28 | B30: 18.771128046920399 | C30: 290 | D30: 145
A31: 29 | B31: 20.6482408516124 | C31: 300 | D31: 150
A32: 30 | B32: 22.713064936773701 | C32: 310 | D32: 155
A33: 31 | B33: 24.984371430450999 | C33: 320 | D33: 160
A34: 32 | B34: 27.4828085734962 | C34: 330 | D34: 165
A35: 33 | B35: 30.231089430845799 | C35: 340 | D35: 170
A36: 34 | B36: 33.2541983739304 | C36: 350 | D36: 175
A37: 35 | B37: 36.5796182113234 | C37: 360 | D37: 180
A38: 36 | B38: 40.237580032455703 | C38: 370 | D38: 185
A39: 37 | B39: 44.2613380357013 | C39: 380 | D39: 190
A40: 38 | B40: 48.687471839271403 | C40: 390 | D40: 195
A41: 39 | B41: 53.556219023198601 | C41: 400 | D41: 200
A42: 40 | B42: 58.911840925518398 | C42: 410 | D42: 205
A43: 41 | B43: 64.803025018070301 | C43: 420 | D43: 210
A44: 42 | B44: 71.283327519877304 | C44: 430 | D44: 215
A45: 43 | B45: 78.411660271865102 | C45: 440 | D45: 220
A46: 44 | B46: 86.252826299051605 | C46: 450 | D46: 225
A47: 45 | B47: 94.878108928956706 | C47: 460 | D47: 230
A48: 46 | B48: 104.365919821852 | C48: 470 | D48: 235
A49: 47 | B49: 114.80251180403801 | C49: 480 | D49: 240
A50: 48 | B50: 126.28276298444101 | C50: 490 | D50: 245
A51: 49 | B51: 138.91103928288601 | C51: 500 | D51: 250
A52: 50 | B52: 152.80214321117401 | C52: 510 | D52: 255
A53: 51 | B53: 168.08235753229201 | C53: 520 | D53: 260
A54: 52 | B54: 184.89059328552099 | C54: 530 | D54: 265
A55: 53 | B55: 203.379652614073 | C55: 540 | D55: 270
A56: 54 | B56: 223.71761787547999 | C56: 550 | D56: 275
A57: 55 | B57: 246.08937966302801 | C57: 560 | D57: 280
A58: 56 | B58: 270.69831762933097 | C58: 570 | D58: 285
A59: 57 | B59: 297.76814939226398 | C59: 580 | D59: 290
A60: 58 | B60: 327.54496433149097 | C60: 590 | D60: 295
A61: 59 | B61: 360.29946076464 | C61: 600 | D61: 300
A62: 60 | B62: 396.329406841104 | C62: 610 | D62: 305
A63: 61 | B63: 435.962347525214 | C63: 620 | D63: 310
A64: 62 | B64: 479.55858227773598 | C64: 630 | D64: 315
A65: 63 | B65: 527.51444050550901 | C65: 640 | D65: 320
A66: 64 | B66: 580.265884556061 | C66: 650 | D66: 325
A67: 65 | B67: 638.29247301166697 | C67: 660 | D67: 330
A68: 66 | B68: 702.12172031283296 | C68: 670 | D68: 335
A69: 67 | B69: 772.33389234411595 | C69: 680 | D69: 340
A70: 68 | B70: 849.56728157852797 | C70: 690 | D70: 345
A71: 69 | B71: 934.524009736381 | C71: 700 | D71: 350
A72: 70 | B72: 1027.97641071002 | C72: 710 | D72: 355
A73: 71 | B73: 1130.77405178102 | C73: 720 | D73: 360
A74: 72 | B74: 1243.85145695912 | C74: 730 | D74: 365
A75: 73 | B75: 1368.2366026550401 | C75: 740 | D75: 370
A76: 74 | B76: 1505.06026292054 | C76: 750 | D76: 375
A77: 75 | B77: 1655.5662892125899 | C77: 760 | D77: 380
A78: 76 | B78: 1821.1229181338499 | C78: 770 | D78: 385
A79: 77 | B79: 2003.23520994724 | C79: 780 | D79: 390
A80: 78 | B80: 2203.5587309419602 | C80: 790 | D80: 395
A81: 79 | B81: 2423.9146040361602 | C81: 800 | D81: 400
A82: 80 | B82: 2666.3060644397701 | C82: 810 | D82: 405
A83: 81 | B83: 2932.9366708837501 | C83: 820 | D83: 410
A84: 82 | B84: 3226.2303379721302 | C84: 830 | D84: 415
A85: 83 | B85: 3548.8533717693399 | C85: 840 | D85: 420
A86: 84 | B86: 3903.73870894628 | C86: 850 | D86: 425
A87: 85 | B87: 4294.1125798409003 | C87: 860 | D87: 430
A88: 86 | B88: 4723.5238378249896 | C88: 870 | D88: 435
A89: 87 | B89: 5195.8762216075002 | C89: 880 | D89: 440
A90: 88 | B90: 5715.4638437682397 | C90: 890 | D90: 445
A91: 89 | B91: 6287.01022814507 | C91: 900 | D91: 450
A92: 90 | B92: 6915.71125095958 | C92: 910 | D92: 455
A93: 91 | B93: 7607.2823760555302 | C93: 920 | D93: 460
A94: 92 | B94: 8368.0106136610793 | C94: 930 | D94: 465
A95: 93 | B95: 9204.8116750271893 | C95: 940 | D95: 470
A96: 94 | B96: 10125.2928425299 | C96: 950 | D96: 475
A97: 95 | B97: 11137.822126782899 | C97: 960 | D97: 480
A98: 96 | B98: 12251.604339461201 | C98: 970 | D98: 485
A99: 97 | B99: 13476.7647734073 | C99: 980 | D99: 490
A100: 98 | B100: 14824.441250748099 | C100: 990 | D100: 495
A101: 99 | B101: 16306.8853758229 | C101: 1000 | D101: 500
A102: 100 | B102: 17937.5739134051 | C102: 1010 | D102: 505

Sheet: export
A1: sheet_name | B1: export_name | C1: merge_to
A2: 玩家升级经验表 | B2: player_upgrade
A3: 任务奖励表 | B3: task
A4: 大章表 | B4: chapter
A5: 任务扫荡产出表 | B5: wipe_out
A6: 任务卡牌配置表 | B6: task_config
A7: 任务怪物属性表 | B7: task_card
A8: 关卡卡牌配置表 | B8: pass_config
A9: 关卡怪物属性表 | B9: pass_card | C9: task_card
A10: 关卡产出表 | B10: pass_reward