Sheet: 经验副本卡牌配置表
A1: id | B1: 卡牌名称 | C1: 攻击力 | D1: 生命值 | E1: 闪避率 | F1: 暴击率
A2: id | B2: card_id | C2: atk | D2: hp | E2: dodge_rate | F2: crit_rate
A3: 50001 | B3: 1星经验元灵 | C3: 1339.2 | D3: =RC[-1]*3.5 -> 4687.2 | E3: 5 | F3: 5
A4: 50002 | B4: 2星经验元灵 | C4: 2042.4 | D4: =RC[-1]*3.5 -> 7148.4000000000005 | E4: 5 | F4: 5
A5: 50003 | B5: 2星经验元灵 | C5: 3287.7 | D5: =RC[-1]*3.5 -> 11506.949999999999 | E5: 5 | F5: 5
A6: 50004 | B6: 3星经验元灵 | C6: 5083 | D6: =RC[-1]*3.5 -> 17790.5 | E6: 10 | F6: 10
A7: 50005 | B7: 3星经验元灵 | C7: 7163 | D7: =RC[-1]*3.5 -> 25070.5 | E7: 5 | F7: 5
A8: 50006 | B8: 4星经验元灵 | C8: 9838.4 | D8: =RC[-1]*3.5 -> 34434.400000000001 | E8: 10 | F8: 10
A9: 50007 | B9: 4星经验元灵 | C9: 12542.4 | D9: =RC[-1]*3.5 -> 43898.400000000001 | E9: 5 | F9: 5
A10: 50008 | B10: 5星经验元灵 | C10: 14058.2 | D10: =RC[-1]*3.5 -> 49203.700000000004 | E10: 10 | F10: 10

Sheet: export
A1: sheet_name | B1: export_name | C1: merge_to
A2: 经验副本卡牌配置表 | B2: exp_pass_cards | C2: task_card