Sheet: 竞技排名奖励加成系数
A1: id | B1: 竞技排名 | C1: 对应等级排名奖励加成系数
A2: id | B2: ranking | C2: percent
A3: 1 | B3: 1 | C3: 95
A4: 2 | B4: 2 | C4: =R[-1]C-5 -> 90
A5: 3 | B5: 3 | C5: =R[-1]C-5 -> 85
A6: 4 | B6: 4 | C6: =R[-1]C-5 -> 80
A7: 5 | B7: 5 | C7: =R[-1]C-5 -> 75
A8: 6 | B8: 6 | C8: =R[-1]C-5 -> 70
A9: 7 | B9: 7 | C9: =R[-1]C-5 -> 65
A10: 8 | B10: 8 | C10: =R[-1]C-5 -> 60
A11: 9 | B11: 9 | C11: =R[-1]C-5 -> 55
A12: 10 | B12: 10 | C12: =R[-1]C-5 -> 50
A13: 11 | B13: 11 | C13: =R[-1]C-2 -> 48
A14: 12 | B14: 12 | C14: =R[-1]C-2 -> 46
A15: 13 | B15: 13 | C15: =R[-1]C-2 -> 44
A16: 14 | B16: 14 | C16: =R[-1]C-2 -> 42
A17: 15 | B17: 15 | C17: =R[-1]C-2 -> 40
A18: 16 | B18: 16 | C18: =R[-1]C-2 -> 38
A19: 17 | B19: 17 | C19: =R[-1]C-2 -> 36
A20: 18 | B20: 18 | C20: =R[-1]C-2 -> 34
A21: 19 | B21: 19 | C21: =R[-1]C-2 -> 32
A22: 20 | B22: 20 | C22: =R[-1]C-2 -> 30
A23: 21 | B23: 31 | C23: =R[-1]C-2 -> 28
A24: 22 | B24: 41 | C24: =R[-1]C-2 -> 26
A25: 23 | B25: 51 | C25: =R[-1]C-2 -> 24
A26: 24 | B26: 101 | C26: =R[-1]C-2 -> 22
A27: 25 | B27: 201 | C27: =R[-1]C-2 -> 20
A28: 26 | B28: 501 | C28: =R[-1]C-2 -> 18
A29: 27 | B29: 1001 | C29: =R[-1]C-2 -> 16
A30: 28 | B30: 2001 | C30: =R[-1]C-2 -> 14
A31: 29 | B31: 3001 | C31: =R[-1]C-2 -> 12
A32: 30 | B32: 4001 | C32: =R[-1]C-2 -> 10
A33: 31 | B33: 5001 | C33: =R[-1]C-2 -> 8
A34: 32 | B34: 8001 | C34: =R[-1]C-2 -> 6
A35: 33 | B35: 10001 | C35: =R[-1]C-2 -> 4

Sheet: 排名奖励
A1: 排名 | B1: 奖励仙丹
A2: id | B2: elixir
A3: 1 | B3: 80000
A4: 10 | B4: 50000
A5: 50 | B5: 30000
A6: 100 | B6: 20000
A7: 500 | B7: 10000

Sheet: export
A1: sheet_name | B1: export_name | C1: merge_to
A2: 竞技排名奖励加成系数 | B2: ranking_reward_factor
A3: 排名奖励 | B3: ranking_reward