Sheet: 卡牌升级表
A1: id | B1: 卡牌等级 | C1: 升级所需经验 | D1: 升级铜板消耗 | E1: 当前等级卡牌蕴含经验
A2: id | B2: lv | C2: exp_need | D2: money_need | E2: cur_exp
A3: 0 | B3: 0 | C3: 110 | D3: 115 | E3: 0
A4: 1 | B4: 1 | C4: =ROUND(R[-1]C*1.14,0) -> 125 | D4: =ROUND(R[-1]C*1.175,0) -> 135 | E4: =R[-1]C+R[-1]C[-2] -> 110
A5: 2 | B5: 2 | C5: =ROUND(R[-1]C*1.14,0) -> 143 | D5: =ROUND(R[-1]C*1.175,0) -> 159 | E5: =R[-1]C+R[-1]C[-2] -> 235
A6: 3 | B6: 3 | C6: =ROUND(R[-1]C*1.14,0) -> 163 | D6: =ROUND(R[-1]C*1.175,0) -> 187 | E6: =R[-1]C+R[-1]C[-2] -> 378
A7: 4 | B7: 4 | C7: =ROUND(R[-1]C*1.14,0) -> 186 | D7: =ROUND(R[-1]C*1.175,0) -> 220 | E7: =R[-1]C+R[-1]C[-2] -> 541
A8: 5 | B8: 5 | C8: =ROUND(R[-1]C*1.14,0) -> 212 | D8: =ROUND(R[-1]C*1.175,0) -> 259 | E8: =R[-1]C+R[-1]C[-2] -> 727
A9: 6 | B9: 6 | C9: =ROUND(R[-1]C*1.14,0) -> 242 | D9: =ROUND(R[-1]C*1.175,0) -> 304 | E9: =R[-1]C+R[-1]C[-2] -> 939
A10: 7 | B10: 7 | C10: =ROUND(R[-1]C*1.14,0) -> 276 | D10: =ROUND(R[-1]C*1.175,0) -> 357 | E10: =R[-1]C+R[-1]C[-2] -> 1181
A11: 8 | B11: 8 | C11: =ROUND(R[-1]C*1.14,0) -> 315 | D11: =ROUND(R[-1]C*1.175,0) -> 419 | E11: =R[-1]C+R[-1]C[-2] -> 1457
A12: 9 | B12: 9 | C12: =ROUND(R[-1]C*1.14,0) -> 359 | D12: =ROUND(R[-1]C*1.175,0) -> 492 | E12: =R[-1]C+R[-1]C[-2] -> 1772
A13: 10 | B13: 10 | C13: =ROUND(R[-1]C*1.14,0) -> 409 | D13: =ROUND(R[-1]C*1.175,0) -> 578 | E13: =R[-1]C+R[-1]C[-2] -> 2131
A14: 11 | B14: 11 | C14: =ROUND(R[-1]C*1.14,0) -> 466 | D14: =ROUND(R[-1]C*1.175,0) -> 679 | E14: =R[-1]C+R[-1]C[-2] -> 2540
A15: 12 | B15: 12 | C15: =ROUND(R[-1]C*1.14,0) -> 531 | D15: =ROUND(R[-1]C*1.175,0) -> 798 | E15: =R[-1]C+R[-1]C[-2] -> 3006
A16: 13 | B16: 13 | C16: =ROUND(R[-1]C*1.14,0) -> 605 | D16: =ROUND(R[-1]C*1.175,0) -> 938 | E16: =R[-1]C+R[-1]C[-2] -> 3537
A17: 14 | B17: 14 | C17: =ROUND(R[-1]C*1.14,0) -> 690 | D17: =ROUND(R[-1]C*1.175,0) -> 1102 | E17: =R[-1]C+R[-1]C[-2] -> 4142
A18: 15 | B18: 15 | C18: =ROUND(R[-1]C*1.14,0) -> 787 | D18: =ROUND(R[-1]C*1.175,0) -> 1295 | E18: =R[-1]C+R[-1]C[-2] -> 4832
A19: 16 | B19: 16 | C19: =ROUND(R[-1]C*1.14,0) -> 897 | D19: =ROUND(R[-1]C*1.175,0) -> 1522 | E19: =R[-1]C+R[-1]C[-2] -> 5619
A20: 17 | B20: 17 | C20: =ROUND(R[-1]C*1.14,0) -> 1023 | D20: =ROUND(R[-1]C*1.175,0) -> 1788 | E20: =R[-1]C+R[-1]C[-2] -> 6516
A21: 18 | B21: 18 | C21: =ROUND(R[-1]C*1.14,0) -> 1166 | D21: =ROUND(R[-1]C*1.175,0) -> 2101 | E21: =R[-1]C+R[-1]C[-2] -> 7539
A22: 19 | B22: 19 | C22: =ROUND(R[-1]C*1.14,0) -> 1329 | D22: =ROUND(R[-1]C*1.175,0) -> 2469 | E22: =R[-1]C+R[-1]C[-2] -> 8705
A23: 20 | B23: 20 | C23: =ROUND(R[-1]C*1.14,0) -> 1515 | D23: =ROUND(R[-1]C*1.175,0) -> 2901 | E23: =R[-1]C+R[-1]C[-2] -> 10034
A24: 21 | B24: 21 | C24: =ROUND(R[-1]C*1.14,0) -> 1727 | D24: =ROUND(R[-1]C*1.175,0) -> 3409 | E24: =R[-1]C+R[-1]C[-2] -> 11549
A25: 22 | B25: 22 | C25: =ROUND(R[-1]C*1.14,0) -> 1969 | D25: =ROUND(R[-1]C*1.175,0) -> 4006 | E25: =R[-1]C+R[-1]C[-2] -> 13276
A26: 23 | B26: 23 | C26: =ROUND(R[-1]C*1.14,0) -> 2245 | D26: =ROUND(R[-1]C*1.175,0) -> 4707 | E26: =R[-1]C+R[-1]C[-2] -> 15245
A27: 24 | B27: 24 | C27: =ROUND(R[-1]C*1.14,0) -> 2559 | D27: =ROUND(R[-1]C*1.175,0) -> 5531 | E27: =R[-1]C+R[-1]C[-2] -> 17490
A28: 25 | B28: 25 | C28: =ROUND(R[-1]C*1.14,0) -> 2917 | D28: =ROUND(R[-1]C*1.175,0) -> 6499 | E28: =R[-1]C+R[-1]C[-2] -> 20049
A29: 26 | B29: 26 | C29: =ROUND(R[-1]C*1.14,0) -> 3325 | D29: =ROUND(R[-1]C*1.175,0) -> 7636 | E29: =R[-1]C+R[-1]C[-2] -> 22966
A30: 27 | B30: 27 | C30: =ROUND(R[-1]C*1.14,0) -> 3791 | D30: =ROUND(R[-1]C*1.175,0) -> 8972 | E30: =R[-1]C+R[-1]C[-2] -> 26291
A31: 28 | B31: 28 | C31: =ROUND(R[-1]C*1.14,0) -> 4322 | D31: =ROUND(R[-1]C*1.175,0) -> 10542 | E31: =R[-1]C+R[-1]C[-2] -> 30082
A32: 29 | B32: 29 | C32: =ROUND(R[-1]C*1.14,0) -> 4927 | D32: =ROUND(R[-1]C*1.175,0) -> 12387 | E32: =R[-1]C+R[-1]C[-2] -> 34404
A33: 30 | B33: 30 | C33: =ROUND(R[-1]C*1.14,0) -> 5617 | D33: =ROUND(R[-1]C*1.175,0) -> 14555 | E33: =R[-1]C+R[-1]C[-2] -> 39331
A34: 31 | B34: 31 | C34: =ROUND(R[-1]C*1.14,0) -> 6403 | D34: =ROUND(R[-1]C*1.175,0) -> 17102 | E34: =R[-1]C+R[-1]C[-2] -> 44948
A35: 32 | B35: 32 | C35: =ROUND(R[-1]C*1.14,0) -> 7299 | D35: =ROUND(R[-1]C*1.175,0) -> 20095 | E35: =R[-1]C+R[-1]C[-2] -> 51351
A36: 33 | B36: 33 | C36: =ROUND(R[-1]C*1.14,0) -> 8321 | D36: =ROUND(R[-1]C*1.175,0) -> 23612 | E36: =R[-1]C+R[-1]C[-2] -> 58650
A37: 34 | B37: 34 | C37: =ROUND(R[-1]C*1.14,0) -> 9486 | D37: =ROUND(R[-1]C*1.175,0) -> 27744 | E37: =R[-1]C+R[-1]C[-2] -> 66971
A38: 35 | B38: 35 | C38: =ROUND(R[-1]C*1.14,0) -> 10814 | D38: =ROUND(R[-1]C*1.175,0) -> 32599 | E38: =R[-1]C+R[-1]C[-2] -> 76457
A39: 36 | B39: 36 | C39: =ROUND(R[-1]C*1.14,0) -> 12328 | D39: =ROUND(R[-1]C*1.175,0) -> 38304 | E39: =R[-1]C+R[-1]C[-2] -> 87271
A40: 37 | B40: 37 | C40: =ROUND(R[-1]C*1.14,0) -> 14054 | D40: =ROUND(R[-1]C*1.175,0) -> 45007 | E40: =R[-1]C+R[-1]C[-2] -> 99599
A41: 38 | B41: 38 | C41: =ROUND(R[-1]C*1.14,0) -> 16022 | D41: =ROUND(R[-1]C*1.175,0) -> 52883 | E41: =R[-1]C+R[-1]C[-2] -> 113653
A42: 39 | B42: 39 | C42: =ROUND(R[-1]C*1.14,0) -> 18265 | D42: =ROUND(R[-1]C*1.175,0) -> 62138 | E42: =R[-1]C+R[-1]C[-2] -> 129675
A43: 40 | B43: 40 | C43: =ROUND(R[-1]C*1.14,0) -> 20822 | D43: =ROUND(R[-1]C*1.175,0) -> 73012 | E43: =R[-1]C+R[-1]C[-2] -> 147940
A44: 41 | B44: 41 | C44: =ROUND(R[-1]C*1.14,0) -> 23737 | D44: =ROUND(R[-1]C*1.175,0) -> 85789 | E44: =R[-1]C+R[-1]C[-2] -> 168762
A45: 42 | B45: 42 | C45: =ROUND(R[-1]C*1.14,0) -> 27060 | D45: =ROUND(R[-1]C*1.175,0) -> 100802 | E45: =R[-1]C+R[-1]C[-2] -> 192499
A46: 43 | B46: 43 | C46: =ROUND(R[-1]C*1.14,0) -> 30848 | D46: =ROUND(R[-1]C*1.175,0) -> 118442 | E46: =R[-1]C+R[-1]C[-2] -> 219559
A47: 44 | B47: 44 | C47: =ROUND(R[-1]C*1.14,0) -> 35167 | D47: =ROUND(R[-1]C*1.175,0) -> 139169 | E47: =R[-1]C+R[-1]C[-2] -> 250407
A48: 45 | B48: 45 | C48: =ROUND(R[-1]C*1.14,0) -> 40090 | D48: =ROUND(R[-1]C*1.175,0) -> 163524 | E48: =R[-1]C+R[-1]C[-2] -> 285574
A49: 46 | B49: 46 | C49: =ROUND(R[-1]C*1.14,0) -> 45703 | D49: =ROUND(R[-1]C*1.175,0) -> 192141 | E49: =R[-1]C+R[-1]C[-2] -> 325664
A50: 47 | B50: 47 | C50: =ROUND(R[-1]C*1.14,0) -> 52101 | D50: =ROUND(R[-1]C*1.175,0) -> 225766 | E50: =R[-1]C+R[-1]C[-2] -> 371367
A51: 48 | B51: 48 | C51: =ROUND(R[-1]C*1.14,0) -> 59395 | D51: =ROUND(R[-1]C*1.175,0) -> 265275 | E51: =R[-1]C+R[-1]C[-2] -> 423468
A52: 49 | B52: 49 | C52: =ROUND(R[-1]C*1.14,0) -> 67710 | D52: =ROUND(R[-1]C*1.175,0) -> 311698 | E52: =R[-1]C+R[-1]C[-2] -> 482863
A53: 50 | B53: 50 | C53: =ROUND(R[-1]C*1.14,0) -> 77189 | D53: =ROUND(R[-1]C*1.175,0) -> 366245 | E53: =R[-1]C+R[-1]C[-2] -> 550573
A54: 51 | B54: 51 | C54: =ROUND(R[-1]C*1.14,0) -> 87995 | D54: =ROUND(R[-1]C*1.175,0) -> 430338 | E54: =R[-1]C+R[-1]C[-2] -> 627762
A55: 52 | B55: 52 | C55: =ROUND(R[-1]C*1.14,0) -> 100314 | D55: =ROUND(R[-1]C*1.175,0) -> 505647 | E55: =R[-1]C+R[-1]C[-2] -> 715757
A56: 53 | B56: 53 | C56: =ROUND(R[-1]C*1.14,0) -> 114358 | D56: =ROUND(R[-1]C*1.175,0) -> 594135 | E56: =R[-1]C+R[-1]C[-2] -> 816071
A57: 54 | B57: 54 | C57: =ROUND(R[-1]C*1.14,0) -> 130368 | D57: =ROUND(R[-1]C*1.175,0) -> 698109 | E57: =R[-1]C+R[-1]C[-2] -> 930429
A58: 55 | B58: 55 | C58: =ROUND(R[-1]C*1.14,0) -> 148620 | D58: =ROUND(R[-1]C*1.175,0) -> 820278 | E58: =R[-1]C+R[-1]C[-2] -> 1060797
A59: 56 | B59: 56 | C59: =ROUND(R[-1]C*1.14,0) -> 169427 | D59: =ROUND(R[-1]C*1.175,0) -> 963827 | E59: =R[-1]C+R[-1]C[-2] -> 1209417
A60: 57 | B60: 57 | C60: =ROUND(R[-1]C*1.14,0) -> 193147 | D60: =ROUND(R[-1]C*1.175,0) -> 1132497 | E60: =R[-1]C+R[-1]C[-2] -> 1378844
A61: 58 | B61: 58 | C61: =ROUND(R[-1]C*1.14,0) -> 220188 | D61: =ROUND(R[-1]C*1.175,0) -> 1330684 | E61: =R[-1]C+R[-1]C[-2] -> 1571991
A62: 59 | B62: 59 | C62: =ROUND(R[-1]C*1.14,0) -> 251014 | D62: =ROUND(R[-1]C*1.175,0) -> 1563554 | E62: =R[-1]C+R[-1]C[-2] -> 1792179
A63: 60 | B63: 60 | C63: =ROUND(R[-1]C*1.14,0) -> 286156 | D63: =ROUND(R[-1]C*1.175,0) -> 1837176 | E63: =R[-1]C+R[-1]C[-2] -> 2043193
A64: 61 | B64: 61 | C64: =ROUND(R[-1]C*1.14,0) -> 326218 | D64: =ROUND(R[-1]C*1.175,0) -> 2158682 | E64: =R[-1]C+R[-1]C[-2] -> 2329349
A65: 62 | B65: 62 | C65: =ROUND(R[-1]C*1.14,0) -> 371889 | D65: =ROUND(R[-1]C*1.175,0) -> 2536451 | E65: =R[-1]C+R[-1]C[-2] -> 2655567
A66: 63 | B66: 63 | C66: =ROUND(R[-1]C*1.14,0) -> 423953 | D66: =ROUND(R[-1]C*1.175,0) -> 2980330 | E66: =R[-1]C+R[-1]C[-2] -> 3027456
A67: 64 | B67: 64 | C67: =ROUND(R[-1]C*1.14,0) -> 483306 | D67: =ROUND(R[-1]C*1.175,0) -> 3501888 | E67: =R[-1]C+R[-1]C[-2] -> 3451409
A68: 65 | B68: 65 | C68: =ROUND(R[-1]C*1.14,0) -> 550969 | D68: =ROUND(R[-1]C*1.175,0) -> 4114718 | E68: =R[-1]C+R[-1]C[-2] -> 3934715
A69: 66 | B69: 66 | C69: =ROUND(R[-1]C*1.14,0) -> 628105 | D69: =ROUND(R[-1]C*1.175,0) -> 4834794 | E69: =R[-1]C+R[-1]C[-2] -> 4485684
A70: 67 | B70: 67 | C70: =ROUND(R[-1]C*1.14,0) -> 716040 | D70: =ROUND(R[-1]C*1.175,0) -> 5680883 | E70: =R[-1]C+R[-1]C[-2] -> 5113789
A71: 68 | B71: 68 | C71: =ROUND(R[-1]C*1.14,0) -> 816286 | D71: =ROUND(R[-1]C*1.175,0) -> 6675038 | E71: =R[-1]C+R[-1]C[-2] -> 5829829
A72: 69 | B72: 69 | C72: =ROUND(R[-1]C*1.14,0) -> 930566 | D72: =ROUND(R[-1]C*1.175,0) -> 7843170 | E72: =R[-1]C+R[-1]C[-2] -> 6646115
A73: 70 | B73: 70 | C73: =ROUND(R[-1]C*1.14,0) -> 1060845 | D73: =ROUND(R[-1]C*1.175,0) -> 9215725 | E73: =R[-1]C+R[-1]C[-2] -> 7576681

Sheet: export
A1: sheet_name | B1: export_name | C1: merge_to
A2: 卡牌升级表 | B2: card_grow