Sheet: 基础属性成长表
A1: id | B1: 等级 | C1: 初始参考系数 | D1: 实际增量系数
A2: id | B2: lv | C2: base | D2: factor
A3: 1 | B3: 1 | C3: 1.1 | D3: 1
A4: 2 | B4: 2 | C4: =R[-1]C-0.001 -> 1.099 | D4: 1.1
A5: 3 | B5: 3 | C5: =R[-1]C-0.001 -> 1.098 | D5: =ROUND(R[-1]C[-1]*R[-1]C,3) -> 1.209
A6: 4 | B6: 4 | C6: =R[-1]C-0.001 -> 1.097 | D6: =ROUND(R[-1]C[-1]*R[-1]C,3) -> 1.327
A7: 5 | B7: 5 | C7: =R[-1]C-0.001 -> 1.096 | D7: =ROUND(R[-1]C[-1]*R[-1]C,3) -> 1.456
A8: 6 | B8: 6 | C8: =R[-1]C-0.001 -> 1.095 | D8: =ROUND(R[-1]C[-1]*R[-1]C,3) -> 1.596
A9: 7 | B9: 7 | C9: =R[-1]C-0.001 -> 1.094 | D9: =ROUND(R[-1]C[-1]*R[-1]C,3) -> 1.748
A10: 8 | B10: 8 | C10: =R[-1]C-0.001 -> 1.093 | D10: =ROUND(R[-1]C[-1]*R[-1]C,3) -> 1.912
A11: 9 | B11: 9 | C11: =R[-1]C-0.001 -> 1.092 | D11: =ROUND(R[-1]C[-1]*R[-1]C,3) -> 2.09
A12: 10 | B12: 10 | C12: =R[-1]C-0.001 -> 1.091 | D12: =ROUND(R[-1]C[-1]*R[-1]C,3) -> 2.282
A13: 11 | B13: 11 | C13: =R[-1]C-0.001 -> 1.09 | D13: =ROUND(R[-1]C[-1]*R[-1]C,3) -> 2.49
A14: 12 | B14: 12 | C14: =R[-1]C-0.001 -> 1.089 | D14: =ROUND(R[-1]C[-1]*R[-1]C,3) -> 2.714
A15: 13 | B15: 13 | C15: =R[-1]C-0.001 -> 1.088 | D15: =ROUND(R[-1]C[-1]*R[-1]C,3) -> 2.956
A16: 14 | B16: 14 | C16: =R[-1]C-0.001 -> 1.087 | D16: =ROUND(R[-1]C[-1]*R[-1]C,3) -> 3.216
A17: 15 | B17: 15 | C17: =R[-1]C-0.001 -> 1.086 | D17: =ROUND(R[-1]C[-1]*R[-1]C,3) -> 3.496
A18: 16 | B18: 16 | C18: =R[-1]C-0.001 -> 1.085 | D18: =ROUND(R[-1]C[-1]*R[-1]C,3) -> 3.797
A19: 17 | B19: 17 | C19: =R[-1]C-0.001 -> 1.084 | D19: =ROUND(R[-1]C[-1]*R[-1]C,3) -> 4.12
A20: 18 | B20: 18 | C20: =R[-1]C-0.001 -> 1.083 | D20: =ROUND(R[-1]C[-1]*R[-1]C,3) -> 4.466
A21: 19 | B21: 19 | C21: =R[-1]C-0.001 -> 1.082 | D21: =ROUND(R[-1]C[-1]*R[-1]C,3) -> 4.837
A22: 20 | B22: 20 | C22: =R[-1]C-0.001 -> 1.081 | D22: =ROUND(R[-1]C[-1]*R[-1]C,3) -> 5.234
A23: 21 | B23: 21 | C23: =R[-1]C-0.001 -> 1.08 | D23: =ROUND(R[-1]C[-1]*R[-1]C,3) -> 5.658
A24: 22 | B24: 22 | C24: =R[-1]C-0.001 -> 1.079 | D24: =ROUND(R[-1]C[-1]*R[-1]C,3) -> 6.111
A25: 23 | B25: 23 | C25: =R[-1]C-0.001 -> 1.078 | D25: =ROUND(R[-1]C[-1]*R[-1]C,3) -> 6.594
A26: 24 | B26: 24 | C26: =R[-1]C-0.001 -> 1.077 | D26: =ROUND(R[-1]C[-1]*R[-1]C,3) -> 7.108
A27: 25 | B27: 25 | C27: =R[-1]C-0.001 -> 1.076 | D27: =ROUND(R[-1]C[-1]*R[-1]C,3) -> 7.655
A28: 26 | B28: 26 | C28: =R[-1]C-0.001 -> 1.075 | D28: =ROUND(R[-1]C[-1]*R[-1]C,3) -> 8.237
A29: 27 | B29: 27 | C29: =R[-1]C-0.001 -> 1.074 | D29: =ROUND(R[-1]C[-1]*R[-1]C,3) -> 8.855
A30: 28 | B30: 28 | C30: =R[-1]C-0.001 -> 1.073 | D30: =ROUND(R[-1]C[-1]*R[-1]C,3) -> 9.51
A31: 29 | B31: 29 | C31: =R[-1]C-0.001 -> 1.072 | D31: =ROUND(R[-1]C[-1]*R[-1]C,3) -> 10.204
A32: 30 | B32: 30 | C32: =R[-1]C-0.001 -> 1.071 | D32: =ROUND(R[-1]C[-1]*R[-1]C,3) -> 10.939
A33: 31 | B33: 31 | C33: =R[-1]C-0.001 -> 1.07 | D33: =ROUND(R[-1]C[-1]*R[-1]C,3) -> 11.716
A34: 32 | B34: 32 | C34: =R[-1]C-0.001 -> 1.069 | D34: =ROUND(R[-1]C[-1]*R[-1]C,3) -> 12.536
A35: 33 | B35: 33 | C35: =R[-1]C-0.001 -> 1.068 | D35: =ROUND(R[-1]C[-1]*R[-1]C,3) -> 13.401
A36: 34 | B36: 34 | C36: =R[-1]C-0.001 -> 1.067 | D36: =ROUND(R[-1]C[-1]*R[-1]C,3) -> 14.312
A37: 35 | B37: 35 | C37: =R[-1]C-0.001 -> 1.066 | D37: =ROUND(R[-1]C[-1]*R[-1]C,3) -> 15.271
A38: 36 | B38: 36 | C38: =R[-1]C-0.001 -> 1.065 | D38: =ROUND(R[-1]C[-1]*R[-1]C,3) -> 16.279
A39: 37 | B39: 37 | C39: =R[-1]C-0.001 -> 1.064 | D39: =ROUND(R[-1]C[-1]*R[-1]C,3) -> 17.337
A40: 38 | B40: 38 | C40: =R[-1]C-0.001 -> 1.063 | D40: =ROUND(R[-1]C[-1]*R[-1]C,3) -> 18.447
A41: 39 | B41: 39 | C41: =R[-1]C-0.001 -> 1.062 | D41: =ROUND(R[-1]C[-1]*R[-1]C,3) -> 19.609
A42: 40 | B42: 40 | C42: =R[-1]C-0.001 -> 1.061 | D42: =ROUND(R[-1]C[-1]*R[-1]C,3) -> 20.825
A43: 41 | B43: 41 | C43: =R[-1]C-0.001 -> 1.06 | D43: =ROUND(R[-1]C[-1]*R[-1]C,3) -> 22.095
A44: 42 | B44: 42 | C44: =R[-1]C-0.001 -> 1.059 | D44: =ROUND(R[-1]C[-1]*R[-1]C,3) -> 23.421
A45: 43 | B45: 43 | C45: =R[-1]C-0.001 -> 1.058 | D45: =ROUND(R[-1]C[-1]*R[-1]C,3) -> 24.803
A46: 44 | B46: 44 | C46: =R[-1]C-0.001 -> 1.057 | D46: =ROUND(R[-1]C[-1]*R[-1]C,3) -> 26.242
A47: 45 | B47: 45 | C47: =R[-1]C-0.001 -> 1.05600000000001 | D47: =ROUND(R[-1]C[-1]*R[-1]C,3) -> 27.738
A48: 46 | B48: 46 | C48: =R[-1]C-0.001 -> 1.05500000000001 | D48: =ROUND(R[-1]C[-1]*R[-1]C,3) -> 29.291
A49: 47 | B49: 47 | C49: =R[-1]C-0.001 -> 1.05400000000001 | D49: =ROUND(R[-1]C[-1]*R[-1]C,3) -> 30.902
A50: 48 | B50: 48 | C50: =R[-1]C-0.001 -> 1.05300000000001 | D50: =ROUND(R[-1]C[-1]*R[-1]C,3) -> 32.571
A51: 49 | B51: 49 | C51: =R[-1]C-0.001 -> 1.05200000000001 | D51: =ROUND(R[-1]C[-1]*R[-1]C,3) -> 34.297
A52: 50 | B52: 50 | C52: =R[-1]C-0.001 -> 1.05100000000001 | D52: =ROUND(R[-1]C[-1]*R[-1]C,3) -> 36.08
A53: 51 | B53: 51 | C53: =R[-1]C-0.001 -> 1.05000000000001 | D53: =ROUND(R[-1]C[-1]*R[-1]C,3) -> 37.92
A54: 52 | B54: 52 | C54: =R[-1]C-0.001 -> 1.04900000000001 | D54: =ROUND(R[-1]C[-1]*R[-1]C,3) -> 39.816
A55: 53 | B55: 53 | C55: =R[-1]C-0.001 -> 1.04800000000001 | D55: =ROUND(R[-1]C[-1]*R[-1]C,3) -> 41.767
A56: 54 | B56: 54 | C56: =R[-1]C-0.001 -> 1.04700000000001 | D56: =ROUND(R[-1]C[-1]*R[-1]C,3) -> 43.772
A57: 55 | B57: 55 | C57: =R[-1]C-0.001 -> 1.04600000000001 | D57: =ROUND(R[-1]C[-1]*R[-1]C,3) -> 45.829
A58: 56 | B58: 56 | C58: =R[-1]C-0.001 -> 1.04500000000001 | D58: =ROUND(R[-1]C[-1]*R[-1]C,3) -> 47.937
A59: 57 | B59: 57 | C59: =R[-1]C-0.001 -> 1.04400000000001 | D59: =ROUND(R[-1]C[-1]*R[-1]C,3) -> 50.094
A60: 58 | B60: 58 | C60: =R[-1]C-0.001 -> 1.04300000000001 | D60: =ROUND(R[-1]C[-1]*R[-1]C,3) -> 52.298
A61: 59 | B61: 59 | C61: =R[-1]C-0.001 -> 1.04200000000001 | D61: =ROUND(R[-1]C[-1]*R[-1]C,3) -> 54.547
A62: 60 | B62: 60 | C62: =R[-1]C-0.001 -> 1.04100000000001 | D62: =ROUND(R[-1]C[-1]*R[-1]C,3) -> 56.838
A63: 61 | B63: 61 | C63: =R[-1]C-0.001 -> 1.04000000000001 | D63: =ROUND(R[-1]C[-1]*R[-1]C,3) -> 59.168
A64: 62 | B64: 62 | C64: =R[-1]C-0.001 -> 1.03900000000001 | D64: =ROUND(R[-1]C[-1]*R[-1]C,3) -> 61.535
A65: 63 | B65: 63 | C65: =R[-1]C-0.001 -> 1.03800000000001 | D65: =ROUND(R[-1]C[-1]*R[-1]C,3) -> 63.935
A66: 64 | B66: 64 | C66: =R[-1]C-0.001 -> 1.03700000000001 | D66: =ROUND(R[-1]C[-1]*R[-1]C,3) -> 66.365
A67: 65 | B67: 65 | C67: =R[-1]C-0.001 -> 1.03600000000001 | D67: =ROUND(R[-1]C[-1]*R[-1]C,3) -> 68.821
A68: 66 | B68: 66 | C68: =R[-1]C-0.001 -> 1.03500000000001 | D68: =ROUND(R[-1]C[-1]*R[-1]C,3) -> 71.299
A69: 67 | B69: 67 | C69: =R[-1]C-0.001 -> 1.03400000000001 | D69: =ROUND(R[-1]C[-1]*R[-1]C,3) -> 73.794
A70: 68 | B70: 68 | C70: =R[-1]C-0.001 -> 1.03300000000001 | D70: =ROUND(R[-1]C[-1]*R[-1]C,3) -> 76.303
A71: 69 | B71: 69 | C71: =R[-1]C-0.001 -> 1.03200000000001 | D71: =ROUND(R[-1]C[-1]*R[-1]C,3) -> 78.821
A72: 70 | B72: 70 | C72: =R[-1]C-0.001 -> 1.03100000000001 | D72: =ROUND(R[-1]C[-1]*R[-1]C,3) -> 81.343

Sheet: export
A1: sheet_name | B1: export_name | C1: merge_to
A2: 基础属性成长表 | B2: factors