Sheet: 卡牌进阶配置表
A1: id | B1: 当前星级 | C1: 素材卡牌星级 | D1: 所需铜板 | E1: 每张卡提供的概率 | F1: 最多卡牌数量 | G1: 不成功卡牌数量 | H1: 消耗精元
A2: id | B2: star | C2: source_card_star | D2: money_need | E2: rate_per_card | F2: max_num | G2: no_work_count | H2: super_honor
A3: 1 | B3: 1 | C3: 1 | D3: 5000 | E3: 10 | F3: 10 | G3: 0 | H3: 0
A4: 2 | B4: 2 | C4: 2 | D4: 10000 | E4: 8 | F4: 13 | G4: 0 | H4: 0
A5: 3 | B5: 3 | C5: 3 | D5: 20000 | E5: 4 | F5: 25 | G5: 0 | H5: 0
A6: 4 | B6: 4 | C6: 4 | D6: 50000 | E6: 6 | F6: 17 | G6: 10 | H6: 4
A7: 5 | B7: 5 | C7: 5 | D7: 100000 | E7: 35 | F7: 3 | G7: 0 | H7: 15
A8: 6 | B8: 6 | C8: 5 | D8: 200000 | E8: 15 | F8: 7 | G8: 0 | H8: 40

Sheet: 高星级卡牌进阶概率配置表
A1: 概率分布 | B1: 实际概率 | C1: 系数
A2: id | B2: rate | C2: factor
A3: 1 | B3: =RC[-1]*RC[1] -> 0.3 | C3: 0.3
A4: 2 | B4: =ROUND(RC[-1]*RC[1],0) -> 1 | C4: =R[-1]C+0.005 -> 0.30499999999999999
A5: 3 | B5: =ROUND(RC[-1]*RC[1],0) -> 1 | C5: =R[-1]C+0.005 -> 0.31
A6: 4 | B6: =ROUND(RC[-1]*RC[1],0) -> 1 | C6: =R[-1]C+0.005 -> 0.315
A7: 5 | B7: =ROUND(RC[-1]*RC[1],0) -> 2 | C7: =R[-1]C+0.005 -> 0.32
A8: 6 | B8: =ROUND(RC[-1]*RC[1],0) -> 2 | C8: =R[-1]C+0.005 -> 0.32500000000000001
A9: 7 | B9: =ROUND(RC[-1]*RC[1],0) -> 2 | C9: =R[-1]C+0.005 -> 0.33
A10: 8 | B10: =ROUND(RC[-1]*RC[1],0) -> 3 | C10: =R[-1]C+0.005 -> 0.33500000000000002
A11: 9 | B11: =ROUND(RC[-1]*RC[1],0) -> 3 | C11: =R[-1]C+0.005 -> 0.34
A12: 10 | B12: =ROUND(RC[-1]*RC[1],0) -> 3 | C12: =R[-1]C+0.005 -> 0.34500000000000003
A13: 11 | B13: =ROUND(RC[-1]*RC[1],0) -> 4 | C13: =R[-1]C+0.005 -> 0.35000000000000003
A14: 12 | B14: =ROUND(RC[-1]*RC[1],0) -> 4 | C14: =R[-1]C+0.005 -> 0.35500000000000004
A15: 13 | B15: =ROUND(RC[-1]*RC[1],0) -> 5 | C15: =R[-1]C+0.005 -> 0.36000000000000004
A16: 14 | B16: =ROUND(RC[-1]*RC[1],0) -> 5 | C16: =R[-1]C+0.005 -> 0.36500000000000005
A17: 15 | B17: =ROUND(RC[-1]*RC[1],0) -> 6 | C17: =R[-1]C+0.005 -> 0.37000000000000005
A18: 16 | B18: =ROUND(RC[-1]*RC[1],0) -> 6 | C18: =R[-1]C+0.005 -> 0.37500000000000006
A19: 17 | B19: =ROUND(RC[-1]*RC[1],0) -> 6 | C19: =R[-1]C+0.005 -> 0.38000000000000006
A20: 18 | B20: =ROUND(RC[-1]*RC[1],0) -> 7 | C20: =R[-1]C+0.005 -> 0.38500000000000006
A21: 19 | B21: =ROUND(RC[-1]*RC[1],0) -> 7 | C21: =R[-1]C+0.005 -> 0.39000000000000007
A22: 20 | B22: =ROUND(RC[-1]*RC[1],0) -> 8 | C22: =R[-1]C+0.008 -> 0.39800000000000008
A23: 21 | B23: =ROUND(RC[-1]*RC[1],0) -> 9 | C23: =R[-1]C+0.008 -> 0.40600000000000008
A24: 22 | B24: =ROUND(RC[-1]*RC[1],0) -> 9 | C24: =R[-1]C+0.008 -> 0.41400000000000009
A25: 23 | B25: =ROUND(RC[-1]*RC[1],0) -> 10 | C25: =R[-1]C+0.008 -> 0.4220000000000001
A26: 24 | B26: =ROUND(RC[-1]*RC[1],0) -> 10 | C26: =R[-1]C+0.008 -> 0.4300000000000001
A27: 25 | B27: =ROUND(RC[-1]*RC[1],0) -> 11 | C27: =R[-1]C+0.008 -> 0.43800000000000011
A28: 26 | B28: =ROUND(RC[-1]*RC[1],0) -> 12 | C28: =R[-1]C+0.008 -> 0.44600000000000012
A29: 27 | B29: =ROUND(RC[-1]*RC[1],0) -> 12 | C29: =R[-1]C+0.008 -> 0.45400000000000013
A30: 28 | B30: =ROUND(RC[-1]*RC[1],0) -> 13 | C30: =R[-1]C+0.008 -> 0.46200000000000013
A31: 29 | B31: =ROUND(RC[-1]*RC[1],0) -> 14 | C31: =R[-1]C+0.008 -> 0.47000000000000014
A32: 30 | B32: =ROUND(RC[-1]*RC[1],0) -> 14 | C32: =R[-1]C+0.008 -> 0.47800000000000015
A33: 31 | B33: =ROUND(RC[-1]*RC[1],0) -> 15 | C33: =R[-1]C+0.008 -> 0.48600000000000015
A34: 32 | B34: =ROUND(RC[-1]*RC[1],0) -> 16 | C34: =R[-1]C+0.008 -> 0.49400000000000016
A35: 33 | B35: =ROUND(RC[-1]*RC[1],0) -> 17 | C35: =R[-1]C+0.008 -> 0.50200000000000011
A36: 34 | B36: =ROUND(RC[-1]*RC[1],0) -> 17 | C36: =R[-1]C+0.008 -> 0.51000000000000012
A37: 35 | B37: =ROUND(RC[-1]*RC[1],0) -> 18 | C37: =R[-1]C+0.008 -> 0.51800000000000013
A38: 36 | B38: =ROUND(RC[-1]*RC[1],0) -> 19 | C38: =R[-1]C+0.008 -> 0.52600000000000013
A39: 37 | B39: =ROUND(RC[-1]*RC[1],0) -> 20 | C39: =R[-1]C+0.008 -> 0.53400000000000014
A40: 38 | B40: =ROUND(RC[-1]*RC[1],0) -> 21 | C40: =R[-1]C+0.008 -> 0.54200000000000015
A41: 39 | B41: =ROUND(RC[-1]*RC[1],0) -> 21 | C41: =R[-1]C+0.008 -> 0.55000000000000016
A42: 40 | B42: =ROUND(RC[-1]*RC[1],0) -> 22 | C42: =R[-1]C+0.01 -> 0.56000000000000016
A43: 41 | B43: =ROUND(RC[-1]*RC[1],0) -> 23 | C43: =R[-1]C+0.01 -> 0.57000000000000017
A44: 42 | B44: =ROUND(RC[-1]*RC[1],0) -> 24 | C44: =R[-1]C+0.01 -> 0.58000000000000018
A45: 43 | B45: =ROUND(RC[-1]*RC[1],0) -> 25 | C45: =R[-1]C+0.01 -> 0.59000000000000019
A46: 44 | B46: =ROUND(RC[-1]*RC[1],0) -> 26 | C46: =R[-1]C+0.01 -> 0.6000000000000002
A47: 45 | B47: =ROUND(RC[-1]*RC[1],0) -> 27 | C47: =R[-1]C+0.01 -> 0.61000000000000021
A48: 46 | B48: =ROUND(RC[-1]*RC[1],0) -> 29 | C48: =R[-1]C+0.01 -> 0.62000000000000022
A49: 47 | B49: =ROUND(RC[-1]*RC[1],0) -> 30 | C49: =R[-1]C+0.01 -> 0.63000000000000023
A50: 48 | B50: =ROUND(RC[-1]*RC[1],0) -> 31 | C50: =R[-1]C+0.01 -> 0.64000000000000024
A51: 49 | B51: =ROUND(RC[-1]*RC[1],0) -> 32 | C51: =R[-1]C+0.018 -> 0.65800000000000025
A52: 50 | B52: =ROUND(RC[-1]*RC[1],0) -> 34 | C52: =R[-1]C+0.018 -> 0.67600000000000027
A53: 51 | B53: =ROUND(RC[-1]*RC[1],0) -> 35 | C53: =R[-1]C+0.018 -> 0.69400000000000028
A54: 52 | B54: =ROUND(RC[-1]*RC[1],0) -> 37 | C54: =R[-1]C+0.018 -> 0.7120000000000003
A55: 53 | B55: =ROUND(RC[-1]*RC[1],0) -> 39 | C55: =R[-1]C+0.018 -> 0.73000000000000032
A56: 54 | B56: =ROUND(RC[-1]*RC[1],0) -> 40 | C56: =R[-1]C+0.018 -> 0.74800000000000033
A57: 55 | B57: =ROUND(RC[-1]*RC[1],0) -> 42 | C57: =R[-1]C+0.018 -> 0.76600000000000035
A58: 56 | B58: =ROUND(RC[-1]*RC[1],0) -> 44 | C58: =R[-1]C+0.018 -> 0.78400000000000036
A59: 57 | B59: =ROUND(RC[-1]*RC[1],0) -> 46 | C59: =R[-1]C+0.018 -> 0.80200000000000038
A60: 58 | B60: =ROUND(RC[-1]*RC[1],0) -> 48 | C60: =R[-1]C+0.018 -> 0.8200000000000004
A61: 59 | B61: =ROUND(RC[-1]*RC[1],0) -> 49 | C61: =R[-1]C+0.018 -> 0.83800000000000041
A62: 60 | B62: =ROUND(RC[-1]*RC[1],0) -> 51 | C62: =R[-1]C+0.018 -> 0.85600000000000043

Sheet: export
A1: sheet_name | B1: export_name | C1: merge_to
A2: 卡牌进阶配置表 | B2: star_upgrade
A3: 高星级卡牌进阶概率配置表 | B3: star_upgrade_rate