Sheet: vip等级配置表
A1: id | B1: vip等级 | C1: vip名称 | D1: 所需充值金额 | E1: 总金额
A2: id | B2: lv | C2: name | D2: cash | E2: total_cash
A3: 1 | B3: 1 | C3: Vip1 | D3: 10 | E3: 10
A4: 2 | B4: 2 | C4: Vip2 | D4: 50 | E4: =R[-1]C+RC[-1] -> 60
A5: 3 | B5: 3 | C5: Vip3 | D5: 100 | E5: =R[-1]C+RC[-1] -> 160
A6: 4 | B6: 4 | C6: Vip4 | D6: 200 | E6: =R[-1]C+RC[-1] -> 360
A7: 5 | B7: 5 | C7: Vip5 | D7: 500 | E7: =R[-1]C+RC[-1] -> 860
A8: 6 | B8: 6 | C8: Vip6 | D8: 1000 | E8: =R[-1]C+RC[-1] -> 1860
A9: 7 | B9: 7 | C9: Vip7 | D9: 2000 | E9: =R[-1]C+RC[-1] -> 3860
A10: 8 | B10: 8 | C10: Vip8 | D10: 5000 | E10: =R[-1]C+RC[-1] -> 8860
A11: 9 | B11: 9 | C11: Vip9 | D11: 8000 | E11: =R[-1]C+RC[-1] -> 16860
A12: 10 | B12: 10 | C12: Vip10 | D12: 10000 | E12: =R[-1]C+RC[-1] -> 26860
A13: 11 | B13: 11 | C13: Vip11 | D13: 20000 | E13: =R[-1]C+RC[-1] -> 46860
A14: 12 | B14: 12 | C14: Vip12 | D14: 50000 | E14: =R[-1]C+RC[-1] -> 96860

Sheet: export
A1: sheet_name | B1: export_name | C1: merge_to
A2: vip等级配置表 | B2: vip