Sheet: vip特权
A1: vip等级 | B1: 每日免费寻宝次数+ | C1: 每日经验元灵购买数量+ | D1: 每日体力购买次数+ | E1: 每日送出祝福次数+ | F1: 每日灵气采集次数+ | G1: 每日收到祝福次数+ | H1: 好友上限+ | I1: 每日有奖竞技次数+ | J1: 描述信息
A2: id | B2: lottery_free_count | C2: exp_card_count | D2: buy_power_count | E2: give_bless_count | F2: spirit_collect_count | G2: receive_bless_count | H2: friend_count | I2: challenge_count | J2: description
A3: 0 | B3: 0 | C3: 0 | D3: 0 | E3: 0 | F3: 0 | G3: 0 | H3: 0 | I3: 0
A4: 1 | B4: 1 | C4: 10 | D4: 1 | E4: 0 | F4: 0 | G4: 0 | H4: 0 | I4: 0
A5: 2 | B5: 2 | C5: =R[-1]C+10 -> 20 | D5: 2 | E5: 1 | F5: 0 | G5: 0 | H5: 0 | I5: 0 | J5: VIP2及以上，到达10级可跳过战斗
A6: 3 | B6: 3 | C6: =R[-1]C+10 -> 30 | D6: 3 | E6: 2 | F6: 1 | G6: 0 | H6: 0 | I6: 0
A7: 4 | B7: 4 | C7: =R[-1]C+10 -> 40 | D7: 4 | E7: 3 | F7: 2 | G7: 3 | H7: 0 | I7: 0
A8: 5 | B8: 5 | C8: =R[-1]C+10 -> 50 | D8: 5 | E8: 4 | F8: 3 | G8: 4 | H8: =R[-1]C+5 -> 5 | I8: 0
A9: 6 | B9: 6 | C9: =R[-1]C+10 -> 60 | D9: 6 | E9: 5 | F9: 4 | G9: 5 | H9: =R[-1]C+5 -> 10 | I9: 1
A10: 7 | B10: 7 | C10: =R[-1]C+10 -> 70 | D10: 7 | E10: 6 | F10: 5 | G10: 6 | H10: =R[-1]C+5 -> 15 | I10: 2
A11: 8 | B11: 8 | C11: =R[-1]C+10 -> 80 | D11: 8 | E11: 7 | F11: 6 | G11: 7 | H11: =R[-1]C+5 -> 20 | I11: 3
A12: 9 | B12: 9 | C12: =R[-1]C+10 -> 90 | D12: 9 | E12: 8 | F12: 7 | G12: 8 | H12: =R[-1]C+5 -> 25 | I12: 4
A13: 10 | B13: 10 | C13: =R[-1]C+10 -> 100 | D13: 10 | E13: 9 | F13: 8 | G13: 9 | H13: =R[-1]C+5 -> 30 | I13: 5
A14: 11 | B14: 10 | C14: =R[-1]C+10 -> 110 | D14: 11 | E14: 10 | F14: 9 | G14: 10 | H14: =R[-1]C+5 -> 35 | I14: 6
A15: 12 | B15: 10 | C15: =R[-1]C+10 -> 120 | D15: 12 | E15: 11 | F15: 10 | G15: 10 | H15: =R[-1]C+5 -> 40 | I15: 7

Sheet: export
A1: sheet_name | B1: export_name | C1: merge_to
A2: vip特权 | B2: vip_privilege