Sheet: 竞技仙丹排行版奖励
A1: 排名 | B1: 仙币奖励 | C1: 活力点 | D1: 仙丹 | E1: 体力点 | F1: 6级经验元灵数量
A2: id | B2: money | C2: energy | D2: elixir | E2: power | F2: expCard
A3: 1 | B3: 600000 | C3: 10000 | D3: 60000 | E3: 200 | F3: 50
A4: 2 | B4: =R[-1]C-5500 -> 594500 | C4: =R[-1]C-150 -> 9850 | D4: =R[-1]C-1120 -> 58880 | E4: =R[-1]C-5 -> 195 | F4: =R[-1]C-1 -> 49
A5: 3 | B5: =R[-1]C-5500 -> 589000 | C5: =R[-1]C-150 -> 9700 | D5: =R[-1]C-1120 -> 57760 | E5: =R[-1]C-5 -> 190 | F5: =R[-1]C-1 -> 48
A6: 4 | B6: =R[-1]C-5500 -> 583500 | C6: =R[-1]C-150 -> 9550 | D6: =R[-1]C-1120 -> 56640 | E6: =R[-1]C-5 -> 185 | F6: =R[-1]C-1 -> 47
A7: 5 | B7: =R[-1]C-5500 -> 578000 | C7: =R[-1]C-150 -> 9400 | D7: =R[-1]C-1120 -> 55520 | E7: =R[-1]C-5 -> 180 | F7: =R[-1]C-1 -> 46
A8: 6 | B8: =R[-1]C-5500 -> 572500 | C8: =R[-1]C-150 -> 9250 | D8: =R[-1]C-1120 -> 54400 | E8: =R[-1]C-5 -> 175 | F8: =R[-1]C-1 -> 45
A9: 7 | B9: =R[-1]C-5500 -> 567000 | C9: =R[-1]C-150 -> 9100 | D9: =R[-1]C-1120 -> 53280 | E9: =R[-1]C-5 -> 170 | F9: =R[-1]C-1 -> 44
A10: 8 | B10: =R[-1]C-5500 -> 561500 | C10: =R[-1]C-150 -> 8950 | D10: =R[-1]C-1120 -> 52160 | E10: =R[-1]C-5 -> 165 | F10: =R[-1]C-1 -> 43
A11: 9 | B11: =R[-1]C-5500 -> 556000 | C11: =R[-1]C-150 -> 8800 | D11: =R[-1]C-1120 -> 51040 | E11: =R[-1]C-5 -> 160 | F11: =R[-1]C-1 -> 42
A12: 10 | B12: =R[-1]C-5500 -> 550500 | C12: =R[-1]C-150 -> 8650 | D12: =R[-1]C-1120 -> 49920 | E12: =R[-1]C-5 -> 155 | F12: =R[-1]C-1 -> 41
A13: 11 | B13: =R[-1]C-5500 -> 545000 | C13: =R[-1]C-150 -> 8500 | D13: =R[-1]C-1120 -> 48800 | E13: =R[-1]C-5 -> 150 | F13: 0
A14: 12 | B14: =R[-1]C-5500 -> 539500 | C14: =R[-1]C-150 -> 8350 | D14: =R[-1]C-1120 -> 47680 | E14: =R[-1]C-5 -> 145 | F14: 0
A15: 13 | B15: =R[-1]C-5500 -> 534000 | C15: =R[-1]C-150 -> 8200 | D15: =R[-1]C-1120 -> 46560 | E15: =R[-1]C-5 -> 140 | F15: 0
A16: 14 | B16: =R[-1]C-5500 -> 528500 | C16: =R[-1]C-150 -> 8050 | D16: =R[-1]C-1120 -> 45440 | E16: =R[-1]C-5 -> 135 | F16: 0
A17: 15 | B17: =R[-1]C-5500 -> 523000 | C17: =R[-1]C-150 -> 7900 | D17: =R[-1]C-1120 -> 44320 | E17: =R[-1]C-5 -> 130 | F17: 0
A18: 16 | B18: =R[-1]C-5500 -> 517500 | C18: =R[-1]C-150 -> 7750 | D18: =R[-1]C-1120 -> 43200 | E18: =R[-1]C-5 -> 125 | F18: 0
A19: 17 | B19: =R[-1]C-5500 -> 512000 | C19: =R[-1]C-150 -> 7600 | D19: =R[-1]C-1120 -> 42080 | E19: =R[-1]C-5 -> 120 | F19: 0
A20: 18 | B20: =R[-1]C-5500 -> 506500 | C20: =R[-1]C-150 -> 7450 | D20: =R[-1]C-1120 -> 40960 | E20: =R[-1]C-5 -> 115 | F20: 0
A21: 19 | B21: =R[-1]C-5500 -> 501000 | C21: =R[-1]C-150 -> 7300 | D21: =R[-1]C-1120 -> 39840 | E21: =R[-1]C-5 -> 110 | F21: 0
A22: 20 | B22: =R[-1]C-5500 -> 495500 | C22: =R[-1]C-150 -> 7150 | D22: =R[-1]C-1120 -> 38720 | E22: 100 | F22: 0
A23: 21 | B23: =R[-1]C-5500 -> 490000 | C23: =R[-1]C-150 -> 7000 | D23: =R[-1]C-1120 -> 37600 | E23: 0 | F23: 0
A24: 22 | B24: =R[-1]C-5500 -> 484500 | C24: =R[-1]C-150 -> 6850 | D24: =R[-1]C-1120 -> 36480 | E24: 0 | F24: 0
A25: 23 | B25: =R[-1]C-5500 -> 479000 | C25: =R[-1]C-150 -> 6700 | D25: =R[-1]C-1120 -> 35360 | E25: 0 | F25: 0
A26: 24 | B26: =R[-1]C-5500 -> 473500 | C26: =R[-1]C-150 -> 6550 | D26: =R[-1]C-1120 -> 34240 | E26: 0 | F26: 0
A27: 25 | B27: =R[-1]C-5500 -> 468000 | C27: =R[-1]C-150 -> 6400 | D27: =R[-1]C-1120 -> 33120 | E27: 0 | F27: 0
A28: 26 | B28: =R[-1]C-5500 -> 462500 | C28: =R[-1]C-150 -> 6250 | D28: =R[-1]C-1120 -> 32000 | E28: 0 | F28: 0
A29: 27 | B29: =R[-1]C-5500 -> 457000 | C29: =R[-1]C-150 -> 6100 | D29: =R[-1]C-1120 -> 30880 | E29: 0 | F29: 0
A30: 28 | B30: =R[-1]C-5500 -> 451500 | C30: =R[-1]C-150 -> 5950 | D30: =R[-1]C-1120 -> 29760 | E30: 0 | F30: 0
A31: 29 | B31: =R[-1]C-5500 -> 446000 | C31: =R[-1]C-150 -> 5800 | D31: =R[-1]C-1120 -> 28640 | E31: 0 | F31: 0
A32: 30 | B32: =R[-1]C-5500 -> 440500 | C32: =R[-1]C-150 -> 5650 | D32: =R[-1]C-1120 -> 27520 | E32: 0 | F32: 0
A33: 31 | B33: =R[-1]C-5500 -> 435000 | C33: =R[-1]C-150 -> 5500 | D33: 0 | E33: 0 | F33: 0
A34: 32 | B34: =R[-1]C-5500 -> 429500 | C34: =R[-1]C-150 -> 5350 | D34: 0 | E34: 0 | F34: 0
A35: 33 | B35: =R[-1]C-5500 -> 424000 | C35: =R[-1]C-150 -> 5200 | D35: 0 | E35: 0 | F35: 0
A36: 34 | B36: =R[-1]C-5500 -> 418500 | C36: =R[-1]C-150 -> 5050 | D36: 0 | E36: 0 | F36: 0
A37: 35 | B37: =R[-1]C-5500 -> 413000 | C37: =R[-1]C-150 -> 4900 | D37: 0 | E37: 0 | F37: 0
A38: 36 | B38: =R[-1]C-5500 -> 407500 | C38: =R[-1]C-150 -> 4750 | D38: 0 | E38: 0 | F38: 0
A39: 37 | B39: =R[-1]C-5500 -> 402000 | C39: =R[-1]C-150 -> 4600 | D39: 0 | E39: 0 | F39: 0
A40: 38 | B40: =R[-1]C-5500 -> 396500 | C40: =R[-1]C-150 -> 4450 | D40: 0 | E40: 0 | F40: 0
A41: 39 | B41: =R[-1]C-5500 -> 391000 | C41: =R[-1]C-150 -> 4300 | D41: 0 | E41: 0 | F41: 0
A42: 40 | B42: =R[-1]C-5500 -> 385500 | C42: =R[-1]C-150 -> 4150 | D42: 0 | E42: 0 | F42: 0
A43: 41 | B43: =R[-1]C-5500 -> 380000 | C43: =R[-1]C-50 -> 4100 | D43: 0 | E43: 0 | F43: 0
A44: 42 | B44: =R[-1]C-5500 -> 374500 | C44: =R[-1]C-50 -> 4050 | D44: 0 | E44: 0 | F44: 0
A45: 43 | B45: =R[-1]C-5500 -> 369000 | C45: =R[-1]C-50 -> 4000 | D45: 0 | E45: 0 | F45: 0
A46: 44 | B46: =R[-1]C-5500 -> 363500 | C46: =R[-1]C-50 -> 3950 | D46: 0 | E46: 0 | F46: 0
A47: 45 | B47: =R[-1]C-5500 -> 358000 | C47: =R[-1]C-50 -> 3900 | D47: 0 | E47: 0 | F47: 0
A48: 46 | B48: =R[-1]C-5500 -> 352500 | C48: =R[-1]C-50 -> 3850 | D48: 0 | E48: 0 | F48: 0
A49: 47 | B49: =R[-1]C-5500 -> 347000 | C49: =R[-1]C-50 -> 3800 | D49: 0 | E49: 0 | F49: 0
A50: 48 | B50: =R[-1]C-5500 -> 341500 | C50: =R[-1]C-50 -> 3750 | D50: 0 | E50: 0 | F50: 0
A51: 49 | B51: =R[-1]C-5500 -> 336000 | C51: =R[-1]C-50 -> 3700 | D51: 0 | E51: 0 | F51: 0
A52: 50 | B52: =R[-1]C-5500 -> 330500 | C52: =R[-1]C-50 -> 3650 | D52: 0 | E52: 0 | F52: 0

Sheet: export
A1: sheet_name | B1: export_name | C1: merge_to
A2: 竞技仙丹排行版奖励 | B2: elixir_ranking_reward