Sheet: 竞技排名奖励加成系数
A1: 竞技排名 | B1: 对应等级排名奖励加成系数
A2: 1--10 | B2: 1 | D2: 该加成，是以等级奖励为基准值的，也就是
A3: 11-50 | B3: =R[-1]C-10% -> 0.9 | D3: 实际每次竞技奖励=等级对应奖励*（1+加成系数）
A4: 51-100 | B4: =R[-1]C-0.1 -> 0.8
A5: 101-200 | B5: =R[-1]C-0.1 -> 0.7 | D5: 该系数，对荣誉点，经验，铜板均有相同的加成效果
A6: 201-500 | B6: =R[-1]C-0.1 -> 0.6
A7: 501-1000 | B7: =R[-1]C-0.1 -> 0.5
A8: 1001-3000 | B8: =R[-1]C-0.1 -> 0.4
A9: 3001--5000 | B9: =R[-1]C-0.1 -> 0.3
A10: 5001-10000 | B10: =R[-1]C-0.1 -> 0.2
A11: 10001--- | B11: =R[-1]C-0.1 -> 0.1

Sheet: export
A1: sheet_name | B1: export_name | C1: merge_to
A2: 竞技排名奖励加成系数 | B2: jiacheng