Sheet: 竞技产出表
A1: id | B1: 等级 | C1: 胜利经验/次 | D1: 胜利铜板/次 | E1: 胜利仙丹/次 | F1: 失败经验/次 | G1: 失败铜板/次 | H1: 失败仙丹/次
A2: id | B2: lv | C2: win_exp | D2: win_money | E2: win_elixir | F2: lose_exp | G2: lose_money | H2: lose_elixir
A3: 5 | B3: 5 | C3: 1 | D3: 10 | E3: 100 | F3: =ROUND(RC[-3]/2,0) -> 1 | G3: =ROUND(RC[-3]/2,0) -> 5 | H3: =ROUND(RC[-3]/2,0) -> 50
A4: 6 | B4: 6 | C4: 2 | D4: =R[-1]C+1 -> 11 | E4: =R[-1]C+6 -> 106 | F4: =ROUND(RC[-3]/2,0) -> 1 | G4: =ROUND(RC[-3]/2,0) -> 6 | H4: =ROUND(RC[-3]/2,0) -> 53
A5: 7 | B5: 7 | C5: 3 | D5: =R[-1]C+1 -> 12 | E5: =R[-1]C+6 -> 112 | F5: =ROUND(RC[-3]/2,0) -> 2 | G5: =ROUND(RC[-3]/2,0) -> 6 | H5: =ROUND(RC[-3]/2,0) -> 56
A6: 8 | B6: 8 | C6: 4 | D6: =R[-1]C+1 -> 13 | E6: =R[-1]C+6 -> 118 | F6: =ROUND(RC[-3]/2,0) -> 2 | G6: =ROUND(RC[-3]/2,0) -> 7 | H6: =ROUND(RC[-3]/2,0) -> 59
A7: 9 | B7: 9 | C7: 5 | D7: =R[-1]C+1 -> 14 | E7: =R[-1]C+6 -> 124 | F7: =ROUND(RC[-3]/2,0) -> 3 | G7: =ROUND(RC[-3]/2,0) -> 7 | H7: =ROUND(RC[-3]/2,0) -> 62
A8: 10 | B8: 10 | C8: 6 | D8: =R[-1]C+1 -> 15 | E8: =R[-1]C+6 -> 130 | F8: =ROUND(RC[-3]/2,0) -> 3 | G8: =ROUND(RC[-3]/2,0) -> 8 | H8: =ROUND(RC[-3]/2,0) -> 65
A9: 11 | B9: 11 | C9: 7 | D9: =R[-1]C+1 -> 16 | E9: =R[-1]C+6 -> 136 | F9: =ROUND(RC[-3]/2,0) -> 4 | G9: =ROUND(RC[-3]/2,0) -> 8 | H9: =ROUND(RC[-3]/2,0) -> 68
A10: 12 | B10: 12 | C10: 8 | D10: =R[-1]C+1 -> 17 | E10: =R[-1]C+6 -> 142 | F10: =ROUND(RC[-3]/2,0) -> 4 | G10: =ROUND(RC[-3]/2,0) -> 9 | H10: =ROUND(RC[-3]/2,0) -> 71
A11: 13 | B11: 13 | C11: 9 | D11: =R[-1]C+1 -> 18 | E11: =R[-1]C+6 -> 148 | F11: =ROUND(RC[-3]/2,0) -> 5 | G11: =ROUND(RC[-3]/2,0) -> 9 | H11: =ROUND(RC[-3]/2,0) -> 74
A12: 14 | B12: 14 | C12: 10 | D12: =R[-1]C+1 -> 19 | E12: =R[-1]C+6 -> 154 | F12: =ROUND(RC[-3]/2,0) -> 5 | G12: =ROUND(RC[-3]/2,0) -> 10 | H12: =ROUND(RC[-3]/2,0) -> 77
A13: 15 | B13: 15 | C13: 11 | D13: =R[-1]C+1 -> 20 | E13: =R[-1]C+6 -> 160 | F13: =ROUND(RC[-3]/2,0) -> 6 | G13: =ROUND(RC[-3]/2,0) -> 10 | H13: =ROUND(RC[-3]/2,0) -> 80
A14: 16 | B14: 16 | C14: 12 | D14: =R[-1]C+1 -> 21 | E14: =R[-1]C+6 -> 166 | F14: =ROUND(RC[-3]/2,0) -> 6 | G14: =ROUND(RC[-3]/2,0) -> 11 | H14: =ROUND(RC[-3]/2,0) -> 83
A15: 17 | B15: 17 | C15: 13 | D15: =R[-1]C+1 -> 22 | E15: =R[-1]C+6 -> 172 | F15: =ROUND(RC[-3]/2,0) -> 7 | G15: =ROUND(RC[-3]/2,0) -> 11 | H15: =ROUND(RC[-3]/2,0) -> 86
A16: 18 | B16: 18 | C16: 14 | D16: =R[-1]C+1 -> 23 | E16: =R[-1]C+6 -> 178 | F16: =ROUND(RC[-3]/2,0) -> 7 | G16: =ROUND(RC[-3]/2,0) -> 12 | H16: =ROUND(RC[-3]/2,0) -> 89
A17: 19 | B17: 19 | C17: 15 | D17: =R[-1]C+1 -> 24 | E17: =R[-1]C+6 -> 184 | F17: =ROUND(RC[-3]/2,0) -> 8 | G17: =ROUND(RC[-3]/2,0) -> 12 | H17: =ROUND(RC[-3]/2,0) -> 92
A18: 20 | B18: 20 | C18: 16 | D18: =R[-1]C+1 -> 25 | E18: =R[-1]C+6 -> 190 | F18: =ROUND(RC[-3]/2,0) -> 8 | G18: =ROUND(RC[-3]/2,0) -> 13 | H18: =ROUND(RC[-3]/2,0) -> 95
A19: 21 | B19: 21 | C19: 17 | D19: =R[-1]C+1 -> 26 | E19: =R[-1]C+6 -> 196 | F19: =ROUND(RC[-3]/2,0) -> 9 | G19: =ROUND(RC[-3]/2,0) -> 13 | H19: =ROUND(RC[-3]/2,0) -> 98
A20: 22 | B20: 22 | C20: 18 | D20: =R[-1]C+1 -> 27 | E20: =R[-1]C+6 -> 202 | F20: =ROUND(RC[-3]/2,0) -> 9 | G20: =ROUND(RC[-3]/2,0) -> 14 | H20: =ROUND(RC[-3]/2,0) -> 101
A21: 23 | B21: 23 | C21: 19 | D21: =R[-1]C+1 -> 28 | E21: =R[-1]C+6 -> 208 | F21: =ROUND(RC[-3]/2,0) -> 10 | G21: =ROUND(RC[-3]/2,0) -> 14 | H21: =ROUND(RC[-3]/2,0) -> 104
A22: 24 | B22: 24 | C22: 20 | D22: =R[-1]C+1 -> 29 | E22: =R[-1]C+6 -> 214 | F22: =ROUND(RC[-3]/2,0) -> 10 | G22: =ROUND(RC[-3]/2,0) -> 15 | H22: =ROUND(RC[-3]/2,0) -> 107
A23: 25 | B23: 25 | C23: 21 | D23: =R[-1]C+1 -> 30 | E23: =R[-1]C+6 -> 220 | F23: =ROUND(RC[-3]/2,0) -> 11 | G23: =ROUND(RC[-3]/2,0) -> 15 | H23: =ROUND(RC[-3]/2,0) -> 110
A24: 26 | B24: 26 | C24: 22 | D24: =R[-1]C+1 -> 31 | E24: =R[-1]C+6 -> 226 | F24: =ROUND(RC[-3]/2,0) -> 11 | G24: =ROUND(RC[-3]/2,0) -> 16 | H24: =ROUND(RC[-3]/2,0) -> 113
A25: 27 | B25: 27 | C25: 23 | D25: =R[-1]C+1 -> 32 | E25: =R[-1]C+6 -> 232 | F25: =ROUND(RC[-3]/2,0) -> 12 | G25: =ROUND(RC[-3]/2,0) -> 16 | H25: =ROUND(RC[-3]/2,0) -> 116
A26: 28 | B26: 28 | C26: 24 | D26: =R[-1]C+1 -> 33 | E26: =R[-1]C+6 -> 238 | F26: =ROUND(RC[-3]/2,0) -> 12 | G26: =ROUND(RC[-3]/2,0) -> 17 | H26: =ROUND(RC[-3]/2,0) -> 119
A27: 29 | B27: 29 | C27: 25 | D27: =R[-1]C+1 -> 34 | E27: =R[-1]C+6 -> 244 | F27: =ROUND(RC[-3]/2,0) -> 13 | G27: =ROUND(RC[-3]/2,0) -> 17 | H27: =ROUND(RC[-3]/2,0) -> 122
A28: 30 | B28: 30 | C28: 26 | D28: =R[-1]C+1 -> 35 | E28: =R[-1]C+6 -> 250 | F28: =ROUND(RC[-3]/2,0) -> 13 | G28: =ROUND(RC[-3]/2,0) -> 18 | H28: =ROUND(RC[-3]/2,0) -> 125
A29: 31 | B29: 31 | C29: 27 | D29: =R[-1]C+1 -> 36 | E29: =R[-1]C+6 -> 256 | F29: =ROUND(RC[-3]/2,0) -> 14 | G29: =ROUND(RC[-3]/2,0) -> 18 | H29: =ROUND(RC[-3]/2,0) -> 128
A30: 32 | B30: 32 | C30: 28 | D30: =R[-1]C+1 -> 37 | E30: =R[-1]C+6 -> 262 | F30: =ROUND(RC[-3]/2,0) -> 14 | G30: =ROUND(RC[-3]/2,0) -> 19 | H30: =ROUND(RC[-3]/2,0) -> 131
A31: 33 | B31: 33 | C31: 29 | D31: =R[-1]C+1 -> 38 | E31: =R[-1]C+6 -> 268 | F31: =ROUND(RC[-3]/2,0) -> 15 | G31: =ROUND(RC[-3]/2,0) -> 19 | H31: =ROUND(RC[-3]/2,0) -> 134
A32: 34 | B32: 34 | C32: 30 | D32: =R[-1]C+1 -> 39 | E32: =R[-1]C+6 -> 274 | F32: =ROUND(RC[-3]/2,0) -> 15 | G32: =ROUND(RC[-3]/2,0) -> 20 | H32: =ROUND(RC[-3]/2,0) -> 137
A33: 35 | B33: 35 | C33: 31 | D33: =R[-1]C+1 -> 40 | E33: =R[-1]C+6 -> 280 | F33: =ROUND(RC[-3]/2,0) -> 16 | G33: =ROUND(RC[-3]/2,0) -> 20 | H33: =ROUND(RC[-3]/2,0) -> 140
A34: 36 | B34: 36 | C34: 32 | D34: =R[-1]C+1 -> 41 | E34: =R[-1]C+6 -> 286 | F34: =ROUND(RC[-3]/2,0) -> 16 | G34: =ROUND(RC[-3]/2,0) -> 21 | H34: =ROUND(RC[-3]/2,0) -> 143
A35: 37 | B35: 37 | C35: 33 | D35: =R[-1]C+1 -> 42 | E35: =R[-1]C+6 -> 292 | F35: =ROUND(RC[-3]/2,0) -> 17 | G35: =ROUND(RC[-3]/2,0) -> 21 | H35: =ROUND(RC[-3]/2,0) -> 146
A36: 38 | B36: 38 | C36: 34 | D36: =R[-1]C+1 -> 43 | E36: =R[-1]C+6 -> 298 | F36: =ROUND(RC[-3]/2,0) -> 17 | G36: =ROUND(RC[-3]/2,0) -> 22 | H36: =ROUND(RC[-3]/2,0) -> 149
A37: 39 | B37: 39 | C37: 35 | D37: =R[-1]C+1 -> 44 | E37: =R[-1]C+6 -> 304 | F37: =ROUND(RC[-3]/2,0) -> 18 | G37: =ROUND(RC[-3]/2,0) -> 22 | H37: =ROUND(RC[-3]/2,0) -> 152
A38: 40 | B38: 40 | C38: 36 | D38: =R[-1]C+1 -> 45 | E38: =R[-1]C+6 -> 310 | F38: =ROUND(RC[-3]/2,0) -> 18 | G38: =ROUND(RC[-3]/2,0) -> 23 | H38: =ROUND(RC[-3]/2,0) -> 155
A39: 41 | B39: 41 | C39: 37 | D39: =R[-1]C+1 -> 46 | E39: =R[-1]C+6 -> 316 | F39: =ROUND(RC[-3]/2,0) -> 19 | G39: =ROUND(RC[-3]/2,0) -> 23 | H39: =ROUND(RC[-3]/2,0) -> 158
A40: 42 | B40: 42 | C40: 38 | D40: =R[-1]C+1 -> 47 | E40: =R[-1]C+6 -> 322 | F40: =ROUND(RC[-3]/2,0) -> 19 | G40: =ROUND(RC[-3]/2,0) -> 24 | H40: =ROUND(RC[-3]/2,0) -> 161
A41: 43 | B41: 43 | C41: 39 | D41: =R[-1]C+1 -> 48 | E41: =R[-1]C+6 -> 328 | F41: =ROUND(RC[-3]/2,0) -> 20 | G41: =ROUND(RC[-3]/2,0) -> 24 | H41: =ROUND(RC[-3]/2,0) -> 164
A42: 44 | B42: 44 | C42: 40 | D42: =R[-1]C+1 -> 49 | E42: =R[-1]C+6 -> 334 | F42: =ROUND(RC[-3]/2,0) -> 20 | G42: =ROUND(RC[-3]/2,0) -> 25 | H42: =ROUND(RC[-3]/2,0) -> 167
A43: 45 | B43: 45 | C43: 41 | D43: =R[-1]C+1 -> 50 | E43: =R[-1]C+6 -> 340 | F43: =ROUND(RC[-3]/2,0) -> 21 | G43: =ROUND(RC[-3]/2,0) -> 25 | H43: =ROUND(RC[-3]/2,0) -> 170
A44: 46 | B44: 46 | C44: 42 | D44: =R[-1]C+1 -> 51 | E44: =R[-1]C+6 -> 346 | F44: =ROUND(RC[-3]/2,0) -> 21 | G44: =ROUND(RC[-3]/2,0) -> 26 | H44: =ROUND(RC[-3]/2,0) -> 173
A45: 47 | B45: 47 | C45: 43 | D45: =R[-1]C+1 -> 52 | E45: =R[-1]C+6 -> 352 | F45: =ROUND(RC[-3]/2,0) -> 22 | G45: =ROUND(RC[-3]/2,0) -> 26 | H45: =ROUND(RC[-3]/2,0) -> 176
A46: 48 | B46: 48 | C46: 44 | D46: =R[-1]C+1 -> 53 | E46: =R[-1]C+6 -> 358 | F46: =ROUND(RC[-3]/2,0) -> 22 | G46: =ROUND(RC[-3]/2,0) -> 27 | H46: =ROUND(RC[-3]/2,0) -> 179
A47: 49 | B47: 49 | C47: 45 | D47: =R[-1]C+1 -> 54 | E47: =R[-1]C+6 -> 364 | F47: =ROUND(RC[-3]/2,0) -> 23 | G47: =ROUND(RC[-3]/2,0) -> 27 | H47: =ROUND(RC[-3]/2,0) -> 182
A48: 50 | B48: 50 | C48: 46 | D48: =R[-1]C+1 -> 55 | E48: =R[-1]C+6 -> 370 | F48: =ROUND(RC[-3]/2,0) -> 23 | G48: =ROUND(RC[-3]/2,0) -> 28 | H48: =ROUND(RC[-3]/2,0) -> 185
A49: 51 | B49: 51 | C49: 47 | D49: =R[-1]C+1 -> 56 | E49: =R[-1]C+6 -> 376 | F49: =ROUND(RC[-3]/2,0) -> 24 | G49: =ROUND(RC[-3]/2,0) -> 28 | H49: =ROUND(RC[-3]/2,0) -> 188
A50: 52 | B50: 52 | C50: 48 | D50: =R[-1]C+1 -> 57 | E50: =R[-1]C+6 -> 382 | F50: =ROUND(RC[-3]/2,0) -> 24 | G50: =ROUND(RC[-3]/2,0) -> 29 | H50: =ROUND(RC[-3]/2,0) -> 191
A51: 53 | B51: 53 | C51: 49 | D51: =R[-1]C+1 -> 58 | E51: =R[-1]C+6 -> 388 | F51: =ROUND(RC[-3]/2,0) -> 25 | G51: =ROUND(RC[-3]/2,0) -> 29 | H51: =ROUND(RC[-3]/2,0) -> 194
A52: 54 | B52: 54 | C52: 50 | D52: =R[-1]C+1 -> 59 | E52: =R[-1]C+6 -> 394 | F52: =ROUND(RC[-3]/2,0) -> 25 | G52: =ROUND(RC[-3]/2,0) -> 30 | H52: =ROUND(RC[-3]/2,0) -> 197
A53: 55 | B53: 55 | C53: 51 | D53: =R[-1]C+1 -> 60 | E53: =R[-1]C+6 -> 400 | F53: =ROUND(RC[-3]/2,0) -> 26 | G53: =ROUND(RC[-3]/2,0) -> 30 | H53: =ROUND(RC[-3]/2,0) -> 200
A54: 56 | B54: 56 | C54: 52 | D54: =R[-1]C+1 -> 61 | E54: =R[-1]C+6 -> 406 | F54: =ROUND(RC[-3]/2,0) -> 26 | G54: =ROUND(RC[-3]/2,0) -> 31 | H54: =ROUND(RC[-3]/2,0) -> 203
A55: 57 | B55: 57 | C55: 53 | D55: =R[-1]C+1 -> 62 | E55: =R[-1]C+6 -> 412 | F55: =ROUND(RC[-3]/2,0) -> 27 | G55: =ROUND(RC[-3]/2,0) -> 31 | H55: =ROUND(RC[-3]/2,0) -> 206
A56: 58 | B56: 58 | C56: 54 | D56: =R[-1]C+1 -> 63 | E56: =R[-1]C+6 -> 418 | F56: =ROUND(RC[-3]/2,0) -> 27 | G56: =ROUND(RC[-3]/2,0) -> 32 | H56: =ROUND(RC[-3]/2,0) -> 209
A57: 59 | B57: 59 | C57: 55 | D57: =R[-1]C+1 -> 64 | E57: =R[-1]C+6 -> 424 | F57: =ROUND(RC[-3]/2,0) -> 28 | G57: =ROUND(RC[-3]/2,0) -> 32 | H57: =ROUND(RC[-3]/2,0) -> 212
A58: 60 | B58: 60 | C58: 56 | D58: =R[-1]C+1 -> 65 | E58: =R[-1]C+6 -> 430 | F58: =ROUND(RC[-3]/2,0) -> 28 | G58: =ROUND(RC[-3]/2,0) -> 33 | H58: =ROUND(RC[-3]/2,0) -> 215
A59: 61 | B59: 61 | C59: 57 | D59: =R[-1]C+1 -> 66 | E59: =R[-1]C+6 -> 436 | F59: =ROUND(RC[-3]/2,0) -> 29 | G59: =ROUND(RC[-3]/2,0) -> 33 | H59: =ROUND(RC[-3]/2,0) -> 218
A60: 62 | B60: 62 | C60: 58 | D60: =R[-1]C+1 -> 67 | E60: =R[-1]C+6 -> 442 | F60: =ROUND(RC[-3]/2,0) -> 29 | G60: =ROUND(RC[-3]/2,0) -> 34 | H60: =ROUND(RC[-3]/2,0) -> 221
A61: 63 | B61: 63 | C61: 59 | D61: =R[-1]C+1 -> 68 | E61: =R[-1]C+6 -> 448 | F61: =ROUND(RC[-3]/2,0) -> 30 | G61: =ROUND(RC[-3]/2,0) -> 34 | H61: =ROUND(RC[-3]/2,0) -> 224
A62: 64 | B62: 64 | C62: 60 | D62: =R[-1]C+1 -> 69 | E62: =R[-1]C+6 -> 454 | F62: =ROUND(RC[-3]/2,0) -> 30 | G62: =ROUND(RC[-3]/2,0) -> 35 | H62: =ROUND(RC[-3]/2,0) -> 227
A63: 65 | B63: 65 | C63: 61 | D63: =R[-1]C+1 -> 70 | E63: =R[-1]C+6 -> 460 | F63: =ROUND(RC[-3]/2,0) -> 31 | G63: =ROUND(RC[-3]/2,0) -> 35 | H63: =ROUND(RC[-3]/2,0) -> 230
A64: 66 | B64: 66 | C64: 62 | D64: =R[-1]C+1 -> 71 | E64: =R[-1]C+6 -> 466 | F64: =ROUND(RC[-3]/2,0) -> 31 | G64: =ROUND(RC[-3]/2,0) -> 36 | H64: =ROUND(RC[-3]/2,0) -> 233
A65: 67 | B65: 67 | C65: 63 | D65: =R[-1]C+1 -> 72 | E65: =R[-1]C+6 -> 472 | F65: =ROUND(RC[-3]/2,0) -> 32 | G65: =ROUND(RC[-3]/2,0) -> 36 | H65: =ROUND(RC[-3]/2,0) -> 236
A66: 68 | B66: 68 | C66: 64 | D66: =R[-1]C+1 -> 73 | E66: =R[-1]C+6 -> 478 | F66: =ROUND(RC[-3]/2,0) -> 32 | G66: =ROUND(RC[-3]/2,0) -> 37 | H66: =ROUND(RC[-3]/2,0) -> 239
A67: 69 | B67: 69 | C67: 65 | D67: =R[-1]C+1 -> 74 | E67: =R[-1]C+6 -> 484 | F67: =ROUND(RC[-3]/2,0) -> 33 | G67: =ROUND(RC[-3]/2,0) -> 37 | H67: =ROUND(RC[-3]/2,0) -> 242
A68: 70 | B68: 70 | C68: 66 | D68: =R[-1]C+1 -> 75 | E68: =R[-1]C+6 -> 490 | F68: =ROUND(RC[-3]/2,0) -> 33 | G68: =ROUND(RC[-3]/2,0) -> 38 | H68: =ROUND(RC[-3]/2,0) -> 245
A69: 71 | B69: 71 | C69: 67 | D69: =R[-1]C+1 -> 76 | E69: =R[-1]C+6 -> 496 | F69: =ROUND(RC[-3]/2,0) -> 34 | G69: =ROUND(RC[-3]/2,0) -> 38 | H69: =ROUND(RC[-3]/2,0) -> 248
A70: 72 | B70: 72 | C70: 68 | D70: =R[-1]C+1 -> 77 | E70: =R[-1]C+6 -> 502 | F70: =ROUND(RC[-3]/2,0) -> 34 | G70: =ROUND(RC[-3]/2,0) -> 39 | H70: =ROUND(RC[-3]/2,0) -> 251
A71: 73 | B71: 73 | C71: 69 | D71: =R[-1]C+1 -> 78 | E71: =R[-1]C+6 -> 508 | F71: =ROUND(RC[-3]/2,0) -> 35 | G71: =ROUND(RC[-3]/2,0) -> 39 | H71: =ROUND(RC[-3]/2,0) -> 254
A72: 74 | B72: 74 | C72: 70 | D72: =R[-1]C+1 -> 79 | E72: =R[-1]C+6 -> 514 | F72: =ROUND(RC[-3]/2,0) -> 35 | G72: =ROUND(RC[-3]/2,0) -> 40 | H72: =ROUND(RC[-3]/2,0) -> 257
A73: 75 | B73: 75 | C73: 71 | D73: =R[-1]C+1 -> 80 | E73: =R[-1]C+6 -> 520 | F73: =ROUND(RC[-3]/2,0) -> 36 | G73: =ROUND(RC[-3]/2,0) -> 40 | H73: =ROUND(RC[-3]/2,0) -> 260
A74: 76 | B74: 76 | C74: 72 | D74: =R[-1]C+1 -> 81 | E74: =R[-1]C+6 -> 526 | F74: =ROUND(RC[-3]/2,0) -> 36 | G74: =ROUND(RC[-3]/2,0) -> 41 | H74: =ROUND(RC[-3]/2,0) -> 263
A75: 77 | B75: 77 | C75: 73 | D75: =R[-1]C+1 -> 82 | E75: =R[-1]C+6 -> 532 | F75: =ROUND(RC[-3]/2,0) -> 37 | G75: =ROUND(RC[-3]/2,0) -> 41 | H75: =ROUND(RC[-3]/2,0) -> 266
A76: 78 | B76: 78 | C76: 74 | D76: =R[-1]C+1 -> 83 | E76: =R[-1]C+6 -> 538 | F76: =ROUND(RC[-3]/2,0) -> 37 | G76: =ROUND(RC[-3]/2,0) -> 42 | H76: =ROUND(RC[-3]/2,0) -> 269
A77: 79 | B77: 79 | C77: 75 | D77: =R[-1]C+1 -> 84 | E77: =R[-1]C+6 -> 544 | F77: =ROUND(RC[-3]/2,0) -> 38 | G77: =ROUND(RC[-3]/2,0) -> 42 | H77: =ROUND(RC[-3]/2,0) -> 272
A78: 80 | B78: 80 | C78: 76 | D78: =R[-1]C+1 -> 85 | E78: =R[-1]C+6 -> 550 | F78: =ROUND(RC[-3]/2,0) -> 38 | G78: =ROUND(RC[-3]/2,0) -> 43 | H78: =ROUND(RC[-3]/2,0) -> 275
A79: 81 | B79: 81 | C79: 77 | D79: =R[-1]C+1 -> 86 | E79: =R[-1]C+6 -> 556 | F79: =ROUND(RC[-3]/2,0) -> 39 | G79: =ROUND(RC[-3]/2,0) -> 43 | H79: =ROUND(RC[-3]/2,0) -> 278
A80: 82 | B80: 82 | C80: 78 | D80: =R[-1]C+1 -> 87 | E80: =R[-1]C+6 -> 562 | F80: =ROUND(RC[-3]/2,0) -> 39 | G80: =ROUND(RC[-3]/2,0) -> 44 | H80: =ROUND(RC[-3]/2,0) -> 281
A81: 83 | B81: 83 | C81: 79 | D81: =R[-1]C+1 -> 88 | E81: =R[-1]C+6 -> 568 | F81: =ROUND(RC[-3]/2,0) -> 40 | G81: =ROUND(RC[-3]/2,0) -> 44 | H81: =ROUND(RC[-3]/2,0) -> 284
A82: 84 | B82: 84 | C82: 80 | D82: =R[-1]C+1 -> 89 | E82: =R[-1]C+6 -> 574 | F82: =ROUND(RC[-3]/2,0) -> 40 | G82: =ROUND(RC[-3]/2,0) -> 45 | H82: =ROUND(RC[-3]/2,0) -> 287
A83: 85 | B83: 85 | C83: 81 | D83: =R[-1]C+1 -> 90 | E83: =R[-1]C+6 -> 580 | F83: =ROUND(RC[-3]/2,0) -> 41 | G83: =ROUND(RC[-3]/2,0) -> 45 | H83: =ROUND(RC[-3]/2,0) -> 290
A84: 86 | B84: 86 | C84: 82 | D84: =R[-1]C+1 -> 91 | E84: =R[-1]C+6 -> 586 | F84: =ROUND(RC[-3]/2,0) -> 41 | G84: =ROUND(RC[-3]/2,0) -> 46 | H84: =ROUND(RC[-3]/2,0) -> 293
A85: 87 | B85: 87 | C85: 83 | D85: =R[-1]C+1 -> 92 | E85: =R[-1]C+6 -> 592 | F85: =ROUND(RC[-3]/2,0) -> 42 | G85: =ROUND(RC[-3]/2,0) -> 46 | H85: =ROUND(RC[-3]/2,0) -> 296
A86: 88 | B86: 88 | C86: 84 | D86: =R[-1]C+1 -> 93 | E86: =R[-1]C+6 -> 598 | F86: =ROUND(RC[-3]/2,0) -> 42 | G86: =ROUND(RC[-3]/2,0) -> 47 | H86: =ROUND(RC[-3]/2,0) -> 299
A87: 89 | B87: 89 | C87: 85 | D87: =R[-1]C+1 -> 94 | E87: =R[-1]C+6 -> 604 | F87: =ROUND(RC[-3]/2,0) -> 43 | G87: =ROUND(RC[-3]/2,0) -> 47 | H87: =ROUND(RC[-3]/2,0) -> 302
A88: 90 | B88: 90 | C88: 86 | D88: =R[-1]C+1 -> 95 | E88: =R[-1]C+6 -> 610 | F88: =ROUND(RC[-3]/2,0) -> 43 | G88: =ROUND(RC[-3]/2,0) -> 48 | H88: =ROUND(RC[-3]/2,0) -> 305
A89: 91 | B89: 91 | C89: 87 | D89: =R[-1]C+1 -> 96 | E89: =R[-1]C+6 -> 616 | F89: =ROUND(RC[-3]/2,0) -> 44 | G89: =ROUND(RC[-3]/2,0) -> 48 | H89: =ROUND(RC[-3]/2,0) -> 308
A90: 92 | B90: 92 | C90: 88 | D90: =R[-1]C+1 -> 97 | E90: =R[-1]C+6 -> 622 | F90: =ROUND(RC[-3]/2,0) -> 44 | G90: =ROUND(RC[-3]/2,0) -> 49 | H90: =ROUND(RC[-3]/2,0) -> 311
A91: 93 | B91: 93 | C91: 89 | D91: =R[-1]C+1 -> 98 | E91: =R[-1]C+6 -> 628 | F91: =ROUND(RC[-3]/2,0) -> 45 | G91: =ROUND(RC[-3]/2,0) -> 49 | H91: =ROUND(RC[-3]/2,0) -> 314
A92: 94 | B92: 94 | C92: 90 | D92: =R[-1]C+1 -> 99 | E92: =R[-1]C+6 -> 634 | F92: =ROUND(RC[-3]/2,0) -> 45 | G92: =ROUND(RC[-3]/2,0) -> 50 | H92: =ROUND(RC[-3]/2,0) -> 317
A93: 95 | B93: 95 | C93: 91 | D93: =R[-1]C+1 -> 100 | E93: =R[-1]C+6 -> 640 | F93: =ROUND(RC[-3]/2,0) -> 46 | G93: =ROUND(RC[-3]/2,0) -> 50 | H93: =ROUND(RC[-3]/2,0) -> 320
A94: 96 | B94: 96 | C94: 92 | D94: =R[-1]C+1 -> 101 | E94: =R[-1]C+6 -> 646 | F94: =ROUND(RC[-3]/2,0) -> 46 | G94: =ROUND(RC[-3]/2,0) -> 51 | H94: =ROUND(RC[-3]/2,0) -> 323
A95: 97 | B95: 97 | C95: 93 | D95: =R[-1]C+1 -> 102 | E95: =R[-1]C+6 -> 652 | F95: =ROUND(RC[-3]/2,0) -> 47 | G95: =ROUND(RC[-3]/2,0) -> 51 | H95: =ROUND(RC[-3]/2,0) -> 326
A96: 98 | B96: 98 | C96: 94 | D96: =R[-1]C+1 -> 103 | E96: =R[-1]C+6 -> 658 | F96: =ROUND(RC[-3]/2,0) -> 47 | G96: =ROUND(RC[-3]/2,0) -> 52 | H96: =ROUND(RC[-3]/2,0) -> 329
A97: 99 | B97: 99 | C97: 95 | D97: =R[-1]C+1 -> 104 | E97: =R[-1]C+6 -> 664 | F97: =ROUND(RC[-3]/2,0) -> 48 | G97: =ROUND(RC[-3]/2,0) -> 52 | H97: =ROUND(RC[-3]/2,0) -> 332
A98: 100 | B98: 100 | C98: 96 | D98: =R[-1]C+1 -> 105 | E98: =R[-1]C+6 -> 670 | F98: =ROUND(RC[-3]/2,0) -> 48 | G98: =ROUND(RC[-3]/2,0) -> 53 | H98: =ROUND(RC[-3]/2,0) -> 335

Sheet: export
A1: sheet_name | B1: export_name | C1: merge_to
A2: 竞技产出表 | B2: rank