Sheet: 关卡怪物属性表
A1: id | B1: 卡牌名称 | C1: 攻击力 | D1: 生命值 | E1: 闪避率 | F1: 暴击率
A2: id | B2: card_id | C2: atk | D2: hp | E2: dodge_rate | F2: crit_rate
A3: 20000 | B3: 巨齿狼王 | C3: 446 | D3: 1113 | E3: 10 | F3: 10
A4: 20001 | B4: 双头牛怪 | C4: 714 | D4: 1784 | E4: 10 | F4: 10
A5: 20002 | B5: 长矛鼠怪 | C5: 1116 | D5: 2789 | E5: 10 | F5: 10
A6: 20003 | B6: 小狗怪 | C6: 1702 | D6: 4251 | E6: 10 | F6: 10
A7: 20004 | B7: 大狗怪 | C7: 2529 | D7: 6320 | E7: 10 | F7: 10
A8: 20005 | B8: 蝙蝠怪 | C8: 3910 | D8: 9773 | E8: 10 | F8: 10
A9: 20006 | B9: 火魔王 | C9: 5510 | D9: 13761 | E9: 10 | F9: 10
A10: 20007 | B10: 独臂铲子怪 | C10: 7568 | D10: 18901 | E10: 10 | F10: 10
A11: 20008 | B11: 黄袍老怪 | C11: 9648 | D11: 24094 | E11: 10 | F11: 10
A12: 20009 | B12: 金角大王 | C12: 10814 | D12: 28084 | E12: 10 | F12: 10
A13: 20010 | B13: 银角大王 | C13: 12417 | D13: 32247 | E13: 10 | F13: 10
A14: 20011 | B14: 长眉老怪 | C14: 15656 | D14: 40666 | E14: 10 | F14: 10
A15: 20012 | B15: 黑山巫妖 | C15: 19426 | D15: 50462 | E15: 10 | F15: 10
A16: 20013 | B16: 半头魔王 | C16: 23718 | D16: 61610 | E16: 10 | F16: 10
A17: 20014 | B17: 三条胳膊怪 | C17: 27450 | D17: 71301 | E17: 10 | F17: 10
A18: 20015 | B18: 巨斧怪 | C18: 32307 | D18: 81000 | E18: 10 | F18: 10
A19: 20016 | B19: 双刀怪 | C19: 38899 | D19: 97528 | E19: 10 | F19: 10
A20: 20017 | B20: 巨剑怪 | C20: 46089 | D20: 115552 | E20: 10 | F20: 10
A21: 20018 | B21: 弓箭怪 | C21: 52117 | D21: 130667 | E21: 10 | F21: 10
A22: 20019 | B22: 锤子怪 | C22: 58384 | D22: 146383 | E22: 10 | F22: 10
A23: 20020 | B23: 石巨人 | C23: =R[-1]C+2361 -> 60745 | D23: =R[-1]C+4562 -> 150945 | E23: 10 | F23: 10
A24: 30001 | B24: 蝙蝠怪 | C24: =R[-16]C -> 3910 | D24: =R[-16]C -> 9773 | E24: 10 | F24: 10
A25: 30002 | B25: 火魔王 | C25: =R[-1]C+150 -> 4060 | D25: =R[-1]C+150 -> 9923 | E25: 10 | F25: 10
A26: 30003 | B26: 金角大王 | C26: =R[-14]C -> 10814 | D26: =R[-14]C -> 28084 | E26: 10 | F26: 10
A27: 30004 | B27: 银角大王 | C27: =R[-1]C+150 -> 10964 | D27: =R[-1]C+150 -> 28234 | E27: 10 | F27: 10
A28: 30005 | B28: 半头魔王 | C28: =R[-12]C -> 23718 | D28: =R[-12]C -> 61610 | E28: 10 | F28: 10
A29: 30006 | B29: 三条胳膊怪 | C29: =R[-1]C+320 -> 24038 | D29: =R[-1]C+150 -> 61760 | E29: 10 | F29: 10
A30: 30007 | B30: 双刀怪 | C30: =R[-10]C -> 46089 | D30: =R[-10]C -> 115552 | E30: 10 | F30: 10
A31: 30008 | B31: 巨剑怪 | C31: =R[-1]C+160 -> 46249 | D31: =R[-1]C+160 -> 115712 | E31: 10 | F31: 10
A32: 30009 | B32: 锤子怪 | C32: =R[-10]C -> 58384 | D32: =R[-10]C -> 146383 | E32: 10 | F32: 10
A33: 30010 | B33: 石巨人 | C33: =R[-1]C+2361 -> 60745 | D33: =R[-1]C+4562 -> 150945 | E33: 10 | F33: 10

Sheet: export
A1: sheet_name | B1: export_name | C1: merge_to
A2: 关卡怪物属性表 | B2: pass_card | C2: task_card