Sheet: 玩家升级经验表
A1: 级别 | B1: 升到下一级所需经验 | C1: 铜板 | D1: 仙丹 | E1: 技能点 | F1: 活力值
A2: id | B2: exp | C2: money | D2: elixir | E2: skillPoint | F2: energy
A3: 1 | B3: 40 | C3: 10000 | D3: 1000 | E3: 800 | F3: 30
A4: 2 | B4: 44 | C4: =R[-1]C+100 -> 10100 | D4: =R[-1]C+20 -> 1020 | E4: =R[-1]C+10 -> 810 | F4: =R[-1]C+5 -> 35
A5: 3 | B5: =ROUND(R[-1]C*1.106,0) -> 49 | C5: =R[-1]C+100 -> 10200 | D5: =R[-1]C+20 -> 1040 | E5: =R[-1]C+10 -> 820 | F5: =R[-1]C+10 -> 45
A6: 4 | B6: =ROUND(R[-1]C*1.106,0) -> 54 | C6: =R[-1]C+100 -> 10300 | D6: =R[-1]C+20 -> 1060 | E6: =R[-1]C+10 -> 830 | F6: =R[-1]C+10 -> 55
A7: 5 | B7: =ROUND(R[-1]C*1.106,0) -> 60 | C7: =R[-1]C+100 -> 10400 | D7: =R[-1]C+20 -> 1080 | E7: =R[-1]C+10 -> 840 | F7: =R[-1]C+10 -> 65
A8: 6 | B8: =ROUND(R[-1]C*1.106,0) -> 66 | C8: =R[-1]C+100 -> 10500 | D8: =R[-1]C+20 -> 1100 | E8: =R[-1]C+10 -> 850 | F8: =R[-1]C+10 -> 75
A9: 7 | B9: =ROUND(R[-1]C*1.106,0) -> 73 | C9: =R[-1]C+100 -> 10600 | D9: =R[-1]C+20 -> 1120 | E9: =R[-1]C+10 -> 860 | F9: =R[-1]C+10 -> 85
A10: 8 | B10: =ROUND(R[-1]C*1.106,0) -> 81 | C10: =R[-1]C+100 -> 10700 | D10: =R[-1]C+20 -> 1140 | E10: =R[-1]C+10 -> 870 | F10: =R[-1]C+10 -> 95
A11: 9 | B11: =ROUND(R[-1]C*1.106,0) -> 90 | C11: =R[-1]C+100 -> 10800 | D11: =R[-1]C+20 -> 1160 | E11: =R[-1]C+10 -> 880 | F11: =R[-1]C+10 -> 105
A12: 10 | B12: =ROUND(R[-1]C*1.106,0) -> 100 | C12: =R[-1]C+100 -> 10900 | D12: =R[-1]C+20 -> 1180 | E12: =R[-1]C+10 -> 890 | F12: =R[-1]C+10 -> 115
A13: 11 | B13: =ROUND(R[-1]C*1.11,0) -> 111 | C13: =R[-1]C+100 -> 11000 | D13: =R[-1]C+20 -> 1200 | E13: =R[-1]C+10 -> 900 | F13: =R[-1]C+10 -> 125
A14: 12 | B14: =ROUND(R[-1]C*1.11,0) -> 123 | C14: =R[-1]C+100 -> 11100 | D14: =R[-1]C+20 -> 1220 | E14: =R[-1]C+10 -> 910 | F14: =R[-1]C+10 -> 135
A15: 13 | B15: =ROUND(R[-1]C*1.11,0) -> 137 | C15: =R[-1]C+100 -> 11200 | D15: =R[-1]C+20 -> 1240 | E15: =R[-1]C+10 -> 920 | F15: =R[-1]C+10 -> 145
A16: 14 | B16: =ROUND(R[-1]C*1.11,0) -> 152 | C16: =R[-1]C+100 -> 11300 | D16: =R[-1]C+20 -> 1260 | E16: =R[-1]C+10 -> 930 | F16: =R[-1]C+10 -> 155
A17: 15 | B17: =ROUND(R[-1]C*1.11,0) -> 169 | C17: =R[-1]C+100 -> 11400 | D17: =R[-1]C+20 -> 1280 | E17: =R[-1]C+10 -> 940 | F17: =R[-1]C+10 -> 165
A18: 16 | B18: =ROUND(R[-1]C*1.11,0) -> 188 | C18: =R[-1]C+100 -> 11500 | D18: =R[-1]C+20 -> 1300 | E18: =R[-1]C+10 -> 950 | F18: =R[-1]C+10 -> 175
A19: 17 | B19: =ROUND(R[-1]C*1.11,0) -> 209 | C19: =R[-1]C+100 -> 11600 | D19: =R[-1]C+20 -> 1320 | E19: =R[-1]C+10 -> 960 | F19: =R[-1]C+10 -> 185
A20: 18 | B20: =ROUND(R[-1]C*1.11,0) -> 232 | C20: =R[-1]C+100 -> 11700 | D20: =R[-1]C+20 -> 1340 | E20: =R[-1]C+10 -> 970 | F20: =R[-1]C+10 -> 195
A21: 19 | B21: =ROUND(R[-1]C*1.11,0) -> 258 | C21: =R[-1]C+100 -> 11800 | D21: =R[-1]C+20 -> 1360 | E21: =R[-1]C+10 -> 980 | F21: =R[-1]C+10 -> 205
A22: 20 | B22: =ROUND(R[-1]C*1.11,0) -> 286 | C22: =R[-1]C+100 -> 11900 | D22: =R[-1]C+20 -> 1380 | E22: =R[-1]C+10 -> 990 | F22: =R[-1]C+10 -> 215
A23: 21 | B23: =ROUND(R[-1]C*1.11,0) -> 317 | C23: =R[-1]C+100 -> 12000 | D23: =R[-1]C+20 -> 1400 | E23: =R[-1]C+10 -> 1000 | F23: =R[-1]C+10 -> 225
A24: 22 | B24: =ROUND(R[-1]C*1.11,0) -> 352 | C24: =R[-1]C+100 -> 12100 | D24: =R[-1]C+20 -> 1420 | E24: =R[-1]C+10 -> 1010 | F24: =R[-1]C+10 -> 235
A25: 23 | B25: =ROUND(R[-1]C*1.11,0) -> 391 | C25: =R[-1]C+100 -> 12200 | D25: =R[-1]C+20 -> 1440 | E25: =R[-1]C+10 -> 1020 | F25: =R[-1]C+10 -> 245
A26: 24 | B26: =ROUND(R[-1]C*1.11,0) -> 434 | C26: =R[-1]C+100 -> 12300 | D26: =R[-1]C+20 -> 1460 | E26: =R[-1]C+10 -> 1030 | F26: =R[-1]C+10 -> 255
A27: 25 | B27: =ROUND(R[-1]C*1.11,0) -> 482 | C27: =R[-1]C+100 -> 12400 | D27: =R[-1]C+20 -> 1480 | E27: =R[-1]C+10 -> 1040 | F27: =R[-1]C+10 -> 265
A28: 26 | B28: =ROUND(R[-1]C*1.11,0) -> 535 | C28: =R[-1]C+100 -> 12500 | D28: =R[-1]C+20 -> 1500 | E28: =R[-1]C+10 -> 1050 | F28: =R[-1]C+10 -> 275
A29: 27 | B29: =ROUND(R[-1]C*1.11,0) -> 594 | C29: =R[-1]C+100 -> 12600 | D29: =R[-1]C+20 -> 1520 | E29: =R[-1]C+10 -> 1060 | F29: =R[-1]C+10 -> 285
A30: 28 | B30: =ROUND(R[-1]C*1.11,0) -> 659 | C30: =R[-1]C+100 -> 12700 | D30: =R[-1]C+20 -> 1540 | E30: =R[-1]C+10 -> 1070 | F30: =R[-1]C+10 -> 295
A31: 29 | B31: =ROUND(R[-1]C*1.11,0) -> 731 | C31: =R[-1]C+100 -> 12800 | D31: =R[-1]C+20 -> 1560 | E31: =R[-1]C+10 -> 1080 | F31: =R[-1]C+10 -> 305
A32: 30 | B32: =ROUND(R[-1]C*1.11,0) -> 811 | C32: =R[-1]C+100 -> 12900 | D32: =R[-1]C+20 -> 1580 | E32: =R[-1]C+10 -> 1090 | F32: =R[-1]C+10 -> 315
A33: 31 | B33: =ROUND(R[-1]C*1.11,0) -> 900 | C33: =R[-1]C+100 -> 13000 | D33: =R[-1]C+20 -> 1600 | E33: =R[-1]C+10 -> 1100 | F33: =R[-1]C+10 -> 325
A34: 32 | B34: =ROUND(R[-1]C*1.11,0) -> 999 | C34: =R[-1]C+100 -> 13100 | D34: =R[-1]C+20 -> 1620 | E34: =R[-1]C+10 -> 1110 | F34: =R[-1]C+10 -> 335
A35: 33 | B35: =ROUND(R[-1]C*1.11,0) -> 1109 | C35: =R[-1]C+100 -> 13200 | D35: =R[-1]C+20 -> 1640 | E35: =R[-1]C+10 -> 1120 | F35: =R[-1]C+10 -> 345
A36: 34 | B36: =ROUND(R[-1]C*1.11,0) -> 1231 | C36: =R[-1]C+100 -> 13300 | D36: =R[-1]C+20 -> 1660 | E36: =R[-1]C+10 -> 1130 | F36: =R[-1]C+10 -> 355
A37: 35 | B37: =ROUND(R[-1]C*1.11,0) -> 1366 | C37: =R[-1]C+100 -> 13400 | D37: =R[-1]C+20 -> 1680 | E37: =R[-1]C+10 -> 1140 | F37: =R[-1]C+10 -> 365
A38: 36 | B38: =ROUND(R[-1]C*1.11,0) -> 1516 | C38: =R[-1]C+100 -> 13500 | D38: =R[-1]C+20 -> 1700 | E38: =R[-1]C+10 -> 1150 | F38: =R[-1]C+10 -> 375
A39: 37 | B39: =ROUND(R[-1]C*1.11,0) -> 1683 | C39: =R[-1]C+100 -> 13600 | D39: =R[-1]C+20 -> 1720 | E39: =R[-1]C+10 -> 1160 | F39: =R[-1]C+10 -> 385
A40: 38 | B40: =ROUND(R[-1]C*1.11,0) -> 1868 | C40: =R[-1]C+100 -> 13700 | D40: =R[-1]C+20 -> 1740 | E40: =R[-1]C+10 -> 1170 | F40: =R[-1]C+10 -> 395
A41: 39 | B41: =ROUND(R[-1]C*1.11,0) -> 2073 | C41: =R[-1]C+100 -> 13800 | D41: =R[-1]C+20 -> 1760 | E41: =R[-1]C+10 -> 1180 | F41: =R[-1]C+10 -> 405
A42: 40 | B42: =ROUND(R[-1]C*1.11,0) -> 2301 | C42: =R[-1]C+100 -> 13900 | D42: =R[-1]C+20 -> 1780 | E42: =R[-1]C+10 -> 1190 | F42: =R[-1]C+10 -> 415
A43: 41 | B43: =ROUND(R[-1]C*1.11,0) -> 2554 | C43: =R[-1]C+100 -> 14000 | D43: =R[-1]C+20 -> 1800 | E43: =R[-1]C+10 -> 1200 | F43: =R[-1]C+10 -> 425
A44: 42 | B44: =ROUND(R[-1]C*1.11,0) -> 2835 | C44: =R[-1]C+100 -> 14100 | D44: =R[-1]C+20 -> 1820 | E44: =R[-1]C+10 -> 1210 | F44: =R[-1]C+10 -> 435
A45: 43 | B45: =ROUND(R[-1]C*1.11,0) -> 3147 | C45: =R[-1]C+100 -> 14200 | D45: =R[-1]C+20 -> 1840 | E45: =R[-1]C+10 -> 1220 | F45: =R[-1]C+10 -> 445
A46: 44 | B46: =ROUND(R[-1]C*1.11,0) -> 3493 | C46: =R[-1]C+100 -> 14300 | D46: =R[-1]C+20 -> 1860 | E46: =R[-1]C+10 -> 1230 | F46: =R[-1]C+10 -> 455
A47: 45 | B47: =ROUND(R[-1]C*1.11,0) -> 3877 | C47: =R[-1]C+100 -> 14400 | D47: =R[-1]C+20 -> 1880 | E47: =R[-1]C+10 -> 1240 | F47: =R[-1]C+10 -> 465
A48: 46 | B48: =ROUND(R[-1]C*1.11,0) -> 4303 | C48: =R[-1]C+100 -> 14500 | D48: =R[-1]C+20 -> 1900 | E48: =R[-1]C+10 -> 1250 | F48: =R[-1]C+10 -> 475
A49: 47 | B49: =ROUND(R[-1]C*1.11,0) -> 4776 | C49: =R[-1]C+100 -> 14600 | D49: =R[-1]C+20 -> 1920 | E49: =R[-1]C+10 -> 1260 | F49: =R[-1]C+10 -> 485
A50: 48 | B50: =ROUND(R[-1]C*1.11,0) -> 5301 | C50: =R[-1]C+100 -> 14700 | D50: =R[-1]C+20 -> 1940 | E50: =R[-1]C+10 -> 1270 | F50: =R[-1]C+10 -> 495
A51: 49 | B51: =ROUND(R[-1]C*1.11,0) -> 5884 | C51: =R[-1]C+100 -> 14800 | D51: =R[-1]C+20 -> 1960 | E51: =R[-1]C+10 -> 1280 | F51: =R[-1]C+10 -> 505
A52: 50 | B52: =ROUND(R[-1]C*1.11,0) -> 6531 | C52: =R[-1]C+100 -> 14900 | D52: =R[-1]C+20 -> 1980 | E52: =R[-1]C+10 -> 1290 | F52: =R[-1]C+10 -> 515
A53: 51 | B53: =ROUND(R[-1]C*1.11,0) -> 7249 | C53: =R[-1]C+100 -> 15000 | D53: =R[-1]C+20 -> 2000 | E53: =R[-1]C+10 -> 1300 | F53: =R[-1]C+10 -> 525
A54: 52 | B54: =ROUND(R[-1]C*1.11,0) -> 8046 | C54: =R[-1]C+100 -> 15100 | D54: =R[-1]C+20 -> 2020 | E54: =R[-1]C+10 -> 1310 | F54: =R[-1]C+10 -> 535
A55: 53 | B55: =ROUND(R[-1]C*1.11,0) -> 8931 | C55: =R[-1]C+100 -> 15200 | D55: =R[-1]C+20 -> 2040 | E55: =R[-1]C+10 -> 1320 | F55: =R[-1]C+10 -> 545
A56: 54 | B56: =ROUND(R[-1]C*1.11,0) -> 9913 | C56: =R[-1]C+100 -> 15300 | D56: =R[-1]C+20 -> 2060 | E56: =R[-1]C+10 -> 1330 | F56: =R[-1]C+10 -> 555
A57: 55 | B57: =ROUND(R[-1]C*1.11,0) -> 11003 | C57: =R[-1]C+100 -> 15400 | D57: =R[-1]C+20 -> 2080 | E57: =R[-1]C+10 -> 1340 | F57: =R[-1]C+10 -> 565
A58: 56 | B58: =ROUND(R[-1]C*1.11,0) -> 12213 | C58: =R[-1]C+100 -> 15500 | D58: =R[-1]C+20 -> 2100 | E58: =R[-1]C+10 -> 1350 | F58: =R[-1]C+10 -> 575
A59: 57 | B59: =ROUND(R[-1]C*1.11,0) -> 13556 | C59: =R[-1]C+100 -> 15600 | D59: =R[-1]C+20 -> 2120 | E59: =R[-1]C+10 -> 1360 | F59: =R[-1]C+10 -> 585
A60: 58 | B60: =ROUND(R[-1]C*1.11,0) -> 15047 | C60: =R[-1]C+100 -> 15700 | D60: =R[-1]C+20 -> 2140 | E60: =R[-1]C+10 -> 1370 | F60: =R[-1]C+10 -> 595
A61: 59 | B61: =ROUND(R[-1]C*1.11,0) -> 16702 | C61: =R[-1]C+100 -> 15800 | D61: =R[-1]C+20 -> 2160 | E61: =R[-1]C+10 -> 1380 | F61: =R[-1]C+10 -> 605
A62: 60 | B62: =ROUND(R[-1]C*1.11,0) -> 18539 | C62: =R[-1]C+100 -> 15900 | D62: =R[-1]C+20 -> 2180 | E62: =R[-1]C+10 -> 1390 | F62: =R[-1]C+10 -> 615
A63: 61 | B63: =ROUND(R[-1]C*1.11,0) -> 20578 | C63: =R[-1]C+100 -> 16000 | D63: =R[-1]C+20 -> 2200 | E63: =R[-1]C+10 -> 1400 | F63: =R[-1]C+10 -> 625
A64: 62 | B64: =ROUND(R[-1]C*1.11,0) -> 22842 | C64: =R[-1]C+100 -> 16100 | D64: =R[-1]C+20 -> 2220 | E64: =R[-1]C+10 -> 1410 | F64: =R[-1]C+10 -> 635
A65: 63 | B65: =ROUND(R[-1]C*1.11,0) -> 25355 | C65: =R[-1]C+100 -> 16200 | D65: =R[-1]C+20 -> 2240 | E65: =R[-1]C+10 -> 1420 | F65: =R[-1]C+10 -> 645
A66: 64 | B66: =ROUND(R[-1]C*1.11,0) -> 28144 | C66: =R[-1]C+100 -> 16300 | D66: =R[-1]C+20 -> 2260 | E66: =R[-1]C+10 -> 1430 | F66: =R[-1]C+10 -> 655
A67: 65 | B67: =ROUND(R[-1]C*1.11,0) -> 31240 | C67: =R[-1]C+100 -> 16400 | D67: =R[-1]C+20 -> 2280 | E67: =R[-1]C+10 -> 1440 | F67: =R[-1]C+10 -> 665
A68: 66 | B68: =ROUND(R[-1]C*1.11,0) -> 34676 | C68: =R[-1]C+100 -> 16500 | D68: =R[-1]C+20 -> 2300 | E68: =R[-1]C+10 -> 1450 | F68: =R[-1]C+10 -> 675
A69: 67 | B69: =ROUND(R[-1]C*1.11,0) -> 38490 | C69: =R[-1]C+100 -> 16600 | D69: =R[-1]C+20 -> 2320 | E69: =R[-1]C+10 -> 1460 | F69: =R[-1]C+10 -> 685
A70: 68 | B70: =ROUND(R[-1]C*1.11,0) -> 42724 | C70: =R[-1]C+100 -> 16700 | D70: =R[-1]C+20 -> 2340 | E70: =R[-1]C+10 -> 1470 | F70: =R[-1]C+10 -> 695
A71: 69 | B71: =ROUND(R[-1]C*1.11,0) -> 47424 | C71: =R[-1]C+100 -> 16800 | D71: =R[-1]C+20 -> 2360 | E71: =R[-1]C+10 -> 1480 | F71: =R[-1]C+10 -> 705
A72: 70 | B72: =ROUND(R[-1]C*1.11,0) -> 52641 | C72: =R[-1]C+100 -> 16900 | D72: =R[-1]C+20 -> 2380 | E72: =R[-1]C+10 -> 1490 | F72: =R[-1]C+10 -> 715
A73: 71 | B73: =ROUND(R[-1]C*1.11,0) -> 58432 | C73: =R[-1]C+100 -> 17000 | D73: =R[-1]C+20 -> 2400 | E73: =R[-1]C+10 -> 1500 | F73: =R[-1]C+10 -> 725
A74: 72 | B74: =ROUND(R[-1]C*1.11,0) -> 64860 | C74: =R[-1]C+100 -> 17100 | D74: =R[-1]C+20 -> 2420 | E74: =R[-1]C+10 -> 1510 | F74: =R[-1]C+10 -> 735
A75: 73 | B75: =ROUND(R[-1]C*1.11,0) -> 71995 | C75: =R[-1]C+100 -> 17200 | D75: =R[-1]C+20 -> 2440 | E75: =R[-1]C+10 -> 1520 | F75: =R[-1]C+10 -> 745
A76: 74 | B76: =ROUND(R[-1]C*1.11,0) -> 79914 | C76: =R[-1]C+100 -> 17300 | D76: =R[-1]C+20 -> 2460 | E76: =R[-1]C+10 -> 1530 | F76: =R[-1]C+10 -> 755
A77: 75 | B77: =ROUND(R[-1]C*1.11,0) -> 88705 | C77: =R[-1]C+100 -> 17400 | D77: =R[-1]C+20 -> 2480 | E77: =R[-1]C+10 -> 1540 | F77: =R[-1]C+10 -> 765
A78: 76 | B78: =ROUND(R[-1]C*1.11,0) -> 98463 | C78: =R[-1]C+100 -> 17500 | D78: =R[-1]C+20 -> 2500 | E78: =R[-1]C+10 -> 1550 | F78: =R[-1]C+10 -> 775
A79: 77 | B79: =ROUND(R[-1]C*1.11,0) -> 109294 | C79: =R[-1]C+100 -> 17600 | D79: =R[-1]C+20 -> 2520 | E79: =R[-1]C+10 -> 1560 | F79: =R[-1]C+10 -> 785
A80: 78 | B80: =ROUND(R[-1]C*1.11,0) -> 121316 | C80: =R[-1]C+100 -> 17700 | D80: =R[-1]C+20 -> 2540 | E80: =R[-1]C+10 -> 1570 | F80: =R[-1]C+10 -> 795
A81: 79 | B81: =ROUND(R[-1]C*1.11,0) -> 134661 | C81: =R[-1]C+100 -> 17800 | D81: =R[-1]C+20 -> 2560 | E81: =R[-1]C+10 -> 1580 | F81: =R[-1]C+10 -> 805
A82: 80 | B82: =ROUND(R[-1]C*1.11,0) -> 149474 | C82: =R[-1]C+100 -> 17900 | D82: =R[-1]C+20 -> 2580 | E82: =R[-1]C+10 -> 1590 | F82: =R[-1]C+10 -> 815
A83: 81 | B83: =ROUND(R[-1]C*1.11,0) -> 165916 | C83: =R[-1]C+100 -> 18000 | D83: =R[-1]C+20 -> 2600 | E83: =R[-1]C+10 -> 1600 | F83: =R[-1]C+10 -> 825
A84: 82 | B84: =ROUND(R[-1]C*1.11,0) -> 184167 | C84: =R[-1]C+100 -> 18100 | D84: =R[-1]C+20 -> 2620 | E84: =R[-1]C+10 -> 1610 | F84: =R[-1]C+10 -> 835
A85: 83 | B85: =ROUND(R[-1]C*1.11,0) -> 204425 | C85: =R[-1]C+100 -> 18200 | D85: =R[-1]C+20 -> 2640 | E85: =R[-1]C+10 -> 1620 | F85: =R[-1]C+10 -> 845
A86: 84 | B86: =ROUND(R[-1]C*1.11,0) -> 226912 | C86: =R[-1]C+100 -> 18300 | D86: =R[-1]C+20 -> 2660 | E86: =R[-1]C+10 -> 1630 | F86: =R[-1]C+10 -> 855
A87: 85 | B87: =ROUND(R[-1]C*1.11,0) -> 251872 | C87: =R[-1]C+100 -> 18400 | D87: =R[-1]C+20 -> 2680 | E87: =R[-1]C+10 -> 1640 | F87: =R[-1]C+10 -> 865
A88: 86 | B88: =ROUND(R[-1]C*1.11,0) -> 279578 | C88: =R[-1]C+100 -> 18500 | D88: =R[-1]C+20 -> 2700 | E88: =R[-1]C+10 -> 1650 | F88: =R[-1]C+10 -> 875
A89: 87 | B89: =ROUND(R[-1]C*1.11,0) -> 310332 | C89: =R[-1]C+100 -> 18600 | D89: =R[-1]C+20 -> 2720 | E89: =R[-1]C+10 -> 1660 | F89: =R[-1]C+10 -> 885
A90: 88 | B90: =ROUND(R[-1]C*1.11,0) -> 344469 | C90: =R[-1]C+100 -> 18700 | D90: =R[-1]C+20 -> 2740 | E90: =R[-1]C+10 -> 1670 | F90: =R[-1]C+10 -> 895
A91: 89 | B91: =ROUND(R[-1]C*1.11,0) -> 382361 | C91: =R[-1]C+100 -> 18800 | D91: =R[-1]C+20 -> 2760 | E91: =R[-1]C+10 -> 1680 | F91: =R[-1]C+10 -> 905
A92: 90 | B92: =ROUND(R[-1]C*1.11,0) -> 424421 | C92: =R[-1]C+100 -> 18900 | D92: =R[-1]C+20 -> 2780 | E92: =R[-1]C+10 -> 1690 | F92: =R[-1]C+10 -> 915
A93: 91 | B93: =ROUND(R[-1]C*1.11,0) -> 471107 | C93: =R[-1]C+100 -> 19000 | D93: =R[-1]C+20 -> 2800 | E93: =R[-1]C+10 -> 1700 | F93: =R[-1]C+10 -> 925
A94: 92 | B94: =ROUND(R[-1]C*1.11,0) -> 522929 | C94: =R[-1]C+100 -> 19100 | D94: =R[-1]C+20 -> 2820 | E94: =R[-1]C+10 -> 1710 | F94: =R[-1]C+10 -> 935
A95: 93 | B95: =ROUND(R[-1]C*1.11,0) -> 580451 | C95: =R[-1]C+100 -> 19200 | D95: =R[-1]C+20 -> 2840 | E95: =R[-1]C+10 -> 1720 | F95: =R[-1]C+10 -> 945
A96: 94 | B96: =ROUND(R[-1]C*1.11,0) -> 644301 | C96: =R[-1]C+100 -> 19300 | D96: =R[-1]C+20 -> 2860 | E96: =R[-1]C+10 -> 1730 | F96: =R[-1]C+10 -> 955
A97: 95 | B97: =ROUND(R[-1]C*1.11,0) -> 715174 | C97: =R[-1]C+100 -> 19400 | D97: =R[-1]C+20 -> 2880 | E97: =R[-1]C+10 -> 1740 | F97: =R[-1]C+10 -> 965
A98: 96 | B98: =ROUND(R[-1]C*1.11,0) -> 793843 | C98: =R[-1]C+100 -> 19500 | D98: =R[-1]C+20 -> 2900 | E98: =R[-1]C+10 -> 1750 | F98: =R[-1]C+10 -> 975
A99: 97 | B99: =ROUND(R[-1]C*1.11,0) -> 881166 | C99: =R[-1]C+100 -> 19600 | D99: =R[-1]C+20 -> 2920 | E99: =R[-1]C+10 -> 1760 | F99: =R[-1]C+10 -> 985
A100: 98 | B100: =ROUND(R[-1]C*1.11,0) -> 978094 | C100: =R[-1]C+100 -> 19700 | D100: =R[-1]C+20 -> 2940 | E100: =R[-1]C+10 -> 1770 | F100: =R[-1]C+10 -> 995
A101: 99 | B101: =ROUND(R[-1]C*1.11,0) -> 1085684 | C101: =R[-1]C+100 -> 19800 | D101: =R[-1]C+20 -> 2960 | E101: =R[-1]C+10 -> 1780 | F101: =R[-1]C+10 -> 1005
A102: 100 | B102: =ROUND(R[-1]C*1.11,0) -> 1205109 | C102: =R[-1]C+100 -> 19900 | D102: =R[-1]C+20 -> 2980 | E102: =R[-1]C+10 -> 1790 | F102: =R[-1]C+10 -> 1015

Sheet: export
A1: sheet_name | B1: export_name | C1: merge_to
A2: 玩家升级经验表 | B2: player_upgrade