Sheet: 通关仙币奖励
A1: 小关ID | B1: 仙币奖励
A2: id | B2: money_obtain
A3: 1 | B3: 1000
A4: 2 | B4: =R[-1]C+50 -> 1050
A5: 3 | B5: =R[-1]C+50 -> 1100
A6: 4 | B6: =R[-1]C+50 -> 1150
A7: 5 | B7: =R[-1]C+50 -> 1200
A8: 6 | B8: =R[-1]C+50 -> 1250
A9: 7 | B9: =R[-1]C+50 -> 1300
A10: 8 | B10: =R[-1]C+50 -> 1350
A11: 9 | B11: =R[-1]C+50 -> 1400
A12: 10 | B12: =R[-1]C+50 -> 1450
A13: 11 | B13: =R[-1]C+50 -> 1500
A14: 12 | B14: =R[-1]C+50 -> 1550
A15: 13 | B15: =R[-1]C+50 -> 1600
A16: 14 | B16: =R[-1]C+50 -> 1650
A17: 15 | B17: =R[-1]C+50 -> 1700
A18: 16 | B18: =R[-1]C+50 -> 1750
A19: 17 | B19: =R[-1]C+50 -> 1800
A20: 18 | B20: =R[-1]C+50 -> 1850
A21: 19 | B21: =R[-1]C+50 -> 1900
A22: 20 | B22: =R[-1]C+50 -> 1950
A23: 21 | B23: =R[-1]C+50 -> 2000
A24: 22 | B24: =R[-1]C+50 -> 2050
A25: 23 | B25: =R[-1]C+50 -> 2100
A26: 24 | B26: =R[-1]C+50 -> 2150
A27: 25 | B27: =R[-1]C+50 -> 2200
A28: 26 | B28: =R[-1]C+50 -> 2250
A29: 27 | B29: =R[-1]C+50 -> 2300
A30: 28 | B30: =R[-1]C+50 -> 2350
A31: 29 | B31: =R[-1]C+50 -> 2400
A32: 30 | B32: =R[-1]C+50 -> 2450
A33: 31 | B33: =R[-1]C+50 -> 2500
A34: 32 | B34: =R[-1]C+50 -> 2550
A35: 33 | B35: =R[-1]C+50 -> 2600
A36: 34 | B36: =R[-1]C+50 -> 2650
A37: 35 | B37: =R[-1]C+50 -> 2700
A38: 36 | B38: =R[-1]C+50 -> 2750
A39: 37 | B39: =R[-1]C+50 -> 2800
A40: 38 | B40: =R[-1]C+50 -> 2850
A41: 39 | B41: =R[-1]C+50 -> 2900
A42: 40 | B42: =R[-1]C+50 -> 2950
A43: 41 | B43: =R[-1]C+50 -> 3000
A44: 42 | B44: =R[-1]C+50 -> 3050
A45: 43 | B45: =R[-1]C+50 -> 3100
A46: 44 | B46: =R[-1]C+50 -> 3150
A47: 45 | B47: =R[-1]C+50 -> 3200
A48: 46 | B48: =R[-1]C+50 -> 3250
A49: 47 | B49: =R[-1]C+50 -> 3300
A50: 48 | B50: =R[-1]C+50 -> 3350
A51: 49 | B51: =R[-1]C+50 -> 3400
A52: 50 | B52: =R[-1]C+50 -> 3450
A53: 51 | B53: =R[-1]C+50 -> 3500
A54: 52 | B54: =R[-1]C+50 -> 3550
A55: 53 | B55: =R[-1]C+50 -> 3600
A56: 54 | B56: =R[-1]C+50 -> 3650
A57: 55 | B57: =R[-1]C+50 -> 3700
A58: 56 | B58: =R[-1]C+50 -> 3750
A59: 57 | B59: =R[-1]C+50 -> 3800
A60: 58 | B60: =R[-1]C+50 -> 3850
A61: 59 | B61: =R[-1]C+50 -> 3900
A62: 60 | B62: =R[-1]C+50 -> 3950
A63: 61 | B63: =R[-1]C+50 -> 4000
A64: 62 | B64: =R[-1]C+50 -> 4050
A65: 63 | B65: =R[-1]C+50 -> 4100
A66: 64 | B66: =R[-1]C+50 -> 4150
A67: 65 | B67: =R[-1]C+50 -> 4200
A68: 66 | B68: =R[-1]C+50 -> 4250
A69: 67 | B69: =R[-1]C+50 -> 4300
A70: 68 | B70: =R[-1]C+50 -> 4350
A71: 69 | B71: =R[-1]C+50 -> 4400
A72: 70 | B72: =R[-1]C+50 -> 4450
A73: 71 | B73: =R[-1]C+50 -> 4500
A74: 72 | B74: =R[-1]C+50 -> 4550
A75: 73 | B75: =R[-1]C+50 -> 4600
A76: 74 | B76: =R[-1]C+50 -> 4650
A77: 75 | B77: =R[-1]C+50 -> 4700
A78: 76 | B78: =R[-1]C+50 -> 4750
A79: 77 | B79: =R[-1]C+50 -> 4800
A80: 78 | B80: =R[-1]C+50 -> 4850
A81: 79 | B81: =R[-1]C+50 -> 4900
A82: 80 | B82: =R[-1]C+50 -> 4950
A83: 81 | B83: =R[-1]C+50 -> 5000
A84: 82 | B84: =R[-1]C+50 -> 5050
A85: 83 | B85: =R[-1]C+50 -> 5100
A86: 84 | B86: =R[-1]C+50 -> 5150
A87: 85 | B87: =R[-1]C+50 -> 5200
A88: 86 | B88: =R[-1]C+50 -> 5250
A89: 87 | B89: =R[-1]C+50 -> 5300
A90: 88 | B90: =R[-1]C+50 -> 5350
A91: 89 | B91: =R[-1]C+50 -> 5400
A92: 90 | B92: =R[-1]C+50 -> 5450
A93: 91 | B93: =R[-1]C+50 -> 5500
A94: 92 | B94: =R[-1]C+50 -> 5550
A95: 93 | B95: =R[-1]C+50 -> 5600
A96: 94 | B96: =R[-1]C+50 -> 5650
A97: 95 | B97: =R[-1]C+50 -> 5700
A98: 96 | B98: =R[-1]C+50 -> 5750
A99: 97 | B99: =R[-1]C+50 -> 5800
A100: 98 | B100: =R[-1]C+50 -> 5850
A101: 99 | B101: =R[-1]C+50 -> 5900
A102: 100 | B102: =R[-1]C+50 -> 5950
A103: 101 | B103: =R[-1]C+50 -> 6000
A104: 102 | B104: =R[-1]C+50 -> 6050
A105: 103 | B105: =R[-1]C+50 -> 6100
A106: 104 | B106: =R[-1]C+50 -> 6150
A107: 105 | B107: =R[-1]C+50 -> 6200
A108: 106 | B108: =R[-1]C+50 -> 6250
A109: 107 | B109: =R[-1]C+50 -> 6300
A110: 108 | B110: =R[-1]C+50 -> 6350
A111: 109 | B111: =R[-1]C+50 -> 6400
A112: 110 | B112: =R[-1]C+50 -> 6450
A113: 111 | B113: =R[-1]C+50 -> 6500
A114: 112 | B114: =R[-1]C+50 -> 6550
A115: 113 | B115: =R[-1]C+50 -> 6600
A116: 114 | B116: =R[-1]C+50 -> 6650
A117: 115 | B117: =R[-1]C+50 -> 6700
A118: 116 | B118: =R[-1]C+50 -> 6750
A119: 117 | B119: =R[-1]C+50 -> 6800
A120: 118 | B120: =R[-1]C+50 -> 6850
A121: 119 | B121: =R[-1]C+50 -> 6900
A122: 120 | B122: =R[-1]C+50 -> 6950
A123: 121 | B123: =R[-1]C+50 -> 7000
A124: 122 | B124: =R[-1]C+50 -> 7050
A125: 123 | B125: =R[-1]C+50 -> 7100
A126: 124 | B126: =R[-1]C+50 -> 7150
A127: 125 | B127: =R[-1]C+50 -> 7200
A128: 126 | B128: =R[-1]C+50 -> 7250
A129: 127 | B129: =R[-1]C+50 -> 7300
A130: 128 | B130: =R[-1]C+50 -> 7350
A131: 129 | B131: =R[-1]C+50 -> 7400
A132: 130 | B132: =R[-1]C+50 -> 7450
A133: 131 | B133: =R[-1]C+50 -> 7500
A134: 132 | B134: =R[-1]C+50 -> 7550
A135: 133 | B135: =R[-1]C+50 -> 7600
A136: 134 | B136: =R[-1]C+50 -> 7650
A137: 135 | B137: =R[-1]C+50 -> 7700
A138: 136 | B138: =R[-1]C+50 -> 7750
A139: 137 | B139: =R[-1]C+50 -> 7800
A140: 138 | B140: =R[-1]C+50 -> 7850
A141: 139 | B141: =R[-1]C+50 -> 7900
A142: 140 | B142: =R[-1]C+50 -> 7950
A143: 141 | B143: =R[-1]C+50 -> 8000
A144: 142 | B144: =R[-1]C+50 -> 8050
A145: 143 | B145: =R[-1]C+50 -> 8100
A146: 144 | B146: =R[-1]C+50 -> 8150
A147: 145 | B147: =R[-1]C+50 -> 8200
A148: 146 | B148: =R[-1]C+50 -> 8250
A149: 147 | B149: =R[-1]C+50 -> 8300
A150: 148 | B150: =R[-1]C+50 -> 8350
A151: 149 | B151: =R[-1]C+50 -> 8400
A152: 150 | B152: =R[-1]C+50 -> 8450
A153: 151 | B153: =R[-1]C+50 -> 8500
A154: 152 | B154: =R[-1]C+50 -> 8550
A155: 153 | B155: =R[-1]C+50 -> 8600
A156: 154 | B156: =R[-1]C+50 -> 8650
A157: 155 | B157: =R[-1]C+50 -> 8700
A158: 156 | B158: =R[-1]C+50 -> 8750
A159: 157 | B159: =R[-1]C+50 -> 8800
A160: 158 | B160: =R[-1]C+50 -> 8850
A161: 159 | B161: =R[-1]C+50 -> 8900
A162: 160 | B162: =R[-1]C+50 -> 8950
A163: 161 | B163: =R[-1]C+50 -> 9000
A164: 162 | B164: =R[-1]C+50 -> 9050
A165: 163 | B165: =R[-1]C+50 -> 9100
A166: 164 | B166: =R[-1]C+50 -> 9150
A167: 165 | B167: =R[-1]C+50 -> 9200
A168: 166 | B168: =R[-1]C+50 -> 9250
A169: 167 | B169: =R[-1]C+50 -> 9300
A170: 168 | B170: =R[-1]C+50 -> 9350
A171: 169 | B171: =R[-1]C+50 -> 9400
A172: 170 | B172: =R[-1]C+50 -> 9450
A173: 171 | B173: =R[-1]C+50 -> 9500
A174: 172 | B174: =R[-1]C+50 -> 9550
A175: 173 | B175: =R[-1]C+50 -> 9600
A176: 174 | B176: =R[-1]C+50 -> 9650
A177: 175 | B177: =R[-1]C+50 -> 9700
A178: 176 | B178: =R[-1]C+50 -> 9750
A179: 177 | B179: =R[-1]C+50 -> 9800
A180: 178 | B180: =R[-1]C+50 -> 9850
A181: 179 | B181: =R[-1]C+50 -> 9900
A182: 180 | B182: =R[-1]C+50 -> 9950
A183: 181 | B183: =R[-1]C+50 -> 10000
A184: 182 | B184: =R[-1]C+50 -> 10050
A185: 183 | B185: =R[-1]C+50 -> 10100
A186: 184 | B186: =R[-1]C+50 -> 10150
A187: 185 | B187: =R[-1]C+50 -> 10200
A188: 186 | B188: =R[-1]C+50 -> 10250
A189: 187 | B189: =R[-1]C+50 -> 10300
A190: 188 | B190: =R[-1]C+50 -> 10350
A191: 189 | B191: =R[-1]C+50 -> 10400
A192: 190 | B192: =R[-1]C+50 -> 10450
A193: 191 | B193: =R[-1]C+50 -> 10500
A194: 192 | B194: =R[-1]C+50 -> 10550
A195: 193 | B195: =R[-1]C+50 -> 10600
A196: 194 | B196: =R[-1]C+50 -> 10650
A197: 195 | B197: =R[-1]C+50 -> 10700
A198: 196 | B198: =R[-1]C+50 -> 10750
A199: 197 | B199: =R[-1]C+50 -> 10800
A200: 198 | B200: =R[-1]C+50 -> 10850
A201: 199 | B201: =R[-1]C+50 -> 10900
A202: 200 | B202: =R[-1]C+50 -> 10950
A203: 201 | B203: =R[-1]C+50 -> 11000
A204: 202 | B204: =R[-1]C+50 -> 11050
A205: 203 | B205: =R[-1]C+50 -> 11100
A206: 204 | B206: =R[-1]C+50 -> 11150
A207: 205 | B207: =R[-1]C+50 -> 11200
A208: 206 | B208: =R[-1]C+50 -> 11250
A209: 207 | B209: =R[-1]C+50 -> 11300
A210: 208 | B210: =R[-1]C+50 -> 11350
A211: 209 | B211: =R[-1]C+50 -> 11400
A212: 210 | B212: =R[-1]C+50 -> 11450
A213: 211 | B213: =R[-1]C+50 -> 11500
A214: 212 | B214: =R[-1]C+50 -> 11550
A215: 213 | B215: =R[-1]C+50 -> 11600
A216: 214 | B216: =R[-1]C+50 -> 11650
A217: 215 | B217: =R[-1]C+50 -> 11700
A218: 216 | B218: =R[-1]C+50 -> 11750
A219: 217 | B219: =R[-1]C+50 -> 11800
A220: 218 | B220: =R[-1]C+50 -> 11850
A221: 219 | B221: =R[-1]C+50 -> 11900
A222: 220 | B222: =R[-1]C+50 -> 11950
A223: 221 | B223: =R[-1]C+50 -> 12000
A224: 222 | B224: =R[-1]C+50 -> 12050
A225: 223 | B225: =R[-1]C+50 -> 12100
A226: 224 | B226: =R[-1]C+50 -> 12150
A227: 225 | B227: =R[-1]C+50 -> 12200
A228: 226 | B228: =R[-1]C+50 -> 12250
A229: 227 | B229: =R[-1]C+50 -> 12300
A230: 228 | B230: =R[-1]C+50 -> 12350
A231: 229 | B231: =R[-1]C+50 -> 12400
A232: 230 | B232: =R[-1]C+50 -> 12450
A233: 231 | B233: =R[-1]C+50 -> 12500
A234: 232 | B234: =R[-1]C+50 -> 12550
A235: 233 | B235: =R[-1]C+50 -> 12600
A236: 234 | B236: =R[-1]C+50 -> 12650
A237: 235 | B237: =R[-1]C+50 -> 12700
A238: 236 | B238: =R[-1]C+50 -> 12750
A239: 237 | B239: =R[-1]C+50 -> 12800
A240: 238 | B240: =R[-1]C+50 -> 12850
A241: 239 | B241: =R[-1]C+50 -> 12900
A242: 240 | B242: =R[-1]C+50 -> 12950
A243: 241 | B243: =R[-1]C+50 -> 13000
A244: 242 | B244: =R[-1]C+50 -> 13050
A245: 243 | B245: =R[-1]C+50 -> 13100
A246: 244 | B246: =R[-1]C+50 -> 13150
A247: 245 | B247: =R[-1]C+50 -> 13200
A248: 246 | B248: =R[-1]C+50 -> 13250
A249: 247 | B249: =R[-1]C+50 -> 13300
A250: 248 | B250: =R[-1]C+50 -> 13350
A251: 249 | B251: =R[-1]C+50 -> 13400
A252: 250 | B252: =R[-1]C+50 -> 13450
A253: 251 | B253: =R[-1]C+50 -> 13500
A254: 252 | B254: =R[-1]C+50 -> 13550
A255: 253 | B255: =R[-1]C+50 -> 13600
A256: 254 | B256: =R[-1]C+50 -> 13650
A257: 255 | B257: =R[-1]C+50 -> 13700
A258: 256 | B258: =R[-1]C+50 -> 13750
A259: 257 | B259: =R[-1]C+50 -> 13800
A260: 258 | B260: =R[-1]C+50 -> 13850
A261: 259 | B261: =R[-1]C+50 -> 13900
A262: 260 | B262: =R[-1]C+50 -> 13950
A263: 261 | B263: =R[-1]C+50 -> 14000
A264: 262 | B264: =R[-1]C+50 -> 14050
A265: 263 | B265: =R[-1]C+50 -> 14100
A266: 264 | B266: =R[-1]C+50 -> 14150
A267: 265 | B267: =R[-1]C+50 -> 14200
A268: 266 | B268: =R[-1]C+50 -> 14250
A269: 267 | B269: =R[-1]C+50 -> 14300
A270: 268 | B270: =R[-1]C+50 -> 14350
A271: 269 | B271: =R[-1]C+50 -> 14400
A272: 270 | B272: =R[-1]C+50 -> 14450
A273: 271 | B273: =R[-1]C+50 -> 14500
A274: 272 | B274: =R[-1]C+50 -> 14550
A275: 273 | B275: =R[-1]C+50 -> 14600
A276: 274 | B276: =R[-1]C+50 -> 14650
A277: 275 | B277: =R[-1]C+50 -> 14700
A278: 276 | B278: =R[-1]C+50 -> 14750
A279: 277 | B279: =R[-1]C+50 -> 14800
A280: 278 | B280: =R[-1]C+50 -> 14850
A281: 279 | B281: =R[-1]C+50 -> 14900
A282: 280 | B282: =R[-1]C+50 -> 14950
A283: 281 | B283: =R[-1]C+50 -> 15000
A284: 282 | B284: =R[-1]C+50 -> 15050
A285: 283 | B285: =R[-1]C+50 -> 15100
A286: 284 | B286: =R[-1]C+50 -> 15150
A287: 285 | B287: =R[-1]C+50 -> 15200
A288: 286 | B288: =R[-1]C+50 -> 15250
A289: 287 | B289: =R[-1]C+50 -> 15300
A290: 288 | B290: =R[-1]C+50 -> 15350
A291: 289 | B291: =R[-1]C+50 -> 15400
A292: 290 | B292: =R[-1]C+50 -> 15450
A293: 291 | B293: =R[-1]C+50 -> 15500
A294: 292 | B294: =R[-1]C+50 -> 15550
A295: 293 | B295: =R[-1]C+50 -> 15600
A296: 294 | B296: =R[-1]C+50 -> 15650
A297: 295 | B297: =R[-1]C+50 -> 15700
A298: 296 | B298: =R[-1]C+50 -> 15750
A299: 297 | B299: =R[-1]C+50 -> 15800
A300: 298 | B300: =R[-1]C+50 -> 15850
A301: 299 | B301: =R[-1]C+50 -> 15900
A302: 300 | B302: =R[-1]C+50 -> 15950
A303: 301 | B303: =R[-1]C+50 -> 16000
A304: 302 | B304: =R[-1]C+50 -> 16050
A305: 303 | B305: =R[-1]C+50 -> 16100
A306: 304 | B306: =R[-1]C+50 -> 16150
A307: 305 | B307: =R[-1]C+50 -> 16200
A308: 306 | B308: =R[-1]C+50 -> 16250
A309: 307 | B309: =R[-1]C+50 -> 16300
A310: 308 | B310: =R[-1]C+50 -> 16350
A311: 309 | B311: =R[-1]C+50 -> 16400
A312: 310 | B312: =R[-1]C+50 -> 16450
A313: 311 | B313: =R[-1]C+50 -> 16500
A314: 312 | B314: =R[-1]C+50 -> 16550
A315: 313 | B315: =R[-1]C+50 -> 16600
A316: 314 | B316: =R[-1]C+50 -> 16650
A317: 315 | B317: =R[-1]C+50 -> 16700
A318: 316 | B318: =R[-1]C+50 -> 16750
A319: 317 | B319: =R[-1]C+50 -> 16800
A320: 318 | B320: =R[-1]C+50 -> 16850
A321: 319 | B321: =R[-1]C+50 -> 16900
A322: 320 | B322: =R[-1]C+50 -> 16950
A323: 321 | B323: =R[-1]C+50 -> 17000
A324: 322 | B324: =R[-1]C+50 -> 17050
A325: 323 | B325: =R[-1]C+50 -> 17100
A326: 324 | B326: =R[-1]C+50 -> 17150
A327: 325 | B327: =R[-1]C+50 -> 17200
A328: 326 | B328: =R[-1]C+50 -> 17250
A329: 327 | B329: =R[-1]C+50 -> 17300
A330: 328 | B330: =R[-1]C+50 -> 17350
A331: 329 | B331: =R[-1]C+50 -> 17400
A332: 330 | B332: =R[-1]C+50 -> 17450
A333: 331 | B333: =R[-1]C+50 -> 17500
A334: 332 | B334: =R[-1]C+50 -> 17550
A335: 333 | B335: =R[-1]C+50 -> 17600
A336: 334 | B336: =R[-1]C+50 -> 17650
A337: 335 | B337: =R[-1]C+50 -> 17700
A338: 336 | B338: =R[-1]C+50 -> 17750
A339: 337 | B339: =R[-1]C+50 -> 17800
A340: 338 | B340: =R[-1]C+50 -> 17850
A341: 339 | B341: =R[-1]C+50 -> 17900
A342: 340 | B342: =R[-1]C+50 -> 17950
A343: 341 | B343: =R[-1]C+50 -> 18000
A344: 342 | B344: =R[-1]C+50 -> 18050
A345: 343 | B345: =R[-1]C+50 -> 18100
A346: 344 | B346: =R[-1]C+50 -> 18150
A347: 345 | B347: =R[-1]C+50 -> 18200
A348: 346 | B348: =R[-1]C+50 -> 18250
A349: 347 | B349: =R[-1]C+50 -> 18300
A350: 348 | B350: =R[-1]C+50 -> 18350
A351: 349 | B351: =R[-1]C+50 -> 18400
A352: 350 | B352: =R[-1]C+50 -> 18450
A353: 351 | B353: =R[-1]C+50 -> 18500
A354: 352 | B354: =R[-1]C+50 -> 18550
A355: 353 | B355: =R[-1]C+50 -> 18600
A356: 354 | B356: =R[-1]C+50 -> 18650
A357: 355 | B357: =R[-1]C+50 -> 18700
A358: 356 | B358: =R[-1]C+50 -> 18750
A359: 357 | B359: =R[-1]C+50 -> 18800
A360: 358 | B360: =R[-1]C+50 -> 18850
A361: 359 | B361: =R[-1]C+50 -> 18900
A362: 360 | B362: =R[-1]C+50 -> 18950
A363: 361 | B363: =R[-1]C+50 -> 19000
A364: 362 | B364: =R[-1]C+50 -> 19050
A365: 363 | B365: =R[-1]C+50 -> 19100
A366: 364 | B366: =R[-1]C+50 -> 19150
A367: 365 | B367: =R[-1]C+50 -> 19200
A368: 366 | B368: =R[-1]C+50 -> 19250
A369: 367 | B369: =R[-1]C+50 -> 19300
A370: 368 | B370: =R[-1]C+50 -> 19350
A371: 369 | B371: =R[-1]C+50 -> 19400
A372: 370 | B372: =R[-1]C+50 -> 19450
A373: 371 | B373: =R[-1]C+50 -> 19500
A374: 372 | B374: =R[-1]C+50 -> 19550
A375: 373 | B375: =R[-1]C+50 -> 19600
A376: 374 | B376: =R[-1]C+50 -> 19650
A377: 375 | B377: =R[-1]C+50 -> 19700
A378: 376 | B378: =R[-1]C+50 -> 19750
A379: 377 | B379: =R[-1]C+50 -> 19800
A380: 378 | B380: =R[-1]C+50 -> 19850
A381: 379 | B381: =R[-1]C+50 -> 19900
A382: 380 | B382: =R[-1]C+50 -> 19950
A383: 381 | B383: =R[-1]C+50 -> 20000
A384: 382 | B384: =R[-1]C+50 -> 20050
A385: 383 | B385: =R[-1]C+50 -> 20100
A386: 384 | B386: =R[-1]C+50 -> 20150
A387: 385 | B387: =R[-1]C+50 -> 20200
A388: 386 | B388: =R[-1]C+50 -> 20250
A389: 387 | B389: =R[-1]C+50 -> 20300
A390: 388 | B390: =R[-1]C+50 -> 20350
A391: 389 | B391: =R[-1]C+50 -> 20400
A392: 390 | B392: =R[-1]C+50 -> 20450
A393: 391 | B393: =R[-1]C+50 -> 20500
A394: 392 | B394: =R[-1]C+50 -> 20550
A395: 393 | B395: =R[-1]C+50 -> 20600
A396: 394 | B396: =R[-1]C+50 -> 20650
A397: 395 | B397: =R[-1]C+50 -> 20700
A398: 396 | B398: =R[-1]C+50 -> 20750
A399: 397 | B399: =R[-1]C+50 -> 20800
A400: 398 | B400: =R[-1]C+50 -> 20850
A401: 399 | B401: =R[-1]C+50 -> 20900
A402: 400 | B402: =R[-1]C+50 -> 20950
A403: 401 | B403: =R[-1]C+50 -> 21000
A404: 402 | B404: =R[-1]C+50 -> 21050
A405: 403 | B405: =R[-1]C+50 -> 21100
A406: 404 | B406: =R[-1]C+50 -> 21150
A407: 405 | B407: =R[-1]C+50 -> 21200
A408: 406 | B408: =R[-1]C+50 -> 21250
A409: 407 | B409: =R[-1]C+50 -> 21300
A410: 408 | B410: =R[-1]C+50 -> 21350
A411: 409 | B411: =R[-1]C+50 -> 21400
A412: 410 | B412: =R[-1]C+50 -> 21450
A413: 411 | B413: =R[-1]C+50 -> 21500
A414: 412 | B414: =R[-1]C+50 -> 21550
A415: 413 | B415: =R[-1]C+50 -> 21600
A416: 414 | B416: =R[-1]C+50 -> 21650
A417: 415 | B417: =R[-1]C+50 -> 21700
A418: 416 | B418: =R[-1]C+50 -> 21750
A419: 417 | B419: =R[-1]C+50 -> 21800
A420: 418 | B420: =R[-1]C+50 -> 21850
A421: 419 | B421: =R[-1]C+50 -> 21900
A422: 420 | B422: =R[-1]C+50 -> 21950
A423: 421 | B423: =R[-1]C+50 -> 22000
A424: 422 | B424: =R[-1]C+50 -> 22050
A425: 423 | B425: =R[-1]C+50 -> 22100
A426: 424 | B426: =R[-1]C+50 -> 22150
A427: 425 | B427: =R[-1]C+50 -> 22200
A428: 426 | B428: =R[-1]C+50 -> 22250
A429: 427 | B429: =R[-1]C+50 -> 22300
A430: 428 | B430: =R[-1]C+50 -> 22350
A431: 429 | B431: =R[-1]C+50 -> 22400
A432: 430 | B432: =R[-1]C+50 -> 22450
A433: 431 | B433: =R[-1]C+50 -> 22500
A434: 432 | B434: =R[-1]C+50 -> 22550
A435: 433 | B435: =R[-1]C+50 -> 22600
A436: 434 | B436: =R[-1]C+50 -> 22650
A437: 435 | B437: =R[-1]C+50 -> 22700
A438: 436 | B438: =R[-1]C+50 -> 22750
A439: 437 | B439: =R[-1]C+50 -> 22800
A440: 438 | B440: =R[-1]C+50 -> 22850
A441: 439 | B441: =R[-1]C+50 -> 22900
A442: 440 | B442: =R[-1]C+50 -> 22950
A443: 441 | B443: =R[-1]C+50 -> 23000
A444: 442 | B444: =R[-1]C+50 -> 23050
A445: 443 | B445: =R[-1]C+50 -> 23100
A446: 444 | B446: =R[-1]C+50 -> 23150
A447: 445 | B447: =R[-1]C+50 -> 23200
A448: 446 | B448: =R[-1]C+50 -> 23250
A449: 447 | B449: =R[-1]C+50 -> 23300
A450: 448 | B450: =R[-1]C+50 -> 23350
A451: 449 | B451: =R[-1]C+50 -> 23400
A452: 450 | B452: =R[-1]C+50 -> 23450
A453: 451 | B453: =R[-1]C+50 -> 23500
A454: 452 | B454: =R[-1]C+50 -> 23550
A455: 453 | B455: =R[-1]C+50 -> 23600
A456: 454 | B456: =R[-1]C+50 -> 23650
A457: 455 | B457: =R[-1]C+50 -> 23700
A458: 456 | B458: =R[-1]C+50 -> 23750
A459: 457 | B459: =R[-1]C+50 -> 23800
A460: 458 | B460: =R[-1]C+50 -> 23850
A461: 459 | B461: =R[-1]C+50 -> 23900
A462: 460 | B462: =R[-1]C+50 -> 23950
A463: 461 | B463: =R[-1]C+50 -> 24000
A464: 462 | B464: =R[-1]C+50 -> 24050
A465: 463 | B465: =R[-1]C+50 -> 24100
A466: 464 | B466: =R[-1]C+50 -> 24150
A467: 465 | B467: =R[-1]C+50 -> 24200
A468: 466 | B468: =R[-1]C+50 -> 24250
A469: 467 | B469: =R[-1]C+50 -> 24300
A470: 468 | B470: =R[-1]C+50 -> 24350
A471: 469 | B471: =R[-1]C+50 -> 24400
A472: 470 | B472: =R[-1]C+50 -> 24450
A473: 471 | B473: =R[-1]C+50 -> 24500
A474: 472 | B474: =R[-1]C+50 -> 24550
A475: 473 | B475: =R[-1]C+50 -> 24600
A476: 474 | B476: =R[-1]C+50 -> 24650
A477: 475 | B477: =R[-1]C+50 -> 24700
A478: 476 | B478: =R[-1]C+50 -> 24750
A479: 477 | B479: =R[-1]C+50 -> 24800
A480: 478 | B480: =R[-1]C+50 -> 24850
A481: 479 | B481: =R[-1]C+50 -> 24900
A482: 480 | B482: =R[-1]C+50 -> 24950
A483: 481 | B483: =R[-1]C+50 -> 25000
A484: 482 | B484: =R[-1]C+50 -> 25050
A485: 483 | B485: =R[-1]C+50 -> 25100
A486: 484 | B486: =R[-1]C+50 -> 25150
A487: 485 | B487: =R[-1]C+50 -> 25200
A488: 486 | B488: =R[-1]C+50 -> 25250
A489: 487 | B489: =R[-1]C+50 -> 25300
A490: 488 | B490: =R[-1]C+50 -> 25350
A491: 489 | B491: =R[-1]C+50 -> 25400
A492: 490 | B492: =R[-1]C+50 -> 25450
A493: 491 | B493: =R[-1]C+50 -> 25500
A494: 492 | B494: =R[-1]C+50 -> 25550
A495: 493 | B495: =R[-1]C+50 -> 25600
A496: 494 | B496: =R[-1]C+50 -> 25650
A497: 495 | B497: =R[-1]C+50 -> 25700
A498: 496 | B498: =R[-1]C+50 -> 25750
A499: 497 | B499: =R[-1]C+50 -> 25800
A500: 498 | B500: =R[-1]C+50 -> 25850
A501: 499 | B501: =R[-1]C+50 -> 25900
A502: 500 | B502: =R[-1]C+50 -> 25950

Sheet: export
A1: sheet_name | B1: export_name | C1: merge_to
A2: 通关仙币奖励 | B2: task_through_reward