Sheet: 任务扫荡产出表
A1: 大章序号 | B1: 铜板产出 | C1: 经验产出
A2: id | B2: money_obtain | C2: exp_obtain
A3: 1 | B3: =RC[1]*15 -> 750 | C3: 50
A4: 2 | B4: =RC[1]*15 -> 780 | C4: =R[-1]C+2 -> 52
A5: 3 | B5: =RC[1]*15 -> 810 | C5: =R[-1]C+2 -> 54
A6: 4 | B6: =RC[1]*15 -> 840 | C6: =R[-1]C+2 -> 56
A7: 5 | B7: =RC[1]*15 -> 870 | C7: =R[-1]C+2 -> 58
A8: 6 | B8: =RC[1]*15 -> 900 | C8: =R[-1]C+2 -> 60
A9: 7 | B9: =RC[1]*15 -> 930 | C9: =R[-1]C+2 -> 62
A10: 8 | B10: =RC[1]*15 -> 960 | C10: =R[-1]C+2 -> 64
A11: 9 | B11: =RC[1]*15 -> 990 | C11: =R[-1]C+2 -> 66
A12: 10 | B12: =RC[1]*15 -> 1020 | C12: =R[-1]C+2 -> 68
A13: 11 | B13: =RC[1]*15 -> 1050 | C13: =R[-1]C+2 -> 70
A14: 12 | B14: =RC[1]*15 -> 1080 | C14: =R[-1]C+2 -> 72
A15: 13 | B15: =RC[1]*15 -> 1110 | C15: =R[-1]C+2 -> 74
A16: 14 | B16: =RC[1]*15 -> 1140 | C16: =R[-1]C+2 -> 76
A17: 15 | B17: =RC[1]*15 -> 1170 | C17: =R[-1]C+2 -> 78
A18: 16 | B18: =RC[1]*15 -> 1200 | C18: =R[-1]C+2 -> 80
A19: 17 | B19: =RC[1]*15 -> 1230 | C19: =R[-1]C+2 -> 82
A20: 18 | B20: =RC[1]*15 -> 1260 | C20: =R[-1]C+2 -> 84
A21: 19 | B21: =RC[1]*15 -> 1290 | C21: =R[-1]C+2 -> 86
A22: 20 | B22: =RC[1]*15 -> 1320 | C22: =R[-1]C+2 -> 88
A23: 21 | B23: =RC[1]*15 -> 1350 | C23: =R[-1]C+2 -> 90
A24: 22 | B24: =RC[1]*15 -> 1380 | C24: =R[-1]C+2 -> 92
A25: 23 | B25: =RC[1]*15 -> 1410 | C25: =R[-1]C+2 -> 94
A26: 24 | B26: =RC[1]*15 -> 1440 | C26: =R[-1]C+2 -> 96
A27: 25 | B27: =RC[1]*15 -> 1470 | C27: =R[-1]C+2 -> 98
A28: 26 | B28: =RC[1]*15 -> 1500 | C28: =R[-1]C+2 -> 100
A29: 27 | B29: =RC[1]*15 -> 1530 | C29: =R[-1]C+2 -> 102
A30: 28 | B30: =RC[1]*15 -> 1560 | C30: =R[-1]C+2 -> 104
A31: 29 | B31: =RC[1]*15 -> 1590 | C31: =R[-1]C+2 -> 106
A32: 30 | B32: =RC[1]*15 -> 1620 | C32: =R[-1]C+2 -> 108
A33: 31 | B33: =RC[1]*15 -> 1650 | C33: =R[-1]C+2 -> 110
A34: 32 | B34: =RC[1]*15 -> 1680 | C34: =R[-1]C+2 -> 112
A35: 33 | B35: =RC[1]*15 -> 1710 | C35: =R[-1]C+2 -> 114
A36: 34 | B36: =RC[1]*15 -> 1740 | C36: =R[-1]C+2 -> 116
A37: 35 | B37: =RC[1]*15 -> 1770 | C37: =R[-1]C+2 -> 118
A38: 36 | B38: =RC[1]*15 -> 1800 | C38: =R[-1]C+2 -> 120
A39: 37 | B39: =RC[1]*15 -> 1830 | C39: =R[-1]C+2 -> 122
A40: 38 | B40: =RC[1]*15 -> 1860 | C40: =R[-1]C+2 -> 124
A41: 39 | B41: =RC[1]*15 -> 1890 | C41: =R[-1]C+2 -> 126
A42: 40 | B42: =RC[1]*15 -> 1920 | C42: =R[-1]C+2 -> 128
A43: 41 | B43: =RC[1]*15 -> 1950 | C43: =R[-1]C+2 -> 130
A44: 42 | B44: =RC[1]*15 -> 1980 | C44: =R[-1]C+2 -> 132
A45: 43 | B45: =RC[1]*15 -> 2010 | C45: =R[-1]C+2 -> 134
A46: 44 | B46: =RC[1]*15 -> 2040 | C46: =R[-1]C+2 -> 136
A47: 45 | B47: =RC[1]*15 -> 2070 | C47: =R[-1]C+2 -> 138
A48: 46 | B48: =RC[1]*15 -> 2100 | C48: =R[-1]C+2 -> 140
A49: 47 | B49: =RC[1]*15 -> 2130 | C49: =R[-1]C+2 -> 142
A50: 48 | B50: =RC[1]*15 -> 2160 | C50: =R[-1]C+2 -> 144
A51: 49 | B51: =RC[1]*15 -> 2190 | C51: =R[-1]C+2 -> 146
A52: 50 | B52: =RC[1]*15 -> 2220 | C52: =R[-1]C+2 -> 148

Sheet: export
A1: sheet_name | B1: export_name | C1: merge_to
A2: 任务扫荡产出表 | B2: wipe_out