Sheet: 成就配置表
A1: id | B1: 函数 | C1: 参数 | D1: 名称 | E1: 描述 | F1: 奖励魔石 | G1: 奖励活力点
A2: id | B2: method | C2: need | D2: name | E2: desc | F2: gold | G2: energy
A3: 1 | B3: levelTo | C3: 50 | D3: 升级达人 | E3: 角色等级达到50级 | F3: 50 | G3: 100
A4: 2 | B4: levelTo | C4: 90 | D4: 疯狂升级 | E4: 角色等级达到90级 | F4: 100 | G4: 1000
A5: 3 | B5: passTo | C5: 50 | D5: 一半！ | E5: 天道闯过50层 | F5: 50 | G5: 100
A6: 4 | B6: passTo | C6: 100 | D6: 通关！ | E6: 天道闯过100层 | F6: 200 | G6: 1000
A7: 5 | B7: winCount | C7: 50 | D7: 小试牛刀 | E7: 竞技获胜次数达到50场 | F7: 50 | G7: 100
A8: 6 | B8: winCount | C8: 5000 | D8: 已经超神了 | E8: 竞技获胜次数达到5000场 | F8: 100 | G8: 1000
A9: 7 | B9: winningStreak | C9: 50 | D9: 所向披靡 | E9: 竞技最高连胜达到50次 | F9: 100 | G9: 1000
A10: 8 | B10: rankingToOne | C10: 1 | D10: 寂寞 | E10: 竞技排名达到第1 | F10: 100 | G10: 1000
A11: 9 | B11: v587 | C11: 1 | D11: 霸气外射！ | E11: 竞技场中以1敌5，战胜对方 | F11: 50 | G11: 500
A12: 10 | B12: friends | C12: 20 | D12: 我们约会吧 | E12: 拥有20个好友 | F12: 50 | G12: 500
A13: 11 | B13: gaveBless | C13: 500 | D13: 无私奉献 | E13: 为好友送出祝福达到500次 | F13: 50 | G13: 500
A14: 12 | B14: receivedBless | C14: 100 | D14: 爱是相互的 | E14: 收到好友祝福次数达到100次 | F14: 300 | G14: 2000
A15: 13 | B15: star5card | C15: 1 | D15: 质的飞跃 | E15: 获得1张5星卡 | F15: 50 | G15: 100
A16: 14 | B16: star5cardFullLevel | C16: 1 | D16: 这就是实力 | E16: 将1张5星卡强化到满级 | F16: 50 | G16: 500
A17: 15 | B17: star5card | C17: 5 | D17: 你就是神！ | E17: 获得5张5星卡 | F17: 100 | G17: 1000
A18: 16 | B18: psTo10 | C18: 1 | D18: 但求最好 | E18: 拥有1个10%的被动属性 | F18: 100 | G18: 100
A19: 17 | B19: elixirTo | C19: 10000000 | D19: 一大波仙丹 | E19: 累计获得1000万仙丹 | F19: 50 | G19: 500
A20: 18 | B20: energyTo | C20: 10000000 | D20: 活力无限 | E20: 累计获得1000万活力点 | F20: 100 | G20: 1000
A21: 19 | B21: luckyCardCount | C21: 99999 | D21: 抽卡狂魔 | E21: 抽卡总次数达到99999 | F21: 100 | G21: 500
A22: 20 | B22: highLuckyCardCount | C22: 88888 | D22: 钱就是个屁 | E22: 高级抽卡总次数达到88888 | F22: 100 | G22: 1000
A23: 21 | B23: soLucky | C23: 1 | D23: 买彩票去吧 | E23: 用1张素材卡成功进阶该卡牌 | F23: 100 | G23: 500
A24: 22 | B24: powerConsume | C24: 10000000 | D24: 孜孜不倦 | E24: 累计消耗体力1000万 | F24: 100 | G24: 500
A25: 24 | B25: moneyConsume | C25: 90000000 | D25: 不差钱 | E25: 累计消耗仙币9000万 | F25: 100 | G25: 500
A26: 25 | B26: goldConsume | C26: 10000000 | D26: 挥金如土 | E26: 累计消耗魔石1000万 | F26: 100 | G26: 500
A27: 26 | B27: taskPoinTo | C27: 10 | D27: 十步之遥 | E27: 修炼里探索总进度达到10 | F27: 20 | G27: 500
A28: 27 | B28: taskChapterPassTo | C28: 1 | D28: 鬼门关之旅 | E28: 通关鬼门关 | F28: 20 | G28: 500
A29: 28 | B29: passFirstWin | C29: 1 | D29: 天道首胜 | E29: 在天道中获得第一场胜利 | F29: 20 | G29: 500
A30: 29 | B30: taskPartPassTo | C30: 1 | D30: 苦寒地狱 | E30: 通关苦寒地狱篇章 | F30: 20 | G30: 500
A31: 30 | B31: taskPartPassTo | C31: 2 | D31: 凄凉人间 | E31: 通关凄凉人间篇章 | F31: 20 | G31: 500
A32: 31 | B32: taskPartPassTo | C32: 3 | D32: 南天之门 | E32: 通关南天之门篇章 | F32: 20 | G32: 500
A33: 32 | B33: taskPartPassTo | C33: 4 | D33: 西天取经 | E33: 通关西天取经篇章 | F33: 20 | G33: 500
A34: 33 | B34: taskPartPassTo | C34: 5 | D34: 莲花加持 | E34: 通关莲花加持篇章 | F34: 20 | G34: 500
A35: 34 | B35: taskPartPassTo | C35: 6 | D35: 千年之修 | E35: 通关千年之修篇章 | F35: 20 | G35: 500
A36: 35 | B36: taskPartPassTo | C36: 7 | D36: 斩妖除魔 | E36: 通关斩妖除魔篇章 | F36: 20 | G36: 500
A37: 36 | B37: taskPartPassTo | C37: 8 | D37: 降龙伏虎 | E37: 通关降龙伏虎篇章 | F37: 20 | G37: 500
A38: 37 | B38: taskPartPassTo | C38: 9 | D38: 普度众生 | E38: 通关普度众生篇章 | F38: 20 | G38: 500
A39: 38 | B39: taskPartPassTo | C39: 10 | D39: 尊者之身 | E39: 通关尊者之身篇章 | F39: 20 | G39: 500
A40: 39 | B40: vipTo | C40: 1 | D40: 尊者VIP1 | E40: 成为VIP1玩家 | F40: 50 | G40: 500
A41: 40 | B41: vipTo | C41: 2 | D41: 尊者VIP2 | E41: 成为VIP2玩家 | F41: 100 | G41: =R[-1]C+50 -> 550
A42: 41 | B42: vipTo | C42: 3 | D42: 尊者VIP3 | E42: 成为VIP3玩家 | F42: 150 | G42: =R[-1]C+100 -> 650
A43: 42 | B43: vipTo | C43: 4 | D43: 尊者VIP4 | E43: 成为VIP4玩家 | F43: 200 | G43: =R[-1]C+100 -> 750
A44: 43 | B44: vipTo | C44: 5 | D44: 尊者VIP5 | E44: 成为VIP5玩家 | F44: 250 | G44: =R[-1]C+100 -> 850
A45: 44 | B45: vipTo | C45: 6 | D45: 尊者VIP6 | E45: 成为VIP6玩家 | F45: 300 | G45: =R[-1]C+100 -> 950
A46: 45 | B46: vipTo | C46: 7 | D46: 尊者VIP7 | E46: 成为VIP7玩家 | F46: 350 | G46: =R[-1]C+100 -> 1050
A47: 46 | B47: vipTo | C47: 8 | D47: 尊者VIP8 | E47: 成为VIP8玩家 | F47: =R[-1]C+50 -> 400 | G47: =R[-1]C+100 -> 1150
A48: 47 | B48: vipTo | C48: 9 | D48: 尊者VIP9 | E48: 成为VIP9玩家 | F48: =R[-1]C+50 -> 450 | G48: =R[-1]C+100 -> 1250
A49: 48 | B49: vipTo | C49: 10 | D49: 尊者VIP10 | E49: 成为VIP10玩家 | F49: =R[-1]C+50 -> 500 | G49: =R[-1]C+100 -> 1350
A50: 49 | B50: vipTo | C50: 11 | D50: 尊者VIP11 | E50: 成为VIP11玩家 | F50: =R[-1]C+50 -> 550 | G50: =R[-1]C+100 -> 1450
A51: 50 | B51: vipTo | C51: 12 | D51: 尊者VIP12 | E51: 成为VIP12玩家 | F51: =R[-1]C+50 -> 600 | G51: 5000
A52: 51 | B52: passPhaseTo | C52: 1 | D52: 降魔大王 | E52: 通关天道里第1阶魔道 | F52: 50 | G52: 500
A53: 52 | B53: passPhaseTo | C53: 2 | D53: 降魔使者 | E53: 通关天道里第2阶魔道 | F53: 100 | G53: =R[-1]C+500 -> 1000
A54: 53 | B54: passPhaseTo | C54: 3 | D54: 降魔罗汉 | E54: 通关天道里第3阶魔道 | F54: 150 | G54: =R[-1]C+500 -> 1500
A55: 54 | B55: passPhaseTo | C55: 4 | D55: 降魔神君 | E55: 通关天道里第4阶魔道 | F55: 200 | G55: =R[-1]C+500 -> 2000
A56: 55 | B56: passPhaseTo | C56: 5 | D56: 降魔圣者 | E56: 通关天道里第5阶魔道 | F56: 250 | G56: =R[-1]C+500 -> 2500

Sheet: export
A1: sheet_name | B1: export_name
A2: 成就配置表 | B2: achievement