Sheet: 寻宝配置表
A1: 序号 | B1: 类型 | C1: 值 | D1: 名称 | E1: 类型概率 | F1: 值概率 | G1: 实际概率
A2: id | B2: type | C2: value | D2: name | E2: type_rate | F2: value_rate | G2: rate
A3: 0 | B3: power | C3: 10 | D3: 体力 | E3: 5 | F3: 85 | G3: =RC[-2]*RC[-1]/100 -> 4.25
A4: 1 | B4: power | C4: 50 | D4: 体力 | E4: 5 | F4: 14 | G4: =RC[-2]*RC[-1]/100 -> 0.7
A5: 2 | B5: power | C5: 100 | D5: 体力 | E5: 5 | F5: 1 | G5: =RC[-2]*RC[-1]/100 -> 0.05
A6: 3 | B6: elixir | C6: 1000 | D6: 仙丹 | E6: 20 | F6: 85 | G6: =RC[-2]*RC[-1]/100 -> 17
A7: 4 | B7: elixir | C7: 5000 | D7: 仙丹 | E7: 20 | F7: 14 | G7: =RC[-2]*RC[-1]/100 -> 2.8
A8: 5 | B8: elixir | C8: 20000 | D8: 仙丹 | E8: 20 | F8: 1 | G8: =RC[-2]*RC[-1]/100 -> 0.2
A9: 6 | B9: spirit | C9: 50 | D9: 灵气 | E9: 15 | F9: 85 | G9: =RC[-2]*RC[-1]/100 -> 12.75
A10: 7 | B10: spirit | C10: 200 | D10: 灵气 | E10: 15 | F10: 14 | G10: =RC[-2]*RC[-1]/100 -> 2.1
A11: 8 | B11: spirit | C11: 500 | D11: 灵气 | E11: 15 | F11: 1 | G11: =RC[-2]*RC[-1]/100 -> 0.15
A12: 9 | B12: skillPoint | C12: 1000 | D12: 技能点 | E12: 20 | F12: 85 | G12: =RC[-2]*RC[-1]/100 -> 17
A13: 10 | B13: skillPoint | C13: 5000 | D13: 技能点 | E13: 20 | F13: 14 | G13: =RC[-2]*RC[-1]/100 -> 2.8
A14: 11 | B14: skillPoint | C14: 20000 | D14: 技能点 | E14: 20 | F14: 1 | G14: =RC[-2]*RC[-1]/100 -> 0.2
A15: 12 | B15: energy | C15: 500 | D15: 活力点 | E15: 15 | F15: 85 | G15: =RC[-2]*RC[-1]/100 -> 12.75
A16: 13 | B16: energy | C16: 1000 | D16: 活力点 | E16: 15 | F16: 14 | G16: =RC[-2]*RC[-1]/100 -> 2.1
A17: 14 | B17: energy | C17: 5000 | D17: 活力点 | E17: 15 | F17: 1 | G17: =RC[-2]*RC[-1]/100 -> 0.15
A18: 15 | B18: money | C18: 10000 | D18: 仙币 | E18: 20 | F18: 85 | G18: =RC[-2]*RC[-1]/100 -> 17
A19: 16 | B19: money | C19: 30000 | D19: 仙币 | E19: 20 | F19: 14 | G19: =RC[-2]*RC[-1]/100 -> 2.8
A20: 17 | B20: money | C20: 100000 | D20: 仙币 | E20: 20 | F20: 1 | G20: =RC[-2]*RC[-1]/100 -> 0.2
A21: 18 | B21: gold | C21: 10 | D21: 魔石 | E21: 5 | F21: 99 | G21: =RC[-2]*RC[-1]/100 -> 4.95
A22: 19 | B22: gold | C22: 500 | D22: 魔石 | E22: 5 | F22: 1 | G22: =RC[-2]*RC[-1]/100 -> 0.05

Sheet: export
A1: sheet_name | B1: export_name | C1: merge_to
A2: 寻宝配置表 | B2: treasure_hunt