Sheet:  发放表说明
A1: 表功能说明：
A2: 怪物奖励配置表 | B2: 配置关卡中每只怪物的奖励
A3: 活跃度奖励配置表 | B3: 配置活跃度奖励
A4: 登入抽奖配置表 | B4: 配置登陆抽奖奖励
A5: 在线奖励配置表 | B5: 配置在线奖励
A6: 奖励表 | B6: 失效
A7: 荣誉表 | B7: 配置擂台荣誉积分能换取的奖励
A8: 宝箱奖励表 | B8: 配置访问好友山庄开启宝箱能获得的奖励
A9: 邀请奖励表 | B9: 配置邀请好友加入游戏能够获得的奖励
A10: 征收奖励表 | B10: 配置搜刮奴隶能够获得的奖励
A11: 资源自生产表 | B11: 失效
A12: 矿洞开采表 | B12: 配置矿洞开采的产量
A13: 擂台排名奖励表 | B13: 配置擂台排名所对应的奖励
A14: 侠客转世表 | B14: 配置侠客转世公式
A15: 寻宝奖励表 | B15: 失效
A16: 悬赏奖励表 | B16: 未启用
A17: 罚恶令伤害奖励表 | B17: 配置罚恶令伤害比率奖励
A18: 罚恶令排行奖励表 | B18: 配置罚恶令输出排行奖励
A19: 精英关卡奖励配置表 | B19: 配置精英关卡相关奖励
A21: 配置规则：
A22: 1.id值确定了每行数据的唯一性，方便索引数据。
A23: 2.reward_type和reward_args两个参数组合在一起来确定奖励的内容，可以重复多组以达到一次性奖励多个物品的目的

Sheet: 怪物奖励配置表
A1: 组队ID | B1: 奖励类型 | C1: 参数列表 | D1: 奖励类型 | E1: 参数列表 | F1: 奖励类型 | G1: 参数列表
A2: id | B2: reward_type | C2: reward_args | D2: reward_type | E2: reward_args | F2: reward_type | G2: reward_args
A3: 1 | B3: player_exp | C3: 10 | D3: money | E3: =RC[-2]*10 -> 100 | F3: hero_exp | G3: 10
A4: 2 | B4: player_exp | C4: 10 | D4: money | E4: =RC[-2]*10 -> 100 | F4: hero_exp | G4: 10
A5: 3 | B5: player_exp | C5: 12 | D5: money | E5: =RC[-2]*10 -> 120 | F5: hero_exp | G5: 12
A6: 4 | B6: player_exp | C6: 12 | D6: money | E6: =RC[-2]*10 -> 120 | F6: hero_exp | G6: 12
A7: 5 | B7: player_exp | C7: 14 | D7: money | E7: =RC[-2]*10 -> 140 | F7: hero_exp | G7: 14
A8: 6 | B8: player_exp | C8: 14 | D8: money | E8: =RC[-2]*10 -> 140 | F8: hero_exp | G8: 14
A9: 7 | B9: player_exp | C9: 14 | D9: money | E9: =RC[-2]*10 -> 140 | F9: hero_exp | G9: 14
A10: 8 | B10: player_exp | C10: 16 | D10: money | E10: =RC[-2]*10 -> 160 | F10: hero_exp | G10: 16
A11: 9 | B11: player_exp | C11: 16 | D11: money | E11: =RC[-2]*10 -> 160 | F11: hero_exp | G11: 16
A12: 10 | B12: player_exp | C12: 16 | D12: money | E12: =RC[-2]*10 -> 160 | F12: hero_exp | G12: 16
A13: 11 | B13: player_exp | C13: 18 | D13: money | E13: =RC[-2]*10 -> 180 | F13: hero_exp | G13: 18
A14: 12 | B14: player_exp | C14: 18 | D14: money | E14: =RC[-2]*10 -> 180 | F14: hero_exp | G14: 18
A15: 13 | B15: player_exp | C15: 18 | D15: money | E15: =RC[-2]*10 -> 180 | F15: hero_exp | G15: 18
A16: 14 | B16: player_exp | C16: 20 | D16: money | E16: =RC[-2]*10 -> 200 | F16: hero_exp | G16: 20
A17: 15 | B17: player_exp | C17: 20 | D17: money | E17: =RC[-2]*10 -> 200 | F17: hero_exp | G17: 20
A18: 16 | B18: player_exp | C18: 20 | D18: money | E18: =RC[-2]*10 -> 200 | F18: hero_exp | G18: 20
A19: 17 | B19: player_exp | C19: 20 | D19: money | E19: =RC[-2]*10 -> 200 | F19: hero_exp | G19: 20
A20: 18 | B20: player_exp | C20: 22 | D20: money | E20: =RC[-2]*10 -> 220 | F20: hero_exp | G20: 22
A21: 19 | B21: player_exp | C21: 22 | D21: money | E21: =RC[-2]*10 -> 220 | F21: hero_exp | G21: 22
A22: 20 | B22: player_exp | C22: 22 | D22: money | E22: =RC[-2]*10 -> 220 | F22: hero_exp | G22: 22
A23: 21 | B23: player_exp | C23: 22 | D23: money | E23: =RC[-2]*10 -> 220 | F23: hero_exp | G23: 22
A24: 22 | B24: player_exp | C24: 24 | D24: money | E24: =RC[-2]*10 -> 240 | F24: hero_exp | G24: 24
A25: 23 | B25: player_exp | C25: 24 | D25: money | E25: =RC[-2]*10 -> 240 | F25: hero_exp | G25: 24
A26: 24 | B26: player_exp | C26: 24 | D26: money | E26: =RC[-2]*10 -> 240 | F26: hero_exp | G26: 24
A27: 25 | B27: player_exp | C27: 24 | D27: money | E27: =RC[-2]*10 -> 240 | F27: hero_exp | G27: 24
A28: 26 | B28: player_exp | C28: 26 | D28: money | E28: =RC[-2]*10 -> 260 | F28: hero_exp | G28: 26
A29: 27 | B29: player_exp | C29: 26 | D29: money | E29: =RC[-2]*10 -> 260 | F29: hero_exp | G29: 26
A30: 28 | B30: player_exp | C30: 26 | D30: money | E30: =RC[-2]*10 -> 260 | F30: hero_exp | G30: 26
A31: 29 | B31: player_exp | C31: 26 | D31: money | E31: =RC[-2]*10 -> 260 | F31: hero_exp | G31: 26
A32: 30 | B32: player_exp | C32: 26 | D32: money | E32: =RC[-2]*10 -> 260 | F32: hero_exp | G32: 26
A33: 31 | B33: player_exp | C33: 28 | D33: money | E33: =RC[-2]*10 -> 280 | F33: hero_exp | G33: 28
A34: 32 | B34: player_exp | C34: 28 | D34: money | E34: =RC[-2]*10 -> 280 | F34: hero_exp | G34: 28
A35: 33 | B35: player_exp | C35: 28 | D35: money | E35: =RC[-2]*10 -> 280 | F35: hero_exp | G35: 28
A36: 34 | B36: player_exp | C36: 28 | D36: money | E36: =RC[-2]*10 -> 280 | F36: hero_exp | G36: 28
A37: 35 | B37: player_exp | C37: 28 | D37: money | E37: =RC[-2]*10 -> 280 | F37: hero_exp | G37: 28
A38: 36 | B38: player_exp | C38: 30 | D38: money | E38: =RC[-2]*10 -> 300 | F38: hero_exp | G38: 30
A39: 37 | B39: player_exp | C39: 30 | D39: money | E39: =RC[-2]*10 -> 300 | F39: hero_exp | G39: 30
A40: 38 | B40: player_exp | C40: 30 | D40: money | E40: =RC[-2]*10 -> 300 | F40: hero_exp | G40: 30
A41: 39 | B41: player_exp | C41: 30 | D41: money | E41: =RC[-2]*10 -> 300 | F41: hero_exp | G41: 30
A42: 40 | B42: player_exp | C42: 30 | D42: money | E42: =RC[-2]*10 -> 300 | F42: hero_exp | G42: 30
A43: 41 | B43: player_exp | C43: 32 | D43: money | E43: =RC[-2]*10 -> 320 | F43: hero_exp | G43: 32
A44: 42 | B44: player_exp | C44: 32 | D44: money | E44: =RC[-2]*10 -> 320 | F44: hero_exp | G44: 32
A45: 43 | B45: player_exp | C45: 32 | D45: money | E45: =RC[-2]*10 -> 320 | F45: hero_exp | G45: 32
A46: 44 | B46: player_exp | C46: 32 | D46: money | E46: =RC[-2]*10 -> 320 | F46: hero_exp | G46: 32
A47: 45 | B47: player_exp | C47: 34 | D47: money | E47: =RC[-2]*10 -> 340 | F47: hero_exp | G47: 34
A48: 46 | B48: player_exp | C48: 34 | D48: money | E48: =RC[-2]*10 -> 340 | F48: hero_exp | G48: 34
A49: 47 | B49: player_exp | C49: 34 | D49: money | E49: =RC[-2]*10 -> 340 | F49: hero_exp | G49: 34
A50: 48 | B50: player_exp | C50: 36 | D50: money | E50: =RC[-2]*10 -> 360 | F50: hero_exp | G50: 36
A51: 49 | B51: player_exp | C51: 36 | D51: money | E51: =RC[-2]*10 -> 360 | F51: hero_exp | G51: 36
A52: 50 | B52: player_exp | C52: 36 | D52: money | E52: =RC[-2]*10 -> 360 | F52: hero_exp | G52: 36
A53: 51 | B53: player_exp | C53: 38 | D53: money | E53: =RC[-2]*10 -> 380 | F53: hero_exp | G53: 38
A54: 52 | B54: player_exp | C54: 38 | D54: money | E54: =RC[-2]*10 -> 380 | F54: hero_exp | G54: 38
A55: 53 | B55: player_exp | C55: 40 | D55: money | E55: =RC[-2]*10 -> 400 | F55: hero_exp | G55: 40
A56: 54 | B56: player_exp | C56: 40 | D56: money | E56: =RC[-2]*10 -> 400 | F56: hero_exp | G56: 40
A57: 55 | B57: player_exp | C57: 42 | D57: money | E57: =RC[-2]*10 -> 420 | F57: hero_exp | G57: 42
A58: 56 | B58: player_exp | C58: 42 | D58: money | E58: =RC[-2]*10 -> 420 | F58: hero_exp | G58: 42
A59: 57 | B59: player_exp | C59: 44 | D59: money | E59: =RC[-2]*10 -> 440 | F59: hero_exp | G59: 44
A60: 58 | B60: player_exp | C60: 44 | D60: money | E60: =RC[-2]*10 -> 440 | F60: hero_exp | G60: 44
A61: 59 | B61: player_exp | C61: 46 | D61: money | E61: =RC[-2]*10 -> 460 | F61: hero_exp | G61: 46
A62: 60 | B62: player_exp | C62: 46 | D62: money | E62: =RC[-2]*10 -> 460 | F62: hero_exp | G62: 46
A63: 61 | B63: player_exp | C63: 48 | D63: money | E63: =RC[-2]*10 -> 480 | F63: hero_exp | G63: 48
A64: 62 | B64: player_exp | C64: 48 | D64: money | E64: =RC[-2]*10 -> 480 | F64: hero_exp | G64: 48
A65: 63 | B65: player_exp | C65: 50 | D65: money | E65: =RC[-2]*10 -> 500 | F65: hero_exp | G65: 50
A66: 64 | B66: player_exp | C66: 50 | D66: money | E66: =RC[-2]*10 -> 500 | F66: hero_exp | G66: 50
A67: 65 | B67: player_exp | C67: 52 | D67: money | E67: =RC[-2]*10 -> 520 | F67: hero_exp | G67: 52
A68: 66 | B68: player_exp | C68: 52 | D68: money | E68: =RC[-2]*10 -> 520 | F68: hero_exp | G68: 52
A69: 67 | B69: player_exp | C69: 54 | D69: money | E69: =RC[-2]*10 -> 540 | F69: hero_exp | G69: 54
A70: 68 | B70: player_exp | C70: 54 | D70: money | E70: =RC[-2]*10 -> 540 | F70: hero_exp | G70: 54
A71: 69 | B71: player_exp | C71: 56 | D71: money | E71: =RC[-2]*10 -> 560 | F71: hero_exp | G71: 56
A72: 70 | B72: player_exp | C72: 56 | D72: money | E72: =RC[-2]*10 -> 560 | F72: hero_exp | G72: 56
A73: 71 | B73: player_exp | C73: 58 | D73: money | E73: =RC[-2]*10 -> 580 | F73: hero_exp | G73: 58
A74: 72 | B74: player_exp | C74: 58 | D74: money | E74: =RC[-2]*10 -> 580 | F74: hero_exp | G74: 58
A75: 73 | B75: player_exp | C75: 60 | D75: money | E75: =RC[-2]*10 -> 600 | F75: hero_exp | G75: 60
A76: 74 | B76: player_exp | C76: 60 | D76: money | E76: =RC[-2]*10 -> 600 | F76: hero_exp | G76: 60
A77: 75 | B77: player_exp | C77: 62 | D77: money | E77: =RC[-2]*10 -> 620 | F77: hero_exp | G77: 62
A78: 76 | B78: player_exp | C78: 62 | D78: money | E78: =RC[-2]*10 -> 620 | F78: hero_exp | G78: 62
A79: 77 | B79: player_exp | C79: 64 | D79: money | E79: =RC[-2]*10 -> 640 | F79: hero_exp | G79: 64
A80: 78 | B80: player_exp | C80: 64 | D80: money | E80: =RC[-2]*10 -> 640 | F80: hero_exp | G80: 64
A81: 79 | B81: player_exp | C81: 66 | D81: money | E81: =RC[-2]*10 -> 660 | F81: hero_exp | G81: 66
A82: 80 | B82: player_exp | C82: 66 | D82: money | E82: =RC[-2]*10 -> 660 | F82: hero_exp | G82: 66
A83: 81 | B83: player_exp | C83: 68 | D83: money | E83: =RC[-2]*10 -> 680 | F83: hero_exp | G83: 68
A84: 82 | B84: player_exp | C84: 68 | D84: money | E84: =RC[-2]*10 -> 680 | F84: hero_exp | G84: 68
A85: 83 | B85: player_exp | C85: 70 | D85: money | E85: =RC[-2]*10 -> 700 | F85: hero_exp | G85: 70
A86: 84 | B86: player_exp | C86: 70 | D86: money | E86: =RC[-2]*10 -> 700 | F86: hero_exp | G86: 70
A87: 85 | B87: player_exp | C87: 72 | D87: money | E87: =RC[-2]*10 -> 720 | F87: hero_exp | G87: 72
A88: 86 | B88: player_exp | C88: 72 | D88: money | E88: =RC[-2]*10 -> 720 | F88: hero_exp | G88: 72
A89: 87 | B89: player_exp | C89: 74 | D89: money | E89: =RC[-2]*10 -> 740 | F89: hero_exp | G89: 74
A90: 88 | B90: player_exp | C90: 74 | D90: money | E90: =RC[-2]*10 -> 740 | F90: hero_exp | G90: 74
A91: 89 | B91: player_exp | C91: 76 | D91: money | E91: =RC[-2]*10 -> 760 | F91: hero_exp | G91: 76
A92: 90 | B92: player_exp | C92: 76 | D92: money | E92: =RC[-2]*10 -> 760 | F92: hero_exp | G92: 76
A93: 91 | B93: player_exp | C93: 78 | D93: money | E93: =RC[-2]*10 -> 780 | F93: hero_exp | G93: 78
A94: 92 | B94: player_exp | C94: 78 | D94: money | E94: =RC[-2]*10 -> 780 | F94: hero_exp | G94: 78
A95: 93 | B95: player_exp | C95: 80 | D95: money | E95: =RC[-2]*10 -> 800 | F95: hero_exp | G95: 80
A96: 94 | B96: player_exp | C96: 80 | D96: money | E96: =RC[-2]*10 -> 800 | F96: hero_exp | G96: 80
A97: 95 | B97: player_exp | C97: 82 | D97: money | E97: =RC[-2]*10 -> 820 | F97: hero_exp | G97: 82
A98: 96 | B98: player_exp | C98: 82 | D98: money | E98: =RC[-2]*10 -> 820 | F98: hero_exp | G98: 82
A99: 97 | B99: player_exp | C99: 84 | D99: money | E99: =RC[-2]*10 -> 840 | F99: hero_exp | G99: 84
A100: 98 | B100: player_exp | C100: 84 | D100: money | E100: =RC[-2]*10 -> 840 | F100: hero_exp | G100: 84
A101: 99 | B101: player_exp | C101: 86 | D101: money | E101: =RC[-2]*10 -> 860 | F101: hero_exp | G101: 86
A102: 100 | B102: player_exp | C102: 86 | D102: money | E102: =RC[-2]*10 -> 860 | F102: hero_exp | G102: 86
A103: 101 | B103: player_exp | C103: 88 | D103: money | E103: =RC[-2]*10 -> 880 | F103: hero_exp | G103: 88
A104: 102 | B104: player_exp | C104: 88 | D104: money | E104: =RC[-2]*10 -> 880 | F104: hero_exp | G104: 88
A105: 103 | B105: player_exp | C105: 90 | D105: money | E105: =RC[-2]*10 -> 900 | F105: hero_exp | G105: 90
A106: 104 | B106: player_exp | C106: 90 | D106: money | E106: =RC[-2]*10 -> 900 | F106: hero_exp | G106: 90
A107: 105 | B107: player_exp | C107: 92 | D107: money | E107: =RC[-2]*10 -> 920 | F107: hero_exp | G107: 92
A108: 106 | B108: player_exp | C108: 92 | D108: money | E108: =RC[-2]*10 -> 920 | F108: hero_exp | G108: 92
A109: 107 | B109: player_exp | C109: 94 | D109: money | E109: =RC[-2]*10 -> 940 | F109: hero_exp | G109: 94
A110: 108 | B110: player_exp | C110: 94 | D110: money | E110: =RC[-2]*10 -> 940 | F110: hero_exp | G110: 94
A111: 109 | B111: player_exp | C111: 96 | D111: money | E111: =RC[-2]*10 -> 960 | F111: hero_exp | G111: 96
A112: 110 | B112: player_exp | C112: 96 | D112: money | E112: =RC[-2]*10 -> 960 | F112: hero_exp | G112: 96
A113: 111 | B113: player_exp | C113: 98 | D113: money | E113: =RC[-2]*10 -> 980 | F113: hero_exp | G113: 98
A114: 112 | B114: player_exp | C114: 98 | D114: money | E114: =RC[-2]*10 -> 980 | F114: hero_exp | G114: 98
A115: 113 | B115: player_exp | C115: 100 | D115: money | E115: =RC[-2]*10 -> 1000 | F115: hero_exp | G115: 100
A116: 114 | B116: player_exp | C116: 100 | D116: money | E116: =RC[-2]*10 -> 1000 | F116: hero_exp | G116: 100
A117: 115 | B117: player_exp | C117: 102 | D117: money | E117: =RC[-2]*10 -> 1020 | F117: hero_exp | G117: 102
A118: 116 | B118: player_exp | C118: 102 | D118: money | E118: =RC[-2]*10 -> 1020 | F118: hero_exp | G118: 102
A119: 117 | B119: player_exp | C119: 104 | D119: money | E119: =RC[-2]*10 -> 1040 | F119: hero_exp | G119: 104
A120: 118 | B120: player_exp | C120: 104 | D120: money | E120: =RC[-2]*10 -> 1040 | F120: hero_exp | G120: 104
A121: 119 | B121: player_exp | C121: 104 | D121: money | E121: =RC[-2]*10 -> 1040 | F121: hero_exp | G121: 104
A122: 120 | B122: player_exp | C122: 106 | D122: money | E122: =RC[-2]*10 -> 1060 | F122: hero_exp | G122: 106
A123: 121 | B123: player_exp | C123: 106 | D123: money | E123: =RC[-2]*10 -> 1060 | F123: hero_exp | G123: 106
A124: 122 | B124: player_exp | C124: 106 | D124: money | E124: =RC[-2]*10 -> 1060 | F124: hero_exp | G124: 106
A125: 123 | B125: player_exp | C125: 108 | D125: money | E125: =RC[-2]*10 -> 1080 | F125: hero_exp | G125: 108
A126: 124 | B126: player_exp | C126: 108 | D126: money | E126: =RC[-2]*10 -> 1080 | F126: hero_exp | G126: 108
A127: 125 | B127: player_exp | C127: 108 | D127: money | E127: =RC[-2]*10 -> 1080 | F127: hero_exp | G127: 108
A128: 126 | B128: player_exp | C128: 110 | D128: money | E128: =RC[-2]*10 -> 1100 | F128: hero_exp | G128: 110
A129: 127 | B129: player_exp | C129: 110 | D129: money | E129: =RC[-2]*10 -> 1100 | F129: hero_exp | G129: 110
A130: 128 | B130: player_exp | C130: 110 | D130: money | E130: =RC[-2]*10 -> 1100 | F130: hero_exp | G130: 110
A131: 129 | B131: player_exp | C131: 112 | D131: money | E131: =RC[-2]*10 -> 1120 | F131: hero_exp | G131: 112
A132: 130 | B132: player_exp | C132: 112 | D132: money | E132: =RC[-2]*10 -> 1120 | F132: hero_exp | G132: 112
A133: 131 | B133: player_exp | C133: 112 | D133: money | E133: =RC[-2]*10 -> 1120 | F133: hero_exp | G133: 112
A134: 132 | B134: player_exp | C134: 114 | D134: money | E134: =RC[-2]*10 -> 1140 | F134: hero_exp | G134: 114
A135: 133 | B135: player_exp | C135: 114 | D135: money | E135: =RC[-2]*10 -> 1140 | F135: hero_exp | G135: 114
A136: 134 | B136: player_exp | C136: 114 | D136: money | E136: =RC[-2]*10 -> 1140 | F136: hero_exp | G136: 114
A137: 135 | B137: player_exp | C137: 116 | D137: money | E137: =RC[-2]*10 -> 1160 | F137: hero_exp | G137: 116
A138: 136 | B138: player_exp | C138: 116 | D138: money | E138: =RC[-2]*10 -> 1160 | F138: hero_exp | G138: 116
A139: 137 | B139: player_exp | C139: 116 | D139: money | E139: =RC[-2]*10 -> 1160 | F139: hero_exp | G139: 116
A140: 138 | B140: player_exp | C140: 118 | D140: money | E140: =RC[-2]*10 -> 1180 | F140: hero_exp | G140: 118
A141: 139 | B141: player_exp | C141: 118 | D141: money | E141: =RC[-2]*10 -> 1180 | F141: hero_exp | G141: 118
A142: 140 | B142: player_exp | C142: 118 | D142: money | E142: =RC[-2]*10 -> 1180 | F142: hero_exp | G142: 118

Sheet: 精英关卡奖励配置表
A1: 组队ID | B1: 奖励类型 | C1: 参数列表 | D1: 奖励类型 | E1: 参数列表 | F1: 奖励类型 | G1: 参数列表 | H1: 奖励类型 | I1: 参数列表
A2: id | B2: reward_type | C2: reward_args | D2: reward_type | E2: reward_args | F2: reward_type | G2: reward_args | H2: reward_type | I2: reward_args
A3: 1 | B3: hero_exp | C3: 280
A4: 2 | B4: hero_exp | C4: 480
A5: 3 | B5: hero_exp | C5: 580
A6: 4 | B6: hero_exp | C6: 680
A7: 5 | B7: hero_exp | C7: 780
A8: 6 | B8: hero_exp | C8: 880
A9: 7 | B9: hero_exp | C9: 980
A10: 8 | B10: hero_exp | C10: 1080
A11: 9 | B11: hero_exp | C11: 1180
A12: 10 | B12: hero_exp | C12: 1280
A13: 11 | B13: player_exp | C13: 60 | D13: money | E13: =RC[-2]*10 -> 600 | F13: hero_exp | G13: 30 | H13: random_hero | I13: 700-D|300-C
A14: 12 | B14: player_exp | C14: 92 | D14: money | E14: =RC[-2]*10 -> 920 | F14: hero_exp | G14: 46 | H14: random_hero | I14: 650-D|300-C|50-B
A15: 13 | B15: player_exp | C15: 132 | D15: money | E15: =RC[-2]*10 -> 1320 | F15: hero_exp | G15: 66 | H15: random_hero | I15: 650-D|300-C|50-B
A16: 14 | B16: player_exp | C16: 172 | D16: money | E16: =RC[-2]*10 -> 1720 | F16: hero_exp | G16: 86 | H16: random_hero | I16: 650-D|300-C|50-B
A17: 15 | B17: player_exp | C17: 212 | D17: money | E17: =RC[-2]*10 -> 2120 | F17: hero_exp | G17: 106 | H17: random_hero | I17: 649-D|300-C|50-B|1-A
A18: 16 | B18: player_exp | C18: 236 | D18: money | E18: =RC[-2]*10 -> 2360 | F18: hero_exp | G18: 118 | H18: random_hero | I18: 649-D|300-C|50-B|1-A
A19: 101 | B19: money | C19: 6000 | D19: random_hero | E19: 1000-C
A20: 102 | B20: money | C20: 9200 | D20: random_hero | E20: 950-C|50-B
A21: 103 | B21: money | C21: 13200 | D21: random_hero | E21: 850-C|150-B
A22: 104 | B22: money | C22: 17200 | D22: random_hero | E22: 750-C|250-B
A23: 105 | B23: money | C23: 21200 | D23: random_hero | E23: 649-C|350-B|1-A
A24: 106 | B24: money | C24: 23600 | D24: random_hero | E24: 549-C|450-B|2-A
A25: 1011 | B25: player_exp | C25: 12 | D25: money | E25: =RC[-2]*10 -> 120 | F25: hero_exp | G25: 6
A26: 1012 | B26: player_exp | C26: 18 | D26: money | E26: =RC[-2]*10 -> 180 | F26: hero_exp | G26: 9
A27: 1013 | B27: player_exp | C27: 26 | D27: money | E27: =RC[-2]*10 -> 260 | F27: hero_exp | G27: 13
A28: 1014 | B28: player_exp | C28: 34 | D28: money | E28: =RC[-2]*10 -> 340 | F28: hero_exp | G28: 17
A29: 1015 | B29: player_exp | C29: 42 | D29: money | E29: =RC[-2]*10 -> 420 | F29: hero_exp | G29: 21
A30: 1016 | B30: player_exp | C30: 47 | D30: money | E30: =RC[-2]*10 -> 470 | F30: hero_exp | G30: 23

Sheet: 活跃度奖励配置表
A1: id | B1: 活跃度 | C1: 奖励类型 | D1: 奖励参数 | E1: 奖励类型 | F1: 奖励参数 | G1: 奖励类型 | H1: 奖励参数 | I1: 奖励类型 | J1: 奖励参数
A2: id | B2: active_degree | C2: reward_type | D2: reward_args | E2: reward_type | F2: reward_args | G2: reward_type | H2: reward_args | I2: reward_type | J2: reward_args
A3: 1 | B3: 10 | C3: money | D3: 500 | E3: sp | F3: 5
A4: 2 | B4: 60 | C4: money | D4: 1000 | E4: sp | F4: 15
A5: 3 | B5: 80 | C5: money | D5: 2000 | E5: sp | F5: 30
A6: 4 | B6: 100 | C6: money | D6: 3000 | E6: sp | F6: 50

Sheet: 登入抽奖配置表
A1: 抽奖id | B1: 抽奖概率 | C1: 奖励图标 | D1: 奖励类型 | E1: 奖励参数
A2: id | B2: rate | C2: reward_icon | D2: reward_type | E2: reward_args
A3: 1 | B3: 16 | D3: sp | E3: 5
A4: 2 | B4: 7 | D4: sp | E4: 10
A5: 3 | B5: 2 | D5: sp | E5: 15
A6: 4 | B6: 16 | D6: bp | E6: 1
A7: 5 | B7: 7 | D7: bp | E7: 2
A8: 6 | B8: 2 | D8: bp | E8: 3
A9: 7 | B9: 16 | D9: money | E9: 500
A10: 8 | B10: 7 | D10: money | E10: 1000
A11: 9 | B11: 2 | D11: money | E11: 1500
A12: 10 | B12: 16 | D12: coin | E12: 1
A13: 11 | B13: 7 | D13: coin | E13: 2
A14: 12 | B14: 2 | D14: coin | E14: 5

Sheet: 在线奖励配置表
A1: id | B1: 在线时长 | C1: 奖励类型 | D1: 奖励参数 | E1: 奖励类型 | F1: 奖励参数
A2: id | B2: online_last | C2: reward_type | D2: reward_args | E2: reward_type | F2: reward_args
A3: 1 | B3: 0 | C3: money | D3: 100
A4: 2 | B4: 300 | C4: money | D4: 200 | E4: bp | F4: 1
A5: 3 | B5: 600 | C5: money | D5: 300 | E5: sp | F5: 5
A6: 4 | B6: 900 | C6: money | D6: 400
A7: 5 | B7: 1200 | C7: money | D7: 500 | E7: bp | F7: 2
A8: 6 | B8: 2100 | C8: money | D8: 600 | E8: sp | F8: 10
A9: 7 | B9: 3300 | C9: money | D9: 700
A10: 8 | B10: 5400 | C10: money | D10: 800 | E10: bp | F10: 5
A11: 9 | B11: 8700 | C11: money | D11: 1000 | E11: sp | F11: 25

Sheet: 奖励表
A1: 奖励表id | B1: 奖励类型 | C1: 奖励物品id | D1: 物品数量
A2: id | B2: reward_type | C2: reward_id | D2: reward_num
A3: 1 | B3: money | D3: 1000
A4: 2 | B4: hero_exp | D4: 100
A5: 3 | B5: gem | C5: 1 | D5: 20
A6: 4 | B6: material | C6: 1 | D6: 10
A7: 5 | B7: player_exp | D7: 10

Sheet: 荣誉表
A1: ID | B1: 荣誉 | C1: 物品名称 | D1: 字体颜色 | E1: 物品图标 | F1: 物品描述 | G1: 奖励类型 | H1: 参数列表 | I1: 奖励类型 | J1: 参数列表 | K1: 奖励类型 | L1: 参数列表
A2: id | B2: hnr_point | C2: item_name | D2: font_color | E2: item_icon | F2: desc | G2: reward_type | H2: reward_args | I2: reward_type | J2: reward_args | K2: reward_type | L2: reward_args
A3: 1 | B3: 50 | C3: 江湖嘉奖 | E3: 6109 | F3: 金币×3000 | G3: money | H3: 3000
A4: 2 | B4: 120 | C4: 少侠嘉奖 | E4: 6109 | F4: 金币×5000，精力卡×1，战力卡×1 | G4: money | H4: 5000 | I4: item | J4: 22|1 | K4: item | L4: 23|1
A5: 3 | B5: 300 | C5: 侠士嘉奖 | E5: 6109 | F5: 金币×8000，侠客宴请贴×1 | G5: money | H5: 8000 | I5: item | J5: 62|1
A6: 4 | B6: 600 | C6: 大侠嘉奖 | E6: 6109 | F6: 金币×10000，精力卡×1，战力卡×1 | G6: money | H6: 10000 | I6: item | J6: 22|1 | K6: item | L6: 23|1
A7: 5 | B7: 1200 | C7: 豪侠嘉奖 | E7: 6109 | F7: 金币×20000，侠客宴请贴×1 | G7: money | H7: 20000 | I7: item | J7: 62|1
A8: 6 | B8: 3000 | C8: 大师嘉奖 | E8: 6109 | F8: 金币×50000，元宝×200，侠客合成卡×1 | G8: money | H8: 50000 | I8: coin | J8: 200 | K8: random_merge | L8: 700|300|0
A9: 7 | B9: 6000 | C9: 宗师嘉奖 | E9: 6109 | F9: 金币×100000，元宝×500，侠客合成卡×1 | G9: money | H9: 100000 | I9: coin | J9: 500 | K9: random_merge | L9: 700|300|0

Sheet: 宝箱奖励表
A1: id | B1: 概率 | C1: 奖励类别 | D1: 参数列表
A2: id | B2: rate | C2: reward_type | D2: reward_arg
A3: 1 | B3: * | C3: money | D3: 100
A4: 2 | B4: 60000 | C4: money | D4: 200
A5: 3 | B5: 20000 | C5: money | D5: 300
A6: 4 | B6: 10000 | C6: money | D6: 400
A7: 5 | B7: 2000 | C7: money | D7: 500
A8: 6 | B8: * | C8: coin | D8: 1
A9: 7 | B9: 60000 | C9: coin | D9: 2
A10: 8 | B10: 20000 | C10: coin | D10: 3
A11: 9 | B11: 10000 | C11: coin | D11: 4
A12: 10 | B12: 2000 | C12: coin | D12: 5
A13: 11 | B13: * | C13: material | D13: 1|10
A14: 12 | B14: 30000 | C14: material | D14: 1|20
A15: 13 | B15: 10000 | C15: material | D15: 1|30
A16: 14 | B16: 5000 | C16: material | D16: 1|50
A17: 15 | B17: 1000 | C17: material | D17: 1|100
A18: 16 | B18: * | C18: material | D18: 2|10
A19: 17 | B19: 30000 | C19: material | D19: 2|20
A20: 18 | B20: 10000 | C20: material | D20: 2|30
A21: 19 | B21: 5000 | C21: material | D21: 2|50
A22: 20 | B22: 1000 | C22: material | D22: 2|100
A23: 16 | B23: * | C23: material | D23: 3|10
A24: 17 | B24: 30000 | C24: material | D24: 3|20
A25: 18 | B25: 10000 | C25: material | D25: 3|30
A26: 19 | B26: 5000 | C26: material | D26: 3|50
A27: 20 | B27: 1000 | C27: material | D27: 3|100
A28: 36 | B28: * | C28: gem | D28: 4|10
A29: 37 | B29: 7500 | C29: gem | D29: 4|20
A30: 38 | B30: 2500 | C30: gem | D30: 4|30
A31: 39 | B31: 1250 | C31: gem | D31: 4|50
A32: 40 | B32: 250 | C32: gem | D32: 4|100
A33: 41 | B33: * | C33: gem | D33: 5|10
A34: 42 | B34: 7500 | C34: gem | D34: 5|20
A35: 43 | B35: 2500 | C35: gem | D35: 5|30
A36: 44 | B36: 1250 | C36: gem | D36: 5|50
A37: 45 | B37: 250 | C37: gem | D37: 5|100
A38: 46 | B38: * | C38: gem | D38: 6|10
A39: 47 | B39: 7500 | C39: gem | D39: 6|20
A40: 48 | B40: 2500 | C40: gem | D40: 6|30
A41: 49 | B41: 1250 | C41: gem | D41: 6|50
A42: 50 | B42: 250 | C42: gem | D42: 6|100
A43: 51 | B43: * | C43: gem | D43: 7|10
A44: 52 | B44: 7500 | C44: gem | D44: 7|20
A45: 53 | B45: 2500 | C45: gem | D45: 7|30
A46: 54 | B46: 1250 | C46: gem | D46: 7|50
A47: 55 | B47: 250 | C47: gem | D47: 7|100
A48: 56 | B48: * | C48: gem | D48: 8|10
A49: 57 | B49: 7500 | C49: gem | D49: 8|20
A50: 58 | B50: 2500 | C50: gem | D50: 8|30
A51: 59 | B51: 1250 | C51: gem | D51: 8|50
A52: 60 | B52: 250 | C52: gem | D52: 8|100
A53: 61 | B53: 7500 | C53: random_hero | D53: 800-D|200-C
A54: 62 | B54: 20000 | C54: sp | D54: 5
A55: 63 | B55: 20000 | C55: bp | D55: 1

Sheet: 邀请奖励表
A1: id | B1: 好友数 | C1: 奖励类别 | D1: 参数列表 | E1: 奖励类别 | F1: 参数列表 | G1: 奖励类别 | H1: 参数列表
A2: id | B2: friend_num | C2: reward_type | D2: reward_args | E2: reward_type | F2: reward_args | G2: reward_type | H2: reward_args
A3: 1 | B3: 2 | C3: money | D3: 10000 | E3: sp | F3: 50 | G3: coin | H3: 20
A4: 2 | B4: 5 | C4: money | D4: 50000 | E4: sp | F4: 50 | G4: coin | H4: 30
A5: 3 | B5: 10 | C5: money | D5: 100000 | E5: sp | F5: 100 | G5: coin | H5: 100
A6: 4 | B6: 15 | C6: money | D6: 200000 | E6: sp | F6: 100 | G6: coin | H6: 150
A7: 5 | B7: 20 | C7: hero | D7: 69

Sheet: 征收奖励表
A1: id | B1: 获得概率 | C1: 等级 | D1: 奖励类别 | E1: 参数列表 | F1: 奖励类别 | G1: 参数列表
A2: id | B2: reward_p | C2: lvl | D2: reward_type | E2: reward_args | F2: reward_type | G2: reward_args
A3: 1 | B3: * | C3: 1 | D3: money | E3: 10
A4: 2 | B4: 500000 | C4: 1 | D4: money | E4: 10 | F4: player_exp | G4: 1
A5: 3 | B5: 500000 | C5: 1 | D5: money | E5: 10 | F5: hero | G5: *
A6: 4 | B6: 500000 | C6: 1 | D6: money | E6: 10 | F6: gem | G6: 1
A7: 5 | B7: 500000 | C7: 1 | D7: money | E7: 10 | F7: material | G7: 1
A8: 6 | B8: * | C8: 2 | D8: money | E8: 10
A9: 7 | B9: 500000 | C9: 2 | D9: money | E9: 10 | F9: player_exp | G9: 2
A10: 8 | B10: 500000 | C10: 2 | D10: money | E10: 10 | F10: hero | G10: *
A11: 9 | B11: 500000 | C11: 2 | D11: money | E11: 10 | F11: gem | G11: 2
A12: 10 | B12: 500000 | C12: 2 | D12: money | E12: 10 | F12: material | G12: 2
A13: 11 | B13: * | C13: 3 | D13: money | E13: 10
A14: 12 | B14: 500000 | C14: 3 | D14: money | E14: 10 | F14: player_exp | G14: 3
A15: 13 | B15: 500000 | C15: 3 | D15: money | E15: 10 | F15: hero | G15: *
A16: 14 | B16: 500000 | C16: 3 | D16: money | E16: 10 | F16: gem | G16: 3
A17: 15 | B17: 500000 | C17: 3 | D17: money | E17: 10 | F17: material | G17: 3
A18: 16 | B18: * | C18: 4 | D18: money | E18: 10
A19: 17 | B19: 500000 | C19: 4 | D19: money | E19: 10 | F19: player_exp | G19: 4
A20: 18 | B20: 500000 | C20: 4 | D20: money | E20: 10 | F20: hero | G20: *
A21: 19 | B21: 500000 | C21: 4 | D21: money | E21: 10 | F21: gem | G21: 4
A22: 20 | B22: 500000 | C22: 4 | D22: money | E22: 10 | F22: material | G22: 4
A23: 21 | B23: * | C23: 5 | D23: money | E23: 10
A24: 22 | B24: 500000 | C24: 5 | D24: money | E24: 10 | F24: player_exp | G24: 5
A25: 23 | B25: 500000 | C25: 5 | D25: money | E25: 10 | F25: hero | G25: *
A26: 24 | B26: 500000 | C26: 5 | D26: money | E26: 10 | F26: gem | G26: 5
A27: 25 | B27: 500000 | C27: 5 | D27: money | E27: 10 | F27: material | G27: 5
A28: 26 | B28: * | C28: 6 | D28: money | E28: 10
A29: 27 | B29: 500000 | C29: 6 | D29: money | E29: 10 | F29: player_exp | G29: 6
A30: 28 | B30: 500000 | C30: 6 | D30: money | E30: 10 | F30: hero | G30: *
A31: 29 | B31: 500000 | C31: 6 | D31: money | E31: 10 | F31: gem | G31: 6
A32: 30 | B32: 500000 | C32: 6 | D32: money | E32: 10 | F32: material | G32: 6
A33: 31 | B33: * | C33: 7 | D33: money | E33: 10
A34: 32 | B34: 500000 | C34: 7 | D34: money | E34: 10 | F34: player_exp | G34: 7
A35: 33 | B35: 500000 | C35: 7 | D35: money | E35: 10 | F35: hero | G35: *
A36: 34 | B36: 500000 | C36: 7 | D36: money | E36: 10 | F36: gem | G36: 7
A37: 35 | B37: 500000 | C37: 7 | D37: money | E37: 10 | F37: material | G37: 7
A38: 36 | B38: * | C38: 8 | D38: money | E38: 10
A39: 37 | B39: 500000 | C39: 8 | D39: money | E39: 10 | F39: player_exp | G39: 8
A40: 38 | B40: 500000 | C40: 8 | D40: money | E40: 10 | F40: hero | G40: *
A41: 39 | B41: 500000 | C41: 8 | D41: money | E41: 10 | F41: gem | G41: 8
A42: 40 | B42: 500000 | C42: 8 | D42: money | E42: 10 | F42: material | G42: 8
A43: 41 | B43: * | C43: 9 | D43: money | E43: 10
A44: 42 | B44: 500000 | C44: 9 | D44: money | E44: 10 | F44: player_exp | G44: 9
A45: 43 | B45: 500000 | C45: 9 | D45: money | E45: 10 | F45: hero | G45: *
A46: 44 | B46: 500000 | C46: 9 | D46: money | E46: 10 | F46: gem | G46: 9
A47: 45 | B47: 500000 | C47: 9 | D47: money | E47: 10 | F47: material | G47: 9
A48: 46 | B48: * | C48: 10 | D48: money | E48: 10
A49: 47 | B49: 500000 | C49: 10 | D49: money | E49: 10 | F49: player_exp | G49: 10
A50: 48 | B50: 500000 | C50: 10 | D50: money | E50: 10 | F50: hero | G50: *
A51: 49 | B51: 500000 | C51: 10 | D51: money | E51: 10 | F51: gem | G51: 10
A52: 50 | B52: 500000 | C52: 10 | D52: money | E52: 10 | F52: material | G52: 10
A53: 51 | B53: * | C53: 11 | D53: money | E53: 10
A54: 52 | B54: 500000 | C54: 11 | D54: money | E54: 10 | F54: player_exp | G54: 11
A55: 53 | B55: 500000 | C55: 11 | D55: money | E55: 10 | F55: hero | G55: *
A56: 54 | B56: 500000 | C56: 11 | D56: money | E56: 10 | F56: gem | G56: 11
A57: 55 | B57: 500000 | C57: 11 | D57: money | E57: 10 | F57: material | G57: 11
A58: 56 | B58: * | C58: 12 | D58: money | E58: 10
A59: 57 | B59: 500000 | C59: 12 | D59: money | E59: 10 | F59: player_exp | G59: 12
A60: 58 | B60: 500000 | C60: 12 | D60: money | E60: 10 | F60: hero | G60: *
A61: 59 | B61: 500000 | C61: 12 | D61: money | E61: 10 | F61: gem | G61: 12
A62: 60 | B62: 500000 | C62: 12 | D62: money | E62: 10 | F62: material | G62: 12
A63: 61 | B63: * | C63: 13 | D63: money | E63: 10
A64: 62 | B64: 500000 | C64: 13 | D64: money | E64: 10 | F64: player_exp | G64: 13
A65: 63 | B65: 500000 | C65: 13 | D65: money | E65: 10 | F65: hero | G65: *
A66: 64 | B66: 500000 | C66: 13 | D66: money | E66: 10 | F66: gem | G66: 13
A67: 65 | B67: 500000 | C67: 13 | D67: money | E67: 10 | F67: material | G67: 13
A68: 66 | B68: * | C68: 14 | D68: money | E68: 10
A69: 67 | B69: 500000 | C69: 14 | D69: money | E69: 10 | F69: player_exp | G69: 14
A70: 68 | B70: 500000 | C70: 14 | D70: money | E70: 10 | F70: hero | G70: *
A71: 69 | B71: 500000 | C71: 14 | D71: money | E71: 10 | F71: gem | G71: 14
A72: 70 | B72: 500000 | C72: 14 | D72: money | E72: 10 | F72: material | G72: 14
A73: 71 | B73: * | C73: 15 | D73: money | E73: 10
A74: 72 | B74: 500000 | C74: 15 | D74: money | E74: 10 | F74: player_exp | G74: 15
A75: 73 | B75: 500000 | C75: 15 | D75: money | E75: 10 | F75: hero | G75: *
A76: 74 | B76: 500000 | C76: 15 | D76: money | E76: 10 | F76: gem | G76: 15
A77: 75 | B77: 500000 | C77: 15 | D77: money | E77: 10 | F77: material | G77: 15
A78: 76 | B78: * | C78: 16 | D78: money | E78: 10
A79: 77 | B79: 500000 | C79: 16 | D79: money | E79: 10 | F79: player_exp | G79: 16
A80: 78 | B80: 500000 | C80: 16 | D80: money | E80: 10 | F80: hero | G80: *
A81: 79 | B81: 500000 | C81: 16 | D81: money | E81: 10 | F81: gem | G81: 16
A82: 80 | B82: 500000 | C82: 16 | D82: money | E82: 10 | F82: material | G82: 16
A83: 81 | B83: * | C83: 17 | D83: money | E83: 10
A84: 82 | B84: 500000 | C84: 17 | D84: money | E84: 10 | F84: player_exp | G84: 17
A85: 83 | B85: 500000 | C85: 17 | D85: money | E85: 10 | F85: hero | G85: *
A86: 84 | B86: 500000 | C86: 17 | D86: money | E86: 10 | F86: gem | G86: 17
A87: 85 | B87: 500000 | C87: 17 | D87: money | E87: 10 | F87: material | G87: 17
A88: 86 | B88: * | C88: 18 | D88: money | E88: 10
A89: 87 | B89: 500000 | C89: 18 | D89: money | E89: 10 | F89: player_exp | G89: 18
A90: 88 | B90: 500000 | C90: 18 | D90: money | E90: 10 | F90: hero | G90: *
A91: 89 | B91: 500000 | C91: 18 | D91: money | E91: 10 | F91: gem | G91: 18
A92: 90 | B92: 500000 | C92: 18 | D92: money | E92: 10 | F92: material | G92: 18
A93: 91 | B93: * | C93: 19 | D93: money | E93: 10
A94: 92 | B94: 500000 | C94: 19 | D94: money | E94: 10 | F94: player_exp | G94: 19
A95: 93 | B95: 500000 | C95: 19 | D95: money | E95: 10 | F95: hero | G95: *
A96: 94 | B96: 500000 | C96: 19 | D96: money | E96: 10 | F96: gem | G96: 19
A97: 95 | B97: 500000 | C97: 19 | D97: money | E97: 10 | F97: material | G97: 19
A98: 96 | B98: * | C98: 20 | D98: money | E98: 10
A99: 97 | B99: 500000 | C99: 20 | D99: money | E99: 10 | F99: player_exp | G99: 20
A100: 98 | B100: 500000 | C100: 20 | D100: money | E100: 10 | F100: hero | G100: *
A101: 99 | B101: 500000 | C101: 20 | D101: money | E101: 10 | F101: gem | G101: 20
A102: 100 | B102: 500000 | C102: 20 | D102: money | E102: 10 | F102: material | G102: 20
A103: 101 | B103: * | C103: 21 | D103: money | E103: 10
A104: 102 | B104: 500000 | C104: 21 | D104: money | E104: 10 | F104: player_exp | G104: 21
A105: 103 | B105: 500000 | C105: 21 | D105: money | E105: 10 | F105: hero | G105: *
A106: 104 | B106: 500000 | C106: 21 | D106: money | E106: 10 | F106: gem | G106: 21
A107: 105 | B107: 500000 | C107: 21 | D107: money | E107: 10 | F107: material | G107: 21
A108: 106 | B108: * | C108: 22 | D108: money | E108: 10
A109: 107 | B109: 500000 | C109: 22 | D109: money | E109: 10 | F109: player_exp | G109: 22
A110: 108 | B110: 500000 | C110: 22 | D110: money | E110: 10 | F110: hero | G110: *
A111: 109 | B111: 500000 | C111: 22 | D111: money | E111: 10 | F111: gem | G111: 22
A112: 110 | B112: 500000 | C112: 22 | D112: money | E112: 10 | F112: material | G112: 22
A113: 111 | B113: * | C113: 23 | D113: money | E113: 10
A114: 112 | B114: 500000 | C114: 23 | D114: money | E114: 10 | F114: player_exp | G114: 23
A115: 113 | B115: 500000 | C115: 23 | D115: money | E115: 10 | F115: hero | G115: *
A116: 114 | B116: 500000 | C116: 23 | D116: money | E116: 10 | F116: gem | G116: 23
A117: 115 | B117: 500000 | C117: 23 | D117: money | E117: 10 | F117: material | G117: 23
A118: 116 | B118: * | C118: 24 | D118: money | E118: 10
A119: 117 | B119: 500000 | C119: 24 | D119: money | E119: 10 | F119: player_exp | G119: 24
A120: 118 | B120: 500000 | C120: 24 | D120: money | E120: 10 | F120: hero | G120: *
A121: 119 | B121: 500000 | C121: 24 | D121: money | E121: 10 | F121: gem | G121: 24
A122: 120 | B122: 500000 | C122: 24 | D122: money | E122: 10 | F122: material | G122: 24
A123: 121 | B123: * | C123: 25 | D123: money | E123: 10
A124: 122 | B124: 500000 | C124: 25 | D124: money | E124: 10 | F124: player_exp | G124: 25
A125: 123 | B125: 500000 | C125: 25 | D125: money | E125: 10 | F125: hero | G125: *
A126: 124 | B126: 500000 | C126: 25 | D126: money | E126: 10 | F126: gem | G126: 25
A127: 125 | B127: 500000 | C127: 25 | D127: money | E127: 10 | F127: material | G127: 25
A128: 126 | B128: * | C128: 26 | D128: money | E128: 10
A129: 127 | B129: 500000 | C129: 26 | D129: money | E129: 10 | F129: player_exp | G129: 26
A130: 128 | B130: 500000 | C130: 26 | D130: money | E130: 10 | F130: hero | G130: *
A131: 129 | B131: 500000 | C131: 26 | D131: money | E131: 10 | F131: gem | G131: 26
A132: 130 | B132: 500000 | C132: 26 | D132: money | E132: 10 | F132: material | G132: 26
A133: 131 | B133: * | C133: 27 | D133: money | E133: 10
A134: 132 | B134: 500000 | C134: 27 | D134: money | E134: 10 | F134: player_exp | G134: 27
A135: 133 | B135: 500000 | C135: 27 | D135: money | E135: 10 | F135: hero | G135: *
A136: 134 | B136: 500000 | C136: 27 | D136: money | E136: 10 | F136: gem | G136: 27
A137: 135 | B137: 500000 | C137: 27 | D137: money | E137: 10 | F137: material | G137: 27
A138: 136 | B138: * | C138: 28 | D138: money | E138: 10
A139: 137 | B139: 500000 | C139: 28 | D139: money | E139: 10 | F139: player_exp | G139: 28
A140: 138 | B140: 500000 | C140: 28 | D140: money | E140: 10 | F140: hero | G140: *
A141: 139 | B141: 500000 | C141: 28 | D141: money | E141: 10 | F141: gem | G141: 28
A142: 140 | B142: 500000 | C142: 28 | D142: money | E142: 10 | F142: material | G142: 28
A143: 141 | B143: * | C143: 29 | D143: money | E143: 10
A144: 142 | B144: 500000 | C144: 29 | D144: money | E144: 10 | F144: player_exp | G144: 29
A145: 143 | B145: 500000 | C145: 29 | D145: money | E145: 10 | F145: hero | G145: *
A146: 144 | B146: 500000 | C146: 29 | D146: money | E146: 10 | F146: gem | G146: 29
A147: 145 | B147: 500000 | C147: 29 | D147: money | E147: 10 | F147: material | G147: 29
A148: 146 | B148: * | C148: 30 | D148: money | E148: 10
A149: 147 | B149: 500000 | C149: 30 | D149: money | E149: 10 | F149: player_exp | G149: 30
A150: 148 | B150: 500000 | C150: 30 | D150: money | E150: 10 | F150: hero | G150: *
A151: 149 | B151: 500000 | C151: 30 | D151: money | E151: 10 | F151: gem | G151: 30
A152: 150 | B152: 500000 | C152: 30 | D152: money | E152: 10 | F152: material | G152: 30
A153: 151 | B153: * | C153: 31 | D153: money | E153: 10
A154: 152 | B154: 500000 | C154: 31 | D154: money | E154: 10 | F154: player_exp | G154: 31
A155: 153 | B155: 500000 | C155: 31 | D155: money | E155: 10 | F155: hero | G155: *
A156: 154 | B156: 500000 | C156: 31 | D156: money | E156: 10 | F156: gem | G156: 31
A157: 155 | B157: 500000 | C157: 31 | D157: money | E157: 10 | F157: material | G157: 31
A158: 156 | B158: * | C158: 32 | D158: money | E158: 10
A159: 157 | B159: 500000 | C159: 32 | D159: money | E159: 10 | F159: player_exp | G159: 32
A160: 158 | B160: 500000 | C160: 32 | D160: money | E160: 10 | F160: hero | G160: *
A161: 159 | B161: 500000 | C161: 32 | D161: money | E161: 10 | F161: gem | G161: 32
A162: 160 | B162: 500000 | C162: 32 | D162: money | E162: 10 | F162: material | G162: 32
A163: 161 | B163: * | C163: 33 | D163: money | E163: 10
A164: 162 | B164: 500000 | C164: 33 | D164: money | E164: 10 | F164: player_exp | G164: 33
A165: 163 | B165: 500000 | C165: 33 | D165: money | E165: 10 | F165: hero | G165: *
A166: 164 | B166: 500000 | C166: 33 | D166: money | E166: 10 | F166: gem | G166: 33
A167: 165 | B167: 500000 | C167: 33 | D167: money | E167: 10 | F167: material | G167: 33
A168: 166 | B168: * | C168: 34 | D168: money | E168: 10
A169: 167 | B169: 500000 | C169: 34 | D169: money | E169: 10 | F169: player_exp | G169: 34
A170: 168 | B170: 500000 | C170: 34 | D170: money | E170: 10 | F170: hero | G170: *
A171: 169 | B171: 500000 | C171: 34 | D171: money | E171: 10 | F171: gem | G171: 34
A172: 170 | B172: 500000 | C172: 34 | D172: money | E172: 10 | F172: material | G172: 34
A173: 171 | B173: * | C173: 35 | D173: money | E173: 10
A174: 172 | B174: 500000 | C174: 35 | D174: money | E174: 10 | F174: player_exp | G174: 35
A175: 173 | B175: 500000 | C175: 35 | D175: money | E175: 10 | F175: hero | G175: *
A176: 174 | B176: 500000 | C176: 35 | D176: money | E176: 10 | F176: gem | G176: 35
A177: 175 | B177: 500000 | C177: 35 | D177: money | E177: 10 | F177: material | G177: 35
A178: 176 | B178: * | C178: 36 | D178: money | E178: 10
A179: 177 | B179: 500000 | C179: 36 | D179: money | E179: 10 | F179: player_exp | G179: 36
A180: 178 | B180: 500000 | C180: 36 | D180: money | E180: 10 | F180: hero | G180: *
A181: 179 | B181: 500000 | C181: 36 | D181: money | E181: 10 | F181: gem | G181: 36
A182: 180 | B182: 500000 | C182: 36 | D182: money | E182: 10 | F182: material | G182: 36
A183: 181 | B183: * | C183: 37 | D183: money | E183: 10
A184: 182 | B184: 500000 | C184: 37 | D184: money | E184: 10 | F184: player_exp | G184: 37
A185: 183 | B185: 500000 | C185: 37 | D185: money | E185: 10 | F185: hero | G185: *
A186: 184 | B186: 500000 | C186: 37 | D186: money | E186: 10 | F186: gem | G186: 37
A187: 185 | B187: 500000 | C187: 37 | D187: money | E187: 10 | F187: material | G187: 37
A188: 186 | B188: * | C188: 38 | D188: money | E188: 10
A189: 187 | B189: 500000 | C189: 38 | D189: money | E189: 10 | F189: player_exp | G189: 38
A190: 188 | B190: 500000 | C190: 38 | D190: money | E190: 10 | F190: hero | G190: *
A191: 189 | B191: 500000 | C191: 38 | D191: money | E191: 10 | F191: gem | G191: 38
A192: 190 | B192: 500000 | C192: 38 | D192: money | E192: 10 | F192: material | G192: 38
A193: 191 | B193: * | C193: 39 | D193: money | E193: 10
A194: 192 | B194: 500000 | C194: 39 | D194: money | E194: 10 | F194: player_exp | G194: 39
A195: 193 | B195: 500000 | C195: 39 | D195: money | E195: 10 | F195: hero | G195: *
A196: 194 | B196: 500000 | C196: 39 | D196: money | E196: 10 | F196: gem | G196: 39
A197: 195 | B197: 500000 | C197: 39 | D197: money | E197: 10 | F197: material | G197: 39
A198: 196 | B198: * | C198: 40 | D198: money | E198: 10
A199: 197 | B199: 500000 | C199: 40 | D199: money | E199: 10 | F199: player_exp | G199: 40
A200: 198 | B200: 500000 | C200: 40 | D200: money | E200: 10 | F200: hero | G200: *
A201: 199 | B201: 500000 | C201: 40 | D201: money | E201: 10 | F201: gem | G201: 40
A202: 200 | B202: 500000 | C202: 40 | D202: money | E202: 10 | F202: material | G202: 40
A203: 201 | B203: * | C203: 41 | D203: money | E203: 10
A204: 202 | B204: 500000 | C204: 41 | D204: money | E204: 10 | F204: player_exp | G204: 41
A205: 203 | B205: 500000 | C205: 41 | D205: money | E205: 10 | F205: hero | G205: *
A206: 204 | B206: 500000 | C206: 41 | D206: money | E206: 10 | F206: gem | G206: 41
A207: 205 | B207: 500000 | C207: 41 | D207: money | E207: 10 | F207: material | G207: 41
A208: 206 | B208: * | C208: 42 | D208: money | E208: 10
A209: 207 | B209: 500000 | C209: 42 | D209: money | E209: 10 | F209: player_exp | G209: 42
A210: 208 | B210: 500000 | C210: 42 | D210: money | E210: 10 | F210: hero | G210: *
A211: 209 | B211: 500000 | C211: 42 | D211: money | E211: 10 | F211: gem | G211: 42
A212: 210 | B212: 500000 | C212: 42 | D212: money | E212: 10 | F212: material | G212: 42
A213: 211 | B213: * | C213: 43 | D213: money | E213: 10
A214: 212 | B214: 500000 | C214: 43 | D214: money | E214: 10 | F214: player_exp | G214: 43
A215: 213 | B215: 500000 | C215: 43 | D215: money | E215: 10 | F215: hero | G215: *
A216: 214 | B216: 500000 | C216: 43 | D216: money | E216: 10 | F216: gem | G216: 43
A217: 215 | B217: 500000 | C217: 43 | D217: money | E217: 10 | F217: material | G217: 43
A218: 216 | B218: * | C218: 44 | D218: money | E218: 10
A219: 217 | B219: 500000 | C219: 44 | D219: money | E219: 10 | F219: player_exp | G219: 44
A220: 218 | B220: 500000 | C220: 44 | D220: money | E220: 10 | F220: hero | G220: *
A221: 219 | B221: 500000 | C221: 44 | D221: money | E221: 10 | F221: gem | G221: 44
A222: 220 | B222: 500000 | C222: 44 | D222: money | E222: 10 | F222: material | G222: 44
A223: 221 | B223: * | C223: 45 | D223: money | E223: 10
A224: 222 | B224: 500000 | C224: 45 | D224: money | E224: 10 | F224: player_exp | G224: 45
A225: 223 | B225: 500000 | C225: 45 | D225: money | E225: 10 | F225: hero | G225: *
A226: 224 | B226: 500000 | C226: 45 | D226: money | E226: 10 | F226: gem | G226: 45
A227: 225 | B227: 500000 | C227: 45 | D227: money | E227: 10 | F227: material | G227: 45
A228: 226 | B228: * | C228: 46 | D228: money | E228: 10
A229: 227 | B229: 500000 | C229: 46 | D229: money | E229: 10 | F229: player_exp | G229: 46
A230: 228 | B230: 500000 | C230: 46 | D230: money | E230: 10 | F230: hero | G230: *
A231: 229 | B231: 500000 | C231: 46 | D231: money | E231: 10 | F231: gem | G231: 46
A232: 230 | B232: 500000 | C232: 46 | D232: money | E232: 10 | F232: material | G232: 46
A233: 231 | B233: * | C233: 47 | D233: money | E233: 10
A234: 232 | B234: 500000 | C234: 47 | D234: money | E234: 10 | F234: player_exp | G234: 47
A235: 233 | B235: 500000 | C235: 47 | D235: money | E235: 10 | F235: hero | G235: *
A236: 234 | B236: 500000 | C236: 47 | D236: money | E236: 10 | F236: gem | G236: 47
A237: 235 | B237: 500000 | C237: 47 | D237: money | E237: 10 | F237: material | G237: 47
A238: 236 | B238: * | C238: 48 | D238: money | E238: 10
A239: 237 | B239: 500000 | C239: 48 | D239: money | E239: 10 | F239: player_exp | G239: 48
A240: 238 | B240: 500000 | C240: 48 | D240: money | E240: 10 | F240: hero | G240: *
A241: 239 | B241: 500000 | C241: 48 | D241: money | E241: 10 | F241: gem | G241: 48
A242: 240 | B242: 500000 | C242: 48 | D242: money | E242: 10 | F242: material | G242: 48
A243: 241 | B243: * | C243: 49 | D243: money | E243: 10
A244: 242 | B244: 500000 | C244: 49 | D244: money | E244: 10 | F244: player_exp | G244: 49
A245: 243 | B245: 500000 | C245: 49 | D245: money | E245: 10 | F245: hero | G245: *
A246: 244 | B246: 500000 | C246: 49 | D246: money | E246: 10 | F246: gem | G246: 49
A247: 245 | B247: 500000 | C247: 49 | D247: money | E247: 10 | F247: material | G247: 49
A248: 246 | B248: * | C248: 50 | D248: money | E248: 10
A249: 247 | B249: 500000 | C249: 50 | D249: money | E249: 10 | F249: player_exp | G249: 50
A250: 248 | B250: 500000 | C250: 50 | D250: money | E250: 10 | F250: hero | G250: *
A251: 249 | B251: 500000 | C251: 50 | D251: money | E251: 10 | F251: gem | G251: 50
A252: 250 | B252: 500000 | C252: 50 | D252: money | E252: 10 | F252: material | G252: 50
A253: 251 | B253: * | C253: 51 | D253: money | E253: 10
A254: 252 | B254: 500000 | C254: 51 | D254: money | E254: 10 | F254: player_exp | G254: 51
A255: 253 | B255: 500000 | C255: 51 | D255: money | E255: 10 | F255: hero | G255: *
A256: 254 | B256: 500000 | C256: 51 | D256: money | E256: 10 | F256: gem | G256: 51
A257: 255 | B257: 500000 | C257: 51 | D257: money | E257: 10 | F257: material | G257: 51
A258: 256 | B258: * | C258: 52 | D258: money | E258: 10
A259: 257 | B259: 500000 | C259: 52 | D259: money | E259: 10 | F259: player_exp | G259: 52
A260: 258 | B260: 500000 | C260: 52 | D260: money | E260: 10 | F260: hero | G260: *
A261: 259 | B261: 500000 | C261: 52 | D261: money | E261: 10 | F261: gem | G261: 52
A262: 260 | B262: 500000 | C262: 52 | D262: money | E262: 10 | F262: material | G262: 52
A263: 261 | B263: * | C263: 53 | D263: money | E263: 10
A264: 262 | B264: 500000 | C264: 53 | D264: money | E264: 10 | F264: player_exp | G264: 53
A265: 263 | B265: 500000 | C265: 53 | D265: money | E265: 10 | F265: hero | G265: *
A266: 264 | B266: 500000 | C266: 53 | D266: money | E266: 10 | F266: gem | G266: 53
A267: 265 | B267: 500000 | C267: 53 | D267: money | E267: 10 | F267: material | G267: 53
A268: 266 | B268: * | C268: 54 | D268: money | E268: 10
A269: 267 | B269: 500000 | C269: 54 | D269: money | E269: 10 | F269: player_exp | G269: 54
A270: 268 | B270: 500000 | C270: 54 | D270: money | E270: 10 | F270: hero | G270: *
A271: 269 | B271: 500000 | C271: 54 | D271: money | E271: 10 | F271: gem | G271: 54
A272: 270 | B272: 500000 | C272: 54 | D272: money | E272: 10 | F272: material | G272: 54
A273: 271 | B273: * | C273: 55 | D273: money | E273: 10
A274: 272 | B274: 500000 | C274: 55 | D274: money | E274: 10 | F274: player_exp | G274: 55
A275: 273 | B275: 500000 | C275: 55 | D275: money | E275: 10 | F275: hero | G275: *
A276: 274 | B276: 500000 | C276: 55 | D276: money | E276: 10 | F276: gem | G276: 55
A277: 275 | B277: 500000 | C277: 55 | D277: money | E277: 10 | F277: material | G277: 55
A278: 276 | B278: * | C278: 56 | D278: money | E278: 10
A279: 277 | B279: 500000 | C279: 56 | D279: money | E279: 10 | F279: player_exp | G279: 56
A280: 278 | B280: 500000 | C280: 56 | D280: money | E280: 10 | F280: hero | G280: *
A281: 279 | B281: 500000 | C281: 56 | D281: money | E281: 10 | F281: gem | G281: 56
A282: 280 | B282: 500000 | C282: 56 | D282: money | E282: 10 | F282: material | G282: 56
A283: 281 | B283: * | C283: 57 | D283: money | E283: 10
A284: 282 | B284: 500000 | C284: 57 | D284: money | E284: 10 | F284: player_exp | G284: 57
A285: 283 | B285: 500000 | C285: 57 | D285: money | E285: 10 | F285: hero | G285: *
A286: 284 | B286: 500000 | C286: 57 | D286: money | E286: 10 | F286: gem | G286: 57
A287: 285 | B287: 500000 | C287: 57 | D287: money | E287: 10 | F287: material | G287: 57
A288: 286 | B288: * | C288: 58 | D288: money | E288: 10
A289: 287 | B289: 500000 | C289: 58 | D289: money | E289: 10 | F289: player_exp | G289: 58
A290: 288 | B290: 500000 | C290: 58 | D290: money | E290: 10 | F290: hero | G290: *
A291: 289 | B291: 500000 | C291: 58 | D291: money | E291: 10 | F291: gem | G291: 58
A292: 290 | B292: 500000 | C292: 58 | D292: money | E292: 10 | F292: material | G292: 58
A293: 291 | B293: * | C293: 59 | D293: money | E293: 10
A294: 292 | B294: 500000 | C294: 59 | D294: money | E294: 10 | F294: player_exp | G294: 59
A295: 293 | B295: 500000 | C295: 59 | D295: money | E295: 10 | F295: hero | G295: *
A296: 294 | B296: 500000 | C296: 59 | D296: money | E296: 10 | F296: gem | G296: 59
A297: 295 | B297: 500000 | C297: 59 | D297: money | E297: 10 | F297: material | G297: 59
A298: 296 | B298: * | C298: 60 | D298: money | E298: 10
A299: 297 | B299: 500000 | C299: 60 | D299: money | E299: 10 | F299: player_exp | G299: 60
A300: 298 | B300: 500000 | C300: 60 | D300: money | E300: 10 | F300: hero | G300: *
A301: 299 | B301: 500000 | C301: 60 | D301: money | E301: 10 | F301: gem | G301: 60
A302: 300 | B302: 500000 | C302: 60 | D302: money | E302: 10 | F302: material | G302: 60

Sheet: 资源自生产表
A1: id | B1: 玩家等级 | C1: 每小时碎片 | D1: 每小时水晶 | E1: 每小时宝石 | F1: 好友碎片 | G1: 好友水晶 | H1: 好友宝石
A2: id | B2: player_lvl | C2: material_ph | D2: gem_ph1 | E2: gem_ph2 | F2: f_material_ph | G2: f_gem_ph1 | H2: f_gem_ph2
A3: 1 | B3: 1 | C3: 1 | D3: 1 | E3: 1 | F3: =FLOOR(RC[-3]/2+1,1) -> 1 | G3: =FLOOR(RC[-3]/2+1,1) -> 1 | H3: =FLOOR(RC[-3]/2+1,1) -> 1
A4: 2 | B4: 2 | C4: 1 | D4: 1 | E4: 1 | F4: =FLOOR(RC[-3]/2+1,1) -> 1 | G4: =FLOOR(RC[-3]/2+1,1) -> 1 | H4: =FLOOR(RC[-3]/2+1,1) -> 1
A5: 3 | B5: 3 | C5: 2 | D5: 2 | E5: 2 | F5: =FLOOR(RC[-3]/2+1,1) -> 2 | G5: =FLOOR(RC[-3]/2+1,1) -> 2 | H5: =FLOOR(RC[-3]/2+1,1) -> 2
A6: 4 | B6: 4 | C6: 2 | D6: 2 | E6: 2 | F6: =FLOOR(RC[-3]/2+1,1) -> 2 | G6: =FLOOR(RC[-3]/2+1,1) -> 2 | H6: =FLOOR(RC[-3]/2+1,1) -> 2
A7: 5 | B7: 5 | C7: 2 | D7: 2 | E7: 2 | F7: =FLOOR(RC[-3]/2+1,1) -> 2 | G7: =FLOOR(RC[-3]/2+1,1) -> 2 | H7: =FLOOR(RC[-3]/2+1,1) -> 2
A8: 6 | B8: 6 | C8: 2 | D8: 2 | E8: 2 | F8: =FLOOR(RC[-3]/2+1,1) -> 2 | G8: =FLOOR(RC[-3]/2+1,1) -> 2 | H8: =FLOOR(RC[-3]/2+1,1) -> 2
A9: 7 | B9: 7 | C9: 2 | D9: 2 | E9: 2 | F9: =FLOOR(RC[-3]/2+1,1) -> 2 | G9: =FLOOR(RC[-3]/2+1,1) -> 2 | H9: =FLOOR(RC[-3]/2+1,1) -> 2
A10: 8 | B10: 8 | C10: 3 | D10: 3 | E10: 3 | F10: =FLOOR(RC[-3]/2+1,1) -> 2 | G10: =FLOOR(RC[-3]/2+1,1) -> 2 | H10: =FLOOR(RC[-3]/2+1,1) -> 2
A11: 9 | B11: 9 | C11: 3 | D11: 3 | E11: 3 | F11: =FLOOR(RC[-3]/2+1,1) -> 2 | G11: =FLOOR(RC[-3]/2+1,1) -> 2 | H11: =FLOOR(RC[-3]/2+1,1) -> 2
A12: 10 | B12: 10 | C12: 3 | D12: 3 | E12: 3 | F12: =FLOOR(RC[-3]/2+1,1) -> 2 | G12: =FLOOR(RC[-3]/2+1,1) -> 2 | H12: =FLOOR(RC[-3]/2+1,1) -> 2
A13: 11 | B13: 11 | C13: 3 | D13: 3 | E13: 3 | F13: =FLOOR(RC[-3]/2+1,1) -> 2 | G13: =FLOOR(RC[-3]/2+1,1) -> 2 | H13: =FLOOR(RC[-3]/2+1,1) -> 2
A14: 12 | B14: 12 | C14: 3 | D14: 3 | E14: 3 | F14: =FLOOR(RC[-3]/2+1,1) -> 2 | G14: =FLOOR(RC[-3]/2+1,1) -> 2 | H14: =FLOOR(RC[-3]/2+1,1) -> 2
A15: 13 | B15: 13 | C15: 4 | D15: 4 | E15: 4 | F15: =FLOOR(RC[-3]/2+1,1) -> 3 | G15: =FLOOR(RC[-3]/2+1,1) -> 3 | H15: =FLOOR(RC[-3]/2+1,1) -> 3
A16: 14 | B16: 14 | C16: 4 | D16: 4 | E16: 4 | F16: =FLOOR(RC[-3]/2+1,1) -> 3 | G16: =FLOOR(RC[-3]/2+1,1) -> 3 | H16: =FLOOR(RC[-3]/2+1,1) -> 3
A17: 15 | B17: 15 | C17: 4 | D17: 4 | E17: 4 | F17: =FLOOR(RC[-3]/2+1,1) -> 3 | G17: =FLOOR(RC[-3]/2+1,1) -> 3 | H17: =FLOOR(RC[-3]/2+1,1) -> 3
A18: 16 | B18: 16 | C18: 4 | D18: 4 | E18: 4 | F18: =FLOOR(RC[-3]/2+1,1) -> 3 | G18: =FLOOR(RC[-3]/2+1,1) -> 3 | H18: =FLOOR(RC[-3]/2+1,1) -> 3
A19: 17 | B19: 17 | C19: 4 | D19: 4 | E19: 4 | F19: =FLOOR(RC[-3]/2+1,1) -> 3 | G19: =FLOOR(RC[-3]/2+1,1) -> 3 | H19: =FLOOR(RC[-3]/2+1,1) -> 3
A20: 18 | B20: 18 | C20: 5 | D20: 5 | E20: 5 | F20: =FLOOR(RC[-3]/2+1,1) -> 3 | G20: =FLOOR(RC[-3]/2+1,1) -> 3 | H20: =FLOOR(RC[-3]/2+1,1) -> 3
A21: 19 | B21: 19 | C21: 5 | D21: 5 | E21: 5 | F21: =FLOOR(RC[-3]/2+1,1) -> 3 | G21: =FLOOR(RC[-3]/2+1,1) -> 3 | H21: =FLOOR(RC[-3]/2+1,1) -> 3
A22: 20 | B22: 20 | C22: 5 | D22: 5 | E22: 5 | F22: =FLOOR(RC[-3]/2+1,1) -> 3 | G22: =FLOOR(RC[-3]/2+1,1) -> 3 | H22: =FLOOR(RC[-3]/2+1,1) -> 3
A23: 21 | B23: 21 | C23: 5 | D23: 5 | E23: 5 | F23: =FLOOR(RC[-3]/2+1,1) -> 3 | G23: =FLOOR(RC[-3]/2+1,1) -> 3 | H23: =FLOOR(RC[-3]/2+1,1) -> 3
A24: 22 | B24: 22 | C24: 5 | D24: 5 | E24: 5 | F24: =FLOOR(RC[-3]/2+1,1) -> 3 | G24: =FLOOR(RC[-3]/2+1,1) -> 3 | H24: =FLOOR(RC[-3]/2+1,1) -> 3
A25: 23 | B25: 23 | C25: 6 | D25: 6 | E25: 6 | F25: =FLOOR(RC[-3]/2+1,1) -> 4 | G25: =FLOOR(RC[-3]/2+1,1) -> 4 | H25: =FLOOR(RC[-3]/2+1,1) -> 4
A26: 24 | B26: 24 | C26: 6 | D26: 6 | E26: 6 | F26: =FLOOR(RC[-3]/2+1,1) -> 4 | G26: =FLOOR(RC[-3]/2+1,1) -> 4 | H26: =FLOOR(RC[-3]/2+1,1) -> 4
A27: 25 | B27: 25 | C27: 6 | D27: 6 | E27: 6 | F27: =FLOOR(RC[-3]/2+1,1) -> 4 | G27: =FLOOR(RC[-3]/2+1,1) -> 4 | H27: =FLOOR(RC[-3]/2+1,1) -> 4
A28: 26 | B28: 26 | C28: 6 | D28: 6 | E28: 6 | F28: =FLOOR(RC[-3]/2+1,1) -> 4 | G28: =FLOOR(RC[-3]/2+1,1) -> 4 | H28: =FLOOR(RC[-3]/2+1,1) -> 4
A29: 27 | B29: 27 | C29: 6 | D29: 6 | E29: 6 | F29: =FLOOR(RC[-3]/2+1,1) -> 4 | G29: =FLOOR(RC[-3]/2+1,1) -> 4 | H29: =FLOOR(RC[-3]/2+1,1) -> 4
A30: 28 | B30: 28 | C30: 7 | D30: 7 | E30: 7 | F30: =FLOOR(RC[-3]/2+1,1) -> 4 | G30: =FLOOR(RC[-3]/2+1,1) -> 4 | H30: =FLOOR(RC[-3]/2+1,1) -> 4
A31: 29 | B31: 29 | C31: 7 | D31: 7 | E31: 7 | F31: =FLOOR(RC[-3]/2+1,1) -> 4 | G31: =FLOOR(RC[-3]/2+1,1) -> 4 | H31: =FLOOR(RC[-3]/2+1,1) -> 4
A32: 30 | B32: 30 | C32: 7 | D32: 7 | E32: 7 | F32: =FLOOR(RC[-3]/2+1,1) -> 4 | G32: =FLOOR(RC[-3]/2+1,1) -> 4 | H32: =FLOOR(RC[-3]/2+1,1) -> 4
A33: 31 | B33: 31 | C33: 7 | D33: 7 | E33: 7 | F33: =FLOOR(RC[-3]/2+1,1) -> 4 | G33: =FLOOR(RC[-3]/2+1,1) -> 4 | H33: =FLOOR(RC[-3]/2+1,1) -> 4
A34: 32 | B34: 32 | C34: 7 | D34: 7 | E34: 7 | F34: =FLOOR(RC[-3]/2+1,1) -> 4 | G34: =FLOOR(RC[-3]/2+1,1) -> 4 | H34: =FLOOR(RC[-3]/2+1,1) -> 4
A35: 33 | B35: 33 | C35: 8 | D35: 8 | E35: 8 | F35: =FLOOR(RC[-3]/2+1,1) -> 5 | G35: =FLOOR(RC[-3]/2+1,1) -> 5 | H35: =FLOOR(RC[-3]/2+1,1) -> 5
A36: 34 | B36: 34 | C36: 8 | D36: 8 | E36: 8 | F36: =FLOOR(RC[-3]/2+1,1) -> 5 | G36: =FLOOR(RC[-3]/2+1,1) -> 5 | H36: =FLOOR(RC[-3]/2+1,1) -> 5
A37: 35 | B37: 35 | C37: 8 | D37: 8 | E37: 8 | F37: =FLOOR(RC[-3]/2+1,1) -> 5 | G37: =FLOOR(RC[-3]/2+1,1) -> 5 | H37: =FLOOR(RC[-3]/2+1,1) -> 5
A38: 36 | B38: 36 | C38: 8 | D38: 8 | E38: 8 | F38: =FLOOR(RC[-3]/2+1,1) -> 5 | G38: =FLOOR(RC[-3]/2+1,1) -> 5 | H38: =FLOOR(RC[-3]/2+1,1) -> 5
A39: 37 | B39: 37 | C39: 8 | D39: 8 | E39: 8 | F39: =FLOOR(RC[-3]/2+1,1) -> 5 | G39: =FLOOR(RC[-3]/2+1,1) -> 5 | H39: =FLOOR(RC[-3]/2+1,1) -> 5
A40: 38 | B40: 38 | C40: 9 | D40: 9 | E40: 9 | F40: =FLOOR(RC[-3]/2+1,1) -> 5 | G40: =FLOOR(RC[-3]/2+1,1) -> 5 | H40: =FLOOR(RC[-3]/2+1,1) -> 5
A41: 39 | B41: 39 | C41: 9 | D41: 9 | E41: 9 | F41: =FLOOR(RC[-3]/2+1,1) -> 5 | G41: =FLOOR(RC[-3]/2+1,1) -> 5 | H41: =FLOOR(RC[-3]/2+1,1) -> 5
A42: 40 | B42: 40 | C42: 9 | D42: 9 | E42: 9 | F42: =FLOOR(RC[-3]/2+1,1) -> 5 | G42: =FLOOR(RC[-3]/2+1,1) -> 5 | H42: =FLOOR(RC[-3]/2+1,1) -> 5
A43: 41 | B43: 41 | C43: 9 | D43: 9 | E43: 9 | F43: =FLOOR(RC[-3]/2+1,1) -> 5 | G43: =FLOOR(RC[-3]/2+1,1) -> 5 | H43: =FLOOR(RC[-3]/2+1,1) -> 5
A44: 42 | B44: 42 | C44: 9 | D44: 9 | E44: 9 | F44: =FLOOR(RC[-3]/2+1,1) -> 5 | G44: =FLOOR(RC[-3]/2+1,1) -> 5 | H44: =FLOOR(RC[-3]/2+1,1) -> 5
A45: 43 | B45: 43 | C45: 10 | D45: 10 | E45: 10 | F45: =FLOOR(RC[-3]/2+1,1) -> 6 | G45: =FLOOR(RC[-3]/2+1,1) -> 6 | H45: =FLOOR(RC[-3]/2+1,1) -> 6
A46: 44 | B46: 44 | C46: 10 | D46: 10 | E46: 10 | F46: =FLOOR(RC[-3]/2+1,1) -> 6 | G46: =FLOOR(RC[-3]/2+1,1) -> 6 | H46: =FLOOR(RC[-3]/2+1,1) -> 6
A47: 45 | B47: 45 | C47: 10 | D47: 10 | E47: 10 | F47: =FLOOR(RC[-3]/2+1,1) -> 6 | G47: =FLOOR(RC[-3]/2+1,1) -> 6 | H47: =FLOOR(RC[-3]/2+1,1) -> 6
A48: 46 | B48: 46 | C48: 10 | D48: 10 | E48: 10 | F48: =FLOOR(RC[-3]/2+1,1) -> 6 | G48: =FLOOR(RC[-3]/2+1,1) -> 6 | H48: =FLOOR(RC[-3]/2+1,1) -> 6
A49: 47 | B49: 47 | C49: 10 | D49: 10 | E49: 10 | F49: =FLOOR(RC[-3]/2+1,1) -> 6 | G49: =FLOOR(RC[-3]/2+1,1) -> 6 | H49: =FLOOR(RC[-3]/2+1,1) -> 6
A50: 48 | B50: 48 | C50: 11 | D50: 11 | E50: 11 | F50: =FLOOR(RC[-3]/2+1,1) -> 6 | G50: =FLOOR(RC[-3]/2+1,1) -> 6 | H50: =FLOOR(RC[-3]/2+1,1) -> 6
A51: 49 | B51: 49 | C51: 11 | D51: 11 | E51: 11 | F51: =FLOOR(RC[-3]/2+1,1) -> 6 | G51: =FLOOR(RC[-3]/2+1,1) -> 6 | H51: =FLOOR(RC[-3]/2+1,1) -> 6
A52: 50 | B52: 50 | C52: 11 | D52: 11 | E52: 11 | F52: =FLOOR(RC[-3]/2+1,1) -> 6 | G52: =FLOOR(RC[-3]/2+1,1) -> 6 | H52: =FLOOR(RC[-3]/2+1,1) -> 6
A53: 51 | B53: 51 | C53: 11 | D53: 11 | E53: 11 | F53: =FLOOR(RC[-3]/2+1,1) -> 6 | G53: =FLOOR(RC[-3]/2+1,1) -> 6 | H53: =FLOOR(RC[-3]/2+1,1) -> 6
A54: 52 | B54: 52 | C54: 11 | D54: 11 | E54: 11 | F54: =FLOOR(RC[-3]/2+1,1) -> 6 | G54: =FLOOR(RC[-3]/2+1,1) -> 6 | H54: =FLOOR(RC[-3]/2+1,1) -> 6
A55: 53 | B55: 53 | C55: 12 | D55: 12 | E55: 12 | F55: =FLOOR(RC[-3]/2+1,1) -> 7 | G55: =FLOOR(RC[-3]/2+1,1) -> 7 | H55: =FLOOR(RC[-3]/2+1,1) -> 7
A56: 54 | B56: 54 | C56: 12 | D56: 12 | E56: 12 | F56: =FLOOR(RC[-3]/2+1,1) -> 7 | G56: =FLOOR(RC[-3]/2+1,1) -> 7 | H56: =FLOOR(RC[-3]/2+1,1) -> 7
A57: 55 | B57: 55 | C57: 12 | D57: 12 | E57: 12 | F57: =FLOOR(RC[-3]/2+1,1) -> 7 | G57: =FLOOR(RC[-3]/2+1,1) -> 7 | H57: =FLOOR(RC[-3]/2+1,1) -> 7
A58: 56 | B58: 56 | C58: 12 | D58: 12 | E58: 12 | F58: =FLOOR(RC[-3]/2+1,1) -> 7 | G58: =FLOOR(RC[-3]/2+1,1) -> 7 | H58: =FLOOR(RC[-3]/2+1,1) -> 7
A59: 57 | B59: 57 | C59: 12 | D59: 12 | E59: 12 | F59: =FLOOR(RC[-3]/2+1,1) -> 7 | G59: =FLOOR(RC[-3]/2+1,1) -> 7 | H59: =FLOOR(RC[-3]/2+1,1) -> 7
A60: 58 | B60: 58 | C60: 13 | D60: 13 | E60: 13 | F60: =FLOOR(RC[-3]/2+1,1) -> 7 | G60: =FLOOR(RC[-3]/2+1,1) -> 7 | H60: =FLOOR(RC[-3]/2+1,1) -> 7
A61: 59 | B61: 59 | C61: 13 | D61: 13 | E61: 13 | F61: =FLOOR(RC[-3]/2+1,1) -> 7 | G61: =FLOOR(RC[-3]/2+1,1) -> 7 | H61: =FLOOR(RC[-3]/2+1,1) -> 7
A62: 60 | B62: 60 | C62: 13 | D62: 13 | E62: 13 | F62: =FLOOR(RC[-3]/2+1,1) -> 7 | G62: =FLOOR(RC[-3]/2+1,1) -> 7 | H62: =FLOOR(RC[-3]/2+1,1) -> 7

Sheet: 矿洞开采表
A1: id | B1: 产量概率 | C1: 产量 | D1: 开采费用
A2: id | B2: pro_rate | C2: pro_num | D2: pro_cost
A3: 1 | B3: 45 | C3: 1 | D3: 50
A4: 2 | B4: 25 | C4: 2 | D4: 100
A5: 3 | B5: 15 | C5: 3 | D5: 150
A6: 4 | B6: 10 | C6: 4 | D6: 200
A7: 5 | B7: 5 | C7: 5 | D7: 250

Sheet: 擂台排名奖励表
A1: ID | B1: 名次 | C1: 奖励类型 | D1: 参数列表 | E1: 奖励类型 | F1: 参数列表
A2: id | B2: rank_lvl | C2: reward_type | D2: reward_args | E2: reward_type | F2: reward_args
A3: 1 | B3: 1 | C3: money | D3: 15000 | E3: hnp | F3: 50
A4: 2 | B4: 2 | C4: money | D4: 12000 | E4: hnp | F4: 40
A5: 3 | B5: 3 | C5: money | D5: 10000 | E5: hnp | F5: 30
A6: 4 | B6: 4 | C6: money | D6: 9700 | E6: hnp | F6: 24
A7: 5 | B7: 5 | C7: money | D7: 9600 | E7: hnp | F7: 24
A8: 6 | B8: 6 | C8: money | D8: 9500 | E8: hnp | F8: 24
A9: 7 | B9: 7 | C9: money | D9: 9400 | E9: hnp | F9: 24
A10: 8 | B10: 8 | C10: money | D10: 9300 | E10: hnp | F10: 24
A11: 9 | B11: 9 | C11: money | D11: 9200 | E11: hnp | F11: 24
A12: 10 | B12: 10 | C12: money | D12: 9100 | E12: hnp | F12: 24
A13: 11 | B13: 11 | C13: money | D13: 9000 | E13: hnp | F13: 21
A14: 12 | B14: 12 | C14: money | D14: 8900 | E14: hnp | F14: 21
A15: 13 | B15: 13 | C15: money | D15: 8800 | E15: hnp | F15: 21
A16: 14 | B16: 14 | C16: money | D16: 8700 | E16: hnp | F16: 21
A17: 15 | B17: 15 | C17: money | D17: 8600 | E17: hnp | F17: 21
A18: 16 | B18: 16 | C18: money | D18: 8500 | E18: hnp | F18: 21
A19: 17 | B19: 17 | C19: money | D19: 8400 | E19: hnp | F19: 21
A20: 18 | B20: 18 | C20: money | D20: 8300 | E20: hnp | F20: 21
A21: 19 | B21: 19 | C21: money | D21: 8200 | E21: hnp | F21: 21
A22: 20 | B22: 20 | C22: money | D22: 8100 | E22: hnp | F22: 21
A23: 21 | B23: 21 | C23: money | D23: 8000 | E23: hnp | F23: 18
A24: 22 | B24: 22 | C24: money | D24: 7900 | E24: hnp | F24: 18
A25: 23 | B25: 23 | C25: money | D25: 7800 | E25: hnp | F25: 18
A26: 24 | B26: 24 | C26: money | D26: 7700 | E26: hnp | F26: 18
A27: 25 | B27: 25 | C27: money | D27: 7600 | E27: hnp | F27: 18
A28: 26 | B28: 26 | C28: money | D28: 7500 | E28: hnp | F28: 18
A29: 27 | B29: 27 | C29: money | D29: 7400 | E29: hnp | F29: 18
A30: 28 | B30: 28 | C30: money | D30: 7300 | E30: hnp | F30: 18
A31: 29 | B31: 29 | C31: money | D31: 7200 | E31: hnp | F31: 18
A32: 30 | B32: 30 | C32: money | D32: 7100 | E32: hnp | F32: 18
A33: 31 | B33: 31 | C33: money | D33: 7000 | E33: hnp | F33: 15
A34: 32 | B34: 32 | C34: money | D34: 6900 | E34: hnp | F34: 15
A35: 33 | B35: 33 | C35: money | D35: 6800 | E35: hnp | F35: 15
A36: 34 | B36: 34 | C36: money | D36: 6700 | E36: hnp | F36: 15
A37: 35 | B37: 35 | C37: money | D37: 6600 | E37: hnp | F37: 15
A38: 36 | B38: 36 | C38: money | D38: 6500 | E38: hnp | F38: 15
A39: 37 | B39: 37 | C39: money | D39: 6400 | E39: hnp | F39: 15
A40: 38 | B40: 38 | C40: money | D40: 6300 | E40: hnp | F40: 15
A41: 39 | B41: 39 | C41: money | D41: 6200 | E41: hnp | F41: 15
A42: 40 | B42: 40 | C42: money | D42: 6100 | E42: hnp | F42: 15
A43: 41 | B43: 41 | C43: money | D43: 6000 | E43: hnp | F43: 12
A44: 42 | B44: 42 | C44: money | D44: 5900 | E44: hnp | F44: 12
A45: 43 | B45: 43 | C45: money | D45: 5800 | E45: hnp | F45: 12
A46: 44 | B46: 44 | C46: money | D46: 5700 | E46: hnp | F46: 12
A47: 45 | B47: 45 | C47: money | D47: 5600 | E47: hnp | F47: 12
A48: 46 | B48: 46 | C48: money | D48: 5500 | E48: hnp | F48: 12
A49: 47 | B49: 47 | C49: money | D49: 5400 | E49: hnp | F49: 12
A50: 48 | B50: 48 | C50: money | D50: 5300 | E50: hnp | F50: 12
A51: 49 | B51: 49 | C51: money | D51: 5200 | E51: hnp | F51: 12
A52: 50 | B52: 50 | C52: money | D52: 5100 | E52: hnp | F52: 12
A53: 51 | B53: 51 | C53: money | D53: 5000 | E53: hnp | F53: 9
A54: 52 | B54: 52 | C54: money | D54: 4900 | E54: hnp | F54: 9
A55: 53 | B55: 53 | C55: money | D55: 4800 | E55: hnp | F55: 9
A56: 54 | B56: 54 | C56: money | D56: 4700 | E56: hnp | F56: 9
A57: 55 | B57: 55 | C57: money | D57: 4600 | E57: hnp | F57: 9
A58: 56 | B58: 56 | C58: money | D58: 4500 | E58: hnp | F58: 9
A59: 57 | B59: 57 | C59: money | D59: 4400 | E59: hnp | F59: 9
A60: 58 | B60: 58 | C60: money | D60: 4300 | E60: hnp | F60: 9
A61: 59 | B61: 59 | C61: money | D61: 4200 | E61: hnp | F61: 9
A62: 60 | B62: 60 | C62: money | D62: 4100 | E62: hnp | F62: 9
A63: 61 | B63: 61 | C63: money | D63: 4000 | E63: hnp | F63: 6
A64: 62 | B64: 62 | C64: money | D64: 3900 | E64: hnp | F64: 6
A65: 63 | B65: 63 | C65: money | D65: 3800 | E65: hnp | F65: 6
A66: 64 | B66: 64 | C66: money | D66: 3700 | E66: hnp | F66: 6
A67: 65 | B67: 65 | C67: money | D67: 3600 | E67: hnp | F67: 6
A68: 66 | B68: 66 | C68: money | D68: 3500 | E68: hnp | F68: 6
A69: 67 | B69: 67 | C69: money | D69: 3400 | E69: hnp | F69: 6
A70: 68 | B70: 68 | C70: money | D70: 3300 | E70: hnp | F70: 6
A71: 69 | B71: 69 | C71: money | D71: 3200 | E71: hnp | F71: 6
A72: 70 | B72: 70 | C72: money | D72: 3100 | E72: hnp | F72: 6
A73: 71 | B73: 71 | C73: money | D73: 3000 | E73: hnp | F73: 6
A74: 72 | B74: 72 | C74: money | D74: 2900 | E74: hnp | F74: 6
A75: 73 | B75: 73 | C75: money | D75: 2800 | E75: hnp | F75: 6
A76: 74 | B76: 74 | C76: money | D76: 2700 | E76: hnp | F76: 6
A77: 75 | B77: 75 | C77: money | D77: 2600 | E77: hnp | F77: 6
A78: 76 | B78: 76 | C78: money | D78: 2500 | E78: hnp | F78: 6
A79: 77 | B79: 77 | C79: money | D79: 2400 | E79: hnp | F79: 6
A80: 78 | B80: 78 | C80: money | D80: 2300 | E80: hnp | F80: 6
A81: 79 | B81: 79 | C81: money | D81: 2200 | E81: hnp | F81: 6
A82: 80 | B82: 80 | C82: money | D82: 2100 | E82: hnp | F82: 6
A83: 81 | B83: 81 | C83: money | D83: 2000 | E83: hnp | F83: 3
A84: 82 | B84: 82 | C84: money | D84: 1900 | E84: hnp | F84: 3
A85: 83 | B85: 83 | C85: money | D85: 1800 | E85: hnp | F85: 3
A86: 84 | B86: 84 | C86: money | D86: 1700 | E86: hnp | F86: 3
A87: 85 | B87: 85 | C87: money | D87: 1600 | E87: hnp | F87: 3
A88: 86 | B88: 86 | C88: money | D88: 1500 | E88: hnp | F88: 3
A89: 87 | B89: 87 | C89: money | D89: 1400 | E89: hnp | F89: 3
A90: 88 | B90: 88 | C90: money | D90: 1300 | E90: hnp | F90: 3
A91: 89 | B91: 89 | C91: money | D91: 1200 | E91: hnp | F91: 3
A92: 90 | B92: 90 | C92: money | D92: 1100 | E92: hnp | F92: 3
A93: 91 | B93: 91 | C93: money | D93: 1000 | E93: hnp | F93: 3
A94: 92 | B94: 92 | C94: money | D94: 900 | E94: hnp | F94: 3
A95: 93 | B95: 93 | C95: money | D95: 800 | E95: hnp | F95: 3
A96: 94 | B96: 94 | C96: money | D96: 700 | E96: hnp | F96: 3
A97: 95 | B97: 95 | C97: money | D97: 600 | E97: hnp | F97: 3
A98: 96 | B98: 96 | C98: money | D98: 500 | E98: hnp | F98: 3
A99: 97 | B99: 97 | C99: money | D99: 400 | E99: hnp | F99: 3
A100: 98 | B100: 98 | C100: money | D100: 300 | E100: hnp | F100: 3
A101: 99 | B101: 99 | C101: money | D101: 200 | E101: hnp | F101: 3
A102: 100 | B102: 100 | C102: money | D102: 100 | E102: hnp | F102: 3

Sheet: 侠客转世表
A1: ID | B1: 转世材料 | C1: 转世材料 | D1: 转世材料 | E1: 匹配优先级 | F1: 奖励类型 | G1: 参数列表
A2: id | B2: repick_src | C2: repick_src | D2: repick_src | E2: mapping_priority | F2: reward_type | G2: reward_args
A3: 1 | B3: power|D | C3: power|D | D3: power|D | E3: 0 | F3: random_hero_all | G3: D|*,C|500000
A4: 2 | B4: power|D | C4: power|D | D4: power|C | E4: 0 | F4: random_hero_all | G4: D|*,C|600000,B|53200
A5: 3 | B5: power|D | C5: power|D | D5: power|B | E5: 0 | F5: random_hero_all | G5: C|*,B|323200,A|35
A6: 4 | B6: power|D | C6: power|D | D6: power|A | E6: 0 | F6: random_hero_all | G6: B|*,A|50035
A7: 5 | B7: power|D | C7: power|C | D7: power|C | E7: 0 | F7: random_hero_all | G7: D|*,C|900000,B|103200
A8: 6 | B8: power|D | C8: power|C | D8: power|B | E8: 0 | F8: random_hero_all | G8: C|*,B|423200,A|35
A9: 7 | B9: power|D | C9: power|C | D9: power|A | E9: 0 | F9: random_hero_all | G9: B|*,A|100035
A10: 8 | B10: power|D | C10: power|B | D10: power|B | E10: 0 | F10: random_hero_all | G10: C|*,B|623200,A|1000
A11: 9 | B11: power|D | C11: power|B | D11: power|A | E11: 0 | F11: random_hero_all | G11: B|*,A|200035
A12: 10 | B12: power|D | C12: power|A | D12: power|A | E12: 0 | F12: random_hero_all | G12: B|*,A|600035
A13: 11 | B13: power|C | C13: power|C | D13: power|C | E13: 0 | F13: random_hero_all | G13: C|*,B|223200,A|35
A14: 12 | B14: power|C | C14: power|C | D14: power|B | E14: 0 | F14: random_hero_all | G14: C|*,B|523200,A|1000
A15: 13 | B15: power|C | C15: power|C | D15: power|A | E15: 0 | F15: random_hero_all | G15: B|*,A|150035
A16: 14 | B16: power|C | C16: power|B | D16: power|B | E16: 0 | F16: random_hero_all | G16: C|*,B|723200,A|3000
A17: 15 | B17: power|C | C17: power|B | D17: power|A | E17: 0 | F17: random_hero_all | G17: B|*,A|200035
A18: 16 | B18: power|C | C18: power|A | D18: power|A | E18: 0 | F18: random_hero_all | G18: B|*,A|650035
A19: 17 | B19: power|B | C19: power|B | D19: power|B | E19: 0 | F19: random_hero_all | G19: B|*,A|10035
A20: 18 | B20: power|B | C20: power|B | D20: power|A | E20: 0 | F20: random_hero_all | G20: B|*,A|300035
A21: 19 | B21: power|B | C21: power|A | D21: power|A | E21: 0 | F21: random_hero_all | G21: B|*,A|700035
A22: 20 | B22: power|A | C22: power|A | D22: power|A | E22: 0 | F22: random_hero_all | G22: A|*

Sheet: 寻宝奖励表
A1: ID | B1: 庄主等级 | C1: 奖励类型 | D1: 参数列表
A2: id | B2: player_lvl | C2: reward_type | D2: reward_args
A3: 1 | B3: 1 | C3: money | D3: 500
A4: 2 | B4: 2 | C4: money | D4: 600
A5: 3 | B5: 3 | C5: money | D5: 700
A6: 4 | B6: 4 | C6: money | D6: 800
A7: 5 | B7: 5 | C7: money | D7: 900
A8: 6 | B8: 6 | C8: money | D8: 1000
A9: 7 | B9: 7 | C9: money | D9: 1100
A10: 8 | B10: 8 | C10: money | D10: 1200.0000000000002
A11: 9 | B11: 9 | C11: money | D11: 1300
A12: 10 | B12: 10 | C12: money | D12: 1400
A13: 11 | B13: 11 | C13: money | D13: 1500
A14: 12 | B14: 12 | C14: money | D14: 1600
A15: 13 | B15: 13 | C15: money | D15: 1700
A16: 14 | B16: 14 | C16: money | D16: 1800
A17: 15 | B17: 15 | C17: money | D17: 1900
A18: 16 | B18: 16 | C18: money | D18: 2000
A19: 17 | B19: 17 | C19: money | D19: 2100
A20: 18 | B20: 18 | C20: money | D20: 2200
A21: 19 | B21: 19 | C21: money | D21: 2300
A22: 20 | B22: 20 | C22: money | D22: 2400.0000000000005
A23: 21 | B23: 21 | C23: money | D23: 2500
A24: 22 | B24: 22 | C24: money | D24: 2600
A25: 23 | B25: 23 | C25: money | D25: 2700
A26: 24 | B26: 24 | C26: money | D26: 2800.0000000000005
A27: 25 | B27: 25 | C27: money | D27: 2900.0000000000005
A28: 26 | B28: 26 | C28: money | D28: 3000
A29: 27 | B29: 27 | C29: money | D29: 3100
A30: 28 | B30: 28 | C30: money | D30: 3200
A31: 29 | B31: 29 | C31: money | D31: 3300
A32: 30 | B32: 30 | C32: money | D32: 3400
A33: 31 | B33: 31 | C33: money | D33: 3500
A34: 32 | B34: 32 | C34: money | D34: 3600
A35: 33 | B35: 33 | C35: money | D35: 3700
A36: 34 | B36: 34 | C36: money | D36: 3800
A37: 35 | B37: 35 | C37: money | D37: 3900
A38: 36 | B38: 36 | C38: money | D38: 4000
A39: 37 | B39: 37 | C39: money | D39: 4100
A40: 38 | B40: 38 | C40: money | D40: 4200
A41: 39 | B41: 39 | C41: money | D41: 4300.0000000000009
A42: 40 | B42: 40 | C42: money | D42: 4400
A43: 41 | B43: 41 | C43: money | D43: 4500
A44: 42 | B44: 42 | C44: money | D44: 4600.0000000000009
A45: 43 | B45: 43 | C45: money | D45: 4700
A46: 44 | B46: 44 | C46: money | D46: 4800
A47: 45 | B47: 45 | C47: money | D47: 4900
A48: 46 | B48: 46 | C48: money | D48: 5000
A49: 47 | B49: 47 | C49: money | D49: 5100.0000000000009
A50: 48 | B50: 48 | C50: money | D50: 5200
A51: 49 | B51: 49 | C51: money | D51: 5300.0000000000009
A52: 50 | B52: 50 | C52: money | D52: 5400
A53: 51 | B53: 51 | C53: money | D53: 5500
A54: 52 | B54: 52 | C54: money | D54: 5600.0000000000009
A55: 53 | B55: 53 | C55: money | D55: 5700
A56: 54 | B56: 54 | C56: money | D56: 5800.0000000000009
A57: 55 | B57: 55 | C57: money | D57: 5900
A58: 56 | B58: 56 | C58: money | D58: 6000
A59: 57 | B59: 57 | C59: money | D59: 6100.0000000000009
A60: 58 | B60: 58 | C60: money | D60: 6200
A61: 59 | B61: 59 | C61: money | D61: 6300.0000000000009
A62: 60 | B62: 60 | C62: money | D62: 6400

Sheet: 悬赏奖励表
A1: 组队ID | B1: 组队名称 | C1: 关卡id | D1: 奖励类型 | E1: 参数列表
A2: id | B2: name | C2: mission_id | D2: reward_type | E2: reward_args
A3: 10 | B3: 沈青刚 | C3: 雪夜邀客 | D3: coin | E3: 50
A4: 20 | B4: 阿紫 | C4: 打草惊蛇 | D4: coin | E4: 50
A5: 30 | B5: 仪清 | C5: 飞来横祸 | D5: coin | E5: 50
A6: 40 | B6: 都史 | C6: 醉仙斗酒 | D6: coin | E6: 50
A7: 50 | B7: 完颜洪烈 | C7: 酒馆结怨 | D7: coin | E7: 100
A8: 60 | B8: 林震南 | C8: 武馆命案 | D8: coin | E8: 100
A9: 70 | B9: 木婉清 | C9: 太湖水寨 | D9: coin | E9: 100
A10: 80 | B10: 柯镇恶 | C10: 归云山庄 | D10: coin | E10: 100
A11: 90 | B11: 秦红棉 | C11: 宝刀玄光 | D11: coin | E11: 100
A12: 100 | B12: 王语嫣 | C12: 千里护镖 | D12: coin | E12: 100
A13: 110 | B13: 巴天石 | C13: 聆秘 | D13: coin | E13: 200
A14: 120 | B14: 余沧海 | C14: 回雁楼 | D14: coin | E14: 200
A15: 130 | B15: 梅超风 | C15: 绿柳山庄 | D15: coin | E15: 200
A16: 140 | B16: 左冷禅 | C16: 太极初传 | D16: coin | E16: 200

Sheet: 罚恶令伤害奖励表
A1: ID | B1: 输出比率 | C1: 奖励类型 | D1: 参数列表 | E1: 奖励类型 | F1: 参数列表
A2: id | B2: damage_rate | C2: reward_type | D2: reward_args | E2: reward_type | F2: reward_args
A3: 1 | B3: 0.01 | C3: money | D3: 2500
A4: 2 | B4: 0.02 | C4: money | D4: 5000
A5: 3 | B5: 0.03 | C5: money | D5: 7500
A6: 4 | B6: 0.04 | C6: money | D6: 10000
A7: 5 | B7: 0.05 | C7: money | D7: 12500
A8: 6 | B8: 0.06 | C8: money | D8: 15000
A9: 7 | B9: 7.0000000000000007E-2 | C9: money | D9: 17500.000000000004
A10: 8 | B10: 0.08 | C10: money | D10: 20000
A11: 9 | B11: 0.09 | C11: money | D11: 22500
A12: 10 | B12: 0.1 | C12: money | D12: 25000
A13: 11 | B13: 0.11 | C13: money | D13: 27500
A14: 12 | B14: 0.12 | C14: money | D14: 30000
A15: 13 | B15: 0.13 | C15: money | D15: 32500
A16: 14 | B16: 0.14000000000000001 | C16: money | D16: 35000.000000000007
A17: 15 | B17: 0.15 | C17: money | D17: 37500
A18: 16 | B18: 0.16 | C18: money | D18: 40000
A19: 17 | B19: 0.17 | C19: money | D19: 42500
A20: 18 | B20: 0.18 | C20: money | D20: 45000
A21: 19 | B21: 0.19 | C21: money | D21: 47500
A22: 20 | B22: 0.2 | C22: money | D22: 50000
A23: 21 | B23: 0.21 | C23: money | D23: 52500
A24: 22 | B24: 0.22 | C24: money | D24: 55000
A25: 23 | B25: 0.23 | C25: money | D25: 57500
A26: 24 | B26: 0.24 | C26: money | D26: 60000
A27: 25 | B27: 0.25 | C27: money | D27: 62500
A28: 26 | B28: 0.26 | C28: money | D28: 65000
A29: 27 | B29: 0.27 | C29: money | D29: 67500
A30: 28 | B30: 0.28000000000000003 | C30: money | D30: 70000.000000000015
A31: 29 | B31: 0.28999999999999998 | C31: money | D31: 72499.999999999985
A32: 30 | B32: 0.3 | C32: money | D32: 75000
A33: 31 | B33: 0.31 | C33: money | D33: 77500
A34: 32 | B34: 0.32 | C34: money | D34: 80000
A35: 33 | B35: 0.33 | C35: money | D35: 82500
A36: 34 | B36: 0.34 | C36: money | D36: 85000
A37: 35 | B37: 0.35 | C37: money | D37: 87500
A38: 36 | B38: 0.36 | C38: money | D38: 90000
A39: 37 | B39: 0.37 | C39: money | D39: 92500
A40: 38 | B40: 0.38 | C40: money | D40: 95000
A41: 39 | B41: 0.39 | C41: money | D41: 97500
A42: 40 | B42: 0.4 | C42: money | D42: 100000
A43: 41 | B43: 0.41 | C43: money | D43: 102500
A44: 42 | B44: 0.42 | C44: money | D44: 105000
A45: 43 | B45: 0.43 | C45: money | D45: 107500
A46: 44 | B46: 0.44 | C46: money | D46: 110000
A47: 45 | B47: 0.45 | C47: money | D47: 112500
A48: 46 | B48: 0.46 | C48: money | D48: 115000
A49: 47 | B49: 0.47 | C49: money | D49: 117500
A50: 48 | B50: 0.48 | C50: money | D50: 120000
A51: 49 | B51: 0.49 | C51: money | D51: 122500
A52: 50 | B52: 0.5 | C52: money | D52: 125000
A53: 51 | B53: 0.51 | C53: money | D53: 127500
A54: 52 | B54: 0.52 | C54: money | D54: 130000
A55: 53 | B55: 0.53 | C55: money | D55: 132500
A56: 54 | B56: 0.54 | C56: money | D56: 135000
A57: 55 | B57: 0.55000000000000004 | C57: money | D57: 137500.00000000003
A58: 56 | B58: 0.56000000000000005 | C58: money | D58: 140000.00000000003
A59: 57 | B59: 0.56999999999999995 | C59: money | D59: 142499.99999999997
A60: 58 | B60: 0.57999999999999996 | C60: money | D60: 144999.99999999997
A61: 59 | B61: 0.59 | C61: money | D61: 147500
A62: 60 | B62: 0.6 | C62: money | D62: 150000
A63: 61 | B63: 0.61 | C63: money | D63: 152500
A64: 62 | B64: 0.62 | C64: money | D64: 155000
A65: 63 | B65: 0.63 | C65: money | D65: 157500
A66: 64 | B66: 0.64 | C66: money | D66: 160000
A67: 65 | B67: 0.65 | C67: money | D67: 162500
A68: 66 | B68: 0.66 | C68: money | D68: 165000
A69: 67 | B69: 0.67 | C69: money | D69: 167500
A70: 68 | B70: 0.68 | C70: money | D70: 170000
A71: 69 | B71: 0.69 | C71: money | D71: 172500
A72: 70 | B72: 0.7 | C72: money | D72: 175000
A73: 71 | B73: 0.71 | C73: money | D73: 177500
A74: 72 | B74: 0.72 | C74: money | D74: 180000
A75: 73 | B75: 0.73 | C75: money | D75: 182500
A76: 74 | B76: 0.74 | C76: money | D76: 185000
A77: 75 | B77: 0.75 | C77: money | D77: 187500
A78: 76 | B78: 0.76 | C78: money | D78: 190000
A79: 77 | B79: 0.77 | C79: money | D79: 192500
A80: 78 | B80: 0.78 | C80: money | D80: 195000
A81: 79 | B81: 0.79 | C81: money | D81: 197500
A82: 80 | B82: 0.8 | C82: money | D82: 200000
A83: 81 | B83: 0.81 | C83: money | D83: 202500
A84: 82 | B84: 0.82 | C84: money | D84: 205000
A85: 83 | B85: 0.83 | C85: money | D85: 207500
A86: 84 | B86: 0.84 | C86: money | D86: 210000
A87: 85 | B87: 0.85 | C87: money | D87: 212500
A88: 86 | B88: 0.86 | C88: money | D88: 215000
A89: 87 | B89: 0.87 | C89: money | D89: 217500
A90: 88 | B90: 0.88 | C90: money | D90: 220000
A91: 89 | B91: 0.89 | C91: money | D91: 222500
A92: 90 | B92: 0.9 | C92: money | D92: 225000
A93: 91 | B93: 0.91 | C93: money | D93: 227500
A94: 92 | B94: 0.92 | C94: money | D94: 230000
A95: 93 | B95: 0.93 | C95: money | D95: 232500
A96: 94 | B96: 0.94 | C96: money | D96: 235000
A97: 95 | B97: 0.95 | C97: money | D97: 237500
A98: 96 | B98: 0.96 | C98: money | D98: 240000
A99: 97 | B99: 0.97 | C99: money | D99: 242500
A100: 98 | B100: 0.98 | C100: money | D100: 245000
A101: 99 | B101: 0.99 | C101: money | D101: 247500
A102: 100 | B102: 1 | C102: money | D102: 250000

Sheet: 罚恶令排行奖励表
A1: ID | B1: 排名范围 | C1: 奖励名称 | D1: 奖励类型 | E1: 参数列表 | F1: 奖励类型 | G1: 参数列表 | H1: 奖励类型 | I1: 参数列表
A2: id | B2: rank_range | C2: reward_name | D2: reward_type | E2: reward_args | F2: reward_type | G2: reward_args | H2: reward_type | I2: reward_args
A3: 1 | B3: 1-1 | C3: 王者嘉奖 | D3: item | E3: 62|3
A4: 2 | B4: 2-5 | C4: 救世嘉奖 | D4: item | E4: 62|2
A5: 3 | B5: 6-10 | C5: 豪义嘉奖 | D5: item | E5: 62|1

Sheet: export
A1: sheet_name | B1: export_name
A2: 怪物奖励配置表 | B2: reward_settings
A3: 活跃度奖励配置表 | B3: active_degree_reward_settings
A4: 登入抽奖配置表 | B4: login_reward_settings
A5: 在线奖励配置表 | B5: online_reward_settings
A6: 奖励表 | B6: reward_list
A7: 荣誉表 | B7: honor_award_list
A8: 宝箱奖励表 | B8: chest_award_list
A9: 邀请奖励表 | B9: invite_award_list
A10: 征收奖励表 | B10: levy_award_list
A11: 资源自生产表 | B11: auto_product_list
A12: 矿洞开采表 | B12: cave_product_list
A13: 擂台排名奖励表 | B13: match_rank_reward_list
A14: 侠客转世表 | B14: repick_list
A15: 寻宝奖励表 | B15: treasure_list
A16: 悬赏奖励表 | B16: wanted_reward_list
A17: 罚恶令伤害奖励表 | B17: bossbattle_damage_reward_list
A18: 罚恶令排行奖励表 | B18: bossbattle_rank_reward_list
A19: 精英关卡奖励配置表 | B19: ex_mission_reward_list