Sheet: 关卡表说明
A1: 表功能说明：
A2: 区域表 | B2: 配置大地图上所显示的区域，更改表数据只会影响到任务文字，而不会影响地图表现
A3: 关卡表 | B3: 配置每个区域中所包含的子关卡
A4: 怪物组队表 | B4: 配置所有肯能的怪物搭配，并确定每组怪物在关卡中的出现位置
A5: 华山论剑 | B5: 配置华山论剑每层的难度说明文字及奖励内容
A6: 千层塔怪物组队表 | B6: 配置华山论剑每层的怪物组队
A7: 罚恶令怪物配置表 | B7: 配置罚恶令中出现的BOSS
A8: 精英关卡配置表 | B8: 配置精英关卡中随机出来的怪物所需附加的修正值，用以提升难度
A10: 配置规则：
A11: 1.怪物组队表中的五项修正值可正可负，是增强/削弱怪物能力的主要参数
A12: 2.怪物组队表中配置的怪物，必须是在“数值系统_侠客.xlsx”中“侠客配置表”中出现的侠客

Sheet: 区域表
A1: 区域ID | B1: 区域名称 | C1: 等级限制
A2: id | B2: name | C2: level_limit
A3: 1 | B3: 江南轶事 | C3: 1
A4: 2 | B4: 醉仙楼 | C4: 8
A5: 3 | B5: 福威惨案 | C5: 12
A6: 4 | B6: 太湖英豪 | C6: 20
A7: 5 | B7: 屠龙踪迹 | C7: 30
A8: 6 | B8: 衡山大会 | C8: 40
A9: 7 | B9: 万安寺 | C9: 50

Sheet: 关卡表old
A1: 关卡ID | B1: 关卡序号 | C1: 关卡名称 | D1: 关卡缩略图 | E1: 战场背景图 | F1: 队伍背景图 | G1: 区域ID | H1: 等级限制
A2: id | B2: no | C2: name | D2: image | E2: back_img | F2: master_back | G2: map_id | H2: level_limit
A3: 1 | B3: 0 | C3: 雪夜邀客 | D3: 1 | E3: 1 | F3: 1 | G3: 江南轶事 | H3: 1
A4: 2 | B4: 1 | C4: 打草惊蛇 | D4: 14 | E4: 14 | F4: 14 | G4: 江南轶事 | H4: 4
A5: 3 | B5: 0 | C5: 飞来横祸 | D5: 9 | E5: 9 | F5: 9 | G5: 醉仙楼 | H5: 15
A6: 4 | B6: 1 | C6: 醉仙斗酒 | D6: 4 | E6: 4 | F6: 4 | G6: 醉仙楼 | H6: 18
A7: 5 | B7: 0 | C7: 酒馆结怨 | D7: 8 | E7: 8 | F7: 8 | G7: 福威惨案 | H7: 24
A8: 6 | B8: 1 | C8: 武馆命案 | D8: 7 | E8: 7 | F8: 7 | G8: 福威惨案 | H8: 26
A9: 7 | B9: 0 | C9: 太湖水寨 | D9: 10 | E9: 10 | F9: 10 | G9: 太湖英豪 | H9: 31
A10: 8 | B10: 1 | C10: 归云山庄 | D10: 15 | E10: 15 | F10: 15 | G10: 太湖英豪 | H10: 33
A11: 9 | B11: 0 | C11: 宝刀玄光 | D11: 13 | E11: 13 | F11: 13 | G11: 屠龙踪迹 | H11: 37
A12: 10 | B12: 1 | C12: 千里护镖 | D12: 14 | E12: 14 | F12: 14 | G12: 屠龙踪迹 | H12: 38
A13: 11 | B13: 0 | C13: 聆秘 | D13: 18 | E13: 18 | F13: 18 | G13: 衡山大会 | H13: 46
A14: 12 | B14: 1 | C14: 回雁楼 | D14: 16 | E14: 16 | F14: 16 | G14: 衡山大会 | H14: 48
A15: 13 | B15: 0 | C15: 绿柳山庄 | D15: 11 | E15: 11 | F15: 11 | G15: 万安寺 | H15: 51
A16: 14 | B16: 1 | C16: 太极初传 | D16: 24 | E16: 24 | F16: 24 | G16: 万安寺 | H16: 53

Sheet: 关卡表
A1: 关卡ID | B1: 关卡序号 | C1: 关卡名称 | D1: 关卡缩略图 | E1: 战场背景图 | F1: 队伍背景图 | G1: 区域ID | H1: 等级限制
A2: id | B2: no | C2: name | D2: image | E2: back_img | F2: master_back | G2: map_id | H2: level_limit
A3: 1 | B3: 0 | C3: 雪夜邀客 | D3: 1 | E3: 1 | F3: 1 | G3: 江南轶事 | H3: 1
A4: 2 | B4: 1 | C4: 打草惊蛇 | D4: 14 | E4: 14 | F4: 14 | G4: 江南轶事 | H4: 1
A5: 3 | B5: 0 | C5: 飞来横祸 | D5: 9 | E5: 9 | F5: 9 | G5: 醉仙楼 | H5: 8
A6: 4 | B6: 1 | C6: 醉仙斗酒 | D6: 4 | E6: 4 | F6: 4 | G6: 醉仙楼 | H6: 8
A7: 5 | B7: 0 | C7: 酒馆结怨 | D7: 8 | E7: 8 | F7: 8 | G7: 福威惨案 | H7: 12
A8: 6 | B8: 1 | C8: 武馆命案 | D8: 7 | E8: 7 | F8: 7 | G8: 福威惨案 | H8: 15
A9: 7 | B9: 0 | C9: 太湖水寨 | D9: 10 | E9: 10 | F9: 10 | G9: 太湖英豪 | H9: 20
A10: 8 | B10: 1 | C10: 归云山庄 | D10: 15 | E10: 15 | F10: 15 | G10: 太湖英豪 | H10: 25
A11: 9 | B11: 0 | C11: 宝刀玄光 | D11: 13 | E11: 13 | F11: 13 | G11: 屠龙踪迹 | H11: 30
A12: 10 | B12: 1 | C12: 千里护镖 | D12: 14 | E12: 14 | F12: 14 | G12: 屠龙踪迹 | H12: 35
A13: 11 | B13: 0 | C13: 聆秘 | D13: 18 | E13: 18 | F13: 18 | G13: 衡山大会 | H13: 40
A14: 12 | B14: 1 | C14: 回雁楼 | D14: 16 | E14: 16 | F14: 16 | G14: 衡山大会 | H14: 45
A15: 13 | B15: 0 | C15: 绿柳山庄 | D15: 11 | E15: 11 | F15: 11 | G15: 万安寺 | H15: 50
A16: 14 | B16: 1 | C16: 太极初传 | D16: 24 | E16: 24 | F16: 24 | G16: 万安寺 | H16: 55

Sheet: 怪物组队表
A1: 组队ID | B1: 组队名称 | C1: 关卡ID | D1: 顺序 | E1: 音乐 | F1: 图片 | G1: 等级限制 | H1: 攻击次数 | I1: 奖励ID | J1: 阵法ID | K1: 0怪物ID | L1: 0怪物等级 | M1: 攻击修正0 | N1: 防御修正0 | O1: 生命修正0 | P1: 内力修正0 | Q1: 体力修正0 | R1: 武器ID0 | S1: 防具ID0 | T1: 饰品ID0 | U1: 技能专精0 | V1: 天赋激活0 | W1: 1怪物ID | X1: 1怪物等级 | Y1: 攻击修正1 | Z1: 防御修正1 | AA1: 生命修正1 | AB1: 内力修正1 | AC1: 体力修正1 | AD1: 武器ID1 | AE1: 防具ID1 | AF1: 饰品ID1 | AG1: 技能专精1 | AH1: 天赋激活1 | AI1: 2怪物ID | AJ1: 2怪物等级 | AK1: 攻击修正2 | AL1: 防御修正2 | AM1: 生命修正2 | AN1: 内力修正2 | AO1: 体力修正2 | AP1: 武器ID2 | AQ1: 防具ID2 | AR1: 饰品ID2 | AS1: 技能专精2 | AT1: 天赋激活2 | AU1: 3怪物ID | AV1: 3怪物等级 | AW1: 攻击修正3 | AX1: 防御修正3 | AY1: 生命修正3 | AZ1: 内力修正3 | BA1: 体力修正3 | BB1: 武器ID3 | BC1: 防具ID3 | BD1: 饰品ID3 | BE1: 技能专精3 | BF1: 天赋激活3 | BG1: 4怪物ID | BH1: 4怪物等级 | BI1: 攻击修正4 | BJ1: 防御修正4 | BK1: 生命修正4 | BL1: 内力修正4 | BM1: 体力修正4 | BN1: 武器ID4 | BO1: 防具ID4 | BP1: 饰品ID4 | BQ1: 技能专精4 | BR1: 天赋激活4 | BS1: 5怪物ID | BT1: 5怪物等级 | BU1: 攻击修正5 | BV1: 防御修正5 | BW1: 生命修正5 | BX1: 内力修正5 | BY1: 体力修正5 | BZ1: 武器ID5 | CA1: 防具ID5 | CB1: 饰品ID5 | CC1: 技能专精5 | CD1: 天赋激活5
A2: id | B2: name | C2: mission_id | D2: no | E2: back_music | F2: stage_img | G2: level_limit | H2: pass_num | I2: reward_id | J2: zhenfa_id | K2: monster_id0 | L2: monster_lvl0 | M2: attack_mod0 | N2: defence_mod0 | O2: hp_mod0 | P2: mp_mod0 | Q2: sp_mod0 | R2: weapon_id0 | S2: armor_id0 | T2: ornament_id0 | U2: skill_power0 | V2: talnet_0 | W2: monster_id1 | X2: monster_lvl1 | Y2: attack_mod1 | Z2: defence_mod1 | AA2: hp_mod1 | AB2: mp_mod1 | AC2: sp_mod1 | AD2: weapon_id1 | AE2: armor_id1 | AF2: ornament_id1 | AG2: skill_power1 | AH2: talnet_1 | AI2: monster_id2 | AJ2: monster_lvl2 | AK2: attack_mod2 | AL2: defence_mod2 | AM2: hp_mod2 | AN2: mp_mod2 | AO2: sp_mod2 | AP2: weapon_id2 | AQ2: armor_id2 | AR2: ornament_id2 | AS2: skill_power2 | AT2: talnet_2 | AU2: monster_id3 | AV2: monster_lvl3 | AW2: attack_mod3 | AX2: defence_mod3 | AY2: hp_mod3 | AZ2: mp_mod3 | BA2: sp_mod3 | BB2: weapon_id3 | BC2: armor_id3 | BD2: ornament_id3 | BE2: skill_power3 | BF2: talnet_3 | BG2: monster_id4 | BH2: monster_lvl4 | BI2: attack_mod4 | BJ2: defence_mod4 | BK2: hp_mod4 | BL2: mp_mod4 | BM2: sp_mod4 | BN2: weapon_id4 | BO2: armor_id4 | BP2: ornament_id4 | BQ2: skill_power4 | BR2: talnet_4 | BS2: monster_id5 | BT2: monster_lvl5 | BU2: attack_mod5 | BV2: defence_mod5 | BW2: hp_mod5 | BX2: mp_mod5 | BY2: sp_mod5 | BZ2: weapon_id5 | CA2: armor_id5 | CB2: ornament_id5 | CC2: skill_power5 | CD2: talnet_5
A3: 1 | B3: 桑昆 | C3: 雪夜邀客 | D3: 1 | F3: 53 | G3: 1 | H3: 1 | I3: 1 | K3: 桑昆 | L3: 1 | M3: -20 | N3: -20 | O3: -20 | P3: -20
A4: 2 | B4: 札木合 | C4: 雪夜邀客 | D4: 2 | F4: 53 | G4: 1 | H4: 1 | I4: 2 | K4: 札木合 | L4: 1 | M4: -20 | N4: -20 | O4: -20 | P4: -20
A5: 3 | B5: 陈歪嘴 | C5: 雪夜邀客 | D5: 3 | F5: 37 | G5: 1 | H5: 1 | I5: 3 | K5: 陈歪嘴 | L5: 1
A6: 4 | B6: 王十三 | C6: 雪夜邀客 | D6: 4 | F6: 62 | G6: 1 | H6: 1 | I6: 4 | K6: 王十三 | L6: 1
A7: 5 | B7: 武三娘 | C7: 雪夜邀客 | D7: 5 | F7: 101 | G7: 1 | H7: 1 | I7: 5 | K7: 武三娘 | L7: 1
A8: 6 | B8: 郭啸天 | C8: 雪夜邀客 | D8: 6 | F8: 51 | G8: 1 | H8: 1 | I8: 6 | K8: 郭啸天 | L8: 1
A9: 7 | B9: 钱青健 | C9: 雪夜邀客 | D9: 7 | F9: 6 | G9: 1 | H9: 1 | I9: 7 | K9: 都史 | L9: =RC[12]-1 -> 1 | W9: 钱青健 | X9: 2
A10: 8 | B10: 马青雄 | C10: 雪夜邀客 | D10: 8 | F10: 6 | G10: 1 | H10: 1 | I10: 8 | K10: 札木合 | L10: =RC[12]-1 -> 2 | W10: 马青雄 | X10: 3
A11: 9 | B11: 吴青烈 | C11: 雪夜邀客 | D11: 9 | F11: 5 | G11: 1 | H11: 1 | I11: 9 | K11: 马青雄 | L11: =RC[12]-1 -> 2 | W11: 吴青烈 | X11: 3
A12: 10 | B12: 沈青刚 | C12: 雪夜邀客 | D12: 10 | F12: 5 | G12: 1 | H12: 1 | I12: 10 | K12: 钱青健 | L12: =RC[12]-1 -> 3 | W12: 沈青刚 | X12: 4
A13: 11 | B13: 殷无寿 | C13: 打草惊蛇 | D13: 1 | F13: 70 | G13: 1 | H13: 1 | I13: 11 | K13: 殷无禄 | L13: =RC[12]-1 -> 3 | W13: 殷无福 | X13: 4 | AI13: 殷无寿 | AJ13: 4
A14: 12 | B14: 青松 | C14: 打草惊蛇 | D14: 2 | F14: 23 | G14: 1 | H14: 1 | I14: 12 | K14: 缘根 | L14: =RC[12]-1 -> 4 | W14: 仪和 | X14: 5 | AI14: 青松 | AJ14: 5
A15: 13 | B15: 仪光 | C15: 打草惊蛇 | D15: 3 | F15: 105 | G15: 1 | H15: 1 | I15: 13 | K15: 仪和 | L15: =RC[12]-1 -> 4 | W15: 仪清 | X15: 5 | AI15: 仪光 | AJ15: 5
A16: 14 | B16: 陆立鼎 | C16: 打草惊蛇 | D16: 4 | F16: 18 | G16: 1 | H16: 1 | I16: 14 | K16: 陆二娘 | L16: 6 | M16: 87 | N16: 52 | O16: 143 | P16: 60 | Q16: 20 | W16: 陆无双 | X16: =RC[-12] -> 6 | Y16: =RC[-12] -> 87 | Z16: =RC[-12] -> 52 | AA16: =RC[-12] -> 143 | AB16: =RC[-12] -> 60 | AC16: =RC[-12] -> 20 | AI16: 陆立鼎 | AJ16: =RC[-12] -> 6 | AK16: =RC[-12] -> 87 | AL16: =RC[-12] -> 52 | AM16: =RC[-12] -> 143 | AN16: =RC[-12] -> 60 | AO16: =RC[-12] -> 20
A17: 15 | B17: 林震南 | C17: 打草惊蛇 | D17: 5 | F17: 78 | G17: 1 | H17: 1 | I17: 15 | K17: 陈七 | L17: 6 | M17: 87 | N17: 52 | O17: 143 | P17: 60 | Q17: 20 | W17: 白二 | X17: =RC[-12] -> 6 | Y17: =RC[-12] -> 87 | Z17: =RC[-12] -> 52 | AA17: =RC[-12] -> 143 | AB17: =RC[-12] -> 60 | AC17: =RC[-12] -> 20 | AI17: 林震南 | AJ17: =RC[-12] -> 6 | AK17: =RC[-12] -> 87 | AL17: =RC[-12] -> 52 | AM17: =RC[-12] -> 143 | AN17: =RC[-12] -> 60 | AO17: =RC[-12] -> 20
A18: 16 | B18: 大圣宝树王 | C18: 打草惊蛇 | D18: 6 | F18: 52 | G18: 1 | H18: 1 | I18: 16 | K18: 智慧宝树王 | L18: 6 | M18: 87 | N18: 52 | O18: 143 | P18: 60 | Q18: 20 | W18: 常胜宝树王 | X18: =RC[-12] -> 6 | Y18: =RC[-12] -> 87 | Z18: =RC[-12] -> 52 | AA18: =RC[-12] -> 143 | AB18: =RC[-12] -> 60 | AC18: =RC[-12] -> 20 | AI18: 大圣宝树王 | AJ18: =RC[-12] -> 6 | AK18: =RC[-12] -> 87 | AL18: =RC[-12] -> 52 | AM18: =RC[-12] -> 143 | AN18: =RC[-12] -> 60 | AO18: =RC[-12] -> 20
A19: 17 | B19: 陈歪嘴 | C19: 打草惊蛇 | D19: 7 | F19: 37 | G19: 1 | H19: 1 | I19: 17 | K19: 郭啸天 | L19: 6 | M19: 87 | N19: 52 | O19: 143 | P19: 60 | Q19: 20 | W19: 王十三 | X19: =RC[-12] -> 6 | Y19: =RC[-12] -> 87 | Z19: =RC[-12] -> 52 | AA19: =RC[-12] -> 143 | AB19: =RC[-12] -> 60 | AC19: =RC[-12] -> 20 | AI19: 过三拳 | AJ19: =RC[-12] -> 6 | AK19: =RC[-12] -> 87 | AL19: =RC[-12] -> 52 | AM19: =RC[-12] -> 143 | AN19: =RC[-12] -> 60 | AO19: =RC[-12] -> 20 | AU19: 陈歪嘴 | AV19: =RC[-12] -> 6 | AW19: =RC[-12] -> 87 | AX19: =RC[-12] -> 52 | AY19: =RC[-12] -> 143 | AZ19: =RC[-12] -> 60 | BA19: =RC[-12] -> 20
A20: 18 | B20: 过三拳 | C20: 打草惊蛇 | D20: 8 | F20: 49 | G20: 1 | H20: 1 | I20: 18 | K20: 梅石坚 | L20: 7 | M20: 174 | N20: 104 | O20: 286 | P20: 120 | Q20: 40 | W20: 王十三 | X20: =RC[-12] -> 7 | Y20: =RC[-12] -> 174 | Z20: =RC[-12] -> 104 | AA20: =RC[-12] -> 286 | AB20: =RC[-12] -> 120 | AC20: =RC[-12] -> 40 | AI20: 史镖头 | AJ20: =RC[-12] -> 7 | AK20: =RC[-12] -> 174 | AL20: =RC[-12] -> 104 | AM20: =RC[-12] -> 286 | AN20: =RC[-12] -> 120 | AO20: =RC[-12] -> 40 | AU20: 过三拳 | AV20: =RC[-12] -> 7 | AW20: =RC[-12] -> 174 | AX20: =RC[-12] -> 104 | AY20: =RC[-12] -> 286 | AZ20: =RC[-12] -> 120 | BA20: =RC[-12] -> 40
A21: 19 | B21: 青城四兽 | C21: 打草惊蛇 | D21: 9 | F21: 6 | G21: 1 | H21: 1 | I21: 19 | K21: 于人豪 | L21: 7 | M21: 174 | N21: 104 | O21: 286 | P21: 120 | Q21: 40 | W21: 洪人雄 | X21: =RC[-12] -> 7 | Y21: =RC[-12] -> 174 | Z21: =RC[-12] -> 104 | AA21: =RC[-12] -> 286 | AB21: =RC[-12] -> 120 | AC21: =RC[-12] -> 40 | AI21: 候人英 | AJ21: =RC[-12] -> 7 | AK21: =RC[-12] -> 174 | AL21: =RC[-12] -> 104 | AM21: =RC[-12] -> 286 | AN21: =RC[-12] -> 120 | AO21: =RC[-12] -> 40 | AU21: 罗人杰 | AV21: =RC[-12] -> 7 | AW21: =RC[-12] -> 174 | AX21: =RC[-12] -> 104 | AY21: =RC[-12] -> 286 | AZ21: =RC[-12] -> 120 | BA21: =RC[-12] -> 40
A22: 20 | B22: 阿紫 | C22: 打草惊蛇 | D22: 10 | F22: 127 | G22: 1 | H22: 1 | I22: 20 | K22: 狮吼子 | L22: 7 | M22: 174 | N22: 104 | O22: 286 | P22: 120 | Q22: 40 | W22: 出尘子 | X22: =RC[-12] -> 7 | Y22: =RC[-12] -> 174 | Z22: =RC[-12] -> 104 | AA22: =RC[-12] -> 286 | AB22: =RC[-12] -> 120 | AC22: =RC[-12] -> 40 | AI22: 天狼子 | AJ22: =RC[-12] -> 7 | AK22: =RC[-12] -> 174 | AL22: =RC[-12] -> 104 | AM22: =RC[-12] -> 286 | AN22: =RC[-12] -> 120 | AO22: =RC[-12] -> 40 | AU22: 阿紫 | AV22: =RC[-12] -> 7 | AW22: =RC[-12] -> 174 | AX22: =RC[-12] -> 104 | AY22: =RC[-12] -> 286 | AZ22: =RC[-12] -> 120 | BA22: =RC[-12] -> 40
A23: 21 | B23: 武三娘 | C23: 飞来横祸 | D23: 1 | F23: 101 | G23: 1 | H23: 1 | I23: 21 | K23: 陆无双 | L23: 7 | M23: 174 | N23: 104 | O23: 286 | P23: 120 | Q23: 40 | W23: 陆二娘 | X23: =RC[-12] -> 7 | Y23: =RC[-12] -> 174 | Z23: =RC[-12] -> 104 | AA23: =RC[-12] -> 286 | AB23: =RC[-12] -> 120 | AC23: =RC[-12] -> 40 | AI23: 郭芙 | AJ23: =RC[-12] -> 7 | AK23: =RC[-12] -> 174 | AL23: =RC[-12] -> 104 | AM23: =RC[-12] -> 286 | AN23: =RC[-12] -> 120 | AO23: =RC[-12] -> 40 | AU23: 武三娘 | AV23: =RC[-12] -> 7 | AW23: =RC[-12] -> 174 | AX23: =RC[-12] -> 104 | AY23: =RC[-12] -> 286 | AZ23: =RC[-12] -> 120 | BA23: =RC[-12] -> 40
A24: 22 | B24: 穆念慈 | C24: 飞来横祸 | D24: 2 | F24: 103 | G24: 1 | H24: 1 | I24: 22 | K24: 郭芙 | L24: 8 | M24: 261 | N24: 156 | O24: 429 | P24: 180 | Q24: 60 | W24: 杨铁心 | X24: =RC[-12] -> 8 | Y24: =RC[-12] -> 261 | Z24: =RC[-12] -> 156 | AA24: =RC[-12] -> 429 | AB24: =RC[-12] -> 180 | AC24: =RC[-12] -> 60 | AI24: 姬清虚 | AJ24: =RC[-12] -> 8 | AK24: =RC[-12] -> 261 | AL24: =RC[-12] -> 156 | AM24: =RC[-12] -> 429 | AN24: =RC[-12] -> 180 | AO24: =RC[-12] -> 60 | AU24: 穆念慈 | AV24: =RC[-12] -> 8 | AW24: =RC[-12] -> 261 | AX24: =RC[-12] -> 156 | AY24: =RC[-12] -> 429 | AZ24: =RC[-12] -> 180 | BA24: =RC[-12] -> 60
A25: 23 | B25: 陈七 | C25: 飞来横祸 | D25: 3 | F25: 7 | G25: 1 | H25: 1 | I25: 23 | K25: 史镖头 | L25: 8 | M25: 261 | N25: 156 | O25: 429 | P25: 180 | Q25: 60 | W25: 富镖头 | X25: =RC[-12] -> 8 | Y25: =RC[-12] -> 261 | Z25: =RC[-12] -> 156 | AA25: =RC[-12] -> 429 | AB25: =RC[-12] -> 180 | AC25: =RC[-12] -> 60 | AI25: 白二 | AJ25: =RC[-12] -> 8 | AK25: =RC[-12] -> 261 | AL25: =RC[-12] -> 156 | AM25: =RC[-12] -> 429 | AN25: =RC[-12] -> 180 | AO25: =RC[-12] -> 60 | AU25: 陈七 | AV25: =RC[-12] -> 8 | AW25: =RC[-12] -> 261 | AX25: =RC[-12] -> 156 | AY25: =RC[-12] -> 429 | AZ25: =RC[-12] -> 180 | BA25: =RC[-12] -> 60
A26: 24 | B26: 姬清虚 | C26: 飞来横祸 | D26: 4 | F26: 94 | G26: 1 | H26: 1 | I26: 24 | K26: 祈志诚 | L26: 8 | M26: 261 | N26: 156 | O26: 429 | P26: 180 | Q26: 60 | W26: 申志凡 | X26: =RC[-12] -> 8 | Y26: =RC[-12] -> 261 | Z26: =RC[-12] -> 156 | AA26: =RC[-12] -> 429 | AB26: =RC[-12] -> 180 | AC26: =RC[-12] -> 60 | AI26: 宋德方 | AJ26: =RC[-12] -> 8 | AK26: =RC[-12] -> 261 | AL26: =RC[-12] -> 156 | AM26: =RC[-12] -> 429 | AN26: =RC[-12] -> 180 | AO26: =RC[-12] -> 60 | AU26: 姬清虚 | AV26: =RC[-12] -> 8 | AW26: =RC[-12] -> 261 | AX26: =RC[-12] -> 156 | AY26: =RC[-12] -> 429 | AZ26: =RC[-12] -> 180 | BA26: =RC[-12] -> 60
A27: 25 | B27: 缘根 | C27: 飞来横祸 | D27: 5 | F27: 23 | G27: 1 | H27: 1 | I27: 25 | K27: 王十三 | L27: 8 | M27: 261 | N27: 156 | O27: 429 | P27: 180 | Q27: 60 | W27: 陈歪嘴 | X27: =RC[-12] -> 8 | Y27: =RC[-12] -> 261 | Z27: =RC[-12] -> 156 | AA27: =RC[-12] -> 429 | AB27: =RC[-12] -> 180 | AC27: =RC[-12] -> 60 | AI27: 过三拳 | AJ27: =RC[-12] -> 8 | AK27: =RC[-12] -> 261 | AL27: =RC[-12] -> 156 | AM27: =RC[-12] -> 429 | AN27: =RC[-12] -> 180 | AO27: =RC[-12] -> 60 | AU27: 缘根 | AV27: =RC[-12] -> 8 | AW27: =RC[-12] -> 261 | AX27: =RC[-12] -> 156 | AY27: =RC[-12] -> 429 | AZ27: =RC[-12] -> 180 | BA27: =RC[-12] -> 60
A28: 26 | B28: 殷无禄 | C28: 飞来横祸 | D28: 6 | F28: 70 | G28: 1 | H28: 1 | I28: 26 | K28: 常胜宝树王 | L28: 9 | M28: 348 | N28: 208 | O28: 572 | P28: 240 | Q28: 80 | W28: 殷无寿 | X28: =RC[-12] -> 9 | Y28: =RC[-12] -> 348 | Z28: =RC[-12] -> 208 | AA28: =RC[-12] -> 572 | AB28: =RC[-12] -> 240 | AC28: =RC[-12] -> 80 | AI28: 大圣宝树王 | AJ28: =RC[-12] -> 9 | AK28: =RC[-12] -> 348 | AL28: =RC[-12] -> 208 | AM28: =RC[-12] -> 572 | AN28: =RC[-12] -> 240 | AO28: =RC[-12] -> 80 | AU28: 殷无禄 | AV28: =RC[-12] -> 9 | AW28: =RC[-12] -> 348 | AX28: =RC[-12] -> 208 | AY28: =RC[-12] -> 572 | AZ28: =RC[-12] -> 240 | BA28: =RC[-12] -> 80
A29: 27 | B29: 完颜阿骨打 | C29: 飞来横祸 | D29: 7 | F29: 55 | G29: 1 | H29: 1 | I29: 27 | K29: 都史 | L29: 9 | M29: 348 | N29: 208 | O29: 572 | P29: 240 | Q29: 80 | W29: 札木合 | X29: =RC[-12] -> 9 | Y29: =RC[-12] -> 348 | Z29: =RC[-12] -> 208 | AA29: =RC[-12] -> 572 | AB29: =RC[-12] -> 240 | AC29: =RC[-12] -> 80 | AI29: 智慧宝树王 | AJ29: =RC[-12] -> 9 | AK29: =RC[-12] -> 348 | AL29: =RC[-12] -> 208 | AM29: =RC[-12] -> 572 | AN29: =RC[-12] -> 240 | AO29: =RC[-12] -> 80 | AU29: 完颜阿骨打 | AV29: =RC[-12] -> 9 | AW29: =RC[-12] -> 348 | AX29: =RC[-12] -> 208 | AY29: =RC[-12] -> 572 | AZ29: =RC[-12] -> 240 | BA29: =RC[-12] -> 80
A30: 28 | B30: 余人彦 | C30: 飞来横祸 | D30: 8 | F30: 14 | G30: 1 | H30: 1 | I30: 28 | K30: 洪人雄 | L30: 9 | M30: 348 | N30: 208 | O30: 572 | P30: 240 | Q30: 80 | W30: 候人英 | X30: =RC[-12] -> 9 | Y30: =RC[-12] -> 348 | Z30: =RC[-12] -> 208 | AA30: =RC[-12] -> 572 | AB30: =RC[-12] -> 240 | AC30: =RC[-12] -> 80 | AI30: 罗人杰 | AJ30: =RC[-12] -> 9 | AK30: =RC[-12] -> 348 | AL30: =RC[-12] -> 208 | AM30: =RC[-12] -> 572 | AN30: =RC[-12] -> 240 | AO30: =RC[-12] -> 80 | AU30: 余人彦 | AV30: =RC[-12] -> 9 | AW30: =RC[-12] -> 348 | AX30: =RC[-12] -> 208 | AY30: =RC[-12] -> 572 | AZ30: =RC[-12] -> 240 | BA30: =RC[-12] -> 80
A31: 29 | B31: 梅石坚 | C31: 飞来横祸 | D31: 9 | F31: 4 | G31: 1 | H31: 1 | I31: 29 | K31: 王十三 | L31: 9 | M31: 348 | N31: 208 | O31: 572 | P31: 240 | Q31: 80 | W31: 杨铁心 | X31: =RC[-12] -> 9 | Y31: =RC[-12] -> 348 | Z31: =RC[-12] -> 208 | AA31: =RC[-12] -> 572 | AB31: =RC[-12] -> 240 | AC31: =RC[-12] -> 80 | AI31: 过三拳 | AJ31: =RC[-12] -> 9 | AK31: =RC[-12] -> 348 | AL31: =RC[-12] -> 208 | AM31: =RC[-12] -> 572 | AN31: =RC[-12] -> 240 | AO31: =RC[-12] -> 80 | AU31: 梅石坚 | AV31: =RC[-12] -> 9 | AW31: =RC[-12] -> 348 | AX31: =RC[-12] -> 208 | AY31: =RC[-12] -> 572 | AZ31: =RC[-12] -> 240 | BA31: =RC[-12] -> 80
A32: 30 | B32: 仪清 | C32: 飞来横祸 | D32: 10 | F32: 105 | G32: 1 | H32: 1 | I32: 30 | K32: 武三娘 | L32: 9 | M32: 348 | N32: 208 | O32: 572 | P32: 240 | Q32: 80 | W32: 仪光 | X32: =RC[-12] -> 9 | Y32: =RC[-12] -> 348 | Z32: =RC[-12] -> 208 | AA32: =RC[-12] -> 572 | AB32: =RC[-12] -> 240 | AC32: =RC[-12] -> 80 | AI32: 姬清虚 | AJ32: =RC[-12] -> 9 | AK32: =RC[-12] -> 348 | AL32: =RC[-12] -> 208 | AM32: =RC[-12] -> 572 | AN32: =RC[-12] -> 240 | AO32: =RC[-12] -> 80 | AU32: 仪清 | AV32: =RC[-12] -> 9 | AW32: =RC[-12] -> 348 | AX32: =RC[-12] -> 208 | AY32: =RC[-12] -> 572 | AZ32: =RC[-12] -> 240 | BA32: =RC[-12] -> 80
A33: 31 | B33: 王十三 | C33: 醉仙斗酒 | D33: 1 | F33: 62 | G33: 1 | H33: 1 | I33: 31 | K33: 殷无禄 | L33: 10 | M33: 435 | N33: 260 | O33: 715 | P33: 300 | Q33: 100 | W33: 陆二娘 | X33: =RC[-12] -> 10 | Y33: =RC[-12] -> 435 | Z33: =RC[-12] -> 260 | AA33: =RC[-12] -> 715 | AB33: =RC[-12] -> 300 | AC33: =RC[-12] -> 100 | AI33: 吴青烈 | AJ33: =RC[-12] -> 10 | AK33: =RC[-12] -> 435 | AL33: =RC[-12] -> 260 | AM33: =RC[-12] -> 715 | AN33: =RC[-12] -> 300 | AO33: =RC[-12] -> 100 | AU33: 王十三 | AV33: =RC[-12] -> 10 | AW33: =RC[-12] -> 435 | AX33: =RC[-12] -> 260 | AY33: =RC[-12] -> 715 | AZ33: =RC[-12] -> 300 | BA33: =RC[-12] -> 100
A34: 32 | B34: 郭芙 | C34: 醉仙斗酒 | D34: 2 | F34: 106 | G34: 1 | H34: 1 | I34: 32 | K34: 出尘子 | L34: 10 | M34: 435 | N34: 260 | O34: 715 | P34: 300 | Q34: 100 | W34: 陆立鼎 | X34: =RC[-12] -> 10 | Y34: =RC[-12] -> 435 | Z34: =RC[-12] -> 260 | AA34: =RC[-12] -> 715 | AB34: =RC[-12] -> 300 | AC34: =RC[-12] -> 100 | AI34: 出尘子 | AJ34: =RC[-12] -> 10 | AK34: =RC[-12] -> 435 | AL34: =RC[-12] -> 260 | AM34: =RC[-12] -> 715 | AN34: =RC[-12] -> 300 | AO34: =RC[-12] -> 100 | AU34: 郭芙 | AV34: =RC[-12] -> 10 | AW34: =RC[-12] -> 435 | AX34: =RC[-12] -> 260 | AY34: =RC[-12] -> 715 | AZ34: =RC[-12] -> 300 | BA34: =RC[-12] -> 100
A35: 33 | B35: 缘根 | C35: 醉仙斗酒 | D35: 3 | F35: 23 | G35: 1 | H35: 1 | I35: 33 | K35: 罗人杰 | L35: 10 | M35: 435 | N35: 260 | O35: 715 | P35: 300 | Q35: 100 | W35: 富镖头 | X35: =RC[-12] -> 10 | Y35: =RC[-12] -> 435 | Z35: =RC[-12] -> 260 | AA35: =RC[-12] -> 715 | AB35: =RC[-12] -> 300 | AC35: =RC[-12] -> 100 | AI35: 过三拳 | AJ35: =RC[-12] -> 10 | AK35: =RC[-12] -> 435 | AL35: =RC[-12] -> 260 | AM35: =RC[-12] -> 715 | AN35: =RC[-12] -> 300 | AO35: =RC[-12] -> 100 | AU35: 缘根 | AV35: =RC[-12] -> 10 | AW35: =RC[-12] -> 435 | AX35: =RC[-12] -> 260 | AY35: =RC[-12] -> 715 | AZ35: =RC[-12] -> 300 | BA35: =RC[-12] -> 100
A36: 34 | B36: 申志凡 | C36: 醉仙斗酒 | D36: 4 | F36: 80 | G36: 1 | H36: 1 | I36: 34 | K36: 青松 | L36: 10 | M36: 435 | N36: 260 | O36: 715 | P36: 300 | Q36: 100 | W36: 桑昆 | X36: =RC[-12] -> 10 | Y36: =RC[-12] -> 435 | Z36: =RC[-12] -> 260 | AA36: =RC[-12] -> 715 | AB36: =RC[-12] -> 300 | AC36: =RC[-12] -> 100 | AI36: 札木合 | AJ36: =RC[-12] -> 10 | AK36: =RC[-12] -> 435 | AL36: =RC[-12] -> 260 | AM36: =RC[-12] -> 715 | AN36: =RC[-12] -> 300 | AO36: =RC[-12] -> 100 | AU36: 申志凡 | AV36: =RC[-12] -> 10 | AW36: =RC[-12] -> 435 | AX36: =RC[-12] -> 260 | AY36: =RC[-12] -> 715 | AZ36: =RC[-12] -> 300 | BA36: =RC[-12] -> 100
A37: 35 | B37: 祈志诚 | C37: 醉仙斗酒 | D37: 5 | F37: 80 | G37: 1 | H37: 1 | I37: 35 | K37: 智慧宝树王 | L37: 10 | M37: 435 | N37: 260 | O37: 715 | P37: 300 | Q37: 100 | W37: 陆二娘 | X37: =RC[-12] -> 10 | Y37: =RC[-12] -> 435 | Z37: =RC[-12] -> 260 | AA37: =RC[-12] -> 715 | AB37: =RC[-12] -> 300 | AC37: =RC[-12] -> 100 | AI37: 都史 | AJ37: =RC[-12] -> 10 | AK37: =RC[-12] -> 435 | AL37: =RC[-12] -> 260 | AM37: =RC[-12] -> 715 | AN37: =RC[-12] -> 300 | AO37: =RC[-12] -> 100 | AU37: 祈志诚 | AV37: =RC[-12] -> 10 | AW37: =RC[-12] -> 435 | AX37: =RC[-12] -> 260 | AY37: =RC[-12] -> 715 | AZ37: =RC[-12] -> 300 | BA37: =RC[-12] -> 100
A38: 36 | B38: 札木合 | C38: 醉仙斗酒 | D38: 6 | F38: 53 | G38: 1 | H38: 1 | I38: 36 | K38: 于人豪 | L38: 11 | M38: 522 | N38: 312 | O38: 858 | P38: 360 | Q38: 120 | W38: 郑镖头 | X38: =RC[-12] -> 11 | Y38: =RC[-12] -> 522 | Z38: =RC[-12] -> 312 | AA38: =RC[-12] -> 858 | AB38: =RC[-12] -> 360 | AC38: =RC[-12] -> 120 | AI38: 富镖头 | AJ38: =RC[-12] -> 11 | AK38: =RC[-12] -> 522 | AL38: =RC[-12] -> 312 | AM38: =RC[-12] -> 858 | AN38: =RC[-12] -> 360 | AO38: =RC[-12] -> 120 | AU38: 札木合 | AV38: =RC[-12] -> 11 | AW38: =RC[-12] -> 522 | AX38: =RC[-12] -> 312 | AY38: =RC[-12] -> 858 | AZ38: =RC[-12] -> 360 | BA38: =RC[-12] -> 120
A39: 37 | B39: 出尘子 | C39: 醉仙斗酒 | D39: 7 | F39: 5 | G39: 1 | H39: 1 | I39: 37 | K39: 吴青烈 | L39: 11 | M39: 522 | N39: 312 | O39: 858 | P39: 360 | Q39: 120 | W39: 沈青刚 | X39: =RC[-12] -> 11 | Y39: =RC[-12] -> 522 | Z39: =RC[-12] -> 312 | AA39: =RC[-12] -> 858 | AB39: =RC[-12] -> 360 | AC39: =RC[-12] -> 120 | AI39: 狮吼子 | AJ39: =RC[-12] -> 11 | AK39: =RC[-12] -> 522 | AL39: =RC[-12] -> 312 | AM39: =RC[-12] -> 858 | AN39: =RC[-12] -> 360 | AO39: =RC[-12] -> 120 | AU39: 出尘子 | AV39: =RC[-12] -> 11 | AW39: =RC[-12] -> 522 | AX39: =RC[-12] -> 312 | AY39: =RC[-12] -> 858 | AZ39: =RC[-12] -> 360 | BA39: =RC[-12] -> 120
A40: 38 | B40: 桑昆 | C40: 醉仙斗酒 | D40: 8 | F40: 53 | G40: 1 | H40: 1 | I40: 38 | K40: 郭啸天 | L40: 11 | M40: 522 | N40: 312 | O40: 858 | P40: 360 | Q40: 120 | W40: 杨铁心 | X40: =RC[-12] -> 11 | Y40: =RC[-12] -> 522 | Z40: =RC[-12] -> 312 | AA40: =RC[-12] -> 858 | AB40: =RC[-12] -> 360 | AC40: =RC[-12] -> 120 | AI40: 札木合 | AJ40: =RC[-12] -> 11 | AK40: =RC[-12] -> 522 | AL40: =RC[-12] -> 312 | AM40: =RC[-12] -> 858 | AN40: =RC[-12] -> 360 | AO40: =RC[-12] -> 120 | AU40: 桑昆 | AV40: =RC[-12] -> 11 | AW40: =RC[-12] -> 522 | AX40: =RC[-12] -> 312 | AY40: =RC[-12] -> 858 | AZ40: =RC[-12] -> 360 | BA40: =RC[-12] -> 120
A41: 39 | B41: 陆无双 | C41: 醉仙斗酒 | D41: 9 | F41: 108 | G41: 1 | H41: 1 | I41: 39 | K41: 仪光 | L41: 11 | M41: 522 | N41: 312 | O41: 858 | P41: 360 | Q41: 120 | W41: 申志凡 | X41: =RC[-12] -> 11 | Y41: =RC[-12] -> 522 | Z41: =RC[-12] -> 312 | AA41: =RC[-12] -> 858 | AB41: =RC[-12] -> 360 | AC41: =RC[-12] -> 120 | AI41: 陆立鼎 | AJ41: =RC[-12] -> 11 | AK41: =RC[-12] -> 522 | AL41: =RC[-12] -> 312 | AM41: =RC[-12] -> 858 | AN41: =RC[-12] -> 360 | AO41: =RC[-12] -> 120 | AU41: 陆无双 | AV41: =RC[-12] -> 11 | AW41: =RC[-12] -> 522 | AX41: =RC[-12] -> 312 | AY41: =RC[-12] -> 858 | AZ41: =RC[-12] -> 360 | BA41: =RC[-12] -> 120
A42: 40 | B42: 都史 | C42: 醉仙斗酒 | D42: 10 | F42: 53 | G42: 1 | H42: 1 | I42: 40 | K42: 常胜宝树王 | L42: 11 | M42: 522 | N42: 312 | O42: 858 | P42: 360 | Q42: 120 | W42: 姬清虚 | X42: =RC[-12] -> 11 | Y42: =RC[-12] -> 522 | Z42: =RC[-12] -> 312 | AA42: =RC[-12] -> 858 | AB42: =RC[-12] -> 360 | AC42: =RC[-12] -> 120 | AI42: 札木合 | AJ42: =RC[-12] -> 11 | AK42: =RC[-12] -> 522 | AL42: =RC[-12] -> 312 | AM42: =RC[-12] -> 858 | AN42: =RC[-12] -> 360 | AO42: =RC[-12] -> 120 | AU42: 桑昆 | AV42: =RC[-12] -> 11 | AW42: =RC[-12] -> 522 | AX42: =RC[-12] -> 312 | AY42: =RC[-12] -> 858 | AZ42: =RC[-12] -> 360 | BA42: =RC[-12] -> 120
A43: 41 | B43: 杨莲亭 | C43: 酒馆结怨 | D43: 1 | F43: 62 | G43: 1 | H43: 1 | I43: 41 | K43: 常胜宝树王 | L43: 12 | M43: 609 | N43: 364 | O43: 1001 | P43: 420 | Q43: 140 | W43: 陆无双 | X43: =RC[-12] -> 12 | Y43: =RC[-12] -> 609 | Z43: =RC[-12] -> 364 | AA43: =RC[-12] -> 1001 | AB43: =RC[-12] -> 420 | AC43: =RC[-12] -> 140 | AI43: 杨莲亭 | AJ43: =RC[-12] -> 12 | AK43: =RC[-12] -> 609 | AL43: =RC[-12] -> 364 | AM43: =RC[-12] -> 1001 | AN43: =RC[-12] -> 420 | AO43: =RC[-12] -> 140 | AU43: 于人豪 | AV43: =RC[-12] -> 12 | AW43: =RC[-12] -> 609 | AX43: =RC[-12] -> 364 | AY43: =RC[-12] -> 1001 | AZ43: =RC[-12] -> 420 | BA43: =RC[-12] -> 140
A44: 42 | B44: 仪琳 | C44: 酒馆结怨 | D44: 2 | F44: 105 | G44: 1 | H44: 1 | I44: 42 | K44: 仪琳 | L44: 12 | M44: 609 | N44: 364 | O44: 1001 | P44: 420 | Q44: 140 | W44: 智慧宝树王 | X44: =RC[-12] -> 12 | Y44: =RC[-12] -> 609 | Z44: =RC[-12] -> 364 | AA44: =RC[-12] -> 1001 | AB44: =RC[-12] -> 420 | AC44: =RC[-12] -> 140 | AI44: 郑镖头 | AJ44: =RC[-12] -> 12 | AK44: =RC[-12] -> 609 | AL44: =RC[-12] -> 364 | AM44: =RC[-12] -> 1001 | AN44: =RC[-12] -> 420 | AO44: =RC[-12] -> 140 | AU44: 史镖头 | AV44: =RC[-12] -> 12 | AW44: =RC[-12] -> 609 | AX44: =RC[-12] -> 364 | AY44: =RC[-12] -> 1001 | AZ44: =RC[-12] -> 420 | BA44: =RC[-12] -> 140
A45: 43 | B45: 觉月 | C45: 酒馆结怨 | D45: 3 | F45: 22 | G45: 1 | H45: 1 | I45: 43 | K45: 吴青烈 | L45: 12 | M45: 609 | N45: 364 | O45: 1001 | P45: 420 | Q45: 140 | W45: 申人俊 | X45: =RC[-12] -> 12 | Y45: =RC[-12] -> 609 | Z45: =RC[-12] -> 364 | AA45: =RC[-12] -> 1001 | AB45: =RC[-12] -> 420 | AC45: =RC[-12] -> 140 | AI45: 史镖头 | AJ45: =RC[-12] -> 12 | AK45: =RC[-12] -> 609 | AL45: =RC[-12] -> 364 | AM45: =RC[-12] -> 1001 | AN45: =RC[-12] -> 420 | AO45: =RC[-12] -> 140 | AU45: 于人豪 | AV45: =RC[-12] -> 12 | AW45: =RC[-12] -> 609 | AX45: =RC[-12] -> 364 | AY45: =RC[-12] -> 1001 | AZ45: =RC[-12] -> 420 | BA45: =RC[-12] -> 140
A46: 44 | B46: 申人俊 | C46: 酒馆结怨 | D46: 4 | F46: 14 | G46: 1 | H46: 1 | I46: 44 | K46: 陆无双 | L46: 12 | M46: 609 | N46: 364 | O46: 1001 | P46: 420 | Q46: 140 | W46: 杨莲亭 | X46: =RC[-12] -> 12 | Y46: =RC[-12] -> 609 | Z46: =RC[-12] -> 364 | AA46: =RC[-12] -> 1001 | AB46: =RC[-12] -> 420 | AC46: =RC[-12] -> 140 | AI46: 仪光 | AJ46: =RC[-12] -> 12 | AK46: =RC[-12] -> 609 | AL46: =RC[-12] -> 364 | AM46: =RC[-12] -> 1001 | AN46: =RC[-12] -> 420 | AO46: =RC[-12] -> 140 | AU46: 候人英 | AV46: =RC[-12] -> 12 | AW46: =RC[-12] -> 609 | AX46: =RC[-12] -> 364 | AY46: =RC[-12] -> 1001 | AZ46: =RC[-12] -> 420 | BA46: =RC[-12] -> 140
A47: 45 | B47: 林震南 | C47: 酒馆结怨 | D47: 5 | F47: 78 | G47: 1 | H47: 1 | I47: 45 | K47: 觉月 | L47: 13 | M47: 696 | N47: 416 | O47: 1144 | P47: 480 | Q47: 160 | W47: 智慧宝树王 | X47: =RC[-12] -> 13 | Y47: =RC[-12] -> 696 | Z47: =RC[-12] -> 416 | AA47: =RC[-12] -> 1144 | AB47: =RC[-12] -> 480 | AC47: =RC[-12] -> 160 | AI47: 马青雄 | AJ47: =RC[-12] -> 13 | AK47: =RC[-12] -> 696 | AL47: =RC[-12] -> 416 | AM47: =RC[-12] -> 1144 | AN47: =RC[-12] -> 480 | AO47: =RC[-12] -> 160 | AU47: 郭啸天 | AV47: =RC[-12] -> 13 | AW47: =RC[-12] -> 696 | AX47: =RC[-12] -> 416 | AY47: =RC[-12] -> 1144 | AZ47: =RC[-12] -> 480 | BA47: =RC[-12] -> 160
A48: 46 | B48: 劳德诺 | C48: 酒馆结怨 | D48: 6 | F48: 32 | G48: 1 | H48: 1 | I48: 46 | K48: 梅石坚 | L48: 13 | M48: 696 | N48: 416 | O48: 1144 | P48: 480 | Q48: 160 | W48: 马青雄 | X48: =RC[-12] -> 13 | Y48: =RC[-12] -> 696 | Z48: =RC[-12] -> 416 | AA48: =RC[-12] -> 1144 | AB48: =RC[-12] -> 480 | AC48: =RC[-12] -> 160 | AI48: 狮吼子 | AJ48: =RC[-12] -> 13 | AK48: =RC[-12] -> 696 | AL48: =RC[-12] -> 416 | AM48: =RC[-12] -> 1144 | AN48: =RC[-12] -> 480 | AO48: =RC[-12] -> 160 | AU48: 劳德诺 | AV48: =RC[-12] -> 13 | AW48: =RC[-12] -> 696 | AX48: =RC[-12] -> 416 | AY48: =RC[-12] -> 1144 | AZ48: =RC[-12] -> 480 | BA48: =RC[-12] -> 160
A49: 47 | B49: 岳灵珊 | C49: 酒馆结怨 | D49: 7 | F49: 99 | G49: 1 | H49: 1 | I49: 47 | K49: 岳灵珊 | L49: 13 | M49: 696 | N49: 416 | O49: 1144 | P49: 480 | Q49: 160 | W49: 富镖头 | X49: =RC[-12] -> 13 | Y49: =RC[-12] -> 696 | Z49: =RC[-12] -> 416 | AA49: =RC[-12] -> 1144 | AB49: =RC[-12] -> 480 | AC49: =RC[-12] -> 160 | AI49: 仪和 | AJ49: =RC[-12] -> 13 | AK49: =RC[-12] -> 696 | AL49: =RC[-12] -> 416 | AM49: =RC[-12] -> 1144 | AN49: =RC[-12] -> 480 | AO49: =RC[-12] -> 160 | AU49: 郭啸天 | AV49: =RC[-12] -> 13 | AW49: =RC[-12] -> 696 | AX49: =RC[-12] -> 416 | AY49: =RC[-12] -> 1144 | AZ49: =RC[-12] -> 480 | BA49: =RC[-12] -> 160
A50: 48 | B50: 韩小莹 | C50: 酒馆结怨 | D50: 8 | F50: 107 | G50: 1 | H50: 1 | I50: 48 | K50: 穆念慈 | L50: 14 | M50: 783 | N50: 468 | O50: 1287 | P50: 540 | Q50: 180 | W50: 韩小莹 | X50: =RC[-12] -> 14 | Y50: =RC[-12] -> 783 | Z50: =RC[-12] -> 468 | AA50: =RC[-12] -> 1287 | AB50: =RC[-12] -> 540 | AC50: =RC[-12] -> 180 | AI50: 出尘子 | AJ50: =RC[-12] -> 14 | AK50: =RC[-12] -> 783 | AL50: =RC[-12] -> 468 | AM50: =RC[-12] -> 1287 | AN50: =RC[-12] -> 540 | AO50: =RC[-12] -> 180 | AU50: 狮吼子 | AV50: =RC[-12] -> 14 | AW50: =RC[-12] -> 783 | AX50: =RC[-12] -> 468 | AY50: =RC[-12] -> 1287 | AZ50: =RC[-12] -> 540 | BA50: =RC[-12] -> 180
A51: 49 | B51: 钟灵 | C51: 酒馆结怨 | D51: 9 | F51: 107 | G51: 1 | H51: 1 | I51: 49 | K51: 郑镖头 | L51: 14 | M51: 783 | N51: 468 | O51: 1287 | P51: 540 | Q51: 180 | W51: 钟灵 | X51: =RC[-12] -> 14 | Y51: =RC[-12] -> 783 | Z51: =RC[-12] -> 468 | AA51: =RC[-12] -> 1287 | AB51: =RC[-12] -> 540 | AC51: =RC[-12] -> 180 | AI51: 常胜宝树王 | AJ51: =RC[-12] -> 14 | AK51: =RC[-12] -> 783 | AL51: =RC[-12] -> 468 | AM51: =RC[-12] -> 1287 | AN51: =RC[-12] -> 540 | AO51: =RC[-12] -> 180 | AU51: 智慧宝树王 | AV51: =RC[-12] -> 14 | AW51: =RC[-12] -> 783 | AX51: =RC[-12] -> 468 | AY51: =RC[-12] -> 1287 | AZ51: =RC[-12] -> 540 | BA51: =RC[-12] -> 180
A52: 50 | B52: 完颜洪烈 | C52: 酒馆结怨 | D52: 10 | F52: 53 | G52: 1 | H52: 1 | I52: 50 | K52: 仪琳 | L52: 14 | M52: 783 | N52: 468 | O52: 1287 | P52: 540 | Q52: 180 | W52: 申人俊 | X52: =RC[-12] -> 14 | Y52: =RC[-12] -> 783 | Z52: =RC[-12] -> 468 | AA52: =RC[-12] -> 1287 | AB52: =RC[-12] -> 540 | AC52: =RC[-12] -> 180 | AI52: 岳灵珊 | AJ52: =RC[-12] -> 14 | AK52: =RC[-12] -> 783 | AL52: =RC[-12] -> 468 | AM52: =RC[-12] -> 1287 | AN52: =RC[-12] -> 540 | AO52: =RC[-12] -> 180 | AU52: 韩小莹 | AV52: =RC[-12] -> 14 | AW52: =RC[-12] -> 783 | AX52: =RC[-12] -> 468 | AY52: =RC[-12] -> 1287 | AZ52: =RC[-12] -> 540 | BA52: =RC[-12] -> 180
A53: 51 | B53: 李清露 | C53: 武馆命案 | D53: 1 | F53: 93 | G53: 1 | H53: 1 | I53: 51 | K53: 杨莲亭 | L53: 15 | M53: 870 | N53: 520 | O53: 1430 | P53: 600 | Q53: 200 | W53: 李清露 | X53: =RC[-12] -> 15 | Y53: =RC[-12] -> 870 | Z53: =RC[-12] -> 520 | AA53: =RC[-12] -> 1430 | AB53: =RC[-12] -> 600 | AC53: =RC[-12] -> 200 | AI53: 常胜宝树王 | AJ53: =RC[-12] -> 15 | AK53: =RC[-12] -> 870 | AL53: =RC[-12] -> 520 | AM53: =RC[-12] -> 1430 | AN53: =RC[-12] -> 600 | AO53: =RC[-12] -> 200 | AU53: 于人豪 | AV53: =RC[-12] -> 15 | AW53: =RC[-12] -> 870 | AX53: =RC[-12] -> 520 | AY53: =RC[-12] -> 1430 | AZ53: =RC[-12] -> 600 | BA53: =RC[-12] -> 200
A54: 52 | B54: 鲍千灵 | C54: 武馆命案 | D54: 2 | F54: 99 | G54: 1 | H54: 1 | I54: 52 | K54: 鲍千灵 | L54: 15 | M54: 870 | N54: 520 | O54: 1430 | P54: 600 | Q54: 200 | W54: 梅石坚 | X54: =RC[-12] -> 15 | Y54: =RC[-12] -> 870 | Z54: =RC[-12] -> 520 | AA54: =RC[-12] -> 1430 | AB54: =RC[-12] -> 600 | AC54: =RC[-12] -> 200 | AI54: 韩小莹 | AJ54: =RC[-12] -> 15 | AK54: =RC[-12] -> 870 | AL54: =RC[-12] -> 520 | AM54: =RC[-12] -> 1430 | AN54: =RC[-12] -> 600 | AO54: =RC[-12] -> 200 | AU54: 穆念慈 | AV54: =RC[-12] -> 15 | AW54: =RC[-12] -> 870 | AX54: =RC[-12] -> 520 | AY54: =RC[-12] -> 1430 | AZ54: =RC[-12] -> 600 | BA54: =RC[-12] -> 200
A55: 53 | B55: 阿朱 | C55: 武馆命案 | D55: 3 | F55: 102 | G55: 1 | H55: 1 | I55: 53 | K55: 陆无双 | L55: 16 | M55: 957 | N55: 572 | O55: 1573 | P55: 660 | Q55: 220 | W55: 觉月 | X55: =RC[-12] -> 16 | Y55: =RC[-12] -> 957 | Z55: =RC[-12] -> 572 | AA55: =RC[-12] -> 1573 | AB55: =RC[-12] -> 660 | AC55: =RC[-12] -> 220 | AI55: 阿朱 | AJ55: =RC[-12] -> 16 | AK55: =RC[-12] -> 957 | AL55: =RC[-12] -> 572 | AM55: =RC[-12] -> 1573 | AN55: =RC[-12] -> 660 | AO55: =RC[-12] -> 220 | AU55: 于人豪 | AV55: =RC[-12] -> 16 | AW55: =RC[-12] -> 957 | AX55: =RC[-12] -> 572 | AY55: =RC[-12] -> 1573 | AZ55: =RC[-12] -> 660 | BA55: =RC[-12] -> 220
A56: 54 | B56: 摘星子 | C56: 武馆命案 | D56: 4 | F56: 5 | G56: 1 | H56: 1 | I56: 54 | K56: 狮吼子 | L56: 16 | M56: 957 | N56: 572 | O56: 1573 | P56: 660 | Q56: 220 | W56: 岳灵珊 | X56: =RC[-12] -> 16 | Y56: =RC[-12] -> 957 | Z56: =RC[-12] -> 572 | AA56: =RC[-12] -> 1573 | AB56: =RC[-12] -> 660 | AC56: =RC[-12] -> 220 | AI56: 天狼子 | AJ56: =RC[-12] -> 16 | AK56: =RC[-12] -> 957 | AL56: =RC[-12] -> 572 | AM56: =RC[-12] -> 1573 | AN56: =RC[-12] -> 660 | AO56: =RC[-12] -> 220 | AU56: 摘星子 | AV56: =RC[-12] -> 16 | AW56: =RC[-12] -> 957 | AX56: =RC[-12] -> 572 | AY56: =RC[-12] -> 1573 | AZ56: =RC[-12] -> 660 | BA56: =RC[-12] -> 220
A57: 55 | B57: 止渊 | C57: 武馆命案 | D57: 5 | F57: 20 | G57: 1 | H57: 1 | I57: 55 | K57: 陆无双 | L57: 17 | M57: 1044 | N57: 624 | O57: 1716 | P57: 720 | Q57: 240 | W57: 仪琳 | X57: =RC[-12] -> 17 | Y57: =RC[-12] -> 1044 | Z57: =RC[-12] -> 624 | AA57: =RC[-12] -> 1716 | AB57: =RC[-12] -> 720 | AC57: =RC[-12] -> 240 | AI57: 史镖头 | AJ57: =RC[-12] -> 17 | AK57: =RC[-12] -> 1044 | AL57: =RC[-12] -> 624 | AM57: =RC[-12] -> 1716 | AN57: =RC[-12] -> 720 | AO57: =RC[-12] -> 240 | AU57: 止渊 | AV57: =RC[-12] -> 17 | AW57: =RC[-12] -> 1044 | AX57: =RC[-12] -> 624 | AY57: =RC[-12] -> 1716 | AZ57: =RC[-12] -> 720 | BA57: =RC[-12] -> 240
A58: 56 | B58: 程瑶迦 | C58: 武馆命案 | D58: 6 | F58: 94 | G58: 1 | H58: 1 | I58: 56 | K58: 程瑶迦 | L58: 17 | M58: 1044 | N58: 624 | O58: 1716 | P58: 720 | Q58: 240 | W58: 申人俊 | X58: =RC[-12] -> 17 | Y58: =RC[-12] -> 1044 | Z58: =RC[-12] -> 624 | AA58: =RC[-12] -> 1716 | AB58: =RC[-12] -> 720 | AC58: =RC[-12] -> 240 | AI58: 杨铁心 | AJ58: =RC[-12] -> 17 | AK58: =RC[-12] -> 1044 | AL58: =RC[-12] -> 624 | AM58: =RC[-12] -> 1716 | AN58: =RC[-12] -> 720 | AO58: =RC[-12] -> 240 | AU58: 于人豪 | AV58: =RC[-12] -> 17 | AW58: =RC[-12] -> 1044 | AX58: =RC[-12] -> 624 | AY58: =RC[-12] -> 1716 | AZ58: =RC[-12] -> 720 | BA58: =RC[-12] -> 240
A59: 57 | B59: 平婆婆 | C59: 武馆命案 | D59: 7 | F59: 115 | G59: 1 | H59: 1 | I59: 57 | K59: 平婆婆 | L59: 18 | M59: 1131 | N59: 676 | O59: 1859 | P59: 780 | Q59: 260 | W59: 陆无双 | X59: =RC[-12] -> 18 | Y59: =RC[-12] -> 1131 | Z59: =RC[-12] -> 676 | AA59: =RC[-12] -> 1859 | AB59: =RC[-12] -> 780 | AC59: =RC[-12] -> 260 | AI59: 劳德诺 | AJ59: =RC[-12] -> 18 | AK59: =RC[-12] -> 1131 | AL59: =RC[-12] -> 676 | AM59: =RC[-12] -> 1859 | AN59: =RC[-12] -> 780 | AO59: =RC[-12] -> 260 | AU59: 智慧宝树王 | AV59: =RC[-12] -> 18 | AW59: =RC[-12] -> 1131 | AX59: =RC[-12] -> 676 | AY59: =RC[-12] -> 1859 | AZ59: =RC[-12] -> 780 | BA59: =RC[-12] -> 260
A60: 58 | B60: 瑞婆婆 | C60: 武馆命案 | D60: 8 | F60: 115 | G60: 1 | H60: 1 | I60: 58 | K60: 瑞婆婆 | L60: 18 | M60: 1131 | N60: 676 | O60: 1859 | P60: 780 | Q60: 260 | W60: 韩小莹 | X60: =RC[-12] -> 18 | Y60: =RC[-12] -> 1131 | Z60: =RC[-12] -> 676 | AA60: =RC[-12] -> 1859 | AB60: =RC[-12] -> 780 | AC60: =RC[-12] -> 260 | AI60: 候人英 | AJ60: =RC[-12] -> 18 | AK60: =RC[-12] -> 1131 | AL60: =RC[-12] -> 676 | AM60: =RC[-12] -> 1859 | AN60: =RC[-12] -> 780 | AO60: =RC[-12] -> 260 | AU60: 余人彦 | AV60: =RC[-12] -> 18 | AW60: =RC[-12] -> 1131 | AX60: =RC[-12] -> 676 | AY60: =RC[-12] -> 1859 | AZ60: =RC[-12] -> 780 | BA60: =RC[-12] -> 260
A61: 59 | B61: 张阿生 | C61: 武馆命案 | D61: 9 | F61: 145 | G61: 1 | H61: 1 | I61: 59 | K61: 大圣宝树王 | L61: 19 | M61: 1218 | N61: 728 | O61: 2002 | P61: 840 | Q61: 280 | W61: 智慧宝树王 | X61: =RC[-12] -> 19 | Y61: =RC[-12] -> 1218 | Z61: =RC[-12] -> 728 | AA61: =RC[-12] -> 2002 | AB61: =RC[-12] -> 840 | AC61: =RC[-12] -> 280 | AI61: 钟灵 | AJ61: =RC[-12] -> 19 | AK61: =RC[-12] -> 1218 | AL61: =RC[-12] -> 728 | AM61: =RC[-12] -> 2002 | AN61: =RC[-12] -> 840 | AO61: =RC[-12] -> 280 | AU61: 张阿生 | AV61: =RC[-12] -> 19 | AW61: =RC[-12] -> 1218 | AX61: =RC[-12] -> 728 | AY61: =RC[-12] -> 2002 | AZ61: =RC[-12] -> 840 | BA61: =RC[-12] -> 280
A62: 60 | B62: 林震南 | C62: 武馆命案 | D62: 10 | F62: 78 | G62: 1 | H62: 1 | I62: 60 | K62: 程瑶迦 | L62: 19 | M62: 1218 | N62: 728 | O62: 2002 | P62: 840 | Q62: 280 | W62: 阿朱 | X62: =RC[-12] -> 19 | Y62: =RC[-12] -> 1218 | Z62: =RC[-12] -> 728 | AA62: =RC[-12] -> 2002 | AB62: =RC[-12] -> 840 | AC62: =RC[-12] -> 280 | AI62: 平婆婆 | AJ62: =RC[-12] -> 19 | AK62: =RC[-12] -> 1218 | AL62: =RC[-12] -> 728 | AM62: =RC[-12] -> 2002 | AN62: =RC[-12] -> 840 | AO62: =RC[-12] -> 280 | AU62: 瑞婆婆 | AV62: =RC[-12] -> 19 | AW62: =RC[-12] -> 1218 | AX62: =RC[-12] -> 728 | AY62: =RC[-12] -> 2002 | AZ62: =RC[-12] -> 840 | BA62: =RC[-12] -> 280 | BG62: 林震南 | BH62: =RC[-12] -> 19 | BI62: =RC[-12] -> 1218 | BJ62: =RC[-12] -> 728 | BK62: =RC[-12] -> 2002 | BL62: =RC[-12] -> 840 | BM62: =RC[-12] -> 280
A63: 61 | B63: 南希仁 | C63: 太湖水寨 | D63: 1 | F63: 14 | G63: 1 | H63: 1 | I63: 61 | K63: 郑镖头 | L63: 20 | M63: 1305 | N63: 780 | O63: 2145 | P63: 900 | Q63: 300 | W63: 陆无双 | X63: =RC[-12] -> 20 | Y63: =RC[-12] -> 1305 | Z63: =RC[-12] -> 780 | AA63: =RC[-12] -> 2145 | AB63: =RC[-12] -> 900 | AC63: =RC[-12] -> 300 | AI63: 觉月 | AJ63: =RC[-12] -> 20 | AK63: =RC[-12] -> 1305 | AL63: =RC[-12] -> 780 | AM63: =RC[-12] -> 2145 | AN63: =RC[-12] -> 900 | AO63: =RC[-12] -> 300 | AU63: 鲍千灵 | AV63: =RC[-12] -> 20 | AW63: =RC[-12] -> 1305 | AX63: =RC[-12] -> 780 | AY63: =RC[-12] -> 2145 | AZ63: =RC[-12] -> 900 | BA63: =RC[-12] -> 300 | BG63: 南希仁 | BH63: =RC[-12] -> 20 | BI63: =RC[-12] -> 1305 | BJ63: =RC[-12] -> 780 | BK63: =RC[-12] -> 2145 | BL63: =RC[-12] -> 900 | BM63: =RC[-12] -> 300
A64: 62 | B64: 韩宝驹 | C64: 太湖水寨 | D64: 2 | F64: 4 | G64: 1 | H64: 1 | I64: 62 | K64: 仪和 | L64: 20 | M64: 1305 | N64: 780 | O64: 2145 | P64: 900 | Q64: 300 | W64: 梅石坚 | X64: =RC[-12] -> 20 | Y64: =RC[-12] -> 1305 | Z64: =RC[-12] -> 780 | AA64: =RC[-12] -> 2145 | AB64: =RC[-12] -> 900 | AC64: =RC[-12] -> 300 | AI64: 止渊 | AJ64: =RC[-12] -> 20 | AK64: =RC[-12] -> 1305 | AL64: =RC[-12] -> 780 | AM64: =RC[-12] -> 2145 | AN64: =RC[-12] -> 900 | AO64: =RC[-12] -> 300 | AU64: 鲍千灵 | AV64: =RC[-12] -> 20 | AW64: =RC[-12] -> 1305 | AX64: =RC[-12] -> 780 | AY64: =RC[-12] -> 2145 | AZ64: =RC[-12] -> 900 | BA64: =RC[-12] -> 300 | BG64: 韩宝驹 | BH64: =RC[-12] -> 20 | BI64: =RC[-12] -> 1305 | BJ64: =RC[-12] -> 780 | BK64: =RC[-12] -> 2145 | BL64: =RC[-12] -> 900 | BM64: =RC[-12] -> 300
A65: 63 | B65: 阿紫 | C65: 太湖水寨 | D65: 3 | F65: 127 | G65: 1 | H65: 1 | I65: 63 | K65: 阿紫 | L65: 21 | M65: 1392 | N65: 832 | O65: 2288 | P65: 960 | Q65: 320 | W65: 摘星子 | X65: =RC[-12] -> 21 | Y65: =RC[-12] -> 1392 | Z65: =RC[-12] -> 832 | AA65: =RC[-12] -> 2288 | AB65: =RC[-12] -> 960 | AC65: =RC[-12] -> 320 | AI65: 韩小莹 | AJ65: =RC[-12] -> 21 | AK65: =RC[-12] -> 1392 | AL65: =RC[-12] -> 832 | AM65: =RC[-12] -> 2288 | AN65: =RC[-12] -> 960 | AO65: =RC[-12] -> 320 | AU65: 狮吼子 | AV65: =RC[-12] -> 21 | AW65: =RC[-12] -> 1392 | AX65: =RC[-12] -> 832 | AY65: =RC[-12] -> 2288 | AZ65: =RC[-12] -> 960 | BA65: =RC[-12] -> 320 | BG65: 出尘子 | BH65: =RC[-12] -> 21 | BI65: =RC[-12] -> 1392 | BJ65: =RC[-12] -> 832 | BK65: =RC[-12] -> 2288 | BL65: =RC[-12] -> 960 | BM65: =RC[-12] -> 320
A66: 64 | B66: 过彦之 | C66: 太湖水寨 | D66: 4 | F66: 58 | G66: 1 | H66: 1 | I66: 64 | K66: 史镖头 | L66: 21 | M66: 1392 | N66: 832 | O66: 2288 | P66: 960 | Q66: 320 | W66: 完颜阿骨打 | X66: =RC[-12] -> 21 | Y66: =RC[-12] -> 1392 | Z66: =RC[-12] -> 832 | AA66: =RC[-12] -> 2288 | AB66: =RC[-12] -> 960 | AC66: =RC[-12] -> 320 | AI66: 过彦之 | AJ66: =RC[-12] -> 21 | AK66: =RC[-12] -> 1392 | AL66: =RC[-12] -> 832 | AM66: =RC[-12] -> 2288 | AN66: =RC[-12] -> 960 | AO66: =RC[-12] -> 320 | AU66: 岳灵珊 | AV66: =RC[-12] -> 21 | AW66: =RC[-12] -> 1392 | AX66: =RC[-12] -> 832 | AY66: =RC[-12] -> 2288 | AZ66: =RC[-12] -> 960 | BA66: =RC[-12] -> 320 | BG66: 劳德诺 | BH66: =RC[-12] -> 21 | BI66: =RC[-12] -> 1392 | BJ66: =RC[-12] -> 832 | BK66: =RC[-12] -> 2288 | BL66: =RC[-12] -> 960 | BM66: =RC[-12] -> 320
A67: 65 | B67: 静虚师太 | C67: 太湖水寨 | D67: 5 | F67: 105 | G67: 1 | H67: 1 | I67: 65 | K67: 梅石坚 | L67: 22 | M67: 1479 | N67: 884 | O67: 2431 | P67: 1020 | Q67: 340 | W67: 仪光 | X67: =RC[-12] -> 22 | Y67: =RC[-12] -> 1479 | Z67: =RC[-12] -> 884 | AA67: =RC[-12] -> 2431 | AB67: =RC[-12] -> 1020 | AC67: =RC[-12] -> 340 | AI67: 平婆婆 | AJ67: =RC[-12] -> 22 | AK67: =RC[-12] -> 1479 | AL67: =RC[-12] -> 884 | AM67: =RC[-12] -> 2431 | AN67: =RC[-12] -> 1020 | AO67: =RC[-12] -> 340 | AU67: 程瑶迦 | AV67: =RC[-12] -> 22 | AW67: =RC[-12] -> 1479 | AX67: =RC[-12] -> 884 | AY67: =RC[-12] -> 2431 | AZ67: =RC[-12] -> 1020 | BA67: =RC[-12] -> 340 | BG67: 静虚师太 | BH67: =RC[-12] -> 22 | BI67: =RC[-12] -> 1479 | BJ67: =RC[-12] -> 884 | BK67: =RC[-12] -> 2431 | BL67: =RC[-12] -> 1020 | BM67: =RC[-12] -> 340
A68: 66 | B68: 静慧师太 | C68: 太湖水寨 | D68: 6 | F68: 105 | G68: 1 | H68: 1 | I68: 66 | K68: 常胜宝树王 | L68: 22 | M68: 1479 | N68: 884 | O68: 2431 | P68: 1020 | Q68: 340 | W68: 仪光 | X68: =RC[-12] -> 22 | Y68: =RC[-12] -> 1479 | Z68: =RC[-12] -> 884 | AA68: =RC[-12] -> 2431 | AB68: =RC[-12] -> 1020 | AC68: =RC[-12] -> 340 | AI68: 程瑶迦 | AJ68: =RC[-12] -> 22 | AK68: =RC[-12] -> 1479 | AL68: =RC[-12] -> 884 | AM68: =RC[-12] -> 2431 | AN68: =RC[-12] -> 1020 | AO68: =RC[-12] -> 340 | AU68: 静虚师太 | AV68: =RC[-12] -> 22 | AW68: =RC[-12] -> 1479 | AX68: =RC[-12] -> 884 | AY68: =RC[-12] -> 2431 | AZ68: =RC[-12] -> 1020 | BA68: =RC[-12] -> 340 | BG68: 静慧师太 | BH68: =RC[-12] -> 22 | BI68: =RC[-12] -> 1479 | BJ68: =RC[-12] -> 884 | BK68: =RC[-12] -> 2431 | BL68: =RC[-12] -> 1020 | BM68: =RC[-12] -> 340
A69: 67 | B69: 清虚道长 | C69: 太湖水寨 | D69: 7 | F69: 79 | G69: 1 | H69: 1 | I69: 67 | K69: 觉月 | L69: 23 | M69: 1566 | N69: 936 | O69: 2574 | P69: 1080 | Q69: 360 | W69: 仪琳 | X69: =RC[-12] -> 23 | Y69: =RC[-12] -> 1566 | Z69: =RC[-12] -> 936 | AA69: =RC[-12] -> 2574 | AB69: =RC[-12] -> 1080 | AC69: =RC[-12] -> 360 | AI69: 韩宝驹 | AJ69: =RC[-12] -> 23 | AK69: =RC[-12] -> 1566 | AL69: =RC[-12] -> 936 | AM69: =RC[-12] -> 2574 | AN69: =RC[-12] -> 1080 | AO69: =RC[-12] -> 360 | AU69: 鲍千灵 | AV69: =RC[-12] -> 23 | AW69: =RC[-12] -> 1566 | AX69: =RC[-12] -> 936 | AY69: =RC[-12] -> 2574 | AZ69: =RC[-12] -> 1080 | BA69: =RC[-12] -> 360 | BG69: 清虚道长 | BH69: =RC[-12] -> 23 | BI69: =RC[-12] -> 1566 | BJ69: =RC[-12] -> 936 | BK69: =RC[-12] -> 2574 | BL69: =RC[-12] -> 1080 | BM69: =RC[-12] -> 360
A70: 68 | B70: 李志常 | C70: 太湖水寨 | D70: 8 | F70: 82 | G70: 1 | H70: 1 | I70: 68 | K70: 李志常 | L70: 23 | M70: 1566 | N70: 936 | O70: 2574 | P70: 1080 | Q70: 360 | W70: 岳灵珊 | X70: =RC[-12] -> 23 | Y70: =RC[-12] -> 1566 | Z70: =RC[-12] -> 936 | AA70: =RC[-12] -> 2574 | AB70: =RC[-12] -> 1080 | AC70: =RC[-12] -> 360 | AI70: 申人俊 | AJ70: =RC[-12] -> 23 | AK70: =RC[-12] -> 1566 | AL70: =RC[-12] -> 936 | AM70: =RC[-12] -> 2574 | AN70: =RC[-12] -> 1080 | AO70: =RC[-12] -> 360 | AU70: 完颜阿骨打 | AV70: =RC[-12] -> 23 | AW70: =RC[-12] -> 1566 | AX70: =RC[-12] -> 936 | AY70: =RC[-12] -> 2574 | AZ70: =RC[-12] -> 1080 | BA70: =RC[-12] -> 360 | BG70: 于人豪 | BH70: =RC[-12] -> 23 | BI70: =RC[-12] -> 1566 | BJ70: =RC[-12] -> 936 | BK70: =RC[-12] -> 2574 | BL70: =RC[-12] -> 1080 | BM70: =RC[-12] -> 360
A71: 69 | B71: 赵志敬 | C71: 太湖水寨 | D71: 9 | F71: 84 | G71: 1 | H71: 1 | I71: 69 | K71: 程瑶迦 | L71: 24 | M71: 1653 | N71: 988 | O71: 2717 | P71: 1140 | Q71: 380 | W71: 常胜宝树王 | X71: =RC[-12] -> 24 | Y71: =RC[-12] -> 1653 | Z71: =RC[-12] -> 988 | AA71: =RC[-12] -> 2717 | AB71: =RC[-12] -> 1140 | AC71: =RC[-12] -> 380 | AI71: 李志常 | AJ71: =RC[-12] -> 24 | AK71: =RC[-12] -> 1653 | AL71: =RC[-12] -> 988 | AM71: =RC[-12] -> 2717 | AN71: =RC[-12] -> 1140 | AO71: =RC[-12] -> 380 | AU71: 仪光 | AV71: =RC[-12] -> 24 | AW71: =RC[-12] -> 1653 | AX71: =RC[-12] -> 988 | AY71: =RC[-12] -> 2717 | AZ71: =RC[-12] -> 1140 | BA71: =RC[-12] -> 380 | BG71: 赵志敬 | BH71: =RC[-12] -> 24 | BI71: =RC[-12] -> 1653 | BJ71: =RC[-12] -> 988 | BK71: =RC[-12] -> 2717 | BL71: =RC[-12] -> 1140 | BM71: =RC[-12] -> 380
A72: 70 | B72: 木婉清 | C72: 太湖水寨 | D72: 10 | F72: 88 | G72: 1 | H72: 1 | I72: 70 | K72: 申人俊 | L72: 24 | M72: 1653 | N72: 988 | O72: 2717 | P72: 1140 | Q72: 380 | W72: 岳灵珊 | X72: =RC[-12] -> 24 | Y72: =RC[-12] -> 1653 | Z72: =RC[-12] -> 988 | AA72: =RC[-12] -> 2717 | AB72: =RC[-12] -> 1140 | AC72: =RC[-12] -> 380 | AI72: 静慧师太 | AJ72: =RC[-12] -> 24 | AK72: =RC[-12] -> 1653 | AL72: =RC[-12] -> 988 | AM72: =RC[-12] -> 2717 | AN72: =RC[-12] -> 1140 | AO72: =RC[-12] -> 380 | AU72: 静虚师太 | AV72: =RC[-12] -> 24 | AW72: =RC[-12] -> 1653 | AX72: =RC[-12] -> 988 | AY72: =RC[-12] -> 2717 | AZ72: =RC[-12] -> 1140 | BA72: =RC[-12] -> 380 | BG72: 木婉清 | BH72: =RC[-12] -> 24 | BI72: =RC[-12] -> 1653 | BJ72: =RC[-12] -> 988 | BK72: =RC[-12] -> 2717 | BL72: =RC[-12] -> 1140 | BM72: =RC[-12] -> 380
A73: 71 | B73: 霍都 | C73: 归云山庄 | D73: 1 | F73: 18 | G73: 1 | H73: 1 | I73: 71 | K73: 史镖头 | L73: 25 | M73: 1740 | N73: 1040 | O73: 2860 | P73: 1200 | Q73: 400 | W73: 申人俊 | X73: =RC[-12] -> 25 | Y73: =RC[-12] -> 1740 | Z73: =RC[-12] -> 1040 | AA73: =RC[-12] -> 2860 | AB73: =RC[-12] -> 1200 | AC73: =RC[-12] -> 400 | AI73: 劳德诺 | AJ73: =RC[-12] -> 25 | AK73: =RC[-12] -> 1740 | AL73: =RC[-12] -> 1040 | AM73: =RC[-12] -> 2860 | AN73: =RC[-12] -> 1200 | AO73: =RC[-12] -> 400 | AU73: 过彦之 | AV73: =RC[-12] -> 25 | AW73: =RC[-12] -> 1740 | AX73: =RC[-12] -> 1040 | AY73: =RC[-12] -> 2860 | AZ73: =RC[-12] -> 1200 | BA73: =RC[-12] -> 400 | BG73: 霍都 | BH73: =RC[-12] -> 25 | BI73: =RC[-12] -> 1740 | BJ73: =RC[-12] -> 1040 | BK73: =RC[-12] -> 2860 | BL73: =RC[-12] -> 1200 | BM73: =RC[-12] -> 400
A74: 72 | B74: 辛然 | C74: 归云山庄 | D74: 2 | F74: 6 | G74: 1 | H74: 1 | I74: 72 | K74: 大圣宝树王 | L74: 25 | M74: 1740 | N74: 1040 | O74: 2860 | P74: 1200 | Q74: 400 | W74: 觉月 | X74: =RC[-12] -> 25 | Y74: =RC[-12] -> 1740 | Z74: =RC[-12] -> 1040 | AA74: =RC[-12] -> 2860 | AB74: =RC[-12] -> 1200 | AC74: =RC[-12] -> 400 | AI74: 辛然 | AJ74: =RC[-12] -> 25 | AK74: =RC[-12] -> 1740 | AL74: =RC[-12] -> 1040 | AM74: =RC[-12] -> 2860 | AN74: =RC[-12] -> 1200 | AO74: =RC[-12] -> 400 | AU74: 李清露 | AV74: =RC[-12] -> 25 | AW74: =RC[-12] -> 1740 | AX74: =RC[-12] -> 1040 | AY74: =RC[-12] -> 2860 | AZ74: =RC[-12] -> 1200 | BA74: =RC[-12] -> 400 | BG74: 韩小莹 | BH74: =RC[-12] -> 25 | BI74: =RC[-12] -> 1740 | BJ74: =RC[-12] -> 1040 | BK74: =RC[-12] -> 2860 | BL74: =RC[-12] -> 1200 | BM74: =RC[-12] -> 400
A75: 73 | B75: 甘宝宝 | C75: 归云山庄 | D75: 3 | F75: 103 | G75: 1 | H75: 1 | I75: 73 | K75: 仪和 | L75: 26 | M75: 1827 | N75: 1092 | O75: 3003 | P75: 1260 | Q75: 420 | W75: 仪琳 | X75: =RC[-12] -> 26 | Y75: =RC[-12] -> 1827 | Z75: =RC[-12] -> 1092 | AA75: =RC[-12] -> 3003 | AB75: =RC[-12] -> 1260 | AC75: =RC[-12] -> 420 | AI75: 阿朱 | AJ75: =RC[-12] -> 26 | AK75: =RC[-12] -> 1827 | AL75: =RC[-12] -> 1092 | AM75: =RC[-12] -> 3003 | AN75: =RC[-12] -> 1260 | AO75: =RC[-12] -> 420 | AU75: 甘宝宝 | AV75: =RC[-12] -> 26 | AW75: =RC[-12] -> 1827 | AX75: =RC[-12] -> 1092 | AY75: =RC[-12] -> 3003 | AZ75: =RC[-12] -> 1260 | BA75: =RC[-12] -> 420 | BG75: 岳灵珊 | BH75: =RC[-12] -> 26 | BI75: =RC[-12] -> 1827 | BJ75: =RC[-12] -> 1092 | BK75: =RC[-12] -> 3003 | BL75: =RC[-12] -> 1260 | BM75: =RC[-12] -> 420
A76: 74 | B76: 桃根仙 | C76: 归云山庄 | D76: 4 | F76: 33 | G76: 1 | H76: 1 | I76: 74 | K76: 鲍千灵 | L76: 26 | M76: 1827 | N76: 1092 | O76: 3003 | P76: 1260 | Q76: 420 | W76: 桃根仙 | X76: =RC[-12] -> 26 | Y76: =RC[-12] -> 1827 | Z76: =RC[-12] -> 1092 | AA76: =RC[-12] -> 3003 | AB76: =RC[-12] -> 1260 | AC76: =RC[-12] -> 420 | AI76: 张阿生 | AJ76: =RC[-12] -> 26 | AK76: =RC[-12] -> 1827 | AL76: =RC[-12] -> 1092 | AM76: =RC[-12] -> 3003 | AN76: =RC[-12] -> 1260 | AO76: =RC[-12] -> 420 | AU76: 南希仁 | AV76: =RC[-12] -> 26 | AW76: =RC[-12] -> 1827 | AX76: =RC[-12] -> 1092 | AY76: =RC[-12] -> 3003 | AZ76: =RC[-12] -> 1260 | BA76: =RC[-12] -> 420 | BG76: 天狼子 | BH76: =RC[-12] -> 26 | BI76: =RC[-12] -> 1827 | BJ76: =RC[-12] -> 1092 | BK76: =RC[-12] -> 3003 | BL76: =RC[-12] -> 1260 | BM76: =RC[-12] -> 420
A77: 75 | B77: 褚万里 | C77: 归云山庄 | D77: 5 | F77: 73 | G77: 1 | H77: 1 | I77: 75 | K77: 褚万里 | L77: 27 | M77: 1914 | N77: 1144 | O77: 3146 | P77: 1320 | Q77: 440 | W77: 阿朱 | X77: =RC[-12] -> 27 | Y77: =RC[-12] -> 1914 | Z77: =RC[-12] -> 1144 | AA77: =RC[-12] -> 3146 | AB77: =RC[-12] -> 1320 | AC77: =RC[-12] -> 440 | AI77: 张阿生 | AJ77: =RC[-12] -> 27 | AK77: =RC[-12] -> 1914 | AL77: =RC[-12] -> 1144 | AM77: =RC[-12] -> 3146 | AN77: =RC[-12] -> 1320 | AO77: =RC[-12] -> 440 | AU77: 桃根仙 | AV77: =RC[-12] -> 27 | AW77: =RC[-12] -> 1914 | AX77: =RC[-12] -> 1144 | AY77: =RC[-12] -> 3146 | AZ77: =RC[-12] -> 1320 | BA77: =RC[-12] -> 440 | BG77: 于人豪 | BH77: =RC[-12] -> 27 | BI77: =RC[-12] -> 1914 | BJ77: =RC[-12] -> 1144 | BK77: =RC[-12] -> 3146 | BL77: =RC[-12] -> 1320 | BM77: =RC[-12] -> 440
A78: 76 | B78: 朱丹臣 | C78: 归云山庄 | D78: 6 | F78: 73 | G78: 1 | H78: 1 | I78: 76 | K78: 穆念慈 | L78: 27 | M78: 1914 | N78: 1144 | O78: 3146 | P78: 1320 | Q78: 440 | W78: 朱丹臣 | X78: =RC[-12] -> 27 | Y78: =RC[-12] -> 1914 | Z78: =RC[-12] -> 1144 | AA78: =RC[-12] -> 3146 | AB78: =RC[-12] -> 1320 | AC78: =RC[-12] -> 440 | AI78: 觉月 | AJ78: =RC[-12] -> 27 | AK78: =RC[-12] -> 1914 | AL78: =RC[-12] -> 1144 | AM78: =RC[-12] -> 3146 | AN78: =RC[-12] -> 1320 | AO78: =RC[-12] -> 440 | AU78: 过彦之 | AV78: =RC[-12] -> 27 | AW78: =RC[-12] -> 1914 | AX78: =RC[-12] -> 1144 | AY78: =RC[-12] -> 3146 | AZ78: =RC[-12] -> 1320 | BA78: =RC[-12] -> 440 | BG78: 劳德诺 | BH78: =RC[-12] -> 27 | BI78: =RC[-12] -> 1914 | BJ78: =RC[-12] -> 1144 | BK78: =RC[-12] -> 3146 | BL78: =RC[-12] -> 1320 | BM78: =RC[-12] -> 440
A79: 77 | B79: 古笃诚 | C79: 归云山庄 | D79: 7 | F79: 73 | G79: 1 | H79: 1 | I79: 77 | K79: 常胜宝树王 | L79: 28 | M79: 2001 | N79: 1196 | O79: 3289 | P79: 1380 | Q79: 460 | W79: 朱丹臣 | X79: =RC[-12] -> 28 | Y79: =RC[-12] -> 2001 | Z79: =RC[-12] -> 1196 | AA79: =RC[-12] -> 3289 | AB79: =RC[-12] -> 1380 | AC79: =RC[-12] -> 460 | AI79: 觉月 | AJ79: =RC[-12] -> 28 | AK79: =RC[-12] -> 2001 | AL79: =RC[-12] -> 1196 | AM79: =RC[-12] -> 3289 | AN79: =RC[-12] -> 1380 | AO79: =RC[-12] -> 460 | AU79: 古笃诚 | AV79: =RC[-12] -> 28 | AW79: =RC[-12] -> 2001 | AX79: =RC[-12] -> 1196 | AY79: =RC[-12] -> 3289 | AZ79: =RC[-12] -> 1380 | BA79: =RC[-12] -> 460 | BG79: 申人俊 | BH79: =RC[-12] -> 28 | BI79: =RC[-12] -> 2001 | BJ79: =RC[-12] -> 1196 | BK79: =RC[-12] -> 3289 | BL79: =RC[-12] -> 1380 | BM79: =RC[-12] -> 460
A80: 78 | B80: 傅思归 | C80: 归云山庄 | D80: 8 | F80: 73 | G80: 1 | H80: 1 | I80: 78 | K80: 傅思归 | L80: 28 | M80: 2001 | N80: 1196 | O80: 3289 | P80: 1380 | Q80: 460 | W80: 申人俊 | X80: =RC[-12] -> 28 | Y80: =RC[-12] -> 2001 | Z80: =RC[-12] -> 1196 | AA80: =RC[-12] -> 3289 | AB80: =RC[-12] -> 1380 | AC80: =RC[-12] -> 460 | AI80: 岳灵珊 | AJ80: =RC[-12] -> 28 | AK80: =RC[-12] -> 2001 | AL80: =RC[-12] -> 1196 | AM80: =RC[-12] -> 3289 | AN80: =RC[-12] -> 1380 | AO80: =RC[-12] -> 460 | AU80: 仪光 | AV80: =RC[-12] -> 28 | AW80: =RC[-12] -> 2001 | AX80: =RC[-12] -> 1196 | AY80: =RC[-12] -> 3289 | AZ80: =RC[-12] -> 1380 | BA80: =RC[-12] -> 460 | BG80: 程瑶迦 | BH80: =RC[-12] -> 28 | BI80: =RC[-12] -> 2001 | BJ80: =RC[-12] -> 1196 | BK80: =RC[-12] -> 3289 | BL80: =RC[-12] -> 1380 | BM80: =RC[-12] -> 460
A81: 79 | B81: 朱聪 | C81: 归云山庄 | D81: 9 | F81: 18 | G81: 1 | H81: 1 | I81: 79 | K81: 常胜宝树王 | L81: 29 | M81: 2088 | N81: 1248 | O81: 3432 | P81: 1440 | Q81: 480 | W81: 韩小莹 | X81: =RC[-12] -> 29 | Y81: =RC[-12] -> 2088 | Z81: =RC[-12] -> 1248 | AA81: =RC[-12] -> 3432 | AB81: =RC[-12] -> 1440 | AC81: =RC[-12] -> 480 | AI81: 钟灵 | AJ81: =RC[-12] -> 29 | AK81: =RC[-12] -> 2088 | AL81: =RC[-12] -> 1248 | AM81: =RC[-12] -> 3432 | AN81: =RC[-12] -> 1440 | AO81: =RC[-12] -> 480 | AU81: 李清露 | AV81: =RC[-12] -> 29 | AW81: =RC[-12] -> 2088 | AX81: =RC[-12] -> 1248 | AY81: =RC[-12] -> 3432 | AZ81: =RC[-12] -> 1440 | BA81: =RC[-12] -> 480 | BG81: 朱聪 | BH81: =RC[-12] -> 29 | BI81: =RC[-12] -> 2088 | BJ81: =RC[-12] -> 1248 | BK81: =RC[-12] -> 3432 | BL81: =RC[-12] -> 1440 | BM81: =RC[-12] -> 480
A82: 80 | B82: 柯镇恶 | C82: 归云山庄 | D82: 10 | F82: 66 | G82: 1 | H82: 1 | I82: 80 | K82: 褚万里 | L82: 29 | M82: 2175 | N82: 1300 | O82: 3575 | P82: 1500 | Q82: 500 | W82: 朱丹臣 | X82: =RC[-12] -> 29 | Y82: =RC[-12] -> 2175 | Z82: =RC[-12] -> 1300 | AA82: =RC[-12] -> 3575 | AB82: =RC[-12] -> 1500 | AC82: =RC[-12] -> 500 | AI82: 古笃诚 | AJ82: =RC[-12] -> 29 | AK82: =RC[-12] -> 2175 | AL82: =RC[-12] -> 1300 | AM82: =RC[-12] -> 3575 | AN82: =RC[-12] -> 1500 | AO82: =RC[-12] -> 500 | AU82: 傅思归 | AV82: =RC[-12] -> 29 | AW82: =RC[-12] -> 2175 | AX82: =RC[-12] -> 1300 | AY82: =RC[-12] -> 3575 | AZ82: =RC[-12] -> 1500 | BA82: =RC[-12] -> 500 | BG82: 柯镇恶 | BH82: =RC[-12] -> 29 | BI82: =RC[-12] -> 2175 | BJ82: =RC[-12] -> 1300 | BK82: =RC[-12] -> 3575 | BL82: =RC[-12] -> 1500 | BM82: =RC[-12] -> 500
A83: 81 | B83: 忽都虎 | C83: 宝刀玄光 | D83: 1 | F83: 53 | G83: 1 | H83: 1 | I83: 81 | K83: 平婆婆 | L83: 30 | M83: 2262 | N83: 1352 | O83: 3718 | P83: 1560 | Q83: 520 | W83: 瑞婆婆 | X83: =RC[-12] -> 30 | Y83: =RC[-12] -> 2262 | Z83: =RC[-12] -> 1352 | AA83: =RC[-12] -> 3718 | AB83: =RC[-12] -> 1560 | AC83: =RC[-12] -> 520 | AI83: 朱丹臣 | AJ83: =RC[-12] -> 30 | AK83: =RC[-12] -> 2262 | AL83: =RC[-12] -> 1352 | AM83: =RC[-12] -> 3718 | AN83: =RC[-12] -> 1560 | AO83: =RC[-12] -> 520 | AU83: 过彦之 | AV83: =RC[-12] -> 30 | AW83: =RC[-12] -> 2262 | AX83: =RC[-12] -> 1352 | AY83: =RC[-12] -> 3718 | AZ83: =RC[-12] -> 1560 | BA83: =RC[-12] -> 520 | BG83: 忽都虎 | BH83: =RC[-12] -> 30 | BI83: =RC[-12] -> 2262 | BJ83: =RC[-12] -> 1352 | BK83: =RC[-12] -> 3718 | BL83: =RC[-12] -> 1560 | BM83: =RC[-12] -> 520
A84: 82 | B84: 侯通海 | C84: 宝刀玄光 | D84: 2 | F84: 2 | G84: 1 | H84: 1 | I84: 82 | K84: 霍都 | L84: 30 | M84: 2262 | N84: 1352 | O84: 3718 | P84: 1560 | Q84: 520 | W84: 侯通海 | X84: =RC[-12] -> 30 | Y84: =RC[-12] -> 2262 | Z84: =RC[-12] -> 1352 | AA84: =RC[-12] -> 3718 | AB84: =RC[-12] -> 1560 | AC84: =RC[-12] -> 520 | AI84: 申人俊 | AJ84: =RC[-12] -> 30 | AK84: =RC[-12] -> 2262 | AL84: =RC[-12] -> 1352 | AM84: =RC[-12] -> 3718 | AN84: =RC[-12] -> 1560 | AO84: =RC[-12] -> 520 | AU84: 劳德诺 | AV84: =RC[-12] -> 30 | AW84: =RC[-12] -> 2262 | AX84: =RC[-12] -> 1352 | AY84: =RC[-12] -> 3718 | AZ84: =RC[-12] -> 1560 | BA84: =RC[-12] -> 520 | BG84: 杨莲亭 | BH84: =RC[-12] -> 30 | BI84: =RC[-12] -> 2262 | BJ84: =RC[-12] -> 1352 | BK84: =RC[-12] -> 3718 | BL84: =RC[-12] -> 1560 | BM84: =RC[-12] -> 520
A85: 83 | B85: 慧风 | C85: 宝刀玄光 | D85: 3 | F85: 23 | G85: 1 | H85: 1 | I85: 83 | K85: 韩宝驹 | L85: 31 | M85: 2349 | N85: 1404 | O85: 3861 | P85: 1620 | Q85: 540 | W85: 清虚道长 | X85: =RC[-12] -> 31 | Y85: =RC[-12] -> 2349 | Z85: =RC[-12] -> 1404 | AA85: =RC[-12] -> 3861 | AB85: =RC[-12] -> 1620 | AC85: =RC[-12] -> 540 | AI85: 褚万里 | AJ85: =RC[-12] -> 31 | AK85: =RC[-12] -> 2349 | AL85: =RC[-12] -> 1404 | AM85: =RC[-12] -> 3861 | AN85: =RC[-12] -> 1620 | AO85: =RC[-12] -> 540 | AU85: 桃根仙 | AV85: =RC[-12] -> 31 | AW85: =RC[-12] -> 2349 | AX85: =RC[-12] -> 1404 | AY85: =RC[-12] -> 3861 | AZ85: =RC[-12] -> 1620 | BA85: =RC[-12] -> 540 | BG85: 慧风 | BH85: =RC[-12] -> 31 | BI85: =RC[-12] -> 2349 | BJ85: =RC[-12] -> 1404 | BK85: =RC[-12] -> 3861 | BL85: =RC[-12] -> 1620 | BM85: =RC[-12] -> 540
A86: 84 | B86: 慧方 | C86: 宝刀玄光 | D86: 4 | F86: 23 | G86: 1 | H86: 1 | I86: 84 | K86: 南希仁 | L86: 31 | M86: 2349 | N86: 1404 | O86: 3861 | P86: 1620 | Q86: 540 | W86: 韩宝驹 | X86: =RC[-12] -> 31 | Y86: =RC[-12] -> 2349 | Z86: =RC[-12] -> 1404 | AA86: =RC[-12] -> 3861 | AB86: =RC[-12] -> 1620 | AC86: =RC[-12] -> 540 | AI86: 清虚道长 | AJ86: =RC[-12] -> 31 | AK86: =RC[-12] -> 2349 | AL86: =RC[-12] -> 1404 | AM86: =RC[-12] -> 3861 | AN86: =RC[-12] -> 1620 | AO86: =RC[-12] -> 540 | AU86: 朱丹臣 | AV86: =RC[-12] -> 31 | AW86: =RC[-12] -> 2349 | AX86: =RC[-12] -> 1404 | AY86: =RC[-12] -> 3861 | AZ86: =RC[-12] -> 1620 | BA86: =RC[-12] -> 540 | BG86: 慧方 | BH86: =RC[-12] -> 31 | BI86: =RC[-12] -> 2349 | BJ86: =RC[-12] -> 1404 | BK86: =RC[-12] -> 3861 | BL86: =RC[-12] -> 1620 | BM86: =RC[-12] -> 540
A87: 85 | B87: 全金发 | C87: 宝刀玄光 | D87: 5 | F87: 6 | G87: 1 | H87: 1 | I87: 85 | K87: 韩宝驹 | L87: 32 | M87: 2436 | N87: 1456 | O87: 4004 | P87: 1680 | Q87: 560 | W87: 阿朱 | X87: =RC[-12] -> 32 | Y87: =RC[-12] -> 2436 | Z87: =RC[-12] -> 1456 | AA87: =RC[-12] -> 4004 | AB87: =RC[-12] -> 1680 | AC87: =RC[-12] -> 560 | AI87: 钟灵 | AJ87: =RC[-12] -> 32 | AK87: =RC[-12] -> 2436 | AL87: =RC[-12] -> 1456 | AM87: =RC[-12] -> 4004 | AN87: =RC[-12] -> 1680 | AO87: =RC[-12] -> 560 | AU87: 鲍千灵 | AV87: =RC[-12] -> 32 | AW87: =RC[-12] -> 2436 | AX87: =RC[-12] -> 1456 | AY87: =RC[-12] -> 4004 | AZ87: =RC[-12] -> 1680 | BA87: =RC[-12] -> 560 | BG87: 全金发 | BH87: =RC[-12] -> 32 | BI87: =RC[-12] -> 2436 | BJ87: =RC[-12] -> 1456 | BK87: =RC[-12] -> 4004 | BL87: =RC[-12] -> 1680 | BM87: =RC[-12] -> 560
A88: 86 | B88: 哲别 | C88: 宝刀玄光 | D88: 6 | F88: 53 | G88: 1 | H88: 1 | I88: 86 | K88: 傅思归 | L88: 32 | M88: 2436 | N88: 1456 | O88: 4004 | P88: 1680 | Q88: 560 | W88: 哲别 | X88: =RC[-12] -> 32 | Y88: =RC[-12] -> 2436 | Z88: =RC[-12] -> 1456 | AA88: =RC[-12] -> 4004 | AB88: =RC[-12] -> 1680 | AC88: =RC[-12] -> 560 | AI88: 李清露 | AJ88: =RC[-12] -> 32 | AK88: =RC[-12] -> 2436 | AL88: =RC[-12] -> 1456 | AM88: =RC[-12] -> 4004 | AN88: =RC[-12] -> 1680 | AO88: =RC[-12] -> 560 | AU88: 韩小莹 | AV88: =RC[-12] -> 32 | AW88: =RC[-12] -> 2436 | AX88: =RC[-12] -> 1456 | AY88: =RC[-12] -> 4004 | AZ88: =RC[-12] -> 1680 | BA88: =RC[-12] -> 560 | BG88: 申人俊 | BH88: =RC[-12] -> 32 | BI88: =RC[-12] -> 2436 | BJ88: =RC[-12] -> 1456 | BK88: =RC[-12] -> 4004 | BL88: =RC[-12] -> 1680 | BM88: =RC[-12] -> 560
A89: 87 | B89: 史火龙 | C89: 宝刀玄光 | D89: 7 | F89: 62 | G89: 1 | H89: 1 | I89: 87 | K89: 止渊 | L89: 33 | M89: 2523 | N89: 1508 | O89: 4147 | P89: 1740 | Q89: 580 | W89: 阿朱 | X89: =RC[-12] -> 33 | Y89: =RC[-12] -> 2523 | Z89: =RC[-12] -> 1508 | AA89: =RC[-12] -> 4147 | AB89: =RC[-12] -> 1740 | AC89: =RC[-12] -> 580 | AI89: 鲍千灵 | AJ89: =RC[-12] -> 33 | AK89: =RC[-12] -> 2523 | AL89: =RC[-12] -> 1508 | AM89: =RC[-12] -> 4147 | AN89: =RC[-12] -> 1740 | AO89: =RC[-12] -> 580 | AU89: 朱丹臣 | AV89: =RC[-12] -> 33 | AW89: =RC[-12] -> 2523 | AX89: =RC[-12] -> 1508 | AY89: =RC[-12] -> 4147 | AZ89: =RC[-12] -> 1740 | BA89: =RC[-12] -> 580 | BG89: 史火龙 | BH89: =RC[-12] -> 33 | BI89: =RC[-12] -> 2523 | BJ89: =RC[-12] -> 1508 | BK89: =RC[-12] -> 4147 | BL89: =RC[-12] -> 1740 | BM89: =RC[-12] -> 580
A90: 88 | B90: 计无施 | C90: 宝刀玄光 | D90: 8 | F90: 18 | G90: 1 | H90: 1 | I90: 88 | K90: 计无施 | L90: 33 | M90: 2523 | N90: 1508 | O90: 4147 | P90: 1740 | Q90: 580 | W90: 韩小莹 | X90: =RC[-12] -> 33 | Y90: =RC[-12] -> 2523 | Z90: =RC[-12] -> 1508 | AA90: =RC[-12] -> 4147 | AB90: =RC[-12] -> 1740 | AC90: =RC[-12] -> 580 | AI90: 钟灵 | AJ90: =RC[-12] -> 33 | AK90: =RC[-12] -> 2523 | AL90: =RC[-12] -> 1508 | AM90: =RC[-12] -> 4147 | AN90: =RC[-12] -> 1740 | AO90: =RC[-12] -> 580 | AU90: 李清露 | AV90: =RC[-12] -> 33 | AW90: =RC[-12] -> 2523 | AX90: =RC[-12] -> 1508 | AY90: =RC[-12] -> 4147 | AZ90: =RC[-12] -> 1740 | BA90: =RC[-12] -> 580 | BG90: 全金发 | BH90: =RC[-12] -> 33 | BI90: =RC[-12] -> 2523 | BJ90: =RC[-12] -> 1508 | BK90: =RC[-12] -> 4147 | BL90: =RC[-12] -> 1740 | BM90: =RC[-12] -> 580
A91: 89 | B91: 哑婆婆 | C91: 宝刀玄光 | D91: 9 | F91: 115 | G91: 1 | H91: 1 | I91: 89 | K91: 哑婆婆 | L91: 34 | M91: 2610 | N91: 1560 | O91: 4290 | P91: 1800 | Q91: 600 | W91: 韩宝驹 | X91: =RC[-12] -> 34 | Y91: =RC[-12] -> 2610 | Z91: =RC[-12] -> 1560 | AA91: =RC[-12] -> 4290 | AB91: =RC[-12] -> 1800 | AC91: =RC[-12] -> 600 | AI91: 阿朱 | AJ91: =RC[-12] -> 34 | AK91: =RC[-12] -> 2610 | AL91: =RC[-12] -> 1560 | AM91: =RC[-12] -> 4290 | AN91: =RC[-12] -> 1800 | AO91: =RC[-12] -> 600 | AU91: 鲍千灵 | AV91: =RC[-12] -> 34 | AW91: =RC[-12] -> 2610 | AX91: =RC[-12] -> 1560 | AY91: =RC[-12] -> 4290 | AZ91: =RC[-12] -> 1800 | BA91: =RC[-12] -> 600 | BG91: 清虚道长 | BH91: =RC[-12] -> 34 | BI91: =RC[-12] -> 2610 | BJ91: =RC[-12] -> 1560 | BK91: =RC[-12] -> 4290 | BL91: =RC[-12] -> 1800 | BM91: =RC[-12] -> 600
A92: 90 | B92: 秦红棉 | C92: 宝刀玄光 | D92: 10 | F92: 89 | G92: 1 | H92: 1 | I92: 90 | K92: 过彦之 | L92: 34 | M92: 2610 | N92: 1560 | O92: 4290 | P92: 1800 | Q92: 600 | W92: 秦红棉 | X92: =RC[-12] -> 34 | Y92: =RC[-12] -> 2610 | Z92: =RC[-12] -> 1560 | AA92: =RC[-12] -> 4290 | AB92: =RC[-12] -> 1800 | AC92: =RC[-12] -> 600 | AI92: 傅思归 | AJ92: =RC[-12] -> 34 | AK92: =RC[-12] -> 2610 | AL92: =RC[-12] -> 1560 | AM92: =RC[-12] -> 4290 | AN92: =RC[-12] -> 1800 | AO92: =RC[-12] -> 600 | AU92: 计无施 | AV92: =RC[-12] -> 34 | AW92: =RC[-12] -> 2610 | AX92: =RC[-12] -> 1560 | AY92: =RC[-12] -> 4290 | AZ92: =RC[-12] -> 1800 | BA92: =RC[-12] -> 600 | BG92: 霍都 | BH92: =RC[-12] -> 34 | BI92: =RC[-12] -> 2610 | BJ92: =RC[-12] -> 1560 | BK92: =RC[-12] -> 4290 | BL92: =RC[-12] -> 1800 | BM92: =RC[-12] -> 600
A93: 91 | B93: 小昭 | C93: 千里护镖 | D93: 1 | F93: 88 | G93: 1 | H93: 1 | I93: 91 | K93: 傅思归 | L93: 35 | M93: 2697 | N93: 1612 | O93: 4433 | P93: 1860 | Q93: 620 | W93: 小昭 | X93: =RC[-12] -> 35 | Y93: =RC[-12] -> 2697 | Z93: =RC[-12] -> 1612 | AA93: =RC[-12] -> 4433 | AB93: =RC[-12] -> 1860 | AC93: =RC[-12] -> 620 | AI93: 辛然 | AJ93: =RC[-12] -> 35 | AK93: =RC[-12] -> 2697 | AL93: =RC[-12] -> 1612 | AM93: =RC[-12] -> 4433 | AN93: =RC[-12] -> 1860 | AO93: =RC[-12] -> 620 | AU93: 赵志敬 | AV93: =RC[-12] -> 35 | AW93: =RC[-12] -> 2697 | AX93: =RC[-12] -> 1612 | AY93: =RC[-12] -> 4433 | AZ93: =RC[-12] -> 1860 | BA93: =RC[-12] -> 620 | BG93: 平婆婆 | BH93: =RC[-12] -> 35 | BI93: =RC[-12] -> 2697 | BJ93: =RC[-12] -> 1612 | BK93: =RC[-12] -> 4433 | BL93: =RC[-12] -> 1860 | BM93: =RC[-12] -> 620
A94: 92 | B94: 全冠清 | C94: 千里护镖 | D94: 2 | F94: 64 | G94: 1 | H94: 1 | I94: 92 | K94: 桃根仙 | L94: 35 | M94: 2697 | N94: 1612 | O94: 4433 | P94: 1860 | Q94: 620 | W94: 全冠清 | X94: =RC[-12] -> 35 | Y94: =RC[-12] -> 2697 | Z94: =RC[-12] -> 1612 | AA94: =RC[-12] -> 4433 | AB94: =RC[-12] -> 1860 | AC94: =RC[-12] -> 620 | AI94: 朱丹臣 | AJ94: =RC[-12] -> 35 | AK94: =RC[-12] -> 2697 | AL94: =RC[-12] -> 1612 | AM94: =RC[-12] -> 4433 | AN94: =RC[-12] -> 1860 | AO94: =RC[-12] -> 620 | AU94: 慧方 | AV94: =RC[-12] -> 35 | AW94: =RC[-12] -> 2697 | AX94: =RC[-12] -> 1612 | AY94: =RC[-12] -> 4433 | AZ94: =RC[-12] -> 1860 | BA94: =RC[-12] -> 620 | BG94: 觉月 | BH94: =RC[-12] -> 35 | BI94: =RC[-12] -> 2697 | BJ94: =RC[-12] -> 1612 | BK94: =RC[-12] -> 4433 | BL94: =RC[-12] -> 1860 | BM94: =RC[-12] -> 620
A95: 93 | B95: 圆音 | C95: 千里护镖 | D95: 3 | F95: 22 | G95: 1 | H95: 1 | I95: 93 | K95: 鲍千灵 | L95: 36 | M95: 2784 | N95: 1664 | O95: 4576 | P95: 1920 | Q95: 640 | W95: 圆音 | X95: =RC[-12] -> 36 | Y95: =RC[-12] -> 2784 | Z95: =RC[-12] -> 1664 | AA95: =RC[-12] -> 4576 | AB95: =RC[-12] -> 1920 | AC95: =RC[-12] -> 640 | AI95: 慧方 | AJ95: =RC[-12] -> 36 | AK95: =RC[-12] -> 2784 | AL95: =RC[-12] -> 1664 | AM95: =RC[-12] -> 4576 | AN95: =RC[-12] -> 1920 | AO95: =RC[-12] -> 640 | AU95: 觉月 | AV95: =RC[-12] -> 36 | AW95: =RC[-12] -> 2784 | AX95: =RC[-12] -> 1664 | AY95: =RC[-12] -> 4576 | AZ95: =RC[-12] -> 1920 | BA95: =RC[-12] -> 640 | BG95: 朱聪 | BH95: =RC[-12] -> 36 | BI95: =RC[-12] -> 2784 | BJ95: =RC[-12] -> 1664 | BK95: =RC[-12] -> 4576 | BL95: =RC[-12] -> 1920 | BM95: =RC[-12] -> 640
A96: 94 | B96: 刀白凤 | C96: 千里护镖 | D96: 4 | F96: 96 | G96: 1 | H96: 1 | I96: 94 | K96: 阿紫 | L96: 36 | M96: 2784 | N96: 1664 | O96: 4576 | P96: 1920 | Q96: 640 | W96: 朱聪 | X96: =RC[-12] -> 36 | Y96: =RC[-12] -> 2784 | Z96: =RC[-12] -> 1664 | AA96: =RC[-12] -> 4576 | AB96: =RC[-12] -> 1920 | AC96: =RC[-12] -> 640 | AI96: 刀白凤 | AJ96: =RC[-12] -> 36 | AK96: =RC[-12] -> 2784 | AL96: =RC[-12] -> 1664 | AM96: =RC[-12] -> 4576 | AN96: =RC[-12] -> 1920 | AO96: =RC[-12] -> 640 | AU96: 韩小莹 | AV96: =RC[-12] -> 36 | AW96: =RC[-12] -> 2784 | AX96: =RC[-12] -> 1664 | AY96: =RC[-12] -> 4576 | AZ96: =RC[-12] -> 1920 | BA96: =RC[-12] -> 640 | BG96: 钟灵 | BH96: =RC[-12] -> 36 | BI96: =RC[-12] -> 2784 | BJ96: =RC[-12] -> 1664 | BK96: =RC[-12] -> 4576 | BL96: =RC[-12] -> 1920 | BM96: =RC[-12] -> 640
A97: 95 | B97: 五叶大师 | C97: 千里护镖 | D97: 5 | F97: 21 | G97: 1 | H97: 1 | I97: 95 | K97: 慧方 | L97: 37 | M97: 2871 | N97: 1716 | O97: 4719 | P97: 1980 | Q97: 660 | W97: 觉月 | X97: =RC[-12] -> 37 | Y97: =RC[-12] -> 2871 | Z97: =RC[-12] -> 1716 | AA97: =RC[-12] -> 4719 | AB97: =RC[-12] -> 1980 | AC97: =RC[-12] -> 660 | AI97: 朱丹臣 | AJ97: =RC[-12] -> 37 | AK97: =RC[-12] -> 2871 | AL97: =RC[-12] -> 1716 | AM97: =RC[-12] -> 4719 | AN97: =RC[-12] -> 1980 | AO97: =RC[-12] -> 660 | AU97: 鲍千灵 | AV97: =RC[-12] -> 37 | AW97: =RC[-12] -> 2871 | AX97: =RC[-12] -> 1716 | AY97: =RC[-12] -> 4719 | AZ97: =RC[-12] -> 1980 | BA97: =RC[-12] -> 660 | BG97: 五叶大师 | BH97: =RC[-12] -> 37 | BI97: =RC[-12] -> 2871 | BJ97: =RC[-12] -> 1716 | BK97: =RC[-12] -> 4719 | BL97: =RC[-12] -> 1980 | BM97: =RC[-12] -> 660
A98: 96 | B98: 费彬 | C98: 千里护镖 | D98: 6 | F98: 112 | G98: 1 | H98: 1 | I98: 96 | K98: 李志常 | L98: 37 | M98: 2871 | N98: 1716 | O98: 4719 | P98: 1980 | Q98: 660 | W98: 赵志敬 | X98: =RC[-12] -> 37 | Y98: =RC[-12] -> 2871 | Z98: =RC[-12] -> 1716 | AA98: =RC[-12] -> 4719 | AB98: =RC[-12] -> 1980 | AC98: =RC[-12] -> 660 | AI98: 辛然 | AJ98: =RC[-12] -> 37 | AK98: =RC[-12] -> 2871 | AL98: =RC[-12] -> 1716 | AM98: =RC[-12] -> 4719 | AN98: =RC[-12] -> 1980 | AO98: =RC[-12] -> 660 | AU98: 桃根仙 | AV98: =RC[-12] -> 37 | AW98: =RC[-12] -> 2871 | AX98: =RC[-12] -> 1716 | AY98: =RC[-12] -> 4719 | AZ98: =RC[-12] -> 1980 | BA98: =RC[-12] -> 660 | BG98: 费彬 | BH98: =RC[-12] -> 37 | BI98: =RC[-12] -> 2871 | BJ98: =RC[-12] -> 1716 | BK98: =RC[-12] -> 4719 | BL98: =RC[-12] -> 1980 | BM98: =RC[-12] -> 660
A99: 97 | B99: 木高峰 | C99: 千里护镖 | D99: 7 | F99: 36 | G99: 1 | H99: 1 | I99: 97 | K99: 木高峰 | L99: 38 | M99: 2958 | N99: 1768 | O99: 4862 | P99: 2040 | Q99: 680 | W99: 侯通海 | X99: =RC[-12] -> 38 | Y99: =RC[-12] -> 2958 | Z99: =RC[-12] -> 1768 | AA99: =RC[-12] -> 4862 | AB99: =RC[-12] -> 2040 | AC99: =RC[-12] -> 680 | AI99: 忽都虎 | AJ99: =RC[-12] -> 38 | AK99: =RC[-12] -> 2958 | AL99: =RC[-12] -> 1768 | AM99: =RC[-12] -> 4862 | AN99: =RC[-12] -> 2040 | AO99: =RC[-12] -> 680 | AU99: 岳灵珊 | AV99: =RC[-12] -> 38 | AW99: =RC[-12] -> 2958 | AX99: =RC[-12] -> 1768 | AY99: =RC[-12] -> 4862 | AZ99: =RC[-12] -> 2040 | BA99: =RC[-12] -> 680 | BG99: 申人俊 | BH99: =RC[-12] -> 38 | BI99: =RC[-12] -> 2958 | BJ99: =RC[-12] -> 1768 | BK99: =RC[-12] -> 4862 | BL99: =RC[-12] -> 2040 | BM99: =RC[-12] -> 680
A100: 98 | B100: 范百龄 | C100: 千里护镖 | D100: 8 | F100: 81 | G100: 1 | H100: 1 | I100: 98 | K100: 过彦之 | L100: 38 | M100: 2958 | N100: 1768 | O100: 4862 | P100: 2040 | Q100: 680 | W100: 范百龄 | X100: =RC[-12] -> 38 | Y100: =RC[-12] -> 2958 | Z100: =RC[-12] -> 1768 | AA100: =RC[-12] -> 4862 | AB100: =RC[-12] -> 2040 | AC100: =RC[-12] -> 680 | AI100: 平婆婆 | AJ100: =RC[-12] -> 38 | AK100: =RC[-12] -> 2958 | AL100: =RC[-12] -> 1768 | AM100: =RC[-12] -> 4862 | AN100: =RC[-12] -> 2040 | AO100: =RC[-12] -> 680 | AU100: 瑞婆婆 | AV100: =RC[-12] -> 38 | AW100: =RC[-12] -> 2958 | AX100: =RC[-12] -> 1768 | AY100: =RC[-12] -> 4862 | AZ100: =RC[-12] -> 2040 | BA100: =RC[-12] -> 680 | BG100: 程瑶迦 | BH100: =RC[-12] -> 38 | BI100: =RC[-12] -> 2958 | BJ100: =RC[-12] -> 1768 | BK100: =RC[-12] -> 4862 | BL100: =RC[-12] -> 2040 | BM100: =RC[-12] -> 680
A101: 99 | B101: 华赫艮 | C101: 千里护镖 | D101: 9 | F101: 13 | G101: 1 | H101: 1 | I101: 99 | K101: 华赫艮 | L101: 39 | M101: 3045 | N101: 1820 | O101: 5005 | P101: 2100 | Q101: 700 | W101: 朱聪 | X101: =RC[-12] -> 39 | Y101: =RC[-12] -> 3045 | Z101: =RC[-12] -> 1820 | AA101: =RC[-12] -> 5005 | AB101: =RC[-12] -> 2100 | AC101: =RC[-12] -> 700 | AI101: 韩小莹 | AJ101: =RC[-12] -> 39 | AK101: =RC[-12] -> 3045 | AL101: =RC[-12] -> 1820 | AM101: =RC[-12] -> 5005 | AN101: =RC[-12] -> 2100 | AO101: =RC[-12] -> 700 | AU101: 甘宝宝 | AV101: =RC[-12] -> 39 | AW101: =RC[-12] -> 3045 | AX101: =RC[-12] -> 1820 | AY101: =RC[-12] -> 5005 | AZ101: =RC[-12] -> 2100 | BA101: =RC[-12] -> 700 | BG101: 全金发 | BH101: =RC[-12] -> 39 | BI101: =RC[-12] -> 3045 | BJ101: =RC[-12] -> 1820 | BK101: =RC[-12] -> 5005 | BL101: =RC[-12] -> 2100 | BM101: =RC[-12] -> 700
A102: 100 | B102: 王语嫣 | C102: 千里护镖 | D102: 10 | F102: 119 | G102: 1 | H102: 1 | I102: 100 | K102: 小昭 | L102: 39 | M102: 3045 | N102: 1820 | O102: 5005 | P102: 2100 | Q102: 700 | W102: 哑婆婆 | X102: =RC[-12] -> 39 | Y102: =RC[-12] -> 3045 | Z102: =RC[-12] -> 1820 | AA102: =RC[-12] -> 5005 | AB102: =RC[-12] -> 2100 | AC102: =RC[-12] -> 700 | AI102: 王语嫣 | AJ102: =RC[-12] -> 39 | AK102: =RC[-12] -> 3045 | AL102: =RC[-12] -> 1820 | AM102: =RC[-12] -> 5005 | AN102: =RC[-12] -> 2100 | AO102: =RC[-12] -> 700 | AU102: 全冠清 | AV102: =RC[-12] -> 39 | AW102: =RC[-12] -> 3045 | AX102: =RC[-12] -> 1820 | AY102: =RC[-12] -> 5005 | AZ102: =RC[-12] -> 2100 | BA102: =RC[-12] -> 700 | BG102: 圆音 | BH102: =RC[-12] -> 39 | BI102: =RC[-12] -> 3045 | BJ102: =RC[-12] -> 1820 | BK102: =RC[-12] -> 5005 | BL102: =RC[-12] -> 2100 | BM102: =RC[-12] -> 700
A103: 101 | B103: 范骅 | C103: 聆秘 | D103: 1 | F103: 12 | G103: 1 | H103: 1 | I103: 101 | K103: 朱丹臣 | L103: 40 | M103: 3306 | N103: 1976 | O103: 5434 | P103: 2280 | Q103: 760 | W103: 慧方 | X103: =RC[-12] -> 40 | Y103: =RC[-12] -> 3306 | Z103: =RC[-12] -> 1976 | AA103: =RC[-12] -> 5434 | AB103: =RC[-12] -> 2280 | AC103: =RC[-12] -> 760 | AI103: 觉月 | AJ103: =RC[-12] -> 40 | AK103: =RC[-12] -> 3306 | AL103: =RC[-12] -> 1976 | AM103: =RC[-12] -> 5434 | AN103: =RC[-12] -> 2280 | AO103: =RC[-12] -> 760 | AU103: 费彬 | AV103: =RC[-12] -> 40 | AW103: =RC[-12] -> 3306 | AX103: =RC[-12] -> 1976 | AY103: =RC[-12] -> 5434 | AZ103: =RC[-12] -> 2280 | BA103: =RC[-12] -> 760 | BG103: 范骅 | BH103: =RC[-12] -> 40 | BI103: =RC[-12] -> 3306 | BJ103: =RC[-12] -> 1976 | BK103: =RC[-12] -> 5434 | BL103: =RC[-12] -> 2280 | BM103: =RC[-12] -> 760
A104: 102 | B104: 包不同 | C104: 聆秘 | D104: 2 | F104: 4 | G104: 1 | H104: 1 | I104: 102 | K104: 包不同 | L104: 40 | M104: 3306 | N104: 1976 | O104: 5434 | P104: 2280 | Q104: 760 | W104: 费彬 | X104: =RC[-12] -> 40 | Y104: =RC[-12] -> 3306 | Z104: =RC[-12] -> 1976 | AA104: =RC[-12] -> 5434 | AB104: =RC[-12] -> 2280 | AC104: =RC[-12] -> 760 | AI104: 桃根仙 | AJ104: =RC[-12] -> 40 | AK104: =RC[-12] -> 3306 | AL104: =RC[-12] -> 1976 | AM104: =RC[-12] -> 5434 | AN104: =RC[-12] -> 2280 | AO104: =RC[-12] -> 760 | AU104: 褚万里 | AV104: =RC[-12] -> 40 | AW104: =RC[-12] -> 3306 | AX104: =RC[-12] -> 1976 | AY104: =RC[-12] -> 5434 | AZ104: =RC[-12] -> 2280 | BA104: =RC[-12] -> 760 | BG104: 清虚道长 | BH104: =RC[-12] -> 40 | BI104: =RC[-12] -> 3306 | BJ104: =RC[-12] -> 1976 | BK104: =RC[-12] -> 5434 | BL104: =RC[-12] -> 2280 | BM104: =RC[-12] -> 760
A105: 103 | B105: 邓百川 | C105: 聆秘 | D105: 3 | F105: 56 | G105: 1 | H105: 1 | I105: 103 | K105: 桃根仙 | L105: 41 | M105: 3393 | N105: 2028 | O105: 5577 | P105: 2340 | Q105: 780 | W105: 邓百川 | X105: =RC[-12] -> 41 | Y105: =RC[-12] -> 3393 | Z105: =RC[-12] -> 2028 | AA105: =RC[-12] -> 5577 | AB105: =RC[-12] -> 2340 | AC105: =RC[-12] -> 780 | AI105: 范骅 | AJ105: =RC[-12] -> 41 | AK105: =RC[-12] -> 3393 | AL105: =RC[-12] -> 2028 | AM105: =RC[-12] -> 5577 | AN105: =RC[-12] -> 2340 | AO105: =RC[-12] -> 780 | AU105: 朱聪 | AV105: =RC[-12] -> 41 | AW105: =RC[-12] -> 3393 | AX105: =RC[-12] -> 2028 | AY105: =RC[-12] -> 5577 | AZ105: =RC[-12] -> 2340 | BA105: =RC[-12] -> 780 | BG105: 林震南 | BH105: =RC[-12] -> 41 | BI105: =RC[-12] -> 3393 | BJ105: =RC[-12] -> 2028 | BK105: =RC[-12] -> 5577 | BL105: =RC[-12] -> 2340 | BM105: =RC[-12] -> 780
A106: 104 | B106: 风波恶 | C106: 聆秘 | D106: 4 | F106: 46 | G106: 1 | H106: 1 | I106: 104 | K106: 风波恶 | L106: 41 | M106: 3393 | N106: 2028 | O106: 5577 | P106: 2340 | Q106: 780 | W106: 费彬 | X106: =RC[-12] -> 41 | Y106: =RC[-12] -> 3393 | Z106: =RC[-12] -> 2028 | AA106: =RC[-12] -> 5577 | AB106: =RC[-12] -> 2340 | AC106: =RC[-12] -> 780 | AI106: 过彦之 | AJ106: =RC[-12] -> 41 | AK106: =RC[-12] -> 3393 | AL106: =RC[-12] -> 2028 | AM106: =RC[-12] -> 5577 | AN106: =RC[-12] -> 2340 | AO106: =RC[-12] -> 780 | AU106: 侯通海 | AV106: =RC[-12] -> 41 | AW106: =RC[-12] -> 3393 | AX106: =RC[-12] -> 2028 | AY106: =RC[-12] -> 5577 | AZ106: =RC[-12] -> 2340 | BA106: =RC[-12] -> 780 | BG106: 哲别 | BH106: =RC[-12] -> 41 | BI106: =RC[-12] -> 3393 | BJ106: =RC[-12] -> 2028 | BK106: =RC[-12] -> 5577 | BL106: =RC[-12] -> 2340 | BM106: =RC[-12] -> 780
A107: 105 | B107: 公冶乾 | C107: 聆秘 | D107: 5 | F107: 17 | G107: 1 | H107: 1 | I107: 105 | K107: 公冶乾 | L107: 42 | M107: 3480 | N107: 2080 | O107: 5720 | P107: 2400 | Q107: 800 | W107: 南希仁 | X107: =RC[-12] -> 42 | Y107: =RC[-12] -> 3480 | Z107: =RC[-12] -> 2080 | AA107: =RC[-12] -> 5720 | AB107: =RC[-12] -> 2400 | AC107: =RC[-12] -> 800 | AI107: 五叶大师 | AJ107: =RC[-12] -> 42 | AK107: =RC[-12] -> 3480 | AL107: =RC[-12] -> 2080 | AM107: =RC[-12] -> 5720 | AN107: =RC[-12] -> 2400 | AO107: =RC[-12] -> 800 | AU107: 清虚道长 | AV107: =RC[-12] -> 42 | AW107: =RC[-12] -> 3480 | AX107: =RC[-12] -> 2080 | AY107: =RC[-12] -> 5720 | AZ107: =RC[-12] -> 2400 | BA107: =RC[-12] -> 800 | BG107: 全金发 | BH107: =RC[-12] -> 42 | BI107: =RC[-12] -> 3480 | BJ107: =RC[-12] -> 2080 | BK107: =RC[-12] -> 5720 | BL107: =RC[-12] -> 2400 | BM107: =RC[-12] -> 800
A108: 106 | B108: 刘正风 | C108: 聆秘 | D108: 6 | F108: 78 | G108: 1 | H108: 1 | I108: 106 | K108: 小昭 | L108: 42 | M108: 3480 | N108: 2080 | O108: 5720 | P108: 2400 | Q108: 800 | W108: 平婆婆 | X108: =RC[-12] -> 42 | Y108: =RC[-12] -> 3480 | Z108: =RC[-12] -> 2080 | AA108: =RC[-12] -> 5720 | AB108: =RC[-12] -> 2400 | AC108: =RC[-12] -> 800 | AI108: 赵志敬 | AJ108: =RC[-12] -> 42 | AK108: =RC[-12] -> 3480 | AL108: =RC[-12] -> 2080 | AM108: =RC[-12] -> 5720 | AN108: =RC[-12] -> 2400 | AO108: =RC[-12] -> 800 | AU108: 程瑶迦 | AV108: =RC[-12] -> 42 | AW108: =RC[-12] -> 3480 | AX108: =RC[-12] -> 2080 | AY108: =RC[-12] -> 5720 | AZ108: =RC[-12] -> 2400 | BA108: =RC[-12] -> 800 | BG108: 刘正风 | BH108: =RC[-12] -> 42 | BI108: =RC[-12] -> 3480 | BJ108: =RC[-12] -> 2080 | BK108: =RC[-12] -> 5720 | BL108: =RC[-12] -> 2400 | BM108: =RC[-12] -> 800
A109: 107 | B109: 赵钱孙 | C109: 聆秘 | D109: 7 | F109: 64 | G109: 1 | H109: 1 | I109: 107 | K109: 圆音 | L109: 43 | M109: 3567 | N109: 2132 | O109: 5863 | P109: 2460 | Q109: 820 | W109: 赵钱孙 | X109: =RC[-12] -> 43 | Y109: =RC[-12] -> 3567 | Z109: =RC[-12] -> 2132 | AA109: =RC[-12] -> 5863 | AB109: =RC[-12] -> 2460 | AC109: =RC[-12] -> 820 | AI109: 韩小莹 | AJ109: =RC[-12] -> 43 | AK109: =RC[-12] -> 3567 | AL109: =RC[-12] -> 2132 | AM109: =RC[-12] -> 5863 | AN109: =RC[-12] -> 2460 | AO109: =RC[-12] -> 820 | AU109: 古笃诚 | AV109: =RC[-12] -> 43 | AW109: =RC[-12] -> 3567 | AX109: =RC[-12] -> 2132 | AY109: =RC[-12] -> 5863 | AZ109: =RC[-12] -> 2460 | BA109: =RC[-12] -> 820 | BG109: 完颜洪烈 | BH109: =RC[-12] -> 43 | BI109: =RC[-12] -> 3567 | BJ109: =RC[-12] -> 2132 | BK109: =RC[-12] -> 5863 | BL109: =RC[-12] -> 2460 | BM109: =RC[-12] -> 820
A110: 108 | B110: 陈孤雁 | C110: 聆秘 | D110: 8 | F110: 62 | G110: 1 | H110: 1 | I110: 108 | K110: 木婉清 | L110: 43 | M110: 3567 | N110: 2132 | O110: 5863 | P110: 2460 | Q110: 820 | W110: 岳灵珊 | X110: =RC[-12] -> 43 | Y110: =RC[-12] -> 3567 | Z110: =RC[-12] -> 2132 | AA110: =RC[-12] -> 5863 | AB110: =RC[-12] -> 2460 | AC110: =RC[-12] -> 820 | AI110: 过彦之 | AJ110: =RC[-12] -> 43 | AK110: =RC[-12] -> 3567 | AL110: =RC[-12] -> 2132 | AM110: =RC[-12] -> 5863 | AN110: =RC[-12] -> 2460 | AO110: =RC[-12] -> 820 | AU110: 包不同 | AV110: =RC[-12] -> 43 | AW110: =RC[-12] -> 3567 | AX110: =RC[-12] -> 2132 | AY110: =RC[-12] -> 5863 | AZ110: =RC[-12] -> 2460 | BA110: =RC[-12] -> 820 | BG110: 陈孤雁 | BH110: =RC[-12] -> 43 | BI110: =RC[-12] -> 3567 | BJ110: =RC[-12] -> 2132 | BK110: =RC[-12] -> 5863 | BL110: =RC[-12] -> 2460 | BM110: =RC[-12] -> 820
A111: 109 | B111: 白世镜 | C111: 聆秘 | D111: 9 | F111: 63 | G111: 1 | H111: 1 | I111: 109 | K111: 摘星子 | L111: 44 | M111: 3654 | N111: 2184 | O111: 6006 | P111: 2520 | Q111: 840 | W111: 韩宝驹 | X111: =RC[-12] -> 44 | Y111: =RC[-12] -> 3654 | Z111: =RC[-12] -> 2184 | AA111: =RC[-12] -> 6006 | AB111: =RC[-12] -> 2520 | AC111: =RC[-12] -> 840 | AI111: 阿朱 | AJ111: =RC[-12] -> 44 | AK111: =RC[-12] -> 3654 | AL111: =RC[-12] -> 2184 | AM111: =RC[-12] -> 6006 | AN111: =RC[-12] -> 2520 | AO111: =RC[-12] -> 840 | AU111: 华赫艮 | AV111: =RC[-12] -> 44 | AW111: =RC[-12] -> 3654 | AX111: =RC[-12] -> 2184 | AY111: =RC[-12] -> 6006 | AZ111: =RC[-12] -> 2520 | BA111: =RC[-12] -> 840 | BG111: 白世镜 | BH111: =RC[-12] -> 44 | BI111: =RC[-12] -> 3654 | BJ111: =RC[-12] -> 2184 | BK111: =RC[-12] -> 6006 | BL111: =RC[-12] -> 2520 | BM111: =RC[-12] -> 840
A112: 110 | B112: 巴天石 | C112: 聆秘 | D112: 10 | F112: 12 | G112: 1 | H112: 1 | I112: 110 | K112: 木高峰 | L112: 44 | M112: 3654 | N112: 2184 | O112: 6006 | P112: 2520 | Q112: 840 | W112: 巴天石 | X112: =RC[-12] -> 44 | Y112: =RC[-12] -> 3654 | Z112: =RC[-12] -> 2184 | AA112: =RC[-12] -> 6006 | AB112: =RC[-12] -> 2520 | AC112: =RC[-12] -> 840 | AI112: 范百龄 | AJ112: =RC[-12] -> 44 | AK112: =RC[-12] -> 3654 | AL112: =RC[-12] -> 2184 | AM112: =RC[-12] -> 6006 | AN112: =RC[-12] -> 2520 | AO112: =RC[-12] -> 840 | AU112: 风波恶 | AV112: =RC[-12] -> 44 | AW112: =RC[-12] -> 3654 | AX112: =RC[-12] -> 2184 | AY112: =RC[-12] -> 6006 | AZ112: =RC[-12] -> 2520 | BA112: =RC[-12] -> 840 | BG112: 费彬 | BH112: =RC[-12] -> 44 | BI112: =RC[-12] -> 3654 | BJ112: =RC[-12] -> 2184 | BK112: =RC[-12] -> 6006 | BL112: =RC[-12] -> 2520 | BM112: =RC[-12] -> 840
A113: 111 | B113: 苦乘 | C113: 回雁楼 | D113: 1 | F113: 22 | G113: 1 | H113: 1 | I113: 111 | K113: 桃根仙 | L113: 45 | M113: 3741 | N113: 2236 | O113: 6149 | P113: 2580 | Q113: 860 | W113: 费彬 | X113: =RC[-12] -> 45 | Y113: =RC[-12] -> 3741 | Z113: =RC[-12] -> 2236 | AA113: =RC[-12] -> 6149 | AB113: =RC[-12] -> 2580 | AC113: =RC[-12] -> 860 | AI113: 哲别 | AJ113: =RC[-12] -> 45 | AK113: =RC[-12] -> 3741 | AL113: =RC[-12] -> 2236 | AM113: =RC[-12] -> 6149 | AN113: =RC[-12] -> 2580 | AO113: =RC[-12] -> 860 | AU113: 仪琳 | AV113: =RC[-12] -> 45 | AW113: =RC[-12] -> 3741 | AX113: =RC[-12] -> 2236 | AY113: =RC[-12] -> 6149 | AZ113: =RC[-12] -> 2580 | BA113: =RC[-12] -> 860 | BG113: 苦乘 | BH113: =RC[-12] -> 45 | BI113: =RC[-12] -> 3741 | BJ113: =RC[-12] -> 2236 | BK113: =RC[-12] -> 6149 | BL113: =RC[-12] -> 2580 | BM113: =RC[-12] -> 860
A114: 112 | B114: 玄苦 | C114: 回雁楼 | D114: 2 | F114: 22 | G114: 1 | H114: 1 | I114: 112 | K114: 柯镇恶 | L114: 45 | M114: 3741 | N114: 2236 | O114: 6149 | P114: 2580 | Q114: 860 | W114: 木高峰 | X114: =RC[-12] -> 45 | Y114: =RC[-12] -> 3741 | Z114: =RC[-12] -> 2236 | AA114: =RC[-12] -> 6149 | AB114: =RC[-12] -> 2580 | AC114: =RC[-12] -> 860 | AI114: 范百龄 | AJ114: =RC[-12] -> 45 | AK114: =RC[-12] -> 3741 | AL114: =RC[-12] -> 2236 | AM114: =RC[-12] -> 6149 | AN114: =RC[-12] -> 2580 | AO114: =RC[-12] -> 860 | AU114: 哲别 | AV114: =RC[-12] -> 45 | AW114: =RC[-12] -> 3741 | AX114: =RC[-12] -> 2236 | AY114: =RC[-12] -> 6149 | AZ114: =RC[-12] -> 2580 | BA114: =RC[-12] -> 860 | BG114: 玄苦 | BH114: =RC[-12] -> 45 | BI114: =RC[-12] -> 3741 | BJ114: =RC[-12] -> 2236 | BK114: =RC[-12] -> 6149 | BL114: =RC[-12] -> 2580 | BM114: =RC[-12] -> 860
A115: 113 | B115: 玄惭 | C115: 回雁楼 | D115: 3 | F115: 22 | G115: 1 | H115: 1 | I115: 113 | K115: 程瑶迦 | L115: 46 | M115: 3828 | N115: 2288 | O115: 6292 | P115: 2640 | Q115: 880 | W115: 觉月 | X115: =RC[-12] -> 46 | Y115: =RC[-12] -> 3828 | Z115: =RC[-12] -> 2288 | AA115: =RC[-12] -> 6292 | AB115: =RC[-12] -> 2640 | AC115: =RC[-12] -> 880 | AI115: 苦乘 | AJ115: =RC[-12] -> 46 | AK115: =RC[-12] -> 3828 | AL115: =RC[-12] -> 2288 | AM115: =RC[-12] -> 6292 | AN115: =RC[-12] -> 2640 | AO115: =RC[-12] -> 880 | AU115: 玄苦 | AV115: =RC[-12] -> 46 | AW115: =RC[-12] -> 3828 | AX115: =RC[-12] -> 2288 | AY115: =RC[-12] -> 6292 | AZ115: =RC[-12] -> 2640 | BA115: =RC[-12] -> 880 | BG115: 玄惭 | BH115: =RC[-12] -> 46 | BI115: =RC[-12] -> 3828 | BJ115: =RC[-12] -> 2288 | BK115: =RC[-12] -> 6292 | BL115: =RC[-12] -> 2640 | BM115: =RC[-12] -> 880
A116: 114 | B116: 黄钟公 | C116: 回雁楼 | D116: 4 | F116: 67 | G116: 1 | H116: 1 | I116: 114 | K116: 朱聪 | L116: 46 | M116: 3828 | N116: 2288 | O116: 6292 | P116: 2640 | Q116: 880 | W116: 张松溪 | X116: =RC[-12] -> 46 | Y116: =RC[-12] -> 3828 | Z116: =RC[-12] -> 2288 | AA116: =RC[-12] -> 6292 | AB116: =RC[-12] -> 2640 | AC116: =RC[-12] -> 880 | AI116: 静虚师太 | AJ116: =RC[-12] -> 46 | AK116: =RC[-12] -> 3828 | AL116: =RC[-12] -> 2288 | AM116: =RC[-12] -> 6292 | AN116: =RC[-12] -> 2640 | AO116: =RC[-12] -> 880 | AU116: 华赫艮 | AV116: =RC[-12] -> 46 | AW116: =RC[-12] -> 3828 | AX116: =RC[-12] -> 2288 | AY116: =RC[-12] -> 6292 | AZ116: =RC[-12] -> 2640 | BA116: =RC[-12] -> 880 | BG116: 黄钟公 | BH116: =RC[-12] -> 46 | BI116: =RC[-12] -> 3828 | BJ116: =RC[-12] -> 2288 | BK116: =RC[-12] -> 6292 | BL116: =RC[-12] -> 2640 | BM116: =RC[-12] -> 880
A117: 115 | B117: 平一指 | C117: 回雁楼 | D117: 5 | F117: 4 | G117: 1 | H117: 1 | I117: 115 | K117: 公冶乾 | L117: 47 | M117: 3915 | N117: 2340 | O117: 6435 | P117: 2700 | Q117: 900 | W117: 木婉清 | X117: =RC[-12] -> 47 | Y117: =RC[-12] -> 3915 | Z117: =RC[-12] -> 2340 | AA117: =RC[-12] -> 6435 | AB117: =RC[-12] -> 2700 | AC117: =RC[-12] -> 900 | AI117: 朱聪 | AJ117: =RC[-12] -> 47 | AK117: =RC[-12] -> 3915 | AL117: =RC[-12] -> 2340 | AM117: =RC[-12] -> 6435 | AN117: =RC[-12] -> 2700 | AO117: =RC[-12] -> 900 | AU117: 仪琳 | AV117: =RC[-12] -> 47 | AW117: =RC[-12] -> 3915 | AX117: =RC[-12] -> 2340 | AY117: =RC[-12] -> 6435 | AZ117: =RC[-12] -> 2700 | BA117: =RC[-12] -> 900 | BG117: 平一指 | BH117: =RC[-12] -> 47 | BI117: =RC[-12] -> 3915 | BJ117: =RC[-12] -> 2340 | BK117: =RC[-12] -> 6435 | BL117: =RC[-12] -> 2700 | BM117: =RC[-12] -> 900
A118: 116 | B118: 潇湘子 | C118: 回雁楼 | D118: 6 | F118: 17 | G118: 1 | H118: 1 | I118: 116 | K118: 邓百川 | L118: 47 | M118: 3915 | N118: 2340 | O118: 6435 | P118: 2700 | Q118: 900 | W118: 王语嫣 | X118: =RC[-12] -> 47 | Y118: =RC[-12] -> 3915 | Z118: =RC[-12] -> 2340 | AA118: =RC[-12] -> 6435 | AB118: =RC[-12] -> 2700 | AC118: =RC[-12] -> 900 | AI118: 觉月 | AJ118: =RC[-12] -> 47 | AK118: =RC[-12] -> 3915 | AL118: =RC[-12] -> 2340 | AM118: =RC[-12] -> 6435 | AN118: =RC[-12] -> 2700 | AO118: =RC[-12] -> 900 | AV118: =RC[-12] -> 47 | AW118: =RC[-12] -> 3915 | AX118: =RC[-12] -> 2340 | AY118: =RC[-12] -> 6435 | AZ118: =RC[-12] -> 2700 | BA118: =RC[-12] -> 900 | BG118: 潇湘子 | BH118: =RC[-12] -> 47 | BI118: =RC[-12] -> 3915 | BJ118: =RC[-12] -> 2340 | BK118: =RC[-12] -> 6435 | BL118: =RC[-12] -> 2700 | BM118: =RC[-12] -> 900
A119: 117 | B119: 尹志平 | C119: 回雁楼 | D119: 7 | F119: 84 | G119: 1 | H119: 1 | I119: 117 | K119: 潇湘子 | L119: 48 | M119: 4002 | N119: 2392 | O119: 6578 | P119: 2760 | Q119: 920 | W119: 平一指 | X119: =RC[-12] -> 48 | Y119: =RC[-12] -> 4002 | Z119: =RC[-12] -> 2392 | AA119: =RC[-12] -> 6578 | AB119: =RC[-12] -> 2760 | AC119: =RC[-12] -> 920 | AI119: 黄钟公 | AJ119: =RC[-12] -> 48 | AK119: =RC[-12] -> 4002 | AL119: =RC[-12] -> 2392 | AM119: =RC[-12] -> 6578 | AN119: =RC[-12] -> 2760 | AO119: =RC[-12] -> 920 | AU119: 赵钱孙 | AV119: =RC[-12] -> 48 | AW119: =RC[-12] -> 4002 | AX119: =RC[-12] -> 2392 | AY119: =RC[-12] -> 6578 | AZ119: =RC[-12] -> 2760 | BA119: =RC[-12] -> 920 | BG119: 尹志平 | BH119: =RC[-12] -> 48 | BI119: =RC[-12] -> 4002 | BJ119: =RC[-12] -> 2392 | BK119: =RC[-12] -> 6578 | BL119: =RC[-12] -> 2760 | BM119: =RC[-12] -> 920
A120: 118 | B120: 鲁有脚 | C120: 回雁楼 | D120: 8 | F120: 62 | G120: 1 | H120: 1 | I120: 118 | K120: 静慧师太 | L120: 48 | M120: 4002 | N120: 2392 | O120: 6578 | P120: 2760 | Q120: 920 | W120: 玄惭 | X120: =RC[-12] -> 48 | Y120: =RC[-12] -> 4002 | Z120: =RC[-12] -> 2392 | AA120: =RC[-12] -> 6578 | AB120: =RC[-12] -> 2760 | AC120: =RC[-12] -> 920 | AI120: 王语嫣 | AJ120: =RC[-12] -> 48 | AK120: =RC[-12] -> 4002 | AL120: =RC[-12] -> 2392 | AM120: =RC[-12] -> 6578 | AN120: =RC[-12] -> 2760 | AO120: =RC[-12] -> 920 | AU120: 全冠清 | AV120: =RC[-12] -> 48 | AW120: =RC[-12] -> 4002 | AX120: =RC[-12] -> 2392 | AY120: =RC[-12] -> 6578 | AZ120: =RC[-12] -> 2760 | BA120: =RC[-12] -> 920 | BG120: 鲁有脚 | BH120: =RC[-12] -> 48 | BI120: =RC[-12] -> 4002 | BJ120: =RC[-12] -> 2392 | BK120: =RC[-12] -> 6578 | BL120: =RC[-12] -> 2760 | BM120: =RC[-12] -> 920
A121: 119 | B121: 张松溪 | C121: 回雁楼 | D121: 9 | F121: 82 | G121: 1 | H121: 1 | I121: 119 | K121: 木高峰 | L121: 48 | M121: 4002 | N121: 2392 | O121: 6578 | P121: 2760 | Q121: 920 | W121: 静虚师太 | X121: =RC[-12] -> 48 | Y121: =RC[-12] -> 4002 | Z121: =RC[-12] -> 2392 | AA121: =RC[-12] -> 6578 | AB121: =RC[-12] -> 2760 | AC121: =RC[-12] -> 920 | AI121: 清虚道长 | AJ121: =RC[-12] -> 48 | AK121: =RC[-12] -> 4002 | AL121: =RC[-12] -> 2392 | AM121: =RC[-12] -> 6578 | AN121: =RC[-12] -> 2760 | AO121: =RC[-12] -> 920 | AU121: 莫声谷 | AV121: =RC[-12] -> 48 | AW121: =RC[-12] -> 4002 | AX121: =RC[-12] -> 2392 | AY121: =RC[-12] -> 6578 | AZ121: =RC[-12] -> 2760 | BA121: =RC[-12] -> 920 | BG121: 张松溪 | BH121: =RC[-12] -> 48 | BI121: =RC[-12] -> 4002 | BJ121: =RC[-12] -> 2392 | BK121: =RC[-12] -> 6578 | BL121: =RC[-12] -> 2760 | BM121: =RC[-12] -> 920
A122: 120 | B122: 余沧海 | C122: 回雁楼 | D122: 10 | F122: 69 | G122: 1 | H122: 1 | I122: 120 | K122: 赵志敬 | L122: 49 | M122: 4089 | N122: 2444 | O122: 6721 | P122: 2820 | Q122: 940 | W122: 木高峰 | X122: =RC[-12] -> 49 | Y122: =RC[-12] -> 4089 | Z122: =RC[-12] -> 2444 | AA122: =RC[-12] -> 6721 | AB122: =RC[-12] -> 2820 | AC122: =RC[-12] -> 940 | AI122: 木婉清 | AJ122: =RC[-12] -> 49 | AK122: =RC[-12] -> 4089 | AL122: =RC[-12] -> 2444 | AM122: =RC[-12] -> 6721 | AN122: =RC[-12] -> 2820 | AO122: =RC[-12] -> 940 | AU122: 全冠清 | AV122: =RC[-12] -> 49 | AW122: =RC[-12] -> 4089 | AX122: =RC[-12] -> 2444 | AY122: =RC[-12] -> 6721 | AZ122: =RC[-12] -> 2820 | BA122: =RC[-12] -> 940 | BG122: 余沧海 | BH122: =RC[-12] -> 49 | BI122: =RC[-12] -> 4089 | BJ122: =RC[-12] -> 2444 | BK122: =RC[-12] -> 6721 | BL122: =RC[-12] -> 2820 | BM122: =RC[-12] -> 940
A123: 121 | B123: 莫声谷 | C123: 绿柳山庄 | D123: 1 | F123: 84 | G123: 1 | H123: 1 | I123: 121 | K123: 李志常 | L123: 49 | M123: 4263 | N123: 2548 | O123: 7007 | P123: 2940 | Q123: 980 | W123: 五叶大师 | X123: =RC[-12] -> 49 | Y123: =RC[-12] -> 4263 | Z123: =RC[-12] -> 2548 | AA123: =RC[-12] -> 7007 | AB123: =RC[-12] -> 2940 | AC123: =RC[-12] -> 980 | AI123: 黄钟公 | AJ123: =RC[-12] -> 49 | AK123: =RC[-12] -> 4263 | AL123: =RC[-12] -> 2548 | AM123: =RC[-12] -> 7007 | AN123: =RC[-12] -> 2940 | AO123: =RC[-12] -> 980 | AU123: 圆音 | AV123: =RC[-12] -> 49 | AW123: =RC[-12] -> 4263 | AX123: =RC[-12] -> 2548 | AY123: =RC[-12] -> 7007 | AZ123: =RC[-12] -> 2940 | BA123: =RC[-12] -> 980 | BG123: 莫声谷 | BH123: =RC[-12] -> 49 | BI123: =RC[-12] -> 4263 | BJ123: =RC[-12] -> 2548 | BK123: =RC[-12] -> 7007 | BL123: =RC[-12] -> 2940 | BM123: =RC[-12] -> 980
A124: 122 | B124: 陈玄风 | C124: 绿柳山庄 | D124: 2 | F124: 58 | G124: 1 | H124: 1 | I124: 122 | K124: 余沧海 | L124: 49 | M124: 4263 | N124: 2548 | O124: 7007 | P124: 2940 | Q124: 980 | W124: 黄钟公 | X124: =RC[-12] -> 49 | Y124: =RC[-12] -> 4263 | Z124: =RC[-12] -> 2548 | AA124: =RC[-12] -> 7007 | AB124: =RC[-12] -> 2940 | AC124: =RC[-12] -> 980 | AI124: 苦乘 | AJ124: =RC[-12] -> 49 | AK124: =RC[-12] -> 4263 | AL124: =RC[-12] -> 2548 | AM124: =RC[-12] -> 7007 | AN124: =RC[-12] -> 2940 | AO124: =RC[-12] -> 980 | AU124: 玄苦 | AV124: =RC[-12] -> 49 | AW124: =RC[-12] -> 4263 | AX124: =RC[-12] -> 2548 | AY124: =RC[-12] -> 7007 | AZ124: =RC[-12] -> 2940 | BA124: =RC[-12] -> 980 | BG124: 陈玄风 | BH124: =RC[-12] -> 49 | BI124: =RC[-12] -> 4263 | BJ124: =RC[-12] -> 2548 | BK124: =RC[-12] -> 7007 | BL124: =RC[-12] -> 2940 | BM124: =RC[-12] -> 980
A125: 123 | B125: 陆乘风 | C125: 绿柳山庄 | D125: 3 | F125: 59 | G125: 1 | H125: 1 | I125: 123 | K125: 计无施 | L125: 50 | M125: 4350 | N125: 2600 | O125: 7150 | P125: 3000 | Q125: 1000 | W125: 刀白凤 | X125: =RC[-12] -> 50 | Y125: =RC[-12] -> 4350 | Z125: =RC[-12] -> 2600 | AA125: =RC[-12] -> 7150 | AB125: =RC[-12] -> 3000 | AC125: =RC[-12] -> 1000 | AI125: 陈玄风 | AJ125: =RC[-12] -> 50 | AK125: =RC[-12] -> 4350 | AL125: =RC[-12] -> 2600 | AM125: =RC[-12] -> 7150 | AN125: =RC[-12] -> 3000 | AO125: =RC[-12] -> 1000 | AU125: 木高峰 | AV125: =RC[-12] -> 50 | AW125: =RC[-12] -> 4350 | AX125: =RC[-12] -> 2600 | AY125: =RC[-12] -> 7150 | AZ125: =RC[-12] -> 3000 | BA125: =RC[-12] -> 1000 | BG125: 陆乘风 | BH125: =RC[-12] -> 50 | BI125: =RC[-12] -> 4350 | BJ125: =RC[-12] -> 2600 | BK125: =RC[-12] -> 7150 | BL125: =RC[-12] -> 3000 | BM125: =RC[-12] -> 1000
A126: 124 | B126: 武眠风 | C126: 绿柳山庄 | D126: 4 | F126: 59 | G126: 1 | H126: 1 | I126: 124 | K126: 潇湘子 | L126: 50 | M126: 4350 | N126: 2600 | O126: 7150 | P126: 3000 | Q126: 1000 | W126: 陆乘风 | X126: =RC[-12] -> 50 | Y126: =RC[-12] -> 4350 | Z126: =RC[-12] -> 2600 | AA126: =RC[-12] -> 7150 | AB126: =RC[-12] -> 3000 | AC126: =RC[-12] -> 1000 | AI126: 完颜洪烈 | AJ126: =RC[-12] -> 50 | AK126: =RC[-12] -> 4350 | AL126: =RC[-12] -> 2600 | AM126: =RC[-12] -> 7150 | AN126: =RC[-12] -> 3000 | AO126: =RC[-12] -> 1000 | AU126: 玄苦 | AV126: =RC[-12] -> 50 | AW126: =RC[-12] -> 4350 | AX126: =RC[-12] -> 2600 | AY126: =RC[-12] -> 7150 | AZ126: =RC[-12] -> 3000 | BA126: =RC[-12] -> 1000 | BG126: 武眠风 | BH126: =RC[-12] -> 50 | BI126: =RC[-12] -> 4350 | BJ126: =RC[-12] -> 2600 | BK126: =RC[-12] -> 7150 | BL126: =RC[-12] -> 3000 | BM126: =RC[-12] -> 1000
A127: 125 | B127: 冯默风 | C127: 绿柳山庄 | D127: 5 | F127: 58 | G127: 1 | H127: 1 | I127: 125 | K127: 苦乘 | L127: 50 | M127: 4350 | N127: 2600 | O127: 7150 | P127: 3000 | Q127: 1000 | W127: 计无施 | X127: =RC[-12] -> 50 | Y127: =RC[-12] -> 4350 | Z127: =RC[-12] -> 2600 | AA127: =RC[-12] -> 7150 | AB127: =RC[-12] -> 3000 | AC127: =RC[-12] -> 1000 | AI127: 柯镇恶 | AJ127: =RC[-12] -> 50 | AK127: =RC[-12] -> 4350 | AL127: =RC[-12] -> 2600 | AM127: =RC[-12] -> 7150 | AN127: =RC[-12] -> 3000 | AO127: =RC[-12] -> 1000 | AU127: 黄钟公 | AV127: =RC[-12] -> 50 | AW127: =RC[-12] -> 4350 | AX127: =RC[-12] -> 2600 | AY127: =RC[-12] -> 7150 | AZ127: =RC[-12] -> 3000 | BA127: =RC[-12] -> 1000 | BG127: 冯默风 | BH127: =RC[-12] -> 50 | BI127: =RC[-12] -> 4350 | BJ127: =RC[-12] -> 2600 | BK127: =RC[-12] -> 7150 | BL127: =RC[-12] -> 3000 | BM127: =RC[-12] -> 1000
A128: 126 | B128: 定静师太 | C128: 绿柳山庄 | D128: 6 | F128: 114 | G128: 1 | H128: 1 | I128: 126 | K128: 余沧海 | L128: 51 | M128: 4437 | N128: 2652 | O128: 7293 | P128: 3060 | Q128: 1020 | W128: 赵敏 | X128: =RC[-12] -> 51 | Y128: =RC[-12] -> 4437 | Z128: =RC[-12] -> 2652 | AA128: =RC[-12] -> 7293 | AB128: =RC[-12] -> 3060 | AC128: =RC[-12] -> 1020 | AI128: 玄苦 | AJ128: =RC[-12] -> 51 | AK128: =RC[-12] -> 4437 | AL128: =RC[-12] -> 2652 | AM128: =RC[-12] -> 7293 | AN128: =RC[-12] -> 3060 | AO128: =RC[-12] -> 1020 | AU128: 刘正风 | AV128: =RC[-12] -> 51 | AW128: =RC[-12] -> 4437 | AX128: =RC[-12] -> 2652 | AY128: =RC[-12] -> 7293 | AZ128: =RC[-12] -> 3060 | BA128: =RC[-12] -> 1020 | BG128: 定静师太 | BH128: =RC[-12] -> 51 | BI128: =RC[-12] -> 4437 | BJ128: =RC[-12] -> 2652 | BK128: =RC[-12] -> 7293 | BL128: =RC[-12] -> 3060 | BM128: =RC[-12] -> 1020
A129: 127 | B129: 定闲师太 | C129: 绿柳山庄 | D129: 7 | F129: 114 | G129: 1 | H129: 1 | I129: 127 | K129: 鲁有脚 | L129: 51 | M129: 4437 | N129: 2652 | O129: 7293 | P129: 3060 | Q129: 1020 | W129: 潇湘子 | X129: =RC[-12] -> 51 | Y129: =RC[-12] -> 4437 | Z129: =RC[-12] -> 2652 | AA129: =RC[-12] -> 7293 | AB129: =RC[-12] -> 3060 | AC129: =RC[-12] -> 1020 | AI129: 刀白凤 | AJ129: =RC[-12] -> 51 | AK129: =RC[-12] -> 4437 | AL129: =RC[-12] -> 2652 | AM129: =RC[-12] -> 7293 | AN129: =RC[-12] -> 3060 | AO129: =RC[-12] -> 1020 | AU129: 平一指 | AV129: =RC[-12] -> 51 | AW129: =RC[-12] -> 4437 | AX129: =RC[-12] -> 2652 | AY129: =RC[-12] -> 7293 | AZ129: =RC[-12] -> 3060 | BA129: =RC[-12] -> 1020 | BG129: 定闲师太 | BH129: =RC[-12] -> 51 | BI129: =RC[-12] -> 4437 | BJ129: =RC[-12] -> 2652 | BK129: =RC[-12] -> 7293 | BL129: =RC[-12] -> 3060 | BM129: =RC[-12] -> 1020
A130: 128 | B130: 俞岱岩 | C130: 绿柳山庄 | D130: 8 | F130: 82 | G130: 1 | H130: 1 | I130: 128 | K130: 俞岱岩 | L130: 51 | M130: 4437 | N130: 2652 | O130: 7293 | P130: 3060 | Q130: 1020 | W130: 圆音 | X130: =RC[-12] -> 51 | Y130: =RC[-12] -> 4437 | Z130: =RC[-12] -> 2652 | AA130: =RC[-12] -> 7293 | AB130: =RC[-12] -> 3060 | AC130: =RC[-12] -> 1020 | AI130: 王语嫣 | AJ130: =RC[-12] -> 51 | AK130: =RC[-12] -> 4437 | AL130: =RC[-12] -> 2652 | AM130: =RC[-12] -> 7293 | AN130: =RC[-12] -> 3060 | AO130: =RC[-12] -> 1020 | AU130: 玄惭 | AV130: =RC[-12] -> 51 | AW130: =RC[-12] -> 4437 | AX130: =RC[-12] -> 2652 | AY130: =RC[-12] -> 7293 | AZ130: =RC[-12] -> 3060 | BA130: =RC[-12] -> 1020 | BG130: 鲁有脚 | BH130: =RC[-12] -> 51 | BI130: =RC[-12] -> 4437 | BJ130: =RC[-12] -> 2652 | BK130: =RC[-12] -> 7293 | BL130: =RC[-12] -> 3060 | BM130: =RC[-12] -> 1020
A131: 129 | B131: 岳老三 | C131: 绿柳山庄 | D131: 9 | F131: 31 | G131: 1 | H131: 1 | I131: 129 | K131: 平一指 | L131: 52 | M131: 4524 | N131: 2704 | O131: 7436 | P131: 3120 | Q131: 1040 | W131: 王语嫣 | X131: =RC[-12] -> 52 | Y131: =RC[-12] -> 4524 | Z131: =RC[-12] -> 2704 | AA131: =RC[-12] -> 7436 | AB131: =RC[-12] -> 3120 | AC131: =RC[-12] -> 1040 | AI131: 哑婆婆 | AJ131: =RC[-12] -> 52 | AK131: =RC[-12] -> 4524 | AL131: =RC[-12] -> 2704 | AM131: =RC[-12] -> 7436 | AN131: =RC[-12] -> 3120 | AO131: =RC[-12] -> 1040 | AU131: 邓百川 | AV131: =RC[-12] -> 52 | AW131: =RC[-12] -> 4524 | AX131: =RC[-12] -> 2704 | AY131: =RC[-12] -> 7436 | AZ131: =RC[-12] -> 3120 | BA131: =RC[-12] -> 1040 | BG131: 岳老三 | BH131: =RC[-12] -> 52 | BI131: =RC[-12] -> 4524 | BJ131: =RC[-12] -> 2704 | BK131: =RC[-12] -> 7436 | BL131: =RC[-12] -> 3120 | BM131: =RC[-12] -> 1040
A132: 130 | B132: 梅超风 | C132: 绿柳山庄 | D132: 10 | F132: 92 | G132: 1 | H132: 1 | I132: 130 | K132: 陆乘风 | L132: 52 | M132: 4524 | N132: 2704 | O132: 7436 | P132: 3120 | Q132: 1040 | W132: 陈玄风 | X132: =RC[-12] -> 52 | Y132: =RC[-12] -> 4524 | Z132: =RC[-12] -> 2704 | AA132: =RC[-12] -> 7436 | AB132: =RC[-12] -> 3120 | AC132: =RC[-12] -> 1040 | AI132: 武眠风 | AJ132: =RC[-12] -> 52 | AK132: =RC[-12] -> 4524 | AL132: =RC[-12] -> 2704 | AM132: =RC[-12] -> 7436 | AN132: =RC[-12] -> 3120 | AO132: =RC[-12] -> 1040 | AU132: 冯默风 | AV132: =RC[-12] -> 52 | AW132: =RC[-12] -> 4524 | AX132: =RC[-12] -> 2704 | AY132: =RC[-12] -> 7436 | AZ132: =RC[-12] -> 3120 | BA132: =RC[-12] -> 1040 | BG132: 梅超风 | BH132: =RC[-12] -> 52 | BI132: =RC[-12] -> 4524 | BJ132: =RC[-12] -> 2704 | BK132: =RC[-12] -> 7436 | BL132: =RC[-12] -> 3120 | BM132: =RC[-12] -> 1040
A133: 131 | B133: 田伯光 | C133: 太极初传 | D133: 1 | F133: 49 | G133: 1 | H133: 1 | I133: 131 | K133: 叶二娘 | L133: 52 | M133: 4524 | N133: 2704 | O133: 7436 | P133: 3120 | Q133: 1040 | W133: 云中鹤 | X133: =RC[-12] -> 52 | Y133: =RC[-12] -> 4524 | Z133: =RC[-12] -> 2704 | AA133: =RC[-12] -> 7436 | AB133: =RC[-12] -> 3120 | AC133: =RC[-12] -> 1040 | AI133: 岳老三 | AJ133: =RC[-12] -> 52 | AK133: =RC[-12] -> 4524 | AL133: =RC[-12] -> 2704 | AM133: =RC[-12] -> 7436 | AN133: =RC[-12] -> 3120 | AO133: =RC[-12] -> 1040 | AU133: 风波恶 | AV133: =RC[-12] -> 52 | AW133: =RC[-12] -> 4524 | AX133: =RC[-12] -> 2704 | AY133: =RC[-12] -> 7436 | AZ133: =RC[-12] -> 3120 | BA133: =RC[-12] -> 1040 | BG133: 田伯光 | BH133: =RC[-12] -> 52 | BI133: =RC[-12] -> 4524 | BJ133: =RC[-12] -> 2704 | BK133: =RC[-12] -> 7436 | BL133: =RC[-12] -> 3120 | BM133: =RC[-12] -> 1040
A134: 132 | B134: 叶二娘 | C134: 太极初传 | D134: 2 | F134: 139 | G134: 1 | H134: 1 | I134: 132 | K134: 云中鹤 | L134: 53 | M134: 4611 | N134: 2756 | O134: 7579 | P134: 3180 | Q134: 1060 | W134: 田伯光 | X134: =RC[-12] -> 53 | Y134: =RC[-12] -> 4611 | Z134: =RC[-12] -> 2756 | AA134: =RC[-12] -> 7579 | AB134: =RC[-12] -> 3180 | AC134: =RC[-12] -> 1060 | AI134: 岳老三 | AJ134: =RC[-12] -> 53 | AK134: =RC[-12] -> 4611 | AL134: =RC[-12] -> 2756 | AM134: =RC[-12] -> 7579 | AN134: =RC[-12] -> 3180 | AO134: =RC[-12] -> 1060 | AU134: 高升泰 | AV134: =RC[-12] -> 53 | AW134: =RC[-12] -> 4611 | AX134: =RC[-12] -> 2756 | AY134: =RC[-12] -> 7579 | AZ134: =RC[-12] -> 3180 | BA134: =RC[-12] -> 1060 | BG134: 叶二娘 | BH134: =RC[-12] -> 53 | BI134: =RC[-12] -> 4611 | BJ134: =RC[-12] -> 2756 | BK134: =RC[-12] -> 7579 | BL134: =RC[-12] -> 3180 | BM134: =RC[-12] -> 1060
A135: 133 | B135: 说不得 | C135: 太极初传 | D135: 3 | F135: 22 | G135: 1 | H135: 1 | I135: 133 | K135: 小昭 | L135: 53 | M135: 4611 | N135: 2756 | O135: 7579 | P135: 3180 | Q135: 1060 | W135: 费彬 | X135: =RC[-12] -> 53 | Y135: =RC[-12] -> 4611 | Z135: =RC[-12] -> 2756 | AA135: =RC[-12] -> 7579 | AB135: =RC[-12] -> 3180 | AC135: =RC[-12] -> 1060 | AI135: 刘正风 | AJ135: =RC[-12] -> 53 | AK135: =RC[-12] -> 4611 | AL135: =RC[-12] -> 2756 | AM135: =RC[-12] -> 7579 | AN135: =RC[-12] -> 3180 | AO135: =RC[-12] -> 1060 | AU135: 莫大先生 | AV135: =RC[-12] -> 53 | AW135: =RC[-12] -> 4611 | AX135: =RC[-12] -> 2756 | AY135: =RC[-12] -> 7579 | AZ135: =RC[-12] -> 3180 | BA135: =RC[-12] -> 1060 | BG135: 说不得 | BH135: =RC[-12] -> 53 | BI135: =RC[-12] -> 4611 | BJ135: =RC[-12] -> 2756 | BK135: =RC[-12] -> 7579 | BL135: =RC[-12] -> 3180 | BM135: =RC[-12] -> 1060
A136: 134 | B136: 王处一 | C136: 太极初传 | D136: 4 | F136: 82 | G136: 1 | H136: 1 | I136: 134 | K136: 秦红棉 | L136: 53 | M136: 4611 | N136: 2756 | O136: 7579 | P136: 3180 | Q136: 1060 | W136: 刀白凤 | X136: =RC[-12] -> 53 | Y136: =RC[-12] -> 4611 | Z136: =RC[-12] -> 2756 | AA136: =RC[-12] -> 7579 | AB136: =RC[-12] -> 3180 | AC136: =RC[-12] -> 1060 | AI136: 华赫艮 | AJ136: =RC[-12] -> 53 | AK136: =RC[-12] -> 4611 | AL136: =RC[-12] -> 2756 | AM136: =RC[-12] -> 7579 | AN136: =RC[-12] -> 3180 | AO136: =RC[-12] -> 1060 | AU136: 巴天石 | AV136: =RC[-12] -> 53 | AW136: =RC[-12] -> 4611 | AX136: =RC[-12] -> 2756 | AY136: =RC[-12] -> 7579 | AZ136: =RC[-12] -> 3180 | BA136: =RC[-12] -> 1060 | BG136: 王处一 | BH136: =RC[-12] -> 53 | BI136: =RC[-12] -> 4611 | BJ136: =RC[-12] -> 2756 | BK136: =RC[-12] -> 7579 | BL136: =RC[-12] -> 3180 | BM136: =RC[-12] -> 1060
A137: 135 | B137: 丘处机 | C137: 太极初传 | D137: 5 | F137: 82 | G137: 1 | H137: 1 | I137: 135 | K137: 莫声谷 | L137: 54 | M137: 4698 | N137: 2808 | O137: 7722 | P137: 3240 | Q137: 1080 | W137: 刘处玄 | X137: =RC[-12] -> 54 | Y137: =RC[-12] -> 4698 | Z137: =RC[-12] -> 2808 | AA137: =RC[-12] -> 7722 | AB137: =RC[-12] -> 3240 | AC137: =RC[-12] -> 1080 | AI137: 尹志平 | AJ137: =RC[-12] -> 54 | AK137: =RC[-12] -> 4698 | AL137: =RC[-12] -> 2808 | AM137: =RC[-12] -> 7722 | AN137: =RC[-12] -> 3240 | AO137: =RC[-12] -> 1080 | AU137: 王处一 | AV137: =RC[-12] -> 54 | AW137: =RC[-12] -> 4698 | AX137: =RC[-12] -> 2808 | AY137: =RC[-12] -> 7722 | AZ137: =RC[-12] -> 3240 | BA137: =RC[-12] -> 1080 | BG137: 丘处机 | BH137: =RC[-12] -> 54 | BI137: =RC[-12] -> 4698 | BJ137: =RC[-12] -> 2808 | BK137: =RC[-12] -> 7722 | BL137: =RC[-12] -> 3240 | BM137: =RC[-12] -> 1080
A138: 136 | B138: 刘处玄 | C138: 太极初传 | D138: 6 | F138: 82 | G138: 1 | H138: 1 | I138: 136 | K138: 定静师太 | L138: 54 | M138: 4698 | N138: 2808 | O138: 7722 | P138: 3240 | Q138: 1080 | W138: 定闲师太 | X138: =RC[-12] -> 54 | Y138: =RC[-12] -> 4698 | Z138: =RC[-12] -> 2808 | AA138: =RC[-12] -> 7722 | AB138: =RC[-12] -> 3240 | AC138: =RC[-12] -> 1080 | AI138: 丘处机 | AJ138: =RC[-12] -> 54 | AK138: =RC[-12] -> 4698 | AL138: =RC[-12] -> 2808 | AM138: =RC[-12] -> 7722 | AN138: =RC[-12] -> 3240 | AO138: =RC[-12] -> 1080 | AU138: 宁中则 | AV138: =RC[-12] -> 54 | AW138: =RC[-12] -> 4698 | AX138: =RC[-12] -> 2808 | AY138: =RC[-12] -> 7722 | AZ138: =RC[-12] -> 3240 | BA138: =RC[-12] -> 1080 | BG138: 刘处玄 | BH138: =RC[-12] -> 54 | BI138: =RC[-12] -> 4698 | BJ138: =RC[-12] -> 2808 | BK138: =RC[-12] -> 7722 | BL138: =RC[-12] -> 3240 | BM138: =RC[-12] -> 1080
A139: 137 | B139: 林远图 | C139: 太极初传 | D139: 7 | F139: 79 | G139: 1 | H139: 1 | I139: 137 | K139: 哑婆婆 | L139: 54 | M139: 4698 | N139: 2808 | O139: 7722 | P139: 3240 | Q139: 1080 | W139: 宁中则 | X139: =RC[-12] -> 54 | Y139: =RC[-12] -> 4698 | Z139: =RC[-12] -> 2808 | AA139: =RC[-12] -> 7722 | AB139: =RC[-12] -> 3240 | AC139: =RC[-12] -> 1080 | AI139: 田伯光 | AJ139: =RC[-12] -> 54 | AK139: =RC[-12] -> 4698 | AL139: =RC[-12] -> 2808 | AM139: =RC[-12] -> 7722 | AN139: =RC[-12] -> 3240 | AO139: =RC[-12] -> 1080 | AU139: 巴天石 | AV139: =RC[-12] -> 54 | AW139: =RC[-12] -> 4698 | AX139: =RC[-12] -> 2808 | AY139: =RC[-12] -> 7722 | AZ139: =RC[-12] -> 3240 | BA139: =RC[-12] -> 1080 | BG139: 林远图 | BH139: =RC[-12] -> 54 | BI139: =RC[-12] -> 4698 | BJ139: =RC[-12] -> 2808 | BK139: =RC[-12] -> 7722 | BL139: =RC[-12] -> 3240 | BM139: =RC[-12] -> 1080
A140: 138 | B140: 灭绝师太 | C140: 太极初传 | D140: 8 | F140: 117 | G140: 1 | H140: 1 | I140: 138 | K140: 邓百川 | L140: 55 | M140: 4785 | N140: 2860 | O140: 7865 | P140: 3300 | Q140: 1100 | W140: 定闲师太 | X140: =RC[-12] -> 55 | Y140: =RC[-12] -> 4785 | Z140: =RC[-12] -> 2860 | AA140: =RC[-12] -> 7865 | AB140: =RC[-12] -> 3300 | AC140: =RC[-12] -> 1100 | AI140: 平一指 | AJ140: =RC[-12] -> 55 | AK140: =RC[-12] -> 4785 | AL140: =RC[-12] -> 2860 | AM140: =RC[-12] -> 7865 | AN140: =RC[-12] -> 3300 | AO140: =RC[-12] -> 1100 | AU140: 定静师太 | AV140: =RC[-12] -> 55 | AW140: =RC[-12] -> 4785 | AX140: =RC[-12] -> 2860 | AY140: =RC[-12] -> 7865 | AZ140: =RC[-12] -> 3300 | BA140: =RC[-12] -> 1100 | BG140: 灭绝师太 | BH140: =RC[-12] -> 55 | BI140: =RC[-12] -> 4785 | BJ140: =RC[-12] -> 2860 | BK140: =RC[-12] -> 7865 | BL140: =RC[-12] -> 3300 | BM140: =RC[-12] -> 1100
A141: 139 | B141: 公孙止 | C141: 太极初传 | D141: 9 | F141: 133 | G141: 1 | H141: 1 | I141: 139 | K141: 平一指 | L141: 55 | M141: 4785 | N141: 2860 | O141: 7865 | P141: 3300 | Q141: 1100 | W141: 宁中则 | X141: =RC[-12] -> 55 | Y141: =RC[-12] -> 4785 | Z141: =RC[-12] -> 2860 | AA141: =RC[-12] -> 7865 | AB141: =RC[-12] -> 3300 | AC141: =RC[-12] -> 1100 | AI141: 林远图 | AJ141: =RC[-12] -> 55 | AK141: =RC[-12] -> 4785 | AL141: =RC[-12] -> 2860 | AM141: =RC[-12] -> 7865 | AN141: =RC[-12] -> 3300 | AO141: =RC[-12] -> 1100 | AU141: 高升泰 | AV141: =RC[-12] -> 55 | AW141: =RC[-12] -> 4785 | AX141: =RC[-12] -> 2860 | AY141: =RC[-12] -> 7865 | AZ141: =RC[-12] -> 3300 | BA141: =RC[-12] -> 1100 | BG141: 公孙止 | BH141: =RC[-12] -> 55 | BI141: =RC[-12] -> 4785 | BJ141: =RC[-12] -> 2860 | BK141: =RC[-12] -> 7865 | BL141: =RC[-12] -> 3300 | BM141: =RC[-12] -> 1100
A142: 140 | B142: 左冷禅 | C142: 太极初传 | D142: 10 | F142: 126 | G142: 1 | H142: 1 | I142: 140 | K142: 高升泰 | L142: 55 | M142: 4785 | N142: 2860 | O142: 7865 | P142: 3300 | Q142: 1100 | W142: 苦乘 | X142: =RC[-12] -> 55 | Y142: =RC[-12] -> 4785 | Z142: =RC[-12] -> 2860 | AA142: =RC[-12] -> 7865 | AB142: =RC[-12] -> 3300 | AC142: =RC[-12] -> 1100 | AI142: 费彬 | AJ142: =RC[-12] -> 55 | AK142: =RC[-12] -> 4785 | AL142: =RC[-12] -> 2860 | AM142: =RC[-12] -> 7865 | AN142: =RC[-12] -> 3300 | AO142: =RC[-12] -> 1100 | AU142: 包不同 | AV142: =RC[-12] -> 55 | AW142: =RC[-12] -> 4785 | AX142: =RC[-12] -> 2860 | AY142: =RC[-12] -> 7865 | AZ142: =RC[-12] -> 3300 | BA142: =RC[-12] -> 1100 | BG142: 左冷禅 | BH142: =RC[-12] -> 55 | BI142: =RC[-12] -> 4785 | BJ142: =RC[-12] -> 2860 | BK142: =RC[-12] -> 7865 | BL142: =RC[-12] -> 3300 | BM142: =RC[-12] -> 1100

Sheet: 怪物组队表old
A1: 组队ID | B1: 组队名称 | C1: 关卡ID | D1: 顺序 | E1: 音乐 | F1: 图片 | G1: 等级限制 | H1: 攻击次数 | I1: 奖励ID | J1: 阵法ID | K1: 0怪物ID | L1: 0怪物等级 | M1: 攻击修正0 | N1: 防御修正0 | O1: 生命修正0 | P1: 内力修正0 | Q1: 体力修正0 | R1: 武器ID0 | S1: 防具ID0 | T1: 饰品ID0 | U1: 技能专精0 | V1: 天赋激活0 | W1: 1怪物ID | X1: 1怪物等级 | Y1: 攻击修正1 | Z1: 防御修正1 | AA1: 生命修正1 | AB1: 内力修正1 | AC1: 体力修正1 | AD1: 武器ID1 | AE1: 防具ID1 | AF1: 饰品ID1 | AG1: 技能专精1 | AH1: 天赋激活1 | AI1: 2怪物ID | AJ1: 2怪物等级 | AK1: 攻击修正2 | AL1: 防御修正2 | AM1: 生命修正2 | AN1: 内力修正2 | AO1: 体力修正2 | AP1: 武器ID2 | AQ1: 防具ID2 | AR1: 饰品ID2 | AS1: 技能专精2 | AT1: 天赋激活2 | AU1: 3怪物ID | AV1: 3怪物等级 | AW1: 攻击修正3 | AX1: 防御修正3 | AY1: 生命修正3 | AZ1: 内力修正3 | BA1: 体力修正3 | BB1: 武器ID3 | BC1: 防具ID3 | BD1: 饰品ID3 | BE1: 技能专精3 | BF1: 天赋激活3 | BG1: 4怪物ID | BH1: 4怪物等级 | BI1: 攻击修正4 | BJ1: 防御修正4 | BK1: 生命修正4 | BL1: 内力修正4 | BM1: 体力修正4 | BN1: 武器ID4 | BO1: 防具ID4 | BP1: 饰品ID4 | BQ1: 技能专精4 | BR1: 天赋激活4 | BS1: 5怪物ID | BT1: 5怪物等级 | BU1: 攻击修正5 | BV1: 防御修正5 | BW1: 生命修正5 | BX1: 内力修正5 | BY1: 体力修正5 | BZ1: 武器ID5 | CA1: 防具ID5 | CB1: 饰品ID5 | CC1: 技能专精5 | CD1: 天赋激活5
A2: id | B2: name | C2: mission_id | D2: no | E2: back_music | F2: stage_img | G2: level_limit | H2: pass_num | I2: reward_id | J2: zhenfa_id | K2: monster_id0 | L2: monster_lvl0 | M2: attack_mod0 | N2: defence_mod0 | O2: hp_mod0 | P2: mp_mod0 | Q2: sp_mod0 | R2: weapon_id0 | S2: armor_id0 | T2: ornament_id0 | U2: skill_power0 | V2: talnet_0 | W2: monster_id1 | X2: monster_lvl1 | Y2: attack_mod1 | Z2: defence_mod1 | AA2: hp_mod1 | AB2: mp_mod1 | AC2: sp_mod1 | AD2: weapon_id1 | AE2: armor_id1 | AF2: ornament_id1 | AG2: skill_power1 | AH2: talnet_1 | AI2: monster_id2 | AJ2: monster_lvl2 | AK2: attack_mod2 | AL2: defence_mod2 | AM2: hp_mod2 | AN2: mp_mod2 | AO2: sp_mod2 | AP2: weapon_id2 | AQ2: armor_id2 | AR2: ornament_id2 | AS2: skill_power2 | AT2: talnet_2 | AU2: monster_id3 | AV2: monster_lvl3 | AW2: attack_mod3 | AX2: defence_mod3 | AY2: hp_mod3 | AZ2: mp_mod3 | BA2: sp_mod3 | BB2: weapon_id3 | BC2: armor_id3 | BD2: ornament_id3 | BE2: skill_power3 | BF2: talnet_3 | BG2: monster_id4 | BH2: monster_lvl4 | BI2: attack_mod4 | BJ2: defence_mod4 | BK2: hp_mod4 | BL2: mp_mod4 | BM2: sp_mod4 | BN2: weapon_id4 | BO2: armor_id4 | BP2: ornament_id4 | BQ2: skill_power4 | BR2: talnet_4 | BS2: monster_id5 | BT2: monster_lvl5 | BU2: attack_mod5 | BV2: defence_mod5 | BW2: hp_mod5 | BX2: mp_mod5 | BY2: sp_mod5 | BZ2: weapon_id5 | CA2: armor_id5 | CB2: ornament_id5 | CC2: skill_power5 | CD2: talnet_5
A3: 1 | B3: 长枪护卫 | C3: 叶三姐节烈 | D3: 1 | F3: 113 | G3: 1 | H3: 1 | I3: 1 | K3: 长枪护卫 | L3: 1
A4: 2 | B4: 长枪护使 | C4: 叶三姐节烈 | D4: 2 | F4: 113 | G4: 2 | H4: 1 | I4: 2 | K4: 长枪护使 | L4: 2
A5: 3 | B5: 叶三姐 | C5: 叶三姐节烈 | D5: 3 | F5: 106 | G5: 3 | H5: 1 | I5: 3 | K5: 叶三姐 | L5: 2 | M5: 56
A6: 4 | B6: 匿踪客 | C6: 雪夜邀客 | D6: 1 | F6: 70 | G6: 4 | H6: 1 | I6: 4 | K6: 匿踪客 | L6: 4 | M6: 61 | N6: 42
A7: 5 | B7: 完颜洪烈 | C7: 雪夜邀客 | D7: 2 | F7: 53 | G7: 5 | H7: 1 | I7: 5 | K7: 长枪护卫 | L7: 5 | M7: 67 | N7: 46 | W7: 完颜洪烈 | X7: 5 | Y7: 67 | Z7: 46
A8: 6 | B8: 郭啸天 | C8: 雪夜邀客 | D8: 3 | F8: 51 | G8: 6 | H8: 1 | I8: 6 | K8: 长枪护使 | L8: 6 | M8: 73 | N8: 51 | W8: 郭啸天 | X8: 6 | Y8: 73 | Z8: 51
A9: 7 | B9: 杨铁心 | C9: 雪夜邀客 | D9: 4 | F9: 56 | G9: 7 | H9: 1 | I9: 7 | K9: 匿踪客 | L9: 7 | M9: 80 | N9: 56 | W9: 杨铁心 | X9: 7 | Y9: 80 | Z9: 56
A10: 8 | B10: 丘处机 | C10: 雪夜邀客 | D10: 5 | F10: 82 | G10: 8 | H10: 1 | I10: 8 | K10: 丘处机 | L10: 8 | M10: 180 | N10: 60 | O10: 500 | P10: 86
A11: 9 | B11: 宽刀护使 | C11: 血洗牛家村 | D11: 1 | F11: 72 | G11: 9 | H11: 1 | I11: 9 | K11: 宽刀护卫 | L11: 9 | M11: 96 | N11: 96 | W11: 宽刀护使 | X11: 10 | Y11: 96 | Z11: 96
A12: 10 | B12: 包惜弱 | C12: 血洗牛家村 | D12: 2 | F12: 101 | G12: 10 | H12: 1 | I12: 10 | K12: 匿踪客 | L12: 10 | M12: 105 | N12: 105 | W12: 包惜弱 | X12: 11 | Y12: 105 | Z12: 105
A13: 11 | B13: 李萍 | C13: 血洗牛家村 | D13: 3 | F13: 106 | G13: 11 | H13: 1 | I13: 11 | K13: 长枪护卫 | L13: 11 | M13: 115 | N13: 115 | W13: 李萍 | X13: 12 | Y13: 115 | Z13: 115
A14: 12 | B14: 杨铁心 | C14: 血洗牛家村 | D14: 4 | F14: 51 | G14: 12 | H14: 1 | I14: 12 | K14: 长枪护使 | L14: 12 | M14: 126 | N14: 126 | W14: 杨铁心 | X14: 13 | Y14: 126 | Z14: 126
A15: 13 | B15: 段天德 | C15: 血洗牛家村 | D15: 5 | F15: 72 | G15: 13 | H15: 1 | I15: 13 | K15: 宽刀护使 | L15: 13 | M15: 137 | N15: 138 | W15: 段天德 | X15: 14 | Y15: 137 | Z15: 138
A16: 14 | B16: 完颜洪烈 | C16: 血洗牛家村 | D16: 6 | F16: 53 | G16: 14 | H16: 1 | I16: 14 | K16: 完颜洪烈 | L16: 15 | M16: 149 | N16: 150 | O16: 500 | P16: 144
A17: 15 | B17: 嗜毒女 | C17: 乔装遭遇 | D17: 1 | F17: 95 | G17: 15 | H17: 1 | I17: 15 | K17: 宽刀护卫 | L17: 15 | M17: 163 | N17: 163 | W17: 宽刀护使 | X17: 15 | Y17: 295 | Z17: 115 | AI17: 匿踪客 | AJ17: 15 | AK17: 300 | AL17: 118 | AU17: 嗜毒女 | AV17: 15 | AW17: 305 | AX17: 121
A18: 16 | B18: 巨力士 | C18: 乔装遭遇 | D18: 2 | F18: 28 | G18: 15 | H18: 1 | I18: 16 | K18: 长枪护卫 | L18: 15 | M18: 178 | N18: 178 | W18: 长枪护使 | X18: 15 | Y18: 330 | Z18: 136 | AI18: 嗜毒女 | AJ18: 15 | AK18: 335 | AL18: 139 | AU18: 巨力士 | AV18: 16 | AW18: 340 | AX18: 142
A19: 17 | B19: 马夫 | C19: 乔装遭遇 | D19: 3 | F19: 2 | G19: 16 | H19: 1 | I19: 17 | K19: 嗜毒女 | L19: 16 | M19: 194 | N19: 194 | W19: 嗜毒女 | X19: 16 | Y19: 365 | Z19: 157 | AI19: 巨力士 | AJ19: 16 | AK19: 370 | AL19: 160 | AU19: 马夫 | AV19: 17 | AW19: 375 | AX19: 163
A20: 18 | B20: 宽刀护卫 | C20: 乔装遭遇 | D20: 4 | F20: 109 | G20: 16 | H20: 1 | I20: 18 | K20: 长枪护卫 | L20: 16 | M20: 211 | N20: 211 | W20: 长枪护使 | X20: 16 | Y20: 400 | Z20: 178 | AI20: 宽刀护卫 | AJ20: 16 | AK20: 405 | AL20: 181 | AU20: 宽刀护使 | AV20: 17 | AW20: 410 | AX20: 184
A21: 19 | B21: 店小二 | C21: 乔装遭遇 | D21: 5 | F21: 1 | G21: 17 | H21: 1 | I21: 19 | K21: 巨力士 | L21: 17 | M21: 230 | N21: 230 | W21: 巨力士 | X21: 17 | Y21: 435 | Z21: 199 | AI21: 嗜毒女 | AJ21: 17 | AK21: 440 | AL21: 202 | AU21: 店小二 | AV21: 18 | AW21: 445 | AX21: 205
A22: 20 | B22: 完颜洪烈 | C22: 乔装遭遇 | D22: 6 | F22: 53 | G22: 17 | H22: 1 | I22: 20 | K22: 完颜洪烈 | L22: 18 | M22: 250 | N22: 250 | O22: 1000 | P22: 239
A23: 21 | B23: 韩小莹 | C23: 醉仙斗酒 | D23: 1 | F23: 107 | G23: 18 | H23: 1 | I23: 21 | K23: 长枪护卫 | L23: 18 | M23: 331 | N23: 196 | O23: 624 | P23: 131 | Q23: 43 | W23: 长枪护使 | X23: 18 | Y23: 331 | Z23: 196 | AA23: 624 | AB23: 131 | AC23: 43 | AI23: 匿踪客 | AJ23: 18 | AK23: 331 | AL23: 196 | AM23: 624 | AN23: 131 | AO23: 43 | AU23: 匿踪客 | AV23: 18 | AW23: 331 | AX23: 196 | AY23: 624 | AZ23: 131 | BA23: 43 | BG23: 韩小莹 | BH23: 19 | BI23: 110 | BJ23: 331 | BK23: 196 | BL23: 624 | BM23: 131
A24: 22 | B24: 全金发 | C24: 醉仙斗酒 | D24: 2 | F24: 6 | G24: 18 | H24: 1 | I24: 22 | K24: 嗜毒女 | L24: 18 | M24: 360 | N24: 214 | O24: 648 | P24: 144 | Q24: 46 | W24: 嗜毒女 | X24: 18 | Y24: 360 | Z24: 214 | AA24: 648 | AB24: 144 | AC24: 46 | AI24: 巨力士 | AJ24: 18 | AK24: 360 | AL24: 214 | AM24: 648 | AN24: 144 | AO24: 46 | AU24: 巨力士 | AV24: 18 | AW24: 360 | AX24: 214 | AY24: 648 | AZ24: 144 | BA24: 46 | BG24: 全金发 | BH24: 19 | BI24: 117 | BJ24: 360 | BK24: 214 | BL24: 648 | BM24: 144
A25: 23 | B25: 张阿生 | C25: 醉仙斗酒 | D25: 3 | F25: 145 | G25: 19 | H25: 1 | I25: 23 | K25: 宽刀护卫 | L25: 19 | M25: 392 | N25: 233 | O25: 673 | P25: 151 | Q25: 50 | W25: 宽刀护卫 | X25: 19 | Y25: 392 | Z25: 233 | AA25: 673 | AB25: 151 | AC25: 50 | AI25: 宽刀护卫 | AJ25: 19 | AK25: 392 | AL25: 233 | AM25: 673 | AN25: 151 | AO25: 50 | AU25: 匿踪客 | AV25: 19 | AW25: 392 | AX25: 233 | AY25: 673 | AZ25: 151 | BA25: 50 | BG25: 张阿生 | BH25: 20 | BI25: 125 | BJ25: 392 | BK25: 233 | BL25: 673 | BM25: 151
A26: 24 | B26: 南希仁 | C26: 醉仙斗酒 | D26: 4 | F26: 14 | G26: 19 | H26: 1 | I26: 24 | K26: 马夫 | L26: 19 | M26: 427 | N26: 254 | O26: 699 | P26: 158 | Q26: 54 | W26: 马夫 | X26: 19 | Y26: 427 | Z26: 254 | AA26: 699 | AB26: 158 | AC26: 54 | AI26: 宽刀护卫 | AJ26: 19 | AK26: 427 | AL26: 254 | AM26: 699 | AN26: 158 | AO26: 54 | AU26: 匿踪客 | AV26: 19 | AW26: 427 | AX26: 254 | AY26: 699 | AZ26: 158 | BA26: 54 | BG26: 南希仁 | BH26: 20 | BI26: 133 | BJ26: 427 | BK26: 254 | BL26: 699 | BM26: 158
A27: 25 | B27: 朱聪 | C27: 醉仙斗酒 | D27: 5 | F27: 18 | G27: 20 | H27: 1 | I27: 25 | K27: 嗜毒女 | L27: 20 | M27: 465 | N27: 277 | O27: 726 | P27: 165 | Q27: 58 | W27: 匿踪客 | X27: 20 | Y27: 465 | Z27: 277 | AA27: 726 | AB27: 165 | AC27: 58 | AI27: 马夫 | AJ27: 20 | AK27: 465 | AL27: 277 | AM27: 726 | AN27: 165 | AO27: 58 | AU27: 匿踪客 | AV27: 20 | AW27: 465 | AX27: 277 | AY27: 726 | AZ27: 165 | BA27: 58 | BG27: 朱聪 | BH27: 21 | BI27: 142 | BJ27: 465 | BK27: 277 | BL27: 726 | BM27: 165
A28: 26 | B28: 柯镇恶 | C28: 醉仙斗酒 | D28: 6 | F28: 66 | G28: 20 | H28: 1 | I28: 26 | K28: 匿踪客 | L28: 20 | M28: 506 | N28: 302 | O28: 755 | P28: 173 | Q28: 63 | W28: 长枪护卫 | X28: 20 | Y28: 506 | Z28: 302 | AA28: 755 | AB28: 173 | AC28: 63 | AI28: 嗜毒女 | AJ28: 20 | AK28: 506 | AL28: 302 | AM28: 755 | AN28: 173 | AO28: 63 | AU28: 匿踪客 | AV28: 20 | AW28: 506 | AX28: 302 | AY28: 755 | AZ28: 173 | BA28: 63 | BG28: 柯镇恶 | BH28: 21 | BI28: 151 | BJ28: 506 | BK28: 302 | BL28: 755 | BM28: 173
A29: 27 | B29: 丘处机 | C29: 醉仙斗酒 | D29: 7 | F29: 82 | G29: 21 | H29: 1 | I29: 27 | K29: 丘处机 | L29: 22 | M29: 550 | N29: 329 | O29: 4000 | P29: 972 | Q29: 324
A30: 28 | B30: 小沙尼 | C30: 约赌法华寺 | D30: 1 | F30: 105 | G30: 21 | H30: 1 | I30: 28 | K30: 嗜毒女 | L30: 21 | M30: 561 | N30: 335 | O30: 816 | P30: 198 | Q30: 66 | W30: 嗜毒女 | X30: 21 | Y30: 561 | Z30: 335 | AA30: 816 | AB30: 198 | AC30: 66 | AI30: 嗜毒女 | AJ30: 21 | AK30: 561 | AL30: 335 | AM30: 816 | AN30: 198 | AO30: 66 | AU30: 嗜毒女 | AV30: 21 | AW30: 561 | AX30: 335 | AY30: 816 | AZ30: 198 | BA30: 66 | BG30: 小沙尼 | BH30: 22 | BI30: 561 | BJ30: 335 | BK30: 816 | BL30: 198 | BM30: 66
A31: 29 | B31: 宽刀护卫 | C31: 约赌法华寺 | D31: 2 | F31: 109 | G31: 21 | H31: 1 | I31: 29 | K31: 宽刀护卫 | L31: 21 | M31: 572 | N31: 341 | O31: 832 | P31: 201 | Q31: 67 | W31: 宽刀护卫 | X31: 21 | Y31: 572 | Z31: 341 | AA31: 832 | AB31: 201 | AC31: 67 | AI31: 宽刀护使 | AJ31: 21 | AK31: 572 | AL31: 341 | AM31: 832 | AN31: 201 | AO31: 67 | AU31: 宽刀护使 | AV31: 21 | AW31: 572 | AX31: 341 | AY31: 832 | AZ31: 201 | BA31: 67 | BG31: 宽刀护使 | BH31: 22 | BI31: 572 | BJ31: 341 | BK31: 832 | BL31: 201 | BM31: 67
A32: 30 | B32: 段天德 | C32: 约赌法华寺 | D32: 3 | F32: 72 | G32: 22 | H32: 1 | I32: 30 | K32: 宽刀护卫 | L32: 22 | M32: 583 | N32: 347 | O32: 848 | P32: 205 | Q32: 68 | W32: 宽刀护卫 | X32: 22 | Y32: 583 | Z32: 347 | AA32: 848 | AB32: 205 | AC32: 68 | AI32: 宽刀护使 | AJ32: 22 | AK32: 583 | AL32: 347 | AM32: 848 | AN32: 205 | AO32: 68 | AU32: 宽刀护使 | AV32: 22 | AW32: 583 | AX32: 347 | AY32: 848 | AZ32: 205 | BA32: 68 | BG32: 段天德 | BH32: 23 | BI32: 583 | BJ32: 347 | BK32: 848 | BL32: 205 | BM32: 68
A33: 31 | B33: 枯木大师 | C33: 约赌法华寺 | D33: 4 | F33: 25 | G33: 22 | H33: 1 | I33: 31 | K33: 匿踪客 | L33: 22 | M33: 594 | N33: 353 | O33: 864 | P33: 209 | Q33: 69 | W33: 匿踪客 | X33: 22 | Y33: 594 | Z33: 353 | AA33: 864 | AB33: 209 | AC33: 69 | AI33: 嗜毒女 | AJ33: 22 | AK33: 594 | AL33: 353 | AM33: 864 | AN33: 209 | AO33: 69 | AU33: 巨力士 | AV33: 22 | AW33: 594 | AX33: 353 | AY33: 864 | AZ33: 209 | BA33: 69 | BG33: 枯木大师 | BH33: 23 | BI33: 594 | BJ33: 353 | BK33: 864 | BL33: 209 | BM33: 69
A34: 32 | B34: 焦木大师 | C34: 约赌法华寺 | D34: 5 | F34: 26 | G34: 22 | H34: 1 | I34: 32 | K34: 匿踪客 | L34: 22 | M34: 605 | N34: 360 | O34: 881 | P34: 213 | Q34: 70 | W34: 匿踪客 | X34: 22 | Y34: 605 | Z34: 360 | AA34: 881 | AB34: 213 | AC34: 70 | AI34: 嗜毒女 | AJ34: 22 | AK34: 605 | AL34: 360 | AM34: 881 | AN34: 213 | AO34: 70 | AU34: 巨力士 | AV34: 22 | AW34: 605 | AX34: 360 | AY34: 881 | AZ34: 213 | BA34: 70 | BG34: 焦木大师 | BH34: 23 | BI34: 605 | BJ34: 360 | BK34: 881 | BL34: 213 | BM34: 70
A35: 33 | B35: 南希仁 | C35: 约赌法华寺 | D35: 6 | F35: 14 | G35: 23 | H35: 1 | I35: 33 | K35: 嗜毒女 | L35: 23 | M35: 617 | N35: 367 | O35: 898 | P35: 217 | Q35: 71 | W35: 长枪护使 | X35: 23 | Y35: 617 | Z35: 367 | AA35: 898 | AB35: 217 | AC35: 71 | AI35: 匿踪客 | AJ35: 23 | AK35: 617 | AL35: 367 | AM35: 898 | AN35: 217 | AO35: 71 | AU35: 巨力士 | AV35: 23 | AW35: 617 | AX35: 367 | AY35: 898 | AZ35: 217 | BA35: 71 | BG35: 南希仁 | BH35: 23 | BI35: 617 | BJ35: 367 | BK35: 898 | BL35: 217 | BM35: 71
A36: 34 | B36: 朱聪 | C36: 约赌法华寺 | D36: 7 | F36: 18 | G36: 23 | H36: 1 | I36: 34 | K36: 嗜毒女 | L36: 23 | M36: 629 | N36: 374 | O36: 915 | P36: 221 | Q36: 72 | W36: 长枪护使 | X36: 23 | Y36: 629 | Z36: 374 | AA36: 915 | AB36: 221 | AC36: 72 | AI36: 巨力士 | AJ36: 23 | AK36: 629 | AL36: 374 | AM36: 915 | AN36: 221 | AO36: 72 | AU36: 嗜毒女 | AV36: 23 | AW36: 629 | AX36: 374 | AY36: 915 | AZ36: 221 | BA36: 72 | BG36: 朱聪 | BH36: 24 | BI36: 629 | BJ36: 374 | BK36: 915 | BL36: 221 | BM36: 72
A37: 35 | B37: 柯镇恶 | C37: 约赌法华寺 | D37: 8 | F37: 66 | G37: 23 | H37: 1 | I37: 35 | K37: 嗜毒女 | L37: 23 | M37: 641 | N37: 381 | O37: 933 | P37: 225 | Q37: 73 | W37: 长枪护使 | X37: 23 | Y37: 641 | Z37: 381 | AA37: 933 | AB37: 225 | AC37: 73 | AI37: 巨力士 | AJ37: 23 | AK37: 641 | AL37: 381 | AM37: 933 | AN37: 225 | AO37: 73 | AU37: 嗜毒女 | AV37: 23 | AW37: 641 | AX37: 381 | AY37: 933 | AZ37: 225 | BA37: 73 | BG37: 柯镇恶 | BH37: 24 | BI37: 641 | BJ37: 381 | BK37: 933 | BL37: 225 | BM37: 73
A38: 36 | B38: 丘处机 | C38: 约赌法华寺 | D38: 9 | F38: 82 | G38: 24 | H38: 1 | I38: 36 | K38: 丘处机 | L38: 25 | M38: 826 | N38: 494 | O38: 4632 | P38: 1944 | Q38: 648
A39: 37 | B39: 婉儿 | C39: 酒馆结怨 | D39: 1 | F39: 107 | G39: 24 | H39: 1 | I39: 37 | K39: 巨力士 | L39: 24 | M39: 834 | N39: 498 | O39: 935 | P39: 392 | Q39: 130 | W39: 巨力士 | X39: 24 | Y39: 834 | Z39: 498 | AA39: 935 | AB39: 392 | AC39: 130 | AI39: 嗜毒女 | AJ39: 25 | AK39: 834 | AL39: 498 | AM39: 935 | AN39: 392 | AO39: 130 | AU39: 嗜毒女 | AV39: 25 | AW39: 834 | AX39: 498 | AY39: 935 | AZ39: 392 | BA39: 130 | BG39: 婉儿 | BH39: 25 | BI39: 834 | BJ39: 498 | BK39: 935 | BL39: 392 | BM39: 130
A40: 38 | B40: 撒老头 | C40: 酒馆结怨 | D40: 2 | F40: 41 | G40: 24 | H40: 1 | I40: 38 | K40: 巨力士 | L40: 24 | M40: 842 | N40: 502 | O40: 944 | P40: 395 | Q40: 131 | W40: 嗜毒女 | X40: 24 | Y40: 842 | Z40: 502 | AA40: 944 | AB40: 395 | AC40: 131 | AI40: 巨力士 | AJ40: 25 | AK40: 842 | AL40: 502 | AM40: 944 | AN40: 395 | AO40: 131 | AU40: 嗜毒女 | AV40: 25 | AW40: 842 | AX40: 502 | AY40: 944 | AZ40: 395 | BA40: 131 | BG40: 撒老头 | BH40: 25 | BI40: 842 | BJ40: 502 | BK40: 944 | BL40: 395 | BM40: 131
A41: 39 | B41: 白二 | C41: 酒馆结怨 | D41: 3 | F41: 1 | G41: 24 | H41: 1 | I41: 39 | K41: 巨力士 | L41: 25 | M41: 850 | N41: 507 | O41: 953 | P41: 398 | Q41: 132 | W41: 嗜毒女 | X41: 25 | Y41: 850 | Z41: 507 | AA41: 953 | AB41: 398 | AC41: 132 | AI41: 宽刀护卫 | AJ41: 25 | AK41: 850 | AL41: 507 | AM41: 953 | AN41: 398 | AO41: 132 | AU41: 撒老头 | AV41: 25 | AW41: 850 | AX41: 507 | AY41: 953 | AZ41: 398 | BA41: 132 | BG41: 白二 | BH41: 25 | BI41: 850 | BJ41: 507 | BK41: 953 | BL41: 398 | BM41: 132
A42: 40 | B42: 陈七 | C42: 酒馆结怨 | D42: 4 | F42: 2 | G42: 25 | H42: 1 | I42: 40 | K42: 店小二 | L42: 25 | M42: 858 | N42: 512 | O42: 962 | P42: 401 | Q42: 133 | W42: 婉儿 | X42: 25 | Y42: 858 | Z42: 512 | AA42: 962 | AB42: 401 | AC42: 133 | AI42: 撒老头 | AJ42: 25 | AK42: 858 | AL42: 512 | AM42: 962 | AN42: 401 | AO42: 133 | AU42: 白二 | AV42: 25 | AW42: 858 | AX42: 512 | AY42: 962 | AZ42: 401 | BA42: 133 | BG42: 陈七 | BH42: 25 | BI42: 858 | BJ42: 512 | BK42: 962 | BL42: 401 | BM42: 133
A43: 41 | B43: 郑镖头 | C43: 酒馆结怨 | D43: 5 | F43: 8 | G43: 25 | H43: 1 | I43: 41 | K43: 御甲师 | L43: 25 | M43: 866 | N43: 517 | O43: 971 | P43: 405 | Q43: 134 | W43: 嗜毒女 | X43: 25 | Y43: 866 | Z43: 517 | AA43: 971 | AB43: 405 | AC43: 134 | AI43: 御甲师 | AJ43: 25 | AK43: 866 | AL43: 517 | AM43: 971 | AN43: 405 | AO43: 134 | AU43: 匿踪客 | AV43: 25 | AW43: 866 | AX43: 517 | AY43: 971 | AZ43: 405 | BA43: 134 | BG43: 郑镖头 | BH43: 26 | BI43: 866 | BJ43: 517 | BK43: 971 | BL43: 405 | BM43: 134
A44: 42 | B44: 史镖头 | C44: 酒馆结怨 | D44: 6 | F44: 8 | G44: 25 | H44: 1 | I44: 42 | K44: 御甲师 | L44: 25 | M44: 874 | N44: 522 | O44: 980 | P44: 409 | Q44: 135 | W44: 巨力士 | X44: 25 | Y44: 874 | Z44: 522 | AA44: 980 | AB44: 409 | AC44: 135 | AI44: 御甲师 | AJ44: 25 | AK44: 874 | AL44: 522 | AM44: 980 | AN44: 409 | AO44: 135 | AU44: 郑镖头 | AV44: 26 | AW44: 874 | AX44: 522 | AY44: 980 | AZ44: 409 | BA44: 135 | BG44: 史镖头 | BH44: 25 | BI44: 874 | BJ44: 522 | BK44: 980 | BL44: 409 | BM44: 135
A45: 43 | B45: 余人严 | C45: 酒馆结怨 | D45: 7 | F45: 12 | G45: 25 | H45: 1 | I45: 43 | K45: 青城弟子 | L45: 25 | M45: 882 | N45: 527 | O45: 989 | P45: 413 | Q45: 136 | W45: 宽刀护使 | X45: 25 | Y45: 882 | Z45: 527 | AA45: 989 | AB45: 413 | AC45: 136 | AI45: 宽刀护使 | AJ45: 25 | AK45: 882 | AL45: 527 | AM45: 989 | AN45: 413 | AO45: 136 | AU45: 青城弟子 | AV45: 25 | AW45: 882 | AX45: 527 | AY45: 989 | AZ45: 413 | BA45: 136 | BG45: 余人严 | BH45: 26 | BI45: 882 | BJ45: 527 | BK45: 989 | BL45: 413 | BM45: 136
A46: 44 | B46: 贾人达 | C46: 酒馆结怨 | D46: 8 | F46: 13 | G46: 26 | H46: 1 | I46: 44 | K46: 青城弟子 | L46: 26 | M46: 890 | N46: 532 | O46: 998 | P46: 417 | Q46: 137 | W46: 宽刀护使 | X46: 26 | Y46: 890 | Z46: 532 | AA46: 998 | AB46: 417 | AC46: 137 | AI46: 宽刀护使 | AJ46: 26 | AK46: 890 | AL46: 532 | AM46: 998 | AN46: 417 | AO46: 137 | AU46: 青城弟子 | AV46: 26 | AW46: 890 | AX46: 532 | AY46: 998 | AZ46: 417 | BA46: 137 | BG46: 贾人达 | BH46: 27 | BI46: 890 | BJ46: 532 | BK46: 998 | BL46: 417 | BM46: 137
A47: 45 | B47: 林平之 | C47: 酒馆结怨 | D47: 9 | F47: 14 | G47: 26 | H47: 1 | I47: 45 | K47: 林平之 | L47: 27 | M47: 918 | N47: 549 | O47: 5148 | P47: 2160 | Q47: 720
A48: 46 | B48: 白二 | C48: 武馆命案 | D48: 1 | F48: 1 | G48: 26 | H48: 1 | I48: 46 | K48: 御甲师 | L48: 26 | M48: 927 | N48: 554 | O48: 1039 | P48: 436 | Q48: 145 | W48: 嗜毒女 | X48: 26 | Y48: 927 | Z48: 554 | AA48: 1039 | AB48: 436 | AC48: 145 | AI48: 巨力士 | AJ48: 26 | AK48: 927 | AL48: 554 | AM48: 1039 | AN48: 436 | AO48: 145 | AU48: 御甲师 | AV48: 26 | AW48: 927 | AX48: 554 | AY48: 1039 | AZ48: 436 | BA48: 145 | BG48: 白二 | BH48: 27 | BI48: 927 | BJ48: 554 | BK48: 1039 | BL48: 436 | BM48: 145
A49: 47 | B49: 陈七 | C49: 武馆命案 | D49: 2 | F49: 2 | G49: 26 | H49: 1 | I49: 47 | K49: 御甲师 | L49: 26 | M49: 936 | N49: 559 | O49: 1049 | P49: 440 | Q49: 146 | W49: 嗜毒女 | X49: 26 | Y49: 936 | Z49: 559 | AA49: 1049 | AB49: 440 | AC49: 146 | AI49: 巨力士 | AJ49: 26 | AK49: 936 | AL49: 559 | AM49: 1049 | AN49: 440 | AO49: 146 | AU49: 御甲师 | AV49: 26 | AW49: 936 | AX49: 559 | AY49: 1049 | AZ49: 440 | BA49: 146 | BG49: 陈七 | BH49: 27 | BI49: 936 | BJ49: 559 | BK49: 1049 | BL49: 440 | BM49: 146
A50: 48 | B50: 史镖头 | C50: 武馆命案 | D50: 3 | F50: 8 | G50: 27 | H50: 1 | I50: 48 | K50: 御甲师 | L50: 27 | M50: 945 | N50: 564 | O50: 1059 | P50: 444 | Q50: 147 | W50: 巨力士 | X50: 27 | Y50: 945 | Z50: 564 | AA50: 1059 | AB50: 444 | AC50: 147 | AI50: 宽刀护使 | AJ50: 27 | AK50: 945 | AL50: 564 | AM50: 1059 | AN50: 444 | AO50: 147 | AU50: 御甲师 | AV50: 27 | AW50: 945 | AX50: 564 | AY50: 1059 | AZ50: 444 | BA50: 147 | BG50: 郑镖头 | BH50: 27 | BI50: 945 | BJ50: 564 | BK50: 1059 | BL50: 444 | BM50: 147
A51: 49 | B51: 郑镖头 | C51: 武馆命案 | D51: 4 | F51: 8 | G51: 27 | H51: 1 | I51: 49 | K51: 御甲师 | L51: 27 | M51: 954 | N51: 569 | O51: 1069 | P51: 448 | Q51: 148 | W51: 巨力士 | X51: 27 | Y51: 954 | Z51: 569 | AA51: 1069 | AB51: 448 | AC51: 148 | AI51: 宽刀护使 | AJ51: 27 | AK51: 954 | AL51: 569 | AM51: 1069 | AN51: 448 | AO51: 148 | AU51: 御甲师 | AV51: 27 | AW51: 954 | AX51: 569 | AY51: 1069 | AZ51: 448 | BA51: 148 | BG51: 史镖头 | BH51: 28 | BI51: 954 | BJ51: 569 | BK51: 1069 | BL51: 448 | BM51: 148
A52: 50 | B52: 林平之 | C52: 武馆命案 | D52: 5 | F52: 14 | G52: 27 | H52: 1 | I52: 50 | K52: 御甲师 | L52: 27 | M52: 963 | N52: 574 | O52: 1079 | P52: 452 | Q52: 149 | W52: 宽刀护使 | X52: 27 | Y52: 963 | Z52: 574 | AA52: 1079 | AB52: 452 | AC52: 149 | AI52: 嗜毒女 | AJ52: 27 | AK52: 963 | AL52: 574 | AM52: 1079 | AN52: 452 | AO52: 149 | AU52: 御甲师 | AV52: 27 | AW52: 963 | AX52: 574 | AY52: 1079 | AZ52: 452 | BA52: 149 | BG52: 林平之 | BH52: 28 | BI52: 963 | BJ52: 574 | BK52: 1079 | BL52: 452 | BM52: 149
A53: 51 | B53: 王夫人 | C53: 武馆命案 | D53: 6 | F53: 86 | G53: 27 | H53: 1 | I53: 51 | K53: 御甲师 | L53: 27 | M53: 972 | N53: 579 | O53: 1089 | P53: 456 | Q53: 150 | W53: 宽刀护使 | X53: 27 | Y53: 972 | Z53: 579 | AA53: 1089 | AB53: 456 | AC53: 150 | AI53: 嗜毒女 | AJ53: 27 | AK53: 972 | AL53: 579 | AM53: 1089 | AN53: 456 | AO53: 150 | AU53: 御甲师 | AV53: 27 | AW53: 972 | AX53: 579 | AY53: 1089 | AZ53: 456 | BA53: 150 | BG53: 王夫人 | BH53: 28 | BI53: 972 | BJ53: 579 | BK53: 1089 | BL53: 456 | BM53: 150
A54: 52 | B54: 林震南 | C54: 武馆命案 | D54: 7 | F54: 78 | G54: 28 | H54: 1 | I54: 52 | K54: 林震南 | L54: 28 | M54: 1101 | N54: 658 | O54: 6176 | P54: 2592 | Q54: 864
A55: 53 | B55: 青城弟子 | C55: 惨遭围剿 | D55: 1 | F55: 111 | G55: 28 | H55: 1 | I55: 53 | K55: 巨力士 | L55: 28 | M55: 1112 | N55: 664 | O55: 1247 | P55: 523 | Q55: 174 | W55: 巨力士 | X55: 28 | Y55: 1112 | Z55: 664 | AA55: 1247 | AB55: 523 | AC55: 174 | AI55: 嗜毒女 | AJ55: 28 | AK55: 1112 | AL55: 664 | AM55: 1247 | AN55: 523 | AO55: 174 | AU55: 青城弟子 | AV55: 28 | AW55: 1112 | AX55: 664 | AY55: 1247 | AZ55: 523 | BA55: 174 | BG55: 青城弟子 | BH55: 28 | BI55: 1112 | BJ55: 664 | BK55: 1247 | BL55: 523 | BM55: 174
A56: 54 | B56: 狂刀汉 | C56: 惨遭围剿 | D56: 2 | F56: 59 | G56: 28 | H56: 1 | I56: 54 | K56: 匿踪客 | L56: 28 | M56: 1123 | N56: 670 | O56: 1259 | P56: 528 | Q56: 175 | W56: 匿踪客 | X56: 28 | Y56: 1123 | Z56: 670 | AA56: 1259 | AB56: 528 | AC56: 175 | AI56: 狂刀汉 | AJ56: 28 | AK56: 1123 | AL56: 670 | AM56: 1259 | AN56: 528 | AO56: 175 | AU56: 狂刀汉 | AV56: 28 | AW56: 1123 | AX56: 670 | AY56: 1259 | AZ56: 528 | BA56: 175 | BG56: 狂刀汉 | BH56: 28 | BI56: 1123 | BJ56: 670 | BK56: 1259 | BL56: 528 | BM56: 175
A57: 55 | B57: 御甲师 | C57: 惨遭围剿 | D57: 3 | F57: 7 | G57: 28 | H57: 1 | I57: 55 | K57: 巨力士 | L57: 28 | M57: 1134 | N57: 676 | O57: 1271 | P57: 533 | Q57: 176 | W57: 巨力士 | X57: 28 | Y57: 1134 | Z57: 676 | AA57: 1271 | AB57: 533 | AC57: 176 | AI57: 匿踪客 | AJ57: 28 | AK57: 1134 | AL57: 676 | AM57: 1271 | AN57: 533 | AO57: 176 | AU57: 嗜毒女 | AV57: 28 | AW57: 1134 | AX57: 676 | AY57: 1271 | AZ57: 533 | BA57: 176 | BG57: 御甲师 | BH57: 28 | BI57: 1134 | BJ57: 676 | BK57: 1271 | BL57: 533 | BM57: 176
A58: 56 | B58: 霍镖头 | C58: 惨遭围剿 | D58: 4 | F58: 11 | G58: 29 | H58: 1 | I58: 56 | K58: 御甲师 | L58: 29 | M58: 1145 | N58: 682 | O58: 1283 | P58: 538 | Q58: 177 | W58: 御甲师 | X58: 29 | Y58: 1145 | Z58: 682 | AA58: 1283 | AB58: 538 | AC58: 177 | AI58: 狂刀汉 | AJ58: 29 | AK58: 1145 | AL58: 682 | AM58: 1283 | AN58: 538 | AO58: 177 | AU58: 狂刀汉 | AV58: 29 | AW58: 1145 | AX58: 682 | AY58: 1283 | AZ58: 538 | BA58: 177 | BG58: 霍镖头 | BH58: 30 | BI58: 1145 | BJ58: 682 | BK58: 1283 | BL58: 538 | BM58: 177
A59: 57 | B59: 林平之 | C59: 惨遭围剿 | D59: 5 | F59: 14 | G59: 29 | H59: 1 | I59: 57 | K59: 狂刀汉 | L59: 29 | M59: 1156 | N59: 688 | O59: 1295 | P59: 543 | Q59: 178 | W59: 狂刀汉 | X59: 29 | Y59: 1156 | Z59: 688 | AA59: 1295 | AB59: 543 | AC59: 178 | AI59: 御甲师 | AJ59: 29 | AK59: 1156 | AL59: 688 | AM59: 1295 | AN59: 543 | AO59: 178 | AU59: 御甲师 | AV59: 29 | AW59: 1156 | AX59: 688 | AY59: 1295 | AZ59: 543 | BA59: 178 | BG59: 林平之 | BH59: 30 | BI59: 1156 | BJ59: 688 | BK59: 1295 | BL59: 543 | BM59: 178
A60: 58 | B60: 王夫人 | C60: 惨遭围剿 | D60: 6 | F60: 86 | G60: 29 | H60: 1 | I60: 58 | K60: 狂刀汉 | L60: 29 | M60: 1167 | N60: 694 | O60: 1307 | P60: 548 | Q60: 179 | W60: 御甲师 | X60: 29 | Y60: 1167 | Z60: 694 | AA60: 1307 | AB60: 548 | AC60: 179 | AI60: 霍镖头 | AJ60: 29 | AK60: 1167 | AL60: 694 | AM60: 1307 | AN60: 548 | AO60: 179 | AU60: 林平之 | AV60: 29 | AW60: 1167 | AX60: 694 | AY60: 1307 | AZ60: 548 | BA60: 179 | BG60: 王夫人 | BH60: 30 | BI60: 1167 | BJ60: 694 | BK60: 1307 | BL60: 548 | BM60: 179
A61: 59 | B61: 林震南 | C61: 惨遭围剿 | D61: 7 | F61: 78 | G61: 29 | H61: 1 | I61: 59 | K61: 林震南 | L61: 30 | M61: 1377 | N61: 823 | O61: 7720 | P61: 3240 | Q61: 1080
A62: 60 | B62: 婉儿 | C62: 决一死战 | D62: 1 | F62: 107 | G62: 30 | H62: 1 | I62: 60 | K62: 狂刀汉 | L62: 30 | M62: 1404 | N62: 839 | O62: 1574 | P62: 660 | Q62: 220 | W62: 狂刀汉 | X62: 30 | Y62: 1404 | Z62: 839 | AA62: 1574 | AB62: 660 | AC62: 220 | AI62: 御甲师 | AJ62: 30 | AK62: 1404 | AL62: 839 | AM62: 1574 | AN62: 660 | AO62: 220 | AU62: 御甲师 | AV62: 30 | AW62: 1404 | AX62: 839 | AY62: 1574 | AZ62: 660 | BA62: 220 | BG62: 婉儿 | BH62: 31 | BI62: 1404 | BJ62: 839 | BK62: 1574 | BL62: 660 | BM62: 220
A63: 61 | B63: 撒老头 | C63: 决一死战 | D63: 2 | F63: 41 | G63: 30 | H63: 1 | I63: 61 | K63: 匿踪客 | L63: 30 | M63: 1432 | N63: 855 | O63: 1605 | P63: 673 | Q63: 224 | W63: 匿踪客 | X63: 30 | Y63: 1432 | Z63: 855 | AA63: 1605 | AB63: 673 | AC63: 224 | AI63: 御甲师 | AJ63: 30 | AK63: 1432 | AL63: 855 | AM63: 1605 | AN63: 673 | AO63: 224 | AU63: 御甲师 | AV63: 30 | AW63: 1432 | AX63: 855 | AY63: 1605 | AZ63: 673 | BA63: 224 | BG63: 撒老头 | BH63: 31 | BI63: 1432 | BJ63: 855 | BK63: 1605 | BL63: 673 | BM63: 224
A64: 62 | B64: 贾人达 | C64: 决一死战 | D64: 3 | F64: 13 | G64: 30 | H64: 1 | I64: 62 | K64: 嗜毒女 | L64: 30 | M64: 1460 | N64: 872 | O64: 1637 | P64: 686 | Q64: 228 | W64: 嗜毒女 | X64: 30 | Y64: 1460 | Z64: 872 | AA64: 1637 | AB64: 686 | AC64: 228 | AI64: 巨力士 | AJ64: 30 | AK64: 1460 | AL64: 872 | AM64: 1637 | AN64: 686 | AO64: 228 | AU64: 巨力士 | AV64: 30 | AW64: 1460 | AX64: 872 | AY64: 1637 | AZ64: 686 | BA64: 228 | BG64: 贾人达 | BH64: 31 | BI64: 1460 | BJ64: 872 | BK64: 1637 | BL64: 686 | BM64: 228
A65: 63 | B65: 方人智 | C65: 决一死战 | D65: 4 | F65: 13 | G65: 30 | H65: 1 | I65: 63 | K65: 嗜毒女 | L65: 30 | M65: 1489 | N65: 889 | O65: 1669 | P65: 699 | Q65: 232 | W65: 巨力士 | X65: 30 | Y65: 1489 | Z65: 889 | AA65: 1669 | AB65: 699 | AC65: 232 | AI65: 嗜毒女 | AJ65: 30 | AK65: 1489 | AL65: 889 | AM65: 1669 | AN65: 699 | AO65: 232 | AU65: 巨力士 | AV65: 30 | AW65: 1489 | AX65: 889 | AY65: 1669 | AZ65: 699 | BA65: 232 | BG65: 方人智 | BH65: 31 | BI65: 1489 | BJ65: 889 | BK65: 1669 | BL65: 699 | BM65: 232
A66: 64 | B66: 于人豪 | C66: 决一死战 | D66: 5 | F66: 14 | G66: 30 | H66: 1 | I66: 64 | K66: 巨力士 | L66: 30 | M66: 1518 | N66: 906 | O66: 1702 | P66: 712 | Q66: 236 | W66: 巨力士 | X66: 30 | Y66: 1518 | Z66: 906 | AA66: 1702 | AB66: 712 | AC66: 236 | AI66: 嗜毒女 | AJ66: 30 | AK66: 1518 | AL66: 906 | AM66: 1702 | AN66: 712 | AO66: 236 | AU66: 嗜毒女 | AV66: 30 | AW66: 1518 | AX66: 906 | AY66: 1702 | AZ66: 712 | BA66: 236 | BG66: 于人豪 | BH66: 31 | BI66: 1518 | BJ66: 906 | BK66: 1702 | BL66: 712 | BM66: 236
A67: 65 | B67: 林平之 | C67: 决一死战 | D67: 6 | F67: 14 | G67: 31 | H67: 1 | I67: 65 | K67: 匿踪客 | L67: 31 | M67: 1548 | N67: 924 | O67: 1736 | P67: 726 | Q67: 240 | W67: 匿踪客 | X67: 31 | Y67: 1548 | Z67: 924 | AA67: 1736 | AB67: 726 | AC67: 240 | AI67: 御甲师 | AJ67: 31 | AK67: 1548 | AL67: 924 | AM67: 1736 | AN67: 726 | AO67: 240 | AU67: 狂刀汉 | AV67: 31 | AW67: 1548 | AX67: 924 | AY67: 1736 | AZ67: 726 | BA67: 240 | BG67: 林平之 | BH67: 32 | BI67: 1548 | BJ67: 924 | BK67: 1736 | BL67: 726 | BM67: 240
A68: 66 | B68: 王夫人 | C68: 决一死战 | D68: 7 | F68: 86 | G68: 31 | H68: 1 | I68: 66 | K68: 贾人达 | L68: 31 | M68: 1578 | N68: 942 | O68: 1770 | P68: 740 | Q68: 244 | W68: 方人智 | X68: 31 | Y68: 1578 | Z68: 942 | AA68: 1770 | AB68: 740 | AC68: 244 | AI68: 于人豪 | AJ68: 31 | AK68: 1578 | AL68: 942 | AM68: 1770 | AN68: 740 | AO68: 244 | AU68: 林平之 | AV68: 31 | AW68: 1578 | AX68: 942 | AY68: 1770 | AZ68: 740 | BA68: 244 | BG68: 王夫人 | BH68: 32 | BI68: 1578 | BJ68: 942 | BK68: 1770 | BL68: 740 | BM68: 244
A69: 67 | B69: 林震南 | C69: 决一死战 | D69: 8 | F69: 78 | G69: 31 | H69: 1 | I69: 67 | K69: 林震南 | L69: 32 | M69: 1820 | N69: 1088 | O69: 10208 | P69: 4284 | Q69: 1428
A70: 68 | B70: 长枪护卫 | C70: 太湖水寨 | D70: 1 | F70: 113 | G70: 31 | H70: 1 | I70: 68 | K70: 长枪护卫 | L70: 31 | M70: 1838 | N70: 1098 | O70: 2062 | P70: 865 | Q70: 288 | W70: 长枪护使 | X70: 31 | Y70: 1838 | Z70: 1098 | AA70: 2062 | AB70: 865 | AC70: 288 | AI70: 长枪护卫 | AJ70: 31 | AK70: 1838 | AL70: 1098 | AM70: 2062 | AN70: 865 | AO70: 288 | AU70: 长枪护使 | AV70: 31 | AW70: 1838 | AX70: 1098 | AY70: 2062 | AZ70: 865 | BA70: 288 | BG70: 长枪护使 | BH70: 32 | BI70: 1838 | BJ70: 1098 | BK70: 2062 | BL70: 865 | BM70: 288
A71: 69 | B71: 宽刀护卫 | C71: 太湖水寨 | D71: 2 | F71: 109 | G71: 31 | H71: 1 | I71: 69 | K71: 宽刀护使 | L71: 31 | M71: 1856 | N71: 1108 | O71: 2082 | P71: 873 | Q71: 290 | W71: 宽刀护使 | X71: 31 | Y71: 1856 | Z71: 1108 | AA71: 2082 | AB71: 873 | AC71: 290 | AI71: 宽刀护卫 | AJ71: 31 | AK71: 1856 | AL71: 1108 | AM71: 2082 | AN71: 873 | AO71: 290 | AU71: 宽刀护使 | AV71: 31 | AW71: 1856 | AX71: 1108 | AY71: 2082 | AZ71: 873 | BA71: 290 | BG71: 宽刀护使 | BH71: 32 | BI71: 1856 | BJ71: 1108 | BK71: 2082 | BL71: 873 | BM71: 290
A72: 70 | B72: 段天德 | C72: 太湖水寨 | D72: 3 | F72: 72 | G72: 32 | H72: 1 | I72: 70 | K72: 宽刀护卫 | L72: 32 | M72: 1874 | N72: 1119 | O72: 2102 | P72: 881 | Q72: 292 | W72: 宽刀护卫 | X72: 32 | Y72: 1874 | Z72: 1119 | AA72: 2102 | AB72: 881 | AC72: 292 | AI72: 宽刀护使 | AJ72: 32 | AK72: 1874 | AL72: 1119 | AM72: 2102 | AN72: 881 | AO72: 292 | AU72: 宽刀护使 | AV72: 32 | AW72: 1874 | AX72: 1119 | AY72: 2102 | AZ72: 881 | BA72: 292 | BG72: 段天德 | BH72: 33 | BI72: 1874 | BJ72: 1119 | BK72: 2102 | BL72: 881 | BM72: 292
A73: 71 | B73: 张寨主 | C73: 太湖水寨 | D73: 4 | F73: 3 | G73: 32 | H73: 1 | I73: 71 | K73: 巨力士 | L73: 32 | M73: 1892 | N73: 1130 | O73: 2123 | P73: 889 | Q73: 294 | W73: 巨力士 | X73: 32 | Y73: 1892 | Z73: 1130 | AA73: 2123 | AB73: 889 | AC73: 294 | AI73: 匿踪客 | AJ73: 32 | AK73: 1892 | AL73: 1130 | AM73: 2123 | AN73: 889 | AO73: 294 | AU73: 匿踪客 | AV73: 32 | AW73: 1892 | AX73: 1130 | AY73: 2123 | AZ73: 889 | BA73: 294 | BG73: 张寨主 | BH73: 33 | BI73: 1892 | BJ73: 1130 | BK73: 2123 | BL73: 889 | BM73: 294
A74: 72 | B74: 马青雄 | C74: 太湖水寨 | D74: 5 | F74: 6 | G74: 32 | H74: 1 | I74: 72 | K74: 嗜毒女 | L74: 32 | M74: 1910 | N74: 1141 | O74: 2144 | P74: 897 | Q74: 296 | W74: 嗜毒女 | X74: 32 | Y74: 1910 | Z74: 1141 | AA74: 2144 | AB74: 897 | AC74: 296 | AI74: 巨力士 | AJ74: 32 | AK74: 1910 | AL74: 1141 | AM74: 2144 | AN74: 897 | AO74: 296 | AU74: 巨力士 | AV74: 32 | AW74: 1910 | AX74: 1141 | AY74: 2144 | AZ74: 897 | BA74: 296 | BG74: 马青雄 | BH74: 33 | BI74: 1910 | BJ74: 1141 | BK74: 2144 | BL74: 897 | BM74: 296
A75: 73 | B75: 贺寨主 | C75: 太湖水寨 | D75: 6 | F75: 4 | G75: 32 | H75: 1 | I75: 73 | K75: 狂刀汉 | L75: 32 | M75: 1929 | N75: 1152 | O75: 2165 | P75: 905 | Q75: 298 | W75: 狂刀汉 | X75: 32 | Y75: 1929 | Z75: 1152 | AA75: 2165 | AB75: 905 | AC75: 298 | AI75: 嗜毒女 | AJ75: 32 | AK75: 1929 | AL75: 1152 | AM75: 2165 | AN75: 905 | AO75: 298 | AU75: 嗜毒女 | AV75: 32 | AW75: 1929 | AX75: 1152 | AY75: 2165 | AZ75: 905 | BA75: 298 | BG75: 贺寨主 | BH75: 33 | BI75: 1929 | BJ75: 1152 | BK75: 2165 | BL75: 905 | BM75: 298
A76: 74 | B76: 彭寨主 | C76: 太湖水寨 | D76: 7 | F76: 62 | G76: 32 | H76: 1 | I76: 74 | K76: 狂刀汉 | L76: 32 | M76: 1948 | N76: 1163 | O76: 2186 | P76: 914 | Q76: 300 | W76: 匿踪客 | X76: 32 | Y76: 1948 | Z76: 1163 | AA76: 2186 | AB76: 914 | AC76: 300 | AI76: 嗜毒女 | AJ76: 32 | AK76: 1948 | AL76: 1163 | AM76: 2186 | AN76: 914 | AO76: 300 | AU76: 狂刀汉 | AV76: 32 | AW76: 1948 | AX76: 1163 | AY76: 2186 | AZ76: 914 | BA76: 300 | BG76: 彭寨主 | BH76: 33 | BI76: 1948 | BJ76: 1163 | BK76: 2186 | BL76: 914 | BM76: 300
A77: 75 | B77: 董寨主 | C77: 太湖水寨 | D77: 8 | F77: 78 | G77: 33 | H77: 1 | I77: 75 | K77: 匿踪客 | L77: 33 | M77: 1967 | N77: 1174 | O77: 2207 | P77: 923 | Q77: 303 | W77: 匿踪客 | X77: 33 | Y77: 1967 | Z77: 1174 | AA77: 2207 | AB77: 923 | AC77: 303 | AI77: 狂刀汉 | AJ77: 33 | AK77: 1967 | AL77: 1174 | AM77: 2207 | AN77: 923 | AO77: 303 | AU77: 狂刀汉 | AV77: 33 | AW77: 1967 | AX77: 1174 | AY77: 2207 | AZ77: 923 | BA77: 303 | BG77: 董寨主 | BH77: 34 | BI77: 1967 | BJ77: 1174 | BK77: 2207 | BL77: 923 | BM77: 303
A78: 76 | B78: 陆冠英 | C78: 太湖水寨 | D78: 9 | F78: 47 | G78: 33 | H78: 1 | I78: 76 | K78: 张寨主 | L78: 33 | M78: 1986 | N78: 1185 | O78: 2229 | P78: 932 | Q78: 306 | W78: 贺寨主 | X78: 33 | Y78: 1986 | Z78: 1185 | AA78: 2229 | AB78: 932 | AC78: 306 | AI78: 彭寨主 | AJ78: 33 | AK78: 1986 | AL78: 1185 | AM78: 2229 | AN78: 932 | AO78: 306 | AU78: 董寨主 | AV78: 33 | AW78: 1986 | AX78: 1185 | AY78: 2229 | AZ78: 932 | BA78: 306 | BG78: 陆冠英 | BH78: 34 | BI78: 1986 | BJ78: 1185 | BK78: 2229 | BL78: 932 | BM78: 306
A79: 77 | B79: 杨康 | C79: 太湖水寨 | D79: 10 | F79: 56 | G79: 33 | H79: 1 | I79: 77 | K79: 杨康 | L79: 34 | M79: 2034 | N79: 1216 | O79: 11408 | P79: 4788 | Q79: 1596
A80: 78 | B80: 张寨主 | C80: 归云山庄 | D80: 1 | F80: 59 | G80: 33 | H80: 1 | I80: 78 | K80: 巨力士 | L80: 33 | M80: 2044 | N80: 1222 | O80: 2293 | P80: 962 | Q80: 320 | W80: 巨力士 | X80: 33 | Y80: 2044 | Z80: 1222 | AA80: 2293 | AB80: 962 | AC80: 320 | AI80: 巨力士 | AJ80: 33 | AK80: 2044 | AL80: 1222 | AM80: 2293 | AN80: 962 | AO80: 320 | AU80: 巨力士 | AV80: 33 | AW80: 2044 | AX80: 1222 | AY80: 2293 | AZ80: 962 | BA80: 320 | BG80: 张寨主 | BH80: 34 | BI80: 2044 | BJ80: 1222 | BK80: 2293 | BL80: 962 | BM80: 320
A81: 79 | B81: 段天德 | C81: 归云山庄 | D81: 2 | F81: 72 | G81: 33 | H81: 1 | I81: 79 | K81: 宽刀护卫 | L81: 33 | M81: 2054 | N81: 1228 | O81: 2304 | P81: 966 | Q81: 321 | W81: 宽刀护使 | X81: 33 | Y81: 2054 | Z81: 1228 | AA81: 2304 | AB81: 966 | AC81: 321 | AI81: 宽刀护卫 | AJ81: 33 | AK81: 2054 | AL81: 1228 | AM81: 2304 | AN81: 966 | AO81: 321 | AU81: 宽刀护使 | AV81: 33 | AW81: 2054 | AX81: 1228 | AY81: 2304 | AZ81: 966 | BA81: 321 | BG81: 段天德 | BH81: 34 | BI81: 2054 | BJ81: 1228 | BK81: 2304 | BL81: 966 | BM81: 321
A82: 80 | B82: 穆念慈 | C82: 归云山庄 | D82: 3 | F82: 103 | G82: 34 | H82: 1 | I82: 80 | K82: 狂刀汉 | L82: 34 | M82: 2064 | N82: 1234 | O82: 2315 | P82: 970 | Q82: 322 | W82: 匿踪客 | X82: 34 | Y82: 2064 | Z82: 1234 | AA82: 2315 | AB82: 970 | AC82: 322 | AI82: 匿踪客 | AJ82: 34 | AK82: 2064 | AL82: 1234 | AM82: 2315 | AN82: 970 | AO82: 322 | AU82: 狂刀汉 | AV82: 34 | AW82: 2064 | AX82: 1234 | AY82: 2315 | AZ82: 970 | BA82: 322 | BG82: 穆念慈 | BH82: 35 | BI82: 2064 | BJ82: 1234 | BK82: 2315 | BL82: 970 | BM82: 322
A83: 81 | B83: 陆冠英 | C83: 归云山庄 | D83: 4 | F83: 47 | G83: 34 | H83: 1 | I83: 81 | K83: 匿踪客 | L83: 34 | M83: 2074 | N83: 1240 | O83: 2326 | P83: 974 | Q83: 323 | W83: 匿踪客 | X83: 34 | Y83: 2074 | Z83: 1240 | AA83: 2326 | AB83: 974 | AC83: 323 | AI83: 狂刀汉 | AJ83: 34 | AK83: 2074 | AL83: 1240 | AM83: 2326 | AN83: 974 | AO83: 323 | AU83: 狂刀汉 | AV83: 34 | AW83: 2074 | AX83: 1240 | AY83: 2326 | AZ83: 974 | BA83: 323 | BG83: 陆冠英 | BH83: 35 | BI83: 2074 | BJ83: 1240 | BK83: 2326 | BL83: 974 | BM83: 323
A84: 82 | B84: 杨康 | C84: 归云山庄 | D84: 5 | F84: 56 | G84: 34 | H84: 1 | I84: 82 | K84: 宽刀护使 | L84: 34 | M84: 2084 | N84: 1246 | O84: 2337 | P84: 978 | Q84: 324 | W84: 厚甲护卫 | X84: 34 | Y84: 2084 | Z84: 1246 | AA84: 2337 | AB84: 978 | AC84: 324 | AI84: 厚甲护卫 | AJ84: 34 | AK84: 2084 | AL84: 1246 | AM84: 2337 | AN84: 978 | AO84: 324 | AU84: 长枪护使 | AV84: 34 | AW84: 2084 | AX84: 1246 | AY84: 2337 | AZ84: 978 | BA84: 324 | BG84: 杨康 | BH84: 35 | BI84: 2084 | BJ84: 1246 | BK84: 2337 | BL84: 978 | BM84: 324
A85: 83 | B85: 郭靖 | C85: 归云山庄 | D85: 6 | F85: 143 | G85: 34 | H85: 1 | I85: 83 | K85: 郭靖 | L85: 35 | M85: 2094 | N85: 1252 | O85: 11740 | P85: 982 | Q85: 325
A86: 84 | B86: 黄蓉 | C86: 归云山庄 | D86: 7 | F86: 104 | G86: 34 | H86: 1 | I86: 84 | K86: 黄蓉 | L86: 35 | M86: 2104 | N86: 1258 | O86: 11798 | P86: 986 | Q86: 326
A87: 85 | B87: 裘千仞 | C87: 归云山庄 | D87: 8 | F87: 140 | G87: 35 | H87: 1 | I87: 85 | K87: 裘千仞 | L87: 36 | M87: 2114 | N87: 1264 | O87: 11856 | P87: 990 | Q87: 327
A88: 86 | B88: 陆乘风 | C88: 归云山庄 | D88: 9 | F88: 59 | G88: 35 | H88: 1 | I88: 86 | K88: 陆乘风 | L88: 36 | M88: 2142 | N88: 1281 | O88: 15015 | P88: 6300 | Q88: 2100
A89: 87 | B89: 韩小莹 | C89: 桃花岛主 | D89: 1 | F89: 107 | G89: 35 | H89: 1 | I89: 87 | K89: 御甲师 | L89: 35 | M89: 2152 | N89: 1287 | O89: 3018 | P89: 1266 | Q89: 422 | W89: 御甲师 | X89: 35 | Y89: 2152 | Z89: 1287 | AA89: 3018 | AB89: 1266 | AC89: 422 | AI89: 嗜毒女 | AJ89: 35 | AK89: 2152 | AL89: 1287 | AM89: 3018 | AN89: 1266 | AO89: 422 | AU89: 嗜毒女 | AV89: 35 | AW89: 2152 | AX89: 1287 | AY89: 3018 | AZ89: 1266 | BA89: 422 | BG89: 韩小莹 | BH89: 36 | BI89: 2152 | BJ89: 1287 | BK89: 3018 | BL89: 1266 | BM89: 422
A90: 88 | B90: 全金发 | C90: 桃花岛主 | D90: 2 | F90: 6 | G90: 35 | H90: 1 | I90: 88 | K90: 巨力士 | L90: 35 | M90: 2162 | N90: 1293 | O90: 3033 | P90: 1272 | Q90: 424 | W90: 巨力士 | X90: 35 | Y90: 2162 | Z90: 1293 | AA90: 3033 | AB90: 1272 | AC90: 424 | AI90: 匿踪客 | AJ90: 35 | AK90: 2162 | AL90: 1293 | AM90: 3033 | AN90: 1272 | AO90: 424 | AU90: 匿踪客 | AV90: 35 | AW90: 2162 | AX90: 1293 | AY90: 3033 | AZ90: 1272 | BA90: 424 | BG90: 全金发 | BH90: 36 | BI90: 2162 | BJ90: 1293 | BK90: 3033 | BL90: 1272 | BM90: 424
A91: 89 | B91: 南希仁 | C91: 桃花岛主 | D91: 3 | F91: 14 | G91: 35 | H91: 1 | I91: 89 | K91: 狂刀汉 | L91: 35 | M91: 2172 | N91: 1299 | O91: 3048 | P91: 1278 | Q91: 426 | W91: 狂刀汉 | X91: 35 | Y91: 2172 | Z91: 1299 | AA91: 3048 | AB91: 1278 | AC91: 426 | AI91: 嗜毒女 | AJ91: 35 | AK91: 2172 | AL91: 1299 | AM91: 3048 | AN91: 1278 | AO91: 426 | AU91: 嗜毒女 | AV91: 35 | AW91: 2172 | AX91: 1299 | AY91: 3048 | AZ91: 1278 | BA91: 426 | BG91: 南希仁 | BH91: 36 | BI91: 2172 | BJ91: 1299 | BK91: 3048 | BL91: 1278 | BM91: 426
A92: 90 | B92: 朱聪 | C92: 桃花岛主 | D92: 4 | F92: 18 | G92: 36 | H92: 1 | I92: 90 | K92: 御甲师 | L92: 36 | M92: 2182 | N92: 1305 | O92: 3063 | P92: 1284 | Q92: 428 | W92: 狂刀汉 | X92: 36 | Y92: 2182 | Z92: 1305 | AA92: 3063 | AB92: 1284 | AC92: 428 | AI92: 狂刀汉 | AJ92: 36 | AK92: 2182 | AL92: 1305 | AM92: 3063 | AN92: 1284 | AO92: 428 | AU92: 嗜毒女 | AV92: 36 | AW92: 2182 | AX92: 1305 | AY92: 3063 | AZ92: 1284 | BA92: 428 | BG92: 朱聪 | BH92: 37 | BI92: 2182 | BJ92: 1305 | BK92: 3063 | BL92: 1284 | BM92: 428
A93: 91 | B93: 柯镇恶 | C93: 桃花岛主 | D93: 5 | F93: 66 | G93: 36 | H93: 1 | I93: 91 | K93: 御甲师 | L93: 36 | M93: 2192 | N93: 1311 | O93: 3078 | P93: 1290 | Q93: 430 | W93: 巨力士 | X93: 36 | Y93: 2192 | Z93: 1311 | AA93: 3078 | AB93: 1290 | AC93: 430 | AI93: 巨力士 | AJ93: 36 | AK93: 2192 | AL93: 1311 | AM93: 3078 | AN93: 1290 | AO93: 430 | AU93: 嗜毒女 | AV93: 36 | AW93: 2192 | AX93: 1311 | AY93: 3078 | AZ93: 1290 | BA93: 430 | BG93: 柯镇恶 | BH93: 37 | BI93: 2192 | BJ93: 1311 | BK93: 3078 | BL93: 1290 | BM93: 430
A94: 92 | B94: 裘千仞 | C94: 桃花岛主 | D94: 6 | F94: 140 | G94: 36 | H94: 1 | I94: 92 | K94: 裘千仞 | L94: 37 | M94: 2202 | N94: 1317 | O94: 15465 | P94: 1296 | Q94: 432
A95: 93 | B95: 陆乘风 | C95: 桃花岛主 | D95: 7 | F95: 59 | G95: 36 | H95: 1 | I95: 93 | K95: 陆乘风 | L95: 37 | M95: 2213 | N95: 1323 | O95: 15542 | P95: 1302 | Q95: 434
A96: 94 | B96: 梅超风 | C96: 桃花岛主 | D96: 8 | F96: 92 | G96: 36 | H96: 1 | I96: 94 | K96: 梅超风 | L96: 37 | M96: 2224 | N96: 1329 | O96: 15619 | P96: 1308 | Q96: 436
A97: 95 | B97: 郭靖 | C97: 桃花岛主 | D97: 9 | F97: 143 | G97: 36 | H97: 1 | I97: 95 | K97: 郭靖 | L97: 37 | M97: 2235 | N97: 1335 | O97: 15697 | P97: 1314 | Q97: 438
A98: 96 | B98: 黄药师 | C98: 桃花岛主 | D98: 10 | F98: 65 | G98: 37 | H98: 1 | I98: 96 | K98: 黄药师 | L98: 38 | M98: 2249 | N98: 1345 | O98: 15765 | P98: 6615 | Q98: 2205
A99: 97 | B99: 海沙帮弟子 | C99: 宝刀玄光 | D99: 1 | F99: 49 | G99: 37 | H99: 1 | I99: 97 | K99: 匿踪客 | L99: 37 | M99: 2249 | N99: 1345 | O99: 3153 | P99: 1323 | Q99: 441 | W99: 匿踪客 | X99: 37 | Y99: 2249 | Z99: 1345 | AA99: 3153 | AB99: 1323 | AC99: 441 | AI99: 海沙帮弟子 | AJ99: 37 | AK99: 2249 | AL99: 1345 | AM99: 3153 | AN99: 1323 | AO99: 441 | AU99: 海沙帮弟子 | AV99: 37 | AW99: 2249 | AX99: 1345 | AY99: 3153 | AZ99: 1323 | BA99: 441 | BG99: 海沙帮弟子 | BH99: 37 | BI99: 2249 | BJ99: 1345 | BK99: 3153 | BL99: 1323 | BM99: 441
A100: 98 | B100: 长白三老 | C100: 宝刀玄光 | D100: 2 | F100: 60 | G100: 37 | H100: 1 | I100: 98 | K100: 长白一老 | L100: 38 | M100: 2249 | N100: 1345 | O100: 6306 | P100: 2646 | Q100: 882 | W100: 长白二老 | X100: 37 | Y100: 2249 | Z100: 1345 | AA100: 6306 | AB100: 2646 | AC100: 882 | AI100: 长白三老 | AJ100: 37 | AK100: 2249 | AL100: 1345 | AM100: 6306 | AN100: 2646 | AO100: 882
A101: 99 | B101: 德成 | C101: 宝刀玄光 | D101: 3 | F101: 6 | G101: 37 | H101: 1 | I101: 99 | K101: 海沙帮弟子 | L101: 37 | M101: 2249 | N101: 1345 | O101: 3153 | P101: 1323 | Q101: 441 | W101: 海沙帮弟子 | X101: 37 | Y101: 2249 | Z101: 1345 | AA101: 3153 | AB101: 1323 | AC101: 441 | AI101: 海沙帮弟子 | AJ101: 37 | AK101: 2249 | AL101: 1345 | AM101: 3153 | AN101: 1323 | AO101: 441 | AU101: 海沙帮弟子 | AV101: 37 | AW101: 2249 | AX101: 1345 | AY101: 3153 | AZ101: 1323 | BA101: 441 | BG101: 德成 | BH101: 38 | BI101: 2249 | BJ101: 1345 | BK101: 3153 | BL101: 1323 | BM101: 441
A102: 100 | B102: 天鹰教众人 | C102: 宝刀玄光 | D102: 4 | F102: 49 | G102: 37 | H102: 1 | I102: 100 | K102: 天鹰教弟子 | L102: 37 | M102: 2249 | N102: 1345 | O102: 3153 | P102: 1323 | Q102: 441 | W102: 天鹰教弟子 | X102: 37 | Y102: 2249 | Z102: 1345 | AA102: 3153 | AB102: 1323 | AC102: 441 | AI102: 天鹰教弟子 | AJ102: 37 | AK102: 2249 | AL102: 1345 | AM102: 3153 | AN102: 1323 | AO102: 441 | AU102: 天鹰教弟子 | AV102: 37 | AW102: 2249 | AX102: 1345 | AY102: 3153 | AZ102: 1323 | BA102: 441 | BG102: 天鹰教弟子 | BH102: 38 | BI102: 2249 | BJ102: 1345 | BK102: 3153 | BL102: 1323 | BM102: 441
A103: 101 | B103: 李堂主 | C103: 宝刀玄光 | D103: 5 | F103: 3 | G103: 37 | H103: 1 | I103: 101 | K103: 天鹰教弟子 | L103: 37 | M103: 2249 | N103: 1345 | O103: 3153 | P103: 1323 | Q103: 441 | W103: 天鹰教弟子 | X103: 37 | Y103: 2249 | Z103: 1345 | AA103: 3153 | AB103: 1323 | AC103: 441 | AI103: 天鹰教弟子 | AJ103: 37 | AK103: 2249 | AL103: 1345 | AM103: 3153 | AN103: 1323 | AO103: 441 | AU103: 天鹰教弟子 | AV103: 37 | AW103: 2249 | AX103: 1345 | AY103: 3153 | AZ103: 1323 | BA103: 441 | BG103: 李堂主 | BH103: 38 | BI103: 2249 | BJ103: 1345 | BK103: 3153 | BL103: 1323 | BM103: 441
A104: 102 | B104: 殷素素 | C104: 宝刀玄光 | D104: 6 | F104: 103 | G104: 38 | H104: 1 | I104: 102 | K104: 天鹰教弟子 | L104: 38 | M104: 2249 | N104: 1345 | O104: 3153 | P104: 1323 | Q104: 441 | W104: 天鹰教弟子 | X104: 38 | Y104: 2249 | Z104: 1345 | AA104: 3153 | AB104: 1323 | AC104: 441 | AI104: 天鹰教弟子 | AJ104: 38 | AK104: 2249 | AL104: 1345 | AM104: 3153 | AN104: 1323 | AO104: 441 | AU104: 天鹰教弟子 | AV104: 38 | AW104: 2249 | AX104: 1345 | AY104: 3153 | AZ104: 1323 | BA104: 441 | BG104: 殷素素 | BH104: 39 | BI104: 2249 | BJ104: 1345 | BK104: 3153 | BL104: 1323 | BM104: 441
A105: 103 | B105: 殷野王 | C105: 宝刀玄光 | D105: 7 | F105: 18 | G105: 38 | H105: 1 | I105: 103 | K105: 天鹰教弟子 | L105: 38 | M105: 2249 | N105: 1345 | O105: 3153 | P105: 1323 | Q105: 441 | W105: 天鹰教弟子 | X105: 38 | Y105: 2249 | Z105: 1345 | AA105: 3153 | AB105: 1323 | AC105: 441 | AI105: 天鹰教弟子 | AJ105: 38 | AK105: 2249 | AL105: 1345 | AM105: 3153 | AN105: 1323 | AO105: 441 | AU105: 天鹰教弟子 | AV105: 38 | AW105: 2249 | AX105: 1345 | AY105: 3153 | AZ105: 1323 | BA105: 441 | BG105: 殷野王 | BH105: 39 | BI105: 2249 | BJ105: 1345 | BK105: 3153 | BL105: 1323 | BM105: 441
A106: 104 | B106: 俞岱岩 | C106: 宝刀玄光 | D106: 8 | F106: 82 | G106: 38 | H106: 1 | I106: 104 | K106: 武当弟子 | L106: 38 | M106: 2249 | N106: 1345 | O106: 3153 | P106: 1323 | Q106: 441 | W106: 武当弟子 | X106: 38 | Y106: 2249 | Z106: 1345 | AA106: 3153 | AB106: 1323 | AC106: 441 | AI106: 武当弟子 | AJ106: 38 | AK106: 2249 | AL106: 1345 | AM106: 3153 | AN106: 1323 | AO106: 441 | AU106: 武当弟子 | AV106: 38 | AW106: 2249 | AX106: 1345 | AY106: 3153 | AZ106: 1323 | BA106: 441 | BG106: 俞岱岩 | BH106: 39 | BI106: 2249 | BJ106: 1345 | BK106: 3153 | BL106: 1323 | BM106: 441
A107: 105 | B107: 白袍客 | C107: 宝刀玄光 | D107: 9 | F107: 79 | G107: 38 | H107: 1 | I107: 105 | K107: 白袍客 | L107: 39 | M107: 2249 | N107: 1345 | O107: 15765 | P107: 6615 | Q107: 2205
A108: 106 | B108: 狂刀汉 | C108: 千里护镖 | D108: 1 | F108: 110 | G108: 38 | H108: 1 | I108: 106 | K108: 狂刀汉 | L108: 38 | M108: 2260 | N108: 1351 | O108: 3168 | P108: 1329 | Q108: 443 | W108: 狂刀汉 | X108: 38 | Y108: 2260 | Z108: 1351 | AA108: 3168 | AB108: 1329 | AC108: 443 | AI108: 狂刀汉 | AJ108: 38 | AK108: 2260 | AL108: 1351 | AM108: 3168 | AN108: 1329 | AO108: 443 | AU108: 狂刀汉 | AV108: 38 | AW108: 2260 | AX108: 1351 | AY108: 3168 | AZ108: 1329 | BA108: 443 | BG108: 狂刀汉 | BH108: 38 | BI108: 2260 | BJ108: 1351 | BK108: 3168 | BL108: 1329 | BM108: 443
A109: 107 | B109: 御甲师 | C109: 千里护镖 | D109: 2 | F109: 7 | G109: 38 | H109: 1 | I109: 107 | K109: 狂刀汉 | L109: 38 | M109: 2271 | N109: 1357 | O109: 3183 | P109: 1335 | Q109: 445 | W109: 狂刀汉 | X109: 38 | Y109: 2271 | Z109: 1357 | AA109: 3183 | AB109: 1335 | AC109: 445 | AI109: 御甲师 | AJ109: 38 | AK109: 2271 | AL109: 1357 | AM109: 3183 | AN109: 1335 | AO109: 445 | AU109: 御甲师 | AV109: 38 | AW109: 2271 | AX109: 1357 | AY109: 3183 | AZ109: 1335 | BA109: 445 | BG109: 御甲师 | BH109: 38 | BI109: 2271 | BJ109: 1357 | BK109: 3183 | BL109: 1335 | BM109: 445
A110: 108 | B110: 祝镖头 | C110: 千里护镖 | D110: 3 | F110: 8 | G110: 39 | H110: 1 | I110: 108 | K110: 狂刀汉 | L110: 39 | M110: 2282 | N110: 1363 | O110: 3198 | P110: 1341 | Q110: 447 | W110: 狂刀汉 | X110: 39 | Y110: 2282 | Z110: 1363 | AA110: 3198 | AB110: 1341 | AC110: 447 | AI110: 御甲师 | AJ110: 39 | AK110: 2282 | AL110: 1363 | AM110: 3198 | AN110: 1341 | AO110: 447 | AU110: 御甲师 | AV110: 39 | AW110: 2282 | AX110: 1363 | AY110: 3198 | AZ110: 1341 | BA110: 447 | BG110: 祝镖头 | BH110: 40 | BI110: 2282 | BJ110: 1363 | BK110: 3198 | BL110: 1341 | BM110: 447
A111: 109 | B111: 史镖头 | C111: 千里护镖 | D111: 4 | F111: 8 | G111: 39 | H111: 1 | I111: 109 | K111: 狂刀汉 | L111: 39 | M111: 2293 | N111: 1369 | O111: 3213 | P111: 1347 | Q111: 449 | W111: 狂刀汉 | X111: 39 | Y111: 2293 | Z111: 1369 | AA111: 3213 | AB111: 1347 | AC111: 449 | AI111: 御甲师 | AJ111: 39 | AK111: 2293 | AL111: 1369 | AM111: 3213 | AN111: 1347 | AO111: 449 | AU111: 御甲师 | AV111: 39 | AW111: 2293 | AX111: 1369 | AY111: 3213 | AZ111: 1347 | BA111: 449 | BG111: 史镖头 | BH111: 40 | BI111: 2293 | BJ111: 1369 | BK111: 3213 | BL111: 1347 | BM111: 449
A112: 110 | B112: 都大锦 | C112: 千里护镖 | D112: 5 | F112: 11 | G112: 39 | H112: 1 | I112: 110 | K112: 狂刀汉 | L112: 39 | M112: 2304 | N112: 1375 | O112: 3229 | P112: 1353 | Q112: 451 | W112: 狂刀汉 | X112: 39 | Y112: 2304 | Z112: 1375 | AA112: 3229 | AB112: 1353 | AC112: 451 | AI112: 御甲师 | AJ112: 39 | AK112: 2304 | AL112: 1375 | AM112: 3229 | AN112: 1353 | AO112: 451 | AU112: 御甲师 | AV112: 39 | AW112: 2304 | AX112: 1375 | AY112: 3229 | AZ112: 1353 | BA112: 451 | BG112: 都大锦 | BH112: 40 | BI112: 2304 | BJ112: 1375 | BK112: 3229 | BL112: 1353 | BM112: 451
A113: 111 | B113: 殷素素 | C113: 千里护镖 | D113: 6 | F113: 103 | G113: 39 | H113: 1 | I113: 111 | K113: 殷素素 | L113: 40 | M113: 2356 | N113: 1409 | O113: 16515 | P113: 6930 | Q113: 2310
A114: 112 | B114: 神秘客 | C114: 武当贺寿 | D114: 1 | F114: 70 | G114: 39 | H114: 1 | I114: 112 | K114: 匿踪客 | L114: 39 | M114: 2379 | N114: 1423 | O114: 3336 | P114: 1399 | Q114: 466 | W114: 匿踪客 | X114: 39 | Y114: 2379 | Z114: 1423 | AA114: 3336 | AB114: 1399 | AC114: 466 | AI114: 匿踪客 | AJ114: 39 | AK114: 2379 | AL114: 1423 | AM114: 3336 | AN114: 1399 | AO114: 466 | AU114: 匿踪客 | AV114: 35 | AW114: 2379 | AX114: 1423 | AY114: 3336 | AZ114: 1399 | BA114: 466 | BG114: 神秘客 | BH114: 40 | BI114: 2379 | BJ114: 1423 | BK114: 3336 | BL114: 1399 | BM114: 466
A115: 113 | B115: 祝镖头 | C115: 武当贺寿 | D115: 2 | F115: 8 | G115: 39 | H115: 1 | I115: 113 | K115: 匿踪客 | L115: 39 | M115: 2402 | N115: 1437 | O115: 3369 | P115: 1412 | Q115: 470 | W115: 匿踪客 | X115: 39 | Y115: 2402 | Z115: 1437 | AA115: 3369 | AB115: 1412 | AC115: 470 | AI115: 匿踪客 | AJ115: 39 | AK115: 2402 | AL115: 1437 | AM115: 3369 | AN115: 1412 | AO115: 470 | AU115: 匿踪客 | AV115: 35 | AW115: 2402 | AX115: 1437 | AY115: 3369 | AZ115: 1412 | BA115: 470 | BG115: 祝镖头 | BH115: 40 | BI115: 2402 | BJ115: 1437 | BK115: 3369 | BL115: 1412 | BM115: 470
A116: 114 | B116: 史镖头 | C116: 武当贺寿 | D116: 3 | F116: 8 | G116: 40 | H116: 1 | I116: 114 | K116: 匿踪客 | L116: 40 | M116: 2426 | N116: 1451 | O116: 3402 | P116: 1426 | Q116: 474 | W116: 匿踪客 | X116: 40 | Y116: 2426 | Z116: 1451 | AA116: 3402 | AB116: 1426 | AC116: 474 | AI116: 匿踪客 | AJ116: 40 | AK116: 2426 | AL116: 1451 | AM116: 3402 | AN116: 1426 | AO116: 474 | AU116: 匿踪客 | AV116: 36 | AW116: 2426 | AX116: 1451 | AY116: 3402 | AZ116: 1426 | BA116: 474 | BG116: 史镖头 | BH116: 41 | BI116: 2426 | BJ116: 1451 | BK116: 3402 | BL116: 1426 | BM116: 474
A117: 115 | B117: 都大锦 | C117: 武当贺寿 | D117: 4 | F117: 11 | G117: 40 | H117: 1 | I117: 115 | K117: 匿踪客 | L117: 40 | M117: 2450 | N117: 1465 | O117: 3436 | P117: 1440 | Q117: 478 | W117: 匿踪客 | X117: 40 | Y117: 2450 | Z117: 1465 | AA117: 3436 | AB117: 1440 | AC117: 478 | AI117: 匿踪客 | AJ117: 40 | AK117: 2450 | AL117: 1465 | AM117: 3436 | AN117: 1440 | AO117: 478 | AU117: 匿踪客 | AV117: 36 | AW117: 2450 | AX117: 1465 | AY117: 3436 | AZ117: 1440 | BA117: 478 | BG117: 都大锦 | BH117: 41 | BI117: 2450 | BJ117: 1465 | BK117: 3436 | BL117: 1440 | BM117: 478
A118: 116 | B118: 莫声谷 | C118: 武当贺寿 | D118: 5 | F118: 84 | G118: 40 | H118: 1 | I118: 116 | K118: 莫声谷 | L118: 41 | M118: 2474 | N118: 1479 | O118: 17350 | P118: 1454 | Q118: 482
A119: 117 | B119: 殷梨亭 | C119: 武当贺寿 | D119: 6 | F119: 84 | G119: 40 | H119: 1 | I119: 117 | K119: 狂刀汉 | L119: 40 | M119: 2498 | N119: 1493 | O119: 3463 | P119: 1468 | Q119: 486 | W119: 狂刀汉 | X119: 40 | Y119: 2498 | Z119: 1493 | AA119: 3463 | AB119: 1468 | AC119: 486 | AI119: 武当弟子 | AJ119: 40 | AK119: 2498 | AL119: 1493 | AM119: 3463 | AN119: 1468 | AO119: 486 | AU119: 武当弟子 | AV119: 40 | AW119: 2498 | AX119: 1493 | AY119: 3463 | AZ119: 1468 | BA119: 486 | BG119: 殷梨亭 | BH119: 41 | BI119: 2498 | BJ119: 1493 | BK119: 3463 | BL119: 1468 | BM119: 486
A120: 118 | B120: 张翠山 | C120: 武当贺寿 | D120: 7 | F120: 84 | G120: 40 | H120: 1 | I120: 118 | K120: 巨力士 | L120: 40 | M120: 2522 | N120: 1507 | O120: 3497 | P120: 1482 | Q120: 490 | W120: 巨力士 | X120: 40 | Y120: 2522 | Z120: 1507 | AA120: 3497 | AB120: 1482 | AC120: 490 | AI120: 武当弟子 | AJ120: 40 | AK120: 2522 | AL120: 1507 | AM120: 3497 | AN120: 1482 | AO120: 490 | AU120: 殷梨亭 | AV120: 41 | AW120: 2522 | AX120: 1507 | AY120: 3497 | AZ120: 1482 | BA120: 490 | BG120: 张翠山 | BH120: 41 | BI120: 2522 | BJ120: 1507 | BK120: 3497 | BL120: 1482 | BM120: 490
A121: 119 | B121: 张松溪 | C121: 武当贺寿 | D121: 8 | F121: 82 | G121: 40 | H121: 1 | I121: 119 | K121: 武当弟子 | L121: 40 | M121: 2547 | N121: 1522 | O121: 3531 | P121: 1496 | Q121: 494 | W121: 匿踪客 | X121: 40 | Y121: 2547 | Z121: 1522 | AA121: 3531 | AB121: 1496 | AC121: 494 | AI121: 狂刀汉 | AJ121: 41 | AK121: 2547 | AL121: 1522 | AM121: 3531 | AN121: 1496 | AO121: 494 | AU121: 巨力士 | AV121: 41 | AW121: 2547 | AX121: 1522 | AY121: 3531 | AZ121: 1496 | BA121: 494 | BG121: 张松溪 | BH121: 41 | BI121: 2547 | BJ121: 1522 | BK121: 3531 | BL121: 1496 | BM121: 494
A122: 120 | B122: 俞莲舟 | C122: 武当贺寿 | D122: 9 | F122: 84 | G122: 41 | H122: 1 | I122: 120 | K122: 御甲师 | L122: 41 | M122: 2572 | N122: 1537 | O122: 3566 | P122: 1510 | Q122: 498 | W122: 殷梨亭 | X122: 41 | Y122: 2572 | Z122: 1537 | AA122: 3566 | AB122: 1510 | AC122: 498 | AI122: 张翠山 | AJ122: 41 | AK122: 2572 | AL122: 1537 | AM122: 3566 | AN122: 1510 | AO122: 498 | AU122: 张松溪 | AV122: 41 | AW122: 2572 | AX122: 1537 | AY122: 3566 | AZ122: 1510 | BA122: 498 | BG122: 俞莲舟 | BH122: 42 | BI122: 2572 | BJ122: 1537 | BK122: 3566 | BL122: 1510 | BM122: 498
A123: 121 | B123: 宋远桥 | C123: 武当贺寿 | D123: 10 | F123: 79 | G123: 41 | H123: 1 | I123: 121 | K123: 殷梨亭 | L123: 41 | M123: 2597 | N123: 1552 | O123: 3601 | P123: 1525 | Q123: 502 | W123: 张翠山 | X123: 41 | Y123: 2597 | Z123: 1552 | AA123: 3601 | AB123: 1525 | AC123: 502 | AI123: 张松溪 | AJ123: 41 | AK123: 2597 | AL123: 1552 | AM123: 3601 | AN123: 1525 | AO123: 502 | AU123: 俞莲舟 | AV123: 42 | AW123: 2597 | AX123: 1552 | AY123: 3601 | AZ123: 1525 | BA123: 502 | BG123: 宋远桥 | BH123: 42 | BI123: 2597 | BJ123: 1552 | BK123: 3601 | BL123: 1525 | BM123: 502
A124: 122 | B124: 张三丰 | C124: 武当贺寿 | D124: 11 | F124: 125 | G124: 41 | H124: 1 | I124: 122 | K124: 张三丰 | L124: 42 | M124: 2815 | N124: 1683 | O124: 19730 | P124: 8280 | Q124: 2760
A125: 123 | B125: 狂刀汉 | C125: 龙门镖局 | D125: 1 | F125: 110 | G125: 41 | H125: 1 | I125: 123 | K125: 狂刀汉 | L125: 41 | M125: 2820 | N125: 1686 | O125: 3953 | P125: 1659 | Q125: 553 | W125: 狂刀汉 | X125: 41 | Y125: 2820 | Z125: 1686 | AA125: 3953 | AB125: 1659 | AC125: 553 | AI125: 狂刀汉 | AJ125: 41 | AK125: 2820 | AL125: 1686 | AM125: 3953 | AN125: 1659 | AO125: 553 | AU125: 狂刀汉 | AV125: 41 | AW125: 2820 | AX125: 1686 | AY125: 3953 | AZ125: 1659 | BA125: 553 | BG125: 狂刀汉 | BH125: 41 | BI125: 2820 | BJ125: 1686 | BK125: 3953 | BL125: 1659 | BM125: 553
A126: 124 | B126: 御甲师 | C126: 龙门镖局 | D126: 2 | F126: 7 | G126: 41 | H126: 1 | I126: 124 | K126: 御甲师 | L126: 41 | M126: 2825 | N126: 1689 | O126: 3960 | P126: 1662 | Q126: 554 | W126: 御甲师 | X126: 41 | Y126: 2825 | Z126: 1689 | AA126: 3960 | AB126: 1662 | AC126: 554 | AI126: 御甲师 | AJ126: 41 | AK126: 2825 | AL126: 1689 | AM126: 3960 | AN126: 1662 | AO126: 554 | AU126: 御甲师 | AV126: 41 | AW126: 2825 | AX126: 1689 | AY126: 3960 | AZ126: 1662 | BA126: 554 | BG126: 御甲师 | BH126: 41 | BI126: 2825 | BJ126: 1689 | BK126: 3960 | BL126: 1662 | BM126: 554
A127: 125 | B127: 祝镖头 | C127: 龙门镖局 | D127: 3 | F127: 8 | G127: 41 | H127: 1 | I127: 125 | K127: 狂刀汉 | L127: 41 | M127: 2830 | N127: 1692 | O127: 3967 | P127: 1665 | Q127: 555 | W127: 狂刀汉 | X127: 41 | Y127: 2830 | Z127: 1692 | AA127: 3967 | AB127: 1665 | AC127: 555 | AI127: 御甲师 | AJ127: 41 | AK127: 2830 | AL127: 1692 | AM127: 3967 | AN127: 1665 | AO127: 555 | AU127: 御甲师 | AV127: 41 | AW127: 2830 | AX127: 1692 | AY127: 3967 | AZ127: 1665 | BA127: 555 | BG127: 祝镖头 | BH127: 42 | BI127: 2830 | BJ127: 1692 | BK127: 3967 | BL127: 1665 | BM127: 555
A128: 126 | B128: 史镖头 | C128: 龙门镖局 | D128: 4 | F128: 8 | G128: 42 | H128: 1 | I128: 126 | K128: 狂刀汉 | L128: 42 | M128: 2835 | N128: 1695 | O128: 3974 | P128: 1668 | Q128: 556 | W128: 狂刀汉 | X128: 42 | Y128: 2835 | Z128: 1695 | AA128: 3974 | AB128: 1668 | AC128: 556 | AI128: 御甲师 | AJ128: 42 | AK128: 2835 | AL128: 1695 | AM128: 3974 | AN128: 1668 | AO128: 556 | AU128: 御甲师 | AV128: 42 | AW128: 2835 | AX128: 1695 | AY128: 3974 | AZ128: 1668 | BA128: 556 | BG128: 史镖头 | BH128: 43 | BI128: 2835 | BJ128: 1695 | BK128: 3974 | BL128: 1668 | BM128: 556
A129: 127 | B129: 都大锦 | C129: 龙门镖局 | D129: 5 | F129: 11 | G129: 42 | H129: 1 | I129: 127 | K129: 狂刀汉 | L129: 42 | M129: 2840 | N129: 1698 | O129: 3981 | P129: 1671 | Q129: 557 | W129: 狂刀汉 | X129: 42 | Y129: 2840 | Z129: 1698 | AA129: 3981 | AB129: 1671 | AC129: 557 | AI129: 御甲师 | AJ129: 42 | AK129: 2840 | AL129: 1698 | AM129: 3981 | AN129: 1671 | AO129: 557 | AU129: 御甲师 | AV129: 42 | AW129: 2840 | AX129: 1698 | AY129: 3981 | AZ129: 1671 | BA129: 557 | BG129: 都大锦 | BH129: 43 | BI129: 2840 | BJ129: 1698 | BK129: 3981 | BL129: 1671 | BM129: 557
A130: 128 | B130: 慧光 | C130: 龙门镖局 | D130: 6 | F130: 20 | G130: 42 | H130: 1 | I130: 128 | K130: 御甲师 | L130: 42 | M130: 2845 | N130: 1701 | O130: 3988 | P130: 1674 | Q130: 558 | W130: 御甲师 | X130: 42 | Y130: 2845 | Z130: 1701 | AA130: 3988 | AB130: 1674 | AC130: 558 | AI130: 匿踪客 | AJ130: 42 | AK130: 2845 | AL130: 1701 | AM130: 3988 | AN130: 1674 | AO130: 558 | AU130: 匿踪客 | AV130: 42 | AW130: 2845 | AX130: 1701 | AY130: 3988 | AZ130: 1674 | BA130: 558 | BG130: 慧光 | BH130: 43 | BI130: 2845 | BJ130: 1701 | BK130: 3988 | BL130: 1674 | BM130: 558
A131: 129 | B131: 慧通 | C131: 龙门镖局 | D131: 7 | F131: 20 | G131: 42 | H131: 1 | I131: 129 | K131: 御甲师 | L131: 42 | M131: 2850 | N131: 1704 | O131: 3995 | P131: 1677 | Q131: 559 | W131: 御甲师 | X131: 42 | Y131: 2850 | Z131: 1704 | AA131: 3995 | AB131: 1677 | AC131: 559 | AI131: 匿踪客 | AJ131: 42 | AK131: 2850 | AL131: 1704 | AM131: 3995 | AN131: 1677 | AO131: 559 | AU131: 慧光 | AV131: 43 | AW131: 2850 | AX131: 1704 | AY131: 3995 | AZ131: 1677 | BA131: 559 | BG131: 慧通 | BH131: 43 | BI131: 2850 | BJ131: 1704 | BK131: 3995 | BL131: 1677 | BM131: 559
A132: 130 | B132: 圆心 | C132: 龙门镖局 | D132: 8 | F132: 23 | G132: 42 | H132: 1 | I132: 130 | K132: 御甲师 | L132: 42 | M132: 2855 | N132: 1707 | O132: 4002 | P132: 1680 | Q132: 560 | W132: 御甲师 | X132: 42 | Y132: 2855 | Z132: 1707 | AA132: 4002 | AB132: 1680 | AC132: 560 | AI132: 慧光 | AJ132: 43 | AK132: 2855 | AL132: 1707 | AM132: 4002 | AN132: 1680 | AO132: 560 | AU132: 慧通 | AV132: 43 | AW132: 2855 | AX132: 1707 | AY132: 4002 | AZ132: 1680 | BA132: 560 | BG132: 圆心 | BH132: 43 | BI132: 2855 | BJ132: 1707 | BK132: 4002 | BL132: 1680 | BM132: 560
A133: 131 | B133: 慧心 | C133: 龙门镖局 | D133: 9 | F133: 20 | G133: 42 | H133: 1 | I133: 131 | K133: 御甲师 | L133: 42 | M133: 2860 | N133: 1710 | O133: 4010 | P133: 1683 | Q133: 561 | W133: 慧光 | X133: 43 | Y133: 2860 | Z133: 1710 | AA133: 4010 | AB133: 1683 | AC133: 561 | AI133: 慧通 | AJ133: 43 | AK133: 2860 | AL133: 1710 | AM133: 4010 | AN133: 1683 | AO133: 561 | AU133: 圆心 | AV133: 43 | AW133: 2860 | AX133: 1710 | AY133: 4010 | AZ133: 1683 | BA133: 561 | BG133: 慧心 | BH133: 43 | BI133: 2860 | BJ133: 1710 | BK133: 4010 | BL133: 1683 | BM133: 561
A134: 132 | B134: 慧青 | C134: 龙门镖局 | D134: 10 | F134: 20 | G134: 43 | H134: 1 | I134: 132 | K134: 慧光 | L134: 43 | M134: 2865 | N134: 1713 | O134: 4018 | P134: 1686 | Q134: 562 | W134: 慧通 | X134: 43 | Y134: 2865 | Z134: 1713 | AA134: 4018 | AB134: 1686 | AC134: 562 | AI134: 圆心 | AJ134: 43 | AK134: 2865 | AL134: 1713 | AM134: 4018 | AN134: 1686 | AO134: 562 | AU134: 慧心 | AV134: 43 | AW134: 2865 | AX134: 1713 | AY134: 4018 | AZ134: 1686 | BA134: 562 | BG134: 慧青 | BH134: 44 | BI134: 2865 | BJ134: 1713 | BK134: 4018 | BL134: 1686 | BM134: 562
A135: 133 | B135: 慧明 | C135: 龙门镖局 | D135: 11 | F135: 20 | G135: 43 | H135: 1 | I135: 133 | K135: 少林弟子 | L135: 43 | M135: 2870 | N135: 1716 | O135: 4026 | P135: 1689 | Q135: 563 | W135: 狂刀汉 | X135: 43 | Y135: 2870 | Z135: 1716 | AA135: 4026 | AB135: 1689 | AC135: 563 | AI135: 御甲师 | AJ135: 43 | AK135: 2870 | AL135: 1716 | AM135: 4026 | AN135: 1689 | AO135: 563 | AU135: 少林弟子 | AV135: 43 | AW135: 2870 | AX135: 1716 | AY135: 4026 | AZ135: 1689 | BA135: 563 | BG135: 慧明 | BH135: 44 | BI135: 2870 | BJ135: 1716 | BK135: 4026 | BL135: 1689 | BM135: 563
A136: 134 | B136: 慧风 | C136: 龙门镖局 | D136: 12 | F136: 20 | G136: 43 | H136: 1 | I136: 134 | K136: 少林弟子 | L136: 43 | M136: 2875 | N136: 1719 | O136: 4034 | P136: 1692 | Q136: 564 | W136: 狂刀汉 | X136: 43 | Y136: 2875 | Z136: 1719 | AA136: 4034 | AB136: 1692 | AC136: 564 | AI136: 御甲师 | AJ136: 43 | AK136: 2875 | AL136: 1719 | AM136: 4034 | AN136: 1692 | AO136: 564 | AU136: 少林弟子 | AV136: 43 | AW136: 2875 | AX136: 1719 | AY136: 4034 | AZ136: 1692 | BA136: 564 | BG136: 慧风 | BH136: 44 | BI136: 2875 | BJ136: 1719 | BK136: 4034 | BL136: 1692 | BM136: 564
A137: 135 | B137: 圆音 | C137: 龙门镖局 | D137: 13 | F137: 22 | G137: 43 | H137: 1 | I137: 135 | K137: 少林弟子 | L137: 43 | M137: 2880 | N137: 1722 | O137: 4042 | P137: 1695 | Q137: 565 | W137: 狂刀汉 | X137: 43 | Y137: 2880 | Z137: 1722 | AA137: 4042 | AB137: 1695 | AC137: 565 | AI137: 御甲师 | AJ137: 43 | AK137: 2880 | AL137: 1722 | AM137: 4042 | AN137: 1695 | AO137: 565 | AU137: 少林弟子 | AV137: 43 | AW137: 2880 | AX137: 1722 | AY137: 4042 | AZ137: 1695 | BA137: 565 | BG137: 圆音 | BH137: 44 | BI137: 2880 | BJ137: 1722 | BK137: 4042 | BL137: 1695 | BM137: 565
A138: 136 | B138: 圆业 | C138: 龙门镖局 | D138: 14 | F138: 22 | G138: 43 | H138: 1 | I138: 136 | K138: 少林弟子 | L138: 43 | M138: 2885 | N138: 1725 | O138: 4050 | P138: 1698 | Q138: 566 | W138: 狂刀汉 | X138: 43 | Y138: 2885 | Z138: 1725 | AA138: 4050 | AB138: 1698 | AC138: 566 | AI138: 御甲师 | AJ138: 43 | AK138: 2885 | AL138: 1725 | AM138: 4050 | AN138: 1698 | AO138: 566 | AU138: 少林弟子 | AV138: 43 | AW138: 2885 | AX138: 1725 | AY138: 4050 | AZ138: 1698 | BA138: 566 | BG138: 圆业 | BH138: 44 | BI138: 2885 | BJ138: 1725 | BK138: 4050 | BL138: 1698 | BM138: 566
A139: 137 | B139: 殷素素 | C139: 龙门镖局 | D139: 15 | F139: 103 | G139: 43 | H139: 1 | I139: 137 | K139: 天鹰教弟子 | L139: 43 | M139: 2890 | N139: 1728 | O139: 4058 | P139: 1701 | Q139: 567 | W139: 嗜毒女 | X139: 43 | Y139: 2890 | Z139: 1728 | AA139: 4058 | AB139: 1701 | AC139: 567 | AI139: 嗜毒女 | AJ139: 43 | AK139: 2890 | AL139: 1728 | AM139: 4058 | AN139: 1701 | AO139: 567 | AU139: 匿踪客 | AV139: 43 | AW139: 2890 | AX139: 1728 | AY139: 4058 | AZ139: 1701 | BA139: 567 | BG139: 殷素素 | BH139: 44 | BI139: 2890 | BJ139: 1728 | BK139: 4058 | BL139: 1701 | BM139: 567
A140: 138 | B140: 张翠山 | C140: 龙门镖局 | D140: 16 | F140: 84 | G140: 44 | H140: 1 | I140: 138 | K140: 张翠山 | L140: 45 | M140: 2937 | N140: 1756 | O140: 20590 | P140: 8640 | Q140: 2880
A141: 139 | B141: 巨鲸帮众 | C141: 王盘山扬刀 | D141: 1 | F141: 28 | G141: 44 | H141: 1 | I141: 139 | K141: 狂刀汉 | L141: 44 | M141: 2951 | N141: 1764 | O141: 4138 | P141: 1736 | Q141: 578 | W141: 狂刀汉 | X141: 44 | Y141: 2951 | Z141: 1764 | AA141: 4138 | AB141: 1736 | AC141: 578 | AI141: 御甲师 | AJ141: 44 | AK141: 2951 | AL141: 1764 | AM141: 4138 | AN141: 1736 | AO141: 578 | AU141: 御甲师 | AV141: 44 | AW141: 2951 | AX141: 1764 | AY141: 4138 | AZ141: 1736 | BA141: 578 | BG141: 巨鲸帮弟子 | BH141: 44 | BI141: 2951 | BJ141: 1764 | BK141: 4138 | BL141: 1736 | BM141: 578
A142: 140 | B142: 常金鹏 | C142: 王盘山扬刀 | D142: 2 | F142: 31 | G142: 44 | H142: 1 | I142: 140 | K142: 狂刀汉 | L142: 44 | M142: 2965 | N142: 1772 | O142: 4158 | P142: 1744 | Q142: 580 | W142: 御甲师 | X142: 44 | Y142: 2965 | Z142: 1772 | AA142: 4158 | AB142: 1744 | AC142: 580 | AI142: 御甲师 | AJ142: 44 | AK142: 2965 | AL142: 1772 | AM142: 4158 | AN142: 1744 | AO142: 580 | AU142: 御甲师 | AV142: 44 | AW142: 2965 | AX142: 1772 | AY142: 4158 | AZ142: 1744 | BA142: 580 | BG142: 常金鹏 | BH142: 45 | BI142: 2965 | BJ142: 1772 | BK142: 4158 | BL142: 1744 | BM142: 580
A143: 141 | B143: 高则诚 | C143: 王盘山扬刀 | D143: 3 | F143: 82 | G143: 44 | H143: 1 | I143: 141 | K143: 御甲师 | L143: 44 | M143: 2979 | N143: 1780 | O143: 4178 | P143: 1752 | Q143: 582 | W143: 御甲师 | X143: 44 | Y143: 2979 | Z143: 1780 | AA143: 4178 | AB143: 1752 | AC143: 582 | AI143: 巨鲸帮弟子 | AJ143: 44 | AK143: 2979 | AL143: 1780 | AM143: 4178 | AN143: 1752 | AO143: 582 | AU143: 巨鲸帮弟子 | AV143: 44 | AW143: 2979 | AX143: 1780 | AY143: 4178 | AZ143: 1752 | BA143: 582 | BG143: 高则诚 | BH143: 45 | BI143: 2979 | BJ143: 1780 | BK143: 4178 | BL143: 1752 | BM143: 582
A144: 142 | B144: 蒋涛 | C144: 王盘山扬刀 | D144: 4 | F144: 82 | G144: 44 | H144: 1 | I144: 142 | K144: 巨鲸帮弟子 | L144: 44 | M144: 2993 | N144: 1788 | O144: 4198 | P144: 1760 | Q144: 584 | W144: 御甲师 | X144: 44 | Y144: 2993 | Z144: 1788 | AA144: 4198 | AB144: 1760 | AC144: 584 | AI144: 狂刀汉 | AJ144: 44 | AK144: 2993 | AL144: 1788 | AM144: 4198 | AN144: 1760 | AO144: 584 | AU144: 巨鲸帮弟子 | AV144: 44 | AW144: 2993 | AX144: 1788 | AY144: 4198 | AZ144: 1760 | BA144: 584 | BG144: 蒋涛 | BH144: 45 | BI144: 2993 | BJ144: 1788 | BK144: 4198 | BL144: 1760 | BM144: 584
A145: 143 | B145: 元广波 | C145: 王盘山扬刀 | D145: 5 | F145: 49 | G145: 44 | H145: 1 | I145: 143 | K145: 巨鲸帮弟子 | L145: 44 | M145: 3007 | N145: 1796 | O145: 4218 | P145: 1768 | Q145: 586 | W145: 巨鲸帮弟子 | X145: 44 | Y145: 3007 | Z145: 1796 | AA145: 4218 | AB145: 1768 | AC145: 586 | AI145: 狂刀汉 | AJ145: 44 | AK145: 3007 | AL145: 1796 | AM145: 4218 | AN145: 1768 | AO145: 586 | AU145: 狂刀汉 | AV145: 44 | AW145: 3007 | AX145: 1796 | AY145: 4218 | AZ145: 1768 | BA145: 586 | BG145: 元广波 | BH145: 45 | BI145: 3007 | BJ145: 1796 | BK145: 4218 | BL145: 1768 | BM145: 586
A146: 144 | B146: 菜四 | C146: 王盘山扬刀 | D146: 6 | F146: 49 | G146: 45 | H146: 1 | I146: 144 | K146: 御甲师 | L146: 45 | M146: 3022 | N146: 1804 | O146: 4239 | P146: 1776 | Q146: 588 | W146: 御甲师 | X146: 45 | Y146: 3022 | Z146: 1804 | AA146: 4239 | AB146: 1776 | AC146: 588 | AI146: 御甲师 | AJ146: 45 | AK146: 3022 | AL146: 1804 | AM146: 4239 | AN146: 1776 | AO146: 588 | AU146: 巨鲸帮弟子 | AV146: 45 | AW146: 3022 | AX146: 1804 | AY146: 4239 | AZ146: 1776 | BA146: 588 | BG146: 菜四 | BH146: 46 | BI146: 3022 | BJ146: 1804 | BK146: 4239 | BL146: 1776 | BM146: 588
A147: 145 | B147: 花青山 | C147: 王盘山扬刀 | D147: 7 | F147: 49 | G147: 45 | H147: 1 | I147: 145 | K147: 嗜毒女 | L147: 45 | M147: 3037 | N147: 1813 | O147: 4260 | P147: 1784 | Q147: 590 | W147: 嗜毒女 | X147: 45 | Y147: 3037 | Z147: 1813 | AA147: 4260 | AB147: 1784 | AC147: 590 | AI147: 御甲师 | AJ147: 45 | AK147: 3037 | AL147: 1813 | AM147: 4260 | AN147: 1784 | AO147: 590 | AU147: 巨鲸帮弟子 | AV147: 45 | AW147: 3037 | AX147: 1813 | AY147: 4260 | AZ147: 1784 | BA147: 590 | BG147: 花青山 | BH147: 46 | BI147: 3037 | BJ147: 1813 | BK147: 4260 | BL147: 1784 | BM147: 590
A148: 146 | B148: 海马胡六 | C148: 王盘山扬刀 | D148: 8 | F148: 49 | G148: 45 | H148: 1 | I148: 146 | K148: 狂刀汉 | L148: 45 | M148: 3052 | N148: 1822 | O148: 4281 | P148: 1792 | Q148: 592 | W148: 嗜毒女 | X148: 45 | Y148: 3052 | Z148: 1822 | AA148: 4281 | AB148: 1792 | AC148: 592 | AI148: 狂刀汉 | AJ148: 45 | AK148: 3052 | AL148: 1822 | AM148: 4281 | AN148: 1792 | AO148: 592 | AU148: 巨鲸帮弟子 | AV148: 45 | AW148: 3052 | AX148: 1822 | AY148: 4281 | AZ148: 1792 | BA148: 592 | BG148: 海马胡六 | BH148: 46 | BI148: 3052 | BJ148: 1822 | BK148: 4281 | BL148: 1792 | BM148: 592
A149: 147 | B149: 麦鲸 | C149: 王盘山扬刀 | D149: 9 | F149: 49 | G149: 45 | H149: 1 | I149: 147 | K149: 狂刀汉 | L149: 45 | M149: 3067 | N149: 1831 | O149: 4302 | P149: 1800 | Q149: 594 | W149: 狂刀汉 | X149: 45 | Y149: 3067 | Z149: 1831 | AA149: 4302 | AB149: 1800 | AC149: 594 | AI149: 狂刀汉 | AJ149: 45 | AK149: 3067 | AL149: 1831 | AM149: 4302 | AN149: 1800 | AO149: 594 | AU149: 巨鲸帮弟子 | AV149: 45 | AW149: 3067 | AX149: 1831 | AY149: 4302 | AZ149: 1800 | BA149: 594 | BG149: 麦鲸 | BH149: 46 | BI149: 3067 | BJ149: 1831 | BK149: 4302 | BL149: 1800 | BM149: 594
A150: 148 | B150: 过三拳 | C150: 王盘山扬刀 | D150: 10 | F150: 49 | G150: 45 | H150: 1 | I150: 148 | K150: 御甲师 | L150: 45 | M150: 3082 | N150: 1840 | O150: 4323 | P150: 1809 | Q150: 596 | W150: 嗜毒女 | X150: 45 | Y150: 3082 | Z150: 1840 | AA150: 4323 | AB150: 1809 | AC150: 596 | AI150: 狂刀汉 | AJ150: 45 | AK150: 3082 | AL150: 1840 | AM150: 4323 | AN150: 1809 | AO150: 596 | AU150: 巨鲸帮弟子 | AV150: 45 | AW150: 3082 | AX150: 1840 | AY150: 4323 | AZ150: 1809 | BA150: 596 | BG150: 过三拳 | BH150: 46 | BI150: 3082 | BJ150: 1840 | BK150: 4323 | BL150: 1809 | BM150: 596
A151: 149 | B151: 常金鹏 | C151: 王盘山扬刀 | D151: 11 | F151: 31 | G151: 45 | H151: 1 | I151: 149 | K151: 御甲师 | L151: 45 | M151: 3097 | N151: 1849 | O151: 4344 | P151: 1818 | Q151: 598 | W151: 御甲师 | X151: 45 | Y151: 3097 | Z151: 1849 | AA151: 4344 | AB151: 1818 | AC151: 598 | AI151: 御甲师 | AJ151: 45 | AK151: 3097 | AL151: 1849 | AM151: 4344 | AN151: 1818 | AO151: 598 | AU151: 巨鲸帮弟子 | AV151: 45 | AW151: 3097 | AX151: 1849 | AY151: 4344 | AZ151: 1818 | BA151: 598 | BG151: 常金鹏 | BH151: 46 | BI151: 3097 | BJ151: 1849 | BK151: 4344 | BL151: 1818 | BM151: 598
A152: 150 | B152: 白龟寿 | C152: 王盘山扬刀 | D152: 12 | F152: 44 | G152: 46 | H152: 1 | I152: 150 | K152: 嗜毒女 | L152: 46 | M152: 3112 | N152: 1858 | O152: 4365 | P152: 1827 | Q152: 600 | W152: 狂刀汉 | X152: 46 | Y152: 3112 | Z152: 1858 | AA152: 4365 | AB152: 1827 | AC152: 600 | AI152: 御甲师 | AJ152: 46 | AK152: 3112 | AL152: 1858 | AM152: 4365 | AN152: 1827 | AO152: 600 | AU152: 巨鲸帮弟子 | AV152: 46 | AW152: 3112 | AX152: 1858 | AY152: 4365 | AZ152: 1827 | BA152: 600 | BG152: 白龟寿 | BH152: 47 | BI152: 3112 | BJ152: 1858 | BK152: 4365 | BL152: 1827 | BM152: 600
A153: 151 | B153: 常金鹏 | C153: 王盘山扬刀 | D153: 13 | F153: 31 | G153: 46 | H153: 1 | I153: 151 | K153: 嗜毒女 | L153: 46 | M153: 3127 | N153: 1867 | O153: 4386 | P153: 1836 | Q153: 603 | W153: 狂刀汉 | X153: 46 | Y153: 3127 | Z153: 1867 | AA153: 4386 | AB153: 1836 | AC153: 603 | AI153: 御甲师 | AJ153: 46 | AK153: 3127 | AL153: 1867 | AM153: 4386 | AN153: 1836 | AO153: 603 | AU153: 巨鲸帮弟子 | AV153: 46 | AW153: 3127 | AX153: 1867 | AY153: 4386 | AZ153: 1836 | BA153: 603 | BG153: 常金鹏 | BH153: 47 | BI153: 3127 | BJ153: 1867 | BK153: 4386 | BL153: 1836 | BM153: 603
A154: 152 | B154: 殷素素 | C154: 王盘山扬刀 | D154: 14 | F154: 103 | G154: 46 | H154: 1 | I154: 152 | K154: 嗜毒女 | L154: 46 | M154: 3142 | N154: 1876 | O154: 4407 | P154: 1845 | Q154: 606 | W154: 嗜毒女 | X154: 46 | Y154: 3142 | Z154: 1876 | AA154: 4407 | AB154: 1845 | AC154: 606 | AI154: 天鹰教弟子 | AJ154: 46 | AK154: 3142 | AL154: 1876 | AM154: 4407 | AN154: 1845 | AO154: 606 | AU154: 天鹰教弟子 | AV154: 46 | AW154: 3142 | AX154: 1876 | AY154: 4407 | AZ154: 1845 | BA154: 606 | BG154: 殷素素 | BH154: 47 | BI154: 3142 | BJ154: 1876 | BK154: 4407 | BL154: 1845 | BM154: 606
A155: 153 | B155: 张翠山 | C155: 王盘山扬刀 | D155: 15 | F155: 84 | G155: 46 | H155: 1 | I155: 153 | K155: 御甲师 | L155: 46 | M155: 3157 | N155: 1885 | O155: 4429 | P155: 1854 | Q155: 609 | W155: 御甲师 | X155: 46 | Y155: 3157 | Z155: 1885 | AA155: 4429 | AB155: 1854 | AC155: 609 | AI155: 武当弟子 | AJ155: 46 | AK155: 3157 | AL155: 1885 | AM155: 4429 | AN155: 1854 | AO155: 609 | AU155: 武当弟子 | AV155: 46 | AW155: 3157 | AX155: 1885 | AY155: 4429 | AZ155: 1854 | BA155: 609 | BG155: 张翠山 | BH155: 47 | BI155: 3157 | BJ155: 1885 | BK155: 4429 | BL155: 1854 | BM155: 609
A156: 154 | B156: 谢逊 | C156: 王盘山扬刀 | D156: 16 | F156: 135 | G156: 46 | H156: 1 | I156: 154 | K156: 谢逊 | L156: 47 | M156: 3182 | N156: 1903 | O156: 22305 | P156: 9360 | Q156: 3120
A157: 155 | B157: 华山弟子 | C157: 聆秘 | D157: 1 | F157: 84 | G157: 46 | H157: 1 | I157: 155 | K157: 狂刀汉 | L157: 47 | M157: 3188 | N157: 1906 | O157: 4469 | P157: 1875 | Q157: 625 | W157: 狂刀汉 | X157: 47 | Y157: 3188 | Z157: 1906 | AA157: 4469 | AB157: 1875 | AC157: 625 | AI157: 巨力士 | AJ157: 47 | AK157: 3188 | AL157: 1906 | AM157: 4469 | AN157: 1875 | AO157: 625 | AU157: 华山弟子 | AV157: 47 | AW157: 3188 | AX157: 1906 | AY157: 4469 | AZ157: 1875 | BA157: 625 | BG157: 华山弟子 | BH157: 47 | BI157: 3188 | BJ157: 1906 | BK157: 4469 | BL157: 1875 | BM157: 625
A158: 156 | B158: 劳德诺 | C158: 聆秘 | D158: 2 | F158: 32 | G158: 47 | H158: 1 | I158: 156 | K158: 狂刀汉 | L158: 47 | M158: 3194 | N158: 1909 | O158: 4477 | P158: 1878 | Q158: 626 | W158: 狂刀汉 | X158: 47 | Y158: 3194 | Z158: 1909 | AA158: 4477 | AB158: 1878 | AC158: 626 | AI158: 巨力士 | AJ158: 47 | AK158: 3194 | AL158: 1909 | AM158: 4477 | AN158: 1878 | AO158: 626 | AU158: 华山弟子 | AV158: 47 | AW158: 3194 | AX158: 1909 | AY158: 4477 | AZ158: 1878 | BA158: 626 | BG158: 劳德诺 | BH158: 48 | BI158: 3194 | BJ158: 1909 | BK158: 4477 | BL158: 1878 | BM158: 626
A159: 157 | B159: 施带子 | C159: 聆秘 | D159: 3 | F159: 84 | G159: 47 | H159: 1 | I159: 157 | K159: 华山弟子 | L159: 47 | M159: 3200 | N159: 1912 | O159: 4485 | P159: 1881 | Q159: 627 | W159: 狂刀汉 | X159: 47 | Y159: 3200 | Z159: 1912 | AA159: 4485 | AB159: 1881 | AC159: 627 | AI159: 巨力士 | AJ159: 47 | AK159: 3200 | AL159: 1912 | AM159: 4485 | AN159: 1881 | AO159: 627 | AU159: 华山弟子 | AV159: 47 | AW159: 3200 | AX159: 1912 | AY159: 4485 | AZ159: 1881 | BA159: 627 | BG159: 施带子 | BH159: 48 | BI159: 3200 | BJ159: 1912 | BK159: 4485 | BL159: 1881 | BM159: 627
A160: 158 | B160: 梁发 | C160: 聆秘 | D160: 4 | F160: 84 | G160: 47 | H160: 1 | I160: 158 | K160: 华山弟子 | L160: 47 | M160: 3206 | N160: 1915 | O160: 4493 | P160: 1884 | Q160: 628 | W160: 狂刀汉 | X160: 47 | Y160: 3206 | Z160: 1915 | AA160: 4493 | AB160: 1884 | AC160: 628 | AI160: 巨力士 | AJ160: 47 | AK160: 3206 | AL160: 1915 | AM160: 4493 | AN160: 1884 | AO160: 628 | AU160: 华山弟子 | AV160: 47 | AW160: 3206 | AX160: 1915 | AY160: 4493 | AZ160: 1884 | BA160: 628 | BG160: 梁发 | BH160: 48 | BI160: 3206 | BJ160: 1915 | BK160: 4493 | BL160: 1884 | BM160: 628
A161: 159 | B161: 高根明 | C161: 聆秘 | D161: 5 | F161: 84 | G161: 47 | H161: 1 | I161: 159 | K161: 巨力士 | L161: 47 | M161: 3212 | N161: 1918 | O161: 4501 | P161: 1887 | Q161: 629 | W161: 华山弟子 | X161: 47 | Y161: 3212 | Z161: 1918 | AA161: 4501 | AB161: 1887 | AC161: 629 | AI161: 巨力士 | AJ161: 47 | AK161: 3212 | AL161: 1918 | AM161: 4501 | AN161: 1887 | AO161: 629 | AU161: 华山弟子 | AV161: 47 | AW161: 3212 | AX161: 1918 | AY161: 4501 | AZ161: 1887 | BA161: 629 | BG161: 高根明 | BH161: 48 | BI161: 3212 | BJ161: 1918 | BK161: 4501 | BL161: 1887 | BM161: 629
A162: 160 | B162: 陆大有 | C162: 聆秘 | D162: 6 | F162: 84 | G162: 47 | H162: 1 | I162: 160 | K162: 华山弟子 | L162: 47 | M162: 3218 | N162: 1921 | O162: 4510 | P162: 1890 | Q162: 630 | W162: 巨力士 | X162: 47 | Y162: 3218 | Z162: 1921 | AA162: 4510 | AB162: 1890 | AC162: 630 | AI162: 巨力士 | AJ162: 47 | AK162: 3218 | AL162: 1921 | AM162: 4510 | AN162: 1890 | AO162: 630 | AU162: 华山弟子 | AV162: 47 | AW162: 3218 | AX162: 1921 | AY162: 4510 | AZ162: 1890 | BA162: 630 | BG162: 陆大有 | BH162: 48 | BI162: 3218 | BJ162: 1921 | BK162: 4510 | BL162: 1890 | BM162: 630
A163: 161 | B163: 岳灵珊 | C163: 聆秘 | D163: 7 | F163: 99 | G163: 47 | H163: 1 | I163: 161 | K163: 巨力士 | L163: 47 | M163: 3224 | N163: 1924 | O163: 4519 | P163: 1893 | Q163: 631 | W163: 华山弟子 | X163: 47 | Y163: 3224 | Z163: 1924 | AA163: 4519 | AB163: 1893 | AC163: 631 | AI163: 巨力士 | AJ163: 47 | AK163: 3224 | AL163: 1924 | AM163: 4519 | AN163: 1893 | AO163: 631 | AU163: 华山弟子 | AV163: 47 | AW163: 3224 | AX163: 1924 | AY163: 4519 | AZ163: 1893 | BA163: 631 | BG163: 岳灵珊 | BH163: 48 | BI163: 3224 | BJ163: 1924 | BK163: 4519 | BL163: 1893 | BM163: 631
A164: 162 | B164: 定逸师太 | C164: 聆秘 | D164: 8 | F164: 114 | G164: 47 | H164: 1 | I164: 162 | K164: 华山弟子 | L164: 47 | M164: 3230 | N164: 1927 | O164: 4528 | P164: 1896 | Q164: 632 | W164: 华山弟子 | X164: 47 | Y164: 3230 | Z164: 1927 | AA164: 4528 | AB164: 1896 | AC164: 632 | AI164: 恒山弟子 | AJ164: 47 | AK164: 3230 | AL164: 1927 | AM164: 4528 | AN164: 1896 | AO164: 632 | AU164: 恒山弟子 | AV164: 47 | AW164: 3230 | AX164: 1927 | AY164: 4528 | AZ164: 1896 | BA164: 632 | BG164: 定逸师太 | BH164: 48 | BI164: 3230 | BJ164: 1927 | BK164: 4528 | BL164: 1896 | BM164: 632
A165: 163 | B165: 何三七 | C165: 聆秘 | D165: 9 | F165: 6 | G165: 48 | H165: 1 | I165: 163 | K165: 何三七 | L165: 49 | M165: 3236 | N165: 1930 | O165: 4537 | P165: 1899 | Q165: 633
A166: 164 | B166: 向大年 | C166: 聆秘 | D166: 10 | F166: 110 | G166: 48 | H166: 1 | I166: 164 | K166: 向大年 | L166: 49 | M166: 3304 | N166: 1976 | O166: 23165 | P166: 9720 | Q166: 3240
A167: 165 | B167: 仪琳 | C167: 回雁楼 | D167: 1 | F167: 105 | G167: 48 | H167: 1 | I167: 165 | K167: 华山弟子 | L167: 48 | M167: 3337 | N167: 1995 | O167: 4679 | P167: 1963 | Q167: 654 | W167: 华山弟子 | X167: 48 | Y167: 3337 | Z167: 1995 | AA167: 4679 | AB167: 1963 | AC167: 654 | AI167: 恒山弟子 | AJ167: 48 | AK167: 3337 | AL167: 1995 | AM167: 4679 | AN167: 1963 | AO167: 654 | AU167: 恒山弟子 | AV167: 48 | AW167: 3337 | AX167: 1995 | AY167: 4679 | AZ167: 1963 | BA167: 654 | BG167: 仪琳 | BH167: 49 | BI167: 3337 | BJ167: 1995 | BK167: 4679 | BL167: 1963 | BM167: 654
A168: 166 | B168: 梨人洪 | C168: 回雁楼 | D168: 2 | F168: 13 | G168: 48 | H168: 1 | I168: 166 | K168: 武当弟子 | L168: 48 | M168: 3370 | N168: 2014 | O168: 4725 | P168: 1982 | Q168: 660 | W168: 武当弟子 | X168: 48 | Y168: 3370 | Z168: 2014 | AA168: 4725 | AB168: 1982 | AC168: 660 | AI168: 华山弟子 | AJ168: 48 | AK168: 3370 | AL168: 2014 | AM168: 4725 | AN168: 1982 | AO168: 660 | AU168: 华山弟子 | AV168: 48 | AW168: 3370 | AX168: 2014 | AY168: 4725 | AZ168: 1982 | BA168: 660 | BG168: 梨人洪 | BH168: 49 | BI168: 3370 | BJ168: 2014 | BK168: 4725 | BL168: 1982 | BM168: 660
A169: 167 | B169: 田伯光 | C169: 回雁楼 | D169: 3 | F169: 49 | G169: 48 | H169: 1 | I169: 167 | K169: 巨力士 | L169: 48 | M169: 3403 | N169: 2034 | O169: 4772 | P169: 2001 | Q169: 666 | W169: 巨力士 | X169: 48 | Y169: 3403 | Z169: 2034 | AA169: 4772 | AB169: 2001 | AC169: 666 | AI169: 狂刀汉 | AJ169: 48 | AK169: 3403 | AL169: 2034 | AM169: 4772 | AN169: 2001 | AO169: 666 | AU169: 狂刀汉 | AV169: 48 | AW169: 3403 | AX169: 2034 | AY169: 4772 | AZ169: 2001 | BA169: 666 | BG169: 田伯光 | BH169: 49 | BI169: 3403 | BJ169: 2034 | BK169: 4772 | BL169: 2001 | BM169: 666
A170: 168 | B170: 迟百城 | C170: 回雁楼 | D170: 4 | F170: 112 | G170: 48 | H170: 1 | I170: 168 | K170: 武当弟子 | L170: 48 | M170: 3437 | N170: 2054 | O170: 4819 | P170: 2021 | Q170: 672 | W170: 华山弟子 | X170: 48 | Y170: 3437 | Z170: 2054 | AA170: 4819 | AB170: 2021 | AC170: 672 | AI170: 华山弟子 | AJ170: 48 | AK170: 3437 | AL170: 2054 | AM170: 4819 | AN170: 2021 | AO170: 672 | AU170: 恒山弟子 | AV170: 48 | AW170: 3437 | AX170: 2054 | AY170: 4819 | AZ170: 2021 | BA170: 672 | BG170: 迟百城 | BH170: 49 | BI170: 3437 | BJ170: 2054 | BK170: 4819 | BL170: 2021 | BM170: 672
A171: 169 | B171: 天松道人 | C171: 回雁楼 | D171: 5 | F171: 128 | G171: 48 | H171: 1 | I171: 169 | K171: 武当弟子 | L171: 48 | M171: 3471 | N171: 2074 | O171: 4867 | P171: 2041 | Q171: 678 | W171: 华山弟子 | X171: 48 | Y171: 3471 | Z171: 2074 | AA171: 4867 | AB171: 2041 | AC171: 678 | AI171: 华山弟子 | AJ171: 48 | AK171: 3471 | AL171: 2074 | AM171: 4867 | AN171: 2041 | AO171: 678 | AU171: 恒山弟子 | AV171: 48 | AW171: 3471 | AX171: 2074 | AY171: 4867 | AZ171: 2041 | BA171: 678 | BG171: 天松道人 | BH171: 49 | BI171: 3471 | BJ171: 2074 | BK171: 4867 | BL171: 2041 | BM171: 678
A172: 170 | B172: 青城弟子 | C172: 回雁楼 | D172: 6 | F172: 12 | G172: 49 | H172: 1 | I172: 170 | K172: 匿踪客 | L172: 49 | M172: 3505 | N172: 2094 | O172: 4915 | P172: 2061 | Q172: 684 | W172: 匿踪客 | X172: 49 | Y172: 3505 | Z172: 2094 | AA172: 4915 | AB172: 2061 | AC172: 684 | AI172: 狂刀汉 | AJ172: 49 | AK172: 3505 | AL172: 2094 | AM172: 4915 | AN172: 2061 | AO172: 684 | AU172: 青城弟子 | AV172: 49 | AW172: 3505 | AX172: 2094 | AY172: 4915 | AZ172: 2061 | BA172: 684 | BG172: 青城弟子 | BH172: 49 | BI172: 3505 | BJ172: 2094 | BK172: 4915 | BL172: 2061 | BM172: 684
A173: 171 | B173: 罗人杰 | C173: 回雁楼 | D173: 7 | F173: 14 | G173: 49 | H173: 1 | I173: 171 | K173: 匿踪客 | L173: 49 | M173: 3540 | N173: 2114 | O173: 4964 | P173: 2081 | Q173: 690 | W173: 匿踪客 | X173: 49 | Y173: 3540 | Z173: 2114 | AA173: 4964 | AB173: 2081 | AC173: 690 | AI173: 青城弟子 | AJ173: 49 | AK173: 3540 | AL173: 2114 | AM173: 4964 | AN173: 2081 | AO173: 690 | AU173: 青城弟子 | AV173: 49 | AW173: 3540 | AX173: 2114 | AY173: 4964 | AZ173: 2081 | BA173: 690 | BG173: 罗人杰 | BH173: 50 | BI173: 3540 | BJ173: 2114 | BK173: 4964 | BL173: 2081 | BM173: 690
A174: 172 | B174: 令狐冲 | C174: 回雁楼 | D174: 8 | F174: 116 | G174: 49 | H174: 1 | I174: 172 | K174: 令狐冲 | L174: 50 | M174: 3672 | N174: 2196 | O174: 25740 | P174: 10800 | Q174: 3600
A175: 173 | B175: 刘菁 | C175: 金盆洗手 | D175: 1 | F175: 107 | G175: 49 | H175: 1 | I175: 173 | K175: 匿踪客 | L175: 49 | M175: 3675 | N175: 2198 | O175: 5153 | P175: 2162 | Q175: 720 | W175: 匿踪客 | X175: 49 | Y175: 3675 | Z175: 2198 | AA175: 5153 | AB175: 2162 | AC175: 720 | AI175: 衡山弟子 | AJ175: 49 | AK175: 3675 | AL175: 2198 | AM175: 5153 | AN175: 2162 | AO175: 720 | AU175: 衡山弟子 | AV175: 49 | AW175: 3675 | AX175: 2198 | AY175: 5153 | AZ175: 2162 | BA175: 720 | BG175: 刘菁 | BH175: 50 | BI175: 3675 | BJ175: 2198 | BK175: 5153 | BL175: 2162 | BM175: 720
A176: 174 | B176: 刘子 | C176: 金盆洗手 | D176: 2 | F176: 19 | G176: 49 | H176: 1 | I176: 174 | K176: 狂刀汉 | L176: 49 | M176: 3678 | N176: 2200 | O176: 5158 | P176: 2164 | Q176: 720 | W176: 狂刀汉 | X176: 49 | Y176: 3678 | Z176: 2200 | AA176: 5158 | AB176: 2164 | AC176: 720 | AI176: 衡山弟子 | AJ176: 49 | AK176: 3678 | AL176: 2200 | AM176: 5158 | AN176: 2164 | AO176: 720 | AU176: 衡山弟子 | AV176: 49 | AW176: 3678 | AX176: 2200 | AY176: 5158 | AZ176: 2164 | BA176: 720 | BG176: 刘子 | BH176: 50 | BI176: 3678 | BJ176: 2200 | BK176: 5158 | BL176: 2164 | BM176: 720
A177: 175 | B177: 刘夫人 | C177: 金盆洗手 | D177: 3 | F177: 106 | G177: 49 | H177: 1 | I177: 175 | K177: 御甲师 | L177: 49 | M177: 3681 | N177: 2202 | O177: 5163 | P177: 2166 | Q177: 720 | W177: 御甲师 | X177: 49 | Y177: 3681 | Z177: 2202 | AA177: 5163 | AB177: 2166 | AC177: 720 | AI177: 衡山弟子 | AJ177: 49 | AK177: 3681 | AL177: 2202 | AM177: 5163 | AN177: 2166 | AO177: 720 | AU177: 衡山弟子 | AV177: 49 | AW177: 3681 | AX177: 2202 | AY177: 5163 | AZ177: 2166 | BA177: 720 | BG177: 刘夫人 | BH177: 50 | BI177: 3681 | BJ177: 2202 | BK177: 5163 | BL177: 2166 | BM177: 720
A178: 176 | B178: 刘正风 | C178: 金盆洗手 | D178: 4 | F178: 78 | G178: 49 | H178: 1 | I178: 176 | K178: 巨力士 | L178: 49 | M178: 3684 | N178: 2204 | O178: 5168 | P178: 2168 | Q178: 720 | W178: 巨力士 | X178: 49 | Y178: 3684 | Z178: 2204 | AA178: 5168 | AB178: 2168 | AC178: 720 | AI178: 衡山弟子 | AJ178: 49 | AK178: 3684 | AL178: 2204 | AM178: 5168 | AN178: 2168 | AO178: 720 | AU178: 衡山弟子 | AV178: 49 | AW178: 3684 | AX178: 2204 | AY178: 5168 | AZ178: 2168 | BA178: 720 | BG178: 刘正风 | BH178: 50 | BI178: 3684 | BJ178: 2204 | BK178: 5168 | BL178: 2168 | BM178: 720
A179: 177 | B179: 天门道人 | C179: 金盆洗手 | D179: 5 | F179: 83 | G179: 50 | H179: 1 | I179: 177 | K179: 御甲师 | L179: 50 | M179: 3687 | N179: 2206 | O179: 5173 | P179: 2170 | Q179: 720 | W179: 御甲师 | X179: 50 | Y179: 3687 | Z179: 2206 | AA179: 5173 | AB179: 2170 | AC179: 720 | AI179: 衡山弟子 | AJ179: 50 | AK179: 3687 | AL179: 2206 | AM179: 5173 | AN179: 2170 | AO179: 720 | AU179: 衡山弟子 | AV179: 50 | AW179: 3687 | AX179: 2206 | AY179: 5173 | AZ179: 2170 | BA179: 720 | BG179: 天门道人 | BH179: 51 | BI179: 3687 | BJ179: 2206 | BK179: 5173 | BL179: 2170 | BM179: 720
A180: 178 | B180: 定逸师太 | C180: 金盆洗手 | D180: 6 | F180: 114 | G180: 50 | H180: 1 | I180: 178 | K180: 定逸师太 | L180: 51 | M180: 3690 | N180: 2208 | O180: 25890 | P180: 2172 | Q180: 720
A181: 179 | B181: 费彬 | C181: 金盆洗手 | D181: 7 | F181: 79 | G181: 50 | H181: 1 | I181: 179 | K181: 费彬 | L181: 51 | M181: 3693 | N181: 2210 | O181: 25915 | P181: 2174 | Q181: 720
A182: 180 | B182: 余沧海 | C182: 金盆洗手 | D182: 8 | F182: 69 | G182: 50 | H182: 1 | I182: 180 | K182: 余沧海 | L182: 51 | M182: 3696 | N182: 2212 | O182: 25940 | P182: 2176 | Q182: 720
A183: 181 | B183: 闻先生 | C183: 金盆洗手 | D183: 9 | F183: 6 | G183: 50 | H183: 1 | I183: 181 | K183: 武当弟子 | L183: 50 | M183: 3699 | N183: 2214 | O183: 5193 | P183: 2178 | Q183: 720 | W183: 恒山弟子 | X183: 50 | Y183: 3699 | Z183: 2214 | AA183: 5193 | AB183: 2178 | AC183: 720 | AI183: 衡山弟子 | AJ183: 50 | AK183: 3699 | AL183: 2214 | AM183: 5193 | AN183: 2178 | AO183: 720 | AU183: 衡山弟子 | AV183: 50 | AW183: 3699 | AX183: 2214 | AY183: 5193 | AZ183: 2178 | BA183: 720 | BG183: 闻先生 | BH183: 51 | BI183: 3699 | BJ183: 2214 | BK183: 5193 | BL183: 2178 | BM183: 720
A184: 182 | B184: 何三七 | C184: 金盆洗手 | D184: 10 | F184: 6 | G184: 50 | H184: 1 | I184: 182 | K184: 衡山弟子 | L184: 50 | M184: 3702 | N184: 2216 | O184: 5198 | P184: 2180 | Q184: 720 | W184: 衡山弟子 | X184: 50 | Y184: 3702 | Z184: 2216 | AA184: 5198 | AB184: 2180 | AC184: 720 | AI184: 少林弟子 | AJ184: 50 | AK184: 3702 | AL184: 2216 | AM184: 5198 | AN184: 2180 | AO184: 720 | AU184: 衡山弟子 | AV184: 50 | AW184: 3702 | AX184: 2216 | AY184: 5198 | AZ184: 2180 | BA184: 720 | BG184: 何三七 | BH184: 51 | BI184: 3702 | BJ184: 2216 | BK184: 5198 | BL184: 2180 | BM184: 720
A185: 183 | B185: 夏老拳师 | C185: 金盆洗手 | D185: 11 | F185: 69 | G185: 50 | H185: 1 | I185: 183 | K185: 少林弟子 | L185: 50 | M185: 3705 | N185: 2218 | O185: 5203 | P185: 2182 | Q185: 720 | W185: 少林弟子 | X185: 50 | Y185: 3705 | Z185: 2218 | AA185: 5203 | AB185: 2182 | AC185: 720 | AI185: 武当弟子 | AJ185: 50 | AK185: 3705 | AL185: 2218 | AM185: 5203 | AN185: 2182 | AO185: 720 | AU185: 衡山弟子 | AV185: 50 | AW185: 3705 | AX185: 2218 | AY185: 5203 | AZ185: 2182 | BA185: 720 | BG185: 夏老拳师 | BH185: 51 | BI185: 3705 | BJ185: 2218 | BK185: 5203 | BL185: 2182 | BM185: 720
A186: 184 | B186: 张金鳖 | C186: 金盆洗手 | D186: 12 | F186: 29 | G186: 51 | H186: 1 | I186: 184 | K186: 少林弟子 | L186: 51 | M186: 3708 | N186: 2220 | O186: 5208 | P186: 2184 | Q186: 720 | W186: 少林弟子 | X186: 51 | Y186: 3708 | Z186: 2220 | AA186: 5208 | AB186: 2184 | AC186: 720 | AI186: 武当弟子 | AJ186: 51 | AK186: 3708 | AL186: 2220 | AM186: 5208 | AN186: 2184 | AO186: 720 | AU186: 衡山弟子 | AV186: 51 | AW186: 3708 | AX186: 2220 | AY186: 5208 | AZ186: 2184 | BA186: 720 | BG186: 张金鳖 | BH186: 52 | BI186: 3708 | BJ186: 2220 | BK186: 5208 | BL186: 2184 | BM186: 720
A187: 185 | B187: 米为义 | C187: 金盆洗手 | D187: 13 | F187: 6 | G187: 51 | H187: 1 | I187: 185 | K187: 嵩山弟子 | L187: 51 | M187: 3711 | N187: 2222 | O187: 5213 | P187: 2186 | Q187: 720 | W187: 嵩山弟子 | X187: 51 | Y187: 3711 | Z187: 2222 | AA187: 5213 | AB187: 2186 | AC187: 720 | AI187: 衡山弟子 | AJ187: 51 | AK187: 3711 | AL187: 2222 | AM187: 5213 | AN187: 2186 | AO187: 720 | AU187: 衡山弟子 | AV187: 51 | AW187: 3711 | AX187: 2222 | AY187: 5213 | AZ187: 2186 | BA187: 720 | BG187: 米为义 | BH187: 52 | BI187: 3711 | BJ187: 2222 | BK187: 5213 | BL187: 2186 | BM187: 720
A188: 186 | B188: 向大年 | C188: 金盆洗手 | D188: 14 | F188: 110 | G188: 51 | H188: 1 | I188: 186 | K188: 衡山弟子 | L188: 51 | M188: 3714 | N188: 2224 | O188: 5218 | P188: 2188 | Q188: 720 | W188: 衡山弟子 | X188: 51 | Y188: 3714 | Z188: 2224 | AA188: 5218 | AB188: 2188 | AC188: 720 | AI188: 武当弟子 | AJ188: 51 | AK188: 3714 | AL188: 2224 | AM188: 5218 | AN188: 2188 | AO188: 720 | AU188: 武当弟子 | AV188: 51 | AW188: 3714 | AX188: 2224 | AY188: 5218 | AZ188: 2188 | BA188: 720 | BG188: 向大年 | BH188: 52 | BI188: 3714 | BJ188: 2224 | BK188: 5218 | BL188: 2188 | BM188: 720
A189: 187 | B189: 嵩山弟子 | C189: 金盆洗手 | D189: 15 | F189: 5 | G189: 51 | H189: 1 | I189: 187 | K189: 狂刀汉 | L189: 51 | M189: 3717 | N189: 2226 | O189: 5223 | P189: 2190 | Q189: 720 | W189: 狂刀汉 | X189: 51 | Y189: 3717 | Z189: 2226 | AA189: 5223 | AB189: 2190 | AC189: 720 | AI189: 嵩山弟子 | AJ189: 51 | AK189: 3717 | AL189: 2226 | AM189: 5223 | AN189: 2190 | AO189: 720 | AU189: 嵩山弟子 | AV189: 51 | AW189: 3717 | AX189: 2226 | AY189: 5223 | AZ189: 2190 | BA189: 720 | BG189: 嵩山弟子 | BH189: 51 | BI189: 3717 | BJ189: 2226 | BK189: 5223 | BL189: 2190 | BM189: 720
A190: 188 | B190: 史登达 | C190: 金盆洗手 | D190: 16 | F190: 38 | G190: 51 | H190: 1 | I190: 188 | K190: 御甲师 | L190: 51 | M190: 3720 | N190: 2228 | O190: 5228 | P190: 2192 | Q190: 720 | W190: 御甲师 | X190: 51 | Y190: 3720 | Z190: 2228 | AA190: 5228 | AB190: 2192 | AC190: 720 | AI190: 嵩山弟子 | AJ190: 51 | AK190: 3720 | AL190: 2228 | AM190: 5228 | AN190: 2192 | AO190: 720 | AU190: 嵩山弟子 | AV190: 51 | AW190: 3720 | AX190: 2228 | AY190: 5228 | AZ190: 2192 | BA190: 720 | BG190: 史登达 | BH190: 52 | BI190: 3720 | BJ190: 2228 | BK190: 5228 | BL190: 2192 | BM190: 720
A191: 189 | B191: 陆柏 | C191: 金盆洗手 | D191: 17 | F191: 112 | G191: 51 | H191: 1 | I191: 189 | K191: 匿踪客 | L191: 51 | M191: 3723 | N191: 2230 | O191: 5233 | P191: 2194 | Q191: 720 | W191: 匿踪客 | X191: 51 | Y191: 3723 | Z191: 2230 | AA191: 5233 | AB191: 2194 | AC191: 720 | AI191: 嵩山弟子 | AJ191: 51 | AK191: 3723 | AL191: 2230 | AM191: 5233 | AN191: 2194 | AO191: 720 | AU191: 嵩山弟子 | AV191: 51 | AW191: 3723 | AX191: 2230 | AY191: 5233 | AZ191: 2194 | BA191: 720 | BG191: 陆柏 | BH191: 52 | BI191: 3723 | BJ191: 2230 | BK191: 5233 | BL191: 2194 | BM191: 720
A192: 190 | B192: 丁勉 | C192: 金盆洗手 | D192: 18 | F192: 79 | G192: 51 | H192: 1 | I192: 190 | K192: 嗜毒女 | L192: 51 | M192: 3726 | N192: 2232 | O192: 5238 | P192: 2196 | Q192: 720 | W192: 嗜毒女 | X192: 51 | Y192: 3726 | Z192: 2232 | AA192: 5238 | AB192: 2196 | AC192: 720 | AI192: 嵩山弟子 | AJ192: 51 | AK192: 3726 | AL192: 2232 | AM192: 5238 | AN192: 2196 | AO192: 720 | AU192: 嵩山弟子 | AV192: 51 | AW192: 3726 | AX192: 2232 | AY192: 5238 | AZ192: 2196 | BA192: 720 | BG192: 丁勉 | BH192: 52 | BI192: 3726 | BJ192: 2232 | BK192: 5238 | BL192: 2196 | BM192: 720
A193: 191 | B193: 岳不群 | C193: 金盆洗手 | D193: 19 | F193: 138 | G193: 52 | H193: 1 | I193: 191 | K193: 岳不群 | L193: 53 | M193: 3916 | N193: 2342 | O193: 27455 | P193: 11520 | Q193: 3840
A194: 192 | B194: 刘正风 | C194: 笑傲江湖 | D194: 1 | F194: 78 | G194: 52 | H194: 1 | I194: 192 | K194: 刘正风 | L194: 53 | M194: 3923 | N194: 2346 | O194: 27509 | P194: 11543 | Q194: 3847
A195: 193 | B195: 曲阳 | C195: 笑傲江湖 | D195: 2 | F195: 67 | G195: 52 | H195: 1 | I195: 193 | K195: 曲阳 | L195: 53 | M195: 3930 | N195: 2350 | O195: 27564 | P195: 11566 | Q195: 3854
A196: 194 | B196: 曲非烟 | C196: 笑傲江湖 | D196: 3 | F196: 107 | G196: 52 | H196: 1 | I196: 194 | K196: 刘正风 | L196: 53 | M196: 3937 | N196: 2354 | O196: 5523 | P196: 2317 | Q196: 772 | W196: 曲阳 | X196: 53 | Y196: 3937 | Z196: 2354 | AA196: 5523 | AB196: 2317 | AC196: 772 | AI196: 曲非烟 | AJ196: 53 | AK196: 3937 | AL196: 2354 | AM196: 5523 | AN196: 2317 | AO196: 772
A197: 195 | B197: 仪琳 | C197: 笑傲江湖 | D197: 4 | F197: 105 | G197: 52 | H197: 1 | I197: 195 | K197: 武当弟子 | L197: 52 | M197: 3944 | N197: 2358 | O197: 5534 | P197: 2321 | Q197: 773 | W197: 武当弟子 | X197: 52 | Y197: 3944 | Z197: 2358 | AA197: 5534 | AB197: 2321 | AC197: 773 | AI197: 恒山弟子 | AJ197: 52 | AK197: 3944 | AL197: 2358 | AM197: 5534 | AN197: 2321 | AO197: 773 | AU197: 恒山弟子 | AV197: 52 | AW197: 3944 | AX197: 2358 | AY197: 5534 | AZ197: 2321 | BA197: 773 | BG197: 仪琳 | BH197: 53 | BI197: 3944 | BJ197: 2358 | BK197: 5534 | BL197: 2321 | BM197: 773
A198: 196 | B198: 令狐冲 | C198: 笑傲江湖 | D198: 5 | F198: 116 | G198: 52 | H198: 1 | I198: 196 | K198: 恒山弟子 | L198: 52 | M198: 3951 | N198: 2362 | O198: 5545 | P198: 2325 | Q198: 774 | W198: 恒山弟子 | X198: 52 | Y198: 3951 | Z198: 2362 | AA198: 5545 | AB198: 2325 | AC198: 774 | AI198: 华山弟子 | AJ198: 52 | AK198: 3951 | AL198: 2362 | AM198: 5545 | AN198: 2325 | AO198: 774 | AU198: 华山弟子 | AV198: 52 | AW198: 3951 | AX198: 2362 | AY198: 5545 | AZ198: 2325 | BA198: 774 | BG198: 令狐冲 | BH198: 53 | BI198: 3951 | BJ198: 2362 | BK198: 5545 | BL198: 2325 | BM198: 774
A199: 197 | B199: 费彬 | C199: 笑傲江湖 | D199: 6 | F199: 112 | G199: 52 | H199: 1 | I199: 197 | K199: 匿踪客 | L199: 52 | M199: 3958 | N199: 2366 | O199: 5556 | P199: 2329 | Q199: 775 | W199: 狂刀汉 | X199: 52 | Y199: 3958 | Z199: 2366 | AA199: 5556 | AB199: 2329 | AC199: 775 | AI199: 巨力士 | AJ199: 52 | AK199: 3958 | AL199: 2366 | AM199: 5556 | AN199: 2329 | AO199: 775 | AU199: 嵩山弟子 | AV199: 52 | AW199: 3958 | AX199: 2366 | AY199: 5556 | AZ199: 2329 | BA199: 775 | BG199: 费彬 | BH199: 53 | BI199: 3958 | BJ199: 2366 | BK199: 5556 | BL199: 2329 | BM199: 775
A200: 198 | B200: 莫大先生 | C200: 笑傲江湖 | D200: 7 | F200: 118 | G200: 53 | H200: 1 | I200: 198 | K200: 莫大先生 | L200: 54 | M200: 4039 | N200: 2415 | O200: 28310 | P200: 11880 | Q200: 3960
A201: 199 | B201: 家丁 | C201: 绿柳山庄 | D201: 1 | F201: 2 | G201: 53 | H201: 1 | I201: 199 | K201: 武当弟子 | L201: 53 | M201: 4079 | N201: 2439 | O201: 5718 | P201: 2399 | Q201: 799 | W201: 武当弟子 | X201: 53 | Y201: 4079 | Z201: 2439 | AA201: 5718 | AB201: 2399 | AC201: 799 | AI201: 恒山弟子 | AJ201: 53 | AK201: 4079 | AL201: 2439 | AM201: 5718 | AN201: 2399 | AO201: 799 | AU201: 恒山弟子 | AV201: 53 | AW201: 4079 | AX201: 2439 | AY201: 5718 | AZ201: 2399 | BA201: 799 | BG201: 家丁 | BH201: 53 | BI201: 4079 | BJ201: 2439 | BK201: 5718 | BL201: 2399 | BM201: 799
A202: 200 | B202: 郑七灭 | C202: 绿柳山庄 | D202: 2 | F202: 42 | G202: 53 | H202: 1 | I202: 200 | K202: 嗜毒女 | L202: 53 | M202: 4119 | N202: 2463 | O202: 5775 | P202: 2422 | Q202: 806 | W202: 嗜毒女 | X202: 53 | Y202: 4119 | Z202: 2463 | AA202: 5775 | AB202: 2422 | AC202: 806 | AI202: 明教弟子 | AJ202: 53 | AK202: 4119 | AL202: 2463 | AM202: 5775 | AN202: 2422 | AO202: 806 | AU202: 御甲师 | AV202: 53 | AW202: 4119 | AX202: 2463 | AY202: 5775 | AZ202: 2422 | BA202: 806 | BG202: 郑七灭 | BH202: 54 | BI202: 4119 | BJ202: 2463 | BK202: 5775 | BL202: 2422 | BM202: 806
A203: 201 | B203: 王八衰 | C203: 绿柳山庄 | D203: 3 | F203: 31 | G203: 53 | H203: 1 | I203: 201 | K203: 御甲师 | L203: 53 | M203: 4160 | N203: 2487 | O203: 5832 | P203: 2446 | Q203: 814 | W203: 御甲师 | X203: 53 | Y203: 4160 | Z203: 2487 | AA203: 5832 | AB203: 2446 | AC203: 814 | AI203: 嗜毒女 | AJ203: 53 | AK203: 4160 | AL203: 2487 | AM203: 5832 | AN203: 2446 | AO203: 814 | AU203: 御甲师 | AV203: 53 | AW203: 4160 | AX203: 2487 | AY203: 5832 | AZ203: 2446 | BA203: 814 | BG203: 王八衰 | BH203: 54 | BI203: 4160 | BJ203: 2487 | BK203: 5832 | BL203: 2446 | BM203: 814
A204: 202 | B204: 杨逍 | C204: 绿柳山庄 | D204: 4 | F204: 136 | G204: 53 | H204: 1 | I204: 202 | K204: 狂刀汉 | L204: 53 | M204: 4201 | N204: 2511 | O204: 5890 | P204: 2470 | Q204: 822 | W204: 狂刀汉 | X204: 53 | Y204: 4201 | Z204: 2511 | AA204: 5890 | AB204: 2470 | AC204: 822 | AI204: 明教弟子 | AJ204: 53 | AK204: 4201 | AL204: 2511 | AM204: 5890 | AN204: 2470 | AO204: 822 | AU204: 御甲师 | AV204: 53 | AW204: 4201 | AX204: 2511 | AY204: 5890 | AZ204: 2470 | BA204: 822 | BG204: 杨逍 | BH204: 54 | BI204: 4201 | BJ204: 2511 | BK204: 5890 | BL204: 2470 | BM204: 822
A205: 203 | B205: 殷天正 | C205: 绿柳山庄 | D205: 5 | F205: 50 | G205: 53 | H205: 1 | I205: 203 | K205: 狂刀汉 | L205: 53 | M205: 4243 | N205: 2536 | O205: 5948 | P205: 2494 | Q205: 830 | W205: 嗜毒女 | X205: 53 | Y205: 4243 | Z205: 2536 | AA205: 5948 | AB205: 2494 | AC205: 830 | AI205: 御甲师 | AJ205: 53 | AK205: 4243 | AL205: 2536 | AM205: 5948 | AN205: 2494 | AO205: 830 | AU205: 御甲师 | AV205: 53 | AW205: 4243 | AX205: 2536 | AY205: 5948 | AZ205: 2494 | BA205: 830 | BG205: 殷天正 | BH205: 54 | BI205: 4243 | BJ205: 2536 | BK205: 5948 | BL205: 2494 | BM205: 830
A206: 204 | B206: 韦一笑 | C206: 绿柳山庄 | D206: 6 | F206: 17 | G206: 53 | H206: 1 | I206: 204 | K206: 嗜毒女 | L206: 53 | M206: 4285 | N206: 2561 | O206: 6007 | P206: 2518 | Q206: 838 | W206: 嗜毒女 | X206: 53 | Y206: 4285 | Z206: 2561 | AA206: 6007 | AB206: 2518 | AC206: 838 | AI206: 明教弟子 | AJ206: 53 | AK206: 4285 | AL206: 2561 | AM206: 6007 | AN206: 2518 | AO206: 838 | AU206: 明教弟子 | AV206: 53 | AW206: 4285 | AX206: 2561 | AY206: 6007 | AZ206: 2518 | BA206: 838 | BG206: 韦一笑 | BH206: 54 | BI206: 4285 | BJ206: 2561 | BK206: 6007 | BL206: 2518 | BM206: 838
A207: 205 | B207: 周颠 | C207: 绿柳山庄 | D207: 7 | F207: 42 | G207: 54 | H207: 1 | I207: 205 | K207: 嗜毒女 | L207: 54 | M207: 4327 | N207: 2586 | O207: 6067 | P207: 2543 | Q207: 846 | W207: 狂刀汉 | X207: 54 | Y207: 4327 | Z207: 2586 | AA207: 6067 | AB207: 2543 | AC207: 846 | AI207: 狂刀汉 | AJ207: 54 | AK207: 4327 | AL207: 2586 | AM207: 6067 | AN207: 2543 | AO207: 846 | AU207: 明教弟子 | AV207: 54 | AW207: 4327 | AX207: 2586 | AY207: 6067 | AZ207: 2543 | BA207: 846 | BG207: 周颠 | BH207: 55 | BI207: 4327 | BJ207: 2586 | BK207: 6067 | BL207: 2543 | BM207: 846
A208: 206 | B208: 张中 | C208: 绿柳山庄 | D208: 8 | F208: 84 | G208: 54 | H208: 1 | I208: 206 | K208: 御甲师 | L208: 54 | M208: 4370 | N208: 2611 | O208: 6127 | P208: 2568 | Q208: 854 | W208: 御甲师 | X208: 54 | Y208: 4370 | Z208: 2611 | AA208: 6127 | AB208: 2568 | AC208: 854 | AI208: 明教弟子 | AJ208: 54 | AK208: 4370 | AL208: 2611 | AM208: 6127 | AN208: 2568 | AO208: 854 | AU208: 明教弟子 | AV208: 54 | AW208: 4370 | AX208: 2611 | AY208: 6127 | AZ208: 2568 | BA208: 854 | BG208: 张中 | BH208: 55 | BI208: 4370 | BJ208: 2611 | BK208: 6127 | BL208: 2568 | BM208: 854
A209: 207 | B209: 赵一伤 | C209: 绿柳山庄 | D209: 9 | F209: 33 | G209: 54 | H209: 1 | I209: 207 | K209: 匿踪客 | L209: 54 | M209: 4413 | N209: 2637 | O209: 6188 | P209: 2593 | Q209: 862 | W209: 匿踪客 | X209: 54 | Y209: 4413 | Z209: 2637 | AA209: 6188 | AB209: 2593 | AC209: 862 | AI209: 长枪护使 | AJ209: 54 | AK209: 4413 | AL209: 2637 | AM209: 6188 | AN209: 2593 | AO209: 862 | AU209: 长枪护使 | AV209: 54 | AW209: 4413 | AX209: 2637 | AY209: 6188 | AZ209: 2593 | BA209: 862 | BG209: 赵一伤 | BH209: 55 | BI209: 4413 | BJ209: 2637 | BK209: 6188 | BL209: 2593 | BM209: 862
A210: 208 | B210: 钱二败 | C210: 绿柳山庄 | D210: 10 | F210: 34 | G210: 54 | H210: 1 | I210: 208 | K210: 御甲师 | L210: 54 | M210: 4457 | N210: 2663 | O210: 6249 | P210: 2618 | Q210: 870 | W210: 御甲师 | X210: 54 | Y210: 4457 | Z210: 2663 | AA210: 6249 | AB210: 2618 | AC210: 870 | AI210: 长枪护使 | AJ210: 54 | AK210: 4457 | AL210: 2663 | AM210: 6249 | AN210: 2618 | AO210: 870 | AU210: 长枪护使 | AV210: 54 | AW210: 4457 | AX210: 2663 | AY210: 6249 | AZ210: 2618 | BA210: 870 | BG210: 钱二败 | BH210: 55 | BI210: 4457 | BJ210: 2663 | BK210: 6249 | BL210: 2618 | BM210: 870
A211: 209 | B211: 孙三毁 | C211: 绿柳山庄 | D211: 11 | F211: 36 | G211: 54 | H211: 1 | I211: 209 | K211: 御甲师 | L211: 54 | M211: 4501 | N211: 2689 | O211: 6311 | P211: 2644 | Q211: 878 | W211: 长枪护使 | X211: 54 | Y211: 4501 | Z211: 2689 | AA211: 6311 | AB211: 2644 | AC211: 878 | AI211: 长枪护使 | AJ211: 54 | AK211: 4501 | AL211: 2689 | AM211: 6311 | AN211: 2644 | AO211: 878 | AU211: 宽刀护使 | AV211: 54 | AW211: 4501 | AX211: 2689 | AY211: 6311 | AZ211: 2644 | BA211: 878 | BG211: 孙三毁 | BH211: 55 | BI211: 4501 | BJ211: 2689 | BK211: 6311 | BL211: 2644 | BM211: 878
A212: 210 | B212: 李四摧 | C212: 绿柳山庄 | D212: 12 | F212: 37 | G212: 54 | H212: 1 | I212: 210 | K212: 嗜毒女 | L212: 54 | M212: 4546 | N212: 2715 | O212: 6374 | P212: 2670 | Q212: 886 | W212: 宽刀护使 | X212: 54 | Y212: 4546 | Z212: 2715 | AA212: 6374 | AB212: 2670 | AC212: 886 | AI212: 宽刀护使 | AJ212: 54 | AK212: 4546 | AL212: 2715 | AM212: 6374 | AN212: 2670 | AO212: 886 | AU212: 嗜毒女 | AV212: 54 | AW212: 4546 | AX212: 2715 | AY212: 6374 | AZ212: 2670 | BA212: 886 | BG212: 李四摧 | BH212: 55 | BI212: 4546 | BJ212: 2715 | BK212: 6374 | BL212: 2670 | BM212: 886
A213: 211 | B213: 周五输 | C213: 绿柳山庄 | D213: 13 | F213: 30 | G213: 54 | H213: 1 | I213: 211 | K213: 长枪护使 | L213: 54 | M213: 4591 | N213: 2742 | O213: 6437 | P213: 2696 | Q213: 894 | W213: 宽刀护使 | X213: 54 | Y213: 4591 | Z213: 2742 | AA213: 6437 | AB213: 2696 | AC213: 894 | AI213: 御甲师 | AJ213: 54 | AK213: 4591 | AL213: 2742 | AM213: 6437 | AN213: 2696 | AO213: 894 | AU213: 明教弟子 | AV213: 54 | AW213: 4591 | AX213: 2742 | AY213: 6437 | AZ213: 2696 | BA213: 894 | BG213: 周五输 | BH213: 55 | BI213: 4591 | BJ213: 2742 | BK213: 6437 | BL213: 2696 | BM213: 894
A214: 212 | B214: 吴六破 | C214: 绿柳山庄 | D214: 14 | F214: 40 | G214: 55 | H214: 1 | I214: 212 | K214: 长枪护使 | L214: 54 | M214: 4636 | N214: 2769 | O214: 6501 | P214: 2722 | Q214: 902 | W214: 宽刀护使 | X214: 54 | Y214: 4636 | Z214: 2769 | AA214: 6501 | AB214: 2722 | AC214: 902 | AI214: 御甲师 | AJ214: 54 | AK214: 4636 | AL214: 2769 | AM214: 6501 | AN214: 2722 | AO214: 902 | AU214: 明教弟子 | AV214: 54 | AW214: 4636 | AX214: 2769 | AY214: 6501 | AZ214: 2722 | BA214: 902 | BG214: 吴六破 | BH214: 56 | BI214: 4636 | BJ214: 2769 | BK214: 6501 | BL214: 2722 | BM214: 902
A215: 213 | B215: 赵敏 | C215: 绿柳山庄 | D215: 15 | F215: 87 | G215: 55 | H215: 1 | I215: 213 | K215: 狂刀汉 | L215: 54 | M215: 4682 | N215: 2796 | O215: 6566 | P215: 2749 | Q215: 911 | W215: 狂刀汉 | X215: 54 | Y215: 4682 | Z215: 2796 | AA215: 6566 | AB215: 2749 | AC215: 911 | AI215: 狂刀汉 | AJ215: 54 | AK215: 4682 | AL215: 2796 | AM215: 6566 | AN215: 2749 | AO215: 911 | AU215: 明教弟子 | AV215: 54 | AW215: 4682 | AX215: 2796 | AY215: 6566 | AZ215: 2749 | BA215: 911 | BG215: 赵敏 | BH215: 56 | BI215: 4682 | BJ215: 2796 | BK215: 6566 | BL215: 2749 | BM215: 911
A216: 214 | B216: 张无忌 | C216: 绿柳山庄 | D216: 16 | F216: 144 | G216: 55 | H216: 1 | I216: 214 | K216: 张无忌 | L216: 56 | M216: 4681 | N216: 2799 | O216: 32815 | P216: 13770 | Q216: 4590
A217: 215 | B217: 清风 | C217: 太极初传 | D217: 1 | F217: 77 | G217: 55 | H217: 1 | I217: 215 | K217: 武当弟子 | L217: 55 | M217: 4690 | N217: 2804 | O217: 6576 | P217: 2759 | Q217: 919 | W217: 武当弟子 | X217: 55 | Y217: 4690 | Z217: 2804 | AA217: 6576 | AB217: 2759 | AC217: 919 | AI217: 华山弟子 | AJ217: 55 | AK217: 4690 | AL217: 2804 | AM217: 6576 | AN217: 2759 | AO217: 919 | AU217: 衡山弟子 | AV217: 55 | AW217: 4690 | AX217: 2804 | AY217: 6576 | AZ217: 2759 | BA217: 919 | BG217: 清风 | BH217: 56 | BI217: 4690 | BJ217: 2804 | BK217: 6576 | BL217: 2759 | BM217: 919
A218: 216 | B218: 灵虚道长 | C218: 太极初传 | D218: 2 | F218: 84 | G218: 55 | H218: 1 | I218: 216 | K218: 华山弟子 | L218: 55 | M218: 4699 | N218: 2809 | O218: 6589 | P218: 2764 | Q218: 920 | W218: 武当弟子 | X218: 55 | Y218: 4699 | Z218: 2809 | AA218: 6589 | AB218: 2764 | AC218: 920 | AI218: 华山弟子 | AJ218: 55 | AK218: 4699 | AL218: 2809 | AM218: 6589 | AN218: 2764 | AO218: 920 | AU218: 衡山弟子 | AV218: 55 | AW218: 4699 | AX218: 2809 | AY218: 6589 | AZ218: 2764 | BA218: 920 | BG218: 灵虚道长 | BH218: 56 | BI218: 4699 | BJ218: 2809 | BK218: 6589 | BL218: 2764 | BM218: 920
A219: 217 | B219: 明月 | C219: 太极初传 | D219: 3 | F219: 77 | G219: 55 | H219: 1 | I219: 217 | K219: 武当弟子 | L219: 55 | M219: 4708 | N219: 2814 | O219: 6602 | P219: 2769 | Q219: 921 | W219: 武当弟子 | X219: 55 | Y219: 4708 | Z219: 2814 | AA219: 6602 | AB219: 2769 | AC219: 921 | AI219: 华山弟子 | AJ219: 55 | AK219: 4708 | AL219: 2814 | AM219: 6602 | AN219: 2769 | AO219: 921 | AU219: 衡山弟子 | AV219: 55 | AW219: 4708 | AX219: 2814 | AY219: 6602 | AZ219: 2769 | BA219: 921 | BG219: 明月 | BH219: 56 | BI219: 4708 | BJ219: 2814 | BK219: 6602 | BL219: 2769 | BM219: 921
A220: 218 | B220: 谷虚道长 | C220: 太极初传 | D220: 4 | F220: 84 | G220: 55 | H220: 1 | I220: 218 | K220: 华山弟子 | L220: 55 | M220: 4717 | N220: 2819 | O220: 6615 | P220: 2774 | Q220: 922 | W220: 武当弟子 | X220: 55 | Y220: 4717 | Z220: 2819 | AA220: 6615 | AB220: 2774 | AC220: 922 | AI220: 华山弟子 | AJ220: 55 | AK220: 4717 | AL220: 2819 | AM220: 6615 | AN220: 2774 | AO220: 922 | AU220: 衡山弟子 | AV220: 55 | AW220: 4717 | AX220: 2819 | AY220: 6615 | AZ220: 2774 | BA220: 922 | BG220: 谷虚道长 | BH220: 56 | BI220: 4717 | BJ220: 2819 | BK220: 6615 | BL220: 2774 | BM220: 922
A221: 219 | B221: 俞岱岩 | C221: 太极初传 | D221: 5 | F221: 82 | G221: 55 | H221: 1 | I221: 219 | K221: 武当弟子 | L221: 55 | M221: 4726 | N221: 2824 | O221: 6628 | P221: 2779 | Q221: 923 | W221: 武当弟子 | X221: 55 | Y221: 4726 | Z221: 2824 | AA221: 6628 | AB221: 2779 | AC221: 923 | AI221: 华山弟子 | AJ221: 55 | AK221: 4726 | AL221: 2824 | AM221: 6628 | AN221: 2779 | AO221: 923 | AU221: 衡山弟子 | AV221: 55 | AW221: 4726 | AX221: 2824 | AY221: 6628 | AZ221: 2779 | BA221: 923 | BG221: 俞岱岩 | BH221: 56 | BI221: 4726 | BJ221: 2824 | BK221: 6628 | BL221: 2779 | BM221: 923
A222: 220 | B222: 空相 | C222: 太极初传 | D222: 6 | F222: 25 | G222: 55 | H222: 1 | I222: 220 | K222: 武当弟子 | L222: 55 | M222: 4735 | N222: 2829 | O222: 6641 | P222: 2784 | Q222: 924 | W222: 武当弟子 | X222: 55 | Y222: 4735 | Z222: 2829 | AA222: 6641 | AB222: 2784 | AC222: 924 | AI222: 少林弟子 | AJ222: 55 | AK222: 4735 | AL222: 2829 | AM222: 6641 | AN222: 2784 | AO222: 924 | AU222: 少林弟子 | AV222: 55 | AW222: 4735 | AX222: 2829 | AY222: 6641 | AZ222: 2784 | BA222: 924 | BG222: 空相 | BH222: 56 | BI222: 4735 | BJ222: 2829 | BK222: 6641 | BL222: 2784 | BM222: 924
A223: 221 | B223: 韦一笑 | C223: 太极初传 | D223: 7 | F223: 17 | G223: 56 | H223: 1 | I223: 221 | K223: 韦一笑 | L223: 57 | M223: 4819 | N223: 2882 | O223: 33780 | P223: 14175 | Q223: 4725
A224: 222 | B224: 说不得 | C224: 太极初传 | D224: 8 | F224: 22 | G224: 56 | H224: 1 | I224: 222 | K224: 嗜毒女 | L224: 56 | M224: 4843 | N224: 2896 | O224: 6789 | P224: 2849 | Q224: 949 | W224: 嗜毒女 | X224: 56 | Y224: 4843 | Z224: 2896 | AA224: 6789 | AB224: 2849 | AC224: 949 | AI224: 明教弟子 | AJ224: 56 | AK224: 4843 | AL224: 2896 | AM224: 6789 | AN224: 2849 | AO224: 949 | AU224: 明教弟子 | AV224: 56 | AW224: 4843 | AX224: 2896 | AY224: 6789 | AZ224: 2849 | BA224: 949 | BG224: 说不得 | BH224: 57 | BI224: 4843 | BJ224: 2896 | BK224: 6789 | BL224: 2849 | BM224: 949
A225: 223 | B225: 杨逍 | C225: 太极初传 | D225: 9 | F225: 136 | G225: 56 | H225: 1 | I225: 223 | K225: 狂刀汉 | L225: 56 | M225: 4867 | N225: 2910 | O225: 6822 | P225: 2863 | Q225: 953 | W225: 狂刀汉 | X225: 56 | Y225: 4867 | Z225: 2910 | AA225: 6822 | AB225: 2863 | AC225: 953 | AI225: 明教弟子 | AJ225: 56 | AK225: 4867 | AL225: 2910 | AM225: 6822 | AN225: 2863 | AO225: 953 | AU225: 明教弟子 | AV225: 56 | AW225: 4867 | AX225: 2910 | AY225: 6822 | AZ225: 2863 | BA225: 953 | BG225: 杨逍 | BH225: 57 | BI225: 4867 | BJ225: 2910 | BK225: 6822 | BL225: 2863 | BM225: 953
A226: 224 | B226: 殷天正 | C226: 太极初传 | D226: 10 | F226: 50 | G226: 56 | H226: 1 | I226: 224 | K226: 天鹰教弟子 | L226: 56 | M226: 4891 | N226: 2924 | O226: 6856 | P226: 2877 | Q226: 957 | W226: 天鹰教弟子 | X226: 56 | Y226: 4891 | Z226: 2924 | AA226: 6856 | AB226: 2877 | AC226: 957 | AI226: 明教弟子 | AJ226: 56 | AK226: 4891 | AL226: 2924 | AM226: 6856 | AN226: 2877 | AO226: 957 | AU226: 明教弟子 | AV226: 56 | AW226: 4891 | AX226: 2924 | AY226: 6856 | AZ226: 2877 | BA226: 957 | BG226: 殷天正 | BH226: 57 | BI226: 4891 | BJ226: 2924 | BK226: 6856 | BL226: 2877 | BM226: 957
A227: 225 | B227: 张中 | C227: 太极初传 | D227: 11 | F227: 84 | G227: 56 | H227: 1 | I227: 225 | K227: 御甲师 | L227: 56 | M227: 4915 | N227: 2938 | O227: 6890 | P227: 2891 | Q227: 961 | W227: 御甲师 | X227: 56 | Y227: 4915 | Z227: 2938 | AA227: 6890 | AB227: 2891 | AC227: 961 | AI227: 明教弟子 | AJ227: 56 | AK227: 4915 | AL227: 2938 | AM227: 6890 | AN227: 2891 | AO227: 961 | AU227: 明教弟子 | AV227: 56 | AW227: 4915 | AX227: 2938 | AY227: 6890 | AZ227: 2891 | BA227: 961 | BG227: 张中 | BH227: 57 | BI227: 4915 | BJ227: 2938 | BK227: 6890 | BL227: 2891 | BM227: 961
A228: 226 | B228: 殷野王 | C228: 太极初传 | D228: 12 | F228: 18 | G228: 56 | H228: 1 | I228: 226 | K228: 明教弟子 | L228: 56 | M228: 4939 | N228: 2952 | O228: 6924 | P228: 2905 | Q228: 965 | W228: 明教弟子 | X228: 56 | Y228: 4939 | Z228: 2952 | AA228: 6924 | AB228: 2905 | AC228: 965 | AI228: 御甲师 | AJ228: 56 | AK228: 4939 | AL228: 2952 | AM228: 6924 | AN228: 2905 | AO228: 965 | AU228: 御甲师 | AV228: 56 | AW228: 4939 | AX228: 2952 | AY228: 6924 | AZ228: 2905 | BA228: 965 | BG228: 殷野王 | BH228: 57 | BI228: 4939 | BJ228: 2952 | BK228: 6924 | BL228: 2905 | BM228: 965
A229: 227 | B229: 周颠 | C229: 太极初传 | D229: 13 | F229: 42 | G229: 56 | H229: 1 | I229: 227 | K229: 明教弟子 | L229: 56 | M229: 4963 | N229: 2966 | O229: 6958 | P229: 2919 | Q229: 969 | W229: 明教弟子 | X229: 56 | Y229: 4963 | Z229: 2966 | AA229: 6958 | AB229: 2919 | AC229: 969 | AI229: 狂刀汉 | AJ229: 56 | AK229: 4963 | AL229: 2966 | AM229: 6958 | AN229: 2919 | AO229: 969 | AU229: 狂刀汉 | AV229: 56 | AW229: 4963 | AX229: 2966 | AY229: 6958 | AZ229: 2919 | BA229: 969 | BG229: 周颠 | BH229: 57 | BI229: 4963 | BJ229: 2966 | BK229: 6958 | BL229: 2919 | BM229: 969
A230: 228 | B230: 彭莹玉 | C230: 太极初传 | D230: 14 | F230: 24 | G230: 56 | H230: 1 | I230: 228 | K230: 明教弟子 | L230: 56 | M230: 4987 | N230: 2980 | O230: 6992 | P230: 2933 | Q230: 973 | W230: 明教弟子 | X230: 56 | Y230: 4987 | Z230: 2980 | AA230: 6992 | AB230: 2933 | AC230: 973 | AI230: 嗜毒女 | AJ230: 56 | AK230: 4987 | AL230: 2980 | AM230: 6992 | AN230: 2933 | AO230: 973 | AU230: 嗜毒女 | AV230: 56 | AW230: 4987 | AX230: 2980 | AY230: 6992 | AZ230: 2933 | BA230: 973 | BG230: 彭莹玉 | BH230: 57 | BI230: 4987 | BJ230: 2980 | BK230: 6992 | BL230: 2933 | BM230: 973
A231: 229 | B231: 阿大 | C231: 太极初传 | D231: 15 | F231: 45 | G231: 56 | H231: 1 | I231: 229 | K231: 阿大 | L231: 57 | M231: 5094 | N231: 3046 | O231: 35710 | P231: 14985 | Q231: 4995
A232: 230 | B232: 阿二 | C232: 太极初传 | D232: 16 | F232: 46 | G232: 57 | H232: 1 | I232: 230 | K232: 阿二 | L232: 58 | M232: 5144 | N232: 3076 | O232: 36067 | P232: 15134 | Q232: 5044
A233: 231 | B233: 阿三 | C233: 太极初传 | D233: 17 | F233: 47 | G233: 57 | H233: 1 | I233: 231 | K233: 阿三 | L233: 58 | M233: 5195 | N233: 3106 | O233: 36427 | P233: 15285 | Q233: 5094
A234: 232 | B234: 小昭 | C234: 太极初传 | D234: 18 | F234: 88 | G234: 57 | H234: 1 | I234: 232 | K234: 天鹰教弟子 | L234: 57 | M234: 5246 | N234: 3137 | O234: 7358 | P234: 3087 | Q234: 1028 | W234: 天鹰教弟子 | X234: 57 | Y234: 5246 | Z234: 3137 | AA234: 7358 | AB234: 3087 | AC234: 1028 | AI234: 明教弟子 | AJ234: 57 | AK234: 5246 | AL234: 3137 | AM234: 7358 | AN234: 3087 | AO234: 1028 | AU234: 明教弟子 | AV234: 57 | AW234: 5246 | AX234: 3137 | AY234: 7358 | AZ234: 3087 | BA234: 1028 | BG234: 小昭 | BH234: 58 | BI234: 5246 | BJ234: 3137 | BK234: 7358 | BL234: 3087 | BM234: 1028
A235: 233 | B235: 杨不悔 | C235: 太极初传 | D235: 19 | F235: 127 | G235: 57 | H235: 1 | I235: 233 | K235: 狂刀汉 | L235: 57 | M235: 5298 | N235: 3168 | O235: 7431 | P235: 3117 | Q235: 1038 | W235: 狂刀汉 | X235: 57 | Y235: 5298 | Z235: 3168 | AA235: 7431 | AB235: 3117 | AC235: 1038 | AI235: 明教弟子 | AJ235: 57 | AK235: 5298 | AL235: 3168 | AM235: 7431 | AN235: 3117 | AO235: 1038 | AU235: 明教弟子 | AV235: 57 | AW235: 5298 | AX235: 3168 | AY235: 7431 | AZ235: 3117 | BA235: 1038 | BG235: 杨不悔 | BH235: 58 | BI235: 5298 | BJ235: 3168 | BK235: 7431 | BL235: 3117 | BM235: 1038
A236: 234 | B236: 殷梨亭 | C236: 太极初传 | D236: 20 | F236: 84 | G236: 57 | H236: 1 | I236: 234 | K236: 嗜毒女 | L236: 57 | M236: 5350 | N236: 3199 | O236: 7505 | P236: 3148 | Q236: 1048 | W236: 嗜毒女 | X236: 57 | Y236: 5350 | Z236: 3199 | AA236: 7505 | AB236: 3148 | AC236: 1048 | AI236: 明教弟子 | AJ236: 57 | AK236: 5350 | AL236: 3199 | AM236: 7505 | AN236: 3148 | AO236: 1048 | AU236: 明教弟子 | AV236: 57 | AW236: 5350 | AX236: 3199 | AY236: 7505 | AZ236: 3148 | BA236: 1048 | BG236: 殷梨亭 | BH236: 58 | BI236: 5350 | BJ236: 3199 | BK236: 7505 | BL236: 3148 | BM236: 1048
A237: 235 | B237: 颜坦 | C237: 太极初传 | D237: 21 | F237: 59 | G237: 57 | H237: 1 | I237: 235 | K237: 明教弟子 | L237: 57 | M237: 5403 | N237: 3230 | O237: 7580 | P237: 3179 | Q237: 1058 | W237: 明教弟子 | X237: 57 | Y237: 5403 | Z237: 3230 | AA237: 7580 | AB237: 3179 | AC237: 1058 | AI237: 匿踪客 | AJ237: 57 | AK237: 5403 | AL237: 3230 | AM237: 7580 | AN237: 3179 | AO237: 1058 | AU237: 匿踪客 | AV237: 57 | AW237: 5403 | AX237: 3230 | AY237: 7580 | AZ237: 3179 | BA237: 1058 | BG237: 颜坦 | BH237: 58 | BI237: 5403 | BJ237: 3230 | BK237: 7580 | BL237: 3179 | BM237: 1058
A238: 236 | B238: 张无忌 | C238: 太极初传 | D238: 22 | F238: 144 | G238: 57 | H238: 1 | I238: 236 | K238: 张无忌 | L238: 58 | M238: 5508 | N238: 3294 | O238: 38610 | P238: 16200 | Q238: 5400
A239: 237 | B239: 厚甲护卫 | C239: 万安解救 | D239: 1 | F239: 71 | G239: 57 | H239: 1 | I239: 237 | K239: 狂刀汉 | L239: 57 | M239: 5535 | N239: 3310 | O239: 7760 | P239: 3256 | Q239: 1085 | W239: 狂刀汉 | X239: 57 | Y239: 5535 | Z239: 3310 | AA239: 7760 | AB239: 3256 | AC239: 1085 | AI239: 御甲师 | AJ239: 57 | AK239: 5535 | AL239: 3310 | AM239: 7760 | AN239: 3256 | AO239: 1085 | AU239: 御甲师 | AV239: 57 | AW239: 5535 | AX239: 3310 | AY239: 7760 | AZ239: 3256 | BA239: 1085 | BG239: 厚甲护卫 | BH239: 58 | BI239: 5535 | BJ239: 3310 | BK239: 7760 | BL239: 3256 | BM239: 1085
A240: 238 | B240: 王保保 | C240: 万安解救 | D240: 2 | F240: 55 | G240: 57 | H240: 1 | I240: 238 | K240: 少林弟子 | L240: 57 | M240: 5562 | N240: 3326 | O240: 7798 | P240: 3272 | Q240: 1090 | W240: 少林弟子 | X240: 57 | Y240: 5562 | Z240: 3326 | AA240: 7798 | AB240: 3272 | AC240: 1090 | AI240: 武当弟子 | AJ240: 57 | AK240: 5562 | AL240: 3326 | AM240: 7798 | AN240: 3272 | AO240: 1090 | AU240: 武当弟子 | AV240: 57 | AW240: 5562 | AX240: 3326 | AY240: 7798 | AZ240: 3272 | BA240: 1090 | BG240: 王保保 | BH240: 58 | BI240: 5562 | BJ240: 3326 | BK240: 7798 | BL240: 3272 | BM240: 1090
A241: 239 | B241: 赵敏 | C241: 万安解救 | D241: 3 | F241: 87 | G241: 58 | H241: 1 | I241: 239 | K241: 华山弟子 | L241: 58 | M241: 5589 | N241: 3342 | O241: 7836 | P241: 3288 | Q241: 1095 | W241: 华山弟子 | X241: 58 | Y241: 5589 | Z241: 3342 | AA241: 7836 | AB241: 3288 | AC241: 1095 | AI241: 明教弟子 | AJ241: 58 | AK241: 5589 | AL241: 3342 | AM241: 7836 | AN241: 3288 | AO241: 1095 | AU241: 明教弟子 | AV241: 58 | AW241: 5589 | AX241: 3342 | AY241: 7836 | AZ241: 3288 | BA241: 1095 | BG241: 赵敏 | BH241: 59 | BI241: 5589 | BJ241: 3342 | BK241: 7836 | BL241: 3288 | BM241: 1095
A242: 240 | B242: 范遥 | C242: 万安解救 | D242: 4 | F242: 67 | G242: 58 | H242: 1 | I242: 240 | K242: 武当弟子 | L242: 58 | M242: 5616 | N242: 3358 | O242: 7875 | P242: 3304 | Q242: 1100 | W242: 武当弟子 | X242: 58 | Y242: 5616 | Z242: 3358 | AA242: 7875 | AB242: 3304 | AC242: 1100 | AI242: 明教弟子 | AJ242: 58 | AK242: 5616 | AL242: 3358 | AM242: 7875 | AN242: 3304 | AO242: 1100 | AU242: 明教弟子 | AV242: 58 | AW242: 5616 | AX242: 3358 | AY242: 7875 | AZ242: 3304 | BA242: 1100 | BG242: 范遥 | BH242: 59 | BI242: 5616 | BJ242: 3358 | BK242: 7875 | BL242: 3304 | BM242: 1100
A243: 241 | B243: 韩姬 | C243: 万安解救 | D243: 5 | F243: 103 | G243: 58 | H243: 1 | I243: 241 | K243: 嗜毒女 | L243: 58 | M243: 5644 | N243: 3374 | O243: 7914 | P243: 3320 | Q243: 1105 | W243: 嗜毒女 | X243: 58 | Y243: 5644 | Z243: 3374 | AA243: 7914 | AB243: 3320 | AC243: 1105 | AI243: 厚甲护卫 | AJ243: 58 | AK243: 5644 | AL243: 3374 | AM243: 7914 | AN243: 3320 | AO243: 1105 | AU243: 厚甲护卫 | AV243: 58 | AW243: 5644 | AX243: 3374 | AY243: 7914 | AZ243: 3320 | BA243: 1105 | BG243: 韩姬 | BH243: 59 | BI243: 5644 | BJ243: 3374 | BK243: 7914 | BL243: 3320 | BM243: 1105
A244: 242 | B244: 鹿杖客 | C244: 万安解救 | D244: 6 | F244: 64 | G244: 58 | H244: 1 | I244: 242 | K244: 鹿杖客 | L244: 59 | M244: 5645 | N244: 3376 | O244: 39575 | P244: 16605 | Q244: 5535
A245: 243 | B245: 鹤笔翁 | C245: 万安解救 | D245: 7 | F245: 50 | G245: 58 | H245: 1 | I245: 243 | K245: 鹤笔翁 | L245: 59 | M245: 5645 | N245: 3376 | O245: 39575 | P245: 16605 | Q245: 5535
A246: 244 | B246: 哈总管 | C246: 万安解救 | D246: 8 | F246: 2 | G246: 58 | H246: 1 | I246: 244 | K246: 御甲师 | L246: 58 | M246: 5656 | N246: 3382 | O246: 7930 | P246: 3327 | Q246: 1109 | W246: 御甲师 | X246: 58 | Y246: 5656 | Z246: 3382 | AA246: 7930 | AB246: 3327 | AC246: 1109 | AI246: 御甲师 | AJ246: 58 | AK246: 5656 | AL246: 3382 | AM246: 7930 | AN246: 3327 | AO246: 1109 | AU246: 御甲师 | AV246: 58 | AW246: 5656 | AX246: 3382 | AY246: 7930 | AZ246: 3327 | BA246: 1109 | BG246: 哈总管 | BH246: 59 | BI246: 5656 | BJ246: 3382 | BK246: 7930 | BL246: 3327 | BM246: 1109
A247: 245 | B247: 王府五刀 | C247: 万安解救 | D247: 9 | F247: 113 | G247: 58 | H247: 1 | I247: 245 | K247: 王府五刀 | L247: 59 | M247: 5667 | N247: 3388 | O247: 7945 | P247: 3333 | Q247: 1111 | W247: 王府五刀 | X247: 59 | Y247: 5667 | Z247: 3388 | AA247: 7945 | AB247: 3333 | AC247: 1111 | AI247: 王府五刀 | AJ247: 59 | AK247: 5667 | AL247: 3388 | AM247: 7945 | AN247: 3333 | AO247: 1111 | AU247: 王府五刀 | AV247: 59 | AW247: 5667 | AX247: 3388 | AY247: 7945 | AZ247: 3333 | BA247: 1111 | BG247: 王府五刀 | BH247: 59 | BI247: 5667 | BJ247: 3388 | BK247: 7945 | BL247: 3333 | BM247: 1111
A248: 246 | B248: 王府五剑 | C248: 万安解救 | D248: 10 | F248: 111 | G248: 58 | H248: 1 | I248: 246 | K248: 王府五剑 | L248: 59 | M248: 5678 | N248: 3394 | O248: 7960 | P248: 3339 | Q248: 1113 | W248: 王府五剑 | X248: 59 | Y248: 5678 | Z248: 3394 | AA248: 7960 | AB248: 3339 | AC248: 1113 | AI248: 王府五剑 | AJ248: 59 | AK248: 5678 | AL248: 3394 | AM248: 7960 | AN248: 3339 | AO248: 1113 | AU248: 王府五剑 | AV248: 59 | AW248: 5678 | AX248: 3394 | AY248: 7960 | AZ248: 3339 | BA248: 1113 | BG248: 王府五剑 | BH248: 59 | BI248: 5678 | BJ248: 3394 | BK248: 7960 | BL248: 3339 | BM248: 1113
A249: 247 | B249: 王府四杖 | C249: 万安解救 | D249: 11 | F249: 63 | G249: 58 | H249: 1 | I249: 247 | K249: 王府四杖 | L249: 59 | M249: 5689 | N249: 3400 | O249: 7975 | P249: 3345 | Q249: 1115 | W249: 王府四杖 | X249: 59 | Y249: 5689 | Z249: 3400 | AA249: 7975 | AB249: 3345 | AC249: 1115 | AI249: 王府四杖 | AJ249: 59 | AK249: 5689 | AL249: 3400 | AM249: 7975 | AN249: 3345 | AO249: 1115 | AU249: 王府四杖 | AV249: 59 | AW249: 5689 | AX249: 3400 | AY249: 7975 | AZ249: 3345 | BA249: 1115
A250: 248 | B250: 王府四钹 | C250: 万安解救 | D250: 12 | F250: 48 | G250: 59 | H250: 1 | I250: 248 | K250: 王府四钹 | L250: 60 | M250: 5700 | N250: 3406 | O250: 7990 | P250: 3351 | Q250: 1117 | W250: 王府四钹 | X250: 60 | Y250: 5700 | Z250: 3406 | AA250: 7990 | AB250: 3351 | AC250: 1117 | AI250: 王府四钹 | AJ250: 60 | AK250: 5700 | AL250: 3406 | AM250: 7990 | AN250: 3351 | AO250: 1117 | AU250: 王府四钹 | AV250: 60 | AW250: 5700 | AX250: 3406 | AY250: 7990 | AZ250: 3351 | BA250: 1117
A251: 249 | B251: 韦一笑 | C251: 万安解救 | D251: 13 | F251: 17 | G251: 59 | H251: 1 | I251: 249 | K251: 韦一笑 | L251: 60 | M251: 5711 | N251: 3412 | O251: 40025 | P251: 16785 | Q251: 5595
A252: 250 | B252: 杨逍 | C252: 万安解救 | D252: 14 | F252: 136 | G252: 59 | H252: 1 | I252: 250 | K252: 杨逍 | L252: 60 | M252: 5722 | N252: 3418 | O252: 40105 | P252: 16818 | Q252: 5606
A253: 251 | B253: 周芷若 | C253: 万安解救 | D253: 15 | F253: 139 | G253: 59 | H253: 1 | I253: 251 | K253: 周芷若 | L253: 60 | M253: 5733 | N253: 3424 | O253: 40185 | P253: 16851 | Q253: 5617
A254: 252 | B254: 丁敏君 | C254: 万安解救 | D254: 16 | F254: 102 | G254: 59 | H254: 1 | I254: 252 | K254: 丁敏君 | L254: 60 | M254: 5744 | N254: 3430 | O254: 40265 | P254: 16884 | Q254: 1628
A255: 253 | B255: 灭绝师太 | C255: 万安解救 | D255: 17 | F255: 117 | G255: 59 | H255: 1 | I255: 253 | K255: 灭绝师太 | L255: 60 | M255: 5783 | N255: 3458 | O255: 40540 | P255: 17010 | Q255: 5670
A256: 254 | B256: 宋远桥 | C256: 万安解救 | D256: 18 | F256: 79 | G256: 59 | H256: 1 | I256: 254 | K256: 宋远桥 | L256: 60 | M256: 5794 | N256: 3464 | O256: 40621 | P256: 17044 | Q256: 5681
A257: 255 | B257: 俞莲舟 | C257: 万安解救 | D257: 19 | F257: 84 | G257: 59 | H257: 1 | I257: 255 | K257: 俞莲舟 | L257: 60 | M257: 5805 | N257: 3470 | O257: 40702 | P257: 17078 | Q257: 5692
A258: 256 | B258: 张松溪 | C258: 万安解救 | D258: 20 | F258: 82 | G258: 59 | H258: 1 | I258: 256 | K258: 张松溪 | L258: 60 | M258: 5816 | N258: 3476 | O258: 40783 | P258: 17112 | Q258: 5703
A259: 257 | B259: 莫声谷 | C259: 万安解救 | D259: 21 | F259: 84 | G259: 60 | H259: 1 | I259: 257 | K259: 莫声谷 | L259: 60 | M259: 5827 | N259: 3482 | O259: 40864 | P259: 17146 | Q259: 5714
A260: 258 | B260: 宋青书 | C260: 万安解救 | D260: 22 | F260: 77 | G260: 60 | H260: 1 | I260: 258 | K260: 宋青书 | L260: 60 | M260: 5838 | N260: 3488 | O260: 40945 | P260: 17180 | Q260: 5725
A261: 259 | B261: 何太冲 | C261: 万安解救 | D261: 23 | F261: 82 | G261: 60 | H261: 1 | I261: 259 | K261: 何太冲 | L261: 60 | M261: 5849 | N261: 3494 | O261: 41026 | P261: 17214 | Q261: 5736
A262: 260 | B262: 班淑娴 | C262: 万安解救 | D262: 24 | F262: 94 | G262: 60 | H262: 1 | I262: 260 | K262: 班淑娴 | L262: 60 | M262: 5860 | N262: 3500 | O262: 41108 | P262: 17248 | Q262: 5747
A263: 261 | B263: 空闻 | C263: 万安解救 | D263: 25 | F263: 26 | G263: 60 | H263: 1 | I263: 261 | K263: 空闻 | L263: 60 | M263: 5871 | N263: 3507 | O263: 41190 | P263: 17282 | Q263: 5758
A264: 262 | B264: 空智 | C264: 万安解救 | D264: 26 | F264: 21 | G264: 60 | H264: 1 | I264: 262 | K264: 空智 | L264: 60 | M264: 5882 | N264: 3514 | O264: 41272 | P264: 17316 | Q264: 5769
A265: 263 | B265: 真·张无忌 | C265: 万安解救 | D265: 27 | F265: 144 | G265: 60 | H265: 1 | I265: 263 | K265: 真·张无忌 | L265: 61 | M265: 5921 | N265: 3541 | O265: 41505 | P265: 17415 | Q265: 5805

Sheet: 精英怪物组队表
A1: 组队ID | B1: 组队名称 | C1: 精英关卡名称 | D1: 秘境ID | E1: 区域ID | F1: 顺序 | G1: 音乐 | H1: 图片 | I1: 等级限制 | J1: 攻击次数 | K1: 奖励ID | L1: 阵法ID | M1: 0怪物ID | N1: 0怪物等级 | O1: 攻击修正0 | P1: 防御修正0 | Q1: 生命修正0 | R1: 内力修正0 | S1: 体力修正0 | T1: 武器ID0 | U1: 防具ID0 | V1: 饰品ID0 | W1: 技能专精0 | X1: 天赋激活0 | Y1: 1怪物ID | Z1: 1怪物等级 | AA1: 攻击修正1 | AB1: 防御修正1 | AC1: 生命修正1 | AD1: 内力修正1 | AE1: 体力修正1 | AF1: 武器ID1 | AG1: 防具ID1 | AH1: 饰品ID1 | AI1: 技能专精1 | AJ1: 天赋激活1 | AK1: 2怪物ID | AL1: 2怪物等级 | AM1: 攻击修正2 | AN1: 防御修正2 | AO1: 生命修正2 | AP1: 内力修正2 | AQ1: 体力修正2 | AR1: 武器ID2 | AS1: 防具ID2 | AT1: 饰品ID2 | AU1: 技能专精2 | AV1: 天赋激活2 | AW1: 3怪物ID | AX1: 3怪物等级 | AY1: 攻击修正3 | AZ1: 防御修正3 | BA1: 生命修正3 | BB1: 内力修正3 | BC1: 体力修正3 | BD1: 武器ID3 | BE1: 防具ID3 | BF1: 饰品ID3 | BG1: 技能专精3 | BH1: 天赋激活3 | BI1: 4怪物ID | BJ1: 4怪物等级 | BK1: 攻击修正4 | BL1: 防御修正4 | BM1: 生命修正4 | BN1: 内力修正4 | BO1: 体力修正4 | BP1: 武器ID4 | BQ1: 防具ID4 | BR1: 饰品ID4 | BS1: 技能专精4 | BT1: 天赋激活4 | BU1: 5怪物ID | BV1: 5怪物等级 | BW1: 攻击修正5 | BX1: 防御修正5 | BY1: 生命修正5 | BZ1: 内力修正5 | CA1: 体力修正5 | CB1: 武器ID5 | CC1: 防具ID5 | CD1: 饰品ID5 | CE1: 技能专精5 | CF1: 天赋激活5
A2: id | B2: name | C2: ex_mission_name | D2: ex_mission_id | E2: area_id | F2: no | G2: back_music | H2: stage_img | I2: level_limit | J2: pass_num | K2: reward_id | L2: zhenfa_id | M2: monster_id0 | N2: monster_lvl0 | O2: attack_mod0 | P2: defence_mod0 | Q2: hp_mod0 | R2: mp_mod0 | S2: sp_mod0 | T2: weapon_id0 | U2: armor_id0 | V2: ornament_id0 | W2: skill_power0 | X2: talnet_0 | Y2: monster_id1 | Z2: monster_lvl1 | AA2: attack_mod1 | AB2: defence_mod1 | AC2: hp_mod1 | AD2: mp_mod1 | AE2: sp_mod1 | AF2: weapon_id1 | AG2: armor_id1 | AH2: ornament_id1 | AI2: skill_power1 | AJ2: talnet_1 | AK2: monster_id2 | AL2: monster_lvl2 | AM2: attack_mod2 | AN2: defence_mod2 | AO2: hp_mod2 | AP2: mp_mod2 | AQ2: sp_mod2 | AR2: weapon_id2 | AS2: armor_id2 | AT2: ornament_id2 | AU2: skill_power2 | AV2: talnet_2 | AW2: monster_id3 | AX2: monster_lvl3 | AY2: attack_mod3 | AZ2: defence_mod3 | BA2: hp_mod3 | BB2: mp_mod3 | BC2: sp_mod3 | BD2: weapon_id3 | BE2: armor_id3 | BF2: ornament_id3 | BG2: skill_power3 | BH2: talnet_3 | BI2: monster_id4 | BJ2: monster_lvl4 | BK2: attack_mod4 | BL2: defence_mod4 | BM2: hp_mod4 | BN2: mp_mod4 | BO2: sp_mod4 | BP2: weapon_id4 | BQ2: armor_id4 | BR2: ornament_id4 | BS2: skill_power4 | BT2: talnet_4 | BU2: monster_id5 | BV2: monster_lvl5 | BW2: attack_mod5 | BX2: defence_mod5 | BY2: hp_mod5 | BZ2: mp_mod5 | CA2: sp_mod5 | CB2: weapon_id5 | CC2: armor_id5 | CD2: ornament_id5 | CE2: skill_power5 | CF2: talnet_5
A3: 1 | B3: 经验木桩10 | C3: 经验秘境 | D3: 1 | E3: 1 | F3: 1 | I3: 10
A4: 2 | B4: 经验木桩20 | C4: 经验秘境 | D4: 1 | E4: 1 | F4: 2 | I4: 20
A5: 3 | B5: 经验木桩25 | C5: 经验秘境 | D5: 1 | E5: 1 | F5: 3 | I5: 25
A6: 4 | B6: 经验木桩30 | C6: 经验秘境 | D6: 1 | E6: 1 | F6: 4 | I6: 30
A7: 5 | B7: 经验木桩35 | C7: 经验秘境 | D7: 1 | E7: 1 | F7: 5 | I7: 35
A8: 6 | B8: 经验木桩40 | C8: 经验秘境 | D8: 1 | E8: 1 | F8: 6 | I8: 40
A9: 7 | B9: 经验木桩45 | C9: 经验秘境 | D9: 1 | E9: 1 | F9: 7 | I9: 45
A10: 8 | B10: 经验木桩50 | C10: 经验秘境 | D10: 1 | E10: 1 | F10: 8 | I10: 50
A11: 9 | B11: 经验木桩55 | C11: 经验秘境 | D11: 1 | E11: 1 | F11: 9 | I11: 55
A12: 10 | B12: 经验木桩60 | C12: 经验秘境 | D12: 1 | E12: 1 | F12: 10 | I12: 60

Sheet: 精英关卡配置表
A1: 组队ID | B1: 精英关卡名称 | C1: 秘境ID | D1: 区域ID | E1: 关卡缩略图 | F1: 战场背景图 | G1: 队伍背景图 | H1: 等级限制 | I1: 攻击次数 | J1: 奖励ID | K1: 失败奖励ID | L1: 通关奖励 | M1: 0怪物ID | N1: 0怪物等级 | O1: 攻击修正0 | P1: 防御修正0 | Q1: 生命修正0 | R1: 内力修正0 | S1: 体力修正0
A2: id | B2: ex_mission_name | C2: ex_mission_id | D2: area_id | E2: image | F2: back_img | G2: master_back | H2: level_limit | I2: pass_num | J2: reward_id | K2: lost_reward_id | L2: pass_reward_id | M2: monster_id0 | N2: monster_lvl0 | O2: attack_mod0 | P2: defence_mod0 | Q2: hp_mod0 | R2: mp_mod0 | S2: sp_mod0
A3: 1 | B3: 三清阁 | C3: 2 | D3: 2 | E3: 5 | F3: 5 | G3: 5 | I3: 1 | J3: 11 | K3: 1011 | L3: 101 | N3: 11 | O3: 522 | P3: 312 | Q3: 858 | R3: 360 | S3: 120
A4: 2 | B4: 桃花谷 | C4: 3 | D4: 3 | E4: 12 | F4: 12 | G4: 12 | I4: 1 | J4: 12 | K4: 1012 | L4: 102 | N4: 19 | O4: 1218 | P4: 728 | Q4: 2002 | R4: 840 | S4: 280
A5: 3 | B5: 兰香苑 | C5: 4 | D5: 4 | E5: 19 | F5: 19 | G5: 19 | I5: 1 | J5: 13 | K5: 1013 | L5: 103 | N5: 29 | O5: 2175 | P5: 1300 | Q5: 3575 | R5: 1500 | S5: 500
A6: 4 | B6: 屠龙殿 | C6: 5 | D6: 5 | E6: 21 | F6: 21 | G6: 21 | I6: 1 | J6: 14 | K6: 1014 | L6: 104 | N6: 39 | O6: 3045 | P6: 1820 | Q6: 5005 | R6: 2100 | S6: 700
A7: 5 | B7: 烽火楼 | C7: 6 | D7: 6 | E7: 22 | F7: 22 | G7: 22 | I7: 1 | J7: 15 | K7: 1015 | L7: 105 | N7: 49 | O7: 4089 | P7: 2444 | Q7: 6721 | R7: 2820 | S7: 940
A8: 6 | B8: 万安寺 | C8: 7 | D8: 7 | E8: 23 | F8: 23 | G8: 23 | I8: 1 | J8: 16 | K8: 1016 | L8: 106 | N8: 55 | O8: 4785 | P8: 2860 | Q8: 7865 | R8: 3300 | S8: 1100

Sheet: 华山论剑
A1: 层数ID | B1: 组队ID | C1: 平均等级 | D1: 难度 | E1: 精力消耗 | F1: 奖励类别 | G1: 参数列表 | H1: 奖励类别 | I1: 参数列表 | J1: 奖励类别 | K1: 参数列表 | L1: 奖励类别 | M1: 参数列表
A2: id | B2: team_name | C2: level | D2: difficulty | E2: eng_cost | F2: reward_type | G2: reward_args | H2: reward_type | I2: reward_args | J2: reward_type | K2: reward_args | L2: reward_type | M2: reward_args
A3: 1 | B3: 1 | C3: 35 | D3: 初出茅庐 | E3: 5 | F3: hero_exp | G3: 303 | H3: player_exp | I3: 36 | J3: money | K3: 5000
A4: 2 | B4: 2 | C4: 35 | D4: 初出茅庐 | E4: 5 | F4: hero_exp | G4: 304 | H4: player_exp | I4: 36 | J4: money | K4: 5000
A5: 3 | B5: 3 | C5: 35 | D5: 初出茅庐 | E5: 5 | F5: hero_exp | G5: 305 | H5: player_exp | I5: 42 | J5: money | K5: 5000
A6: 4 | B6: 4 | C6: 35 | D6: 初出茅庐 | E6: 5 | F6: hero_exp | G6: 306 | H6: player_exp | I6: 42 | J6: money | K6: 5000
A7: 5 | B7: 5 | C7: 35 | D7: 初出茅庐 | E7: 5 | F7: hero_exp | G7: 357 | H7: player_exp | I7: 42 | J7: money | K7: 5000 | L7: hero | M7: 293
A8: 6 | B8: 6 | C8: 37 | D8: 初出茅庐 | E8: 5 | F8: hero_exp | G8: 358 | H8: player_exp | I8: 42 | J8: money | K8: 10000
A9: 7 | B9: 7 | C9: 37 | D9: 初出茅庐 | E9: 5 | F9: hero_exp | G9: 359 | H9: player_exp | I9: 42 | J9: money | K9: 10000
A10: 8 | B10: 8 | C10: 37 | D10: 初出茅庐 | E10: 5 | F10: hero_exp | G10: 360 | H10: player_exp | I10: 48 | J10: money | K10: 10000
A11: 9 | B11: 9 | C11: 37 | D11: 初出茅庐 | E11: 5 | F11: hero_exp | G11: 361 | H11: player_exp | I11: 48 | J11: money | K11: 10000
A12: 10 | B12: 10 | C12: 37 | D12: 初出茅庐 | E12: 5 | F12: hero_exp | G12: 412 | H12: player_exp | I12: 48 | J12: money | K12: 10000 | L12: hero | M12: 657
A13: 11 | B13: 11 | C13: 39 | D13: 初出茅庐 | E13: 5 | F13: hero_exp | G13: 413 | H13: player_exp | I13: 48 | J13: money | K13: 15000
A14: 12 | B14: 12 | C14: 39 | D14: 初出茅庐 | E14: 5 | F14: hero_exp | G14: 414 | H14: player_exp | I14: 48 | J14: money | K14: 15000
A15: 13 | B15: 13 | C15: 39 | D15: 初出茅庐 | E15: 5 | F15: hero_exp | G15: 415 | H15: player_exp | I15: 54 | J15: money | K15: 15000
A16: 14 | B16: 14 | C16: 39 | D16: 初出茅庐 | E16: 5 | F16: hero_exp | G16: 416 | H16: player_exp | I16: 54 | J16: money | K16: 15000
A17: 15 | B17: 15 | C17: 39 | D17: 初出茅庐 | E17: 5 | F17: hero_exp | G17: 467 | H17: player_exp | I17: 54 | J17: money | K17: 15000 | L17: hero | M17: 412
A18: 16 | B18: 16 | C18: 41 | D18: 初出茅庐 | E18: 5 | F18: hero_exp | G18: 468 | H18: player_exp | I18: 54 | J18: money | K18: 20000
A19: 17 | B19: 17 | C19: 41 | D19: 初出茅庐 | E19: 5 | F19: hero_exp | G19: 469 | H19: player_exp | I19: 54 | J19: money | K19: 20000
A20: 18 | B20: 18 | C20: 41 | D20: 初出茅庐 | E20: 5 | F20: hero_exp | G20: 470 | H20: player_exp | I20: 60 | J20: money | K20: 20000
A21: 19 | B21: 19 | C21: 41 | D21: 初出茅庐 | E21: 5 | F21: hero_exp | G21: 471 | H21: player_exp | I21: 60 | J21: money | K21: 20000
A22: 20 | B22: 20 | C22: 41 | D22: 初出茅庐 | E22: 5 | F22: hero_exp | G22: 522 | H22: player_exp | I22: 60 | J22: money | K22: 20000 | L22: hero | M22: 219
A23: 21 | B23: 21 | C23: 43 | D23: 初出茅庐 | E23: 5 | F23: hero_exp | G23: 523 | H23: player_exp | I23: 60 | J23: money | K23: 25000
A24: 22 | B24: 22 | C24: 43 | D24: 初出茅庐 | E24: 5 | F24: hero_exp | G24: 524 | H24: player_exp | I24: 60 | J24: money | K24: 25000
A25: 23 | B25: 23 | C25: 43 | D25: 初出茅庐 | E25: 5 | F25: hero_exp | G25: 525 | H25: player_exp | I25: 66 | J25: money | K25: 25000
A26: 24 | B26: 24 | C26: 43 | D26: 初出茅庐 | E26: 5 | F26: hero_exp | G26: 526 | H26: player_exp | I26: 66 | J26: money | K26: 25000
A27: 25 | B27: 25 | C27: 43 | D27: 初出茅庐 | E27: 5 | F27: hero_exp | G27: 577 | H27: player_exp | I27: 66 | J27: money | K27: 25000 | L27: hero | M27: 497
A28: 26 | B28: 26 | C28: 45 | D28: 初出茅庐 | E28: 5 | F28: hero_exp | G28: 578 | H28: player_exp | I28: 66 | J28: money | K28: 30000
A29: 27 | B29: 27 | C29: 45 | D29: 初出茅庐 | E29: 5 | F29: hero_exp | G29: 579 | H29: player_exp | I29: 66 | J29: money | K29: 30000
A30: 28 | B30: 28 | C30: 45 | D30: 初出茅庐 | E30: 5 | F30: hero_exp | G30: 580 | H30: player_exp | I30: 72 | J30: money | K30: 30000
A31: 29 | B31: 29 | C31: 45 | D31: 初出茅庐 | E31: 5 | F31: hero_exp | G31: 581 | H31: player_exp | I31: 72 | J31: money | K31: 30000
A32: 30 | B32: 30 | C32: 45 | D32: 初出茅庐 | E32: 5 | F32: hero_exp | G32: 632 | H32: player_exp | I32: 72 | J32: money | K32: 30000 | L32: hero | M32: 521
A33: 31 | B33: 31 | C33: 47 | D33: 武林高手 | E33: 5 | F33: hero_exp | G33: 303 | H33: player_exp | I33: 36 | J33: money | K33: 35000
A34: 32 | B34: 32 | C34: 47 | D34: 武林高手 | E34: 5 | F34: hero_exp | G34: 304 | H34: player_exp | I34: 36 | J34: money | K34: 35000
A35: 33 | B35: 33 | C35: 47 | D35: 武林高手 | E35: 5 | F35: hero_exp | G35: 305 | H35: player_exp | I35: 42 | J35: money | K35: 35000
A36: 34 | B36: 34 | C36: 47 | D36: 武林高手 | E36: 5 | F36: hero_exp | G36: 306 | H36: player_exp | I36: 42 | J36: money | K36: 35000
A37: 35 | B37: 35 | C37: 48 | D37: 武林高手 | E37: 5 | F37: hero_exp | G37: 357 | H37: player_exp | I37: 42 | J37: money | K37: 35000 | L37: hero | M37: 251
A38: 36 | B38: 36 | C38: 49 | D38: 武林高手 | E38: 5 | F38: hero_exp | G38: 358 | H38: player_exp | I38: 42 | J38: money | K38: 40000
A39: 37 | B39: 37 | C39: 49 | D39: 武林高手 | E39: 5 | F39: hero_exp | G39: 359 | H39: player_exp | I39: 42 | J39: money | K39: 40000
A40: 38 | B40: 38 | C40: 49 | D40: 武林高手 | E40: 5 | F40: hero_exp | G40: 360 | H40: player_exp | I40: 48 | J40: money | K40: 40000
A41: 39 | B41: 39 | C41: 49 | D41: 武林高手 | E41: 5 | F41: hero_exp | G41: 361 | H41: player_exp | I41: 48 | J41: money | K41: 40000
A42: 40 | B42: 40 | C42: 50 | D42: 武林高手 | E42: 5 | F42: hero_exp | G42: 412 | H42: player_exp | I42: 48 | J42: money | K42: 40000 | L42: hero | M42: 155
A43: 41 | B43: 41 | C43: 51 | D43: 武林高手 | E43: 5 | F43: hero_exp | G43: 413 | H43: player_exp | I43: 48 | J43: money | K43: 45000
A44: 42 | B44: 42 | C44: 51 | D44: 武林高手 | E44: 5 | F44: hero_exp | G44: 414 | H44: player_exp | I44: 48 | J44: money | K44: 45000
A45: 43 | B45: 43 | C45: 51 | D45: 武林高手 | E45: 5 | F45: hero_exp | G45: 415 | H45: player_exp | I45: 54 | J45: money | K45: 45000
A46: 44 | B46: 44 | C46: 51 | D46: 武林高手 | E46: 5 | F46: hero_exp | G46: 416 | H46: player_exp | I46: 54 | J46: money | K46: 45000
A47: 45 | B47: 45 | C47: 52 | D47: 武林高手 | E47: 5 | F47: hero_exp | G47: 467 | H47: player_exp | I47: 54 | J47: money | K47: 45000 | L47: hero | M47: 370
A48: 46 | B48: 46 | C48: 53 | D48: 武林高手 | E48: 5 | F48: hero_exp | G48: 468 | H48: player_exp | I48: 54 | J48: money | K48: 50000
A49: 47 | B49: 47 | C49: 53 | D49: 武林高手 | E49: 5 | F49: hero_exp | G49: 469 | H49: player_exp | I49: 54 | J49: money | K49: 50000
A50: 48 | B50: 48 | C50: 53 | D50: 武林高手 | E50: 5 | F50: hero_exp | G50: 470 | H50: player_exp | I50: 60 | J50: money | K50: 50000
A51: 49 | B51: 49 | C51: 53 | D51: 武林高手 | E51: 5 | F51: hero_exp | G51: 471 | H51: player_exp | I51: 60 | J51: money | K51: 50000
A52: 50 | B52: 50 | C52: 54 | D52: 武林高手 | E52: 5 | F52: hero_exp | G52: 522 | H52: player_exp | I52: 60 | J52: money | K52: 50000 | L52: hero | M52: 252
A53: 51 | B53: 51 | C53: 55 | D53: 武林高手 | E53: 5 | F53: hero_exp | G53: 523 | H53: player_exp | I53: 60 | J53: money | K53: 55000
A54: 52 | B54: 52 | C54: 55 | D54: 武林高手 | E54: 5 | F54: hero_exp | G54: 524 | H54: player_exp | I54: 60 | J54: money | K54: 55000
A55: 53 | B55: 53 | C55: 55 | D55: 武林高手 | E55: 5 | F55: hero_exp | G55: 525 | H55: player_exp | I55: 66 | J55: money | K55: 55000
A56: 54 | B56: 54 | C56: 55 | D56: 武林高手 | E56: 5 | F56: hero_exp | G56: 526 | H56: player_exp | I56: 66 | J56: money | K56: 55000
A57: 55 | B57: 55 | C57: 56 | D57: 武林高手 | E57: 5 | F57: hero_exp | G57: 577 | H57: player_exp | I57: 66 | J57: money | K57: 55000 | L57: hero | M57: 110
A58: 56 | B58: 56 | C58: 57 | D58: 武林高手 | E58: 5 | F58: hero_exp | G58: 578 | H58: player_exp | I58: 66 | J58: money | K58: 60000
A59: 57 | B59: 57 | C59: 57 | D59: 武林高手 | E59: 5 | F59: hero_exp | G59: 579 | H59: player_exp | I59: 66 | J59: money | K59: 60000
A60: 58 | B60: 58 | C60: 57 | D60: 武林高手 | E60: 5 | F60: hero_exp | G60: 580 | H60: player_exp | I60: 72 | J60: money | K60: 60000
A61: 59 | B61: 59 | C61: 57 | D61: 武林高手 | E61: 5 | F61: hero_exp | G61: 581 | H61: player_exp | I61: 72 | J61: money | K61: 60000
A62: 60 | B62: 60 | C62: 58 | D62: 武林高手 | E62: 5 | F62: hero_exp | G62: 632 | H62: player_exp | I62: 72 | J62: money | K62: 60000 | L62: hero | M62: 584
A63: 61 | B63: 61 | C63: 60 | D63: 一代宗师 | E63: 5 | F63: hero_exp | G63: 303 | H63: player_exp | I63: 36 | J63: item | K63: 57|1
A64: 62 | B64: 62 | C64: 60 | D64: 一代宗师 | E64: 5 | F64: hero_exp | G64: 304 | H64: player_exp | I64: 36 | J64: item | K64: 57|1
A65: 63 | B65: 63 | C65: 60 | D65: 一代宗师 | E65: 5 | F65: hero_exp | G65: 305 | H65: player_exp | I65: 42 | J65: item | K65: 57|1
A66: 64 | B66: 64 | C66: 60 | D66: 一代宗师 | E66: 5 | F66: hero_exp | G66: 306 | H66: player_exp | I66: 42 | J66: item | K66: 57|1
A67: 65 | B67: 65 | C67: 60 | D67: 一代宗师 | E67: 5 | F67: hero_exp | G67: 357 | H67: player_exp | I67: 42 | J67: item | K67: 57|1 | L67: item | M67: 61|1
A68: 66 | B68: 66 | C68: 60 | D68: 一代宗师 | E68: 5 | F68: hero_exp | G68: 358 | H68: player_exp | I68: 42 | J68: item | K68: 57|1
A69: 67 | B69: 67 | C69: 60 | D69: 一代宗师 | E69: 5 | F69: hero_exp | G69: 359 | H69: player_exp | I69: 42 | J69: item | K69: 57|1
A70: 68 | B70: 68 | C70: 60 | D70: 一代宗师 | E70: 5 | F70: hero_exp | G70: 360 | H70: player_exp | I70: 48 | J70: item | K70: 57|1
A71: 69 | B71: 69 | C71: 60 | D71: 一代宗师 | E71: 5 | F71: hero_exp | G71: 361 | H71: player_exp | I71: 48 | J71: item | K71: 57|1
A72: 70 | B72: 70 | C72: 60 | D72: 一代宗师 | E72: 5 | F72: hero_exp | G72: 412 | H72: player_exp | I72: 48 | J72: item | K72: 57|1 | L72: item | M72: 62|1
A73: 71 | B73: 71 | C73: 60 | D73: 一代宗师 | E73: 5 | F73: hero_exp | G73: 413 | H73: player_exp | I73: 48 | J73: item | K73: 57|1
A74: 72 | B74: 72 | C74: 60 | D74: 一代宗师 | E74: 5 | F74: hero_exp | G74: 414 | H74: player_exp | I74: 48 | J74: item | K74: 57|1
A75: 73 | B75: 73 | C75: 60 | D75: 一代宗师 | E75: 5 | F75: hero_exp | G75: 415 | H75: player_exp | I75: 54 | J75: item | K75: 57|1
A76: 74 | B76: 74 | C76: 60 | D76: 一代宗师 | E76: 5 | F76: hero_exp | G76: 416 | H76: player_exp | I76: 54 | J76: item | K76: 57|1
A77: 75 | B77: 75 | C77: 60 | D77: 一代宗师 | E77: 5 | F77: hero_exp | G77: 467 | H77: player_exp | I77: 54 | J77: item | K77: 57|1 | L77: item | M77: 61|1
A78: 76 | B78: 76 | C78: 60 | D78: 一代宗师 | E78: 5 | F78: hero_exp | G78: 468 | H78: player_exp | I78: 54 | J78: item | K78: 57|1
A79: 77 | B79: 77 | C79: 60 | D79: 一代宗师 | E79: 5 | F79: hero_exp | G79: 469 | H79: player_exp | I79: 54 | J79: item | K79: 57|1
A80: 78 | B80: 78 | C80: 60 | D80: 一代宗师 | E80: 5 | F80: hero_exp | G80: 470 | H80: player_exp | I80: 60 | J80: item | K80: 57|1
A81: 79 | B81: 79 | C81: 60 | D81: 一代宗师 | E81: 5 | F81: hero_exp | G81: 471 | H81: player_exp | I81: 60 | J81: item | K81: 57|1
A82: 80 | B82: 80 | C82: 60 | D82: 一代宗师 | E82: 5 | F82: hero_exp | G82: 522 | H82: player_exp | I82: 60 | J82: item | K82: 57|1 | L82: item | M82: 62|1
A83: 81 | B83: 81 | C83: 60 | D83: 一代宗师 | E83: 5 | F83: hero_exp | G83: 523 | H83: player_exp | I83: 60 | J83: item | K83: 57|1
A84: 82 | B84: 82 | C84: 60 | D84: 一代宗师 | E84: 5 | F84: hero_exp | G84: 524 | H84: player_exp | I84: 60 | J84: item | K84: 57|1
A85: 83 | B85: 83 | C85: 60 | D85: 一代宗师 | E85: 5 | F85: hero_exp | G85: 525 | H85: player_exp | I85: 66 | J85: item | K85: 57|1
A86: 84 | B86: 84 | C86: 60 | D86: 一代宗师 | E86: 5 | F86: hero_exp | G86: 526 | H86: player_exp | I86: 66 | J86: item | K86: 57|1
A87: 85 | B87: 85 | C87: 60 | D87: 一代宗师 | E87: 5 | F87: hero_exp | G87: 577 | H87: player_exp | I87: 66 | J87: item | K87: 57|1 | L87: item | M87: 61|1
A88: 86 | B88: 86 | C88: 60 | D88: 一代宗师 | E88: 5 | F88: hero_exp | G88: 578 | H88: player_exp | I88: 66 | J88: item | K88: 57|1
A89: 87 | B89: 87 | C89: 60 | D89: 一代宗师 | E89: 5 | F89: hero_exp | G89: 579 | H89: player_exp | I89: 66 | J89: item | K89: 57|1
A90: 88 | B90: 88 | C90: 60 | D90: 一代宗师 | E90: 5 | F90: hero_exp | G90: 580 | H90: player_exp | I90: 72 | J90: item | K90: 57|1
A91: 89 | B91: 89 | C91: 60 | D91: 一代宗师 | E91: 5 | F91: hero_exp | G91: 581 | H91: player_exp | I91: 72 | J91: item | K91: 57|1
A92: 90 | B92: 90 | C92: 60 | D92: 一代宗师 | E92: 5 | F92: hero_exp | G92: 632 | H92: player_exp | I92: 72 | J92: item | K92: 57|1 | L92: item | M92: 62|1
A93: 91 | B93: 91 | C93: 60 | D93: 一代宗师 | E93: 5 | F93: hero_exp | G93: 632 | H93: player_exp | I93: 72 | J93: item | K93: 57|1
A94: 92 | B94: 92 | C94: 60 | D94: 一代宗师 | E94: 5 | F94: hero_exp | G94: 632 | H94: player_exp | I94: 72 | J94: item | K94: 57|1
A95: 93 | B95: 93 | C95: 60 | D95: 一代宗师 | E95: 5 | F95: hero_exp | G95: 632 | H95: player_exp | I95: 72 | J95: item | K95: 57|1
A96: 94 | B96: 94 | C96: 60 | D96: 一代宗师 | E96: 5 | F96: hero_exp | G96: 632 | H96: player_exp | I96: 72 | J96: item | K96: 57|1
A97: 95 | B97: 95 | C97: 60 | D97: 一代宗师 | E97: 5 | F97: hero_exp | G97: 632 | H97: player_exp | I97: 72 | J97: item | K97: 57|1 | L97: item | M97: 61|1
A98: 96 | B98: 96 | C98: 60 | D98: 一代宗师 | E98: 5 | F98: hero_exp | G98: 632 | H98: player_exp | I98: 72 | J98: item | K98: 57|1
A99: 97 | B99: 97 | C99: 60 | D99: 一代宗师 | E99: 5 | F99: hero_exp | G99: 632 | H99: player_exp | I99: 72 | J99: item | K99: 57|1
A100: 98 | B100: 98 | C100: 60 | D100: 一代宗师 | E100: 5 | F100: hero_exp | G100: 632 | H100: player_exp | I100: 72 | J100: item | K100: 57|1
A101: 99 | B101: 99 | C101: 60 | D101: 一代宗师 | E101: 5 | F101: hero_exp | G101: 632 | H101: player_exp | I101: 72 | J101: item | K101: 57|1
A102: 100 | B102: 100 | C102: 60 | D102: 一代宗师 | E102: 5 | F102: hero_exp | G102: 632 | H102: player_exp | I102: 72 | J102: item | K102: 57|1 | L102: item | M102: 62|1
A103: 101 | B103: 101 | C103: 60 | D103: 一代宗师 | E103: 5 | F103: hero_exp | G103: 632 | H103: player_exp | I103: 72 | J103: item | K103: 57|1
A104: 102 | B104: 102 | C104: 60 | D104: 一代宗师 | E104: 5 | F104: hero_exp | G104: 632 | H104: player_exp | I104: 72 | J104: item | K104: 57|1
A105: 103 | B105: 103 | C105: 60 | D105: 一代宗师 | E105: 5 | F105: hero_exp | G105: 632 | H105: player_exp | I105: 72 | J105: item | K105: 57|1
A106: 104 | B106: 104 | C106: 60 | D106: 一代宗师 | E106: 5 | F106: hero_exp | G106: 632 | H106: player_exp | I106: 72 | J106: item | K106: 57|1
A107: 105 | B107: 105 | C107: 60 | D107: 一代宗师 | E107: 5 | F107: hero_exp | G107: 632 | H107: player_exp | I107: 72 | J107: item | K107: 57|1 | L107: item | M107: 61|1
A108: 106 | B108: 106 | C108: 60 | D108: 一代宗师 | E108: 5 | F108: hero_exp | G108: 632 | H108: player_exp | I108: 72 | J108: item | K108: 57|1
A109: 107 | B109: 107 | C109: 60 | D109: 一代宗师 | E109: 5 | F109: hero_exp | G109: 632 | H109: player_exp | I109: 72 | J109: item | K109: 57|1
A110: 108 | B110: 108 | C110: 60 | D110: 一代宗师 | E110: 5 | F110: hero_exp | G110: 632 | H110: player_exp | I110: 72 | J110: item | K110: 57|1
A111: 109 | B111: 109 | C111: 60 | D111: 一代宗师 | E111: 5 | F111: hero_exp | G111: 632 | H111: player_exp | I111: 72 | J111: item | K111: 57|1
A112: 110 | B112: 110 | C112: 60 | D112: 一代宗师 | E112: 5 | F112: hero_exp | G112: 632 | H112: player_exp | I112: 72 | J112: item | K112: 57|1 | L112: item | M112: 62|1
A113: 111 | B113: 111 | C113: 60 | D113: 一代宗师 | E113: 5 | F113: hero_exp | G113: 632 | H113: player_exp | I113: 72 | J113: item | K113: 57|1
A114: 112 | B114: 112 | C114: 60 | D114: 一代宗师 | E114: 5 | F114: hero_exp | G114: 632 | H114: player_exp | I114: 72 | J114: item | K114: 57|1
A115: 113 | B115: 113 | C115: 60 | D115: 一代宗师 | E115: 5 | F115: hero_exp | G115: 632 | H115: player_exp | I115: 72 | J115: item | K115: 57|1
A116: 114 | B116: 114 | C116: 60 | D116: 一代宗师 | E116: 5 | F116: hero_exp | G116: 632 | H116: player_exp | I116: 72 | J116: item | K116: 57|1
A117: 115 | B117: 115 | C117: 60 | D117: 一代宗师 | E117: 5 | F117: hero_exp | G117: 632 | H117: player_exp | I117: 72 | J117: item | K117: 57|1 | L117: item | M117: 61|1
A118: 116 | B118: 116 | C118: 60 | D118: 一代宗师 | E118: 5 | F118: hero_exp | G118: 632 | H118: player_exp | I118: 72 | J118: item | K118: 57|1
A119: 117 | B119: 117 | C119: 60 | D119: 一代宗师 | E119: 5 | F119: hero_exp | G119: 632 | H119: player_exp | I119: 72 | J119: item | K119: 57|1
A120: 118 | B120: 118 | C120: 60 | D120: 一代宗师 | E120: 5 | F120: hero_exp | G120: 632 | H120: player_exp | I120: 72 | J120: item | K120: 57|1
A121: 119 | B121: 119 | C121: 60 | D121: 一代宗师 | E121: 5 | F121: hero_exp | G121: 632 | H121: player_exp | I121: 72 | J121: item | K121: 57|1
A122: 120 | B122: 120 | C122: 60 | D122: 一代宗师 | E122: 5 | F122: hero_exp | G122: 632 | H122: player_exp | I122: 72 | J122: item | K122: 57|1 | L122: item | M122: 62|1

Sheet: 千层塔怪物组队表
A1: 组队ID | B1: 组队名称 | C1: 队长 | D1: 音乐 | E1: 阵法ID | F1: 0怪物ID | G1: 0怪物等级 | H1: 攻击修正0 | I1: 防御修正0 | J1: 生命修正0 | K1: 内力修正0 | L1: 体力修正0 | M1: 武器ID0 | N1: 防具ID0 | O1: 饰品ID0 | P1: 技能专精0 | Q1: 天赋激活0 | R1: 1怪物ID | S1: 1怪物等级 | T1: 攻击修正1 | U1: 防御修正1 | V1: 生命修正1 | W1: 内力修正1 | X1: 体力修正1 | Y1: 武器ID1 | Z1: 防具ID1 | AA1: 饰品ID1 | AB1: 技能专精1 | AC1: 天赋激活1 | AD1: 2怪物ID | AE1: 2怪物等级 | AF1: 攻击修正2 | AG1: 防御修正2 | AH1: 生命修正2 | AI1: 内力修正2 | AJ1: 体力修正2 | AK1: 武器ID2 | AL1: 防具ID2 | AM1: 饰品ID2 | AN1: 技能专精2 | AO1: 天赋激活2 | AP1: 3怪物ID | AQ1: 3怪物等级 | AR1: 攻击修正3 | AS1: 防御修正3 | AT1: 生命修正3 | AU1: 内力修正3 | AV1: 体力修正3 | AW1: 武器ID3 | AX1: 防具ID3 | AY1: 饰品ID3 | AZ1: 技能专精3 | BA1: 天赋激活3 | BB1: 4怪物ID | BC1: 4怪物等级 | BD1: 攻击修正4 | BE1: 防御修正4 | BF1: 生命修正4 | BG1: 内力修正4 | BH1: 体力修正4 | BI1: 武器ID4 | BJ1: 防具ID4 | BK1: 饰品ID4 | BL1: 技能专精4 | BM1: 天赋激活4 | BN1: 5怪物ID | BO1: 5怪物等级 | BP1: 攻击修正5 | BQ1: 防御修正5 | BR1: 生命修正5 | BS1: 内力修正5 | BT1: 体力修正5 | BU1: 武器ID5 | BV1: 防具ID5 | BW1: 饰品ID5 | BX1: 技能专精5 | BY1: 天赋激活5
A2: id | B2: name | C2: leader | D2: back_music | E2: zhenfa_id | F2: monster_id0 | G2: monster_lvl0 | H2: attack_mod0 | I2: defence_mod0 | J2: hp_mod0 | K2: mp_mod0 | L2: sp_mod0 | M2: weapon_id0 | N2: armor_id0 | O2: ornament_id0 | P2: skill_power0 | Q2: talnet_0 | R2: monster_id1 | S2: monster_lvl1 | T2: attack_mod1 | U2: defence_mod1 | V2: hp_mod1 | W2: mp_mod1 | X2: sp_mod1 | Y2: weapon_id1 | Z2: armor_id1 | AA2: ornament_id1 | AB2: skill_power1 | AC2: talnet_1 | AD2: monster_id2 | AE2: monster_lvl2 | AF2: attack_mod2 | AG2: defence_mod2 | AH2: hp_mod2 | AI2: mp_mod2 | AJ2: sp_mod2 | AK2: weapon_id2 | AL2: armor_id2 | AM2: ornament_id2 | AN2: skill_power2 | AO2: talnet_2 | AP2: monster_id3 | AQ2: monster_lvl3 | AR2: attack_mod3 | AS2: defence_mod3 | AT2: hp_mod3 | AU2: mp_mod3 | AV2: sp_mod3 | AW2: weapon_id3 | AX2: armor_id3 | AY2: ornament_id3 | AZ2: skill_power3 | BA2: talnet_3 | BB2: monster_id4 | BC2: monster_lvl4 | BD2: attack_mod4 | BE2: defence_mod4 | BF2: hp_mod4 | BG2: mp_mod4 | BH2: sp_mod4 | BI2: weapon_id4 | BJ2: armor_id4 | BK2: ornament_id4 | BL2: skill_power4 | BM2: talnet_4 | BN2: monster_id5 | BO2: monster_lvl5 | BP2: attack_mod5 | BQ2: defence_mod5 | BR2: hp_mod5 | BS2: mp_mod5 | BT2: sp_mod5 | BU2: weapon_id5 | BV2: armor_id5 | BW2: ornament_id5 | BX2: skill_power5 | BY2: talnet_5
A3: 1 | B3: 1 | C3: 左冷禅 | F3: 摘星子 | G3: 35 | H3: 2550 | I3: 1525 | J3: 3575 | K3: 1500 | L3: 500 | R3: 出尘子 | S3: 35 | T3: 2550 | U3: 1525 | V3: 3575 | W3: 1500 | X3: 500 | AD3: 狮吼子 | AE3: 35 | AF3: 2550 | AG3: 1525 | AH3: 3575 | AI3: 1500 | AJ3: 500 | AP3: 阿紫 | AQ3: 35 | AR3: 2550 | AS3: 1525 | AT3: 3575 | AU3: 1500 | AV3: 500 | BB3: 左冷禅 | BC3: 35 | BD3: 2550 | BE3: 1525 | BF3: 3575 | BG3: 1500 | BH3: 500
A4: 2 | B4: 2 | C4: 韩小莹 | F4: 出尘子 | G4: 35 | H4: 2601 | I4: 1546 | J4: 3626 | K4: 1521 | L4: 507 | R4: 摘星子 | S4: 35 | T4: 2293 | U4: 1364 | V4: 3216 | W4: 6747 | X4: 2249 | AD4: 狮吼子 | AE4: 35 | AF4: 2550 | AG4: 1525 | AH4: 3575 | AI4: 1521 | AJ4: 507 | AP4: 左冷禅 | AQ4: 35 | AR4: 2550 | AS4: 1525 | AT4: 3575 | AU4: 1521 | AV4: 507 | BB4: 韩小莹 | BC4: 35 | BD4: 2601 | BE4: 1546 | BF4: 3626 | BG4: 1521 | BH4: 507
A5: 3 | B5: 3 | C5: 林远图 | F5: 阿紫 | G5: 35 | H5: 2338 | I5: 1383 | J5: 3280 | K5: 6881 | L5: 2293 | R5: 出尘子 | S5: 35 | T5: 2338 | U5: 1383 | V5: 3216 | W5: 6881 | X5: 2293 | AD5: 左冷禅 | AE5: 35 | AF5: 2550 | AG5: 1525 | AH5: 3575 | AI5: 1542 | AJ5: 514 | AP5: 风波恶 | AQ5: 35 | AR5: 2601 | AS5: 1546 | AT5: 3626 | AU5: 1542 | AV5: 514 | BB5: 林远图 | BC5: 35 | BD5: 2653 | BE5: 1568 | BF5: 3677 | BG5: 1542 | BH5: 514
A6: 4 | B6: 4 | C6: 摘星子 | F6: 左冷禅 | G6: 35 | H6: 2338 | I6: 1383 | J6: 3280 | K6: 6881 | L6: 2293 | R6: 出尘子 | S6: 35 | T6: 2550 | U6: 1525 | V6: 3575 | W6: 1564 | X6: 521 | AD6: 左冷禅 | AE6: 35 | AF6: 2601 | AG6: 1546 | AH6: 3626 | AI6: 1564 | AJ6: 521 | AP6: 阿紫 | AQ6: 35 | AR6: 2653 | AS6: 1568 | AT6: 3677 | AU6: 1564 | AV6: 521 | BB6: 摘星子 | BC6: 35 | BD6: 2706 | BE6: 1590 | BF6: 3729 | BG6: 1564 | BH6: 521
A7: 5 | B7: 5 | C7: 出尘子 | F7: 狮吼子 | G7: 35 | H7: 2550 | I7: 1525 | J7: 3575 | K7: 1800 | L7: 600 | R7: 天狼子 | S7: 35 | T7: 2338 | U7: 1383 | V7: 3280 | W7: 6881 | X7: 2293 | AD7: 韩小莹 | AE7: 35 | AF7: 2653 | AG7: 1568 | AH7: 3216 | AI7: 1595 | AJ7: 531 | AP7: 林远图 | AQ7: 35 | AR7: 2754 | AS7: 1647 | AT7: 3861 | AU7: 1620 | AV7: 540 | BB7: 出尘子 | BC7: 35 | BD7: 3060 | BE7: 1830 | BF7: 4290 | BG7: 1800 | BH7: 600
A8: 6 | B8: 6 | C8: 狮吼子 | F8: 出尘子 | G8: 37 | H8: 2550 | I8: 1525 | J8: 3575 | K8: 1860 | L8: 620 | R8: 王处一 | S8: 37 | T8: 3162 | U8: 1891 | V8: 4433 | W8: 1860 | X8: 620 | AD8: 林远图 | AE8: 37 | AF8: 3162 | AG8: 1891 | AH8: 4433 | AI8: 1860 | AJ8: 620 | AP8: 阿紫 | AQ8: 37 | AR8: 2845 | AS8: 1701 | AT8: 3989 | AU8: 1674 | AV8: 558 | BB8: 狮吼子 | BC8: 37 | BD8: 3162 | BE8: 1891 | BF8: 4433 | BG8: 1860 | BH8: 620
A9: 7 | B9: 7 | C9: 天狼子 | F9: 韩小莹 | G9: 37 | H9: 2293 | I9: 1364 | J9: 3216 | K9: 6747 | L9: 2249 | R9: 梅超风 | S9: 37 | T9: 3162 | U9: 1891 | V9: 4433 | W9: 1886 | X9: 628 | AD9: 朱丹臣 | AE9: 37 | AF9: 2845 | AG9: 1701 | AH9: 3989 | AI9: 1886 | AJ9: 628 | AP9: 王处一 | AQ9: 37 | AR9: 2902 | AS9: 1726 | AT9: 4046 | AU9: 1697 | AV9: 565 | BB9: 天狼子 | BC9: 37 | BD9: 3225 | BE9: 1918 | BF9: 4496 | BG9: 1886 | BH9: 628
A10: 8 | B10: 8 | C10: 梅超风 | F10: 韩小莹 | G10: 37 | H10: 2550 | I10: 1525 | J10: 3575 | K10: 1912 | L10: 636 | R10: 阿紫 | S10: 37 | T10: 3225 | U10: 1918 | V10: 3280 | W10: 1923 | X10: 640 | AD10: 出尘子 | AE10: 37 | AF10: 2902 | AG10: 1726 | AH10: 4046 | AI10: 1912 | AJ10: 636 | AP10: 左冷禅 | AQ10: 37 | AR10: 2960 | AS10: 1750 | AT10: 4104 | AU10: 1720 | AV10: 572 | BB10: 梅超风 | BC10: 37 | BD10: 3289 | BE10: 1945 | BF10: 4560 | BG10: 1912 | BH10: 636
A11: 9 | B11: 9 | C11: 阿紫 | F11: 林远图 | G11: 37 | H11: 2716 | I11: 1596 | J11: 3745 | K11: 1570 | L11: 522 | R11: 左冷禅 | S11: 37 | T11: 3018 | U11: 1774 | V11: 4162 | W11: 1745 | X11: 580 | AD11: 韩小莹 | AE11: 37 | AF11: 3018 | AG11: 1774 | AH11: 4162 | AI11: 1745 | AJ11: 580 | AP11: 梅超风 | AQ11: 37 | AR11: 3018 | AS11: 1774 | AT11: 4162 | AU11: 1745 | AV11: 580 | BB11: 阿紫 | BC11: 37 | BD11: 3354 | BE11: 1972 | BF11: 4625 | BG11: 1939 | BH11: 645
A12: 10 | B12: 10 | C12: 王处一 | F12: 梅超风 | G12: 37 | H12: 2808 | I12: 1679 | J12: 3937 | K12: 1652 | L12: 550 | R12: 左冷禅 | S12: 37 | T12: 3121 | U12: 1866 | V12: 4375 | W12: 1836 | X12: 612 | AD12: 狮吼子 | AE12: 37 | AF12: 3121 | AG12: 1866 | AH12: 4375 | AI12: 1836 | AJ12: 612 | AP12: 阿紫 | AQ12: 37 | AR12: 3121 | AS12: 1866 | AT12: 4375 | AU12: 1836 | AV12: 612 | BB12: 王处一 | BC12: 37 | BD12: 3468 | BE12: 2074 | BF12: 4862 | BG12: 2040 | BH12: 680
A13: 11 | B13: 11 | C13: 忽都虎 | F13: 沈青刚 | G13: 39 | H13: 2836 | I13: 1695 | J13: 3976 | K13: 1668 | L13: 555 | R13: 吴青烈 | S13: 39 | T13: 3152 | U13: 1884 | V13: 4418 | W13: 1854 | X13: 618 | AD13: 霍都 | AE13: 39 | AF13: 3152 | AG13: 1884 | AH13: 4418 | AI13: 1854 | AJ13: 618 | AP13: 完颜洪烈 | AQ13: 39 | AR13: 3152 | AS13: 1884 | AT13: 4418 | AU13: 1854 | AV13: 618 | BB13: 忽都虎 | BC13: 39 | BD13: 3570 | BE13: 2135 | BF13: 5005 | BG13: 2100 | BH13: 700
A14: 12 | B14: 12 | C14: 俞岱岩 | F14: 马青雄 | G14: 39 | H14: 2864 | I14: 1711 | J14: 4015 | K14: 1684 | L14: 560 | R14: 钱青健 | S14: 39 | T14: 3183 | U14: 1902 | V14: 4462 | W14: 1872 | X14: 624 | AD14: 忽都虎 | AE14: 39 | AF14: 3183 | AG14: 1902 | AH14: 4462 | AI14: 1872 | AJ14: 624 | AP14: 完颜阿骨打 | AQ14: 39 | AR14: 3183 | AS14: 1902 | AT14: 4462 | AU14: 1872 | AV14: 624 | BB14: 俞岱岩 | BC14: 39 | BD14: 3621 | BE14: 2165 | BF14: 5076 | BG14: 2130 | BH14: 710
A15: 13 | B15: 13 | C15: 完颜洪烈 | F15: 吴青烈 | G15: 39 | H15: 2892 | I15: 1728 | J15: 4055 | K15: 1700 | L15: 565 | R15: 哲别 | S15: 39 | T15: 3214 | U15: 1921 | V15: 4506 | W15: 1890 | X15: 630 | AD15: 潇湘子 | AE15: 39 | AF15: 3214 | AG15: 1921 | AH15: 4506 | AI15: 1890 | AJ15: 630 | AP15: 侯通海 | AQ15: 39 | AR15: 3214 | AS15: 1921 | AT15: 4506 | AU15: 1890 | AV15: 630 | BB15: 完颜洪烈 | BC15: 39 | BD15: 3672 | BE15: 2195 | BF15: 5148 | BG15: 2160 | BH15: 720
A16: 14 | B16: 14 | C16: 霍都 | F16: 忽都虎 | G16: 39 | H16: 2920 | I16: 1745 | J16: 4095 | K16: 1717 | L16: 570 | R16: 完颜阿骨打 | S16: 39 | T16: 3246 | U16: 1940 | V16: 4551 | W16: 1908 | X16: 636 | AD16: 哲别 | AE16: 39 | AF16: 3246 | AG16: 1940 | AH16: 4551 | AI16: 1908 | AJ16: 636 | AP16: 潇湘子 | AQ16: 39 | AR16: 3246 | AS16: 1940 | AT16: 4551 | AU16: 1908 | AV16: 636 | BB16: 霍都 | BC16: 39 | BD16: 3724 | BE16: 2226 | BF16: 5221 | BG16: 2190 | BH16: 730
A17: 15 | B17: 15 | C17: 完颜阿骨打 | F17: 常胜宝树王 | G17: 39 | H17: 2949 | I17: 1762 | J17: 4135 | K17: 1734 | L17: 575 | R17: 忽都虎 | S17: 39 | T17: 3278 | U17: 1959 | V17: 4596 | W17: 1927 | X17: 642 | AD17: 俞岱岩 | AE17: 39 | AF17: 3278 | AG17: 1959 | AH17: 4596 | AI17: 1927 | AJ17: 642 | AP17: 完颜洪烈 | AQ17: 39 | AR17: 3278 | AS17: 1959 | AT17: 4596 | AU17: 1927 | AV17: 642 | BB17: 完颜阿骨打 | BC17: 39 | BD17: 3774 | BE17: 2257 | BF17: 5291 | BG17: 2220 | BH17: 740
A18: 16 | B18: 16 | C18: 哲别 | F18: 沈青刚 | G18: 41 | H18: 2978 | I18: 1779 | J18: 4176 | K18: 1751 | L18: 580 | R18: 忽都虎 | S18: 41 | T18: 3310 | U18: 1978 | V18: 4641 | W18: 1946 | X18: 648 | AD18: 完颜洪烈 | AE18: 41 | AF18: 3310 | AG18: 1978 | AH18: 4641 | AI18: 1946 | AJ18: 648 | AP18: 侯通海 | AQ18: 41 | AR18: 3310 | AS18: 1978 | AT18: 4641 | AU18: 1946 | AV18: 648 | BB18: 哲别 | BC18: 41 | BD18: 3876 | BE18: 2318 | BF18: 5434 | BG18: 2280 | BH18: 760
A19: 17 | B19: 17 | C19: 侯通海 | F19: 智慧宝树王 | G19: 41 | H19: 3007 | I19: 1796 | J19: 4217 | K19: 1768 | L19: 585 | R19: 完颜阿骨打 | S19: 41 | T19: 3343 | U19: 1997 | V19: 4687 | W19: 1965 | X19: 654 | AD19: 忽都虎 | AE19: 41 | AF19: 3343 | AG19: 1997 | AH19: 4687 | AI19: 1965 | AJ19: 654 | AP19: 忽都虎 | AQ19: 41 | AR19: 3343 | AS19: 1997 | AT19: 4687 | AU19: 1965 | AV19: 654 | BB19: 侯通海 | BC19: 41 | BD19: 3919 | BE19: 2343 | BF19: 5494 | BG19: 2305 | BH19: 768
A20: 18 | B20: 18 | C20: 潇湘子 | F20: 忽都虎 | G20: 41 | H20: 3037 | I20: 1813 | J20: 4259 | K20: 1785 | L20: 590 | R20: 哲别 | S20: 41 | T20: 3376 | U20: 2016 | V20: 4733 | W20: 1984 | X20: 660 | AD20: 完颜阿骨打 | AE20: 41 | AF20: 3376 | AG20: 2016 | AH20: 4733 | AI20: 1984 | AJ20: 660 | AP20: 侯通海 | AQ20: 41 | AR20: 3376 | AS20: 2016 | AT20: 4733 | AU20: 1984 | AV20: 660 | BB20: 潇湘子 | BC20: 41 | BD20: 3962 | BE20: 2369 | BF20: 5555 | BG20: 2330 | BH20: 776
A21: 19 | B21: 19 | C21: 欧阳克 | F21: 完颜阿骨打 | G21: 41 | H21: 3067 | I21: 1831 | J21: 4301 | K21: 1802 | L21: 595 | R21: 忽都虎 | S21: 41 | T21: 3409 | U21: 2036 | V21: 4780 | W21: 2003 | X21: 666 | AD21: 哲别 | AE21: 41 | AF21: 3409 | AG21: 2036 | AH21: 4780 | AI21: 2003 | AJ21: 666 | AP21: 潇湘子 | AQ21: 41 | AR21: 3409 | AS21: 2036 | AT21: 4780 | AU21: 2003 | AV21: 666 | BB21: 欧阳克 | BC21: 41 | BD21: 4006 | BE21: 2395 | BF21: 5616 | BG21: 2355 | BH21: 784
A22: 20 | B22: 20 | C22: 俞岱岩 | F22: 忽都虎 | G22: 41 | H22: 3097 | I22: 1849 | J22: 4344 | K22: 1820 | L22: 600 | R22: 完颜阿骨打 | S22: 41 | T22: 3443 | U22: 2056 | V22: 4827 | W22: 2023 | X22: 672 | AD22: 潇湘子 | AE22: 41 | AF22: 3443 | AG22: 2056 | AH22: 4827 | AI22: 2023 | AJ22: 672 | AP22: 哲别 | AQ22: 41 | AR22: 3443 | AS22: 2056 | AT22: 4827 | AU22: 2023 | AV22: 672 | BB22: 俞岱岩 | BC22: 41 | BD22: 4080 | BE22: 2440 | BF22: 5720 | BG22: 2400 | BH22: 800
A23: 21 | B23: 21 | C23: 包不同 | F23: 王语嫣 | G23: 43 | H23: 3127 | I23: 1867 | J23: 4387 | K23: 1838 | L23: 606 | R23: 风波恶 | S23: 43 | T23: 3477 | U23: 2076 | V23: 4875 | W23: 2043 | X23: 678 | AD23: 邓百川 | AE23: 43 | AF23: 3477 | AG23: 2076 | AH23: 4875 | AI23: 2043 | AJ23: 678 | AP23: 公冶乾 | AQ23: 43 | AR23: 3477 | AS23: 2076 | AT23: 4875 | AU23: 2043 | AV23: 678 | BB23: 包不同 | BC23: 43 | BD23: 4182 | BE23: 2501 | BF23: 5863 | BG23: 2460 | BH23: 820
A24: 22 | B24: 22 | C24: 邓百川 | F24: 风波恶 | G24: 43 | H24: 3158 | I24: 1885 | J24: 4430 | K24: 1856 | L24: 612 | R24: 公冶乾 | S24: 43 | T24: 3511 | U24: 2096 | V24: 4923 | W24: 2063 | X24: 684 | AD24: 王语嫣 | AE24: 43 | AF24: 3511 | AG24: 2096 | AH24: 4923 | AI24: 2063 | AJ24: 684 | AP24: 包不同 | AQ24: 43 | AR24: 3511 | AS24: 2096 | AT24: 4923 | AU24: 2063 | AV24: 684 | BB24: 邓百川 | BC24: 43 | BD24: 4209 | BE24: 2517 | BF24: 5902 | BG24: 2476 | BH24: 825
A25: 23 | B25: 23 | C25: 风波恶 | F25: 王语嫣 | G25: 43 | H25: 3189 | I25: 1903 | J25: 4474 | K25: 1874 | L25: 618 | R25: 邓百川 | S25: 43 | T25: 3546 | U25: 2116 | V25: 4972 | W25: 2083 | X25: 690 | AD25: 公冶乾 | AE25: 43 | AF25: 3546 | AG25: 2116 | AH25: 4972 | AI25: 2083 | AJ25: 690 | AP25: 包不同 | AQ25: 43 | AR25: 3546 | AS25: 2116 | AT25: 4972 | AU25: 2083 | AV25: 690 | BB25: 风波恶 | BC25: 43 | BD25: 4237 | BE25: 2533 | BF25: 5941 | BG25: 2492 | BH25: 830
A26: 24 | B26: 24 | C26: 公冶乾 | F26: 阿朱 | G26: 43 | H26: 3220 | I26: 1922 | J26: 4518 | K26: 1892 | L26: 624 | R26: 包不同 | S26: 43 | T26: 3581 | U26: 2137 | V26: 5021 | W26: 2103 | X26: 696 | AD26: 邓百川 | AE26: 43 | AF26: 3581 | AG26: 2137 | AH26: 5021 | AI26: 2103 | AJ26: 696 | AP26: 风波恶 | AQ26: 43 | AR26: 3581 | AS26: 2137 | AT26: 5021 | AU26: 2103 | AV26: 696 | BB26: 公冶乾 | BC26: 43 | BD26: 4265 | BE26: 2549 | BF26: 5980 | BG26: 2508 | BH26: 835
A27: 25 | B27: 25 | C27: 王语嫣 | F27: 邓百川 | G27: 43 | H27: 3252 | I27: 1941 | J27: 4563 | K27: 1910 | L27: 630 | R27: 风波恶 | S27: 43 | T27: 3616 | U27: 2158 | V27: 5071 | W27: 2124 | X27: 702 | AD27: 包不同 | AE27: 43 | AF27: 3616 | AG27: 2158 | AH27: 5071 | AI27: 2124 | AJ27: 702 | AP27: 公冶乾 | AQ27: 43 | AR27: 3616 | AS27: 2158 | AT27: 5071 | AU27: 2124 | AV27: 702 | BB27: 王语嫣 | BC27: 43 | BD27: 4284 | BE27: 2562 | BF27: 6006 | BG27: 2520 | BH27: 840
A28: 26 | B28: 26 | C28: 阿朱 | F28: 王语嫣 | G28: 45 | H28: 3284 | I28: 1960 | J28: 4608 | K28: 1929 | L28: 636 | R28: 公冶乾 | S28: 45 | T28: 3652 | U28: 2179 | V28: 5121 | W28: 2145 | X28: 709 | AD28: 包不同 | AE28: 45 | AF28: 3652 | AG28: 2179 | AH28: 5121 | AI28: 2145 | AJ28: 709 | AP28: 风波恶 | AQ28: 45 | AR28: 3652 | AS28: 2179 | AT28: 5121 | AU28: 2145 | AV28: 709 | BB28: 阿朱 | BC28: 45 | BD28: 4305 | BE28: 2574 | BF28: 6036 | BG28: 2532 | BH28: 844
A29: 27 | B29: 27 | C29: 莫声谷 | F29: 王语嫣 | G29: 45 | H29: 3316 | I29: 1979 | J29: 4654 | K29: 1948 | L29: 642 | R29: 公冶乾 | S29: 45 | T29: 3688 | U29: 2200 | V29: 5172 | W29: 2166 | X29: 716 | AD29: 邓百川 | AE29: 45 | AF29: 3688 | AG29: 2200 | AH29: 5172 | AI29: 2166 | AJ29: 716 | AP29: 包不同 | AQ29: 45 | AR29: 3688 | AS29: 2200 | AT29: 5172 | AU29: 2166 | AV29: 716 | BB29: 莫声谷 | BC29: 45 | BD29: 4326 | BE29: 2586 | BF29: 6066 | BG29: 2544 | BH29: 848
A30: 28 | B30: 28 | C30: 风波恶 | F30: 王语嫣 | G30: 45 | H30: 3349 | I30: 1998 | J30: 4700 | K30: 1967 | L30: 648 | R30: 公冶乾 | S30: 45 | T30: 3724 | U30: 2222 | V30: 5223 | W30: 2187 | X30: 723 | AD30: 邓百川 | AE30: 45 | AF30: 3724 | AG30: 2222 | AH30: 5223 | AI30: 2187 | AJ30: 723 | AP30: 风波恶 | AQ30: 45 | AR30: 3724 | AS30: 2222 | AT30: 5223 | AU30: 2187 | AV30: 723 | BB30: 风波恶 | BC30: 45 | BD30: 4347 | BE30: 2598 | BF30: 6096 | BG30: 2556 | BH30: 852
A31: 29 | B31: 29 | C31: 林远图 | F31: 阿朱 | G31: 45 | H31: 3382 | I31: 2017 | J31: 4747 | K31: 1986 | L31: 654 | R31: 王语嫣 | S31: 45 | T31: 3761 | U31: 2244 | V31: 5275 | W31: 2208 | X31: 730 | AD31: 公冶乾 | AE31: 45 | AF31: 3761 | AG31: 2244 | AH31: 5275 | AI31: 2208 | AJ31: 730 | AP31: 风波恶 | AQ31: 45 | AR31: 3761 | AS31: 2244 | AT31: 5275 | AU31: 2208 | AV31: 730 | BB31: 林远图 | BC31: 45 | BD31: 4368 | BE31: 2610 | BF31: 6126 | BG31: 2568 | BH31: 856
A32: 30 | B32: 30 | C32: 莫声谷 | F32: 王语嫣 | G32: 45 | H32: 3415 | I32: 2037 | J32: 4794 | K32: 2005 | L32: 660 | R32: 公冶乾 | S32: 45 | T32: 3798 | U32: 2266 | V32: 5327 | W32: 2230 | X32: 737 | AD32: 风波恶 | AE32: 45 | AF32: 3798 | AG32: 2266 | AH32: 5327 | AI32: 2230 | AJ32: 737 | AP32: 林远图 | AQ32: 45 | AR32: 3798 | AS32: 2266 | AT32: 5327 | AU32: 2230 | AV32: 737 | BB32: 莫声谷 | BC32: 45 | BD32: 4386 | BE32: 2623 | BF32: 6149 | BG32: 2580 | BH32: 860
A33: 31 | B33: 31 | C33: 左冷禅 | F33: 摘星子 | G33: 47 | H33: 4314 | I33: 2580 | J33: 6048 | K33: 2538 | L33: 846 | R33: 出尘子 | S33: 47 | T33: 4314 | U33: 2580 | V33: 6048 | W33: 2538 | X33: 846 | AD33: 狮吼子 | AE33: 47 | AF33: 4314 | AG33: 2580 | AH33: 6048 | AI33: 2538 | AJ33: 846 | AP33: 阿紫 | AQ33: 47 | AR33: 4314 | AS33: 2580 | AT33: 6048 | AU33: 2538 | AV33: 846 | BB33: 左冷禅 | BC33: 47 | BD33: 4794 | BE33: 2867 | BF33: 6721 | BG33: 2820 | BH33: 940
A34: 32 | B34: 32 | C34: 韩小莹 | F34: 出尘子 | G34: 47 | H34: 4357 | I34: 2867 | J34: 6721 | K34: 2834 | L34: 944 | R34: 摘星子 | S34: 47 | T34: 4357 | U34: 2867 | V34: 6721 | W34: 2834 | X34: 944 | AD34: 狮吼子 | AE34: 47 | AF34: 4357 | AG34: 2580 | AH34: 6048 | AI34: 2834 | AJ34: 944 | AP34: 左冷禅 | AQ34: 47 | AR34: 4357 | AS34: 2867 | AT34: 6721 | AU34: 2834 | AV34: 944 | BB34: 韩小莹 | BC34: 47 | BD34: 4817 | BE34: 2881 | BF34: 6754 | BG34: 2834 | BH34: 944
A35: 33 | B35: 33 | C35: 林远图 | F35: 阿紫 | G35: 47 | H35: 4400 | I35: 2881 | J35: 6754 | K35: 2848 | L35: 948 | R35: 出尘子 | S35: 47 | T35: 4400 | U35: 2881 | V35: 6754 | W35: 2848 | X35: 948 | AD35: 左冷禅 | AE35: 47 | AF35: 4400 | AG35: 2867 | AH35: 6721 | AI35: 2848 | AJ35: 948 | AP35: 风波恶 | AQ35: 47 | AR35: 4400 | AS35: 2881 | AT35: 6754 | AU35: 2848 | AV35: 948 | BB35: 林远图 | BC35: 47 | BD35: 4841 | BE35: 2895 | BF35: 6787 | BG35: 2848 | BH35: 948
A36: 34 | B36: 34 | C36: 摘星子 | F36: 左冷禅 | G36: 47 | H36: 4444 | I36: 2895 | J36: 6787 | K36: 2862 | L36: 952 | R36: 出尘子 | S36: 47 | T36: 4444 | U36: 2895 | V36: 6787 | W36: 2862 | X36: 952 | AD36: 左冷禅 | AE36: 47 | AF36: 4444 | AG36: 2881 | AH36: 6754 | AI36: 2862 | AJ36: 952 | AP36: 阿紫 | AQ36: 47 | AR36: 4444 | AS36: 2895 | AT36: 6787 | AU36: 2862 | AV36: 952 | BB36: 摘星子 | BC36: 47 | BD36: 4865 | BE36: 2909 | BF36: 6820 | BG36: 2862 | BH36: 952
A37: 35 | B37: 35 | C37: 出尘子 | F37: 狮吼子 | G37: 48 | H37: 4488 | I37: 2635 | J37: 6177 | K37: 2592 | L37: 864 | R37: 天狼子 | S37: 48 | T37: 4488 | U37: 2635 | V37: 6177 | W37: 2592 | X37: 864 | AD37: 韩小莹 | AE37: 48 | AF37: 4488 | AG37: 2635 | AH37: 6177 | AI37: 2592 | AJ37: 864 | AP37: 林远图 | AQ37: 48 | AR37: 4488 | AS37: 2635 | AT37: 6177 | AU37: 2592 | AV37: 864 | BB37: 出尘子 | BC37: 48 | BD37: 4896 | BE37: 2928 | BF37: 6864 | BG37: 2880 | BH37: 960
A38: 36 | B38: 36 | C38: 狮吼子 | F38: 出尘子 | G38: 49 | H38: 4532 | I38: 2690 | J38: 6306 | K38: 2646 | L38: 882 | R38: 王处一 | S38: 49 | T38: 4532 | U38: 2690 | V38: 6306 | W38: 2646 | X38: 882 | AD38: 林远图 | AE38: 49 | AF38: 4532 | AG38: 2690 | AH38: 6306 | AI38: 2646 | AJ38: 882 | AP38: 阿紫 | AQ38: 49 | AR38: 4532 | AS38: 2690 | AT38: 6306 | AU38: 2646 | AV38: 882 | BB38: 狮吼子 | BC38: 49 | BD38: 4998 | BE38: 2989 | BF38: 7007 | BG38: 2940 | BH38: 980
A39: 37 | B39: 37 | C39: 天狼子 | F39: 韩小莹 | G39: 49 | H39: 4577 | I39: 2702 | J39: 6337 | K39: 2658 | L39: 885 | R39: 梅超风 | S39: 49 | T39: 4577 | U39: 2702 | V39: 6337 | W39: 2658 | X39: 885 | AD39: 朱丹臣 | AE39: 49 | AF39: 4577 | AG39: 2702 | AH39: 6337 | AI39: 2658 | AJ39: 885 | AP39: 王处一 | AQ39: 49 | AR39: 4577 | AS39: 2702 | AT39: 6337 | AU39: 2658 | AV39: 885 | BB39: 天狼子 | BC39: 49 | BD39: 5022 | BE39: 3003 | BF39: 7042 | BG39: 2954 | BH39: 984
A40: 38 | B40: 38 | C40: 梅超风 | F40: 韩小莹 | G40: 49 | H40: 4622 | I40: 2716 | J40: 6369 | K40: 2671 | L40: 889 | R40: 阿紫 | S40: 49 | T40: 4622 | U40: 2716 | V40: 6369 | W40: 2671 | X40: 889 | AD40: 出尘子 | AE40: 49 | AF40: 4622 | AG40: 2716 | AH40: 6369 | AI40: 2671 | AJ40: 889 | AP40: 左冷禅 | AQ40: 49 | AR40: 4622 | AS40: 2716 | AT40: 6369 | AU40: 2671 | AV40: 889 | BB40: 梅超风 | BC40: 49 | BD40: 5047 | BE40: 3018 | BF40: 7077 | BG40: 2968 | BH40: 988
A41: 39 | B41: 39 | C41: 阿紫 | F41: 林远图 | G41: 49 | H41: 4668 | I41: 2729 | J41: 6400 | K41: 2683 | L41: 892 | R41: 左冷禅 | S41: 49 | T41: 4668 | U41: 2729 | V41: 6400 | W41: 2683 | X41: 892 | AD41: 韩小莹 | AE41: 49 | AF41: 4668 | AG41: 2729 | AH41: 6400 | AI41: 2683 | AJ41: 892 | AP41: 梅超风 | AQ41: 49 | AR41: 4668 | AS41: 2729 | AT41: 6400 | AU41: 2683 | AV41: 892 | BB41: 阿紫 | BC41: 49 | BD41: 5072 | BE41: 3033 | BF41: 7112 | BG41: 2982 | BH41: 992
A42: 40 | B42: 40 | C42: 王处一 | F42: 梅超风 | G42: 50 | H42: 4714 | I42: 2745 | J42: 6435 | K42: 2700 | L42: 900 | R42: 左冷禅 | S42: 50 | T42: 4714 | U42: 2745 | V42: 6435 | W42: 2700 | X42: 900 | AD42: 狮吼子 | AE42: 50 | AF42: 4714 | AG42: 2745 | AH42: 6435 | AI42: 2700 | AJ42: 900 | AP42: 阿紫 | AQ42: 50 | AR42: 4714 | AS42: 2745 | AT42: 6435 | AU42: 2700 | AV42: 900 | BB42: 王处一 | BC42: 50 | BD42: 5100 | BE42: 3050 | BF42: 7150 | BG42: 3000 | BH42: 1000
A43: 41 | B43: 41 | C43: 忽都虎 | F43: 沈青刚 | G43: 51 | H43: 4761 | I43: 2772 | J43: 6499 | K43: 2727 | L43: 909 | R43: 吴青烈 | S43: 51 | T43: 4761 | U43: 2772 | V43: 6499 | W43: 2727 | X43: 909 | AD43: 霍都 | AE43: 51 | AF43: 4761 | AG43: 2772 | AH43: 6499 | AI43: 2727 | AJ43: 909 | AP43: 完颜洪烈 | AQ43: 51 | AR43: 4761 | AS43: 2772 | AT43: 6499 | AU43: 2727 | AV43: 909 | BB43: 忽都虎 | BC43: 51 | BD43: 5202 | BE43: 3111 | BF43: 7293 | BG43: 3060 | BH43: 1020
A44: 42 | B44: 42 | C44: 俞岱岩 | F44: 马青雄 | G44: 51 | H44: 4808 | I44: 2799 | J44: 6563 | K44: 2754 | L44: 918 | R44: 钱青健 | S44: 51 | T44: 4808 | U44: 2799 | V44: 6563 | W44: 2754 | X44: 918 | AD44: 忽都虎 | AE44: 51 | AF44: 4808 | AG44: 2799 | AH44: 6563 | AI44: 2754 | AJ44: 918 | AP44: 完颜阿骨打 | AQ44: 51 | AR44: 4808 | AS44: 2799 | AT44: 6563 | AU44: 2754 | AV44: 918 | BB44: 俞岱岩 | BC44: 51 | BD44: 5228 | BE44: 3126 | BF44: 7329 | BG44: 3075 | BH44: 1025
A45: 43 | B45: 43 | C45: 完颜洪烈 | F45: 吴青烈 | G45: 51 | H45: 4856 | I45: 2826 | J45: 6628 | K45: 2781 | L45: 927 | R45: 哲别 | S45: 51 | T45: 4856 | U45: 2826 | V45: 6628 | W45: 2781 | X45: 927 | AD45: 潇湘子 | AE45: 51 | AF45: 4856 | AG45: 2826 | AH45: 6628 | AI45: 2781 | AJ45: 927 | AP45: 侯通海 | AQ45: 51 | AR45: 4856 | AS45: 2826 | AT45: 6628 | AU45: 2781 | AV45: 927 | BB45: 完颜洪烈 | BC45: 51 | BD45: 5254 | BE45: 3141 | BF45: 7365 | BG45: 3090 | BH45: 1030
A46: 44 | B46: 44 | C46: 霍都 | F46: 忽都虎 | G46: 51 | H46: 4904 | I46: 2854 | J46: 6694 | K46: 2808 | L46: 936 | R46: 完颜阿骨打 | S46: 51 | T46: 4904 | U46: 2854 | V46: 6694 | W46: 2808 | X46: 936 | AD46: 哲别 | AE46: 51 | AF46: 4904 | AG46: 2854 | AH46: 6694 | AI46: 2808 | AJ46: 936 | AP46: 潇湘子 | AQ46: 51 | AR46: 4904 | AS46: 2854 | AT46: 6694 | AU46: 2808 | AV46: 936 | BB46: 霍都 | BC46: 51 | BD46: 5280 | BE46: 3156 | BF46: 7401 | BG46: 3105 | BH46: 1035
A47: 45 | B47: 45 | C47: 完颜阿骨打 | F47: 常胜宝树王 | G47: 52 | H47: 4953 | I47: 2882 | J47: 6760 | K47: 2836 | L47: 945 | R47: 忽都虎 | S47: 52 | T47: 4953 | U47: 2882 | V47: 6760 | W47: 2836 | X47: 945 | AD47: 俞岱岩 | AE47: 52 | AF47: 4953 | AG47: 2882 | AH47: 6760 | AI47: 2836 | AJ47: 945 | AP47: 完颜洪烈 | AQ47: 52 | AR47: 4953 | AS47: 2882 | AT47: 6760 | AU47: 2836 | AV47: 945 | BB47: 完颜阿骨打 | BC47: 52 | BD47: 5304 | BE47: 3172 | BF47: 7436 | BG47: 3120 | BH47: 1040
A48: 46 | B48: 46 | C48: 哲别 | F48: 沈青刚 | G48: 53 | H48: 5002 | I48: 2910 | J48: 6827 | K48: 2864 | L48: 954 | R48: 忽都虎 | S48: 53 | T48: 5002 | U48: 2910 | V48: 6827 | W48: 2864 | X48: 954 | AD48: 完颜洪烈 | AE48: 53 | AF48: 5002 | AG48: 2910 | AH48: 6827 | AI48: 2864 | AJ48: 954 | AP48: 侯通海 | AQ48: 53 | AR48: 5002 | AS48: 2910 | AT48: 6827 | AU48: 2864 | AV48: 954 | BB48: 哲别 | BC48: 53 | BD48: 5406 | BE48: 3233 | BF48: 7579 | BG48: 3180 | BH48: 1060
A49: 47 | B49: 47 | C49: 侯通海 | F49: 智慧宝树王 | G49: 53 | H49: 5052 | I49: 2939 | J49: 6895 | K49: 2892 | L49: 963 | R49: 完颜阿骨打 | S49: 53 | T49: 5052 | U49: 2939 | V49: 6895 | W49: 2892 | X49: 963 | AD49: 忽都虎 | AE49: 53 | AF49: 5052 | AG49: 2939 | AH49: 6895 | AI49: 2892 | AJ49: 963 | AP49: 忽都虎 | AQ49: 53 | AR49: 5052 | AS49: 2939 | AT49: 6895 | AU49: 2892 | AV49: 963 | BB49: 侯通海 | BC49: 53 | BD49: 5433 | BE49: 3249 | BF49: 7616 | BG49: 3195 | BH49: 1065
A50: 48 | B50: 48 | C50: 潇湘子 | F50: 忽都虎 | G50: 53 | H50: 5102 | I50: 2968 | J50: 6963 | K50: 2920 | L50: 972 | R50: 哲别 | S50: 53 | T50: 5102 | U50: 2968 | V50: 6963 | W50: 2920 | X50: 972 | AD50: 完颜阿骨打 | AE50: 53 | AF50: 5102 | AG50: 2968 | AH50: 6963 | AI50: 2920 | AJ50: 972 | AP50: 侯通海 | AQ50: 53 | AR50: 5102 | AS50: 2968 | AT50: 6963 | AU50: 2920 | AV50: 972 | BB50: 潇湘子 | BC50: 53 | BD50: 5460 | BE50: 3265 | BF50: 7654 | BG50: 3210 | BH50: 1070
A51: 49 | B51: 49 | C51: 欧阳克 | F51: 完颜阿骨打 | G51: 53 | H51: 5153 | I51: 2997 | J51: 7032 | K51: 2949 | L51: 981 | R51: 忽都虎 | S51: 53 | T51: 5153 | U51: 2997 | V51: 7032 | W51: 2949 | X51: 981 | AD51: 哲别 | AE51: 53 | AF51: 5153 | AG51: 2997 | AH51: 7032 | AI51: 2949 | AJ51: 981 | AP51: 潇湘子 | AQ51: 53 | AR51: 5153 | AS51: 2997 | AT51: 7032 | AU51: 2949 | AV51: 981 | BB51: 欧阳克 | BC51: 53 | BD51: 5487 | BE51: 3281 | BF51: 7692 | BG51: 3226 | BH51: 1075
A52: 50 | B52: 50 | C52: 俞岱岩 | F52: 忽都虎 | G52: 54 | H52: 5204 | I52: 3026 | J52: 7102 | K52: 2978 | L52: 990 | R52: 完颜阿骨打 | S52: 54 | T52: 5204 | U52: 3026 | V52: 7102 | W52: 2978 | X52: 990 | AD52: 潇湘子 | AE52: 54 | AF52: 5204 | AG52: 3026 | AH52: 7102 | AI52: 2978 | AJ52: 990 | AP52: 哲别 | AQ52: 54 | AR52: 5204 | AS52: 3026 | AT52: 7102 | AU52: 2978 | AV52: 990 | BB52: 俞岱岩 | BC52: 54 | BD52: 5508 | BE52: 3294 | BF52: 7722 | BG52: 3240 | BH52: 1080
A53: 51 | B53: 51 | C53: 包不同 | F53: 王语嫣 | G53: 55 | H53: 5256 | I53: 3056 | J53: 7173 | K53: 3007 | L53: 999 | R53: 风波恶 | S53: 55 | T53: 5256 | U53: 3056 | V53: 7173 | W53: 3007 | X53: 999 | AD53: 邓百川 | AE53: 55 | AF53: 5256 | AG53: 3056 | AH53: 7173 | AI53: 3007 | AJ53: 999 | AP53: 公冶乾 | AQ53: 55 | AR53: 5256 | AS53: 3056 | AT53: 7173 | AU53: 3007 | AV53: 999 | BB53: 包不同 | BC53: 55 | BD53: 5610 | BE53: 3355 | BF53: 7865 | BG53: 3300 | BH53: 1100
A54: 52 | B54: 52 | C54: 邓百川 | F54: 风波恶 | G54: 55 | H54: 5308 | I54: 3086 | J54: 7244 | K54: 3037 | L54: 1008 | R54: 公冶乾 | S54: 55 | T54: 5308 | U54: 3086 | V54: 7244 | W54: 3037 | X54: 1008 | AD54: 王语嫣 | AE54: 55 | AF54: 5308 | AG54: 3086 | AH54: 7244 | AI54: 3037 | AJ54: 1008 | AP54: 包不同 | AQ54: 55 | AR54: 5308 | AS54: 3086 | AT54: 7244 | AU54: 3037 | AV54: 1008 | BB54: 邓百川 | BC54: 55 | BD54: 5647 | BE54: 3377 | BF54: 7917 | BG54: 3322 | BH54: 1107
A55: 53 | B55: 53 | C55: 风波恶 | F55: 王语嫣 | G55: 55 | H55: 5361 | I55: 3116 | J55: 7316 | K55: 3067 | L55: 1018 | R55: 邓百川 | S55: 55 | T55: 5361 | U55: 3116 | V55: 7316 | W55: 3067 | X55: 1018 | AD55: 公冶乾 | AE55: 55 | AF55: 5361 | AG55: 3116 | AH55: 7316 | AI55: 3067 | AJ55: 1018 | AP55: 包不同 | AQ55: 55 | AR55: 5361 | AS55: 3116 | AT55: 7316 | AU55: 3067 | AV55: 1018 | BB55: 风波恶 | BC55: 55 | BD55: 5684 | BE55: 3399 | BF55: 7969 | BG55: 3344 | BH55: 1114
A56: 54 | B56: 54 | C56: 公冶乾 | F56: 阿朱 | G56: 55 | H56: 5414 | I56: 3147 | J56: 7389 | K56: 3097 | L56: 1028 | R56: 包不同 | S56: 55 | T56: 5414 | U56: 3147 | V56: 7389 | W56: 3097 | X56: 1028 | AD56: 邓百川 | AE56: 55 | AF56: 5414 | AG56: 3147 | AH56: 7389 | AI56: 3097 | AJ56: 1028 | AP56: 风波恶 | AQ56: 55 | AR56: 5414 | AS56: 3147 | AT56: 7389 | AU56: 3097 | AV56: 1028 | BB56: 公冶乾 | BC56: 55 | BD56: 5721 | BE56: 3421 | BF56: 8022 | BG56: 3366 | BH56: 1121
A57: 55 | B57: 55 | C57: 王语嫣 | F57: 邓百川 | G57: 56 | H57: 5468 | I57: 3178 | J57: 7462 | K57: 3127 | L57: 1038 | R57: 风波恶 | S57: 56 | T57: 5468 | U57: 3178 | V57: 7462 | W57: 3127 | X57: 1038 | AD57: 包不同 | AE57: 56 | AF57: 5468 | AG57: 3178 | AH57: 7462 | AI57: 3127 | AJ57: 1038 | AP57: 公冶乾 | AQ57: 56 | AR57: 5468 | AS57: 3178 | AT57: 7462 | AU57: 3127 | AV57: 1038 | BB57: 王语嫣 | BC57: 56 | BD57: 5712 | BE57: 3416 | BF57: 8008 | BG57: 3360 | BH57: 1120
A58: 56 | B58: 56 | C58: 阿朱 | F58: 王语嫣 | G58: 57 | H58: 5522 | I58: 3209 | J58: 7536 | K58: 3158 | L58: 1048 | R58: 公冶乾 | S58: 57 | T58: 5522 | U58: 3209 | V58: 7536 | W58: 3158 | X58: 1048 | AD58: 包不同 | AE58: 57 | AF58: 5522 | AG58: 3209 | AH58: 7536 | AI58: 3158 | AJ58: 1048 | AP58: 风波恶 | AQ58: 57 | AR58: 5522 | AS58: 3209 | AT58: 7536 | AU58: 3158 | AV58: 1048 | BB58: 阿朱 | BC58: 57 | BD58: 5814 | BE58: 3477 | BF58: 8151 | BG58: 3420 | BH58: 1140
A59: 57 | B59: 57 | C59: 莫声谷 | F59: 王语嫣 | G59: 57 | H59: 5577 | I59: 3241 | J59: 7611 | K59: 3189 | L59: 1058 | R59: 公冶乾 | S59: 57 | T59: 5577 | U59: 3241 | V59: 7611 | W59: 3189 | X59: 1058 | AD59: 邓百川 | AE59: 57 | AF59: 5577 | AG59: 3241 | AH59: 7611 | AI59: 3189 | AJ59: 1058 | AP59: 包不同 | AQ59: 57 | AR59: 5577 | AS59: 3241 | AT59: 7611 | AU59: 3189 | AV59: 1058 | BB59: 莫声谷 | BC59: 57 | BD59: 5843 | BE59: 3494 | BF59: 8191 | BG59: 3437 | BH59: 1145
A60: 58 | B60: 58 | C60: 风波恶 | F60: 王语嫣 | G60: 57 | H60: 5632 | I60: 3273 | J60: 7687 | K60: 3220 | L60: 1068 | R60: 公冶乾 | S60: 57 | T60: 5632 | U60: 3273 | V60: 7687 | W60: 3220 | X60: 1068 | AD60: 邓百川 | AE60: 57 | AF60: 5632 | AG60: 3273 | AH60: 7687 | AI60: 3220 | AJ60: 1068 | AP60: 风波恶 | AQ60: 57 | AR60: 5632 | AS60: 3273 | AT60: 7687 | AU60: 3220 | AV60: 1068 | BB60: 风波恶 | BC60: 57 | BD60: 5872 | BE60: 3511 | BF60: 8231 | BG60: 3454 | BH60: 1150
A61: 59 | B61: 59 | C61: 林远图 | F61: 阿朱 | G61: 57 | H61: 5688 | I61: 3305 | J61: 7763 | K61: 3252 | L61: 1078 | R61: 王语嫣 | S61: 57 | T61: 5688 | U61: 3305 | V61: 7763 | W61: 3252 | X61: 1078 | AD61: 公冶乾 | AE61: 57 | AF61: 5688 | AG61: 3305 | AH61: 7763 | AI61: 3252 | AJ61: 1078 | AP61: 风波恶 | AQ61: 57 | AR61: 5688 | AS61: 3305 | AT61: 7763 | AU61: 3252 | AV61: 1078 | BB61: 林远图 | BC61: 57 | BD61: 5901 | BE61: 3528 | BF61: 8272 | BG61: 3471 | BH61: 1155
A62: 60 | B62: 60 | C62: 莫声谷 | F62: 王语嫣 | G62: 58 | H62: 5744 | I62: 3338 | J62: 7840 | K62: 3284 | L62: 1088 | R62: 公冶乾 | S62: 58 | T62: 5744 | U62: 3338 | V62: 7840 | W62: 3284 | X62: 1088 | AD62: 风波恶 | AE62: 58 | AF62: 5744 | AG62: 3338 | AH62: 7840 | AI62: 3284 | AJ62: 1088 | AP62: 林远图 | AQ62: 58 | AR62: 5744 | AS62: 3338 | AT62: 7840 | AU62: 3284 | AV62: 1088 | BB62: 莫声谷 | BC62: 58 | BD62: 5916 | BE62: 3538 | BF62: 8294 | BG62: 3480 | BH62: 1160
A63: 61 | B63: 61 | C63: 左冷禅 | F63: 摘星子 | G63: 60 | H63: 6120 | I63: 3660 | J63: 8580 | K63: 3600 | L63: 1200 | R63: 出尘子 | S63: 60 | T63: 6120 | U63: 3660 | V63: 8580 | W63: 3600 | X63: 1200 | AD63: 狮吼子 | AE63: 60 | AF63: 6120 | AG63: 3660 | AH63: 8580 | AI63: 3600 | AJ63: 1200 | AP63: 阿紫 | AQ63: 60 | AR63: 6120 | AS63: 3660 | AT63: 8580 | AU63: 3600 | AV63: 1200 | BB63: 左冷禅 | BC63: 60 | BD63: 6120 | BE63: 3660 | BF63: 8580 | BG63: 3600 | BH63: 1200
A64: 62 | B64: 62 | C64: 韩小莹 | F64: 出尘子 | G64: 60 | H64: 6150 | I64: 3678 | J64: 8622 | K64: 3618 | L64: 1206 | R64: 摘星子 | S64: 60 | T64: 6150 | U64: 3678 | V64: 8622 | W64: 3618 | X64: 1206 | AD64: 狮吼子 | AE64: 60 | AF64: 6150 | AG64: 3678 | AH64: 8622 | AI64: 3618 | AJ64: 1206 | AP64: 左冷禅 | AQ64: 60 | AR64: 6150 | AS64: 3678 | AT64: 8622 | AU64: 3618 | AV64: 1206 | BB64: 韩小莹 | BC64: 60 | BD64: 6150 | BE64: 3678 | BF64: 8622 | BG64: 3618 | BH64: 1206
A65: 63 | B65: 63 | C65: 林远图 | F65: 阿紫 | G65: 60 | H65: 6180 | I65: 3696 | J65: 8665 | K65: 3636 | L65: 1212 | R65: 出尘子 | S65: 60 | T65: 6180 | U65: 3696 | V65: 8665 | W65: 3636 | X65: 1212 | AD65: 左冷禅 | AE65: 60 | AF65: 6180 | AG65: 3696 | AH65: 8665 | AI65: 3636 | AJ65: 1212 | AP65: 风波恶 | AQ65: 60 | AR65: 6180 | AS65: 3696 | AT65: 8665 | AU65: 3636 | AV65: 1212 | BB65: 林远图 | BC65: 60 | BD65: 6180 | BE65: 3696 | BF65: 8665 | BG65: 3636 | BH65: 1212
A66: 64 | B66: 64 | C66: 摘星子 | F66: 左冷禅 | G66: 60 | H66: 6210 | I66: 3714 | J66: 8708 | K66: 3654 | L66: 1218 | R66: 出尘子 | S66: 60 | T66: 6210 | U66: 3714 | V66: 8708 | W66: 3654 | X66: 1218 | AD66: 左冷禅 | AE66: 60 | AF66: 6210 | AG66: 3714 | AH66: 8708 | AI66: 3654 | AJ66: 1218 | AP66: 阿紫 | AQ66: 60 | AR66: 6210 | AS66: 3714 | AT66: 8708 | AU66: 3654 | AV66: 1218 | BB66: 摘星子 | BC66: 60 | BD66: 6210 | BE66: 3714 | BF66: 8708 | BG66: 3654 | BH66: 1218
A67: 65 | B67: 65 | C67: 出尘子 | F67: 狮吼子 | G67: 60 | H67: 6241 | I67: 3732 | J67: 8751 | K67: 3672 | L67: 1224 | R67: 天狼子 | S67: 60 | T67: 6241 | U67: 3732 | V67: 8751 | W67: 3672 | X67: 1224 | AD67: 韩小莹 | AE67: 60 | AF67: 6241 | AG67: 3732 | AH67: 8751 | AI67: 3672 | AJ67: 1224 | AP67: 林远图 | AQ67: 60 | AR67: 6241 | AS67: 3732 | AT67: 8751 | AU67: 3672 | AV67: 1224 | BB67: 出尘子 | BC67: 60 | BD67: 6241 | BE67: 3732 | BF67: 8751 | BG67: 3672 | BH67: 1224
A68: 66 | B68: 66 | C68: 狮吼子 | F68: 出尘子 | G68: 60 | H68: 6272 | I68: 3750 | J68: 8794 | K68: 3690 | L68: 1230 | R68: 王处一 | S68: 60 | T68: 6272 | U68: 3750 | V68: 8794 | W68: 3690 | X68: 1230 | AD68: 林远图 | AE68: 60 | AF68: 6272 | AG68: 3750 | AH68: 8794 | AI68: 3690 | AJ68: 1230 | AP68: 阿紫 | AQ68: 60 | AR68: 6272 | AS68: 3750 | AT68: 8794 | AU68: 3690 | AV68: 1230 | BB68: 狮吼子 | BC68: 60 | BD68: 6272 | BE68: 3750 | BF68: 8794 | BG68: 3690 | BH68: 1230
A69: 67 | B69: 67 | C69: 天狼子 | F69: 韩小莹 | G69: 60 | H69: 6303 | I69: 3768 | J69: 8837 | K69: 3708 | L69: 1236 | R69: 梅超风 | S69: 60 | T69: 6303 | U69: 3768 | V69: 8837 | W69: 3708 | X69: 1236 | AD69: 朱丹臣 | AE69: 60 | AF69: 6303 | AG69: 3768 | AH69: 8837 | AI69: 3708 | AJ69: 1236 | AP69: 王处一 | AQ69: 60 | AR69: 6303 | AS69: 3768 | AT69: 8837 | AU69: 3708 | AV69: 1236 | BB69: 天狼子 | BC69: 60 | BD69: 6303 | BE69: 3768 | BF69: 8837 | BG69: 3708 | BH69: 1236
A70: 68 | B70: 68 | C70: 梅超风 | F70: 韩小莹 | G70: 60 | H70: 6334 | I70: 3786 | J70: 8881 | K70: 3726 | L70: 1242 | R70: 阿紫 | S70: 60 | T70: 6334 | U70: 3786 | V70: 8881 | W70: 3726 | X70: 1242 | AD70: 出尘子 | AE70: 60 | AF70: 6334 | AG70: 3786 | AH70: 8881 | AI70: 3726 | AJ70: 1242 | AP70: 左冷禅 | AQ70: 60 | AR70: 6334 | AS70: 3786 | AT70: 8881 | AU70: 3726 | AV70: 1242 | BB70: 梅超风 | BC70: 60 | BD70: 6334 | BE70: 3786 | BF70: 8881 | BG70: 3726 | BH70: 1242
A71: 69 | B71: 69 | C71: 阿紫 | F71: 林远图 | G71: 60 | H71: 6365 | I71: 3804 | J71: 8925 | K71: 3744 | L71: 1248 | R71: 左冷禅 | S71: 60 | T71: 6365 | U71: 3804 | V71: 8925 | W71: 3744 | X71: 1248 | AD71: 韩小莹 | AE71: 60 | AF71: 6365 | AG71: 3804 | AH71: 8925 | AI71: 3744 | AJ71: 1248 | AP71: 梅超风 | AQ71: 60 | AR71: 6365 | AS71: 3804 | AT71: 8925 | AU71: 3744 | AV71: 1248 | BB71: 阿紫 | BC71: 60 | BD71: 6365 | BE71: 3804 | BF71: 8925 | BG71: 3744 | BH71: 1248
A72: 70 | B72: 70 | C72: 王处一 | F72: 梅超风 | G72: 60 | H72: 6396 | I72: 3823 | J72: 8969 | K72: 3762 | L72: 1254 | R72: 左冷禅 | S72: 60 | T72: 6396 | U72: 3823 | V72: 8969 | W72: 3762 | X72: 1254 | AD72: 狮吼子 | AE72: 60 | AF72: 6396 | AG72: 3823 | AH72: 8969 | AI72: 3762 | AJ72: 1254 | AP72: 阿紫 | AQ72: 60 | AR72: 6396 | AS72: 3823 | AT72: 8969 | AU72: 3762 | AV72: 1254 | BB72: 王处一 | BC72: 60 | BD72: 6396 | BE72: 3823 | BF72: 8969 | BG72: 3762 | BH72: 1254
A73: 71 | B73: 71 | C73: 忽都虎 | F73: 沈青刚 | G73: 60 | H73: 6427 | I73: 3842 | J73: 9013 | K73: 3780 | L73: 1260 | R73: 吴青烈 | S73: 60 | T73: 6427 | U73: 3842 | V73: 9013 | W73: 3780 | X73: 1260 | AD73: 霍都 | AE73: 60 | AF73: 6427 | AG73: 3842 | AH73: 9013 | AI73: 3780 | AJ73: 1260 | AP73: 完颜洪烈 | AQ73: 60 | AR73: 6427 | AS73: 3842 | AT73: 9013 | AU73: 3780 | AV73: 1260 | BB73: 忽都虎 | BC73: 60 | BD73: 6427 | BE73: 3842 | BF73: 9013 | BG73: 3780 | BH73: 1260
A74: 72 | B74: 72 | C74: 俞岱岩 | F74: 马青雄 | G74: 60 | H74: 6459 | I74: 3861 | J74: 9058 | K74: 3798 | L74: 1266 | R74: 钱青健 | S74: 60 | T74: 6459 | U74: 3861 | V74: 9058 | W74: 3798 | X74: 1266 | AD74: 忽都虎 | AE74: 60 | AF74: 6459 | AG74: 3861 | AH74: 9058 | AI74: 3798 | AJ74: 1266 | AP74: 完颜阿骨打 | AQ74: 60 | AR74: 6459 | AS74: 3861 | AT74: 9058 | AU74: 3798 | AV74: 1266 | BB74: 俞岱岩 | BC74: 60 | BD74: 6459 | BE74: 3861 | BF74: 9058 | BG74: 3798 | BH74: 1266
A75: 73 | B75: 73 | C75: 完颜洪烈 | F75: 吴青烈 | G75: 60 | H75: 6491 | I75: 3880 | J75: 9103 | K75: 3816 | L75: 1272 | R75: 哲别 | S75: 60 | T75: 6491 | U75: 3880 | V75: 9103 | W75: 3816 | X75: 1272 | AD75: 潇湘子 | AE75: 60 | AF75: 6491 | AG75: 3880 | AH75: 9103 | AI75: 3816 | AJ75: 1272 | AP75: 侯通海 | AQ75: 60 | AR75: 6491 | AS75: 3880 | AT75: 9103 | AU75: 3816 | AV75: 1272 | BB75: 完颜洪烈 | BC75: 60 | BD75: 6491 | BE75: 3880 | BF75: 9103 | BG75: 3816 | BH75: 1272
A76: 74 | B76: 74 | C76: 霍都 | F76: 忽都虎 | G76: 60 | H76: 6523 | I76: 3899 | J76: 9148 | K76: 3835 | L76: 1278 | R76: 完颜阿骨打 | S76: 60 | T76: 6523 | U76: 3899 | V76: 9148 | W76: 3835 | X76: 1278 | AD76: 哲别 | AE76: 60 | AF76: 6523 | AG76: 3899 | AH76: 9148 | AI76: 3835 | AJ76: 1278 | AP76: 潇湘子 | AQ76: 60 | AR76: 6523 | AS76: 3899 | AT76: 9148 | AU76: 3835 | AV76: 1278 | BB76: 霍都 | BC76: 60 | BD76: 6523 | BE76: 3899 | BF76: 9148 | BG76: 3835 | BH76: 1278
A77: 75 | B77: 75 | C77: 完颜阿骨打 | F77: 常胜宝树王 | G77: 60 | H77: 6555 | I77: 3918 | J77: 9193 | K77: 3854 | L77: 1284 | R77: 忽都虎 | S77: 60 | T77: 6555 | U77: 3918 | V77: 9193 | W77: 3854 | X77: 1284 | AD77: 俞岱岩 | AE77: 60 | AF77: 6555 | AG77: 3918 | AH77: 9193 | AI77: 3854 | AJ77: 1284 | AP77: 完颜洪烈 | AQ77: 60 | AR77: 6555 | AS77: 3918 | AT77: 9193 | AU77: 3854 | AV77: 1284 | BB77: 完颜阿骨打 | BC77: 60 | BD77: 6555 | BE77: 3918 | BF77: 9193 | BG77: 3854 | BH77: 1284
A78: 76 | B78: 76 | C78: 哲别 | F78: 沈青刚 | G78: 60 | H78: 6587 | I78: 3937 | J78: 9238 | K78: 3873 | L78: 1290 | R78: 忽都虎 | S78: 60 | T78: 6587 | U78: 3937 | V78: 9238 | W78: 3873 | X78: 1290 | AD78: 完颜洪烈 | AE78: 60 | AF78: 6587 | AG78: 3937 | AH78: 9238 | AI78: 3873 | AJ78: 1290 | AP78: 侯通海 | AQ78: 60 | AR78: 6587 | AS78: 3937 | AT78: 9238 | AU78: 3873 | AV78: 1290 | BB78: 哲别 | BC78: 60 | BD78: 6587 | BE78: 3937 | BF78: 9238 | BG78: 3873 | BH78: 1290
A79: 77 | B79: 77 | C79: 侯通海 | F79: 智慧宝树王 | G79: 60 | H79: 6619 | I79: 3956 | J79: 9284 | K79: 3892 | L79: 1296 | R79: 完颜阿骨打 | S79: 60 | T79: 6619 | U79: 3956 | V79: 9284 | W79: 3892 | X79: 1296 | AD79: 忽都虎 | AE79: 60 | AF79: 6619 | AG79: 3956 | AH79: 9284 | AI79: 3892 | AJ79: 1296 | AP79: 忽都虎 | AQ79: 60 | AR79: 6619 | AS79: 3956 | AT79: 9284 | AU79: 3892 | AV79: 1296 | BB79: 侯通海 | BC79: 60 | BD79: 6619 | BE79: 3956 | BF79: 9284 | BG79: 3892 | BH79: 1296
A80: 78 | B80: 78 | C80: 潇湘子 | F80: 忽都虎 | G80: 60 | H80: 6685 | I80: 3995 | J80: 9376 | K80: 3930 | L80: 1308 | R80: 哲别 | S80: 60 | T80: 6685 | U80: 3995 | V80: 9376 | W80: 3930 | X80: 1308 | AD80: 完颜阿骨打 | AE80: 60 | AF80: 6685 | AG80: 3995 | AH80: 9376 | AI80: 3930 | AJ80: 1308 | AP80: 侯通海 | AQ80: 60 | AR80: 6685 | AS80: 3995 | AT80: 9376 | AU80: 3930 | AV80: 1308 | BB80: 潇湘子 | BC80: 60 | BD80: 6685 | BE80: 3995 | BF80: 9376 | BG80: 3930 | BH80: 1308
A81: 79 | B81: 79 | C81: 欧阳克 | F81: 完颜阿骨打 | G81: 60 | H81: 6751 | I81: 4034 | J81: 9469 | K81: 3969 | L81: 1321 | R81: 忽都虎 | S81: 60 | T81: 6751 | U81: 4034 | V81: 9469 | W81: 3969 | X81: 1321 | AD81: 哲别 | AE81: 60 | AF81: 6751 | AG81: 4034 | AH81: 9469 | AI81: 3969 | AJ81: 1321 | AP81: 潇湘子 | AQ81: 60 | AR81: 6751 | AS81: 4034 | AT81: 9469 | AU81: 3969 | AV81: 1321 | BB81: 欧阳克 | BC81: 60 | BD81: 6751 | BE81: 4034 | BF81: 9469 | BG81: 3969 | BH81: 1321
A82: 80 | B82: 80 | C82: 俞岱岩 | F82: 忽都虎 | G82: 60 | H82: 6818 | I82: 4074 | J82: 9563 | K82: 4008 | L82: 1334 | R82: 完颜阿骨打 | S82: 60 | T82: 6818 | U82: 4074 | V82: 9563 | W82: 4008 | X82: 1334 | AD82: 潇湘子 | AE82: 60 | AF82: 6818 | AG82: 4074 | AH82: 9563 | AI82: 4008 | AJ82: 1334 | AP82: 哲别 | AQ82: 60 | AR82: 6818 | AS82: 4074 | AT82: 9563 | AU82: 4008 | AV82: 1334 | BB82: 俞岱岩 | BC82: 60 | BD82: 6818 | BE82: 4074 | BF82: 9563 | BG82: 4008 | BH82: 1334
A83: 81 | B83: 81 | C83: 包不同 | F83: 王语嫣 | G83: 60 | H83: 6886 | I83: 4114 | J83: 9658 | K83: 4048 | L83: 1347 | R83: 风波恶 | S83: 60 | T83: 6886 | U83: 4114 | V83: 9658 | W83: 4048 | X83: 1347 | AD83: 邓百川 | AE83: 60 | AF83: 6886 | AG83: 4114 | AH83: 9658 | AI83: 4048 | AJ83: 1347 | AP83: 公冶乾 | AQ83: 60 | AR83: 6886 | AS83: 4114 | AT83: 9658 | AU83: 4048 | AV83: 1347 | BB83: 包不同 | BC83: 60 | BD83: 6886 | BE83: 4114 | BF83: 9658 | BG83: 4048 | BH83: 1347
A84: 82 | B84: 82 | C84: 邓百川 | F84: 风波恶 | G84: 60 | H84: 6954 | I84: 4155 | J84: 9754 | K84: 4088 | L84: 1360 | R84: 公冶乾 | S84: 60 | T84: 6954 | U84: 4155 | V84: 9754 | W84: 4088 | X84: 1360 | AD84: 王语嫣 | AE84: 60 | AF84: 6954 | AG84: 4155 | AH84: 9754 | AI84: 4088 | AJ84: 1360 | AP84: 包不同 | AQ84: 60 | AR84: 6954 | AS84: 4155 | AT84: 9754 | AU84: 4088 | AV84: 1360 | BB84: 邓百川 | BC84: 60 | BD84: 6954 | BE84: 4155 | BF84: 9754 | BG84: 4088 | BH84: 1360
A85: 83 | B85: 83 | C85: 风波恶 | F85: 王语嫣 | G85: 60 | H85: 7023 | I85: 4196 | J85: 9851 | K85: 4128 | L85: 1373 | R85: 邓百川 | S85: 60 | T85: 7023 | U85: 4196 | V85: 9851 | W85: 4128 | X85: 1373 | AD85: 公冶乾 | AE85: 60 | AF85: 7023 | AG85: 4196 | AH85: 9851 | AI85: 4128 | AJ85: 1373 | AP85: 包不同 | AQ85: 60 | AR85: 7023 | AS85: 4196 | AT85: 9851 | AU85: 4128 | AV85: 1373 | BB85: 风波恶 | BC85: 60 | BD85: 7023 | BE85: 4196 | BF85: 9851 | BG85: 4128 | BH85: 1373
A86: 84 | B86: 84 | C86: 公冶乾 | F86: 阿朱 | G86: 60 | H86: 7093 | I86: 4237 | J86: 9949 | K86: 4169 | L86: 1386 | R86: 包不同 | S86: 60 | T86: 7093 | U86: 4237 | V86: 9949 | W86: 4169 | X86: 1386 | AD86: 邓百川 | AE86: 60 | AF86: 7093 | AG86: 4237 | AH86: 9949 | AI86: 4169 | AJ86: 1386 | AP86: 风波恶 | AQ86: 60 | AR86: 7093 | AS86: 4237 | AT86: 9949 | AU86: 4169 | AV86: 1386 | BB86: 公冶乾 | BC86: 60 | BD86: 7093 | BE86: 4237 | BF86: 9949 | BG86: 4169 | BH86: 1386
A87: 85 | B87: 85 | C87: 王语嫣 | F87: 邓百川 | G87: 60 | H87: 7163 | I87: 4279 | J87: 10048 | K87: 4210 | L87: 1399 | R87: 风波恶 | S87: 60 | T87: 7163 | U87: 4279 | V87: 10048 | W87: 4210 | X87: 1399 | AD87: 包不同 | AE87: 60 | AF87: 7163 | AG87: 4279 | AH87: 10048 | AI87: 4210 | AJ87: 1399 | AP87: 公冶乾 | AQ87: 60 | AR87: 7163 | AS87: 4279 | AT87: 10048 | AU87: 4210 | AV87: 1399 | BB87: 王语嫣 | BC87: 60 | BD87: 7163 | BE87: 4279 | BF87: 10048 | BG87: 4210 | BH87: 1399
A88: 86 | B88: 86 | C88: 阿朱 | F88: 王语嫣 | G88: 60 | H88: 7234 | I88: 4321 | J88: 10148 | K88: 4252 | L88: 1412 | R88: 公冶乾 | S88: 60 | T88: 7234 | U88: 4321 | V88: 10148 | W88: 4252 | X88: 1412 | AD88: 包不同 | AE88: 60 | AF88: 7234 | AG88: 4321 | AH88: 10148 | AI88: 4252 | AJ88: 1412 | AP88: 风波恶 | AQ88: 60 | AR88: 7234 | AS88: 4321 | AT88: 10148 | AU88: 4252 | AV88: 1412 | BB88: 阿朱 | BC88: 60 | BD88: 7234 | BE88: 4321 | BF88: 10148 | BG88: 4252 | BH88: 1412
A89: 87 | B89: 87 | C89: 莫声谷 | F89: 王语嫣 | G89: 60 | H89: 7306 | I89: 4364 | J89: 10249 | K89: 4294 | L89: 1426 | R89: 公冶乾 | S89: 60 | T89: 7306 | U89: 4364 | V89: 10249 | W89: 4294 | X89: 1426 | AD89: 邓百川 | AE89: 60 | AF89: 7306 | AG89: 4364 | AH89: 10249 | AI89: 4294 | AJ89: 1426 | AP89: 包不同 | AQ89: 60 | AR89: 7306 | AS89: 4364 | AT89: 10249 | AU89: 4294 | AV89: 1426 | BB89: 莫声谷 | BC89: 60 | BD89: 7306 | BE89: 4364 | BF89: 10249 | BG89: 4294 | BH89: 1426
A90: 88 | B90: 88 | C90: 风波恶 | F90: 王语嫣 | G90: 60 | H90: 7379 | I90: 4407 | J90: 10351 | K90: 4336 | L90: 1440 | R90: 公冶乾 | S90: 60 | T90: 7379 | U90: 4407 | V90: 10351 | W90: 4336 | X90: 1440 | AD90: 邓百川 | AE90: 60 | AF90: 7379 | AG90: 4407 | AH90: 10351 | AI90: 4336 | AJ90: 1440 | AP90: 风波恶 | AQ90: 60 | AR90: 7379 | AS90: 4407 | AT90: 10351 | AU90: 4336 | AV90: 1440 | BB90: 风波恶 | BC90: 60 | BD90: 7379 | BE90: 4407 | BF90: 10351 | BG90: 4336 | BH90: 1440
A91: 89 | B91: 89 | C91: 林远图 | F91: 阿朱 | G91: 60 | H91: 7452 | I91: 4451 | J91: 10454 | K91: 4379 | L91: 1454 | R91: 王语嫣 | S91: 60 | T91: 7452 | U91: 4451 | V91: 10454 | W91: 4379 | X91: 1454 | AD91: 公冶乾 | AE91: 60 | AF91: 7452 | AG91: 4451 | AH91: 10454 | AI91: 4379 | AJ91: 1454 | AP91: 风波恶 | AQ91: 60 | AR91: 7452 | AS91: 4451 | AT91: 10454 | AU91: 4379 | AV91: 1454 | BB91: 林远图 | BC91: 60 | BD91: 7452 | BE91: 4451 | BF91: 10454 | BG91: 4379 | BH91: 1454
A92: 90 | B92: 90 | C92: 莫声谷 | F92: 王语嫣 | G92: 60 | H92: 7526 | I92: 4495 | J92: 10558 | K92: 4422 | L92: 1468 | R92: 公冶乾 | S92: 60 | T92: 7526 | U92: 4495 | V92: 10558 | W92: 4422 | X92: 1468 | AD92: 风波恶 | AE92: 60 | AF92: 7526 | AG92: 4495 | AH92: 10558 | AI92: 4422 | AJ92: 1468 | AP92: 林远图 | AQ92: 60 | AR92: 7526 | AS92: 4495 | AT92: 10558 | AU92: 4422 | AV92: 1468 | BB92: 莫声谷 | BC92: 60 | BD92: 7526 | BE92: 4495 | BF92: 10558 | BG92: 4422 | BH92: 1468
A93: 91 | B93: 91 | C93: 计无施 | F93: 计无施 | G93: 60 | H93: 8000 | I93: 5000 | J93: 11000 | K93: 5000 | L93: 2000 | R93: 韩小莹 | S93: =RC[-12] -> 60 | T93: =RC[-12] -> 8000 | U93: =RC[-12] -> 5000 | V93: =RC[-12] -> 11000 | W93: =RC[-12] -> 5000 | X93: =RC[-12] -> 2000 | AD93: 钟灵 | AE93: =RC[-12] -> 60 | AF93: =RC[-12] -> 8000 | AG93: =RC[-12] -> 5000 | AH93: =RC[-12] -> 11000 | AI93: =RC[-12] -> 5000 | AJ93: =RC[-12] -> 2000 | AP93: 李清露 | AQ93: =RC[-12] -> 60 | AR93: =RC[-12] -> 8000 | AS93: =RC[-12] -> 5000 | AT93: =RC[-12] -> 11000 | AU93: =RC[-12] -> 5000 | AV93: =RC[-12] -> 2000 | BB93: 全金发 | BC93: =RC[-12] -> 60 | BD93: =RC[-12] -> 8000 | BE93: =RC[-12] -> 5000 | BF93: =RC[-12] -> 11000 | BG93: =RC[-12] -> 5000 | BH93: =RC[-12] -> 2000
A94: 92 | B94: 92 | C94: 哑婆婆 | F94: 哑婆婆 | G94: 60 | H94: 8000 | I94: 5000 | J94: 11000 | K94: 5000 | L94: 2000 | R94: 韩宝驹 | S94: =RC[-12] -> 60 | T94: =RC[-12] -> 8000 | U94: =RC[-12] -> 5000 | V94: =RC[-12] -> 11000 | W94: =RC[-12] -> 5000 | X94: =RC[-12] -> 2000 | AD94: 阿朱 | AE94: =RC[-12] -> 60 | AF94: =RC[-12] -> 8000 | AG94: =RC[-12] -> 5000 | AH94: =RC[-12] -> 11000 | AI94: =RC[-12] -> 5000 | AJ94: =RC[-12] -> 2000 | AP94: 鲍千灵 | AQ94: =RC[-12] -> 60 | AR94: =RC[-12] -> 8000 | AS94: =RC[-12] -> 5000 | AT94: =RC[-12] -> 11000 | AU94: =RC[-12] -> 5000 | AV94: =RC[-12] -> 2000 | BB94: 清虚道长 | BC94: =RC[-12] -> 60 | BD94: =RC[-12] -> 8000 | BE94: =RC[-12] -> 5000 | BF94: =RC[-12] -> 11000 | BG94: =RC[-12] -> 5000 | BH94: =RC[-12] -> 2000
A95: 93 | B95: 93 | C95: 秦红棉 | F95: 过彦之 | G95: 60 | H95: 8000 | I95: 5000 | J95: 11000 | K95: 5000 | L95: 2000 | R95: 秦红棉 | S95: =RC[-12] -> 60 | T95: =RC[-12] -> 8000 | U95: =RC[-12] -> 5000 | V95: =RC[-12] -> 11000 | W95: =RC[-12] -> 5000 | X95: =RC[-12] -> 2000 | AD95: 傅思归 | AE95: =RC[-12] -> 60 | AF95: =RC[-12] -> 8000 | AG95: =RC[-12] -> 5000 | AH95: =RC[-12] -> 11000 | AI95: =RC[-12] -> 5000 | AJ95: =RC[-12] -> 2000 | AP95: 计无施 | AQ95: =RC[-12] -> 60 | AR95: =RC[-12] -> 8000 | AS95: =RC[-12] -> 5000 | AT95: =RC[-12] -> 11000 | AU95: =RC[-12] -> 5000 | AV95: =RC[-12] -> 2000 | BB95: 霍都 | BC95: =RC[-12] -> 60 | BD95: =RC[-12] -> 8000 | BE95: =RC[-12] -> 5000 | BF95: =RC[-12] -> 11000 | BG95: =RC[-12] -> 5000 | BH95: =RC[-12] -> 2000
A96: 94 | B96: 94 | C96: 小昭 | F96: 傅思归 | G96: 60 | H96: 8000 | I96: 5000 | J96: 11000 | K96: 5000 | L96: 2000 | R96: 小昭 | S96: =RC[-12] -> 60 | T96: =RC[-12] -> 8000 | U96: =RC[-12] -> 5000 | V96: =RC[-12] -> 11000 | W96: =RC[-12] -> 5000 | X96: =RC[-12] -> 2000 | AD96: 辛然 | AE96: =RC[-12] -> 60 | AF96: =RC[-12] -> 8000 | AG96: =RC[-12] -> 5000 | AH96: =RC[-12] -> 11000 | AI96: =RC[-12] -> 5000 | AJ96: =RC[-12] -> 2000 | AP96: 赵志敬 | AQ96: =RC[-12] -> 60 | AR96: =RC[-12] -> 8000 | AS96: =RC[-12] -> 5000 | AT96: =RC[-12] -> 11000 | AU96: =RC[-12] -> 5000 | AV96: =RC[-12] -> 2000 | BB96: 平婆婆 | BC96: =RC[-12] -> 60 | BD96: =RC[-12] -> 8000 | BE96: =RC[-12] -> 5000 | BF96: =RC[-12] -> 11000 | BG96: =RC[-12] -> 5000 | BH96: =RC[-12] -> 2000
A97: 95 | B97: 95 | C97: 全冠清 | F97: 桃根仙 | G97: 60 | H97: 8000 | I97: 5000 | J97: 11000 | K97: 5000 | L97: 2000 | R97: 全冠清 | S97: =RC[-12] -> 60 | T97: =RC[-12] -> 8000 | U97: =RC[-12] -> 5000 | V97: =RC[-12] -> 11000 | W97: =RC[-12] -> 5000 | X97: =RC[-12] -> 2000 | AD97: 朱丹臣 | AE97: =RC[-12] -> 60 | AF97: =RC[-12] -> 8000 | AG97: =RC[-12] -> 5000 | AH97: =RC[-12] -> 11000 | AI97: =RC[-12] -> 5000 | AJ97: =RC[-12] -> 2000 | AP97: 慧方 | AQ97: =RC[-12] -> 60 | AR97: =RC[-12] -> 8000 | AS97: =RC[-12] -> 5000 | AT97: =RC[-12] -> 11000 | AU97: =RC[-12] -> 5000 | AV97: =RC[-12] -> 2000 | BB97: 觉月 | BC97: =RC[-12] -> 60 | BD97: =RC[-12] -> 8000 | BE97: =RC[-12] -> 5000 | BF97: =RC[-12] -> 11000 | BG97: =RC[-12] -> 5000 | BH97: =RC[-12] -> 2000
A98: 96 | B98: 96 | C98: 圆音 | F98: 鲍千灵 | G98: 60 | H98: 8000 | I98: 5000 | J98: 11000 | K98: 5000 | L98: 2000 | R98: 圆音 | S98: =RC[-12] -> 60 | T98: =RC[-12] -> 8000 | U98: =RC[-12] -> 5000 | V98: =RC[-12] -> 11000 | W98: =RC[-12] -> 5000 | X98: =RC[-12] -> 2000 | AD98: 慧方 | AE98: =RC[-12] -> 60 | AF98: =RC[-12] -> 8000 | AG98: =RC[-12] -> 5000 | AH98: =RC[-12] -> 11000 | AI98: =RC[-12] -> 5000 | AJ98: =RC[-12] -> 2000 | AP98: 觉月 | AQ98: =RC[-12] -> 60 | AR98: =RC[-12] -> 8000 | AS98: =RC[-12] -> 5000 | AT98: =RC[-12] -> 11000 | AU98: =RC[-12] -> 5000 | AV98: =RC[-12] -> 2000 | BB98: 朱聪 | BC98: =RC[-12] -> 60 | BD98: =RC[-12] -> 8000 | BE98: =RC[-12] -> 5000 | BF98: =RC[-12] -> 11000 | BG98: =RC[-12] -> 5000 | BH98: =RC[-12] -> 2000
A99: 97 | B99: 97 | C99: 刀白凤 | F99: 阿紫 | G99: 60 | H99: 8000 | I99: 5000 | J99: 11000 | K99: 5000 | L99: 2000 | R99: 朱聪 | S99: =RC[-12] -> 60 | T99: =RC[-12] -> 8000 | U99: =RC[-12] -> 5000 | V99: =RC[-12] -> 11000 | W99: =RC[-12] -> 5000 | X99: =RC[-12] -> 2000 | AD99: 刀白凤 | AE99: =RC[-12] -> 60 | AF99: =RC[-12] -> 8000 | AG99: =RC[-12] -> 5000 | AH99: =RC[-12] -> 11000 | AI99: =RC[-12] -> 5000 | AJ99: =RC[-12] -> 2000 | AP99: 韩小莹 | AQ99: =RC[-12] -> 60 | AR99: =RC[-12] -> 8000 | AS99: =RC[-12] -> 5000 | AT99: =RC[-12] -> 11000 | AU99: =RC[-12] -> 5000 | AV99: =RC[-12] -> 2000 | BB99: 钟灵 | BC99: =RC[-12] -> 60 | BD99: =RC[-12] -> 8000 | BE99: =RC[-12] -> 5000 | BF99: =RC[-12] -> 11000 | BG99: =RC[-12] -> 5000 | BH99: =RC[-12] -> 2000
A100: 98 | B100: 98 | C100: 五叶大师 | F100: 慧方 | G100: 60 | H100: 8000 | I100: 5000 | J100: 11000 | K100: 5000 | L100: 2000 | R100: 觉月 | S100: =RC[-12] -> 60 | T100: =RC[-12] -> 8000 | U100: =RC[-12] -> 5000 | V100: =RC[-12] -> 11000 | W100: =RC[-12] -> 5000 | X100: =RC[-12] -> 2000 | AD100: 朱丹臣 | AE100: =RC[-12] -> 60 | AF100: =RC[-12] -> 8000 | AG100: =RC[-12] -> 5000 | AH100: =RC[-12] -> 11000 | AI100: =RC[-12] -> 5000 | AJ100: =RC[-12] -> 2000 | AP100: 鲍千灵 | AQ100: =RC[-12] -> 60 | AR100: =RC[-12] -> 8000 | AS100: =RC[-12] -> 5000 | AT100: =RC[-12] -> 11000 | AU100: =RC[-12] -> 5000 | AV100: =RC[-12] -> 2000 | BB100: 五叶大师 | BC100: =RC[-12] -> 60 | BD100: =RC[-12] -> 8000 | BE100: =RC[-12] -> 5000 | BF100: =RC[-12] -> 11000 | BG100: =RC[-12] -> 5000 | BH100: =RC[-12] -> 2000
A101: 99 | B101: 99 | C101: 费彬 | F101: 李志常 | G101: 60 | H101: 8000 | I101: 5000 | J101: 11000 | K101: 5000 | L101: 2000 | R101: 赵志敬 | S101: =RC[-12] -> 60 | T101: =RC[-12] -> 8000 | U101: =RC[-12] -> 5000 | V101: =RC[-12] -> 11000 | W101: =RC[-12] -> 5000 | X101: =RC[-12] -> 2000 | AD101: 辛然 | AE101: =RC[-12] -> 60 | AF101: =RC[-12] -> 8000 | AG101: =RC[-12] -> 5000 | AH101: =RC[-12] -> 11000 | AI101: =RC[-12] -> 5000 | AJ101: =RC[-12] -> 2000 | AP101: 桃根仙 | AQ101: =RC[-12] -> 60 | AR101: =RC[-12] -> 8000 | AS101: =RC[-12] -> 5000 | AT101: =RC[-12] -> 11000 | AU101: =RC[-12] -> 5000 | AV101: =RC[-12] -> 2000 | BB101: 费彬 | BC101: =RC[-12] -> 60 | BD101: =RC[-12] -> 8000 | BE101: =RC[-12] -> 5000 | BF101: =RC[-12] -> 11000 | BG101: =RC[-12] -> 5000 | BH101: =RC[-12] -> 2000
A102: 100 | B102: 100 | C102: 木高峰 | F102: 木高峰 | G102: 60 | H102: 8000 | I102: 5000 | J102: 11000 | K102: 5000 | L102: 2000 | R102: 侯通海 | S102: =RC[-12] -> 60 | T102: =RC[-12] -> 8000 | U102: =RC[-12] -> 5000 | V102: =RC[-12] -> 11000 | W102: =RC[-12] -> 5000 | X102: =RC[-12] -> 2000 | AD102: 忽都虎 | AE102: =RC[-12] -> 60 | AF102: =RC[-12] -> 8000 | AG102: =RC[-12] -> 5000 | AH102: =RC[-12] -> 11000 | AI102: =RC[-12] -> 5000 | AJ102: =RC[-12] -> 2000 | AP102: 岳灵珊 | AQ102: =RC[-12] -> 60 | AR102: =RC[-12] -> 8000 | AS102: =RC[-12] -> 5000 | AT102: =RC[-12] -> 11000 | AU102: =RC[-12] -> 5000 | AV102: =RC[-12] -> 2000 | BB102: 申人俊 | BC102: =RC[-12] -> 60 | BD102: =RC[-12] -> 8000 | BE102: =RC[-12] -> 5000 | BF102: =RC[-12] -> 11000 | BG102: =RC[-12] -> 5000 | BH102: =RC[-12] -> 2000
A103: 101 | B103: 101 | C103: 范百龄 | F103: 过彦之 | G103: 60 | H103: 8000 | I103: 5000 | J103: 11000 | K103: 5000 | L103: 2000 | R103: 范百龄 | S103: =RC[-12] -> 60 | T103: =RC[-12] -> 8000 | U103: =RC[-12] -> 5000 | V103: =RC[-12] -> 11000 | W103: =RC[-12] -> 5000 | X103: =RC[-12] -> 2000 | AD103: 平婆婆 | AE103: =RC[-12] -> 60 | AF103: =RC[-12] -> 8000 | AG103: =RC[-12] -> 5000 | AH103: =RC[-12] -> 11000 | AI103: =RC[-12] -> 5000 | AJ103: =RC[-12] -> 2000 | AP103: 瑞婆婆 | AQ103: =RC[-12] -> 60 | AR103: =RC[-12] -> 8000 | AS103: =RC[-12] -> 5000 | AT103: =RC[-12] -> 11000 | AU103: =RC[-12] -> 5000 | AV103: =RC[-12] -> 2000 | BB103: 程瑶迦 | BC103: =RC[-12] -> 60 | BD103: =RC[-12] -> 8000 | BE103: =RC[-12] -> 5000 | BF103: =RC[-12] -> 11000 | BG103: =RC[-12] -> 5000 | BH103: =RC[-12] -> 2000
A104: 102 | B104: 102 | C104: 华赫艮 | F104: 华赫艮 | G104: 60 | H104: 8000 | I104: 5000 | J104: 11000 | K104: 5000 | L104: 2000 | R104: 朱聪 | S104: =RC[-12] -> 60 | T104: =RC[-12] -> 8000 | U104: =RC[-12] -> 5000 | V104: =RC[-12] -> 11000 | W104: =RC[-12] -> 5000 | X104: =RC[-12] -> 2000 | AD104: 韩小莹 | AE104: =RC[-12] -> 60 | AF104: =RC[-12] -> 8000 | AG104: =RC[-12] -> 5000 | AH104: =RC[-12] -> 11000 | AI104: =RC[-12] -> 5000 | AJ104: =RC[-12] -> 2000 | AP104: 甘宝宝 | AQ104: =RC[-12] -> 60 | AR104: =RC[-12] -> 8000 | AS104: =RC[-12] -> 5000 | AT104: =RC[-12] -> 11000 | AU104: =RC[-12] -> 5000 | AV104: =RC[-12] -> 2000 | BB104: 全金发 | BC104: =RC[-12] -> 60 | BD104: =RC[-12] -> 8000 | BE104: =RC[-12] -> 5000 | BF104: =RC[-12] -> 11000 | BG104: =RC[-12] -> 5000 | BH104: =RC[-12] -> 2000
A105: 103 | B105: 103 | C105: 王语嫣 | F105: 小昭 | G105: 60 | H105: 8000 | I105: 5000 | J105: 11000 | K105: 5000 | L105: 2000 | R105: 哑婆婆 | S105: =RC[-12] -> 60 | T105: =RC[-12] -> 8000 | U105: =RC[-12] -> 5000 | V105: =RC[-12] -> 11000 | W105: =RC[-12] -> 5000 | X105: =RC[-12] -> 2000 | AD105: 王语嫣 | AE105: =RC[-12] -> 60 | AF105: =RC[-12] -> 8000 | AG105: =RC[-12] -> 5000 | AH105: =RC[-12] -> 11000 | AI105: =RC[-12] -> 5000 | AJ105: =RC[-12] -> 2000 | AP105: 全冠清 | AQ105: =RC[-12] -> 60 | AR105: =RC[-12] -> 8000 | AS105: =RC[-12] -> 5000 | AT105: =RC[-12] -> 11000 | AU105: =RC[-12] -> 5000 | AV105: =RC[-12] -> 2000 | BB105: 圆音 | BC105: =RC[-12] -> 60 | BD105: =RC[-12] -> 8000 | BE105: =RC[-12] -> 5000 | BF105: =RC[-12] -> 11000 | BG105: =RC[-12] -> 5000 | BH105: =RC[-12] -> 2000
A106: 104 | B106: 104 | C106: 范骅 | F106: 朱丹臣 | G106: 60 | H106: 8000 | I106: 5000 | J106: 11000 | K106: 5000 | L106: 2000 | R106: 慧方 | S106: =RC[-12] -> 60 | T106: =RC[-12] -> 8000 | U106: =RC[-12] -> 5000 | V106: =RC[-12] -> 11000 | W106: =RC[-12] -> 5000 | X106: =RC[-12] -> 2000 | AD106: 觉月 | AE106: =RC[-12] -> 60 | AF106: =RC[-12] -> 8000 | AG106: =RC[-12] -> 5000 | AH106: =RC[-12] -> 11000 | AI106: =RC[-12] -> 5000 | AJ106: =RC[-12] -> 2000 | AP106: 费彬 | AQ106: =RC[-12] -> 60 | AR106: =RC[-12] -> 8000 | AS106: =RC[-12] -> 5000 | AT106: =RC[-12] -> 11000 | AU106: =RC[-12] -> 5000 | AV106: =RC[-12] -> 2000 | BB106: 范骅 | BC106: =RC[-12] -> 60 | BD106: =RC[-12] -> 8000 | BE106: =RC[-12] -> 5000 | BF106: =RC[-12] -> 11000 | BG106: =RC[-12] -> 5000 | BH106: =RC[-12] -> 2000
A107: 105 | B107: 105 | C107: 包不同 | F107: 包不同 | G107: 60 | H107: 8000 | I107: 5000 | J107: 11000 | K107: 5000 | L107: 2000 | R107: 费彬 | S107: =RC[-12] -> 60 | T107: =RC[-12] -> 8000 | U107: =RC[-12] -> 5000 | V107: =RC[-12] -> 11000 | W107: =RC[-12] -> 5000 | X107: =RC[-12] -> 2000 | AD107: 桃根仙 | AE107: =RC[-12] -> 60 | AF107: =RC[-12] -> 8000 | AG107: =RC[-12] -> 5000 | AH107: =RC[-12] -> 11000 | AI107: =RC[-12] -> 5000 | AJ107: =RC[-12] -> 2000 | AP107: 褚万里 | AQ107: =RC[-12] -> 60 | AR107: =RC[-12] -> 8000 | AS107: =RC[-12] -> 5000 | AT107: =RC[-12] -> 11000 | AU107: =RC[-12] -> 5000 | AV107: =RC[-12] -> 2000 | BB107: 清虚道长 | BC107: =RC[-12] -> 60 | BD107: =RC[-12] -> 8000 | BE107: =RC[-12] -> 5000 | BF107: =RC[-12] -> 11000 | BG107: =RC[-12] -> 5000 | BH107: =RC[-12] -> 2000
A108: 106 | B108: 106 | C108: 邓百川 | F108: 桃根仙 | G108: 60 | H108: 8000 | I108: 5000 | J108: 11000 | K108: 5000 | L108: 2000 | R108: 邓百川 | S108: =RC[-12] -> 60 | T108: =RC[-12] -> 8000 | U108: =RC[-12] -> 5000 | V108: =RC[-12] -> 11000 | W108: =RC[-12] -> 5000 | X108: =RC[-12] -> 2000 | AD108: 范骅 | AE108: =RC[-12] -> 60 | AF108: =RC[-12] -> 8000 | AG108: =RC[-12] -> 5000 | AH108: =RC[-12] -> 11000 | AI108: =RC[-12] -> 5000 | AJ108: =RC[-12] -> 2000 | AP108: 朱聪 | AQ108: =RC[-12] -> 60 | AR108: =RC[-12] -> 8000 | AS108: =RC[-12] -> 5000 | AT108: =RC[-12] -> 11000 | AU108: =RC[-12] -> 5000 | AV108: =RC[-12] -> 2000 | BB108: 林震南 | BC108: =RC[-12] -> 60 | BD108: =RC[-12] -> 8000 | BE108: =RC[-12] -> 5000 | BF108: =RC[-12] -> 11000 | BG108: =RC[-12] -> 5000 | BH108: =RC[-12] -> 2000
A109: 107 | B109: 107 | C109: 风波恶 | F109: 风波恶 | G109: 60 | H109: 8000 | I109: 5000 | J109: 11000 | K109: 5000 | L109: 2000 | R109: 费彬 | S109: =RC[-12] -> 60 | T109: =RC[-12] -> 8000 | U109: =RC[-12] -> 5000 | V109: =RC[-12] -> 11000 | W109: =RC[-12] -> 5000 | X109: =RC[-12] -> 2000 | AD109: 过彦之 | AE109: =RC[-12] -> 60 | AF109: =RC[-12] -> 8000 | AG109: =RC[-12] -> 5000 | AH109: =RC[-12] -> 11000 | AI109: =RC[-12] -> 5000 | AJ109: =RC[-12] -> 2000 | AP109: 侯通海 | AQ109: =RC[-12] -> 60 | AR109: =RC[-12] -> 8000 | AS109: =RC[-12] -> 5000 | AT109: =RC[-12] -> 11000 | AU109: =RC[-12] -> 5000 | AV109: =RC[-12] -> 2000 | BB109: 哲别 | BC109: =RC[-12] -> 60 | BD109: =RC[-12] -> 8000 | BE109: =RC[-12] -> 5000 | BF109: =RC[-12] -> 11000 | BG109: =RC[-12] -> 5000 | BH109: =RC[-12] -> 2000
A110: 108 | B110: 108 | C110: 公冶乾 | F110: 公冶乾 | G110: 60 | H110: 8000 | I110: 5000 | J110: 11000 | K110: 5000 | L110: 2000 | R110: 南希仁 | S110: =RC[-12] -> 60 | T110: =RC[-12] -> 8000 | U110: =RC[-12] -> 5000 | V110: =RC[-12] -> 11000 | W110: =RC[-12] -> 5000 | X110: =RC[-12] -> 2000 | AD110: 五叶大师 | AE110: =RC[-12] -> 60 | AF110: =RC[-12] -> 8000 | AG110: =RC[-12] -> 5000 | AH110: =RC[-12] -> 11000 | AI110: =RC[-12] -> 5000 | AJ110: =RC[-12] -> 2000 | AP110: 清虚道长 | AQ110: =RC[-12] -> 60 | AR110: =RC[-12] -> 8000 | AS110: =RC[-12] -> 5000 | AT110: =RC[-12] -> 11000 | AU110: =RC[-12] -> 5000 | AV110: =RC[-12] -> 2000 | BB110: 全金发 | BC110: =RC[-12] -> 60 | BD110: =RC[-12] -> 8000 | BE110: =RC[-12] -> 5000 | BF110: =RC[-12] -> 11000 | BG110: =RC[-12] -> 5000 | BH110: =RC[-12] -> 2000
A111: 109 | B111: 109 | C111: 刘正风 | F111: 小昭 | G111: 60 | H111: 8000 | I111: 5000 | J111: 11000 | K111: 5000 | L111: 2000 | R111: 平婆婆 | S111: =RC[-12] -> 60 | T111: =RC[-12] -> 8000 | U111: =RC[-12] -> 5000 | V111: =RC[-12] -> 11000 | W111: =RC[-12] -> 5000 | X111: =RC[-12] -> 2000 | AD111: 赵志敬 | AE111: =RC[-12] -> 60 | AF111: =RC[-12] -> 8000 | AG111: =RC[-12] -> 5000 | AH111: =RC[-12] -> 11000 | AI111: =RC[-12] -> 5000 | AJ111: =RC[-12] -> 2000 | AP111: 程瑶迦 | AQ111: =RC[-12] -> 60 | AR111: =RC[-12] -> 8000 | AS111: =RC[-12] -> 5000 | AT111: =RC[-12] -> 11000 | AU111: =RC[-12] -> 5000 | AV111: =RC[-12] -> 2000 | BB111: 刘正风 | BC111: =RC[-12] -> 60 | BD111: =RC[-12] -> 8000 | BE111: =RC[-12] -> 5000 | BF111: =RC[-12] -> 11000 | BG111: =RC[-12] -> 5000 | BH111: =RC[-12] -> 2000
A112: 110 | B112: 110 | C112: 赵钱孙 | F112: 圆音 | G112: 60 | H112: 8000 | I112: 5000 | J112: 11000 | K112: 5000 | L112: 2000 | R112: 赵钱孙 | S112: =RC[-12] -> 60 | T112: =RC[-12] -> 8000 | U112: =RC[-12] -> 5000 | V112: =RC[-12] -> 11000 | W112: =RC[-12] -> 5000 | X112: =RC[-12] -> 2000 | AD112: 韩小莹 | AE112: =RC[-12] -> 60 | AF112: =RC[-12] -> 8000 | AG112: =RC[-12] -> 5000 | AH112: =RC[-12] -> 11000 | AI112: =RC[-12] -> 5000 | AJ112: =RC[-12] -> 2000 | AP112: 古笃诚 | AQ112: =RC[-12] -> 60 | AR112: =RC[-12] -> 8000 | AS112: =RC[-12] -> 5000 | AT112: =RC[-12] -> 11000 | AU112: =RC[-12] -> 5000 | AV112: =RC[-12] -> 2000 | BB112: 完颜洪烈 | BC112: =RC[-12] -> 60 | BD112: =RC[-12] -> 8000 | BE112: =RC[-12] -> 5000 | BF112: =RC[-12] -> 11000 | BG112: =RC[-12] -> 5000 | BH112: =RC[-12] -> 2000
A113: 111 | B113: 111 | C113: 陈孤雁 | F113: 木婉清 | G113: 60 | H113: 8000 | I113: 5000 | J113: 11000 | K113: 5000 | L113: 2000 | R113: 岳灵珊 | S113: =RC[-12] -> 60 | T113: =RC[-12] -> 8000 | U113: =RC[-12] -> 5000 | V113: =RC[-12] -> 11000 | W113: =RC[-12] -> 5000 | X113: =RC[-12] -> 2000 | AD113: 过彦之 | AE113: =RC[-12] -> 60 | AF113: =RC[-12] -> 8000 | AG113: =RC[-12] -> 5000 | AH113: =RC[-12] -> 11000 | AI113: =RC[-12] -> 5000 | AJ113: =RC[-12] -> 2000 | AP113: 包不同 | AQ113: =RC[-12] -> 60 | AR113: =RC[-12] -> 8000 | AS113: =RC[-12] -> 5000 | AT113: =RC[-12] -> 11000 | AU113: =RC[-12] -> 5000 | AV113: =RC[-12] -> 2000 | BB113: 陈孤雁 | BC113: =RC[-12] -> 60 | BD113: =RC[-12] -> 8000 | BE113: =RC[-12] -> 5000 | BF113: =RC[-12] -> 11000 | BG113: =RC[-12] -> 5000 | BH113: =RC[-12] -> 2000
A114: 112 | B114: 112 | C114: 白世镜 | F114: 摘星子 | G114: 60 | H114: 8000 | I114: 5000 | J114: 11000 | K114: 5000 | L114: 2000 | R114: 韩宝驹 | S114: =RC[-12] -> 60 | T114: =RC[-12] -> 8000 | U114: =RC[-12] -> 5000 | V114: =RC[-12] -> 11000 | W114: =RC[-12] -> 5000 | X114: =RC[-12] -> 2000 | AD114: 阿朱 | AE114: =RC[-12] -> 60 | AF114: =RC[-12] -> 8000 | AG114: =RC[-12] -> 5000 | AH114: =RC[-12] -> 11000 | AI114: =RC[-12] -> 5000 | AJ114: =RC[-12] -> 2000 | AP114: 华赫艮 | AQ114: =RC[-12] -> 60 | AR114: =RC[-12] -> 8000 | AS114: =RC[-12] -> 5000 | AT114: =RC[-12] -> 11000 | AU114: =RC[-12] -> 5000 | AV114: =RC[-12] -> 2000 | BB114: 白世镜 | BC114: =RC[-12] -> 60 | BD114: =RC[-12] -> 8000 | BE114: =RC[-12] -> 5000 | BF114: =RC[-12] -> 11000 | BG114: =RC[-12] -> 5000 | BH114: =RC[-12] -> 2000
A115: 113 | B115: 113 | C115: 巴天石 | F115: 木高峰 | G115: 60 | H115: 8000 | I115: 5000 | J115: 11000 | K115: 5000 | L115: 2000 | R115: 巴天石 | S115: =RC[-12] -> 60 | T115: =RC[-12] -> 8000 | U115: =RC[-12] -> 5000 | V115: =RC[-12] -> 11000 | W115: =RC[-12] -> 5000 | X115: =RC[-12] -> 2000 | AD115: 范百龄 | AE115: =RC[-12] -> 60 | AF115: =RC[-12] -> 8000 | AG115: =RC[-12] -> 5000 | AH115: =RC[-12] -> 11000 | AI115: =RC[-12] -> 5000 | AJ115: =RC[-12] -> 2000 | AP115: 风波恶 | AQ115: =RC[-12] -> 60 | AR115: =RC[-12] -> 8000 | AS115: =RC[-12] -> 5000 | AT115: =RC[-12] -> 11000 | AU115: =RC[-12] -> 5000 | AV115: =RC[-12] -> 2000 | BB115: 费彬 | BC115: =RC[-12] -> 60 | BD115: =RC[-12] -> 8000 | BE115: =RC[-12] -> 5000 | BF115: =RC[-12] -> 11000 | BG115: =RC[-12] -> 5000 | BH115: =RC[-12] -> 2000
A116: 114 | B116: 114 | C116: 苦乘 | F116: 桃根仙 | G116: 60 | H116: 8000 | I116: 5000 | J116: 11000 | K116: 5000 | L116: 2000 | R116: 费彬 | S116: =RC[-12] -> 60 | T116: =RC[-12] -> 8000 | U116: =RC[-12] -> 5000 | V116: =RC[-12] -> 11000 | W116: =RC[-12] -> 5000 | X116: =RC[-12] -> 2000 | AD116: 哲别 | AE116: =RC[-12] -> 60 | AF116: =RC[-12] -> 8000 | AG116: =RC[-12] -> 5000 | AH116: =RC[-12] -> 11000 | AI116: =RC[-12] -> 5000 | AJ116: =RC[-12] -> 2000 | AP116: 仪琳 | AQ116: =RC[-12] -> 60 | AR116: =RC[-12] -> 8000 | AS116: =RC[-12] -> 5000 | AT116: =RC[-12] -> 11000 | AU116: =RC[-12] -> 5000 | AV116: =RC[-12] -> 2000 | BB116: 苦乘 | BC116: =RC[-12] -> 60 | BD116: =RC[-12] -> 8000 | BE116: =RC[-12] -> 5000 | BF116: =RC[-12] -> 11000 | BG116: =RC[-12] -> 5000 | BH116: =RC[-12] -> 2000
A117: 115 | B117: 115 | C117: 玄苦 | F117: 柯镇恶 | G117: 60 | H117: 8000 | I117: 5000 | J117: 11000 | K117: 5000 | L117: 2000 | R117: 木高峰 | S117: =RC[-12] -> 60 | T117: =RC[-12] -> 8000 | U117: =RC[-12] -> 5000 | V117: =RC[-12] -> 11000 | W117: =RC[-12] -> 5000 | X117: =RC[-12] -> 2000 | AD117: 范百龄 | AE117: =RC[-12] -> 60 | AF117: =RC[-12] -> 8000 | AG117: =RC[-12] -> 5000 | AH117: =RC[-12] -> 11000 | AI117: =RC[-12] -> 5000 | AJ117: =RC[-12] -> 2000 | AP117: 哲别 | AQ117: =RC[-12] -> 60 | AR117: =RC[-12] -> 8000 | AS117: =RC[-12] -> 5000 | AT117: =RC[-12] -> 11000 | AU117: =RC[-12] -> 5000 | AV117: =RC[-12] -> 2000 | BB117: 玄苦 | BC117: =RC[-12] -> 60 | BD117: =RC[-12] -> 8000 | BE117: =RC[-12] -> 5000 | BF117: =RC[-12] -> 11000 | BG117: =RC[-12] -> 5000 | BH117: =RC[-12] -> 2000
A118: 116 | B118: 116 | C118: 玄惭 | F118: 程瑶迦 | G118: 60 | H118: 8000 | I118: 5000 | J118: 11000 | K118: 5000 | L118: 2000 | R118: 觉月 | S118: =RC[-12] -> 60 | T118: =RC[-12] -> 8000 | U118: =RC[-12] -> 5000 | V118: =RC[-12] -> 11000 | W118: =RC[-12] -> 5000 | X118: =RC[-12] -> 2000 | AD118: 苦乘 | AE118: =RC[-12] -> 60 | AF118: =RC[-12] -> 8000 | AG118: =RC[-12] -> 5000 | AH118: =RC[-12] -> 11000 | AI118: =RC[-12] -> 5000 | AJ118: =RC[-12] -> 2000 | AP118: 玄苦 | AQ118: =RC[-12] -> 60 | AR118: =RC[-12] -> 8000 | AS118: =RC[-12] -> 5000 | AT118: =RC[-12] -> 11000 | AU118: =RC[-12] -> 5000 | AV118: =RC[-12] -> 2000 | BB118: 玄惭 | BC118: =RC[-12] -> 60 | BD118: =RC[-12] -> 8000 | BE118: =RC[-12] -> 5000 | BF118: =RC[-12] -> 11000 | BG118: =RC[-12] -> 5000 | BH118: =RC[-12] -> 2000
A119: 117 | B119: 117 | C119: 黄钟公 | F119: 朱聪 | G119: 60 | H119: 8000 | I119: 5000 | J119: 11000 | K119: 5000 | L119: 2000 | R119: 张松溪 | S119: =RC[-12] -> 60 | T119: =RC[-12] -> 8000 | U119: =RC[-12] -> 5000 | V119: =RC[-12] -> 11000 | W119: =RC[-12] -> 5000 | X119: =RC[-12] -> 2000 | AD119: 静虚师太 | AE119: =RC[-12] -> 60 | AF119: =RC[-12] -> 8000 | AG119: =RC[-12] -> 5000 | AH119: =RC[-12] -> 11000 | AI119: =RC[-12] -> 5000 | AJ119: =RC[-12] -> 2000 | AP119: 华赫艮 | AQ119: =RC[-12] -> 60 | AR119: =RC[-12] -> 8000 | AS119: =RC[-12] -> 5000 | AT119: =RC[-12] -> 11000 | AU119: =RC[-12] -> 5000 | AV119: =RC[-12] -> 2000 | BB119: 黄钟公 | BC119: =RC[-12] -> 60 | BD119: =RC[-12] -> 8000 | BE119: =RC[-12] -> 5000 | BF119: =RC[-12] -> 11000 | BG119: =RC[-12] -> 5000 | BH119: =RC[-12] -> 2000
A120: 118 | B120: 118 | C120: 平一指 | F120: 公冶乾 | G120: 60 | H120: 8000 | I120: 5000 | J120: 11000 | K120: 5000 | L120: 2000 | R120: 木婉清 | S120: =RC[-12] -> 60 | T120: =RC[-12] -> 8000 | U120: =RC[-12] -> 5000 | V120: =RC[-12] -> 11000 | W120: =RC[-12] -> 5000 | X120: =RC[-12] -> 2000 | AD120: 朱聪 | AE120: =RC[-12] -> 60 | AF120: =RC[-12] -> 8000 | AG120: =RC[-12] -> 5000 | AH120: =RC[-12] -> 11000 | AI120: =RC[-12] -> 5000 | AJ120: =RC[-12] -> 2000 | AP120: 仪琳 | AQ120: =RC[-12] -> 60 | AR120: =RC[-12] -> 8000 | AS120: =RC[-12] -> 5000 | AT120: =RC[-12] -> 11000 | AU120: =RC[-12] -> 5000 | AV120: =RC[-12] -> 2000 | BB120: 平一指 | BC120: =RC[-12] -> 60 | BD120: =RC[-12] -> 8000 | BE120: =RC[-12] -> 5000 | BF120: =RC[-12] -> 11000 | BG120: =RC[-12] -> 5000 | BH120: =RC[-12] -> 2000
A121: 119 | B121: 119 | C121: 潇湘子 | F121: 邓百川 | G121: 60 | H121: 8000 | I121: 5000 | J121: 11000 | K121: 5000 | L121: 2000 | R121: 王语嫣 | S121: =RC[-12] -> 60 | T121: =RC[-12] -> 8000 | U121: =RC[-12] -> 5000 | V121: =RC[-12] -> 11000 | W121: =RC[-12] -> 5000 | X121: =RC[-12] -> 2000 | AD121: 觉月 | AE121: =RC[-12] -> 60 | AF121: =RC[-12] -> 8000 | AG121: =RC[-12] -> 5000 | AH121: =RC[-12] -> 11000 | AI121: =RC[-12] -> 5000 | AJ121: =RC[-12] -> 2000 | AQ121: =RC[-12] -> 60 | AR121: =RC[-12] -> 8000 | AS121: =RC[-12] -> 5000 | AT121: =RC[-12] -> 11000 | AU121: =RC[-12] -> 5000 | AV121: =RC[-12] -> 2000 | BB121: 潇湘子 | BC121: =RC[-12] -> 60 | BD121: =RC[-12] -> 8000 | BE121: =RC[-12] -> 5000 | BF121: =RC[-12] -> 11000 | BG121: =RC[-12] -> 5000 | BH121: =RC[-12] -> 2000
A122: 120 | B122: 120 | C122: 尹志平 | F122: 潇湘子 | G122: 60 | H122: 8000 | I122: 5000 | J122: 11000 | K122: 5000 | L122: 2000 | R122: 平一指 | S122: =RC[-12] -> 60 | T122: =RC[-12] -> 8000 | U122: =RC[-12] -> 5000 | V122: =RC[-12] -> 11000 | W122: =RC[-12] -> 5000 | X122: =RC[-12] -> 2000 | AD122: 黄钟公 | AE122: =RC[-12] -> 60 | AF122: =RC[-12] -> 8000 | AG122: =RC[-12] -> 5000 | AH122: =RC[-12] -> 11000 | AI122: =RC[-12] -> 5000 | AJ122: =RC[-12] -> 2000 | AP122: 赵钱孙 | AQ122: =RC[-12] -> 60 | AR122: =RC[-12] -> 8000 | AS122: =RC[-12] -> 5000 | AT122: =RC[-12] -> 11000 | AU122: =RC[-12] -> 5000 | AV122: =RC[-12] -> 2000 | BB122: 尹志平 | BC122: =RC[-12] -> 60 | BD122: =RC[-12] -> 8000 | BE122: =RC[-12] -> 5000 | BF122: =RC[-12] -> 11000 | BG122: =RC[-12] -> 5000 | BH122: =RC[-12] -> 2000

Sheet: 罚恶令怪物配置表
A1: 组队ID | B1: 组队名称 | C1: 图片 | D1: 开始时间 | E1: 时长s | F1: 间隔时间h | G1: 阵法ID | H1: 0怪物ID | I1: 0怪物等级 | J1: 攻击修正0 | K1: 防御修正0 | L1: 生命修正0 | M1: 内力修正0 | N1: 体力修正0 | O1: 武器ID0 | P1: 防具ID0 | Q1: 饰品ID0 | R1: 技能专精0 | S1: 天赋激活0 | T1: 1怪物ID | U1: 1怪物等级 | V1: 攻击修正1 | W1: 防御修正1 | X1: 生命修正1 | Y1: 内力修正1 | Z1: 体力修正1 | AA1: 武器ID1 | AB1: 防具ID1 | AC1: 饰品ID1 | AD1: 技能专精1 | AE1: 天赋激活1 | AF1: 2怪物ID | AG1: 2怪物等级 | AH1: 攻击修正2 | AI1: 防御修正2 | AJ1: 生命修正2 | AK1: 内力修正2 | AL1: 体力修正2 | AM1: 武器ID2 | AN1: 防具ID2 | AO1: 饰品ID2 | AP1: 技能专精2 | AQ1: 天赋激活2 | AR1: 3怪物ID | AS1: 3怪物等级 | AT1: 攻击修正3 | AU1: 防御修正3 | AV1: 生命修正3 | AW1: 内力修正3 | AX1: 体力修正3 | AY1: 武器ID3 | AZ1: 防具ID3 | BA1: 饰品ID3 | BB1: 技能专精3 | BC1: 天赋激活3 | BD1: 4怪物ID | BE1: 4怪物等级 | BF1: 攻击修正4 | BG1: 防御修正4 | BH1: 生命修正4 | BI1: 内力修正4 | BJ1: 体力修正4 | BK1: 武器ID4 | BL1: 防具ID4 | BM1: 饰品ID4 | BN1: 技能专精4 | BO1: 天赋激活4 | BP1: 5怪物ID | BQ1: 5怪物等级 | BR1: 攻击修正5 | BS1: 防御修正5 | BT1: 生命修正5 | BU1: 内力修正5 | BV1: 体力修正5 | BW1: 武器ID5 | BX1: 防具ID5 | BY1: 饰品ID5 | BZ1: 技能专精5 | CA1: 天赋激活5
A2: id | B2: name | C2: stage_img | D2: start_time | E2: duration | F2: repeat_time | G2: zhenfa_id | H2: monster_id0 | I2: monster_lvl0 | J2: attack_mod0 | K2: defence_mod0 | L2: hp_mod0 | M2: mp_mod0 | N2: sp_mod0 | O2: weapon_id0 | P2: armor_id0 | Q2: ornament_id0 | R2: skill_power0 | S2: talnet_0 | T2: monster_id1 | U2: monster_lvl1 | V2: attack_mod1 | W2: defence_mod1 | X2: hp_mod1 | Y2: mp_mod1 | Z2: sp_mod1 | AA2: weapon_id1 | AB2: armor_id1 | AC2: ornament_id1 | AD2: skill_power1 | AE2: talnet_1 | AF2: monster_id2 | AG2: monster_lvl2 | AH2: attack_mod2 | AI2: defence_mod2 | AJ2: hp_mod2 | AK2: mp_mod2 | AL2: sp_mod2 | AM2: weapon_id2 | AN2: armor_id2 | AO2: ornament_id2 | AP2: skill_power2 | AQ2: talnet_2 | AR2: monster_id3 | AS2: monster_lvl3 | AT2: attack_mod3 | AU2: defence_mod3 | AV2: hp_mod3 | AW2: mp_mod3 | AX2: sp_mod3 | AY2: weapon_id3 | AZ2: armor_id3 | BA2: ornament_id3 | BB2: skill_power3 | BC2: talnet_3 | BD2: monster_id4 | BE2: monster_lvl4 | BF2: attack_mod4 | BG2: defence_mod4 | BH2: hp_mod4 | BI2: mp_mod4 | BJ2: sp_mod4 | BK2: weapon_id4 | BL2: armor_id4 | BM2: ornament_id4 | BN2: skill_power4 | BO2: talnet_4 | BP2: monster_id5 | BQ2: monster_lvl5 | BR2: attack_mod5 | BS2: defence_mod5 | BT2: hp_mod5 | BU2: mp_mod5 | BV2: sp_mod5 | BW2: weapon_id5 | BX2: armor_id5 | BY2: ornament_id5 | BZ2: skill_power5 | CA2: talnet_5
A3: 1 | B3: 堕落欧阳锋 | C3: 123 | D3: 2013/2/1 13:00:00 | E3: 7200 | F3: 24 | H3: 6001 | I3: 60 | J3: 9000 | K3: 0 | L3: 8000000 | M3: 8000000 | N3: 8000000

Sheet: export
A1: sheet_name | B1: export_name
A2: 区域表 | B2: map_list
A3: 关卡表 | B3: mission_list
A4: 怪物组队表 | B4: monster_team
A5: 华山论剑 | B5: tower_monster_list
A6: 千层塔怪物组队表 | B6: tower_monsters
A7: 罚恶令怪物配置表 | B7: bossbattle_list
A8: 精英关卡配置表 | B8: ex_mission_list