Sheet: 技能表说明
A1: 表功能说明：
A2: 技能配置表 | B2: 配置技能库
A3: 功夫名 | B3: 失效
A4: 目标常量表 | B4: 展示技能能够作用的目标
A5: 功夫类型表 | B5: 失效
A6: 技能类型表 | B6: 展示技能类型
A7: 状态配置表 | B7: 配置buff/debuff
A8: 战斗数值 | B8: 失效
A9: 技能触发条件 | B9: 展示技能可被触发的时机
A10: 魔法属性表 | B10: 展示已经实现的技能效果
A11: 魔法属性效果表 | B11: 配置不同技能效果所对应的数值
A12: 普通攻击效果表 | B12: 失效
A13: 战斗参数表 | B13: 配置战斗系统中一些可变参数
A15: 配置规则：
A16: 1.技能类型和技能效果的组合决定了最终的技能
A17: 2.在“技能配置表”中的最后一列填写“状态配置表”中某个状态的名称，以实现“状态类”的技能
A18: 比如：“状态配置表”中有一个状态是“持续回血3回合”，这个状态一定要在“技能配置表”中配置一条技能与之关联才能够配置在侠客身上
A19: 3.配置技能的几个比较关键的因素如下：
A20: tips_desc | B20: 描述信息，决定了战斗界面点击技能之后弹出的信息内容
A21: name | B21: 技能名称
A22: type | B22: 技能类型
A23: icon | B23: 技能图标，位置：\resource\images\icon\skill
A24: wuxing | B24: 技能五行属性，技能属性与人物属性相生时，技能效果被放大20%
A25: party | B25: 技能门派
A26: target | B26: 技能作用目标
A27: cost | B27: 技能蓝耗，随着等级增长
A28: const_cost | B28: 技能蓝耗，恒定不变
A29: start_eff | B29: 技能释放动画
A30: hit_action | B30: 技能命中动画
A31: multi_hit | B31: 技能连击的次数
A32: range | B32: 技能作用的目标数名
A33: range_direct | B33: 技能作用目标的方向，在这里只有“向后”和空白两种
A34: trigger_condition | B34: 技能的触发条件
A35: trigger_rate | B35: 技能的触发概率
A36: magic_id | B36: 技能效果
A37: !magic_eff | B37: 技能效果的数值
A38: state_id | B38: 技能所附带的状态(buff/debuff)

Sheet: 技能配置表
A1: 技能ID | B1: 描述 | C1: 技能名 | D1: 技能类型 | E1: 图标 | F1: 五行 | G1: 武功名称 | H1: 招式分类 | I1: 武功档次 | J1: 所属门派 | K1: 技能目标 | L1: 内力消耗成长 | M1: 内力消耗 | N1: 特效文字 | O1: 发招动作 | P1: 动作长度 | Q1: 发招特效 | R1: 发招音效 | S1: 碰撞时间 | T1: 飞行特效 | U1: 飞行时间 | V1: 命中动作 | W1: 命中特效 | X1: 命中音效 | Y1: 连击 | Z1: 连击间隔 | AA1: 完结时间 | AB1: 技能范围 | AC1: 范围方向 | AD1: 触发条件 | AE1: 触发概率 | AF1: 魔法属性ID | AG1: 魔法属性效果 | AH1: 魔法属性参数 | AI1: 状态id | AJ1: 状态说明
A2: id | B2: tips_desc | C2: name | D2: type | E2: icon | F2: wuxing | G2: kongfu_name | H2: kongfu_type | I2: kongfu_class | J2: party | K2: target | L2: cost | M2: const_cost | N2: word_type | O2: start_action | P2: action_time | Q2: start_eff | R2: start_sound | S2: on_hit_time | T2: fly_eff | U2: fly_time | V2: hit_action | W2: hit_eff | X2: hit_sound | Y2: multi_hit | Z2: multi_interval | AA2: delay_time | AB2: range | AC2: range_direct | AD2: trigger_condition | AE2: trigger_rate | AF2: magic_id | AG2: !magic_eff | AH2: magic_params | AI2: state_id | AJ2: desc
A3: 1 | B3: 瞬间，战败时使对方所有角色体力流失 | C3: 箫花齐放 | D3: 气功 | E3: 124 | F3: 水 | J3: 桃花岛 | K3: 对手 | L3: D0 | V3: debuff | AB3: 5 | AC3: 向后 | AD3: on_lose | AE3: 1000 | AF3: ch_sp_p | AG3: #-A0
A4: 2 | B4: 起招阶段，使对手体力流失 | C4: 散花势 | D4: 气功 | E4: 404 | F4: 水 | J4: 桃花岛 | K4: 对手 | L4: A0 | V4: debuff | AB4: 1 | AD4: starting_turn | AE4: 1000 | AF4: ch_sp_v | AG4: -B0
A5: 4 | B5: 瞬间，战败时使对方所有角色内力流失 | C5: 浪卷云飞 | D5: 气功 | E5: 404 | F5: 水 | J5: 桃花岛 | K5: 对手 | L5: D0 | V5: debuff | AB5: 5 | AC5: 向后 | AD5: on_lose | AE5: 1000 | AF5: ch_mp_p | AG5: #-A0
A6: 6 | B6: 起招阶段，使对手内力流失 | C6: 花魂附体 | D6: 气功 | E6: 274 | F6: 水 | J6: 桃花岛 | K6: 对手 | L6: A0 | V6: debuff | AB6: 1 | AD6: starting_turn | AE6: 1000 | AF6: ch_mp_v | AG6: -B0
A7: 7 | B7: 出招阶段，对2名对手造成伤害 | C7: 九阴白骨爪 | D7: 攻击 | E7: 144 | F7: 水 | J7: 江湖 | K7: 对手 | L7: A0 | Q7: slash_eff | AB7: 2 | AC7: 向后 | AD7: auto_action | AE7: 1000 | AF7: sk_attack_p | AG7: #-C0
A8: 8 | B8: 起招阶段，使自身能够根据造成的伤害回复自身内力 | C8: 九阴摧心掌 | D8: 增益 | E8: 124 | F8: 水 | J8: 江湖 | K8: 自身 | L8: D0 | AB8: 1 | AD8: starting_turn | AE8: 1000 | AI8: 内力分流
A9: 9 | B9: 收招阶段，增加自身反击率 | C9: 嵩阳剑法 | D9: 增益 | E9: 331 | F9: 火 | J9: 嵩山派 | K9: 自身 | L9: A0 | AB9: 1 | AD9: ending_turn | AE9: 1000 | AI9: 嵩阳剑法
A10: 11 | B10: 接招阶段，增加自身反击率 | C10: 寒冰真气 | D10: 增益 | E10: 1041 | F10: 火 | J10: 嵩山派 | K10: 自身 | L10: A0 | AB10: 1 | AD10: on_defence | AE10: 1000 | AI10: 寒冰真气
A11: 12 | B11: 被动，回合开始后攻击力不断增加 | C11: 寒冰神掌 | D11: 被动 | E11: 121 | F11: 火 | J11: 嵩山派 | K11: 自身 | AB11: 1 | AF11: float_attack_p | AG11: #C0
A12: 14 | B12: 瞬间，攻击丢失时有几率为自身回复内力3回合 | C12: 冲虚养气 | D12: 增益 | E12: 401 | F12: 火 | J12: 峨眉派 | K12: 自身 | L12: D0 | AB12: 1 | AD12: on_miss | AE12: 500 | AI12: 冲虚养气
A13: 15 | B13: 接招阶段，为自身及后方角色增加闪避率 | C13: 白鹤展翅 | D13: 增益 | E13: 143 | F13: 木 | J13: 江湖 | K13: 自身 | L13: A0 | AB13: 2 | AC13: 向后 | AD13: on_defence | AE13: 1000 | AI13: 白鹤展翅
A14: 16 | B14: 接招阶段，消耗体力抵消攻击伤害 | C14: 白鹤翔空 | D14: 增益 | E14: 405 | F14: 土 | J14: 丐帮 | K14: 自身 | L14: A0 | AB14: 1 | AD14: on_defence | AE14: 1000 | AI14: 白鹤翔空
A15: 17 | B15: 收招阶段，使对方不能施展诅咒类招式 | C15: 緾丝擒拿手 | D15: 诅咒 | E15: 145 | F15: 土 | J15: 丐帮 | K15: 对手 | L15: A0 | AB15: 1 | AD15: ending_turn | AE15: 1000 | AI15: 诅咒不能
A16: 18 | B16: 出招阶段，增加自身攻击力 | C16: 玉女剑式 | D16: 增益 | E16: 332 | F16: 金 | J16: 华山派 | K16: 自身 | L16: A0 | AB16: 1 | AD16: auto_action | AE16: 1000 | AI16: 玉女剑式
A17: 19 | B17: 被动，回合开始后自身暴击率不断增加 | C17: 宁氏一剑 | D17: 被动 | E17: 332 | F17: 金 | J17: 华山派 | K17: 自身 | AF17: float_crit_p | AG17: #C0
A18: 20 | B18: 瞬间，攻击丢失时使自身暴击率提升2回合 | C18: 铁掌碎石 | D18: 增益 | E18: 122 | F18: 金 | J18: 江湖 | K18: 自身 | L18: A0 | AB18: 1 | AD18: on_miss | AE18: 1000 | AI18: 铁掌碎石
A19: 21 | B19: 被动，攻击力增加 | C19: 闭穴功 | D19: 被动 | E19: 1042 | F19: 金 | J19: 江湖 | K19: 自身 | AF19: ch_attack_p | AG19: #C0
A20: 22 | B20: 出招阶段，对对手造成2连击伤害 | C20: 刀剑乱舞 | D20: 攻击 | E20: 512 | F20: 金 | J20: 江湖 | K20: 对手 | L20: A0 | Q20: slash_eff | Y20: 2 | AB20: 1 | AD20: auto_action | AE20: 1000 | AF20: sk_attack_p | AG20: #-C0
A21: 23 | B21: 瞬间，攻击命中时使自身暴击率提升2回合 | C21: 乘胜追击 | D21: 增益 | E21: 142 | F21: 金 | J21: 江湖 | K21: 自身 | L21: A0 | AB21: 1 | AD21: on_hit | AE21: 1000 | AI21: 乘胜追击
A22: 25 | B22: 牺牲首个回合，使自身具备内力吸收能力 | C22: 七弦无形剑 | D22: 增益 | E22: 334 | F22: 水 | J22: 江湖 | K22: 自身 | L22: S4 | AB22: 1 | AD22: first_action | AE22: 1000 | AI22: 七弦无形剑
A23: 26 | B23: 牺牲首个回合，使自身及后方角色闪避率增加6回合 | C23: 踏雪无痕 | D23: 增益 | E23: 273 | F23: 木 | J23: 江湖 | K23: 自身 | L23: S4 | AB23: 2 | AC23: 向后 | AD23: first_action | AE23: 1000 | AI23: 踏雪无痕
A24: 27 | B24: 接招阶段，消耗内力抵消攻击伤害 | C24: 琴音缭绕 | D24: 增益 | E24: 404 | F24: 水 | J24: 江湖 | K24: 自身 | L24: A0 | AB24: 1 | AD24: on_defence | AE24: 1000 | AI24: 琴音缭绕
A25: 28 | B25: 被动，增加自身生命力上限 | C25: 丹霞仙体 | D25: 被动 | E25: 1043 | F25: 木 | J25: 江湖 | K25: 自身 | AB25: 1 | AF25: ch_max_hp_p | AG25: #S0
A26: 29 | B26: 收招阶段，为自身及后方角色回复生命 | C26: 起死回生 | D26: 气功 | E26: 123 | F26: 木 | J26: 江湖 | K26: 自身 | L26: A0 | V26: buff_up | AB26: 2 | AC26: 向后 | AD26: ending_turn | AE26: 1000 | AF26: ch_hp_p | AG26: #A0
A27: 30 | B27: 出招阶段，对对手造成大量伤害 | C27: 狂风刀法 | D27: 攻击 | E27: 512 | F27: 金 | J27: 江湖 | K27: 对手 | L27: A0 | Q27: bang_eff | AB27: 1 | AD27: auto_action | AE27: 1000 | AF27: sk_attack_v | AG27: A0
A28: 31 | B28: 收招阶段，增加自身暴击率2回合 | C28: 飞沙走石 | D28: 增益 | E28: 272 | F28: 金 | J28: 江湖 | K28: 自身 | L28: A0 | AB28: 1 | AD28: ending_turn | AE28: 1000 | AI28: 飞沙走石
A29: 32 | B29: 出招阶段，对3名对手造成伤害 | C29: 飘雪穿云掌 | D29: 攻击 | E29: 121 | F29: 火 | J29: 峨眉派 | K29: 对手 | L29: A0 | Q29: bang_eff | AB29: 3 | AC29: 向后 | AD29: auto_action | AE29: 1000 | AF29: sk_attack_p | AG29: #-C0
A30: 33 | B30: 接招阶段，使对方不能施展诅咒类招式 | C30: 佛光普照 | D30: 诅咒 | E30: 274 | F30: 水 | J30: 峨眉派 | K30: 对手 | L30: A0 | AB30: 1 | AD30: on_defence | AE30: 1000 | AI30: 诅咒不能
A31: 34 | B31: 被动，增加自身攻击力 | C31: 如影随形 | D31: 被动 | E31: 272 | F31: 金 | J31: 华山派 | K31: 自身 | L31: A0 | AB31: 1 | AF31: ch_attack_p | AG31: #A0
A32: 35 | B32: 牺牲首个回合，使后自身及后方角色获得生命回复能力6回合 | C32: 针灸术 | D32: 增益 | E32: 333 | F32: 木 | J32: 江湖 | K32: 自身 | L32: S4 | V32: buff_up | AB32: 2 | AC32: 向后 | AD32: first_action | AE32: 1000 | AI32: 针灸术
A33: 36 | B33: 牺牲首个回合，使自身及后方角色获得内力回复能力6回合 | C33: 正阳气场 | D33: 增益 | E33: 1043 | F33: 木 | J33: 大理段氏 | K33: 自身 | L33: S4 | V33: buff_up | AB33: 2 | AC33: 向后 | AD33: first_action | AE33: 1000 | AI33: 正阳气场
A34: 37 | B34: 瞬间，攻击命中时有几率为自身回复内力 | C34: 三阳开泰 | D34: 气功 | E34: 513 | F34: 木 | J34: 大理段氏 | K34: 自身 | L34: D0 | V34: buff_up | AB34: 1 | AD34: on_hit | AE34: 500 | AF34: ch_mp_p | AG34: #A0
A35: 38 | B35: 牺牲首个回合，使自身及后方角色防御力增加6回合 | C35: 以守为攻 | D35: 增益 | E35: 1043 | F35: 木 | J35: 大理段氏 | K35: 自身 | L35: S4 | AB35: 2 | AC35: 向后 | AD35: first_action | AE35: 1000 | AI35: 以守为攻
A36: 40 | B36: 收招阶段，为自身及后方角色增加防御力 | C36: 正气浩然 | D36: 增益 | E36: 403 | F36: 木 | J36: 大理段氏 | K36: 自身 | L36: C0 | AB36: 2 | AC36: 向后 | AD36: ending_turn | AE36: 1000 | AI36: 正气浩然
A37: 41 | B37: 瞬间，攻击命中时有几率为自身回复体力 | C37: 蟠龙纳新 | D37: 气功 | E37: 405 | F37: 土 | J37: 丐帮 | K37: 自身 | L37: A0 | V37: buff_up | AB37: 1 | AD37: on_hit | AE37: 500 | AF37: ch_sp_p | AG37: #A0
A38: 43 | B38: 起招阶段，增加自身攻击力 | C38: 断命刀法 | D38: 增益 | E38: 512 | F38: 金 | J38: 江湖 | K38: 自身 | L38: A0 | AB38: 1 | AD38: starting_turn | AE38: 1000 | AI38: 断命刀法
A39: 44 | B39: 收招阶段，增加自身攻击力2回合 | C39: 无恶不作 | D39: 增益 | E39: 402 | F39: 金 | J39: 江湖 | K39: 自身 | L39: A0 | AB39: 1 | AD39: ending_turn | AE39: 1000 | AI39: 无恶不作
A40: 45 | B40: 收招阶段，增加自身防御力 | C40: 粘衣十八跌 | D40: 增益 | E40: 1045 | F40: 土 | J40: 丐帮 | K40: 自身 | L40: A0 | AB40: 1 | AD40: ending_turn | AE40: 1000 | AI40: 粘衣十八跌
A41: 47 | B41: 瞬间，攻击命中时使自身攻击力提升2回合 | C41: 魅影重重 | D41: 增益 | E41: 272 | F41: 金 | J41: 江湖 | K41: 自身 | L41: A0 | AB41: 1 | AD41: on_hit | AE41: 1000 | AI41: 魅影重重
A42: 48 | B42: 收招阶段，为自身及后方角色增加攻击力 | C42: 大理剑诀 | D42: 增益 | E42: 333 | F42: 木 | J42: 大理段氏 | K42: 自身 | L42: C0 | AB42: 2 | AC42: 向后 | AD42: ending_turn | AE42: 1000 | AI42: 大理剑诀
A43: 49 | B43: 牺牲首个回合，使自身及后方角色攻击力增加6回合 | C43: 凌风剑气 | D43: 增益 | E43: 333 | F43: 木 | J43: 大理段氏 | K43: 自身 | L43: S4 | AB43: 2 | AC43: 向后 | AD43: first_action | AE43: 1000 | AI43: 凌风剑气
A44: 50 | B44: 瞬间，攻击丢失时使自身攻击力提升2回合 | C44: 凤舞修罗 | D44: 增益 | E44: 402 | F44: 金 | J44: 江湖 | K44: 自身 | L44: A0 | AB44: 1 | AD44: on_miss | AE44: 1000 | AI44: 凤舞修罗
A45: 51 | B45: 被动，增加自身攻击力 | C45: 炼毒术 | D45: 被动 | E45: 142 | F45: 金 | J45: 江湖 | K45: 自身 | AB45: 1 | AF45: ch_attack_p | AG45: #A0
A46: 52 | B46: 出招阶段，对2名对手造成伤害 | C46: 毒镖夺魂 | D46: 攻击 | E46: 620 | F46: 金 | J46: 江湖 | K46: 对手 | L46: A0 | Q46: bang_eff | AB46: 2 | AC46: 向后 | AD46: auto_action | AE46: 1000 | AF46: sk_attack_p | AG46: #-C0
A47: 54 | B47: 出招阶段，对2名对手造成伤害 | C47: 阴阳一掷 | D47: 攻击 | E47: 334 | F47: 水 | J47: 江湖 | K47: 对手 | L47: A0 | Q47: bang_eff | AB47: 2 | AC47: 向后 | AD47: auto_action | AE47: 1000 | AF47: sk_attack_p | AG47: #-C0
A48: 55 | B48: 瞬间，攻击丢失时使对手下回合不能闪避 | C48: 阴阳迷阵 | D48: 诅咒 | E48: 274 | F48: 水 | J48: 江湖 | K48: 对手 | L48: A0 | AB48: 1 | AD48: on_miss | AE48: 1000 | AI48: 闪避不能
A49: 57 | B49: 瞬间，闪避成功时回复自身内力 | C49: 慈航普度 | D49: 气功 | E49: 274 | F49: 水 | J49: 江湖 | K49: 自身 | L49: D0 | V49: buff_up | AB49: 1 | AD49: on_dodge | AE49: 1000 | AF49: ch_mp_p | AG49: #A0
A50: 58 | B50: 被动，回合开始后自身攻击力不断增加 | C50: 凶神恶煞 | D50: 被动 | E50: 142 | F50: 金 | J50: 江湖 | K50: 自身 | AB50: 1 | AF50: float_attack_p | AG50: #C0
A51: 59 | B51: 起招阶段，使对手不能够施展增益类招式 | C51: 玉虚无恨 | D51: 诅咒 | E51: 334 | F51: 水 | J51: 江湖 | K51: 对手 | L51: A0 | AB51: 1 | AD51: starting_turn | AE51: 1000 | AI51: 增益不能
A52: 60 | B52: 起招阶段，增加自身闪避率 | C52: 花谢五叶 | D52: 增益 | E52: 274 | F52: 水 | J52: 江湖 | K52: 自身 | L52: A0 | AB52: 1 | AD52: starting_turn | AE52: 1000 | AI52: 花谢五叶
A53: 61 | B53: 瞬间，闪避成功时使对手内力流失 | C53: 穷凶极恶 | D53: 气功 | E53: 144 | F53: 水 | J53: 江湖 | K53: 对手 | L53: A0 | V53: debuff | AB53: 1 | AD53: on_dodge | AE53: 1000 | AF53: ch_mp_p | AG53: #-A0
A54: 62 | B54: 瞬间，攻击命中时有几率使对方下回合不能命中 | C54: 铁爪无形 | D54: 诅咒 | E54: 144 | F54: 水 | J54: 江湖 | K54: 对手 | L54: A0 | AB54: 1 | AD54: on_hit | AE54: 300 | AI54: 命中不能
A55: 63 | B55: 起招阶段，增加自身防御力 | C55: 罗汉护体 | D55: 增益 | E55: 1045 | F55: 土 | J55: 少林寺 | K55: 自身 | L55: A0 | AB55: 1 | AD55: starting_turn | AE55: 1000 | AI55: 罗汉护体
A56: 64 | B56: 收招阶段，增加自身防御力 | C56: 铁布衫 | D56: 增益 | E56: 1045 | F56: 土 | J56: 少林寺 | K56: 自身 | L56: A0 | AB56: 1 | AD56: ending_turn | AE56: 1000 | AI56: 铁布衫
A57: 66 | B57: 瞬间，攻击命中时增加自身反击率 | C57: 慈悲刀法 | D57: 增益 | E57: 515 | F57: 土 | J57: 少林寺 | K57: 自身 | L57: A0 | AB57: 1 | AD57: on_hit | AE57: 1000 | AI57: 慈悲刀法
A58: 67 | B58: 起招阶段，增加自身反击率 | C58: 弥勒护身 | D58: 增益 | E58: 1045 | F58: 土 | J58: 少林寺 | K58: 自身 | L58: A0 | AB58: 1 | AD58: starting_turn | AE58: 1000 | AI58: 弥勒护身
A59: 68 | B59: 接招阶段，回复自身体力 | C59: 一拍两散 | D59: 气功 | E59: 125 | F59: 土 | J59: 少林寺 | K59: 自身 | L59: A0 | V59: buff_up | AB59: 1 | AD59: on_defence | AE59: 1000 | AF59: ch_sp_p | AG59: #C0
A60: 70 | B60: 出招阶段，对3名对手造成伤害 | C60: 一剑化三清 | D60: 攻击 | E60: 331 | F60: 火 | J60: 全真教 | K60: 对手 | L60: A0 | Q60: slash_eff | AB60: 3 | AC60: 向后 | AD60: auto_action | AE60: 1000 | AF60: sk_attack_p | AG60: #-C0
A61: 72 | B61: 瞬间，生命不足时自身攻击力大量提升 | C61: 哭丧棒法 | D61: 增益 | E61: 402 | F61: 金 | J61: 西域密宗 | K61: 自身 | L61: D0 | AB61: 1 | AD61: hp_not_enough | AE61: 1000 | AI61: 哭丧棒法
A62: 73 | B62: 出招阶段，对对手造成大量伤害 | C62: 散筋毒砂 | D62: 攻击 | E62: 272 | F62: 金 | J62: 西域密宗 | K62: 对手 | L62: A0 | Q62: bang_eff | AB62: 1 | AD62: auto_action | AE62: 1000 | AF62: sk_attack_v | AG62: A0
A63: 74 | B63: 瞬间，内力不足时自身攻击力大量提升 | C63: 瑜伽术 | D63: 增益 | E63: 1042 | F63: 金 | J63: 西域密宗 | K63: 自身 | L63: D0 | AB63: 1 | AD63: mp_not_enough | AE63: 1000 | AI63: 瑜伽术
A64: 75 | B64: 起招阶段，使对手生命流失 | C64: 神驼雪山掌 | D64: 气功 | E64: 122 | F64: 金 | J64: 西域密宗 | K64: 对手 | L64: A0 | V64: debuff | AB64: 1 | AD64: starting_turn | AE64: 1000 | AF64: ch_hp_v | AG64: -A0
A65: 78 | B65: 收招阶段，使对手攻击力下降 | C65: 云雾十三式 | D65: 诅咒 | E65: 401 | F65: 火 | J65: 衡山派 | K65: 对手 | L65: A0 | AB65: 1 | AD65: ending_turn | AE65: 1000 | AI65: 云雾十三式
A66: 79 | B66: 瞬间，攻击命中时使对手攻击力下降 | C66: 回风落雁剑 | D66: 诅咒 | E66: 331 | F66: 火 | J66: 衡山派 | K66: 对手 | L66: A0 | AB66: 1 | AD66: on_hit | AE66: 1000 | AI66: 回风落雁剑
A67: 80 | B67: 接招阶段，使对手攻击力下降 | C67: 五神剑 | D67: 诅咒 | E67: 331 | F67: 火 | J67: 衡山派 | K67: 对手 | L67: A0 | AB67: 1 | AD67: on_defence | AE67: 1000 | AI67: 五神剑
A68: 81 | B68: 被动，增加自身内力上限 | C68: 云影雾踪 | D68: 被动 | E68: 271 | F68: 火 | J68: 衡山派 | K68: 自身 | AB68: 1 | AF68: ch_max_mp_p | AG68: #S0
A69: 82 | B69: 牺牲首个回合，使自身及后方角色反击率增加6回合 | C69: 空手接刃 | D69: 增益 | E69: 123 | F69: 木 | J69: 姑苏慕容 | K69: 自身 | L69: S4 | AB69: 2 | AC69: 向后 | AD69: first_action | AE69: 1000 | AI69: 空手接刃
A70: 83 | B70: 接招阶段，反弹所受伤害 | C70: 借力返施 | D70: 增益 | E70: 143 | F70: 木 | J70: 姑苏慕容 | K70: 自身 | L70: A0 | AB70: 1 | AD70: on_defence | AE70: 1000 | AI70: 借力返施
A71: 84 | B71: 牺牲首个回合，使自身及后方角色获得体力回复能力6回合 | C71: 柳拂衣 | D71: 增益 | E71: 123 | F71: 木 | J71: 姑苏慕容 | K71: 自身 | L71: S4 | AB71: 2 | AC71: 向后 | AD71: first_action | AE71: 1000 | AI71: 柳拂衣
A72: 89 | B72: 接招阶段，为自身及后方角色回复体力 | C72: 流云袖 | D72: 气功 | E72: 403 | F72: 木 | J72: 姑苏慕容 | K72: 自身 | L72: A0 | V72: buff_up | AB72: 2 | AC72: 向后 | AD72: on_defence | AE72: 1000 | AF72: ch_sp_p | AG72: #B0
A73: 91 | B73: 接招阶段，使对方内力流失 | C73: 劈空掌 | D73: 气功 | E73: 124 | F73: 水 | J73: 桃花岛 | K73: 对手 | L73: A0 | V73: debuff | AB73: 1 | AD73: on_defence | AE73: 1000 | AF73: ch_mp_p | AG73: #-A0
A74: 92 | B74: 接招阶段，回复自身生命 | C74: 春光四沐 | D74: 气功 | E74: 273 | F74: 木 | J74: 江湖 | K74: 自身 | L74: A0 | V74: buff_up | AB74: 1 | AD74: on_defence | AE74: 1000 | AF74: ch_hp_p | AG74: #A0
A75: 93 | B75: 接招阶段，为自身及后方角色回复生命 | C75: 仪光道霞 | D75: 气功 | E75: 273 | F75: 木 | J75: 恒山派 | K75: 自身 | L75: A0 | V75: buff_up | AB75: 2 | AC75: 向后 | AD75: on_defence | AE75: 1000 | AF75: ch_hp_p | AG75: #A0
A76: 94 | B76: 收招阶段，为自身及后方角色增加防御力 | C76: 御剑势 | D76: 增益 | E76: 333 | F76: 木 | J76: 恒山派 | K76: 自身 | L76: A0 | AB76: 2 | AC76: 向后 | AD76: ending_turn | AE76: 1000 | AI76: 御剑势
A77: 98 | B77: 瞬间，攻击命中时使对手下回合不能施展增益类招式 | C77: 障眼法 | D77: 诅咒 | E77: 404 | F77: 水 | J77: 江湖 | K77: 对手 | L77: A0 | AB77: 1 | AD77: on_hit | AE77: 1000 | AI77: 障眼法
A78: 99 | B78: 出招阶段，对2名对手造成伤害 | C78: 釜底抽薪 | D78: 攻击 | E78: 144 | F78: 水 | J78: 江湖 | K78: 对手 | L78: A0 | Q78: bang_eff | AB78: 2 | AC78: 向后 | AD78: auto_action | AE78: 1000 | AF78: sk_attack_p | AG78: #-C0
A79: 101 | B79: 接招阶段，为自身及后方角色增加反击率 | C79: 天罡正气 | D79: 增益 | E79: 403 | F79: 木 | J79: 大理段氏 | K79: 自身 | L79: A0 | AB79: 2 | AC79: 向后 | AD79: on_defence | AE79: 1000 | AI79: 天罡正气
A80: 102 | B80: 瞬间，攻击命中时有几率为自身回复内力 | C80: 静影沉璧 | D80: 气功 | E80: 1043 | F80: 木 | J80: 大理段氏 | K80: 自身 | L80: D0 | V80: buff_up | AB80: 1 | AD80: on_hit | AE80: 500 | AF80: ch_mp_p | AG80: #A0
A81: 105 | B81: 被动，增加自身体力上限 | C81: 川流不息 | D81: 被动 | E81: 275 | F81: 土 | J81: 江湖 | K81: 自身 | AB81: 1 | AF81: ch_max_sp_p | AG81: #S0
A82: 106 | B82: 瞬间，攻击命中时有几率使对手攻击力下降3回合 | C82: 五气朝元 | D82: 诅咒 | E82: 141 | F82: 火 | J82: 全真教 | K82: 对手 | L82: A0 | AB82: 3 | AC82: 向后 | AD82: on_hit | AE82: 300 | AI82: 五气朝元
A83: 107 | B83: 瞬间，生命不足时使对方防御力下降 | C83: 散气功 | D83: 诅咒 | E83: 121 | F83: 火 | J83: 全真教 | K83: 对手 | L83: A0 | AB83: 1 | AD83: hp_not_enough | AE83: 1000 | AI83: 散气功
A84: 108 | B84: 接招阶段，有几率使对手生命流失3回合 | C84: 玉碎昆冈 | D84: 诅咒 | E84: 401 | F84: 火 | J84: 明教 | K84: 对手 | L84: A0 | AB84: 1 | AD84: on_defence | AE84: 500 | AI84: 玉碎昆冈
A85: 109 | B85: 瞬间，攻击命中时有几率使对手生命流失3回合 | C85: 金针渡劫 | D85: 诅咒 | E85: 331 | F85: 火 | J85: 明教 | K85: 对手 | L85: A0 | AB85: 1 | AD85: on_hit | AE85: 500 | AI85: 金针渡劫
A86: 110 | B86: 被动，增加自身内力上限 | C86: 圣火心法 | D86: 被动 | E86: 401 | F86: 火 | J86: 明教 | K86: 自身 | AF86: ch_max_mp_p | AG86: #S0
A87: 111 | B87: 瞬间，战败时使对方所有角色生命流失 | C87: 天地同寿 | D87: 气功 | E87: 141 | F87: 火 | J87: 明教 | K87: 对手 | L87: D0 | V87: debuff | AB87: 5 | AC87: 向后 | AD87: on_lose | AE87: 1000 | AF87: ch_hp_v | AG87: -A0
A88: 113 | B88: 瞬间，生命不足时使对方所有角色防御力下降 | C88: 天网恢恢 | D88: 诅咒 | E88: 271 | F88: 火 | J88: 江湖 | K88: 对手 | L88: D0 | AB88: 5 | AC88: 向后 | AD88: hp_not_enough | AE88: 1000 | AI88: 天网恢恢
A89: 114 | B89: 牺牲首个回合，使对手防御力不断下降 | C89: 布袋束体 | D89: 诅咒 | E89: 1041 | F89: 火 | J89: 江湖 | K89: 对手 | L89: S4 | AB89: 1 | AD89: first_action | AE89: 1000 | AI89: 布袋束体
A90: 115 | B90: 牺牲首个回合，使对手攻击力不断下降 | C90: 八卦之术 | D90: 诅咒 | E90: 271 | F90: 火 | J90: 西域密宗 | K90: 对手 | L90: S4 | AB90: 1 | AD90: first_action | AE90: 1000 | AI90: 八卦之术
A91: 116 | B91: 瞬间，生命不足时使对方所有角色攻击力下降 | C91: 坐地求全 | D91: 诅咒 | E91: 511 | F91: 火 | J91: 江湖 | K91: 对手 | L91: D0 | AB91: 5 | AC91: 向后 | AD91: hp_not_enough | AE91: 1000 | AI91: 坐地求全
A92: 117 | B92: 接招阶段，为自身及后方角色回复生命 | C92: 九转丹成 | D92: 气功 | E92: 403 | F92: 木 | J92: 武当派 | K92: 自身 | L92: A0 | V92: buff_up | AB92: 1 | AD92: on_defence | AE92: 1000 | AF92: ch_hp_p | AG92: #A0
A93: 120 | B93: 瞬间，体力不足时增加自身闪避率 | C93: 梯云纵 | D93: 增益 | E93: 275 | F93: 土 | J93: 武当派 | K93: 自身 | L93: A0 | AB93: 1 | AD93: sp_not_enough | AE93: 1000 | AI93: 梯云纵
A94: 121 | B94: 牺牲首个回合，使自身反击率不断增加 | C94: 太极剑法 | D94: 增益 | E94: 334 | F94: 土 | J94: 武当派 | K94: 自身 | L94: S4 | AB94: 1 | AD94: first_action | AE94: 1000 | AI94: 太极剑法
A95: 122 | B95: 出招阶段，对对手造成大量伤害 | C95: 飞燕穿柳 | D95: 攻击 | E95: 402 | F95: 金 | J95: 江湖 | K95: 对手 | L95: A0 | Q95: slash_eff | AB95: 1 | AD95: auto_action | AE95: 1000 | AF95: sk_attack_v | AG95: A0
A96: 123 | B96: 接招阶段，增加自身防御力 | C96: 花开见佛 | D96: 增益 | E96: 1042 | F96: 土 | J96: 江湖 | K96: 自身 | L96: A0 | AB96: 1 | AD96: on_defence | AE96: 1000 | AI96: 花开见佛
A97: 125 | B97: 被动，增加自身攻击力 | C97: 紫气东来 | D97: 被动 | E97: 272 | F97: 金 | J97: 江湖 | K97: 自身 | AF97: ch_attack_p | AG97: #A0
A98: 126 | B98: 瞬间，生命不足时使对手生命流失 | C98: 无影幻脚 | D98: 气功 | E98: 170 | F98: 金 | J98: 青城派 | K98: 对手 | L98: D0 | V98: debuff | AB98: 1 | AD98: hp_not_enough | AE98: 1000 | AF98: ch_hp_v | AG98: -S4
A99: 127 | B99: 接招阶段，使对手生命流失 | C99: 青城飞脸 | D99: 气功 | E99: 1030 | F99: 金 | J99: 青城派 | K99: 对手 | L99: A0 | V99: debuff | AB99: 1 | AD99: on_defence | AE99: 1000 | AF99: ch_hp_v | AG99: -A0
A100: 128 | B100: 瞬间，内力不足时使对手生命流失 | C100: 青城鬼烟 | D100: 气功 | E100: 272 | F100: 金 | J100: 青城派 | K100: 对手 | L100: D0 | V100: debuff | AB100: 1 | AD100: mp_not_enough | AE100: 1000 | AF100: ch_hp_v | AG100: -S4
A101: 130 | B101: 收招阶段，使对方不能施展诅咒类招式 | C101: 星宿毒镖 | D101: 诅咒 | E101: 274 | F101: 水 | J101: 星宿派 | K101: 对手 | L101: A0 | AB101: 1 | AD101: on_defence | AE101: 1000 | AI101: 诅咒不能
A102: 132 | B102: 收招阶段，为自身及后方角色增加闪避率 | C102: 马踏飞燕 | D102: 增益 | E102: 273 | F102: 木 | J102: 江湖 | K102: 自身 | L102: A0 | AB102: 2 | AC102: 向后 | AD102: ending_turn | AE102: 1000 | AI102: 马踏飞燕
A103: 136 | B103: 出招阶段，对2名对手造成伤害 | C103: 一箭双雕 | D103: 攻击 | E103: 333 | F103: 金 | J103: 西域密宗 | K103: 对手 | L103: A0 | Q103: bang_eff | AB103: 2 | AC103: 向后 | AD103: auto_action | AE103: 1000 | AF103: sk_attack_p | AG103: #-C0
A104: 142 | B104: 瞬间，体力不足时反弹所受伤害 | C104: 亢龙有悔 | D104: 增益 | E104: 405 | F104: 土 | J104: 丐帮 | K104: 自身 | L104: A0 | AB104: 1 | AD104: sp_not_enough | AE104: 1000 | AI104: 亢龙有悔
A105: 145 | B105: 瞬间，攻击命中时有几率使对方下回合不能命中 | C105: 秤钩束体 | D105: 诅咒 | E105: 170 | F105: 水 | J105: 江湖 | K105: 对手 | L105: A0 | AB105: 1 | AD105: on_hit | AE105: 300 | AI105: 命中不能
A106: 147 | B106: 起招阶段，增加自身攻击力 | C106: 华山剑法 | D106: 增益 | E106: 334 | F106: 金 | J106: 华山派 | K106: 自身 | L106: A0 | AB106: 1 | AD106: starting_turn | AE106: 1000 | AI106: 剑法精妙
A107: 148 | B107: 瞬间，攻击命中时有几率为自身提升反击率 | C107: 龙盘斗里 | D107: 增益 | E107: 275 | F107: 土 | J107: 江湖 | K107: 自身 | L107: A0 | AB107: 1 | AD107: on_hit | AE107: 300 | AI107: 龙盘斗里
A108: 151 | B108: 收招阶段，使对手不能够施展增益类招式 | C108: 蝎尾针 | D108: 诅咒 | E108: 273 | F108: 水 | J108: 星宿派 | K108: 对手 | L108: A0 | AB108: 1 | AD108: ending_turn | AE108: 1000 | AI108: 增益不能
A109: 158 | B109: 收招阶段，增加自身反击率 | C109: 礼敬如来 | D109: 增益 | E109: 125 | F109: 土 | J109: 少林寺 | K109: 自身 | L109: A0 | AB109: 1 | AD109: ending_turn | AE109: 1000 | AI109: 礼敬如来
A110: 162 | B110: 牺牲首个回合，使对手攻击力不断下降 | C110: 阴阳倒乱 | D110: 诅咒 | E110: 271 | F110: 火 | J110: 江湖 | K110: 对手 | L110: S4 | AB110: 1 | AD110: first_action | AE110: 1000 | AI110: 阴阳倒乱
A111: 163 | B111: 出招阶段，对2名对手造成伤害 | C111: 蚀肉掌 | D111: 攻击 | E111: 121 | F111: 火 | J111: 峨眉派 | K111: 对手 | L111: A0 | Q111: bang_eff | AB111: 2 | AC111: 向后 | AD111: auto_action | AE111: 1000 | AF111: sk_attack_p | AG111: #-C0
A112: 164 | B112: 牺牲首个回合，使对手防御力不断下降 | C112: 飞凤爪 | D112: 诅咒 | E112: 141 | F112: 火 | J112: 江湖 | K112: 对手 | L112: S4 | AB112: 1 | AD112: first_action | AE112: 1000 | AI112: 飞凤爪
A113: 166 | B113: 瞬间，攻击命中时有几率回复自身生命 | C113: 百炼印 | D113: 增益 | E113: 123 | F113: 木 | J113: 江湖 | K113: 自身 | L113: A0 | AB113: 1 | AD113: on_hit | AE113: 1000 | AI113: 百炼印
A114: 168 | B114: 牺牲首个回合，使自身具备内力吸收能力 | C114: 断空追魂 | D114: 增益 | E114: 260 | F114: 水 | J114: 江湖 | K114: 自身 | L114: S4 | AB114: 1 | AD114: first_action | AE114: 1000 | AI114: 断空追魂
A115: 169 | B115: 出招阶段，使对方内力流失 | C115: 断魂吟 | D115: 气功 | E115: 271 | F115: 水 | J115: 江湖 | K115: 对手 | L115: A0 | V115: debuff | AB115: 1 | AD115: auto_action | AE115: 1000 | AF115: ch_mp_p | AG115: #-A0
A116: 174 | B116: 出招阶段，对2名对手造成伤害 | C116: 伏魔杖法 | D116: 攻击 | E116: 405 | F116: 水 | J116: 丐帮 | K116: 对手 | L116: A0 | Q116: bang_eff | AB116: 2 | AC116: 向后 | AD116: auto_action | AE116: 1000 | AF116: sk_attack_p | AG116: #-C0
A117: 175 | B117: 瞬间，攻击丢失时使对手下回合不能闪避 | C117: 听风辨位 | D117: 诅咒 | E117: 620 | F117: 水 | J117: 江湖 | K117: 对手 | L117: A0 | AB117: 1 | AD117: on_miss | AE117: 1000 | AI117: 闪避不能
A118: 176 | B118: 出招阶段，使对方内力流失 | C118: 空空拳 | D118: 气功 | E118: 134 | F118: 水 | J118: 江湖 | K118: 对手 | L118: A0 | V118: debuff | AB118: 1 | AD118: auto_action | AE118: 1000 | AF118: ch_mp_p | AG118: #-A0
A119: 180 | B119: 接招阶段，消耗内力抵消攻击伤害 | C119: 梵海劲 | D119: 增益 | E119: 420 | F119: 水 | J119: 江湖 | K119: 自身 | L119: A0 | AB119: 1 | AD119: on_defence | AE119: 1000 | AI119: 梵海劲
A120: 189 | B120: 收招阶段，增加闪避率 | C120: 销声匿迹 | D120: 增益 | E120: 275 | F120: 土 | J120: 江湖 | K120: 自身 | L120: B0 | AB120: 1 | AD120: ending_turn | AE120: 1000 | AI120: 销声匿迹
A121: 191 | B121: 被动，增加自身防御力 | C121: 不动如山 | D121: 被动 | E121: 280 | F121: 土 | J121: 丐帮 | K121: 自身 | AB121: 1 | AF121: ch_defence_p | AG121: #A0
A122: 196 | B122: 被动，回合开始后自身攻击力不断增加 | C122: 明镜止水 | D122: 被动 | E122: 1044 | F122: 水 | J122: 江湖 | K122: 自身 | AB122: 1 | AF122: float_attack_p | AG122: #C0
A123: 240 | B123: 接招阶段，对对手造成大量伤害 | C123: 剑走偏锋 | D123: 攻击 | E123: 332 | F123: 金 | J123: 华山派 | K123: 对手 | L123: A0 | Q123: slash_eff | AB123: 1 | AD123: on_defence | AE123: 1000 | AF123: sk_attack_v | AG123: A0
A124: 241 | B124: 起招阶段，增加自身攻击力 | C124: 异筋法 | D124: 增益 | E124: 272 | F124: 金 | J124: 江湖 | K124: 自身 | L124: A0 | AB124: 1 | AD124: starting_turn | AE124: 1000 | AI124: 异筋法
A125: 242 | B125: 出招阶段，对对手造成大量伤害 | C125: 夺魂爪 | D125: 攻击 | E125: 142 | F125: 金 | J125: 江湖 | K125: 对手 | L125: A0 | Q125: slash_eff | AB125: 1 | AD125: auto_action | AE125: 1000 | AF125: sk_attack_v | AG125: A0
A126: 243 | B126: 接招阶段，增加自身防御力 | C126: 无相霸术 | D126: 增益 | E126: 1042 | F126: 金 | J126: 江湖 | K126: 自身 | L126: A0 | AB126: 1 | AD126: on_defence | AE126: 1000 | AI126: 无相霸术
A127: 244 | B127: 出招阶段，对对手造成大量伤害 | C127: 玄武破 | D127: 攻击 | E127: 142 | F127: 金 | J127: 江湖 | K127: 对手 | L127: A0 | Q127: bang_eff | AB127: 1 | AD127: auto_action | AE127: 1000 | AF127: sk_attack_v | AG127: A0
A128: 245 | B128: 瞬间，攻击命中时使对手生命流失 | C128: 灵蛇出洞 | D128: 气功 | E128: 402 | F128: 金 | J128: 江湖 | K128: 对手 | L128: A0 | V128: debuff | AB128: 1 | AD128: on_hit | AE128: 1000 | AF128: ch_hp_v | AG128: -A0
A129: 246 | B129: 瞬间，攻击丢失时使对手生命流失 | C129: 灵蛇穿心 | D129: 气功 | E129: 142 | F129: 金 | J129: 江湖 | K129: 对手 | L129: A0 | V129: debuff | AB129: 1 | AD129: on_miss | AE129: 1000 | AF129: ch_hp_v | AG129: -A0
A130: 247 | B130: 瞬间，攻击命中时有几率发动额外攻击 | C130: 辟邪快剑 | D130: 攻击 | E130: 332 | F130: 金 | J130: 江湖 | K130: 对手 | L130: A0 | Q130: slash_eff | AB130: 1 | AD130: on_hit | AE130: 500 | AF130: sk_attack_v | AG130: A0
A131: 248 | B131: 接招阶段，有几率对对手造成大量伤害 | C131: 疾光剑影 | D131: 攻击 | E131: 332 | F131: 金 | J131: 江湖 | K131: 对手 | L131: A0 | Q131: slash_eff | AB131: 1 | AD131: on_defence | AE131: 1000 | AF131: sk_attack_v | AG131: A0
A132: 249 | B132: 瞬间，体力不足时使对手生命流失 | C132: 无影幻掌 | D132: 气功 | E132: 122 | F132: 金 | J132: 青城派 | K132: 对手 | L132: D0 | V132: debuff | AB132: 1 | AD132: sp_not_enough | AE132: 1000 | AF132: ch_hp_v | AG132: -S4
A133: 250 | B133: 接招阶段，为自身及后方角色回复内力 | C133: 以退为进 | D133: 气功 | E133: 273 | F133: 木 | J133: 大理段氏 | K133: 自身 | L133: C0 | V133: buff_up | AB133: 2 | AC133: 向后 | AD133: on_defence | AE133: 1000 | AF133: ch_mp_p | AG133: #A0
A134: 251 | B134: 牺牲首个回合，使自身及后方角色获得生命抵挡攻击能力6回合 | C134: 刻骨步 | D134: 增益 | E134: 273 | F134: 木 | J134: 姑苏慕容 | K134: 自身 | L134: S4 | AB134: 2 | AC134: 向后 | AD134: first_action | AE134: 1000 | AI134: 刻骨步
A135: 252 | B135: 接招阶段，消耗固定生命抵挡对手的攻击 | C135: 无定手 | D135: 增益 | E135: 123 | F135: 木 | J135: 姑苏慕容 | K135: 自身 | L135: A0 | AB135: 1 | AD135: on_defence | AE135: 1000 | AI135: 血气护体
A136: 253 | B136: 瞬间，攻击命中时有几率回复自身内力 | C136: 残阳势 | D136: 气功 | E136: 143 | F136: 木 | J136: 姑苏慕容 | K136: 自身 | L136: D0 | AB136: 1 | AD136: on_hit | AE136: 500 | AF136: ch_mp_p | AG136: #B0
A137: 254 | B137: 牺牲首个回合，使自身及后方角色暴击率增加6回合 | C137: 落日势 | D137: 增益 | E137: 123 | F137: 木 | J137: 姑苏慕容 | K137: 自身 | L137: S4 | AB137: 2 | AC137: 向后 | AD137: first_action | AE137: 1000 | AI137: 落日势
A138: 255 | B138: 被动，增加自身内力上限 | C138: 气聚丹田 | D138: 被动 | E138: 1044 | F138: 水 | J138: 江湖 | K138: 自身 | AB138: 1 | AF138: ch_max_mp_p | AG138: #S0
A139: 256 | B139: 收招阶段，增加自身闪避率 | C139: 飞鹤步法 | D139: 增益 | E139: 274 | F139: 水 | J139: 江湖 | K139: 自身 | L139: A0 | AB139: 1 | AD139: ending_turn | AE139: 1000 | AI139: 飞鹤步法
A140: 257 | B140: 瞬间，战胜时为自身回复内力 | C140: 噬魂归心 | D140: 气功 | E140: 514 | F140: 水 | J140: 江湖 | K140: 自身 | L140: D0 | V140: buff_up | AB140: 1 | AD140: on_win | AE140: 1000 | AF140: ch_mp_p | AG140: #S1
A141: 258 | B141: 瞬间，战败时使对方所有角色丧失闪避能力 | C141: 剧毒驼峰 | D141: 诅咒 | E141: 1044 | F141: 水 | J141: 江湖 | K141: 对手 | L141: D0 | AB141: 5 | AC141: 向后 | AD141: on_lose | AE141: 1000 | AI141: 剧毒驼峰
A142: 259 | B142: 牺牲首个回合，使自身反击率不断增加 | C142: 弥勒在心 | D142: 增益 | E142: 405 | F142: 土 | J142: 少林寺 | K142: 自身 | L142: S4 | AB142: 1 | AD142: first_action | AE142: 1000 | AI142: 弥勒在心
A143: 260 | B143: 牺牲首个回合，使自身防御力不断增加 | C143: 金钟罩 | D143: 增益 | E143: 1045 | F143: 土 | J143: 少林寺 | K143: 自身 | L143: S4 | AB143: 1 | AD143: first_action | AE143: 1000 | AI143: 金钟罩
A144: 261 | B144: 被动，增加自身闪避率 | C144: 蹑云逐月 | D144: 被动 | E144: 275 | F144: 土 | J144: 江湖 | K144: 自身 | AB144: 1 | AF144: ch_dodge_p | AG144: #A0
A145: 262 | B145: 牺牲首个回合，使自身闪避率不断增加 | C145: 扶摇直上 | D145: 增益 | E145: 275 | F145: 土 | J145: 江湖 | K145: 自身 | L145: S4 | AB145: 1 | AD145: first_action | AE145: 1000 | AI145: 扶摇直上
A146: 263 | B146: 瞬间，闪避成功时为自身回复内力 | C146: 四象归心 | D146: 气功 | E146: 405 | F146: 土 | J146: 武当派 | K146: 自身 | L146: D0 | V146: buff_up | AB146: 1 | AD146: on_dodge | AE146: 1000 | AF146: ch_mp_p | AG146: #A0
A147: 264 | B147: 接招阶段，增加自身反击率 | C147: 无影蝎毒 | D147: 增益 | E147: 275 | F147: 土 | J147: 丐帮 | K147: 自身 | L147: A0 | AB147: 1 | AD147: on_defence | AE147: 1000 | AI147: 无影蝎毒
A148: 265 | B148: 牺牲首个回合，使自身具备生命吸收能力 | C148: 嗜命归元 | D148: 增益 | E148: 141 | F148: 火 | J148: 江湖 | K148: 自身 | L148: S4 | AB148: 1 | AD148: first_action | AE148: 1000 | AI148: 嗜命归元
A149: 269 | B149: 起招阶段，几率使自身具备生命吸收能力持续3回合 | C149: 阎王追命 | D149: 增益 | E149: 141 | F149: 火 | J149: 江湖 | K149: 自身 | L149: A0 | AB149: 1 | AD149: starting_turn | AE149: 300 | AI149: 阎王追命
A150: 266 | B150: 瞬间，攻击命中时有几率使对手防御力下降3回合 | C150: 灭绝剑气 | D150: 诅咒 | E150: 331 | F150: 火 | J150: 江湖 | K150: 对手 | L150: A0 | AB150: 3 | AC150: 向后 | AD150: on_hit | AE150: 300 | AI150: 灭绝剑气
A151: 267 | B151: 瞬间，攻击命中时有几率使对手生命流失3回合 | C151: 三清灌体 | D151: 诅咒 | E151: 511 | F151: 火 | J151: 华山派 | K151: 对手 | L151: A0 | AB151: 3 | AC151: 向后 | AD151: on_hit | AE151: 300 | AI151: 三清灌体
A152: 268 | B152: 接招阶段，对3名对手造成伤害 | C152: 三清化一剑 | D152: 攻击 | E152: 401 | F152: 火 | J152: 华山派 | K152: 对手 | L152: A0 | AB152: 3 | AC152: 向后 | AD152: on_defence | AE152: 1000 | AF152: sk_attack_p | AG152: #-C0
A153: 131 | B153: 起招阶段，使对手不能够施展增益类招式 | C153: 青蛇毒掌 | D153: 诅咒 | E153: 143 | F153: 水 | J153: 星宿派 | K153: 对手 | L153: A0 | AB153: 1 | AD153: starting_turn | AE153: 1000 | AI153: 增益不能
A154: 1240 | B154: 收招阶段，使对手生命流失 | C154: 灵蛇入洞 | D154: 气功 | E154: 401 | F154: 火 | J154: 西域密宗 | K154: 对手 | L154: D0 | AB154: 1 | AD154: ending_turn | AE154: 1000 | AF154: ch_hp_v | AG154: #-S4
A155: 1241 | B155: 出招阶段，对5名对手造成伤害 | C155: 漫天蛇影 | D155: 攻击 | E155: 1041 | F155: 火 | J155: 西域密宗 | K155: 对手 | L155: D0 | Q155: bang_eff | AB155: 5 | AC155: 向后 | AD155: auto_action | AE155: 1000 | AF155: sk_attack_v | AG155: D0
A156: 1076 | B156: 被动，诅咒免疫 | C156: 蛤蟆功 | D156: 被动 | E156: 1043 | F156: 水 | J156: 西域密宗 | K156: 自身 | AB156: 1 | AF156: cant_curse

Sheet: 状态配置表
A1: 状态ID | B1: 杀伤 | C1: 状态名 | D1: 图标 | E1: 状态类型 | F1: 持续时间 | G1: 状态动作 | H1: 状态特效 | I1: 状态声音 | J1: 播放时间 | K1: 魔法属性ID | L1: 魔法属性效果 | M1: 魔法属性参数
A2: id | B2: power | C2: name | D2: icon | E2: type | F2: duration | G2: buff_action | H2: buff_effect | I2: buff_sound | J2: delay | K2: magic_id | L2: !magic_eff | M2: magic_params
A3: keguwuding | C3: 血气护体 | D3: 1040 | E3: 增益 | F3: 2 | H3: buff_up | K3: cancel_damage_cost_hp_v | L3: A0
A4: qinyinliaorao | C4: 琴音缭绕 | D4: 1040 | E4: 增益 | F4: 1 | H4: buff_up | K4: cancel_damage_cost_mp_v | L4: A0
A5: baihexiangkong | C5: 白鹤翔空 | D5: 1040 | E5: 增益 | F5: 1 | H5: buff_up | K5: cancel_damage_cost_sp_v | L5: B0
A6: yinyangmizhen | C6: 闪避不能 | D6: 9982 | E6: 诅咒 | F6: 2 | H6: debuff | K6: cant_dodge
A7: judutuofeng | C7: 剧毒驼峰 | D7: 9982 | E7: 诅咒 | F7: -1 | H7: debuff | K7: cant_dodge
A8: mingzhongbuneng | C8: 命中不能 | D8: 9999 | E8: 诅咒 | F8: 2 | H8: debuff | K8: cant_hit
A9: zuzhoubuneng | C9: 诅咒不能 | D9: 9999 | E9: 诅咒 | F9: 2 | H9: debuff | K9: cant_perform_curse
A10: zengyibuneng | C10: 增益不能 | D10: 9999 | E10: 诅咒 | F10: 2 | H10: debuff | K10: cant_perform_gain
A11: zhangyanfa | C11: 障眼法 | D11: 9999 | E11: 诅咒 | F11: 2 | H11: debuff | K11: cant_perform_gain
A12: yunvjianshi | C12: 玉女剑式 | D12: 9992 | E12: 增益 | F12: 2 | H12: buff_up | K12: ch_attack_p | L12: #C0
A13: yijinfa | C13: 异筋法 | D13: 9992 | E13: 增益 | F13: 1 | H13: buff_up | K13: ch_attack_p | L13: #C0
A14: meiyingchongchong | C14: 魅影重重 | D14: 9992 | E14: 增益 | F14: 2 | H14: buff_up | K14: ch_attack_p | L14: #C0
A15: fengwuxiuluo | C15: 凤舞修罗 | D15: 9992 | E15: 增益 | F15: 2 | H15: buff_up | K15: ch_attack_p | L15: #C0
A16: duanmingdaofa | C16: 断命刀法 | D16: 9992 | E16: 增益 | F16: 1 | H16: buff_up | K16: ch_attack_p | L16: #C0
A17: wuebuzuo | C17: 无恶不作 | D17: 9992 | E17: 增益 | F17: 2 | H17: buff_up | K17: ch_attack_p | L17: #C0
A18: kusangbangfa | C18: 哭丧棒法 | D18: 9992 | E18: 增益 | F18: -1 | H18: buff_up | K18: ch_attack_p | L18: #S4
A19: yujiashu | C19: 瑜伽术 | D19: 9992 | E19: 增益 | F19: -1 | H19: buff_up | K19: ch_attack_p | L19: #S4
A20: dalijianjue | C20: 大理剑诀 | D20: 9992 | E20: 增益 | F20: 2 | H20: buff_up | K20: ch_attack_p | L20: #C0
A21: lingfengjianqi | C21: 凌风剑气 | D21: 9992 | E21: 增益 | F21: 6 | H21: buff_up | K21: ch_attack_p | L21: #C0
A22: yunwushisanshi | C22: 云雾十三式 | D22: 9990 | E22: 诅咒 | F22: 1 | H22: debuff | K22: ch_attack_v | L22: -B0
A23: huifengluoyejian | C23: 回风落雁剑 | D23: 9990 | E23: 诅咒 | F23: 1 | H23: debuff | K23: ch_attack_v | L23: -B0
A24: wushenjian | C24: 五神剑 | D24: 9990 | E24: 诅咒 | F24: 1 | H24: debuff | K24: ch_attack_v | L24: -B0
A25: zuodiqiuquan | C25: 坐地求全 | D25: 9990 | E25: 诅咒 | F25: -1 | H25: debuff | K25: ch_attack_v | L25: -C0
A26: wuqizhaoyuan | C26: 五气朝元 | D26: 9990 | E26: 诅咒 | F26: 3 | H26: debuff | K26: ch_attack_v | L26: -C0
A27: sanqigong | C27: 散气功 | D27: 9991 | E27: 诅咒 | F27: 3 | H27: debuff | K27: ch_attack_p | L27: #-S4
A28: kongshoujieren | C28: 空手接刃 | D28: 9995 | E28: 增益 | F28: 6 | H28: buff_up | K28: ch_counter_p | L28: #A0
A29: jielifanshi | C29: 借力返施 | D29: 9995 | E29: 增益 | F29: 1 | H29: buff_up | K29: rebound_hp_p | L29: #A0
A30: tiangangzhengqi | C30: 天罡正气 | D30: 9995 | E30: 增益 | F30: 2 | H30: buff_up | K30: ch_counter_p | L30: #A0
A31: lijingrulai | C31: 礼敬如来 | D31: 9995 | E31: 增益 | F31: 2 | H31: buff_up | K31: ch_counter_p | L31: #A0
A32: milehushen | C32: 弥勒护身 | D32: 9995 | E32: 增益 | F32: 2 | H32: buff_up | K32: ch_counter_p | L32: #A0
A33: cibeidaofa | C33: 慈悲刀法 | D33: 9995 | E33: 增益 | F33: 2 | H33: buff_up | K33: ch_counter_p | L33: #A0
A34: wuyingxiedu | C34: 无影蝎毒 | D34: 9995 | E34: 增益 | F34: 1 | H34: buff_up | K34: ch_counter_p | L34: #A0
A35: hanbingzhenqi | C35: 寒冰真气 | D35: 9995 | E35: 增益 | F35: 1 | H35: buff_up | K35: ch_counter_p | L35: #A0
A36: songyangjianfa | C36: 嵩阳剑法 | D36: 9995 | E36: 增益 | F36: 2 | H36: buff_up | K36: ch_counter_p | L36: #A0
A37: tiezhangsuishi | C37: 铁掌碎石 | D37: 9994 | E37: 增益 | F37: 2 | H37: buff_up | K37: ch_crit_p | L37: #A0
A38: chengshengzhuiji | C38: 乘胜追击 | D38: 9994 | E38: 增益 | F38: 2 | H38: buff_up | K38: ch_crit_p | L38: #A0
A39: feishazoushi | C39: 飞沙走石 | D39: 9994 | E39: 增益 | F39: 2 | H39: buff_up | K39: ch_crit_p | L39: #A0
A40: canyangshi | C40: 残阳势 | D40: 9994 | E40: 增益 | F40: 2 | H40: buff_up | K40: ch_crit_p | L40: #A0
A41: luorishi | C41: 落日势 | D41: 9994 | E41: 增益 | F41: 6 | H41: buff_up | K41: ch_crit_p | L41: #A0
A42: wuxiangbashu | C42: 无相霸术 | D42: 9993 | E42: 增益 | F42: 2 | H42: buff_up | K42: ch_defence_p | L42: #B0
A43: yigongweishou | C43: 以守为攻 | D43: 9993 | E43: 增益 | F43: 6 | H43: buff_up | K43: ch_defence_p | L43: #B0
A44: zhengqihaoran | C44: 正气浩然 | D44: 9993 | E44: 增益 | F44: 2 | H44: buff_up | K44: ch_defence_p | L44: #B0
A45: yujianshi | C45: 御剑势 | D45: 9993 | E45: 增益 | F45: 2 | H45: buff_up | K45: ch_defence_p | L45: #B0
A46: luohanhuti | C46: 罗汉护体 | D46: 9993 | E46: 增益 | F46: 2 | H46: buff_up | K46: ch_defence_p | L46: #B0
A47: tiebushan | C47: 铁布衫 | D47: 9993 | E47: 增益 | F47: 1 | H47: buff_up | K47: ch_defence_p | L47: #B0
A48: nianyishibadie | C48: 粘衣十八跌 | D48: 9993 | E48: 增益 | F48: 2 | H48: buff_up | K48: ch_defence_p | L48: #B0
A49: tianwanghuihui | C49: 天网恢恢 | D49: 9991 | E49: 诅咒 | F49: -1 | H49: debuff | K49: ch_defence_v | L49: -C0
A50: miejuejianqi | C50: 灭绝剑气 | D50: 9991 | E50: 诅咒 | F50: 3 | H50: debuff | K50: ch_defence_v | L50: -B0
A51: matafeiyan | C51: 马踏飞燕 | D51: 9996 | E51: 增益 | F51: 2 | H51: buff_up | K51: ch_dodge_p | L51: #A0
A52: taxuewuhen | C52: 踏雪无痕 | D52: 9996 | E52: 增益 | F52: 6 | H52: buff_up | K52: ch_dodge_p | L52: #A0
A53: baihezhanchi | C53: 白鹤展翅 | D53: 9996 | E53: 增益 | F53: 2 | H53: buff_up | K53: ch_dodge_p | L53: #A0
A54: huaxiewuye | C54: 花谢五叶 | D54: 9996 | E54: 增益 | F54: 2 | H54: buff_up | K54: ch_dodge_p | L54: #A0
A55: feihebufa | C55: 飞鹤步法 | D55: 9996 | E55: 增益 | F55: 1 | H55: buff_up | K55: ch_dodge_p | L55: #A0
A56: tiyunzong | C56: 梯云纵 | D56: 9996 | E56: 增益 | F56: 3 | H56: buff_up | K56: ch_dodge_p | L56: #S4
A57: baguazhishu | C57: 八卦之术 | D57: 9990 | E57: 诅咒 | F57: -1 | H57: debuff | K57: float_attack_p | L57: #-C0
A58: milezaixin | C58: 弥勒在心 | D58: 9995 | E58: 增益 | F58: -1 | H58: buff_up | K58: float_counter_p | L58: #C0
A59: jinzhongzhao | C59: 金钟罩 | D59: 9993 | E59: 增益 | F59: -1 | H59: buff_up | K59: float_defence_p | L59: #C0
A60: budaishuti | C60: 布袋束体 | D60: 9991 | E60: 诅咒 | F60: -1 | H60: debuff | K60: float_defence_p | L60: #-C0
A61: fuyaozhishang | C61: 扶摇直上 | D61: 9996 | E61: 增益 | F61: -1 | H61: buff_up | K61: float_dodge_p | L61: #C0
A62: yusuikungang | C62: 玉碎昆冈 | D62: 9980 | E62: 诅咒 | F62: 3 | H62: debuff | K62: float_hp_v | L62: -B0
A63: jinzhendujie | C63: 金针渡劫 | D63: 9980 | E63: 诅咒 | F63: 3 | H63: debuff | K63: float_hp_v | L63: -B0
A64: sanqingguanti | C64: 三清灌体 | D64: 9980 | E64: 诅咒 | F64: 3 | H64: debuff | K64: float_hp_v | L64: -B0
A65: chongxuyangqi | C65: 冲虚养气 | D65: 9984 | E65: 增益 | F65: 3 | H65: buff_up | K65: float_mp_p | L65: #D0
A66: neilifenliu | C66: 内力分流 | D66: 9984 | E66: 增益 | F66: 1 | H66: buff_up | K66: link_mp_p | L66: #A0
A67: kanglongyouhui | C67: 亢龙有悔 | D67: 1040 | E67: 增益 | F67: -1 | H67: buff_up | K67: rebound_hp_p | L67: #S4
A68: qixianwuxingjian | C68: 七弦无形剑 | D68: 9984 | E68: 增益 | F68: -1 | H68: buff_up | K68: link_mp_p | L68: #A0
A69: shimingguiyuan | C69: 嗜命归元 | D69: 9981 | E69: 增益 | F69: -1 | H69: buff_up | K69: link_hp_p | L69: #A0
A70: zhenjiushu | C70: 针灸术 | D70: 9981 | E70: 增益 | F70: 6 | H70: buff_up | K70: float_hp_p | L70: #C0
A71: zhengyangqichang | C71: 正阳气场 | D71: 9984 | E71: 增益 | F71: 6 | H71: buff_up | K71: float_mp_p | L71: #C0
A72: liufuyi | C72: 柳拂衣 | D72: 9997 | E72: 增益 | F72: 6 | H72: buff_up | K72: float_sp_p | L72: #C0
A73: bailianyin | C73: 百炼印 | D73: 9981 | E73: 增益 | F73: 3 | H73: buff_up | K73: float_hp_p | L73: #C0
A74: kegubu | C74: 刻骨步 | D74: 1040 | E74: 增益 | F74: 6 | H74: buff_up | K74: cancel_damage_cost_hp_v | L74: C0
A75: jianfajingmiao | C75: 剑法精妙 | D75: 9992 | E75: 增益 | F75: 1 | H75: buff_up | K75: ch_attack_p | L75: #C0
A76: taijijianfa | C76: 太极剑法 | D76: 9992 | E76: 增益 | F76: 1 | H76: buff_up | K76: ch_attack_p | L76: #S4
A77: yanwangzhuiming | C77: 阎王追命 | D77: 9981 | E77: 增益 | F77: 3 | H77: buff_up | K77: link_hp_p | L77: #A0
A78: yinyangdaoluan | C78: 阴阳倒乱 | D78: 9990 | E78: 诅咒 | F78: -1 | H78: debuff | K78: float_attack_p | L78: #-C0
A79: feifengzhua | C79: 飞凤爪 | D79: 9991 | E79: 诅咒 | F79: -1 | H79: debuff | K79: float_defence_p | L79: #-C0
A80: huakaijianfo | C80: 花开见佛 | D80: 9993 | E80: 增益 | F80: 1 | H80: buff_up | K80: ch_defence_p | L80: #B0
A81: fanhaijin | C81: 梵海劲 | D81: 1040 | E81: 增益 | F81: 1 | H81: buff_up | K81: cancel_damage_cost_mp_v | L81: A0
A82: duankongzhuihun | C82: 断空追魂 | D82: 9984 | E82: 增益 | F82: -1 | H82: buff_up | K82: link_mp_p | L82: #A0
A83: longpandouli | C83: 龙盘斗里 | D83: 9995 | E83: 增益 | F83: 2 | H83: buff_up | K83: ch_counter_p | L83: #A0
A84: xiaoshengniji | C84: 销声匿迹 | D84: 9996 | E84: 增益 | F84: 2 | H84: buff_up | K84: ch_dodge_p | L84: #A0

Sheet: 技能配置表old
A1: 技能ID | B1: 描述 | C1: 技能名 | D1: 技能类型 | E1: 图标 | F1: 五行 | G1: 武功名称 | H1: 招式分类 | I1: 武功档次 | J1: 所属门派 | K1: 技能目标 | L1: 内力消耗成长 | M1: 内力消耗 | N1: 特效文字 | O1: 发招动作 | P1: 动作长度 | Q1: 发招特效 | R1: 发招音效 | S1: 碰撞时间 | T1: 飞行特效 | U1: 飞行时间 | V1: 命中动作 | W1: 命中特效 | X1: 命中音效 | Y1: 连击 | Z1: 连击间隔 | AA1: 完结时间 | AB1: 技能范围 | AC1: 范围方向 | AD1: 触发条件 | AE1: 触发概率 | AF1: 魔法属性ID | AG1: 魔法属性效果 | AH1: 魔法属性参数 | AI1: 状态id | AJ1: 状态说明
A2: id | B2: tips_desc | C2: name | D2: type | E2: icon | F2: wuxing | G2: kongfu_name | H2: kongfu_type | I2: kongfu_class | J2: party | K2: target | L2: cost | M2: const_cost | N2: word_type | O2: start_action | P2: action_time | Q2: start_eff | R2: start_sound | S2: on_hit_time | T2: fly_eff | U2: fly_time | V2: hit_action | W2: hit_eff | X2: hit_sound | Y2: multi_hit | Z2: multi_interval | AA2: delay_time | AB2: range | AC2: range_direct | AD2: trigger_condition | AE2: trigger_rate | AF2: magic_id | AG2: !magic_eff | AH2: magic_params | AI2: state_id | AJ2: desc
A3: 1 | B3: 出招阶段，对对手造成大量伤害 | C3: 箫花齐放 | D3: 攻击 | E3: 330 | F3: 火 | I3: A0 | J3: 桃花岛 | K3: 对手 | L3: B0 | Q3: slash_eff | AB3: 1 | AD3: auto_action | AE3: 1000 | AF3: sk_attack_v | AG3: A0
A4: 2 | B4: 接招阶段，增加该回合自身防御力 | C4: 聚花势 | D4: 增益 | E4: 401 | F4: 火 | I4: A0 | J4: 桃花岛 | K4: 自身 | L4: B0 | AB4: 1 | AD4: on_defence | AE4: 1000 | AI4: 聚花势
A5: 3 | B5: 瞬间，生命不足时有几率为自身恢复大量生命 | C5: 观音诀 | D5: 气功 | E5: 420 | F5: 火 | I5: A0 | J5: 桃花岛 | K5: 自身 | L5: D0 | O5: magic | AB5: 1 | AD5: hp_not_enough | AE5: 800 | AF5: ch_hp_p | AG5: #A0
A6: 4 | B6: 接招阶段，增加该回合自身反击率 | C6: 浪卷云飞 | D6: 增益 | E6: 404 | F6: 火 | I6: A0 | J6: 桃花岛 | K6: 自身 | L6: B0 | AB6: 1 | AD6: on_defence | AE6: 1000 | AI6: 浪卷云飞
A7: 5 | B7: 被动，生命力提升 | C7: 桃花心法 | D7: 被动 | E7: 1041 | F7: 火 | I7: A0 | J7: 桃花岛 | K7: 自身 | AB7: 1 | AF7: ch_max_hp_p | AG7: #A0
A8: 6 | B8: 被动，反击率提升 | C8: 花魂附体 | D8: 被动 | E8: 1044 | F8: 火 | I8: A0 | J8: 桃花岛 | K8: 自身 | AB8: 1 | AF8: ch_counter_p | AG8: #B0
A9: 7 | B9: 出招阶段，对对手造成大量伤害 | C9: 九阴白骨爪 | D9: 攻击 | E9: 141 | F9: 金 | I9: S0 | J9: 江湖 | K9: 对手 | L9: B0 | Q9: slash_eff | AB9: 1 | AD9: auto_action | AE9: 1000 | AF9: sk_attack_v | AG9: S0
A10: 8 | B10: 瞬间，攻击命中时有几率使对手在3回合内不断流失体力 | C10: 九阴摧心掌 | D10: 诅咒 | E10: 121 | F10: 金 | I10: S0 | J10: 江湖 | K10: 对手 | L10: B0 | AB10: 1 | AD10: on_hit | AE10: 300 | AI10: 脏裂
A11: 9 | B11: 出招阶段，对对手造成大量伤害 | C11: 嵩阳剑法 | D11: 攻击 | E11: 333 | F11: 火 | I11: A0 | J11: 嵩山派 | K11: 对手 | L11: B0 | Q11: slash_eff | AB11: 1 | AD11: auto_action | AE11: 1000 | AF11: sk_attack_v | AG11: B0
A12: 10 | B12: 起招阶段，增加该回合自身暴击率 | C12: 大嵩阳神掌 | D12: 增益 | E12: 123 | F12: 火 | I12: A0 | J12: 嵩山派 | K12: 自身 | L12: B0 | AB12: 1 | AD12: starting_turn | AE12: 1000 | AI12: 嵩阳神掌
A13: 11 | B13: 接招阶段，对对手造成所受伤害的一部分 | C13: 寒冰真气 | D13: 增益 | E13: 1044 | F13: 火 | I13: A0 | J13: 嵩山派 | K13: 自身 | L13: B0 | AB13: 1 | AD13: on_defence | AE13: 1000 | AI13: 寒气护体
A14: 12 | B14: 瞬间，攻击命中时有几率使对手在3回合内不能出招 | C14: 寒冰神掌 | D14: 诅咒 | E14: 124 | F14: 火 | I14: A0 | J14: 嵩山派 | K14: 对手 | L14: B0 | AB14: 1 | AD14: on_hit | AE14: 300 | AI14: 寒气透骨
A15: 13 | B15: 被动，暴击率提升 | C15: 阳关三叠 | D15: 被动 | E15: 405 | F15: 火 | I15: A0 | J15: 嵩山派 | K15: 自身 | AB15: 1 | AF15: ch_crit_p | AG15: #B0
A16: 14 | B16: 瞬间，内力不足时有几率为自身恢复大量内力 | C16: 冲虚养气 | D16: 增益 | E16: 1044 | F16: 土 | I16: A0 | J16: 峨眉派 | K16: 自身 | L16: D0 | AB16: 1 | AD16: mp_not_enough | AE16: 800 | AI16: 冲虚养气
A17: 15 | B17: 被动，防御力提升 | C17: 白鹤展翅 | D17: 被动 | E17: 160 | F17: 土 | I17: A0 | J17: 丐帮 | K17: 自身 | AB17: 1 | AF17: ch_defence_p | AG17: #A0
A18: 16 | B18: 接招阶段，增加该回合自身防御力 | C18: 白鹤翔空 | D18: 增益 | E18: 260 | F18: 土 | I18: A0 | J18: 丐帮 | K18: 自身 | L18: B0 | AB18: 1 | AD18: on_defence | AE18: 1000 | AI18: 白鹤翔空
A19: 17 | B19: 瞬间，攻击命中时有几率使对手在3回合内不能出招 | C19: 緾丝擒拿手 | D19: 诅咒 | E19: 144 | F19: 土 | I19: A0 | J19: 丐帮 | K19: 对手 | L19: B0 | AB19: 1 | AD19: on_hit | AE19: 300 | AI19: 行动不便
A20: 18 | B20: 出招阶段，对对手造成大量伤害 | C20: 玉女剑式 | D20: 攻击 | E20: 334 | F20: 金 | I20: A0 | J20: 华山派 | K20: 对手 | L20: B0 | Q20: slash_eff | AB20: 1 | AD20: auto_action | AE20: 1000 | AF20: sk_attack_v | AG20: B0
A21: 19 | B21: 起招阶段，增加该回合自身攻击力 | C21: 宁氏一剑 | D21: 增益 | E21: 333 | F21: 金 | I21: A0 | J21: 华山派 | K21: 自身 | L21: B0 | AB21: 1 | AD21: starting_turn | AE21: 1000 | AI21: 宁氏一剑
A22: 20 | B22: 出招阶段，对对手造成大量伤害 | C22: 铁掌碎石 | D22: 攻击 | E22: 125 | F22: 水 | I22: A0 | J22: 江湖 | K22: 对手 | L22: B0 | Q22: bang_eff | AB22: 1 | AD22: auto_action | AE22: 1000 | AF22: sk_attack_v | AG22: A0
A23: 21 | B23: 被动，诅咒免疫 | C23: 闭穴功 | D23: 被动 | E23: 1044 | F23: 水 | I23: A0 | J23: 江湖 | K23: 自身 | AB23: 1 | AF23: cant_curse
A24: 22 | B24: 出招阶段，对对手造成2连击伤害 | C24: 刀剑乱舞 | D24: 攻击 | E24: 511 | F24: 土 | I24: A0 | J24: 江湖 | K24: 对手 | L24: B0 | Q24: slash_eff | Y24: 2 | Z24: 300 | AB24: 1 | AD24: auto_action | AE24: 1000 | AF24: sk_attack_p | AG24: #-S0
A25: 23 | B25: 起招阶段，增加该回合自身攻击力 | C25: 乘胜追击 | D25: 增益 | E25: 271 | F25: 火 | I25: A0 | J25: 江湖 | K25: 自身 | L25: B0 | AB25: 1 | AD25: starting_turn | AE25: 1000 | AI25: 乘胜追击
A26: 24 | B26: 出招阶段，对对手造成大量伤害 | C26: 弦起剑落 | D26: 攻击 | E26: 335 | F26: 火 | I26: A0 | J26: 江湖 | K26: 对手 | L26: B0 | Q26: slash_eff | AB26: 1 | AD26: auto_action | AE26: 1000 | AF26: sk_attack_v | AG26: A0
A27: 25 | B27: 瞬间，攻击命中时有几率使对手在3回合内不断流失内力 | C27: 七弦无形剑 | D27: 诅咒 | E27: 334 | F27: 火 | I27: A0 | J27: 江湖 | K27: 对手 | L27: B0 | AB27: 1 | AD27: on_hit | AE27: 300 | AI27: 意乱心急
A28: 26 | B28: 起招阶段，增加该回合自身闪避率 | C28: 踏雪无痕 | D28: 增益 | E28: 270 | F28: 火 | I28: A0 | J28: 江湖 | K28: 自身 | L28: B0 | AB28: 1 | AD28: starting_turn | AE28: 1000 | AI28: 踏雪无痕
A29: 27 | B29: 接招阶段，消耗内力抵挡下次伤害 | C29: 琴音缭绕 | D29: 增益 | E29: 1044 | F29: 火 | I29: A0 | J29: 江湖 | K29: 自身 | L29: C0 | AB29: 1 | AD29: on_defence | AE29: 1000 | AI29: 琴音缭绕
A30: 28 | B30: 收招阶段，恢复自身大量生命 | C30: 灵丹妙药 | D30: 增益 | E30: 1043 | F30: 水 | I30: A0 | J30: 江湖 | K30: 自身 | L30: B0 | AB30: 1 | AD30: ending_turn | AE30: 1000 | AI30: 灵丹妙药
A31: 29 | B31: 瞬间，生命不足时有几率为我方3名角色恢复大量生命 | C31: 起死回生 | D31: 气功 | E31: 1043 | F31: 水 | I31: A0 | J31: 江湖 | K31: 自身 | L31: D0 | O31: magic | AB31: 3 | AC31: 向后 | AD31: hp_not_enough | AE31: 800 | AF31: ch_hp_p | AG31: #C0
A32: 30 | B32: 起招阶段，增加该回合自身攻击力 | C32: 狂风刀法 | D32: 增益 | E32: 513 | F32: 水 | I32: A0 | J32: 江湖 | K32: 自身 | L32: B0 | AB32: 1 | AD32: starting_turn | AE32: 1000 | AI32: 狂风刀法
A33: 31 | B33: 起招阶段，使对方该回合不能闪避 | C33: 飞沙走石 | D33: 诅咒 | E33: 280 | F33: 水 | I33: A0 | J33: 江湖 | K33: 对手 | L33: B0 | AB33: 1 | AD33: starting_turn | AE33: 1000 | AI33: 沙雾
A34: 32 | B34: 出招阶段，同时对2名对方角色造成伤害 | C34: 飘雪穿云掌 | D34: 攻击 | E34: 124 | F34: 火 | I34: A0 | J34: 峨眉派 | K34: 对手 | L34: B0 | Q34: bang_eff | AB34: 2 | AC34: 向后 | AD34: auto_action | AE34: 1000 | AF34: sk_attack_p | AG34: #-B0
A35: 33 | B35: 接招阶段，同时对3名对方角色造成伤害 | C35: 佛光普照 | D35: 攻击 | E35: 1040 | F35: 火 | I35: A0 | J35: 峨眉派 | K35: 对手 | L35: B0 | Q35: bang_eff | AB35: 3 | AC35: 向后 | AD35: on_defence | AE35: 1000 | AF35: sk_attack_p | AG35: #-B0
A36: 34 | B36: 被动，闪避率提升 | C36: 如影随形 | D36: 被动 | E36: 260 | F36: 水 | I36: A0 | J36: 华山派 | K36: 自身 | AB36: 1 | AF36: ch_dodge_p | AG36: #A0
A37: 35 | B37: 瞬间，攻击命中时有几率使对手在3回合内不断流失生命 | C37: 针灸术 | D37: 诅咒 | E37: 1040 | F37: 水 | I37: A0 | J37: 江湖 | K37: 对手 | L37: B0 | AB37: 1 | AD37: on_hit | AE37: 300 | AI37: 穴脉受损
A38: 36 | B38: 接招阶段，增加该回合自身防御力 | C38: 正阳气场 | D38: 增益 | E38: 1042 | F38: 金 | I38: A0 | J38: 大理段氏 | K38: 自身 | L38: B0 | AB38: 1 | AD38: on_defence | AE38: 1000 | AI38: 正阳气场
A39: 37 | B39: 瞬间，生命不足时有几率为自身恢复大量生命 | C39: 三阳开泰 | D39: 气功 | E39: 420 | F39: 金 | I39: A0 | J39: 大理段氏 | K39: 自身 | L39: D0 | O39: magic | AB39: 1 | AD39: hp_not_enough | AE39: 800 | AF39: ch_hp_p | AG39: #A0
A40: 38 | B40: 接招阶段，增加该回合自身反击率 | C40: 以守为攻 | D40: 增益 | E40: 135 | F40: 金 | I40: A0 | J40: 大理段氏 | K40: 自身 | L40: B0 | AB40: 1 | AD40: on_defence | AE40: 1000 | AI40: 以守为攻
A41: 39 | B41: 被动，生命力提升 | C41: 擒龙心法 | D41: 被动 | E41: 402 | F41: 土 | I41: A0 | J41: 丐帮 | K41: 自身 | AB41: 1 | AF41: ch_max_hp_p | AG41: #A0
A42: 40 | B42: 被动，反击率提升 | C42: 正气浩然 | D42: 被动 | E42: 1000 | F42: 金 | I42: A0 | J42: 大理段氏 | K42: 自身 | AB42: 1 | AF42: ch_counter_p | AG42: #B0
A43: 41 | B43: 出招阶段，对对手造成大量伤害 | C43: 蟠龙击 | D43: 攻击 | E43: 145 | F43: 土 | I43: A0 | J43: 丐帮 | K43: 对手 | L43: B0 | Q43: bang_eff | AB43: 1 | AD43: auto_action | AE43: 1000 | AF43: sk_attack_v | AG43: A0
A44: 42 | B44: 瞬间，攻击命中时有几率使对手在3回合内不断流失体力 | C44: 无影蝎毒 | D44: 诅咒 | E44: 273 | F44: 金 | I44: S0 | J44: 江湖 | K44: 对手 | L44: B0 | AB44: 1 | AD44: on_hit | AE44: 300 | AI44: 无影蝎毒
A45: 43 | B45: 出招阶段，对对手造成大量伤害 | C45: 断命刀法 | D45: 攻击 | E45: 515 | F45: 水 | I45: A0 | J45: 江湖 | K45: 对手 | L45: B0 | Q45: slash_eff | AB45: 1 | AD45: auto_action | AE45: 1000 | AF45: sk_attack_v | AG45: A0
A46: 44 | B46: 起招阶段，增加该回合自身攻击力 | C46: 无恶不作 | D46: 增益 | E46: 110 | F46: 水 | I46: A0 | J46: 江湖 | K46: 自身 | L46: B0 | AB46: 1 | AD46: starting_turn | AE46: 1000 | AI46: 无恶不作
A47: 45 | B47: 接招阶段，对对手造成所受伤害的一部分 | C47: 粘衣十八跌 | D47: 增益 | E47: 1045 | F47: 土 | I47: A0 | J47: 丐帮 | K47: 自身 | L47: B0 | AB47: 1 | AD47: on_defence | AE47: 1000 | AI47: 粘衣十八跌
A48: 46 | B48: 瞬间，攻击命中时有几率使对手在3回合内不能出招 | C48: 擒龙式 | D48: 诅咒 | E48: 170 | F48: 土 | I48: A0 | J48: 丐帮 | K48: 对手 | L48: B0 | AB48: 1 | AD48: on_hit | AE48: 300 | AI48: 力消气散
A49: 47 | B49: 被动，暴击率提升 | C49: 魅影重重 | D49: 被动 | E49: 260 | F49: 水 | I49: A0 | J49: 江湖 | K49: 自身 | AB49: 1 | AF49: ch_crit_p | AG49: #A0
A50: 48 | B50: 出招阶段，对对手造成大量伤害 | C50: 大理剑诀 | D50: 攻击 | E50: 330 | F50: 金 | I50: A0 | J50: 大理段氏 | K50: 对手 | L50: B0 | Q50: slash_eff | AB50: 1 | AD50: auto_action | AE50: 1000 | AF50: sk_attack_v | AG50: A0
A51: 49 | B51: 起招阶段，增加该回合自身攻击力 | C51: 凌风剑气 | D51: 增益 | E51: 1040 | F51: 金 | I51: A0 | J51: 大理段氏 | K51: 自身 | L51: B0 | AB51: 1 | AD51: starting_turn | AE51: 1000 | AI51: 凌风剑气
A52: 50 | B52: 出招阶段，对对手造成大量伤害 | C52: 凤舞修罗 | D52: 攻击 | E52: 511 | F52: 水 | I52: A0 | J52: 江湖 | K52: 对手 | L52: B0 | Q52: slash_eff | AB52: 1 | AD52: auto_action | AE52: 1000 | AF52: sk_attack_v | AG52: A0
A53: 51 | B53: 被动，诅咒免疫 | C53: 炼毒术 | D53: 被动 | E53: 1043 | F53: 水 | I53: A0 | J53: 江湖 | K53: 自身 | AB53: 1 | AF53: cant_curse
A54: 52 | B54: 出招阶段，对对手造成3连击伤害 | C54: 毒镖夺魂 | D54: 攻击 | E54: 620 | F54: 土 | I54: A0 | J54: 江湖 | K54: 对手 | L54: B0 | Q54: bang_eff | Y54: 3 | Z54: 300 | AB54: 1 | AD54: auto_action | AE54: 1000 | AF54: sk_attack_p | AG54: #-S0
A55: 54 | B55: 出招阶段，对对手造成大量伤害 | C55: 阴阳一掷 | D55: 攻击 | E55: 1010 | F55: 火 | I55: A0 | J55: 江湖 | K55: 对手 | L55: B0 | Q55: bang_eff | AB55: 1 | AD55: auto_action | AE55: 1000 | AF55: sk_attack_v | AG55: A0
A56: 55 | B56: 瞬间，攻击命中时有几率使对手在3回合内不断流失内力 | C56: 阴阳迷阵 | D56: 诅咒 | E56: 1010 | F56: 火 | I56: A0 | J56: 江湖 | K56: 对手 | L56: B0 | AB56: 1 | AD56: on_hit | AE56: 300 | AI56: 意乱心急
A57: 56 | B57: 接招阶段，消耗内力抵挡下次伤害 | C57: 黑白皆兵 | D57: 增益 | E57: 1010 | F57: 火 | I57: A0 | J57: 江湖 | K57: 自身 | L57: C0 | AB57: 1 | AD57: on_defence | AE57: 1000 | AI57: 黑白皆兵
A58: 57 | B58: 收招阶段，恢复自身大量生命 | C58: 慈航普度 | D58: 增益 | E58: 1043 | F58: 水 | I58: A0 | J58: 江湖 | K58: 自身 | L58: B0 | AB58: 1 | AD58: ending_turn | AE58: 1000 | AI58: 慈航普度
A59: 58 | B59: 起招阶段，增加该回合自身攻击力 | C59: 凶神恶煞 | D59: 增益 | E59: 511 | F59: 水 | I59: A0 | J59: 江湖 | K59: 自身 | L59: B0 | AB59: 1 | AD59: starting_turn | AE59: 1000 | AI59: 凶神恶煞
A60: 59 | B60: 出招阶段，同时对2名对方角色造成伤害 | C60: 玉虚无恨 | D60: 攻击 | E60: 334 | F60: 金 | I60: A0 | J60: 江湖 | K60: 对手 | L60: B0 | Q60: bang_eff | AB60: 2 | AC60: 向后 | AD60: auto_action | AE60: 1000 | AF60: sk_attack_p | AG60: #-B0
A61: 60 | B61: 瞬间，攻击命中时有几率使对手在3回合内不断流失生命 | C61: 花谢五叶 | D61: 诅咒 | E61: 331 | F61: 水 | I61: A0 | J61: 江湖 | K61: 对手 | L61: B0 | AB61: 1 | AD61: on_hit | AE61: 300 | AI61: 穴脉受损
A62: 61 | B62: 起招阶段，增加该回合自身攻击力 | C62: 穷凶极恶 | D62: 增益 | E62: 511 | F62: 金 | I62: A0 | J62: 江湖 | K62: 自身 | L62: B0 | AB62: 1 | AD62: starting_turn | AE62: 1000 | AI62: 穷凶极恶
A63: 62 | B63: 出招阶段，对对手造成大量伤害 | C63: 铁爪无形 | D63: 攻击 | E63: 332 | F63: 金 | I63: A0 | J63: 江湖 | K63: 对手 | L63: B0 | Q63: slash_eff | AB63: 1 | AD63: auto_action | AE63: 1000 | AF63: sk_attack_v | AG63: A0
A64: 63 | B64: 被动，防御力提升 | C64: 罗汉护体 | D64: 被动 | E64: 1042 | F64: 金 | I64: A0 | J64: 少林寺 | K64: 自身 | AB64: 1 | AF64: ch_defence_p | AG64: #A0
A65: 64 | B65: 接招阶段，增加该回合自身防御力 | C65: 铁布衫 | D65: 增益 | E65: 1045 | F65: 金 | I65: A0 | J65: 少林寺 | K65: 自身 | L65: B0 | AB65: 1 | AD65: on_defence | AE65: 1000 | AI65: 铁布衫
A66: 65 | B66: 瞬间，攻击命中时有几率使对手在3回合内不能出招 | C66: 拈花指 | D66: 诅咒 | E66: 230 | F66: 金 | I66: A0 | J66: 少林寺 | K66: 对手 | L66: B0 | AB66: 1 | AD66: on_hit | AE66: 300 | AI66: 力消气散
A67: 66 | B67: 出招阶段，对对手造成大量伤害 | C67: 慈悲刀法 | D67: 攻击 | E67: 512 | F67: 金 | I67: S0 | J67: 少林寺 | K67: 对手 | L67: B0 | Q67: slash_eff | AB67: 1 | AD67: auto_action | AE67: 1000 | AF67: sk_attack_v | AG67: A0
A68: 67 | B68: 接招阶段，对对手造成所受伤害的一部分 | C68: 弥勒护身 | D68: 增益 | E68: 1042 | F68: 金 | I68: A0 | J68: 少林寺 | K68: 自身 | L68: B0 | AB68: 1 | AD68: on_defence | AE68: 1000 | AI68: 弥勒护身
A69: 68 | B69: 瞬间，攻击命中时有几率使对手在3回合内不断流失生命 | C69: 一拍两散 | D69: 诅咒 | E69: 110 | F69: 金 | I69: A0 | J69: 少林寺 | K69: 对手 | L69: B0 | AB69: 1 | AD69: on_hit | AE69: 300 | AI69: 穴脉受损
A70: 69 | B70: 起招阶段，增加该回合自身攻击力 | C70: 棒打狗头 | D70: 增益 | E70: 405 | F70: 土 | I70: A0 | J70: 丐帮 | K70: 自身 | L70: B0 | AB70: 1 | AD70: starting_turn | AE70: 1000 | AI70: 棒打狗头
A71: 70 | B71: 出招阶段，同时对2名对方角色造成伤害 | C71: 一剑化三清 | D71: 攻击 | E71: 334 | F71: 土 | I71: A0 | J71: 全真教 | K71: 对手 | L71: B0 | Q71: slash_eff | AB71: 2 | AC71: 向后 | AD71: auto_action | AE71: 1000 | AF71: sk_attack_p | AG71: #-A0
A72: 71 | B72: 接招阶段，同时对3名对方角色造成伤害 | C72: 七星聚义 | D72: 攻击 | E72: 404 | F72: 土 | I72: A0 | J72: 全真教 | K72: 对手 | L72: B0 | Q72: bang_eff | AB72: 3 | AC72: 向后 | AD72: on_defence | AE72: 1000 | AF72: sk_attack_p | AG72: #-B0
A73: 72 | B73: 出招阶段，对对手造成大量伤害 | C73: 哭丧棒法 | D73: 攻击 | E73: 400 | F73: 金 | I73: S0 | J73: 西域密宗 | K73: 对手 | L73: B0 | Q73: bang_eff | AB73: 1 | AD73: auto_action | AE73: 1000 | AF73: sk_attack_v | AG73: A0
A74: 73 | B74: 瞬间，攻击命中时有几率使对手在3回合内不断流失体力 | C74: 散筋毒砂 | D74: 诅咒 | E74: 275 | F74: 火 | I74: S0 | J74: 西域密宗 | K74: 对手 | L74: B0 | AB74: 1 | AD74: on_hit | AE74: 300 | AI74: 散筋毒砂
A75: 74 | B75: 被动，生命力提升 | C75: 瑜伽术 | D75: 被动 | E75: 273 | F75: 土 | I75: A0 | J75: 西域密宗 | K75: 自身 | AB75: 1 | AF75: ch_max_hp_p | AG75: #A0
A76: 75 | B76: 出招阶段，对对手造成大量伤害 | C76: 神驼雪山掌 | D76: 攻击 | E76: 124 | F76: 水 | I76: A0 | J76: 西域密宗 | K76: 对手 | L76: B0 | Q76: bang_eff | AB76: 1 | AD76: auto_action | AE76: 1000 | AF76: sk_attack_v | AG76: S0
A77: 76 | B77: 被动，诅咒免疫 | C77: 蛤蟆功 | D77: 被动 | E77: 1043 | F77: 水 | I77: A0 | J77: 西域密宗 | K77: 自身 | AB77: 1 | AF77: cant_curse
A78: 77 | B78: 出招阶段，对对手造成2连击伤害 | C78: 灵蛇杖法 | D78: 攻击 | E78: 403 | F78: 土 | I78: A0 | J78: 西域密宗 | K78: 对手 | L78: B0 | Q78: bang_eff | Y78: 2 | Z78: 300 | AB78: 1 | AD78: auto_action | AE78: 1000 | AF78: sk_attack_p | AG78: #-C0
A79: 78 | B79: 接招阶段，增加该回合自身反击率 | C79: 云雾十三式 | D79: 增益 | E79: 274 | F79: 木 | I79: A0 | J79: 衡山派 | K79: 自身 | L79: B0 | AB79: 1 | AD79: on_defence | AE79: 1000 | AI79: 云雾十三式
A80: 79 | B80: 出招阶段，对对手造成大量伤害 | C80: 回风落雁剑 | D80: 攻击 | E80: 333 | F80: 木 | I80: A0 | J80: 衡山派 | K80: 对手 | L80: B0 | Q80: slash_eff | AB80: 1 | AD80: auto_action | AE80: 1000 | AF80: sk_attack_v | AG80: A0
A81: 80 | B81: 起招阶段，增加该回合自身攻击力 | C81: 五神剑 | D81: 增益 | E81: 334 | F81: 木 | I81: A0 | J81: 衡山派 | K81: 自身 | L81: B0 | AB81: 1 | AD81: starting_turn | AE81: 1000 | AI81: 五神剑
A82: 81 | B82: 被动，反击率提升 | C82: 云影雾踪 | D82: 被动 | E82: 260 | F82: 木 | I82: A0 | J82: 衡山派 | K82: 自身 | AB82: 1 | AF82: ch_counter_p | AG82: #A0
A83: 82 | B83: 瞬间，攻击命中时有几率使对手在3回合内不能出招 | C83: 空手接刃 | D83: 诅咒 | E83: 110 | F83: 水 | I83: A0 | J83: 姑苏慕容 | K83: 对手 | L83: B0 | AB83: 1 | AD83: on_hit | AE83: 300 | AI83: 手无寸铁
A84: 83 | B84: 被动，反击率提升 | C84: 借力返施 | D84: 被动 | E84: 170 | F84: 水 | I84: A0 | J84: 姑苏慕容 | K84: 自身 | AB84: 1 | AF84: ch_counter_p | AG84: #B0
A85: 84 | B85: 出招阶段，对对手造成大量伤害 | C85: 柳拂衣 | D85: 攻击 | E85: 333 | F85: 水 | I85: A0 | J85: 姑苏慕容 | K85: 对手 | L85: B0 | Q85: slash_eff | AB85: 1 | AD85: auto_action | AE85: 1000 | AF85: sk_attack_v | AG85: A0
A86: 85 | B86: 出招阶段，对对手造成2连击伤害 | C86: 星火闪 | D86: 攻击 | E86: 170 | F86: 水 | I86: A0 | J86: 姑苏慕容 | K86: 对手 | L86: B0 | Q86: slash_eff | Y86: 2 | Z86: 300 | AB86: 1 | AD86: auto_action | AE86: 1000 | AF86: sk_attack_p | AG86: #-A0
A87: 86 | B87: 被动，诅咒免疫 | C87: 气定六合 | D87: 被动 | E87: 1044 | F87: 水 | I87: A0 | J87: 姑苏慕容 | K87: 自身 | AB87: 1 | AF87: cant_curse
A88: 87 | B88: 接招阶段，对对手造成所受伤害的一部分 | C88: 化气式 | D88: 增益 | E88: 1044 | F88: 水 | I88: A0 | J88: 姑苏慕容 | K88: 自身 | L88: B0 | AB88: 1 | AD88: on_defence | AE88: 1000 | AI88: 化气式
A89: 88 | B89: 瞬间，攻击命中时有几率使对手在3回合内不能出招 | C89: 剑锁江山 | D89: 诅咒 | E89: 334 | F89: 水 | I89: A0 | J89: 姑苏慕容 | K89: 对手 | L89: B0 | AB89: 1 | AD89: on_hit | AE89: 300 | AI89: 剑锁江山
A90: 89 | B90: 瞬间，生命不足时有几率为自身恢复大量生命 | C90: 流云袖 | D90: 气功 | E90: 403 | F90: 水 | I90: A0 | J90: 姑苏慕容 | K90: 自身 | L90: D0 | O90: magic | AB90: 1 | AD90: hp_not_enough | AE90: 800 | AF90: ch_hp_p | AG90: #A0
A91: 90 | B91: 被动，防御力提升 | C91: 通晓武学 | D91: 被动 | E91: 1044 | F91: 金 | I91: A0 | J91: 江湖 | K91: 自身 | AB91: 1 | AF91: ch_defence_p | AG91: #A0
A92: 91 | B92: 接招阶段，同时对3名对方角色造成伤害 | C92: 劈空掌 | D92: 攻击 | E92: 121 | F92: 火 | I92: A0 | J92: 桃花岛 | K92: 对手 | L92: B0 | Q92: bang_eff | AB92: 3 | AC92: 向后 | AD92: on_defence | AE92: 1000 | AF92: sk_attack_p | AG92: #-B0
A93: 92 | B93: 瞬间，生命不足时有几率为我方3名角色恢复大量生命 | C93: 春光四沐 | D93: 气功 | E93: 1043 | F93: 水 | I93: A0 | J93: 姑苏慕容 | K93: 自身 | L93: D0 | O93: magic | AB93: 3 | AC93: 向后 | AD93: hp_not_enough | AE93: 800 | AF93: ch_hp_p | AG93: #C0
A94: 93 | B94: 收招阶段，恢复自身大量生命 | C94: 仪光道霞 | D94: 增益 | E94: 403 | F94: 水 | I94: A0 | J94: 恒山派 | K94: 自身 | L94: B0 | AB94: 1 | AD94: ending_turn | AE94: 1000 | AI94: 仪光道霞
A95: 94 | B95: 接招阶段，增加该回合自身防御力 | C95: 御剑势 | D95: 增益 | E95: 1044 | F95: 水 | I95: A0 | J95: 恒山派 | K95: 自身 | L95: B0 | AB95: 1 | AD95: on_defence | AE95: 1000 | AI95: 御剑势
A96: 95 | B96: 出招阶段，对对手造成大量伤害 | C96: 恒山剑法 | D96: 攻击 | E96: 333 | F96: 水 | I96: A0 | J96: 恒山派 | K96: 对手 | L96: B0 | Q96: slash_eff | AB96: 1 | AD96: auto_action | AE96: 1000 | AF96: sk_attack_v | AG96: B0
A97: 96 | B97: 瞬间，攻击命中时有几率使对手在3回合内不能出招 | C97: 梦溪式 | D97: 诅咒 | E97: 1041 | F97: 水 | I97: A0 | J97: 恒山派 | K97: 对手 | L97: B0 | AB97: 1 | AD97: on_hit | AE97: 300 | AI97: 行动不便
A98: 97 | B98: 出招阶段，对对手造成大量伤害 | C98: 游刃有余 | D98: 攻击 | E98: 510 | F98: 火 | I98: A0 | J98: 江湖 | K98: 对手 | L98: B0 | Q98: bang_eff | AB98: 1 | AD98: auto_action | AE98: 1000 | AF98: sk_attack_v | AG98: A0
A99: 98 | B99: 接招阶段，消耗内力抵挡下次伤害 | C99: 障眼法 | D99: 增益 | E99: 1044 | F99: 火 | I99: A0 | J99: 江湖 | K99: 自身 | L99: C0 | AB99: 1 | AD99: on_defence | AE99: 1000 | AI99: 障眼法
A100: 99 | B100: 瞬间，攻击命中时有几率使对手在3回合内不断流失内力 | C100: 釜底抽薪 | D100: 诅咒 | E100: 1010 | F100: 火 | I100: A0 | J100: 江湖 | K100: 对手 | L100: B0 | AB100: 1 | AD100: on_hit | AE100: 300 | AI100: 意乱心急
A101: 100 | B101: 瞬间，攻击命中时有几率使对手在3回合内不能出招 | C101: 八门金锁 | D101: 诅咒 | E101: 1030 | F101: 金 | I101: A0 | J101: 大理段氏 | K101: 对手 | L101: B0 | AB101: 1 | AD101: on_hit | AE101: 300 | AI101: 行动不便
A102: 101 | B102: 被动，防御力提升 | C102: 天罡正气 | D102: 被动 | E102: 420 | F102: 金 | I102: A0 | J102: 大理段氏 | K102: 自身 | AB102: 1 | AF102: ch_defence_p | AG102: #B0
A103: 102 | B103: 接招阶段，增加该回合自身防御力 | C103: 静影沉璧 | D103: 增益 | E103: 1044 | F103: 金 | I103: A0 | J103: 大理段氏 | K103: 自身 | L103: B0 | AB103: 1 | AD103: on_defence | AE103: 1000 | AI103: 静影沉璧
A104: 103 | B104: 被动，反击率提升 | C104: 金雁功 | D104: 被动 | E104: 260 | F104: 土 | I104: A0 | J104: 全真教 | K104: 自身 | AB104: 1 | AF104: ch_counter_p | AG104: #B0
A105: 104 | B105: 接招阶段，对对手造成所受伤害的一部分 | C105: 真武圣体 | D105: 增益 | E105: 1044 | F105: 土 | I105: A0 | J105: 全真教 | K105: 自身 | L105: B0 | AB105: 1 | AD105: on_defence | AE105: 1000 | AI105: 真武圣体
A106: 105 | B106: 瞬间，生命不足时有几率为自身恢复大量生命 | C106: 川流不息 | D106: 气功 | E106: 403 | F106: 土 | I106: A0 | J106: 全真教 | K106: 自身 | L106: D0 | O106: magic | AB106: 1 | AD106: hp_not_enough | AE106: 1000 | AF106: ch_hp_p | AG106: #A0
A107: 106 | B107: 接招阶段，消耗内力抵挡下次伤害 | C107: 五气朝元 | D107: 增益 | E107: 1044 | F107: 土 | I107: A0 | J107: 全真教 | K107: 自身 | L107: C0 | AB107: 1 | AD107: on_defence | AE107: 1000 | AI107: 五气朝元
A108: 107 | B108: 瞬间，攻击命中时有几率使对手在3回合内不断流失内力 | C108: 散气功 | D108: 诅咒 | E108: 143 | F108: 土 | I108: A0 | J108: 全真教 | K108: 对手 | L108: B0 | AB108: 1 | AD108: on_hit | AE108: 300 | AI108: 散气功
A109: 108 | B109: 出招阶段，对对手造成大量伤害 | C109: 玉碎昆冈 | D109: 攻击 | E109: 400 | F109: 火 | I109: A0 | J109: 明教 | K109: 对手 | L109: B0 | Q109: bang_eff | AB109: 1 | AD109: auto_action | AE109: 1000 | AF109: sk_attack_v | AG109: A0
A110: 109 | B110: 瞬间，攻击命中时有几率使对手在3回合内不断流失体力 | C110: 金针渡劫 | D110: 诅咒 | E110: 620 | F110: 火 | I110: S0 | J110: 明教 | K110: 对手 | L110: B0 | AB110: 1 | AD110: on_hit | AE110: 300 | AI110: 脏裂
A111: 110 | B111: 被动，生命力提升 | C111: 圣火心法 | D111: 被动 | E111: 401 | F111: 火 | I111: A0 | J111: 明教 | K111: 自身 | AB111: 1 | AF111: ch_max_hp_p | AG111: #A0
A112: 111 | B112: 瞬间，生命不足时对6名对方角色造成伤害 | C112: 天地同寿 | D112: 攻击 | E112: 141 | F112: 火 | I112: A0 | J112: 明教 | K112: 对手 | L112: D0 | Q112: bang_eff | AB112: 6 | AC112: 向后 | AD112: hp_not_enough | AE112: 1000 | AF112: sk_attack_p | AG112: #-C0
A113: 112 | B113: 被动，防御力提升 | C113: 袋中乾坤 | D113: 被动 | E113: 1010 | F113: 金 | I113: A0 | J113: 江湖 | K113: 自身 | AB113: 1 | AF113: ch_defence_p | AG113: #A0
A114: 113 | B114: 接招阶段，增加该回合自身防御力 | C114: 天网恢恢 | D114: 增益 | E114: 1044 | F114: 金 | I114: A0 | J114: 江湖 | K114: 自身 | L114: B0 | AB114: 1 | AD114: on_defence | AE114: 1000 | AI114: 天网恢恢
A115: 114 | B115: 瞬间，攻击命中时有几率使对手在3回合内不能出招 | C115: 布袋束体 | D115: 诅咒 | E115: 170 | F115: 金 | I115: A0 | J115: 江湖 | K115: 对手 | L115: B0 | AB115: 1 | AD115: on_hit | AE115: 300 | AI115: 行动不便
A116: 115 | B116: 接招阶段，增加该回合自身防御力 | C116: 八卦之术 | D116: 增益 | E116: 1010 | F116: 水 | I116: A0 | J116: 西域密宗 | K116: 自身 | L116: B0 | AB116: 1 | AD116: on_defence | AE116: 1000 | AI116: 八卦之术
A117: 116 | B117: 瞬间，生命不足时有几率为我方3名角色恢复大量生命 | C117: 坐地求全 | D117: 气功 | E117: 1043 | F117: 水 | I117: A0 | J117: 江湖 | K117: 自身 | L117: D0 | O117: magic | AB117: 3 | AC117: 向后 | AD117: hp_not_enough | AE117: 800 | AF117: ch_hp_p | AG117: #C0
A118: 117 | B118: 收招阶段，恢复自身大量生命 | C118: 九转丹成 | D118: 增益 | E118: 1043 | F118: 土 | I118: A0 | J118: 武当派 | K118: 自身 | L118: B0 | AB118: 1 | AD118: ending_turn | AE118: 1000 | AI118: 九转丹成
A119: 118 | B119: 瞬间，攻击命中时有几率使对手在3回合内不断流失生命 | C119: 太极剑气 | D119: 诅咒 | E119: 334 | F119: 土 | I119: A0 | J119: 武当派 | K119: 对手 | L119: B0 | AB119: 1 | AD119: on_hit | AE119: 300 | AI119: 穴脉受损
A120: 119 | B120: 起招阶段，增加该回合自身攻击力 | C120: 武当长拳 | D120: 增益 | E120: 134 | F120: 土 | I120: A0 | J120: 武当派 | K120: 自身 | L120: B0 | AB120: 1 | AD120: starting_turn | AE120: 1000 | AI120: 武当长拳
A121: 120 | B121: 起招阶段，增加该回合自身闪避率 | C121: 梯云纵 | D121: 增益 | E121: 274 | F121: 土 | I121: A0 | J121: 武当派 | K121: 自身 | L121: B0 | AB121: 1 | AD121: starting_turn | AE121: 1000 | AI121: 梯云纵
A122: 121 | B122: 出招阶段，对对手造成大量伤害 | C122: 太极剑法 | D122: 攻击 | E122: 334 | F122: 土 | I122: A0 | J122: 武当派 | K122: 对手 | L122: B0 | Q122: slash_eff | AB122: 1 | AD122: auto_action | AE122: 1000 | AF122: sk_attack_v | AG122: B0
A123: 122 | B123: 出招阶段，对对手造成大量伤害 | C123: 飞燕穿柳 | D123: 攻击 | E123: 404 | F123: 水 | I123: A0 | J123: 江湖 | K123: 对手 | L123: B0 | Q123: slash_eff | AB123: 1 | AD123: auto_action | AE123: 1000 | AF123: sk_attack_v | AG123: B0
A124: 123 | B124: 被动，诅咒免疫 | C124: 花开见佛 | D124: 被动 | E124: 1042 | F124: 水 | I124: A0 | J124: 江湖 | K124: 自身 | AB124: 1 | AF124: cant_curse
A125: 124 | B125: 出招阶段，同时对2名对方角色造成2连击伤害 | C125: 扫荡群魔 | D125: 攻击 | E125: 512 | F125: 土 | I125: A0 | J125: 江湖 | K125: 对手 | L125: B0 | Q125: bang_eff | Y125: 2 | Z125: 300 | AB125: 2 | AC125: 向后 | AD125: auto_action | AE125: 1000 | AF125: sk_attack_p | AG125: #-B0
A126: 125 | B126: 起招阶段，增加该回合自身攻击力 | C126: 紫气东来 | D126: 增益 | E126: 274 | F126: 水 | I126: A0 | J126: 江湖 | K126: 自身 | L126: B0 | AB126: 1 | AD126: starting_turn | AE126: 1000 | AI126: 紫气东来
A127: 126 | B127: 出招阶段，同时对2名对方角色造成伤害 | C127: 无影幻脚 | D127: 攻击 | E127: 170 | F127: 木 | I127: A0 | J127: 青城派 | K127: 对手 | L127: B0 | Q127: bang_eff | AB127: 2 | AC127: 向后 | AD127: auto_action | AE127: 1000 | AF127: sk_attack_p | AG127: #-B0
A128: 127 | B128: 接招阶段，同时对3名对方角色造成伤害 | C128: 青城飞脸 | D128: 攻击 | E128: 1010 | F128: 木 | I128: A0 | J128: 青城派 | K128: 对手 | L128: B0 | Q128: bang_eff | AB128: 3 | AC128: 向后 | AD128: on_defence | AE128: 1000 | AF128: sk_attack_p | AG128: #-A0
A129: 128 | B129: 起招阶段，增加该回合自身闪避率 | C129: 青城鬼烟 | D129: 增益 | E129: 275 | F129: 木 | I129: A0 | J129: 青城派 | K129: 自身 | L129: B0 | AB129: 1 | AD129: starting_turn | AE129: 1000 | AI129: 青城鬼烟
A130: 129 | B130: 被动，防御力提升 | C130: 少林体术 | D130: 被动 | E130: 170 | F130: 金 | I130: B0 | J130: 少林寺 | K130: 自身 | AB130: 1 | AF130: ch_defence_p | AG130: #B0
A131: 130 | B131: 瞬间，攻击命中时有几率使对手在3回合内不断流失生命 | C131: 星宿毒镖 | D131: 诅咒 | E131: 620 | F131: 火 | I131: B0 | J131: 星宿派 | K131: 对手 | L131: B0 | AB131: 1 | AD131: on_hit | AE131: 500 | AI131: 腐尸毒
A132: 131 | B132: 出招阶段，对对手造成大量伤害 | C132: 青蛇毒掌 | D132: 攻击 | E132: 143 | F132: 火 | I132: B0 | J132: 星宿派 | K132: 对手 | L132: B0 | Q132: bang_eff | AB132: 1 | AD132: auto_action | AE132: 1000 | AF132: sk_attack_v | AG132: B0
A133: 132 | B133: 收招阶段，增加该回合自身闪避率 | C133: 马踏飞燕 | D133: 增益 | E133: 270 | F133: 火 | I133: B0 | J133: 江湖 | K133: 自身 | L133: B0 | AB133: 1 | AD133: ending_turn | AE133: 1000 | AI133: 马踏飞燕
A134: 133 | B134: 瞬间，攻击命中时有几率使对手在3回合内不能出招 | C134: 迅貂猛咬 | D134: 诅咒 | E134: 110 | F134: 木 | I134: A0 | J134: 西域密宗 | K134: 对手 | L134: B0 | AB134: 1 | AD134: on_hit | AE134: 300 | AI134: 貂毒
A135: 134 | B135: 出招阶段，对对手造成大量伤害 | C135: 韦陀伏魔 | D135: 攻击 | E135: 402 | F135: 金 | I135: B0 | J135: 西域密宗 | K135: 对手 | L135: B0 | Q135: bang_eff | AB135: 1 | AD135: auto_action | AE135: 1000 | AF135: sk_attack_v | AG135: B0
A136: 135 | B136: 起招阶段，增加该回合自身攻击力 | C136: 修罗真言 | D136: 增益 | E136: 420 | F136: 金 | I136: B0 | J136: 西域密宗 | K136: 自身 | L136: B0 | AB136: 1 | AD136: starting_turn | AE136: 1000 | AI136: 修罗真言
A137: 136 | B137: 出招阶段，同时对2名对方角色造成伤害 | C137: 一箭双雕 | D137: 攻击 | E137: 333 | F137: 水 | I137: B0 | J137: 西域密宗 | K137: 对手 | L137: B0 | Q137: bang_eff | AB137: 2 | AC137: 向后 | AD137: auto_action | AE137: 1000 | AF137: sk_attack_p | AG137: #-A0
A138: 137 | B138: 起招阶段，增加该回合自身暴击率 | C138: 百步穿杨 | D138: 增益 | E138: 610 | F138: 水 | I138: B0 | J138: 江湖 | K138: 自身 | L138: B0 | AB138: 1 | AD138: starting_turn | AE138: 1000 | AI138: 百步穿杨
A139: 138 | B139: 收招阶段，恢复自身大量生命 | C139: 桃谷花开 | D139: 增益 | E139: 403 | F139: 火 | I139: B0 | J139: 桃花岛 | K139: 自身 | L139: B0 | AB139: 1 | AD139: ending_turn | AE139: 1000 | AI139: 桃谷花开
A140: 139 | B140: 出招阶段，对对手造成大量伤害 | C140: 冲气穴 | D140: 攻击 | E140: 405 | F140: 水 | I140: B0 | J140: 西域密宗 | K140: 对手 | L140: B0 | Q140: bang_eff | AB140: 1 | AD140: auto_action | AE140: 1000 | AF140: sk_attack_v | AG140: B0
A141: 140 | B141: 出招阶段，对对手造成大量伤害 | C141: 日月掌法 | D141: 攻击 | E141: 121 | F141: 火 | I141: B0 | J141: 西域密宗 | K141: 对手 | L141: B0 | Q141: bang_eff | AB141: 1 | AD141: auto_action | AE141: 1000 | AF141: sk_attack_v | AG141: B0
A142: 141 | B142: 瞬间，攻击命中时有几率使对手在3回合内不断流失生命 | C142: 圣火焚身 | D142: 诅咒 | E142: 401 | F142: 火 | I142: B0 | J142: 明教 | K142: 对手 | L142: B0 | AB142: 1 | AD142: on_hit | AE142: 300 | AI142: 圣火焚身
A143: 142 | B143: 出招阶段，对对手造成大量伤害 | C143: 亢龙有悔 | D143: 攻击 | E143: 125 | F143: 土 | I143: S0 | J143: 丐帮 | K143: 对手 | L143: B0 | Q143: bang_eff | AB143: 1 | AD143: auto_action | AE143: 1000 | AF143: sk_attack_v | AG143: A0
A144: 143 | B144: 起招阶段，增加该回合自身暴击率 | C144: 圣火心法 | D144: 增益 | E144: 1041 | F144: 火 | I144: B0 | J144: 明教 | K144: 自身 | L144: B0 | AB144: 1 | AD144: starting_turn | AE144: 1000 | AI144: 圣火心法
A145: 144 | B145: 出招阶段，对对手造成大量伤害 | C145: 开山掌法 | D145: 攻击 | E145: 125 | F145: 金 | I145: B0 | J145: 江湖 | K145: 对手 | L145: B0 | Q145: bang_eff | AB145: 1 | AD145: auto_action | AE145: 1000 | AF145: sk_attack_v | AG145: B0
A146: 145 | B146: 瞬间，攻击命中时有几率使对手在3回合内不能出招 | C146: 秤钩束体 | D146: 诅咒 | E146: 170 | F146: 金 | I146: A0 | J146: 西域密宗 | K146: 对手 | L146: B0 | AB146: 1 | AD146: on_hit | AE146: 300 | AI146: 行动不便
A147: 146 | B147: 收招阶段，恢复自身大量生命 | C147: 白云出袖 | D147: 增益 | E147: 403 | F147: 金 | I147: B0 | J147: 华山派 | K147: 自身 | L147: B0 | AB147: 1 | AD147: ending_turn | AE147: 1000 | AI147: 白云出袖
A148: 147 | B148: 出招阶段，对对手造成大量伤害 | C148: 华山剑法 | D148: 攻击 | E148: 334 | F148: 金 | I148: B0 | J148: 华山派 | K148: 对手 | L148: B0 | Q148: slash_eff | AB148: 1 | AD148: auto_action | AE148: 1000 | AF148: sk_attack_v | AG148: B0
A149: 148 | B149: 被动，防御力提升 | C149: 龙盘斗里 | D149: 被动 | E149: 275 | F149: 金 | I149: B0 | J149: 江湖 | K149: 自身 | AB149: 1 | AF149: ch_defence_p | AG149: #C0
A150: 149 | B150: 接招阶段，增加该回合自身防御力 | C150: 如封似闭 | D150: 增益 | E150: 1044 | F150: 金 | I150: B0 | J150: 江湖 | K150: 自身 | L150: B0 | AB150: 1 | AD150: on_defence | AE150: 1000 | AI150: 如封似闭
A151: 150 | B151: 出招阶段，对对手造成3连击伤害 | C151: 毒镖夺命 | D151: 攻击 | E151: 620 | F151: 土 | I151: A0 | J151: 江湖 | K151: 对手 | L151: B0 | Q151: bang_eff | Y151: 3 | Z151: 300 | AB151: 1 | AD151: auto_action | AE151: 1000 | AF151: sk_attack_p | AG151: #-B0
A152: 151 | B152: 接招阶段，使对手进入生命流失状态并持续3回合 | C152: 蝎尾针 | D152: 诅咒 | E152: 273 | F152: 火 | I152: B0 | J152: 星宿派 | K152: 对手 | L152: B0 | AB152: 1 | AD152: on_defence | AE152: 1000 | AI152: 蝎毒
A153: 152 | B153: 起招阶段，增加该回合自身攻击力 | C153: 七星剑气 | D153: 增益 | E153: 334 | F153: 土 | I153: B0 | J153: 全真教 | K153: 自身 | L153: B0 | AB153: 1 | AD153: starting_turn | AE153: 1000 | AI153: 七星剑气
A154: 153 | B154: 出招阶段，对对手造成大量伤害 | C154: 峨眉剑法 | D154: 攻击 | E154: 332 | F154: 土 | I154: B0 | J154: 峨眉派 | K154: 对手 | L154: B0 | Q154: slash_eff | AB154: 1 | AD154: auto_action | AE154: 1000 | AF154: sk_attack_v | AG154: B0
A155: 154 | B155: 瞬间，攻击命中时有几率使对手在3回合内不能出招 | C155: 梅花刺 | D155: 诅咒 | E155: 331 | F155: 土 | I155: A0 | J155: 峨眉派 | K155: 对手 | L155: B0 | AB155: 1 | AD155: on_hit | AE155: 300 | AI155: 行动不便
A156: 155 | B156: 收招阶段，恢复自身大量生命 | C156: 回风拂柳 | D156: 增益 | E156: 403 | F156: 土 | I156: A0 | J156: 峨眉派 | K156: 自身 | L156: B0 | AB156: 1 | AD156: ending_turn | AE156: 1000 | AI156: 回风拂柳
A157: 156 | B157: 出招阶段，对对手造成大量伤害 | C157: 松风迅刺 | D157: 攻击 | E157: 513 | F157: 木 | I157: B0 | J157: 青城派 | K157: 对手 | L157: B0 | Q157: slash_eff | AB157: 1 | AD157: auto_action | AE157: 1000 | AF157: sk_attack_v | AG157: B0
A158: 157 | B158: 起招阶段，增加该回合自身暴击率 | C158: 青城心法 | D158: 增益 | E158: 123 | F158: 木 | I158: B0 | J158: 青城派 | K158: 自身 | L158: B0 | AB158: 1 | AD158: starting_turn | AE158: 1000 | AI158: 青城心法
A159: 158 | B159: 被动，反击率提升 | C159: 礼敬如来 | D159: 被动 | E159: 1030 | F159: 金 | I159: A0 | J159: 少林寺 | K159: 自身 | AB159: 1 | AF159: ch_counter_p | AG159: #C0
A160: 159 | B160: 出招阶段，对对手造成大量伤害 | C160: 韦陀棍法 | D160: 攻击 | E160: 402 | F160: 金 | I160: B0 | J160: 少林寺 | K160: 对手 | L160: B0 | Q160: bang_eff | AB160: 1 | AD160: auto_action | AE160: 1000 | AF160: sk_attack_v | AG160: B0
A161: 160 | B161: 被动，防御力提升 | C161: 莫容身法 | D161: 被动 | E161: 260 | F161: 土 | I161: A0 | J161: 丐帮 | K161: 自身 | AB161: 1 | AF161: ch_defence_p | AG161: #C0
A162: 161 | B162: 接招阶段，增加该回合自身防御力 | C162: 易容术 | D162: 增益 | E162: 1044 | F162: 土 | I162: A0 | J162: 丐帮 | K162: 自身 | L162: B0 | AB162: 1 | AD162: on_defence | AE162: 1000 | AI162: 易容术
A163: 162 | B163: 瞬间，攻击命中时有几率使对手在3回合内不断流失生命 | C163: 阴阳倒乱 | D163: 诅咒 | E163: 1010 | F163: 水 | I163: B0 | J163: 江湖 | K163: 对手 | L163: B0 | AB163: 1 | AD163: on_hit | AE163: 300 | AI163: 阴阳倒乱
A164: 163 | B164: 出招阶段，对对手造成大量伤害 | C164: 蚀肉掌 | D164: 攻击 | E164: 123 | F164: 金 | I164: B0 | J164: 江湖 | K164: 对手 | L164: B0 | Q164: bang_eff | AB164: 1 | AD164: auto_action | AE164: 1000 | AF164: sk_attack_v | AG164: B0
A165: 164 | B165: 起招阶段，增加该回合自身攻击力 | C165: 飞凤爪 | D165: 增益 | E165: 141 | F165: 水 | I165: B0 | J165: 江湖 | K165: 自身 | L165: B0 | AB165: 1 | AD165: starting_turn | AE165: 1000 | AI165: 飞凤爪
A166: 165 | B166: 出招阶段，对对手造成大量伤害 | C166: 明心刀法 | D166: 攻击 | E166: 512 | F166: 金 | I166: B0 | J166: 江湖 | K166: 对手 | L166: B0 | Q166: slash_eff | AB166: 1 | AD166: auto_action | AE166: 1000 | AF166: sk_attack_v | AG166: B0
A167: 166 | B167: 瞬间，攻击命中时有几率使对手在3回合内不能出招 | C167: 百炼印 | D167: 诅咒 | E167: 1041 | F167: 金 | I167: A0 | J167: 江湖 | K167: 对手 | L167: B0 | AB167: 1 | AD167: on_hit | AE167: 300 | AI167: 行动不便
A168: 167 | B168: 出招阶段，对对手造成大量伤害 | C168: 伏牛拳 | D168: 攻击 | E168: 135 | F168: 金 | I168: B0 | J168: 江湖 | K168: 对手 | L168: B0 | Q168: bang_eff | AB168: 1 | AD168: auto_action | AE168: 1000 | AF168: sk_attack_v | AG168: B0
A169: 168 | B169: 被动，暴击率提升 | C169: 断空追魂 | D169: 被动 | E169: 260 | F169: 水 | I169: B0 | J169: 江湖 | K169: 自身 | AB169: 1 | AF169: ch_crit_p | AG169: #C0
A170: 169 | B170: 瞬间，攻击命中时有几率使对手在3回合内不断流失生命 | C170: 断魂吟 | D170: 诅咒 | E170: 271 | F170: 水 | I170: B0 | J170: 江湖 | K170: 对手 | L170: B0 | AB170: 1 | AD170: on_hit | AE170: 300 | AI170: 断魂吟
A171: 170 | B171: 出招阶段，对对手造成大量伤害 | C171: 凶虎拳 | D171: 攻击 | E171: 130 | F171: 金 | I171: B0 | J171: 江湖 | K171: 对手 | L171: B0 | Q171: bang_eff | AB171: 1 | AD171: auto_action | AE171: 1000 | AF171: sk_attack_v | AG171: B0
A172: 171 | B172: 被动，暴击率提升 | C172: 虎王闪 | D172: 被动 | E172: 170 | F172: 水 | I172: B0 | J172: 江湖 | K172: 自身 | AB172: 1 | AF172: ch_crit_p | AG172: #C0
A173: 172 | B173: 起招阶段，增加该回合自身攻击力 | C173: 狂风迅雷功 | D173: 增益 | E173: 404 | F173: 水 | I173: B0 | J173: 江湖 | K173: 自身 | L173: B0 | AB173: 1 | AD173: starting_turn | AE173: 1000 | AI173: 狂风迅雷功
A174: 173 | B174: 出招阶段，对对手造成大量伤害 | C174: 降魔杖法 | D174: 攻击 | E174: 402 | F174: 金 | I174: B0 | J174: 江湖 | K174: 对手 | L174: B0 | Q174: bang_eff | AB174: 1 | AD174: auto_action | AE174: 1000 | AF174: sk_attack_v | AG174: B0
A175: 174 | B175: 被动，防御力提升 | C175: 伏魔杖法 | D175: 被动 | E175: 405 | F175: 土 | I175: A0 | J175: 丐帮 | K175: 自身 | AB175: 1 | AF175: ch_defence_p | AG175: #B0
A176: 175 | B176: 瞬间，攻击命中时有几率使对手在3回合内不能出招 | C176: 剧毒铁菱 | D176: 诅咒 | E176: 620 | F176: 金 | I176: A0 | J176: 江湖 | K176: 对手 | L176: B0 | AB176: 1 | AD176: on_hit | AE176: 300 | AI176: 行动不便
A177: 176 | B177: 出招阶段，对对手造成大量伤害 | C177: 空空拳 | D177: 攻击 | E177: 134 | F177: 金 | I177: B0 | J177: 江湖 | K177: 对手 | L177: B0 | Q177: bang_eff | AB177: 1 | AD177: auto_action | AE177: 1000 | AF177: sk_attack_v | AG177: B0
A178: 177 | B178: 瞬间，攻击命中时有几率使对手在3回合内不能出招 | C178: 分筋错骨手 | D178: 诅咒 | E178: 142 | F178: 金 | I178: A0 | J178: 江湖 | K178: 对手 | L178: B0 | AB178: 1 | AD178: on_hit | AE178: 300 | AI178: 行动不便
A179: 178 | B179: 被动，反击率提升 | C179: 金龙鞭法 | D179: 被动 | E179: 420 | F179: 金 | I179: A0 | J179: 少林寺 | K179: 自身 | AB179: 1 | AF179: ch_counter_p | AG179: #C0
A180: 179 | B180: 出招阶段，对对手造成大量伤害 | C180: 煞神掌 | D180: 攻击 | E180: 122 | F180: 金 | I180: B0 | J180: 江湖 | K180: 对手 | L180: B0 | Q180: bang_eff | AB180: 1 | AD180: auto_action | AE180: 1000 | AF180: sk_attack_v | AG180: B0
A181: 180 | B181: 起招阶段，增加该回合自身攻击力 | C181: 梵海劲 | D181: 增益 | E181: 420 | F181: 水 | I181: B0 | J181: 江湖 | K181: 自身 | L181: B0 | AB181: 1 | AD181: starting_turn | AE181: 1000 | AI181: 梵海劲
A182: 181 | B182: 起招阶段，增加该回合自身反击率 | C182: 以眼还眼 | D182: 增益 | E182: 170 | F182: 金 | I182: B0 | J182: 大理段氏 | K182: 自身 | L182: B0 | AB182: 1 | AD182: starting_turn | AE182: 1000 | AI182: 以眼还眼
A183: 182 | B183: 起招阶段，增加该回合自身攻击力 | C183: 乘热打铁 | D183: 增益 | E183: 1041 | F183: 火 | I183: C0 | J183: 江湖 | K183: 自身 | L183: B0 | AB183: 1 | AD183: starting_turn | AE183: 1000 | AI183: 乘热打铁
A184: 183 | B184: 出招阶段，对对手造成9连击伤害 | C184: 星空爆裂流 | D184: 攻击 | E184: 514 | F184: 土 | I184: A0 | J184: 江湖 | K184: 对手 | L184: B0 | Q184: slash_eff | Y184: 9 | Z184: 100 | AB184: 1 | AD184: auto_action | AE184: 1000 | AF184: sk_attack_p | AG184: #-B0
A185: 184 | B185: 出招阶段，同时对2名对方角色造成伤害 | C185: 长枪猛刺 | D185: 攻击 | E185: 512 | F185: 土 | I185: A0 | J185: 江湖 | K185: 对手 | L185: B0 | Q185: bang_eff | Y185: 1 | Z185: 300 | AB185: 2 | AC185: 向后 | AD185: auto_action | AE185: 1000 | AF185: sk_attack_p | AG185: #-S0
A186: 185 | B186: 起招阶段，增加该回合自身攻击力 | C186: 全军突击 | D186: 增益 | E186: 260 | F186: 火 | I186: C0 | J186: 江湖 | K186: 自身 | L186: B0 | AB186: 1 | AD186: starting_turn | AE186: 1000 | AI186: 全军突击
A187: 186 | B187: 接招阶段，增加该回合自身防御力 | C187: 金戈铁马 | D187: 增益 | E187: 1045 | F187: 土 | I187: A0 | J187: 丐帮 | K187: 自身 | L187: B0 | AB187: 1 | AD187: on_defence | AE187: 1000 | AI187: 金戈铁马
A188: 187 | B188: 出招阶段，对对手造成2连击伤害 | C188: 军刀乱舞 | D188: 攻击 | E188: 170 | F188: 土 | I188: A0 | J188: 江湖 | K188: 对手 | L188: B0 | Q188: slash_eff | Y188: 2 | Z188: 300 | AB188: 1 | AC188: 向后 | AD188: auto_action | AE188: 1000 | AF188: sk_attack_p | AG188: #-A0
A189: 188 | B189: 瞬间，攻击命中时有几率使对手在3回合内不断流失生命 | C189: 暗器飞掷 | D189: 诅咒 | E189: 610 | F189: 水 | I189: B0 | J189: 江湖 | K189: 对手 | L189: B0 | AB189: 1 | AD189: on_hit | AE189: 300 | AI189: 暗器飞掷
A190: 189 | B190: 被动，内力提升 | C190: 销声匿迹 | D190: 被动 | E190: 275 | F190: 金 | I190: A0 | J190: 江湖 | K190: 自身 | AB190: 1 | AF190: ch_max_mp_p | AG190: #C0
A191: 190 | B191: 被动，攻击力提升 | C191: 乘火打劫 | D191: 被动 | E191: 271 | F191: 金 | I191: A0 | J191: 江湖 | K191: 自身 | AB191: 1 | AF191: ch_attack_p | AG191: #C0
A192: 191 | B192: 收招阶段，增加该回合自身防御力 | C192: 不动如山 | D192: 增益 | E192: 280 | F192: 土 | I192: A0 | J192: 丐帮 | K192: 自身 | L192: B0 | AB192: 1 | AD192: ending_turn | AE192: 1000 | AI192: 不动如山
A193: 192 | B193: 接招阶段，增加该回合自身防御力 | C193: 太极化力 | D193: 增益 | E193: 260 | F193: 土 | I193: A0 | J193: 武当派 | K193: 自身 | L193: B0 | AB193: 1 | AD193: on_defence | AE193: 1000 | AI193: 太极化力
A194: 193 | B194: 收招阶段，增加该回合自身防御力 | C194: 罗汉在心 | D194: 增益 | E194: 512 | F194: 金 | I194: A0 | J194: 少林寺 | K194: 自身 | L194: B0 | AB194: 1 | AD194: ending_turn | AE194: 1000 | AI194: 罗汉在心
A195: 194 | B195: 收招阶段，增加该回合自身反击率 | C195: 修罗于胸 | D195: 增益 | E195: 1045 | F195: 金 | I195: A0 | J195: 少林寺 | K195: 自身 | L195: B0 | AB195: 1 | AD195: ending_turn | AE195: 1000 | AI195: 修罗于胸
A196: 195 | B196: 被动，攻击力提升 | C196: 华山心法 | D196: 被动 | E196: 420 | F196: 金 | I196: A0 | J196: 华山派 | K196: 自身 | AB196: 1 | AF196: ch_attack_p | AG196: #C0
A197: 196 | B197: 瞬间，体力不足时有几率为自身回复大量体力 | C197: 明镜止水 | D197: 增益 | E197: 1040 | F197: 金 | I197: A0 | J197: 江湖 | K197: 自身 | L197: D0 | AB197: 1 | AD197: sp_not_enough | AE197: 1000 | AI197: 明镜止水
A198: 197 | B198: 起招阶段，增加该回合自身暴击率 | C198: 嵩阳势 | D198: 增益 | E198: 121 | F198: 火 | I198: A0 | J198: 嵩山派 | K198: 自身 | L198: B0 | AB198: 1 | AD198: starting_turn | AE198: 1000 | AI198: 嵩阳势
A199: 198 | B199: 起招阶段，增加该回合自身攻击力 | C199: 落溪势 | D199: 增益 | E199: 123 | F199: 火 | I199: A0 | J199: 嵩山派 | K199: 自身 | L199: B0 | AB199: 1 | AD199: starting_turn | AE199: 1000 | AI199: 落溪势
A200: 199 | B200: 瞬间，攻击命中时有几率使对手在3回合内不断流失内力 | C200: 圣火燃心 | D200: 诅咒 | E200: 401 | F200: 火 | I200: B0 | J200: 明教 | K200: 对手 | L200: B0 | AB200: 1 | AD200: on_hit | AE200: 300 | AI200: 圣火燃心
A201: 200 | B201: 被动，内力提升 | C201: 日月同心 | D201: 被动 | E201: 1044 | F201: 火 | I201: A0 | J201: 明教 | K201: 自身 | AB201: 1 | AF201: ch_max_mp_p | AG201: #C0
A202: 201 | B202: 出招阶段，对对手造成大量伤害 | C202: 鹿杖法 | D202: 攻击 | E202: 403 | F202: 木 | I202: B0 | J202: 江湖 | K202: 对手 | L202: B0 | Q202: bang_eff | AB202: 1 | AD202: auto_action | AE202: 1000 | AF202: sk_attack_v | AG202: A0
A203: 202 | B203: 出招阶段，对对手造成大量伤害 | C203: 玄冥神掌 | D203: 攻击 | E203: 123 | F203: 水 | I203: A0 | J203: 江湖 | K203: 对手 | L203: B0 | AB203: 1 | AD203: auto_action | AE203: 1000 | AF203: sk_attack_v | AG203: A0
A204: 203 | B204: 被动，对手被【玄冥神掌】击中后流失生命 | C204: 玄冥寒毒 | D204: 被动 | E204: 124 | F204: 水 | I204: B0 | J204: 江湖 | K204: 对手 | L204: B0 | AB204: 1 | AF204: sk_add_state | AH204: 202|handu
A205: 204 | B205: 出招阶段，对对手造成大量伤害 | C205: 鹤笔法 | D205: 攻击 | E205: 420 | F205: 木 | I205: B0 | J205: 江湖 | K205: 对手 | L205: B0 | Q205: bang_eff | AB205: 1 | AD205: auto_action | AE205: 1000 | AF205: sk_attack_v | AG205: A0
A206: 205 | B206: 出招阶段，同时对2名对方角色造成2连击伤害 | C206: 八臂神剑 | D206: 攻击 | E206: 331 | F206: 水 | I206: A0 | J206: 江湖 | K206: 对手 | L206: B0 | Q206: bang_eff | Y206: 2 | Z206: 100 | AB206: 2 | AC206: 向后 | AD206: auto_action | AE206: 1000 | AF206: sk_attack_p | AG206: #-B0
A207: 206 | B207: 瞬间，攻击命中时使对手不能出招 | C207: 弹指神通 | D207: 诅咒 | E207: 142 | F207: 金 | I207: A0 | J207: 江湖 | K207: 对手 | L207: B0 | AB207: 1 | AD207: on_hit | AE207: 1000 | AI207: 行动不便
A208: 207 | B208: 出招阶段，同时对2名对方角色造成伤害 | C208: 落英神剑掌 | D208: 攻击 | E208: 141 | F208: 火 | I208: S0 | J208: 桃花岛 | K208: 对手 | L208: B0 | Q208: slash_eff | AB208: 2 | AC208: 向后 | AD208: auto_action | AE208: 1000 | AF208: sk_attack_p | AG208: #-C0
A209: 208 | B209: 起招阶段，几率性使对手在3回合内不能出招 | C209: 狮子吼 | D209: 诅咒 | E209: 142 | F209: 金 | I209: A0 | J209: 江湖 | K209: 对手 | L209: B0 | AB209: 1 | AD209: starting_turn | AE209: 300 | AI209: 行动不便
A210: 209 | B210: 出招阶段，同时对2名对方角色造成伤害 | C210: 利剑无意 | D210: 攻击 | E210: 331 | F210: 火 | I210: S0 | J210: 江湖 | K210: 对手 | L210: B0 | Q210: slash_eff | AB210: 2 | AC210: 向后 | AD210: auto_action | AE210: 1000 | AF210: sk_attack_p | AG210: #-C0
A211: 210 | B211: 起招阶段，增加该回合自身攻击力 | C211: 重剑无锋 | D211: 增益 | E211: 511 | F211: 火 | I211: A0 | J211: 江湖 | K211: 自身 | L211: B0 | AB211: 1 | AD211: starting_turn | AE211: 1000 | AI211: 重剑无锋
A212: 211 | B212: 被动，闪避率提升 | C212: 木剑无滞 | D212: 被动 | E212: 260 | F212: 水 | I212: A0 | J212: 华山派 | K212: 自身 | AB212: 1 | AF212: ch_dodge_p | AG212: #S0
A213: 212 | B213: 瞬间，攻击命中时使对手流失内力 | C213: 软剑无常 | D213: 诅咒 | E213: 401 | F213: 火 | I213: B0 | J213: 明教 | K213: 对手 | L213: B0 | AB213: 1 | AD213: on_hit | AE213: 1000 | AI213: 软剑无常
A214: 213 | B214: 接招阶段，消耗内力抵挡下次伤害 | C214: 乾坤大挪移 | D214: 增益 | E214: 1040 | F214: 火 | I214: A0 | J214: 江湖 | K214: 自身 | L214: C0 | AB214: 1 | AD214: on_defence | AE214: 1000 | AI214: 乾坤大挪移
A215: 214 | B215: 被动，诅咒免疫 | C215: 九阳神功 | D215: 被动 | E215: 1042 | F215: 金 | I215: A0 | J215: 江湖 | K215: 自身 | AB215: 1 | AF215: cant_curse
A216: 215 | B216: 瞬间，攻击命中时使对手流失体力 | C216: 圣火令神功 | D216: 诅咒 | E216: 401 | F216: 火 | I216: B0 | J216: 明教 | K216: 对手 | L216: B0 | AB216: 1 | AD216: on_hit | AE216: 1000 | AI216: 圣火燃骨
A217: 216 | B217: 接招阶段，对对手造成所受伤害的一部分 | C217: 斗转星移 | D217: 增益 | E217: 1044 | F217: 水 | I217: S0 | J217: 姑苏慕容 | K217: 自身 | L217: B0 | AB217: 1 | AD217: on_defence | AE217: 1000 | AI217: 斗转星移
A218: 217 | B218: 被动，反击率提升 | C218: 精通武学 | D218: 被动 | E218: 1044 | F218: 木 | I218: A0 | J218: 姑苏慕容 | K218: 自身 | AB218: 1 | AF218: ch_counter_p | AG218: #A0
A219: 218 | B219: 出招阶段，对对手造成2连击伤害 | C219: 慕容剑法 | D219: 攻击 | E219: 511 | F219: 金 | I219: A0 | J219: 姑苏慕容 | K219: 对手 | L219: B0 | Q219: slash_eff | Y219: 2 | Z219: 300 | AB219: 1 | AD219: auto_action | AE219: 1000 | AF219: sk_attack_p | AG219: #-C0
A220: 219 | B220: 接招阶段，几率性使对手在3回合内不能出招 | C220: 龙爪手 | D220: 诅咒 | E220: 280 | F220: 木 | I220: A0 | J220: 少林寺 | K220: 对手 | L220: B0 | AB220: 1 | AD220: on_defence | AE220: 300 | AI220: 行动不便
A221: 220 | B221: 被动，暴击率提升 | C221: 潜龙勿用 | D221: 被动 | E221: 170 | F221: 火 | I221: A0 | J221: 丐帮 | K221: 自身 | AB221: 1 | AF221: ch_crit_p | AG221: #S0
A222: 221 | B222: 起招阶段，几率2回合自身闪避率大幅提升 | C222: 凌波微步 | D222: 增益 | E222: 270 | F222: 水 | I222: A0 | J222: 江湖 | K222: 自身 | L222: B0 | AB222: 1 | AD222: starting_turn | AE222: 400 | AI222: 凌波微步
A223: 222 | B223: 出招阶段，同时对3名对方角色造成2连击伤害 | C223: 六脉神剑 | D223: 攻击 | E223: 331 | F223: 金 | I223: S0 | J223: 大理段氏 | K223: 对手 | L223: B0 | Q223: bang_eff | Y223: 2 | Z223: 100 | AB223: 3 | AC223: 向后 | AD223: auto_action | AE223: 1000 | AF223: sk_attack_p | AG223: #-B0
A224: 223 | B224: 被动，内力提升 | C224: 段式心法 | D224: 被动 | E224: 420 | F224: 水 | I224: A0 | J224: 大理段氏 | K224: 自身 | AB224: 1 | AF224: ch_max_mp_p | AG224: #S0
A225: 224 | B225: 被动，诅咒免疫 | C225: 五毒不侵 | D225: 被动 | E225: 1043 | F225: 水 | I225: A0 | J225: 江湖 | K225: 自身 | AB225: 1 | AF225: cant_curse
A226: 225 | B226: 接招阶段，消耗内力抵挡下次伤害 | C226: 紫霞神功 | D226: 增益 | E226: 1044 | F226: 水 | I226: S0 | J226: 华山派 | K226: 自身 | L226: C0 | AB226: 1 | AD226: on_defence | AE226: 1000 | AI226: 紫霞神功
A227: 226 | B227: 出招阶段，同时对3名对方角色造成伤害 | C227: 夺命三仙剑 | D227: 攻击 | E227: 331 | F227: 水 | I227: S0 | J227: 华山派 | K227: 对手 | L227: B0 | Q227: slash_eff | AB227: 3 | AC227: 向后 | AD227: auto_action | AE227: 1000 | AF227: sk_attack_p | AG227: #-C0
A228: 227 | B228: 瞬间，体力不足时使自身攻击力不断增加 | C228: 太岳三青峰 | D228: 增益 | E228: 331 | F228: 水 | I228: S0 | J228: 华山派 | K228: 对手 | L228: D0 | AB228: 1 | AD228: sp_not_enough | AE228: 1000 | AI228: 太岳三青峰
A229: 228 | B229: 出招阶段，对对手造成大量伤害 | C229: 冰蚕毒掌 | D229: 攻击 | E229: 123 | F229: 水 | I229: A0 | J229: 江湖 | K229: 对手 | L229: B0 | AB229: 1 | AD229: auto_action | AE229: 1000 | AF229: sk_attack_v | AG229: A0
A230: 229 | B230: 被动，对手被【冰蚕毒掌】击中后流失体力 | C230: 冰蚕寒毒 | D230: 被动 | E230: 124 | F230: 水 | I230: B0 | J230: 江湖 | K230: 对手 | L230: B0 | AB230: 1 | AF230: sk_add_state | AH230: 228|bingchanhandu
A231: 230 | B231: 瞬间，攻击命中时有几率使对手在3回合内不断流失生命 | C231: 腐尸剧毒 | D231: 诅咒 | E231: 620 | F231: 木 | I231: B0 | J231: 星宿派 | K231: 对手 | L231: B0 | AB231: 1 | AD231: on_hit | AE231: 300 | AI231: 腐尸毒
A232: 231 | B232: 被动，诅咒免疫 | C232: 神足经 | D232: 被动 | E232: 1044 | F232: 火 | I232: A0 | J232: 江湖 | K232: 自身 | AB232: 1 | AF232: cant_curse
A233: 232 | B233: 瞬间，体力不足时使自身闪避率不断增加 | C233: 太极无形 | D233: 增益 | E233: 1010 | F233: 水 | I233: S0 | J233: 华山派 | K233: 自身 | L233: D0 | AB233: 1 | AD233: sp_not_enough | AE233: 1000 | AI233: 太极无形
A234: 233 | B234: 出招阶段，对对手造成3连击伤害 | C234: 天下无狗 | D234: 攻击 | E234: 620 | F234: 火 | I234: A0 | J234: 丐帮 | K234: 对手 | L234: B0 | Q234: bang_eff | Y234: 3 | Z234: 300 | AB234: 1 | AC234: 向后 | AD234: auto_action | AE234: 1000 | AF234: sk_attack_p | AG234: #-C0
A235: 234 | B235: 起招阶段，几率自身攻击力不断增加持续3回合 | C235: 飞龙在天 | D235: 增益 | E235: 122 | F235: 金 | I235: A0 | J235: 丐帮 | K235: 自身 | L235: B0 | AB235: 1 | AD235: starting_turn | AE235: 400 | AI235: 飞龙在天
A236: 235 | B236: 收招阶段，增加该回合自身反击率 | C236: 神龙摆尾 | D236: 增益 | E236: 1045 | F236: 土 | I236: B0 | J236: 丐帮 | K236: 自身 | L236: C0 | AB236: 1 | AD236: ending_turn | AE236: 1000 | AI236: 神龙摆尾
A237: 236 | B237: 瞬间，攻击命中时有几率大幅提升暴击率持续2回合 | C237: 龙战于野 | D237: 增益 | E237: 123 | F237: 土 | I237: A0 | J237: 丐帮 | K237: 自身 | L237: C0 | AB237: 1 | AD237: on_hit | AE237: 300 | AI237: 降龙掌势
A238: 239 | B238: 瞬间，生命不足时有几率为自身恢复大量生命 | C238: 龟息术 | D238: 气功 | E238: 420 | F238: 水 | I238: A0 | J238: 星宿派 | K238: 自身 | L238: B0 | O238: magic | AB238: 1 | AD238: hp_not_enough | AE238: 500 | AF238: ch_hp_p | AG238: #A0
A239: 238 | B239: 出招阶段，对对手造成大量伤害 | C239: 小无相功 | D239: 攻击 | E239: 270 | F239: 金 | I239: B0 | J239: 逍遥派 | K239: 对手 | L239: B0 | Q239: slash_eff | AB239: 1 | AD239: auto_action | AE239: 1000 | AF239: sk_attack_p | AG239: A0
A240: 237 | B240: 接招阶段，使对手进入内力流失状态并持续3回合 | C240: 化功大法 | D240: 诅咒 | E240: 330 | F240: 土 | I240: A0 | J240: 星宿派 | K240: 对手 | L240: B0 | AB240: 1 | AD240: on_defence | AE240: 1000 | AI240: 化功大法
A241: 240 | B241: 收招阶段，使对手生命流失 | C241: 灵蛇出洞 | D241: 气功 | E241: 401 | F241: 火 | I241: S0 | J241: 西域密宗 | K241: 对手 | L241: D0 | AB241: 1 | AD241: ending_turn | AE241: 1000 | AF241: ch_hp_v | AG241: #-S4
A242: 241 | B242: 出招阶段，对5名对手造成伤害 | C242: 漫天蛇影 | D242: 攻击 | E242: 1041 | F242: 火 | I242: S0 | J242: 西域密宗 | K242: 对手 | L242: D0 | Q242: bang_eff | AB242: 5 | AC242: 向后 | AD242: auto_action | AE242: 1000 | AF242: sk_attack_v | AG242: D0

Sheet: 状态配置表old
A1: 状态ID | B1: 杀伤 | C1: 状态名 | D1: 图标 | E1: 状态类型 | F1: 持续时间 | G1: 状态动作 | H1: 状态特效 | I1: 状态声音 | J1: 播放时间 | K1: 魔法属性ID | L1: 魔法属性效果 | M1: 魔法属性参数
A2: id | B2: power | C2: name | D2: icon | E2: type | F2: duration | G2: buff_action | H2: buff_effect | I2: buff_sound | J2: delay | K2: magic_id | L2: !magic_eff | M2: magic_params
A3: baihexiangkong | C3: 白鹤翔空 | D3: 9993 | E3: 增益 | F3: 1 | H3: buff_up | K3: ch_defence_p | L3: #C0
A4: dingshen | C4: 行动不便 | D4: 9999 | E4: 诅咒 | F4: 3 | H4: debuff | K4: cant_action
A5: zanglie | C5: 脏裂 | D5: 9998 | E5: 诅咒 | F5: 3 | H5: debuff | K5: float_sp_v | L5: ="-"&"A0" -> -A0
A6: chongxuyangqi | C6: 冲虚养气 | D6: 9984 | E6: 增益 | F6: 1 | H6: buff_up | K6: float_mp_p | L6: #A0
A7: ningshiyijian | C7: 宁氏一剑 | D7: 9992 | E7: 增益 | F7: 1 | H7: buff_up | K7: ch_attack_p | L7: #B0
A8: taxuewuhen | C8: 踏雪无痕 | D8: 9996 | E8: 增益 | F8: 1 | H8: buff_up | K8: ch_dodge_p | L8: #S0
A9: yiluanxinji | C9: 意乱心急 | D9: 9983 | E9: 诅咒 | F9: 3 | H9: debuff | K9: float_mp_v | L9: ="-"&"A0" -> -A0
A10: qinyimianmian | C10: 琴音缭绕 | D10: 1040 | E10: 增益 | F10: 1 | H10: buff_up | K10: cancel_damage_cost_mp_v | L10: B0
A11: lingdanmiaoyao | C11: 灵丹妙药 | D11: 9981 | E11: 增益 | F11: 1 | H11: buff_up | K11: float_hp_v | L11: A0
A12: qisihuisheng | C12: 起死回生 | D12: 9981 | E12: 增益 | F12: 1 | H12: buff_up | K12: float_hp_p | L12: #A0
A13: chengshengzhuiji | C13: 乘胜追击 | D13: 9992 | E13: 增益 | F13: 1 | H13: buff_up | K13: ch_attack_v | L13: C0
A14: shawu | C14: 沙雾 | D14: 9982 | E14: 诅咒 | F14: 3 | H14: debuff | K14: cant_dodge
A15: songyangshenzhang | C15: 嵩阳神掌 | D15: 9994 | E15: 增益 | F15: 1 | H15: buff_up | K15: ch_crit_p | L15: #A0
A16: hanqitougu | C16: 寒气透骨 | D16: 9999 | E16: 诅咒 | F16: 3 | H16: debuff | K16: cant_action
A17: kuangfengdaofa | C17: 狂风刀法 | D17: 9992 | E17: 增益 | F17: 1 | H17: buff_up | K17: ch_attack_p | L17: #B0
A18: hanqihuti | C18: 寒气护体 | D18: 1040 | E18: 增益 | F18: 1 | H18: buff_up | K18: rebound_hp_p | L18: #A0
A19: juhuashi | C19: 聚花势 | D19: 9993 | E19: 增益 | F19: 1 | H19: buff_up | K19: ch_defence_p | L19: #B0
A20: langjuanyunfei | C20: 浪卷云飞 | D20: 9995 | E20: 增益 | F20: 1 | H20: buff_up | K20: ch_counter_p | L20: #A0
A21: yihuajiemu | C21: 移花接木 | D21: 9996 | E21: 增益 | F21: 1 | H21: buff_up | K21: ch_dodge_p | L21: #B0
A22: xuemaishousun | C22: 穴脉受损 | D22: 9980 | E22: 诅咒 | F22: 3 | H22: debuff | K22: float_hp_v | L22: ="-"&"A0" -> -A0
A23: wuyingxiedu | C23: 无影蝎毒 | D23: 9998 | E23: 诅咒 | F23: 3 | H23: debuff | K23: float_sp_v | L23: ="-"&"A0" -> -A0
A24: lingfengjianqi | C24: 凌风剑气 | D24: 9992 | E24: 增益 | F24: 1 | H24: buff_up | K24: ch_attack_p | L24: #B0
A25: heibaijiebin | C25: 黑白皆兵 | D25: 1040 | E25: 增益 | F25: 1 | H25: buff_up | K25: cancel_damage_cost_mp_v | L25: B0
A26: cihangpudu | C26: 慈航普度 | D26: 9981 | E26: 增益 | F26: 1 | H26: buff_up | K26: float_hp_v | L26: B0
A27: wuebuzuo | C27: 无恶不作 | D27: 9994 | E27: 增益 | F27: 1 | H27: buff_up | K27: ch_crit_p | L27: #A0
A28: qingchengxinfa | C28: 青城心法 | D28: 9994 | E28: 增益 | F28: 1 | H28: buff_up | K28: ch_crit_p | L28: #B0
A29: yiyanhuanyan | C29: 以眼还眼 | D29: 9995 | E29: 增益 | F29: 1 | H29: buff_up | K29: ch_counter_p | L29: #B0
A30: lixiaoqisan | C30: 力消气散 | D30: 9999 | E30: 诅咒 | F30: 3 | H30: debuff | K30: cant_action
A31: xiongshenesha | C31: 凶神恶煞 | D31: 9992 | E31: 增益 | F31: 1 | H31: buff_up | K31: ch_attack_p | L31: #B0
A32: nianyishibadie | C32: 粘衣十八跌 | D32: 1040 | E32: 增益 | F32: 1 | H32: buff_up | K32: rebound_hp_p | L32: #A0
A33: zhengyangqichang | C33: 正阳气场 | D33: 9993 | E33: 增益 | F33: 1 | H33: buff_up | K33: ch_defence_p | L33: #C0
A34: yishouweigong | C34: 以守为攻 | D34: 9995 | E34: 增益 | F34: 1 | H34: buff_up | K34: ch_counter_p | L34: #B0
A35: qiongxiongjie | C35: 穷凶极恶 | D35: 9992 | E35: 增益 | F35: 1 | H35: buff_up | K35: ch_attack_p | L35: #B0
A36: tiebushan | C36: 铁布衫 | D36: 9993 | E36: 增益 | F36: 1 | H36: buff_up | K36: ch_defence_p | L36: #B0
A37: milehushen | C37: 弥勒护身 | D37: 1040 | E37: 增益 | F37: 1 | H37: buff_up | K37: rebound_hp_p | L37: #A0
A38: bangdagoutou | C38: 棒打狗头 | D38: 9992 | E38: 增益 | F38: 1 | H38: buff_up | K38: ch_attack_p | L38: #A0
A39: sanjingdusha | C39: 散筋毒砂 | D39: 9998 | E39: 诅咒 | F39: 3 | H39: debuff | K39: float_sp_v | L39: ="-"&"A0" -> -A0
A40: yunwushisanshi | C40: 云雾十三式 | D40: 9995 | E40: 增益 | F40: 1 | H40: buff_up | K40: ch_counter_p | L40: #S0
A41: shouwucuntie | C41: 手无寸铁 | D41: 9999 | E41: 诅咒 | F41: 3 | H41: debuff | K41: cant_action
A42: huaqishi | C42: 化气式 | D42: 1040 | E42: 增益 | F42: 1 | H42: buff_up | K42: rebound_hp_p | L42: #A0
A43: jiansuojiangshan | C43: 剑锁江山 | D43: 9999 | E43: 诅咒 | F43: 3 | H43: debuff | K43: cant_action
A44: yiguangdaoxia | C44: 仪光道霞 | D44: 9981 | E44: 增益 | F44: 1 | H44: buff_up | K44: float_hp_v | L44: A0
A45: yujianshi | C45: 御剑势 | D45: 9993 | E45: 增益 | F45: 1 | H45: buff_up | K45: ch_defence_p | L45: #C0
A46: zhangyanfa | C46: 障眼法 | D46: 1040 | E46: 增益 | F46: 1 | H46: buff_up | K46: cancel_damage_cost_mp_v | L46: B0
A47: jingyingchenbi | C47: 静影沉璧 | D47: 9993 | E47: 增益 | F47: 1 | H47: buff_up | K47: ch_defence_p | L47: #C0
A48: zhenwushenti | C48: 真武圣体 | D48: 1040 | E48: 增益 | F48: 1 | H48: buff_up | K48: rebound_hp_p | L48: #A0
A49: wuqizhaoyuan | C49: 五气朝元 | D49: 1040 | E49: 增益 | F49: 1 | H49: buff_up | K49: cancel_damage_cost_mp_v | L49: B0
A50: sanqigong | C50: 散气功 | D50: 9983 | E50: 诅咒 | F50: 3 | H50: debuff | K50: float_mp_v | L50: ="-"&"A0" -> -A0
A51: tianwanghuihui | C51: 天网恢恢 | D51: 9993 | E51: 增益 | F51: 1 | H51: buff_up | K51: ch_defence_p | L51: #C0
A52: baguazhishu | C52: 八卦之术 | D52: 9993 | E52: 增益 | F52: 1 | H52: buff_up | K52: ch_defence_p | L52: #C0
A53: tiyunzong | C53: 梯云纵 | D53: 9996 | E53: 增益 | F53: 1 | H53: buff_up | K53: ch_dodge_p | L53: #S0
A54: ziqidonglai | C54: 紫气东来 | D54: 9992 | E54: 增益 | F54: 1 | H54: buff_up | K54: ch_attack_p | L54: #A0
A55: qingchengguiyan | C55: 青城鬼烟 | D55: 9996 | E55: 增益 | F55: 1 | H55: buff_up | K55: ch_dodge_p | L55: #S0
A56: wushenjian | C56: 五神剑 | D56: 9992 | E56: 增益 | F56: 1 | H56: buff_up | K56: ch_attack_p | L56: #A0
A57: jiuzhuandancheng | C57: 九转丹成 | D57: 9981 | E57: 增益 | F57: 1 | H57: buff_up | K57: float_hp_v | L57: B0
A58: wudangchangquan | C58: 武当长拳 | D58: 9992 | E58: 增益 | F58: 1 | H58: buff_up | K58: ch_attack_p | L58: #A0
A59: fushidu | C59: 腐尸毒 | D59: 9980 | E59: 诅咒 | F59: 3 | H59: debuff | K59: float_hp_v | L59: ="-"&"A0" -> -A0
A60: matafeiyan | C60: 马踏飞燕 | D60: 9996 | E60: 增益 | F60: 1 | H60: buff_up | K60: ch_dodge_p | L60: #B0
A61: diaodu | C61: 貂毒 | D61: 9999 | E61: 诅咒 | F61: 3 | H61: debuff | K61: cant_action
A62: xiuluozhenyan | C62: 修罗真言 | D62: 9992 | E62: 增益 | F62: 1 | H62: buff_up | K62: ch_attack_v | L62: C0
A63: baibuchuanyang | C63: 百步穿杨 | D63: 9994 | E63: 增益 | F63: 1 | H63: buff_up | K63: ch_crit_p | L63: #B0
A64: chongqixue | C64: 桃谷花开 | D64: 9981 | E64: 增益 | F64: 1 | H64: buff_up | K64: float_hp_v | L64: B0
A65: shenghuofenshen | C65: 圣火焚身 | D65: 9980 | E65: 诅咒 | F65: 3 | H65: debuff | K65: float_hp_v | L65: ="-"&"B0" -> -B0
A66: shenghuoxinfa | C66: 圣火心法 | D66: 9994 | E66: 增益 | F66: 1 | H66: buff_up | K66: ch_crit_p | L66: #B0
A67: baiyunchuxiu | C67: 白云出袖 | D67: 9981 | E67: 增益 | F67: 1 | H67: buff_up | K67: float_hp_v | L67: B0
A68: rufengsibi | C68: 如封似闭 | D68: 9993 | E68: 增益 | F68: 1 | H68: buff_up | K68: ch_defence_p | L68: #C0
A69: xiedu | C69: 蝎毒 | D69: 9980 | E69: 诅咒 | F69: 3 | H69: debuff | K69: float_hp_v | L69: ="-"&"B0" -> -B0
A70: qixingjianqi | C70: 七星剑气 | D70: 9992 | E70: 增益 | F70: 1 | H70: buff_up | K70: ch_attack_p | L70: #B0
A71: huifengfuliu | C71: 回风拂柳 | D71: 9981 | E71: 增益 | F71: 1 | H71: buff_up | K71: float_hp_v | L71: B0
A72: yirongshu | C72: 易容术 | D72: 9993 | E72: 增益 | F72: 1 | H72: buff_up | K72: ch_defence_p | L72: #B0
A73: yinyangdaoluan | C73: 阴阳倒乱 | D73: 9980 | E73: 诅咒 | F73: 3 | H73: debuff | K73: float_hp_v | L73: ="-"&"B0" -> -B0
A74: feifengzhua | C74: 飞凤爪 | D74: 9992 | E74: 增益 | F74: 1 | H74: buff_up | K74: ch_attack_p | L74: #B0
A75: duanhunying | C75: 断魂吟 | D75: 9980 | E75: 诅咒 | F75: 3 | H75: debuff | K75: float_hp_v | L75: ="-"&"B0" -> -B0
A76: kuangfengxunleigong | C76: 狂风迅雷功 | D76: 9992 | E76: 增益 | F76: 1 | H76: buff_up | K76: ch_attack_p | L76: #A0
A77: fanhaijing | C77: 梵海劲 | D77: 9992 | E77: 增益 | F77: 1 | H77: buff_up | K77: ch_attack_p | L77: #B0
A78: chengredatie | C78: 乘热打铁 | D78: 9992 | E78: 增益 | F78: 1 | H78: buff_up | K78: ch_attack_v | L78: C0
A79: quanjuntuji | C79: 全军突击 | D79: 9992 | E79: 增益 | F79: 1 | H79: buff_up | K79: ch_attack_v | L79: C0
A80: jingetiema | C80: 金戈铁马 | D80: 9993 | E80: 增益 | F80: 1 | H80: buff_up | K80: ch_defence_p | L80: #C0
A81: anqifeizhi | C81: 暗器飞掷 | D81: 9980 | E81: 诅咒 | F81: 3 | H81: debuff | K81: float_hp_v | L81: ="-"&"B0" -> -B0
A82: budongrushan | C82: 不动如山 | D82: 9993 | E82: 增益 | F82: 1 | H82: buff_up | K82: ch_defence_p | L82: #C0
A83: taijihuali | C83: 太极化力 | D83: 9993 | E83: 增益 | F83: 1 | H83: buff_up | K83: ch_defence_p | L83: #C0
A84: luohanzaixin | C84: 罗汉在心 | D84: 9993 | E84: 增益 | F84: 1 | H84: buff_up | K84: ch_defence_p | L84: #B0
A85: xiuluoyuxiong | C85: 修罗于胸 | D85: 9995 | E85: 增益 | F85: 1 | H85: buff_up | K85: ch_counter_p | L85: #B0
A86: mingjingzhishui | C86: 明镜止水 | D86: 9997 | E86: 增益 | F86: 1 | H86: buff_up | K86: float_sp_p | L86: ="#"&"A0" -> #A0
A87: songyangxinfa | C87: 嵩阳势 | D87: 9994 | E87: 增益 | F87: 1 | H87: buff_up | K87: ch_crit_p | L87: #B0
A88: luoxishi | C88: 落溪势 | D88: 9992 | E88: 增益 | F88: 1 | H88: buff_up | K88: ch_attack_p | L88: #B0
A89: shenghuoranxin | C89: 圣火燃心 | D89: 9983 | E89: 诅咒 | F89: 3 | H89: debuff | K89: float_mp_v | L89: ="-"&"C0" -> -C0
A90: handu | C90: 寒毒 | D90: 9983 | E90: 诅咒 | F90: 1 | H90: debuff | K90: float_hp_v | L90: ="-"&"A0" -> -A0
A91: zhongjianwufeng | C91: 重剑无锋 | D91: 9992 | E91: 增益 | F91: 1 | H91: buff_up | K91: ch_attack_p | L91: #S0
A92: ruanjianwuchang | C92: 软剑无常 | D92: 9983 | E92: 诅咒 | F92: 1 | H92: debuff | K92: float_mp_v | L92: ="-"&"S0" -> -S0
A93: qiankundanuoyi | C93: 乾坤大挪移 | D93: 1040 | E93: 增益 | F93: 1 | H93: buff_up | K93: cancel_damage_cost_mp_v | L93: C0
A94: shenghuorangu | C94: 圣火燃骨 | D94: 9998 | E94: 诅咒 | F94: 1 | H94: debuff | K94: float_sp_v | L94: =""&"-S0" -> -S0
A95: douzhuanxingyi | C95: 斗转星移 | D95: 1040 | E95: 增益 | F95: 1 | H95: buff_up | K95: rebound_hp_p | L95: #S0
A96: longzhuashou | C96: 龙爪手 | D96: 9982 | E96: 诅咒 | F96: 1 | H96: debuff | K96: cant_dodge
A97: lingboweibu | C97: 凌波微步 | D97: 9996 | E97: 增益 | F97: 3 | H97: buff_up | K97: ch_dodge_p | L97: #S0
A98: qianlongwuyong | C98: 潜龙勿用 | D98: 9992 | E98: 增益 | F98: 1 | H98: buff_up | K98: ch_crit_p | L98: #S0
A99: zixiashengong | C99: 紫霞神功 | D99: 1040 | E99: 增益 | F99: 1 | H99: buff_up | K99: cancel_damage_cost_mp_v | L99: C0
A100: taiyuesanqingfeng | C100: 太岳三青峰 | D100: 9992 | E100: 增益 | F100: -1 | H100: buff_up | K100: float_attack_p | L100: #A0
A101: bingchanhandu | C101: 冰蚕寒毒 | D101: 9983 | E101: 诅咒 | F101: 1 | H101: debuff | K101: float_sp_v | L101: ="-"&"A0" -> -A0
A102: taijiwuxing | C102: 太极无形 | D102: 9996 | E102: 增益 | F102: -1 | H102: buff_up | K102: float_dodge_p | L102: #S0
A103: xianglongzhangshi | C103: 降龙掌势 | D103: 9994 | E103: 增益 | F103: 2 | H103: buff_up | K103: ch_crit_p | L103: #S0
A104: feilongzaitian | C104: 飞龙在天 | D104: 9992 | E104: 增益 | F104: 3 | H104: buff_up | K104: float_attack_p | L104: #A0
A105: shenlongbaiwei | C105: 神龙摆尾 | D105: 9995 | E105: 增益 | F105: 1 | H105: buff_up | K105: ch_counter_p | L105: #A0
A106: huagongdafa | C106: 化功大法 | D106: 9983 | E106: 诅咒 | F106: 3 | H106: debuff | K106: float_mp_p | L106: #-S0

Sheet: 魔法属性表
A1: no | B1: id | C1: summary | D1: desc | E1: effect | F1: param | G1: comment
A2: no | B2: id | C2: summary | D2: desc | E2: effect | F2: param | G2: comment
A3: 0 | B3: ch_attack_v | C3: 攻击力增加/减少点数值 | D3: 攻击力：+x点 | E3: 攻击力要改变的点数值 | F3: 无 | G3: +x是一个替代值，其中+表示该替代如果大于等于0，替代为增加x，小于0，替代为减少x。
A4: 1 | B4: ch_attack_p | C4: 攻击力增加/减少百分比 | D4: 攻击力：+p% | E4: 攻击力要改变的百分比数值 | F4: 无 | G4: +p是一个替代值，其中+表示该替代如果大于等于0，替代为增加(p/10)%，小于0，替代为减少(p/10)%，其中p是一个1000为底的整数值，真实的计算值应该除以1000，而显示值需要除以10，小数点后保留1位。
A5: 2 | B5: ch_tall_attack_v | C5: 攻击力上限值增加/减少点数值 | D5: 攻击力上限：+x点 | E5: 攻击力上限要改变的点数值 | G5: 攻击上限值不能小于攻击力下限值，当攻击力上限值小于下限值的时候，采用下限值。 tall_attack=tall_attack_v*(1+tall_attack_p)
A6: 3 | B6: ch_tall_attack_p | C6: 攻击力上限增加/减少百分比 | D6: 攻击力上限：+p% | E6: 攻击力上限要改变的百分比数值 | G6: 攻击上限值不能小于攻击力下限值，当攻击力上限值小于下限值的时候，采用下限值。 tall_attack=tall_attack_v*(1+tall_attack_p)
A7: 4 | B7: ch_low_attack_v | C7: 攻击力下限增加/减少点数值 | D7: 攻击力下限：+x点 | E7: 攻击力下限要改变的点数值 | G7: 攻击下限值不能大于攻击力上限值，当攻击力下限值大于上限值的时候，采用上限值。 low_attack=low_attack_v*(1+low_attack_p)
A8: 5 | B8: ch_low_attack_p | C8: 攻击力下限增加/减少百分比 | D8: 攻击力下限：+p% | E8: 攻击力下限要改变的百分比值 | G8: 攻击下限值不能大于攻击力上限值，当攻击力下限值大于上限值的时候，采用上限值。 low_attack=low_attack_v*(1+low_attack_p)
A9: 6 | B9: sk_attack_v | C9: 技能攻击力点数 | D9: 攻击力：+x点 | E9: 攻击力的点数值 | G9: x前没有+号表示，这个值不会随着正负显示增加或减少的文字。该属性只能配置与战斗技能上，才不会产生混淆，因为战斗技能是施展的时候才有数值，且这个数值战斗结算过后，立刻消失，所以该数值属于一个读取性数值。即，在战斗需要时，读取该值，代入公式，进行计算。
A10: 7 | B10: sk_attack_p | C10: 技能攻击力百分比值 | D10: 攻击力：+p% | E10: 攻击力的百分比数值 | G10: p前没有+号，表示这个值不会随着其值的正负显示增加或者减少的文字。 该属性只能配置在战斗技能a上，才不会产生混淆。因为战斗技能是施展的时候才有数值，且这个数值战斗结算过后，立刻消失，所以该数值属于一个读取性数值。即，在战斗需要时，读取该值，代入公式，进行计算。
A11: 8 | B11: sk_attack_range_v | C11: 技能攻击范围值 | D11: 攻击力：x0~x1点 | E11: 数组值，单元0放置攻击下限点数，单元1放置攻击上限点数 | G11: x0表示效果值的单元0的数值，x1表示效果值的单元1数值
A12: 9 | B12: sk_attack_range_p | C12: 技能攻击范围百分比 | D12: 攻击力：p0~p1% | E12: 数组值，单元0放置攻击下限点数，单元1放置攻击上限百分比 | G12: p0表示效果值的单元0的数值的百分比，p1表示效果值的单元1百分比值，其值是以1000为底的整数，真实值需要除以1000，显示值需要除以10，小数点后保留1位
A13: 10 | B13: float_attack_v | C13: 攻击力增幅点数 | D13: 每回合攻击力：+~x点 | E13: 增幅点数，正数表增加，负数表衰减 | G13: float系列为临时性增减属性，它不同于ch系列魔法属性，是永久性增减，float系列一般在战斗用每回合增减，战斗结束，增减效果消失。+~是转义符号，当后面的值为正数是+~转义为“增幅”，当后面的值为负数的时候，+~转义为“衰减”。
A14: 11 | B14: float_attack_p | C14: 攻击力增幅百分比 | D14: 每回合攻击力：+~p% | E14: 增幅百分比 | G14: 同上
A15: 12 | B15: float_tall_attack_v | C15: 攻击力上限增幅点数 | D15: 每回合攻击力上限：+~x点 | E15: 攻击力上限增幅点数 | G15: 同上
A16: 13 | B16: float_tall_attack_p | C16: 攻击力上限增幅百分比 | D16: 每回合攻击力上限：+~p% | E16: 攻击力上限增幅百分比数 | G16: 同上
A17: 14 | B17: float_low_attack_v | C17: 攻击力下限增幅点数 | D17: 每回合攻击力下限：+~x点 | E17: 攻击力下限增幅点数 | G17: 同上
A18: 15 | B18: float_low_attack_p | C18: 攻击力下限增幅百分比 | D18: 每回合攻击力下限：+~p% | E18: 攻击力下限增幅百分比数 | G18: 同上
A19: 16 | B19: ch_defence_v | C19: 防御力改变点数 | D19: 防御力：+x点 | E19: 防御力增加点数值
A20: 17 | B20: ch_defence_p | C20: 防御力改变百分比 | D20: 防御力：+p% | E20: 防御力增加百分比值
A21: 18 | B21: float_defence_v | C21: 防御力增幅点数 | D21: 每回合防御力：+~x点 | E21: 攻击力增幅点数值
A22: 19 | B22: float_defence_p | C22: 防御力增幅百分比 | D22: 每回合防御力：+~p% | E22: 攻击力增幅百分比值
A23: 20 | B23: ch_max_hp_v | C23: 生命上限改变点数 | D23: 生命上限：+x点 | E23: 生命上限增加点数值
A24: 21 | B24: ch_max_hp_p | C24: 生命上限改变百分比 | D24: 生命上限：+p% | E24: 生命上限增加百分比值
A25: 22 | B25: float_hp_v | C25: 生命回复点数 | D25: 每回合生命：+#x点 | E25: 生命回复点数值 | G25: 参见攻击力增幅。+#是转移符号，当后面的值为正数时，+#转移为“回复”，当+#后面的值为负数时，转义为“损失”
A26: 23 | B26: float_hp_p | C26: 生命回复百分比 | D26: 每回合生命：+#p% | E26: 生命回复百分比值 | G26: 同上
A27: 24 | B27: ch_max_mp_v | C27: 内力上限改变点数 | D27: 内力上限：+x点 | E27: 内力上限增加点数值 | G27: 同上
A28: 25 | B28: ch_max_mp_p | C28: 内力上限改变百分比 | D28: 内力上限：+p% | E28: 内力上限增加百分比值 | G28: 同上
A29: 26 | B29: float_mp_v | C29: 内力回复点数 | D29: 每回合内力：+#x点 | E29: 内力回复点数值 | G29: 同上
A30: 27 | B30: float_mp_p | C30: 内力回复百分比 | D30: 每回合内力：+#p% | E30: 内力回复百分比值 | G30: 同上
A31: 28 | B31: ch_max_sp_v | C31: 体力上限改变点数 | D31: 体力上限：+x点 | E31: 体力上限增加点数值 | G31: 同上
A32: 29 | B32: ch_max_sp_p | C32: 体力上限改变百分比 | D32: 体力上限：+p% | E32: 体力上限增加百分比值 | G32: 同上
A33: 30 | B33: float_sp_v | C33: 体力回复点数 | D33: 每回合体力：+#x点 | E33: 体力回复点数值 | G33: 同上
A34: 31 | B34: float_sp_p | C34: 体力回复百分比 | D34: 每回合体力：+#p% | E34: 体力回复百分比值 | G34: 同上
A35: 32 | B35: link_hp_v | C35: 系命点数 | D35: 生命吸收：+x点 | E35: 吸取生命的点数 | G35: 系命是必须造成伤害之后，才能吸取生命，如果没有造成伤害，则无法吸取生命，而吸取生命的点数，跟伤害的点数没有关系。
A36: 33 | B36: link_hp_p | C36: 系命百分比 | D36: 生命吸收：+p% | E36: 吸取生命的百分比数 | G36: 系命是必须造成伤害之后，才能吸取生命，如果没有造成伤害，则无法吸取生命，而吸取生命的百分比，是所造成的最终伤害的百分比
A37: 34 | B37: link_mp_v | C37: 系内点数 | D37: 内力吸收：+x点 | E37: 吸取内力的点数 | G37: 同系命点数
A38: 35 | B38: link_mp_p | C38: 系内百分比 | D38: 内力吸收：+p% | E38: 吸取内力的百分比 | G38: 同系命百分比
A39: 36 | B39: link_sp_v | C39: 系体点数 | D39: 体力吸收：+x点 | E39: 吸取体力的点数值 | G39: 同系命点数
A40: 37 | B40: link_sp_p | C40: 系体百分比 | D40: 体力吸收：+p% | E40: 吸取体力的百分比值 | G40: 同系命百分比
A41: 38 | B41: rebound_hp_v | C41: 反弹生命点数 | D41: 伤害反弹生命：+x点 | E41: 反弹的生命点数 | G41: 反弹生命是对自身造成战斗伤害之后，才能伤害反弹。如果没有造成战斗伤害，则无法反弹，而反弹的点数，与造成的伤害点数无关。
A42: 39 | B42: rebound_hp_p | C42: 反弹生命百分比 | D42: 伤害反弹生命：+p% | E42: 反弹的生命百分比 | G42: 反弹生命是对自身造成战斗伤害之后，才能伤害反弹。如果没有造成战斗伤害，则无法反弹，而反弹的百分比，为造成的最终伤害的百分比值。
A43: 40 | B43: rebound_mp_v | C43: 反弹内力点数 | D43: 伤害反弹内力：+x点 | E43: 反弹的内力点数 | G43: 同反弹生命点数
A44: 41 | B44: rebound_mp_p | C44: 反弹内力百分比 | D44: 伤害反弹内力：+p% | E44: 反弹的内力百分比 | G44: 同反弹生命百分比
A45: 42 | B45: rebound_sp_v | C45: 反弹体力点数 | D45: 伤害反弹体力：+x点 | E45: 反弹的体力点数 | G45: 同反弹生命点数
A46: 43 | B46: rebound_sp_p | C46: 反弹体力百分比 | D46: 伤害反弹体力：+p% | E46: 反弹的体力百分比 | G46: 同反弹生命百分比
A47: 44 | B47: cancel_damage_cost_hp_v | C47: 生命点数抵消伤害 | D47: 支付x点生命抵消所有伤害 | E47: 支付的生命点数 | G47: 支付x点生命，来抵消所有伤害，多个同属性抵消不能累加，选择最大值，例如支付1点生命抵消所有伤害，和支付5点生命抵消所有伤害，同时作用在一个角色身上，那么最终为支付5点生命抵消所有伤害，而不是1点，或者6点。
A48: 45 | B48: cancel_damage_cost_hp_p | C48: 生命百分比抵消伤害 | D48: 支付伤害的p%生命抵消所有伤害 | E48: 用生命支付伤害的百分比数，来抵消伤害 | G48: 把伤害的p%点用生命支付，来抵消所有伤害。该属性不能累加计算，选择最大值。例如支付伤害的5%的生命来抵消伤害，和支付伤害的1%的生命来抵消伤害，同时作用在一个角色身上，那么最终为支付5%，而不是1%，或者6%。只要属性不同的抵消，都需要累加
A49: 46 | B49: cancel_damage_cost_mp_v | C49: 内力点数抵消伤害 | D49: 支付x点内力抵消所有伤害 | E49: 支付的内力点数 | G49: 支付x点内力，来抵消所有伤害，多个同属性抵消不能累加，选择最大值。但是只要属性不同，例如抵消生命点数，抵消生命百分比，抵消内力点数，抵消内力百分比，抵消体力点数，抵消体力百分比同时作用，则效果累加。
A50: 47 | B50: cancel_damage_cost_mp_p | C50: 内力百分比抵消伤害 | D50: 支付伤害的p%内力抵消所有伤害 | E50: 用内力支付伤害的百分比数，来抵消伤害 | G50: 把伤害的p%点用内力支付，来抵消所有伤害。该属性不能累加计算，选择最大值。
A51: 48 | B51: cancel_damage_cost_sp_v | C51: 体力点数抵消伤害 | D51: 支付x点体力抵消所有伤害 | E51: 支付的体力点数 | G51: 支付x点体力，来抵消所有伤害，多个同属性抵消不能累加，选择最大值。
A52: 49 | B52: cancel_damage_cost_sp_p | C52: 体力百分比抵消伤害 | D52: 支付伤害的p%体力抵消所有伤害 | E52: 用体力支付伤害的百分比数，来抵消伤害 | G52: 把伤害的p%点用体力支付，来抵消所有伤害。该属性不能累加计算，选择最大值。
A53: 50 | B53: ch_speed_v | C53: 攻速改变点数 | D53: 攻速：+x点 | E53: 攻速点数
A54: 51 | B54: ch_speed_p | C54: 攻速改变百分比数 | D54: 攻速：+p% | E54: 攻速百分比数
A55: 52 | B55: float_speed_v | C55: 攻速增幅点数 | D55: 每回合攻速：+~x点 | E55: 攻速增幅点数
A56: 53 | B56: float_speed_p | C56: 攻速增幅百分比数 | D56: 每回合攻速：+~p% | E56: 攻速增幅百分比数
A57: 54 | B57: ch_dodge_p | C57: 改变闪避率 | D57: 闪避率：+p% | E57: 闪避率百分比
A58: 55 | B58: float_dodge_p | C58: 闪避率增幅 | D58: 每回合闪避率：+~p% | E58: 每回合增幅的闪避率百分比
A59: 56 | B59: ch_crit_p | C59: 改变暴击率 | D59: 暴击率：+p% | E59: 改变的暴击率值
A60: 57 | B60: float_crit_p | C60: 暴击率增幅 | D60: 每回合暴击率：+~p% | E60: 增幅的暴击率值
A61: 58 | B61: ch_crit_v | C61: 改变暴击效果 | D61: 暴击效果：+p% | E61: 改变的暴击效果值
A62: 59 | B62: float_crit_v | C62: 暴击效果增幅 | D62: 每回合暴击效果：+~p% | E62: 增幅的暴击效果值
A63: 60 | B63: ch_parry_p | C63: 改变招架几率 | D63: 招架率：+p% | E63: 招架率值
A64: 61 | B64: float_parry_p | C64: 招架率增幅 | D64: 每回合招架率：+~p% | E64: 增幅的招架率值
A65: 62 | B65: ch_block_p | C65: 改变格挡率 | D65: 格挡率：+p% | E65: 格挡率值
A66: 63 | B66: float_block_p | C66: 格挡率增幅 | D66: 每回合格挡率：+~p% | E66: 格挡率增幅值
A67: 64 | B67: ch_strike_p | C67: 改变破防率 | D67: 破防率：+p% | E67: 破防率值
A68: 65 | B68: float_strike_p | C68: 破防率增幅 | D68: 每回合破防率：+~p% | E68: 破防率增幅值
A69: 66 | B69: ch_counter_p | C69: 改变反击率 | D69: 反击率：+p% | E69: 反击率值
A70: 67 | B70: float_counter_p | C70: 反击率增幅 | D70: 每回合反击率：+~p% | E70: 反击率增幅值
A71: 68 | B71: ch_combo_p | C71: 改变连击率 | D71: 连击率：+p% | E71: 连击率值
A72: 69 | B72: float_combo_p | C72: 连击率增幅 | D72: 每回合连击率：+~p% | E72: 连击率增幅值
A73: 70 | B73: ch_equip_effect_v | C73: 改变某装备某类属性效果点数值 | D73: e类装备上的t属性效果值：+x点 | E73: 增加效果的值 | F73: ["equip" "type"] | G73: equip=1，武器；=2是防具；=3是首饰，1xx=武器细类，101=拳套、102=暗器、103=剑等等，2xx=防具子类；3xx=首饰子类。Type=1为基础属性；type=2为传奇属性；type=3为镶嵌属性；type=4为套装属性。该值只对装备上某个类型的所有的点数属性的效果值有作用，百分比的无作用。
A74: 71 | B74: ch_equip_effect_p | C74: 改变某装备某类属性效果百分比 | D74: e类装备上的t属性效果值：+p% | E74: 增加效果的百分比值 | F74: ["equip" "type"] | G74: 该值对装备上某个类型的所有的属性的效果值有作用，其值=原先值*（1+p%）
A75: 72 | B75: ch_skill_effect_v | C75: 改变某技能的效果值 | D75: s0上的属性效果值：+x点 | E75: 增加效果的值 | F75: [skill_id] | G75: skill_id为技能模板中的技能id，-1表示所有技能，-n表示类别，如-10表示金系、-20表示水系、-30表示木系、-40表示火系、-50表示土系，-100表示武当、-200表示少林等等
A76: 73 | B76: ch_skill_effect_p | C76: 改变某技能的效果百分比 | D76: s0上的属性效果值：+p% | E76: 增加效果的百分比值 | F76: [skill_id] | G76: 同上
A77: 74 | B77: ch_state_effect_v | C77: 改变某状态的效果值 | D77: b0上的属性效果值：+x点 | E77: 增加效果的值 | F77: [state_id] | G77: 同上
A78: 75 | B78: ch_state_effect_p | C78: 改变某状态的效果百分比 | D78: b0上的属性效果值：+p% | E78: 增加效果的百分比值 | F78: [state_id] | G78: 同上
A79: 76 | B79: ch_talent_effect_v | C79: 改变某天赋的效果值 | D79: t0上的属性效果值：+x点 | E79: 增加效果的值 | F79: [talent_id] | G79: 同上
A80: 77 | B80: ch_talent_effect_p | C80: 改变某天赋的效果百分比 | D80: t0上的属性效果值：+p% | E80: 增加效果的百分比值 | F80: [talent_id] | G80: 同上
A81: 78 | B81: ch_equip_effect_v_by_my_state | C81: 在自身某状态下，改变某装备某类属性效果值 | D81: 自身在b0状态下，e1类装备上的et2属性效果值：+x点 | E81: 增加效果的值 | F81: [state_id equip type] | G81: state_id为技能模板中的技能id，（因为state都是由技能生成的）-1表示所有状态，-2表示诅咒，-3表示增益，-n表示类别，如-10表示金系、-20表示水系、-30表示木系、-40表示火系、-50表示土系，-100表示武当、-200表示少林等等
A82: 79 | B82: ch_equip_effect_p_by_my_state | C82: 在自身某状态下，改变某装备某类属性效果百分比 | D82: 自身在b0状态下，e1类装备上的et2属性效果值：+p% | E82: 增加效果的百分比值 | F82: [state_id equip type] | G82: 同上
A83: 80 | B83: ch_skill_effect_v_by_my_state | C83: 在自身某状态下，改变某技能属性效果值 | D83: 自身在b0状态下，s1上的属性效果值：+x点 | E83: 增加效果的值 | F83: [state_id skill_id] | G83: 同上
A84: 81 | B84: ch_skill_effect_p_by_my_state | C84: 在自身某状态下，改变某技能属性效果百分比 | D84: 自身在b0状态下，s1上的属性效果值：+p% | E84: 增加效果的百分比值 | F84: [state_id skill_id] | G84: 同上
A85: 82 | B85: ch_state_effect_v_by_my_state | C85: 在自身某状态下，改变某状态属性效果值 | D85: 自身在b0状态下，b1上的属性效果值：+x点 | E85: 增加效果的值 | F85: [state_id state_id] | G85: 同上
A86: 83 | B86: ch_state_effect_p_by_my_state | C86: 在自身某状态下，改变某状态属性效果百分比 | D86: 自身在b0状态下，b1上的属性效果值：+p% | E86: 增加效果的百分比值 | F86: [state_id state_id] | G86: 同上
A87: 84 | B87: ch_talent_effect_v_by_my_state | C87: 在自身某状态下，改变某天赋属性效果值 | D87: 自身在b0状态下，t1上的属性效果值：+x点 | E87: 增加效果的值 | F87: [state_id talent_id] | G87: 同上
A88: 85 | B88: ch_talent_effect_p_by_my_state | C88: 在自身某状态下，改变某天赋属性效果百分比 | D88: 自身在b0状态下，t1上的属性效果值：+p% | E88: 增加效果的百分比值 | F88: [state_id talent_id] | G88: 同上
A89: 86 | B89: ch_equip_effect_v_by_enemy_state | C89: 在对手某状态下，改变某装备某类属性效果值 | D89: 对手在b0状态下，e1类装备上的et2属性效果值：+x点 | E89: 增加效果的值 | F89: [state_id equip type] | G89: 同上
A90: 87 | B90: ch_equip_effect_p_by_enemy_state | C90: 在对手某状态下，改变某装备某类属性效果百分比 | D90: 对手在b0状态下，e1类装备上的et2属性效果值：+p% | E90: 增加效果的百分比值 | F90: [state_id equip type] | G90: 同上
A91: 88 | B91: ch_skill_effect_v_by_enemy_state | C91: 在对手某状态下，改变某技能属性效果值 | D91: 对手在b0状态下，s1上的属性效果值：+x点 | E91: 增加效果的值 | F91: [state_id skill_id] | G91: 同上
A92: 89 | B92: ch_skill_effect_p_by_enemy_state | C92: 在对手某状态下，改变某技能属性效果百分比 | D92: 对手在b0状态下，s1上的属性效果值：+p% | E92: 增加效果的百分比值 | F92: [state_id skill_id] | G92: 同上
A93: 90 | B93: ch_state_effect_v_by_enemy_state | C93: 在对手某状态下，改变某状态属性效果值 | D93: 对手在b0状态下，b1上的属性效果值：+x点 | E93: 增加效果的值 | F93: [state_id state_id] | G93: 同上
A94: 91 | B94: ch_state_effect_p_by_enemy_state | C94: 在对手某状态下，改变某状态属性效果百分比 | D94: 对手在b0状态下，b1上的属性效果值：+p% | E94: 增加效果的百分比值 | F94: [state_id state_id] | G94: 同上
A95: 92 | B95: ch_talent_effect_v_by_enemy_state | C95: 在对手某状态下，改变某天赋属性效果值 | D95: 对手在b0状态下，t1上的属性效果值：+x点 | E95: 增加效果的值 | F95: [state_id talent_id] | G95: 同上
A96: 93 | B96: ch_talent_effect_p_by_enemy_state | C96: 在对手某状态下，改变某天赋属性效果百分比 | D96: 对手在b0状态下，t1上的属性效果值：+p% | E96: 增加效果的百分比值 | F96: [state_id talent_id] | G96: 同上
A97: 94 | B97: ch_triger_skill_p | C97: 某触发条件下，施展某技能的几率 | D97: t0时，p%几率施展s1 | E97: 施展技能的几率 | F97: [triger skill_id] | G97: triger为触发条件，当某一触发条件满足时，有p%的几率施展skill_id的技能。其中：triger=2表示出手时、3：收手时、4：命中时、5：防御时、6：未命中时、7：闪避时、8：格挡时、9：连招时、10=增益时、11=诅咒时。
A98: 95 | B98: ch_trigger_p | C98: 改变触发条件的几率 | D98: t0触发的几率：+p% | E98: 触发的几率 | F98: [triger]
A99: 96 | B99: ch_preform_skill_on_my_state | C99: 在自身某状态下，改变施展某技能的概率 | D99: 自身在b0状态下，施展s1的几率：+p% | E99: 触发几率 | F99: [state_id skill_id]
A100: 97 | B100: ch_preform_skill_on_enemy_state | C100: 在对手某状态下，改变施展某技能的概率 | D100: 对手在b0状态下，施展s1的几率：+p% | E100: 触发几率 | F100: [state_id skill_id]
A101: 98 | B101: ch_triger_skill_on_my_state | C101: 在自身某状态下，改变某触发条件下，施展某技能的概率 | D101: 当t2时，自身在b0状态下，施展s1的几率：+p% | E101: 触发几率 | F101: [state_id skill_id triger]
A102: 99 | B102: ch_triger_skill_on_enemy_state | C102: 在对手某状态下，改变某触发条件下，施展某技能的概率 | D102: 当t2时，对手在b0状态下，施展s1的几率：+p% | E102: 触发几率 | F102: [state_id skill_id triger]
A103: 100 | B103: ch_skill_effect_v_by_mp | C103: 额外支付内力改变技能效果值 | D103: 额外支付x0内力，s1技能效果：+x点 | E103: 改变的技能效果值 | F103: [mp skill_id]
A104: 101 | B104: ch_skill_effect_p_by_mp | C104: 额外支付内力改变技能效果百分比 | D104: 额外支付x0内力，s1技能效果：+p% | E104: 改变的技能效果百分比 | F104: [mp skill_id]
A105: 102 | B105: ch_defence_v_by_sp | C105: 额外支付体力改变防御效果值 | D105: 额外支付x0体力，防御效果：+x点 | E105: 改变的防御效果值 | F105: [sp]
A106: 103 | B106: ch_defence_p_by_sp | C106: 额外支付体力改变防御效果百分比 | D106: 额外支付x0体力，防御效果：+p% | E106: 改变的防御效果百分比 | F106: [sp]
A107: 104 | B107: ch_mp_cost_v | C107: 改变内力消耗点数值 | D107: 内力消耗：+x点 | E107: 内力消耗值
A108: 105 | B108: ch_mp_cost_p | C108: 改变内力消耗百分比值 | D108: 内力消耗：+p% | E108: 内力消耗百分比
A109: 106 | B109: ch_sp_cost_v | C109: 改变体力消耗点数值 | D109: 体力消耗：+x点 | E109: 体力消耗值
A110: 107 | B110: ch_sp_cost_p | C110: 改变体力消耗百分比值 | D110: 体力消耗：+p% | E110: 体力消耗百分比
A111: 108 | B111: ignore_defence_v | C111: 忽视防御值 | D111: 忽视对手防御力：+x点 | E111: 忽视的防御力点数
A112: 109 | B112: ignore_defence_p | C112: 忽视防御百分比 | D112: 忽视对手防御力：+p% | E112: 忽视的防御力百分比
A113: 110 | B113: ignore_attack_v | C113: 忽视攻击值 | D113: 忽视对手攻击力：+x点 | E113: 忽视的攻击力点数
A114: 111 | B114: ignore_attack_p | C114: 忽视攻击百分比 | D114: 忽视对手攻击力：+p% | E114: 忽视的攻击力百分比
A115: 112 | B115: change_target | C115: 改变目标 | D115: 为技能随机选择一个g目标 | F115: [target_type]
A116: 113 | B116: cant_dodge | C116: 闪避不能 | D116: 闪避不能
A117: 114 | B117: cant_attack | C117: 攻击不能 | D117: 攻击不能
A118: 115 | B118: cant_defence | C118: 防御不能 | D118: 防御不能
A119: 116 | B119: cant_combo | C119: 连击不能 | D119: 连击不能
A120: 117 | B120: cant_relife | C120: 复活不能 | D120: 复活不能
A121: 118 | B121: cant_action | C121: 出招不能 | D121: 出招不能
A122: 119 | B122: cant_hit | C122: 命中不能 | D122: 命中不能
A123: 120 | B123: cant_block | C123: 格挡不能 | D123: 格挡不能
A124: 121 | B124: cant_counter | C124: 反击不能 | D124: 反击不能
A125: 122 | B125: cant_parry | C125: 招架不能 | D125: 招架不能
A126: 123 | B126: cant_curse | C126: 诅咒不能 | D126: 诅咒不能
A127: 124 | B127: cant_gain | C127: 增益不能 | D127: 增益不能
A128: 125 | B128: cant_perform_curse | C128: 不能施展诅咒 | D128: 带诅咒效果的技能不能施展
A129: 126 | B129: cant_perform_gain | C129: 不能施展增益 | D129: 带增益效果的技能不能施展
A130: 127 | B130: skip_dodge | C130: 无视闪避 | D130: 无视对手闪避
A131: 128 | B131: add_skill | C131: 增加一个技能 | D131: 拥有技能s0 | F131: [skill_id]
A132: 129 | B132: active_xiangsheng | C132: 激活五行相生 | D132: 五行相生
A133: 130 | B133: active_xiangke | C133: 激活五行相克 | D133: 五行相克
A134: 131 | B134: first_strike | C134: 先攻 | D134: 先攻 | G134: 先攻是在对手施展战斗技能攻击自己前，触发一个攻击动作
A135: 132 | B135: conterval_strike | C135: 对攻 | D135: 对攻 | G135: 对攻发生在对手施展技能攻击自己时，自己同样触发一个攻击动作。并且同时进行伤害结算
A136: 133 | B136: lost_hp_v_after_turn | C136: n回合后，损失生命点数 | D136: x0回合后，产生x点生命损失 | E136: 损失的生命点数值 | F136: [回合数]
A137: 134 | B137: lost_hp_p_after_turn | C137: n回合后，损失生命百分比 | D137: x0回合后，产生平%生命损失 | E137: 损失的生命百分比值 | F137: [回合数]
A138: 135 | B138: lost_mp_v_after_turn | C138: n回合后，损失内力点数 | D138: x0回合后，产生x点内力损失 | E138: 损失的内力点数值 | F138: [回合数]
A139: 136 | B139: lost_mp_p_after_turn | C139: n回合后，损失内力百分比 | D139: x0回合后，产生p%内力损失 | E139: 损失的内力百分比值 | F139: [回合数]
A140: 137 | B140: lost_sp_v_after_turn | C140: n回合后，损失体力点数 | D140: x0回合后，产生x点体力损失 | E140: 损失的体力点数值 | F140: [回合数]
A141: 138 | B141: lost_sp_p_after_turn | C141: n回合后，损失体力百分比 | D141: x0回合后，产生p%体力损失 | E141: 损失的体力百分比值 | F141: [回合数]
A142: 139 | B142: sk_add_state | C142: 为某个技能增加某个状态 | D142: 为s0技能增加b1效果 | F142: [skill_id state_id] | G142: 改魔法属性相当于为某个技能增加一个状态，如果该技能是攻击技能，则在命中时，为对手增加一个状态，如果为增益技能，则在施展时，为目标增加一个状态
A143: 140 | B143: ch_skill_effect_v_by_kongfu | C143: 为某种武功的技能增加效果值 | D143: k1所有技能效果增加x0点 | E143: 效果值点数 | F143: [type,value] | G143: type=name,value=技能配置表中的kongfu_name,type=type,value=技能配置表中的type，type=party，value=技能配置表中的party
A144: 141 | B144: ch_skill_effect_p_by_kongfu | C144: 为某种武功的技能增加效果百分比 | D144: k1所有技能效果增加p0% | E144: 效果值百分比 | F144: [type,value] | G144: type=name,value=技能配置表中的kongfu_name,type=type,value=技能配置表中的type，type=party，value=技能配置表中的party
A145: 142 | B145: clean_debuff | C145: 清除自身所有debuff
A146: 143 | B146: clean_buff | C146: 清除对手所有buff
A147: 144 | B147: ch_hp_v | C147: 立即为目标产生生命值 | D147: 立即使目标x点生命值 | E147: 产生的生命点数值
A148: 145 | B148: ch_hp_p | C148: 立即为目标产生生命值百分比 | D148: 立即使目标p％生命值 | E148: 产生的生命百分比
A149: 146 | B149: ch_mp_v | C149: 立即为目标产生内力值 | D149: 立即使目标x点内力值 | E149: 产生的内力数值
A150: 147 | B150: ch_mp_p | C150: 立即为目标产生内力百分比 | D150: 立即使目标p％内力值 | E150: 产生的内力百分比
A151: 148 | B151: ch_sp_v | C151: 立即为目标产生体力值 | D151: 立即使目标x点体力值 | E151: 产生的体力数值
A152: 149 | B152: ch_sp_p | C152: 立即为目标产生体力百分比 | D152: 立即使目标p％体力值 | E152: 产生的体力百分比
A153: 201 | B153: login | C153: 登陆游戏
A154: 202 | B154: kill_monster | C154: 挑战关卡
A155: 203 | B155: fight_player | C155: 挑战擂台
A156: 204 | B156: fight_stranger | C156: 挑战陌客
A157: 205 | B157: tax_stranger | C157: 搜刮奴隶
A158: 206 | B158: free_friend | C158: 解救好友
A159: 207 | B159: reinforce_amr | C159: 强化或镶嵌
A160: 208 | B160: inlay_amr | C160: 镶嵌装备
A161: 209 | B161: refresh_inn | C161: 刷新客栈
A162: 210 | B162: visit_friend | C162: 好友宝箱
A163: 211 | B163: gain_mine | C163: 收获宝石
A164: 212 | B164: gain_chip | C164: 炼造碎片
A165: 213 | B165: capture_stranger | C165: 占领山庄
A166: 214 | B166: fight_friend | C166: 好友切磋
A167: 215 | B167: pay_coin | C167: 消费元宝
A168: 216 | B168: improve_amr | C168: 强化装备
A169: 217 | B169: challenge_tower | C169: 华山论剑

Sheet: 魔法属性效果表
A1: 1 | B1: 2 | C1: 3 | D1: 4 | E1: 5 | F1: 6 | G1: 7 | H1: 8 | I1: 9 | J1: 10 | K1: 11 | L1: 12 | M1: 13 | N1: 14 | O1: 15 | P1: 16 | Q1: 17 | R1: 18 | S1: 19 | T1: 20 | U1: 21 | V1: 22 | W1: 23 | X1: 24 | Y1: 25 | Z1: 26 | AA1: 27 | AB1: 28 | AC1: 29 | AD1: 30 | AE1: 31 | AF1: 32 | AG1: 33 | AH1: 34 | AI1: 35 | AJ1: 36 | AK1: 37 | AL1: 38 | AM1: 39 | AN1: 40 | AO1: 41 | AP1: 42 | AQ1: 43 | AR1: 44 | AS1: 45 | AT1: 46 | AU1: 47 | AV1: 43 | AW1: 44 | AX1: 45 | AY1: 46 | AZ1: 47 | BA1: 48 | BB1: 49 | BC1: 50 | BD1: 51 | BE1: 52 | BF1: 53 | BG1: 54 | BH1: 55 | BI1: 56 | BJ1: 57 | BK1: 58 | BL1: 59 | BM1: 60 | BN1: 61 | BO1: 62 | BP1: 63 | BQ1: 64 | BR1: 65 | BS1: 66 | BT1: 67 | BU1: 68 | BV1: 69 | BW1: 70 | BX1: 71 | BY1: 72 | BZ1: 73 | CA1: 74
A2: id | B2: cost | C2: const_cost | D2: sk_attack_v | E2: ch_attack_v | F2: ch_defence_v | G2: ch_max_hp_v | H2: ch_max_mp_v | I2: ch_max_sp_v | J2: float_hp_v | K2: float_mp_v | L2: float_sp_v | M2: sk_attack_p | N2: ch_attack_p | O2: ch_defence_p | P2: ch_max_hp_p | Q2: ch_max_mp_p | R2: ch_max_sp_p | S2: #float_hp_p | T2: #float_mp_p | U2: #float_sp_p | V2: #ch_dodge_p | W2: #ch_crit_p | X2: -ch_attack_v | Y2: -ch_defence_v | Z2: -ch_max_hp_v | AA2: -ch_max_mp_v | AB2: -ch_max_sp_v | AC2: -float_hp_v | AD2: -float_mp_v | AE2: -float_sp_v | AF2: -ch_attack_p | AG2: -ch_defence_p | AH2: -ch_max_hp_p | AI2: -ch_max_mp_p | AJ2: -ch_max_sp_p | AK2: #-float_hp_p | AL2: #-float_mp_p | AM2: #-float_sp_p | AN2: #-ch_dodge_p | AO2: #-ch_crit_p | AP2: #rebound_hp_p | AQ2: #ch_defence_p | AR2: #ch_attack_p | AS2: #ch_max_hp_p | AT2: #ch_max_mp_p | AU2: #ch_max_sp_p | AV2: #-ch_defence_p | AW2: #-ch_attack_p | AX2: #-ch_max_hp_p | AY2: #-ch_max_mp_p | AZ2: #-ch_max_sp_p | BA2: cancel_damage_cost_mp_v | BB2: #ch_counter_p | BC2: #-sk_attack_p | BD2: #float_attack_p | BE2: #float_crit_p | BF2: #ch_hp_p | BG2: #float_dodge_p | BH2: ch_hp_v | BI2: #ch_mp_p | BJ2: cancel_damage_cost_hp_v | BK2: #ch_sp_p | BL2: ch_mp_v | BM2: ch_sp_v | BN2: #link_mp_p | BO2: #-ch_sp_p | BP2: ="-"&"ch_mp_v" -> -ch_mp_v | BQ2: #-ch_mp_p | BR2: ="-"&"ch_sp_v" -> -ch_sp_v | BS2: #float_counter_p | BT2: #float_defence_p | BU2: ="-"&"ch_hp_v" -> -ch_hp_v | BV2: cancel_damage_cost_sp_v | BW2: #link_hp_p | BX2: #-float_defence_p | BY2: #-float_attack_p | BZ2: #-ch_hp_p | CA2: #-ch_hp_v
A3: D0 | B3: 0 | C3: 140 | D3: 10 | E3: 10 | F3: 6 | G3: 14 | H3: 11 | I3: 8 | J3: 2 | K3: 2 | L3: 2 | M3: 10 | N3: 10 | O3: 10 | P3: 10 | Q3: 10 | R3: 10 | S3: 108 | T3: 50 | U3: 108 | V3: 108 | W3: 108 | X3: 5 | Y3: 3 | Z3: 7 | AA3: 5 | AB3: 4 | AC3: 1 | AD3: 1 | AE3: 1 | AF3: 10 | AG3: 10 | AH3: 10 | AI3: 10 | AJ3: 10 | AK3: 54 | AL3: 54 | AM3: 108 | AN3: 54 | AO3: 54 | AP3: 108 | AQ3: 108 | AR3: 108 | AS3: 108 | AT3: 108 | AU3: 108 | AV3: 108 | AW3: 108 | AX3: 108 | AY3: 108 | AZ3: 108 | BA3: 4 | BB3: 108 | BC3: 25 | BD3: 25 | BE3: 8 | BF3: 108 | BG3: 25 | BH3: 1 | BI3: 108 | BJ3: 4 | BK3: 108 | BL3: 1 | BM3: 1 | BN3: 1 | BO3: 108 | BP3: 1 | BQ3: 108 | BR3: 1 | BS3: 25 | BT3: 25 | BU3: 1 | BV3: 1 | BW3: 1 | BX3: 25 | BY3: 25 | BZ3: 108 | CA3: 1
A4: D1 | B4: 4 | C4: 140 | D4: 10 | E4: 10 | F4: 6 | G4: 15 | H4: 12 | I4: 9 | J4: 3 | K4: 2 | L4: 2 | M4: 12 | N4: 12 | O4: 12 | P4: 12 | Q4: 12 | R4: 12 | S4: 116 | T4: 116 | U4: 116 | V4: 116 | W4: 116 | X4: 5 | Y4: 3 | Z4: 7 | AA4: 6 | AB4: 4 | AC4: 1 | AD4: 1 | AE4: 1 | AF4: 12 | AG4: 12 | AH4: 12 | AI4: 12 | AJ4: 12 | AK4: 58 | AL4: 58 | AM4: 116 | AN4: 58 | AO4: 58 | AP4: 116 | AQ4: 116 | AR4: 116 | AS4: 116 | AT4: 116 | AU4: 116 | AV4: 116 | AW4: 116 | AX4: 116 | AY4: 116 | AZ4: 116 | BA4: 4 | BB4: 116 | BC4: 30 | BD4: 30 | BE4: 16 | BF4: 116 | BG4: 30 | BH4: 1 | BI4: 116 | BJ4: 4 | BK4: 116 | BL4: 1 | BM4: 1 | BN4: 1 | BO4: 116 | BP4: 1 | BQ4: 116 | BR4: 1 | BS4: 30 | BT4: 30 | BU4: 1 | BV4: 1 | BW4: 1 | BX4: 30 | BY4: 30 | BZ4: 116 | CA4: 1
A5: D2 | B5: 4 | C5: 140 | D5: 11 | E5: 11 | F5: 6 | G5: 15 | H5: 12 | I5: 9 | J5: 3 | K5: 2 | L5: 2 | M5: 14 | N5: 14 | O5: 14 | P5: 14 | Q5: 14 | R5: 14 | S5: 124 | T5: 124 | U5: 124 | V5: 124 | W5: 124 | X5: 5 | Y5: 3 | Z5: 7 | AA5: 6 | AB5: 4 | AC5: 1 | AD5: 1 | AE5: 1 | AF5: 14 | AG5: 14 | AH5: 14 | AI5: 14 | AJ5: 14 | AK5: 62 | AL5: 62 | AM5: 124 | AN5: 62 | AO5: 62 | AP5: 124 | AQ5: 124 | AR5: 124 | AS5: 124 | AT5: 124 | AU5: 124 | AV5: 124 | AW5: 124 | AX5: 124 | AY5: 124 | AZ5: 124 | BA5: 4 | BB5: 124 | BC5: 35 | BD5: 35 | BE5: 24 | BF5: 124 | BG5: 35 | BH5: 1 | BI5: 124 | BJ5: 4 | BK5: 124 | BL5: 1 | BM5: 1 | BN5: 1 | BO5: 124 | BP5: 1 | BQ5: 124 | BR5: 1 | BS5: 35 | BT5: 35 | BU5: 1 | BV5: 1 | BW5: 1 | BX5: 35 | BY5: 35 | BZ5: 124 | CA5: 1
A6: D3 | B6: 5 | C6: 175 | D6: 11 | E6: 11 | F6: 6 | G6: 17 | H6: 14 | I6: 10 | J6: 3 | K6: 2 | L6: 3 | M6: 16 | N6: 16 | O6: 16 | P6: 16 | Q6: 16 | R6: 16 | S6: 132 | T6: 132 | U6: 132 | V6: 132 | W6: 132 | X6: 5 | Y6: 3 | Z6: 8 | AA6: 7 | AB6: 5 | AC6: 1 | AD6: 1 | AE6: 1 | AF6: 16 | AG6: 16 | AH6: 16 | AI6: 16 | AJ6: 16 | AK6: 66 | AL6: 66 | AM6: 132 | AN6: 66 | AO6: 66 | AP6: 132 | AQ6: 132 | AR6: 132 | AS6: 132 | AT6: 132 | AU6: 132 | AV6: 132 | AW6: 132 | AX6: 132 | AY6: 132 | AZ6: 132 | BA6: 5 | BB6: 132 | BC6: 40 | BD6: 40 | BE6: 32 | BF6: 132 | BG6: 40 | BH6: 1 | BI6: 132 | BJ6: 5 | BK6: 132 | BL6: 1 | BM6: 1 | BN6: 1 | BO6: 132 | BP6: 1 | BQ6: 132 | BR6: 1 | BS6: 40 | BT6: 40 | BU6: 1 | BV6: 1 | BW6: 1 | BX6: 40 | BY6: 40 | BZ6: 132 | CA6: 1
A7: D4 | B7: 5 | C7: 175 | D7: 12 | E7: 12 | F7: 7 | G7: 17 | H7: 14 | I7: 10 | J7: 3 | K7: 2 | L7: 3 | M7: 18 | N7: 18 | O7: 18 | P7: 18 | Q7: 18 | R7: 18 | S7: 140 | T7: 140 | U7: 140 | V7: 140 | W7: 140 | X7: 6 | Y7: 3 | Z7: 8 | AA7: 7 | AB7: 5 | AC7: 1 | AD7: 1 | AE7: 1 | AF7: 18 | AG7: 18 | AH7: 18 | AI7: 18 | AJ7: 18 | AK7: 70 | AL7: 70 | AM7: 140 | AN7: 70 | AO7: 70 | AP7: 140 | AQ7: 140 | AR7: 140 | AS7: 140 | AT7: 140 | AU7: 140 | AV7: 140 | AW7: 140 | AX7: 140 | AY7: 140 | AZ7: 140 | BA7: 5 | BB7: 140 | BC7: 45 | BD7: 45 | BE7: 40 | BF7: 140 | BG7: 45 | BH7: 1 | BI7: 140 | BJ7: 5 | BK7: 140 | BL7: 1 | BM7: 1 | BN7: 1 | BO7: 140 | BP7: 1 | BQ7: 140 | BR7: 1 | BS7: 45 | BT7: 45 | BU7: 1 | BV7: 1 | BW7: 1 | BX7: 45 | BY7: 45 | BZ7: 140 | CA7: 1
A8: C0 | B8: 5 | C8: 175 | D8: 10 | E8: 10 | F8: 10 | G8: 15 | H8: 10 | I8: 5 | J8: 15 | K8: 10 | L8: 5 | M8: 150 | N8: 150 | O8: 150 | P8: 150 | Q8: 150 | R8: 150 | S8: 150 | T8: 150 | U8: 150 | V8: 150 | W8: 150 | X8: 10 | Y8: 10 | Z8: 15 | AA8: 10 | AB8: 5 | AC8: 15 | AD8: 10 | AE8: 5 | AF8: 150 | AG8: 150 | AH8: 150 | AI8: 150 | AJ8: 150 | AK8: 150 | AL8: 150 | AM8: 150 | AN8: 150 | AO8: 150 | AP8: 150 | AQ8: 150 | AR8: 150 | AS8: 150 | AT8: 150 | AU8: 150 | AV8: 150 | AW8: 150 | AX8: 150 | AY8: 150 | AZ8: 150 | BA8: 10 | BB8: 150 | BC8: 50 | BD8: 50 | BE8: 50 | BF8: 150 | BG8: 50 | BH8: 10 | BI8: 150 | BJ8: 15 | BK8: 150 | BL8: 10 | BM8: 5 | BN8: 50 | BO8: 150 | BP8: 10 | BQ8: 150 | BR8: 5 | BS8: 50 | BT8: 50 | BU8: 10 | BV8: 5 | BW8: 50 | BX8: 50 | BY8: 50 | BZ8: 150 | CA8: 10
A9: C1 | B9: 6 | C9: 210 | D9: 13 | E9: 13 | F9: 8 | G9: 19 | H9: 15 | I9: 11 | J9: 3 | K9: 3 | L9: 3 | M9: 22 | N9: 22 | O9: 22 | P9: 22 | Q9: 22 | R9: 22 | S9: 156 | T9: 156 | U9: 156 | V9: 156 | W9: 156 | X9: 6 | Y9: 4 | Z9: 19 | AA9: 15 | AB9: 11 | AC9: 3 | AD9: 3 | AE9: 3 | AF9: 22 | AG9: 22 | AH9: 22 | AI9: 22 | AJ9: 22 | AK9: 78 | AL9: 78 | AM9: 156 | AN9: 78 | AO9: 78 | AP9: 156 | AQ9: 156 | AR9: 156 | AS9: 156 | AT9: 156 | AU9: 156 | AV9: 156 | AW9: 156 | AX9: 156 | AY9: 156 | AZ9: 156 | BA9: 6 | BB9: 156 | BC9: 55 | BD9: 55 | BE9: 56 | BF9: 156 | BG9: 55 | BH9: 3 | BI9: 156 | BJ9: 3 | BK9: 156 | BL9: 3 | BM9: 1 | BN9: 1 | BO9: 156 | BP9: 3 | BQ9: 156 | BR9: 1 | BS9: 55 | BT9: 55 | BU9: 3 | BV9: 1 | BW9: 1 | BX9: 55 | BY9: 55 | BZ9: 156 | CA9: 3
A10: C2 | B10: 6 | C10: 210 | D10: 14 | E10: 14 | F10: 8 | G10: 21 | H10: 16 | I10: 12 | J10: 4 | K10: 3 | L10: 3 | M10: 24 | N10: 24 | O10: 24 | P10: 24 | Q10: 24 | R10: 24 | S10: 164 | T10: 164 | U10: 164 | V10: 164 | W10: 164 | X10: 7 | Y10: 4 | Z10: 21 | AA10: 16 | AB10: 12 | AC10: 4 | AD10: 3 | AE10: 3 | AF10: 24 | AG10: 24 | AH10: 24 | AI10: 24 | AJ10: 24 | AK10: 82 | AL10: 82 | AM10: 164 | AN10: 82 | AO10: 82 | AP10: 164 | AQ10: 164 | AR10: 164 | AS10: 164 | AT10: 164 | AU10: 164 | AV10: 164 | AW10: 164 | AX10: 164 | AY10: 164 | AZ10: 164 | BA10: 6 | BB10: 164 | BC10: 60 | BD10: 60 | BE10: 64 | BF10: 164 | BG10: 60 | BH10: 4 | BI10: 164 | BJ10: 4 | BK10: 164 | BL10: 4 | BM10: 1 | BN10: 1 | BO10: 164 | BP10: 4 | BQ10: 164 | BR10: 1 | BS10: 60 | BT10: 60 | BU10: 4 | BV10: 1 | BW10: 1 | BX10: 60 | BY10: 60 | BZ10: 164 | CA10: 4
A11: C3 | B11: 7 | C11: 245 | D11: 15 | E11: 15 | F11: 9 | G11: 22 | H11: 18 | I11: 13 | J11: 4 | K11: 3 | L11: 3 | M11: 26 | N11: 26 | O11: 26 | P11: 26 | Q11: 26 | R11: 26 | S11: 172 | T11: 172 | U11: 172 | V11: 172 | W11: 172 | X11: 7 | Y11: 4 | Z11: 22 | AA11: 18 | AB11: 13 | AC11: 4 | AD11: 3 | AE11: 3 | AF11: 26 | AG11: 26 | AH11: 26 | AI11: 26 | AJ11: 26 | AK11: 86 | AL11: 86 | AM11: 172 | AN11: 86 | AO11: 86 | AP11: 172 | AQ11: 172 | AR11: 172 | AS11: 172 | AT11: 172 | AU11: 172 | AV11: 172 | AW11: 172 | AX11: 172 | AY11: 172 | AZ11: 172 | BA11: 7 | BB11: 172 | BC11: 65 | BD11: 65 | BE11: 72 | BF11: 172 | BG11: 65 | BH11: 4 | BI11: 172 | BJ11: 4 | BK11: 172 | BL11: 4 | BM11: 1 | BN11: 1 | BO11: 172 | BP11: 4 | BQ11: 172 | BR11: 1 | BS11: 65 | BT11: 65 | BU11: 4 | BV11: 1 | BW11: 1 | BX11: 65 | BY11: 65 | BZ11: 172 | CA11: 4
A12: C4 | B12: 7 | C12: 245 | D12: 16 | E12: 16 | F12: 9 | G12: 24 | H12: 19 | I12: 14 | J12: 4 | K12: 3 | L12: 3 | M12: 28 | N12: 28 | O12: 28 | P12: 28 | Q12: 28 | R12: 28 | S12: 180 | T12: 180 | U12: 180 | V12: 180 | W12: 180 | X12: 8 | Y12: 4 | Z12: 24 | AA12: 19 | AB12: 14 | AC12: 4 | AD12: 3 | AE12: 3 | AF12: 28 | AG12: 28 | AH12: 28 | AI12: 28 | AJ12: 28 | AK12: 90 | AL12: 90 | AM12: 180 | AN12: 90 | AO12: 90 | AP12: 180 | AQ12: 180 | AR12: 180 | AS12: 180 | AT12: 180 | AU12: 180 | AV12: 180 | AW12: 180 | AX12: 180 | AY12: 180 | AZ12: 180 | BA12: 7 | BB12: 180 | BC12: 70 | BD12: 70 | BE12: 80 | BF12: 180 | BG12: 70 | BH12: 4 | BI12: 180 | BJ12: 4 | BK12: 180 | BL12: 4 | BM12: 1 | BN12: 1 | BO12: 180 | BP12: 4 | BQ12: 180 | BR12: 1 | BS12: 70 | BT12: 70 | BU12: 4 | BV12: 1 | BW12: 1 | BX12: 70 | BY12: 70 | BZ12: 180 | CA12: 4
A13: B0 | B13: 10 | C13: 245 | D13: 20 | E13: 20 | F13: 20 | G13: 30 | H13: 20 | I13: 10 | J13: 30 | K13: 20 | L13: 10 | M13: 200 | N13: 200 | O13: 200 | P13: 200 | Q13: 200 | R13: 200 | S13: 200 | T13: 200 | U13: 200 | V13: 200 | W13: 200 | X13: 20 | Y13: 20 | Z13: 30 | AA13: 20 | AB13: 10 | AC13: 30 | AD13: 20 | AE13: 10 | AF13: 200 | AG13: 200 | AH13: 200 | AI13: 200 | AJ13: 200 | AK13: 200 | AL13: 200 | AM13: 200 | AN13: 200 | AO13: 200 | AP13: 200 | AQ13: 200 | AR13: 200 | AS13: 200 | AT13: 200 | AU13: 200 | AV13: 200 | AW13: 200 | AX13: 200 | AY13: 200 | AZ13: 200 | BA13: 20 | BB13: 200 | BC13: 100 | BD13: 100 | BE13: 100 | BF13: 200 | BG13: 100 | BH13: 20 | BI13: 200 | BJ13: 30 | BK13: 200 | BL13: 20 | BM13: 10 | BN13: 100 | BO13: 200 | BP13: 20 | BQ13: 200 | BR13: 10 | BS13: 100 | BT13: 100 | BU13: 20 | BV13: 10 | BW13: 100 | BX13: 100 | BY13: 100 | BZ13: 200 | CA13: 20
A14: B1 | B14: 8 | C14: 280 | D14: 18 | E14: 18 | F14: 11 | G14: 26 | H14: 20 | I14: 15 | J14: 5 | K14: 4 | L14: 4 | M14: 32 | N14: 32 | O14: 32 | P14: 32 | Q14: 32 | R14: 32 | S14: 196 | T14: 196 | U14: 196 | V14: 196 | W14: 196 | X14: 9 | Y14: 5 | Z14: 26 | AA14: 20 | AB14: 15 | AC14: 5 | AD14: 4 | AE14: 4 | AF14: 32 | AG14: 32 | AH14: 32 | AI14: 32 | AJ14: 32 | AK14: 98 | AL14: 98 | AM14: 196 | AN14: 98 | AO14: 98 | AP14: 196 | AQ14: 196 | AR14: 196 | AS14: 196 | AT14: 196 | AU14: 196 | AV14: 196 | AW14: 196 | AX14: 196 | AY14: 196 | AZ14: 196 | BA14: 8 | BB14: 196 | BC14: 80 | BD14: 80 | BE14: 96 | BF14: 196 | BG14: 80 | BH14: 5 | BI14: 196 | BJ14: 5 | BK14: 196 | BL14: 5 | BM14: 1 | BN14: 1 | BO14: 196 | BP14: 5 | BQ14: 196 | BR14: 1 | BS14: 80 | BT14: 80 | BU14: 5 | BV14: 1 | BW14: 1 | BX14: 80 | BY14: 80 | BZ14: 196 | CA14: 5
A15: B2 | B15: 8 | C15: 280 | D15: 19 | E15: 19 | F15: 11 | G15: 28 | H15: 22 | I15: 16 | J15: 5 | K15: 4 | L15: 4 | M15: 34 | N15: 34 | O15: 34 | P15: 34 | Q15: 34 | R15: 34 | S15: 204 | T15: 204 | U15: 204 | V15: 204 | W15: 204 | X15: 9 | Y15: 5 | Z15: 28 | AA15: 22 | AB15: 16 | AC15: 5 | AD15: 4 | AE15: 4 | AF15: 34 | AG15: 34 | AH15: 34 | AI15: 34 | AJ15: 34 | AK15: 102 | AL15: 102 | AM15: 204 | AN15: 102 | AO15: 102 | AP15: 204 | AQ15: 204 | AR15: 204 | AS15: 204 | AT15: 204 | AU15: 204 | AV15: 204 | AW15: 204 | AX15: 204 | AY15: 204 | AZ15: 204 | BA15: 8 | BB15: 204 | BC15: 85 | BD15: 85 | BE15: 104 | BF15: 204 | BG15: 85 | BH15: 5 | BI15: 204 | BJ15: 5 | BK15: 204 | BL15: 5 | BM15: 1 | BN15: 1 | BO15: 204 | BP15: 5 | BQ15: 204 | BR15: 1 | BS15: 85 | BT15: 85 | BU15: 5 | BV15: 1 | BW15: 1 | BX15: 85 | BY15: 85 | BZ15: 204 | CA15: 5
A16: B3 | B16: 9 | C16: 315 | D16: 21 | E16: 21 | F16: 12 | G16: 29 | H16: 23 | I16: 17 | J16: 5 | K16: 4 | L16: 4 | M16: 36 | N16: 36 | O16: 36 | P16: 36 | Q16: 36 | R16: 36 | S16: 212 | T16: 212 | U16: 212 | V16: 212 | W16: 212 | X16: 10 | Y16: 6 | Z16: 29 | AA16: 23 | AB16: 17 | AC16: 5 | AD16: 4 | AE16: 4 | AF16: 36 | AG16: 36 | AH16: 36 | AI16: 36 | AJ16: 36 | AK16: 106 | AL16: 106 | AM16: 212 | AN16: 106 | AO16: 106 | AP16: 212 | AQ16: 212 | AR16: 212 | AS16: 212 | AT16: 212 | AU16: 212 | AV16: 212 | AW16: 212 | AX16: 212 | AY16: 212 | AZ16: 212 | BA16: 9 | BB16: 212 | BC16: 90 | BD16: 90 | BE16: 112 | BF16: 212 | BG16: 90 | BH16: 5 | BI16: 212 | BJ16: 5 | BK16: 212 | BL16: 5 | BM16: 1 | BN16: 1 | BO16: 212 | BP16: 5 | BQ16: 212 | BR16: 1 | BS16: 90 | BT16: 90 | BU16: 5 | BV16: 1 | BW16: 1 | BX16: 90 | BY16: 90 | BZ16: 212 | CA16: 5
A17: B4 | B17: 10 | C17: 350 | D17: 22 | E17: 22 | F17: 13 | G17: 31 | H17: 25 | I17: 18 | J17: 6 | K17: 5 | L17: 4 | M17: 38 | N17: 38 | O17: 38 | P17: 38 | Q17: 38 | R17: 38 | S17: 220 | T17: 220 | U17: 220 | V17: 220 | W17: 220 | X17: 11 | Y17: 6 | Z17: 31 | AA17: 25 | AB17: 18 | AC17: 6 | AD17: 5 | AE17: 4 | AF17: 38 | AG17: 38 | AH17: 38 | AI17: 38 | AJ17: 38 | AK17: 110 | AL17: 110 | AM17: 220 | AN17: 110 | AO17: 110 | AP17: 220 | AQ17: 220 | AR17: 220 | AS17: 220 | AT17: 220 | AU17: 220 | AV17: 220 | AW17: 220 | AX17: 220 | AY17: 220 | AZ17: 220 | BA17: 10 | BB17: 220 | BC17: 95 | BD17: 95 | BE17: 120 | BF17: 220 | BG17: 95 | BH17: 6 | BI17: 220 | BJ17: 6 | BK17: 220 | BL17: 6 | BM17: 1 | BN17: 1 | BO17: 220 | BP17: 6 | BQ17: 220 | BR17: 1 | BS17: 95 | BT17: 95 | BU17: 6 | BV17: 1 | BW17: 1 | BX17: 95 | BY17: 95 | BZ17: 220 | CA17: 6
A18: A0 | B18: 15 | C18: 385 | D18: 30 | E18: 30 | F18: 30 | G18: 45 | H18: 30 | I18: 15 | J18: 45 | K18: 30 | L18: 15 | M18: 250 | N18: 250 | O18: 250 | P18: 250 | Q18: 250 | R18: 250 | S18: 250 | T18: 250 | U18: 250 | V18: 250 | W18: 250 | X18: 30 | Y18: 30 | Z18: 45 | AA18: 30 | AB18: 15 | AC18: 45 | AD18: 30 | AE18: 15 | AF18: 250 | AG18: 250 | AH18: 250 | AI18: 250 | AJ18: 250 | AK18: 250 | AL18: 250 | AM18: 250 | AN18: 250 | AO18: 250 | AP18: 250 | AQ18: 250 | AR18: 250 | AS18: 250 | AT18: 250 | AU18: 250 | AV18: 250 | AW18: 250 | AX18: 250 | AY18: 250 | AZ18: 250 | BA18: 30 | BB18: 250 | BC18: 150 | BD18: 150 | BE18: 150 | BF18: 250 | BG18: 150 | BH18: 30 | BI18: 250 | BJ18: 45 | BK18: 250 | BL18: 30 | BM18: 15 | BN18: 150 | BO18: 250 | BP18: 30 | BQ18: 250 | BR18: 15 | BS18: 150 | BT18: 150 | BU18: 30 | BV18: 15 | BW18: 150 | BX18: 150 | BY18: 150 | BZ18: 250 | CA18: 30
A19: A1 | B19: 11 | C19: 385 | D19: 25 | E19: 25 | F19: 15 | G19: 36 | H19: 29 | I19: 21 | J19: 7 | K19: 5 | L19: 5 | M19: 42 | N19: 42 | O19: 42 | P19: 42 | Q19: 42 | R19: 42 | S19: 236 | T19: 236 | U19: 236 | V19: 236 | W19: 236 | X19: 12 | Y19: 7 | Z19: 36 | AA19: 29 | AB19: 21 | AC19: 7 | AD19: 5 | AE19: 5 | AF19: 42 | AG19: 42 | AH19: 42 | AI19: 42 | AJ19: 42 | AK19: 118 | AL19: 118 | AM19: 236 | AN19: 118 | AO19: 118 | AP19: 236 | AQ19: 236 | AR19: 236 | AS19: 236 | AT19: 236 | AU19: 236 | AV19: 236 | AW19: 236 | AX19: 236 | AY19: 236 | AZ19: 236 | BA19: 11 | BB19: 236 | BC19: 105 | BD19: 105 | BE19: 136 | BF19: 236 | BG19: 105 | BH19: 7 | BI19: 236 | BJ19: 7 | BK19: 236 | BL19: 7 | BM19: 1 | BN19: 1 | BO19: 236 | BP19: 7 | BQ19: 236 | BR19: 1 | BS19: 105 | BT19: 105 | BU19: 7 | BV19: 1 | BW19: 1 | BX19: 105 | BY19: 105 | BZ19: 236 | CA19: 7
A20: A2 | B20: 12 | C20: 420 | D20: 27 | E20: 27 | F20: 16 | G20: 38 | H20: 30 | I20: 23 | J20: 7 | K20: 6 | L20: 5 | M20: 44 | N20: 44 | O20: 44 | P20: 44 | Q20: 44 | R20: 44 | S20: 244 | T20: 244 | U20: 244 | V20: 244 | W20: 244 | X20: 13 | Y20: 8 | Z20: 38 | AA20: 30 | AB20: 23 | AC20: 7 | AD20: 6 | AE20: 5 | AF20: 44 | AG20: 44 | AH20: 44 | AI20: 44 | AJ20: 44 | AK20: 122 | AL20: 122 | AM20: 244 | AN20: 122 | AO20: 122 | AP20: 244 | AQ20: 244 | AR20: 244 | AS20: 244 | AT20: 244 | AU20: 244 | AV20: 244 | AW20: 244 | AX20: 244 | AY20: 244 | AZ20: 244 | BA20: 12 | BB20: 244 | BC20: 110 | BD20: 110 | BE20: 144 | BF20: 244 | BG20: 110 | BH20: 7 | BI20: 244 | BJ20: 7 | BK20: 244 | BL20: 7 | BM20: 1 | BN20: 1 | BO20: 244 | BP20: 7 | BQ20: 244 | BR20: 1 | BS20: 110 | BT20: 110 | BU20: 7 | BV20: 1 | BW20: 1 | BX20: 110 | BY20: 110 | BZ20: 244 | CA20: 7
A21: A3 | B21: 13 | C21: 455 | D21: 29 | E21: 29 | F21: 17 | G21: 42 | H21: 33 | I21: 25 | J21: 8 | K21: 6 | L21: 6 | M21: 46 | N21: 46 | O21: 46 | P21: 46 | Q21: 46 | R21: 46 | S21: 252 | T21: 252 | U21: 252 | V21: 252 | W21: 252 | X21: 14 | Y21: 8 | Z21: 42 | AA21: 33 | AB21: 25 | AC21: 8 | AD21: 6 | AE21: 6 | AF21: 46 | AG21: 46 | AH21: 46 | AI21: 46 | AJ21: 46 | AK21: 126 | AL21: 126 | AM21: 252 | AN21: 126 | AO21: 126 | AP21: 252 | AQ21: 252 | AR21: 252 | AS21: 252 | AT21: 252 | AU21: 252 | AV21: 252 | AW21: 252 | AX21: 252 | AY21: 252 | AZ21: 252 | BA21: 13 | BB21: 252 | BC21: 115 | BD21: 115 | BE21: 152 | BF21: 252 | BG21: 115 | BH21: 8 | BI21: 252 | BJ21: 8 | BK21: 252 | BL21: 8 | BM21: 1 | BN21: 1 | BO21: 252 | BP21: 8 | BQ21: 252 | BR21: 1 | BS21: 115 | BT21: 115 | BU21: 8 | BV21: 1 | BW21: 1 | BX21: 115 | BY21: 115 | BZ21: 252 | CA21: 8
A22: A4 | B22: 14 | C22: 490 | D22: 31 | E22: 31 | F22: 18 | G22: 45 | H22: 36 | I22: 27 | J22: 9 | K22: 7 | L22: 6 | M22: 48 | N22: 48 | O22: 48 | P22: 48 | Q22: 48 | R22: 48 | S22: 260 | T22: 260 | U22: 260 | V22: 260 | W22: 260 | X22: 15 | Y22: 9 | Z22: 45 | AA22: 36 | AB22: 27 | AC22: 9 | AD22: 7 | AE22: 6 | AF22: 48 | AG22: 48 | AH22: 48 | AI22: 48 | AJ22: 48 | AK22: 130 | AL22: 130 | AM22: 260 | AN22: 130 | AO22: 130 | AP22: 260 | AQ22: 260 | AR22: 260 | AS22: 260 | AT22: 260 | AU22: 260 | AV22: 260 | AW22: 260 | AX22: 260 | AY22: 260 | AZ22: 260 | BA22: 14 | BB22: 260 | BC22: 120 | BD22: 120 | BE22: 160 | BF22: 260 | BG22: 120 | BH22: 9 | BI22: 260 | BJ22: 9 | BK22: 260 | BL22: 9 | BM22: 1 | BN22: 1 | BO22: 260 | BP22: 9 | BQ22: 260 | BR22: 1 | BS22: 120 | BT22: 120 | BU22: 9 | BV22: 1 | BW22: 1 | BX22: 120 | BY22: 120 | BZ22: 260 | CA22: 9
A23: S0 | B23: 20 | C23: 525 | D23: 40 | E23: 40 | F23: 40 | G23: 60 | H23: 40 | I23: 20 | J23: 60 | K23: 40 | L23: 20 | M23: 300 | N23: 300 | O23: 300 | P23: 300 | Q23: 300 | R23: 300 | S23: 300 | T23: 300 | U23: 300 | V23: 300 | W23: 300 | X23: 40 | Y23: 40 | Z23: 60 | AA23: 40 | AB23: 20 | AC23: 60 | AD23: 40 | AE23: 20 | AF23: 300 | AG23: 300 | AH23: 300 | AI23: 300 | AJ23: 300 | AK23: 300 | AL23: 300 | AM23: 300 | AN23: 300 | AO23: 300 | AP23: 300 | AQ23: 300 | AR23: 300 | AS23: 300 | AT23: 300 | AU23: 300 | AV23: 300 | AW23: 300 | AX23: 300 | AY23: 300 | AZ23: 300 | BA23: 40 | BB23: 300 | BC23: 200 | BD23: 200 | BE23: 200 | BF23: 300 | BG23: 200 | BH23: 40 | BI23: 300 | BJ23: 60 | BK23: 300 | BL23: 40 | BM23: 20 | BN23: 200 | BO23: 300 | BP23: 40 | BQ23: 300 | BR23: 20 | BS23: 200 | BT23: 200 | BU23: 40 | BV23: 20 | BW23: 200 | BX23: 200 | BY23: 200 | BZ23: 300 | CA23: 40
A24: S1 | B24: 16 | C24: 560 | D24: 36 | E24: 36 | F24: 21 | G24: 52 | H24: 42 | I24: 31 | J24: 10 | K24: 8 | L24: 7 | M24: 52 | N24: 52 | O24: 52 | P24: 52 | Q24: 52 | R24: 52 | S24: 276 | T24: 276 | U24: 276 | V24: 350 | W24: 350 | X24: 18 | Y24: 10 | Z24: 26 | AA24: 21 | AB24: 15 | AC24: 5 | AD24: 4 | AE24: 3 | AF24: 52 | AG24: 52 | AH24: 52 | AI24: 52 | AJ24: 52 | AK24: 138 | AL24: 138 | AM24: 276 | AN24: 138 | AO24: 138 | AP24: 276 | AQ24: 276 | AR24: 276 | AS24: 276 | AT24: 276 | AU24: 276 | AV24: 276 | AW24: 276 | AX24: 276 | AY24: 276 | AZ24: 276 | BA24: 16 | BB24: 276 | BC24: 130 | BD24: 130 | BE24: 176 | BF24: 500 | BG24: 130 | BH24: 1 | BI24: 500 | BJ24: 16 | BK24: 500 | BL24: 1 | BM24: 1 | BN24: 1 | BO24: 500 | BP24: 1 | BQ24: 500 | BR24: 1 | BS24: 130 | BT24: 130 | BU24: 1 | BV24: 1 | BW24: 1 | BX24: 130 | BY24: 130 | BZ24: 500 | CA24: 1
A25: S2 | B25: 17 | C25: 595 | D25: 39 | E25: 39 | F25: 23 | G25: 56 | H25: 44 | I25: 33 | J25: 11 | K25: 8 | L25: 7 | M25: 54 | N25: 54 | O25: 54 | P25: 54 | Q25: 54 | R25: 54 | S25: 284 | T25: 284 | U25: 284 | V25: 500 | W25: 500 | X25: 19 | Y25: 11 | Z25: 28 | AA25: 22 | AB25: 16 | AC25: 5 | AD25: 4 | AE25: 3 | AF25: 54 | AG25: 54 | AH25: 54 | AI25: 54 | AJ25: 54 | AK25: 142 | AL25: 142 | AM25: 284 | AN25: 142 | AO25: 142 | AP25: 284 | AQ25: 284 | AR25: 284 | AS25: 284 | AT25: 284 | AU25: 284 | AV25: 284 | AW25: 284 | AX25: 284 | AY25: 284 | AZ25: 284 | BA25: 17 | BB25: 284 | BC25: 135 | BD25: 135 | BE25: 184 | BF25: 284 | BG25: 135 | BH25: 1 | BI25: 284 | BJ25: 17 | BK25: 284 | BL25: 1 | BM25: 1 | BN25: 1 | BO25: 284 | BP25: 1 | BQ25: 284 | BR25: 1 | BS25: 135 | BT25: 135 | BU25: 1 | BV25: 1 | BW25: 1 | BX25: 135 | BY25: 135 | BZ25: 284 | CA25: 1
A26: S3 | B26: 18 | C26: 630 | D26: 42 | E26: 42 | F26: 25 | G26: 59 | H26: 47 | I26: 35 | J26: 11 | K26: 9 | L26: 8 | M26: 56 | N26: 56 | O26: 56 | P26: 56 | Q26: 56 | R26: 56 | S26: 292 | T26: 292 | U26: 292 | V26: 600 | W26: 600 | X26: 21 | Y26: 12 | Z26: 29 | AA26: 23 | AB26: 17 | AC26: 5 | AD26: 4 | AE26: 4 | AF26: 56 | AG26: 56 | AH26: 56 | AI26: 56 | AJ26: 56 | AK26: 146 | AL26: 146 | AM26: 292 | AN26: 146 | AO26: 146 | AP26: 292 | AQ26: 292 | AR26: 292 | AS26: 292 | AT26: 292 | AU26: 292 | AV26: 292 | AW26: 292 | AX26: 292 | AY26: 292 | AZ26: 292 | BA26: 18 | BB26: 292 | BC26: 140 | BD26: 140 | BE26: 192 | BF26: 292 | BG26: 140 | BH26: 1 | BI26: 292 | BJ26: 18 | BK26: 292 | BL26: 1 | BM26: 1 | BN26: 1 | BO26: 292 | BP26: 1 | BQ26: 292 | BR26: 1 | BS26: 140 | BT26: 140 | BU26: 1 | BV26: 1 | BW26: 1 | BX26: 140 | BY26: 140 | BZ26: 292 | CA26: 1
A27: S4 | B27: 30 | C27: 700 | D27: 45 | E27: 45 | F27: 27 | G27: 63 | H27: 50 | I27: 37 | J27: 12 | K27: 10 | L27: 8 | M27: 58 | N27: 1000 | O27: 1000 | P27: 58 | Q27: 58 | R27: 58 | S27: 300 | T27: 300 | U27: 300 | V27: 800 | W27: 800 | X27: 22 | Y27: 13 | Z27: 31 | AA27: 25 | AB27: 18 | AC27: 6 | AD27: 5 | AE27: 4 | AF27: 1000 | AG27: 1000 | AH27: 1000 | AI27: 1000 | AJ27: 1000 | AK27: 150 | AL27: 150 | AM27: 300 | AN27: 150 | AO27: 150 | AP27: 1000 | AQ27: 300 | AR27: 300 | AS27: 300 | AT27: 300 | AU27: 300 | AV27: 300 | AW27: 300 | AX27: 300 | AY27: 300 | AZ27: 300 | BA27: 20 | BB27: 300 | BC27: 145 | BD27: 145 | BE27: 200 | BF27: 1000 | BG27: 145 | BH27: 100 | BI27: 1000 | BJ27: 20 | BK27: 1000 | BL27: 100 | BM27: 1 | BN27: 1 | BO27: 1000 | BP27: 100 | BQ27: 1000 | BR27: 1 | BS27: 145 | BT27: 145 | BU27: 100 | BV27: 1 | BW27: 1 | BX27: 145 | BY27: 145 | BZ27: 1000 | CA27: 99999

Sheet: 功夫名
A1: id | B1: 名称 | C1: 值
A2: id | B2: name | C2: const
A3: 1 | B3: 少林长拳 | C3: shaolinchangquan
A4: 2 | B4: 龙爪功 | C4: longzhaogong
A5: 3 | B5: 大金刚拳 | C5: dajingangquan
A6: 4 | B6: 如意随形腿 | C6: ruyingsuixingtui
A7: 5 | B7: 般若掌 | C7: banruozhang
A8: 6 | B8: 如来千叶手 | C8: rulaiqianyeshou
A9: 7 | B9: 一指禅 | C9: yizhichan
A10: 8 | B10: 少林弹腿 | C10: shaolintantui
A11: 9 | B11: 寂灭爪 | C11: jimiezhua
A12: 10 | B12: 韦驮掌 | C12: weituozhang
A13: 11 | B13: 摩诃指 | C13: mohezhi
A14: 12 | B14: 风云手 | C14: fengyunshou
A15: 13 | B15: 罗汉拳 | C15: luohanquan
A16: 14 | B16: 拈花指 | C16: nianhuazhi
A17: 15 | B17: 散花掌 | C17: sanhuazhang
A18: 16 | B18: 修罗刀 | C18: xiuluodao
A19: 17 | B19: 普渡杖法 | C19: puduzhangfa
A20: 18 | B20: 少林醉棍 | C20: shaolinzuigun
A21: 19 | B21: 达摩剑 | C21: damojian
A22: 20 | B22: 韦陀棍 | C22: weituogun
A23: 21 | B23: 慈悲刀 | C23: cibeidao
A24: 22 | B24: 伏魔剑 | C24: fumojian
A25: 23 | B25: 无常杖法 | C25: wuchangzhangfa
A26: 24 | B26: 韦驮杵 | C26: weituochufa
A27: 25 | B27: 燃木刀法 | C27: ranmudaofa
A28: 26 | B28: 日月鞭法 | C28: riyuebianfa
A29: 27 | B29: 辟邪剑法 | C29: bixiejianfa
A30: 28 | B30: 松风剑法 | C30: songfengjianfa
A31: 29 | B31: 无影幻腿 | C31: wuyinghuantui
A32: 30 | B32: 摧心掌 | C32: cuixinzhang
A33: 31 | B33: 宋军枪法 | C33: songjunqiangfa
A34: 32 | B34: 骑兵刀法 | C34: qibingdaofa
A35: 33 | B35: 殿前刀法 | C35: dianqiandaofa
A36: 34 | B36: 钩镰枪法 | C36: goulianqiangfa
A37: 35 | B37: 五虎刀法 | C37: wuhudaofa
A38: 36 | B38: 氤氲紫气 | C38: yinyunziqi
A39: 37 | B39: 梯云纵 | C39: tiyunzong
A40: 38 | B40: 武当长拳 | C40: wudangchangquan
A41: 39 | B41: 玄虚刀法 | C41: xuanxudaofa
A42: 40 | B42: 震山绵掌 | C42: zhenshanmianzhang
A43: 41 | B43: 虎爪绝户手 | C43: huzhaojuehushou
A44: 42 | B44: 太极拳 | C44: taijiquan
A45: 43 | B45: 太极剑 | C45: taijijian
A46: 44 | B46: 太极心法 | C46: taijixinfa
A47: 45 | B47: 神门十三剑 | C47: shenmenshisanjian
A48: 46 | B48: 绕指柔剑 | C48: raozhiroujian
A49: 47 | B49: 倚天屠龙功 | C49: titiantulonggong
A50: 48 | B50: 五虎拳 | C50: wuhuquan
A51: 49 | B51: 断门刀 | C51: duanmendao
A52: 50 | B52: 辟邪心法 | C52: bixiexinfa
A53: 51 | B53: 辟邪身法 | C53: bixieshenfa
A54: 52 | B54: 通臂拳 | C54: tongbiquan
A55: 53 | B55: 江湖技艺 | C55: jianghujiyi
A56: 54 | B56: 落花剑法 | C56: huohuajianfa
A57: 55 | B57: 罗汉刀 | C57: luohandao
A58: 56 | B58: 金刀刀法 | C58: jindaodaofa
A59: 57 | B59: 青城剑法 | C59: qingchengjianfa
A60: 58 | B60: 青城刀法 | C60: qingchengdaofa
A61: 59 | B61: 青城身法 | C61: qingchengshenfa
A62: 60 | B62: 青城心法 | C62: qingchengshenfa
A63: 61 | B63: 杨家枪 | C63: yangjiaqiang
A64: 62 | B64: 郭家戟法 | C64: guojiajifa
A65: 63 | B65: 碧海潮生功 | C65: bihaichaoshenggong
A66: 64 | B66: 随波逐流 | C66: suibozhuliu
A67: 65 | B67: 落英神剑掌 | C67: luoyingshenjianzhang
A68: 66 | B68: 旋风扫叶腿 | C68: xuanfengtuifa
A69: 67 | B69: 兰花拂穴手 | C69: lanhuafuxueshou
A70: 68 | B70: 玉箫剑法 | C70: yuxiaojianfa
A71: 69 | B71: 弹指神通 | C71: tanzhishentong
A72: 70 | B72: 九阴白骨爪 | C72: jiuyinbaiguzhao
A73: 81 | B73: 九阴摧心掌 | C73: jiuyincuixinzhang
A74: 82 | B74: 九阴白蟒鞭 | C74: jiuyinbaimangbian
A75: 83 | B75: 九阴真经 | C75: jiuyinzhenjing
A76: 84
A77: 85
A78: 86
A79: 87
A80: 88
A81: 89
A82: 90
A83: 91
A84: 92
A85: 93
A86: 94
A87: 95
A88: 96
A89: 97
A90: 98

Sheet: 目标常量表
A1: id | B1: 目标 | C1: 值
A2: id | B2: name | C2: const
A3: 1 | B3: 自身 | C3: 1
A4: 2 | B4: 己方 | C4: 1
A5: 3 | B5: 对方 | C5: -1
A6: 4 | B6: 对手 | C6: -1

Sheet: 功夫类型表
A1: id | B1: 类型名 | C1: 值
A2: id | B2: name | C2: const
A3: 1 | B3: 拳法 | C3: quanfa
A4: 2 | B4: 爪法 | C4: zhaofa
A5: 3 | B5: 空手 | C5: kongshou
A6: 4 | B6: 腿法 | C6: tuifa
A7: 5 | B7: 掌法 | C7: zhangfa
A8: 6 | B8: 手法 | C8: shoufa
A9: 7 | B9: 指法 | C9: zhifa
A10: 8 | B10: 刀法 | C10: daofa
A11: 9 | B11: 杖法 | C11: zhangfa
A12: 10 | B12: 棍法 | C12: gunfa
A13: 11 | B13: 剑法 | C13: jianfa
A14: 12 | B14: 棒法 | C14: bangfa
A15: 13 | B15: 鞭法 | C15: bianfa
A16: 14 | B16: 内功 | C16: neigong
A17: 15 | B17: 轻功 | C17: qinggong
A18: 16 | B18: 心法 | C18: xinfa
A19: 17 | B19: 器械 | C19: qixie
A20: 18 | B20: 武功 | C20: wugong

Sheet: 技能类型表
A1: id | B1: 类型 | C1: 值
A2: id | B2: name | C2: const
A3: 1 | B3: 攻击 | C3: fight
A4: 2 | B4: 增益 | C4: buff
A5: 3 | B5: 诅咒 | C5: debuff
A6: 4 | B6: 被动 | C6: passive
A7: 5 | B7: 气功 | C7: heal

Sheet: 战斗数值
C1: 侠客成长率 | H1: 侠客天赋 | M1: 装备基础值 | R1: 装备镶嵌值 | W1: 装备传奇值 | AB1: 技能基础值 | AG1: 技能专精I | AL1: 技能专精II | AQ1: 技能专精III | AV1: 增长型百分比 | AY1: 渐增型 | BD1: 渐增型百分比 | BG1: 增长型百分比（恒定值） | BJ1: 渐增型百分比（恒定值） | BM1: 攻速
A2: id | B2: power | C2: 攻击 | D2: 防御 | E2: 生命 | F2: 内力 | G2: 体力 | H2: 攻击 | I2: 防御 | J2: 生命 | K2: 内力 | L2: 体力 | M2: 攻击 | N2: 防御 | O2: 生命 | P2: 内力 | Q2: 体力 | R2: 攻击 | S2: 防御 | T2: 生命 | U2: 内力 | V2: 体力 | W2: 攻击 | X2: 防御 | Y2: 生命 | Z2: 内力 | AA2: 体力 | AB2: 攻击 | AC2: 防御 | AD2: 生命 | AE2: 内力 | AF2: 体力 | AG2: 攻击 | AH2: 防御 | AI2: 生命 | AJ2: 内力 | AK2: 体力 | AL2: 攻击 | AM2: 防御 | AN2: 生命 | AO2: 内力 | AP2: 体力 | AQ2: 攻击 | AR2: 防御 | AS2: 生命 | AT2: 内力 | AU2: 体力 | AV2: large_p | AW2: small_p | AX2: middle_p | AY2: 攻击 | AZ2: 防御 | BA2: 生命 | BB2: 内力 | BC2: 体力 | BD2: large_p | BE2: small_p | BF2: middle_p | BG2: large_p | BH2: small_p | BI2: middle_p | BJ2: large_p | BK2: small_p | BL2: middle_p | BM2: 增长值 | BN2: 增长百分比 | BO2: 渐增值 | BP2: 渐增百分比 | BQ2: 恒定值 | BR2: 恒定百分比 | BS2: 恒定渐增值 | BT2: 恒定渐增百分比
A3: 1 | B3: D0 | C3: 3 | D3: =RC[-1]*0.3 -> 0.89999999999999991 | E3: =(RC[-2]-RC[-1])*15 -> 31.5 | F3: =RC[-1] -> 31.5 | G3: =RC[-1] -> 31.5 | H3: =RC[-5]*1.2 -> 3.5999999999999996 | I3: =RC[-5]*1.2 -> 1.0799999999999998 | J3: =RC[-5]*1.2 -> 37.799999999999997 | K3: =RC[-5]*1.2 -> 37.799999999999997 | L3: =RC[-5]*1.2 -> 37.799999999999997 | M3: =RC[-10] -> 3 | N3: =RC[-10] -> 0.89999999999999991 | O3: =RC[-10] -> 31.5 | P3: =RC[-10] -> 31.5 | Q3: =RC[-10] -> 31.5 | R3: =RC[-15] -> 3 | S3: =RC[-15] -> 0.89999999999999991 | T3: =RC[-15] -> 31.5 | U3: =RC[-15] -> 31.5 | V3: =RC[-15] -> 31.5 | W3: =RC[-20] -> 3 | X3: =RC[-20] -> 0.89999999999999991 | Y3: =RC[-20] -> 31.5 | Z3: =RC[-20] -> 31.5 | AA3: =RC[-20] -> 31.5 | AB3: =RC[-25] -> 3 | AC3: =RC[-25] -> 0.89999999999999991 | AD3: =RC[-25] -> 31.5 | AE3: =RC[-25] -> 31.5 | AF3: =RC[-25] -> 31.5 | AG3: =RC[-5]*1.2 -> 3.5999999999999996 | AH3: =RC[-5]*1.2 -> 1.0799999999999998 | AI3: =RC[-5]*1.2 -> 37.799999999999997 | AJ3: =RC[-5]*1.2 -> 37.799999999999997 | AK3: =RC[-5]*1.2 -> 37.799999999999997 | AL3: =RC[-10]*1.5 -> 4.5 | AM3: =RC[-10]*1.5 -> 1.3499999999999999 | AN3: =RC[-10]*1.5 -> 47.25 | AO3: =RC[-10]*1.5 -> 47.25 | AP3: =RC[-10]*1.5 -> 47.25 | AQ3: =RC[-15]*2 -> 6 | AR3: =RC[-15]*2 -> 1.7999999999999998 | AS3: =RC[-15]*2 -> 63 | AT3: =RC[-15]*2 -> 63 | AU3: =RC[-15]*2 -> 63 | AV3: 25 | AW3: 1.2 | AX3: 5 | AY3: =RC[-48]/10 -> 0.3 | AZ3: =RC[-48]/10 -> 0.09 | BA3: =RC[-48]/10 -> 3.15 | BB3: =RC[-48]/10 -> 3.15 | BC3: =RC[-48]/10 -> 3.15 | BD3: =RC[-8]/10 -> 2.5 | BE3: =RC[-8]/10 -> 0.12 | BF3: =RC[-8]/10 -> 0.5 | BG3: 500 | BH3: 40 | BI3: 120 | BJ3: =RC[-6]*30 -> 75 | BK3: =RC[-6]*30 -> 3.5999999999999996 | BL3: =RC[-6]*30 -> 15 | BM3: =(R[1]C*60-20)/60 -> 0.33333333333333537 | BN3: =(R[1]C*60-100)/60 -> 10.000000000000004 | BO3: =RC[-2]/5 -> 6.6666666666667068E-2 | BP3: =RC[-2]/5 -> 2.0000000000000009 | BQ3: =RC[-4]*30 -> 10.00000000000006 | BR3: =RC[-4]*30 -> 300.00000000000011 | BS3: =RC[-4]*30 -> 2.000000000000012 | BT3: =RC[-4]*30 -> 60.000000000000028
A4: 2 | B4: D1 | C4: =R3C*(1+(RC[-2]-1)*0.1) -> 3.3000000000000003 | D4: =RC[-1]*0.3 -> 0.99 | E4: =(RC[-2]-RC[-1])*15 -> 34.650000000000006 | F4: =RC[-1] -> 34.650000000000006 | G4: =RC[-1] -> 34.650000000000006 | H4: =RC[-5]*1.2 -> 3.96 | I4: =RC[-5]*1.2 -> 1.1879999999999999 | J4: =RC[-5]*1.2 -> 41.580000000000005 | K4: =RC[-5]*1.2 -> 41.580000000000005 | L4: =RC[-5]*1.2 -> 41.580000000000005 | M4: =RC[-10] -> 3.3000000000000003 | N4: =RC[-10] -> 0.99 | O4: =RC[-10] -> 34.650000000000006 | P4: =RC[-10] -> 34.650000000000006 | Q4: =RC[-10] -> 34.650000000000006 | R4: =RC[-15] -> 3.3000000000000003 | S4: =RC[-15] -> 0.99 | T4: =RC[-15] -> 34.650000000000006 | U4: =RC[-15] -> 34.650000000000006 | V4: =RC[-15] -> 34.650000000000006 | W4: =RC[-20] -> 3.3000000000000003 | X4: =RC[-20] -> 0.99 | Y4: =RC[-20] -> 34.650000000000006 | Z4: =RC[-20] -> 34.650000000000006 | AA4: =RC[-20] -> 34.650000000000006 | AB4: =RC[-25] -> 3.3000000000000003 | AC4: =RC[-25] -> 0.99 | AD4: =RC[-25] -> 34.650000000000006 | AE4: =RC[-25] -> 34.650000000000006 | AF4: =RC[-25] -> 34.650000000000006 | AG4: =RC[-5]*1.2 -> 3.96 | AH4: =RC[-5]*1.2 -> 1.1879999999999999 | AI4: =RC[-5]*1.2 -> 41.580000000000005 | AJ4: =RC[-5]*1.2 -> 41.580000000000005 | AK4: =RC[-5]*1.2 -> 41.580000000000005 | AL4: =RC[-10]*1.5 -> 4.95 | AM4: =RC[-10]*1.5 -> 1.4849999999999999 | AN4: =RC[-10]*1.5 -> 51.975000000000009 | AO4: =RC[-10]*1.5 -> 51.975000000000009 | AP4: =RC[-10]*1.5 -> 51.975000000000009 | AQ4: =RC[-15]*2 -> 6.6000000000000005 | AR4: =RC[-15]*2 -> 1.98 | AS4: =RC[-15]*2 -> 69.300000000000011 | AT4: =RC[-15]*2 -> 69.300000000000011 | AU4: =RC[-15]*2 -> 69.300000000000011 | AV4: 26 | AW4: 1.4 | AX4: 6 | AY4: =RC[-48]/10 -> 0.33 | AZ4: =RC[-48]/10 -> 9.9000000000000005E-2 | BA4: =RC[-48]/10 -> 3.4650000000000007 | BB4: =RC[-48]/10 -> 3.4650000000000007 | BC4: =RC[-48]/10 -> 3.4650000000000007 | BD4: =RC[-8]/10 -> 2.6 | BE4: =RC[-8]/10 -> 0.13999999999999999 | BF4: =RC[-8]/10 -> 0.6 | BG4: 800 | BH4: 50 | BI4: 240 | BJ4: =RC[-6]*30 -> 78 | BK4: =RC[-6]*30 -> 4.1999999999999993 | BL4: =RC[-6]*30 -> 18 | BM4: =(R[1]C*60-20)/60 -> 0.66666666666666863 | BN4: =(R[1]C*60-100)/60 -> 11.66666666666667 | BO4: =RC[-2]/5 -> 0.13333333333333372 | BP4: =RC[-2]/5 -> 2.3333333333333339 | BQ4: =RC[-4]*30 -> 20.00000000000006 | BR4: =RC[-4]*30 -> 350.00000000000011 | BS4: =RC[-4]*30 -> 4.0000000000000115 | BT4: =RC[-4]*30 -> 70.000000000000014
A5: 3 | B5: D2 | C5: =R3C*(1+(RC[-2]-1)*0.1) -> 3.5999999999999996 | D5: =RC[-1]*0.3 -> 1.0799999999999998 | E5: =(RC[-2]-RC[-1])*15 -> 37.799999999999997 | F5: =RC[-1] -> 37.799999999999997 | G5: =RC[-1] -> 37.799999999999997 | H5: =RC[-5]*1.2 -> 4.3199999999999994 | I5: =RC[-5]*1.2 -> 1.2959999999999998 | J5: =RC[-5]*1.2 -> 45.359999999999992 | K5: =RC[-5]*1.2 -> 45.359999999999992 | L5: =RC[-5]*1.2 -> 45.359999999999992 | M5: =RC[-10] -> 3.5999999999999996 | N5: =RC[-10] -> 1.0799999999999998 | O5: =RC[-10] -> 37.799999999999997 | P5: =RC[-10] -> 37.799999999999997 | Q5: =RC[-10] -> 37.799999999999997 | R5: =RC[-15] -> 3.5999999999999996 | S5: =RC[-15] -> 1.0799999999999998 | T5: =RC[-15] -> 37.799999999999997 | U5: =RC[-15] -> 37.799999999999997 | V5: =RC[-15] -> 37.799999999999997 | W5: =RC[-20] -> 3.5999999999999996 | X5: =RC[-20] -> 1.0799999999999998 | Y5: =RC[-20] -> 37.799999999999997 | Z5: =RC[-20] -> 37.799999999999997 | AA5: =RC[-20] -> 37.799999999999997 | AB5: =RC[-25] -> 3.5999999999999996 | AC5: =RC[-25] -> 1.0799999999999998 | AD5: =RC[-25] -> 37.799999999999997 | AE5: =RC[-25] -> 37.799999999999997 | AF5: =RC[-25] -> 37.799999999999997 | AG5: =RC[-5]*1.2 -> 4.3199999999999994 | AH5: =RC[-5]*1.2 -> 1.2959999999999998 | AI5: =RC[-5]*1.2 -> 45.359999999999992 | AJ5: =RC[-5]*1.2 -> 45.359999999999992 | AK5: =RC[-5]*1.2 -> 45.359999999999992 | AL5: =RC[-10]*1.5 -> 5.3999999999999995 | AM5: =RC[-10]*1.5 -> 1.6199999999999997 | AN5: =RC[-10]*1.5 -> 56.699999999999996 | AO5: =RC[-10]*1.5 -> 56.699999999999996 | AP5: =RC[-10]*1.5 -> 56.699999999999996 | AQ5: =RC[-15]*2 -> 7.1999999999999993 | AR5: =RC[-15]*2 -> 2.1599999999999997 | AS5: =RC[-15]*2 -> 75.599999999999994 | AT5: =RC[-15]*2 -> 75.599999999999994 | AU5: =RC[-15]*2 -> 75.599999999999994 | AV5: 27 | AW5: 1.6 | AX5: 7 | AY5: =RC[-48]/10 -> 0.36 | AZ5: =RC[-48]/10 -> 0.10799999999999998 | BA5: =RC[-48]/10 -> 3.78 | BB5: =RC[-48]/10 -> 3.78 | BC5: =RC[-48]/10 -> 3.78 | BD5: =RC[-8]/10 -> 2.7 | BE5: =RC[-8]/10 -> 0.16 | BF5: =RC[-8]/10 -> 0.7 | BG5: 1200 | BH5: 60 | BI5: 360 | BJ5: =RC[-6]*30 -> 81 | BK5: =RC[-6]*30 -> 4.8 | BL5: =RC[-6]*30 -> 21 | BM5: =(R[1]C*60-20)/60 -> 1.000000000000002 | BN5: =(R[1]C*60-100)/60 -> 13.333333333333337 | BO5: =RC[-2]/5 -> 0.2000000000000004 | BP5: =RC[-2]/5 -> 2.6666666666666674 | BQ5: =RC[-4]*30 -> 30.00000000000006 | BR5: =RC[-4]*30 -> 400.00000000000011 | BS5: =RC[-4]*30 -> 6.0000000000000124 | BT5: =RC[-4]*30 -> 80.000000000000028
A6: 4 | B6: D3 | C6: =R3C*(1+(RC[-2]-1)*0.1) -> 3.9000000000000004 | D6: =RC[-1]*0.3 -> 1.1700000000000002 | E6: =(RC[-2]-RC[-1])*15 -> 40.950000000000003 | F6: =RC[-1] -> 40.950000000000003 | G6: =RC[-1] -> 40.950000000000003 | H6: =RC[-5]*1.2 -> 4.6800000000000006 | I6: =RC[-5]*1.2 -> 1.4040000000000001 | J6: =RC[-5]*1.2 -> 49.14 | K6: =RC[-5]*1.2 -> 49.14 | L6: =RC[-5]*1.2 -> 49.14 | M6: =RC[-10] -> 3.9000000000000004 | N6: =RC[-10] -> 1.1700000000000002 | O6: =RC[-10] -> 40.950000000000003 | P6: =RC[-10] -> 40.950000000000003 | Q6: =RC[-10] -> 40.950000000000003 | R6: =RC[-15] -> 3.9000000000000004 | S6: =RC[-15] -> 1.1700000000000002 | T6: =RC[-15] -> 40.950000000000003 | U6: =RC[-15] -> 40.950000000000003 | V6: =RC[-15] -> 40.950000000000003 | W6: =RC[-20] -> 3.9000000000000004 | X6: =RC[-20] -> 1.1700000000000002 | Y6: =RC[-20] -> 40.950000000000003 | Z6: =RC[-20] -> 40.950000000000003 | AA6: =RC[-20] -> 40.950000000000003 | AB6: =RC[-25] -> 3.9000000000000004 | AC6: =RC[-25] -> 1.1700000000000002 | AD6: =RC[-25] -> 40.950000000000003 | AE6: =RC[-25] -> 40.950000000000003 | AF6: =RC[-25] -> 40.950000000000003 | AG6: =RC[-5]*1.2 -> 4.6800000000000006 | AH6: =RC[-5]*1.2 -> 1.4040000000000001 | AI6: =RC[-5]*1.2 -> 49.14 | AJ6: =RC[-5]*1.2 -> 49.14 | AK6: =RC[-5]*1.2 -> 49.14 | AL6: =RC[-10]*1.5 -> 5.8500000000000005 | AM6: =RC[-10]*1.5 -> 1.7550000000000003 | AN6: =RC[-10]*1.5 -> 61.425000000000004 | AO6: =RC[-10]*1.5 -> 61.425000000000004 | AP6: =RC[-10]*1.5 -> 61.425000000000004 | AQ6: =RC[-15]*2 -> 7.8000000000000007 | AR6: =RC[-15]*2 -> 2.3400000000000003 | AS6: =RC[-15]*2 -> 81.900000000000006 | AT6: =RC[-15]*2 -> 81.900000000000006 | AU6: =RC[-15]*2 -> 81.900000000000006 | AV6: 28 | AW6: 1.8 | AX6: 8 | AY6: =RC[-48]/10 -> 0.39 | AZ6: =RC[-48]/10 -> 0.11700000000000002 | BA6: =RC[-48]/10 -> 4.0950000000000006 | BB6: =RC[-48]/10 -> 4.0950000000000006 | BC6: =RC[-48]/10 -> 4.0950000000000006 | BD6: =RC[-8]/10 -> 2.8 | BE6: =RC[-8]/10 -> 0.18 | BF6: =RC[-8]/10 -> 0.8 | BG6: 1600 | BH6: 80 | BI6: 480 | BJ6: =RC[-6]*30 -> 84 | BK6: =RC[-6]*30 -> 5.3999999999999995 | BL6: =RC[-6]*30 -> 24 | BM6: =(R[1]C*60-20)/60 -> 1.3333333333333353 | BN6: =(R[1]C*60-100)/60 -> 15.000000000000004 | BO6: =RC[-2]/5 -> 0.26666666666666705 | BP6: =RC[-2]/5 -> 3.0000000000000009 | BQ6: =RC[-4]*30 -> 40.000000000000057 | BR6: =RC[-4]*30 -> 450.00000000000011 | BS6: =RC[-4]*30 -> 8.0000000000000107 | BT6: =RC[-4]*30 -> 90.000000000000028
A7: 5 | B7: D4 | C7: =R3C*(1+(RC[-2]-1)*0.1) -> 4.1999999999999993 | D7: =RC[-1]*0.3 -> 1.2599999999999998 | E7: =(RC[-2]-RC[-1])*15 -> 44.099999999999994 | F7: =RC[-1] -> 44.099999999999994 | G7: =RC[-1] -> 44.099999999999994 | H7: =RC[-5]*1.2 -> 5.0399999999999991 | I7: =RC[-5]*1.2 -> 1.5119999999999998 | J7: =RC[-5]*1.2 -> 52.919999999999995 | K7: =RC[-5]*1.2 -> 52.919999999999995 | L7: =RC[-5]*1.2 -> 52.919999999999995 | M7: =RC[-10] -> 4.1999999999999993 | N7: =RC[-10] -> 1.2599999999999998 | O7: =RC[-10] -> 44.099999999999994 | P7: =RC[-10] -> 44.099999999999994 | Q7: =RC[-10] -> 44.099999999999994 | R7: =RC[-15] -> 4.1999999999999993 | S7: =RC[-15] -> 1.2599999999999998 | T7: =RC[-15] -> 44.099999999999994 | U7: =RC[-15] -> 44.099999999999994 | V7: =RC[-15] -> 44.099999999999994 | W7: =RC[-20] -> 4.1999999999999993 | X7: =RC[-20] -> 1.2599999999999998 | Y7: =RC[-20] -> 44.099999999999994 | Z7: =RC[-20] -> 44.099999999999994 | AA7: =RC[-20] -> 44.099999999999994 | AB7: =RC[-25] -> 4.1999999999999993 | AC7: =RC[-25] -> 1.2599999999999998 | AD7: =RC[-25] -> 44.099999999999994 | AE7: =RC[-25] -> 44.099999999999994 | AF7: =RC[-25] -> 44.099999999999994 | AG7: =RC[-5]*1.2 -> 5.0399999999999991 | AH7: =RC[-5]*1.2 -> 1.5119999999999998 | AI7: =RC[-5]*1.2 -> 52.919999999999995 | AJ7: =RC[-5]*1.2 -> 52.919999999999995 | AK7: =RC[-5]*1.2 -> 52.919999999999995 | AL7: =RC[-10]*1.5 -> 6.2999999999999989 | AM7: =RC[-10]*1.5 -> 1.8899999999999997 | AN7: =RC[-10]*1.5 -> 66.149999999999991 | AO7: =RC[-10]*1.5 -> 66.149999999999991 | AP7: =RC[-10]*1.5 -> 66.149999999999991 | AQ7: =RC[-15]*2 -> 8.3999999999999986 | AR7: =RC[-15]*2 -> 2.5199999999999996 | AS7: =RC[-15]*2 -> 88.199999999999989 | AT7: =RC[-15]*2 -> 88.199999999999989 | AU7: =RC[-15]*2 -> 88.199999999999989 | AV7: 29 | AW7: 2 | AX7: 10 | AY7: =RC[-48]/10 -> 0.41999999999999993 | AZ7: =RC[-48]/10 -> 0.12599999999999997 | BA7: =RC[-48]/10 -> 4.4099999999999993 | BB7: =RC[-48]/10 -> 4.4099999999999993 | BC7: =RC[-48]/10 -> 4.4099999999999993 | BD7: =RC[-8]/10 -> 2.9 | BE7: =RC[-8]/10 -> 0.2 | BF7: =RC[-8]/10 -> 1 | BG7: 2000 | BH7: 100 | BI7: 600 | BJ7: =RC[-6]*30 -> 87 | BK7: =RC[-6]*30 -> 6 | BL7: =RC[-6]*30 -> 30 | BM7: =(R[1]C*60-20)/60 -> 1.6666666666666685 | BN7: =(R[1]C*60-100)/60 -> 16.666666666666671 | BO7: =RC[-2]/5 -> 0.3333333333333337 | BP7: =RC[-2]/5 -> 3.3333333333333344 | BQ7: =RC[-4]*30 -> 50.000000000000057 | BR7: =RC[-4]*30 -> 500.00000000000011 | BS7: =RC[-4]*30 -> 10.000000000000011 | BT7: =RC[-4]*30 -> 100.00000000000003
A8: 6 | B8: C0 | C8: =R3C*(1+(RC[-2]-1)*0.1) -> 4.5 | D8: =RC[-1]*0.3 -> 1.3499999999999999 | E8: =(RC[-2]-RC[-1])*15 -> 47.250000000000007 | F8: =RC[-1] -> 47.250000000000007 | G8: =RC[-1] -> 47.250000000000007 | H8: =RC[-5]*1.2 -> 5.3999999999999995 | I8: =RC[-5]*1.2 -> 1.6199999999999999 | J8: =RC[-5]*1.2 -> 56.70000000000001 | K8: =RC[-5]*1.2 -> 56.70000000000001 | L8: =RC[-5]*1.2 -> 56.70000000000001 | M8: =RC[-10] -> 4.5 | N8: =RC[-10] -> 1.3499999999999999 | O8: =RC[-10] -> 47.250000000000007 | P8: =RC[-10] -> 47.250000000000007 | Q8: =RC[-10] -> 47.250000000000007 | R8: =RC[-15] -> 4.5 | S8: =RC[-15] -> 1.3499999999999999 | T8: =RC[-15] -> 47.250000000000007 | U8: =RC[-15] -> 47.250000000000007 | V8: =RC[-15] -> 47.250000000000007 | W8: =RC[-20] -> 4.5 | X8: =RC[-20] -> 1.3499999999999999 | Y8: =RC[-20] -> 47.250000000000007 | Z8: =RC[-20] -> 47.250000000000007 | AA8: =RC[-20] -> 47.250000000000007 | AB8: =RC[-25] -> 4.5 | AC8: =RC[-25] -> 1.3499999999999999 | AD8: =RC[-25] -> 47.250000000000007 | AE8: =RC[-25] -> 47.250000000000007 | AF8: =RC[-25] -> 47.250000000000007 | AG8: =RC[-5]*1.2 -> 5.3999999999999995 | AH8: =RC[-5]*1.2 -> 1.6199999999999999 | AI8: =RC[-5]*1.2 -> 56.70000000000001 | AJ8: =RC[-5]*1.2 -> 56.70000000000001 | AK8: =RC[-5]*1.2 -> 56.70000000000001 | AL8: =RC[-10]*1.5 -> 6.75 | AM8: =RC[-10]*1.5 -> 2.0249999999999999 | AN8: =RC[-10]*1.5 -> 70.875000000000014 | AO8: =RC[-10]*1.5 -> 70.875000000000014 | AP8: =RC[-10]*1.5 -> 70.875000000000014 | AQ8: =RC[-15]*2 -> 9 | AR8: =RC[-15]*2 -> 2.6999999999999997 | AS8: =RC[-15]*2 -> 94.500000000000014 | AT8: =RC[-15]*2 -> 94.500000000000014 | AU8: =RC[-15]*2 -> 94.500000000000014 | AV8: 30 | AW8: 2.2000000000000002 | AX8: 12 | AY8: =RC[-48]/10 -> 0.45 | AZ8: =RC[-48]/10 -> 0.13499999999999998 | BA8: =RC[-48]/10 -> 4.7250000000000005 | BB8: =RC[-48]/10 -> 4.7250000000000005 | BC8: =RC[-48]/10 -> 4.7250000000000005 | BD8: =RC[-8]/10 -> 3 | BE8: =RC[-8]/10 -> 0.22000000000000003 | BF8: =RC[-8]/10 -> 1.2 | BG8: 2200 | BH8: 120 | BI8: 720 | BJ8: =RC[-6]*30 -> 90 | BK8: =RC[-6]*30 -> 6.6000000000000005 | BL8: =RC[-6]*30 -> 36 | BM8: =(R[1]C*60-20)/60 -> 2.0000000000000018 | BN8: =(R[1]C*60-100)/60 -> 18.333333333333336 | BO8: =RC[-2]/5 -> 0.40000000000000036 | BP8: =RC[-2]/5 -> 3.666666666666667 | BQ8: =RC[-4]*30 -> 60.000000000000057 | BR8: =RC[-4]*30 -> 550.00000000000011 | BS8: =RC[-4]*30 -> 12.000000000000011 | BT8: =RC[-4]*30 -> 110.00000000000001
A9: 7 | B9: C1 | C9: =R3C*(1+(RC[-2]-1)*0.1) -> 4.8000000000000007 | D9: =RC[-1]*0.3 -> 1.4400000000000002 | E9: =(RC[-2]-RC[-1])*15 -> 50.400000000000006 | F9: =RC[-1] -> 50.400000000000006 | G9: =RC[-1] -> 50.400000000000006 | H9: =RC[-5]*1.2 -> 5.7600000000000007 | I9: =RC[-5]*1.2 -> 1.7280000000000002 | J9: =RC[-5]*1.2 -> 60.480000000000004 | K9: =RC[-5]*1.2 -> 60.480000000000004 | L9: =RC[-5]*1.2 -> 60.480000000000004 | M9: =RC[-10] -> 4.8000000000000007 | N9: =RC[-10] -> 1.4400000000000002 | O9: =RC[-10] -> 50.400000000000006 | P9: =RC[-10] -> 50.400000000000006 | Q9: =RC[-10] -> 50.400000000000006 | R9: =RC[-15] -> 4.8000000000000007 | S9: =RC[-15] -> 1.4400000000000002 | T9: =RC[-15] -> 50.400000000000006 | U9: =RC[-15] -> 50.400000000000006 | V9: =RC[-15] -> 50.400000000000006 | W9: =RC[-20] -> 4.8000000000000007 | X9: =RC[-20] -> 1.4400000000000002 | Y9: =RC[-20] -> 50.400000000000006 | Z9: =RC[-20] -> 50.400000000000006 | AA9: =RC[-20] -> 50.400000000000006 | AB9: =RC[-25] -> 4.8000000000000007 | AC9: =RC[-25] -> 1.4400000000000002 | AD9: =RC[-25] -> 50.400000000000006 | AE9: =RC[-25] -> 50.400000000000006 | AF9: =RC[-25] -> 50.400000000000006 | AG9: =RC[-5]*1.2 -> 5.7600000000000007 | AH9: =RC[-5]*1.2 -> 1.7280000000000002 | AI9: =RC[-5]*1.2 -> 60.480000000000004 | AJ9: =RC[-5]*1.2 -> 60.480000000000004 | AK9: =RC[-5]*1.2 -> 60.480000000000004 | AL9: =RC[-10]*1.5 -> 7.2000000000000011 | AM9: =RC[-10]*1.5 -> 2.16 | AN9: =RC[-10]*1.5 -> 75.600000000000009 | AO9: =RC[-10]*1.5 -> 75.600000000000009 | AP9: =RC[-10]*1.5 -> 75.600000000000009 | AQ9: =RC[-15]*2 -> 9.6000000000000014 | AR9: =RC[-15]*2 -> 2.8800000000000003 | AS9: =RC[-15]*2 -> 100.80000000000001 | AT9: =RC[-15]*2 -> 100.80000000000001 | AU9: =RC[-15]*2 -> 100.80000000000001 | AV9: 31 | AW9: 2.4 | AX9: 14 | AY9: =RC[-48]/10 -> 0.48000000000000009 | AZ9: =RC[-48]/10 -> 0.14400000000000002 | BA9: =RC[-48]/10 -> 5.0400000000000009 | BB9: =RC[-48]/10 -> 5.0400000000000009 | BC9: =RC[-48]/10 -> 5.0400000000000009 | BD9: =RC[-8]/10 -> 3.1 | BE9: =RC[-8]/10 -> 0.24 | BF9: =RC[-8]/10 -> 1.4 | BG9: 2400 | BH9: 140 | BI9: 840 | BJ9: =RC[-6]*30 -> 93 | BK9: =RC[-6]*30 -> 7.1999999999999993 | BL9: =RC[-6]*30 -> 42 | BM9: =(R[1]C*60-20)/60 -> 2.3333333333333353 | BN9: =(R[1]C*60-100)/60 -> 20.000000000000004 | BO9: =RC[-2]/5 -> 0.46666666666666706 | BP9: =RC[-2]/5 -> 4.0000000000000009 | BQ9: =RC[-4]*30 -> 70.000000000000057 | BR9: =RC[-4]*30 -> 600.00000000000011 | BS9: =RC[-4]*30 -> 14.000000000000012 | BT9: =RC[-4]*30 -> 120.00000000000003
A10: 8 | B10: C2 | C10: =R3C*(1+(RC[-2]-1)*0.1) -> 5.1000000000000005 | D10: =RC[-1]*0.3 -> 1.53 | E10: =(RC[-2]-RC[-1])*15 -> 53.550000000000004 | F10: =RC[-1] -> 53.550000000000004 | G10: =RC[-1] -> 53.550000000000004 | H10: =RC[-5]*1.2 -> 6.12 | I10: =RC[-5]*1.2 -> 1.8359999999999999 | J10: =RC[-5]*1.2 -> 64.260000000000005 | K10: =RC[-5]*1.2 -> 64.260000000000005 | L10: =RC[-5]*1.2 -> 64.260000000000005 | M10: =RC[-10] -> 5.1000000000000005 | N10: =RC[-10] -> 1.53 | O10: =RC[-10] -> 53.550000000000004 | P10: =RC[-10] -> 53.550000000000004 | Q10: =RC[-10] -> 53.550000000000004 | R10: =RC[-15] -> 5.1000000000000005 | S10: =RC[-15] -> 1.53 | T10: =RC[-15] -> 53.550000000000004 | U10: =RC[-15] -> 53.550000000000004 | V10: =RC[-15] -> 53.550000000000004 | W10: =RC[-20] -> 5.1000000000000005 | X10: =RC[-20] -> 1.53 | Y10: =RC[-20] -> 53.550000000000004 | Z10: =RC[-20] -> 53.550000000000004 | AA10: =RC[-20] -> 53.550000000000004 | AB10: =RC[-25] -> 5.1000000000000005 | AC10: =RC[-25] -> 1.53 | AD10: =RC[-25] -> 53.550000000000004 | AE10: =RC[-25] -> 53.550000000000004 | AF10: =RC[-25] -> 53.550000000000004 | AG10: =RC[-5]*1.2 -> 6.12 | AH10: =RC[-5]*1.2 -> 1.8359999999999999 | AI10: =RC[-5]*1.2 -> 64.260000000000005 | AJ10: =RC[-5]*1.2 -> 64.260000000000005 | AK10: =RC[-5]*1.2 -> 64.260000000000005 | AL10: =RC[-10]*1.5 -> 7.65 | AM10: =RC[-10]*1.5 -> 2.2949999999999999 | AN10: =RC[-10]*1.5 -> 80.325000000000003 | AO10: =RC[-10]*1.5 -> 80.325000000000003 | AP10: =RC[-10]*1.5 -> 80.325000000000003 | AQ10: =RC[-15]*2 -> 10.200000000000001 | AR10: =RC[-15]*2 -> 3.06 | AS10: =RC[-15]*2 -> 107.10000000000001 | AT10: =RC[-15]*2 -> 107.10000000000001 | AU10: =RC[-15]*2 -> 107.10000000000001 | AV10: 32 | AW10: 2.6 | AX10: 16 | AY10: =RC[-48]/10 -> 0.51 | AZ10: =RC[-48]/10 -> 0.153 | BA10: =RC[-48]/10 -> 5.3550000000000004 | BB10: =RC[-48]/10 -> 5.3550000000000004 | BC10: =RC[-48]/10 -> 5.3550000000000004 | BD10: =RC[-8]/10 -> 3.2 | BE10: =RC[-8]/10 -> 0.26 | BF10: =RC[-8]/10 -> 1.6 | BG10: 2600 | BH10: 160 | BI10: 960 | BJ10: =RC[-6]*30 -> 96 | BK10: =RC[-6]*30 -> 7.8000000000000007 | BL10: =RC[-6]*30 -> 48 | BM10: =(R[1]C*60-20)/60 -> 2.6666666666666687 | BN10: =(R[1]C*60-100)/60 -> 21.666666666666671 | BO10: =RC[-2]/5 -> 0.53333333333333377 | BP10: =RC[-2]/5 -> 4.3333333333333339 | BQ10: =RC[-4]*30 -> 80.000000000000057 | BR10: =RC[-4]*30 -> 650.00000000000011 | BS10: =RC[-4]*30 -> 16.000000000000014 | BT10: =RC[-4]*30 -> 130.00000000000003
A11: 9 | B11: C3 | C11: =R3C*(1+(RC[-2]-1)*0.1) -> 5.4 | D11: =RC[-1]*0.3 -> 1.62 | E11: =(RC[-2]-RC[-1])*15 -> 56.7 | F11: =RC[-1] -> 56.7 | G11: =RC[-1] -> 56.7 | H11: =RC[-5]*1.2 -> 6.48 | I11: =RC[-5]*1.2 -> 1.944 | J11: =RC[-5]*1.2 -> 68.040000000000006 | K11: =RC[-5]*1.2 -> 68.040000000000006 | L11: =RC[-5]*1.2 -> 68.040000000000006 | M11: =RC[-10] -> 5.4 | N11: =RC[-10] -> 1.62 | O11: =RC[-10] -> 56.7 | P11: =RC[-10] -> 56.7 | Q11: =RC[-10] -> 56.7 | R11: =RC[-15] -> 5.4 | S11: =RC[-15] -> 1.62 | T11: =RC[-15] -> 56.7 | U11: =RC[-15] -> 56.7 | V11: =RC[-15] -> 56.7 | W11: =RC[-20] -> 5.4 | X11: =RC[-20] -> 1.62 | Y11: =RC[-20] -> 56.7 | Z11: =RC[-20] -> 56.7 | AA11: =RC[-20] -> 56.7 | AB11: =RC[-25] -> 5.4 | AC11: =RC[-25] -> 1.62 | AD11: =RC[-25] -> 56.7 | AE11: =RC[-25] -> 56.7 | AF11: =RC[-25] -> 56.7 | AG11: =RC[-5]*1.2 -> 6.48 | AH11: =RC[-5]*1.2 -> 1.944 | AI11: =RC[-5]*1.2 -> 68.040000000000006 | AJ11: =RC[-5]*1.2 -> 68.040000000000006 | AK11: =RC[-5]*1.2 -> 68.040000000000006 | AL11: =RC[-10]*1.5 -> 8.1000000000000014 | AM11: =RC[-10]*1.5 -> 2.4300000000000002 | AN11: =RC[-10]*1.5 -> 85.050000000000011 | AO11: =RC[-10]*1.5 -> 85.050000000000011 | AP11: =RC[-10]*1.5 -> 85.050000000000011 | AQ11: =RC[-15]*2 -> 10.8 | AR11: =RC[-15]*2 -> 3.24 | AS11: =RC[-15]*2 -> 113.4 | AT11: =RC[-15]*2 -> 113.4 | AU11: =RC[-15]*2 -> 113.4 | AV11: 33 | AW11: 2.8 | AX11: 18 | AY11: =RC[-48]/10 -> 0.54 | AZ11: =RC[-48]/10 -> 0.16200000000000001 | BA11: =RC[-48]/10 -> 5.67 | BB11: =RC[-48]/10 -> 5.67 | BC11: =RC[-48]/10 -> 5.67 | BD11: =RC[-8]/10 -> 3.3 | BE11: =RC[-8]/10 -> 0.27999999999999997 | BF11: =RC[-8]/10 -> 1.8 | BG11: 2800 | BH11: 180 | BI11: 1080 | BJ11: =RC[-6]*30 -> 99 | BK11: =RC[-6]*30 -> 8.3999999999999986 | BL11: =RC[-6]*30 -> 54 | BM11: =(R[1]C*60-20)/60 -> 3.0000000000000018 | BN11: =(R[1]C*60-100)/60 -> 23.333333333333336 | BO11: =RC[-2]/5 -> 0.60000000000000031 | BP11: =RC[-2]/5 -> 4.666666666666667 | BQ11: =RC[-4]*30 -> 90.000000000000057 | BR11: =RC[-4]*30 -> 700.00000000000011 | BS11: =RC[-4]*30 -> 18.000000000000011 | BT11: =RC[-4]*30 -> 140
A12: 10 | B12: C4 | C12: =R3C*(1+(RC[-2]-1)*0.1) -> 5.6999999999999993 | D12: =RC[-1]*0.3 -> 1.7099999999999997 | E12: =(RC[-2]-RC[-1])*15 -> 59.849999999999987 | F12: =RC[-1] -> 59.849999999999987 | G12: =RC[-1] -> 59.849999999999987 | H12: =RC[-5]*1.2 -> 6.839999999999999 | I12: =RC[-5]*1.2 -> 2.0519999999999996 | J12: =RC[-5]*1.2 -> 71.819999999999979 | K12: =RC[-5]*1.2 -> 71.819999999999979 | L12: =RC[-5]*1.2 -> 71.819999999999979 | M12: =RC[-10] -> 5.6999999999999993 | N12: =RC[-10] -> 1.7099999999999997 | O12: =RC[-10] -> 59.849999999999987 | P12: =RC[-10] -> 59.849999999999987 | Q12: =RC[-10] -> 59.849999999999987 | R12: =RC[-15] -> 5.6999999999999993 | S12: =RC[-15] -> 1.7099999999999997 | T12: =RC[-15] -> 59.849999999999987 | U12: =RC[-15] -> 59.849999999999987 | V12: =RC[-15] -> 59.849999999999987 | W12: =RC[-20] -> 5.6999999999999993 | X12: =RC[-20] -> 1.7099999999999997 | Y12: =RC[-20] -> 59.849999999999987 | Z12: =RC[-20] -> 59.849999999999987 | AA12: =RC[-20] -> 59.849999999999987 | AB12: =RC[-25] -> 5.6999999999999993 | AC12: =RC[-25] -> 1.7099999999999997 | AD12: =RC[-25] -> 59.849999999999987 | AE12: =RC[-25] -> 59.849999999999987 | AF12: =RC[-25] -> 59.849999999999987 | AG12: =RC[-5]*1.2 -> 6.839999999999999 | AH12: =RC[-5]*1.2 -> 2.0519999999999996 | AI12: =RC[-5]*1.2 -> 71.819999999999979 | AJ12: =RC[-5]*1.2 -> 71.819999999999979 | AK12: =RC[-5]*1.2 -> 71.819999999999979 | AL12: =RC[-10]*1.5 -> 8.5499999999999989 | AM12: =RC[-10]*1.5 -> 2.5649999999999995 | AN12: =RC[-10]*1.5 -> 89.774999999999977 | AO12: =RC[-10]*1.5 -> 89.774999999999977 | AP12: =RC[-10]*1.5 -> 89.774999999999977 | AQ12: =RC[-15]*2 -> 11.399999999999999 | AR12: =RC[-15]*2 -> 3.4199999999999995 | AS12: =RC[-15]*2 -> 119.69999999999997 | AT12: =RC[-15]*2 -> 119.69999999999997 | AU12: =RC[-15]*2 -> 119.69999999999997 | AV12: 34 | AW12: 3 | AX12: 20 | AY12: =RC[-48]/10 -> 0.56999999999999995 | AZ12: =RC[-48]/10 -> 0.17099999999999999 | BA12: =RC[-48]/10 -> 5.9849999999999985 | BB12: =RC[-48]/10 -> 5.9849999999999985 | BC12: =RC[-48]/10 -> 5.9849999999999985 | BD12: =RC[-8]/10 -> 3.4 | BE12: =RC[-8]/10 -> 0.3 | BF12: =RC[-8]/10 -> 2 | BG12: 3000 | BH12: 200 | BI12: 1200 | BJ12: =RC[-6]*30 -> 102 | BK12: =RC[-6]*30 -> 9 | BL12: =RC[-6]*30 -> 60 | BM12: =(R[1]C*60-20)/60 -> 3.3333333333333353 | BN12: =(R[1]C*60-100)/60 -> 25.000000000000004 | BO12: =RC[-2]/5 -> 0.66666666666666707 | BP12: =RC[-2]/5 -> 5.0000000000000009 | BQ12: =RC[-4]*30 -> 100.00000000000006 | BR12: =RC[-4]*30 -> 750.00000000000011 | BS12: =RC[-4]*30 -> 20.000000000000011 | BT12: =RC[-4]*30 -> 150.00000000000003
A13: 11 | B13: B0 | C13: =R3C*(1+(RC[-2]-1)*0.1) -> 6 | D13: =RC[-1]*0.3 -> 1.7999999999999998 | E13: =(RC[-2]-RC[-1])*15 -> 63 | F13: =RC[-1] -> 63 | G13: =RC[-1] -> 63 | H13: =RC[-5]*1.2 -> 7.1999999999999993 | I13: =RC[-5]*1.2 -> 2.1599999999999997 | J13: =RC[-5]*1.2 -> 75.599999999999994 | K13: =RC[-5]*1.2 -> 75.599999999999994 | L13: =RC[-5]*1.2 -> 75.599999999999994 | M13: =RC[-10] -> 6 | N13: =RC[-10] -> 1.7999999999999998 | O13: =RC[-10] -> 63 | P13: =RC[-10] -> 63 | Q13: =RC[-10] -> 63 | R13: =RC[-15] -> 6 | S13: =RC[-15] -> 1.7999999999999998 | T13: =RC[-15] -> 63 | U13: =RC[-15] -> 63 | V13: =RC[-15] -> 63 | W13: =RC[-20] -> 6 | X13: =RC[-20] -> 1.7999999999999998 | Y13: =RC[-20] -> 63 | Z13: =RC[-20] -> 63 | AA13: =RC[-20] -> 63 | AB13: =RC[-25] -> 6 | AC13: =RC[-25] -> 1.7999999999999998 | AD13: =RC[-25] -> 63 | AE13: =RC[-25] -> 63 | AF13: =RC[-25] -> 63 | AG13: =RC[-5]*1.2 -> 7.1999999999999993 | AH13: =RC[-5]*1.2 -> 2.1599999999999997 | AI13: =RC[-5]*1.2 -> 75.599999999999994 | AJ13: =RC[-5]*1.2 -> 75.599999999999994 | AK13: =RC[-5]*1.2 -> 75.599999999999994 | AL13: =RC[-10]*1.5 -> 9 | AM13: =RC[-10]*1.5 -> 2.6999999999999997 | AN13: =RC[-10]*1.5 -> 94.5 | AO13: =RC[-10]*1.5 -> 94.5 | AP13: =RC[-10]*1.5 -> 94.5 | AQ13: =RC[-15]*2 -> 12 | AR13: =RC[-15]*2 -> 3.5999999999999996 | AS13: =RC[-15]*2 -> 126 | AT13: =RC[-15]*2 -> 126 | AU13: =RC[-15]*2 -> 126 | AV13: 35 | AW13: 3.4 | AX13: 22 | AY13: =RC[-48]/10 -> 0.6 | AZ13: =RC[-48]/10 -> 0.18 | BA13: =RC[-48]/10 -> 6.3 | BB13: =RC[-48]/10 -> 6.3 | BC13: =RC[-48]/10 -> 6.3 | BD13: =RC[-8]/10 -> 3.5 | BE13: =RC[-8]/10 -> 0.33999999999999997 | BF13: =RC[-8]/10 -> 2.2000000000000002 | BG13: 3200 | BH13: 220 | BI13: 1320 | BJ13: =RC[-6]*30 -> 105 | BK13: =RC[-6]*30 -> 10.199999999999999 | BL13: =RC[-6]*30 -> 66 | BM13: =(R[1]C*60-20)/60 -> 3.6666666666666687 | BN13: =(R[1]C*60-100)/60 -> 26.666666666666671 | BO13: =RC[-2]/5 -> 0.73333333333333373 | BP13: =RC[-2]/5 -> 5.3333333333333339 | BQ13: =RC[-4]*30 -> 110.00000000000006 | BR13: =RC[-4]*30 -> 800.00000000000011 | BS13: =RC[-4]*30 -> 22.000000000000011 | BT13: =RC[-4]*30 -> 160.00000000000003
A14: 12 | B14: B1 | C14: =R3C*(1+(RC[-2]-1)*0.1) -> 6.3000000000000007 | D14: =RC[-1]*0.3 -> 1.8900000000000001 | E14: =(RC[-2]-RC[-1])*15 -> 66.150000000000006 | F14: =RC[-1] -> 66.150000000000006 | G14: =RC[-1] -> 66.150000000000006 | H14: =RC[-5]*1.2 -> 7.5600000000000005 | I14: =RC[-5]*1.2 -> 2.2680000000000002 | J14: =RC[-5]*1.2 -> 79.38000000000001 | K14: =RC[-5]*1.2 -> 79.38000000000001 | L14: =RC[-5]*1.2 -> 79.38000000000001 | M14: =RC[-10] -> 6.3000000000000007 | N14: =RC[-10] -> 1.8900000000000001 | O14: =RC[-10] -> 66.150000000000006 | P14: =RC[-10] -> 66.150000000000006 | Q14: =RC[-10] -> 66.150000000000006 | R14: =RC[-15] -> 6.3000000000000007 | S14: =RC[-15] -> 1.8900000000000001 | T14: =RC[-15] -> 66.150000000000006 | U14: =RC[-15] -> 66.150000000000006 | V14: =RC[-15] -> 66.150000000000006 | W14: =RC[-20] -> 6.3000000000000007 | X14: =RC[-20] -> 1.8900000000000001 | Y14: =RC[-20] -> 66.150000000000006 | Z14: =RC[-20] -> 66.150000000000006 | AA14: =RC[-20] -> 66.150000000000006 | AB14: =RC[-25] -> 6.3000000000000007 | AC14: =RC[-25] -> 1.8900000000000001 | AD14: =RC[-25] -> 66.150000000000006 | AE14: =RC[-25] -> 66.150000000000006 | AF14: =RC[-25] -> 66.150000000000006 | AG14: =RC[-5]*1.2 -> 7.5600000000000005 | AH14: =RC[-5]*1.2 -> 2.2680000000000002 | AI14: =RC[-5]*1.2 -> 79.38000000000001 | AJ14: =RC[-5]*1.2 -> 79.38000000000001 | AK14: =RC[-5]*1.2 -> 79.38000000000001 | AL14: =RC[-10]*1.5 -> 9.4500000000000011 | AM14: =RC[-10]*1.5 -> 2.835 | AN14: =RC[-10]*1.5 -> 99.225000000000009 | AO14: =RC[-10]*1.5 -> 99.225000000000009 | AP14: =RC[-10]*1.5 -> 99.225000000000009 | AQ14: =RC[-15]*2 -> 12.600000000000001 | AR14: =RC[-15]*2 -> 3.7800000000000002 | AS14: =RC[-15]*2 -> 132.30000000000001 | AT14: =RC[-15]*2 -> 132.30000000000001 | AU14: =RC[-15]*2 -> 132.30000000000001 | AV14: 36 | AW14: 3.8 | AX14: 24 | AY14: =RC[-48]/10 -> 0.63000000000000012 | AZ14: =RC[-48]/10 -> 0.189 | BA14: =RC[-48]/10 -> 6.6150000000000002 | BB14: =RC[-48]/10 -> 6.6150000000000002 | BC14: =RC[-48]/10 -> 6.6150000000000002 | BD14: =RC[-8]/10 -> 3.6 | BE14: =RC[-8]/10 -> 0.38 | BF14: =RC[-8]/10 -> 2.4 | BG14: 3400 | BH14: 240 | BI14: 1440 | BJ14: =RC[-6]*30 -> 108 | BK14: =RC[-6]*30 -> 11.4 | BL14: =RC[-6]*30 -> 72 | BM14: =(R[1]C*60-20)/60 -> 4.0000000000000018 | BN14: =(R[1]C*60-100)/60 -> 28.333333333333336 | BO14: =RC[-2]/5 -> 0.80000000000000038 | BP14: =RC[-2]/5 -> 5.666666666666667 | BQ14: =RC[-4]*30 -> 120.00000000000006 | BR14: =RC[-4]*30 -> 850.00000000000011 | BS14: =RC[-4]*30 -> 24.000000000000011 | BT14: =RC[-4]*30 -> 170
A15: 13 | B15: B2 | C15: =R3C*(1+(RC[-2]-1)*0.1) -> 6.6000000000000005 | D15: =RC[-1]*0.3 -> 1.98 | E15: =(RC[-2]-RC[-1])*15 -> 69.300000000000011 | F15: =RC[-1] -> 69.300000000000011 | G15: =RC[-1] -> 69.300000000000011 | H15: =RC[-5]*1.2 -> 7.92 | I15: =RC[-5]*1.2 -> 2.3759999999999999 | J15: =RC[-5]*1.2 -> 83.160000000000011 | K15: =RC[-5]*1.2 -> 83.160000000000011 | L15: =RC[-5]*1.2 -> 83.160000000000011 | M15: =RC[-10] -> 6.6000000000000005 | N15: =RC[-10] -> 1.98 | O15: =RC[-10] -> 69.300000000000011 | P15: =RC[-10] -> 69.300000000000011 | Q15: =RC[-10] -> 69.300000000000011 | R15: =RC[-15] -> 6.6000000000000005 | S15: =RC[-15] -> 1.98 | T15: =RC[-15] -> 69.300000000000011 | U15: =RC[-15] -> 69.300000000000011 | V15: =RC[-15] -> 69.300000000000011 | W15: =RC[-20] -> 6.6000000000000005 | X15: =RC[-20] -> 1.98 | Y15: =RC[-20] -> 69.300000000000011 | Z15: =RC[-20] -> 69.300000000000011 | AA15: =RC[-20] -> 69.300000000000011 | AB15: =RC[-25] -> 6.6000000000000005 | AC15: =RC[-25] -> 1.98 | AD15: =RC[-25] -> 69.300000000000011 | AE15: =RC[-25] -> 69.300000000000011 | AF15: =RC[-25] -> 69.300000000000011 | AG15: =RC[-5]*1.2 -> 7.92 | AH15: =RC[-5]*1.2 -> 2.3759999999999999 | AI15: =RC[-5]*1.2 -> 83.160000000000011 | AJ15: =RC[-5]*1.2 -> 83.160000000000011 | AK15: =RC[-5]*1.2 -> 83.160000000000011 | AL15: =RC[-10]*1.5 -> 9.9 | AM15: =RC[-10]*1.5 -> 2.9699999999999998 | AN15: =RC[-10]*1.5 -> 103.95000000000002 | AO15: =RC[-10]*1.5 -> 103.95000000000002 | AP15: =RC[-10]*1.5 -> 103.95000000000002 | AQ15: =RC[-15]*2 -> 13.200000000000001 | AR15: =RC[-15]*2 -> 3.96 | AS15: =RC[-15]*2 -> 138.60000000000002 | AT15: =RC[-15]*2 -> 138.60000000000002 | AU15: =RC[-15]*2 -> 138.60000000000002 | AV15: 27 | AW15: 4.2 | AX15: 26 | AY15: =RC[-48]/10 -> 0.66 | AZ15: =RC[-48]/10 -> 0.19800000000000001 | BA15: =RC[-48]/10 -> 6.9300000000000015 | BB15: =RC[-48]/10 -> 6.9300000000000015 | BC15: =RC[-48]/10 -> 6.9300000000000015 | BD15: =RC[-8]/10 -> 2.7 | BE15: =RC[-8]/10 -> 0.42000000000000004 | BF15: =RC[-8]/10 -> 2.6 | BG15: 3600 | BH15: 260 | BI15: 1560 | BJ15: =RC[-6]*30 -> 81 | BK15: =RC[-6]*30 -> 12.600000000000001 | BL15: =RC[-6]*30 -> 78 | BM15: =(R[1]C*60-20)/60 -> 4.3333333333333348 | BN15: =(R[1]C*60-100)/60 -> 30.000000000000004 | BO15: =RC[-2]/5 -> 0.86666666666666692 | BP15: =RC[-2]/5 -> 6.0000000000000009 | BQ15: =RC[-4]*30 -> 130.00000000000006 | BR15: =RC[-4]*30 -> 900.00000000000011 | BS15: =RC[-4]*30 -> 26.000000000000007 | BT15: =RC[-4]*30 -> 180.00000000000003
A16: 14 | B16: B3 | C16: =R3C*(1+(RC[-2]-1)*0.1) -> 6.8999999999999995 | D16: =RC[-1]*0.3 -> 2.0699999999999998 | E16: =(RC[-2]-RC[-1])*15 -> 72.45 | F16: =RC[-1] -> 72.45 | G16: =RC[-1] -> 72.45 | H16: =RC[-5]*1.2 -> 8.2799999999999994 | I16: =RC[-5]*1.2 -> 2.4839999999999995 | J16: =RC[-5]*1.2 -> 86.94 | K16: =RC[-5]*1.2 -> 86.94 | L16: =RC[-5]*1.2 -> 86.94 | M16: =RC[-10] -> 6.8999999999999995 | N16: =RC[-10] -> 2.0699999999999998 | O16: =RC[-10] -> 72.45 | P16: =RC[-10] -> 72.45 | Q16: =RC[-10] -> 72.45 | R16: =RC[-15] -> 6.8999999999999995 | S16: =RC[-15] -> 2.0699999999999998 | T16: =RC[-15] -> 72.45 | U16: =RC[-15] -> 72.45 | V16: =RC[-15] -> 72.45 | W16: =RC[-20] -> 6.8999999999999995 | X16: =RC[-20] -> 2.0699999999999998 | Y16: =RC[-20] -> 72.45 | Z16: =RC[-20] -> 72.45 | AA16: =RC[-20] -> 72.45 | AB16: =RC[-25] -> 6.8999999999999995 | AC16: =RC[-25] -> 2.0699999999999998 | AD16: =RC[-25] -> 72.45 | AE16: =RC[-25] -> 72.45 | AF16: =RC[-25] -> 72.45 | AG16: =RC[-5]*1.2 -> 8.2799999999999994 | AH16: =RC[-5]*1.2 -> 2.4839999999999995 | AI16: =RC[-5]*1.2 -> 86.94 | AJ16: =RC[-5]*1.2 -> 86.94 | AK16: =RC[-5]*1.2 -> 86.94 | AL16: =RC[-10]*1.5 -> 10.35 | AM16: =RC[-10]*1.5 -> 3.1049999999999995 | AN16: =RC[-10]*1.5 -> 108.67500000000001 | AO16: =RC[-10]*1.5 -> 108.67500000000001 | AP16: =RC[-10]*1.5 -> 108.67500000000001 | AQ16: =RC[-15]*2 -> 13.799999999999999 | AR16: =RC[-15]*2 -> 4.1399999999999997 | AS16: =RC[-15]*2 -> 144.9 | AT16: =RC[-15]*2 -> 144.9 | AU16: =RC[-15]*2 -> 144.9 | AV16: 38 | AW16: 4.5999999999999996 | AX16: 28 | AY16: =RC[-48]/10 -> 0.69 | AZ16: =RC[-48]/10 -> 0.20699999999999999 | BA16: =RC[-48]/10 -> 7.2450000000000001 | BB16: =RC[-48]/10 -> 7.2450000000000001 | BC16: =RC[-48]/10 -> 7.2450000000000001 | BD16: =RC[-8]/10 -> 3.8 | BE16: =RC[-8]/10 -> 0.45999999999999996 | BF16: =RC[-8]/10 -> 2.8 | BG16: 3800 | BH16: 280 | BI16: 1680 | BJ16: =RC[-6]*30 -> 114 | BK16: =RC[-6]*30 -> 13.799999999999999 | BL16: =RC[-6]*30 -> 84 | BM16: =(R[1]C*60-20)/60 -> 4.6666666666666687 | BN16: =(R[1]C*60-100)/60 -> 31.666666666666671 | BO16: =RC[-2]/5 -> 0.93333333333333379 | BP16: =RC[-2]/5 -> 6.3333333333333339 | BQ16: =RC[-4]*30 -> 140.00000000000006 | BR16: =RC[-4]*30 -> 950.00000000000011 | BS16: =RC[-4]*30 -> 28.000000000000014 | BT16: =RC[-4]*30 -> 190.00000000000003
A17: 15 | B17: B4 | C17: =R3C*(1+(RC[-2]-1)*0.1) -> 7.2000000000000011 | D17: =RC[-1]*0.3 -> 2.16 | E17: =(RC[-2]-RC[-1])*15 -> 75.600000000000009 | F17: =RC[-1] -> 75.600000000000009 | G17: =RC[-1] -> 75.600000000000009 | H17: =RC[-5]*1.2 -> 8.64 | I17: =RC[-5]*1.2 -> 2.5920000000000001 | J17: =RC[-5]*1.2 -> 90.720000000000013 | K17: =RC[-5]*1.2 -> 90.720000000000013 | L17: =RC[-5]*1.2 -> 90.720000000000013 | M17: =RC[-10] -> 7.2000000000000011 | N17: =RC[-10] -> 2.16 | O17: =RC[-10] -> 75.600000000000009 | P17: =RC[-10] -> 75.600000000000009 | Q17: =RC[-10] -> 75.600000000000009 | R17: =RC[-15] -> 7.2000000000000011 | S17: =RC[-15] -> 2.16 | T17: =RC[-15] -> 75.600000000000009 | U17: =RC[-15] -> 75.600000000000009 | V17: =RC[-15] -> 75.600000000000009 | W17: =RC[-20] -> 7.2000000000000011 | X17: =RC[-20] -> 2.16 | Y17: =RC[-20] -> 75.600000000000009 | Z17: =RC[-20] -> 75.600000000000009 | AA17: =RC[-20] -> 75.600000000000009 | AB17: =RC[-25] -> 7.2000000000000011 | AC17: =RC[-25] -> 2.16 | AD17: =RC[-25] -> 75.600000000000009 | AE17: =RC[-25] -> 75.600000000000009 | AF17: =RC[-25] -> 75.600000000000009 | AG17: =RC[-5]*1.2 -> 8.64 | AH17: =RC[-5]*1.2 -> 2.5920000000000001 | AI17: =RC[-5]*1.2 -> 90.720000000000013 | AJ17: =RC[-5]*1.2 -> 90.720000000000013 | AK17: =RC[-5]*1.2 -> 90.720000000000013 | AL17: =RC[-10]*1.5 -> 10.8 | AM17: =RC[-10]*1.5 -> 3.24 | AN17: =RC[-10]*1.5 -> 113.4 | AO17: =RC[-10]*1.5 -> 113.4 | AP17: =RC[-10]*1.5 -> 113.4 | AQ17: =RC[-15]*2 -> 14.400000000000002 | AR17: =RC[-15]*2 -> 4.32 | AS17: =RC[-15]*2 -> 151.20000000000002 | AT17: =RC[-15]*2 -> 151.20000000000002 | AU17: =RC[-15]*2 -> 151.20000000000002 | AV17: 40 | AW17: 5 | AX17: 30 | AY17: =RC[-48]/10 -> 0.72000000000000008 | AZ17: =RC[-48]/10 -> 0.21600000000000003 | BA17: =RC[-48]/10 -> 7.5600000000000005 | BB17: =RC[-48]/10 -> 7.5600000000000005 | BC17: =RC[-48]/10 -> 7.5600000000000005 | BD17: =RC[-8]/10 -> 4 | BE17: =RC[-8]/10 -> 0.5 | BF17: =RC[-8]/10 -> 3 | BG17: 4000 | BH17: 300 | BI17: 1800 | BJ17: =RC[-6]*30 -> 120 | BK17: =RC[-6]*30 -> 15 | BL17: =RC[-6]*30 -> 90 | BM17: =(R[1]C*60-20)/60 -> 5.0000000000000018 | BN17: =(R[1]C*60-100)/60 -> 33.333333333333336 | BO17: =RC[-2]/5 -> 1.0000000000000004 | BP17: =RC[-2]/5 -> 6.666666666666667 | BQ17: =RC[-4]*30 -> 150.00000000000006 | BR17: =RC[-4]*30 -> 1000.0000000000001 | BS17: =RC[-4]*30 -> 30.000000000000014 | BT17: =RC[-4]*30 -> 200
A18: 16 | B18: A0 | C18: =R3C*(1+(RC[-2]-1)*0.1) -> 7.5 | D18: =RC[-1]*0.3 -> 2.25 | E18: =(RC[-2]-RC[-1])*15 -> 78.75 | F18: =RC[-1] -> 78.75 | G18: =RC[-1] -> 78.75 | H18: =RC[-5]*1.2 -> 9 | I18: =RC[-5]*1.2 -> 2.6999999999999997 | J18: =RC[-5]*1.2 -> 94.5 | K18: =RC[-5]*1.2 -> 94.5 | L18: =RC[-5]*1.2 -> 94.5 | M18: =RC[-10] -> 7.5 | N18: =RC[-10] -> 2.25 | O18: =RC[-10] -> 78.75 | P18: =RC[-10] -> 78.75 | Q18: =RC[-10] -> 78.75 | R18: =RC[-15] -> 7.5 | S18: =RC[-15] -> 2.25 | T18: =RC[-15] -> 78.75 | U18: =RC[-15] -> 78.75 | V18: =RC[-15] -> 78.75 | W18: =RC[-20] -> 7.5 | X18: =RC[-20] -> 2.25 | Y18: =RC[-20] -> 78.75 | Z18: =RC[-20] -> 78.75 | AA18: =RC[-20] -> 78.75 | AB18: =RC[-25] -> 7.5 | AC18: =RC[-25] -> 2.25 | AD18: =RC[-25] -> 78.75 | AE18: =RC[-25] -> 78.75 | AF18: =RC[-25] -> 78.75 | AG18: =RC[-5]*1.2 -> 9 | AH18: =RC[-5]*1.2 -> 2.6999999999999997 | AI18: =RC[-5]*1.2 -> 94.5 | AJ18: =RC[-5]*1.2 -> 94.5 | AK18: =RC[-5]*1.2 -> 94.5 | AL18: =RC[-10]*1.5 -> 11.25 | AM18: =RC[-10]*1.5 -> 3.375 | AN18: =RC[-10]*1.5 -> 118.125 | AO18: =RC[-10]*1.5 -> 118.125 | AP18: =RC[-10]*1.5 -> 118.125 | AQ18: =RC[-15]*2 -> 15 | AR18: =RC[-15]*2 -> 4.5 | AS18: =RC[-15]*2 -> 157.5 | AT18: =RC[-15]*2 -> 157.5 | AU18: =RC[-15]*2 -> 157.5 | AV18: 42 | AW18: 5.4 | AX18: 32 | AY18: =RC[-48]/10 -> 0.75 | AZ18: =RC[-48]/10 -> 0.22500000000000001 | BA18: =RC[-48]/10 -> 7.875 | BB18: =RC[-48]/10 -> 7.875 | BC18: =RC[-48]/10 -> 7.875 | BD18: =RC[-8]/10 -> 4.2 | BE18: =RC[-8]/10 -> 0.54 | BF18: =RC[-8]/10 -> 3.2 | BG18: 4200 | BH18: 320 | BI18: 1920 | BJ18: =RC[-6]*30 -> 126 | BK18: =RC[-6]*30 -> 16.200000000000003 | BL18: =RC[-6]*30 -> 96 | BM18: =(R[1]C*60-20)/60 -> 5.3333333333333348 | BN18: =(R[1]C*60-100)/60 -> 35 | BO18: =RC[-2]/5 -> 1.0666666666666669 | BP18: =RC[-2]/5 -> 7 | BQ18: =RC[-4]*30 -> 160.00000000000006 | BR18: =RC[-4]*30 -> 1050 | BS18: =RC[-4]*30 -> 32.000000000000007 | BT18: =RC[-4]*30 -> 210
A19: 17 | B19: A1 | C19: =R3C*(1+(RC[-2]-1)*0.1) -> 7.8000000000000007 | D19: =RC[-1]*0.3 -> 2.3400000000000003 | E19: =(RC[-2]-RC[-1])*15 -> 81.900000000000006 | F19: =RC[-1] -> 81.900000000000006 | G19: =RC[-1] -> 81.900000000000006 | H19: =RC[-5]*1.2 -> 9.3600000000000012 | I19: =RC[-5]*1.2 -> 2.8080000000000003 | J19: =RC[-5]*1.2 -> 98.28 | K19: =RC[-5]*1.2 -> 98.28 | L19: =RC[-5]*1.2 -> 98.28 | M19: =RC[-10] -> 7.8000000000000007 | N19: =RC[-10] -> 2.3400000000000003 | O19: =RC[-10] -> 81.900000000000006 | P19: =RC[-10] -> 81.900000000000006 | Q19: =RC[-10] -> 81.900000000000006 | R19: =RC[-15] -> 7.8000000000000007 | S19: =RC[-15] -> 2.3400000000000003 | T19: =RC[-15] -> 81.900000000000006 | U19: =RC[-15] -> 81.900000000000006 | V19: =RC[-15] -> 81.900000000000006 | W19: =RC[-20] -> 7.8000000000000007 | X19: =RC[-20] -> 2.3400000000000003 | Y19: =RC[-20] -> 81.900000000000006 | Z19: =RC[-20] -> 81.900000000000006 | AA19: =RC[-20] -> 81.900000000000006 | AB19: =RC[-25] -> 7.8000000000000007 | AC19: =RC[-25] -> 2.3400000000000003 | AD19: =RC[-25] -> 81.900000000000006 | AE19: =RC[-25] -> 81.900000000000006 | AF19: =RC[-25] -> 81.900000000000006 | AG19: =RC[-5]*1.2 -> 9.3600000000000012 | AH19: =RC[-5]*1.2 -> 2.8080000000000003 | AI19: =RC[-5]*1.2 -> 98.28 | AJ19: =RC[-5]*1.2 -> 98.28 | AK19: =RC[-5]*1.2 -> 98.28 | AL19: =RC[-10]*1.5 -> 11.700000000000001 | AM19: =RC[-10]*1.5 -> 3.5100000000000007 | AN19: =RC[-10]*1.5 -> 122.85000000000001 | AO19: =RC[-10]*1.5 -> 122.85000000000001 | AP19: =RC[-10]*1.5 -> 122.85000000000001 | AQ19: =RC[-15]*2 -> 15.600000000000001 | AR19: =RC[-15]*2 -> 4.6800000000000006 | AS19: =RC[-15]*2 -> 163.80000000000001 | AT19: =RC[-15]*2 -> 163.80000000000001 | AU19: =RC[-15]*2 -> 163.80000000000001 | AV19: 44 | AW19: 5.8 | AX19: 34 | AY19: =RC[-48]/10 -> 0.78 | AZ19: =RC[-48]/10 -> 0.23400000000000004 | BA19: =RC[-48]/10 -> 8.1900000000000013 | BB19: =RC[-48]/10 -> 8.1900000000000013 | BC19: =RC[-48]/10 -> 8.1900000000000013 | BD19: =RC[-8]/10 -> 4.4000000000000004 | BE19: =RC[-8]/10 -> 0.57999999999999996 | BF19: =RC[-8]/10 -> 3.4 | BG19: 4400 | BH19: 340 | BI19: 2040 | BJ19: =RC[-6]*30 -> 132 | BK19: =RC[-6]*30 -> 17.399999999999999 | BL19: =RC[-6]*30 -> 102 | BM19: =(R[1]C*60-20)/60 -> 5.6666666666666687 | BN19: =(R[1]C*60-100)/60 -> 36.666666666666664 | BO19: =RC[-2]/5 -> 1.1333333333333337 | BP19: =RC[-2]/5 -> 7.333333333333333 | BQ19: =RC[-4]*30 -> 170.00000000000006 | BR19: =RC[-4]*30 -> 1100 | BS19: =RC[-4]*30 -> 34.000000000000014 | BT19: =RC[-4]*30 -> 220
A20: 18 | B20: A2 | C20: =R3C*(1+(RC[-2]-1)*0.1) -> 8.1000000000000014 | D20: =RC[-1]*0.3 -> 2.4300000000000002 | E20: =(RC[-2]-RC[-1])*15 -> 85.050000000000026 | F20: =RC[-1] -> 85.050000000000026 | G20: =RC[-1] -> 85.050000000000026 | H20: =RC[-5]*1.2 -> 9.7200000000000006 | I20: =RC[-5]*1.2 -> 2.9159999999999999 | J20: =RC[-5]*1.2 -> 102.06000000000003 | K20: =RC[-5]*1.2 -> 102.06000000000003 | L20: =RC[-5]*1.2 -> 102.06000000000003 | M20: =RC[-10] -> 8.1000000000000014 | N20: =RC[-10] -> 2.4300000000000002 | O20: =RC[-10] -> 85.050000000000026 | P20: =RC[-10] -> 85.050000000000026 | Q20: =RC[-10] -> 85.050000000000026 | R20: =RC[-15] -> 8.1000000000000014 | S20: =RC[-15] -> 2.4300000000000002 | T20: =RC[-15] -> 85.050000000000026 | U20: =RC[-15] -> 85.050000000000026 | V20: =RC[-15] -> 85.050000000000026 | W20: =RC[-20] -> 8.1000000000000014 | X20: =RC[-20] -> 2.4300000000000002 | Y20: =RC[-20] -> 85.050000000000026 | Z20: =RC[-20] -> 85.050000000000026 | AA20: =RC[-20] -> 85.050000000000026 | AB20: =RC[-25] -> 8.1000000000000014 | AC20: =RC[-25] -> 2.4300000000000002 | AD20: =RC[-25] -> 85.050000000000026 | AE20: =RC[-25] -> 85.050000000000026 | AF20: =RC[-25] -> 85.050000000000026 | AG20: =RC[-5]*1.2 -> 9.7200000000000006 | AH20: =RC[-5]*1.2 -> 2.9159999999999999 | AI20: =RC[-5]*1.2 -> 102.06000000000003 | AJ20: =RC[-5]*1.2 -> 102.06000000000003 | AK20: =RC[-5]*1.2 -> 102.06000000000003 | AL20: =RC[-10]*1.5 -> 12.150000000000002 | AM20: =RC[-10]*1.5 -> 3.6450000000000005 | AN20: =RC[-10]*1.5 -> 127.57500000000005 | AO20: =RC[-10]*1.5 -> 127.57500000000005 | AP20: =RC[-10]*1.5 -> 127.57500000000005 | AQ20: =RC[-15]*2 -> 16.200000000000003 | AR20: =RC[-15]*2 -> 4.8600000000000003 | AS20: =RC[-15]*2 -> 170.10000000000005 | AT20: =RC[-15]*2 -> 170.10000000000005 | AU20: =RC[-15]*2 -> 170.10000000000005 | AV20: 46 | AW20: 6.2 | AX20: 36 | AY20: =RC[-48]/10 -> 0.81000000000000016 | AZ20: =RC[-48]/10 -> 0.24300000000000002 | BA20: =RC[-48]/10 -> 8.5050000000000026 | BB20: =RC[-48]/10 -> 8.5050000000000026 | BC20: =RC[-48]/10 -> 8.5050000000000026 | BD20: =RC[-8]/10 -> 4.5999999999999996 | BE20: =RC[-8]/10 -> 0.62 | BF20: =RC[-8]/10 -> 3.6 | BG20: 4600 | BH20: 360 | BI20: 2160 | BJ20: =RC[-6]*30 -> 138 | BK20: =RC[-6]*30 -> 18.600000000000001 | BL20: =RC[-6]*30 -> 108 | BM20: =(R[1]C*60-20)/60 -> 6.0000000000000018 | BN20: =(R[1]C*60-100)/60 -> 38.333333333333336 | BO20: =RC[-2]/5 -> 1.2000000000000004 | BP20: =RC[-2]/5 -> 7.666666666666667 | BQ20: =RC[-4]*30 -> 180.00000000000006 | BR20: =RC[-4]*30 -> 1150 | BS20: =RC[-4]*30 -> 36.000000000000014 | BT20: =RC[-4]*30 -> 230
A21: 19 | B21: A3 | C21: =R3C*(1+(RC[-2]-1)*0.1) -> 8.3999999999999986 | D21: =RC[-1]*0.3 -> 2.5199999999999996 | E21: =(RC[-2]-RC[-1])*15 -> 88.199999999999989 | F21: =RC[-1] -> 88.199999999999989 | G21: =RC[-1] -> 88.199999999999989 | H21: =RC[-5]*1.2 -> 10.079999999999998 | I21: =RC[-5]*1.2 -> 3.0239999999999996 | J21: =RC[-5]*1.2 -> 105.83999999999999 | K21: =RC[-5]*1.2 -> 105.83999999999999 | L21: =RC[-5]*1.2 -> 105.83999999999999 | M21: =RC[-10] -> 8.3999999999999986 | N21: =RC[-10] -> 2.5199999999999996 | O21: =RC[-10] -> 88.199999999999989 | P21: =RC[-10] -> 88.199999999999989 | Q21: =RC[-10] -> 88.199999999999989 | R21: =RC[-15] -> 8.3999999999999986 | S21: =RC[-15] -> 2.5199999999999996 | T21: =RC[-15] -> 88.199999999999989 | U21: =RC[-15] -> 88.199999999999989 | V21: =RC[-15] -> 88.199999999999989 | W21: =RC[-20] -> 8.3999999999999986 | X21: =RC[-20] -> 2.5199999999999996 | Y21: =RC[-20] -> 88.199999999999989 | Z21: =RC[-20] -> 88.199999999999989 | AA21: =RC[-20] -> 88.199999999999989 | AB21: =RC[-25] -> 8.3999999999999986 | AC21: =RC[-25] -> 2.5199999999999996 | AD21: =RC[-25] -> 88.199999999999989 | AE21: =RC[-25] -> 88.199999999999989 | AF21: =RC[-25] -> 88.199999999999989 | AG21: =RC[-5]*1.2 -> 10.079999999999998 | AH21: =RC[-5]*1.2 -> 3.0239999999999996 | AI21: =RC[-5]*1.2 -> 105.83999999999999 | AJ21: =RC[-5]*1.2 -> 105.83999999999999 | AK21: =RC[-5]*1.2 -> 105.83999999999999 | AL21: =RC[-10]*1.5 -> 12.599999999999998 | AM21: =RC[-10]*1.5 -> 3.7799999999999994 | AN21: =RC[-10]*1.5 -> 132.29999999999998 | AO21: =RC[-10]*1.5 -> 132.29999999999998 | AP21: =RC[-10]*1.5 -> 132.29999999999998 | AQ21: =RC[-15]*2 -> 16.799999999999997 | AR21: =RC[-15]*2 -> 5.0399999999999991 | AS21: =RC[-15]*2 -> 176.39999999999998 | AT21: =RC[-15]*2 -> 176.39999999999998 | AU21: =RC[-15]*2 -> 176.39999999999998 | AV21: 48 | AW21: 6.6 | AX21: 38 | AY21: =RC[-48]/10 -> 0.83999999999999986 | AZ21: =RC[-48]/10 -> 0.25199999999999995 | BA21: =RC[-48]/10 -> 8.8199999999999985 | BB21: =RC[-48]/10 -> 8.8199999999999985 | BC21: =RC[-48]/10 -> 8.8199999999999985 | BD21: =RC[-8]/10 -> 4.8 | BE21: =RC[-8]/10 -> 0.65999999999999992 | BF21: =RC[-8]/10 -> 3.8 | BG21: 4800 | BH21: 380 | BI21: 2280 | BJ21: =RC[-6]*30 -> 144 | BK21: =RC[-6]*30 -> 19.799999999999997 | BL21: =RC[-6]*30 -> 114 | BM21: =(R[1]C*60-20)/60 -> 6.3333333333333348 | BN21: =(R[1]C*60-100)/60 -> 40 | BO21: =RC[-2]/5 -> 1.2666666666666671 | BP21: =RC[-2]/5 -> 8 | BQ21: =RC[-4]*30 -> 190.00000000000006 | BR21: =RC[-4]*30 -> 1200 | BS21: =RC[-4]*30 -> 38.000000000000014 | BT21: =RC[-4]*30 -> 240
A22: 20 | B22: A4 | C22: =R3C*(1+(RC[-2]-1)*0.1) -> 8.7000000000000011 | D22: =RC[-1]*0.3 -> 2.6100000000000003 | E22: =(RC[-2]-RC[-1])*15 -> 91.350000000000009 | F22: =RC[-1] -> 91.350000000000009 | G22: =RC[-1] -> 91.350000000000009 | H22: =RC[-5]*1.2 -> 10.440000000000001 | I22: =RC[-5]*1.2 -> 3.1320000000000001 | J22: =RC[-5]*1.2 -> 109.62 | K22: =RC[-5]*1.2 -> 109.62 | L22: =RC[-5]*1.2 -> 109.62 | M22: =RC[-10] -> 8.7000000000000011 | N22: =RC[-10] -> 2.6100000000000003 | O22: =RC[-10] -> 91.350000000000009 | P22: =RC[-10] -> 91.350000000000009 | Q22: =RC[-10] -> 91.350000000000009 | R22: =RC[-15] -> 8.7000000000000011 | S22: =RC[-15] -> 2.6100000000000003 | T22: =RC[-15] -> 91.350000000000009 | U22: =RC[-15] -> 91.350000000000009 | V22: =RC[-15] -> 91.350000000000009 | W22: =RC[-20] -> 8.7000000000000011 | X22: =RC[-20] -> 2.6100000000000003 | Y22: =RC[-20] -> 91.350000000000009 | Z22: =RC[-20] -> 91.350000000000009 | AA22: =RC[-20] -> 91.350000000000009 | AB22: =RC[-25] -> 8.7000000000000011 | AC22: =RC[-25] -> 2.6100000000000003 | AD22: =RC[-25] -> 91.350000000000009 | AE22: =RC[-25] -> 91.350000000000009 | AF22: =RC[-25] -> 91.350000000000009 | AG22: =RC[-5]*1.2 -> 10.440000000000001 | AH22: =RC[-5]*1.2 -> 3.1320000000000001 | AI22: =RC[-5]*1.2 -> 109.62 | AJ22: =RC[-5]*1.2 -> 109.62 | AK22: =RC[-5]*1.2 -> 109.62 | AL22: =RC[-10]*1.5 -> 13.05 | AM22: =RC[-10]*1.5 -> 3.9150000000000005 | AN22: =RC[-10]*1.5 -> 137.02500000000001 | AO22: =RC[-10]*1.5 -> 137.02500000000001 | AP22: =RC[-10]*1.5 -> 137.02500000000001 | AQ22: =RC[-15]*2 -> 17.400000000000002 | AR22: =RC[-15]*2 -> 5.2200000000000006 | AS22: =RC[-15]*2 -> 182.70000000000002 | AT22: =RC[-15]*2 -> 182.70000000000002 | AU22: =RC[-15]*2 -> 182.70000000000002 | AV22: 50 | AW22: 7 | AX22: 40 | AY22: =RC[-48]/10 -> 0.87000000000000011 | AZ22: =RC[-48]/10 -> 0.26100000000000001 | BA22: =RC[-48]/10 -> 9.1350000000000016 | BB22: =RC[-48]/10 -> 9.1350000000000016 | BC22: =RC[-48]/10 -> 9.1350000000000016 | BD22: =RC[-8]/10 -> 5 | BE22: =RC[-8]/10 -> 0.7 | BF22: =RC[-8]/10 -> 4 | BG22: 5000 | BH22: 400 | BI22: 2400 | BJ22: =RC[-6]*30 -> 150 | BK22: =RC[-6]*30 -> 21 | BL22: =RC[-6]*30 -> 120 | BM22: =(R[1]C*60-20)/60 -> 6.6666666666666687 | BN22: =(R[1]C*60-100)/60 -> 41.666666666666664 | BO22: =RC[-2]/5 -> 1.3333333333333337 | BP22: =RC[-2]/5 -> 8.3333333333333321 | BQ22: =RC[-4]*30 -> 200.00000000000006 | BR22: =RC[-4]*30 -> 1250 | BS22: =RC[-4]*30 -> 40.000000000000014 | BT22: =RC[-4]*30 -> 249.99999999999997
A23: 21 | B23: S0 | C23: =R3C*(1+(RC[-2]-1)*0.1) -> 9 | D23: =RC[-1]*0.3 -> 2.6999999999999997 | E23: =(RC[-2]-RC[-1])*15 -> 94.500000000000014 | F23: =RC[-1] -> 94.500000000000014 | G23: =RC[-1] -> 94.500000000000014 | H23: =RC[-5]*1.2 -> 10.799999999999999 | I23: =RC[-5]*1.2 -> 3.2399999999999998 | J23: =RC[-5]*1.2 -> 113.40000000000002 | K23: =RC[-5]*1.2 -> 113.40000000000002 | L23: =RC[-5]*1.2 -> 113.40000000000002 | M23: =RC[-10] -> 9 | N23: =RC[-10] -> 2.6999999999999997 | O23: =RC[-10] -> 94.500000000000014 | P23: =RC[-10] -> 94.500000000000014 | Q23: =RC[-10] -> 94.500000000000014 | R23: =RC[-15] -> 9 | S23: =RC[-15] -> 2.6999999999999997 | T23: =RC[-15] -> 94.500000000000014 | U23: =RC[-15] -> 94.500000000000014 | V23: =RC[-15] -> 94.500000000000014 | W23: =RC[-20] -> 9 | X23: =RC[-20] -> 2.6999999999999997 | Y23: =RC[-20] -> 94.500000000000014 | Z23: =RC[-20] -> 94.500000000000014 | AA23: =RC[-20] -> 94.500000000000014 | AB23: =RC[-25] -> 9 | AC23: =RC[-25] -> 2.6999999999999997 | AD23: =RC[-25] -> 94.500000000000014 | AE23: =RC[-25] -> 94.500000000000014 | AF23: =RC[-25] -> 94.500000000000014 | AG23: =RC[-5]*1.2 -> 10.799999999999999 | AH23: =RC[-5]*1.2 -> 3.2399999999999998 | AI23: =RC[-5]*1.2 -> 113.40000000000002 | AJ23: =RC[-5]*1.2 -> 113.40000000000002 | AK23: =RC[-5]*1.2 -> 113.40000000000002 | AL23: =RC[-10]*1.5 -> 13.5 | AM23: =RC[-10]*1.5 -> 4.05 | AN23: =RC[-10]*1.5 -> 141.75000000000003 | AO23: =RC[-10]*1.5 -> 141.75000000000003 | AP23: =RC[-10]*1.5 -> 141.75000000000003 | AQ23: =RC[-15]*2 -> 18 | AR23: =RC[-15]*2 -> 5.3999999999999995 | AS23: =RC[-15]*2 -> 189.00000000000003 | AT23: =RC[-15]*2 -> 189.00000000000003 | AU23: =RC[-15]*2 -> 189.00000000000003 | AV23: 60 | AW23: 7.4 | AX23: 42 | AY23: =RC[-48]/10 -> 0.9 | AZ23: =RC[-48]/10 -> 0.26999999999999996 | BA23: =RC[-48]/10 -> 9.4500000000000011 | BB23: =RC[-48]/10 -> 9.4500000000000011 | BC23: =RC[-48]/10 -> 9.4500000000000011 | BD23: =RC[-8]/10 -> 6 | BE23: =RC[-8]/10 -> 0.74 | BF23: =RC[-8]/10 -> 4.2 | BG23: 5200 | BH23: 420 | BI23: 2520 | BJ23: =RC[-6]*30 -> 180 | BK23: =RC[-6]*30 -> 22.2 | BL23: =RC[-6]*30 -> 126 | BM23: =(R[1]C*60-20)/60 -> 7.0000000000000018 | BN23: =(R[1]C*60-100)/60 -> 43.333333333333336 | BO23: =RC[-2]/5 -> 1.4000000000000004 | BP23: =RC[-2]/5 -> 8.6666666666666679 | BQ23: =RC[-4]*30 -> 210.00000000000006 | BR23: =RC[-4]*30 -> 1300 | BS23: =RC[-4]*30 -> 42.000000000000014 | BT23: =RC[-4]*30 -> 260.00000000000006
A24: 22 | B24: S1 | C24: =R3C*(1+(RC[-2]-1)*0.1) -> 9.3000000000000007 | D24: =RC[-1]*0.3 -> 2.79 | E24: =(RC[-2]-RC[-1])*15 -> 97.65 | F24: =RC[-1] -> 97.65 | G24: =RC[-1] -> 97.65 | H24: =RC[-5]*1.2 -> 11.16 | I24: =RC[-5]*1.2 -> 3.3479999999999999 | J24: =RC[-5]*1.2 -> 117.18 | K24: =RC[-5]*1.2 -> 117.18 | L24: =RC[-5]*1.2 -> 117.18 | M24: =RC[-10] -> 9.3000000000000007 | N24: =RC[-10] -> 2.79 | O24: =RC[-10] -> 97.65 | P24: =RC[-10] -> 97.65 | Q24: =RC[-10] -> 97.65 | R24: =RC[-15] -> 9.3000000000000007 | S24: =RC[-15] -> 2.79 | T24: =RC[-15] -> 97.65 | U24: =RC[-15] -> 97.65 | V24: =RC[-15] -> 97.65 | W24: =RC[-20] -> 9.3000000000000007 | X24: =RC[-20] -> 2.79 | Y24: =RC[-20] -> 97.65 | Z24: =RC[-20] -> 97.65 | AA24: =RC[-20] -> 97.65 | AB24: =RC[-25] -> 9.3000000000000007 | AC24: =RC[-25] -> 2.79 | AD24: =RC[-25] -> 97.65 | AE24: =RC[-25] -> 97.65 | AF24: =RC[-25] -> 97.65 | AG24: =RC[-5]*1.2 -> 11.16 | AH24: =RC[-5]*1.2 -> 3.3479999999999999 | AI24: =RC[-5]*1.2 -> 117.18 | AJ24: =RC[-5]*1.2 -> 117.18 | AK24: =RC[-5]*1.2 -> 117.18 | AL24: =RC[-10]*1.5 -> 13.950000000000001 | AM24: =RC[-10]*1.5 -> 4.1850000000000005 | AN24: =RC[-10]*1.5 -> 146.47500000000002 | AO24: =RC[-10]*1.5 -> 146.47500000000002 | AP24: =RC[-10]*1.5 -> 146.47500000000002 | AQ24: =RC[-15]*2 -> 18.600000000000001 | AR24: =RC[-15]*2 -> 5.58 | AS24: =RC[-15]*2 -> 195.3 | AT24: =RC[-15]*2 -> 195.3 | AU24: =RC[-15]*2 -> 195.3 | AV24: 70 | AW24: 7.8 | AX24: 44 | AY24: =RC[-48]/10 -> 0.93 | AZ24: =RC[-48]/10 -> 0.27900000000000003 | BA24: =RC[-48]/10 -> 9.7650000000000006 | BB24: =RC[-48]/10 -> 9.7650000000000006 | BC24: =RC[-48]/10 -> 9.7650000000000006 | BD24: =RC[-8]/10 -> 7 | BE24: =RC[-8]/10 -> 0.78 | BF24: =RC[-8]/10 -> 4.4000000000000004 | BG24: 5400 | BH24: 440 | BI24: 2640 | BJ24: =RC[-6]*30 -> 210 | BK24: =RC[-6]*30 -> 23.400000000000002 | BL24: =RC[-6]*30 -> 132 | BM24: =(R[1]C*60-20)/60 -> 7.3333333333333348 | BN24: =(R[1]C*60-100)/60 -> 45 | BO24: =RC[-2]/5 -> 1.466666666666667 | BP24: =RC[-2]/5 -> 9 | BQ24: =RC[-4]*30 -> 220.00000000000006 | BR24: =RC[-4]*30 -> 1350 | BS24: =RC[-4]*30 -> 44.000000000000007 | BT24: =RC[-4]*30 -> 270
A25: 23 | B25: S2 | C25: =R3C*(1+(RC[-2]-1)*0.1) -> 9.6000000000000014 | D25: =RC[-1]*0.3 -> 2.8800000000000003 | E25: =(RC[-2]-RC[-1])*15 -> 100.80000000000001 | F25: =RC[-1] -> 100.80000000000001 | G25: =RC[-1] -> 100.80000000000001 | H25: =RC[-5]*1.2 -> 11.520000000000001 | I25: =RC[-5]*1.2 -> 3.4560000000000004 | J25: =RC[-5]*1.2 -> 120.96000000000001 | K25: =RC[-5]*1.2 -> 120.96000000000001 | L25: =RC[-5]*1.2 -> 120.96000000000001 | M25: =RC[-10] -> 9.6000000000000014 | N25: =RC[-10] -> 2.8800000000000003 | O25: =RC[-10] -> 100.80000000000001 | P25: =RC[-10] -> 100.80000000000001 | Q25: =RC[-10] -> 100.80000000000001 | R25: =RC[-15] -> 9.6000000000000014 | S25: =RC[-15] -> 2.8800000000000003 | T25: =RC[-15] -> 100.80000000000001 | U25: =RC[-15] -> 100.80000000000001 | V25: =RC[-15] -> 100.80000000000001 | W25: =RC[-20] -> 9.6000000000000014 | X25: =RC[-20] -> 2.8800000000000003 | Y25: =RC[-20] -> 100.80000000000001 | Z25: =RC[-20] -> 100.80000000000001 | AA25: =RC[-20] -> 100.80000000000001 | AB25: =RC[-25] -> 9.6000000000000014 | AC25: =RC[-25] -> 2.8800000000000003 | AD25: =RC[-25] -> 100.80000000000001 | AE25: =RC[-25] -> 100.80000000000001 | AF25: =RC[-25] -> 100.80000000000001 | AG25: =RC[-5]*1.2 -> 11.520000000000001 | AH25: =RC[-5]*1.2 -> 3.4560000000000004 | AI25: =RC[-5]*1.2 -> 120.96000000000001 | AJ25: =RC[-5]*1.2 -> 120.96000000000001 | AK25: =RC[-5]*1.2 -> 120.96000000000001 | AL25: =RC[-10]*1.5 -> 14.400000000000002 | AM25: =RC[-10]*1.5 -> 4.32 | AN25: =RC[-10]*1.5 -> 151.20000000000002 | AO25: =RC[-10]*1.5 -> 151.20000000000002 | AP25: =RC[-10]*1.5 -> 151.20000000000002 | AQ25: =RC[-15]*2 -> 19.200000000000003 | AR25: =RC[-15]*2 -> 5.7600000000000007 | AS25: =RC[-15]*2 -> 201.60000000000002 | AT25: =RC[-15]*2 -> 201.60000000000002 | AU25: =RC[-15]*2 -> 201.60000000000002 | AV25: 80 | AW25: 8.1999999999999993 | AX25: 46 | AY25: =RC[-48]/10 -> 0.96000000000000019 | AZ25: =RC[-48]/10 -> 0.28800000000000003 | BA25: =RC[-48]/10 -> 10.080000000000002 | BB25: =RC[-48]/10 -> 10.080000000000002 | BC25: =RC[-48]/10 -> 10.080000000000002 | BD25: =RC[-8]/10 -> 8 | BE25: =RC[-8]/10 -> 0.82 | BF25: =RC[-8]/10 -> 4.5999999999999996 | BG25: 5600 | BH25: 460 | BI25: 2760 | BJ25: =RC[-6]*30 -> 240 | BK25: =RC[-6]*30 -> 24.599999999999998 | BL25: =RC[-6]*30 -> 138 | BM25: =(R[1]C*60-20)/60 -> 7.6666666666666687 | BN25: =(R[1]C*60-100)/60 -> 46.666666666666664 | BO25: =RC[-2]/5 -> 1.5333333333333337 | BP25: =RC[-2]/5 -> 9.3333333333333321 | BQ25: =RC[-4]*30 -> 230.00000000000006 | BR25: =RC[-4]*30 -> 1400 | BS25: =RC[-4]*30 -> 46.000000000000007 | BT25: =RC[-4]*30 -> 279.99999999999994
A26: 24 | B26: S3 | C26: =R3C*(1+(RC[-2]-1)*0.1) -> 9.9 | D26: =RC[-1]*0.3 -> 2.97 | E26: =(RC[-2]-RC[-1])*15 -> 103.94999999999999 | F26: =RC[-1] -> 103.94999999999999 | G26: =RC[-1] -> 103.94999999999999 | H26: =RC[-5]*1.2 -> 11.88 | I26: =RC[-5]*1.2 -> 3.5640000000000001 | J26: =RC[-5]*1.2 -> 124.73999999999998 | K26: =RC[-5]*1.2 -> 124.73999999999998 | L26: =RC[-5]*1.2 -> 124.73999999999998 | M26: =RC[-10] -> 9.9 | N26: =RC[-10] -> 2.97 | O26: =RC[-10] -> 103.94999999999999 | P26: =RC[-10] -> 103.94999999999999 | Q26: =RC[-10] -> 103.94999999999999 | R26: =RC[-15] -> 9.9 | S26: =RC[-15] -> 2.97 | T26: =RC[-15] -> 103.94999999999999 | U26: =RC[-15] -> 103.94999999999999 | V26: =RC[-15] -> 103.94999999999999 | W26: =RC[-20] -> 9.9 | X26: =RC[-20] -> 2.97 | Y26: =RC[-20] -> 103.94999999999999 | Z26: =RC[-20] -> 103.94999999999999 | AA26: =RC[-20] -> 103.94999999999999 | AB26: =RC[-25] -> 9.9 | AC26: =RC[-25] -> 2.97 | AD26: =RC[-25] -> 103.94999999999999 | AE26: =RC[-25] -> 103.94999999999999 | AF26: =RC[-25] -> 103.94999999999999 | AG26: =RC[-5]*1.2 -> 11.88 | AH26: =RC[-5]*1.2 -> 3.5640000000000001 | AI26: =RC[-5]*1.2 -> 124.73999999999998 | AJ26: =RC[-5]*1.2 -> 124.73999999999998 | AK26: =RC[-5]*1.2 -> 124.73999999999998 | AL26: =RC[-10]*1.5 -> 14.850000000000001 | AM26: =RC[-10]*1.5 -> 4.4550000000000001 | AN26: =RC[-10]*1.5 -> 155.92499999999998 | AO26: =RC[-10]*1.5 -> 155.92499999999998 | AP26: =RC[-10]*1.5 -> 155.92499999999998 | AQ26: =RC[-15]*2 -> 19.8 | AR26: =RC[-15]*2 -> 5.94 | AS26: =RC[-15]*2 -> 207.89999999999998 | AT26: =RC[-15]*2 -> 207.89999999999998 | AU26: =RC[-15]*2 -> 207.89999999999998 | AV26: 90 | AW26: 8.6 | AX26: 48 | AY26: =RC[-48]/10 -> 0.99 | AZ26: =RC[-48]/10 -> 0.29700000000000004 | BA26: =RC[-48]/10 -> 10.395 | BB26: =RC[-48]/10 -> 10.395 | BC26: =RC[-48]/10 -> 10.395 | BD26: =RC[-8]/10 -> 9 | BE26: =RC[-8]/10 -> 0.86 | BF26: =RC[-8]/10 -> 4.8 | BG26: 5800 | BH26: 480 | BI26: 2880 | BJ26: =RC[-6]*30 -> 270 | BK26: =RC[-6]*30 -> 25.8 | BL26: =RC[-6]*30 -> 144 | BM26: =(R[1]C*60-20)/60 -> 8.0000000000000018 | BN26: =(R[1]C*60-100)/60 -> 48.333333333333336 | BO26: =RC[-2]/5 -> 1.6000000000000003 | BP26: =RC[-2]/5 -> 9.6666666666666679 | BQ26: =RC[-4]*30 -> 240.00000000000006 | BR26: =RC[-4]*30 -> 1450 | BS26: =RC[-4]*30 -> 48.000000000000007 | BT26: =RC[-4]*30 -> 290.00000000000006
A27: 25 | B27: S4 | C27: =R3C*(1+(RC[-2]-1)*0.1) -> 10.200000000000001 | D27: =RC[-1]*0.3 -> 3.06 | E27: =(RC[-2]-RC[-1])*15 -> 107.10000000000001 | F27: =RC[-1] -> 107.10000000000001 | G27: =RC[-1] -> 107.10000000000001 | H27: =RC[-5]*1.2 -> 12.24 | I27: =RC[-5]*1.2 -> 3.6719999999999997 | J27: =RC[-5]*1.2 -> 128.52000000000001 | K27: =RC[-5]*1.2 -> 128.52000000000001 | L27: =RC[-5]*1.2 -> 128.52000000000001 | M27: =RC[-10] -> 10.200000000000001 | N27: =RC[-10] -> 3.06 | O27: =RC[-10] -> 107.10000000000001 | P27: =RC[-10] -> 107.10000000000001 | Q27: =RC[-10] -> 107.10000000000001 | R27: =RC[-15] -> 10.200000000000001 | S27: =RC[-15] -> 3.06 | T27: =RC[-15] -> 107.10000000000001 | U27: =RC[-15] -> 107.10000000000001 | V27: =RC[-15] -> 107.10000000000001 | W27: =RC[-20] -> 10.200000000000001 | X27: =RC[-20] -> 3.06 | Y27: =RC[-20] -> 107.10000000000001 | Z27: =RC[-20] -> 107.10000000000001 | AA27: =RC[-20] -> 107.10000000000001 | AB27: =RC[-25] -> 10.200000000000001 | AC27: =RC[-25] -> 3.06 | AD27: =RC[-25] -> 107.10000000000001 | AE27: =RC[-25] -> 107.10000000000001 | AF27: =RC[-25] -> 107.10000000000001 | AG27: =RC[-5]*1.2 -> 12.24 | AH27: =RC[-5]*1.2 -> 3.6719999999999997 | AI27: =RC[-5]*1.2 -> 128.52000000000001 | AJ27: =RC[-5]*1.2 -> 128.52000000000001 | AK27: =RC[-5]*1.2 -> 128.52000000000001 | AL27: =RC[-10]*1.5 -> 15.3 | AM27: =RC[-10]*1.5 -> 4.59 | AN27: =RC[-10]*1.5 -> 160.65 | AO27: =RC[-10]*1.5 -> 160.65 | AP27: =RC[-10]*1.5 -> 160.65 | AQ27: =RC[-15]*2 -> 20.400000000000002 | AR27: =RC[-15]*2 -> 6.12 | AS27: =RC[-15]*2 -> 214.20000000000002 | AT27: =RC[-15]*2 -> 214.20000000000002 | AU27: =RC[-15]*2 -> 214.20000000000002 | AV27: 100 | AW27: 9 | AX27: 50 | AY27: =RC[-48]/10 -> 1.02 | AZ27: =RC[-48]/10 -> 0.30599999999999999 | BA27: =RC[-48]/10 -> 10.71 | BB27: =RC[-48]/10 -> 10.71 | BC27: =RC[-48]/10 -> 10.71 | BD27: =RC[-8]/10 -> 10 | BE27: =RC[-8]/10 -> 0.9 | BF27: =RC[-8]/10 -> 5 | BG27: 6000 | BH27: 500 | BI27: 3000 | BJ27: =RC[-6]*30 -> 300 | BK27: =RC[-6]*30 -> 27 | BL27: =RC[-6]*30 -> 150 | BM27: =500/60 -> 8.3333333333333339 | BN27: =3000/60 -> 50 | BO27: =RC[-2]/5 -> 1.6666666666666667 | BP27: =RC[-2]/5 -> 10 | BQ27: =RC[-4]*30 -> 250.00000000000003 | BR27: =RC[-4]*30 -> 1500 | BS27: =RC[-4]*30 -> 50 | BT27: =RC[-4]*30 -> 300

Sheet: 技能触发条件
A1: id | B1: 触发条件名 | C1: 触发说明
A2: id | B2: name | C2: desc
A3: 0 | B3: auto_action | C3: 自动触发
A4: 1 | B4: starting_turn | C4: 回合起始触发
A5: 2 | B5: ending_turn | C5: 回合结束触发
A6: 3 | B6: first_action | C6: 首招触发
A7: 4 | B7: on_lose | C7: 战败触发
A8: 5 | B8: on_win | C8: 战胜触发
A9: 6 | B9: on_hit | C9: 命中触发
A10: 7 | B10: on_defence | C10: 防御触发
A11: 8 | B11: on_miss | C11: 未命中触发
A12: 9 | B12: on_dodge | C12: 闪避触发
A13: 10 | B13: on_block | C13: 格挡触发
A14: 11 | B14: on_combo | C14: 连招触发
A15: 12 | B15: on_counterattack | C15: 反击触发
A16: 13 | B16: on_gain_self | C16: 自身增益触发
A17: 14 | B17: on_gain_opp | C17: 对手增益触发
A18: 15 | B18: on_curse_self | C18: 自身诅咒触发
A19: 16 | B19: on_curse_opp | C19: 对手诅咒触发
A20: 17 | B20: hp_not_enough | C20: 命悬一刻
A21: 18 | B21: mp_not_enough | C21: 内力不济
A22: 19 | B22: sp_not_enough | C22: 体力不支
A23: 20 | B23: on_first_strike | C23: 先攻触发
A24: 21 | B24: on_counterval_strike | C24: 对攻触发
A25: 22 | B25: starting_skill | C25: 出招前触发
A26: 23 | B26: ending_skill | C26: 出招后触发
A27: 24
A28: 25
A29: 26
A30: 27

Sheet: 普通攻击效果表
A1: id | B1: 武器类别 | C1: 发招动作 | D1: 发招音效 | E1: 命中动作 | F1: 命中特效 | G1: 命中音效 | H1: 延迟时间
A2: id | B2: weapon_type | C2: start_action | D2: start_sound | E2: hit_action | F2: hit_eff | G2: hit_sound | H2: delay
A3: 1 | B3: 空手 | C3: action | D3: action | E3: on_hit | F3: quan | G3: on_hit | H3: 1200
A4: 2 | B4: 剑 | C4: action | D4: action | E4: on_hit | F4: sword | G4: on_hit | H4: 1200
A5: 3 | B5: 刀 | C5: action | D5: action | E5: on_hit | F5: blade | G5: on_hit | H5: 1200
A6: 4 | B6: 护腕 | C6: action | D6: action | E6: on_hit | F6: cuff | G6: on_hit | H6: 1200
A7: 5 | B7: 棍 | C7: action | D7: action | E7: on_hit | F7: stick | G7: on_hit | H7: 1200
A8: 6 | B8: 棒 | C8: action | D8: action | E8: on_hit | F8: club | G8: on_hit | H8: 1200
A9: 7 | B9: 杖 | C9: action | D9: action | E9: on_hit | F9: staff | G9: on_hit | H9: 1200
A10: 8 | B10: 鞭 | C10: action | D10: action | E10: on_hit | F10: whip | G10: on_hit | H10: 1200
A11: 9 | B11: 枪 | C11: action | D11: action | E11: on_hit | F11: pike | G11: on_hit | H11: 1200

Sheet: 战斗参数表
A1: id | B1: 内容 | C1: 注释
A2: id | B2: value | C2: comment
A3: hero_sp_costptrun_v | B3: 5 | C3: 战斗中每回合体力消耗基数及成长值，需要乘以侠客等级换算成最终值
A4: attack_range_v | B4: 100 | C4: 攻击力浮动百分比参数

Sheet: export
A1: sheet_name | B1: export_name
A2: 技能配置表 | B2: skill_settings
A3: 功夫名 | B3: kongfu_name
A4: 目标常量表 | B4: target_const
A5: 功夫类型表 | B5: kongfu_type
A6: 技能类型表 | B6: skill_type
A7: 状态配置表 | B7: state_settings
A8: 战斗数值 | B8: value_table
A9: 技能触发条件 | B9: skill_trigger
A10: 魔法属性表 | B10: magic_table
A11: 魔法属性效果表 | B11: magic_eff_table
A12: 普通攻击效果表 | B12: default_attack
A13: 战斗参数表 | B13: battle_value_list