Sheet: 任务表说明
A1: 表功能说明：
A2: 基本任务表 | B2: 展示所有已经实现的任务类型
A3: 通关任务配置表 | B3: 主线任务(侠义令)的内容及奖励配置
A4: 每日任务配置表 | B4: 失效
A5: 每日任务类型表 | B5: 支线任务(五行令)的内容及奖励配置
A6: 活跃度任务表 | B6: 活跃度任务内容配置

Sheet: 基本任务表
A1: no | B1: id | C1: quest_category | D1: param | E1: desc | F1: comment
A2: no | B2: id | C2: quest_category | D2: param | E2: desc | F2: comment
A3: 1 | B3: pass_chapter | D3: x | E3: 击败x | F3: 击杀怪物组队表中的id为x的怪物，即为通过某一章某一关的条件
A4: 2 | B4: login | E4: 登入游戏
A5: 3 | B5: hehe | D5: x | E5: 击败x | F5: 击败区域i中j章节内id为x的怪物n次
A6: 4 | B6: fight_player | C6: liehuoling | D6: n | E6: 挑战擂台n次
A7: 5 | B7: fight_stranger | C7: hongshuiling | D7: n | E7: 挑战陌生人n次
A8: 6 | B8: capture_stranger | C8: hongshuiling | D8: n | E8: 占领陌生人n次
A9: 7 | B9: tax_stranger | C9: hongshuiling | D9: n | E9: 搜刮奴隶n次
A10: 8 | B10: free_friend | C10: hongshuiling | D10: n | E10: 解救好友n次
A11: 9 | B11: reinforce_amr | C11: houtuling | D11: n | E11: 强化镶嵌装备n次
A12: 10 | B12: refresh_inn | D12: n | E12: 刷新客栈n次
A13: 11 | B13: fight_friend | D13: n | E13: 好友切磋n次
A14: 12 | B14: visit_friend | D14: n | E14: 开启n次好友宝箱
A15: 13 | B15: gain_mine | D15: n | E15: 收获矿石n次
A16: 14 | B16: gain_chip | D16: n | E16: 收获碎片n次
A17: 15 | B17: challenge_tower | C17: ruijinling | D17: n | E17: 华山论剑n次
A18: 16 | B18: pay_coin | C18: jumuling | D18: n | E18: 消费元宝n次
A19: 17 | B19: improve_amr | D19: n | E19: 强化装备n次
A20: 18 | B20: inlay_amr | D20: n | E20: 镶嵌装备n次

Sheet: 通关任务配置表
A1: id | B1: 基本任务id | C1: 基本任务参数 | D1: 接受时机 | E1: 接受等级 | F1: 后置任务id | G1: 任务类型 | H1: 精力消耗 | I1: 奖励类型 | J1: 奖励参数
A2: id | B2: base_quest_id | C2: base_quest_params | D2: accept_time | E2: quest_level | F2: after_quest_id | G2: type | H2: sp_cost | I2: reward_type | J2: reward_args
A3: 1 | B3: pass_chapter | C3: 1 | E3: 1 | F3: 2 | H3: 0 | I3: player_exp | J3: 20
A4: 2 | B4: pass_chapter | C4: 2 | E4: 1 | F4: 3 | H4: =R[-1]C -> 0 | I4: player_exp | J4: 20
A5: 3 | B5: pass_chapter | C5: 3 | E5: 1 | F5: 4 | H5: =R[-1]C -> 0 | I5: player_exp | J5: 24
A6: 4 | B6: pass_chapter | C6: 4 | E6: 1 | F6: 5 | H6: =R[-1]C -> 0 | I6: player_exp | J6: 24
A7: 5 | B7: pass_chapter | C7: 5 | E7: 1 | F7: 6 | H7: =R[-1]C -> 0 | I7: player_exp | J7: 28
A8: 6 | B8: pass_chapter | C8: 6 | E8: 1 | F8: 7 | H8: =R[-1]C -> 0 | I8: player_exp | J8: 28
A9: 7 | B9: pass_chapter | C9: 7 | E9: 1 | F9: 8 | H9: =R[-1]C -> 0 | I9: player_exp | J9: 28
A10: 8 | B10: pass_chapter | C10: 8 | E10: 1 | F10: 9 | H10: =R[-1]C -> 0 | I10: player_exp | J10: 32
A11: 9 | B11: pass_chapter | C11: 9 | E11: 1 | F11: 10 | H11: =R[-1]C -> 0 | I11: player_exp | J11: 32
A12: 10 | B12: pass_chapter | C12: 10 | E12: 1 | F12: 11 | H12: =R[-1]C -> 0 | I12: player_exp | J12: 32
A13: 11 | B13: pass_chapter | C13: 11 | E13: 1 | F13: 12 | H13: =R[-1]C -> 0 | I13: player_exp | J13: 36
A14: 12 | B14: pass_chapter | C14: 12 | E14: 1 | F14: 13 | H14: =R[-1]C -> 0 | I14: player_exp | J14: 36
A15: 13 | B15: pass_chapter | C15: 13 | E15: 1 | F15: 14 | H15: =R[-1]C -> 0 | I15: player_exp | J15: 36
A16: 14 | B16: pass_chapter | C16: 14 | E16: 1 | F16: 15 | H16: =R[-1]C -> 0 | I16: player_exp | J16: 40
A17: 15 | B17: pass_chapter | C17: 15 | E17: 1 | F17: 16 | H17: =R[-1]C -> 0 | I17: player_exp | J17: 40
A18: 16 | B18: pass_chapter | C18: 16 | E18: 1 | F18: 17 | H18: =R[-1]C -> 0 | I18: player_exp | J18: 40
A19: 17 | B19: pass_chapter | C19: 17 | E19: 1 | F19: 18 | H19: =R[-1]C -> 0 | I19: player_exp | J19: 40
A20: 18 | B20: pass_chapter | C20: 18 | E20: 1 | F20: 19 | H20: =R[-1]C -> 0 | I20: player_exp | J20: 44
A21: 19 | B21: pass_chapter | C21: 19 | E21: 1 | F21: 20 | H21: =R[-1]C -> 0 | I21: player_exp | J21: 44
A22: 20 | B22: pass_chapter | C22: 20 | E22: 1 | F22: 21 | H22: =R[-1]C -> 0 | I22: player_exp | J22: 44
A23: 21 | B23: pass_chapter | C23: 21 | E23: 1 | F23: 22 | H23: =R[-1]C -> 0 | I23: player_exp | J23: 44
A24: 22 | B24: pass_chapter | C24: 22 | E24: 1 | F24: 23 | H24: =R[-1]C -> 0 | I24: player_exp | J24: 48
A25: 23 | B25: pass_chapter | C25: 23 | E25: 1 | F25: 24 | H25: =R[-1]C -> 0 | I25: player_exp | J25: 48
A26: 24 | B26: pass_chapter | C26: 24 | E26: 1 | F26: 25 | H26: =R[-1]C -> 0 | I26: player_exp | J26: 48
A27: 25 | B27: pass_chapter | C27: 25 | E27: 1 | F27: 26 | H27: =R[-1]C -> 0 | I27: player_exp | J27: 48
A28: 26 | B28: pass_chapter | C28: 26 | E28: 1 | F28: 27 | H28: =R[-1]C -> 0 | I28: player_exp | J28: 52
A29: 27 | B29: pass_chapter | C29: 27 | E29: 1 | F29: 28 | H29: =R[-1]C -> 0 | I29: player_exp | J29: 52
A30: 28 | B30: pass_chapter | C30: 28 | E30: 1 | F30: 29 | H30: =R[-1]C -> 0 | I30: player_exp | J30: 52
A31: 29 | B31: pass_chapter | C31: 29 | E31: 1 | F31: 30 | H31: =R[-1]C -> 0 | I31: player_exp | J31: 52
A32: 30 | B32: pass_chapter | C32: 30 | E32: 1 | F32: 31 | H32: =R[-1]C -> 0 | I32: player_exp | J32: 52
A33: 31 | B33: pass_chapter | C33: 31 | E33: 1 | F33: 32 | H33: =R[-1]C -> 0 | I33: player_exp | J33: 56
A34: 32 | B34: pass_chapter | C34: 32 | E34: 1 | F34: 33 | H34: =R[-1]C -> 0 | I34: player_exp | J34: 56
A35: 33 | B35: pass_chapter | C35: 33 | E35: 1 | F35: 34 | H35: =R[-1]C -> 0 | I35: player_exp | J35: 56
A36: 34 | B36: pass_chapter | C36: 34 | E36: 1 | F36: 35 | H36: =R[-1]C -> 0 | I36: player_exp | J36: 56
A37: 35 | B37: pass_chapter | C37: 35 | E37: 1 | F37: 36 | H37: =R[-1]C -> 0 | I37: player_exp | J37: 56
A38: 36 | B38: pass_chapter | C38: 36 | E38: 1 | F38: 37 | H38: =R[-1]C -> 0 | I38: player_exp | J38: 60
A39: 37 | B39: pass_chapter | C39: 37 | E39: 1 | F39: 38 | H39: =R[-1]C -> 0 | I39: player_exp | J39: 60
A40: 38 | B40: pass_chapter | C40: 38 | E40: 1 | F40: 39 | H40: =R[-1]C -> 0 | I40: player_exp | J40: 60
A41: 39 | B41: pass_chapter | C41: 39 | E41: 1 | F41: 40 | H41: =R[-1]C -> 0 | I41: player_exp | J41: 60
A42: 40 | B42: pass_chapter | C42: 40 | E42: 1 | F42: 41 | H42: =R[-1]C -> 0 | I42: player_exp | J42: 60
A43: 41 | B43: pass_chapter | C43: 41 | E43: 1 | F43: 42 | H43: =R[-1]C -> 0 | I43: player_exp | J43: 64
A44: 42 | B44: pass_chapter | C44: 42 | E44: 1 | F44: 43 | H44: =R[-1]C -> 0 | I44: player_exp | J44: 64
A45: 43 | B45: pass_chapter | C45: 43 | E45: 1 | F45: 44 | H45: =R[-1]C -> 0 | I45: player_exp | J45: 64
A46: 44 | B46: pass_chapter | C46: 44 | E46: 1 | F46: 45 | H46: =R[-1]C -> 0 | I46: player_exp | J46: 64
A47: 45 | B47: pass_chapter | C47: 45 | E47: 1 | F47: 46 | H47: =R[-1]C -> 0 | I47: player_exp | J47: 68
A48: 46 | B48: pass_chapter | C48: 46 | E48: 1 | F48: 47 | H48: =R[-1]C -> 0 | I48: player_exp | J48: 68
A49: 47 | B49: pass_chapter | C49: 47 | E49: 1 | F49: 48 | H49: =R[-1]C -> 0 | I49: player_exp | J49: 68
A50: 48 | B50: pass_chapter | C50: 48 | E50: 1 | F50: 49 | H50: =R[-1]C -> 0 | I50: player_exp | J50: 72
A51: 49 | B51: pass_chapter | C51: 49 | E51: 1 | F51: 50 | H51: =R[-1]C -> 0 | I51: player_exp | J51: 72
A52: 50 | B52: pass_chapter | C52: 50 | E52: 1 | F52: 51 | H52: =R[-1]C -> 0 | I52: player_exp | J52: 72
A53: 51 | B53: pass_chapter | C53: 51 | E53: 1 | F53: 52 | H53: =R[-1]C -> 0 | I53: player_exp | J53: 76
A54: 52 | B54: pass_chapter | C54: 52 | E54: 1 | F54: 53 | H54: =R[-1]C -> 0 | I54: player_exp | J54: 76
A55: 53 | B55: pass_chapter | C55: 53 | E55: 1 | F55: 54 | H55: =R[-1]C -> 0 | I55: player_exp | J55: 80
A56: 54 | B56: pass_chapter | C56: 54 | E56: 1 | F56: 55 | H56: =R[-1]C -> 0 | I56: player_exp | J56: 80
A57: 55 | B57: pass_chapter | C57: 55 | E57: 1 | F57: 56 | H57: =R[-1]C -> 0 | I57: player_exp | J57: 84
A58: 56 | B58: pass_chapter | C58: 56 | E58: 1 | F58: 57 | H58: =R[-1]C -> 0 | I58: player_exp | J58: 84
A59: 57 | B59: pass_chapter | C59: 57 | E59: 1 | F59: 58 | H59: =R[-1]C -> 0 | I59: player_exp | J59: 88
A60: 58 | B60: pass_chapter | C60: 58 | E60: 1 | F60: 59 | H60: =R[-1]C -> 0 | I60: player_exp | J60: 88
A61: 59 | B61: pass_chapter | C61: 59 | E61: 1 | F61: 60 | H61: =R[-1]C -> 0 | I61: player_exp | J61: 92
A62: 60 | B62: pass_chapter | C62: 60 | E62: 1 | F62: 61 | H62: =R[-1]C -> 0 | I62: player_exp | J62: 92
A63: 61 | B63: pass_chapter | C63: 61 | E63: 1 | F63: 62 | H63: =R[-1]C -> 0 | I63: player_exp | J63: 96
A64: 62 | B64: pass_chapter | C64: 62 | E64: 1 | F64: 63 | H64: =R[-1]C -> 0 | I64: player_exp | J64: 96
A65: 63 | B65: pass_chapter | C65: 63 | E65: 1 | F65: 64 | H65: =R[-1]C -> 0 | I65: player_exp | J65: 100
A66: 64 | B66: pass_chapter | C66: 64 | E66: 1 | F66: 65 | H66: =R[-1]C -> 0 | I66: player_exp | J66: 100
A67: 65 | B67: pass_chapter | C67: 65 | E67: 1 | F67: 66 | H67: =R[-1]C -> 0 | I67: player_exp | J67: 104
A68: 66 | B68: pass_chapter | C68: 66 | E68: 1 | F68: 67 | H68: =R[-1]C -> 0 | I68: player_exp | J68: 104
A69: 67 | B69: pass_chapter | C69: 67 | E69: 1 | F69: 68 | H69: =R[-1]C -> 0 | I69: player_exp | J69: 108
A70: 68 | B70: pass_chapter | C70: 68 | E70: 1 | F70: 69 | H70: =R[-1]C -> 0 | I70: player_exp | J70: 108
A71: 69 | B71: pass_chapter | C71: 69 | E71: 1 | F71: 70 | H71: =R[-1]C -> 0 | I71: player_exp | J71: 112
A72: 70 | B72: pass_chapter | C72: 70 | E72: 1 | F72: 71 | H72: =R[-1]C -> 0 | I72: player_exp | J72: 112
A73: 71 | B73: pass_chapter | C73: 71 | E73: 1 | F73: 72 | H73: =R[-1]C -> 0 | I73: player_exp | J73: 116
A74: 72 | B74: pass_chapter | C74: 72 | E74: 1 | F74: 73 | H74: =R[-1]C -> 0 | I74: player_exp | J74: 116
A75: 73 | B75: pass_chapter | C75: 73 | E75: 1 | F75: 74 | H75: =R[-1]C -> 0 | I75: player_exp | J75: 120
A76: 74 | B76: pass_chapter | C76: 74 | E76: 1 | F76: 75 | H76: =R[-1]C -> 0 | I76: player_exp | J76: 120
A77: 75 | B77: pass_chapter | C77: 75 | E77: 1 | F77: 76 | H77: =R[-1]C -> 0 | I77: player_exp | J77: 124
A78: 76 | B78: pass_chapter | C78: 76 | E78: 1 | F78: 77 | H78: =R[-1]C -> 0 | I78: player_exp | J78: 124
A79: 77 | B79: pass_chapter | C79: 77 | E79: 1 | F79: 78 | H79: =R[-1]C -> 0 | I79: player_exp | J79: 128
A80: 78 | B80: pass_chapter | C80: 78 | E80: 1 | F80: 79 | H80: =R[-1]C -> 0 | I80: player_exp | J80: 128
A81: 79 | B81: pass_chapter | C81: 79 | E81: 1 | F81: 80 | H81: =R[-1]C -> 0 | I81: player_exp | J81: 132
A82: 80 | B82: pass_chapter | C82: 80 | E82: 1 | F82: 81 | H82: =R[-1]C -> 0 | I82: player_exp | J82: 132
A83: 81 | B83: pass_chapter | C83: 81 | E83: 1 | F83: 82 | H83: =R[-1]C -> 0 | I83: player_exp | J83: 136
A84: 82 | B84: pass_chapter | C84: 82 | E84: 1 | F84: 83 | H84: =R[-1]C -> 0 | I84: player_exp | J84: 136
A85: 83 | B85: pass_chapter | C85: 83 | E85: 1 | F85: 84 | H85: =R[-1]C -> 0 | I85: player_exp | J85: 140
A86: 84 | B86: pass_chapter | C86: 84 | E86: 1 | F86: 85 | H86: =R[-1]C -> 0 | I86: player_exp | J86: 140
A87: 85 | B87: pass_chapter | C87: 85 | E87: 1 | F87: 86 | H87: =R[-1]C -> 0 | I87: player_exp | J87: 144
A88: 86 | B88: pass_chapter | C88: 86 | E88: 1 | F88: 87 | H88: =R[-1]C -> 0 | I88: player_exp | J88: 144
A89: 87 | B89: pass_chapter | C89: 87 | E89: 1 | F89: 88 | H89: =R[-1]C -> 0 | I89: player_exp | J89: 148
A90: 88 | B90: pass_chapter | C90: 88 | E90: 1 | F90: 89 | H90: =R[-1]C -> 0 | I90: player_exp | J90: 148
A91: 89 | B91: pass_chapter | C91: 89 | E91: 1 | F91: 90 | H91: =R[-1]C -> 0 | I91: player_exp | J91: 152
A92: 90 | B92: pass_chapter | C92: 90 | E92: 1 | F92: 91 | H92: =R[-1]C -> 0 | I92: player_exp | J92: 152
A93: 91 | B93: pass_chapter | C93: 91 | E93: 1 | F93: 92 | H93: =R[-1]C -> 0 | I93: player_exp | J93: 156
A94: 92 | B94: pass_chapter | C94: 92 | E94: 1 | F94: 93 | H94: =R[-1]C -> 0 | I94: player_exp | J94: 156
A95: 93 | B95: pass_chapter | C95: 93 | E95: 1 | F95: 94 | H95: =R[-1]C -> 0 | I95: player_exp | J95: 160
A96: 94 | B96: pass_chapter | C96: 94 | E96: 1 | F96: 95 | H96: =R[-1]C -> 0 | I96: player_exp | J96: 160
A97: 95 | B97: pass_chapter | C97: 95 | E97: 1 | F97: 96 | H97: =R[-1]C -> 0 | I97: player_exp | J97: 164
A98: 96 | B98: pass_chapter | C98: 96 | E98: 1 | F98: 97 | H98: =R[-1]C -> 0 | I98: player_exp | J98: 164
A99: 97 | B99: pass_chapter | C99: 97 | E99: 1 | F99: 98 | H99: =R[-1]C -> 0 | I99: player_exp | J99: 168
A100: 98 | B100: pass_chapter | C100: 98 | E100: 1 | F100: 99 | H100: =R[-1]C -> 0 | I100: player_exp | J100: 168
A101: 99 | B101: pass_chapter | C101: 99 | E101: 1 | F101: 100 | H101: =R[-1]C -> 0 | I101: player_exp | J101: 172
A102: 100 | B102: pass_chapter | C102: 100 | E102: 1 | F102: 101 | H102: =R[-1]C -> 0 | I102: player_exp | J102: 172
A103: 101 | B103: pass_chapter | C103: 101 | E103: 1 | F103: 102 | H103: =R[-1]C -> 0 | I103: player_exp | J103: 176
A104: 102 | B104: pass_chapter | C104: 102 | E104: 1 | F104: 103 | H104: =R[-1]C -> 0 | I104: player_exp | J104: 176
A105: 103 | B105: pass_chapter | C105: 103 | E105: 1 | F105: 104 | H105: =R[-1]C -> 0 | I105: player_exp | J105: 180
A106: 104 | B106: pass_chapter | C106: 104 | E106: 1 | F106: 105 | H106: =R[-1]C -> 0 | I106: player_exp | J106: 180
A107: 105 | B107: pass_chapter | C107: 105 | E107: 1 | F107: 106 | H107: =R[-1]C -> 0 | I107: player_exp | J107: 184
A108: 106 | B108: pass_chapter | C108: 106 | E108: 1 | F108: 107 | H108: =R[-1]C -> 0 | I108: player_exp | J108: 184
A109: 107 | B109: pass_chapter | C109: 107 | E109: 1 | F109: 108 | H109: =R[-1]C -> 0 | I109: player_exp | J109: 188
A110: 108 | B110: pass_chapter | C110: 108 | E110: 1 | F110: 109 | H110: =R[-1]C -> 0 | I110: player_exp | J110: 188
A111: 109 | B111: pass_chapter | C111: 109 | E111: 1 | F111: 110 | H111: =R[-1]C -> 0 | I111: player_exp | J111: 192
A112: 110 | B112: pass_chapter | C112: 110 | E112: 1 | F112: 111 | H112: =R[-1]C -> 0 | I112: player_exp | J112: 192
A113: 111 | B113: pass_chapter | C113: 111 | E113: 1 | F113: 112 | H113: =R[-1]C -> 0 | I113: player_exp | J113: 196
A114: 112 | B114: pass_chapter | C114: 112 | E114: 1 | F114: 113 | H114: =R[-1]C -> 0 | I114: player_exp | J114: 196
A115: 113 | B115: pass_chapter | C115: 113 | E115: 1 | F115: 114 | H115: =R[-1]C -> 0 | I115: player_exp | J115: 200
A116: 114 | B116: pass_chapter | C116: 114 | E116: 1 | F116: 115 | H116: =R[-1]C -> 0 | I116: player_exp | J116: 200
A117: 115 | B117: pass_chapter | C117: 115 | E117: 1 | F117: 116 | H117: =R[-1]C -> 0 | I117: player_exp | J117: 204
A118: 116 | B118: pass_chapter | C118: 116 | E118: 1 | F118: 117 | H118: =R[-1]C -> 0 | I118: player_exp | J118: 204
A119: 117 | B119: pass_chapter | C119: 117 | E119: 1 | F119: 118 | H119: =R[-1]C -> 0 | I119: player_exp | J119: 208
A120: 118 | B120: pass_chapter | C120: 118 | E120: 1 | F120: 119 | H120: =R[-1]C -> 0 | I120: player_exp | J120: 208
A121: 119 | B121: pass_chapter | C121: 119 | E121: 1 | F121: 120 | H121: =R[-1]C -> 0 | I121: player_exp | J121: 208
A122: 120 | B122: pass_chapter | C122: 120 | E122: 1 | F122: 121 | H122: =R[-1]C -> 0 | I122: player_exp | J122: 212
A123: 121 | B123: pass_chapter | C123: 121 | E123: 1 | F123: 122 | H123: =R[-1]C -> 0 | I123: player_exp | J123: 212
A124: 122 | B124: pass_chapter | C124: 122 | E124: 1 | F124: 123 | H124: =R[-1]C -> 0 | I124: player_exp | J124: 212
A125: 123 | B125: pass_chapter | C125: 123 | E125: 1 | F125: 124 | H125: =R[-1]C -> 0 | I125: player_exp | J125: 216
A126: 124 | B126: pass_chapter | C126: 124 | E126: 1 | F126: 125 | H126: =R[-1]C -> 0 | I126: player_exp | J126: 216
A127: 125 | B127: pass_chapter | C127: 125 | E127: 1 | F127: 126 | H127: =R[-1]C -> 0 | I127: player_exp | J127: 216
A128: 126 | B128: pass_chapter | C128: 126 | E128: 1 | F128: 127 | H128: =R[-1]C -> 0 | I128: player_exp | J128: 220
A129: 127 | B129: pass_chapter | C129: 127 | E129: 1 | F129: 128 | H129: =R[-1]C -> 0 | I129: player_exp | J129: 220
A130: 128 | B130: pass_chapter | C130: 128 | E130: 1 | F130: 129 | H130: =R[-1]C -> 0 | I130: player_exp | J130: 220
A131: 129 | B131: pass_chapter | C131: 129 | E131: 1 | F131: 130 | H131: =R[-1]C -> 0 | I131: player_exp | J131: 224
A132: 130 | B132: pass_chapter | C132: 130 | E132: 1 | F132: 131 | H132: =R[-1]C -> 0 | I132: player_exp | J132: 224
A133: 131 | B133: pass_chapter | C133: 131 | E133: 1 | F133: 132 | H133: =R[-1]C -> 0 | I133: player_exp | J133: 224
A134: 132 | B134: pass_chapter | C134: 132 | E134: 1 | F134: 133 | H134: =R[-1]C -> 0 | I134: player_exp | J134: 228
A135: 133 | B135: pass_chapter | C135: 133 | E135: 1 | F135: 134 | H135: =R[-1]C -> 0 | I135: player_exp | J135: 228
A136: 134 | B136: pass_chapter | C136: 134 | E136: 1 | F136: 135 | H136: =R[-1]C -> 0 | I136: player_exp | J136: 228
A137: 135 | B137: pass_chapter | C137: 135 | E137: 1 | F137: 136 | H137: =R[-1]C -> 0 | I137: player_exp | J137: 232
A138: 136 | B138: pass_chapter | C138: 136 | E138: 1 | F138: 137 | H138: =R[-1]C -> 0 | I138: player_exp | J138: 232
A139: 137 | B139: pass_chapter | C139: 137 | E139: 1 | F139: 138 | H139: =R[-1]C -> 0 | I139: player_exp | J139: 232
A140: 138 | B140: pass_chapter | C140: 138 | E140: 1 | F140: 139 | H140: =R[-1]C -> 0 | I140: player_exp | J140: 236
A141: 139 | B141: pass_chapter | C141: 139 | E141: 1 | F141: 140 | H141: =R[-1]C -> 0 | I141: player_exp | J141: 236
A142: 140 | B142: pass_chapter | C142: 140 | E142: 1 | H142: =R[-1]C -> 0 | I142: player_exp | J142: 236

Sheet: 每日任务配置表
A1: id | B1: 基本任务id | C1: 基本任务参数 | D1: 接受时机 | E1: 接受等级 | F1: 前置任务id | G1: 任务类型 | H1: 奖励类型 | I1: 奖励参数 | J1: 奖励类型 | K1: 奖励参数 | L1: 奖励类型 | M1: 奖励参数 | N1: 奖励类型 | O1: 奖励参数
A2: id | B2: base_quest_id | C2: base_quest_params | D2: accept_time | E2: quest_level | F2: fore_quest_id | G2: type | H2: reward_type | I2: reward_args | J2: reward_type | K2: reward_args | L2: reward_type | M2: reward_args | N2: reward_type | O2: reward_args
A3: 1 | B3: pass_chapter | C3: 5 | E3: 1 | H3: money | I3: 1000 | J3: hero_exp | K3: 100
A4: 2 | B4: pass_chapter | C4: 11 | E4: 5 | H4: hero_exp | I4: 200
A5: 3 | B5: pass_chapter | C5: 15 | E5: 15 | H5: player_exp | I5: 100
A6: 4 | B6: pass_chapter | C6: 18 | E6: 20 | H6: hero | I6: 3
A7: 5 | B7: pass_chapter | C7: 23 | E7: 25 | H7: gem | I7: 1|20
A8: 6 | B8: pass_chapter | C8: 26 | E8: 5 | H8: material | I8: 2|30

Sheet: 每日任务类型表
A1: id | B1: 等级阶段 | C1: 任务类型图标 | D1: 基本任务id | E1: 基本任务参数 | F1: 获得概率 | G1: 精力消耗 | H1: 任务难度 | I1: 奖励类型 | J1: 奖励参数 | K1: 奖励类型 | L1: 奖励参数
A2: id | B2: level_range | C2: quest_type_icon | D2: base_quest_id | E2: base_quest_params | F2: quest_rate | G2: sp_cost | H2: quest_dif | I2: reward_type | J2: reward_args | K2: reward_type | L2: reward_args
A3: 1001 | B3: 1-5 | C3: liehuoling | D3: fight_player | E3: 3 | F3: 6 | G3: 5 | H3: 1 | I3: player_exp | J3: 10 | K3: money | L3: 100
A4: 1002 | B4: 1-5 | C4: liehuoling | D4: fight_player | E4: 5 | F4: 3 | G4: 5 | H4: 2 | I4: player_exp | J4: 14 | K4: money | L4: 140
A5: 1003 | B5: 1-5 | C5: liehuoling | D5: fight_player | E5: 7 | F5: 1 | G5: 5 | H5: 3 | I5: player_exp | J5: 18 | K5: money | L5: 180
A6: 1004 | B6: 1-5 | C6: hongshuiling | D6: fight_stranger | E6: 3 | F6: 6 | G6: 5 | H6: 1 | I6: player_exp | J6: 10 | K6: money | L6: 100
A7: 1005 | B7: 1-5 | C7: hongshuiling | D7: fight_stranger | E7: 5 | F7: 3 | G7: 5 | H7: 2 | I7: player_exp | J7: 14 | K7: money | L7: 140
A8: 1006 | B8: 1-5 | C8: hongshuiling | D8: fight_stranger | E8: 7 | F8: 1 | G8: 5 | H8: 3 | I8: player_exp | J8: 18 | K8: money | L8: 180
A9: 1007 | C9: hongshuiling | D9: capture_stranger | E9: 1 | F9: 6 | G9: 5 | H9: =R[-3]C -> 1 | I9: player_exp | J9: 10 | K9: money | L9: 100
A10: 1008 | C10: hongshuiling | D10: capture_stranger | E10: 2 | F10: 3 | G10: 5 | H10: =R[-3]C -> 2 | I10: player_exp | J10: 14 | K10: money | L10: 140
A11: 1009 | C11: hongshuiling | D11: capture_stranger | E11: 3 | F11: 1 | G11: 5 | H11: =R[-3]C -> 3 | I11: player_exp | J11: 18 | K11: money | L11: 180
A12: 1010 | C12: hongshuiling | D12: tax_stranger | E12: 5 | F12: 6 | G12: 5 | H12: =R[-3]C -> 1 | I12: player_exp | J12: 10 | K12: money | L12: 100
A13: 1011 | C13: hongshuiling | D13: tax_stranger | E13: 10 | F13: 3 | G13: 5 | H13: =R[-3]C -> 2 | I13: player_exp | J13: 14 | K13: money | L13: 140
A14: 1012 | C14: hongshuiling | D14: tax_stranger | E14: 15 | F14: 1 | G14: 5 | H14: =R[-3]C -> 3 | I14: player_exp | J14: 18 | K14: money | L14: 180
A15: 1013 | C15: hongshuiling | D15: free_friend | E15: 1 | F15: 6 | G15: 5 | H15: =R[-3]C -> 1 | I15: player_exp | J15: 10 | K15: money | L15: 100
A16: 1014 | C16: hongshuiling | D16: free_friend | E16: 2 | F16: 3 | G16: 5 | H16: =R[-3]C -> 2 | I16: player_exp | J16: 14 | K16: money | L16: 140
A17: 1015 | C17: hongshuiling | D17: free_friend | E17: 3 | F17: 1 | G17: 5 | H17: =R[-3]C -> 3 | I17: player_exp | J17: 18 | K17: money | L17: 180
A18: 1016 | C18: liehuoling | D18: fight_player | E18: 3 | F18: 6 | G18: 5 | H18: 1 | I18: player_exp | J18: 20 | K18: money | L18: 200
A19: 1017 | C19: liehuoling | D19: fight_player | E19: 5 | F19: 3 | G19: 5 | H19: 2 | I19: player_exp | J19: 24 | K19: money | L19: 240
A20: 1018 | C20: liehuoling | D20: fight_player | E20: 7 | F20: 1 | G20: 5 | H20: 3 | I20: player_exp | J20: 28 | K20: money | L20: 280
A21: 1019 | B21: 6-10 | C21: hongshuiling | D21: fight_stranger | E21: 3 | F21: 6 | G21: 5 | H21: 1 | I21: player_exp | J21: 20 | K21: money | L21: 200
A22: 1020 | B22: 6-10 | C22: hongshuiling | D22: fight_stranger | E22: 5 | F22: 3 | G22: 5 | H22: 2 | I22: player_exp | J22: 24 | K22: money | L22: 240
A23: 1021 | B23: 6-10 | C23: hongshuiling | D23: fight_stranger | E23: 7 | F23: 1 | G23: 5 | H23: 3 | I23: player_exp | J23: 28 | K23: money | L23: 280
A24: 1022 | C24: hongshuiling | D24: capture_stranger | E24: 1 | F24: 6 | G24: 5 | H24: 1 | I24: player_exp | J24: 20 | K24: money | L24: 200
A25: 1023 | C25: hongshuiling | D25: capture_stranger | E25: 2 | F25: 3 | G25: 5 | H25: 2 | I25: player_exp | J25: 24 | K25: money | L25: 240
A26: 1024 | C26: hongshuiling | D26: capture_stranger | E26: 3 | F26: 1 | G26: 5 | H26: 3 | I26: player_exp | J26: 28 | K26: money | L26: 280
A27: 1025 | C27: hongshuiling | D27: tax_stranger | E27: 5 | F27: 6 | G27: 5 | H27: 1 | I27: player_exp | J27: 20 | K27: money | L27: 200
A28: 1026 | C28: hongshuiling | D28: tax_stranger | E28: 10 | F28: 3 | G28: 5 | H28: 2 | I28: player_exp | J28: 24 | K28: money | L28: 240
A29: 1027 | C29: hongshuiling | D29: tax_stranger | E29: 15 | F29: 1 | G29: 5 | H29: 3 | I29: player_exp | J29: 28 | K29: money | L29: 280
A30: 1028 | C30: hongshuiling | D30: free_friend | E30: 1 | F30: 6 | G30: 5 | H30: 1 | I30: player_exp | J30: 20 | K30: money | L30: 200
A31: 1029 | C31: hongshuiling | D31: free_friend | E31: 2 | F31: 3 | G31: 5 | H31: 2 | I31: player_exp | J31: 24 | K31: money | L31: 240
A32: 1030 | C32: hongshuiling | D32: free_friend | E32: 3 | F32: 1 | G32: 5 | H32: 3 | I32: player_exp | J32: 28 | K32: money | L32: 280
A33: 1031 | C33: liehuoling | D33: fight_player | E33: 3 | F33: 6 | G33: 5 | H33: 1 | I33: player_exp | J33: 30 | K33: money | L33: 300
A34: 1032 | C34: liehuoling | D34: fight_player | E34: 5 | F34: 3 | G34: 5 | H34: 2 | I34: player_exp | J34: 34 | K34: money | L34: 340
A35: 1033 | C35: liehuoling | D35: fight_player | E35: 7 | F35: 1 | G35: 5 | H35: 3 | I35: player_exp | J35: 38 | K35: money | L35: 380
A36: 1034 | B36: 11-15 | C36: hongshuiling | D36: fight_stranger | E36: 3 | F36: 6 | G36: 5 | H36: 1 | I36: player_exp | J36: 30 | K36: money | L36: 300
A37: 1035 | B37: 11-15 | C37: hongshuiling | D37: fight_stranger | E37: 5 | F37: 3 | G37: 5 | H37: 2 | I37: player_exp | J37: 34 | K37: money | L37: 340
A38: 1036 | B38: 11-15 | C38: hongshuiling | D38: fight_stranger | E38: 7 | F38: 1 | G38: 5 | H38: 3 | I38: player_exp | J38: 38 | K38: money | L38: 380
A39: 1037 | C39: hongshuiling | D39: capture_stranger | E39: 1 | F39: 6 | G39: 5 | H39: 1 | I39: player_exp | J39: 30 | K39: money | L39: 300
A40: 1038 | C40: hongshuiling | D40: capture_stranger | E40: 2 | F40: 3 | G40: 5 | H40: 2 | I40: player_exp | J40: 34 | K40: money | L40: 340
A41: 1039 | C41: hongshuiling | D41: capture_stranger | E41: 3 | F41: 1 | G41: 5 | H41: 3 | I41: player_exp | J41: 38 | K41: money | L41: 380
A42: 1040 | C42: hongshuiling | D42: tax_stranger | E42: 5 | F42: 6 | G42: 5 | H42: 1 | I42: player_exp | J42: 30 | K42: money | L42: 300
A43: 1041 | C43: hongshuiling | D43: tax_stranger | E43: 10 | F43: 3 | G43: 5 | H43: 2 | I43: player_exp | J43: 34 | K43: money | L43: 340
A44: 1042 | C44: hongshuiling | D44: tax_stranger | E44: 15 | F44: 1 | G44: 5 | H44: 3 | I44: player_exp | J44: 38 | K44: money | L44: 380
A45: 1043 | C45: hongshuiling | D45: free_friend | E45: 1 | F45: 6 | G45: 5 | H45: 1 | I45: player_exp | J45: 30 | K45: money | L45: 300
A46: 1044 | C46: hongshuiling | D46: free_friend | E46: 2 | F46: 3 | G46: 5 | H46: 2 | I46: player_exp | J46: 34 | K46: money | L46: 340
A47: 1045 | C47: hongshuiling | D47: free_friend | E47: 3 | F47: 1 | G47: 5 | H47: 3 | I47: player_exp | J47: 38 | K47: money | L47: 380
A48: 1046 | B48: 16-20 | C48: liehuoling | D48: fight_player | E48: 3 | F48: 6 | G48: 5 | H48: 1 | I48: player_exp | J48: 40 | K48: money | L48: 400
A49: 1047 | B49: 16-20 | C49: liehuoling | D49: fight_player | E49: 5 | F49: 3 | G49: 5 | H49: 2 | I49: player_exp | J49: 44 | K49: money | L49: 440
A50: 1048 | B50: 16-20 | C50: liehuoling | D50: fight_player | E50: 7 | F50: 1 | G50: 5 | H50: 3 | I50: player_exp | J50: 48 | K50: money | L50: 480
A51: 1049 | B51: 16-20 | C51: hongshuiling | D51: fight_stranger | E51: 3 | F51: 6 | G51: 5 | H51: 1 | I51: player_exp | J51: 40 | K51: money | L51: 400
A52: 1050 | B52: 16-20 | C52: hongshuiling | D52: fight_stranger | E52: 5 | F52: 3 | G52: 5 | H52: 2 | I52: player_exp | J52: 44 | K52: money | L52: 440
A53: 1051 | B53: 16-20 | C53: hongshuiling | D53: fight_stranger | E53: 7 | F53: 1 | G53: 5 | H53: 3 | I53: player_exp | J53: 48 | K53: money | L53: 480
A54: 1052 | C54: hongshuiling | D54: capture_stranger | E54: 1 | F54: 6 | G54: 5 | H54: 1 | I54: player_exp | J54: 40 | K54: money | L54: 400
A55: 1053 | C55: hongshuiling | D55: capture_stranger | E55: 2 | F55: 3 | G55: 5 | H55: 2 | I55: player_exp | J55: 44 | K55: money | L55: 440
A56: 1054 | C56: hongshuiling | D56: capture_stranger | E56: 3 | F56: 1 | G56: 5 | H56: 3 | I56: player_exp | J56: 48 | K56: money | L56: 480
A57: 1055 | C57: hongshuiling | D57: tax_stranger | E57: 5 | F57: 6 | G57: 5 | H57: 1 | I57: player_exp | J57: 40 | K57: money | L57: 400
A58: 1056 | C58: hongshuiling | D58: tax_stranger | E58: 10 | F58: 3 | G58: 5 | H58: 2 | I58: player_exp | J58: 44 | K58: money | L58: 440
A59: 1057 | C59: hongshuiling | D59: tax_stranger | E59: 15 | F59: 1 | G59: 5 | H59: 3 | I59: player_exp | J59: 48 | K59: money | L59: 480
A60: 1058 | C60: hongshuiling | D60: free_friend | E60: 1 | F60: 6 | G60: 5 | H60: 1 | I60: player_exp | J60: 40 | K60: money | L60: 400
A61: 1059 | C61: hongshuiling | D61: free_friend | E61: 2 | F61: 3 | G61: 5 | H61: 2 | I61: player_exp | J61: 44 | K61: money | L61: 440
A62: 1060 | C62: hongshuiling | D62: free_friend | E62: 3 | F62: 1 | G62: 5 | H62: 3 | I62: player_exp | J62: 48 | K62: money | L62: 480
A63: 1061 | B63: 21-25 | C63: liehuoling | D63: fight_player | E63: 3 | F63: 6 | G63: 5 | H63: 1 | I63: player_exp | J63: 50 | K63: money | L63: 500
A64: 1062 | B64: 21-25 | C64: liehuoling | D64: fight_player | E64: 5 | F64: 3 | G64: 5 | H64: 2 | I64: player_exp | J64: 54 | K64: money | L64: 540
A65: 1063 | B65: 21-25 | C65: liehuoling | D65: fight_player | E65: 7 | F65: 1 | G65: 5 | H65: 3 | I65: player_exp | J65: 58 | K65: money | L65: 580
A66: 1064 | B66: 21-25 | C66: hongshuiling | D66: fight_stranger | E66: 3 | F66: 6 | G66: 5 | H66: 1 | I66: player_exp | J66: 50 | K66: money | L66: 500
A67: 1065 | B67: 21-25 | C67: hongshuiling | D67: fight_stranger | E67: 5 | F67: 3 | G67: 5 | H67: 2 | I67: player_exp | J67: 54 | K67: money | L67: 540
A68: 1066 | B68: 21-25 | C68: hongshuiling | D68: fight_stranger | E68: 7 | F68: 1 | G68: 5 | H68: 3 | I68: player_exp | J68: 58 | K68: money | L68: 580
A69: 1067 | C69: hongshuiling | D69: capture_stranger | E69: 1 | F69: 6 | G69: 5 | H69: 1 | I69: player_exp | J69: 50 | K69: money | L69: 500
A70: 1068 | C70: hongshuiling | D70: capture_stranger | E70: 2 | F70: 3 | G70: 5 | H70: 2 | I70: player_exp | J70: 54 | K70: money | L70: 540
A71: 1069 | C71: hongshuiling | D71: capture_stranger | E71: 3 | F71: 1 | G71: 5 | H71: 3 | I71: player_exp | J71: 58 | K71: money | L71: 580
A72: 1070 | C72: hongshuiling | D72: tax_stranger | E72: 5 | F72: 6 | G72: 5 | H72: 1 | I72: player_exp | J72: 50 | K72: money | L72: 500
A73: 1071 | C73: hongshuiling | D73: tax_stranger | E73: 10 | F73: 3 | G73: 5 | H73: 2 | I73: player_exp | J73: 54 | K73: money | L73: 540
A74: 1072 | C74: hongshuiling | D74: tax_stranger | E74: 15 | F74: 1 | G74: 5 | H74: 3 | I74: player_exp | J74: 58 | K74: money | L74: 580
A75: 1073 | C75: hongshuiling | D75: free_friend | E75: 1 | F75: 6 | G75: 5 | H75: 1 | I75: player_exp | J75: 50 | K75: money | L75: 500
A76: 1074 | C76: hongshuiling | D76: free_friend | E76: 2 | F76: 3 | G76: 5 | H76: 2 | I76: player_exp | J76: 54 | K76: money | L76: 540
A77: 1075 | C77: hongshuiling | D77: free_friend | E77: 3 | F77: 1 | G77: 5 | H77: 3 | I77: player_exp | J77: 58 | K77: money | L77: 580
A78: 1076 | B78: 26-31 | C78: liehuoling | D78: fight_player | E78: 3 | F78: 6 | G78: 5 | H78: 1 | I78: player_exp | J78: 60 | K78: money | L78: 600
A79: 1077 | B79: 26-31 | C79: liehuoling | D79: fight_player | E79: 5 | F79: 3 | G79: 5 | H79: 2 | I79: player_exp | J79: 64 | K79: money | L79: 640
A80: 1078 | B80: 26-31 | C80: liehuoling | D80: fight_player | E80: 7 | F80: 1 | G80: 5 | H80: 3 | I80: player_exp | J80: 68 | K80: money | L80: 680
A81: 1079 | B81: 26-31 | C81: hongshuiling | D81: fight_stranger | E81: 3 | F81: 6 | G81: 5 | H81: 1 | I81: player_exp | J81: 60 | K81: money | L81: 600
A82: 1080 | B82: 26-31 | C82: hongshuiling | D82: fight_stranger | E82: 5 | F82: 3 | G82: 5 | H82: 2 | I82: player_exp | J82: 64 | K82: money | L82: 640
A83: 1081 | B83: 26-31 | C83: hongshuiling | D83: fight_stranger | E83: 7 | F83: 1 | G83: 5 | H83: 3 | I83: player_exp | J83: 68 | K83: money | L83: 680
A84: 1082 | C84: hongshuiling | D84: capture_stranger | E84: 1 | F84: 6 | G84: 5 | H84: 1 | I84: player_exp | J84: 60 | K84: money | L84: 600
A85: 1083 | C85: hongshuiling | D85: capture_stranger | E85: 2 | F85: 3 | G85: 5 | H85: 2 | I85: player_exp | J85: 64 | K85: money | L85: 640
A86: 1084 | C86: hongshuiling | D86: capture_stranger | E86: 3 | F86: 1 | G86: 5 | H86: 3 | I86: player_exp | J86: 68 | K86: money | L86: 680
A87: 1085 | C87: hongshuiling | D87: tax_stranger | E87: 5 | F87: 6 | G87: 5 | H87: 1 | I87: player_exp | J87: 60 | K87: money | L87: 600
A88: 1086 | C88: hongshuiling | D88: tax_stranger | E88: 10 | F88: 3 | G88: 5 | H88: 2 | I88: player_exp | J88: 64 | K88: money | L88: 640
A89: 1087 | C89: hongshuiling | D89: tax_stranger | E89: 15 | F89: 1 | G89: 5 | H89: 3 | I89: player_exp | J89: 68 | K89: money | L89: 680
A90: 1088 | C90: hongshuiling | D90: free_friend | E90: 1 | F90: 6 | G90: 5 | H90: 1 | I90: player_exp | J90: 60 | K90: money | L90: 600
A91: 1089 | C91: hongshuiling | D91: free_friend | E91: 2 | F91: 3 | G91: 5 | H91: 2 | I91: player_exp | J91: 64 | K91: money | L91: 640
A92: 1090 | C92: hongshuiling | D92: free_friend | E92: 3 | F92: 1 | G92: 5 | H92: 3 | I92: player_exp | J92: 68 | K92: money | L92: 680
A93: 1091 | B93: 32-35 | C93: liehuoling | D93: fight_player | E93: 3 | F93: 6 | G93: 5 | H93: 1 | I93: player_exp | J93: 70 | K93: money | L93: 700
A94: 1092 | B94: 32-35 | C94: liehuoling | D94: fight_player | E94: 5 | F94: 3 | G94: 5 | H94: 2 | I94: player_exp | J94: 74 | K94: money | L94: 740
A95: 1093 | B95: 32-35 | C95: liehuoling | D95: fight_player | E95: 7 | F95: 1 | G95: 5 | H95: 3 | I95: player_exp | J95: 78 | K95: money | L95: 780
A96: 1094 | B96: 32-35 | C96: hongshuiling | D96: fight_stranger | E96: 3 | F96: 6 | G96: 5 | H96: 1 | I96: player_exp | J96: 70 | K96: money | L96: 700
A97: 1095 | B97: 32-35 | C97: hongshuiling | D97: fight_stranger | E97: 5 | F97: 3 | G97: 5 | H97: 2 | I97: player_exp | J97: 74 | K97: money | L97: 740
A98: 1096 | B98: 32-35 | C98: hongshuiling | D98: fight_stranger | E98: 7 | F98: 1 | G98: 5 | H98: 3 | I98: player_exp | J98: 78 | K98: money | L98: 780
A99: 1097 | B99: 32-35 | C99: hongshuiling | D99: capture_stranger | E99: 1 | F99: 6 | G99: 5 | H99: 1 | I99: player_exp | J99: 70 | K99: money | L99: 700
A100: 1098 | B100: 32-35 | C100: hongshuiling | D100: capture_stranger | E100: 2 | F100: 3 | G100: 5 | H100: 2 | I100: player_exp | J100: 74 | K100: money | L100: 740
A101: 1099 | B101: 32-35 | C101: hongshuiling | D101: capture_stranger | E101: 3 | F101: 1 | G101: 5 | H101: 3 | I101: player_exp | J101: 78 | K101: money | L101: 780
A102: 1100 | B102: 32-35 | C102: hongshuiling | D102: tax_stranger | E102: 5 | F102: 6 | G102: 5 | H102: 1 | I102: player_exp | J102: 70 | K102: money | L102: 700
A103: 1101 | B103: 32-35 | C103: hongshuiling | D103: tax_stranger | E103: 10 | F103: 3 | G103: 5 | H103: 2 | I103: player_exp | J103: 74 | K103: money | L103: 740
A104: 1102 | B104: 32-35 | C104: hongshuiling | D104: tax_stranger | E104: 15 | F104: 1 | G104: 5 | H104: 3 | I104: player_exp | J104: 78 | K104: money | L104: 780
A105: 1103 | B105: 32-35 | C105: hongshuiling | D105: free_friend | E105: 1 | F105: 6 | G105: 5 | H105: 1 | I105: player_exp | J105: 70 | K105: money | L105: 700
A106: 1104 | B106: 32-35 | C106: hongshuiling | D106: free_friend | E106: 2 | F106: 3 | G106: 5 | H106: 2 | I106: player_exp | J106: 74 | K106: money | L106: 740
A107: 1105 | B107: 32-35 | C107: hongshuiling | D107: free_friend | E107: 3 | F107: 1 | G107: 5 | H107: 3 | I107: player_exp | J107: 78 | K107: money | L107: 780
A108: 1106 | B108: 36-40 | C108: liehuoling | D108: fight_player | E108: 3 | F108: 6 | G108: 5 | H108: 1 | I108: player_exp | J108: 80 | K108: money | L108: 800
A109: 1107 | B109: 36-40 | C109: liehuoling | D109: fight_player | E109: 5 | F109: 3 | G109: 5 | H109: 2 | I109: player_exp | J109: 84 | K109: money | L109: 840
A110: 1108 | B110: 36-40 | C110: liehuoling | D110: fight_player | E110: 7 | F110: 1 | G110: 5 | H110: 3 | I110: player_exp | J110: 88 | K110: money | L110: 880
A111: 1109 | B111: 36-40 | C111: hongshuiling | D111: fight_stranger | E111: 3 | F111: 6 | G111: 5 | H111: 1 | I111: player_exp | J111: 80 | K111: money | L111: 800
A112: 1110 | B112: 36-40 | C112: hongshuiling | D112: fight_stranger | E112: 5 | F112: 3 | G112: 5 | H112: 2 | I112: player_exp | J112: 84 | K112: money | L112: 840
A113: 1111 | B113: 36-40 | C113: hongshuiling | D113: fight_stranger | E113: 7 | F113: 1 | G113: 5 | H113: 3 | I113: player_exp | J113: 88 | K113: money | L113: 880
A114: 1112 | B114: 36-40 | C114: hongshuiling | D114: capture_stranger | E114: 1 | F114: 6 | G114: 5 | H114: 1 | I114: player_exp | J114: 80 | K114: money | L114: 800
A115: 1113 | B115: 36-40 | C115: hongshuiling | D115: capture_stranger | E115: 2 | F115: 3 | G115: 5 | H115: 2 | I115: player_exp | J115: 84 | K115: money | L115: 840
A116: 1114 | B116: 36-40 | C116: hongshuiling | D116: capture_stranger | E116: 3 | F116: 1 | G116: 5 | H116: 3 | I116: player_exp | J116: 88 | K116: money | L116: 880
A117: 1115 | B117: 36-40 | C117: hongshuiling | D117: tax_stranger | E117: 5 | F117: 6 | G117: 5 | H117: 1 | I117: player_exp | J117: 80 | K117: money | L117: 800
A118: 1116 | B118: 36-40 | C118: hongshuiling | D118: tax_stranger | E118: 10 | F118: 3 | G118: 5 | H118: 2 | I118: player_exp | J118: 84 | K118: money | L118: 840
A119: 1117 | B119: 36-40 | C119: hongshuiling | D119: tax_stranger | E119: 15 | F119: 1 | G119: 5 | H119: 3 | I119: player_exp | J119: 88 | K119: money | L119: 880
A120: 1118 | B120: 36-40 | C120: hongshuiling | D120: free_friend | E120: 1 | F120: 6 | G120: 5 | H120: 1 | I120: player_exp | J120: 80 | K120: money | L120: 800
A121: 1119 | B121: 36-40 | C121: hongshuiling | D121: free_friend | E121: 2 | F121: 3 | G121: 5 | H121: 2 | I121: player_exp | J121: 84 | K121: money | L121: 840
A122: 1120 | B122: 36-40 | C122: hongshuiling | D122: free_friend | E122: 3 | F122: 1 | G122: 5 | H122: 3 | I122: player_exp | J122: 88 | K122: money | L122: 880
A123: 1121 | B123: 41-45 | C123: liehuoling | D123: fight_player | E123: 3 | F123: 6 | G123: 5 | H123: 1 | I123: player_exp | J123: 90 | K123: money | L123: 900
A124: 1122 | B124: 41-45 | C124: liehuoling | D124: fight_player | E124: 5 | F124: 3 | G124: 5 | H124: 2 | I124: player_exp | J124: 94 | K124: money | L124: 940
A125: 1123 | B125: 41-45 | C125: liehuoling | D125: fight_player | E125: 7 | F125: 1 | G125: 5 | H125: 3 | I125: player_exp | J125: 98 | K125: money | L125: 980
A126: 1124 | B126: 41-45 | C126: hongshuiling | D126: fight_stranger | E126: 3 | F126: 6 | G126: 5 | H126: 1 | I126: player_exp | J126: 90 | K126: money | L126: 900
A127: 1125 | B127: 41-45 | C127: hongshuiling | D127: fight_stranger | E127: 5 | F127: 3 | G127: 5 | H127: 2 | I127: player_exp | J127: 94 | K127: money | L127: 940
A128: 1126 | B128: 41-45 | C128: hongshuiling | D128: fight_stranger | E128: 7 | F128: 1 | G128: 5 | H128: 3 | I128: player_exp | J128: 98 | K128: money | L128: 980
A129: 1127 | B129: 41-45 | C129: hongshuiling | D129: capture_stranger | E129: 1 | F129: 6 | G129: 5 | H129: 1 | I129: player_exp | J129: 90 | K129: money | L129: 900
A130: 1128 | B130: 41-45 | C130: hongshuiling | D130: capture_stranger | E130: 2 | F130: 3 | G130: 5 | H130: 2 | I130: player_exp | J130: 94 | K130: money | L130: 940
A131: 1129 | B131: 41-45 | C131: hongshuiling | D131: capture_stranger | E131: 3 | F131: 1 | G131: 5 | H131: 3 | I131: player_exp | J131: 98 | K131: money | L131: 980
A132: 1130 | B132: 41-45 | C132: hongshuiling | D132: tax_stranger | E132: 5 | F132: 6 | G132: 5 | H132: 1 | I132: player_exp | J132: 90 | K132: money | L132: 900
A133: 1131 | B133: 41-45 | C133: hongshuiling | D133: tax_stranger | E133: 10 | F133: 3 | G133: 5 | H133: 2 | I133: player_exp | J133: 94 | K133: money | L133: 940
A134: 1132 | B134: 41-45 | C134: hongshuiling | D134: tax_stranger | E134: 15 | F134: 1 | G134: 5 | H134: 3 | I134: player_exp | J134: 98 | K134: money | L134: 980
A135: 1133 | B135: 41-45 | C135: hongshuiling | D135: free_friend | E135: 1 | F135: 6 | G135: 5 | H135: 1 | I135: player_exp | J135: 90 | K135: money | L135: 900
A136: 1134 | B136: 41-45 | C136: hongshuiling | D136: free_friend | E136: 2 | F136: 3 | G136: 5 | H136: 2 | I136: player_exp | J136: 94 | K136: money | L136: 940
A137: 1135 | B137: 41-45 | C137: hongshuiling | D137: free_friend | E137: 3 | F137: 1 | G137: 5 | H137: 3 | I137: player_exp | J137: 98 | K137: money | L137: 980
A138: 1136 | B138: 46-50 | C138: liehuoling | D138: fight_player | E138: 3 | F138: 6 | G138: 5 | H138: 1 | I138: player_exp | J138: 100 | K138: money | L138: 1000
A139: 1137 | B139: 46-50 | C139: liehuoling | D139: fight_player | E139: 5 | F139: 3 | G139: 5 | H139: 2 | I139: player_exp | J139: 104 | K139: money | L139: 1040
A140: 1138 | B140: 46-50 | C140: liehuoling | D140: fight_player | E140: 7 | F140: 1 | G140: 5 | H140: 3 | I140: player_exp | J140: 108 | K140: money | L140: 1080
A141: 1139 | B141: 46-50 | C141: hongshuiling | D141: fight_stranger | E141: 3 | F141: 6 | G141: 5 | H141: 1 | I141: player_exp | J141: 100 | K141: money | L141: 1000
A142: 1140 | B142: 46-50 | C142: hongshuiling | D142: fight_stranger | E142: 5 | F142: 3 | G142: 5 | H142: 2 | I142: player_exp | J142: 104 | K142: money | L142: 1040
A143: 1141 | B143: 46-50 | C143: hongshuiling | D143: fight_stranger | E143: 7 | F143: 1 | G143: 5 | H143: 3 | I143: player_exp | J143: 108 | K143: money | L143: 1080
A144: 1142 | B144: 46-50 | C144: hongshuiling | D144: capture_stranger | E144: 1 | F144: 6 | G144: 5 | H144: 1 | I144: player_exp | J144: 100 | K144: money | L144: 1000
A145: 1143 | B145: 46-50 | C145: hongshuiling | D145: capture_stranger | E145: 2 | F145: 3 | G145: 5 | H145: 2 | I145: player_exp | J145: 104 | K145: money | L145: 1040
A146: 1144 | B146: 46-50 | C146: hongshuiling | D146: capture_stranger | E146: 3 | F146: 1 | G146: 5 | H146: 3 | I146: player_exp | J146: 108 | K146: money | L146: 1080
A147: 1145 | B147: 46-50 | C147: hongshuiling | D147: tax_stranger | E147: 5 | F147: 6 | G147: 5 | H147: 1 | I147: player_exp | J147: 100 | K147: money | L147: 1000
A148: 1146 | B148: 46-50 | C148: hongshuiling | D148: tax_stranger | E148: 10 | F148: 3 | G148: 5 | H148: 2 | I148: player_exp | J148: 104 | K148: money | L148: 1040
A149: 1147 | B149: 46-50 | C149: hongshuiling | D149: tax_stranger | E149: 15 | F149: 1 | G149: 5 | H149: 3 | I149: player_exp | J149: 108 | K149: money | L149: 1080
A150: 1148 | B150: 46-50 | C150: hongshuiling | D150: free_friend | E150: 1 | F150: 6 | G150: 5 | H150: 1 | I150: player_exp | J150: 100 | K150: money | L150: 1000
A151: 1149 | B151: 46-50 | C151: hongshuiling | D151: free_friend | E151: 2 | F151: 3 | G151: 5 | H151: 2 | I151: player_exp | J151: 104 | K151: money | L151: 1040
A152: 1150 | B152: 46-50 | C152: hongshuiling | D152: free_friend | E152: 3 | F152: 1 | G152: 5 | H152: 3 | I152: player_exp | J152: 108 | K152: money | L152: 1080
A153: 1151 | B153: 51-55 | C153: liehuoling | D153: fight_player | E153: 3 | F153: 6 | G153: 5 | H153: 1 | I153: player_exp | J153: 110 | K153: money | L153: 1100
A154: 1152 | B154: 51-55 | C154: liehuoling | D154: fight_player | E154: 5 | F154: 3 | G154: 5 | H154: 2 | I154: player_exp | J154: 114 | K154: money | L154: 1140
A155: 1153 | B155: 51-55 | C155: liehuoling | D155: fight_player | E155: 7 | F155: 1 | G155: 5 | H155: 3 | I155: player_exp | J155: 118 | K155: money | L155: 1180
A156: 1154 | B156: 51-55 | C156: hongshuiling | D156: fight_stranger | E156: 3 | F156: 6 | G156: 5 | H156: 1 | I156: player_exp | J156: 110 | K156: money | L156: 1100
A157: 1155 | B157: 51-55 | C157: hongshuiling | D157: fight_stranger | E157: 5 | F157: 3 | G157: 5 | H157: 2 | I157: player_exp | J157: 114 | K157: money | L157: 1140
A158: 1156 | B158: 51-55 | C158: hongshuiling | D158: fight_stranger | E158: 7 | F158: 1 | G158: 5 | H158: 3 | I158: player_exp | J158: 118 | K158: money | L158: 1180
A159: 1157 | B159: 51-55 | C159: hongshuiling | D159: capture_stranger | E159: 1 | F159: 6 | G159: 5 | H159: 1 | I159: player_exp | J159: 110 | K159: money | L159: 1100
A160: 1158 | B160: 51-55 | C160: hongshuiling | D160: capture_stranger | E160: 2 | F160: 3 | G160: 5 | H160: 2 | I160: player_exp | J160: 114 | K160: money | L160: 1140
A161: 1159 | B161: 51-55 | C161: hongshuiling | D161: capture_stranger | E161: 3 | F161: 1 | G161: 5 | H161: 3 | I161: player_exp | J161: 118 | K161: money | L161: 1180
A162: 1160 | B162: 51-55 | C162: hongshuiling | D162: tax_stranger | E162: 5 | F162: 6 | G162: 5 | H162: 1 | I162: player_exp | J162: 110 | K162: money | L162: 1100
A163: 1161 | B163: 51-55 | C163: hongshuiling | D163: tax_stranger | E163: 10 | F163: 3 | G163: 5 | H163: 2 | I163: player_exp | J163: 114 | K163: money | L163: 1140
A164: 1162 | B164: 51-55 | C164: hongshuiling | D164: tax_stranger | E164: 15 | F164: 1 | G164: 5 | H164: 3 | I164: player_exp | J164: 118 | K164: money | L164: 1180
A165: 1163 | B165: 51-55 | C165: hongshuiling | D165: free_friend | E165: 1 | F165: 6 | G165: 5 | H165: 1 | I165: player_exp | J165: 110 | K165: money | L165: 1100
A166: 1164 | B166: 51-55 | C166: hongshuiling | D166: free_friend | E166: 2 | F166: 3 | G166: 5 | H166: 2 | I166: player_exp | J166: 114 | K166: money | L166: 1140
A167: 1165 | B167: 51-55 | C167: hongshuiling | D167: free_friend | E167: 3 | F167: 1 | G167: 5 | H167: 3 | I167: player_exp | J167: 118 | K167: money | L167: 1180
A168: 1166 | B168: 56-60 | C168: liehuoling | D168: fight_player | E168: 3 | F168: 6 | G168: 5 | H168: 1 | I168: player_exp | J168: 110 | K168: money | L168: 1200
A169: 1167 | B169: 56-60 | C169: liehuoling | D169: fight_player | E169: 5 | F169: 3 | G169: 5 | H169: 2 | I169: player_exp | J169: 124 | K169: money | L169: 1240
A170: 1168 | B170: 56-60 | C170: liehuoling | D170: fight_player | E170: 7 | F170: 1 | G170: 5 | H170: 3 | I170: player_exp | J170: 128 | K170: money | L170: 1280
A171: 1169 | B171: 56-60 | C171: hongshuiling | D171: fight_stranger | E171: 3 | F171: 6 | G171: 5 | H171: 1 | I171: player_exp | J171: 120 | K171: money | L171: 1200
A172: 1170 | B172: 56-60 | C172: hongshuiling | D172: fight_stranger | E172: 5 | F172: 3 | G172: 5 | H172: 2 | I172: player_exp | J172: 124 | K172: money | L172: 1240
A173: 1171 | B173: 56-60 | C173: hongshuiling | D173: fight_stranger | E173: 7 | F173: 1 | G173: 5 | H173: 3 | I173: player_exp | J173: 128 | K173: money | L173: 1280
A174: 1172 | B174: 56-60 | C174: hongshuiling | D174: capture_stranger | E174: 1 | F174: 6 | G174: 5 | H174: 1 | I174: player_exp | J174: 120 | K174: money | L174: 1200
A175: 1173 | B175: 56-60 | C175: hongshuiling | D175: capture_stranger | E175: 2 | F175: 3 | G175: 5 | H175: 2 | I175: player_exp | J175: 124 | K175: money | L175: 1240
A176: 1174 | B176: 56-60 | C176: hongshuiling | D176: capture_stranger | E176: 3 | F176: 1 | G176: 5 | H176: 3 | I176: player_exp | J176: 128 | K176: money | L176: 1280
A177: 1175 | B177: 56-60 | C177: hongshuiling | D177: tax_stranger | E177: 5 | F177: 6 | G177: 5 | H177: 1 | I177: player_exp | J177: 120 | K177: money | L177: 1200
A178: 1176 | B178: 56-60 | C178: hongshuiling | D178: tax_stranger | E178: 10 | F178: 3 | G178: 5 | H178: 2 | I178: player_exp | J178: 124 | K178: money | L178: 1240
A179: 1177 | B179: 56-60 | C179: hongshuiling | D179: tax_stranger | E179: 15 | F179: 1 | G179: 5 | H179: 3 | I179: player_exp | J179: 128 | K179: money | L179: 1280
A180: 1178 | B180: 56-60 | C180: hongshuiling | D180: free_friend | E180: 1 | F180: 6 | G180: 5 | H180: 1 | I180: player_exp | J180: 120 | K180: money | L180: 1200
A181: 1179 | B181: 56-60 | C181: hongshuiling | D181: free_friend | E181: 2 | F181: 3 | G181: 5 | H181: 2 | I181: player_exp | J181: 124 | K181: money | L181: 1240
A182: 1180 | B182: 56-60 | C182: hongshuiling | D182: free_friend | E182: 3 | F182: 1 | G182: 5 | H182: 3 | I182: player_exp | J182: 128 | K182: money | L182: 1280
A183: 2001 | B183: 1-5 | C183: houtuling | D183: reinforce_amr | E183: 3 | F183: 1 | G183: 5 | H183: 1 | I183: player_exp | J183: 10 | K183: money | L183: 100
A184: 2002 | B184: 1-5 | C184: houtuling | D184: reinforce_amr | E184: 3 | F184: 1 | G184: 5 | H184: 1 | I184: player_exp | J184: 10 | K184: money | L184: 100
A185: 2003 | B185: 1-5 | C185: houtuling | D185: reinforce_amr | E185: 3 | F185: 1 | G185: 5 | H185: 1 | I185: player_exp | J185: 10 | K185: money | L185: 100
A186: 2004 | B186: 1-5 | C186: houtuling | D186: reinforce_amr | E186: 3 | F186: 1 | G186: 5 | H186: 1 | I186: player_exp | J186: 10 | K186: money | L186: 100
A187: 2005 | B187: 1-5 | C187: houtuling | D187: reinforce_amr | E187: 3 | F187: 1 | G187: 5 | H187: 1 | I187: player_exp | J187: 10 | K187: money | L187: 100
A188: 2006 | B188: 1-5 | C188: houtuling | D188: reinforce_amr | E188: 4 | F188: 1 | G188: 5 | H188: 2 | I188: player_exp | J188: 14 | K188: money | L188: 140
A189: 2007 | B189: 1-5 | C189: houtuling | D189: reinforce_amr | E189: 4 | F189: 1 | G189: 5 | H189: 2 | I189: player_exp | J189: 14 | K189: money | L189: 140
A190: 2008 | B190: 1-5 | C190: houtuling | D190: reinforce_amr | E190: 4 | F190: 1 | G190: 5 | H190: 2 | I190: player_exp | J190: 14 | K190: money | L190: 140
A191: 2009 | B191: 1-5 | C191: houtuling | D191: reinforce_amr | E191: 4 | F191: 1 | G191: 5 | H191: 2 | I191: player_exp | J191: 14 | K191: money | L191: 140
A192: 2010 | B192: 1-5 | C192: houtuling | D192: reinforce_amr | E192: 4 | F192: 1 | G192: 5 | H192: 2 | I192: player_exp | J192: 14 | K192: money | L192: 140
A193: 2011 | B193: 1-5 | C193: houtuling | D193: reinforce_amr | E193: 4 | F193: 1 | G193: 5 | H193: 2 | I193: player_exp | J193: 14 | K193: money | L193: 140
A194: 2012 | B194: 1-5 | C194: houtuling | D194: reinforce_amr | E194: 4 | F194: 1 | G194: 5 | H194: 2 | I194: player_exp | J194: 14 | K194: money | L194: 140
A195: 2013 | B195: 1-5 | C195: houtuling | D195: reinforce_amr | E195: 5 | F195: 1 | G195: 5 | H195: 3 | I195: player_exp | J195: 18 | K195: money | L195: 180
A196: 2014 | B196: 1-5 | C196: houtuling | D196: reinforce_amr | E196: 5 | F196: 1 | G196: 5 | H196: 3 | I196: player_exp | J196: 18 | K196: money | L196: 180
A197: 2015 | B197: 1-5 | C197: houtuling | D197: reinforce_amr | E197: 5 | F197: 1 | G197: 5 | H197: 3 | I197: player_exp | J197: 18 | K197: money | L197: 180
A198: 2016 | B198: 1-5 | C198: houtuling | D198: reinforce_amr | E198: 5 | F198: 1 | G198: 5 | H198: 3 | I198: player_exp | J198: 18 | K198: money | L198: 180
A199: 2017 | B199: 6-10 | C199: houtuling | D199: reinforce_amr | E199: 5 | F199: 1 | G199: 5 | H199: 1 | I199: player_exp | J199: 20 | K199: money | L199: 200
A200: 2018 | B200: 6-10 | C200: houtuling | D200: reinforce_amr | E200: 5 | F200: 1 | G200: 5 | H200: 1 | I200: player_exp | J200: 20 | K200: money | L200: 200
A201: 2019 | B201: 6-10 | C201: houtuling | D201: reinforce_amr | E201: 5 | F201: 1 | G201: 5 | H201: 1 | I201: player_exp | J201: 20 | K201: money | L201: 200
A202: 2020 | B202: 6-10 | C202: houtuling | D202: reinforce_amr | E202: 5 | F202: 1 | G202: 5 | H202: 1 | I202: player_exp | J202: 20 | K202: money | L202: 200
A203: 2021 | B203: 6-10 | C203: houtuling | D203: reinforce_amr | E203: 5 | F203: 1 | G203: 5 | H203: 1 | I203: player_exp | J203: 20 | K203: money | L203: 200
A204: 2022 | B204: 6-10 | C204: houtuling | D204: reinforce_amr | E204: =R[-16]C -> 4 | F204: 1 | G204: 5 | H204: 2 | I204: player_exp | J204: 24 | K204: money | L204: 240
A205: 2023 | B205: 6-10 | C205: houtuling | D205: reinforce_amr | E205: =R[-16]C -> 4 | F205: 1 | G205: 5 | H205: 2 | I205: player_exp | J205: 24 | K205: money | L205: 240
A206: 2024 | B206: 6-10 | C206: houtuling | D206: reinforce_amr | E206: =R[-16]C -> 4 | F206: 1 | G206: 5 | H206: 2 | I206: player_exp | J206: 24 | K206: money | L206: 240
A207: 2025 | B207: 6-10 | C207: houtuling | D207: reinforce_amr | E207: =R[-16]C -> 4 | F207: 1 | G207: 5 | H207: 2 | I207: player_exp | J207: 24 | K207: money | L207: 240
A208: 2026 | B208: 6-10 | C208: houtuling | D208: reinforce_amr | E208: =R[-16]C -> 4 | F208: 1 | G208: 5 | H208: 2 | I208: player_exp | J208: 24 | K208: money | L208: 240
A209: 2027 | B209: 6-10 | C209: houtuling | D209: reinforce_amr | E209: =R[-16]C -> 4 | F209: 1 | G209: 5 | H209: 2 | I209: player_exp | J209: 24 | K209: money | L209: 240
A210: 2028 | B210: 6-10 | C210: houtuling | D210: reinforce_amr | E210: =R[-16]C -> 4 | F210: 1 | G210: 5 | H210: 2 | I210: player_exp | J210: 24 | K210: money | L210: 240
A211: 2029 | B211: 6-10 | C211: houtuling | D211: reinforce_amr | E211: =R[-16]C -> 5 | F211: 1 | G211: 5 | H211: 3 | I211: player_exp | J211: 28 | K211: money | L211: 280
A212: 2030 | B212: 6-10 | C212: houtuling | D212: reinforce_amr | E212: =R[-16]C -> 5 | F212: 1 | G212: 5 | H212: 3 | I212: player_exp | J212: 28 | K212: money | L212: 280
A213: 2031 | B213: 6-10 | C213: houtuling | D213: reinforce_amr | E213: =R[-16]C -> 5 | F213: 1 | G213: 5 | H213: 3 | I213: player_exp | J213: 28 | K213: money | L213: 280
A214: 2032 | B214: 6-10 | C214: houtuling | D214: reinforce_amr | E214: =R[-16]C -> 5 | F214: 1 | G214: 5 | H214: 3 | I214: player_exp | J214: 28 | K214: money | L214: 280
A215: 2033 | B215: 11-15 | C215: houtuling | D215: reinforce_amr | E215: =R[-16]C -> 5 | F215: 1 | G215: 5 | H215: 1 | I215: player_exp | J215: 30 | K215: money | L215: 300
A216: 2034 | B216: 11-15 | C216: houtuling | D216: reinforce_amr | E216: =R[-16]C -> 5 | F216: 1 | G216: 5 | H216: 1 | I216: player_exp | J216: 30 | K216: money | L216: 300
A217: 2035 | B217: 11-15 | C217: houtuling | D217: reinforce_amr | E217: =R[-16]C -> 5 | F217: 1 | G217: 5 | H217: 1 | I217: player_exp | J217: 30 | K217: money | L217: 300
A218: 2036 | B218: 11-15 | C218: houtuling | D218: reinforce_amr | E218: =R[-16]C -> 5 | F218: 1 | G218: 5 | H218: 1 | I218: player_exp | J218: 30 | K218: money | L218: 300
A219: 2037 | B219: 11-15 | C219: houtuling | D219: reinforce_amr | E219: =R[-16]C -> 5 | F219: 1 | G219: 5 | H219: 1 | I219: player_exp | J219: 30 | K219: money | L219: 300
A220: 2038 | B220: 11-15 | C220: houtuling | D220: reinforce_amr | E220: =R[-16]C -> 4 | F220: 1 | G220: 5 | H220: 2 | I220: player_exp | J220: 34 | K220: money | L220: 340
A221: 2039 | B221: 11-15 | C221: houtuling | D221: reinforce_amr | E221: =R[-16]C -> 4 | F221: 1 | G221: 5 | H221: 2 | I221: player_exp | J221: 34 | K221: money | L221: 340
A222: 2040 | B222: 11-15 | C222: houtuling | D222: reinforce_amr | E222: =R[-16]C -> 4 | F222: 1 | G222: 5 | H222: 2 | I222: player_exp | J222: 34 | K222: money | L222: 340
A223: 2041 | B223: 11-15 | C223: houtuling | D223: reinforce_amr | E223: =R[-16]C -> 4 | F223: 1 | G223: 5 | H223: 2 | I223: player_exp | J223: 34 | K223: money | L223: 340
A224: 2042 | B224: 11-15 | C224: houtuling | D224: reinforce_amr | E224: =R[-16]C -> 4 | F224: 1 | G224: 5 | H224: 2 | I224: player_exp | J224: 34 | K224: money | L224: 340
A225: 2043 | B225: 11-15 | C225: houtuling | D225: reinforce_amr | E225: =R[-16]C -> 4 | F225: 1 | G225: 5 | H225: 2 | I225: player_exp | J225: 34 | K225: money | L225: 340
A226: 2044 | B226: 11-15 | C226: houtuling | D226: reinforce_amr | E226: =R[-16]C -> 4 | F226: 1 | G226: 5 | H226: 2 | I226: player_exp | J226: 34 | K226: money | L226: 340
A227: 2045 | B227: 11-15 | C227: houtuling | D227: reinforce_amr | E227: =R[-16]C -> 5 | F227: 1 | G227: 5 | H227: 3 | I227: player_exp | J227: 38 | K227: money | L227: 380
A228: 2046 | B228: 11-15 | C228: houtuling | D228: reinforce_amr | E228: =R[-16]C -> 5 | F228: 1 | G228: 5 | H228: 3 | I228: player_exp | J228: 38 | K228: money | L228: 380
A229: 2047 | B229: 11-15 | C229: houtuling | D229: reinforce_amr | E229: =R[-16]C -> 5 | F229: 1 | G229: 5 | H229: 3 | I229: player_exp | J229: 38 | K229: money | L229: 380
A230: 2048 | B230: 11-15 | C230: houtuling | D230: reinforce_amr | E230: =R[-16]C -> 5 | F230: 1 | G230: 5 | H230: 3 | I230: player_exp | J230: 38 | K230: money | L230: 380
A231: 2049 | B231: 16-20 | C231: houtuling | D231: reinforce_amr | E231: =R[-16]C -> 5 | F231: 1 | G231: 5 | H231: 1 | I231: player_exp | J231: 40 | K231: money | L231: 400
A232: 2050 | B232: 16-20 | C232: houtuling | D232: reinforce_amr | E232: =R[-16]C -> 5 | F232: 1 | G232: 5 | H232: 1 | I232: player_exp | J232: 40 | K232: money | L232: 400
A233: 2051 | B233: 16-20 | C233: houtuling | D233: reinforce_amr | E233: =R[-16]C -> 5 | F233: 1 | G233: 5 | H233: 1 | I233: player_exp | J233: 40 | K233: money | L233: 400
A234: 2052 | B234: 16-20 | C234: houtuling | D234: reinforce_amr | E234: =R[-16]C -> 5 | F234: 1 | G234: 5 | H234: 1 | I234: player_exp | J234: 40 | K234: money | L234: 400
A235: 2053 | B235: 16-20 | C235: houtuling | D235: reinforce_amr | E235: =R[-16]C -> 5 | F235: 1 | G235: 5 | H235: 1 | I235: player_exp | J235: 40 | K235: money | L235: 400
A236: 2054 | B236: 16-20 | C236: houtuling | D236: reinforce_amr | E236: =R[-16]C -> 4 | F236: 1 | G236: 5 | H236: 2 | I236: player_exp | J236: 44 | K236: money | L236: 440
A237: 2055 | B237: 16-20 | C237: houtuling | D237: reinforce_amr | E237: =R[-16]C -> 4 | F237: 1 | G237: 5 | H237: 2 | I237: player_exp | J237: 44 | K237: money | L237: 440
A238: 2056 | B238: 16-20 | C238: houtuling | D238: reinforce_amr | E238: =R[-16]C -> 4 | F238: 1 | G238: 5 | H238: 2 | I238: player_exp | J238: 44 | K238: money | L238: 440
A239: 2057 | B239: 16-20 | C239: houtuling | D239: reinforce_amr | E239: =R[-16]C -> 4 | F239: 1 | G239: 5 | H239: 2 | I239: player_exp | J239: 44 | K239: money | L239: 440
A240: 2058 | B240: 16-20 | C240: houtuling | D240: reinforce_amr | E240: =R[-16]C -> 4 | F240: 1 | G240: 5 | H240: 2 | I240: player_exp | J240: 44 | K240: money | L240: 440
A241: 2059 | B241: 16-20 | C241: houtuling | D241: reinforce_amr | E241: =R[-16]C -> 4 | F241: 1 | G241: 5 | H241: 2 | I241: player_exp | J241: 44 | K241: money | L241: 440
A242: 2060 | B242: 16-20 | C242: houtuling | D242: reinforce_amr | E242: =R[-16]C -> 4 | F242: 1 | G242: 5 | H242: 2 | I242: player_exp | J242: 44 | K242: money | L242: 440
A243: 2061 | B243: 16-20 | C243: houtuling | D243: reinforce_amr | E243: =R[-16]C -> 5 | F243: 1 | G243: 5 | H243: 3 | I243: player_exp | J243: 48 | K243: money | L243: 480
A244: 2062 | B244: 16-20 | C244: houtuling | D244: reinforce_amr | E244: =R[-16]C -> 5 | F244: 1 | G244: 5 | H244: 3 | I244: player_exp | J244: 48 | K244: money | L244: 480
A245: 2063 | B245: 16-20 | C245: houtuling | D245: reinforce_amr | E245: =R[-16]C -> 5 | F245: 1 | G245: 5 | H245: 3 | I245: player_exp | J245: 48 | K245: money | L245: 480
A246: 2064 | B246: 16-20 | C246: houtuling | D246: reinforce_amr | E246: =R[-16]C -> 5 | F246: 1 | G246: 5 | H246: 3 | I246: player_exp | J246: 48 | K246: money | L246: 480
A247: 2065 | B247: 21-25 | C247: houtuling | D247: reinforce_amr | E247: =R[-16]C -> 5 | F247: 1 | G247: 5 | H247: 1 | I247: player_exp | J247: 50 | K247: money | L247: 500
A248: 2066 | B248: 21-25 | C248: houtuling | D248: reinforce_amr | E248: =R[-16]C -> 5 | F248: 1 | G248: 5 | H248: 1 | I248: player_exp | J248: 50 | K248: money | L248: 500
A249: 2067 | B249: 21-25 | C249: houtuling | D249: reinforce_amr | E249: =R[-16]C -> 5 | F249: 1 | G249: 5 | H249: 1 | I249: player_exp | J249: 50 | K249: money | L249: 500
A250: 2068 | B250: 21-25 | C250: houtuling | D250: reinforce_amr | E250: =R[-16]C -> 5 | F250: 1 | G250: 5 | H250: 1 | I250: player_exp | J250: 50 | K250: money | L250: 500
A251: 2069 | B251: 21-25 | C251: houtuling | D251: reinforce_amr | E251: =R[-16]C -> 5 | F251: 1 | G251: 5 | H251: 1 | I251: player_exp | J251: 50 | K251: money | L251: 500
A252: 2070 | B252: 21-25 | C252: houtuling | D252: reinforce_amr | E252: =R[-16]C -> 4 | F252: 1 | G252: 5 | H252: 2 | I252: player_exp | J252: 54 | K252: money | L252: 540
A253: 2071 | B253: 21-25 | C253: houtuling | D253: reinforce_amr | E253: =R[-16]C -> 4 | F253: 1 | G253: 5 | H253: 2 | I253: player_exp | J253: 54 | K253: money | L253: 540
A254: 2072 | B254: 21-25 | C254: houtuling | D254: reinforce_amr | E254: =R[-16]C -> 4 | F254: 1 | G254: 5 | H254: 2 | I254: player_exp | J254: 54 | K254: money | L254: 540
A255: 2073 | B255: 21-25 | C255: houtuling | D255: reinforce_amr | E255: =R[-16]C -> 4 | F255: 1 | G255: 5 | H255: 2 | I255: player_exp | J255: 54 | K255: money | L255: 540
A256: 2074 | B256: 21-25 | C256: houtuling | D256: reinforce_amr | E256: =R[-16]C -> 4 | F256: 1 | G256: 5 | H256: 2 | I256: player_exp | J256: 54 | K256: money | L256: 540
A257: 2075 | B257: 21-25 | C257: houtuling | D257: reinforce_amr | E257: =R[-16]C -> 4 | F257: 1 | G257: 5 | H257: 2 | I257: player_exp | J257: 54 | K257: money | L257: 540
A258: 2076 | B258: 21-25 | C258: houtuling | D258: reinforce_amr | E258: =R[-16]C -> 4 | F258: 1 | G258: 5 | H258: 2 | I258: player_exp | J258: 54 | K258: money | L258: 540
A259: 2077 | B259: 21-25 | C259: houtuling | D259: reinforce_amr | E259: =R[-16]C -> 5 | F259: 1 | G259: 5 | H259: 3 | I259: player_exp | J259: 58 | K259: money | L259: 580
A260: 2078 | B260: 21-25 | C260: houtuling | D260: reinforce_amr | E260: =R[-16]C -> 5 | F260: 1 | G260: 5 | H260: 3 | I260: player_exp | J260: 58 | K260: money | L260: 580
A261: 2079 | B261: 21-25 | C261: houtuling | D261: reinforce_amr | E261: =R[-16]C -> 5 | F261: 1 | G261: 5 | H261: 3 | I261: player_exp | J261: 58 | K261: money | L261: 580
A262: 2080 | B262: 21-25 | C262: houtuling | D262: reinforce_amr | E262: =R[-16]C -> 5 | F262: 1 | G262: 5 | H262: 3 | I262: player_exp | J262: 58 | K262: money | L262: 580
A263: 2081 | B263: 26-30 | C263: houtuling | D263: reinforce_amr | E263: =R[-16]C -> 5 | F263: 1 | G263: 5 | H263: 1 | I263: player_exp | J263: 60 | K263: money | L263: 600
A264: 2082 | B264: 26-30 | C264: houtuling | D264: reinforce_amr | E264: =R[-16]C -> 5 | F264: 1 | G264: 5 | H264: 1 | I264: player_exp | J264: 60 | K264: money | L264: 600
A265: 2083 | B265: 26-30 | C265: houtuling | D265: reinforce_amr | E265: =R[-16]C -> 5 | F265: 1 | G265: 5 | H265: 1 | I265: player_exp | J265: 60 | K265: money | L265: 600
A266: 2084 | B266: 26-30 | C266: houtuling | D266: reinforce_amr | E266: =R[-16]C -> 5 | F266: 1 | G266: 5 | H266: 1 | I266: player_exp | J266: 60 | K266: money | L266: 600
A267: 2085 | B267: 26-30 | C267: houtuling | D267: reinforce_amr | E267: =R[-16]C -> 5 | F267: 1 | G267: 5 | H267: 1 | I267: player_exp | J267: 60 | K267: money | L267: 600
A268: 2086 | B268: 26-30 | C268: houtuling | D268: reinforce_amr | E268: =R[-16]C -> 4 | F268: 1 | G268: 5 | H268: 2 | I268: player_exp | J268: 64 | K268: money | L268: 640
A269: 2087 | B269: 26-30 | C269: houtuling | D269: reinforce_amr | E269: =R[-16]C -> 4 | F269: 1 | G269: 5 | H269: 2 | I269: player_exp | J269: 64 | K269: money | L269: 640
A270: 2088 | B270: 26-30 | C270: houtuling | D270: reinforce_amr | E270: =R[-16]C -> 4 | F270: 1 | G270: 5 | H270: 2 | I270: player_exp | J270: 64 | K270: money | L270: 640
A271: 2089 | B271: 26-30 | C271: houtuling | D271: reinforce_amr | E271: =R[-16]C -> 4 | F271: 1 | G271: 5 | H271: 2 | I271: player_exp | J271: 64 | K271: money | L271: 640
A272: 2090 | B272: 26-30 | C272: houtuling | D272: reinforce_amr | E272: =R[-16]C -> 4 | F272: 1 | G272: 5 | H272: 2 | I272: player_exp | J272: 64 | K272: money | L272: 640
A273: 2091 | B273: 26-30 | C273: houtuling | D273: reinforce_amr | E273: =R[-16]C -> 4 | F273: 1 | G273: 5 | H273: 2 | I273: player_exp | J273: 64 | K273: money | L273: 640
A274: 2092 | B274: 26-30 | C274: houtuling | D274: reinforce_amr | E274: =R[-16]C -> 4 | F274: 1 | G274: 5 | H274: 2 | I274: player_exp | J274: 64 | K274: money | L274: 640
A275: 2093 | B275: 26-30 | C275: houtuling | D275: reinforce_amr | E275: =R[-16]C -> 5 | F275: 1 | G275: 5 | H275: 3 | I275: player_exp | J275: 68 | K275: money | L275: 680
A276: 2094 | B276: 26-30 | C276: houtuling | D276: reinforce_amr | E276: =R[-16]C -> 5 | F276: 1 | G276: 5 | H276: 3 | I276: player_exp | J276: 68 | K276: money | L276: 680
A277: 2095 | B277: 26-30 | C277: houtuling | D277: reinforce_amr | E277: =R[-16]C -> 5 | F277: 1 | G277: 5 | H277: 3 | I277: player_exp | J277: 68 | K277: money | L277: 680
A278: 2096 | B278: 26-30 | C278: houtuling | D278: reinforce_amr | E278: =R[-16]C -> 5 | F278: 1 | G278: 5 | H278: 3 | I278: player_exp | J278: 68 | K278: money | L278: 680
A279: 2097 | B279: 31-35 | C279: houtuling | D279: reinforce_amr | E279: =R[-16]C -> 5 | F279: 1 | G279: 5 | H279: 1 | I279: player_exp | J279: 70 | K279: money | L279: 700
A280: 2098 | B280: 31-35 | C280: houtuling | D280: reinforce_amr | E280: =R[-16]C -> 5 | F280: 1 | G280: 5 | H280: 1 | I280: player_exp | J280: 70 | K280: money | L280: 700
A281: 2099 | B281: 31-35 | C281: houtuling | D281: reinforce_amr | E281: =R[-16]C -> 5 | F281: 1 | G281: 5 | H281: 1 | I281: player_exp | J281: 70 | K281: money | L281: 700
A282: 2100 | B282: 31-35 | C282: houtuling | D282: reinforce_amr | E282: =R[-16]C -> 5 | F282: 1 | G282: 5 | H282: 1 | I282: player_exp | J282: 70 | K282: money | L282: 700
A283: 2101 | B283: 31-35 | C283: houtuling | D283: reinforce_amr | E283: =R[-16]C -> 5 | F283: 1 | G283: 5 | H283: 1 | I283: player_exp | J283: 70 | K283: money | L283: 700
A284: 2102 | B284: 31-35 | C284: houtuling | D284: reinforce_amr | E284: =R[-16]C -> 4 | F284: 1 | G284: 5 | H284: 2 | I284: player_exp | J284: 74 | K284: money | L284: 740
A285: 2103 | B285: 31-35 | C285: houtuling | D285: reinforce_amr | E285: =R[-16]C -> 4 | F285: 1 | G285: 5 | H285: 2 | I285: player_exp | J285: 74 | K285: money | L285: 740
A286: 2104 | B286: 31-35 | C286: houtuling | D286: reinforce_amr | E286: =R[-16]C -> 4 | F286: 1 | G286: 5 | H286: 2 | I286: player_exp | J286: 74 | K286: money | L286: 740
A287: 2105 | B287: 31-35 | C287: houtuling | D287: reinforce_amr | E287: =R[-16]C -> 4 | F287: 1 | G287: 5 | H287: 2 | I287: player_exp | J287: 74 | K287: money | L287: 740
A288: 2106 | B288: 31-35 | C288: houtuling | D288: reinforce_amr | E288: =R[-16]C -> 4 | F288: 1 | G288: 5 | H288: 2 | I288: player_exp | J288: 74 | K288: money | L288: 740
A289: 2107 | B289: 31-35 | C289: houtuling | D289: reinforce_amr | E289: =R[-16]C -> 4 | F289: 1 | G289: 5 | H289: 2 | I289: player_exp | J289: 74 | K289: money | L289: 740
A290: 2108 | B290: 31-35 | C290: houtuling | D290: reinforce_amr | E290: =R[-16]C -> 4 | F290: 1 | G290: 5 | H290: 2 | I290: player_exp | J290: 74 | K290: money | L290: 740
A291: 2109 | B291: 31-35 | C291: houtuling | D291: reinforce_amr | E291: =R[-16]C -> 5 | F291: 1 | G291: 5 | H291: 3 | I291: player_exp | J291: 78 | K291: money | L291: 780
A292: 2110 | B292: 31-35 | C292: houtuling | D292: reinforce_amr | E292: =R[-16]C -> 5 | F292: 1 | G292: 5 | H292: 3 | I292: player_exp | J292: 78 | K292: money | L292: 780
A293: 2111 | B293: 31-35 | C293: houtuling | D293: reinforce_amr | E293: =R[-16]C -> 5 | F293: 1 | G293: 5 | H293: 3 | I293: player_exp | J293: 78 | K293: money | L293: 780
A294: 2112 | B294: 31-35 | C294: houtuling | D294: reinforce_amr | E294: =R[-16]C -> 5 | F294: 1 | G294: 5 | H294: 3 | I294: player_exp | J294: 78 | K294: money | L294: 780
A295: 2113 | B295: 36-40 | C295: houtuling | D295: reinforce_amr | E295: =R[-16]C -> 5 | F295: 1 | G295: 5 | H295: 1 | I295: player_exp | J295: 80 | K295: money | L295: 800
A296: 2114 | B296: 36-40 | C296: houtuling | D296: reinforce_amr | E296: =R[-16]C -> 5 | F296: 1 | G296: 5 | H296: 1 | I296: player_exp | J296: 80 | K296: money | L296: 800
A297: 2115 | B297: 36-40 | C297: houtuling | D297: reinforce_amr | E297: =R[-16]C -> 5 | F297: 1 | G297: 5 | H297: 1 | I297: player_exp | J297: 80 | K297: money | L297: 800
A298: 2116 | B298: 36-40 | C298: houtuling | D298: reinforce_amr | E298: =R[-16]C -> 5 | F298: 1 | G298: 5 | H298: 1 | I298: player_exp | J298: 80 | K298: money | L298: 800
A299: 2117 | B299: 36-40 | C299: houtuling | D299: reinforce_amr | E299: =R[-16]C -> 5 | F299: 1 | G299: 5 | H299: 1 | I299: player_exp | J299: 80 | K299: money | L299: 800
A300: 2118 | B300: 36-40 | C300: houtuling | D300: reinforce_amr | E300: =R[-16]C -> 4 | F300: 1 | G300: 5 | H300: 2 | I300: player_exp | J300: 84 | K300: money | L300: 840
A301: 2119 | B301: 36-40 | C301: houtuling | D301: reinforce_amr | E301: =R[-16]C -> 4 | F301: 1 | G301: 5 | H301: 2 | I301: player_exp | J301: 84 | K301: money | L301: 840
A302: 2120 | B302: 36-40 | C302: houtuling | D302: reinforce_amr | E302: =R[-16]C -> 4 | F302: 1 | G302: 5 | H302: 2 | I302: player_exp | J302: 84 | K302: money | L302: 840
A303: 2121 | B303: 36-40 | C303: houtuling | D303: reinforce_amr | E303: =R[-16]C -> 4 | F303: 1 | G303: 5 | H303: 2 | I303: player_exp | J303: 84 | K303: money | L303: 840
A304: 2122 | B304: 36-40 | C304: houtuling | D304: reinforce_amr | E304: =R[-16]C -> 4 | F304: 1 | G304: 5 | H304: 2 | I304: player_exp | J304: 84 | K304: money | L304: 840
A305: 2123 | B305: 36-40 | C305: houtuling | D305: reinforce_amr | E305: =R[-16]C -> 4 | F305: 1 | G305: 5 | H305: 2 | I305: player_exp | J305: 84 | K305: money | L305: 840
A306: 2124 | B306: 36-40 | C306: houtuling | D306: reinforce_amr | E306: =R[-16]C -> 4 | F306: 1 | G306: 5 | H306: 2 | I306: player_exp | J306: 84 | K306: money | L306: 840
A307: 2125 | B307: 36-40 | C307: houtuling | D307: reinforce_amr | E307: =R[-16]C -> 5 | F307: 1 | G307: 5 | H307: 3 | I307: player_exp | J307: 88 | K307: money | L307: 880
A308: 2126 | B308: 36-40 | C308: houtuling | D308: reinforce_amr | E308: =R[-16]C -> 5 | F308: 1 | G308: 5 | H308: 3 | I308: player_exp | J308: 88 | K308: money | L308: 880
A309: 2127 | B309: 36-40 | C309: houtuling | D309: reinforce_amr | E309: =R[-16]C -> 5 | F309: 1 | G309: 5 | H309: 3 | I309: player_exp | J309: 88 | K309: money | L309: 880
A310: 2128 | B310: 36-40 | C310: houtuling | D310: reinforce_amr | E310: =R[-16]C -> 5 | F310: 1 | G310: 5 | H310: 3 | I310: player_exp | J310: 88 | K310: money | L310: 880
A311: 2129 | B311: 41-45 | C311: houtuling | D311: reinforce_amr | E311: =R[-16]C -> 5 | F311: 1 | G311: 5 | H311: 1 | I311: player_exp | J311: 90 | K311: money | L311: 900
A312: 2130 | B312: 41-45 | C312: houtuling | D312: reinforce_amr | E312: =R[-16]C -> 5 | F312: 1 | G312: 5 | H312: 1 | I312: player_exp | J312: 90 | K312: money | L312: 900
A313: 2131 | B313: 41-45 | C313: houtuling | D313: reinforce_amr | E313: =R[-16]C -> 5 | F313: 1 | G313: 5 | H313: 1 | I313: player_exp | J313: 90 | K313: money | L313: 900
A314: 2132 | B314: 41-45 | C314: houtuling | D314: reinforce_amr | E314: =R[-16]C -> 5 | F314: 1 | G314: 5 | H314: 1 | I314: player_exp | J314: 90 | K314: money | L314: 900
A315: 2133 | B315: 41-45 | C315: houtuling | D315: reinforce_amr | E315: =R[-16]C -> 5 | F315: 1 | G315: 5 | H315: 1 | I315: player_exp | J315: 90 | K315: money | L315: 900
A316: 2134 | B316: 41-45 | C316: houtuling | D316: reinforce_amr | E316: =R[-16]C -> 4 | F316: 1 | G316: 5 | H316: 2 | I316: player_exp | J316: 94 | K316: money | L316: 940
A317: 2135 | B317: 41-45 | C317: houtuling | D317: reinforce_amr | E317: =R[-16]C -> 4 | F317: 1 | G317: 5 | H317: 2 | I317: player_exp | J317: 94 | K317: money | L317: 940
A318: 2136 | B318: 41-45 | C318: houtuling | D318: reinforce_amr | E318: =R[-16]C -> 4 | F318: 1 | G318: 5 | H318: 2 | I318: player_exp | J318: 94 | K318: money | L318: 940
A319: 2137 | B319: 41-45 | C319: houtuling | D319: reinforce_amr | E319: =R[-16]C -> 4 | F319: 1 | G319: 5 | H319: 2 | I319: player_exp | J319: 94 | K319: money | L319: 940
A320: 2138 | B320: 41-45 | C320: houtuling | D320: reinforce_amr | E320: =R[-16]C -> 4 | F320: 1 | G320: 5 | H320: 2 | I320: player_exp | J320: 94 | K320: money | L320: 940
A321: 2139 | B321: 41-45 | C321: houtuling | D321: reinforce_amr | E321: =R[-16]C -> 4 | F321: 1 | G321: 5 | H321: 2 | I321: player_exp | J321: 94 | K321: money | L321: 940
A322: 2140 | B322: 41-45 | C322: houtuling | D322: reinforce_amr | E322: =R[-16]C -> 4 | F322: 1 | G322: 5 | H322: 2 | I322: player_exp | J322: 94 | K322: money | L322: 940
A323: 2141 | B323: 41-45 | C323: houtuling | D323: reinforce_amr | E323: =R[-16]C -> 5 | F323: 1 | G323: 5 | H323: 3 | I323: player_exp | J323: 98 | K323: money | L323: 980
A324: 2142 | B324: 41-45 | C324: houtuling | D324: reinforce_amr | E324: =R[-16]C -> 5 | F324: 1 | G324: 5 | H324: 3 | I324: player_exp | J324: 98 | K324: money | L324: 980
A325: 2143 | B325: 41-45 | C325: houtuling | D325: reinforce_amr | E325: =R[-16]C -> 5 | F325: 1 | G325: 5 | H325: 3 | I325: player_exp | J325: 98 | K325: money | L325: 980
A326: 2144 | B326: 41-45 | C326: houtuling | D326: reinforce_amr | E326: =R[-16]C -> 5 | F326: 1 | G326: 5 | H326: 3 | I326: player_exp | J326: 98 | K326: money | L326: 980
A327: 2145 | B327: 46-50 | C327: houtuling | D327: reinforce_amr | E327: =R[-16]C -> 5 | F327: 1 | G327: 5 | H327: 1 | I327: player_exp | J327: 100 | K327: money | L327: 1000
A328: 2146 | B328: 46-50 | C328: houtuling | D328: reinforce_amr | E328: =R[-16]C -> 5 | F328: 1 | G328: 5 | H328: 1 | I328: player_exp | J328: 100 | K328: money | L328: 1000
A329: 2147 | B329: 46-50 | C329: houtuling | D329: reinforce_amr | E329: =R[-16]C -> 5 | F329: 1 | G329: 5 | H329: 1 | I329: player_exp | J329: 100 | K329: money | L329: 1000
A330: 2148 | B330: 46-50 | C330: houtuling | D330: reinforce_amr | E330: =R[-16]C -> 5 | F330: 1 | G330: 5 | H330: 1 | I330: player_exp | J330: 100 | K330: money | L330: 1000
A331: 2149 | B331: 46-50 | C331: houtuling | D331: reinforce_amr | E331: =R[-16]C -> 5 | F331: 1 | G331: 5 | H331: 1 | I331: player_exp | J331: 100 | K331: money | L331: 1000
A332: 2150 | B332: 46-50 | C332: houtuling | D332: reinforce_amr | E332: =R[-16]C -> 4 | F332: 1 | G332: 5 | H332: 2 | I332: player_exp | J332: 104 | K332: money | L332: 1040
A333: 2151 | B333: 46-50 | C333: houtuling | D333: reinforce_amr | E333: =R[-16]C -> 4 | F333: 1 | G333: 5 | H333: 2 | I333: player_exp | J333: 104 | K333: money | L333: 1040
A334: 2152 | B334: 46-50 | C334: houtuling | D334: reinforce_amr | E334: =R[-16]C -> 4 | F334: 1 | G334: 5 | H334: 2 | I334: player_exp | J334: 104 | K334: money | L334: 1040
A335: 2153 | B335: 46-50 | C335: houtuling | D335: reinforce_amr | E335: =R[-16]C -> 4 | F335: 1 | G335: 5 | H335: 2 | I335: player_exp | J335: 104 | K335: money | L335: 1040
A336: 2154 | B336: 46-50 | C336: houtuling | D336: reinforce_amr | E336: =R[-16]C -> 4 | F336: 1 | G336: 5 | H336: 2 | I336: player_exp | J336: 104 | K336: money | L336: 1040
A337: 2155 | B337: 46-50 | C337: houtuling | D337: reinforce_amr | E337: =R[-16]C -> 4 | F337: 1 | G337: 5 | H337: 2 | I337: player_exp | J337: 104 | K337: money | L337: 1040
A338: 2156 | B338: 46-50 | C338: houtuling | D338: reinforce_amr | E338: =R[-16]C -> 4 | F338: 1 | G338: 5 | H338: 2 | I338: player_exp | J338: 104 | K338: money | L338: 1040
A339: 2157 | B339: 46-50 | C339: houtuling | D339: reinforce_amr | E339: =R[-16]C -> 5 | F339: 1 | G339: 5 | H339: 3 | I339: player_exp | J339: 108 | K339: money | L339: 1080
A340: 2158 | B340: 46-50 | C340: houtuling | D340: reinforce_amr | E340: =R[-16]C -> 5 | F340: 1 | G340: 5 | H340: 3 | I340: player_exp | J340: 108 | K340: money | L340: 1080
A341: 2159 | B341: 46-50 | C341: houtuling | D341: reinforce_amr | E341: =R[-16]C -> 5 | F341: 1 | G341: 5 | H341: 3 | I341: player_exp | J341: 108 | K341: money | L341: 1080
A342: 2160 | B342: 46-50 | C342: houtuling | D342: reinforce_amr | E342: =R[-16]C -> 5 | F342: 1 | G342: 5 | H342: 3 | I342: player_exp | J342: 108 | K342: money | L342: 1080
A343: 2161 | B343: 51-55 | C343: houtuling | D343: reinforce_amr | E343: =R[-16]C -> 5 | F343: 1 | G343: 5 | H343: 1 | I343: player_exp | J343: 110 | K343: money | L343: 1100
A344: 2162 | B344: 51-55 | C344: houtuling | D344: reinforce_amr | E344: =R[-16]C -> 5 | F344: 1 | G344: 5 | H344: 1 | I344: player_exp | J344: 110 | K344: money | L344: 1100
A345: 2163 | B345: 51-55 | C345: houtuling | D345: reinforce_amr | E345: =R[-16]C -> 5 | F345: 1 | G345: 5 | H345: 1 | I345: player_exp | J345: 110 | K345: money | L345: 1100
A346: 2164 | B346: 51-55 | C346: houtuling | D346: reinforce_amr | E346: =R[-16]C -> 5 | F346: 1 | G346: 5 | H346: 1 | I346: player_exp | J346: 110 | K346: money | L346: 1100
A347: 2165 | B347: 51-55 | C347: houtuling | D347: reinforce_amr | E347: =R[-16]C -> 5 | F347: 1 | G347: 5 | H347: 1 | I347: player_exp | J347: 110 | K347: money | L347: 1100
A348: 2166 | B348: 51-55 | C348: houtuling | D348: reinforce_amr | E348: =R[-16]C -> 4 | F348: 1 | G348: 5 | H348: 2 | I348: player_exp | J348: 114 | K348: money | L348: 1140
A349: 2167 | B349: 51-55 | C349: houtuling | D349: reinforce_amr | E349: =R[-16]C -> 4 | F349: 1 | G349: 5 | H349: 2 | I349: player_exp | J349: 114 | K349: money | L349: 1140
A350: 2168 | B350: 51-55 | C350: houtuling | D350: reinforce_amr | E350: =R[-16]C -> 4 | F350: 1 | G350: 5 | H350: 2 | I350: player_exp | J350: 114 | K350: money | L350: 1140
A351: 2169 | B351: 51-55 | C351: houtuling | D351: reinforce_amr | E351: =R[-16]C -> 4 | F351: 1 | G351: 5 | H351: 2 | I351: player_exp | J351: 114 | K351: money | L351: 1140
A352: 2170 | B352: 51-55 | C352: houtuling | D352: reinforce_amr | E352: =R[-16]C -> 4 | F352: 1 | G352: 5 | H352: 2 | I352: player_exp | J352: 114 | K352: money | L352: 1140
A353: 2171 | B353: 51-55 | C353: houtuling | D353: reinforce_amr | E353: =R[-16]C -> 4 | F353: 1 | G353: 5 | H353: 2 | I353: player_exp | J353: 114 | K353: money | L353: 1140
A354: 2172 | B354: 51-55 | C354: houtuling | D354: reinforce_amr | E354: =R[-16]C -> 4 | F354: 1 | G354: 5 | H354: 2 | I354: player_exp | J354: 114 | K354: money | L354: 1140
A355: 2173 | B355: 51-55 | C355: houtuling | D355: reinforce_amr | E355: =R[-16]C -> 5 | F355: 1 | G355: 5 | H355: 3 | I355: player_exp | J355: 118 | K355: money | L355: 1180
A356: 2174 | B356: 51-55 | C356: houtuling | D356: reinforce_amr | E356: =R[-16]C -> 5 | F356: 1 | G356: 5 | H356: 3 | I356: player_exp | J356: 118 | K356: money | L356: 1180
A357: 2175 | B357: 51-55 | C357: houtuling | D357: reinforce_amr | E357: =R[-16]C -> 5 | F357: 1 | G357: 5 | H357: 3 | I357: player_exp | J357: 118 | K357: money | L357: 1180
A358: 2176 | B358: 51-55 | C358: houtuling | D358: reinforce_amr | E358: =R[-16]C -> 5 | F358: 1 | G358: 5 | H358: 3 | I358: player_exp | J358: 118 | K358: money | L358: 1180
A359: 2177 | B359: 56-60 | C359: houtuling | D359: reinforce_amr | E359: =R[-16]C -> 5 | F359: 1 | G359: 5 | H359: 1 | I359: player_exp | J359: 120 | K359: money | L359: 1200
A360: 2178 | B360: 56-60 | C360: houtuling | D360: reinforce_amr | E360: =R[-16]C -> 5 | F360: 1 | G360: 5 | H360: 1 | I360: player_exp | J360: 120 | K360: money | L360: 1200
A361: 2179 | B361: 56-60 | C361: houtuling | D361: reinforce_amr | E361: =R[-16]C -> 5 | F361: 1 | G361: 5 | H361: 1 | I361: player_exp | J361: 120 | K361: money | L361: 1200
A362: 2180 | B362: 56-60 | C362: houtuling | D362: reinforce_amr | E362: =R[-16]C -> 5 | F362: 1 | G362: 5 | H362: 1 | I362: player_exp | J362: 120 | K362: money | L362: 1200
A363: 2181 | B363: 56-60 | C363: houtuling | D363: reinforce_amr | E363: =R[-16]C -> 5 | F363: 1 | G363: 5 | H363: 1 | I363: player_exp | J363: 120 | K363: money | L363: 1200
A364: 2182 | B364: 56-60 | C364: houtuling | D364: reinforce_amr | E364: =R[-16]C -> 4 | F364: 1 | G364: 5 | H364: 2 | I364: player_exp | J364: 124 | K364: money | L364: 1240
A365: 2183 | B365: 56-60 | C365: houtuling | D365: reinforce_amr | E365: =R[-16]C -> 4 | F365: 1 | G365: 5 | H365: 2 | I365: player_exp | J365: 124 | K365: money | L365: 1240
A366: 2184 | B366: 56-60 | C366: houtuling | D366: reinforce_amr | E366: =R[-16]C -> 4 | F366: 1 | G366: 5 | H366: 2 | I366: player_exp | J366: 124 | K366: money | L366: 1240
A367: 2185 | B367: 56-60 | C367: houtuling | D367: reinforce_amr | E367: =R[-16]C -> 4 | F367: 1 | G367: 5 | H367: 2 | I367: player_exp | J367: 124 | K367: money | L367: 1240
A368: 2186 | B368: 56-60 | C368: houtuling | D368: reinforce_amr | E368: =R[-16]C -> 4 | F368: 1 | G368: 5 | H368: 2 | I368: player_exp | J368: 124 | K368: money | L368: 1240
A369: 2187 | B369: 56-60 | C369: houtuling | D369: reinforce_amr | E369: =R[-16]C -> 4 | F369: 1 | G369: 5 | H369: 2 | I369: player_exp | J369: 124 | K369: money | L369: 1240
A370: 2188 | B370: 56-60 | C370: houtuling | D370: reinforce_amr | E370: =R[-16]C -> 4 | F370: 1 | G370: 5 | H370: 2 | I370: player_exp | J370: 124 | K370: money | L370: 1240
A371: 2189 | B371: 56-60 | C371: houtuling | D371: reinforce_amr | E371: =R[-16]C -> 5 | F371: 1 | G371: 5 | H371: 3 | I371: player_exp | J371: 128 | K371: money | L371: 1280
A372: 2190 | B372: 56-60 | C372: houtuling | D372: reinforce_amr | E372: =R[-16]C -> 5 | F372: 1 | G372: 5 | H372: 3 | I372: player_exp | J372: 128 | K372: money | L372: 1280
A373: 2191 | B373: 56-60 | C373: houtuling | D373: reinforce_amr | E373: =R[-16]C -> 5 | F373: 1 | G373: 5 | H373: 3 | I373: player_exp | J373: 128 | K373: money | L373: 1280
A374: 2192 | B374: 56-60 | C374: houtuling | D374: reinforce_amr | E374: =R[-16]C -> 5 | F374: 1 | G374: 5 | H374: 3 | I374: player_exp | J374: 128 | K374: money | L374: 1280
A375: 3001 | B375: 1-5 | C375: jumuling | D375: pay_coin | E375: 1 | F375: 1 | G375: 5 | H375: 1 | I375: player_exp | J375: 10 | K375: money | L375: 100
A376: 3002 | B376: 1-5 | C376: jumuling | D376: pay_coin | E376: 1 | F376: 1 | G376: 5 | H376: 1 | I376: player_exp | J376: 10 | K376: money | L376: 100
A377: 3003 | B377: 1-5 | C377: jumuling | D377: pay_coin | E377: 1 | F377: 1 | G377: 5 | H377: 1 | I377: player_exp | J377: 10 | K377: money | L377: 100
A378: 3004 | B378: 1-5 | C378: jumuling | D378: pay_coin | E378: 1 | F378: 1 | G378: 5 | H378: 1 | I378: player_exp | J378: 10 | K378: money | L378: 100
A379: 3005 | B379: 1-5 | C379: jumuling | D379: pay_coin | E379: 1 | F379: 1 | G379: 5 | H379: 1 | I379: player_exp | J379: 10 | K379: money | L379: 100
A380: 3006 | B380: 1-5 | C380: jumuling | D380: pay_coin | E380: 2 | F380: 1 | G380: 5 | H380: 2 | I380: player_exp | J380: 14 | K380: money | L380: 140
A381: 3007 | B381: 1-5 | C381: jumuling | D381: pay_coin | E381: 2 | F381: 1 | G381: 5 | H381: 2 | I381: player_exp | J381: 14 | K381: money | L381: 140
A382: 3008 | B382: 1-5 | C382: jumuling | D382: pay_coin | E382: 2 | F382: 1 | G382: 5 | H382: 2 | I382: player_exp | J382: 14 | K382: money | L382: 140
A383: 3009 | B383: 1-5 | C383: jumuling | D383: pay_coin | E383: 2 | F383: 1 | G383: 5 | H383: 2 | I383: player_exp | J383: 14 | K383: money | L383: 140
A384: 3010 | B384: 1-5 | C384: jumuling | D384: pay_coin | E384: 2 | F384: 1 | G384: 5 | H384: 2 | I384: player_exp | J384: 14 | K384: money | L384: 140
A385: 3011 | B385: 1-5 | C385: jumuling | D385: pay_coin | E385: 2 | F385: 1 | G385: 5 | H385: 2 | I385: player_exp | J385: 14 | K385: money | L385: 140
A386: 3012 | B386: 1-5 | C386: jumuling | D386: pay_coin | E386: 2 | F386: 1 | G386: 5 | H386: 2 | I386: player_exp | J386: 14 | K386: money | L386: 140
A387: 3013 | B387: 1-5 | C387: jumuling | D387: pay_coin | E387: 3 | F387: 1 | G387: 5 | H387: 3 | I387: player_exp | J387: 18 | K387: money | L387: 180
A388: 3014 | B388: 1-5 | C388: jumuling | D388: pay_coin | E388: 3 | F388: 1 | G388: 5 | H388: 3 | I388: player_exp | J388: 18 | K388: money | L388: 180
A389: 3015 | B389: 1-5 | C389: jumuling | D389: pay_coin | E389: 3 | F389: 1 | G389: 5 | H389: 3 | I389: player_exp | J389: 18 | K389: money | L389: 180
A390: 3016 | B390: 1-5 | C390: jumuling | D390: pay_coin | E390: 3 | F390: 1 | G390: 5 | H390: 3 | I390: player_exp | J390: 18 | K390: money | L390: 180
A391: 3017 | B391: 6-10 | C391: jumuling | D391: pay_coin | E391: =R[-16]C -> 1 | F391: 1 | G391: 5 | H391: 1 | I391: player_exp | J391: 20 | K391: money | L391: 200
A392: 3018 | B392: 6-10 | C392: jumuling | D392: pay_coin | E392: =R[-16]C -> 1 | F392: 1 | G392: 5 | H392: 1 | I392: player_exp | J392: 20 | K392: money | L392: 200
A393: 3019 | B393: 6-10 | C393: jumuling | D393: pay_coin | E393: =R[-16]C -> 1 | F393: 1 | G393: 5 | H393: 1 | I393: player_exp | J393: 20 | K393: money | L393: 200
A394: 3020 | B394: 6-10 | C394: jumuling | D394: pay_coin | E394: =R[-16]C -> 1 | F394: 1 | G394: 5 | H394: 1 | I394: player_exp | J394: 20 | K394: money | L394: 200
A395: 3021 | B395: 6-10 | C395: jumuling | D395: pay_coin | E395: =R[-16]C -> 1 | F395: 1 | G395: 5 | H395: 1 | I395: player_exp | J395: 20 | K395: money | L395: 200
A396: 3022 | B396: 6-10 | C396: jumuling | D396: pay_coin | E396: =R[-16]C -> 2 | F396: 1 | G396: 5 | H396: 2 | I396: player_exp | J396: 24 | K396: money | L396: 240
A397: 3023 | B397: 6-10 | C397: jumuling | D397: pay_coin | E397: =R[-16]C -> 2 | F397: 1 | G397: 5 | H397: 2 | I397: player_exp | J397: 24 | K397: money | L397: 240
A398: 3024 | B398: 6-10 | C398: jumuling | D398: pay_coin | E398: =R[-16]C -> 2 | F398: 1 | G398: 5 | H398: 2 | I398: player_exp | J398: 24 | K398: money | L398: 240
A399: 3025 | B399: 6-10 | C399: jumuling | D399: pay_coin | E399: =R[-16]C -> 2 | F399: 1 | G399: 5 | H399: 2 | I399: player_exp | J399: 24 | K399: money | L399: 240
A400: 3026 | B400: 6-10 | C400: jumuling | D400: pay_coin | E400: =R[-16]C -> 2 | F400: 1 | G400: 5 | H400: 2 | I400: player_exp | J400: 24 | K400: money | L400: 240
A401: 3027 | B401: 6-10 | C401: jumuling | D401: pay_coin | E401: =R[-16]C -> 2 | F401: 1 | G401: 5 | H401: 2 | I401: player_exp | J401: 24 | K401: money | L401: 240
A402: 3028 | B402: 6-10 | C402: jumuling | D402: pay_coin | E402: =R[-16]C -> 2 | F402: 1 | G402: 5 | H402: 2 | I402: player_exp | J402: 24 | K402: money | L402: 240
A403: 3029 | B403: 6-10 | C403: jumuling | D403: pay_coin | E403: =R[-16]C -> 3 | F403: 1 | G403: 5 | H403: 3 | I403: player_exp | J403: 28 | K403: money | L403: 280
A404: 3030 | B404: 6-10 | C404: jumuling | D404: pay_coin | E404: =R[-16]C -> 3 | F404: 1 | G404: 5 | H404: 3 | I404: player_exp | J404: 28 | K404: money | L404: 280
A405: 3031 | B405: 6-10 | C405: jumuling | D405: pay_coin | E405: =R[-16]C -> 3 | F405: 1 | G405: 5 | H405: 3 | I405: player_exp | J405: 28 | K405: money | L405: 280
A406: 3032 | B406: 6-10 | C406: jumuling | D406: pay_coin | E406: =R[-16]C -> 3 | F406: 1 | G406: 5 | H406: 3 | I406: player_exp | J406: 28 | K406: money | L406: 280
A407: 3033 | B407: 11-15 | C407: jumuling | D407: pay_coin | E407: =R[-16]C -> 1 | F407: 1 | G407: 5 | H407: 1 | I407: player_exp | J407: 30 | K407: money | L407: 300
A408: 3034 | B408: 11-15 | C408: jumuling | D408: pay_coin | E408: =R[-16]C -> 1 | F408: 1 | G408: 5 | H408: 1 | I408: player_exp | J408: 30 | K408: money | L408: 300
A409: 3035 | B409: 11-15 | C409: jumuling | D409: pay_coin | E409: =R[-16]C -> 1 | F409: 1 | G409: 5 | H409: 1 | I409: player_exp | J409: 30 | K409: money | L409: 300
A410: 3036 | B410: 11-15 | C410: jumuling | D410: pay_coin | E410: =R[-16]C -> 1 | F410: 1 | G410: 5 | H410: 1 | I410: player_exp | J410: 30 | K410: money | L410: 300
A411: 3037 | B411: 11-15 | C411: jumuling | D411: pay_coin | E411: =R[-16]C -> 1 | F411: 1 | G411: 5 | H411: 1 | I411: player_exp | J411: 30 | K411: money | L411: 300
A412: 3038 | B412: 11-15 | C412: jumuling | D412: pay_coin | E412: =R[-16]C -> 2 | F412: 1 | G412: 5 | H412: 2 | I412: player_exp | J412: 34 | K412: money | L412: 340
A413: 3039 | B413: 11-15 | C413: jumuling | D413: pay_coin | E413: =R[-16]C -> 2 | F413: 1 | G413: 5 | H413: 2 | I413: player_exp | J413: 34 | K413: money | L413: 340
A414: 3040 | B414: 11-15 | C414: jumuling | D414: pay_coin | E414: =R[-16]C -> 2 | F414: 1 | G414: 5 | H414: 2 | I414: player_exp | J414: 34 | K414: money | L414: 340
A415: 3041 | B415: 11-15 | C415: jumuling | D415: pay_coin | E415: =R[-16]C -> 2 | F415: 1 | G415: 5 | H415: 2 | I415: player_exp | J415: 34 | K415: money | L415: 340
A416: 3042 | B416: 11-15 | C416: jumuling | D416: pay_coin | E416: =R[-16]C -> 2 | F416: 1 | G416: 5 | H416: 2 | I416: player_exp | J416: 34 | K416: money | L416: 340
A417: 3043 | B417: 11-15 | C417: jumuling | D417: pay_coin | E417: =R[-16]C -> 2 | F417: 1 | G417: 5 | H417: 2 | I417: player_exp | J417: 34 | K417: money | L417: 340
A418: 3044 | B418: 11-15 | C418: jumuling | D418: pay_coin | E418: =R[-16]C -> 2 | F418: 1 | G418: 5 | H418: 2 | I418: player_exp | J418: 34 | K418: money | L418: 340
A419: 3045 | B419: 11-15 | C419: jumuling | D419: pay_coin | E419: =R[-16]C -> 3 | F419: 1 | G419: 5 | H419: 3 | I419: player_exp | J419: 38 | K419: money | L419: 380
A420: 3046 | B420: 11-15 | C420: jumuling | D420: pay_coin | E420: =R[-16]C -> 3 | F420: 1 | G420: 5 | H420: 3 | I420: player_exp | J420: 38 | K420: money | L420: 380
A421: 3047 | B421: 11-15 | C421: jumuling | D421: pay_coin | E421: =R[-16]C -> 3 | F421: 1 | G421: 5 | H421: 3 | I421: player_exp | J421: 38 | K421: money | L421: 380
A422: 3048 | B422: 11-15 | C422: jumuling | D422: pay_coin | E422: =R[-16]C -> 3 | F422: 1 | G422: 5 | H422: 3 | I422: player_exp | J422: 38 | K422: money | L422: 380
A423: 3049 | B423: 16-20 | C423: jumuling | D423: pay_coin | E423: =R[-16]C -> 1 | F423: 1 | G423: 5 | H423: 1 | I423: player_exp | J423: 40 | K423: money | L423: 400
A424: 3050 | B424: 16-20 | C424: jumuling | D424: pay_coin | E424: =R[-16]C -> 1 | F424: 1 | G424: 5 | H424: 1 | I424: player_exp | J424: 40 | K424: money | L424: 400
A425: 3051 | B425: 16-20 | C425: jumuling | D425: pay_coin | E425: =R[-16]C -> 1 | F425: 1 | G425: 5 | H425: 1 | I425: player_exp | J425: 40 | K425: money | L425: 400
A426: 3052 | B426: 16-20 | C426: jumuling | D426: pay_coin | E426: =R[-16]C -> 1 | F426: 1 | G426: 5 | H426: 1 | I426: player_exp | J426: 40 | K426: money | L426: 400
A427: 3053 | B427: 16-20 | C427: jumuling | D427: pay_coin | E427: =R[-16]C -> 1 | F427: 1 | G427: 5 | H427: 1 | I427: player_exp | J427: 40 | K427: money | L427: 400
A428: 3054 | B428: 16-20 | C428: jumuling | D428: pay_coin | E428: =R[-16]C -> 2 | F428: 1 | G428: 5 | H428: 2 | I428: player_exp | J428: 44 | K428: money | L428: 440
A429: 3055 | B429: 16-20 | C429: jumuling | D429: pay_coin | E429: =R[-16]C -> 2 | F429: 1 | G429: 5 | H429: 2 | I429: player_exp | J429: 44 | K429: money | L429: 440
A430: 3056 | B430: 16-20 | C430: jumuling | D430: pay_coin | E430: =R[-16]C -> 2 | F430: 1 | G430: 5 | H430: 2 | I430: player_exp | J430: 44 | K430: money | L430: 440
A431: 3057 | B431: 16-20 | C431: jumuling | D431: pay_coin | E431: =R[-16]C -> 2 | F431: 1 | G431: 5 | H431: 2 | I431: player_exp | J431: 44 | K431: money | L431: 440
A432: 3058 | B432: 16-20 | C432: jumuling | D432: pay_coin | E432: =R[-16]C -> 2 | F432: 1 | G432: 5 | H432: 2 | I432: player_exp | J432: 44 | K432: money | L432: 440
A433: 3059 | B433: 16-20 | C433: jumuling | D433: pay_coin | E433: =R[-16]C -> 2 | F433: 1 | G433: 5 | H433: 2 | I433: player_exp | J433: 44 | K433: money | L433: 440
A434: 3060 | B434: 16-20 | C434: jumuling | D434: pay_coin | E434: =R[-16]C -> 2 | F434: 1 | G434: 5 | H434: 2 | I434: player_exp | J434: 44 | K434: money | L434: 440
A435: 3061 | B435: 16-20 | C435: jumuling | D435: pay_coin | E435: =R[-16]C -> 3 | F435: 1 | G435: 5 | H435: 3 | I435: player_exp | J435: 48 | K435: money | L435: 480
A436: 3062 | B436: 16-20 | C436: jumuling | D436: pay_coin | E436: =R[-16]C -> 3 | F436: 1 | G436: 5 | H436: 3 | I436: player_exp | J436: 48 | K436: money | L436: 480
A437: 3063 | B437: 16-20 | C437: jumuling | D437: pay_coin | E437: =R[-16]C -> 3 | F437: 1 | G437: 5 | H437: 3 | I437: player_exp | J437: 48 | K437: money | L437: 480
A438: 3064 | B438: 16-20 | C438: jumuling | D438: pay_coin | E438: =R[-16]C -> 3 | F438: 1 | G438: 5 | H438: 3 | I438: player_exp | J438: 48 | K438: money | L438: 480
A439: 3065 | B439: 21-25 | C439: jumuling | D439: pay_coin | E439: =R[-16]C -> 1 | F439: 1 | G439: 5 | H439: 1 | I439: player_exp | J439: 50 | K439: money | L439: 500
A440: 3066 | B440: 21-25 | C440: jumuling | D440: pay_coin | E440: =R[-16]C -> 1 | F440: 1 | G440: 5 | H440: 1 | I440: player_exp | J440: 50 | K440: money | L440: 500
A441: 3067 | B441: 21-25 | C441: jumuling | D441: pay_coin | E441: =R[-16]C -> 1 | F441: 1 | G441: 5 | H441: 1 | I441: player_exp | J441: 50 | K441: money | L441: 500
A442: 3068 | B442: 21-25 | C442: jumuling | D442: pay_coin | E442: =R[-16]C -> 1 | F442: 1 | G442: 5 | H442: 1 | I442: player_exp | J442: 50 | K442: money | L442: 500
A443: 3069 | B443: 21-25 | C443: jumuling | D443: pay_coin | E443: =R[-16]C -> 1 | F443: 1 | G443: 5 | H443: 1 | I443: player_exp | J443: 50 | K443: money | L443: 500
A444: 3070 | B444: 21-25 | C444: jumuling | D444: pay_coin | E444: =R[-16]C -> 2 | F444: 1 | G444: 5 | H444: 2 | I444: player_exp | J444: 54 | K444: money | L444: 540
A445: 3071 | B445: 21-25 | C445: jumuling | D445: pay_coin | E445: =R[-16]C -> 2 | F445: 1 | G445: 5 | H445: 2 | I445: player_exp | J445: 54 | K445: money | L445: 540
A446: 3072 | B446: 21-25 | C446: jumuling | D446: pay_coin | E446: =R[-16]C -> 2 | F446: 1 | G446: 5 | H446: 2 | I446: player_exp | J446: 54 | K446: money | L446: 540
A447: 3073 | B447: 21-25 | C447: jumuling | D447: pay_coin | E447: =R[-16]C -> 2 | F447: 1 | G447: 5 | H447: 2 | I447: player_exp | J447: 54 | K447: money | L447: 540
A448: 3074 | B448: 21-25 | C448: jumuling | D448: pay_coin | E448: =R[-16]C -> 2 | F448: 1 | G448: 5 | H448: 2 | I448: player_exp | J448: 54 | K448: money | L448: 540
A449: 3075 | B449: 21-25 | C449: jumuling | D449: pay_coin | E449: =R[-16]C -> 2 | F449: 1 | G449: 5 | H449: 2 | I449: player_exp | J449: 54 | K449: money | L449: 540
A450: 3076 | B450: 21-25 | C450: jumuling | D450: pay_coin | E450: =R[-16]C -> 2 | F450: 1 | G450: 5 | H450: 2 | I450: player_exp | J450: 54 | K450: money | L450: 540
A451: 3077 | B451: 21-25 | C451: jumuling | D451: pay_coin | E451: =R[-16]C -> 3 | F451: 1 | G451: 5 | H451: 3 | I451: player_exp | J451: 58 | K451: money | L451: 580
A452: 3078 | B452: 21-25 | C452: jumuling | D452: pay_coin | E452: =R[-16]C -> 3 | F452: 1 | G452: 5 | H452: 3 | I452: player_exp | J452: 58 | K452: money | L452: 580
A453: 3079 | B453: 21-25 | C453: jumuling | D453: pay_coin | E453: =R[-16]C -> 3 | F453: 1 | G453: 5 | H453: 3 | I453: player_exp | J453: 58 | K453: money | L453: 580
A454: 3080 | B454: 21-25 | C454: jumuling | D454: pay_coin | E454: =R[-16]C -> 3 | F454: 1 | G454: 5 | H454: 3 | I454: player_exp | J454: 58 | K454: money | L454: 580
A455: 3081 | B455: 26-30 | C455: jumuling | D455: pay_coin | E455: =R[-16]C -> 1 | F455: 1 | G455: 5 | H455: 1 | I455: player_exp | J455: 60 | K455: money | L455: 600
A456: 3082 | B456: 26-30 | C456: jumuling | D456: pay_coin | E456: =R[-16]C -> 1 | F456: 1 | G456: 5 | H456: 1 | I456: player_exp | J456: 60 | K456: money | L456: 600
A457: 3083 | B457: 26-30 | C457: jumuling | D457: pay_coin | E457: =R[-16]C -> 1 | F457: 1 | G457: 5 | H457: 1 | I457: player_exp | J457: 60 | K457: money | L457: 600
A458: 3084 | B458: 26-30 | C458: jumuling | D458: pay_coin | E458: =R[-16]C -> 1 | F458: 1 | G458: 5 | H458: 1 | I458: player_exp | J458: 60 | K458: money | L458: 600
A459: 3085 | B459: 26-30 | C459: jumuling | D459: pay_coin | E459: =R[-16]C -> 1 | F459: 1 | G459: 5 | H459: 1 | I459: player_exp | J459: 60 | K459: money | L459: 600
A460: 3086 | B460: 26-30 | C460: jumuling | D460: pay_coin | E460: =R[-16]C -> 2 | F460: 1 | G460: 5 | H460: 2 | I460: player_exp | J460: 64 | K460: money | L460: 640
A461: 3087 | B461: 26-30 | C461: jumuling | D461: pay_coin | E461: =R[-16]C -> 2 | F461: 1 | G461: 5 | H461: 2 | I461: player_exp | J461: 64 | K461: money | L461: 640
A462: 3088 | B462: 26-30 | C462: jumuling | D462: pay_coin | E462: =R[-16]C -> 2 | F462: 1 | G462: 5 | H462: 2 | I462: player_exp | J462: 64 | K462: money | L462: 640
A463: 3089 | B463: 26-30 | C463: jumuling | D463: pay_coin | E463: =R[-16]C -> 2 | F463: 1 | G463: 5 | H463: 2 | I463: player_exp | J463: 64 | K463: money | L463: 640
A464: 3090 | B464: 26-30 | C464: jumuling | D464: pay_coin | E464: =R[-16]C -> 2 | F464: 1 | G464: 5 | H464: 2 | I464: player_exp | J464: 64 | K464: money | L464: 640
A465: 3091 | B465: 26-30 | C465: jumuling | D465: pay_coin | E465: =R[-16]C -> 2 | F465: 1 | G465: 5 | H465: 2 | I465: player_exp | J465: 64 | K465: money | L465: 640
A466: 3092 | B466: 26-30 | C466: jumuling | D466: pay_coin | E466: =R[-16]C -> 2 | F466: 1 | G466: 5 | H466: 2 | I466: player_exp | J466: 64 | K466: money | L466: 640
A467: 3093 | B467: 26-30 | C467: jumuling | D467: pay_coin | E467: =R[-16]C -> 3 | F467: 1 | G467: 5 | H467: 3 | I467: player_exp | J467: 68 | K467: money | L467: 680
A468: 3094 | B468: 26-30 | C468: jumuling | D468: pay_coin | E468: =R[-16]C -> 3 | F468: 1 | G468: 5 | H468: 3 | I468: player_exp | J468: 68 | K468: money | L468: 680
A469: 3095 | B469: 26-30 | C469: jumuling | D469: pay_coin | E469: =R[-16]C -> 3 | F469: 1 | G469: 5 | H469: 3 | I469: player_exp | J469: 68 | K469: money | L469: 680
A470: 3096 | B470: 26-30 | C470: jumuling | D470: pay_coin | E470: =R[-16]C -> 3 | F470: 1 | G470: 5 | H470: 3 | I470: player_exp | J470: 68 | K470: money | L470: 680
A471: 3097 | B471: 31-35 | C471: jumuling | D471: pay_coin | E471: =R[-16]C -> 1 | F471: 1 | G471: 5 | H471: 1 | I471: player_exp | J471: 70 | K471: money | L471: 700
A472: 3098 | B472: 31-35 | C472: jumuling | D472: pay_coin | E472: =R[-16]C -> 1 | F472: 1 | G472: 5 | H472: 1 | I472: player_exp | J472: 70 | K472: money | L472: 700
A473: 3099 | B473: 31-35 | C473: jumuling | D473: pay_coin | E473: =R[-16]C -> 1 | F473: 1 | G473: 5 | H473: 1 | I473: player_exp | J473: 70 | K473: money | L473: 700
A474: 3100 | B474: 31-35 | C474: jumuling | D474: pay_coin | E474: =R[-16]C -> 1 | F474: 1 | G474: 5 | H474: 1 | I474: player_exp | J474: 70 | K474: money | L474: 700
A475: 3101 | B475: 31-35 | C475: jumuling | D475: pay_coin | E475: =R[-16]C -> 1 | F475: 1 | G475: 5 | H475: 1 | I475: player_exp | J475: 70 | K475: money | L475: 700
A476: 3102 | B476: 31-35 | C476: jumuling | D476: pay_coin | E476: =R[-16]C -> 2 | F476: 1 | G476: 5 | H476: 2 | I476: player_exp | J476: 74 | K476: money | L476: 740
A477: 3103 | B477: 31-35 | C477: jumuling | D477: pay_coin | E477: =R[-16]C -> 2 | F477: 1 | G477: 5 | H477: 2 | I477: player_exp | J477: 74 | K477: money | L477: 740
A478: 3104 | B478: 31-35 | C478: jumuling | D478: pay_coin | E478: =R[-16]C -> 2 | F478: 1 | G478: 5 | H478: 2 | I478: player_exp | J478: 74 | K478: money | L478: 740
A479: 3105 | B479: 31-35 | C479: jumuling | D479: pay_coin | E479: =R[-16]C -> 2 | F479: 1 | G479: 5 | H479: 2 | I479: player_exp | J479: 74 | K479: money | L479: 740
A480: 3106 | B480: 31-35 | C480: jumuling | D480: pay_coin | E480: =R[-16]C -> 2 | F480: 1 | G480: 5 | H480: 2 | I480: player_exp | J480: 74 | K480: money | L480: 740
A481: 3107 | B481: 31-35 | C481: jumuling | D481: pay_coin | E481: =R[-16]C -> 2 | F481: 1 | G481: 5 | H481: 2 | I481: player_exp | J481: 74 | K481: money | L481: 740
A482: 3108 | B482: 31-35 | C482: jumuling | D482: pay_coin | E482: =R[-16]C -> 2 | F482: 1 | G482: 5 | H482: 2 | I482: player_exp | J482: 74 | K482: money | L482: 740
A483: 3109 | B483: 31-35 | C483: jumuling | D483: pay_coin | E483: =R[-16]C -> 3 | F483: 1 | G483: 5 | H483: 3 | I483: player_exp | J483: 78 | K483: money | L483: 780
A484: 3110 | B484: 31-35 | C484: jumuling | D484: pay_coin | E484: =R[-16]C -> 3 | F484: 1 | G484: 5 | H484: 3 | I484: player_exp | J484: 78 | K484: money | L484: 780
A485: 3111 | B485: 31-35 | C485: jumuling | D485: pay_coin | E485: =R[-16]C -> 3 | F485: 1 | G485: 5 | H485: 3 | I485: player_exp | J485: 78 | K485: money | L485: 780
A486: 3112 | B486: 31-35 | C486: jumuling | D486: pay_coin | E486: =R[-16]C -> 3 | F486: 1 | G486: 5 | H486: 3 | I486: player_exp | J486: 78 | K486: money | L486: 780
A487: 3113 | B487: 36-40 | C487: jumuling | D487: pay_coin | E487: =R[-16]C -> 1 | F487: 1 | G487: 5 | H487: 1 | I487: player_exp | J487: 80 | K487: money | L487: 800
A488: 3114 | B488: 36-40 | C488: jumuling | D488: pay_coin | E488: =R[-16]C -> 1 | F488: 1 | G488: 5 | H488: 1 | I488: player_exp | J488: 80 | K488: money | L488: 800
A489: 3115 | B489: 36-40 | C489: jumuling | D489: pay_coin | E489: =R[-16]C -> 1 | F489: 1 | G489: 5 | H489: 1 | I489: player_exp | J489: 80 | K489: money | L489: 800
A490: 3116 | B490: 36-40 | C490: jumuling | D490: pay_coin | E490: =R[-16]C -> 1 | F490: 1 | G490: 5 | H490: 1 | I490: player_exp | J490: 80 | K490: money | L490: 800
A491: 3117 | B491: 36-40 | C491: jumuling | D491: pay_coin | E491: =R[-16]C -> 1 | F491: 1 | G491: 5 | H491: 1 | I491: player_exp | J491: 80 | K491: money | L491: 800
A492: 3118 | B492: 36-40 | C492: jumuling | D492: pay_coin | E492: =R[-16]C -> 2 | F492: 1 | G492: 5 | H492: 2 | I492: player_exp | J492: 84 | K492: money | L492: 840
A493: 3119 | B493: 36-40 | C493: jumuling | D493: pay_coin | E493: =R[-16]C -> 2 | F493: 1 | G493: 5 | H493: 2 | I493: player_exp | J493: 84 | K493: money | L493: 840
A494: 3120 | B494: 36-40 | C494: jumuling | D494: pay_coin | E494: =R[-16]C -> 2 | F494: 1 | G494: 5 | H494: 2 | I494: player_exp | J494: 84 | K494: money | L494: 840
A495: 3121 | B495: 36-40 | C495: jumuling | D495: pay_coin | E495: =R[-16]C -> 2 | F495: 1 | G495: 5 | H495: 2 | I495: player_exp | J495: 84 | K495: money | L495: 840
A496: 3122 | B496: 36-40 | C496: jumuling | D496: pay_coin | E496: =R[-16]C -> 2 | F496: 1 | G496: 5 | H496: 2 | I496: player_exp | J496: 84 | K496: money | L496: 840
A497: 3123 | B497: 36-40 | C497: jumuling | D497: pay_coin | E497: =R[-16]C -> 2 | F497: 1 | G497: 5 | H497: 2 | I497: player_exp | J497: 84 | K497: money | L497: 840
A498: 3124 | B498: 36-40 | C498: jumuling | D498: pay_coin | E498: =R[-16]C -> 2 | F498: 1 | G498: 5 | H498: 2 | I498: player_exp | J498: 84 | K498: money | L498: 840
A499: 3125 | B499: 36-40 | C499: jumuling | D499: pay_coin | E499: =R[-16]C -> 3 | F499: 1 | G499: 5 | H499: 3 | I499: player_exp | J499: 88 | K499: money | L499: 880
A500: 3126 | B500: 36-40 | C500: jumuling | D500: pay_coin | E500: =R[-16]C -> 3 | F500: 1 | G500: 5 | H500: 3 | I500: player_exp | J500: 88 | K500: money | L500: 880
A501: 3127 | B501: 36-40 | C501: jumuling | D501: pay_coin | E501: =R[-16]C -> 3 | F501: 1 | G501: 5 | H501: 3 | I501: player_exp | J501: 88 | K501: money | L501: 880
A502: 3128 | B502: 36-40 | C502: jumuling | D502: pay_coin | E502: =R[-16]C -> 3 | F502: 1 | G502: 5 | H502: 3 | I502: player_exp | J502: 88 | K502: money | L502: 880
A503: 3129 | B503: 41-45 | C503: jumuling | D503: pay_coin | E503: =R[-16]C -> 1 | F503: 1 | G503: 5 | H503: 1 | I503: player_exp | J503: 90 | K503: money | L503: 900
A504: 3130 | B504: 41-45 | C504: jumuling | D504: pay_coin | E504: =R[-16]C -> 1 | F504: 1 | G504: 5 | H504: 1 | I504: player_exp | J504: 90 | K504: money | L504: 900
A505: 3131 | B505: 41-45 | C505: jumuling | D505: pay_coin | E505: =R[-16]C -> 1 | F505: 1 | G505: 5 | H505: 1 | I505: player_exp | J505: 90 | K505: money | L505: 900
A506: 3132 | B506: 41-45 | C506: jumuling | D506: pay_coin | E506: =R[-16]C -> 1 | F506: 1 | G506: 5 | H506: 1 | I506: player_exp | J506: 90 | K506: money | L506: 900
A507: 3133 | B507: 41-45 | C507: jumuling | D507: pay_coin | E507: =R[-16]C -> 1 | F507: 1 | G507: 5 | H507: 1 | I507: player_exp | J507: 90 | K507: money | L507: 900
A508: 3134 | B508: 41-45 | C508: jumuling | D508: pay_coin | E508: =R[-16]C -> 2 | F508: 1 | G508: 5 | H508: 2 | I508: player_exp | J508: 94 | K508: money | L508: 940
A509: 3135 | B509: 41-45 | C509: jumuling | D509: pay_coin | E509: =R[-16]C -> 2 | F509: 1 | G509: 5 | H509: 2 | I509: player_exp | J509: 94 | K509: money | L509: 940
A510: 3136 | B510: 41-45 | C510: jumuling | D510: pay_coin | E510: =R[-16]C -> 2 | F510: 1 | G510: 5 | H510: 2 | I510: player_exp | J510: 94 | K510: money | L510: 940
A511: 3137 | B511: 41-45 | C511: jumuling | D511: pay_coin | E511: =R[-16]C -> 2 | F511: 1 | G511: 5 | H511: 2 | I511: player_exp | J511: 94 | K511: money | L511: 940
A512: 3138 | B512: 41-45 | C512: jumuling | D512: pay_coin | E512: =R[-16]C -> 2 | F512: 1 | G512: 5 | H512: 2 | I512: player_exp | J512: 94 | K512: money | L512: 940
A513: 3139 | B513: 41-45 | C513: jumuling | D513: pay_coin | E513: =R[-16]C -> 2 | F513: 1 | G513: 5 | H513: 2 | I513: player_exp | J513: 94 | K513: money | L513: 940
A514: 3140 | B514: 41-45 | C514: jumuling | D514: pay_coin | E514: =R[-16]C -> 2 | F514: 1 | G514: 5 | H514: 2 | I514: player_exp | J514: 94 | K514: money | L514: 940
A515: 3141 | B515: 41-45 | C515: jumuling | D515: pay_coin | E515: =R[-16]C -> 3 | F515: 1 | G515: 5 | H515: 3 | I515: player_exp | J515: 98 | K515: money | L515: 980
A516: 3142 | B516: 41-45 | C516: jumuling | D516: pay_coin | E516: =R[-16]C -> 3 | F516: 1 | G516: 5 | H516: 3 | I516: player_exp | J516: 98 | K516: money | L516: 980
A517: 3143 | B517: 41-45 | C517: jumuling | D517: pay_coin | E517: =R[-16]C -> 3 | F517: 1 | G517: 5 | H517: 3 | I517: player_exp | J517: 98 | K517: money | L517: 980
A518: 3144 | B518: 41-45 | C518: jumuling | D518: pay_coin | E518: =R[-16]C -> 3 | F518: 1 | G518: 5 | H518: 3 | I518: player_exp | J518: 98 | K518: money | L518: 980
A519: 3145 | B519: 46-50 | C519: jumuling | D519: pay_coin | E519: =R[-16]C -> 1 | F519: 1 | G519: 5 | H519: 1 | I519: player_exp | J519: 100 | K519: money | L519: 1000
A520: 3146 | B520: 46-50 | C520: jumuling | D520: pay_coin | E520: =R[-16]C -> 1 | F520: 1 | G520: 5 | H520: 1 | I520: player_exp | J520: 100 | K520: money | L520: 1000
A521: 3147 | B521: 46-50 | C521: jumuling | D521: pay_coin | E521: =R[-16]C -> 1 | F521: 1 | G521: 5 | H521: 1 | I521: player_exp | J521: 100 | K521: money | L521: 1000
A522: 3148 | B522: 46-50 | C522: jumuling | D522: pay_coin | E522: =R[-16]C -> 1 | F522: 1 | G522: 5 | H522: 1 | I522: player_exp | J522: 100 | K522: money | L522: 1000
A523: 3149 | B523: 46-50 | C523: jumuling | D523: pay_coin | E523: =R[-16]C -> 1 | F523: 1 | G523: 5 | H523: 1 | I523: player_exp | J523: 100 | K523: money | L523: 1000
A524: 3150 | B524: 46-50 | C524: jumuling | D524: pay_coin | E524: =R[-16]C -> 2 | F524: 1 | G524: 5 | H524: 2 | I524: player_exp | J524: 104 | K524: money | L524: 1040
A525: 3151 | B525: 46-50 | C525: jumuling | D525: pay_coin | E525: =R[-16]C -> 2 | F525: 1 | G525: 5 | H525: 2 | I525: player_exp | J525: 104 | K525: money | L525: 1040
A526: 3152 | B526: 46-50 | C526: jumuling | D526: pay_coin | E526: =R[-16]C -> 2 | F526: 1 | G526: 5 | H526: 2 | I526: player_exp | J526: 104 | K526: money | L526: 1040
A527: 3153 | B527: 46-50 | C527: jumuling | D527: pay_coin | E527: =R[-16]C -> 2 | F527: 1 | G527: 5 | H527: 2 | I527: player_exp | J527: 104 | K527: money | L527: 1040
A528: 3154 | B528: 46-50 | C528: jumuling | D528: pay_coin | E528: =R[-16]C -> 2 | F528: 1 | G528: 5 | H528: 2 | I528: player_exp | J528: 104 | K528: money | L528: 1040
A529: 3155 | B529: 46-50 | C529: jumuling | D529: pay_coin | E529: =R[-16]C -> 2 | F529: 1 | G529: 5 | H529: 2 | I529: player_exp | J529: 104 | K529: money | L529: 1040
A530: 3156 | B530: 46-50 | C530: jumuling | D530: pay_coin | E530: =R[-16]C -> 2 | F530: 1 | G530: 5 | H530: 2 | I530: player_exp | J530: 104 | K530: money | L530: 1040
A531: 3157 | B531: 46-50 | C531: jumuling | D531: pay_coin | E531: =R[-16]C -> 3 | F531: 1 | G531: 5 | H531: 3 | I531: player_exp | J531: 108 | K531: money | L531: 1080
A532: 3158 | B532: 46-50 | C532: jumuling | D532: pay_coin | E532: =R[-16]C -> 3 | F532: 1 | G532: 5 | H532: 3 | I532: player_exp | J532: 108 | K532: money | L532: 1080
A533: 3159 | B533: 46-50 | C533: jumuling | D533: pay_coin | E533: =R[-16]C -> 3 | F533: 1 | G533: 5 | H533: 3 | I533: player_exp | J533: 108 | K533: money | L533: 1080
A534: 3160 | B534: 46-50 | C534: jumuling | D534: pay_coin | E534: =R[-16]C -> 3 | F534: 1 | G534: 5 | H534: 3 | I534: player_exp | J534: 108 | K534: money | L534: 1080
A535: 3161 | B535: 51-55 | C535: jumuling | D535: pay_coin | E535: =R[-16]C -> 1 | F535: 1 | G535: 5 | H535: 1 | I535: player_exp | J535: 110 | K535: money | L535: 1100
A536: 3162 | B536: 51-55 | C536: jumuling | D536: pay_coin | E536: =R[-16]C -> 1 | F536: 1 | G536: 5 | H536: 1 | I536: player_exp | J536: 110 | K536: money | L536: 1100
A537: 3163 | B537: 51-55 | C537: jumuling | D537: pay_coin | E537: =R[-16]C -> 1 | F537: 1 | G537: 5 | H537: 1 | I537: player_exp | J537: 110 | K537: money | L537: 1100
A538: 3164 | B538: 51-55 | C538: jumuling | D538: pay_coin | E538: =R[-16]C -> 1 | F538: 1 | G538: 5 | H538: 1 | I538: player_exp | J538: 110 | K538: money | L538: 1100
A539: 3165 | B539: 51-55 | C539: jumuling | D539: pay_coin | E539: =R[-16]C -> 1 | F539: 1 | G539: 5 | H539: 1 | I539: player_exp | J539: 110 | K539: money | L539: 1100
A540: 3166 | B540: 51-55 | C540: jumuling | D540: pay_coin | E540: =R[-16]C -> 2 | F540: 1 | G540: 5 | H540: 2 | I540: player_exp | J540: 114 | K540: money | L540: 1140
A541: 3167 | B541: 51-55 | C541: jumuling | D541: pay_coin | E541: =R[-16]C -> 2 | F541: 1 | G541: 5 | H541: 2 | I541: player_exp | J541: 114 | K541: money | L541: 1140
A542: 3168 | B542: 51-55 | C542: jumuling | D542: pay_coin | E542: =R[-16]C -> 2 | F542: 1 | G542: 5 | H542: 2 | I542: player_exp | J542: 114 | K542: money | L542: 1140
A543: 3169 | B543: 51-55 | C543: jumuling | D543: pay_coin | E543: =R[-16]C -> 2 | F543: 1 | G543: 5 | H543: 2 | I543: player_exp | J543: 114 | K543: money | L543: 1140
A544: 3170 | B544: 51-55 | C544: jumuling | D544: pay_coin | E544: =R[-16]C -> 2 | F544: 1 | G544: 5 | H544: 2 | I544: player_exp | J544: 114 | K544: money | L544: 1140
A545: 3171 | B545: 51-55 | C545: jumuling | D545: pay_coin | E545: =R[-16]C -> 2 | F545: 1 | G545: 5 | H545: 2 | I545: player_exp | J545: 114 | K545: money | L545: 1140
A546: 3172 | B546: 51-55 | C546: jumuling | D546: pay_coin | E546: =R[-16]C -> 2 | F546: 1 | G546: 5 | H546: 2 | I546: player_exp | J546: 114 | K546: money | L546: 1140
A547: 3173 | B547: 51-55 | C547: jumuling | D547: pay_coin | E547: =R[-16]C -> 3 | F547: 1 | G547: 5 | H547: 3 | I547: player_exp | J547: 118 | K547: money | L547: 1180
A548: 3174 | B548: 51-55 | C548: jumuling | D548: pay_coin | E548: =R[-16]C -> 3 | F548: 1 | G548: 5 | H548: 3 | I548: player_exp | J548: 118 | K548: money | L548: 1180
A549: 3175 | B549: 51-55 | C549: jumuling | D549: pay_coin | E549: =R[-16]C -> 3 | F549: 1 | G549: 5 | H549: 3 | I549: player_exp | J549: 118 | K549: money | L549: 1180
A550: 3176 | B550: 51-55 | C550: jumuling | D550: pay_coin | E550: =R[-16]C -> 3 | F550: 1 | G550: 5 | H550: 3 | I550: player_exp | J550: 118 | K550: money | L550: 1180
A551: 3177 | B551: 56-60 | C551: jumuling | D551: pay_coin | E551: =R[-16]C -> 1 | F551: 1 | G551: 5 | H551: 1 | I551: player_exp | J551: 120 | K551: money | L551: 1200
A552: 3178 | B552: 56-60 | C552: jumuling | D552: pay_coin | E552: =R[-16]C -> 1 | F552: 1 | G552: 5 | H552: 1 | I552: player_exp | J552: 120 | K552: money | L552: 1200
A553: 3179 | B553: 56-60 | C553: jumuling | D553: pay_coin | E553: =R[-16]C -> 1 | F553: 1 | G553: 5 | H553: 1 | I553: player_exp | J553: 120 | K553: money | L553: 1200
A554: 3180 | B554: 56-60 | C554: jumuling | D554: pay_coin | E554: =R[-16]C -> 1 | F554: 1 | G554: 5 | H554: 1 | I554: player_exp | J554: 120 | K554: money | L554: 1200
A555: 3181 | B555: 56-60 | C555: jumuling | D555: pay_coin | E555: =R[-16]C -> 1 | F555: 1 | G555: 5 | H555: 1 | I555: player_exp | J555: 120 | K555: money | L555: 1200
A556: 3182 | B556: 56-60 | C556: jumuling | D556: pay_coin | E556: =R[-16]C -> 2 | F556: 1 | G556: 5 | H556: 2 | I556: player_exp | J556: 124 | K556: money | L556: 1240
A557: 3183 | B557: 56-60 | C557: jumuling | D557: pay_coin | E557: =R[-16]C -> 2 | F557: 1 | G557: 5 | H557: 2 | I557: player_exp | J557: 124 | K557: money | L557: 1240
A558: 3184 | B558: 56-60 | C558: jumuling | D558: pay_coin | E558: =R[-16]C -> 2 | F558: 1 | G558: 5 | H558: 2 | I558: player_exp | J558: 124 | K558: money | L558: 1240
A559: 3185 | B559: 56-60 | C559: jumuling | D559: pay_coin | E559: =R[-16]C -> 2 | F559: 1 | G559: 5 | H559: 2 | I559: player_exp | J559: 124 | K559: money | L559: 1240
A560: 3186 | B560: 56-60 | C560: jumuling | D560: pay_coin | E560: =R[-16]C -> 2 | F560: 1 | G560: 5 | H560: 2 | I560: player_exp | J560: 124 | K560: money | L560: 1240
A561: 3187 | B561: 56-60 | C561: jumuling | D561: pay_coin | E561: =R[-16]C -> 2 | F561: 1 | G561: 5 | H561: 2 | I561: player_exp | J561: 124 | K561: money | L561: 1240
A562: 3188 | B562: 56-60 | C562: jumuling | D562: pay_coin | E562: =R[-16]C -> 2 | F562: 1 | G562: 5 | H562: 2 | I562: player_exp | J562: 124 | K562: money | L562: 1240
A563: 3189 | B563: 56-60 | C563: jumuling | D563: pay_coin | E563: =R[-16]C -> 3 | F563: 1 | G563: 5 | H563: 3 | I563: player_exp | J563: 128 | K563: money | L563: 1280
A564: 3190 | B564: 56-60 | C564: jumuling | D564: pay_coin | E564: =R[-16]C -> 3 | F564: 1 | G564: 5 | H564: 3 | I564: player_exp | J564: 128 | K564: money | L564: 1280
A565: 3191 | B565: 56-60 | C565: jumuling | D565: pay_coin | E565: =R[-16]C -> 3 | F565: 1 | G565: 5 | H565: 3 | I565: player_exp | J565: 128 | K565: money | L565: 1280
A566: 3192 | B566: 56-60 | C566: jumuling | D566: pay_coin | E566: =R[-16]C -> 3 | F566: 1 | G566: 5 | H566: 3 | I566: player_exp | J566: 128 | K566: money | L566: 1280
A567: 4001 | B567: 1-5 | C567: ruijinling | D567: challenge_tower | E567: =R[-16]C -> 1 | F567: 1 | G567: 5 | H567: 1 | I567: player_exp | J567: 10 | K567: money | L567: 100
A568: 4002 | B568: 1-5 | C568: ruijinling | D568: challenge_tower | E568: =R[-16]C -> 1 | F568: 1 | G568: 5 | H568: 1 | I568: player_exp | J568: 10 | K568: money | L568: 100
A569: 4003 | B569: 1-5 | C569: ruijinling | D569: challenge_tower | E569: =R[-16]C -> 1 | F569: 1 | G569: 5 | H569: 1 | I569: player_exp | J569: 10 | K569: money | L569: 100
A570: 4004 | B570: 1-5 | C570: ruijinling | D570: challenge_tower | E570: =R[-16]C -> 1 | F570: 1 | G570: 5 | H570: 1 | I570: player_exp | J570: 10 | K570: money | L570: 100
A571: 4005 | B571: 1-5 | C571: ruijinling | D571: challenge_tower | E571: =R[-16]C -> 1 | F571: 1 | G571: 5 | H571: 1 | I571: player_exp | J571: 10 | K571: money | L571: 100
A572: 4006 | B572: 1-5 | C572: ruijinling | D572: challenge_tower | E572: =R[-16]C -> 2 | F572: 1 | G572: 5 | H572: 2 | I572: player_exp | J572: 14 | K572: money | L572: 140
A573: 4007 | B573: 1-5 | C573: ruijinling | D573: challenge_tower | E573: =R[-16]C -> 2 | F573: 1 | G573: 5 | H573: 2 | I573: player_exp | J573: 14 | K573: money | L573: 140
A574: 4008 | B574: 1-5 | C574: ruijinling | D574: challenge_tower | E574: =R[-16]C -> 2 | F574: 1 | G574: 5 | H574: 2 | I574: player_exp | J574: 14 | K574: money | L574: 140
A575: 4009 | B575: 1-5 | C575: ruijinling | D575: challenge_tower | E575: =R[-16]C -> 2 | F575: 1 | G575: 5 | H575: 2 | I575: player_exp | J575: 14 | K575: money | L575: 140
A576: 4010 | B576: 1-5 | C576: ruijinling | D576: challenge_tower | E576: =R[-16]C -> 2 | F576: 1 | G576: 5 | H576: 2 | I576: player_exp | J576: 14 | K576: money | L576: 140
A577: 4011 | B577: 1-5 | C577: ruijinling | D577: challenge_tower | E577: =R[-16]C -> 2 | F577: 1 | G577: 5 | H577: 2 | I577: player_exp | J577: 14 | K577: money | L577: 140
A578: 4012 | B578: 1-5 | C578: ruijinling | D578: challenge_tower | E578: =R[-16]C -> 2 | F578: 1 | G578: 5 | H578: 2 | I578: player_exp | J578: 14 | K578: money | L578: 140
A579: 4013 | B579: 1-5 | C579: ruijinling | D579: challenge_tower | E579: =R[-16]C -> 3 | F579: 1 | G579: 5 | H579: 3 | I579: player_exp | J579: 18 | K579: money | L579: 180
A580: 4014 | B580: 1-5 | C580: ruijinling | D580: challenge_tower | E580: =R[-16]C -> 3 | F580: 1 | G580: 5 | H580: 3 | I580: player_exp | J580: 18 | K580: money | L580: 180
A581: 4015 | B581: 1-5 | C581: ruijinling | D581: challenge_tower | E581: =R[-16]C -> 3 | F581: 1 | G581: 5 | H581: 3 | I581: player_exp | J581: 18 | K581: money | L581: 180
A582: 4016 | B582: 1-5 | C582: ruijinling | D582: challenge_tower | E582: =R[-16]C -> 3 | F582: 1 | G582: 5 | H582: 3 | I582: player_exp | J582: 18 | K582: money | L582: 180
A583: 4017 | B583: 6-10 | C583: ruijinling | D583: challenge_tower | E583: =R[-16]C -> 1 | F583: 1 | G583: 5 | H583: 1 | I583: player_exp | J583: 20 | K583: money | L583: 200
A584: 4018 | B584: 6-10 | C584: ruijinling | D584: challenge_tower | E584: =R[-16]C -> 1 | F584: 1 | G584: 5 | H584: 1 | I584: player_exp | J584: 20 | K584: money | L584: 200
A585: 4019 | B585: 6-10 | C585: ruijinling | D585: challenge_tower | E585: =R[-16]C -> 1 | F585: 1 | G585: 5 | H585: 1 | I585: player_exp | J585: 20 | K585: money | L585: 200
A586: 4020 | B586: 6-10 | C586: ruijinling | D586: challenge_tower | E586: =R[-16]C -> 1 | F586: 1 | G586: 5 | H586: 1 | I586: player_exp | J586: 20 | K586: money | L586: 200
A587: 4021 | B587: 6-10 | C587: ruijinling | D587: challenge_tower | E587: =R[-16]C -> 1 | F587: 1 | G587: 5 | H587: 1 | I587: player_exp | J587: 20 | K587: money | L587: 200
A588: 4022 | B588: 6-10 | C588: ruijinling | D588: challenge_tower | E588: =R[-16]C -> 2 | F588: 1 | G588: 5 | H588: 2 | I588: player_exp | J588: 24 | K588: money | L588: 240
A589: 4023 | B589: 6-10 | C589: ruijinling | D589: challenge_tower | E589: =R[-16]C -> 2 | F589: 1 | G589: 5 | H589: 2 | I589: player_exp | J589: 24 | K589: money | L589: 240
A590: 4024 | B590: 6-10 | C590: ruijinling | D590: challenge_tower | E590: =R[-16]C -> 2 | F590: 1 | G590: 5 | H590: 2 | I590: player_exp | J590: 24 | K590: money | L590: 240
A591: 4025 | B591: 6-10 | C591: ruijinling | D591: challenge_tower | E591: =R[-16]C -> 2 | F591: 1 | G591: 5 | H591: 2 | I591: player_exp | J591: 24 | K591: money | L591: 240
A592: 4026 | B592: 6-10 | C592: ruijinling | D592: challenge_tower | E592: =R[-16]C -> 2 | F592: 1 | G592: 5 | H592: 2 | I592: player_exp | J592: 24 | K592: money | L592: 240
A593: 4027 | B593: 6-10 | C593: ruijinling | D593: challenge_tower | E593: =R[-16]C -> 2 | F593: 1 | G593: 5 | H593: 2 | I593: player_exp | J593: 24 | K593: money | L593: 240
A594: 4028 | B594: 6-10 | C594: ruijinling | D594: challenge_tower | E594: =R[-16]C -> 2 | F594: 1 | G594: 5 | H594: 2 | I594: player_exp | J594: 24 | K594: money | L594: 240
A595: 4029 | B595: 6-10 | C595: ruijinling | D595: challenge_tower | E595: =R[-16]C -> 3 | F595: 1 | G595: 5 | H595: 3 | I595: player_exp | J595: 28 | K595: money | L595: 280
A596: 4030 | B596: 6-10 | C596: ruijinling | D596: challenge_tower | E596: =R[-16]C -> 3 | F596: 1 | G596: 5 | H596: 3 | I596: player_exp | J596: 28 | K596: money | L596: 280
A597: 4031 | B597: 6-10 | C597: ruijinling | D597: challenge_tower | E597: =R[-16]C -> 3 | F597: 1 | G597: 5 | H597: 3 | I597: player_exp | J597: 28 | K597: money | L597: 280
A598: 4032 | B598: 6-10 | C598: ruijinling | D598: challenge_tower | E598: =R[-16]C -> 3 | F598: 1 | G598: 5 | H598: 3 | I598: player_exp | J598: 28 | K598: money | L598: 280
A599: 4033 | B599: 11-15 | C599: ruijinling | D599: challenge_tower | E599: =R[-16]C -> 1 | F599: 1 | G599: 5 | H599: 1 | I599: player_exp | J599: 30 | K599: money | L599: 300
A600: 4034 | B600: 11-15 | C600: ruijinling | D600: challenge_tower | E600: =R[-16]C -> 1 | F600: 1 | G600: 5 | H600: 1 | I600: player_exp | J600: 30 | K600: money | L600: 300
A601: 4035 | B601: 11-15 | C601: ruijinling | D601: challenge_tower | E601: =R[-16]C -> 1 | F601: 1 | G601: 5 | H601: 1 | I601: player_exp | J601: 30 | K601: money | L601: 300
A602: 4036 | B602: 11-15 | C602: ruijinling | D602: challenge_tower | E602: =R[-16]C -> 1 | F602: 1 | G602: 5 | H602: 1 | I602: player_exp | J602: 30 | K602: money | L602: 300
A603: 4037 | B603: 11-15 | C603: ruijinling | D603: challenge_tower | E603: =R[-16]C -> 1 | F603: 1 | G603: 5 | H603: 1 | I603: player_exp | J603: 30 | K603: money | L603: 300
A604: 4038 | B604: 11-15 | C604: ruijinling | D604: challenge_tower | E604: =R[-16]C -> 2 | F604: 1 | G604: 5 | H604: 2 | I604: player_exp | J604: 34 | K604: money | L604: 340
A605: 4039 | B605: 11-15 | C605: ruijinling | D605: challenge_tower | E605: =R[-16]C -> 2 | F605: 1 | G605: 5 | H605: 2 | I605: player_exp | J605: 34 | K605: money | L605: 340
A606: 4040 | B606: 11-15 | C606: ruijinling | D606: challenge_tower | E606: =R[-16]C -> 2 | F606: 1 | G606: 5 | H606: 2 | I606: player_exp | J606: 34 | K606: money | L606: 340
A607: 4041 | B607: 11-15 | C607: ruijinling | D607: challenge_tower | E607: =R[-16]C -> 2 | F607: 1 | G607: 5 | H607: 2 | I607: player_exp | J607: 34 | K607: money | L607: 340
A608: 4042 | B608: 11-15 | C608: ruijinling | D608: challenge_tower | E608: =R[-16]C -> 2 | F608: 1 | G608: 5 | H608: 2 | I608: player_exp | J608: 34 | K608: money | L608: 340
A609: 4043 | B609: 11-15 | C609: ruijinling | D609: challenge_tower | E609: =R[-16]C -> 2 | F609: 1 | G609: 5 | H609: 2 | I609: player_exp | J609: 34 | K609: money | L609: 340
A610: 4044 | B610: 11-15 | C610: ruijinling | D610: challenge_tower | E610: =R[-16]C -> 2 | F610: 1 | G610: 5 | H610: 2 | I610: player_exp | J610: 34 | K610: money | L610: 340
A611: 4045 | B611: 11-15 | C611: ruijinling | D611: challenge_tower | E611: =R[-16]C -> 3 | F611: 1 | G611: 5 | H611: 3 | I611: player_exp | J611: 38 | K611: money | L611: 380
A612: 4046 | B612: 11-15 | C612: ruijinling | D612: challenge_tower | E612: =R[-16]C -> 3 | F612: 1 | G612: 5 | H612: 3 | I612: player_exp | J612: 38 | K612: money | L612: 380
A613: 4047 | B613: 11-15 | C613: ruijinling | D613: challenge_tower | E613: =R[-16]C -> 3 | F613: 1 | G613: 5 | H613: 3 | I613: player_exp | J613: 38 | K613: money | L613: 380
A614: 4048 | B614: 11-15 | C614: ruijinling | D614: challenge_tower | E614: =R[-16]C -> 3 | F614: 1 | G614: 5 | H614: 3 | I614: player_exp | J614: 38 | K614: money | L614: 380
A615: 4049 | B615: 16-20 | C615: ruijinling | D615: challenge_tower | E615: =R[-16]C -> 1 | F615: 1 | G615: 5 | H615: 1 | I615: player_exp | J615: 40 | K615: money | L615: 400
A616: 4050 | B616: 16-20 | C616: ruijinling | D616: challenge_tower | E616: =R[-16]C -> 1 | F616: 1 | G616: 5 | H616: 1 | I616: player_exp | J616: 40 | K616: money | L616: 400
A617: 4051 | B617: 16-20 | C617: ruijinling | D617: challenge_tower | E617: =R[-16]C -> 1 | F617: 1 | G617: 5 | H617: 1 | I617: player_exp | J617: 40 | K617: money | L617: 400
A618: 4052 | B618: 16-20 | C618: ruijinling | D618: challenge_tower | E618: =R[-16]C -> 1 | F618: 1 | G618: 5 | H618: 1 | I618: player_exp | J618: 40 | K618: money | L618: 400
A619: 4053 | B619: 16-20 | C619: ruijinling | D619: challenge_tower | E619: =R[-16]C -> 1 | F619: 1 | G619: 5 | H619: 1 | I619: player_exp | J619: 40 | K619: money | L619: 400
A620: 4054 | B620: 16-20 | C620: ruijinling | D620: challenge_tower | E620: =R[-16]C -> 2 | F620: 1 | G620: 5 | H620: 2 | I620: player_exp | J620: 44 | K620: money | L620: 440
A621: 4055 | B621: 16-20 | C621: ruijinling | D621: challenge_tower | E621: =R[-16]C -> 2 | F621: 1 | G621: 5 | H621: 2 | I621: player_exp | J621: 44 | K621: money | L621: 440
A622: 4056 | B622: 16-20 | C622: ruijinling | D622: challenge_tower | E622: =R[-16]C -> 2 | F622: 1 | G622: 5 | H622: 2 | I622: player_exp | J622: 44 | K622: money | L622: 440
A623: 4057 | B623: 16-20 | C623: ruijinling | D623: challenge_tower | E623: =R[-16]C -> 2 | F623: 1 | G623: 5 | H623: 2 | I623: player_exp | J623: 44 | K623: money | L623: 440
A624: 4058 | B624: 16-20 | C624: ruijinling | D624: challenge_tower | E624: =R[-16]C -> 2 | F624: 1 | G624: 5 | H624: 2 | I624: player_exp | J624: 44 | K624: money | L624: 440
A625: 4059 | B625: 16-20 | C625: ruijinling | D625: challenge_tower | E625: =R[-16]C -> 2 | F625: 1 | G625: 5 | H625: 2 | I625: player_exp | J625: 44 | K625: money | L625: 440
A626: 4060 | B626: 16-20 | C626: ruijinling | D626: challenge_tower | E626: =R[-16]C -> 2 | F626: 1 | G626: 5 | H626: 2 | I626: player_exp | J626: 44 | K626: money | L626: 440
A627: 4061 | B627: 16-20 | C627: ruijinling | D627: challenge_tower | E627: =R[-16]C -> 3 | F627: 1 | G627: 5 | H627: 3 | I627: player_exp | J627: 48 | K627: money | L627: 480
A628: 4062 | B628: 16-20 | C628: ruijinling | D628: challenge_tower | E628: =R[-16]C -> 3 | F628: 1 | G628: 5 | H628: 3 | I628: player_exp | J628: 48 | K628: money | L628: 480
A629: 4063 | B629: 16-20 | C629: ruijinling | D629: challenge_tower | E629: =R[-16]C -> 3 | F629: 1 | G629: 5 | H629: 3 | I629: player_exp | J629: 48 | K629: money | L629: 480
A630: 4064 | B630: 16-20 | C630: ruijinling | D630: challenge_tower | E630: =R[-16]C -> 3 | F630: 1 | G630: 5 | H630: 3 | I630: player_exp | J630: 48 | K630: money | L630: 480
A631: 4065 | B631: 21-25 | C631: ruijinling | D631: challenge_tower | E631: =R[-16]C -> 1 | F631: 1 | G631: 5 | H631: 1 | I631: player_exp | J631: 50 | K631: money | L631: 500
A632: 4066 | B632: 21-25 | C632: ruijinling | D632: challenge_tower | E632: =R[-16]C -> 1 | F632: 1 | G632: 5 | H632: 1 | I632: player_exp | J632: 50 | K632: money | L632: 500
A633: 4067 | B633: 21-25 | C633: ruijinling | D633: challenge_tower | E633: =R[-16]C -> 1 | F633: 1 | G633: 5 | H633: 1 | I633: player_exp | J633: 50 | K633: money | L633: 500
A634: 4068 | B634: 21-25 | C634: ruijinling | D634: challenge_tower | E634: =R[-16]C -> 1 | F634: 1 | G634: 5 | H634: 1 | I634: player_exp | J634: 50 | K634: money | L634: 500
A635: 4069 | B635: 21-25 | C635: ruijinling | D635: challenge_tower | E635: =R[-16]C -> 1 | F635: 1 | G635: 5 | H635: 1 | I635: player_exp | J635: 50 | K635: money | L635: 500
A636: 4070 | B636: 21-25 | C636: ruijinling | D636: challenge_tower | E636: =R[-16]C -> 2 | F636: 1 | G636: 5 | H636: 2 | I636: player_exp | J636: 54 | K636: money | L636: 540
A637: 4071 | B637: 21-25 | C637: ruijinling | D637: challenge_tower | E637: =R[-16]C -> 2 | F637: 1 | G637: 5 | H637: 2 | I637: player_exp | J637: 54 | K637: money | L637: 540
A638: 4072 | B638: 21-25 | C638: ruijinling | D638: challenge_tower | E638: =R[-16]C -> 2 | F638: 1 | G638: 5 | H638: 2 | I638: player_exp | J638: 54 | K638: money | L638: 540
A639: 4073 | B639: 21-25 | C639: ruijinling | D639: challenge_tower | E639: =R[-16]C -> 2 | F639: 1 | G639: 5 | H639: 2 | I639: player_exp | J639: 54 | K639: money | L639: 540
A640: 4074 | B640: 21-25 | C640: ruijinling | D640: challenge_tower | E640: =R[-16]C -> 2 | F640: 1 | G640: 5 | H640: 2 | I640: player_exp | J640: 54 | K640: money | L640: 540
A641: 4075 | B641: 21-25 | C641: ruijinling | D641: challenge_tower | E641: =R[-16]C -> 2 | F641: 1 | G641: 5 | H641: 2 | I641: player_exp | J641: 54 | K641: money | L641: 540
A642: 4076 | B642: 21-25 | C642: ruijinling | D642: challenge_tower | E642: =R[-16]C -> 2 | F642: 1 | G642: 5 | H642: 2 | I642: player_exp | J642: 54 | K642: money | L642: 540
A643: 4077 | B643: 21-25 | C643: ruijinling | D643: challenge_tower | E643: =R[-16]C -> 3 | F643: 1 | G643: 5 | H643: 3 | I643: player_exp | J643: 58 | K643: money | L643: 580
A644: 4078 | B644: 21-25 | C644: ruijinling | D644: challenge_tower | E644: =R[-16]C -> 3 | F644: 1 | G644: 5 | H644: 3 | I644: player_exp | J644: 58 | K644: money | L644: 580
A645: 4079 | B645: 21-25 | C645: ruijinling | D645: challenge_tower | E645: =R[-16]C -> 3 | F645: 1 | G645: 5 | H645: 3 | I645: player_exp | J645: 58 | K645: money | L645: 580
A646: 4080 | B646: 21-25 | C646: ruijinling | D646: challenge_tower | E646: =R[-16]C -> 3 | F646: 1 | G646: 5 | H646: 3 | I646: player_exp | J646: 58 | K646: money | L646: 580
A647: 4081 | B647: 26-30 | C647: ruijinling | D647: challenge_tower | E647: =R[-16]C -> 1 | F647: 1 | G647: 5 | H647: 1 | I647: player_exp | J647: 60 | K647: money | L647: 600
A648: 4082 | B648: 26-30 | C648: ruijinling | D648: challenge_tower | E648: =R[-16]C -> 1 | F648: 1 | G648: 5 | H648: 1 | I648: player_exp | J648: 60 | K648: money | L648: 600
A649: 4083 | B649: 26-30 | C649: ruijinling | D649: challenge_tower | E649: =R[-16]C -> 1 | F649: 1 | G649: 5 | H649: 1 | I649: player_exp | J649: 60 | K649: money | L649: 600
A650: 4084 | B650: 26-30 | C650: ruijinling | D650: challenge_tower | E650: =R[-16]C -> 1 | F650: 1 | G650: 5 | H650: 1 | I650: player_exp | J650: 60 | K650: money | L650: 600
A651: 4085 | B651: 26-30 | C651: ruijinling | D651: challenge_tower | E651: =R[-16]C -> 1 | F651: 1 | G651: 5 | H651: 1 | I651: player_exp | J651: 60 | K651: money | L651: 600
A652: 4086 | B652: 26-30 | C652: ruijinling | D652: challenge_tower | E652: =R[-16]C -> 2 | F652: 1 | G652: 5 | H652: 2 | I652: player_exp | J652: 64 | K652: money | L652: 640
A653: 4087 | B653: 26-30 | C653: ruijinling | D653: challenge_tower | E653: =R[-16]C -> 2 | F653: 1 | G653: 5 | H653: 2 | I653: player_exp | J653: 64 | K653: money | L653: 640
A654: 4088 | B654: 26-30 | C654: ruijinling | D654: challenge_tower | E654: =R[-16]C -> 2 | F654: 1 | G654: 5 | H654: 2 | I654: player_exp | J654: 64 | K654: money | L654: 640
A655: 4089 | B655: 26-30 | C655: ruijinling | D655: challenge_tower | E655: =R[-16]C -> 2 | F655: 1 | G655: 5 | H655: 2 | I655: player_exp | J655: 64 | K655: money | L655: 640
A656: 4090 | B656: 26-30 | C656: ruijinling | D656: challenge_tower | E656: =R[-16]C -> 2 | F656: 1 | G656: 5 | H656: 2 | I656: player_exp | J656: 64 | K656: money | L656: 640
A657: 4091 | B657: 26-30 | C657: ruijinling | D657: challenge_tower | E657: =R[-16]C -> 2 | F657: 1 | G657: 5 | H657: 2 | I657: player_exp | J657: 64 | K657: money | L657: 640
A658: 4092 | B658: 26-30 | C658: ruijinling | D658: challenge_tower | E658: =R[-16]C -> 2 | F658: 1 | G658: 5 | H658: 2 | I658: player_exp | J658: 64 | K658: money | L658: 640
A659: 4093 | B659: 26-30 | C659: ruijinling | D659: challenge_tower | E659: =R[-16]C -> 3 | F659: 1 | G659: 5 | H659: 3 | I659: player_exp | J659: 68 | K659: money | L659: 680
A660: 4094 | B660: 26-30 | C660: ruijinling | D660: challenge_tower | E660: =R[-16]C -> 3 | F660: 1 | G660: 5 | H660: 3 | I660: player_exp | J660: 68 | K660: money | L660: 680
A661: 4095 | B661: 26-30 | C661: ruijinling | D661: challenge_tower | E661: =R[-16]C -> 3 | F661: 1 | G661: 5 | H661: 3 | I661: player_exp | J661: 68 | K661: money | L661: 680
A662: 4096 | B662: 26-30 | C662: ruijinling | D662: challenge_tower | E662: =R[-16]C -> 3 | F662: 1 | G662: 5 | H662: 3 | I662: player_exp | J662: 68 | K662: money | L662: 680
A663: 4097 | B663: 31-35 | C663: ruijinling | D663: challenge_tower | E663: =R[-16]C -> 1 | F663: 1 | G663: 5 | H663: 1 | I663: player_exp | J663: 70 | K663: money | L663: 700
A664: 4098 | B664: 31-35 | C664: ruijinling | D664: challenge_tower | E664: =R[-16]C -> 1 | F664: 1 | G664: 5 | H664: 1 | I664: player_exp | J664: 70 | K664: money | L664: 700
A665: 4099 | B665: 31-35 | C665: ruijinling | D665: challenge_tower | E665: =R[-16]C -> 1 | F665: 1 | G665: 5 | H665: 1 | I665: player_exp | J665: 70 | K665: money | L665: 700
A666: 4100 | B666: 31-35 | C666: ruijinling | D666: challenge_tower | E666: =R[-16]C -> 1 | F666: 1 | G666: 5 | H666: 1 | I666: player_exp | J666: 70 | K666: money | L666: 700
A667: 4101 | B667: 31-35 | C667: ruijinling | D667: challenge_tower | E667: =R[-16]C -> 1 | F667: 1 | G667: 5 | H667: 1 | I667: player_exp | J667: 70 | K667: money | L667: 700
A668: 4102 | B668: 31-35 | C668: ruijinling | D668: challenge_tower | E668: =R[-16]C -> 2 | F668: 1 | G668: 5 | H668: 2 | I668: player_exp | J668: 74 | K668: money | L668: 740
A669: 4103 | B669: 31-35 | C669: ruijinling | D669: challenge_tower | E669: =R[-16]C -> 2 | F669: 1 | G669: 5 | H669: 2 | I669: player_exp | J669: 74 | K669: money | L669: 740
A670: 4104 | B670: 31-35 | C670: ruijinling | D670: challenge_tower | E670: =R[-16]C -> 2 | F670: 1 | G670: 5 | H670: 2 | I670: player_exp | J670: 74 | K670: money | L670: 740
A671: 4105 | B671: 31-35 | C671: ruijinling | D671: challenge_tower | E671: =R[-16]C -> 2 | F671: 1 | G671: 5 | H671: 2 | I671: player_exp | J671: 74 | K671: money | L671: 740
A672: 4106 | B672: 31-35 | C672: ruijinling | D672: challenge_tower | E672: =R[-16]C -> 2 | F672: 1 | G672: 5 | H672: 2 | I672: player_exp | J672: 74 | K672: money | L672: 740
A673: 4107 | B673: 31-35 | C673: ruijinling | D673: challenge_tower | E673: =R[-16]C -> 2 | F673: 1 | G673: 5 | H673: 2 | I673: player_exp | J673: 74 | K673: money | L673: 740
A674: 4108 | B674: 31-35 | C674: ruijinling | D674: challenge_tower | E674: =R[-16]C -> 2 | F674: 1 | G674: 5 | H674: 2 | I674: player_exp | J674: 74 | K674: money | L674: 740
A675: 4109 | B675: 31-35 | C675: ruijinling | D675: challenge_tower | E675: =R[-16]C -> 3 | F675: 1 | G675: 5 | H675: 3 | I675: player_exp | J675: 78 | K675: money | L675: 780
A676: 4110 | B676: 31-35 | C676: ruijinling | D676: challenge_tower | E676: =R[-16]C -> 3 | F676: 1 | G676: 5 | H676: 3 | I676: player_exp | J676: 78 | K676: money | L676: 780
A677: 4111 | B677: 31-35 | C677: ruijinling | D677: challenge_tower | E677: =R[-16]C -> 3 | F677: 1 | G677: 5 | H677: 3 | I677: player_exp | J677: 78 | K677: money | L677: 780
A678: 4112 | B678: 31-35 | C678: ruijinling | D678: challenge_tower | E678: =R[-16]C -> 3 | F678: 1 | G678: 5 | H678: 3 | I678: player_exp | J678: 78 | K678: money | L678: 780
A679: 4113 | B679: 36-40 | C679: ruijinling | D679: challenge_tower | E679: =R[-16]C -> 1 | F679: 1 | G679: 5 | H679: 1 | I679: player_exp | J679: 80 | K679: money | L679: 800
A680: 4114 | B680: 36-40 | C680: ruijinling | D680: challenge_tower | E680: =R[-16]C -> 1 | F680: 1 | G680: 5 | H680: 1 | I680: player_exp | J680: 80 | K680: money | L680: 800
A681: 4115 | B681: 36-40 | C681: ruijinling | D681: challenge_tower | E681: =R[-16]C -> 1 | F681: 1 | G681: 5 | H681: 1 | I681: player_exp | J681: 80 | K681: money | L681: 800
A682: 4116 | B682: 36-40 | C682: ruijinling | D682: challenge_tower | E682: =R[-16]C -> 1 | F682: 1 | G682: 5 | H682: 1 | I682: player_exp | J682: 80 | K682: money | L682: 800
A683: 4117 | B683: 36-40 | C683: ruijinling | D683: challenge_tower | E683: =R[-16]C -> 1 | F683: 1 | G683: 5 | H683: 1 | I683: player_exp | J683: 80 | K683: money | L683: 800
A684: 4118 | B684: 36-40 | C684: ruijinling | D684: challenge_tower | E684: =R[-16]C -> 2 | F684: 1 | G684: 5 | H684: 2 | I684: player_exp | J684: 84 | K684: money | L684: 840
A685: 4119 | B685: 36-40 | C685: ruijinling | D685: challenge_tower | E685: =R[-16]C -> 2 | F685: 1 | G685: 5 | H685: 2 | I685: player_exp | J685: 84 | K685: money | L685: 840
A686: 4120 | B686: 36-40 | C686: ruijinling | D686: challenge_tower | E686: =R[-16]C -> 2 | F686: 1 | G686: 5 | H686: 2 | I686: player_exp | J686: 84 | K686: money | L686: 840
A687: 4121 | B687: 36-40 | C687: ruijinling | D687: challenge_tower | E687: =R[-16]C -> 2 | F687: 1 | G687: 5 | H687: 2 | I687: player_exp | J687: 84 | K687: money | L687: 840
A688: 4122 | B688: 36-40 | C688: ruijinling | D688: challenge_tower | E688: =R[-16]C -> 2 | F688: 1 | G688: 5 | H688: 2 | I688: player_exp | J688: 84 | K688: money | L688: 840
A689: 4123 | B689: 36-40 | C689: ruijinling | D689: challenge_tower | E689: =R[-16]C -> 2 | F689: 1 | G689: 5 | H689: 2 | I689: player_exp | J689: 84 | K689: money | L689: 840
A690: 4124 | B690: 36-40 | C690: ruijinling | D690: challenge_tower | E690: =R[-16]C -> 2 | F690: 1 | G690: 5 | H690: 2 | I690: player_exp | J690: 84 | K690: money | L690: 840
A691: 4125 | B691: 36-40 | C691: ruijinling | D691: challenge_tower | E691: =R[-16]C -> 3 | F691: 1 | G691: 5 | H691: 3 | I691: player_exp | J691: 88 | K691: money | L691: 880
A692: 4126 | B692: 36-40 | C692: ruijinling | D692: challenge_tower | E692: =R[-16]C -> 3 | F692: 1 | G692: 5 | H692: 3 | I692: player_exp | J692: 88 | K692: money | L692: 880
A693: 4127 | B693: 36-40 | C693: ruijinling | D693: challenge_tower | E693: =R[-16]C -> 3 | F693: 1 | G693: 5 | H693: 3 | I693: player_exp | J693: 88 | K693: money | L693: 880
A694: 4128 | B694: 36-40 | C694: ruijinling | D694: challenge_tower | E694: =R[-16]C -> 3 | F694: 1 | G694: 5 | H694: 3 | I694: player_exp | J694: 88 | K694: money | L694: 880
A695: 4129 | B695: 41-45 | C695: ruijinling | D695: challenge_tower | E695: =R[-16]C -> 1 | F695: 1 | G695: 5 | H695: 1 | I695: player_exp | J695: 90 | K695: money | L695: 900
A696: 4130 | B696: 41-45 | C696: ruijinling | D696: challenge_tower | E696: =R[-16]C -> 1 | F696: 1 | G696: 5 | H696: 1 | I696: player_exp | J696: 90 | K696: money | L696: 900
A697: 4131 | B697: 41-45 | C697: ruijinling | D697: challenge_tower | E697: =R[-16]C -> 1 | F697: 1 | G697: 5 | H697: 1 | I697: player_exp | J697: 90 | K697: money | L697: 900
A698: 4132 | B698: 41-45 | C698: ruijinling | D698: challenge_tower | E698: =R[-16]C -> 1 | F698: 1 | G698: 5 | H698: 1 | I698: player_exp | J698: 90 | K698: money | L698: 900
A699: 4133 | B699: 41-45 | C699: ruijinling | D699: challenge_tower | E699: =R[-16]C -> 1 | F699: 1 | G699: 5 | H699: 1 | I699: player_exp | J699: 90 | K699: money | L699: 900
A700: 4134 | B700: 41-45 | C700: ruijinling | D700: challenge_tower | E700: =R[-16]C -> 2 | F700: 1 | G700: 5 | H700: 2 | I700: player_exp | J700: 94 | K700: money | L700: 940
A701: 4135 | B701: 41-45 | C701: ruijinling | D701: challenge_tower | E701: =R[-16]C -> 2 | F701: 1 | G701: 5 | H701: 2 | I701: player_exp | J701: 94 | K701: money | L701: 940
A702: 4136 | B702: 41-45 | C702: ruijinling | D702: challenge_tower | E702: =R[-16]C -> 2 | F702: 1 | G702: 5 | H702: 2 | I702: player_exp | J702: 94 | K702: money | L702: 940
A703: 4137 | B703: 41-45 | C703: ruijinling | D703: challenge_tower | E703: =R[-16]C -> 2 | F703: 1 | G703: 5 | H703: 2 | I703: player_exp | J703: 94 | K703: money | L703: 940
A704: 4138 | B704: 41-45 | C704: ruijinling | D704: challenge_tower | E704: =R[-16]C -> 2 | F704: 1 | G704: 5 | H704: 2 | I704: player_exp | J704: 94 | K704: money | L704: 940
A705: 4139 | B705: 41-45 | C705: ruijinling | D705: challenge_tower | E705: =R[-16]C -> 2 | F705: 1 | G705: 5 | H705: 2 | I705: player_exp | J705: 94 | K705: money | L705: 940
A706: 4140 | B706: 41-45 | C706: ruijinling | D706: challenge_tower | E706: =R[-16]C -> 2 | F706: 1 | G706: 5 | H706: 2 | I706: player_exp | J706: 94 | K706: money | L706: 940
A707: 4141 | B707: 41-45 | C707: ruijinling | D707: challenge_tower | E707: =R[-16]C -> 3 | F707: 1 | G707: 5 | H707: 3 | I707: player_exp | J707: 98 | K707: money | L707: 980
A708: 4142 | B708: 41-45 | C708: ruijinling | D708: challenge_tower | E708: =R[-16]C -> 3 | F708: 1 | G708: 5 | H708: 3 | I708: player_exp | J708: 98 | K708: money | L708: 980
A709: 4143 | B709: 41-45 | C709: ruijinling | D709: challenge_tower | E709: =R[-16]C -> 3 | F709: 1 | G709: 5 | H709: 3 | I709: player_exp | J709: 98 | K709: money | L709: 980
A710: 4144 | B710: 41-45 | C710: ruijinling | D710: challenge_tower | E710: =R[-16]C -> 3 | F710: 1 | G710: 5 | H710: 3 | I710: player_exp | J710: 98 | K710: money | L710: 980
A711: 4145 | B711: 46-50 | C711: ruijinling | D711: challenge_tower | E711: =R[-16]C -> 1 | F711: 1 | G711: 5 | H711: 1 | I711: player_exp | J711: 100 | K711: money | L711: 1000
A712: 4146 | B712: 46-50 | C712: ruijinling | D712: challenge_tower | E712: =R[-16]C -> 1 | F712: 1 | G712: 5 | H712: 1 | I712: player_exp | J712: 100 | K712: money | L712: 1000
A713: 4147 | B713: 46-50 | C713: ruijinling | D713: challenge_tower | E713: =R[-16]C -> 1 | F713: 1 | G713: 5 | H713: 1 | I713: player_exp | J713: 100 | K713: money | L713: 1000
A714: 4148 | B714: 46-50 | C714: ruijinling | D714: challenge_tower | E714: =R[-16]C -> 1 | F714: 1 | G714: 5 | H714: 1 | I714: player_exp | J714: 100 | K714: money | L714: 1000
A715: 4149 | B715: 46-50 | C715: ruijinling | D715: challenge_tower | E715: =R[-16]C -> 1 | F715: 1 | G715: 5 | H715: 1 | I715: player_exp | J715: 100 | K715: money | L715: 1000
A716: 4150 | B716: 46-50 | C716: ruijinling | D716: challenge_tower | E716: =R[-16]C -> 2 | F716: 1 | G716: 5 | H716: 2 | I716: player_exp | J716: 104 | K716: money | L716: 1040
A717: 4151 | B717: 46-50 | C717: ruijinling | D717: challenge_tower | E717: =R[-16]C -> 2 | F717: 1 | G717: 5 | H717: 2 | I717: player_exp | J717: 104 | K717: money | L717: 1040
A718: 4152 | B718: 46-50 | C718: ruijinling | D718: challenge_tower | E718: =R[-16]C -> 2 | F718: 1 | G718: 5 | H718: 2 | I718: player_exp | J718: 104 | K718: money | L718: 1040
A719: 4153 | B719: 46-50 | C719: ruijinling | D719: challenge_tower | E719: =R[-16]C -> 2 | F719: 1 | G719: 5 | H719: 2 | I719: player_exp | J719: 104 | K719: money | L719: 1040
A720: 4154 | B720: 46-50 | C720: ruijinling | D720: challenge_tower | E720: =R[-16]C -> 2 | F720: 1 | G720: 5 | H720: 2 | I720: player_exp | J720: 104 | K720: money | L720: 1040
A721: 4155 | B721: 46-50 | C721: ruijinling | D721: challenge_tower | E721: =R[-16]C -> 2 | F721: 1 | G721: 5 | H721: 2 | I721: player_exp | J721: 104 | K721: money | L721: 1040
A722: 4156 | B722: 46-50 | C722: ruijinling | D722: challenge_tower | E722: =R[-16]C -> 2 | F722: 1 | G722: 5 | H722: 2 | I722: player_exp | J722: 104 | K722: money | L722: 1040
A723: 4157 | B723: 46-50 | C723: ruijinling | D723: challenge_tower | E723: =R[-16]C -> 3 | F723: 1 | G723: 5 | H723: 3 | I723: player_exp | J723: 108 | K723: money | L723: 1080
A724: 4158 | B724: 46-50 | C724: ruijinling | D724: challenge_tower | E724: =R[-16]C -> 3 | F724: 1 | G724: 5 | H724: 3 | I724: player_exp | J724: 108 | K724: money | L724: 1080
A725: 4159 | B725: 46-50 | C725: ruijinling | D725: challenge_tower | E725: =R[-16]C -> 3 | F725: 1 | G725: 5 | H725: 3 | I725: player_exp | J725: 108 | K725: money | L725: 1080
A726: 4160 | B726: 46-50 | C726: ruijinling | D726: challenge_tower | E726: =R[-16]C -> 3 | F726: 1 | G726: 5 | H726: 3 | I726: player_exp | J726: 108 | K726: money | L726: 1080
A727: 4161 | B727: 51-55 | C727: ruijinling | D727: challenge_tower | E727: =R[-16]C -> 1 | F727: 1 | G727: 5 | H727: 1 | I727: player_exp | J727: 110 | K727: money | L727: 1100
A728: 4162 | B728: 51-55 | C728: ruijinling | D728: challenge_tower | E728: =R[-16]C -> 1 | F728: 1 | G728: 5 | H728: 1 | I728: player_exp | J728: 110 | K728: money | L728: 1100
A729: 4163 | B729: 51-55 | C729: ruijinling | D729: challenge_tower | E729: =R[-16]C -> 1 | F729: 1 | G729: 5 | H729: 1 | I729: player_exp | J729: 110 | K729: money | L729: 1100
A730: 4164 | B730: 51-55 | C730: ruijinling | D730: challenge_tower | E730: =R[-16]C -> 1 | F730: 1 | G730: 5 | H730: 1 | I730: player_exp | J730: 110 | K730: money | L730: 1100
A731: 4165 | B731: 51-55 | C731: ruijinling | D731: challenge_tower | E731: =R[-16]C -> 1 | F731: 1 | G731: 5 | H731: 1 | I731: player_exp | J731: 110 | K731: money | L731: 1100
A732: 4166 | B732: 51-55 | C732: ruijinling | D732: challenge_tower | E732: =R[-16]C -> 2 | F732: 1 | G732: 5 | H732: 2 | I732: player_exp | J732: 114 | K732: money | L732: 1140
A733: 4167 | B733: 51-55 | C733: ruijinling | D733: challenge_tower | E733: =R[-16]C -> 2 | F733: 1 | G733: 5 | H733: 2 | I733: player_exp | J733: 114 | K733: money | L733: 1140
A734: 4168 | B734: 51-55 | C734: ruijinling | D734: challenge_tower | E734: =R[-16]C -> 2 | F734: 1 | G734: 5 | H734: 2 | I734: player_exp | J734: 114 | K734: money | L734: 1140
A735: 4169 | B735: 51-55 | C735: ruijinling | D735: challenge_tower | E735: =R[-16]C -> 2 | F735: 1 | G735: 5 | H735: 2 | I735: player_exp | J735: 114 | K735: money | L735: 1140
A736: 4170 | B736: 51-55 | C736: ruijinling | D736: challenge_tower | E736: =R[-16]C -> 2 | F736: 1 | G736: 5 | H736: 2 | I736: player_exp | J736: 114 | K736: money | L736: 1140
A737: 4171 | B737: 51-55 | C737: ruijinling | D737: challenge_tower | E737: =R[-16]C -> 2 | F737: 1 | G737: 5 | H737: 2 | I737: player_exp | J737: 114 | K737: money | L737: 1140
A738: 4172 | B738: 51-55 | C738: ruijinling | D738: challenge_tower | E738: =R[-16]C -> 2 | F738: 1 | G738: 5 | H738: 2 | I738: player_exp | J738: 114 | K738: money | L738: 1140
A739: 4173 | B739: 51-55 | C739: ruijinling | D739: challenge_tower | E739: =R[-16]C -> 3 | F739: 1 | G739: 5 | H739: 3 | I739: player_exp | J739: 118 | K739: money | L739: 1180
A740: 4174 | B740: 51-55 | C740: ruijinling | D740: challenge_tower | E740: =R[-16]C -> 3 | F740: 1 | G740: 5 | H740: 3 | I740: player_exp | J740: 118 | K740: money | L740: 1180
A741: 4175 | B741: 51-55 | C741: ruijinling | D741: challenge_tower | E741: =R[-16]C -> 3 | F741: 1 | G741: 5 | H741: 3 | I741: player_exp | J741: 118 | K741: money | L741: 1180
A742: 4176 | B742: 51-55 | C742: ruijinling | D742: challenge_tower | E742: =R[-16]C -> 3 | F742: 1 | G742: 5 | H742: 3 | I742: player_exp | J742: 118 | K742: money | L742: 1180
A743: 4177 | B743: 56-60 | C743: ruijinling | D743: challenge_tower | E743: =R[-16]C -> 1 | F743: 1 | G743: 5 | H743: 1 | I743: player_exp | J743: 120 | K743: money | L743: 1200
A744: 4178 | B744: 56-60 | C744: ruijinling | D744: challenge_tower | E744: =R[-16]C -> 1 | F744: 1 | G744: 5 | H744: 1 | I744: player_exp | J744: 120 | K744: money | L744: 1200
A745: 4179 | B745: 56-60 | C745: ruijinling | D745: challenge_tower | E745: =R[-16]C -> 1 | F745: 1 | G745: 5 | H745: 1 | I745: player_exp | J745: 120 | K745: money | L745: 1200
A746: 4180 | B746: 56-60 | C746: ruijinling | D746: challenge_tower | E746: =R[-16]C -> 1 | F746: 1 | G746: 5 | H746: 1 | I746: player_exp | J746: 120 | K746: money | L746: 1200
A747: 4181 | B747: 56-60 | C747: ruijinling | D747: challenge_tower | E747: =R[-16]C -> 1 | F747: 1 | G747: 5 | H747: 1 | I747: player_exp | J747: 120 | K747: money | L747: 1200
A748: 4182 | B748: 56-60 | C748: ruijinling | D748: challenge_tower | E748: =R[-16]C -> 2 | F748: 1 | G748: 5 | H748: 2 | I748: player_exp | J748: 124 | K748: money | L748: 1240
A749: 4183 | B749: 56-60 | C749: ruijinling | D749: challenge_tower | E749: =R[-16]C -> 2 | F749: 1 | G749: 5 | H749: 2 | I749: player_exp | J749: 124 | K749: money | L749: 1240
A750: 4184 | B750: 56-60 | C750: ruijinling | D750: challenge_tower | E750: =R[-16]C -> 2 | F750: 1 | G750: 5 | H750: 2 | I750: player_exp | J750: 124 | K750: money | L750: 1240
A751: 4185 | B751: 56-60 | C751: ruijinling | D751: challenge_tower | E751: =R[-16]C -> 2 | F751: 1 | G751: 5 | H751: 2 | I751: player_exp | J751: 124 | K751: money | L751: 1240
A752: 4186 | B752: 56-60 | C752: ruijinling | D752: challenge_tower | E752: =R[-16]C -> 2 | F752: 1 | G752: 5 | H752: 2 | I752: player_exp | J752: 124 | K752: money | L752: 1240
A753: 4187 | B753: 56-60 | C753: ruijinling | D753: challenge_tower | E753: =R[-16]C -> 2 | F753: 1 | G753: 5 | H753: 2 | I753: player_exp | J753: 124 | K753: money | L753: 1240
A754: 4188 | B754: 56-60 | C754: ruijinling | D754: challenge_tower | E754: =R[-16]C -> 2 | F754: 1 | G754: 5 | H754: 2 | I754: player_exp | J754: 124 | K754: money | L754: 1240
A755: 4189 | B755: 56-60 | C755: ruijinling | D755: challenge_tower | E755: =R[-16]C -> 3 | F755: 1 | G755: 5 | H755: 3 | I755: player_exp | J755: 128 | K755: money | L755: 1280
A756: 4190 | B756: 56-60 | C756: ruijinling | D756: challenge_tower | E756: =R[-16]C -> 3 | F756: 1 | G756: 5 | H756: 3 | I756: player_exp | J756: 128 | K756: money | L756: 1280
A757: 4191 | B757: 56-60 | C757: ruijinling | D757: challenge_tower | E757: =R[-16]C -> 3 | F757: 1 | G757: 5 | H757: 3 | I757: player_exp | J757: 128 | K757: money | L757: 1280
A758: 4192 | B758: 56-60 | C758: ruijinling | D758: challenge_tower | E758: =R[-16]C -> 3 | F758: 1 | G758: 5 | H758: 3 | I758: player_exp | J758: 128 | K758: money | L758: 1280

Sheet: 活跃度任务表
A1: id | B1: 基本任务id | C1: 基本任务参数 | D1: 任务次数 | E1: 活跃值
A2: id | B2: base_quest_id | C2: base_quest_params | D2: active_quest_times | E2: active_degree
A3: 1 | B3: login | D3: 1 | E3: 5
A4: 2 | B4: kill_monster | D4: 10 | E4: 2
A5: 3 | B5: fight_player | D5: 5 | E5: 2
A6: 4 | B6: fight_stranger | D6: 10 | E6: 2
A7: 5 | B7: tax_stranger | D7: 1 | E7: 5
A8: 6 | B8: free_friend | D8: 1 | E8: 5
A9: 7 | B9: improve_amr | D9: 5 | E9: 2
A10: 8 | B10: inlay_amr | D10: 5 | E10: 2
A11: 9 | B11: refresh_inn | D11: 1 | E11: 5
A12: 10 | B12: visit_friend | D12: 5 | E12: 2

Sheet: export
A1: sheet_name | B1: export_name
A2: 基本任务表 | B2: base_quest_list
A3: 通关任务配置表 | B3: chapter_quest_settings
A4: 每日任务配置表 | B4: everyday_quest_settings
A5: 每日任务类型表 | B5: everyday_quest_type_list
A6: 活跃度任务表 | B6: active_degree_quest_list