Sheet: 系统表说明
A1: 表功能说明：
A2: 招募金钱常量表 | B2: 配置客栈中招募侠客所需要耗费的金钱
A3: 招募概率常量表 | B3: 配置客栈中刷出某星级侠客所对应的概率
A4: 客栈配置表 | B4: 配置客栈中可刷出的侠客
A5: 装备类型常量表 | B5: 失效
A6: 装备类型表 | B6: 配置装备类型
A7: 阵法表 | B7: 未启用
A8: 好友加成位解锁表 | B8: 配置采矿、炼兵中好友加成位置的解锁条件
A9: 常用参数表 | B9: 配置各种系统参数
A10: 商城表 | B10: 配置在商城中售卖的物品
A11: 练功房参数表 | B11: 配置练功房相关参数
A12: 触发式弹出条件表 | B12: 配置新手指引的切入条件
A13: 侠客合成表 | B13: 配置侠客合成卡及所需材料
A14: 消息表 | B14: 配置消息
A15: 物品价值表 | B15: 配置物品价格，供拆解功能反计算
A16: 商城随机商品表 | B16: 配置商城中随机刷出的商品
A17: 元宝充值表 | B17: 新浪客户端元宝充值的选项配置

Sheet: 招募金钱常量表
B1: 常量值 | C1: 花费费用
A2: id | B2: const | C2: cost
A3: 1 | B3: D0 | C3: 1000
A4: 2 | B4: D1 | C4: 1000
A5: 3 | B5: D2 | C5: 1000
A6: 4 | B6: D3 | C6: 1000
A7: 5 | B7: D4 | C7: 1000
A8: 6 | B8: C0 | C8: =R[-5]C*5 -> 5000
A9: 7 | B9: C1 | C9: =R[-5]C*5 -> 5000
A10: 8 | B10: C2 | C10: =R[-5]C*5 -> 5000
A11: 9 | B11: C3 | C11: =R[-5]C*5 -> 5000
A12: 10 | B12: C4 | C12: =R[-5]C*5 -> 5000
A13: 11 | B13: B0 | C13: =R[-5]C*5 -> 25000
A14: 12 | B14: B1 | C14: =R[-5]C*5 -> 25000
A15: 13 | B15: B2 | C15: =R[-5]C*5 -> 25000
A16: 14 | B16: B3 | C16: =R[-5]C*5 -> 25000
A17: 15 | B17: B4 | C17: =R[-5]C*5 -> 25000
A18: 16 | B18: A0 | C18: =R[-5]C*5 -> 125000
A19: 17 | B19: A1 | C19: =R[-5]C*5 -> 125000
A20: 18 | B20: A2 | C20: =R[-5]C*5 -> 125000
A21: 19 | B21: A3 | C21: =R[-5]C*5 -> 125000
A22: 20 | B22: A4 | C22: =R[-5]C*5 -> 125000
A23: 21 | B23: S0 | C23: =R[-5]C*5 -> 625000
A24: 22 | B24: S1 | C24: =R[-5]C*5 -> 625000
A25: 23 | B25: S2 | C25: =R[-5]C*5 -> 625000
A26: 24 | B26: S3 | C26: =R[-5]C*5 -> 625000
A27: 25 | B27: S4 | C27: =R[-5]C*5 -> 625000

Sheet: 招募概率常量表
A1: id | B1: 常量值 | C1: 概率值
A2: id | B2: const | C2: rate
A3: 1 | B3: 0 | C3: 0
A4: 2 | B4: D0 | C4: *
A5: 3 | B5: D1 | C5: 0
A6: 4 | B6: D2 | C6: 0
A7: 5 | B7: D3 | C7: 0
A8: 6 | B8: D4 | C8: 0
A9: 7 | B9: C0 | C9: =100000/COUNTIF(客栈配置表!R[-6]C[2]:R[147]C[2],"C0") -> 3448.2758620689656
A10: 8 | B10: C1 | C10: 0
A11: 9 | B11: C2 | C11: 0
A12: 10 | B12: C3 | C12: 0
A13: 11 | B13: C4 | C13: 0
A14: 12 | B14: B0 | C14: =5000/COUNTIF(客栈配置表!R[-11]C[2]:R[142]C[2],"B0") -> 128.2051282051282
A15: 13 | B15: B1 | C15: 0
A16: 14 | B16: B2 | C16: 0
A17: 15 | B17: B3 | C17: 0
A18: 16 | B18: B4 | C18: 0
A19: 17 | B19: A0 | C19: 1
A20: 18 | B20: A1 | C20: 0
A21: 19 | B21: A2 | C21: 0
A22: 20 | B22: A3 | C22: 0
A23: 21 | B23: A4 | C23: 0
A24: 22 | B24: S0 | C24: 0
A25: 23 | B25: S1 | C25: 0
A26: 24 | B26: S2 | C26: 0
A27: 25 | B27: S3 | C27: 0
A28: 26 | B28: S4 | C28: 0

Sheet: 客栈配置表
B1: 招募ID | C1: 侠客ID | D1: 等级限制 | E1: 出现概率 | F1: 招募金钱 | G1: 宴请贴
A2: b | B2: id | C2: hero_id | D2: level_limit | E2: rate | F2: cost | G2: randomable
A3: 天 | B3: 35 | C3: 白世镜 | D3: 火 | E3: A0 | F3: A0 | G3: 1
A4: 射 | B4: 273 | C4: 武眠风 | D4: 火 | E4: A0 | F4: A0 | G4: 1
A5: 射 | B5: 274 | C5: 冯默风 | D5: 火 | E5: A0 | F5: A0 | G5: 1
A6: 射 | B6: 275 | C6: 陈玄风 | D6: 火 | E6: A0 | F6: A0 | G6: 1
A7: 射 | B7: 289 | C7: 灭绝师太 | D7: 火 | E7: 0 | F7: A0 | G7: 0
A8: 射 | B8: 395 | C8: 公孙止 | D8: 火 | E8: 0 | F8: A0 | G8: 0
A9: 笑 | B9: 519 | C9: 宁中则 | D9: 火 | E9: 0 | F9: A0 | G9: 0
A10: 笑 | B10: 544 | C10: 黄钟公 | D10: 火 | E10: A0 | F10: A0 | G10: 1
A11: 笑 | B11: 545 | C11: 平一指 | D11: 火 | E11: A0 | F11: A0 | G11: 1
A12: 笑 | B12: 546 | C12: 田伯光 | D12: 火 | E12: A0 | F12: A0 | G12: 1
A13: 笑 | B13: 629 | C13: 左冷禅 | D13: 火 | E13: 0 | F13: A0 | G13: 0
A14: 笑 | B14: 630 | C14: 费彬 | D14: 火 | E14: A0 | F14: A0 | G14: 1
A15: 天 | B15: 32 | C15: 巴天石 | D15: 金 | E15: A0 | F15: A0 | G15: 1
A16: 天 | B16: 33 | C16: 范骅 | D16: 金 | E16: A0 | F16: A0 | G16: 1
A17: 天 | B17: 34 | C17: 华赫艮 | D17: 金 | E17: A0 | F17: A0 | G17: 1
A18: 天 | B18: 36 | C18: 陈孤雁 | D18: 金 | E18: A0 | F18: A0 | G18: 1
A19: 天 | B19: 37 | C19: 全冠清 | D19: 金 | E19: A0 | F19: A0 | G19: 1
A20: 天 | B20: 46 | C20: 赵钱孙 | D20: 金 | E20: A0 | F20: A0 | G20: 1
A21: 天 | B21: 56 | C21: 刀白凤 | D21: 金 | E21: A0 | F21: A0 | G21: 1
A22: 天 | B22: 62 | C22: 秦红棉 | D22: 金 | E22: 0 | F22: A0 | G22: 0
A23: 天 | B23: 64 | C23: 五叶大师 | D23: 金 | E23: A0 | F23: A0 | G23: 1
A24: 天 | B24: 65 | C24: 叶二娘 | D24: 金 | E24: A0 | F24: A0 | G24: 1
A25: 天 | B25: 68 | C25: 岳老三 | D25: 金 | E25: A0 | F25: A0 | G25: 1
A26: 天 | B26: 92 | C26: 范百龄 | D26: 金 | E26: A0 | F26: A0 | G26: 1
A27: 天 | B27: 69 | C27: 云中鹤 | D27: 木 | E27: 0 | F27: A0 | G27: 0
A28: 天 | B28: 83 | C28: 玄惭 | D28: 木 | E28: A0 | F28: A0 | G28: 1
A29: 天 | B29: 86 | C29: 玄苦 | D29: 木 | E29: A0 | F29: A0 | G29: 1
A30: 射 | B30: 191 | C30: 苦乘 | D30: 木 | E30: A0 | F30: A0 | G30: 1
A31: 射 | B31: 196 | C31: 圆音 | D31: 木 | E31: A0 | F31: A0 | G31: 1
A32: 射 | B32: 215 | C32: 鲁有脚 | D32: 木 | E32: A0 | F32: A0 | G32: 1
A33: 射 | B33: 242 | C33: 丘处机 | D33: 木 | E33: A0 | F33: A0 | G33: 1
A34: 射 | B34: 352 | C34: 潇湘子 | D34: 木 | E34: A0 | F34: A0 | G34: 1
A35: 射 | B35: 356 | C35: 欧阳克 | D35: 木 | E35: 0 | F35: A0 | G35: 0
A36: 笑 | B36: 507 | C36: 莫大先生 | D36: 木 | E36: 0 | F36: A0 | G36: 0
A37: 笑 | B37: 508 | C37: 刘正风 | D37: 木 | E37: A0 | F37: A0 | G37: 1
A38: 天 | B38: 48 | C38: 包不同 | D38: 水 | E38: A0 | F38: A0 | G38: 1
A39: 天 | B39: 49 | C39: 邓百川 | D39: 水 | E39: A0 | F39: A0 | G39: 1
A40: 天 | B40: 50 | C40: 风波恶 | D40: 水 | E40: A0 | F40: A0 | G40: 1
A41: 天 | B41: 51 | C41: 公冶乾 | D41: 水 | E41: A0 | F41: A0 | G41: 1
A42: 天 | B42: 52 | C42: 王语嫣 | D42: 水 | E42: 0 | F42: A0 | G42: 0
A43: 射 | B43: 271 | C43: 梅超风 | D43: 水 | E43: 0 | F43: A0 | G43: 0
A44: 射 | B44: 272 | C44: 陆乘风 | D44: 水 | E44: A0 | F44: A0 | G44: 1
A45: 笑 | B45: 472 | C45: 定静师太 | D45: 水 | E45: A0 | F45: A0 | G45: 1
A46: 笑 | B46: 473 | C46: 定闲师太 | D46: 水 | E46: A0 | F46: A0 | G46: 1
A47: 笑 | B47: 496 | C47: 哑婆婆 | D47: 水 | E47: A0 | F47: A0 | G47: 1
A48: 笑 | B48: 535 | C48: 计无施 | D48: 水 | E48: A0 | F48: A0 | G48: 1
A49: 笑 | B49: 543 | C49: 木高峰 | D49: 水 | E49: A0 | F49: A0 | G49: 1
A50: 天 | B50: 31 | C50: 高升泰 | D50: 土 | E50: A0 | F50: A0 | G50: 1
A51: 射 | B51: 243 | C51: 尹志平 | D51: 土 | E51: A0 | F51: A0 | G51: 1
A52: 射 | B52: 245 | C52: 刘处玄 | D52: 土 | E52: A0 | F52: A0 | G52: 1
A53: 射 | B53: 248 | C53: 王处一 | D53: 土 | E53: A0 | F53: A0 | G53: 1
A54: 射 | B54: 305 | C54: 赵敏 | D54: 土 | E54: 0 | F54: A0 | G54: 0
A55: 射 | B55: 307 | C55: 说不得 | D55: 土 | E55: A0 | F55: A0 | G55: 1
A56: 射 | B56: 312 | C56: 小昭 | D56: 土 | E56: A0 | F56: A0 | G56: 1
A57: 射 | B57: 341 | C57: 俞岱岩 | D57: 土 | E57: 0 | F57: A0 | G57: 0
A58: 射 | B58: 342 | C58: 张松溪 | D58: 土 | E58: A0 | F58: A0 | G58: 1
A59: 射 | B59: 345 | C59: 莫声谷 | D59: 土 | E59: A0 | F59: A0 | G59: 1
A60: 笑 | B60: 476 | C60: 林远图 | D60: 土 | E60: 0 | F60: A0 | G60: 0
A61: 笑 | B61: 582 | C61: 余沧海 | D61: 土 | E61: 0 | F61: A0 | G61: 0
A62: 天 | B62: 143 | C62: 慧方 | D62: 火 | E62: B0 | F62: B0 | G62: 1
A63: 天 | B63: 154 | C63: 摘星子 | D63: 火 | E63: B0 | F63: B0 | G63: 1
A64: 天 | B64: 155 | C64: 钟灵 | D64: 火 | E64: B0 | F64: B0 | G64: 1
A65: 射 | B65: 359 | C65: 侯通海 | D65: 火 | E65: B0 | F65: B0 | G65: 1
A66: 射 | B66: 366 | C66: 忽都虎 | D66: 火 | E66: B0 | F66: B0 | G66: 1
A67: 射 | B67: 367 | C67: 哲别 | D67: 火 | E67: 0 | F67: B0 | G67: 0
A68: 笑 | B68: 548 | C68: 林震南 | D68: 火 | E68: 0 | F68: B0 | G68: 0
A69: 笑 | B69: 553 | C69: 桃根仙 | D69: 火 | E69: B0 | F69: B0 | G69: 1
A70: 笑 | B70: 617 | C70: 杨莲亭 | D70: 火 | E70: B0 | F70: B0 | G70: 1
A71: 天 | B71: 100 | C71: 褚万里 | D71: 金 | E71: B0 | F71: B0 | G71: 1
A72: 天 | B72: 101 | C72: 傅思归 | D72: 金 | E72: B0 | F72: B0 | G72: 1
A73: 天 | B73: 102 | C73: 古笃诚 | D73: 金 | E73: B0 | F73: B0 | G73: 1
A74: 天 | B74: 103 | C74: 朱丹臣 | D74: 金 | E74: B0 | F74: B0 | G74: 1
A75: 射 | B75: 219 | C75: 史火龙 | D75: 金 | E75: B0 | F75: B0 | G75: 1
A76: 射 | B76: 317 | C76: 辛然 | D76: 金 | E76: B0 | F76: B0 | G76: 1
A77: 射 | B77: 411 | C77: 全金发 | D77: 金 | E77: 0 | F77: B0 | G77: 0
A78: 笑 | B78: 520 | C78: 岳灵珊 | D78: 金 | E78: B0 | F78: B0 | G78: 1
A79: 笑 | B79: 521 | C79: 劳德诺 | D79: 金 | E79: B0 | F79: B0 | G79: 1
A80: 笑 | B80: 657 | C80: 清虚道长 | D80: 金 | E80: B0 | F80: B0 | G80: 1
A81: 天 | B81: 113 | C81: 鲍千灵 | D81: 木 | E81: B0 | F81: B0 | G81: 1
A82: 天 | B82: 123 | C82: 李清露 | D82: 木 | E82: B0 | F82: B0 | G82: 1
A83: 天 | B83: 124 | C83: 木婉清 | D83: 木 | E83: 0 | F83: B0 | G83: 0
A84: 天 | B84: 152 | C84: 阿紫 | D84: 木 | E84: B0 | F84: B0 | G84: 1
A85: 射 | B85: 257 | C85: 赵志敬 | D85: 木 | E85: 0 | F85: B0 | G85: 0
A86: 射 | B86: 291 | C86: 静虚师太 | D86: 木 | E86: B0 | F86: B0 | G86: 1
A87: 射 | B87: 293 | C87: 静慧师太 | D87: 木 | E87: B0 | F87: B0 | G87: 1
A88: 笑 | B88: 584 | C88: 申人俊 | D88: 木 | E88: B0 | F88: B0 | G88: 1
A89: 笑 | B89: 625 | C89: 觉月 | D89: 木 | E89: B0 | F89: B0 | G89: 1
A90: 天 | B90: 109 | C90: 阿朱 | D90: 水 | E90: B0 | F90: B0 | G90: 1
A91: 天 | B91: 110 | C91: 平婆婆 | D91: 水 | E91: B0 | F91: B0 | G91: 1
A92: 天 | B92: 111 | C92: 瑞婆婆 | D92: 水 | E92: B0 | F92: B0 | G92: 1
A93: 天 | B93: 121 | C93: 甘宝宝 | D93: 水 | E93: B0 | F93: B0 | G93: 1
A94: 天 | B94: 122 | C94: 过彦之 | D94: 水 | E94: B0 | F94: B0 | G94: 1
A95: 射 | B95: 251 | C95: 程瑶迦 | D95: 水 | E95: B0 | F95: B0 | G95: 1
A96: 射 | B96: 252 | C96: 李志常 | D96: 水 | E96: B0 | F96: B0 | G96: 1
A97: 射 | B97: 412 | C97: 韩小莹 | D97: 水 | E97: B0 | F97: B0 | G97: 1
A98: 笑 | B98: 497 | C98: 仪琳 | D98: 水 | E98: B0 | F98: B0 | G98: 1
A99: 天 | B99: 150 | C99: 止渊 | D99: 土 | E99: B0 | F99: B0 | G99: 1
A100: 射 | B100: 199 | C100: 慧风 | D100: 土 | E100: B0 | F100: B0 | G100: 1
A101: 射 | B101: 369 | C101: 完颜洪烈 | D101: 土 | E101: 0 | F101: B0 | G101: 0
A102: 射 | B102: 370 | C102: 霍都 | D102: 土 | E102: B0 | F102: B0 | G102: 1
A103: 射 | B103: 406 | C103: 柯镇恶 | D103: 土 | E103: 0 | F103: B0 | G103: 0
A104: 射 | B104: 407 | C104: 朱聪 | D104: 土 | E104: B0 | F104: B0 | G104: 1
A105: 射 | B105: 408 | C105: 韩宝驹 | D105: 土 | E105: B0 | F105: B0 | G105: 1
A106: 射 | B106: 409 | C106: 南希仁 | D106: 土 | E106: B0 | F106: B0 | G106: 1
A107: 射 | B107: 410 | C107: 张阿生 | D107: 土 | E107: B0 | F107: B0 | G107: 1
A108: 天 | B108: 161 | C108: 完颜阿骨打 | D108: 火 | E108: C0 | F108: C0 | G108: 1
A109: 天 | B109: 176 | C109: 出尘子 | D109: 金 | E109: C0 | F109: C0 | G109: 1
A110: 天 | B110: 177 | C110: 狮吼子 | D110: 木 | E110: C0 | F110: C0 | G110: 1
A111: 天 | B111: 178 | C111: 天狼子 | D111: 水 | E111: C0 | F111: C0 | G111: 1
A112: 射 | B112: 231 | C112: 陆无双 | D112: 水 | E112: C0 | F112: C0 | G112: 1
A113: 射 | B113: 319 | C113: 大圣宝树王 | D113: 金 | E113: C0 | F113: C0 | G113: 1
A114: 射 | B114: 320 | C114: 智慧宝树王 | D114: 木 | E114: C0 | F114: C0 | G114: 1
A115: 射 | B115: 321 | C115: 常胜宝树王 | D115: 土 | E115: C0 | F115: C0 | G115: 1
A116: 射 | B116: 373 | C116: 沈青刚 | D116: 金 | E116: C0 | F116: C0 | G116: 1
A117: 射 | B117: 374 | C117: 吴青烈 | D117: 木 | E117: C0 | F117: C0 | G117: 1
A118: 射 | B118: 375 | C118: 马青雄 | D118: 土 | E118: C0 | F118: C0 | G118: 1
A119: 射 | B119: 376 | C119: 钱青健 | D119: 火 | E119: C0 | F119: C0 | G119: 1
A120: 射 | B120: 448 | C120: 梅石坚 | D120: 金 | E120: C0 | F120: C0 | G120: 1
A121: 射 | B121: 450 | C121: 郭芙 | D121: 木 | E121: C0 | F121: C0 | G121: 1
A122: 射 | B122: 451 | C122: 穆念慈 | D122: 水 | E122: C0 | F122: C0 | G122: 1
A123: 射 | B123: 452 | C123: 郭啸天 | D123: 火 | E123: C0 | F123: C0 | G123: 1
A124: 射 | B124: 453 | C124: 杨铁心 | D124: 土 | E124: C0 | F124: C0 | G124: 1
A125: 射 | B125: 462 | C125: 过三拳 | D125: 金 | E125: C0 | F125: C0 | G125: 1
A126: 笑 | B126: 478 | C126: 史镖头 | D126: 水 | E126: C0 | F126: C0 | G126: 1
A127: 笑 | B127: 479 | C127: 郑镖头 | D127: 火 | E127: C0 | F127: C0 | G127: 1
A128: 笑 | B128: 480 | C128: 富镖头 | D128: 土 | E128: C0 | F128: C0 | G128: 1
A129: 笑 | B129: 498 | C129: 仪光 | D129: 水 | E129: C0 | F129: C0 | G129: 1
A130: 笑 | B130: 499 | C130: 仪和 | D130: 火 | E130: C0 | F130: C0 | G130: 1
A131: 笑 | B131: 500 | C131: 仪清 | D131: 土 | E131: C0 | F131: C0 | G131: 1
A132: 笑 | B132: 588 | C132: 余人彦 | D132: 金 | E132: C0 | F132: C0 | G132: 1
A133: 笑 | B133: 593 | C133: 候人英 | D133: 木 | E133: C0 | F133: C0 | G133: 1
A134: 笑 | B134: 594 | C134: 洪人雄 | D134: 水 | E134: C0 | F134: C0 | G134: 1
A135: 笑 | B135: 595 | C135: 于人豪 | D135: 火 | E135: C0 | F135: C0 | G135: 1
A136: 笑 | B136: 596 | C136: 罗人杰 | D136: 土 | E136: C0 | F136: C0 | G136: 1
A137: 天 | B137: 179 | C137: 青松 | D137: 金 | E137: D0 | F137: D0 | G137: 1
A138: 天 | B138: 180 | C138: 缘根 | D138: 木 | E138: D0 | F138: D0 | G138: 1
A139: 射 | B139: 212 | C139: 武三娘 | D139: 水 | E139: D0 | F139: D0 | G139: 1
A140: 射 | B140: 223 | C140: 王十三 | D140: 火 | E140: D0 | F140: D0 | G140: 1
A141: 射 | B141: 259 | C141: 皮清玄 | D141: 土 | E141: D0 | F141: D0 | G141: 1
A142: 射 | B142: 260 | C142: 姬清虚 | D142: 金 | E142: D0 | F142: D0 | G142: 1
A143: 射 | B143: 261 | C143: 申志凡 | D143: 木 | E143: D0 | F143: D0 | G143: 1
A144: 射 | B144: 262 | C144: 祈志诚 | D144: 水 | E144: D0 | F144: D0 | G144: 1
A145: 射 | B145: 263 | C145: 宋德方 | D145: 火 | E145: D0 | F145: D0 | G145: 1
A146: 射 | B146: 334 | C146: 殷无福 | D146: 土 | E146: D0 | F146: D0 | G146: 1
A147: 射 | B147: 335 | C147: 殷无禄 | D147: 金 | E147: D0 | F147: D0 | G147: 1
A148: 射 | B148: 336 | C148: 殷无寿 | D148: 木 | E148: D0 | F148: D0 | G148: 1
A149: 射 | B149: 383 | C149: 札木合 | D149: 水 | E149: D0 | F149: D0 | G149: 1
A150: 射 | B150: 384 | C150: 桑昆 | D150: 火 | E150: D0 | F150: D0 | G150: 1
A151: 射 | B151: 385 | C151: 都史 | D151: 土 | E151: D0 | F151: D0 | G151: 1
A152: 射 | B152: 470 | C152: 陆立鼎 | D152: 金 | E152: D0 | F152: D0 | G152: 1
A153: 射 | B153: 471 | C153: 陆二娘 | D153: 木 | E153: D0 | F153: D0 | G153: 1
A154: 笑 | B154: 492 | C154: 白二 | D154: 水 | E154: D0 | F154: D0 | G154: 1
A155: 笑 | B155: 493 | C155: 陈七 | D155: 火 | E155: D0 | F155: D0 | G155: 1
A156: 笑 | B156: 573 | C156: 陈歪嘴 | D156: 土 | E156: D0 | F156: D0 | G156: 1

Sheet: 装备类型常量表
A1: id | B1: 武器类型 | C1: 值
A2: id | B2: equip_type | C2: const
A3: 1 | B3: 武器 | C3: weapon
A4: 2 | B4: 防具 | C4: armor
A5: 3 | B5: 饰品 | C5: ornament
A6: 4 | B6: 空手 | C6: none
A7: 5 | B7: 护腕 | C7: cuff
A8: 6 | B8: 刀 | C8: blade
A9: 7 | B9: 剑 | C9: sword
A10: 8 | B10: 枪 | C10: pike
A11: 9 | B11: 棍 | C11: stick
A12: 10 | B12: 棒 | C12: club
A13: 11 | B13: 杖 | C13: staff
A14: 12 | B14: 鞭 | C14: whip
A15: 13 | B15: 布袍 | C15: cloth
A16: 14 | B16: 皮衣 | C16: leather
A17: 15 | B17: 铠甲 | C17: plate
A18: 16 | B18: 头饰 | C18: headdress
A19: 17 | B19: 挂饰 | C19: neckless
A20: 18 | B20: 戒指 | C20: ring

Sheet: 装备类型表
A1: id | B1: 装备名称 | C1: 强化水晶id | D1: 碎片id
A2: id | B2: name | C2: crystal_id | D2: frag_id
A3: weapon | B3: 武器 | C3: 1 | D3: 1
A4: armor | B4: 防具 | C4: 2 | D4: 2
A5: ornament | B5: 饰品 | C5: 3 | D5: 3

Sheet: 阵法表
A1: id | B1: 阵法名 | C1: 图片 | D1: 位置1效果 | E1: 效果值 | F1: 位置2效果 | G1: 效果值 | H1: 位置3效果 | I1: 效果值 | J1: 位置4效果 | K1: 效果值 | L1: 位置5效果 | M1: 效果值 | N1: 位置6效果 | O1: 效果值
A2: id | B2: name | C2: img | D2: effect1 | E2: effect_v | F2: effect2 | G2: effect_v | H2: effect3 | I2: effect_v | J2: effect4 | K2: effect_v | L2: effect5 | M2: effect_v | N2: effect6 | O2: effect_v
A3: 1 | B3: 一字长蛇 | D3: ch_defence_p | E3: 100 | F3: ch_defence_p | G3: 100 | H3: ch_defence_p | I3: 100 | J3: ch_defence_p | K3: 100 | L3: ch_defence_p | M3: 100 | N3: ch_defence_p | O3: 100
A4: 2 | B4: 二龙出水 | D4: ch_attack_p | E4: 100 | F4: ch_attack_p | G4: 100 | H4: ch_attack_p | I4: 100 | J4: ch_attack_p | K4: 100 | L4: ch_attack_p | M4: 100 | N4: ch_attack_p | O4: 100
A5: 3 | B5: 天地三才 | D5: ch_dodge_p | E5: 100 | F5: ch_dodge_p | G5: 100 | H5: ch_dodge_p | I5: 100 | J5: ch_dodge_p | K5: 100 | L5: ch_dodge_p | M5: 100 | N5: ch_dodge_p | O5: 100
A6: 4 | B6: 四门兜底 | D6: ch_crit_p | E6: 100 | F6: ch_crit_p | G6: 100 | H6: ch_crit_p | I6: 100 | J6: ch_crit_p | K6: 100 | L6: ch_crit_p | M6: 100 | N6: ch_crit_p | O6: 100
A7: 5 | B7: 虎群羊阵 | D7: ch_defence_p | E7: 100 | F7: ch_defence_p | G7: 100 | H7: ch_defence_p | I7: 100 | J7: ch_attack_p | K7: 100 | L7: ch_attack_p | M7: 100 | N7: ch_attack_p | O7: 100
A8: 6 | B8: 六丁六甲 | D8: ch_attack_p | E8: 100 | F8: ch_attack_p | G8: 100 | H8: ch_attack_p | I8: 100 | J8: ch_defence_p | K8: 100 | L8: ch_defence_p | M8: 100 | N8: ch_defence_p | O8: 100
A9: 7 | B9: 七星北斗 | D9: ch_crit_p | E9: 100 | F9: ch_crit_p | G9: 100 | H9: ch_crit_p | I9: 100 | J9: ch_defence_p | K9: 100 | L9: ch_defence_p | M9: 100 | N9: ch_defence_p | O9: 100
A10: 8 | B10: 八门金锁 | D10: ch_dodge_p | E10: 100 | F10: ch_dodge_p | G10: 100 | H10: ch_dodge_p | I10: 100 | J10: ch_crit_p | K10: 100 | L10: ch_crit_p | M10: 100 | N10: ch_crit_p | O10: 100
A11: 9 | B11: 九字连环 | D11: ch_crit_p | E11: 100 | F11: ch_crit_p | G11: 100 | H11: ch_crit_p | I11: 100 | J11: ch_dodge_p | K11: 100 | L11: ch_dodge_p | M11: 100 | N11: ch_dodge_p | O11: 100
A12: 10 | B12: 十面埋伏 | D12: ch_defence_p | E12: 100 | F12: ch_defence_p | G12: 100 | H12: ch_defence_p | I12: 100 | J12: ch_dodge_p | K12: 100 | L12: ch_dodge_p | M12: 100 | N12: ch_dodge_p | O12: 100

Sheet: 好友加成位解锁表
A1: id | B1: 好友数 | C1: 玩家等级 | D1: 文字说明 | E1: 奖励类别 | F1: 参数列表 | G1: 奖励类别 | H1: 参数列表
A2: id | B2: friend_num | C2: player_lvl | D2: hover_tips | E2: reward_type | F2: reward_args | G2: reward_type | H2: reward_args
A3: 1 | B3: 2 | C3: 1 | D3: 邀请2名好友 | E3: unlock | F3: mine|3 | G3: unlock | H3: factory|3
A4: 2 | B4: 5 | C4: 15 | D4: 邀请5名好友，庄主15级 | E4: unlock | F4: mine|4 | G4: unlock | H4: factory|4
A5: 3 | B5: 10 | C5: 20 | D5: 邀请10名好友，庄主20级 | E5: unlock | F5: mine|5 | G5: unlock | H5: factory|5
A6: 4 | B6: 15 | C6: 25 | D6: 邀请15名好友，庄主25级 | E6: unlock | F6: mine|6 | G6: unlock | H6: factory|6

Sheet: 常用参数表
A1: id | B1: 内容 | C1: 注释
A2: id | B2: value | C2: comment
A3: sp_cost_story | B3: 5 | C3: 挑战关卡(包括精英关卡)每次需要消耗的精力点数
A4: boss_rush_cd | B4: 60 | C4: 罚恶令挑战CDs
A5: chest_max_v | B5: 18 | C5: 宝箱容量上限
A6: reward_cd_v | B6: 7 | C6: 悬赏倒计时(天)
A7: split_card_max_v | B7: 8 | C7: 拆解卡消耗数量上限
A8: split_discount_p | B8: 500 | C8: 拆解功能中返还材料总量的计算折扣
A9: treasure_hero_reward | B9: D|*,C|100000,B|0,A|0 | C9: 寻宝获得的侠客等级出现概率
A10: treasure_hero_p | B10: 300 | C10: 寻宝获得侠客的概率
A11: sp_cost_treasure_max | B11: 20 | C11: 寻宝精力消耗上限
A12: sp_cost_treasure | B12: 2 | C12: 寻宝精力消耗基数及累加值
A13: pro_split_p | B13: 200 | C13: 拆解卡返还百分比加成
A14: split_p | B14: 800 | C14: 普通拆解返还百分比
A15: ppt_color_green | B15: C0 | C15: 属性成长值范围，侠客属性显示为绿色
A16: ppt_color_blue | B16: B0 | C16: 属性成长值范围，侠客属性显示为蓝色
A17: ppt_color_purple | B17: A0 | C17: 属性成长值范围，侠客属性显示为紫色
A18: ppt_color_golden | B18: S0 | C18: 属性成长值范围，侠客属性显示为金色
A19: help_gem_hover_msg | B19: 帮助好友提升今日5%产量，并在对方每次开采时也能获得少量收益(不会影响好友产量) | C19: 帮助开采hover显示信息
A20: help_mat_hover_msg | B20: 帮助好友提升今日5%产量，并在对方每次炼造时也能获得少量收益(不会影响好友产量) | C20: 帮助炼兵hover显示信息
A21: sp_hover_msg | B21: 每12分钟恢复1点 | C21: 精力hover显示信息
A22: bp_hover_msg | B22: 每30分钟恢复1点 | C22: 战力hover显示信息
A23: share_money_reward | B23: 100 | C23: 分享铜币奖励基数，需要乘以升级后的玩家等级
A24: lvlup_money_reward | B24: 100 | C24: 升级铜币奖励基数，需要乘以升级后的玩家等级
A25: invite_prize_lvl_v | B25: 35 | C25: 邀请好友最后奖励的附加等级要求
A26: money_start_v | B26: 10000 | C26: 铜币初始值
A27: friend_invite_bonus_p | B27: 10 | C27: 每次成功邀请好友获得的征收产量加成
A28: friend_invite_bonus_max_p | B28: 200 | C28: 每次成功邀请好友获得的征收产量加成上限
A29: first_hero_id | B29: 596 | C29: 进入游戏第一个获得的侠客
A30: bp_start_v | B30: 10 | C30: 战力初始值
A31: sp_start_v | B31: 100 | C31: 精力初始值
A32: exp_lose_p | B32: 100 | C32: 关卡战败经验百分比
A33: unlock_meeting_lvl | B33: 1 | C33: 解锁议事厅等级
A34: unlock_forge_reinforce_lvl | B34: 1 | C34: 解锁铁匠铺-强化等级
A35: unlock_inn_lvl | B35: 6 | C35: 解锁客栈等级
A36: unlock_forge_inlay_lvl | B36: 1 | C36: 解锁铁匠铺-镶嵌等级
A37: unlock_shop_lvl | B37: 8 | C37: 解锁商铺等级
A38: unlock_firend_lvl | B38: 5 | C38: 解锁好友功能等级
A39: unlock_trainingroom_lvl | B39: 13 | C39: 解锁习武馆
A40: unlock_match_lvl | B40: 16 | C40: 解锁擂台等级
A41: unlock_factory_lvl | B41: 14 | C41: 解锁高级炼兵房等级
A42: unlock_cave_lvl | B42: 15 | C42: 解锁高级矿洞等级
A43: unlock_tower_lvl | B43: 35 | C43: 解锁华山论剑等级
A44: unlock_treasure_lvl | B44: 20 | C44: 解锁寻宝等级
A45: unlock_split_lvl | B45: 30 | C45: 解锁铁匠铺-拆解等级
A46: unlock_repick_lvl | B46: 25 | C46: 解锁转世等级
A47: unlock_jail_slot1_lvl | B47: 18 | C47: 解锁监狱1号位
A48: unlock_jail_slot2_lvl | B48: 24 | C48: 解锁监狱2号位
A49: unlock_jail_slot3_lvl | B49: 32 | C49: 解锁监狱3号位
A50: unlock_hero_slot2_lvl | B50: 1 | C50: 解锁2号侠客位
A51: unlock_hero_slot3_lvl | B51: 5 | C51: 解锁3号侠客位
A52: unlock_hero_slot4_lvl | B52: 10 | C52: 解锁4号侠客位
A53: unlock_hero_slot5_lvl | B53: 20 | C53: 解锁5号侠客位
A54: unlock_liehuoling_lvl | B54: 16 | C54: 解锁烈火令
A55: unlock_houtuling_lvl | B55: 2 | C55: 解锁厚土令
A56: unlock_jumuling_lvl | B56: 8 | C56: 解锁巨木令
A57: unlock_ruijinling_lvl | B57: 35 | C57: 解锁锐金令
A58: unlock_hongshuiling_lvl | B58: 5 | C58: 解锁洪水令
A59: material_combo_bonus_p | B59: 50 | C59: 炼造连击后的产量加成
A60: money_material_pro_cost_v | B60: 100 | C60: 每次炼造的金币消耗，需乘以庄主等级
A61: material_pro_base_v | B61: 2 | C61: 每次炼造的基础产值，需乘以庄主等级
A62: cd_gem_pro_v | B62: 1440 | C62: 每次开采累加CD
A63: cd_gem_pro_max_v | B63: 14400 | C63: 开采最大可累加CD，超过后不可开采
A64: cd_material_pro_v | B64: 1440 | C64: 每次炼兵累加CD
A65: cd_material_pro_max_v | B65: 14400 | C65: 炼兵最大可累加CD，超过后不可炼兵
A66: cd_refresh_inn_v | B66: 1440 | C66: 客栈每次刷新累加CD
A67: cd_refresh_inn_max_v | B67: 7200 | C67: 客栈刷新最大可累加CD，超过后不可刷新
A68: rate_material_combo_p | B68: 300 | C68: 炼造连击概率
A69: sp_cost_material_v | B69: 1 | C69: 每次炼造碎片需要消耗的精力
A70: sp_cost_gem_v | B70: 1 | C70: 每次开采矿石需要消耗的精力
A71: pro_speedup_p | B71: 50 | C71: 每个好友造成的产量加成5%
A72: times_help_factory_v | B72: 5 | C72: 每天帮助5个不同的好友加成炼造
A73: times_help_cave_v | B73: 5 | C73: 每天帮助5个不同的好友加成采矿
A74: pro_speedup_reward_p | B74: 200 | C74: 好友帮助开采时间内可获得对应产物的20%奖励
A75: friend_assist_bonus_p | B75: 100 | C75: 帮助加成/收获的好友可以获得相应物资10%的奖励
A76: tax_money_v | B76: 5000 | C76: 每次征收所得金币
A77: tax_numpday_v | B77: 30 | C77: 每日征收最大次数
A78: tax_recover_time_v | B78: 0 | C78: 每日零点回复征收次数
A79: tax_recover_times_v | B79: 30 | C79: 每日零点可回复的征收次数，超过上限则溢出
A80: cd_tax_ptime | B80: 900 | C80: 每次征收累加CD
A81: cd_tax_max | B81: 5400 | C81: 征收最大可累加CD，超过后不可征收
A82: coin_cost_ftax_v | B82: 1 | C82: 强征每次消耗强征卡基础值及累加值
A83: coin_cost_max_ftax_v | B83: 1 | C83: 强征每次消耗强征卡上限
A84: merge_hero_return_p | B84: 800 | C84: 合成侠客返还材料
A85: cd_clean_v | B85: 3600 | C85: 每张加速卡清除CD的时长
A86: levy_v | B86: 10 | C86: 每次搜刮基数，需乘以被奴役玩家等级
A87: levy_p | B87: 100 | C87: 占领陌生人立即获得其10%金钱
A88: levy_cd_v | B88: 3600 | C88: 搜刮奴隶每次叠加的冷却时间
A89: levy_cd_max_v | B89: 3600 | C89: 搜刮奴隶冷却时间可叠加上限，超过则进入冷却
A90: hero_exp_fightf_v | B90: 2 | C90: 好友切磋获得侠客经验奖励的基数，需要乘以被挑战玩家等级
A91: money_fightf_v | B91: 10 | C91: 挑战陌客获得金币奖励，需要乘以被挑战玩家等级
A92: exp_fightf_v | B92: 2 | C92: 挑战陌客获得玩家经验奖励的基数，需要乘以被挑战玩家的等级
A93: exp_enslave_v | B93: 2 | C93: 占领奴隶获得玩家经验奖励的基数，需要乘以被占领玩家的等级
A94: vip_new_item_id | B94: 27 | C94: 黄钻新手礼包
A95: exp_arena_v | B95: 2 | C95: 擂台挑战成功，每次获得玩家经验，需要乘以玩家等级
A96: bp_cost4fightf_v | B96: 1 | C96: 挑战陌客每次消耗战力点数
A97: bp_cost4enslave_v | B97: 1 | C97: 占领奴隶每次消耗战力点数
A98: hnp_arena_win_v | B98: 3 | C98: 擂台挑战成功，每次获得荣誉点数
A99: hnp_arena_lose_v | B99: 1 | C99: 擂台挑战失败，每次获得荣誉点数
A100: time_enslave_v | B100: 86400 | C100: 奴隶被占领最大时长
A101: sp_cost4arena_v | B101: 1 | C101: 擂台赛每次挑战消耗精力点数
A102: sp_cost4tower_v | B102: 1 | C102: 华山论剑每次挑战消耗精力点数
A103: sp_cost4product_v | B103: 1 | C103: 每次开采需要花费精力点数
A104: sp_cost4misson_v1 | B104: 3 | C104: 每日任务消耗的精力点数
A105: sp_cost4chapter_v | B105: 0 | C105: 主线任务耗费精力点数
A106: battle_sp_cost | B106: 5 | C106: 战斗体力消耗基数，需要乘以侠客等级
A107: bp_cost | B107: 1 | C107: 占领、擂台、挑战陌生人每次消耗的战力点数
A108: lose_offset_p | B108: 200 | C108: 战败获得对应战胜资源的百分比
A109: sp_max_v | B109: 200 | C109: 精力上限
A110: bp_max_v | B110: 10 | C110: 战力上限
A111: time_sp_arecovery | B111: 720 | C111: 每点精力恢复所需时间
A112: time_bp_arecovery | B112: 1800 | C112: 每点战力恢复所需时间
A113: msg_meeting_lvlnotenough | B113: 请先提升庄主等级 | C113: 侠义令导向目标关卡未解锁时显示提示内容
A114: msg_hire_s | B114: 我在《侠客天下》里招募到S级侠客了！大家一起来玩吧~ | C114: 每次成功招募S级侠客时发布消息内容
A115: msg_reinforce_1 | B115: 我在《侠客天下》里将武器强化到1级了！大家一起来玩吧~ | C115: 第一次将任意武器强化到1级时发布消息内容
A116: msg_reinforce_2 | B116: 我在《侠客天下》里将武器强化到2级了！大家一起来玩吧~ | C116: 第一次将任意武器强化到2级时发布消息内容
A117: msg_reinforce_3 | B117: 我在《侠客天下》里将武器强化到3级了！大家一起来玩吧~ | C117: 第一次将任意武器强化到3级时发布消息内容
A118: msg_reinforce_4 | B118: 我在《侠客天下》里将武器强化到4级了！大家一起来玩吧~ | C118: 第一次将任意武器强化到4级时发布消息内容
A119: msg_reinforce_5 | B119: 我在《侠客天下》里将武器强化到5级了！大家一起来玩吧~ | C119: 第一次将任意武器强化到5级时发布消息内容
A120: msg_reinforce_6 | B120: 我在《侠客天下》里将武器强化到6级了！大家一起来玩吧~ | C120: 第一次将任意武器强化到6级时发布消息内容
A121: msg_reinforce_7 | B121: 我在《侠客天下》里将武器强化到7级了！大家一起来玩吧~ | C121: 第一次将任意武器强化到7级时发布消息内容
A122: msg_reinforce_8 | B122: 我在《侠客天下》里将武器强化到8级了！大家一起来玩吧~ | C122: 第一次将任意武器强化到8级时发布消息内容
A123: msg_reinforce_9 | B123: 我在《侠客天下》里将武器强化到9级了！大家一起来玩吧~ | C123: 第一次将任意武器强化到9级时发布消息内容
A124: msg_reinforce_10 | B124: 我在《侠客天下》里将武器强化到10级了！大家一起来玩吧~ | C124: 第一次将任意武器强化到10级时发布消息内容
A125: msg_reinforce_11 | B125: 我在《侠客天下》里将武器强化到11级了！大家一起来玩吧~ | C125: 第一次将任意武器强化到11级时发布消息内容
A126: msg_reinforce_12 | B126: 我在《侠客天下》里将武器强化到12级了！大家一起来玩吧~ | C126: 第一次将任意武器强化到12级时发布消息内容
A127: msg_reinforce_13 | B127: 我在《侠客天下》里将武器强化到13级了！大家一起来玩吧~ | C127: 第一次将任意武器强化到13级时发布消息内容
A128: msg_reinforce_14 | B128: 我在《侠客天下》里将武器强化到14级了！大家一起来玩吧~ | C128: 第一次将任意武器强化到14级时发布消息内容
A129: msg_reinforce_15 | B129: 我在《侠客天下》里将武器强化到15级了！大家一起来玩吧~ | C129: 第一次将任意武器强化到15级时发布消息内容
A130: msg_reinforce_16 | B130: 我在《侠客天下》里将武器强化到16级了！大家一起来玩吧~ | C130: 第一次将任意武器强化到16级时发布消息内容
A131: msg_reinforce_17 | B131: 我在《侠客天下》里将武器强化到17级了！大家一起来玩吧~ | C131: 第一次将任意武器强化到17级时发布消息内容
A132: msg_reinforce_18 | B132: 我在《侠客天下》里将武器强化到18级了！大家一起来玩吧~ | C132: 第一次将任意武器强化到18级时发布消息内容
A133: msg_reinforce_19 | B133: 我在《侠客天下》里将武器强化到19级了！大家一起来玩吧~ | C133: 第一次将任意武器强化到19级时发布消息内容
A134: msg_reinforce_20 | B134: 我在《侠客天下》里将武器强化到20级了！大家一起来玩吧~ | C134: 第一次将任意武器强化到20级时发布消息内容
A135: msg_reinforce_21 | B135: 我在《侠客天下》里将武器强化到21级了！大家一起来玩吧~ | C135: 第一次将任意武器强化到21级时发布消息内容
A136: msg_reinforce_22 | B136: 我在《侠客天下》里将武器强化到22级了！大家一起来玩吧~ | C136: 第一次将任意武器强化到22级时发布消息内容
A137: msg_reinforce_23 | B137: 我在《侠客天下》里将武器强化到23级了！大家一起来玩吧~ | C137: 第一次将任意武器强化到23级时发布消息内容
A138: msg_reinforce_24 | B138: 我在《侠客天下》里将武器强化到24级了！大家一起来玩吧~ | C138: 第一次将任意武器强化到24级时发布消息内容
A139: msg_reinforce_25 | B139: 我在《侠客天下》里将武器强化到25级了！大家一起来玩吧~ | C139: 第一次将任意武器强化到25级时发布消息内容
A140: msg_reinforce_26 | B140: 我在《侠客天下》里将武器强化到26级了！大家一起来玩吧~ | C140: 第一次将任意武器强化到26级时发布消息内容
A141: msg_reinforce_27 | B141: 我在《侠客天下》里将武器强化到27级了！大家一起来玩吧~ | C141: 第一次将任意武器强化到27级时发布消息内容
A142: msg_reinforce_28 | B142: 我在《侠客天下》里将武器强化到28级了！大家一起来玩吧~ | C142: 第一次将任意武器强化到28级时发布消息内容
A143: msg_reinforce_29 | B143: 我在《侠客天下》里将武器强化到29级了！大家一起来玩吧~ | C143: 第一次将任意武器强化到29级时发布消息内容
A144: msg_reinforce_30 | B144: 我在《侠客天下》里将武器强化到30级了！大家一起来玩吧~ | C144: 第一次将任意武器强化到30级时发布消息内容
A145: msg_reinforce_31 | B145: 我在《侠客天下》里将武器强化到31级了！大家一起来玩吧~ | C145: 第一次将任意武器强化到31级时发布消息内容
A146: msg_reinforce_32 | B146: 我在《侠客天下》里将武器强化到32级了！大家一起来玩吧~ | C146: 第一次将任意武器强化到32级时发布消息内容
A147: msg_reinforce_33 | B147: 我在《侠客天下》里将武器强化到33级了！大家一起来玩吧~ | C147: 第一次将任意武器强化到33级时发布消息内容
A148: msg_reinforce_34 | B148: 我在《侠客天下》里将武器强化到34级了！大家一起来玩吧~ | C148: 第一次将任意武器强化到34级时发布消息内容
A149: msg_reinforce_35 | B149: 我在《侠客天下》里将武器强化到35级了！大家一起来玩吧~ | C149: 第一次将任意武器强化到35级时发布消息内容
A150: msg_reinforce_36 | B150: 我在《侠客天下》里将武器强化到36级了！大家一起来玩吧~ | C150: 第一次将任意武器强化到36级时发布消息内容
A151: msg_reinforce_37 | B151: 我在《侠客天下》里将武器强化到37级了！大家一起来玩吧~ | C151: 第一次将任意武器强化到37级时发布消息内容
A152: msg_reinforce_38 | B152: 我在《侠客天下》里将武器强化到38级了！大家一起来玩吧~ | C152: 第一次将任意武器强化到38级时发布消息内容
A153: msg_reinforce_39 | B153: 我在《侠客天下》里将武器强化到39级了！大家一起来玩吧~ | C153: 第一次将任意武器强化到39级时发布消息内容
A154: msg_reinforce_40 | B154: 我在《侠客天下》里将武器强化到40级了！大家一起来玩吧~ | C154: 第一次将任意武器强化到40级时发布消息内容
A155: msg_reinforce_41 | B155: 我在《侠客天下》里将武器强化到41级了！大家一起来玩吧~ | C155: 第一次将任意武器强化到41级时发布消息内容
A156: msg_reinforce_42 | B156: 我在《侠客天下》里将武器强化到42级了！大家一起来玩吧~ | C156: 第一次将任意武器强化到42级时发布消息内容
A157: msg_reinforce_43 | B157: 我在《侠客天下》里将武器强化到43级了！大家一起来玩吧~ | C157: 第一次将任意武器强化到43级时发布消息内容
A158: msg_reinforce_44 | B158: 我在《侠客天下》里将武器强化到44级了！大家一起来玩吧~ | C158: 第一次将任意武器强化到44级时发布消息内容
A159: msg_reinforce_45 | B159: 我在《侠客天下》里将武器强化到45级了！大家一起来玩吧~ | C159: 第一次将任意武器强化到45级时发布消息内容
A160: msg_reinforce_46 | B160: 我在《侠客天下》里将武器强化到46级了！大家一起来玩吧~ | C160: 第一次将任意武器强化到46级时发布消息内容
A161: msg_reinforce_47 | B161: 我在《侠客天下》里将武器强化到47级了！大家一起来玩吧~ | C161: 第一次将任意武器强化到47级时发布消息内容
A162: msg_reinforce_48 | B162: 我在《侠客天下》里将武器强化到48级了！大家一起来玩吧~ | C162: 第一次将任意武器强化到48级时发布消息内容
A163: msg_reinforce_49 | B163: 我在《侠客天下》里将武器强化到49级了！大家一起来玩吧~ | C163: 第一次将任意武器强化到49级时发布消息内容
A164: msg_reinforce_50 | B164: 我在《侠客天下》里将武器强化到50级了！大家一起来玩吧~ | C164: 第一次将任意武器强化到50级时发布消息内容
A165: msg_reinforce_51 | B165: 我在《侠客天下》里将武器强化到51级了！大家一起来玩吧~ | C165: 第一次将任意武器强化到51级时发布消息内容
A166: msg_reinforce_52 | B166: 我在《侠客天下》里将武器强化到52级了！大家一起来玩吧~ | C166: 第一次将任意武器强化到52级时发布消息内容
A167: msg_reinforce_53 | B167: 我在《侠客天下》里将武器强化到53级了！大家一起来玩吧~ | C167: 第一次将任意武器强化到53级时发布消息内容
A168: msg_reinforce_54 | B168: 我在《侠客天下》里将武器强化到54级了！大家一起来玩吧~ | C168: 第一次将任意武器强化到54级时发布消息内容
A169: msg_reinforce_55 | B169: 我在《侠客天下》里将武器强化到55级了！大家一起来玩吧~ | C169: 第一次将任意武器强化到55级时发布消息内容
A170: msg_reinforce_56 | B170: 我在《侠客天下》里将武器强化到56级了！大家一起来玩吧~ | C170: 第一次将任意武器强化到56级时发布消息内容
A171: msg_reinforce_57 | B171: 我在《侠客天下》里将武器强化到57级了！大家一起来玩吧~ | C171: 第一次将任意武器强化到57级时发布消息内容
A172: msg_reinforce_58 | B172: 我在《侠客天下》里将武器强化到58级了！大家一起来玩吧~ | C172: 第一次将任意武器强化到58级时发布消息内容
A173: msg_reinforce_59 | B173: 我在《侠客天下》里将武器强化到59级了！大家一起来玩吧~ | C173: 第一次将任意武器强化到59级时发布消息内容
A174: msg_reinforce_60 | B174: 我在《侠客天下》里将武器强化到60级了！大家一起来玩吧~ | C174: 第一次将任意武器强化到60级时发布消息内容
A175: msg_lvlup_1 | B175: 我在《侠客天下》里升到1级了！大家一起来玩吧~ | C175: 玩家升到1级时发布消息内容
A176: msg_lvlup_2 | B176: 我在《侠客天下》里升到2级了！大家一起来玩吧~ | C176: 玩家升到2级时发布消息内容
A177: msg_lvlup_3 | B177: 我在《侠客天下》里升到3级了！大家一起来玩吧~ | C177: 玩家升到3级时发布消息内容
A178: msg_lvlup_4 | B178: 我在《侠客天下》里升到4级了！大家一起来玩吧~ | C178: 玩家升到4级时发布消息内容
A179: msg_lvlup_5 | B179: 我在《侠客天下》里升到5级了！大家一起来玩吧~ | C179: 玩家升到5级时发布消息内容
A180: msg_lvlup_6 | B180: 我在《侠客天下》里升到6级了！大家一起来玩吧~ | C180: 玩家升到6级时发布消息内容
A181: msg_lvlup_7 | B181: 我在《侠客天下》里升到7级了！大家一起来玩吧~ | C181: 玩家升到7级时发布消息内容
A182: msg_lvlup_8 | B182: 我在《侠客天下》里升到8级了！大家一起来玩吧~ | C182: 玩家升到8级时发布消息内容
A183: msg_lvlup_9 | B183: 我在《侠客天下》里升到9级了！大家一起来玩吧~ | C183: 玩家升到9级时发布消息内容
A184: msg_lvlup_10 | B184: 我在《侠客天下》里升到10级了！大家一起来玩吧~ | C184: 玩家升到10级时发布消息内容
A185: msg_lvlup_11 | B185: 我在《侠客天下》里升到11级了！大家一起来玩吧~ | C185: 玩家升到11级时发布消息内容
A186: msg_lvlup_12 | B186: 我在《侠客天下》里升到12级了！大家一起来玩吧~ | C186: 玩家升到12级时发布消息内容
A187: msg_lvlup_13 | B187: 我在《侠客天下》里升到13级了！大家一起来玩吧~ | C187: 玩家升到13级时发布消息内容
A188: msg_lvlup_14 | B188: 我在《侠客天下》里升到14级了！大家一起来玩吧~ | C188: 玩家升到14级时发布消息内容
A189: msg_lvlup_15 | B189: 我在《侠客天下》里升到15级了！大家一起来玩吧~ | C189: 玩家升到15级时发布消息内容
A190: msg_lvlup_16 | B190: 我在《侠客天下》里升到16级了！大家一起来玩吧~ | C190: 玩家升到16级时发布消息内容
A191: msg_lvlup_17 | B191: 我在《侠客天下》里升到17级了！大家一起来玩吧~ | C191: 玩家升到17级时发布消息内容
A192: msg_lvlup_18 | B192: 我在《侠客天下》里升到18级了！大家一起来玩吧~ | C192: 玩家升到18级时发布消息内容
A193: msg_lvlup_19 | B193: 我在《侠客天下》里升到19级了！大家一起来玩吧~ | C193: 玩家升到19级时发布消息内容
A194: msg_lvlup_20 | B194: 我在《侠客天下》里升到20级了！大家一起来玩吧~ | C194: 玩家升到20级时发布消息内容
A195: msg_lvlup_21 | B195: 我在《侠客天下》里升到21级了！大家一起来玩吧~ | C195: 玩家升到21级时发布消息内容
A196: msg_lvlup_22 | B196: 我在《侠客天下》里升到22级了！大家一起来玩吧~ | C196: 玩家升到22级时发布消息内容
A197: msg_lvlup_23 | B197: 我在《侠客天下》里升到23级了！大家一起来玩吧~ | C197: 玩家升到23级时发布消息内容
A198: msg_lvlup_24 | B198: 我在《侠客天下》里升到24级了！大家一起来玩吧~ | C198: 玩家升到24级时发布消息内容
A199: msg_lvlup_25 | B199: 我在《侠客天下》里升到25级了！大家一起来玩吧~ | C199: 玩家升到25级时发布消息内容
A200: msg_lvlup_26 | B200: 我在《侠客天下》里升到26级了！大家一起来玩吧~ | C200: 玩家升到26级时发布消息内容
A201: msg_lvlup_27 | B201: 我在《侠客天下》里升到27级了！大家一起来玩吧~ | C201: 玩家升到27级时发布消息内容
A202: msg_lvlup_28 | B202: 我在《侠客天下》里升到28级了！大家一起来玩吧~ | C202: 玩家升到28级时发布消息内容
A203: msg_lvlup_29 | B203: 我在《侠客天下》里升到29级了！大家一起来玩吧~ | C203: 玩家升到29级时发布消息内容
A204: msg_lvlup_30 | B204: 我在《侠客天下》里升到30级了！大家一起来玩吧~ | C204: 玩家升到30级时发布消息内容
A205: msg_lvlup_31 | B205: 我在《侠客天下》里升到31级了！大家一起来玩吧~ | C205: 玩家升到31级时发布消息内容
A206: msg_lvlup_32 | B206: 我在《侠客天下》里升到32级了！大家一起来玩吧~ | C206: 玩家升到32级时发布消息内容
A207: msg_lvlup_33 | B207: 我在《侠客天下》里升到33级了！大家一起来玩吧~ | C207: 玩家升到33级时发布消息内容
A208: msg_lvlup_34 | B208: 我在《侠客天下》里升到34级了！大家一起来玩吧~ | C208: 玩家升到34级时发布消息内容
A209: msg_lvlup_35 | B209: 我在《侠客天下》里升到35级了！大家一起来玩吧~ | C209: 玩家升到35级时发布消息内容
A210: msg_lvlup_36 | B210: 我在《侠客天下》里升到36级了！大家一起来玩吧~ | C210: 玩家升到36级时发布消息内容
A211: msg_lvlup_37 | B211: 我在《侠客天下》里升到37级了！大家一起来玩吧~ | C211: 玩家升到37级时发布消息内容
A212: msg_lvlup_38 | B212: 我在《侠客天下》里升到38级了！大家一起来玩吧~ | C212: 玩家升到38级时发布消息内容
A213: msg_lvlup_39 | B213: 我在《侠客天下》里升到39级了！大家一起来玩吧~ | C213: 玩家升到39级时发布消息内容
A214: msg_lvlup_40 | B214: 我在《侠客天下》里升到40级了！大家一起来玩吧~ | C214: 玩家升到40级时发布消息内容
A215: msg_lvlup_41 | B215: 我在《侠客天下》里升到41级了！大家一起来玩吧~ | C215: 玩家升到41级时发布消息内容
A216: msg_lvlup_42 | B216: 我在《侠客天下》里升到42级了！大家一起来玩吧~ | C216: 玩家升到42级时发布消息内容
A217: msg_lvlup_43 | B217: 我在《侠客天下》里升到43级了！大家一起来玩吧~ | C217: 玩家升到43级时发布消息内容
A218: msg_lvlup_44 | B218: 我在《侠客天下》里升到44级了！大家一起来玩吧~ | C218: 玩家升到44级时发布消息内容
A219: msg_lvlup_45 | B219: 我在《侠客天下》里升到45级了！大家一起来玩吧~ | C219: 玩家升到45级时发布消息内容
A220: msg_lvlup_46 | B220: 我在《侠客天下》里升到46级了！大家一起来玩吧~ | C220: 玩家升到46级时发布消息内容
A221: msg_lvlup_47 | B221: 我在《侠客天下》里升到47级了！大家一起来玩吧~ | C221: 玩家升到47级时发布消息内容
A222: msg_lvlup_48 | B222: 我在《侠客天下》里升到48级了！大家一起来玩吧~ | C222: 玩家升到48级时发布消息内容
A223: msg_lvlup_49 | B223: 我在《侠客天下》里升到49级了！大家一起来玩吧~ | C223: 玩家升到49级时发布消息内容
A224: msg_lvlup_50 | B224: 我在《侠客天下》里升到50级了！大家一起来玩吧~ | C224: 玩家升到50级时发布消息内容
A225: msg_lvlup_51 | B225: 我在《侠客天下》里升到51级了！大家一起来玩吧~ | C225: 玩家升到51级时发布消息内容
A226: msg_lvlup_52 | B226: 我在《侠客天下》里升到52级了！大家一起来玩吧~ | C226: 玩家升到52级时发布消息内容
A227: msg_lvlup_53 | B227: 我在《侠客天下》里升到53级了！大家一起来玩吧~ | C227: 玩家升到53级时发布消息内容
A228: msg_lvlup_54 | B228: 我在《侠客天下》里升到54级了！大家一起来玩吧~ | C228: 玩家升到54级时发布消息内容
A229: msg_lvlup_55 | B229: 我在《侠客天下》里升到55级了！大家一起来玩吧~ | C229: 玩家升到55级时发布消息内容
A230: msg_lvlup_56 | B230: 我在《侠客天下》里升到56级了！大家一起来玩吧~ | C230: 玩家升到56级时发布消息内容
A231: msg_lvlup_57 | B231: 我在《侠客天下》里升到57级了！大家一起来玩吧~ | C231: 玩家升到57级时发布消息内容
A232: msg_lvlup_58 | B232: 我在《侠客天下》里升到58级了！大家一起来玩吧~ | C232: 玩家升到58级时发布消息内容
A233: msg_lvlup_59 | B233: 我在《侠客天下》里升到59级了！大家一起来玩吧~ | C233: 玩家升到59级时发布消息内容
A234: msg_lvlup_60 | B234: 我在《侠客天下》里升到60级了！大家一起来玩吧~ | C234: 玩家升到60级时发布消息内容
A235: buff_invite_friends_1 | B235: 10 | C235: 成功邀请好友1人，获得经验金钱加成1%
A236: buff_invite_friends_2 | B236: 20 | C236: 成功邀请好友2人，获得经验金钱加成2%
A237: buff_invite_friends_3 | B237: 30 | C237: 成功邀请好友3人，获得经验金钱加成3%
A238: buff_invite_friends_4 | B238: 40 | C238: 成功邀请好友4人，获得经验金钱加成4%
A239: buff_invite_friends_5 | B239: 50 | C239: 成功邀请好友5人，获得经验金钱加成5%
A240: buff_invite_friends_6 | B240: 60 | C240: 成功邀请好友6人，获得经验金钱加成6%
A241: buff_invite_friends_7 | B241: 70 | C241: 成功邀请好友7人，获得经验金钱加成7%
A242: buff_invite_friends_8 | B242: 80 | C242: 成功邀请好友8人，获得经验金钱加成8%
A243: buff_invite_friends_9 | B243: 90 | C243: 成功邀请好友9人，获得经验金钱加成9%
A244: buff_invite_friends_10 | B244: 100 | C244: 成功邀请好友10人，获得经验金钱加成10%
A245: buff_invite_friends_11 | B245: 110 | C245: 成功邀请好友11人，获得经验金钱加成11%
A246: buff_invite_friends_12 | B246: 120 | C246: 成功邀请好友12人，获得经验金钱加成12%
A247: buff_invite_friends_13 | B247: 130 | C247: 成功邀请好友13人，获得经验金钱加成13%
A248: buff_invite_friends_14 | B248: 140 | C248: 成功邀请好友14人，获得经验金钱加成14%
A249: buff_invite_friends_15 | B249: 150 | C249: 成功邀请好友15人，获得经验金钱加成15%
A250: buff_invite_friends_16 | B250: 160 | C250: 成功邀请好友16人，获得经验金钱加成16%
A251: buff_invite_friends_17 | B251: 170 | C251: 成功邀请好友17人，获得经验金钱加成17%
A252: buff_invite_friends_18 | B252: 180 | C252: 成功邀请好友18人，获得经验金钱加成18%
A253: buff_invite_friends_19 | B253: 190 | C253: 成功邀请好友19人，获得经验金钱加成19%
A254: buff_invite_friends_20 | B254: 200 | C254: 成功邀请好友20人，获得经验金钱加成20%

Sheet: 商城表
A1: 物品id | B1: 物品名称 | C1: 字体颜色 | D1: 可购买次数 | E1: 物品图标 | F1: 热卖图标 | G1: 折扣图标 | H1: 所属分类 | I1: 物品描述 | J1: 单价 | K1: 奖励类型 | L1: 参数列表 | M1: 奖励类型 | N1: 参数列表 | O1: 奖励类型 | P1: 参数列表 | Q1: 奖励类型 | R1: 参数列表 | S1: 奖励类型 | T1: 参数列表 | U1: 奖励类型 | V1: 参数列表
A2: id | B2: item_name | C2: font_color | D2: pay_time | E2: item_icon | F2: hot_icon | G2: disconut_icon | H2: item_category | I2: desc | J2: item_price | K2: reward_type | L2: reward_args | M2: reward_type | N2: reward_args | O2: reward_type | P2: reward_args | Q2: reward_type | R2: reward_args | S2: reward_type | T2: reward_args | U2: reward_type | V2: reward_args
A3: 1 | B3: 一箱锐金石 | E3: 6013 | H3: cailiao | I3: 锐金石×500 | J3: 100 | K3: gem | L3: 4|500
A4: 2 | B4: 一箱厚土石 | E4: 6016 | H4: cailiao | I4: 厚土石×500 | J4: 100 | K4: gem | L4: 5|500
A5: 3 | B5: 一箱烈火石 | E5: 6012 | H5: cailiao | I5: 烈火石×500 | J5: 100 | K5: gem | L5: 6|500
A6: 4 | B6: 一箱洪水石 | E6: 6015 | H6: cailiao | I6: 洪水石×500 | J6: 100 | K6: gem | L6: 7|500
A7: 5 | B7: 一箱巨木石 | E7: 6014 | H7: cailiao | I7: 巨木石×500 | J7: 100 | K7: gem | L7: 8|500
A8: 6 | B8: 一箱武器碎片 | E8: 6009 | H8: cailiao | I8: 武器碎片×500 | J8: 100 | K8: material | L8: 1|500
A9: 7 | B9: 一箱防具碎片 | E9: 6010 | H9: cailiao | I9: 防具碎片×500 | J9: 100 | K9: material | L9: 2|500
A10: 8 | B10: 一箱饰品碎片 | E10: 6011 | H10: cailiao | I10: 饰品碎片×500 | J10: 100 | K10: material | L10: 3|500
A11: 9 | B11: 三星宴请帖 | E11: 6008 | H11: hidden | I11: 极大可能获得三星侠客，最低获得二星侠客 | J11: 500 | K11: item | L11: 2|1
A12: 10 | B12: 二星宴请帖 | E12: 6007 | H12: hidden | I12: 极大可能获得二星侠客，最低获得一星侠客 | J12: 200 | K12: item | L12: 1|1
A13: 11 | B13: 精力卡 | E13: 6003 | H13: daoju | I13: 回复25点精力值 | J13: 50 | K13: item | L13: 22|1
A14: 12 | B14: 战力卡 | E14: 6006 | H14: daoju | I14: 回复5点战力值 | J14: 20 | K14: item | L14: 23|1
A15: 13 | B15: 侠客合成卡 | E15: 6001 | H15: xiake | I15: 立即获得2星以上侠客合成卡1张，用于合成高属性的隐藏侠客。 | J15: 150 | K15: random_merge | L15: 700|300|0
A16: 14 | B16: 突飞卡 | E16: 6005 | H16: daoju | I16: 让训练中的侠客立即获得1000经验 | J16: 50 | K16: item | L16: 24|1
A17: 15 | B17: 加速卡 | E17: 6002 | H17: daoju | I17: 清除当前冷却时间 | J17: 20 | K17: item | L17: 25|1
A18: 16 | B18: 强征卡 | E18: 6004 | H18: daoju | I18: 征收金币(无视冷却时间及征收次数) | J18: 20 | K18: item | L18: 26|1
A19: 500 | B19: 突飞经验 | H19: hidden | I19: 突飞经验 | J19: 2 | K19: exp | L19: 500|1
A20: 501 | B20: 解锁练功房位置 | H20: hidden | I20: 解锁练功房位置 | J20: 400 | K20: train_slot | L20: 501|1
A21: 502 | B21: 黄钻每日礼包1级 | H21: hidden | I21: 黄钻每日礼包1级 | J21: 0 | K21: item | L21: 25|1
A22: 503 | B22: 黄钻每日礼包2级 | H22: hidden | I22: 黄钻每日礼包2级 | J22: 0 | K22: item | L22: 25|1 | M22: item | N22: 26|1
A23: 504 | B23: 黄钻每日礼包3级 | H23: hidden | I23: 黄钻每日礼包3级 | J23: 0 | K23: item | L23: 25|2 | M23: item | N23: 26|1
A24: 505 | B24: 黄钻每日礼包4级 | H24: hidden | I24: 黄钻每日礼包4级 | J24: 0 | K24: item | L24: 25|2 | M24: item | N24: 26|2
A25: 506 | B25: 黄钻每日礼包5级 | H25: hidden | I25: 黄钻每日礼包5级 | J25: 0 | K25: item | L25: 25|2 | M25: item | N25: 26|3
A26: 507 | B26: 黄钻每日礼包6级 | H26: hidden | I26: 黄钻每日礼包6级 | J26: 0 | K26: item | L26: 25|3 | M26: item | N26: 26|3
A27: 508 | B27: 黄钻每日礼包7级 | H27: hidden | I27: 黄钻每日礼包7级 | J27: 0 | K27: item | L27: 25|4 | M27: item | N27: 26|3
A28: 509 | B28: 黄钻每日礼包8级 | H28: hidden | I28: 黄钻每日礼包8级 | J28: 0 | K28: item | L28: 25|4 | M28: item | N28: 26|4
A29: 510 | B29: 年费黄钻每日礼包1级 | H29: hidden | I29: 年费黄钻每日礼包1级 | J29: 0 | K29: item | L29: 25|1 | M29: item | N29: 24|1
A30: 511 | B30: 年费黄钻每日礼包2级 | H30: hidden | I30: 年费黄钻每日礼包2级 | J30: 0 | K30: item | L30: 25|1 | M30: item | N30: 26|1 | O30: item | P30: 24|1
A31: 512 | B31: 年费黄钻每日礼包3级 | H31: hidden | I31: 年费黄钻每日礼包3级 | J31: 0 | K31: item | L31: 25|2 | M31: item | N31: 26|1 | O31: item | P31: 24|2
A32: 513 | B32: 年费黄钻每日礼包4级 | H32: hidden | I32: 年费黄钻每日礼包4级 | J32: 0 | K32: item | L32: 25|2 | M32: item | N32: 26|2 | O32: item | P32: 24|3
A33: 514 | B33: 年费黄钻每日礼包5级 | H33: hidden | I33: 年费黄钻每日礼包5级 | J33: 0 | K33: item | L33: 25|2 | M33: item | N33: 26|3 | O33: item | P33: 24|4
A34: 515 | B34: 年费黄钻每日礼包6级 | H34: hidden | I34: 年费黄钻每日礼包6级 | J34: 0 | K34: item | L34: 25|3 | M34: item | N34: 26|3 | O34: item | P34: 24|5
A35: 516 | B35: 年费黄钻每日礼包7级 | H35: hidden | I35: 年费黄钻每日礼包7级 | J35: 0 | K35: item | L35: 25|4 | M35: item | N35: 26|3 | O35: item | P35: 24|6
A36: 517 | B36: 年费黄钻每日礼包8级 | H36: hidden | I36: 年费黄钻每日礼包8级 | J36: 0 | K36: item | L36: 25|4 | M36: item | N36: 26|4 | O36: item | P36: 24|7
A37: 17 | B37: 三星合成卡 | E37: 6018 | H37: hidden | I37: 随机获得隐藏三星侠客合成卡 | J37: 300 | K37: random_merge | L37: 0|1000|0
A38: 18 | B38: 二星合成卡 | E38: 6017 | H38: hidden | I38: 随机获得隐藏二星侠客合成卡 | J38: 200 | K38: random_merge | L38: 1000|0|0
A39: 19 | B39: 拆解卡 | E39: 6019 | H39: daoju | I39: 拆解后材料完全返还，拆解损失越大消耗数量越多 | J39: 300 | K39: item | L39: 57|1
A40: 1000 | H40: hidden | K40: random_good | L40: xiakeA
A41: 20 | B41: 重置卡 | E41: 6020 | H41: daoju | I41: 重置任一精英关卡 | J41: 500 | K41: item | L41: 61|1
A42: 21 | B42: 限购特惠包 | D42: 1 | E42: 6007 | H42: daoju | I42: 限购一次！获得：侠客宴请帖×1，侠客合成卡×1，重置卡×1。 | J42: 10 | K42: item | L42: 62|1 | M42: random_merge | N42: 700|300|0 | O42: item | P42: 61|1
A43: 22 | B43: 侠客宴请帖 | E43: 6008 | H43: xiake | I43: 使用后可获得2星以上侠客卡1张。 | J43: 150 | K43: item | L43: 62|1

Sheet: 练功房参数表
A1: id | B1: 内容 | C1: 注释
A2: id | B2: value | C2: comment
A3: improve_time_1 | B3: 14400 | C3: 训练可选时间1:4小时
A4: improve_time_2 | B4: 28800 | C4: 训练可选时间2:8小时
A5: improve_time_3 | B5: 43200 | C5: 训练可选时间3:12小时
A6: improve_time_4 | B6: 86400 | C6: 训练可选时间4:24小时
A7: improve_cost_1 | B7: 1000 | C7: 开始训练1需要消耗的金币数
A8: improve_cost_2 | B8: 2500 | C8: 开始训练2需要消耗的金币数
A9: improve_cost_3 | B9: 4000 | C9: 开始训练3需要消耗的金币数
A10: improve_cost_4 | B10: 10000 | C10: 开始训练4需要消耗的金币数
A11: slot_icon | C11: 提供给购买API使用的商品图标
A12: slot_max_num | B12: 9 | C12: 最大可使用训练位数量
A13: slot_unlock_num | B13: 3 | C13: 默认解锁训练位数量
A14: slot_unlock_coin | B14: 499 | C14: 解锁训练位需要花费Q点
A15: rush_exp | B15: 5000 | C15: 每次突飞获得的经验值
A16: rush_cost | B16: 1 | C16: 每次突飞所需突飞卡的基础值及累加值
A17: rush_cost_max | B17: 1 | C17: 每次突飞卡消耗上限
A18: improve_exp_1 | B18: 15 | C18: 1级侠客挂机每分钟可以获得的经验
A19: improve_exp_2 | B19: 15 | C19: 2级侠客挂机每分钟可以获得的经验
A20: improve_exp_3 | B20: 15 | C20: 3级侠客挂机每分钟可以获得的经验
A21: improve_exp_4 | B21: 15 | C21: 4级侠客挂机每分钟可以获得的经验
A22: improve_exp_5 | B22: 15 | C22: 5级侠客挂机每分钟可以获得的经验
A23: improve_exp_6 | B23: 15 | C23: 6级侠客挂机每分钟可以获得的经验
A24: improve_exp_7 | B24: 15 | C24: 7级侠客挂机每分钟可以获得的经验
A25: improve_exp_8 | B25: 15 | C25: 8级侠客挂机每分钟可以获得的经验
A26: improve_exp_9 | B26: 15 | C26: 9级侠客挂机每分钟可以获得的经验
A27: improve_exp_10 | B27: 15 | C27: 10级侠客挂机每分钟可以获得的经验
A28: improve_exp_11 | B28: 15 | C28: 11级侠客挂机每分钟可以获得的经验
A29: improve_exp_12 | B29: 15 | C29: 12级侠客挂机每分钟可以获得的经验
A30: improve_exp_13 | B30: 15 | C30: 13级侠客挂机每分钟可以获得的经验
A31: improve_exp_14 | B31: 15 | C31: 14级侠客挂机每分钟可以获得的经验
A32: improve_exp_15 | B32: 15 | C32: 15级侠客挂机每分钟可以获得的经验
A33: improve_exp_16 | B33: 15 | C33: 16级侠客挂机每分钟可以获得的经验
A34: improve_exp_17 | B34: 15 | C34: 17级侠客挂机每分钟可以获得的经验
A35: improve_exp_18 | B35: 15 | C35: 18级侠客挂机每分钟可以获得的经验
A36: improve_exp_19 | B36: 15 | C36: 19级侠客挂机每分钟可以获得的经验
A37: improve_exp_20 | B37: 15 | C37: 20级侠客挂机每分钟可以获得的经验
A38: improve_exp_21 | B38: 15 | C38: 21级侠客挂机每分钟可以获得的经验
A39: improve_exp_22 | B39: 15 | C39: 22级侠客挂机每分钟可以获得的经验
A40: improve_exp_23 | B40: 15 | C40: 23级侠客挂机每分钟可以获得的经验
A41: improve_exp_24 | B41: 15 | C41: 24级侠客挂机每分钟可以获得的经验
A42: improve_exp_25 | B42: 15 | C42: 25级侠客挂机每分钟可以获得的经验
A43: improve_exp_26 | B43: 15 | C43: 26级侠客挂机每分钟可以获得的经验
A44: improve_exp_27 | B44: 15 | C44: 27级侠客挂机每分钟可以获得的经验
A45: improve_exp_28 | B45: 15 | C45: 28级侠客挂机每分钟可以获得的经验
A46: improve_exp_29 | B46: 15 | C46: 29级侠客挂机每分钟可以获得的经验
A47: improve_exp_30 | B47: 15 | C47: 30级侠客挂机每分钟可以获得的经验
A48: improve_exp_31 | B48: 15 | C48: 31级侠客挂机每分钟可以获得的经验
A49: improve_exp_32 | B49: 15 | C49: 32级侠客挂机每分钟可以获得的经验
A50: improve_exp_33 | B50: 15 | C50: 33级侠客挂机每分钟可以获得的经验
A51: improve_exp_34 | B51: 15 | C51: 34级侠客挂机每分钟可以获得的经验
A52: improve_exp_35 | B52: 15 | C52: 35级侠客挂机每分钟可以获得的经验
A53: improve_exp_36 | B53: 15 | C53: 36级侠客挂机每分钟可以获得的经验
A54: improve_exp_37 | B54: 15 | C54: 37级侠客挂机每分钟可以获得的经验
A55: improve_exp_38 | B55: 15 | C55: 38级侠客挂机每分钟可以获得的经验
A56: improve_exp_39 | B56: 15 | C56: 39级侠客挂机每分钟可以获得的经验
A57: improve_exp_40 | B57: 15 | C57: 40级侠客挂机每分钟可以获得的经验
A58: improve_exp_41 | B58: 15 | C58: 41级侠客挂机每分钟可以获得的经验
A59: improve_exp_42 | B59: 15 | C59: 42级侠客挂机每分钟可以获得的经验
A60: improve_exp_43 | B60: 15 | C60: 43级侠客挂机每分钟可以获得的经验
A61: improve_exp_44 | B61: 15 | C61: 44级侠客挂机每分钟可以获得的经验
A62: improve_exp_45 | B62: 15 | C62: 45级侠客挂机每分钟可以获得的经验
A63: improve_exp_46 | B63: 15 | C63: 46级侠客挂机每分钟可以获得的经验
A64: improve_exp_47 | B64: 15 | C64: 47级侠客挂机每分钟可以获得的经验
A65: improve_exp_48 | B65: 15 | C65: 48级侠客挂机每分钟可以获得的经验
A66: improve_exp_49 | B66: 15 | C66: 49级侠客挂机每分钟可以获得的经验
A67: improve_exp_50 | B67: 15 | C67: 50级侠客挂机每分钟可以获得的经验
A68: improve_exp_51 | B68: 15 | C68: 51级侠客挂机每分钟可以获得的经验
A69: improve_exp_52 | B69: 15 | C69: 52级侠客挂机每分钟可以获得的经验
A70: improve_exp_53 | B70: 15 | C70: 53级侠客挂机每分钟可以获得的经验
A71: improve_exp_54 | B71: 15 | C71: 54级侠客挂机每分钟可以获得的经验
A72: improve_exp_55 | B72: 15 | C72: 55级侠客挂机每分钟可以获得的经验
A73: improve_exp_56 | B73: 15 | C73: 56级侠客挂机每分钟可以获得的经验
A74: improve_exp_57 | B74: 15 | C74: 57级侠客挂机每分钟可以获得的经验
A75: improve_exp_58 | B75: 15 | C75: 58级侠客挂机每分钟可以获得的经验
A76: improve_exp_59 | B76: 15 | C76: 59级侠客挂机每分钟可以获得的经验

Sheet: 触发式弹出条件表
A1: ID | B1: 事件名称 | C1: 类型 | D1: 附注
A2: id | B2: event_name | C2: type | D2: comments
A3: 1 | B3: 每日抽奖 | C3: every_day | D3: 每日第一次登陆
A4: 2 | B4: 在线奖励 | C4: every_day | D4: 每日第一次登陆，关闭每日抽奖页面之后
A5: 3 | B5: 邀请好友奖励 | C5: every_day | D5: 每日第一次登陆，关闭在线奖励页面之后
A6: 4 | B6: 升级提示框 | C6: every_lvl_up | D6: 等级提升，并且没有其他窗口正在弹出
A7: 5 | B7: 山庄 | C7: once | D7: 每个玩家第一次打开该页面
A8: 6 | B8: 总坛 | C8: once | D8: 每个玩家第一次打开该页面
A9: 7 | B9: 监狱 | C9: once | D9: 每个玩家第一次打开该页面
A10: 8 | B10: 炼兵房 | C10: once | D10: 每个玩家第一次打开该页面
A11: 9 | B11: 矿场 | C11: once | D11: 每个玩家第一次打开该页面
A12: 10 | B12: 习武馆 | C12: once | D12: 每个玩家第一次打开该页面
A13: 11 | B13: 客栈 | C13: once | D13: 每个玩家第一次打开该页面
A14: 12 | B14: 擂台 | C14: once | D14: 每个玩家第一次打开该页面
A15: 13 | B15: 议事厅 | C15: once | D15: 每个玩家第一次打开该页面
A16: 14 | B16: 铁匠铺 | C16: once | D16: 每个玩家第一次打开该页面
A17: 15 | B17: 阵型 | C17: once | D17: 每个玩家第一次打开该页面
A18: 16 | B18: 地图 | C18: once | D18: 每个玩家第一次打开该页面
A19: 17 | B19: 关卡选择页面 | C19: once | D19: 每个玩家第一次打开该页面
A20: 18 | B20: 战斗页面 | C20: once | D20: 每个玩家第一次打开该页面
A21: 19 | B21: 华山论剑 | C21: once | D21: 每个玩家第一次打开该页面
A22: 20 | B22: 第一次进入游戏 | C22: custom | D22: 播放战斗动画
A23: 21 | B23: 第一次战斗结束 | C23: custom | D23: 新手指引图1
A24: 22 | B24: 第一次退出总坛 | C24: custom | D24: 新手指引图2
A25: 23 | B25: 第一次进入地图 | C25: custom | D25: 新手指引图3
A26: 24 | B26: 第一次击败1-1之前 | C26: custom | D26: 新手指引图4，10-战斗教程1,10-战斗教程2，10-战斗教程3
A27: 25 | B27: 第一次击败1-2之前 | C27: custom | D27: 新手指引图5
A28: 26 | B28: 第一次击败1-3之前 | C28: custom | D28: 13-1侠客不能升级，关闭关卡
A29: 27 | B29: 第一次回庄 | C29: custom | D29: 15-仓库，16-1选择新手礼包，16-2使用新手礼包
A30: 28 | B30: 第一次退出议事厅 | C30: custom | D30: 新手指引图8
A31: 29 | B31: 第一次进入游戏播放战斗动画之前 | C31: custom | D31: 1-剧情内容1
A32: 30 | B32: 第一次进入游戏播放战斗动画之后 | C32: custom | D32: 3-剧情内容2，4-获得侠客，新手指引图1
A33: 31 | B33: 第一次退出仓库 | C33: custom | D33: 17-进入铁匠铺
A34: 32 | B34: 第一次退出铁匠铺 | C34: custom | D34: 新手指引图7
A35: 33 | B35: 第一次关闭议事厅帮助 | C35: custom | D35: 22-领取任务奖励，22-领取任务奖励，23-关闭议事厅
A36: 34 | B36: 第一次退出议事厅 | C36: custom | D36: 24-打开阵型，25-上阵侠客
A37: 35 | B37: 第一次退出阵型 | C37: custom | D37: 26-主界面教程
A38: 36 | B38: 铁匠铺镶嵌 | C38: once | D38: 第一次进入镶嵌页面
A39: 37 | B39: 仓库 | C39: once | D39: 第一次进入仓库

Sheet: 侠客合成表
A1: ID | B1: 物品ID | C1: 卷轴名称 | D1: 合成卡等级 | E1: 描述 | F1: 合成奖励 | G1: 参数列表 | H1: 材料侠客名称 | I1: 材料侠客等级 | J1: 侠客个数 | K1: 材料侠客名称 | L1: 材料侠客等级 | M1: 侠客个数 | N1: 材料侠客名称 | O1: 材料侠客等级 | P1: 侠客个数 | Q1: 材料侠客名称 | R1: 材料侠客等级 | S1: 侠客个数 | T1: 材料侠客名称 | U1: 材料侠客等级 | V1: 侠客个数
A2: id | B2: item_id | C2: name | D2: mergecard_lvl | E2: desc | F2: reward_type | G2: reward_args | H2: src_hero | I2: src_hero_lvl | J2: src_hero_num | K2: src_hero | L2: src_hero_lvl | M2: src_hero_num | N2: src_hero | O2: src_hero_lvl | P2: src_hero_num | Q2: src_hero | R2: src_hero_lvl | S2: src_hero_num | T2: src_hero | U2: src_hero_lvl | V2: src_hero_num
A3: 1 | B3: 3 | C3: 合成：灭绝师太 | D3: A | E3: 使用：获得灭绝师太(三星) | F3: hero | G3: 289 | H3: 木婉清 | I3: 1 | J3: 1 | K3: 静慧师太 | L3: 1 | M3: 1 | N3: 仪光 | O3: 1 | P3: 1 | Q3: 仪和 | R3: 1 | S3: 1 | T3: 仪清 | U3: 1 | V3: 1
A4: 2 | B4: 4 | C4: 合成：公孙止 | D4: A | E4: 使用：获得公孙止(三星) | F4: hero | G4: 395 | H4: 哲别 | I4: 1 | J4: 1 | K4: 清虚道长 | L4: 1 | M4: 1 | N4: 过三拳 | O4: 1 | P4: 1 | Q4: 沈青刚 | R4: 1 | S4: 1 | T4: 余人彦 | U4: 1 | V4: 1
A5: 3 | B5: 5 | C5: 合成：宁中则 | D5: A | E5: 使用：获得宁中则(三星) | F5: hero | G5: 519 | H5: 木婉清 | I5: 1 | J5: 1 | K5: 韩小莹 | L5: 1 | M5: 1 | N5: 智慧宝树王 | O5: 1 | P5: 1 | Q5: 穆念慈 | R5: 1 | S5: 1 | T5: 仪光 | U5: 1 | V5: 1
A6: 4 | B6: 6 | C6: 合成：左冷禅 | D6: A | E6: 使用：获得左冷禅(三星) | F6: hero | G6: 629 | H6: 哲别 | I6: 1 | J6: 1 | K6: 史火龙 | L6: 1 | M6: 1 | N6: 大圣宝树王 | O6: 1 | P6: 1 | Q6: 天狼子 | R6: 1 | S6: 1 | T6: 洪人雄 | U6: 1 | V6: 1
A7: 5 | B7: 7 | C7: 合成：秦红棉 | D7: A | E7: 使用：获得秦红棉(三星) | F7: hero | G7: 62 | H7: 木婉清 | I7: 1 | J7: 1 | K7: 仪琳 | L7: 1 | M7: 1 | N7: 陆无双 | O7: 1 | P7: 1 | Q7: 狮吼子 | R7: 1 | S7: 1 | T7: 郭芙 | U7: 1 | V7: 1
A8: 6 | B8: 8 | C8: 合成：莫大先生 | D8: A | E8: 使用：获得莫大先生(三星) | F8: hero | G8: 507 | H8: 林震南 | I8: 1 | J8: 1 | K8: 劳德诺 | L8: 1 | M8: 1 | N8: 大圣宝树王 | O8: 1 | P8: 1 | Q8: 郭啸天 | R8: 1 | S8: 1 | T8: 过三拳 | U8: 1 | V8: 1
A9: 7 | B9: 9 | C9: 合成：王语嫣 | D9: A | E9: 使用：获得王语嫣(三星) | F9: hero | G9: 52 | H9: 木婉清 | I9: 1 | J9: 1 | K9: 程瑶迦 | L9: 1 | M9: 1 | N9: 吴青烈 | O9: 1 | P9: 1 | Q9: 杨铁心 | R9: 1 | S9: 1 | T9: 郭啸天 | U9: 1 | V9: 1
A10: 8 | B10: 10 | C10: 合成：梅超风 | D10: A | E10: 使用：获得梅超风(三星) | F10: hero | G10: 271 | H10: 全金发 | I10: 1 | J10: 1 | K10: 钟灵 | L10: 1 | M10: 1 | N10: 郑镖头 | O10: 1 | P10: 1 | Q10: 杨铁心 | R10: 1 | S10: 1 | T10: 候人英 | U10: 1 | V10: 1
A11: 9 | B11: 11 | C11: 合成：赵敏 | D11: A | E11: 使用：获得赵敏(三星) | F11: hero | G11: 305 | H11: 哲别 | I11: 1 | J11: 1 | K11: 霍都 | L11: 1 | M11: 1 | N11: 完颜阿骨打 | O11: 1 | P11: 1 | Q11: 智慧宝树王 | R11: 1 | S11: 1 | T11: 常胜宝树王 | U11: 1 | V11: 1
A12: 10 | B12: 12 | C12: 合成：林远图 | D12: A | E12: 使用：获得林远图(三星) | F12: hero | G12: 476 | H12: 林震南 | I12: 1 | J12: 1 | K12: 李志常 | L12: 1 | M12: 1 | N12: 富镖头 | O12: 1 | P12: 1 | Q12: 郑镖头 | R12: 1 | S12: 1 | T12: 史镖头 | U12: 1 | V12: 1
A13: 11 | B13: 13 | C13: 合成：欧阳克 | D13: A | E13: 使用：获得欧阳克(三星) | F13: hero | G13: 356 | H13: 完颜洪烈 | I13: 1 | J13: 1 | K13: 平婆婆 | L13: 1 | M13: 1 | N13: 沈青刚 | O13: 1 | P13: 1 | Q13: 马青雄 | R13: 1 | S13: 1 | T13: 钱青健 | U13: 1 | V13: 1
A14: 12 | B14: 14 | C14: 合成：余沧海 | D14: A | E14: 使用：获得余沧海(三星) | F14: hero | G14: 582 | H14: 柯镇恶 | I14: 1 | J14: 1 | K14: 申人俊 | L14: 1 | M14: 1 | N14: 罗人杰 | O14: 1 | P14: 1 | Q14: 洪人雄 | R14: 1 | S14: 1 | T14: 余人彦 | U14: 1 | V14: 1
A15: 13 | B15: 15 | C15: 合成：哲别 | D15: B | E15: 使用：获得哲别(二星) | F15: hero | G15: 367 | H15: 常胜宝树王 | I15: 1 | J15: 1 | K15: 大圣宝树王 | L15: 1 | M15: 1 | N15: 殷无福 | O15: 1 | P15: 1 | Q15: 皮清玄 | R15: 1 | S15: 1 | T15: 白二 | U15: 1 | V15: 1
A16: 14 | B16: 16 | C16: 合成：林震南 | D16: B | E16: 使用：获得林震南(二星) | F16: hero | G16: 548 | H16: 郑镖头 | I16: 1 | J16: 1 | K16: 郭啸天 | L16: 1 | M16: 1 | N16: 姬清虚 | O16: 1 | P16: 1 | Q16: 申志凡 | R16: 1 | S16: 1 | T16: 白二 | U16: 1 | V16: 1
A17: 15 | B17: 17 | C17: 合成：全金发 | D17: B | E17: 使用：获得全金发(二星) | F17: hero | G17: 411 | H17: 狮吼子 | I17: 1 | J17: 1 | K17: 天狼子 | L17: 1 | M17: 1 | N17: 陈歪嘴 | O17: 1 | P17: 1 | Q17: 王十三 | R17: 1 | S17: 1 | T17: 陈七 | U17: 1 | V17: 1
A18: 16 | B18: 18 | C18: 合成：木婉清 | D18: B | E18: 使用：获得木婉清(二星) | F18: hero | G18: 124 | H18: 仪光 | I18: 1 | J18: 1 | K18: 杨铁心 | L18: 1 | M18: 1 | N18: 武三娘 | O18: 1 | P18: 1 | Q18: 陆二娘 | R18: 1 | S18: 1 | T18: 陈七 | U18: 1 | V18: 1
A19: 17 | B19: 19 | C19: 合成：柯镇恶 | D19: B | E19: 使用：获得柯镇恶(二星) | F19: hero | G19: 406 | H19: 余人彦 | I19: 1 | J19: 1 | K19: 马青雄 | L19: 1 | M19: 1 | N19: 殷无禄 | O19: 1 | P19: 1 | Q19: 殷无寿 | R19: 1 | S19: 1 | T19: 殷无福 | U19: 1 | V19: 1
A20: 18 | B20: 20 | C20: 合成：赵志敬 | D20: B | E20: 使用：获得赵志敬(二星) | F20: hero | G20: 257 | H20: 仪清 | I20: 1 | J20: 1 | K20: 余人彦 | L20: 1 | M20: 1 | N20: 祈志诚 | O20: 1 | P20: 1 | Q20: 宋德方 | R20: 1 | S20: 1 | T20: 申志凡 | U20: 1 | V20: 1
A21: 19 | B21: 21 | C21: 合成：完颜洪烈 | D21: B | E21: 使用：获得完颜洪烈(二星) | F21: hero | G21: 369 | H21: 完颜阿骨打 | I21: 1 | J21: 1 | K21: 洪人雄 | L21: 1 | M21: 1 | N21: 桑昆 | O21: 1 | P21: 1 | Q21: 札木合 | R21: 1 | S21: 1 | T21: 都史 | U21: 1 | V21: 1

Sheet: 消息表
A1: ID | B1: 类型 | C1: 触发条件 | D1: 格式
A2: id | B2: msg_type | C2: trigger_case | D2: format
A3: 1 | B3: system_msg | C3: 帮助好友收获矿石 | D3: %player_name% 帮您收获了矿石，获得 %gem_name%×%gem_num%。
A4: 2 | B4: system_msg | C4: 抱住好友收获碎片 | D4: %player_name% 帮您收获了碎片，获得 %material_name%×%material_num%。
A5: 3 | B5: system_msg | C5: 帮助好友加成开采 | D5: %player_name% 来矿场帮忙了，当前好友加成共提升产量 %gem_bonus_p%。
A6: 4 | B6: system_msg | C6: 帮助好友加成炼兵 | D6: %player_name% 来炼兵房帮忙了，当前好友加成功提升产量 %material_bonus_p%。
A7: 5 | B7: system_msg | C7: 擂台挑战其他玩家，成功 | D7: %player_name% 在擂台中向您发起挑战，您失败了，当前排名第%match_rank%名。
A8: 6 | B8: system_msg | C8: 擂台挑战其他玩家，失败 | D8: %player_name% 在擂台中向您发起挑战，您胜利了，排名不变。
A9: 7 | B9: system_msg | C9: 占领陌客山庄，成功 | D9: %player_name% 占领了您的山庄，您被掠夺了%rob_money% 铜币。
A10: 8 | B10: system_msg | C10: 占领陌客山庄，失败 | D10: %player_name% 企图占领您的山庄，但是被您打的屁滚尿流。
A11: 9 | B11: system_msg | C11: 访问好友山庄 | D11: %player_name% 访问了您的山庄。
A12: 10 | B12: system_msg | C12: 与好友切磋比武，成功 | D12: %player_name% 同您比武切磋，您落败了，您在江湖好友中排名%friend_rank%。
A13: 11 | B13: system_msg | C13: 与好友切磋比武，失败 | D13: %player_name% 同您比武切磋，被您打的鼻青脸肿。
A14: 12 | B14: system_msg | C14: 解救好友，成功 | D14: %friend_name% 将您从%stranger_name%手中救了出来。
A15: 13 | B15: system_msg | C15: 解救好友，失败 | D15: %friend_namee% 试图从%stranger_name%手中将您解救，但是TA失败了！
A16: 14 | B16: system_msg | C16: 反抗成功 | D16: %player_name% 成功反抗了您的占领，从牢房逃脱了。
A17: 15 | B17: system_msg | C17: 反抗失败 | D17: %player_name% 试图反抗您的占领，但是失败了。
A18: 16 | B18: interact_msg | C18: 邀请好友加成开采 | D18: %player_name% 邀请您去TA的矿场帮忙。是否帮忙？
A19: 17 | B19: interact_msg | C19: 邀请好友加成炼造 | D19: %player_name% 邀请您去TA的炼兵房帮忙。是否帮忙？
A20: 18 | B20: interact_msg | C20: 请求好友解救 | D20: %player_name% 的山庄被占领了，请求您的援助。是否解救？
A21: 19 | B21: passing_msg | C21: ItemLevelCanNotBeyondHero | D21: 请先提升侠客等级
A22: 20 | B22: passing_msg | C22: 强化等级到达顶级后继续强化 | D22: 已达到强化上限
A23: 21 | B23: passing_msg | C23: 镶嵌等级到达顶级后继续镶嵌 | D23: 已达到镶嵌上限
A24: 22 | B24: passing_msg | C24: 习武馆训练满级侠客 | D24: 该侠客已达到等级上限
A25: 23 | B25: passing_msg | C25: 获得物品时(若超过3个物品分几次显示) | D25: 获得%item_name1%×%item_num1%，%item_name2%×%item_num2%，%item_name3%×%item_num3%
A26: 24 | B26: passing_msg | C26: MoneyNotEnough | D26: 金钱不足
A27: 25 | B27: passing_msg | C27: 侠义令导向目标关卡未解锁时显示提示内容 | D27: 请先提升庄主等级
A28: 26 | B28: passing_msg | C28: 任意任务完成 | D28: 任务完成，请前往议事厅领取奖励
A29: 27 | B29: passing_msg | C29: 服务器未响应 | D29: 服务器连接异常，请刷新页面后重试
A30: 28 | B30: passing_msg | C30: ExistsHero | D30: 您已经招募过该侠客了
A31: 29 | B31: passing_msg | C31: 成功招募侠客 | D31: 恭喜您招募到新侠客%hero_name%
A32: 30 | B32: passing_msg | C32: 侠客解锁新技能 | D32: %hero_name% 领悟了新技能 %skill_name%
A33: 31 | B33: passing_msg | C33: 接受任务 | D33: 接受任务
A34: 32 | B34: passing_msg | C34: NotExists | D34: 该侠客不存在
A35: 33 | B35: passing_msg | C35: DataError | D35: 数据异常
A36: 34 | B36: passing_msg | C36: MaxReady | D36: 出战侠客已达到上限
A37: 35 | B37: passing_msg | C37: AlreadyFight | D37: 该侠客已出战
A38: 36 | B38: passing_msg | C38: NotReady | D38: 目标侠客未出战
A39: 37 | B39: passing_msg | C39: ParameterError | D39: 参数错误
A40: 38 | B40: passing_msg | C40: NotAllowEmpty | D40: 出战列表不允许空
A41: 39 | B41: passing_msg | C41: NotExistsHeroData | D41: 没有侠客数据
A42: 40 | B42: passing_msg | C42: ExistsUser | D42: 用户已存在，不能创建数据
A43: 41 | B43: passing_msg | C43: SaveFail | D43: 保存用户数据失败
A44: 42 | B44: passing_msg | C44: LoadFailed | D44: 加载错误数据
A45: 43 | B45: passing_msg | C45: LevelNoAllow | D45: 等级不够
A46: 44 | B46: passing_msg | C46: ProgressNoAllow | D46: 进度未到
A47: 45 | B47: passing_msg | C47: SkillNotExists | D47: 技能不存在
A48: 46 | B48: passing_msg | C48: OutOfTime | D48: 信息已过时，请刷新页面后重试
A49: 47 | B49: passing_msg | C49: DupHeros | D49: 侠客重复
A50: 48 | B50: passing_msg | C50: NotExistsItem | D50: 物品不存在
A51: 49 | B51: passing_msg | C51: ItemIsUsed | D51: 物品已被使用
A52: 50 | B52: passing_msg | C52: MaterialIsNotEnough | D52: 材料不足
A53: 51 | B53: passing_msg | C53: NoMoreLoginReward | D53: 今日抽奖次数已用完
A54: 52 | B54: passing_msg | C54: SpIsNotEnough | D54: 精力不足
A55: 53 | B55: passing_msg | C55: BpIsNotEnough | D55: 战力不足
A56: 54 | B56: passing_msg | C56: GloryIsNotEnough | D56: 荣誉点不足
A57: 55 | B57: passing_msg | C57: FriendIsNotCaptured | D57: 好友未被占领
A58: 56 | B58: passing_msg | C58: HasAlreadyBeenCaptured | D58: 已经被人占领了
A59: 57 | B59: passing_msg | C59: HeroIsReserching | D59: 该侠客正在训练中
A60: 58 | B60: passing_msg | C60: MaxLevied | D60: 征收次数不足
A61: 59 | B61: passing_msg | C61: OnCDTime | D61: 冷却中
A62: 60 | B62: passing_msg | C62: HelpNotEnought | D62: 好友加成位已满
A63: 61 | B63: passing_msg | C63: HelpEnought | D63: 今日帮助次数已用完
A64: 62 | B64: passing_msg | C64: AlreadyHelp | D64: 您已经帮助过该好友了
A65: 63 | B65: passing_msg | C65: MAX_SP | D65: 精力已达到上限
A66: 64 | B66: passing_msg | C66: MAX_BP | D66: 战力已达到上限

Sheet: 物品价值表
A1: ID | B1: 物品名称 | C1: 物品单价(元宝)
A2: id | B2: item_name | C2: item_price
A3: gem|4 | B3: 锐金石 | C3: 0.2
A4: gem|5 | B4: 厚土石 | C4: 0.2
A5: gem|6 | B5: 烈火石 | C5: 0.2
A6: gem|7 | B6: 洪水石 | C6: 0.2
A7: gem|8 | B7: 巨木石 | C7: 0.2
A8: material|1 | B8: 武器碎片 | C8: 0.2
A9: material|2 | B9: 防具碎片 | C9: 0.2
A10: material|3 | B10: 饰品碎片 | C10: 0.2
A11: item|57 | B11: 拆解卡 | C11: 300

Sheet: 商城随机商品表
A1: ID | B1: 物品名称 | C1: 随机类别 | D1: 字体颜色 | E1: 物品图标 | F1: 热卖图标 | G1: 折扣图标 | H1: 所属分类 | I1: 物品描述 | J1: 单价 | K1: 奖励类型 | L1: 参数列表 | M1: 奖励类型 | N1: 参数列表 | O1: 奖励类型 | P1: 参数列表
A2: id | B2: item_name | C2: random_type | D2: font_color | E2: item_icon | F2: hot_icon | G2: disconut_icon | H2: item_category | I2: desc | J2: item_price | K2: reward_type | L2: reward_args | M2: reward_type | N2: reward_args | O2: reward_type | P2: reward_args
A3: 1 | B3: 白世镜 | C3: xiakeA | E3: images\head\63.png | H3: xiake | I3: 获得三星侠客：白世镜 | J3: 5000 | K3: hero | L3: 35
A4: 2 | B4: 武眠风 | C4: xiakeA | E4: images\head\59.png | H4: xiake | I4: 获得三星侠客：武眠风 | J4: 5000 | K4: hero | L4: 273
A5: 3 | B5: 冯默风 | C5: xiakeA | E5: images\head\58.png | H5: xiake | I5: 获得三星侠客：冯默风 | J5: 5000 | K5: hero | L5: 274
A6: 4 | B6: 陈玄风 | C6: xiakeA | E6: images\head\58.png | H6: xiake | I6: 获得三星侠客：陈玄风 | J6: 5000 | K6: hero | L6: 275
A7: 5 | B7: 黄钟公 | C7: xiakeA | E7: images\head\67.png | H7: xiake | I7: 获得三星侠客：黄钟公 | J7: 5000 | K7: hero | L7: 544
A8: 6 | B8: 平一指 | C8: xiakeA | E8: images\head\4.png | H8: xiake | I8: 获得三星侠客：平一指 | J8: 5000 | K8: hero | L8: 545
A9: 7 | B9: 田伯光 | C9: xiakeA | E9: images\head\49.png | H9: xiake | I9: 获得三星侠客：田伯光 | J9: 5000 | K9: hero | L9: 546
A10: 8 | B10: 费彬 | C10: xiakeA | E10: images\head\112.png | H10: xiake | I10: 获得三星侠客：费彬 | J10: 5000 | K10: hero | L10: 630
A11: 9 | B11: 巴天石 | C11: xiakeA | E11: images\head\12.png | H11: xiake | I11: 获得三星侠客：巴天石 | J11: 5000 | K11: hero | L11: 32
A12: 10 | B12: 范骅 | C12: xiakeA | E12: images\head\12.png | H12: xiake | I12: 获得三星侠客：范骅 | J12: 5000 | K12: hero | L12: 33
A13: 11 | B13: 华赫艮 | C13: xiakeA | E13: images\head\13.png | H13: xiake | I13: 获得三星侠客：华赫艮 | J13: 5000 | K13: hero | L13: 34
A14: 12 | B14: 陈孤雁 | C14: xiakeA | E14: images\head\62.png | H14: xiake | I14: 获得三星侠客：陈孤雁 | J14: 5000 | K14: hero | L14: 36
A15: 13 | B15: 全冠清 | C15: xiakeA | E15: images\head\64.png | H15: xiake | I15: 获得三星侠客：全冠清 | J15: 5000 | K15: hero | L15: 37
A16: 14 | B16: 赵钱孙 | C16: xiakeA | E16: images\head\64.png | H16: xiake | I16: 获得三星侠客：赵钱孙 | J16: 5000 | K16: hero | L16: 46
A17: 15 | B17: 刀白凤 | C17: xiakeA | E17: images\head\96.png | H17: xiake | I17: 获得三星侠客：刀白凤 | J17: 5000 | K17: hero | L17: 56
A18: 16 | B18: 五叶大师 | C18: xiakeA | E18: images\head\21.png | H18: xiake | I18: 获得三星侠客：五叶大师 | J18: 5000 | K18: hero | L18: 64
A19: 17 | B19: 叶二娘 | C19: xiakeA | E19: images\head\139.png | H19: xiake | I19: 获得三星侠客：叶二娘 | J19: 5000 | K19: hero | L19: 65
A20: 18 | B20: 岳老三 | C20: xiakeA | E20: images\head\31.png | H20: xiake | I20: 获得三星侠客：岳老三 | J20: 5000 | K20: hero | L20: 68
A21: 19 | B21: 范百龄 | C21: xiakeA | E21: images\head\81.png | H21: xiake | I21: 获得三星侠客：范百龄 | J21: 5000 | K21: hero | L21: 92
A22: 20 | B22: 玄惭 | C22: xiakeA | E22: images\head\22.png | H22: xiake | I22: 获得三星侠客：玄惭 | J22: 5000 | K22: hero | L22: 83
A23: 21 | B23: 玄苦 | C23: xiakeA | E23: images\head\22.png | H23: xiake | I23: 获得三星侠客：玄苦 | J23: 5000 | K23: hero | L23: 86
A24: 22 | B24: 苦乘 | C24: xiakeA | E24: images\head\22.png | H24: xiake | I24: 获得三星侠客：苦乘 | J24: 5000 | K24: hero | L24: 191
A25: 23 | B25: 圆音 | C25: xiakeA | E25: images\head\22.png | H25: xiake | I25: 获得三星侠客：圆音 | J25: 5000 | K25: hero | L25: 196
A26: 24 | B26: 鲁有脚 | C26: xiakeA | E26: images\head\62.png | H26: xiake | I26: 获得三星侠客：鲁有脚 | J26: 5000 | K26: hero | L26: 215
A27: 25 | B27: 丘处机 | C27: xiakeA | E27: images\head\82.png | H27: xiake | I27: 获得三星侠客：丘处机 | J27: 5000 | K27: hero | L27: 242
A28: 26 | B28: 潇湘子 | C28: xiakeA | E28: images\head\17.png | H28: xiake | I28: 获得三星侠客：潇湘子 | J28: 5000 | K28: hero | L28: 352
A29: 27 | B29: 刘正风 | C29: xiakeA | E29: images\head\78.png | H29: xiake | I29: 获得三星侠客：刘正风 | J29: 5000 | K29: hero | L29: 508
A30: 28 | B30: 包不同 | C30: xiakeA | E30: images\head\4.png | H30: xiake | I30: 获得三星侠客：包不同 | J30: 5000 | K30: hero | L30: 48
A31: 29 | B31: 邓百川 | C31: xiakeA | E31: images\head\56.png | H31: xiake | I31: 获得三星侠客：邓百川 | J31: 5000 | K31: hero | L31: 49
A32: 30 | B32: 风波恶 | C32: xiakeA | E32: images\head\46.png | H32: xiake | I32: 获得三星侠客：风波恶 | J32: 5000 | K32: hero | L32: 50
A33: 31 | B33: 公冶乾 | C33: xiakeA | E33: images\head\17.png | H33: xiake | I33: 获得三星侠客：公冶乾 | J33: 5000 | K33: hero | L33: 51
A34: 32 | B34: 陆乘风 | C34: xiakeA | E34: images\head\59.png | H34: xiake | I34: 获得三星侠客：陆乘风 | J34: 5000 | K34: hero | L34: 272
A35: 33 | B35: 定静师太 | C35: xiakeA | E35: images\head\114.png | H35: xiake | I35: 获得三星侠客：定静师太 | J35: 5000 | K35: hero | L35: 472
A36: 34 | B36: 定闲师太 | C36: xiakeA | E36: images\head\14.png | H36: xiake | I36: 获得三星侠客：定闲师太 | J36: 5000 | K36: hero | L36: 473
A37: 35 | B37: 哑婆婆 | C37: xiakeA | E37: images\head\496.png | H37: xiake | I37: 获得三星侠客：哑婆婆 | J37: 5000 | K37: hero | L37: 496
A38: 36 | B38: 计无施 | C38: xiakeA | E38: images\head\535.png | H38: xiake | I38: 获得三星侠客：计无施 | J38: 5000 | K38: hero | L38: 535
A39: 37 | B39: 木高峰 | C39: xiakeA | E39: images\head\543.png | H39: xiake | I39: 获得三星侠客：木高峰 | J39: 5000 | K39: hero | L39: 543
A40: 38 | B40: 高升泰 | C40: xiakeA | E40: images\head\58.png | H40: xiake | I40: 获得三星侠客：高升泰 | J40: 5000 | K40: hero | L40: 31
A41: 39 | B41: 尹志平 | C41: xiakeA | E41: images\head\84.png | H41: xiake | I41: 获得三星侠客：尹志平 | J41: 5000 | K41: hero | L41: 243
A42: 40 | B42: 刘处玄 | C42: xiakeA | E42: images\head\82.png | H42: xiake | I42: 获得三星侠客：刘处玄 | J42: 5000 | K42: hero | L42: 245
A43: 41 | B43: 王处一 | C43: xiakeA | E43: images\head\82.png | H43: xiake | I43: 获得三星侠客：王处一 | J43: 5000 | K43: hero | L43: 248
A44: 42 | B44: 说不得 | C44: xiakeA | E44: images\head\22.png | H44: xiake | I44: 获得三星侠客：说不得 | J44: 5000 | K44: hero | L44: 307
A45: 43 | B45: 小昭 | C45: xiakeA | E45: images\head\88.png | H45: xiake | I45: 获得三星侠客：小昭 | J45: 5000 | K45: hero | L45: 312
A46: 44 | B46: 张松溪 | C46: xiakeA | E46: images\head\82.png | H46: xiake | I46: 获得三星侠客：张松溪 | J46: 5000 | K46: hero | L46: 342
A47: 45 | B47: 莫声谷 | C47: xiakeA | E47: images\head\84.png | H47: xiake | I47: 获得三星侠客：莫声谷 | J47: 5000 | K47: hero | L47: 345

Sheet: 元宝充值表
A1: ID | B1: RMB(分) | C1: 元宝 | D1: 赠送元宝 | E1: 描述
A2: id | B2: rmb_cost | C2: coin | D2: send | E2: detail
A3: 1 | B3: 100 | C3: 10 | D3: 0 | E3: 10_yuanbao
A4: 2 | B4: 800 | C4: 80 | D4: 0 | E4: 80_yuanbao
A5: 3 | B5: 2800 | C5: 280 | D5: 0 | E5: 280_yuanbao
A6: 4 | B6: 12800 | C6: 1280 | D6: 0 | E6: 1280_yuanbao
A7: 5 | B7: 36800 | C7: 3680 | D7: 0 | E7: 3680_yuanbao
A8: 6 | B8: 68800 | C8: 6880 | D8: 0 | E8: 6880_yuanbao

Sheet: export
A1: sheet_name | B1: export_name
A2: 招募金钱常量表 | B2: recruit_cost
A3: 招募概率常量表 | B3: recruit_rate
A4: 客栈配置表 | B4: inn_settings
A5: 装备类型常量表 | B5: equip_type_const
A6: 装备类型表 | B6: equip_type_list
A7: 阵法表 | B7: formation_list
A8: 好友加成位解锁表 | B8: unlock_list
A9: 常用参数表 | B9: common_value_list
A10: 商城表 | B10: sales_list
A11: 练功房参数表 | B11: exp_room_arg_list
A12: 触发式弹出条件表 | B12: popup_event_list
A13: 侠客合成表 | B13: hero_merge_list
A14: 消息表 | B14: message_list
A15: 物品价值表 | B15: item_value_list
A16: 商城随机商品表 | B16: random_good_list
A17: 元宝充值表 | B17: pay_coin_list