Sheet: 神仙卡牌配置表
A1: id | B1: 系列ID | C1: 名称 | D1: 星级 | E1: 等级 | F1: 攻击力 | G1: 生命值 | H1: 技能ID | I1: 卡牌组合 | J1: 组合效果 | K1: 卡牌描述
A2: id | B2: number | C2: name | D2: star | E2: lv | F2: atk | G2: hp | H2: skill_id | I2: group | J2: group_effect | K2: descrption
A3: 1 | B3: 1 | C3: =RC[-2]*100 -> 100 | D3: 1 | E3: 1 | F3: 59 | G3: 120 | H3: 1
A4: 2 | B4: 1 | C4: =RC[-2]*100 -> 200 | D4: 2 | E4: 1 | F4: 100 | G4: 195 | H4: 1
A5: 3 | B5: 1 | C5: =RC[-2]*100 -> 300 | D5: 3 | E5: 1 | F5: 149 | G5: 355 | H5: 1 | I5: 2 | J5: 1,20
A6: 4 | B6: 1 | C6: =RC[-2]*100 -> 400 | D6: 4 | E6: 1 | F6: 238 | G6: 516 | H6: 1 | I6: 3,9 | J6: 2,25
A7: 5 | B7: 1 | C7: =RC[-2]*100 -> 500 | D7: 5 | E7: 1 | F7: 378 | G7: 821 | H7: 1 | I7: 8,4 | J7: 1,25
A8: 6 | B8: 2 | C8: =RC[-2]*100 -> 600 | D8: 1 | E8: 1 | F8: 45 | G8: 140 | H8: 2
A9: 7 | B9: 2 | C9: =RC[-2]*100 -> 700 | D9: 2 | E9: 1 | F9: 79 | G9: 221 | H9: 2
A10: 8 | B10: 2 | C10: =RC[-2]*100 -> 800 | D10: 3 | E10: 1 | F10: 118 | G10: 390 | H10: 2 | I10: 2 | J10: 1,20
A11: 9 | B11: 2 | C11: =RC[-2]*100 -> 900 | D11: 4 | E11: 1 | F11: 199 | G11: 552 | H11: 2 | I11: 3,9 | J11: 2,25
A12: 10 | B12: 2 | C12: =RC[-2]*100 -> 1000 | D12: 5 | E12: 1 | F12: 327 | G12: 878 | H12: 2 | I12: 8,4 | J12: 1,25
A13: 11 | B13: 3 | C13: =RC[-2]*100 -> 1100 | D13: 1 | E13: 1 | F13: 51 | G13: 129 | H13: 3
A14: 12 | B14: 3 | C14: =RC[-2]*100 -> 1200 | D14: 2 | E14: 1 | F14: 82 | G14: 208 | H14: 3
A15: 13 | B15: 3 | C15: =RC[-2]*100 -> 1300 | D15: 3 | E15: 1 | F15: 123 | G15: 357 | H15: 3 | I15: 2 | J15: 1,20
A16: 14 | B16: 3 | C16: =RC[-2]*100 -> 1400 | D16: 4 | E16: 1 | F16: 209 | G16: 526 | H16: 3 | I16: 3,9 | J16: 2,25
A17: 15 | B17: 3 | C17: =RC[-2]*100 -> 1500 | D17: 5 | E17: 1 | F17: 327 | G17: 825 | H17: 3 | I17: 8,4 | J17: 1,25
A18: 16 | B18: 4 | C18: =RC[-2]*100 -> 1600 | D18: 1 | E18: 1 | F18: 47 | G18: 131 | H18: 4
A19: 17 | B19: 4 | C19: =RC[-2]*100 -> 1700 | D19: 2 | E19: 1 | F19: 75 | G19: 211 | H19: 4
A20: 18 | B20: 4 | C20: =RC[-2]*100 -> 1800 | D20: 3 | E20: 1 | F20: 120 | G20: 367 | H20: 4 | I20: 2 | J20: 1,20
A21: 19 | B21: 4 | C21: =RC[-2]*100 -> 1900 | D21: 4 | E21: 1 | F21: 199 | G21: 530 | H21: 4 | I21: 3,9 | J21: 2,25
A22: 20 | B22: 4 | C22: =RC[-2]*100 -> 2000 | D22: 5 | E22: 1 | F22: 321 | G22: 829 | H22: 4 | I22: 8,4 | J22: 1,25
A23: 21 | B23: 5 | C23: =RC[-2]*100 -> 2100 | D23: 1 | E23: 1 | F23: 53 | G23: 121 | H23: 5
A24: 22 | B24: 5 | C24: =RC[-2]*100 -> 2200 | D24: 2 | E24: 1 | F24: 82 | G24: 195 | H24: 5
A25: 23 | B25: 5 | C25: =RC[-2]*100 -> 2300 | D25: 3 | E25: 1 | F25: 119 | G25: 354 | H25: 5 | I25: 2 | J25: 1,20
A26: 24 | B26: 5 | C26: =RC[-2]*100 -> 2400 | D26: 4 | E26: 1 | F26: 195 | G26: 517 | H26: 5 | I26: 3,9 | J26: 2,25
A27: 25 | B27: 5 | C27: =RC[-2]*100 -> 2500 | D27: 5 | E27: 1 | F27: 328 | G27: 822 | H27: 5 | I27: 8,4 | J27: 1,25
A28: 26 | B28: 6 | C28: =RC[-2]*100 -> 2600 | D28: 1 | E28: 1 | F28: 61 | G28: 115 | H28: 6
A29: 27 | B29: 6 | C29: =RC[-2]*100 -> 2700 | D29: 2 | E29: 1 | F29: 95 | G29: 186 | H29: 6
A30: 28 | B30: 6 | C30: =RC[-2]*100 -> 2800 | D30: 3 | E30: 1 | F30: 141 | G30: 341 | H30: 6 | I30: 2 | J30: 1,20
A31: 29 | B31: 6 | C31: =RC[-2]*100 -> 2900 | D31: 4 | E31: 1 | F31: 234 | G31: 519 | H31: 6 | I31: 3,9 | J31: 2,25
A32: 30 | B32: 6 | C32: =RC[-2]*100 -> 3000 | D32: 5 | E32: 1 | F32: 375 | G32: 813 | H32: 6 | I32: 8,4 | J32: 1,25
A33: 31 | B33: 7 | C33: =RC[-2]*100 -> 3100 | D33: 1 | E33: 1 | F33: 51 | G33: 130 | H33: 7
A34: 32 | B34: 7 | C34: =RC[-2]*100 -> 3200 | D34: 2 | E34: 1 | F34: 82 | G34: 220 | H34: 7
A35: 33 | B35: 7 | C35: =RC[-2]*100 -> 3300 | D35: 3 | E35: 1 | F35: 123 | G35: 390 | H35: 7 | I35: 2 | J35: 1,20
A36: 34 | B36: 7 | C36: =RC[-2]*100 -> 3400 | D36: 4 | E36: 1 | F36: 204 | G36: 550 | H36: 7 | I36: 3,9 | J36: 2,25
A37: 35 | B37: 7 | C37: =RC[-2]*100 -> 3500 | D37: 5 | E37: 1 | F37: 336 | G37: 855 | H37: 7 | I37: 8,4 | J37: 1,25
A38: 36 | B38: 8 | C38: =RC[-2]*100 -> 3600 | D38: 1 | E38: 1 | F38: 56 | G38: 134 | H38: 8
A39: 37 | B39: 8 | C39: =RC[-2]*100 -> 3700 | D39: 2 | E39: 1 | F39: 86 | G39: 226 | H39: 8
A40: 38 | B40: 8 | C40: =RC[-2]*100 -> 3800 | D40: 3 | E40: 1 | F40: 129 | G40: 393 | H40: 8 | I40: 2 | J40: 1,20
A41: 39 | B41: 8 | C41: =RC[-2]*100 -> 3900 | D41: 4 | E41: 1 | F41: 209 | G41: 556 | H41: 8 | I41: 3,9 | J41: 2,25
A42: 40 | B42: 8 | C42: =RC[-2]*100 -> 4000 | D42: 5 | E42: 1 | F42: 333 | G42: 859 | H42: 8 | I42: 8,4 | J42: 1,25
A43: 41 | B43: 9 | C43: =RC[-2]*100 -> 4100 | D43: 1 | E43: 1 | F43: 53 | G43: 139 | H43: 9
A44: 42 | B44: 9 | C44: =RC[-2]*100 -> 4200 | D44: 2 | E44: 1 | F44: 86 | G44: 223 | H44: 9
A45: 43 | B45: 9 | C45: =RC[-2]*100 -> 4300 | D45: 3 | E45: 1 | F45: 127 | G45: 392 | H45: 9 | I45: 2 | J45: 1,20
A46: 44 | B46: 9 | C46: =RC[-2]*100 -> 4400 | D46: 4 | E46: 1 | F46: 206 | G46: 556 | H46: 9 | I46: 3,9 | J46: 2,25
A47: 45 | B47: 9 | C47: =RC[-2]*100 -> 4500 | D47: 5 | E47: 1 | F47: 337 | G47: 857 | H47: 9 | I47: 8,4 | J47: 1,25
A48: 46 | B48: 10 | C48: =RC[-2]*100 -> 4600 | D48: 1 | E48: 1 | F48: 53 | G48: 140 | H48: 10
A49: 47 | B49: 10 | C49: =RC[-2]*100 -> 4700 | D49: 2 | E49: 1 | F49: 86 | G49: 227 | H49: 10
A50: 48 | B50: 10 | C50: =RC[-2]*100 -> 4800 | D50: 3 | E50: 1 | F50: 129 | G50: 389 | H50: 10 | I50: 2 | J50: 1,20
A51: 49 | B51: 10 | C51: =RC[-2]*100 -> 4900 | D51: 4 | E51: 1 | F51: 208 | G51: 559 | H51: 10 | I51: 3,9 | J51: 2,25
A52: 50 | B52: 10 | C52: =RC[-2]*100 -> 5000 | D52: 5 | E52: 1 | F52: 331 | G52: 860 | H52: 10 | I52: 8,4 | J52: 1,25
A53: 51 | B53: 11 | C53: =RC[-2]*100 -> 5100 | D53: 1 | E53: 1 | F53: 55 | G53: 120 | H53: 11
A54: 52 | B54: 11 | C54: =RC[-2]*100 -> 5200 | D54: 2 | E54: 1 | F54: 85 | G54: 195 | H54: 11
A55: 53 | B55: 11 | C55: =RC[-2]*100 -> 5300 | D55: 3 | E55: 1 | F55: 140 | G55: 354 | H55: 11 | I55: 2 | J55: 1,20
A56: 54 | B56: 11 | C56: =RC[-2]*100 -> 5400 | D56: 4 | E56: 1 | F56: 235 | G56: 516 | H56: 11 | I56: 3,9 | J56: 2,25
A57: 55 | B57: 11 | C57: =RC[-2]*100 -> 5500 | D57: 5 | E57: 1 | F57: 370 | G57: 823 | H57: 11 | I57: 8,4 | J57: 1,25
A58: 56 | B58: 12 | C58: =RC[-2]*100 -> 5600 | D58: 1 | E58: 1 | F58: 54 | G58: 125 | H58: 12
A59: 57 | B59: 12 | C59: =RC[-2]*100 -> 5700 | D59: 2 | E59: 1 | F59: 88 | G59: 190 | H59: 12
A60: 58 | B60: 12 | C60: =RC[-2]*100 -> 5800 | D60: 3 | E60: 1 | F60: 145 | G60: 350 | H60: 12 | I60: 2 | J60: 1,20
A61: 59 | B61: 12 | C61: =RC[-2]*100 -> 5900 | D61: 4 | E61: 1 | F61: 240 | G61: 515 | H61: 12 | I61: 3,9 | J61: 2,25
A62: 60 | B62: 12 | C62: =RC[-2]*100 -> 6000 | D62: 5 | E62: 1 | F62: 375 | G62: 821 | H62: 12 | I62: 8,4 | J62: 1,25
A63: 61 | B63: 13 | C63: =RC[-2]*100 -> 6100 | D63: 1 | E63: 1 | F63: 58 | G63: 120 | H63: 13
A64: 62 | B64: 13 | C64: =RC[-2]*100 -> 6200 | D64: 2 | E64: 1 | F64: 87 | G64: 192 | H64: 13
A65: 63 | B65: 13 | C65: =RC[-2]*100 -> 6300 | D65: 3 | E65: 1 | F65: 149 | G65: 355 | H65: 13 | I65: 2 | J65: 1,20
A66: 64 | B66: 13 | C66: =RC[-2]*100 -> 6400 | D66: 4 | E66: 1 | F66: 241 | G66: 511 | H66: 13 | I66: 3,9 | J66: 2,25
A67: 65 | B67: 13 | C67: =RC[-2]*100 -> 6500 | D67: 5 | E67: 1 | F67: 379 | G67: 828 | H67: 13 | I67: 8,4 | J67: 1,25
A68: 66 | B68: 14 | C68: =RC[-2]*100 -> 6600 | D68: 1 | E68: 1 | F68: 51 | G68: 130 | H68: 14
A69: 67 | B69: 14 | C69: =RC[-2]*100 -> 6700 | D69: 2 | E69: 1 | F69: 81 | G69: 221 | H69: 14
A70: 68 | B70: 14 | C70: =RC[-2]*100 -> 6800 | D70: 3 | E70: 1 | F70: 123 | G70: 375 | H70: 14 | I70: 2 | J70: 1,20
A71: 69 | B71: 14 | C71: =RC[-2]*100 -> 6900 | D71: 4 | E71: 1 | F71: 202 | G71: 512 | H71: 14 | I71: 3,9 | J71: 2,25
A72: 70 | B72: 14 | C72: =RC[-2]*100 -> 7000 | D72: 5 | E72: 1 | F72: 332 | G72: 815 | H72: 14 | I72: 8,4 | J72: 1,25
A73: 71 | B73: 15 | C73: =RC[-2]*100 -> 7100 | D73: 1 | E73: 1 | F73: 53 | G73: 126 | H73: 15
A74: 72 | B74: 15 | C74: =RC[-2]*100 -> 7200 | D74: 2 | E74: 1 | F74: 83 | G74: 224 | H74: 15
A75: 73 | B75: 15 | C75: =RC[-2]*100 -> 7300 | D75: 3 | E75: 1 | F75: 125 | G75: 374 | H75: 15 | I75: 2 | J75: 1,20
A76: 74 | B76: 15 | C76: =RC[-2]*100 -> 7400 | D76: 4 | E76: 1 | F76: 205 | G76: 516 | H76: 15 | I76: 3,9 | J76: 2,25
A77: 75 | B77: 15 | C77: =RC[-2]*100 -> 7500 | D77: 5 | E77: 1 | F77: 336 | G77: 820 | H77: 15 | I77: 8,4 | J77: 1,25
A78: 76 | B78: 16 | C78: =RC[-2]*100 -> 7600 | D78: 1 | E78: 1 | F78: 55 | G78: 121 | H78: 16
A79: 77 | B79: 16 | C79: =RC[-2]*100 -> 7700 | D79: 2 | E79: 1 | F79: 85 | G79: 228 | H79: 16
A80: 78 | B80: 16 | C80: =RC[-2]*100 -> 7800 | D80: 3 | E80: 1 | F80: 126 | G80: 375 | H80: 16 | I80: 2 | J80: 1,20
A81: 79 | B81: 16 | C81: =RC[-2]*100 -> 7900 | D81: 4 | E81: 1 | F81: 201 | G81: 520 | H81: 16 | I81: 3,9 | J81: 2,25
A82: 80 | B82: 16 | C82: =RC[-2]*100 -> 8000 | D82: 5 | E82: 1 | F82: 330 | G82: 825 | H82: 16 | I82: 8,4 | J82: 1,25
A83: 81 | B83: 17 | C83: =RC[-2]*100 -> 8100 | D83: 1 | E83: 1 | F83: 56 | G83: 129 | H83: 17
A84: 82 | B84: 17 | C84: =RC[-2]*100 -> 8200 | D84: 2 | E84: 1 | F84: 88 | G84: 226 | H84: 17
A85: 83 | B85: 17 | C85: =RC[-2]*100 -> 8300 | D85: 3 | E85: 1 | F85: 122 | G85: 375 | H85: 17 | I85: 2 | J85: 1,20
A86: 84 | B86: 17 | C86: =RC[-2]*100 -> 8400 | D86: 4 | E86: 1 | F86: 203 | G86: 519 | H86: 17 | I86: 3,9 | J86: 2,25
A87: 85 | B87: 17 | C87: =RC[-2]*100 -> 8500 | D87: 5 | E87: 1 | F87: 340 | G87: 830 | H87: 17 | I87: 8,4 | J87: 1,25
A88: 86 | B88: 18 | C88: =RC[-2]*100 -> 8600 | D88: 1 | E88: 1 | F88: 58 | G88: 122 | H88: 18
A89: 87 | B89: 18 | C89: =RC[-2]*100 -> 8700 | D89: 2 | E89: 1 | F89: 88 | G89: 222 | H89: 18
A90: 88 | B90: 18 | C90: =RC[-2]*100 -> 8800 | D90: 3 | E90: 1 | F90: 129 | G90: 380 | H90: 18 | I90: 2 | J90: 1,20
A91: 89 | B91: 18 | C91: =RC[-2]*100 -> 8900 | D91: 4 | E91: 1 | F91: 207 | G91: 524 | H91: 18 | I91: 3,9 | J91: 2,25
A92: 90 | B92: 18 | C92: =RC[-2]*100 -> 9000 | D92: 5 | E92: 1 | F92: 339 | G92: 831 | H92: 18 | I92: 8,4 | J92: 1,25
A93: 91 | B93: 19 | C93: =RC[-2]*100 -> 9100 | D93: 1 | E93: 1 | F93: 53 | G93: 126 | H93: 19
A94: 92 | B94: 19 | C94: =RC[-2]*100 -> 9200 | D94: 2 | E94: 1 | F94: 83 | G94: 224 | H94: 19
A95: 93 | B95: 19 | C95: =RC[-2]*100 -> 9300 | D95: 3 | E95: 1 | F95: 125 | G95: 374 | H95: 19 | I95: 2 | J95: 1,20
A96: 94 | B96: 19 | C96: =RC[-2]*100 -> 9400 | D96: 4 | E96: 1 | F96: 205 | G96: 516 | H96: 19 | I96: 3,9 | J96: 2,25
A97: 95 | B97: 19 | C97: =RC[-2]*100 -> 9500 | D97: 5 | E97: 1 | F97: 336 | G97: 820 | H97: 19 | I97: 8,4 | J97: 1,25
A98: 96 | B98: 20 | C98: =RC[-2]*100 -> 9600 | D98: 1 | E98: 1 | F98: 60 | G98: 120 | H98: 20
A99: 97 | B99: 20 | C99: =RC[-2]*100 -> 9700 | D99: 2 | E99: 1 | F99: 100 | G99: 190 | H99: 20
A100: 98 | B100: 20 | C100: =RC[-2]*100 -> 9800 | D100: 3 | E100: 1 | F100: 150 | G100: 345 | H100: 20 | I100: 2 | J100: 1,20
A101: 99 | B101: 20 | C101: =RC[-2]*100 -> 9900 | D101: 4 | E101: 1 | F101: 240 | G101: 510 | H101: 20 | I101: 3,9 | J101: 2,25
A102: 100 | B102: 20 | C102: =RC[-2]*100 -> 10000 | D102: 5 | E102: 1 | F102: 380 | G102: 801 | H102: 20 | I102: 8,4 | J102: 1,25
A103: 101 | B103: 21 | C103: =RC[-2]*100 -> 10100 | D103: 1 | E103: 1 | F103: 51 | G103: 140 | H103: 21
A104: 102 | B104: 21 | C104: =RC[-2]*100 -> 10200 | D104: 2 | E104: 1 | F104: 82 | G104: 230 | H104: 21
A105: 103 | B105: 21 | C105: =RC[-2]*100 -> 10300 | D105: 3 | E105: 1 | F105: 131 | G105: 408 | H105: 21 | I105: 2 | J105: 1,20
A106: 104 | B106: 21 | C106: =RC[-2]*100 -> 10400 | D106: 4 | E106: 1 | F106: 222 | G106: 572 | H106: 21 | I106: 3,9 | J106: 2,25
A107: 105 | B107: 21 | C107: =RC[-2]*100 -> 10500 | D107: 5 | E107: 1 | F107: 351 | G107: 875 | H107: 21 | I107: 8,4 | J107: 1,25
A108: 106 | B108: 22 | C108: =RC[-2]*100 -> 10600 | D108: 1 | E108: 1 | F108: 52 | G108: 141 | H108: 22
A109: 107 | B109: 22 | C109: =RC[-2]*100 -> 10700 | D109: 2 | E109: 1 | F109: 82 | G109: 232 | H109: 22
A110: 108 | B110: 22 | C110: =RC[-2]*100 -> 10800 | D110: 3 | E110: 1 | F110: 135 | G110: 712 | H110: 22 | I110: 2 | J110: 1,20
A111: 109 | B111: 22 | C111: =RC[-2]*100 -> 10900 | D111: 4 | E111: 1 | F111: 226 | G111: 575 | H111: 22 | I111: 3,9 | J111: 2,25
A112: 110 | B112: 22 | C112: =RC[-2]*100 -> 11000 | D112: 5 | E112: 1 | F112: 353 | G112: 872 | H112: 22 | I112: 8,4 | J112: 1,25
A113: 111 | B113: 23 | C113: =RC[-2]*100 -> 11100 | D113: 1 | E113: 1 | F113: 55 | G113: 144 | H113: 23
A114: 112 | B114: 23 | C114: =RC[-2]*100 -> 11200 | D114: 2 | E114: 1 | F114: 85 | G114: 231 | H114: 23
A115: 113 | B115: 23 | C115: =RC[-2]*100 -> 11300 | D115: 3 | E115: 1 | F115: 138 | G115: 711 | H115: 23 | I115: 2 | J115: 1,20
A116: 114 | B116: 23 | C116: =RC[-2]*100 -> 11400 | D116: 4 | E116: 1 | F116: 227 | G116: 574 | H116: 23 | I116: 3,9 | J116: 2,25
A117: 115 | B117: 23 | C117: =RC[-2]*100 -> 11500 | D117: 5 | E117: 1 | F117: 349 | G117: 873 | H117: 23 | I117: 8,4 | J117: 1,25
A118: 116 | B118: 24 | C118: =RC[-2]*100 -> 11600 | D118: 1 | E118: 1 | F118: 48 | G118: 145 | H118: 24
A119: 117 | B119: 24 | C119: =RC[-2]*100 -> 11700 | D119: 2 | E119: 1 | F119: 75 | G119: 230 | H119: 24
A120: 118 | B120: 24 | C120: =RC[-2]*100 -> 11800 | D120: 3 | E120: 1 | F120: 116 | G120: 405 | H120: 24 | I120: 2 | J120: 1,20
A121: 119 | B121: 24 | C121: =RC[-2]*100 -> 11900 | D121: 4 | E121: 1 | F121: 198 | G121: 598 | H121: 24 | I121: 3,9 | J121: 2,25
A122: 120 | B122: 24 | C122: =RC[-2]*100 -> 12000 | D122: 5 | E122: 1 | F122: 323 | G122: 902 | H122: 24 | I122: 8,4 | J122: 1,25
A123: 121 | B123: 25 | C123: =RC[-2]*100 -> 12100 | D123: 1 | E123: 1 | F123: 46 | G123: 146 | H123: 25
A124: 122 | B124: 25 | C124: =RC[-2]*100 -> 12200 | D124: 2 | E124: 1 | F124: 76 | G124: 231 | H124: 25
A125: 123 | B125: 25 | C125: =RC[-2]*100 -> 12300 | D125: 3 | E125: 1 | F125: 114 | G125: 408 | H125: 25 | I125: 2 | J125: 1,20
A126: 124 | B126: 25 | C126: =RC[-2]*100 -> 12400 | D126: 4 | E126: 1 | F126: 196 | G126: 600 | H126: 25 | I126: 3,9 | J126: 2,25
A127: 125 | B127: 25 | C127: =RC[-2]*100 -> 12500 | D127: 5 | E127: 1 | F127: 327 | G127: 910 | H127: 25 | I127: 8,4 | J127: 1,25
A128: 126 | B128: 26 | C128: =RC[-2]*100 -> 12600 | D128: 1 | E128: 1 | F128: 49 | G128: 144 | H128: 26
A129: 127 | B129: 26 | C129: =RC[-2]*100 -> 12700 | D129: 2 | E129: 1 | F129: 77 | G129: 238 | H129: 26
A130: 128 | B130: 26 | C130: =RC[-2]*100 -> 12800 | D130: 3 | E130: 1 | F130: 112 | G130: 410 | H130: 26 | I130: 2 | J130: 1,20
A131: 129 | B131: 26 | C131: =RC[-2]*100 -> 12900 | D131: 4 | E131: 1 | F131: 195 | G131: 602 | H131: 26 | I131: 3,9 | J131: 2,25
A132: 130 | B132: 26 | C132: =RC[-2]*100 -> 13000 | D132: 5 | E132: 1 | F132: 327 | G132: 908 | H132: 26 | I132: 8,4 | J132: 1,25
A133: 131 | B133: 27 | C133: =RC[-2]*100 -> 13100 | D133: 1 | E133: 1 | F133: 42 | G133: 141 | H133: 27
A134: 132 | B134: 27 | C134: =RC[-2]*100 -> 13200 | D134: 2 | E134: 1 | F134: 73 | G134: 238 | H134: 27
A135: 133 | B135: 27 | C135: =RC[-2]*100 -> 13300 | D135: 3 | E135: 1 | F135: 119 | G135: 412 | H135: 27 | I135: 2 | J135: 1,20
A136: 134 | B136: 27 | C136: =RC[-2]*100 -> 13400 | D136: 4 | E136: 1 | F136: 203 | G136: 604 | H136: 27 | I136: 3,9 | J136: 2,25
A137: 135 | B137: 27 | C137: =RC[-2]*100 -> 13500 | D137: 5 | E137: 1 | F137: 322 | G137: 908 | H137: 27 | I137: 8,4 | J137: 1,25
A138: 136 | B138: 28 | C138: =RC[-2]*100 -> 13600 | D138: 1 | E138: 1 | F138: 43 | G138: 140 | H138: 28
A139: 137 | B139: 28 | C139: =RC[-2]*100 -> 13700 | D139: 2 | E139: 1 | F139: 72 | G139: 229 | H139: 28
A140: 138 | B140: 28 | C140: =RC[-2]*100 -> 13800 | D140: 3 | E140: 1 | F140: 111 | G140: 403 | H140: 28 | I140: 2 | J140: 1,20
A141: 139 | B141: 28 | C141: =RC[-2]*100 -> 13900 | D141: 4 | E141: 1 | F141: 189 | G141: 592 | H141: 28 | I141: 3,9 | J141: 2,25
A142: 140 | B142: 28 | C142: =RC[-2]*100 -> 14000 | D142: 5 | E142: 1 | F142: 331 | G142: 901 | H142: 28 | I142: 8,4 | J142: 1,25
A143: 141 | B143: 29 | C143: =RC[-2]*100 -> 14100 | D143: 1 | E143: 1 | F143: 47 | G143: 150 | H143: 29
A144: 142 | B144: 29 | C144: =RC[-2]*100 -> 14200 | D144: 2 | E144: 1 | F144: 79 | G144: 229 | H144: 29
A145: 143 | B145: 29 | C145: =RC[-2]*100 -> 14300 | D145: 3 | E145: 1 | F145: 122 | G145: 394 | H145: 29 | I145: 2 | J145: 1,20
A146: 144 | B146: 29 | C146: =RC[-2]*100 -> 14400 | D146: 4 | E146: 1 | F146: 203 | G146: 604 | H146: 29 | I146: 3,9 | J146: 2,25
A147: 145 | B147: 29 | C147: =RC[-2]*100 -> 14500 | D147: 5 | E147: 1 | F147: 332 | G147: 911 | H147: 29 | I147: 8,4 | J147: 1,25
A148: 146 | B148: 30 | C148: =RC[-2]*100 -> 14600 | D148: 1 | E148: 1 | F148: 40 | G148: 151 | H148: 30
A149: 147 | B149: 30 | C149: =RC[-2]*100 -> 14700 | D149: 2 | E149: 1 | F149: 80 | G149: 232 | H149: 30
A150: 148 | B150: 30 | C150: =RC[-2]*100 -> 14800 | D150: 3 | E150: 1 | F150: 119 | G150: 412 | H150: 30 | I150: 2 | J150: 1,20
A151: 149 | B151: 30 | C151: =RC[-2]*100 -> 14900 | D151: 4 | E151: 1 | F151: 203 | G151: 608 | H151: 30 | I151: 3,9 | J151: 2,25
A152: 150 | B152: 30 | C152: =RC[-2]*100 -> 15000 | D152: 5 | E152: 1 | F152: 333 | G152: 909 | H152: 30 | I152: 8,4 | J152: 1,25
A153: 151 | B153: 31 | C153: =RC[-2]*100 -> 15100 | D153: 1 | E153: 1 | F153: 50 | G153: 145 | H153: 31
A154: 152 | B154: 31 | C154: =RC[-2]*100 -> 15200 | D154: 2 | E154: 1 | F154: 75 | G154: 243 | H154: 31
A155: 153 | B155: 31 | C155: =RC[-2]*100 -> 15300 | D155: 3 | E155: 1 | F155: 115 | G155: 432 | H155: 31 | I155: 2 | J155: 1,20
A156: 154 | B156: 31 | C156: =RC[-2]*100 -> 15400 | D156: 4 | E156: 1 | F156: 192 | G156: 592 | H156: 31 | I156: 3,9 | J156: 2,25
A157: 155 | B157: 31 | C157: =RC[-2]*100 -> 15500 | D157: 5 | E157: 1 | F157: 318 | G157: 938 | H157: 31 | I157: 8,4 | J157: 1,25
A158: 156 | B158: 32 | C158: =RC[-2]*100 -> 15600 | D158: 1 | E158: 1 | F158: 55 | G158: 144 | H158: 32
A159: 157 | B159: 32 | C159: =RC[-2]*100 -> 15700 | D159: 2 | E159: 1 | F159: 79 | G159: 242 | H159: 32
A160: 158 | B160: 32 | C160: =RC[-2]*100 -> 15800 | D160: 3 | E160: 1 | F160: 117 | G160: 430 | H160: 32 | I160: 2 | J160: 1,20
A161: 159 | B161: 32 | C161: =RC[-2]*100 -> 15900 | D161: 4 | E161: 1 | F161: 197 | G161: 590 | H161: 32 | I161: 3,9 | J161: 2,25
A162: 160 | B162: 32 | C162: =RC[-2]*100 -> 16000 | D162: 5 | E162: 1 | F162: 320 | G162: 940 | H162: 32 | I162: 8,4 | J162: 1,25
A163: 161 | B163: 33 | C163: =RC[-2]*100 -> 16100 | D163: 1 | E163: 1 | F163: 56 | G163: 129 | H163: 33
A164: 162 | B164: 33 | C164: =RC[-2]*100 -> 16200 | D164: 2 | E164: 1 | F164: 85 | G164: 208 | H164: 33
A165: 163 | B165: 33 | C165: =RC[-2]*100 -> 16300 | D165: 3 | E165: 1 | F165: 135 | G165: 355 | H165: 33 | I165: 2 | J165: 1,20
A166: 164 | B166: 33 | C166: =RC[-2]*100 -> 16400 | D166: 4 | E166: 1 | F166: 228 | G166: 518 | H166: 33 | I166: 3,9 | J166: 2,25
A167: 165 | B167: 33 | C167: =RC[-2]*100 -> 16500 | D167: 5 | E167: 1 | F167: 352 | G167: 830 | H167: 33 | I167: 8,4 | J167: 1,25
A168: 166 | B168: 34 | C168: =RC[-2]*100 -> 16600 | D168: 1 | E168: 1 | F168: 58 | G168: 124 | H168: 34
A169: 167 | B169: 34 | C169: =RC[-2]*100 -> 16700 | D169: 2 | E169: 1 | F169: 89 | G169: 207 | H169: 34
A170: 168 | B170: 34 | C170: =RC[-2]*100 -> 16800 | D170: 3 | E170: 1 | F170: 137 | G170: 253 | H170: 34 | I170: 2 | J170: 1,20
A171: 169 | B171: 34 | C171: =RC[-2]*100 -> 16900 | D171: 4 | E171: 1 | F171: 230 | G171: 515 | H171: 34 | I171: 3,9 | J171: 2,25
A172: 170 | B172: 34 | C172: =RC[-2]*100 -> 17000 | D172: 5 | E172: 1 | F172: 360 | G172: 824 | H172: 34 | I172: 8,4 | J172: 1,25
A173: 171 | B173: 35 | C173: =RC[-2]*100 -> 17100 | D173: 1 | E173: 1 | F173: 45 | G173: 135 | H173: 35
A174: 172 | B174: 35 | C174: =RC[-2]*100 -> 17200 | D174: 2 | E174: 1 | F174: 76 | G174: 236 | H174: 35
A175: 173 | B175: 35 | C175: =RC[-2]*100 -> 17300 | D175: 3 | E175: 1 | F175: 116 | G175: 426 | H175: 35 | I175: 2 | J175: 1,20
A176: 174 | B176: 35 | C176: =RC[-2]*100 -> 17400 | D176: 4 | E176: 1 | F176: 204 | G176: 587 | H176: 35 | I176: 3,9 | J176: 2,25
A177: 175 | B177: 35 | C177: =RC[-2]*100 -> 17500 | D177: 5 | E177: 1 | F177: 321 | G177: 934 | H177: 35 | I177: 8,4 | J177: 1,25
A178: 176 | B178: 36 | C178: =RC[-2]*100 -> 17600 | D178: 1 | E178: 1 | F178: 47 | G178: 132 | H178: 36
A179: 177 | B179: 36 | C179: =RC[-2]*100 -> 17700 | D179: 2 | E179: 1 | F179: 73 | G179: 230 | H179: 36
A180: 178 | B180: 36 | C180: =RC[-2]*100 -> 17800 | D180: 3 | E180: 1 | F180: 112 | G180: 430 | H180: 36 | I180: 2 | J180: 1,20
A181: 179 | B181: 36 | C181: =RC[-2]*100 -> 17900 | D181: 4 | E181: 1 | F181: 200 | G181: 585 | H181: 36 | I181: 3,9 | J181: 2,25
A182: 180 | B182: 36 | C182: =RC[-2]*100 -> 18000 | D182: 5 | E182: 1 | F182: 329 | G182: 931 | H182: 36 | I182: 8,4 | J182: 1,25
A183: 181 | B183: 37 | C183: =RC[-2]*100 -> 18100 | D183: 1 | E183: 1 | F183: 43 | G183: 135 | H183: 37
A184: 182 | B184: 37 | C184: =RC[-2]*100 -> 18200 | D184: 2 | E184: 1 | F184: 70 | G184: 233 | H184: 37
A185: 183 | B185: 37 | C185: =RC[-2]*100 -> 18300 | D185: 3 | E185: 1 | F185: 110 | G185: 431 | H185: 37 | I185: 2 | J185: 1,20
A186: 184 | B186: 37 | C186: =RC[-2]*100 -> 18400 | D186: 4 | E186: 1 | F186: 207 | G186: 588 | H186: 37 | I186: 3,9 | J186: 2,25
A187: 185 | B187: 37 | C187: =RC[-2]*100 -> 18500 | D187: 5 | E187: 1 | F187: 331 | G187: 934 | H187: 37 | I187: 8,4 | J187: 1,25
A188: 186 | B188: 38 | C188: =RC[-2]*100 -> 18600 | D188: 1 | E188: 1 | F188: 46 | G188: 130 | H188: 38
A189: 187 | B189: 38 | C189: =RC[-2]*100 -> 18700 | D189: 2 | E189: 1 | F189: 75 | G189: 231 | H189: 38
A190: 188 | B190: 38 | C190: =RC[-2]*100 -> 18800 | D190: 3 | E190: 1 | F190: 114 | G190: 428 | H190: 38 | I190: 2 | J190: 1,20
A191: 189 | B191: 38 | C191: =RC[-2]*100 -> 18900 | D191: 4 | E191: 1 | F191: 202 | G191: 565 | H191: 38 | I191: 3,9 | J191: 2,25
A192: 190 | B192: 38 | C192: =RC[-2]*100 -> 19000 | D192: 5 | E192: 1 | F192: 324 | G192: 939 | H192: 38 | I192: 8,4 | J192: 1,25
A193: 191 | B193: 39 | C193: =RC[-2]*100 -> 19100 | D193: 1 | E193: 1 | F193: 57 | G193: 130 | H193: 39
A194: 192 | B194: 39 | C194: =RC[-2]*100 -> 19200 | D194: 2 | E194: 1 | F194: 84 | G194: 221 | H194: 39
A195: 193 | B195: 39 | C195: =RC[-2]*100 -> 19300 | D195: 3 | E195: 1 | F195: 141 | G195: 385 | H195: 39 | I195: 2 | J195: 1,20
A196: 194 | B196: 39 | C196: =RC[-2]*100 -> 19400 | D196: 4 | E196: 1 | F196: 230 | G196: 546 | H196: 39 | I196: 3,9 | J196: 2,25
A197: 195 | B197: 39 | C197: =RC[-2]*100 -> 19500 | D197: 5 | E197: 1 | F197: 360 | G197: 852 | H197: 39 | I197: 8,4 | J197: 1,25
A198: 196 | B198: 40 | C198: =RC[-2]*100 -> 19600 | D198: 1 | E198: 1 | F198: 58 | G198: 129 | H198: 40
A199: 197 | B199: 40 | C199: =RC[-2]*100 -> 19700 | D199: 2 | E199: 1 | F199: 86 | G199: 220 | H199: 40
A200: 198 | B200: 40 | C200: =RC[-2]*100 -> 19800 | D200: 3 | E200: 1 | F200: 145 | G200: 383 | H200: 40 | I200: 2 | J200: 1,20
A201: 199 | B201: 40 | C201: =RC[-2]*100 -> 19900 | D201: 4 | E201: 1 | F201: 233 | G201: 542 | H201: 40 | I201: 3,9 | J201: 2,25
A202: 200 | B202: 40 | C202: =RC[-2]*100 -> 20000 | D202: 5 | E202: 1 | F202: 364 | G202: 848 | H202: 40 | I202: 8,4 | J202: 1,25
A203: 201 | B203: 41 | C203: =RC[-2]*100 -> 20100 | D203: 1 | E203: 1 | F203: 53 | G203: 133 | H203: 41
A204: 202 | B204: 41 | C204: =RC[-2]*100 -> 20200 | D204: 2 | E204: 1 | F204: 82 | G204: 225 | H204: 41
A205: 203 | B205: 41 | C205: =RC[-2]*100 -> 20300 | D205: 3 | E205: 1 | F205: 141 | G205: 386 | H205: 41 | I205: 2 | J205: 1,20
A206: 204 | B206: 41 | C206: =RC[-2]*100 -> 20400 | D206: 4 | E206: 1 | F206: 231 | G206: 547 | H206: 41 | I206: 3,9 | J206: 2,25
A207: 205 | B207: 41 | C207: =RC[-2]*100 -> 20500 | D207: 5 | E207: 1 | F207: 362 | G207: 851 | H207: 41 | I207: 8,4 | J207: 1,25
A208: 206 | B208: 42 | C208: =RC[-2]*100 -> 20600 | D208: 1 | E208: 1 | F208: 51 | G208: 134 | H208: 42
A209: 207 | B209: 42 | C209: =RC[-2]*100 -> 20700 | D209: 2 | E209: 1 | F209: 86 | G209: 221 | H209: 42
A210: 208 | B210: 42 | C210: =RC[-2]*100 -> 20800 | D210: 3 | E210: 1 | F210: 149 | G210: 381 | H210: 42 | I210: 2 | J210: 1,20
A211: 209 | B211: 42 | C211: =RC[-2]*100 -> 20900 | D211: 4 | E211: 1 | F211: 238 | G211: 540 | H211: 42 | I211: 3,9 | J211: 2,25
A212: 210 | B212: 42 | C212: =RC[-2]*100 -> 21000 | D212: 5 | E212: 1 | F212: 366 | G212: 847 | H212: 42 | I212: 8,4 | J212: 1,25
A213: 211 | B213: 43 | C213: =RC[-2]*100 -> 21100 | D213: 1 | E213: 1 | F213: 56 | G213: 121 | H213: 43
A214: 212 | B214: 43 | C214: =RC[-2]*100 -> 21200 | D214: 2 | E214: 1 | F214: 87 | G214: 221 | H214: 43
A215: 213 | B215: 43 | C215: =RC[-2]*100 -> 21300 | D215: 3 | E215: 1 | F215: 131 | G215: 382 | H215: 43 | I215: 2 | J215: 1,20
A216: 214 | B216: 43 | C216: =RC[-2]*100 -> 21400 | D216: 4 | E216: 1 | F216: 215 | G216: 545 | H216: 43 | I216: 3,9 | J216: 2,25
A217: 215 | B217: 43 | C217: =RC[-2]*100 -> 21500 | D217: 5 | E217: 1 | F217: 342 | G217: 849 | H217: 43 | I217: 8,4 | J217: 1,25
A218: 216 | B218: 44 | C218: =RC[-2]*100 -> 21600 | D218: 1 | E218: 1 | F218: 57 | G218: 120 | H218: 44
A219: 217 | B219: 44 | C219: =RC[-2]*100 -> 21700 | D219: 2 | E219: 1 | F219: 89 | G219: 217 | H219: 44
A220: 218 | B220: 44 | C220: =RC[-2]*100 -> 21800 | D220: 3 | E220: 1 | F220: 137 | G220: 380 | H220: 44 | I220: 2 | J220: 1,20
A221: 219 | B221: 44 | C221: =RC[-2]*100 -> 21900 | D221: 4 | E221: 1 | F221: 220 | G221: 550 | H221: 44 | I221: 3,9 | J221: 2,25
A222: 220 | B222: 44 | C222: =RC[-2]*100 -> 22000 | D222: 5 | E222: 1 | F222: 347 | G222: 845 | H222: 44 | I222: 8,4 | J222: 1,25
A223: 221 | B223: 45 | C223: =RC[-2]*100 -> 22100 | D223: 1 | E223: 1 | F223: 53 | G223: 126 | H223: 45
A224: 222 | B224: 45 | C224: =RC[-2]*100 -> 22200 | D224: 2 | E224: 1 | F224: 92 | G224: 214 | H224: 45
A225: 223 | B225: 45 | C225: =RC[-2]*100 -> 22300 | D225: 3 | E225: 1 | F225: 133 | G225: 388 | H225: 45 | I225: 2 | J225: 1,20
A226: 224 | B226: 45 | C226: =RC[-2]*100 -> 22400 | D226: 4 | E226: 1 | F226: 224 | G226: 545 | H226: 45 | I226: 3,9 | J226: 2,25
A227: 225 | B227: 45 | C227: =RC[-2]*100 -> 22500 | D227: 5 | E227: 1 | F227: 343 | G227: 851 | H227: 45 | I227: 8,4 | J227: 1,25
A228: 226 | B228: 46 | C228: =RC[-2]*100 -> 22600 | D228: 1 | E228: 1 | F228: 51 | G228: 129 | H228: 46
A229: 227 | B229: 46 | C229: =RC[-2]*100 -> 22700 | D229: 2 | E229: 1 | F229: 87 | G229: 211 | H229: 46
A230: 228 | B230: 46 | C230: =RC[-2]*100 -> 22800 | D230: 3 | E230: 1 | F230: 133 | G230: 384 | H230: 46 | I230: 2 | J230: 1,20
A231: 229 | B231: 46 | C231: =RC[-2]*100 -> 22900 | D231: 4 | E231: 1 | F231: 226 | G231: 541 | H231: 46 | I231: 3,9 | J231: 2,25
A232: 230 | B232: 46 | C232: =RC[-2]*100 -> 23000 | D232: 5 | E232: 1 | F232: 344 | G232: 849 | H232: 46 | I232: 8,4 | J232: 1,25
A233: 231 | B233: 47 | C233: =RC[-2]*100 -> 23100 | D233: 1 | E233: 1 | F233: 59 | G233: 121 | H233: 47
A234: 232 | B234: 47 | C234: =RC[-2]*100 -> 23200 | D234: 2 | E234: 1 | F234: 91 | G234: 212 | H234: 47
A235: 233 | B235: 47 | C235: =RC[-2]*100 -> 23300 | D235: 3 | E235: 1 | F235: 134 | G235: 386 | H235: 47 | I235: 2 | J235: 1,20
A236: 234 | B236: 47 | C236: =RC[-2]*100 -> 23400 | D236: 4 | E236: 1 | F236: 222 | G236: 555 | H236: 47 | I236: 3,9 | J236: 2,25
A237: 235 | B237: 47 | C237: =RC[-2]*100 -> 23500 | D237: 5 | E237: 1 | F237: 349 | G237: 841 | H237: 47 | I237: 8,4 | J237: 1,25
A238: 236 | B238: 48 | C238: =RC[-2]*100 -> 23600 | D238: 1 | E238: 1 | F238: 44 | G238: 130 | H238: 48
A239: 237 | B239: 48 | C239: =RC[-2]*100 -> 23700 | D239: 2 | E239: 1 | F239: 72 | G239: 225 | H239: 48
A240: 238 | B240: 48 | C240: =RC[-2]*100 -> 23800 | D240: 3 | E240: 1 | F240: 113 | G240: 420 | H240: 48 | I240: 2 | J240: 1,20
A241: 239 | B241: 48 | C241: =RC[-2]*100 -> 23900 | D241: 4 | E241: 1 | F241: 193 | G241: 595 | H241: 48 | I241: 3,9 | J241: 2,25
A242: 240 | B242: 48 | C242: =RC[-2]*100 -> 24000 | D242: 5 | E242: 1 | F242: 321 | G242: 920 | H242: 48 | I242: 8,4 | J242: 1,25
A243: 241 | B243: 49 | C243: =RC[-2]*100 -> 24100 | D243: 1 | E243: 1 | F243: 49 | G243: 128 | H243: 49
A244: 242 | B244: 49 | C244: =RC[-2]*100 -> 24200 | D244: 2 | E244: 1 | F244: 78 | G244: 221 | H244: 49
A245: 243 | B245: 49 | C245: =RC[-2]*100 -> 24300 | D245: 3 | E245: 1 | F245: 119 | G245: 591 | H245: 49 | I245: 2 | J245: 1,20
A246: 244 | B246: 49 | C246: =RC[-2]*100 -> 24400 | D246: 4 | E246: 1 | F246: 192 | G246: 597 | H246: 49 | I246: 3,9 | J246: 2,25
A247: 245 | B247: 49 | C247: =RC[-2]*100 -> 24500 | D247: 5 | E247: 1 | F247: 328 | G247: 915 | H247: 49 | I247: 8,4 | J247: 1,25
A248: 246 | B248: 50 | C248: =RC[-2]*100 -> 24600 | D248: 1 | E248: 1 | F248: 41 | G248: 132 | H248: 50
A249: 247 | B249: 50 | C249: =RC[-2]*100 -> 24700 | D249: 2 | E249: 1 | F249: 75 | G249: 226 | H249: 50
A250: 248 | B250: 50 | C250: =RC[-2]*100 -> 24800 | D250: 3 | E250: 1 | F250: 115 | G250: 597 | H250: 50 | I250: 2 | J250: 1,20
A251: 249 | B251: 50 | C251: =RC[-2]*100 -> 24900 | D251: 4 | E251: 1 | F251: 194 | G251: 593 | H251: 50 | I251: 3,9 | J251: 2,25
A252: 250 | B252: 50 | C252: =RC[-2]*100 -> 25000 | D252: 5 | E252: 1 | F252: 322 | G252: 920 | H252: 50

Sheet: 怪物卡牌配置表
A1: id | B1: 系列ID | C1: 名称 | D1: 星级 | E1: 等级 | F1: 攻击力 | G1: 生命值 | H1: 技能ID | I1: 卡牌组合 | J1: 组合效果 | K1: 卡牌描述
A2: id | B2: number | C2: name | D2: star | E2: lv | F2: atk | G2: hp | H2: skill_id | I2: group | J2: group_effect | K2: descrption
A3: 10000 | B3: 1000 | C3: 白熊1 | D3: 1 | E3: 1 | F3: 59 | G3: 120
A4: 10001 | B4: 1000 | C4: 白熊2 | D4: 2 | E4: 1 | F4: 100 | G4: 195
A5: 10005 | B5: 1001 | C5: 白熊3 | D5: 1 | E5: 1 | F5: 45 | G5: 140
A6: 10006 | B6: 1001 | C6: 白熊4 | D6: 2 | E6: 1 | F6: 79 | G6: 221
A7: 10010 | B7: 1002 | C7: 白熊5 | D7: 1 | E7: 1 | F7: 51 | G7: 129
A8: 10011 | B8: 1002 | C8: 白熊6 | D8: 2 | E8: 1 | F8: 82 | G8: 208
A9: 10015 | B9: 1003 | C9: 白熊7 | D9: 1 | E9: 1 | F9: 47 | G9: 131
A10: 10016 | B10: 1003 | C10: 白熊8 | D10: 2 | E10: 1 | F10: 75 | G10: 211
A11: 10020 | B11: 1004 | C11: 白熊9 | D11: 1 | E11: 1 | F11: 53 | G11: 121
A12: 10021 | B12: 1004 | C12: 白熊10 | D12: 2 | E12: 1 | F12: 82 | G12: 195
A13: 10025 | B13: 1005 | C13: 白熊11 | D13: 1 | E13: 1 | F13: 61 | G13: 115
A14: 10026 | B14: 1005 | C14: 白熊12 | D14: 2 | E14: 1 | F14: 95 | G14: 186
A15: 10030 | B15: 1006 | C15: 白熊13 | D15: 1 | E15: 1 | F15: 51 | G15: 130
A16: 10031 | B16: 1006 | C16: 白熊14 | D16: 2 | E16: 1 | F16: 82 | G16: 220
A17: 10035 | B17: 1007 | C17: 白熊15 | D17: 1 | E17: 1 | F17: 56 | G17: 134
A18: 10036 | B18: 1007 | C18: 白熊16 | D18: 2 | E18: 1 | F18: 86 | G18: 226
A19: 10040 | B19: 1008 | C19: 白熊17 | D19: 1 | E19: 1 | F19: 53 | G19: 139
A20: 10041 | B20: 1008 | C20: 白熊18 | D20: 2 | E20: 1 | F20: 86 | G20: 223
A21: 10045 | B21: 1009 | C21: 白熊19 | D21: 1 | E21: 1 | F21: 53 | G21: 140
A22: 10046 | B22: 1009 | C22: 白熊20 | D22: 2 | E22: 1 | F22: 86 | G22: 227
A23: 10050 | B23: 1010 | C23: 白熊21 | D23: 1 | E23: 1 | F23: 55 | G23: 120
A24: 10051 | B24: 1010 | C24: 白熊22 | D24: 2 | E24: 1 | F24: 85 | G24: 195
A25: 10055 | B25: 1011 | C25: 白熊23 | D25: 1 | E25: 1 | F25: 54 | G25: 125
A26: 10056 | B26: 1011 | C26: 白熊24 | D26: 2 | E26: 1 | F26: 88 | G26: 190
A27: 10060 | B27: 1012 | C27: 白熊25 | D27: 1 | E27: 1 | F27: 58 | G27: 120
A28: 10061 | B28: 1012 | C28: 白熊26 | D28: 2 | E28: 1 | F28: 87 | G28: 192
A29: 10065 | B29: 1013 | C29: 白熊27 | D29: 1 | E29: 1 | F29: 51 | G29: 130
A30: 10066 | B30: 1013 | C30: 白熊28 | D30: 2 | E30: 1 | F30: 81 | G30: 221
A31: 10070 | B31: 1014 | C31: 白熊29 | D31: 1 | E31: 1 | F31: 53 | G31: 126
A32: 10071 | B32: 1014 | C32: 白熊30 | D32: 2 | E32: 1 | F32: 83 | G32: 224
A33: 10075 | B33: 1015 | C33: 白熊31 | D33: 1 | E33: 1 | F33: 55 | G33: 121
A34: 10076 | B34: 1015 | C34: 白熊32 | D34: 2 | E34: 1 | F34: 85 | G34: 228
A35: 10080 | B35: 1016 | C35: 白熊33 | D35: 1 | E35: 1 | F35: 56 | G35: 129
A36: 10081 | B36: 1016 | C36: 白熊34 | D36: 2 | E36: 1 | F36: 88 | G36: 226
A37: 10085 | B37: 1017 | C37: 白熊35 | D37: 1 | E37: 1 | F37: 58 | G37: 122
A38: 10086 | B38: 1017 | C38: 白熊36 | D38: 2 | E38: 1 | F38: 88 | G38: 222
A39: 10090 | B39: 1018 | C39: 白熊37 | D39: 1 | E39: 1 | F39: 53 | G39: 126
A40: 10091 | B40: 1018 | C40: 白熊38 | D40: 2 | E40: 1 | F40: 83 | G40: 224
A41: 10095 | B41: 1019 | C41: 白熊39 | D41: 1 | E41: 1 | F41: 60 | G41: 120
A42: 10096 | B42: 1019 | C42: 白熊40 | D42: 2 | E42: 1 | F42: 100 | G42: 190
A43: 10100 | B43: 1020 | C43: 白熊41 | D43: 1 | E43: 1 | F43: 51 | G43: 140
A44: 10101 | B44: 1020 | C44: 白熊42 | D44: 2 | E44: 1 | F44: 82 | G44: 230
A45: 10105 | B45: 1021 | C45: 白熊43 | D45: 1 | E45: 1 | F45: 52 | G45: 141
A46: 10106 | B46: 1021 | C46: 白熊44 | D46: 2 | E46: 1 | F46: 82 | G46: 232
A47: 10110 | B47: 1022 | C47: 白熊45 | D47: 1 | E47: 1 | F47: 55 | G47: 144
A48: 10111 | B48: 1022 | C48: 白熊46 | D48: 2 | E48: 1 | F48: 85 | G48: 231
A49: 10115 | B49: 1023 | C49: 白熊47 | D49: 1 | E49: 1 | F49: 48 | G49: 145
A50: 10116 | B50: 1023 | C50: 白熊48 | D50: 2 | E50: 1 | F50: 75 | G50: 230
A51: 10120 | B51: 1024 | C51: 白熊49 | D51: 1 | E51: 1 | F51: 46 | G51: 146
A52: 10121 | B52: 1024 | C52: 白熊50 | D52: 2 | E52: 1 | F52: 76 | G52: 231
A53: 10125 | B53: 1025 | C53: 白熊51 | D53: 1 | E53: 1 | F53: 49 | G53: 144
A54: 10126 | B54: 1025 | C54: 白熊52 | D54: 2 | E54: 1 | F54: 77 | G54: 238
A55: 10130 | B55: 1026 | C55: 白熊53 | D55: 1 | E55: 1 | F55: 42 | G55: 141
A56: 10131 | B56: 1026 | C56: 白熊54 | D56: 2 | E56: 1 | F56: 73 | G56: 238
A57: 10135 | B57: 1027 | C57: 白熊55 | D57: 1 | E57: 1 | F57: 43 | G57: 140
A58: 10136 | B58: 1027 | C58: 白熊56 | D58: 2 | E58: 1 | F58: 72 | G58: 229
A59: 10140 | B59: 1028 | C59: 白熊57 | D59: 1 | E59: 1 | F59: 47 | G59: 150
A60: 10141 | B60: 1028 | C60: 白熊58 | D60: 2 | E60: 1 | F60: 79 | G60: 229
A61: 10145 | B61: 1029 | C61: 白熊59 | D61: 1 | E61: 1 | F61: 40 | G61: 151
A62: 10146 | B62: 1029 | C62: 白熊60 | D62: 2 | E62: 1 | F62: 80 | G62: 232
A63: 10150 | B63: 1030 | C63: 白熊61 | D63: 1 | E63: 1 | F63: 50 | G63: 145
A64: 10151 | B64: 1030 | C64: 白熊62 | D64: 2 | E64: 1 | F64: 75 | G64: 243
A65: 10155 | B65: 1031 | C65: 白熊63 | D65: 1 | E65: 1 | F65: 55 | G65: 144
A66: 10156 | B66: 1031 | C66: 白熊64 | D66: 2 | E66: 1 | F66: 79 | G66: 242
A67: 10160 | B67: 1032 | C67: 白熊65 | D67: 1 | E67: 1 | F67: 56 | G67: 129
A68: 10161 | B68: 1032 | C68: 白熊66 | D68: 2 | E68: 1 | F68: 85 | G68: 208
A69: 10165 | B69: 1033 | C69: 白熊67 | D69: 1 | E69: 1 | F69: 58 | G69: 124
A70: 10166 | B70: 1033 | C70: 白熊68 | D70: 2 | E70: 1 | F70: 89 | G70: 207
A71: 10170 | B71: 1034 | C71: 白熊69 | D71: 1 | E71: 1 | F71: 45 | G71: 135
A72: 10171 | B72: 1034 | C72: 白熊70 | D72: 2 | E72: 1 | F72: 76 | G72: 236
A73: 10175 | B73: 1035 | C73: 白熊71 | D73: 1 | E73: 1 | F73: 47 | G73: 132
A74: 10176 | B74: 1035 | C74: 白熊72 | D74: 2 | E74: 1 | F74: 73 | G74: 230
A75: 10180 | B75: 1036 | C75: 白熊73 | D75: 1 | E75: 1 | F75: 43 | G75: 135
A76: 10181 | B76: 1036 | C76: 白熊74 | D76: 2 | E76: 1 | F76: 70 | G76: 233
A77: 10185 | B77: 1037 | C77: 白熊75 | D77: 1 | E77: 1 | F77: 46 | G77: 130
A78: 10186 | B78: 1037 | C78: 白熊76 | D78: 2 | E78: 1 | F78: 75 | G78: 231
A79: 10190 | B79: 1038 | C79: 白熊77 | D79: 1 | E79: 1 | F79: 57 | G79: 130
A80: 10191 | B80: 1038 | C80: 白熊78 | D80: 2 | E80: 1 | F80: 84 | G80: 221
A81: 10195 | B81: 1039 | C81: 白熊79 | D81: 1 | E81: 1 | F81: 58 | G81: 129
A82: 10196 | B82: 1039 | C82: 白熊80 | D82: 2 | E82: 1 | F82: 86 | G82: 220
A83: 10200 | B83: 1040 | C83: 白熊81 | D83: 1 | E83: 1 | F83: 53 | G83: 133
A84: 10201 | B84: 1040 | C84: 白熊82 | D84: 2 | E84: 1 | F84: 82 | G84: 225
A85: 10205 | B85: 1041 | C85: 白熊83 | D85: 1 | E85: 1 | F85: 51 | G85: 134
A86: 10206 | B86: 1041 | C86: 白熊84 | D86: 2 | E86: 1 | F86: 86 | G86: 221
A87: 10210 | B87: 1042 | C87: 白熊85 | D87: 1 | E87: 1 | F87: 56 | G87: 121
A88: 10211 | B88: 1042 | C88: 白熊86 | D88: 2 | E88: 1 | F88: 87 | G88: 221
A89: 10215 | B89: 1043 | C89: 白熊87 | D89: 1 | E89: 1 | F89: 57 | G89: 120
A90: 10216 | B90: 1043 | C90: 白熊88 | D90: 2 | E90: 1 | F90: 89 | G90: 217
A91: 10220 | B91: 1044 | C91: 白熊89 | D91: 1 | E91: 1 | F91: 53 | G91: 126
A92: 10221 | B92: 1044 | C92: 白熊90 | D92: 2 | E92: 1 | F92: 92 | G92: 214
A93: 10225 | B93: 1045 | C93: 白熊91 | D93: 1 | E93: 1 | F93: 51 | G93: 129
A94: 10226 | B94: 1045 | C94: 白熊92 | D94: 2 | E94: 1 | F94: 87 | G94: 211
A95: 10230 | B95: 1046 | C95: 白熊93 | D95: 1 | E95: 1 | F95: 59 | G95: 121
A96: 10231 | B96: 1046 | C96: 白熊94 | D96: 2 | E96: 1 | F96: 91 | G96: 212
A97: 10235 | B97: 1047 | C97: 白熊95 | D97: 1 | E97: 1 | F97: 44 | G97: 130
A98: 10236 | B98: 1047 | C98: 白熊96 | D98: 2 | E98: 1 | F98: 72 | G98: 225
A99: 10240 | B99: 1048 | C99: 白熊97 | D99: 1 | E99: 1 | F99: 49 | G99: 128
A100: 10241 | B100: 1048 | C100: 白熊98 | D100: 2 | E100: 1 | F100: 78 | G100: 221
A101: 10245 | B101: 1049 | C101: 白熊99 | D101: 1 | E101: 1 | F101: 41 | G101: 132
A102: 10246 | B102: 1049 | C102: 白熊100 | D102: 2 | E102: 1 | F102: 75 | G102: 226

Sheet: 基础属性成长表
A1: id | B1: 等级 | C1: 初始参考系数 | D1: 实际增量系数
A2: id | B2: lv | C2: base | D2: factor
A3: 1 | B3: 1 | C3: 1.1000000000000001 | D3: 1
A4: 2 | B4: 2 | C4: 1.099 | D4: 1.1000000000000001
A5: 3 | B5: 3 | C5: 1.0980000000000001 | D5: 1.2089000000000001
A6: 4 | B6: 4 | C6: 1.097 | D6: 1.3273721999999999
A7: 5 | B7: 5 | C7: 1.0960000000000001 | D7: 1.4561273034
A8: 6 | B8: 6 | C8: 1.095 | D8: 1.5959155245264001
A9: 7 | B9: 7 | C9: 1.0940000000000001 | D9: 1.7475274993564101
A10: 8 | B10: 8 | C10: 1.093 | D10: 1.9117950842959199
A11: 9 | B11: 9 | C11: 1.0920000000000001 | D11: 2.0895920271354398
A12: 10 | B12: 10 | C12: 1.091 | D12: 2.2818344936319002
A13: 11 | B13: 11 | C13: 1.0900000000000001 | D13: 2.4894814325524002
A14: 12 | B14: 12 | C14: 1.089 | D14: 2.7135347614821299
A15: 13 | B15: 13 | C15: 1.0880000000000001 | D15: 2.9550393552540402
A16: 14 | B16: 14 | C16: 1.087 | D16: 3.2150828185164002
A17: 15 | B17: 15 | C17: 1.0860000000000001 | D17: 3.4947950237273302
A18: 16 | B18: 16 | C18: 1.085 | D18: 3.7953473957678798
A19: 17 | B19: 17 | C19: 1.0840000000000001 | D19: 4.1179519244081604
A20: 18 | B20: 18 | C20: 1.083 | D20: 4.46385988605845
A21: 19 | B21: 19 | C21: 1.0820000000000001 | D21: 4.8343602566013102
A22: 20 | B22: 20 | C22: 1.081 | D22: 5.23077779764263
A23: 21 | B23: 21 | C23: 1.08 | D23: 5.6544707992517003
A24: 22 | B24: 22 | C24: 1.079 | D24: 6.1068284631918504
A25: 23 | B25: 23 | C25: 1.0780000000000001 | D25: 6.5892679117840203
A26: 24 | B26: 24 | C26: 1.077 | D26: 7.1032308089031897
A27: 25 | B27: 25 | C27: 1.0760000000000001 | D27: 7.6501795811887501
A28: 26 | B28: 26 | C28: 1.075 | D28: 8.2315932293591203
A29: 27 | B29: 27 | C29: 1.0740000000000001 | D29: 8.8489627215610707
A30: 28 | B30: 28 | C30: 1.073 | D30: 9.5037859629566199
A31: 29 | B31: 29 | C31: 1.0720000000000001 | D31: 10.197562338252499
A32: 30 | B32: 30 | C32: 1.071 | D32: 10.9317868266067
A33: 31 | B33: 31 | C33: 1.07 | D33: 11.707943691295799
A34: 32 | B34: 32 | C34: 1.069 | D34: 12.5274997496866
A35: 33 | B35: 33 | C35: 1.0680000000000001 | D35: 13.391897232414999
A36: 34 | B36: 34 | C36: 1.0669999999999999 | D36: 14.302546244219201
A37: 35 | B37: 35 | C37: 1.0660000000000001 | D37: 15.260816842582001
A38: 36 | B38: 36 | C38: 1.0649999999999999 | D38: 16.268030754192399
A39: 37 | B39: 37 | C39: 1.0640000000000001 | D39: 17.325452753215
A40: 38 | B40: 38 | C40: 1.0629999999999999 | D40: 18.4342817294208
A41: 39 | B41: 39 | C41: 1.0620000000000001 | D41: 19.5956414783744
A42: 40 | B42: 40 | C42: 1.0609999999999999 | D42: 20.8105712500337
A43: 41 | B43: 41 | C43: 1.06 | D43: 22.080016096285899
A44: 42 | B44: 42 | C44: 1.0589999999999999 | D44: 23.404817062063099
A45: 43 | B45: 43 | C45: 1.0580000000000001 | D45: 24.785701268724999
A46: 44 | B46: 44 | C46: 1.0569999999999999 | D46: 26.223271942311101
A47: 45 | B47: 45 | C47: 1.05600000000001 | D47: 27.717998443022999
A48: 46 | B48: 46 | C48: 1.0550000000000099 | D48: 29.2702063558324
A49: 47 | B49: 47 | C49: 1.05400000000001 | D49: 30.880067705403299
A50: 48 | B50: 48 | C50: 1.0530000000000099 | D50: 32.5475913614953
A51: 49 | B51: 49 | C51: 1.05200000000001 | D51: 34.272613703654699
A52: 50 | B52: 50 | C52: 1.0510000000000099 | D52: 36.054789616244904
A53: 51 | B53: 51 | C53: 1.05000000000001 | D53: 37.893583886673603
A54: 52 | B54: 52 | C54: 1.0490000000000099 | D54: 39.7882630810075
A55: 53 | B55: 53 | C55: 1.04800000000001 | D55: 41.737887971977102
A56: 54 | B56: 54 | C56: 1.0470000000000099 | D56: 43.741306594632199
A57: 55 | B57: 55 | C57: 1.04600000000001 | D57: 45.797148004580201
A58: 56 | B58: 56 | C58: 1.0450000000000099 | D58: 47.903816812791199
A59: 57 | B59: 57 | C59: 1.04400000000001 | D59: 50.059488569367097
A60: 58 | B60: 58 | C60: 1.0430000000000099 | D60: 52.262106066419598
A61: 59 | B61: 59 | C61: 1.04200000000001 | D61: 54.509376627275998
A62: 60 | B62: 60 | C62: 1.0410000000000099 | D62: 56.798770445621898

Sheet: 卡牌升级表
A1: id | B1: 卡牌等级 | C1: 升级所需经验 | D1: 升级铜板消耗 | E1: 当前等级卡牌蕴含经验
A2: id | B2: lv | C2: exp_need | D2: money_need | E2: cur_exp
A3: 0 | B3: 0 | C3: 100 | D3: 110 | E3: 0
A4: 1 | B4: 1 | C4: 110 | D4: 115 | E4: =R[-1]C+R[-1]C[-2] -> 100
A5: 2 | B5: 2 | C5: =R[-1]C*1.1 -> 121.00000000000001 | D5: =R[-1]C*1.15 -> 132.25 | E5: =R[-1]C+R[-1]C[-2] -> 210
A6: 3 | B6: 3 | C6: =R[-1]C*1.1 -> 133.10000000000002 | D6: =R[-1]C*1.15 -> 152.08749999999998 | E6: =R[-1]C+R[-1]C[-2] -> 331
A7: 4 | B7: 4 | C7: =R[-1]C*1.1 -> 146.41000000000003 | D7: =R[-1]C*1.15 -> 174.90062499999996 | E7: =R[-1]C+R[-1]C[-2] -> 464.1
A8: 5 | B8: 5 | C8: =R[-1]C*1.1 -> 161.05100000000004 | D8: =R[-1]C*1.15 -> 201.13571874999994 | E8: =R[-1]C+R[-1]C[-2] -> 610.51
A9: 6 | B9: 6 | C9: =R[-1]C*1.1 -> 177.15610000000007 | D9: =R[-1]C*1.15 -> 231.30607656249992 | E9: =R[-1]C+R[-1]C[-2] -> 771.56100000000004
A10: 7 | B10: 7 | C10: =R[-1]C*1.1 -> 194.87171000000009 | D10: =R[-1]C*1.15 -> 266.00198804687489 | E10: =R[-1]C+R[-1]C[-2] -> 948.71710000000007
A11: 8 | B11: 8 | C11: =R[-1]C*1.1 -> 214.35888100000011 | D11: =R[-1]C*1.15 -> 305.90228625390608 | E11: =R[-1]C+R[-1]C[-2] -> 1143.5888100000002
A12: 9 | B12: 9 | C12: =R[-1]C*1.1 -> 235.79476910000014 | D12: =R[-1]C*1.15 -> 351.78762919199198 | E12: =R[-1]C+R[-1]C[-2] -> 1357.9476910000003
A13: 10 | B13: 10 | C13: =R[-1]C*1.1 -> 259.37424601000015 | D13: =R[-1]C*1.15 -> 404.55577357079073 | E13: =R[-1]C+R[-1]C[-2] -> 1593.7424601000005
A14: 11 | B14: 11 | C14: =R[-1]C*1.1 -> 285.31167061100018 | D14: =R[-1]C*1.15 -> 465.23913960640931 | E14: =R[-1]C+R[-1]C[-2] -> 1853.1167061100007
A15: 12 | B15: 12 | C15: =R[-1]C*1.1 -> 313.84283767210025 | D15: =R[-1]C*1.15 -> 535.0250105473707 | E15: =R[-1]C+R[-1]C[-2] -> 2138.4283767210009
A16: 13 | B16: 13 | C16: =R[-1]C*1.1 -> 345.22712143931028 | D16: =R[-1]C*1.15 -> 615.27876212947626 | E16: =R[-1]C+R[-1]C[-2] -> 2452.2712143931012
A17: 14 | B17: 14 | C17: =R[-1]C*1.1 -> 379.74983358324135 | D17: =R[-1]C*1.15 -> 707.57057644889767 | E17: =R[-1]C+R[-1]C[-2] -> 2797.4983358324116
A18: 15 | B18: 15 | C18: =R[-1]C*1.1 -> 417.72481694156551 | D18: =R[-1]C*1.15 -> 813.7061629162323 | E18: =R[-1]C+R[-1]C[-2] -> 3177.2481694156531
A19: 16 | B19: 16 | C19: =R[-1]C*1.1 -> 459.49729863572207 | D19: =R[-1]C*1.15 -> 935.76208735366708 | E19: =R[-1]C+R[-1]C[-2] -> 3594.9729863572188
A20: 17 | B20: 17 | C20: =R[-1]C*1.1 -> 505.44702849929433 | D20: =R[-1]C*1.15 -> 1076.126400456717 | E20: =R[-1]C+R[-1]C[-2] -> 4054.4702849929408
A21: 18 | B21: 18 | C21: =R[-1]C*1.1 -> 555.99173134922376 | D21: =R[-1]C*1.15 -> 1237.5453605252244 | E21: =R[-1]C+R[-1]C[-2] -> 4559.9173134922348
A22: 19 | B22: 19 | C22: =R[-1]C*1.1 -> 611.59090448414622 | D22: =R[-1]C*1.15 -> 1423.1771646040079 | E22: =R[-1]C+R[-1]C[-2] -> 5115.909044841459
A23: 20 | B23: 20 | C23: =R[-1]C*1.1 -> 672.74999493256087 | D23: =R[-1]C*1.15 -> 1636.6537392946088 | E23: =R[-1]C+R[-1]C[-2] -> 5727.4999493256055
A24: 21 | B24: 21 | C24: =R[-1]C*1.1 -> 740.024994425817 | D24: =R[-1]C*1.15 -> 1882.1518001888001 | E24: =R[-1]C+R[-1]C[-2] -> 6400.2499442581666
A25: 22 | B25: 22 | C25: =R[-1]C*1.1 -> 814.02749386839878 | D25: =R[-1]C*1.15 -> 2164.4745702171199 | E25: =R[-1]C+R[-1]C[-2] -> 7140.2749386839832
A26: 23 | B26: 23 | C26: =R[-1]C*1.1 -> 895.43024325523868 | D26: =R[-1]C*1.15 -> 2489.1457557496879 | E26: =R[-1]C+R[-1]C[-2] -> 7954.302432552382
A27: 24 | B27: 24 | C27: =R[-1]C*1.1 -> 984.97326758076258 | D27: =R[-1]C*1.15 -> 2862.5176191121409 | E27: =R[-1]C+R[-1]C[-2] -> 8849.7326758076215
A28: 25 | B28: 25 | C28: =R[-1]C*1.1 -> 1083.470594338839 | D28: =R[-1]C*1.15 -> 3291.8952619789616 | E28: =R[-1]C+R[-1]C[-2] -> 9834.7059433883842
A29: 26 | B29: 26 | C29: =R[-1]C*1.1 -> 1191.8176537727229 | D29: =R[-1]C*1.15 -> 3785.6795512758054 | E29: =R[-1]C+R[-1]C[-2] -> 10918.176537727224
A30: 27 | B30: 27 | C30: =R[-1]C*1.1 -> 1310.9994191499952 | D30: =R[-1]C*1.15 -> 4353.5314839671755 | E30: =R[-1]C+R[-1]C[-2] -> 12109.994191499947
A31: 28 | B31: 28 | C31: =R[-1]C*1.1 -> 1442.0993610649948 | D31: =R[-1]C*1.15 -> 5006.5612065622518 | E31: =R[-1]C+R[-1]C[-2] -> 13420.993610649943
A32: 29 | B32: 29 | C32: =R[-1]C*1.1 -> 1586.3092971714943 | D32: =R[-1]C*1.15 -> 5757.5453875465892 | E32: =R[-1]C+R[-1]C[-2] -> 14863.092971714937
A33: 30 | B33: 30 | C33: =R[-1]C*1.1 -> 1744.940226888644 | D33: =R[-1]C*1.15 -> 6621.1771956785769 | E33: =R[-1]C+R[-1]C[-2] -> 16449.402268886432
A34: 31 | B34: 31 | C34: =R[-1]C*1.1 -> 1919.4342495775086 | D34: =R[-1]C*1.15 -> 7614.3537750303631 | E34: =R[-1]C+R[-1]C[-2] -> 18194.342495775076
A35: 32 | B35: 32 | C35: =R[-1]C*1.1 -> 2111.3776745352598 | D35: =R[-1]C*1.15 -> 8756.5068412849178 | E35: =R[-1]C+R[-1]C[-2] -> 20113.776745352585
A36: 33 | B36: 33 | C36: =R[-1]C*1.1 -> 2322.5154419887858 | D36: =R[-1]C*1.15 -> 10069.982867477655 | E36: =R[-1]C+R[-1]C[-2] -> 22225.154419887844
A37: 34 | B37: 34 | C37: =R[-1]C*1.1 -> 2554.7669861876648 | D37: =R[-1]C*1.15 -> 11580.480297599303 | E37: =R[-1]C+R[-1]C[-2] -> 24547.669861876631
A38: 35 | B38: 35 | C38: =R[-1]C*1.1 -> 2810.2436848064312 | D38: =R[-1]C*1.15 -> 13317.552342239196 | E38: =R[-1]C+R[-1]C[-2] -> 27102.436848064295
A39: 36 | B39: 36 | C39: =R[-1]C*1.1 -> 3091.2680532870745 | D39: =R[-1]C*1.15 -> 15315.185193575075 | E39: =R[-1]C+R[-1]C[-2] -> 29912.680532870727
A40: 37 | B40: 37 | C40: =R[-1]C*1.1 -> 3400.3948586157821 | D40: =R[-1]C*1.15 -> 17612.462972611334 | E40: =R[-1]C+R[-1]C[-2] -> 33003.9485861578
A41: 38 | B41: 38 | C41: =R[-1]C*1.1 -> 3740.4343444773608 | D41: =R[-1]C*1.15 -> 20254.332418503032 | E41: =R[-1]C+R[-1]C[-2] -> 36404.343444773578
A42: 39 | B42: 39 | C42: =R[-1]C*1.1 -> 4114.4777789250975 | D42: =R[-1]C*1.15 -> 23292.482281278484 | E42: =R[-1]C+R[-1]C[-2] -> 40144.77778925094
A43: 40 | B43: 40 | C43: =R[-1]C*1.1 -> 4525.9255568176077 | D43: =R[-1]C*1.15 -> 26786.354623470255 | E43: =R[-1]C+R[-1]C[-2] -> 44259.255568176035
A44: 41 | B44: 41 | C44: =R[-1]C*1.1 -> 4978.5181124993687 | D44: =R[-1]C*1.15 -> 30804.307816990789 | E44: =R[-1]C+R[-1]C[-2] -> 48785.181124993644
A45: 42 | B45: 42 | C45: =R[-1]C*1.1 -> 5476.3699237493056 | D45: =R[-1]C*1.15 -> 35424.953989539405 | E45: =R[-1]C+R[-1]C[-2] -> 53763.699237493012
A46: 43 | B46: 43 | C46: =R[-1]C*1.1 -> 6024.0069161242363 | D46: =R[-1]C*1.15 -> 40738.697087970315 | E46: =R[-1]C+R[-1]C[-2] -> 59240.069161242318
A47: 44 | B47: 44 | C47: =R[-1]C*1.1 -> 6626.4076077366608 | D47: =R[-1]C*1.15 -> 46849.501651165861 | E47: =R[-1]C+R[-1]C[-2] -> 65264.076077366553
A48: 45 | B48: 45 | C48: =R[-1]C*1.1 -> 7289.0483685103272 | D48: =R[-1]C*1.15 -> 53876.926898840735 | E48: =R[-1]C+R[-1]C[-2] -> 71890.483685103216
A49: 46 | B49: 46 | C49: =R[-1]C*1.1 -> 8017.9532053613602 | D49: =R[-1]C*1.15 -> 61958.465933666841 | E49: =R[-1]C+R[-1]C[-2] -> 79179.53205361354
A50: 47 | B50: 47 | C50: =R[-1]C*1.1 -> 8819.7485258974975 | D50: =R[-1]C*1.15 -> 71252.235823716866 | E50: =R[-1]C+R[-1]C[-2] -> 87197.485258974906
A51: 48 | B51: 48 | C51: =R[-1]C*1.1 -> 9701.7233784872478 | D51: =R[-1]C*1.15 -> 81940.071197274388 | E51: =R[-1]C+R[-1]C[-2] -> 96017.233784872398
A52: 49 | B52: 49 | C52: =R[-1]C*1.1 -> 10671.895716335974 | D52: =R[-1]C*1.15 -> 94231.081876865544 | E52: =R[-1]C+R[-1]C[-2] -> 105718.95716335965
A53: 50 | B53: 50 | C53: =R[-1]C*1.1 -> 11739.085287969572 | D53: =R[-1]C*1.15 -> 108365.74415839536 | E53: =R[-1]C+R[-1]C[-2] -> 116390.85287969562
A54: 51 | B54: 51 | C54: =R[-1]C*1.1 -> 12912.99381676653 | D54: =R[-1]C*1.15 -> 124620.60578215466 | E54: =R[-1]C+R[-1]C[-2] -> 128129.9381676652
A55: 52 | B55: 52 | C55: =R[-1]C*1.1 -> 14204.293198443183 | D55: =R[-1]C*1.15 -> 143313.69664947785 | E55: =R[-1]C+R[-1]C[-2] -> 141042.93198443172
A56: 53 | B56: 53 | C56: =R[-1]C*1.1 -> 15624.722518287503 | D56: =R[-1]C*1.15 -> 164810.75114689951 | E56: =R[-1]C+R[-1]C[-2] -> 155247.22518287491
A57: 54 | B57: 54 | C57: =R[-1]C*1.1 -> 17187.194770116253 | D57: =R[-1]C*1.15 -> 189532.36381893442 | E57: =R[-1]C+R[-1]C[-2] -> 170871.94770116243
A58: 55 | B58: 55 | C58: =R[-1]C*1.1 -> 18905.914247127879 | D58: =R[-1]C*1.15 -> 217962.21839177457 | E58: =R[-1]C+R[-1]C[-2] -> 188059.14247127867
A59: 56 | B59: 56 | C59: =R[-1]C*1.1 -> 20796.50567184067 | D59: =R[-1]C*1.15 -> 250656.55115054073 | E59: =R[-1]C+R[-1]C[-2] -> 206965.05671840656
A60: 57 | B60: 57 | C60: =R[-1]C*1.1 -> 22876.156239024738 | D60: =R[-1]C*1.15 -> 288255.0338231218 | E60: =R[-1]C+R[-1]C[-2] -> 227761.56239024724
A61: 58 | B61: 58 | C61: =R[-1]C*1.1 -> 25163.771862927213 | D61: =R[-1]C*1.15 -> 331493.28889659006 | E61: =R[-1]C+R[-1]C[-2] -> 250637.71862927199
A62: 59 | B62: 59 | C62: =R[-1]C*1.1 -> 27680.149049219937 | D62: =R[-1]C*1.15 -> 381217.28223107854 | E62: =R[-1]C+R[-1]C[-2] -> 275801.4904921992
A63: 60 | B63: 60 | C63: =R[-1]C*1.1 -> 30448.163954141932 | D63: =R[-1]C*1.15 -> 438399.87456574029 | E63: =R[-1]C+R[-1]C[-2] -> 303481.63954141911

Sheet: export
A1: sheet_name | B1: export_name | C1: merge_to
A2: 神仙卡牌配置表 | B2: cards
A3: 基础属性成长表 | B3: factors
A4: 卡牌升级表 | B4: card_grow
A5: 怪物卡牌配置表 | B5: monster_cards | C5: cards