Sheet: 竞技产出表
A1: id | B1: 等级 | C1: 胜利经验/次 | D1: 胜利铜板/次 | E1: 胜利荣誉点/次 | F1: 失败经验/次 | G1: 失败铜板/次 | H1: 失败荣誉点/次
A2: id | B2: lv | C2: win_exp | D2: win_money | E2: win_elixir | F2: lose_exp | G2: lose_money | H2: lose_elixir
A3: 20 | B3: 20 | C3: 1 | D3: 50 | E3: 5 | F3: 1 | G3: 25 | H3: 3
A4: 21 | B4: 21 | C4: 1 | D4: 60 | E4: 7 | F4: 1 | G4: 30 | H4: 4
A5: 22 | B5: 22 | C5: 1 | D5: 70 | E5: 9 | F5: 1 | G5: 35 | H5: 5
A6: 23 | B6: 23 | C6: 1 | D6: 80 | E6: 11 | F6: 1 | G6: 40 | H6: 6
A7: 24 | B7: 24 | C7: 1 | D7: 90 | E7: 13 | F7: 1 | G7: 45 | H7: 7
A8: 25 | B8: 25 | C8: 2 | D8: 100 | E8: 15 | F8: 1 | G8: 50 | H8: 8
A9: 26 | B9: 26 | C9: 2 | D9: 110 | E9: 17 | F9: 1 | G9: 55 | H9: 9
A10: 27 | B10: 27 | C10: 2 | D10: 120 | E10: 19 | F10: 1 | G10: 60 | H10: 10
A11: 28 | B11: 28 | C11: 2 | D11: 130 | E11: 21 | F11: 1 | G11: 65 | H11: 11
A12: 29 | B12: 29 | C12: 2 | D12: 140 | E12: 23 | F12: 1 | G12: 70 | H12: 12
A13: 30 | B13: 30 | C13: 2 | D13: 150 | E13: 25 | F13: 1 | G13: 75 | H13: 13
A14: 31 | B14: 31 | C14: 3 | D14: 160 | E14: 27 | F14: 1 | G14: 80 | H14: 14
A15: 32 | B15: 32 | C15: 3 | D15: 170 | E15: 29 | F15: 1 | G15: 85 | H15: 15
A16: 33 | B16: 33 | C16: 3 | D16: 180 | E16: 31 | F16: 2 | G16: 90 | H16: 16
A17: 34 | B17: 34 | C17: 4 | D17: 190 | E17: 33 | F17: 2 | G17: 95 | H17: 17
A18: 35 | B18: 35 | C18: 4 | D18: 200 | E18: 35 | F18: 2 | G18: 100 | H18: 18
A19: 36 | B19: 36 | C19: 4 | D19: 210 | E19: 37 | F19: 2 | G19: 105 | H19: 19
A20: 37 | B20: 37 | C20: 5 | D20: 220 | E20: 39 | F20: 2 | G20: 110 | H20: 20
A21: 38 | B21: 38 | C21: 5 | D21: 230 | E21: 41 | F21: 3 | G21: 115 | H21: 21
A22: 39 | B22: 39 | C22: 6 | D22: 240 | E22: 43 | F22: 3 | G22: 120 | H22: 22
A23: 40 | B23: 40 | C23: 6 | D23: 250 | E23: 45 | F23: 3 | G23: 125 | H23: 23
A24: 41 | B24: 41 | C24: 7 | D24: 260 | E24: 47 | F24: 3 | G24: 130 | H24: 24
A25: 42 | B25: 42 | C25: 8 | D25: 270 | E25: 49 | F25: 4 | G25: 135 | H25: 25
A26: 43 | B26: 43 | C26: 8 | D26: 280 | E26: 51 | F26: 4 | G26: 140 | H26: 26
A27: 44 | B27: 44 | C27: 9 | D27: 290 | E27: 53 | F27: 5 | G27: 145 | H27: 27
A28: 45 | B28: 45 | C28: 10 | D28: 300 | E28: 55 | F28: 5 | G28: 150 | H28: 28
A29: 46 | B29: 46 | C29: 11 | D29: 310 | E29: 57 | F29: 6 | G29: 155 | H29: 29
A30: 47 | B30: 47 | C30: 12 | D30: 320 | E30: 59 | F30: 6 | G30: 160 | H30: 30
A31: 48 | B31: 48 | C31: 13 | D31: 330 | E31: 61 | F31: 7 | G31: 165 | H31: 31
A32: 49 | B32: 49 | C32: 15 | D32: 340 | E32: 63 | F32: 7 | G32: 170 | H32: 32
A33: 50 | B33: 50 | C33: 16 | D33: 350 | E33: 65 | F33: 8 | G33: 175 | H33: 33
A34: 51 | B34: 51 | C34: 18 | D34: 360 | E34: 67 | F34: 9 | G34: 180 | H34: 34
A35: 52 | B35: 52 | C35: 20 | D35: 370 | E35: 69 | F35: 10 | G35: 185 | H35: 35
A36: 53 | B36: 53 | C36: 22 | D36: 380 | E36: 71 | F36: 11 | G36: 190 | H36: 36
A37: 54 | B37: 54 | C37: 24 | D37: 390 | E37: 73 | F37: 12 | G37: 195 | H37: 37
A38: 55 | B38: 55 | C38: 26 | D38: 400 | E38: 75 | F38: 13 | G38: 200 | H38: 38
A39: 56 | B39: 56 | C39: 29 | D39: 410 | E39: 77 | F39: 14 | G39: 205 | H39: 39
A40: 57 | B40: 57 | C40: 32 | D40: 420 | E40: 79 | F40: 16 | G40: 210 | H40: 40
A41: 58 | B41: 58 | C41: 35 | D41: 430 | E41: 81 | F41: 17 | G41: 215 | H41: 41
A42: 59 | B42: 59 | C42: 38 | D42: 440 | E42: 83 | F42: 19 | G42: 220 | H42: 42
A43: 60 | B43: 60 | C43: 42 | D43: 450 | E43: 85 | F43: 21 | G43: 225 | H43: 43
A44: 61 | B44: 61 | C44: 47 | D44: 460 | E44: 87 | F44: 23 | G44: 230 | H44: 44
A45: 62 | B45: 62 | C45: 51 | D45: 470 | E45: 89 | F45: 26 | G45: 235 | H45: 45
A46: 63 | B46: 63 | C46: 56 | D46: 480 | E46: 91 | F46: 28 | G46: 240 | H46: 46
A47: 64 | B47: 64 | C47: 62 | D47: 490 | E47: 93 | F47: 31 | G47: 245 | H47: 47
A48: 65 | B48: 65 | C48: 68 | D48: 500 | E48: 95 | F48: 34 | G48: 250 | H48: 48
A49: 66 | B49: 66 | C49: 75 | D49: 510 | E49: 97 | F49: 37 | G49: 255 | H49: 49
A50: 67 | B50: 67 | C50: 82 | D50: 520 | E50: 99 | F50: 41 | G50: 260 | H50: 50
A51: 68 | B51: 68 | C51: 91 | D51: 530 | E51: 101 | F51: 45 | G51: 265 | H51: 51
A52: 69 | B52: 69 | C52: 100 | D52: 540 | E52: 103 | F52: 50 | G52: 270 | H52: 52
A53: 70 | B53: 70 | C53: 110 | D53: 550 | E53: 105 | F53: 55 | G53: 275 | H53: 53
A54: 71 | B54: 71 | C54: 121 | D54: 560 | E54: 107 | F54: 60 | G54: 280 | H54: 54
A55: 72 | B55: 72 | C55: 133 | D55: 570 | E55: 109 | F55: 66 | G55: 285 | H55: 55
A56: 73 | B56: 73 | C56: 146 | D56: 580 | E56: 111 | F56: 73 | G56: 290 | H56: 56
A57: 74 | B57: 74 | C57: 161 | D57: 590 | E57: 113 | F57: 80 | G57: 295 | H57: 57
A58: 75 | B58: 75 | C58: 177 | D58: 600 | E58: 115 | F58: 88 | G58: 300 | H58: 58
A59: 76 | B59: 76 | C59: 194 | D59: 610 | E59: 117 | F59: 97 | G59: 305 | H59: 59
A60: 77 | B60: 77 | C60: 214 | D60: 620 | E60: 119 | F60: 107 | G60: 310 | H60: 60
A61: 78 | B61: 78 | C61: 235 | D61: 630 | E61: 121 | F61: 118 | G61: 315 | H61: 61
A62: 79 | B62: 79 | C62: 259 | D62: 640 | E62: 123 | F62: 129 | G62: 320 | H62: 62
A63: 80 | B63: 80 | C63: 284 | D63: 650 | E63: 125 | F63: 142 | G63: 325 | H63: 63
A64: 81 | B64: 81 | C64: 313 | D64: 660 | E64: 127 | F64: 156 | G64: 330 | H64: 64
A65: 82 | B65: 82 | C65: 344 | D65: 670 | E65: 129 | F65: 172 | G65: 335 | H65: 65
A66: 83 | B66: 83 | C66: 379 | D66: 680 | E66: 131 | F66: 189 | G66: 340 | H66: 66
A67: 84 | B67: 84 | C67: 416 | D67: 690 | E67: 133 | F67: 208 | G67: 345 | H67: 67
A68: 85 | B68: 85 | C68: 458 | D68: 700 | E68: 135 | F68: 229 | G68: 350 | H68: 68
A69: 86 | B69: 86 | C69: 504 | D69: 710 | E69: 137 | F69: 252 | G69: 355 | H69: 69
A70: 87 | B70: 87 | C70: 554 | D70: 720 | E70: 139 | F70: 277 | G70: 360 | H70: 70
A71: 88 | B71: 88 | C71: 610 | D71: 730 | E71: 141 | F71: 305 | G71: 365 | H71: 71
A72: 89 | B72: 89 | C72: 671 | D72: 740 | E72: 143 | F72: 335 | G72: 370 | H72: 72
A73: 90 | B73: 90 | C73: 738 | D73: 750 | E73: 145 | F73: 369 | G73: 375 | H73: 73
A74: 91 | B74: 91 | C74: 811 | D74: 760 | E74: 147 | F74: 406 | G74: 380 | H74: 74
A75: 92 | B75: 92 | C75: 893 | D75: 770 | E75: 149 | F75: 446 | G75: 385 | H75: 75
A76: 93 | B76: 93 | C76: 982 | D76: 780 | E76: 151 | F76: 491 | G76: 390 | H76: 76
A77: 94 | B77: 94 | C77: 1080 | D77: 790 | E77: 153 | F77: 540 | G77: 395 | H77: 77
A78: 95 | B78: 95 | C78: 1188 | D78: 800 | E78: 155 | F78: 594 | G78: 400 | H78: 78
A79: 96 | B79: 96 | C79: 1307 | D79: 810 | E79: 157 | F79: 653 | G79: 405 | H79: 79
A80: 97 | B80: 97 | C80: 1438 | D80: 820 | E80: 159 | F80: 719 | G80: 410 | H80: 80
A81: 98 | B81: 98 | C81: 1581 | D81: 830 | E81: 161 | F81: 791 | G81: 415 | H81: 81
A82: 99 | B82: 99 | C82: 1739 | D82: 840 | E82: 163 | F82: 870 | G82: 420 | H82: 82
A83: 100 | B83: 100 | C83: 0 | D83: 850 | E83: 165 | F83: 0 | G83: 425 | H83: 83

Sheet: 竞技称号表
A1: 阶级 | B1: 名称 | C1: 百分比加成 | D1: 兑换当前等级所需荣誉点
A2: id | B2: title | C2: inc_value | D2: honnorPoint_need
A3: 1 | B3: 初级天兵 | C3: 5 | D3: 3000
A4: 2 | B4: 中级天兵 | C4: =R[-1]C+5 -> 10 | D4: 5000
A5: 3 | B5: 高级天兵 | C5: =R[-1]C+5 -> 15 | D5: 10000
A6: 4 | B6: 初级天将 | C6: =R[-1]C+5 -> 20 | D6: 20000
A7: 5 | B7: 中级天将 | C7: =R[-1]C+5 -> 25 | D7: 40000
A8: 6 | B8: 高级天将 | C8: =R[-1]C+5 -> 30 | D8: 70000
A9: 7 | B9: 伏虎尊者 | C9: =R[-1]C+5 -> 35 | D9: 10000
A10: 8 | B10: 降龙尊者 | C10: =R[-1]C+5 -> 40 | D10: 150000
A11: 9 | B11: 三界战神 | C11: =R[-1]C+5 -> 45 | D11: 200000
A12: 10 | B12: 斗战胜佛 | C12: =R[-1]C+5 -> 50 | D12: 300000

Sheet: 竞技排名奖励加成系数
A1: 竞技排名 | B1: 对应等级排名奖励加成系数
A2: 1--10 | B2: 1 | D2: 该加成，是以等级奖励为基准值的，也就是
A3: 11-50 | B3: =R[-1]C-10% -> 0.9 | D3: 实际每次竞技奖励=等级对应奖励*（1+加成系数）
A4: 51-100 | B4: =R[-1]C-0.1 -> 0.8
A5: 101-200 | B5: =R[-1]C-0.1 -> 0.70000000000000007 | D5: 该系数，对荣誉点，经验，铜板均有相同的加成效果
A6: 201-500 | B6: =R[-1]C-0.1 -> 0.60000000000000009
A7: 501-1000 | B7: =R[-1]C-0.1 -> 0.50000000000000011
A8: 1001-3000 | B8: =R[-1]C-0.1 -> 0.40000000000000013
A9: 3001--5000 | B9: =R[-1]C-0.1 -> 0.30000000000000016
A10: 5001-10000 | B10: =R[-1]C-0.1 -> 0.20000000000000015
A11: 10001--- | B11: =R[-1]C-0.1 -> 0.10000000000000014

Sheet: export
A1: sheet_name | B1: export_name | C1: merge_to
A2: 竞技产出表 | B2: rank
A3: 竞技称号表 | B3: title