Sheet: 玩家升级经验表
A1: 级别 | B1: 升到下一级所需经验
A2: id | B2: exp
A3: 1 | B3: 32
A4: 2 | B4: =R[-1]C*1.05 -> 33.6
A5: 3 | B5: =R[-1]C*1.1 -> 36.96
A6: 4 | B6: =R[-1]C*1.1 -> 40.656
A7: 5 | B7: =R[-1]C*1.1 -> 44.7216
A8: 6 | B8: =R[-1]C*1.1 -> 49.19376
A9: 7 | B9: =R[-1]C*1.1 -> 54.113136
A10: 8 | B10: =R[-1]C*1.1 -> 59.5244496
A11: 9 | B11: =R[-1]C*1.1 -> 65.4768945600001
A12: 10 | B12: =R[-1]C*1.1 -> 72.0245840160001
A13: 11 | B13: =R[-1]C*1.1 -> 79.2270424176001
A14: 12 | B14: =R[-1]C*1.1 -> 87.1497466593601
A15: 13 | B15: =R[-1]C*1.1 -> 95.8647213252961
A16: 14 | B16: =R[-1]C*1.1 -> 105.451193457826
A17: 15 | B17: =R[-1]C*1.1 -> 115.996312803608
A18: 16 | B18: =R[-1]C*1.1 -> 127.595944083969
A19: 17 | B19: =R[-1]C*1.1 -> 140.355538492366
A20: 18 | B20: =R[-1]C*1.1 -> 154.391092341603
A21: 19 | B21: =R[-1]C*1.1 -> 169.830201575763
A22: 20 | B22: =R[-1]C*1.1 -> 186.813221733339
A23: 21 | B23: =R[-1]C*1.1 -> 205.494543906673
A24: 22 | B24: =R[-1]C*1.1 -> 226.043998297341
A25: 23 | B25: =R[-1]C*1.1 -> 248.648398127075
A26: 24 | B26: =R[-1]C*1.1 -> 273.513237939782
A27: 25 | B27: =R[-1]C*1.1 -> 300.86456173376
A28: 26 | B28: =R[-1]C*1.1 -> 330.951017907136
A29: 27 | B29: =R[-1]C*1.1 -> 364.04611969785
A30: 28 | B30: =R[-1]C*1.1 -> 400.450731667635
A31: 29 | B31: =R[-1]C*1.1 -> 440.495804834399
A32: 30 | B32: =R[-1]C*1.1 -> 484.545385317839
A33: 31 | B33: =R[-1]C*1.1 -> 532.999923849622
A34: 32 | B34: =R[-1]C*1.1 -> 586.299916234585
A35: 33 | B35: =R[-1]C*1.1 -> 644.929907858043
A36: 34 | B36: =R[-1]C*1.1 -> 709.422898643848
A37: 35 | B37: =R[-1]C*1.1 -> 780.365188508232
A38: 36 | B38: =R[-1]C*1.1 -> 858.401707359056
A39: 37 | B39: =R[-1]C*1.1 -> 944.241878094961
A40: 38 | B40: =R[-1]C*1.1 -> 1038.66606590446
A41: 39 | B41: =R[-1]C*1.1 -> 1142.5326724949
A42: 40 | B42: =R[-1]C*1.1 -> 1256.78593974439
A43: 41 | B43: =R[-1]C*1.1 -> 1382.46453371883
A44: 42 | B44: =R[-1]C*1.1 -> 1520.71098709072
A45: 43 | B45: =R[-1]C*1.1 -> 1672.78208579979
A46: 44 | B46: =R[-1]C*1.1 -> 1840.06029437977
A47: 45 | B47: =R[-1]C*1.1 -> 2024.06632381774
A48: 46 | B48: =R[-1]C*1.1 -> 2226.47295619952
A49: 47 | B49: =R[-1]C*1.1 -> 2449.12025181947
A50: 48 | B50: =R[-1]C*1.1 -> 2694.03227700142
A51: 49 | B51: =R[-1]C*1.1 -> 2963.43550470156
A52: 50 | B52: =R[-1]C*1.1 -> 3259.77905517172
A53: 51 | B53: =R[-1]C*1.1 -> 3585.75696068889
A54: 52 | B54: =R[-1]C*1.1 -> 3944.33265675778
A55: 53 | B55: =R[-1]C*1.1 -> 4338.76592243356
A56: 54 | B56: =R[-1]C*1.1 -> 4772.64251467691
A57: 55 | B57: =R[-1]C*1.1 -> 5249.9067661446
A58: 56 | B58: =R[-1]C*1.1 -> 5774.89744275907
A59: 57 | B59: =R[-1]C*1.1 -> 6352.38718703497
A60: 58 | B60: =R[-1]C*1.1 -> 6987.62590573847
A61: 59 | B61: =R[-1]C*1.1 -> 7686.38849631232
A62: 60 | B62: =R[-1]C*1.1 -> 8455.02734594355
A63: 61 | B63: =R[-1]C*1.1 -> 9300.53008053791
A64: 62 | B64: =R[-1]C*1.1 -> 10230.5830885917
A65: 63 | B65: =R[-1]C*1.1 -> 11253.6413974509
A66: 64 | B66: =R[-1]C*1.1 -> 12379.005537196
A67: 65 | B67: =R[-1]C*1.1 -> 13616.9060909156
A68: 66 | B68: =R[-1]C*1.1 -> 14978.5967000071
A69: 67 | B69: =R[-1]C*1.1 -> 16476.4563700078
A70: 68 | B70: =R[-1]C*1.1 -> 18124.1020070086
A71: 69 | B71: =R[-1]C*1.1 -> 19936.5122077095
A72: 70 | B72: =R[-1]C*1.1 -> 21930.1634284804
A73: 71 | B73: =R[-1]C*1.1 -> 24123.1797713285
A74: 72 | B74: =R[-1]C*1.1 -> 26535.4977484613
A75: 73 | B75: =R[-1]C*1.1 -> 29189.0475233074
A76: 74 | B76: =R[-1]C*1.1 -> 32107.9522756382
A77: 75 | B77: =R[-1]C*1.1 -> 35318.747503202
A78: 76 | B78: =R[-1]C*1.1 -> 38850.6222535222
A79: 77 | B79: =R[-1]C*1.1 -> 42735.6844788744
A80: 78 | B80: =R[-1]C*1.1 -> 47009.2529267619
A81: 79 | B81: =R[-1]C*1.1 -> 51710.1782194381
A82: 80 | B82: =R[-1]C*1.1 -> 56881.1960413819
A83: 81 | B83: =R[-1]C*1.1 -> 62569.3156455201
A84: 82 | B84: =R[-1]C*1.1 -> 68826.2472100721
A85: 83 | B85: =R[-1]C*1.1 -> 75708.8719310793
A86: 84 | B86: =R[-1]C*1.1 -> 83279.7591241872
A87: 85 | B87: =R[-1]C*1.1 -> 91607.735036606
A88: 86 | B88: =R[-1]C*1.1 -> 100768.508540267
A89: 87 | B89: =R[-1]C*1.1 -> 110845.359394293
A90: 88 | B90: =R[-1]C*1.1 -> 121929.895333723
A91: 89 | B91: =R[-1]C*1.1 -> 134122.884867095
A92: 90 | B92: =R[-1]C*1.1 -> 147535.173353804
A93: 91 | B93: =R[-1]C*1.1 -> 162288.690689185
A94: 92 | B94: =R[-1]C*1.1 -> 178517.559758103
A95: 93 | B95: =R[-1]C*1.1 -> 196369.315733914
A96: 94 | B96: =R[-1]C*1.1 -> 216006.247307305
A97: 95 | B97: =R[-1]C*1.1 -> 237606.872038035
A98: 96 | B98: =R[-1]C*1.1 -> 261367.559241839
A99: 97 | B99: =R[-1]C*1.1 -> 287504.315166023
A100: 98 | B100: =R[-1]C*1.1 -> 316254.746682625
A101: 99 | B101: =R[-1]C*1.1 -> 347880.221350888
A102: 100

Sheet: 任务奖励表
A1: id | B1: 章名称 | C1: 小节序号 | D1: 小节名称 | E1: 进度层数 | F1: 每次消耗体力 | G1: 每次奖励经验 | H1: 每次奖励铜板 | I1: 小节描述
A2: id | B2: chapter_id | C2: section_id | D2: section_name | E2: points | F2: power_consume | G2: exp_obtain | H2: coins_obtain | I2: description
A3: 1 | B3: 遇到上帝的 | C3: 1 | D3: 上帝死了 | E3: 5 | F3: 5 | G3: =RC[-2]*1 -> 5 | H3: =RC[-3]*10 -> 50 | I3: 玉帝日嫦娥
A4: 2 | B4: 遇到上帝的 | C4: =R[-1]C+1 -> 2 | D4: 上帝死了 | E4: 5 | F4: =R[-1]C -> 5 | G4: =RC[-2]*1 -> 5 | H4: =RC[-3]*10 -> 50 | I4: 玉帝日嫦娥
A5: 3 | B5: 遇到上帝的 | C5: =R[-1]C+1 -> 3 | D5: 上帝死了 | E5: 5 | F5: =R[-1]C -> 5 | G5: =RC[-2]*1 -> 5 | H5: =RC[-3]*10 -> 50 | I5: 玉帝日嫦娥
A6: 4 | B6: 遇到上帝的 | C6: =R[-1]C+1 -> 4 | D6: 上帝死了 | E6: 5 | F6: =R[-1]C -> 5 | G6: =RC[-2]*1 -> 5 | H6: =RC[-3]*10 -> 50 | I6: 玉帝日嫦娥
A7: 5 | B7: 遇到上帝的 | C7: =R[-1]C+1 -> 5 | D7: 上帝死了 | E7: 5 | F7: =R[-1]C -> 5 | G7: =RC[-2]*1 -> 5 | H7: =RC[-3]*10 -> 50 | I7: 玉帝日嫦娥
A8: 6 | B8: 遇到上帝的 | C8: =R[-1]C+1 -> 6 | D8: 上帝死了 | E8: 5 | F8: =R[-1]C -> 5 | G8: =RC[-2]*1 -> 5 | H8: =RC[-3]*10 -> 50 | I8: 玉帝日嫦娥
A9: 7 | B9: 遇到上帝的 | C9: =R[-1]C+1 -> 7 | D9: 上帝死了 | E9: 5 | F9: =R[-1]C -> 5 | G9: =RC[-2]*1 -> 5 | H9: =RC[-3]*10 -> 50 | I9: 玉帝日嫦娥
A10: 8 | B10: 遇到上帝的 | C10: =R[-1]C+1 -> 8 | D10: 上帝死了 | E10: 5 | F10: =R[-1]C -> 5 | G10: =RC[-2]*1 -> 5 | H10: =RC[-3]*10 -> 50 | I10: 玉帝日嫦娥
A11: 9 | B11: 遇到上帝的 | C11: =R[-1]C+1 -> 9 | D11: 上帝死了 | E11: 5 | F11: =R[-1]C -> 5 | G11: =RC[-2]*1 -> 5 | H11: =RC[-3]*10 -> 50 | I11: 玉帝日嫦娥
A12: 10 | B12: 遇到上帝的 | C12: =R[-1]C+1 -> 10 | D12: 上帝死了 | E12: 5 | F12: =R[-1]C -> 5 | G12: =RC[-2]*1 -> 5 | H12: =RC[-3]*10 -> 50 | I12: 玉帝日嫦娥
A13: 11 | B13: 遇到上帝的 | C13: =R[-1]C+1 -> 11 | D13: 上帝死了 | E13: 5 | F13: =R[-1]C -> 5 | G13: =RC[-2]*1 -> 5 | H13: =RC[-3]*10 -> 50 | I13: 玉帝日嫦娥
A14: 12 | B14: 遇到上帝的 | C14: =R[-1]C+1 -> 12 | D14: 上帝死了 | E14: 5 | F14: =R[-1]C -> 5 | G14: =RC[-2]*1 -> 5 | H14: =RC[-3]*10 -> 50 | I14: 玉帝日嫦娥
A15: 13 | B15: 遇到上帝的 | C15: =R[-1]C+1 -> 13 | D15: 上帝死了 | E15: 5 | F15: =R[-1]C -> 5 | G15: =RC[-2]*1 -> 5 | H15: =RC[-3]*10 -> 50 | I15: 玉帝日嫦娥
A16: 14 | B16: 遇到上帝的 | C16: =R[-1]C+1 -> 14 | D16: 上帝死了 | E16: 5 | F16: =R[-1]C -> 5 | G16: =RC[-2]*1 -> 5 | H16: =RC[-3]*10 -> 50 | I16: 玉帝日嫦娥
A17: 15 | B17: 遇到上帝的 | C17: =R[-1]C+1 -> 15 | D17: 上帝死了 | E17: 5 | F17: =R[-1]C -> 5 | G17: =RC[-2]*1 -> 5 | H17: =RC[-3]*10 -> 50 | I17: 玉帝日嫦娥
A18: 16 | B18: 遇到上帝的 | C18: =R[-1]C+1 -> 16 | D18: 上帝死了 | E18: 5 | F18: =R[-1]C -> 5 | G18: =RC[-2]*1 -> 5 | H18: =RC[-3]*10 -> 50 | I18: 玉帝日嫦娥
A19: 17 | B19: 遇到上帝的 | C19: =R[-1]C+1 -> 17 | D19: 上帝死了 | E19: 5 | F19: =R[-1]C -> 5 | G19: =RC[-2]*1 -> 5 | H19: =RC[-3]*10 -> 50 | I19: 玉帝日嫦娥
A20: 18 | B20: 遇到上帝的 | C20: =R[-1]C+1 -> 18 | D20: 上帝死了 | E20: 5 | F20: =R[-1]C -> 5 | G20: =RC[-2]*1 -> 5 | H20: =RC[-3]*10 -> 50 | I20: 玉帝日嫦娥
A21: 19 | B21: 遇到上帝的 | C21: =R[-1]C+1 -> 19 | D21: 上帝死了 | E21: 5 | F21: =R[-1]C -> 5 | G21: =RC[-2]*1 -> 5 | H21: =RC[-3]*10 -> 50 | I21: 玉帝日嫦娥
A22: 20 | B22: 遇到上帝的 | C22: =R[-1]C+1 -> 20 | D22: 上帝死了 | E22: 5 | F22: =R[-1]C -> 5 | G22: =RC[-2]*1 -> 5 | H22: =RC[-3]*10 -> 50 | I22: 玉帝日嫦娥
A23: 21 | B23: 遇到上帝的 | C23: =R[-1]C+1 -> 21 | D23: 上帝死了 | E23: 6 | F23: =R[-1]C -> 5 | G23: =RC[-2]*2 -> 12 | H23: =RC[-3]*10 -> 60 | I23: 玉帝日嫦娥
A24: 22 | B24: 遇到上帝的 | C24: =R[-1]C+1 -> 22 | D24: 上帝死了 | E24: 6 | F24: =R[-1]C -> 5 | G24: =RC[-2]*2 -> 12 | H24: =RC[-3]*10 -> 60 | I24: 玉帝日嫦娥
A25: 23 | B25: 遇到上帝的 | C25: =R[-1]C+1 -> 23 | D25: 上帝死了 | E25: 6 | F25: =R[-1]C -> 5 | G25: =RC[-2]*2 -> 12 | H25: =RC[-3]*10 -> 60 | I25: 玉帝日嫦娥
A26: 24 | B26: 遇到上帝的 | C26: =R[-1]C+1 -> 24 | D26: 上帝死了 | E26: 6 | F26: =R[-1]C -> 5 | G26: =RC[-2]*2 -> 12 | H26: =RC[-3]*10 -> 60 | I26: 玉帝日嫦娥
A27: 25 | B27: 遇到上帝的 | C27: =R[-1]C+1 -> 25 | D27: 上帝死了 | E27: 6 | F27: =R[-1]C -> 5 | G27: =RC[-2]*2 -> 12 | H27: =RC[-3]*10 -> 60 | I27: 玉帝日嫦娥
A28: 26 | B28: 遇到上帝的 | C28: =R[-1]C+1 -> 26 | D28: 上帝死了 | E28: 6 | F28: =R[-1]C -> 5 | G28: =RC[-2]*2 -> 12 | H28: =RC[-3]*10 -> 60 | I28: 玉帝日嫦娥
A29: 27 | B29: 遇到上帝的 | C29: =R[-1]C+1 -> 27 | D29: 上帝死了 | E29: 6 | F29: =R[-1]C -> 5 | G29: =RC[-2]*2 -> 12 | H29: =RC[-3]*10 -> 60 | I29: 玉帝日嫦娥
A30: 28 | B30: 遇到上帝的 | C30: =R[-1]C+1 -> 28 | D30: 上帝死了 | E30: 6 | F30: =R[-1]C -> 5 | G30: =RC[-2]*2 -> 12 | H30: =RC[-3]*10 -> 60 | I30: 玉帝日嫦娥
A31: 29 | B31: 遇到上帝的 | C31: =R[-1]C+1 -> 29 | D31: 上帝死了 | E31: 6 | F31: =R[-1]C -> 5 | G31: =RC[-2]*2 -> 12 | H31: =RC[-3]*10 -> 60 | I31: 玉帝日嫦娥
A32: 30 | B32: 遇到上帝的 | C32: =R[-1]C+1 -> 30 | D32: 上帝死了 | E32: 6 | F32: =R[-1]C -> 5 | G32: =RC[-2]*2 -> 12 | H32: =RC[-3]*10 -> 60 | I32: 玉帝日嫦娥
A33: 31 | B33: 遇到上帝的 | C33: =R[-1]C+1 -> 31 | D33: 上帝死了 | E33: 6 | F33: =R[-1]C -> 5 | G33: =RC[-2]*2 -> 12 | H33: =RC[-3]*10 -> 60 | I33: 玉帝日嫦娥
A34: 32 | B34: 遇到上帝的 | C34: =R[-1]C+1 -> 32 | D34: 上帝死了 | E34: 6 | F34: =R[-1]C -> 5 | G34: =RC[-2]*2 -> 12 | H34: =RC[-3]*10 -> 60 | I34: 玉帝日嫦娥
A35: 33 | B35: 遇到上帝的 | C35: =R[-1]C+1 -> 33 | D35: 上帝死了 | E35: 6 | F35: =R[-1]C -> 5 | G35: =RC[-2]*2 -> 12 | H35: =RC[-3]*10 -> 60 | I35: 玉帝日嫦娥
A36: 34 | B36: 遇到上帝的 | C36: =R[-1]C+1 -> 34 | D36: 上帝死了 | E36: 6 | F36: =R[-1]C -> 5 | G36: =RC[-2]*2 -> 12 | H36: =RC[-3]*10 -> 60 | I36: 玉帝日嫦娥
A37: 35 | B37: 遇到上帝的 | C37: =R[-1]C+1 -> 35 | D37: 上帝死了 | E37: 6 | F37: =R[-1]C -> 5 | G37: =RC[-2]*2 -> 12 | H37: =RC[-3]*10 -> 60 | I37: 玉帝日嫦娥
A38: 36 | B38: 遇到上帝的 | C38: =R[-1]C+1 -> 36 | D38: 上帝死了 | E38: 6 | F38: =R[-1]C -> 5 | G38: =RC[-2]*2 -> 12 | H38: =RC[-3]*10 -> 60 | I38: 玉帝日嫦娥
A39: 37 | B39: 遇到上帝的 | C39: =R[-1]C+1 -> 37 | D39: 上帝死了 | E39: 6 | F39: =R[-1]C -> 5 | G39: =RC[-2]*2 -> 12 | H39: =RC[-3]*10 -> 60 | I39: 玉帝日嫦娥
A40: 38 | B40: 遇到上帝的 | C40: =R[-1]C+1 -> 38 | D40: 上帝死了 | E40: 6 | F40: =R[-1]C -> 5 | G40: =RC[-2]*2 -> 12 | H40: =RC[-3]*10 -> 60 | I40: 玉帝日嫦娥
A41: 39 | B41: 遇到上帝的 | C41: =R[-1]C+1 -> 39 | D41: 上帝死了 | E41: 6 | F41: =R[-1]C -> 5 | G41: =RC[-2]*2 -> 12 | H41: =RC[-3]*10 -> 60 | I41: 玉帝日嫦娥
A42: 40 | B42: 遇到上帝的 | C42: =R[-1]C+1 -> 40 | D42: 上帝死了 | E42: 6 | F42: =R[-1]C -> 5 | G42: =RC[-2]*2 -> 12 | H42: =RC[-3]*10 -> 60 | I42: 玉帝日嫦娥
A43: 41 | B43: 遇到上帝的 | C43: =R[-1]C+1 -> 41 | D43: 上帝死了 | E43: 7 | F43: =R[-1]C -> 5 | G43: =RC[-2]*3 -> 21 | H43: =RC[-3]*10 -> 70 | I43: 玉帝日嫦娥
A44: 42 | B44: 遇到上帝的 | C44: =R[-1]C+1 -> 42 | D44: 上帝死了 | E44: 7 | F44: =R[-1]C -> 5 | G44: =RC[-2]*3 -> 21 | H44: =RC[-3]*10 -> 70 | I44: 玉帝日嫦娥
A45: 43 | B45: 遇到上帝的 | C45: =R[-1]C+1 -> 43 | D45: 上帝死了 | E45: 7 | F45: =R[-1]C -> 5 | G45: =RC[-2]*3 -> 21 | H45: =RC[-3]*10 -> 70 | I45: 玉帝日嫦娥
A46: 44 | B46: 遇到上帝的 | C46: =R[-1]C+1 -> 44 | D46: 上帝死了 | E46: 7 | F46: =R[-1]C -> 5 | G46: =RC[-2]*3 -> 21 | H46: =RC[-3]*10 -> 70 | I46: 玉帝日嫦娥
A47: 45 | B47: 遇到上帝的 | C47: =R[-1]C+1 -> 45 | D47: 上帝死了 | E47: 7 | F47: =R[-1]C -> 5 | G47: =RC[-2]*3 -> 21 | H47: =RC[-3]*10 -> 70 | I47: 玉帝日嫦娥
A48: 46 | B48: 遇到上帝的 | C48: =R[-1]C+1 -> 46 | D48: 上帝死了 | E48: 7 | F48: =R[-1]C -> 5 | G48: =RC[-2]*3 -> 21 | H48: =RC[-3]*10 -> 70 | I48: 玉帝日嫦娥
A49: 47 | B49: 遇到上帝的 | C49: =R[-1]C+1 -> 47 | D49: 上帝死了 | E49: 7 | F49: =R[-1]C -> 5 | G49: =RC[-2]*3 -> 21 | H49: =RC[-3]*10 -> 70 | I49: 玉帝日嫦娥
A50: 48 | B50: 遇到上帝的 | C50: =R[-1]C+1 -> 48 | D50: 上帝死了 | E50: 7 | F50: =R[-1]C -> 5 | G50: =RC[-2]*3 -> 21 | H50: =RC[-3]*10 -> 70 | I50: 玉帝日嫦娥
A51: 49 | B51: 遇到上帝的 | C51: =R[-1]C+1 -> 49 | D51: 上帝死了 | E51: 7 | F51: =R[-1]C -> 5 | G51: =RC[-2]*3 -> 21 | H51: =RC[-3]*10 -> 70 | I51: 玉帝日嫦娥
A52: 50 | B52: 遇到上帝的 | C52: =R[-1]C+1 -> 50 | D52: 上帝死了 | E52: 7 | F52: =R[-1]C -> 5 | G52: =RC[-2]*3 -> 21 | H52: =RC[-3]*10 -> 70 | I52: 玉帝日嫦娥
A53: 51 | B53: 遇到上帝的 | C53: =R[-1]C+1 -> 51 | D53: 上帝死了 | E53: 7 | F53: =R[-1]C -> 5 | G53: =RC[-2]*3 -> 21 | H53: =RC[-3]*10 -> 70 | I53: 玉帝日嫦娥
A54: 52 | B54: 遇到上帝的 | C54: =R[-1]C+1 -> 52 | D54: 上帝死了 | E54: 7 | F54: =R[-1]C -> 5 | G54: =RC[-2]*3 -> 21 | H54: =RC[-3]*10 -> 70 | I54: 玉帝日嫦娥
A55: 53 | B55: 遇到上帝的 | C55: =R[-1]C+1 -> 53 | D55: 上帝死了 | E55: 7 | F55: =R[-1]C -> 5 | G55: =RC[-2]*3 -> 21 | H55: =RC[-3]*10 -> 70 | I55: 玉帝日嫦娥
A56: 54 | B56: 遇到上帝的 | C56: =R[-1]C+1 -> 54 | D56: 上帝死了 | E56: 7 | F56: =R[-1]C -> 5 | G56: =RC[-2]*3 -> 21 | H56: =RC[-3]*10 -> 70 | I56: 玉帝日嫦娥
A57: 55 | B57: 遇到上帝的 | C57: =R[-1]C+1 -> 55 | D57: 上帝死了 | E57: 7 | F57: =R[-1]C -> 5 | G57: =RC[-2]*3 -> 21 | H57: =RC[-3]*10 -> 70 | I57: 玉帝日嫦娥
A58: 56 | B58: 遇到上帝的 | C58: =R[-1]C+1 -> 56 | D58: 上帝死了 | E58: 7 | F58: =R[-1]C -> 5 | G58: =RC[-2]*3 -> 21 | H58: =RC[-3]*10 -> 70 | I58: 玉帝日嫦娥
A59: 57 | B59: 遇到上帝的 | C59: =R[-1]C+1 -> 57 | D59: 上帝死了 | E59: 7 | F59: =R[-1]C -> 5 | G59: =RC[-2]*3 -> 21 | H59: =RC[-3]*10 -> 70 | I59: 玉帝日嫦娥
A60: 58 | B60: 遇到上帝的 | C60: =R[-1]C+1 -> 58 | D60: 上帝死了 | E60: 7 | F60: =R[-1]C -> 5 | G60: =RC[-2]*3 -> 21 | H60: =RC[-3]*10 -> 70 | I60: 玉帝日嫦娥
A61: 59 | B61: 遇到上帝的 | C61: =R[-1]C+1 -> 59 | D61: 上帝死了 | E61: 7 | F61: =R[-1]C -> 5 | G61: =RC[-2]*3 -> 21 | H61: =RC[-3]*10 -> 70 | I61: 玉帝日嫦娥
A62: 60 | B62: 遇到上帝的 | C62: =R[-1]C+1 -> 60 | D62: 上帝死了 | E62: 7 | F62: =R[-1]C -> 5 | G62: =RC[-2]*3 -> 21 | H62: =RC[-3]*10 -> 70 | I62: 玉帝日嫦娥
A63: 61 | B63: 遇到上帝的 | C63: =R[-1]C+1 -> 61 | D63: 上帝死了 | E63: 8 | F63: =R[-1]C -> 5 | G63: =RC[-2]*4 -> 32 | H63: =RC[-3]*10 -> 80 | I63: 玉帝日嫦娥
A64: 62 | B64: 遇到上帝的 | C64: =R[-1]C+1 -> 62 | D64: 上帝死了 | E64: 8 | F64: =R[-1]C -> 5 | G64: =RC[-2]*4 -> 32 | H64: =RC[-3]*10 -> 80 | I64: 玉帝日嫦娥
A65: 63 | B65: 遇到上帝的 | C65: =R[-1]C+1 -> 63 | D65: 上帝死了 | E65: 8 | F65: =R[-1]C -> 5 | G65: =RC[-2]*4 -> 32 | H65: =RC[-3]*10 -> 80 | I65: 玉帝日嫦娥
A66: 64 | B66: 遇到上帝的 | C66: =R[-1]C+1 -> 64 | D66: 上帝死了 | E66: 8 | F66: =R[-1]C -> 5 | G66: =RC[-2]*4 -> 32 | H66: =RC[-3]*10 -> 80 | I66: 玉帝日嫦娥
A67: 65 | B67: 遇到上帝的 | C67: =R[-1]C+1 -> 65 | D67: 上帝死了 | E67: 8 | F67: =R[-1]C -> 5 | G67: =RC[-2]*4 -> 32 | H67: =RC[-3]*10 -> 80 | I67: 玉帝日嫦娥
A68: 66 | B68: 遇到上帝的 | C68: =R[-1]C+1 -> 66 | D68: 上帝死了 | E68: 8 | F68: =R[-1]C -> 5 | G68: =RC[-2]*4 -> 32 | H68: =RC[-3]*10 -> 80 | I68: 玉帝日嫦娥
A69: 67 | B69: 遇到上帝的 | C69: =R[-1]C+1 -> 67 | D69: 上帝死了 | E69: 8 | F69: =R[-1]C -> 5 | G69: =RC[-2]*4 -> 32 | H69: =RC[-3]*10 -> 80 | I69: 玉帝日嫦娥
A70: 68 | B70: 遇到上帝的 | C70: =R[-1]C+1 -> 68 | D70: 上帝死了 | E70: 8 | F70: =R[-1]C -> 5 | G70: =RC[-2]*4 -> 32 | H70: =RC[-3]*10 -> 80 | I70: 玉帝日嫦娥
A71: 69 | B71: 遇到上帝的 | C71: =R[-1]C+1 -> 69 | D71: 上帝死了 | E71: 8 | F71: =R[-1]C -> 5 | G71: =RC[-2]*4 -> 32 | H71: =RC[-3]*10 -> 80 | I71: 玉帝日嫦娥
A72: 70 | B72: 遇到上帝的 | C72: =R[-1]C+1 -> 70 | D72: 上帝死了 | E72: 8 | F72: =R[-1]C -> 5 | G72: =RC[-2]*4 -> 32 | H72: =RC[-3]*10 -> 80 | I72: 玉帝日嫦娥
A73: 71 | B73: 遇到上帝的 | C73: =R[-1]C+1 -> 71 | D73: 上帝死了 | E73: 10 | F73: =R[-1]C -> 5 | G73: =RC[-2]*5 -> 50 | H73: =RC[-3]*10 -> 100 | I73: 玉帝日嫦娥
A74: 72 | B74: 遇到上帝的 | C74: =R[-1]C+1 -> 72 | D74: 上帝死了 | E74: 10 | F74: =R[-1]C -> 5 | G74: =RC[-2]*5 -> 50 | H74: =RC[-3]*10 -> 100 | I74: 玉帝日嫦娥
A75: 73 | B75: 遇到上帝的 | C75: =R[-1]C+1 -> 73 | D75: 上帝死了 | E75: 10 | F75: =R[-1]C -> 5 | G75: =RC[-2]*5 -> 50 | H75: =RC[-3]*10 -> 100 | I75: 玉帝日嫦娥
A76: 74 | B76: 遇到上帝的 | C76: =R[-1]C+1 -> 74 | D76: 上帝死了 | E76: 10 | F76: =R[-1]C -> 5 | G76: =RC[-2]*5 -> 50 | H76: =RC[-3]*10 -> 100 | I76: 玉帝日嫦娥
A77: 75 | B77: 遇到上帝的 | C77: =R[-1]C+1 -> 75 | D77: 上帝死了 | E77: 10 | F77: =R[-1]C -> 5 | G77: =RC[-2]*5 -> 50 | H77: =RC[-3]*10 -> 100 | I77: 玉帝日嫦娥
A78: 76 | B78: 遇到上帝的 | C78: =R[-1]C+1 -> 76 | D78: 上帝死了 | E78: 10 | F78: =R[-1]C -> 5 | G78: =RC[-2]*5 -> 50 | H78: =RC[-3]*10 -> 100 | I78: 玉帝日嫦娥
A79: 77 | B79: 遇到上帝的 | C79: =R[-1]C+1 -> 77 | D79: 上帝死了 | E79: 10 | F79: =R[-1]C -> 5 | G79: =RC[-2]*5 -> 50 | H79: =RC[-3]*10 -> 100 | I79: 玉帝日嫦娥
A80: 78 | B80: 遇到上帝的 | C80: =R[-1]C+1 -> 78 | D80: 上帝死了 | E80: 10 | F80: =R[-1]C -> 5 | G80: =RC[-2]*5 -> 50 | H80: =RC[-3]*10 -> 100 | I80: 玉帝日嫦娥
A81: 79 | B81: 遇到上帝的 | C81: =R[-1]C+1 -> 79 | D81: 上帝死了 | E81: 10 | F81: =R[-1]C -> 5 | G81: =RC[-2]*5 -> 50 | H81: =RC[-3]*10 -> 100 | I81: 玉帝日嫦娥
A82: 80 | B82: 遇到上帝的 | C82: =R[-1]C+1 -> 80 | D82: 上帝死了 | E82: 10 | F82: =R[-1]C -> 5 | G82: =RC[-2]*5 -> 50 | H82: =RC[-3]*10 -> 100 | I82: 玉帝日嫦娥
A83: 81 | B83: 遇到上帝的 | C83: =R[-1]C+1 -> 81 | D83: 上帝死了 | E83: 12 | F83: =R[-1]C -> 5 | G83: =RC[-2]*5 -> 60 | H83: =RC[-3]*10 -> 120 | I83: 玉帝日嫦娥
A84: 82 | B84: 遇到上帝的 | C84: =R[-1]C+1 -> 82 | D84: 上帝死了 | E84: 12 | F84: =R[-1]C -> 5 | G84: =RC[-2]*5 -> 60 | H84: =RC[-3]*10 -> 120 | I84: 玉帝日嫦娥
A85: 83 | B85: 遇到上帝的 | C85: =R[-1]C+1 -> 83 | D85: 上帝死了 | E85: 12 | F85: =R[-1]C -> 5 | G85: =RC[-2]*5 -> 60 | H85: =RC[-3]*10 -> 120 | I85: 玉帝日嫦娥
A86: 84 | B86: 遇到上帝的 | C86: =R[-1]C+1 -> 84 | D86: 上帝死了 | E86: 12 | F86: =R[-1]C -> 5 | G86: =RC[-2]*5 -> 60 | H86: =RC[-3]*10 -> 120 | I86: 玉帝日嫦娥
A87: 85 | B87: 遇到上帝的 | C87: =R[-1]C+1 -> 85 | D87: 上帝死了 | E87: 12 | F87: =R[-1]C -> 5 | G87: =RC[-2]*5 -> 60 | H87: =RC[-3]*10 -> 120 | I87: 玉帝日嫦娥
A88: 86 | B88: 遇到上帝的 | C88: =R[-1]C+1 -> 86 | D88: 上帝死了 | E88: 12 | F88: =R[-1]C -> 5 | G88: =RC[-2]*5 -> 60 | H88: =RC[-3]*10 -> 120 | I88: 玉帝日嫦娥
A89: 87 | B89: 遇到上帝的 | C89: =R[-1]C+1 -> 87 | D89: 上帝死了 | E89: 12 | F89: =R[-1]C -> 5 | G89: =RC[-2]*5 -> 60 | H89: =RC[-3]*10 -> 120 | I89: 玉帝日嫦娥
A90: 88 | B90: 遇到上帝的 | C90: =R[-1]C+1 -> 88 | D90: 上帝死了 | E90: 12 | F90: =R[-1]C -> 5 | G90: =RC[-2]*5 -> 60 | H90: =RC[-3]*10 -> 120 | I90: 玉帝日嫦娥
A91: 89 | B91: 遇到上帝的 | C91: =R[-1]C+1 -> 89 | D91: 上帝死了 | E91: 12 | F91: =R[-1]C -> 5 | G91: =RC[-2]*5 -> 60 | H91: =RC[-3]*10 -> 120 | I91: 玉帝日嫦娥
A92: 90 | B92: 遇到上帝的 | C92: =R[-1]C+1 -> 90 | D92: 上帝死了 | E92: 12 | F92: =R[-1]C -> 5 | G92: =RC[-2]*5 -> 60 | H92: =RC[-3]*10 -> 120 | I92: 玉帝日嫦娥
A93: 91 | B93: 遇到上帝的 | C93: =R[-1]C+1 -> 91 | D93: 上帝死了 | E93: 14 | F93: =R[-1]C -> 5 | G93: =RC[-2]*5 -> 70 | H93: =RC[-3]*10 -> 140 | I93: 玉帝日嫦娥
A94: 92 | B94: 遇到上帝的 | C94: =R[-1]C+1 -> 92 | D94: 上帝死了 | E94: 14 | F94: =R[-1]C -> 5 | G94: =RC[-2]*5 -> 70 | H94: =RC[-3]*10 -> 140 | I94: 玉帝日嫦娥
A95: 93 | B95: 遇到上帝的 | C95: =R[-1]C+1 -> 93 | D95: 上帝死了 | E95: 14 | F95: =R[-1]C -> 5 | G95: =RC[-2]*5 -> 70 | H95: =RC[-3]*10 -> 140 | I95: 玉帝日嫦娥
A96: 94 | B96: 遇到上帝的 | C96: =R[-1]C+1 -> 94 | D96: 上帝死了 | E96: 14 | F96: =R[-1]C -> 5 | G96: =RC[-2]*5 -> 70 | H96: =RC[-3]*10 -> 140 | I96: 玉帝日嫦娥
A97: 95 | B97: 遇到上帝的 | C97: =R[-1]C+1 -> 95 | D97: 上帝死了 | E97: 14 | F97: =R[-1]C -> 5 | G97: =RC[-2]*5 -> 70 | H97: =RC[-3]*10 -> 140 | I97: 玉帝日嫦娥
A98: 96 | B98: 遇到上帝的 | C98: =R[-1]C+1 -> 96 | D98: 上帝死了 | E98: 14 | F98: =R[-1]C -> 5 | G98: =RC[-2]*5 -> 70 | H98: =RC[-3]*10 -> 140 | I98: 玉帝日嫦娥
A99: 97 | B99: 遇到上帝的 | C99: =R[-1]C+1 -> 97 | D99: 上帝死了 | E99: 14 | F99: =R[-1]C -> 5 | G99: =RC[-2]*5 -> 70 | H99: =RC[-3]*10 -> 140 | I99: 玉帝日嫦娥
A100: 98 | B100: 遇到上帝的 | C100: =R[-1]C+1 -> 98 | D100: 上帝死了 | E100: 14 | F100: =R[-1]C -> 5 | G100: =RC[-2]*5 -> 70 | H100: =RC[-3]*10 -> 140 | I100: 玉帝日嫦娥
A101: 99 | B101: 遇到上帝的 | C101: =R[-1]C+1 -> 99 | D101: 上帝死了 | E101: 14 | F101: =R[-1]C -> 5 | G101: =RC[-2]*5 -> 70 | H101: =RC[-3]*10 -> 140 | I101: 玉帝日嫦娥
A102: 100 | B102: 遇到上帝的 | C102: =R[-1]C+1 -> 100 | D102: 上帝死了 | E102: 14 | F102: =R[-1]C -> 5 | G102: =RC[-2]*5 -> 70 | H102: =RC[-3]*10 -> 140 | I102: 玉帝日嫦娥
A103: 101 | B103: 遇到上帝的 | C103: =R[-1]C+1 -> 101 | D103: 上帝死了 | E103: 15 | F103: =R[-1]C -> 5 | G103: =RC[-2]*5 -> 75 | H103: =RC[-3]*10 -> 150 | I103: 玉帝日嫦娥
A104: 102 | B104: 遇到上帝的 | C104: =R[-1]C+1 -> 102 | D104: 上帝死了 | E104: 15 | F104: =R[-1]C -> 5 | G104: =RC[-2]*5 -> 75 | H104: =RC[-3]*10 -> 150 | I104: 玉帝日嫦娥
A105: 103 | B105: 遇到上帝的 | C105: =R[-1]C+1 -> 103 | D105: 上帝死了 | E105: 15 | F105: =R[-1]C -> 5 | G105: =RC[-2]*5 -> 75 | H105: =RC[-3]*10 -> 150 | I105: 玉帝日嫦娥
A106: 104 | B106: 遇到上帝的 | C106: =R[-1]C+1 -> 104 | D106: 上帝死了 | E106: 15 | F106: =R[-1]C -> 5 | G106: =RC[-2]*5 -> 75 | H106: =RC[-3]*10 -> 150 | I106: 玉帝日嫦娥
A107: 105 | B107: 遇到上帝的 | C107: =R[-1]C+1 -> 105 | D107: 上帝死了 | E107: 15 | F107: =R[-1]C -> 5 | G107: =RC[-2]*5 -> 75 | H107: =RC[-3]*10 -> 150 | I107: 玉帝日嫦娥
A108: 106 | B108: 遇到上帝的 | C108: =R[-1]C+1 -> 106 | D108: 上帝死了 | E108: 15 | F108: =R[-1]C -> 5 | G108: =RC[-2]*5 -> 75 | H108: =RC[-3]*10 -> 150 | I108: 玉帝日嫦娥
A109: 107 | B109: 遇到上帝的 | C109: =R[-1]C+1 -> 107 | D109: 上帝死了 | E109: 15 | F109: =R[-1]C -> 5 | G109: =RC[-2]*5 -> 75 | H109: =RC[-3]*10 -> 150 | I109: 玉帝日嫦娥
A110: 108 | B110: 遇到上帝的 | C110: =R[-1]C+1 -> 108 | D110: 上帝死了 | E110: 15 | F110: =R[-1]C -> 5 | G110: =RC[-2]*5 -> 75 | H110: =RC[-3]*10 -> 150 | I110: 玉帝日嫦娥
A111: 109 | B111: 遇到上帝的 | C111: =R[-1]C+1 -> 109 | D111: 上帝死了 | E111: 15 | F111: =R[-1]C -> 5 | G111: =RC[-2]*5 -> 75 | H111: =RC[-3]*10 -> 150 | I111: 玉帝日嫦娥
A112: 110 | B112: 遇到上帝的 | C112: =R[-1]C+1 -> 110 | D112: 上帝死了 | E112: 15 | F112: =R[-1]C -> 5 | G112: =RC[-2]*5 -> 75 | H112: =RC[-3]*10 -> 150 | I112: 玉帝日嫦娥
A113: 111 | B113: 遇到上帝的 | C113: =R[-1]C+1 -> 111 | D113: 上帝死了 | E113: 16 | F113: =R[-1]C -> 5 | G113: =RC[-2]*5 -> 80 | H113: =RC[-3]*10 -> 160 | I113: 玉帝日嫦娥
A114: 112 | B114: 遇到上帝的 | C114: =R[-1]C+1 -> 112 | D114: 上帝死了 | E114: 16 | F114: =R[-1]C -> 5 | G114: =RC[-2]*5 -> 80 | H114: =RC[-3]*10 -> 160 | I114: 玉帝日嫦娥
A115: 113 | B115: 遇到上帝的 | C115: =R[-1]C+1 -> 113 | D115: 上帝死了 | E115: 16 | F115: =R[-1]C -> 5 | G115: =RC[-2]*5 -> 80 | H115: =RC[-3]*10 -> 160 | I115: 玉帝日嫦娥
A116: 114 | B116: 遇到上帝的 | C116: =R[-1]C+1 -> 114 | D116: 上帝死了 | E116: 16 | F116: =R[-1]C -> 5 | G116: =RC[-2]*5 -> 80 | H116: =RC[-3]*10 -> 160 | I116: 玉帝日嫦娥
A117: 115 | B117: 遇到上帝的 | C117: =R[-1]C+1 -> 115 | D117: 上帝死了 | E117: 16 | F117: =R[-1]C -> 5 | G117: =RC[-2]*5 -> 80 | H117: =RC[-3]*10 -> 160 | I117: 玉帝日嫦娥
A118: 116 | B118: 遇到上帝的 | C118: =R[-1]C+1 -> 116 | D118: 上帝死了 | E118: 16 | F118: =R[-1]C -> 5 | G118: =RC[-2]*5 -> 80 | H118: =RC[-3]*10 -> 160 | I118: 玉帝日嫦娥
A119: 117 | B119: 遇到上帝的 | C119: =R[-1]C+1 -> 117 | D119: 上帝死了 | E119: 16 | F119: =R[-1]C -> 5 | G119: =RC[-2]*5 -> 80 | H119: =RC[-3]*10 -> 160 | I119: 玉帝日嫦娥
A120: 118 | B120: 遇到上帝的 | C120: =R[-1]C+1 -> 118 | D120: 上帝死了 | E120: 16 | F120: =R[-1]C -> 5 | G120: =RC[-2]*5 -> 80 | H120: =RC[-3]*10 -> 160 | I120: 玉帝日嫦娥
A121: 119 | B121: 遇到上帝的 | C121: =R[-1]C+1 -> 119 | D121: 上帝死了 | E121: 16 | F121: =R[-1]C -> 5 | G121: =RC[-2]*5 -> 80 | H121: =RC[-3]*10 -> 160 | I121: 玉帝日嫦娥
A122: 120 | B122: 遇到上帝的 | C122: =R[-1]C+1 -> 120 | D122: 上帝死了 | E122: 16 | F122: =R[-1]C -> 5 | G122: =RC[-2]*5 -> 80 | H122: =RC[-3]*10 -> 160 | I122: 玉帝日嫦娥
A123: 121 | B123: 遇到上帝的 | C123: =R[-1]C+1 -> 121 | D123: 上帝死了 | E123: 17 | F123: =R[-1]C -> 5 | G123: =RC[-2]*5 -> 85 | H123: =RC[-3]*10 -> 170 | I123: 玉帝日嫦娥
A124: 122 | B124: 遇到上帝的 | C124: =R[-1]C+1 -> 122 | D124: 上帝死了 | E124: 17 | F124: =R[-1]C -> 5 | G124: =RC[-2]*5 -> 85 | H124: =RC[-3]*10 -> 170 | I124: 玉帝日嫦娥
A125: 123 | B125: 遇到上帝的 | C125: =R[-1]C+1 -> 123 | D125: 上帝死了 | E125: 17 | F125: =R[-1]C -> 5 | G125: =RC[-2]*5 -> 85 | H125: =RC[-3]*10 -> 170 | I125: 玉帝日嫦娥
A126: 124 | B126: 遇到上帝的 | C126: =R[-1]C+1 -> 124 | D126: 上帝死了 | E126: 17 | F126: =R[-1]C -> 5 | G126: =RC[-2]*5 -> 85 | H126: =RC[-3]*10 -> 170 | I126: 玉帝日嫦娥
A127: 125 | B127: 遇到上帝的 | C127: =R[-1]C+1 -> 125 | D127: 上帝死了 | E127: 17 | F127: =R[-1]C -> 5 | G127: =RC[-2]*5 -> 85 | H127: =RC[-3]*10 -> 170 | I127: 玉帝日嫦娥
A128: 126 | B128: 遇到上帝的 | C128: =R[-1]C+1 -> 126 | D128: 上帝死了 | E128: 17 | F128: =R[-1]C -> 5 | G128: =RC[-2]*5 -> 85 | H128: =RC[-3]*10 -> 170 | I128: 玉帝日嫦娥
A129: 127 | B129: 遇到上帝的 | C129: =R[-1]C+1 -> 127 | D129: 上帝死了 | E129: 17 | F129: =R[-1]C -> 5 | G129: =RC[-2]*5 -> 85 | H129: =RC[-3]*10 -> 170 | I129: 玉帝日嫦娥
A130: 128 | B130: 遇到上帝的 | C130: =R[-1]C+1 -> 128 | D130: 上帝死了 | E130: 17 | F130: =R[-1]C -> 5 | G130: =RC[-2]*5 -> 85 | H130: =RC[-3]*10 -> 170 | I130: 玉帝日嫦娥
A131: 129 | B131: 遇到上帝的 | C131: =R[-1]C+1 -> 129 | D131: 上帝死了 | E131: 17 | F131: =R[-1]C -> 5 | G131: =RC[-2]*5 -> 85 | H131: =RC[-3]*10 -> 170 | I131: 玉帝日嫦娥
A132: 130 | B132: 遇到上帝的 | C132: =R[-1]C+1 -> 130 | D132: 上帝死了 | E132: 17 | F132: =R[-1]C -> 5 | G132: =RC[-2]*5 -> 85 | H132: =RC[-3]*10 -> 170 | I132: 玉帝日嫦娥
A133: 131 | B133: 遇到上帝的 | C133: =R[-1]C+1 -> 131 | D133: 上帝死了 | E133: 18 | F133: =R[-1]C -> 5 | G133: =RC[-2]*5 -> 90 | H133: =RC[-3]*10 -> 180 | I133: 玉帝日嫦娥
A134: 132 | B134: 遇到上帝的 | C134: =R[-1]C+1 -> 132 | D134: 上帝死了 | E134: 18 | F134: =R[-1]C -> 5 | G134: =RC[-2]*5 -> 90 | H134: =RC[-3]*10 -> 180 | I134: 玉帝日嫦娥
A135: 133 | B135: 遇到上帝的 | C135: =R[-1]C+1 -> 133 | D135: 上帝死了 | E135: 18 | F135: =R[-1]C -> 5 | G135: =RC[-2]*5 -> 90 | H135: =RC[-3]*10 -> 180 | I135: 玉帝日嫦娥
A136: 134 | B136: 遇到上帝的 | C136: =R[-1]C+1 -> 134 | D136: 上帝死了 | E136: 18 | F136: =R[-1]C -> 5 | G136: =RC[-2]*5 -> 90 | H136: =RC[-3]*10 -> 180 | I136: 玉帝日嫦娥
A137: 135 | B137: 遇到上帝的 | C137: =R[-1]C+1 -> 135 | D137: 上帝死了 | E137: 18 | F137: =R[-1]C -> 5 | G137: =RC[-2]*5 -> 90 | H137: =RC[-3]*10 -> 180 | I137: 玉帝日嫦娥
A138: 136 | B138: 遇到上帝的 | C138: =R[-1]C+1 -> 136 | D138: 上帝死了 | E138: 18 | F138: =R[-1]C -> 5 | G138: =RC[-2]*5 -> 90 | H138: =RC[-3]*10 -> 180 | I138: 玉帝日嫦娥
A139: 137 | B139: 遇到上帝的 | C139: =R[-1]C+1 -> 137 | D139: 上帝死了 | E139: 18 | F139: =R[-1]C -> 5 | G139: =RC[-2]*5 -> 90 | H139: =RC[-3]*10 -> 180 | I139: 玉帝日嫦娥
A140: 138 | B140: 遇到上帝的 | C140: =R[-1]C+1 -> 138 | D140: 上帝死了 | E140: 18 | F140: =R[-1]C -> 5 | G140: =RC[-2]*5 -> 90 | H140: =RC[-3]*10 -> 180 | I140: 玉帝日嫦娥
A141: 139 | B141: 遇到上帝的 | C141: =R[-1]C+1 -> 139 | D141: 上帝死了 | E141: 18 | F141: =R[-1]C -> 5 | G141: =RC[-2]*5 -> 90 | H141: =RC[-3]*10 -> 180 | I141: 玉帝日嫦娥
A142: 140 | B142: 遇到上帝的 | C142: =R[-1]C+1 -> 140 | D142: 上帝死了 | E142: 18 | F142: =R[-1]C -> 5 | G142: =RC[-2]*5 -> 90 | H142: =RC[-3]*10 -> 180 | I142: 玉帝日嫦娥
A143: 141 | B143: 遇到上帝的 | C143: =R[-1]C+1 -> 141 | D143: 上帝死了 | E143: 19 | F143: =R[-1]C -> 5 | G143: =RC[-2]*5 -> 95 | H143: =RC[-3]*10 -> 190 | I143: 玉帝日嫦娥
A144: 142 | B144: 遇到上帝的 | C144: =R[-1]C+1 -> 142 | D144: 上帝死了 | E144: 19 | F144: =R[-1]C -> 5 | G144: =RC[-2]*5 -> 95 | H144: =RC[-3]*10 -> 190 | I144: 玉帝日嫦娥
A145: 143 | B145: 遇到上帝的 | C145: =R[-1]C+1 -> 143 | D145: 上帝死了 | E145: 19 | F145: =R[-1]C -> 5 | G145: =RC[-2]*5 -> 95 | H145: =RC[-3]*10 -> 190 | I145: 玉帝日嫦娥
A146: 144 | B146: 遇到上帝的 | C146: =R[-1]C+1 -> 144 | D146: 上帝死了 | E146: 19 | F146: =R[-1]C -> 5 | G146: =RC[-2]*5 -> 95 | H146: =RC[-3]*10 -> 190 | I146: 玉帝日嫦娥
A147: 145 | B147: 遇到上帝的 | C147: =R[-1]C+1 -> 145 | D147: 上帝死了 | E147: 19 | F147: =R[-1]C -> 5 | G147: =RC[-2]*5 -> 95 | H147: =RC[-3]*10 -> 190 | I147: 玉帝日嫦娥
A148: 146 | B148: 遇到上帝的 | C148: =R[-1]C+1 -> 146 | D148: 上帝死了 | E148: 19 | F148: =R[-1]C -> 5 | G148: =RC[-2]*5 -> 95 | H148: =RC[-3]*10 -> 190 | I148: 玉帝日嫦娥
A149: 147 | B149: 遇到上帝的 | C149: =R[-1]C+1 -> 147 | D149: 上帝死了 | E149: 19 | F149: =R[-1]C -> 5 | G149: =RC[-2]*5 -> 95 | H149: =RC[-3]*10 -> 190 | I149: 玉帝日嫦娥
A150: 148 | B150: 遇到上帝的 | C150: =R[-1]C+1 -> 148 | D150: 上帝死了 | E150: 19 | F150: =R[-1]C -> 5 | G150: =RC[-2]*5 -> 95 | H150: =RC[-3]*10 -> 190 | I150: 玉帝日嫦娥
A151: 149 | B151: 遇到上帝的 | C151: =R[-1]C+1 -> 149 | D151: 上帝死了 | E151: 19 | F151: =R[-1]C -> 5 | G151: =RC[-2]*5 -> 95 | H151: =RC[-3]*10 -> 190 | I151: 玉帝日嫦娥
A152: 150 | B152: 遇到上帝的 | C152: =R[-1]C+1 -> 150 | D152: 上帝死了 | E152: 19 | F152: =R[-1]C -> 5 | G152: =RC[-2]*5 -> 95 | H152: =RC[-3]*10 -> 190 | I152: 玉帝日嫦娥
A153: 151 | B153: 遇到上帝的 | C153: =R[-1]C+1 -> 151 | D153: 上帝死了 | E153: 20 | F153: =R[-1]C -> 5 | G153: =RC[-2]*5 -> 100 | H153: =RC[-3]*10 -> 200 | I153: 玉帝日嫦娥
A154: 152 | B154: 遇到上帝的 | C154: =R[-1]C+1 -> 152 | D154: 上帝死了 | E154: 20 | F154: =R[-1]C -> 5 | G154: =RC[-2]*5 -> 100 | H154: =RC[-3]*10 -> 200 | I154: 玉帝日嫦娥
A155: 153 | B155: 遇到上帝的 | C155: =R[-1]C+1 -> 153 | D155: 上帝死了 | E155: 20 | F155: =R[-1]C -> 5 | G155: =RC[-2]*5 -> 100 | H155: =RC[-3]*10 -> 200 | I155: 玉帝日嫦娥
A156: 154 | B156: 遇到上帝的 | C156: =R[-1]C+1 -> 154 | D156: 上帝死了 | E156: 20 | F156: =R[-1]C -> 5 | G156: =RC[-2]*5 -> 100 | H156: =RC[-3]*10 -> 200 | I156: 玉帝日嫦娥
A157: 155 | B157: 遇到上帝的 | C157: =R[-1]C+1 -> 155 | D157: 上帝死了 | E157: 20 | F157: =R[-1]C -> 5 | G157: =RC[-2]*5 -> 100 | H157: =RC[-3]*10 -> 200 | I157: 玉帝日嫦娥
A158: 156 | B158: 遇到上帝的 | C158: =R[-1]C+1 -> 156 | D158: 上帝死了 | E158: 20 | F158: =R[-1]C -> 5 | G158: =RC[-2]*5 -> 100 | H158: =RC[-3]*10 -> 200 | I158: 玉帝日嫦娥
A159: 157 | B159: 遇到上帝的 | C159: =R[-1]C+1 -> 157 | D159: 上帝死了 | E159: 20 | F159: =R[-1]C -> 5 | G159: =RC[-2]*5 -> 100 | H159: =RC[-3]*10 -> 200 | I159: 玉帝日嫦娥
A160: 158 | B160: 遇到上帝的 | C160: =R[-1]C+1 -> 158 | D160: 上帝死了 | E160: 20 | F160: =R[-1]C -> 5 | G160: =RC[-2]*5 -> 100 | H160: =RC[-3]*10 -> 200 | I160: 玉帝日嫦娥
A161: 159 | B161: 遇到上帝的 | C161: =R[-1]C+1 -> 159 | D161: 上帝死了 | E161: 20 | F161: =R[-1]C -> 5 | G161: =RC[-2]*5 -> 100 | H161: =RC[-3]*10 -> 200 | I161: 玉帝日嫦娥
A162: 160 | B162: 遇到上帝的 | C162: =R[-1]C+1 -> 160 | D162: 上帝死了 | E162: 20 | F162: =R[-1]C -> 5 | G162: =RC[-2]*5 -> 100 | H162: =RC[-3]*10 -> 200 | I162: 玉帝日嫦娥
A163: 161 | B163: 遇到上帝的 | C163: =R[-1]C+1 -> 161 | D163: 上帝死了 | E163: 21 | F163: =R[-1]C -> 5 | G163: =RC[-2]*5 -> 105 | H163: =RC[-3]*10 -> 210 | I163: 玉帝日嫦娥
A164: 162 | B164: 遇到上帝的 | C164: =R[-1]C+1 -> 162 | D164: 上帝死了 | E164: 21 | F164: =R[-1]C -> 5 | G164: =RC[-2]*5 -> 105 | H164: =RC[-3]*10 -> 210 | I164: 玉帝日嫦娥
A165: 163 | B165: 遇到上帝的 | C165: =R[-1]C+1 -> 163 | D165: 上帝死了 | E165: 21 | F165: =R[-1]C -> 5 | G165: =RC[-2]*5 -> 105 | H165: =RC[-3]*10 -> 210 | I165: 玉帝日嫦娥
A166: 164 | B166: 遇到上帝的 | C166: =R[-1]C+1 -> 164 | D166: 上帝死了 | E166: 21 | F166: =R[-1]C -> 5 | G166: =RC[-2]*5 -> 105 | H166: =RC[-3]*10 -> 210 | I166: 玉帝日嫦娥
A167: 165 | B167: 遇到上帝的 | C167: =R[-1]C+1 -> 165 | D167: 上帝死了 | E167: 21 | F167: =R[-1]C -> 5 | G167: =RC[-2]*5 -> 105 | H167: =RC[-3]*10 -> 210 | I167: 玉帝日嫦娥
A168: 166 | B168: 遇到上帝的 | C168: =R[-1]C+1 -> 166 | D168: 上帝死了 | E168: 21 | F168: =R[-1]C -> 5 | G168: =RC[-2]*5 -> 105 | H168: =RC[-3]*10 -> 210 | I168: 玉帝日嫦娥
A169: 167 | B169: 遇到上帝的 | C169: =R[-1]C+1 -> 167 | D169: 上帝死了 | E169: 21 | F169: =R[-1]C -> 5 | G169: =RC[-2]*5 -> 105 | H169: =RC[-3]*10 -> 210 | I169: 玉帝日嫦娥
A170: 168 | B170: 遇到上帝的 | C170: =R[-1]C+1 -> 168 | D170: 上帝死了 | E170: 21 | F170: =R[-1]C -> 5 | G170: =RC[-2]*5 -> 105 | H170: =RC[-3]*10 -> 210 | I170: 玉帝日嫦娥
A171: 169 | B171: 遇到上帝的 | C171: =R[-1]C+1 -> 169 | D171: 上帝死了 | E171: 21 | F171: =R[-1]C -> 5 | G171: =RC[-2]*5 -> 105 | H171: =RC[-3]*10 -> 210 | I171: 玉帝日嫦娥
A172: 170 | B172: 遇到上帝的 | C172: =R[-1]C+1 -> 170 | D172: 上帝死了 | E172: 21 | F172: =R[-1]C -> 5 | G172: =RC[-2]*5 -> 105 | H172: =RC[-3]*10 -> 210 | I172: 玉帝日嫦娥
A173: 171 | B173: 遇到上帝的 | C173: =R[-1]C+1 -> 171 | D173: 上帝死了 | E173: 22 | F173: =R[-1]C -> 5 | G173: =RC[-2]*5 -> 110 | H173: =RC[-3]*10 -> 220 | I173: 玉帝日嫦娥
A174: 172 | B174: 遇到上帝的 | C174: =R[-1]C+1 -> 172 | D174: 上帝死了 | E174: 22 | F174: =R[-1]C -> 5 | G174: =RC[-2]*5 -> 110 | H174: =RC[-3]*10 -> 220 | I174: 玉帝日嫦娥
A175: 173 | B175: 遇到上帝的 | C175: =R[-1]C+1 -> 173 | D175: 上帝死了 | E175: 22 | F175: =R[-1]C -> 5 | G175: =RC[-2]*5 -> 110 | H175: =RC[-3]*10 -> 220 | I175: 玉帝日嫦娥
A176: 174 | B176: 遇到上帝的 | C176: =R[-1]C+1 -> 174 | D176: 上帝死了 | E176: 22 | F176: =R[-1]C -> 5 | G176: =RC[-2]*5 -> 110 | H176: =RC[-3]*10 -> 220 | I176: 玉帝日嫦娥
A177: 175 | B177: 遇到上帝的 | C177: =R[-1]C+1 -> 175 | D177: 上帝死了 | E177: 22 | F177: =R[-1]C -> 5 | G177: =RC[-2]*5 -> 110 | H177: =RC[-3]*10 -> 220 | I177: 玉帝日嫦娥
A178: 176 | B178: 遇到上帝的 | C178: =R[-1]C+1 -> 176 | D178: 上帝死了 | E178: 22 | F178: =R[-1]C -> 5 | G178: =RC[-2]*5 -> 110 | H178: =RC[-3]*10 -> 220 | I178: 玉帝日嫦娥
A179: 177 | B179: 遇到上帝的 | C179: =R[-1]C+1 -> 177 | D179: 上帝死了 | E179: 22 | F179: =R[-1]C -> 5 | G179: =RC[-2]*5 -> 110 | H179: =RC[-3]*10 -> 220 | I179: 玉帝日嫦娥
A180: 178 | B180: 遇到上帝的 | C180: =R[-1]C+1 -> 178 | D180: 上帝死了 | E180: 22 | F180: =R[-1]C -> 5 | G180: =RC[-2]*5 -> 110 | H180: =RC[-3]*10 -> 220 | I180: 玉帝日嫦娥
A181: 179 | B181: 遇到上帝的 | C181: =R[-1]C+1 -> 179 | D181: 上帝死了 | E181: 22 | F181: =R[-1]C -> 5 | G181: =RC[-2]*5 -> 110 | H181: =RC[-3]*10 -> 220 | I181: 玉帝日嫦娥
A182: 180 | B182: 遇到上帝的 | C182: =R[-1]C+1 -> 180 | D182: 上帝死了 | E182: 22 | F182: =R[-1]C -> 5 | G182: =RC[-2]*5 -> 110 | H182: =RC[-3]*10 -> 220 | I182: 玉帝日嫦娥
A183: 181 | B183: 遇到上帝的 | C183: =R[-1]C+1 -> 181 | D183: 上帝死了 | E183: 23 | F183: =R[-1]C -> 5 | G183: =RC[-2]*5 -> 115 | H183: =RC[-3]*10 -> 230 | I183: 玉帝日嫦娥
A184: 182 | B184: 遇到上帝的 | C184: =R[-1]C+1 -> 182 | D184: 上帝死了 | E184: 23 | F184: =R[-1]C -> 5 | G184: =RC[-2]*5 -> 115 | H184: =RC[-3]*10 -> 230 | I184: 玉帝日嫦娥
A185: 183 | B185: 遇到上帝的 | C185: =R[-1]C+1 -> 183 | D185: 上帝死了 | E185: 23 | F185: =R[-1]C -> 5 | G185: =RC[-2]*5 -> 115 | H185: =RC[-3]*10 -> 230 | I185: 玉帝日嫦娥
A186: 184 | B186: 遇到上帝的 | C186: =R[-1]C+1 -> 184 | D186: 上帝死了 | E186: 23 | F186: =R[-1]C -> 5 | G186: =RC[-2]*5 -> 115 | H186: =RC[-3]*10 -> 230 | I186: 玉帝日嫦娥
A187: 185 | B187: 遇到上帝的 | C187: =R[-1]C+1 -> 185 | D187: 上帝死了 | E187: 23 | F187: =R[-1]C -> 5 | G187: =RC[-2]*5 -> 115 | H187: =RC[-3]*10 -> 230 | I187: 玉帝日嫦娥
A188: 186 | B188: 遇到上帝的 | C188: =R[-1]C+1 -> 186 | D188: 上帝死了 | E188: 23 | F188: =R[-1]C -> 5 | G188: =RC[-2]*5 -> 115 | H188: =RC[-3]*10 -> 230 | I188: 玉帝日嫦娥
A189: 187 | B189: 遇到上帝的 | C189: =R[-1]C+1 -> 187 | D189: 上帝死了 | E189: 23 | F189: =R[-1]C -> 5 | G189: =RC[-2]*5 -> 115 | H189: =RC[-3]*10 -> 230 | I189: 玉帝日嫦娥
A190: 188 | B190: 遇到上帝的 | C190: =R[-1]C+1 -> 188 | D190: 上帝死了 | E190: 23 | F190: =R[-1]C -> 5 | G190: =RC[-2]*5 -> 115 | H190: =RC[-3]*10 -> 230 | I190: 玉帝日嫦娥
A191: 189 | B191: 遇到上帝的 | C191: =R[-1]C+1 -> 189 | D191: 上帝死了 | E191: 23 | F191: =R[-1]C -> 5 | G191: =RC[-2]*5 -> 115 | H191: =RC[-3]*10 -> 230 | I191: 玉帝日嫦娥
A192: 190 | B192: 遇到上帝的 | C192: =R[-1]C+1 -> 190 | D192: 上帝死了 | E192: 23 | F192: =R[-1]C -> 5 | G192: =RC[-2]*5 -> 115 | H192: =RC[-3]*10 -> 230 | I192: 玉帝日嫦娥
A193: 191 | B193: 遇到上帝的 | C193: =R[-1]C+1 -> 191 | D193: 上帝死了 | E193: 24 | F193: =R[-1]C -> 5 | G193: =RC[-2]*5 -> 120 | H193: =RC[-3]*10 -> 240 | I193: 玉帝日嫦娥
A194: 192 | B194: 遇到上帝的 | C194: =R[-1]C+1 -> 192 | D194: 上帝死了 | E194: 24 | F194: =R[-1]C -> 5 | G194: =RC[-2]*5 -> 120 | H194: =RC[-3]*10 -> 240 | I194: 玉帝日嫦娥
A195: 193 | B195: 遇到上帝的 | C195: =R[-1]C+1 -> 193 | D195: 上帝死了 | E195: 24 | F195: =R[-1]C -> 5 | G195: =RC[-2]*5 -> 120 | H195: =RC[-3]*10 -> 240 | I195: 玉帝日嫦娥
A196: 194 | B196: 遇到上帝的 | C196: =R[-1]C+1 -> 194 | D196: 上帝死了 | E196: 24 | F196: =R[-1]C -> 5 | G196: =RC[-2]*5 -> 120 | H196: =RC[-3]*10 -> 240 | I196: 玉帝日嫦娥
A197: 195 | B197: 遇到上帝的 | C197: =R[-1]C+1 -> 195 | D197: 上帝死了 | E197: 24 | F197: =R[-1]C -> 5 | G197: =RC[-2]*5 -> 120 | H197: =RC[-3]*10 -> 240 | I197: 玉帝日嫦娥
A198: 196 | B198: 遇到上帝的 | C198: =R[-1]C+1 -> 196 | D198: 上帝死了 | E198: 24 | F198: =R[-1]C -> 5 | G198: =RC[-2]*5 -> 120 | H198: =RC[-3]*10 -> 240 | I198: 玉帝日嫦娥
A199: 197 | B199: 遇到上帝的 | C199: =R[-1]C+1 -> 197 | D199: 上帝死了 | E199: 24 | F199: =R[-1]C -> 5 | G199: =RC[-2]*5 -> 120 | H199: =RC[-3]*10 -> 240 | I199: 玉帝日嫦娥
A200: 198 | B200: 遇到上帝的 | C200: =R[-1]C+1 -> 198 | D200: 上帝死了 | E200: 24 | F200: =R[-1]C -> 5 | G200: =RC[-2]*5 -> 120 | H200: =RC[-3]*10 -> 240 | I200: 玉帝日嫦娥
A201: 199 | B201: 遇到上帝的 | C201: =R[-1]C+1 -> 199 | D201: 上帝死了 | E201: 24 | F201: =R[-1]C -> 5 | G201: =RC[-2]*5 -> 120 | H201: =RC[-3]*10 -> 240 | I201: 玉帝日嫦娥
A202: 200 | B202: 遇到上帝的 | C202: =R[-1]C+1 -> 200 | D202: 上帝死了 | E202: 24 | F202: =R[-1]C -> 5 | G202: =RC[-2]*5 -> 120 | H202: =RC[-3]*10 -> 240 | I202: 玉帝日嫦娥
A203: 201 | B203: 遇到上帝的 | C203: =R[-1]C+1 -> 201 | D203: 上帝死了 | E203: 25 | F203: =R[-1]C -> 5 | G203: =RC[-2]*5 -> 125 | H203: =RC[-3]*10 -> 250 | I203: 玉帝日嫦娥
A204: 202 | B204: 遇到上帝的 | C204: =R[-1]C+1 -> 202 | D204: 上帝死了 | E204: 25 | F204: =R[-1]C -> 5 | G204: =RC[-2]*5 -> 125 | H204: =RC[-3]*10 -> 250 | I204: 玉帝日嫦娥
A205: 203 | B205: 遇到上帝的 | C205: =R[-1]C+1 -> 203 | D205: 上帝死了 | E205: 25 | F205: =R[-1]C -> 5 | G205: =RC[-2]*5 -> 125 | H205: =RC[-3]*10 -> 250 | I205: 玉帝日嫦娥
A206: 204 | B206: 遇到上帝的 | C206: =R[-1]C+1 -> 204 | D206: 上帝死了 | E206: 25 | F206: =R[-1]C -> 5 | G206: =RC[-2]*5 -> 125 | H206: =RC[-3]*10 -> 250 | I206: 玉帝日嫦娥
A207: 205 | B207: 遇到上帝的 | C207: =R[-1]C+1 -> 205 | D207: 上帝死了 | E207: 25 | F207: =R[-1]C -> 5 | G207: =RC[-2]*5 -> 125 | H207: =RC[-3]*10 -> 250 | I207: 玉帝日嫦娥
A208: 206 | B208: 遇到上帝的 | C208: =R[-1]C+1 -> 206 | D208: 上帝死了 | E208: 25 | F208: =R[-1]C -> 5 | G208: =RC[-2]*5 -> 125 | H208: =RC[-3]*10 -> 250 | I208: 玉帝日嫦娥
A209: 207 | B209: 遇到上帝的 | C209: =R[-1]C+1 -> 207 | D209: 上帝死了 | E209: 25 | F209: =R[-1]C -> 5 | G209: =RC[-2]*5 -> 125 | H209: =RC[-3]*10 -> 250 | I209: 玉帝日嫦娥
A210: 208 | B210: 遇到上帝的 | C210: =R[-1]C+1 -> 208 | D210: 上帝死了 | E210: 25 | F210: =R[-1]C -> 5 | G210: =RC[-2]*5 -> 125 | H210: =RC[-3]*10 -> 250 | I210: 玉帝日嫦娥
A211: 209 | B211: 遇到上帝的 | C211: =R[-1]C+1 -> 209 | D211: 上帝死了 | E211: 25 | F211: =R[-1]C -> 5 | G211: =RC[-2]*5 -> 125 | H211: =RC[-3]*10 -> 250 | I211: 玉帝日嫦娥
A212: 210 | B212: 遇到上帝的 | C212: =R[-1]C+1 -> 210 | D212: 上帝死了 | E212: 25 | F212: =R[-1]C -> 5 | G212: =RC[-2]*5 -> 125 | H212: =RC[-3]*10 -> 250 | I212: 玉帝日嫦娥
A213: 211 | B213: 遇到上帝的 | C213: =R[-1]C+1 -> 211 | D213: 上帝死了 | E213: 26 | F213: =R[-1]C -> 5 | G213: =RC[-2]*5 -> 130 | H213: =RC[-3]*10 -> 260 | I213: 玉帝日嫦娥
A214: 212 | B214: 遇到上帝的 | C214: =R[-1]C+1 -> 212 | D214: 上帝死了 | E214: 26 | F214: =R[-1]C -> 5 | G214: =RC[-2]*5 -> 130 | H214: =RC[-3]*10 -> 260 | I214: 玉帝日嫦娥
A215: 213 | B215: 遇到上帝的 | C215: =R[-1]C+1 -> 213 | D215: 上帝死了 | E215: 26 | F215: =R[-1]C -> 5 | G215: =RC[-2]*5 -> 130 | H215: =RC[-3]*10 -> 260 | I215: 玉帝日嫦娥
A216: 214 | B216: 遇到上帝的 | C216: =R[-1]C+1 -> 214 | D216: 上帝死了 | E216: 26 | F216: =R[-1]C -> 5 | G216: =RC[-2]*5 -> 130 | H216: =RC[-3]*10 -> 260 | I216: 玉帝日嫦娥
A217: 215 | B217: 遇到上帝的 | C217: =R[-1]C+1 -> 215 | D217: 上帝死了 | E217: 26 | F217: =R[-1]C -> 5 | G217: =RC[-2]*5 -> 130 | H217: =RC[-3]*10 -> 260 | I217: 玉帝日嫦娥
A218: 216 | B218: 遇到上帝的 | C218: =R[-1]C+1 -> 216 | D218: 上帝死了 | E218: 26 | F218: =R[-1]C -> 5 | G218: =RC[-2]*5 -> 130 | H218: =RC[-3]*10 -> 260 | I218: 玉帝日嫦娥
A219: 217 | B219: 遇到上帝的 | C219: =R[-1]C+1 -> 217 | D219: 上帝死了 | E219: 26 | F219: =R[-1]C -> 5 | G219: =RC[-2]*5 -> 130 | H219: =RC[-3]*10 -> 260 | I219: 玉帝日嫦娥
A220: 218 | B220: 遇到上帝的 | C220: =R[-1]C+1 -> 218 | D220: 上帝死了 | E220: 26 | F220: =R[-1]C -> 5 | G220: =RC[-2]*5 -> 130 | H220: =RC[-3]*10 -> 260 | I220: 玉帝日嫦娥
A221: 219 | B221: 遇到上帝的 | C221: =R[-1]C+1 -> 219 | D221: 上帝死了 | E221: 26 | F221: =R[-1]C -> 5 | G221: =RC[-2]*5 -> 130 | H221: =RC[-3]*10 -> 260 | I221: 玉帝日嫦娥
A222: 220 | B222: 遇到上帝的 | C222: =R[-1]C+1 -> 220 | D222: 上帝死了 | E222: 26 | F222: =R[-1]C -> 5 | G222: =RC[-2]*5 -> 130 | H222: =RC[-3]*10 -> 260 | I222: 玉帝日嫦娥
A223: 221 | B223: 遇到上帝的 | C223: =R[-1]C+1 -> 221 | D223: 上帝死了 | E223: 27 | F223: =R[-1]C -> 5 | G223: =RC[-2]*5 -> 135 | H223: =RC[-3]*10 -> 270 | I223: 玉帝日嫦娥
A224: 222 | B224: 遇到上帝的 | C224: =R[-1]C+1 -> 222 | D224: 上帝死了 | E224: 27 | F224: =R[-1]C -> 5 | G224: =RC[-2]*5 -> 135 | H224: =RC[-3]*10 -> 270 | I224: 玉帝日嫦娥
A225: 223 | B225: 遇到上帝的 | C225: =R[-1]C+1 -> 223 | D225: 上帝死了 | E225: 27 | F225: =R[-1]C -> 5 | G225: =RC[-2]*5 -> 135 | H225: =RC[-3]*10 -> 270 | I225: 玉帝日嫦娥
A226: 224 | B226: 遇到上帝的 | C226: =R[-1]C+1 -> 224 | D226: 上帝死了 | E226: 27 | F226: =R[-1]C -> 5 | G226: =RC[-2]*5 -> 135 | H226: =RC[-3]*10 -> 270 | I226: 玉帝日嫦娥
A227: 225 | B227: 遇到上帝的 | C227: =R[-1]C+1 -> 225 | D227: 上帝死了 | E227: 27 | F227: =R[-1]C -> 5 | G227: =RC[-2]*5 -> 135 | H227: =RC[-3]*10 -> 270 | I227: 玉帝日嫦娥
A228: 226 | B228: 遇到上帝的 | C228: =R[-1]C+1 -> 226 | D228: 上帝死了 | E228: 27 | F228: =R[-1]C -> 5 | G228: =RC[-2]*5 -> 135 | H228: =RC[-3]*10 -> 270 | I228: 玉帝日嫦娥
A229: 227 | B229: 遇到上帝的 | C229: =R[-1]C+1 -> 227 | D229: 上帝死了 | E229: 27 | F229: =R[-1]C -> 5 | G229: =RC[-2]*5 -> 135 | H229: =RC[-3]*10 -> 270 | I229: 玉帝日嫦娥
A230: 228 | B230: 遇到上帝的 | C230: =R[-1]C+1 -> 228 | D230: 上帝死了 | E230: 27 | F230: =R[-1]C -> 5 | G230: =RC[-2]*5 -> 135 | H230: =RC[-3]*10 -> 270 | I230: 玉帝日嫦娥
A231: 229 | B231: 遇到上帝的 | C231: =R[-1]C+1 -> 229 | D231: 上帝死了 | E231: 27 | F231: =R[-1]C -> 5 | G231: =RC[-2]*5 -> 135 | H231: =RC[-3]*10 -> 270 | I231: 玉帝日嫦娥
A232: 230 | B232: 遇到上帝的 | C232: =R[-1]C+1 -> 230 | D232: 上帝死了 | E232: 27 | F232: =R[-1]C -> 5 | G232: =RC[-2]*5 -> 135 | H232: =RC[-3]*10 -> 270 | I232: 玉帝日嫦娥
A233: 231 | B233: 遇到上帝的 | C233: =R[-1]C+1 -> 231 | D233: 上帝死了 | E233: 28 | F233: =R[-1]C -> 5 | G233: =RC[-2]*5 -> 140 | H233: =RC[-3]*10 -> 280 | I233: 玉帝日嫦娥
A234: 232 | B234: 遇到上帝的 | C234: =R[-1]C+1 -> 232 | D234: 上帝死了 | E234: 28 | F234: =R[-1]C -> 5 | G234: =RC[-2]*5 -> 140 | H234: =RC[-3]*10 -> 280 | I234: 玉帝日嫦娥
A235: 233 | B235: 遇到上帝的 | C235: =R[-1]C+1 -> 233 | D235: 上帝死了 | E235: 28 | F235: =R[-1]C -> 5 | G235: =RC[-2]*5 -> 140 | H235: =RC[-3]*10 -> 280 | I235: 玉帝日嫦娥
A236: 234 | B236: 遇到上帝的 | C236: =R[-1]C+1 -> 234 | D236: 上帝死了 | E236: 28 | F236: =R[-1]C -> 5 | G236: =RC[-2]*5 -> 140 | H236: =RC[-3]*10 -> 280 | I236: 玉帝日嫦娥
A237: 235 | B237: 遇到上帝的 | C237: =R[-1]C+1 -> 235 | D237: 上帝死了 | E237: 28 | F237: =R[-1]C -> 5 | G237: =RC[-2]*5 -> 140 | H237: =RC[-3]*10 -> 280 | I237: 玉帝日嫦娥
A238: 236 | B238: 遇到上帝的 | C238: =R[-1]C+1 -> 236 | D238: 上帝死了 | E238: 28 | F238: =R[-1]C -> 5 | G238: =RC[-2]*5 -> 140 | H238: =RC[-3]*10 -> 280 | I238: 玉帝日嫦娥
A239: 237 | B239: 遇到上帝的 | C239: =R[-1]C+1 -> 237 | D239: 上帝死了 | E239: 28 | F239: =R[-1]C -> 5 | G239: =RC[-2]*5 -> 140 | H239: =RC[-3]*10 -> 280 | I239: 玉帝日嫦娥
A240: 238 | B240: 遇到上帝的 | C240: =R[-1]C+1 -> 238 | D240: 上帝死了 | E240: 28 | F240: =R[-1]C -> 5 | G240: =RC[-2]*5 -> 140 | H240: =RC[-3]*10 -> 280 | I240: 玉帝日嫦娥
A241: 239 | B241: 遇到上帝的 | C241: =R[-1]C+1 -> 239 | D241: 上帝死了 | E241: 28 | F241: =R[-1]C -> 5 | G241: =RC[-2]*5 -> 140 | H241: =RC[-3]*10 -> 280 | I241: 玉帝日嫦娥
A242: 240 | B242: 遇到上帝的 | C242: =R[-1]C+1 -> 240 | D242: 上帝死了 | E242: 28 | F242: =R[-1]C -> 5 | G242: =RC[-2]*5 -> 140 | H242: =RC[-3]*10 -> 280 | I242: 玉帝日嫦娥
A243: 241 | B243: 遇到上帝的 | C243: =R[-1]C+1 -> 241 | D243: 上帝死了 | E243: 29 | F243: =R[-1]C -> 5 | G243: =RC[-2]*5 -> 145 | H243: =RC[-3]*10 -> 290 | I243: 玉帝日嫦娥
A244: 242 | B244: 遇到上帝的 | C244: =R[-1]C+1 -> 242 | D244: 上帝死了 | E244: 29 | F244: =R[-1]C -> 5 | G244: =RC[-2]*5 -> 145 | H244: =RC[-3]*10 -> 290 | I244: 玉帝日嫦娥
A245: 243 | B245: 遇到上帝的 | C245: =R[-1]C+1 -> 243 | D245: 上帝死了 | E245: 29 | F245: =R[-1]C -> 5 | G245: =RC[-2]*5 -> 145 | H245: =RC[-3]*10 -> 290 | I245: 玉帝日嫦娥
A246: 244 | B246: 遇到上帝的 | C246: =R[-1]C+1 -> 244 | D246: 上帝死了 | E246: 29 | F246: =R[-1]C -> 5 | G246: =RC[-2]*5 -> 145 | H246: =RC[-3]*10 -> 290 | I246: 玉帝日嫦娥
A247: 245 | B247: 遇到上帝的 | C247: =R[-1]C+1 -> 245 | D247: 上帝死了 | E247: 29 | F247: =R[-1]C -> 5 | G247: =RC[-2]*5 -> 145 | H247: =RC[-3]*10 -> 290 | I247: 玉帝日嫦娥
A248: 246 | B248: 遇到上帝的 | C248: =R[-1]C+1 -> 246 | D248: 上帝死了 | E248: 29 | F248: =R[-1]C -> 5 | G248: =RC[-2]*5 -> 145 | H248: =RC[-3]*10 -> 290 | I248: 玉帝日嫦娥
A249: 247 | B249: 遇到上帝的 | C249: =R[-1]C+1 -> 247 | D249: 上帝死了 | E249: 29 | F249: =R[-1]C -> 5 | G249: =RC[-2]*5 -> 145 | H249: =RC[-3]*10 -> 290 | I249: 玉帝日嫦娥
A250: 248 | B250: 遇到上帝的 | C250: =R[-1]C+1 -> 248 | D250: 上帝死了 | E250: 29 | F250: =R[-1]C -> 5 | G250: =RC[-2]*5 -> 145 | H250: =RC[-3]*10 -> 290 | I250: 玉帝日嫦娥
A251: 249 | B251: 遇到上帝的 | C251: =R[-1]C+1 -> 249 | D251: 上帝死了 | E251: 29 | F251: =R[-1]C -> 5 | G251: =RC[-2]*5 -> 145 | H251: =RC[-3]*10 -> 290 | I251: 玉帝日嫦娥
A252: 250 | B252: 遇到上帝的 | C252: =R[-1]C+1 -> 250 | D252: 上帝死了 | E252: 29 | F252: =R[-1]C -> 5 | G252: =RC[-2]*5 -> 145 | H252: =RC[-3]*10 -> 290 | I252: 玉帝日嫦娥
A253: 251 | B253: 遇到上帝的 | C253: =R[-1]C+1 -> 251 | D253: 上帝死了 | E253: 30 | F253: =R[-1]C -> 5 | G253: =RC[-2]*5 -> 150 | H253: =RC[-3]*10 -> 300 | I253: 玉帝日嫦娥
A254: 252 | B254: 遇到上帝的 | C254: =R[-1]C+1 -> 252 | D254: 上帝死了 | E254: 30 | F254: =R[-1]C -> 5 | G254: =RC[-2]*5 -> 150 | H254: =RC[-3]*10 -> 300 | I254: 玉帝日嫦娥
A255: 253 | B255: 遇到上帝的 | C255: =R[-1]C+1 -> 253 | D255: 上帝死了 | E255: 30 | F255: =R[-1]C -> 5 | G255: =RC[-2]*5 -> 150 | H255: =RC[-3]*10 -> 300 | I255: 玉帝日嫦娥
A256: 254 | B256: 遇到上帝的 | C256: =R[-1]C+1 -> 254 | D256: 上帝死了 | E256: 30 | F256: =R[-1]C -> 5 | G256: =RC[-2]*5 -> 150 | H256: =RC[-3]*10 -> 300 | I256: 玉帝日嫦娥
A257: 255 | B257: 遇到上帝的 | C257: =R[-1]C+1 -> 255 | D257: 上帝死了 | E257: 30 | F257: =R[-1]C -> 5 | G257: =RC[-2]*5 -> 150 | H257: =RC[-3]*10 -> 300 | I257: 玉帝日嫦娥
A258: 256 | B258: 遇到上帝的 | C258: =R[-1]C+1 -> 256 | D258: 上帝死了 | E258: 30 | F258: =R[-1]C -> 5 | G258: =RC[-2]*5 -> 150 | H258: =RC[-3]*10 -> 300 | I258: 玉帝日嫦娥
A259: 257 | B259: 遇到上帝的 | C259: =R[-1]C+1 -> 257 | D259: 上帝死了 | E259: 30 | F259: =R[-1]C -> 5 | G259: =RC[-2]*5 -> 150 | H259: =RC[-3]*10 -> 300 | I259: 玉帝日嫦娥
A260: 258 | B260: 遇到上帝的 | C260: =R[-1]C+1 -> 258 | D260: 上帝死了 | E260: 30 | F260: =R[-1]C -> 5 | G260: =RC[-2]*5 -> 150 | H260: =RC[-3]*10 -> 300 | I260: 玉帝日嫦娥
A261: 259 | B261: 遇到上帝的 | C261: =R[-1]C+1 -> 259 | D261: 上帝死了 | E261: 30 | F261: =R[-1]C -> 5 | G261: =RC[-2]*5 -> 150 | H261: =RC[-3]*10 -> 300 | I261: 玉帝日嫦娥
A262: 260 | B262: 遇到上帝的 | C262: =R[-1]C+1 -> 260 | D262: 上帝死了 | E262: 30 | F262: =R[-1]C -> 5 | G262: =RC[-2]*5 -> 150 | H262: =RC[-3]*10 -> 300 | I262: 玉帝日嫦娥
A263: 261 | B263: 遇到上帝的 | C263: =R[-1]C+1 -> 261 | D263: 上帝死了 | E263: 31 | F263: =R[-1]C -> 5 | G263: =RC[-2]*5 -> 155 | H263: =RC[-3]*10 -> 310 | I263: 玉帝日嫦娥
A264: 262 | B264: 遇到上帝的 | C264: =R[-1]C+1 -> 262 | D264: 上帝死了 | E264: 31 | F264: =R[-1]C -> 5 | G264: =RC[-2]*5 -> 155 | H264: =RC[-3]*10 -> 310 | I264: 玉帝日嫦娥
A265: 263 | B265: 遇到上帝的 | C265: =R[-1]C+1 -> 263 | D265: 上帝死了 | E265: 31 | F265: =R[-1]C -> 5 | G265: =RC[-2]*5 -> 155 | H265: =RC[-3]*10 -> 310 | I265: 玉帝日嫦娥
A266: 264 | B266: 遇到上帝的 | C266: =R[-1]C+1 -> 264 | D266: 上帝死了 | E266: 31 | F266: =R[-1]C -> 5 | G266: =RC[-2]*5 -> 155 | H266: =RC[-3]*10 -> 310 | I266: 玉帝日嫦娥
A267: 265 | B267: 遇到上帝的 | C267: =R[-1]C+1 -> 265 | D267: 上帝死了 | E267: 31 | F267: =R[-1]C -> 5 | G267: =RC[-2]*5 -> 155 | H267: =RC[-3]*10 -> 310 | I267: 玉帝日嫦娥
A268: 266 | B268: 遇到上帝的 | C268: =R[-1]C+1 -> 266 | D268: 上帝死了 | E268: 31 | F268: =R[-1]C -> 5 | G268: =RC[-2]*5 -> 155 | H268: =RC[-3]*10 -> 310 | I268: 玉帝日嫦娥
A269: 267 | B269: 遇到上帝的 | C269: =R[-1]C+1 -> 267 | D269: 上帝死了 | E269: 31 | F269: =R[-1]C -> 5 | G269: =RC[-2]*5 -> 155 | H269: =RC[-3]*10 -> 310 | I269: 玉帝日嫦娥
A270: 268 | B270: 遇到上帝的 | C270: =R[-1]C+1 -> 268 | D270: 上帝死了 | E270: 31 | F270: =R[-1]C -> 5 | G270: =RC[-2]*5 -> 155 | H270: =RC[-3]*10 -> 310 | I270: 玉帝日嫦娥
A271: 269 | B271: 遇到上帝的 | C271: =R[-1]C+1 -> 269 | D271: 上帝死了 | E271: 31 | F271: =R[-1]C -> 5 | G271: =RC[-2]*5 -> 155 | H271: =RC[-3]*10 -> 310 | I271: 玉帝日嫦娥
A272: 270 | B272: 遇到上帝的 | C272: =R[-1]C+1 -> 270 | D272: 上帝死了 | E272: 31 | F272: =R[-1]C -> 5 | G272: =RC[-2]*5 -> 155 | H272: =RC[-3]*10 -> 310 | I272: 玉帝日嫦娥
A273: 271 | B273: 遇到上帝的 | C273: =R[-1]C+1 -> 271 | D273: 上帝死了 | E273: 32 | F273: =R[-1]C -> 5 | G273: =RC[-2]*5 -> 160 | H273: =RC[-3]*10 -> 320 | I273: 玉帝日嫦娥
A274: 272 | B274: 遇到上帝的 | C274: =R[-1]C+1 -> 272 | D274: 上帝死了 | E274: 32 | F274: =R[-1]C -> 5 | G274: =RC[-2]*5 -> 160 | H274: =RC[-3]*10 -> 320 | I274: 玉帝日嫦娥
A275: 273 | B275: 遇到上帝的 | C275: =R[-1]C+1 -> 273 | D275: 上帝死了 | E275: 32 | F275: =R[-1]C -> 5 | G275: =RC[-2]*5 -> 160 | H275: =RC[-3]*10 -> 320 | I275: 玉帝日嫦娥
A276: 274 | B276: 遇到上帝的 | C276: =R[-1]C+1 -> 274 | D276: 上帝死了 | E276: 32 | F276: =R[-1]C -> 5 | G276: =RC[-2]*5 -> 160 | H276: =RC[-3]*10 -> 320 | I276: 玉帝日嫦娥
A277: 275 | B277: 遇到上帝的 | C277: =R[-1]C+1 -> 275 | D277: 上帝死了 | E277: 32 | F277: =R[-1]C -> 5 | G277: =RC[-2]*5 -> 160 | H277: =RC[-3]*10 -> 320 | I277: 玉帝日嫦娥
A278: 276 | B278: 遇到上帝的 | C278: =R[-1]C+1 -> 276 | D278: 上帝死了 | E278: 32 | F278: =R[-1]C -> 5 | G278: =RC[-2]*5 -> 160 | H278: =RC[-3]*10 -> 320 | I278: 玉帝日嫦娥
A279: 277 | B279: 遇到上帝的 | C279: =R[-1]C+1 -> 277 | D279: 上帝死了 | E279: 32 | F279: =R[-1]C -> 5 | G279: =RC[-2]*5 -> 160 | H279: =RC[-3]*10 -> 320 | I279: 玉帝日嫦娥
A280: 278 | B280: 遇到上帝的 | C280: =R[-1]C+1 -> 278 | D280: 上帝死了 | E280: 32 | F280: =R[-1]C -> 5 | G280: =RC[-2]*5 -> 160 | H280: =RC[-3]*10 -> 320 | I280: 玉帝日嫦娥
A281: 279 | B281: 遇到上帝的 | C281: =R[-1]C+1 -> 279 | D281: 上帝死了 | E281: 32 | F281: =R[-1]C -> 5 | G281: =RC[-2]*5 -> 160 | H281: =RC[-3]*10 -> 320 | I281: 玉帝日嫦娥
A282: 280 | B282: 遇到上帝的 | C282: =R[-1]C+1 -> 280 | D282: 上帝死了 | E282: 32 | F282: =R[-1]C -> 5 | G282: =RC[-2]*5 -> 160 | H282: =RC[-3]*10 -> 320 | I282: 玉帝日嫦娥
A283: 281 | B283: 遇到上帝的 | C283: =R[-1]C+1 -> 281 | D283: 上帝死了 | E283: 33 | F283: =R[-1]C -> 5 | G283: =RC[-2]*5 -> 165 | H283: =RC[-3]*10 -> 330 | I283: 玉帝日嫦娥
A284: 282 | B284: 遇到上帝的 | C284: =R[-1]C+1 -> 282 | D284: 上帝死了 | E284: 33 | F284: =R[-1]C -> 5 | G284: =RC[-2]*5 -> 165 | H284: =RC[-3]*10 -> 330 | I284: 玉帝日嫦娥
A285: 283 | B285: 遇到上帝的 | C285: =R[-1]C+1 -> 283 | D285: 上帝死了 | E285: 33 | F285: =R[-1]C -> 5 | G285: =RC[-2]*5 -> 165 | H285: =RC[-3]*10 -> 330 | I285: 玉帝日嫦娥
A286: 284 | B286: 遇到上帝的 | C286: =R[-1]C+1 -> 284 | D286: 上帝死了 | E286: 33 | F286: =R[-1]C -> 5 | G286: =RC[-2]*5 -> 165 | H286: =RC[-3]*10 -> 330 | I286: 玉帝日嫦娥
A287: 285 | B287: 遇到上帝的 | C287: =R[-1]C+1 -> 285 | D287: 上帝死了 | E287: 33 | F287: =R[-1]C -> 5 | G287: =RC[-2]*5 -> 165 | H287: =RC[-3]*10 -> 330 | I287: 玉帝日嫦娥
A288: 286 | B288: 遇到上帝的 | C288: =R[-1]C+1 -> 286 | D288: 上帝死了 | E288: 33 | F288: =R[-1]C -> 5 | G288: =RC[-2]*5 -> 165 | H288: =RC[-3]*10 -> 330 | I288: 玉帝日嫦娥
A289: 287 | B289: 遇到上帝的 | C289: =R[-1]C+1 -> 287 | D289: 上帝死了 | E289: 33 | F289: =R[-1]C -> 5 | G289: =RC[-2]*5 -> 165 | H289: =RC[-3]*10 -> 330 | I289: 玉帝日嫦娥
A290: 288 | B290: 遇到上帝的 | C290: =R[-1]C+1 -> 288 | D290: 上帝死了 | E290: 33 | F290: =R[-1]C -> 5 | G290: =RC[-2]*5 -> 165 | H290: =RC[-3]*10 -> 330 | I290: 玉帝日嫦娥
A291: 289 | B291: 遇到上帝的 | C291: =R[-1]C+1 -> 289 | D291: 上帝死了 | E291: 33 | F291: =R[-1]C -> 5 | G291: =RC[-2]*5 -> 165 | H291: =RC[-3]*10 -> 330 | I291: 玉帝日嫦娥
A292: 290 | B292: 遇到上帝的 | C292: =R[-1]C+1 -> 290 | D292: 上帝死了 | E292: 33 | F292: =R[-1]C -> 5 | G292: =RC[-2]*5 -> 165 | H292: =RC[-3]*10 -> 330 | I292: 玉帝日嫦娥
A293: 291 | B293: 遇到上帝的 | C293: =R[-1]C+1 -> 291 | D293: 上帝死了 | E293: 34 | F293: =R[-1]C -> 5 | G293: =RC[-2]*5 -> 170 | H293: =RC[-3]*10 -> 340 | I293: 玉帝日嫦娥
A294: 292 | B294: 遇到上帝的 | C294: =R[-1]C+1 -> 292 | D294: 上帝死了 | E294: 34 | F294: =R[-1]C -> 5 | G294: =RC[-2]*5 -> 170 | H294: =RC[-3]*10 -> 340 | I294: 玉帝日嫦娥
A295: 293 | B295: 遇到上帝的 | C295: =R[-1]C+1 -> 293 | D295: 上帝死了 | E295: 34 | F295: =R[-1]C -> 5 | G295: =RC[-2]*5 -> 170 | H295: =RC[-3]*10 -> 340 | I295: 玉帝日嫦娥
A296: 294 | B296: 遇到上帝的 | C296: =R[-1]C+1 -> 294 | D296: 上帝死了 | E296: 34 | F296: =R[-1]C -> 5 | G296: =RC[-2]*5 -> 170 | H296: =RC[-3]*10 -> 340 | I296: 玉帝日嫦娥
A297: 295 | B297: 遇到上帝的 | C297: =R[-1]C+1 -> 295 | D297: 上帝死了 | E297: 34 | F297: =R[-1]C -> 5 | G297: =RC[-2]*5 -> 170 | H297: =RC[-3]*10 -> 340 | I297: 玉帝日嫦娥
A298: 296 | B298: 遇到上帝的 | C298: =R[-1]C+1 -> 296 | D298: 上帝死了 | E298: 34 | F298: =R[-1]C -> 5 | G298: =RC[-2]*5 -> 170 | H298: =RC[-3]*10 -> 340 | I298: 玉帝日嫦娥
A299: 297 | B299: 遇到上帝的 | C299: =R[-1]C+1 -> 297 | D299: 上帝死了 | E299: 34 | F299: =R[-1]C -> 5 | G299: =RC[-2]*5 -> 170 | H299: =RC[-3]*10 -> 340 | I299: 玉帝日嫦娥
A300: 298 | B300: 遇到上帝的 | C300: =R[-1]C+1 -> 298 | D300: 上帝死了 | E300: 34 | F300: =R[-1]C -> 5 | G300: =RC[-2]*5 -> 170 | H300: =RC[-3]*10 -> 340 | I300: 玉帝日嫦娥
A301: 299 | B301: 遇到上帝的 | C301: =R[-1]C+1 -> 299 | D301: 上帝死了 | E301: 34 | F301: =R[-1]C -> 5 | G301: =RC[-2]*5 -> 170 | H301: =RC[-3]*10 -> 340 | I301: 玉帝日嫦娥
A302: 300 | B302: 遇到上帝的 | C302: =R[-1]C+1 -> 300 | D302: 上帝死了 | E302: 34 | F302: =R[-1]C -> 5 | G302: =RC[-2]*5 -> 170 | H302: =RC[-3]*10 -> 340 | I302: 玉帝日嫦娥
A303: 301 | B303: 遇到上帝的 | C303: =R[-1]C+1 -> 301 | D303: 上帝死了 | E303: 35 | F303: =R[-1]C -> 5 | G303: =RC[-2]*5 -> 175 | H303: =RC[-3]*10 -> 350 | I303: 玉帝日嫦娥
A304: 302 | B304: 遇到上帝的 | C304: =R[-1]C+1 -> 302 | D304: 上帝死了 | E304: 35 | F304: =R[-1]C -> 5 | G304: =RC[-2]*5 -> 175 | H304: =RC[-3]*10 -> 350 | I304: 玉帝日嫦娥
A305: 303 | B305: 遇到上帝的 | C305: =R[-1]C+1 -> 303 | D305: 上帝死了 | E305: 35 | F305: =R[-1]C -> 5 | G305: =RC[-2]*5 -> 175 | H305: =RC[-3]*10 -> 350 | I305: 玉帝日嫦娥
A306: 304 | B306: 遇到上帝的 | C306: =R[-1]C+1 -> 304 | D306: 上帝死了 | E306: 35 | F306: =R[-1]C -> 5 | G306: =RC[-2]*5 -> 175 | H306: =RC[-3]*10 -> 350 | I306: 玉帝日嫦娥
A307: 305 | B307: 遇到上帝的 | C307: =R[-1]C+1 -> 305 | D307: 上帝死了 | E307: 35 | F307: =R[-1]C -> 5 | G307: =RC[-2]*5 -> 175 | H307: =RC[-3]*10 -> 350 | I307: 玉帝日嫦娥
A308: 306 | B308: 遇到上帝的 | C308: =R[-1]C+1 -> 306 | D308: 上帝死了 | E308: 35 | F308: =R[-1]C -> 5 | G308: =RC[-2]*5 -> 175 | H308: =RC[-3]*10 -> 350 | I308: 玉帝日嫦娥
A309: 307 | B309: 遇到上帝的 | C309: =R[-1]C+1 -> 307 | D309: 上帝死了 | E309: 35 | F309: =R[-1]C -> 5 | G309: =RC[-2]*5 -> 175 | H309: =RC[-3]*10 -> 350 | I309: 玉帝日嫦娥
A310: 308 | B310: 遇到上帝的 | C310: =R[-1]C+1 -> 308 | D310: 上帝死了 | E310: 35 | F310: =R[-1]C -> 5 | G310: =RC[-2]*5 -> 175 | H310: =RC[-3]*10 -> 350 | I310: 玉帝日嫦娥
A311: 309 | B311: 遇到上帝的 | C311: =R[-1]C+1 -> 309 | D311: 上帝死了 | E311: 35 | F311: =R[-1]C -> 5 | G311: =RC[-2]*5 -> 175 | H311: =RC[-3]*10 -> 350 | I311: 玉帝日嫦娥
A312: 310 | B312: 遇到上帝的 | C312: =R[-1]C+1 -> 310 | D312: 上帝死了 | E312: 35 | F312: =R[-1]C -> 5 | G312: =RC[-2]*5 -> 175 | H312: =RC[-3]*10 -> 350 | I312: 玉帝日嫦娥
A313: 311 | B313: 遇到上帝的 | C313: =R[-1]C+1 -> 311 | D313: 上帝死了 | E313: 36 | F313: =R[-1]C -> 5 | G313: =RC[-2]*5 -> 180 | H313: =RC[-3]*10 -> 360 | I313: 玉帝日嫦娥
A314: 312 | B314: 遇到上帝的 | C314: =R[-1]C+1 -> 312 | D314: 上帝死了 | E314: 36 | F314: =R[-1]C -> 5 | G314: =RC[-2]*5 -> 180 | H314: =RC[-3]*10 -> 360 | I314: 玉帝日嫦娥
A315: 313 | B315: 遇到上帝的 | C315: =R[-1]C+1 -> 313 | D315: 上帝死了 | E315: 36 | F315: =R[-1]C -> 5 | G315: =RC[-2]*5 -> 180 | H315: =RC[-3]*10 -> 360 | I315: 玉帝日嫦娥
A316: 314 | B316: 遇到上帝的 | C316: =R[-1]C+1 -> 314 | D316: 上帝死了 | E316: 36 | F316: =R[-1]C -> 5 | G316: =RC[-2]*5 -> 180 | H316: =RC[-3]*10 -> 360 | I316: 玉帝日嫦娥
A317: 315 | B317: 遇到上帝的 | C317: =R[-1]C+1 -> 315 | D317: 上帝死了 | E317: 36 | F317: =R[-1]C -> 5 | G317: =RC[-2]*5 -> 180 | H317: =RC[-3]*10 -> 360 | I317: 玉帝日嫦娥
A318: 316 | B318: 遇到上帝的 | C318: =R[-1]C+1 -> 316 | D318: 上帝死了 | E318: 36 | F318: =R[-1]C -> 5 | G318: =RC[-2]*5 -> 180 | H318: =RC[-3]*10 -> 360 | I318: 玉帝日嫦娥
A319: 317 | B319: 遇到上帝的 | C319: =R[-1]C+1 -> 317 | D319: 上帝死了 | E319: 36 | F319: =R[-1]C -> 5 | G319: =RC[-2]*5 -> 180 | H319: =RC[-3]*10 -> 360 | I319: 玉帝日嫦娥
A320: 318 | B320: 遇到上帝的 | C320: =R[-1]C+1 -> 318 | D320: 上帝死了 | E320: 36 | F320: =R[-1]C -> 5 | G320: =RC[-2]*5 -> 180 | H320: =RC[-3]*10 -> 360 | I320: 玉帝日嫦娥
A321: 319 | B321: 遇到上帝的 | C321: =R[-1]C+1 -> 319 | D321: 上帝死了 | E321: 36 | F321: =R[-1]C -> 5 | G321: =RC[-2]*5 -> 180 | H321: =RC[-3]*10 -> 360 | I321: 玉帝日嫦娥
A322: 320 | B322: 遇到上帝的 | C322: =R[-1]C+1 -> 320 | D322: 上帝死了 | E322: 36 | F322: =R[-1]C -> 5 | G322: =RC[-2]*5 -> 180 | H322: =RC[-3]*10 -> 360 | I322: 玉帝日嫦娥
A323: 321 | B323: 遇到上帝的 | C323: =R[-1]C+1 -> 321 | D323: 上帝死了 | E323: 37 | F323: =R[-1]C -> 5 | G323: =RC[-2]*5 -> 185 | H323: =RC[-3]*10 -> 370 | I323: 玉帝日嫦娥
A324: 322 | B324: 遇到上帝的 | C324: =R[-1]C+1 -> 322 | D324: 上帝死了 | E324: 37 | F324: =R[-1]C -> 5 | G324: =RC[-2]*5 -> 185 | H324: =RC[-3]*10 -> 370 | I324: 玉帝日嫦娥
A325: 323 | B325: 遇到上帝的 | C325: =R[-1]C+1 -> 323 | D325: 上帝死了 | E325: 37 | F325: =R[-1]C -> 5 | G325: =RC[-2]*5 -> 185 | H325: =RC[-3]*10 -> 370 | I325: 玉帝日嫦娥
A326: 324 | B326: 遇到上帝的 | C326: =R[-1]C+1 -> 324 | D326: 上帝死了 | E326: 37 | F326: =R[-1]C -> 5 | G326: =RC[-2]*5 -> 185 | H326: =RC[-3]*10 -> 370 | I326: 玉帝日嫦娥
A327: 325 | B327: 遇到上帝的 | C327: =R[-1]C+1 -> 325 | D327: 上帝死了 | E327: 37 | F327: =R[-1]C -> 5 | G327: =RC[-2]*5 -> 185 | H327: =RC[-3]*10 -> 370 | I327: 玉帝日嫦娥
A328: 326 | B328: 遇到上帝的 | C328: =R[-1]C+1 -> 326 | D328: 上帝死了 | E328: 37 | F328: =R[-1]C -> 5 | G328: =RC[-2]*5 -> 185 | H328: =RC[-3]*10 -> 370 | I328: 玉帝日嫦娥
A329: 327 | B329: 遇到上帝的 | C329: =R[-1]C+1 -> 327 | D329: 上帝死了 | E329: 37 | F329: =R[-1]C -> 5 | G329: =RC[-2]*5 -> 185 | H329: =RC[-3]*10 -> 370 | I329: 玉帝日嫦娥
A330: 328 | B330: 遇到上帝的 | C330: =R[-1]C+1 -> 328 | D330: 上帝死了 | E330: 37 | F330: =R[-1]C -> 5 | G330: =RC[-2]*5 -> 185 | H330: =RC[-3]*10 -> 370 | I330: 玉帝日嫦娥
A331: 329 | B331: 遇到上帝的 | C331: =R[-1]C+1 -> 329 | D331: 上帝死了 | E331: 37 | F331: =R[-1]C -> 5 | G331: =RC[-2]*5 -> 185 | H331: =RC[-3]*10 -> 370 | I331: 玉帝日嫦娥
A332: 330 | B332: 遇到上帝的 | C332: =R[-1]C+1 -> 330 | D332: 上帝死了 | E332: 37 | F332: =R[-1]C -> 5 | G332: =RC[-2]*5 -> 185 | H332: =RC[-3]*10 -> 370 | I332: 玉帝日嫦娥
A333: 331 | B333: 遇到上帝的 | C333: =R[-1]C+1 -> 331 | D333: 上帝死了 | E333: 38 | F333: =R[-1]C -> 5 | G333: =RC[-2]*5 -> 190 | H333: =RC[-3]*10 -> 380 | I333: 玉帝日嫦娥
A334: 332 | B334: 遇到上帝的 | C334: =R[-1]C+1 -> 332 | D334: 上帝死了 | E334: 38 | F334: =R[-1]C -> 5 | G334: =RC[-2]*5 -> 190 | H334: =RC[-3]*10 -> 380 | I334: 玉帝日嫦娥
A335: 333 | B335: 遇到上帝的 | C335: =R[-1]C+1 -> 333 | D335: 上帝死了 | E335: 38 | F335: =R[-1]C -> 5 | G335: =RC[-2]*5 -> 190 | H335: =RC[-3]*10 -> 380 | I335: 玉帝日嫦娥
A336: 334 | B336: 遇到上帝的 | C336: =R[-1]C+1 -> 334 | D336: 上帝死了 | E336: 38 | F336: =R[-1]C -> 5 | G336: =RC[-2]*5 -> 190 | H336: =RC[-3]*10 -> 380 | I336: 玉帝日嫦娥
A337: 335 | B337: 遇到上帝的 | C337: =R[-1]C+1 -> 335 | D337: 上帝死了 | E337: 38 | F337: =R[-1]C -> 5 | G337: =RC[-2]*5 -> 190 | H337: =RC[-3]*10 -> 380 | I337: 玉帝日嫦娥
A338: 336 | B338: 遇到上帝的 | C338: =R[-1]C+1 -> 336 | D338: 上帝死了 | E338: 38 | F338: =R[-1]C -> 5 | G338: =RC[-2]*5 -> 190 | H338: =RC[-3]*10 -> 380 | I338: 玉帝日嫦娥
A339: 337 | B339: 遇到上帝的 | C339: =R[-1]C+1 -> 337 | D339: 上帝死了 | E339: 38 | F339: =R[-1]C -> 5 | G339: =RC[-2]*5 -> 190 | H339: =RC[-3]*10 -> 380 | I339: 玉帝日嫦娥
A340: 338 | B340: 遇到上帝的 | C340: =R[-1]C+1 -> 338 | D340: 上帝死了 | E340: 38 | F340: =R[-1]C -> 5 | G340: =RC[-2]*5 -> 190 | H340: =RC[-3]*10 -> 380 | I340: 玉帝日嫦娥
A341: 339 | B341: 遇到上帝的 | C341: =R[-1]C+1 -> 339 | D341: 上帝死了 | E341: 38 | F341: =R[-1]C -> 5 | G341: =RC[-2]*5 -> 190 | H341: =RC[-3]*10 -> 380 | I341: 玉帝日嫦娥
A342: 340 | B342: 遇到上帝的 | C342: =R[-1]C+1 -> 340 | D342: 上帝死了 | E342: 38 | F342: =R[-1]C -> 5 | G342: =RC[-2]*5 -> 190 | H342: =RC[-3]*10 -> 380 | I342: 玉帝日嫦娥
A343: 341 | B343: 遇到上帝的 | C343: =R[-1]C+1 -> 341 | D343: 上帝死了 | E343: 39 | F343: =R[-1]C -> 5 | G343: =RC[-2]*5 -> 195 | H343: =RC[-3]*10 -> 390 | I343: 玉帝日嫦娥
A344: 342 | B344: 遇到上帝的 | C344: =R[-1]C+1 -> 342 | D344: 上帝死了 | E344: 39 | F344: =R[-1]C -> 5 | G344: =RC[-2]*5 -> 195 | H344: =RC[-3]*10 -> 390 | I344: 玉帝日嫦娥
A345: 343 | B345: 遇到上帝的 | C345: =R[-1]C+1 -> 343 | D345: 上帝死了 | E345: 39 | F345: =R[-1]C -> 5 | G345: =RC[-2]*5 -> 195 | H345: =RC[-3]*10 -> 390 | I345: 玉帝日嫦娥
A346: 344 | B346: 遇到上帝的 | C346: =R[-1]C+1 -> 344 | D346: 上帝死了 | E346: 39 | F346: =R[-1]C -> 5 | G346: =RC[-2]*5 -> 195 | H346: =RC[-3]*10 -> 390 | I346: 玉帝日嫦娥
A347: 345 | B347: 遇到上帝的 | C347: =R[-1]C+1 -> 345 | D347: 上帝死了 | E347: 39 | F347: =R[-1]C -> 5 | G347: =RC[-2]*5 -> 195 | H347: =RC[-3]*10 -> 390 | I347: 玉帝日嫦娥
A348: 346 | B348: 遇到上帝的 | C348: =R[-1]C+1 -> 346 | D348: 上帝死了 | E348: 39 | F348: =R[-1]C -> 5 | G348: =RC[-2]*5 -> 195 | H348: =RC[-3]*10 -> 390 | I348: 玉帝日嫦娥
A349: 347 | B349: 遇到上帝的 | C349: =R[-1]C+1 -> 347 | D349: 上帝死了 | E349: 39 | F349: =R[-1]C -> 5 | G349: =RC[-2]*5 -> 195 | H349: =RC[-3]*10 -> 390 | I349: 玉帝日嫦娥
A350: 348 | B350: 遇到上帝的 | C350: =R[-1]C+1 -> 348 | D350: 上帝死了 | E350: 39 | F350: =R[-1]C -> 5 | G350: =RC[-2]*5 -> 195 | H350: =RC[-3]*10 -> 390 | I350: 玉帝日嫦娥
A351: 349 | B351: 遇到上帝的 | C351: =R[-1]C+1 -> 349 | D351: 上帝死了 | E351: 39 | F351: =R[-1]C -> 5 | G351: =RC[-2]*5 -> 195 | H351: =RC[-3]*10 -> 390 | I351: 玉帝日嫦娥
A352: 350 | B352: 遇到上帝的 | C352: =R[-1]C+1 -> 350 | D352: 上帝死了 | E352: 39 | F352: =R[-1]C -> 5 | G352: =RC[-2]*5 -> 195 | H352: =RC[-3]*10 -> 390 | I352: 玉帝日嫦娥
A353: 351 | B353: 遇到上帝的 | C353: =R[-1]C+1 -> 351 | D353: 上帝死了 | E353: 40 | F353: =R[-1]C -> 5 | G353: =RC[-2]*5 -> 200 | H353: =RC[-3]*10 -> 400 | I353: 玉帝日嫦娥
A354: 352 | B354: 遇到上帝的 | C354: =R[-1]C+1 -> 352 | D354: 上帝死了 | E354: 40 | F354: =R[-1]C -> 5 | G354: =RC[-2]*5 -> 200 | H354: =RC[-3]*10 -> 400 | I354: 玉帝日嫦娥
A355: 353 | B355: 遇到上帝的 | C355: =R[-1]C+1 -> 353 | D355: 上帝死了 | E355: 40 | F355: =R[-1]C -> 5 | G355: =RC[-2]*5 -> 200 | H355: =RC[-3]*10 -> 400 | I355: 玉帝日嫦娥
A356: 354 | B356: 遇到上帝的 | C356: =R[-1]C+1 -> 354 | D356: 上帝死了 | E356: 40 | F356: =R[-1]C -> 5 | G356: =RC[-2]*5 -> 200 | H356: =RC[-3]*10 -> 400 | I356: 玉帝日嫦娥
A357: 355 | B357: 遇到上帝的 | C357: =R[-1]C+1 -> 355 | D357: 上帝死了 | E357: 40 | F357: =R[-1]C -> 5 | G357: =RC[-2]*5 -> 200 | H357: =RC[-3]*10 -> 400 | I357: 玉帝日嫦娥
A358: 356 | B358: 遇到上帝的 | C358: =R[-1]C+1 -> 356 | D358: 上帝死了 | E358: 40 | F358: =R[-1]C -> 5 | G358: =RC[-2]*5 -> 200 | H358: =RC[-3]*10 -> 400 | I358: 玉帝日嫦娥
A359: 357 | B359: 遇到上帝的 | C359: =R[-1]C+1 -> 357 | D359: 上帝死了 | E359: 40 | F359: =R[-1]C -> 5 | G359: =RC[-2]*5 -> 200 | H359: =RC[-3]*10 -> 400 | I359: 玉帝日嫦娥
A360: 358 | B360: 遇到上帝的 | C360: =R[-1]C+1 -> 358 | D360: 上帝死了 | E360: 40 | F360: =R[-1]C -> 5 | G360: =RC[-2]*5 -> 200 | H360: =RC[-3]*10 -> 400 | I360: 玉帝日嫦娥
A361: 359 | B361: 遇到上帝的 | C361: =R[-1]C+1 -> 359 | D361: 上帝死了 | E361: 40 | F361: =R[-1]C -> 5 | G361: =RC[-2]*5 -> 200 | H361: =RC[-3]*10 -> 400 | I361: 玉帝日嫦娥
A362: 360 | B362: 遇到上帝的 | C362: =R[-1]C+1 -> 360 | D362: 上帝死了 | E362: 40 | F362: =R[-1]C -> 5 | G362: =RC[-2]*5 -> 200 | H362: =RC[-3]*10 -> 400 | I362: 玉帝日嫦娥
A363: 361 | B363: 遇到上帝的 | C363: =R[-1]C+1 -> 361 | D363: 上帝死了 | E363: 41 | F363: =R[-1]C -> 5 | G363: =RC[-2]*5 -> 205 | H363: =RC[-3]*10 -> 410 | I363: 玉帝日嫦娥
A364: 362 | B364: 遇到上帝的 | C364: =R[-1]C+1 -> 362 | D364: 上帝死了 | E364: 41 | F364: =R[-1]C -> 5 | G364: =RC[-2]*5 -> 205 | H364: =RC[-3]*10 -> 410 | I364: 玉帝日嫦娥
A365: 363 | B365: 遇到上帝的 | C365: =R[-1]C+1 -> 363 | D365: 上帝死了 | E365: 41 | F365: =R[-1]C -> 5 | G365: =RC[-2]*5 -> 205 | H365: =RC[-3]*10 -> 410 | I365: 玉帝日嫦娥
A366: 364 | B366: 遇到上帝的 | C366: =R[-1]C+1 -> 364 | D366: 上帝死了 | E366: 41 | F366: =R[-1]C -> 5 | G366: =RC[-2]*5 -> 205 | H366: =RC[-3]*10 -> 410 | I366: 玉帝日嫦娥
A367: 365 | B367: 遇到上帝的 | C367: =R[-1]C+1 -> 365 | D367: 上帝死了 | E367: 41 | F367: =R[-1]C -> 5 | G367: =RC[-2]*5 -> 205 | H367: =RC[-3]*10 -> 410 | I367: 玉帝日嫦娥
A368: 366 | B368: 遇到上帝的 | C368: =R[-1]C+1 -> 366 | D368: 上帝死了 | E368: 41 | F368: =R[-1]C -> 5 | G368: =RC[-2]*5 -> 205 | H368: =RC[-3]*10 -> 410 | I368: 玉帝日嫦娥
A369: 367 | B369: 遇到上帝的 | C369: =R[-1]C+1 -> 367 | D369: 上帝死了 | E369: 41 | F369: =R[-1]C -> 5 | G369: =RC[-2]*5 -> 205 | H369: =RC[-3]*10 -> 410 | I369: 玉帝日嫦娥
A370: 368 | B370: 遇到上帝的 | C370: =R[-1]C+1 -> 368 | D370: 上帝死了 | E370: 41 | F370: =R[-1]C -> 5 | G370: =RC[-2]*5 -> 205 | H370: =RC[-3]*10 -> 410 | I370: 玉帝日嫦娥
A371: 369 | B371: 遇到上帝的 | C371: =R[-1]C+1 -> 369 | D371: 上帝死了 | E371: 41 | F371: =R[-1]C -> 5 | G371: =RC[-2]*5 -> 205 | H371: =RC[-3]*10 -> 410 | I371: 玉帝日嫦娥
A372: 370 | B372: 遇到上帝的 | C372: =R[-1]C+1 -> 370 | D372: 上帝死了 | E372: 41 | F372: =R[-1]C -> 5 | G372: =RC[-2]*5 -> 205 | H372: =RC[-3]*10 -> 410 | I372: 玉帝日嫦娥
A373: 371 | B373: 遇到上帝的 | C373: =R[-1]C+1 -> 371 | D373: 上帝死了 | E373: 42 | F373: =R[-1]C -> 5 | G373: =RC[-2]*5 -> 210 | H373: =RC[-3]*10 -> 420 | I373: 玉帝日嫦娥
A374: 372 | B374: 遇到上帝的 | C374: =R[-1]C+1 -> 372 | D374: 上帝死了 | E374: 42 | F374: =R[-1]C -> 5 | G374: =RC[-2]*5 -> 210 | H374: =RC[-3]*10 -> 420 | I374: 玉帝日嫦娥
A375: 373 | B375: 遇到上帝的 | C375: =R[-1]C+1 -> 373 | D375: 上帝死了 | E375: 42 | F375: =R[-1]C -> 5 | G375: =RC[-2]*5 -> 210 | H375: =RC[-3]*10 -> 420 | I375: 玉帝日嫦娥
A376: 374 | B376: 遇到上帝的 | C376: =R[-1]C+1 -> 374 | D376: 上帝死了 | E376: 42 | F376: =R[-1]C -> 5 | G376: =RC[-2]*5 -> 210 | H376: =RC[-3]*10 -> 420 | I376: 玉帝日嫦娥
A377: 375 | B377: 遇到上帝的 | C377: =R[-1]C+1 -> 375 | D377: 上帝死了 | E377: 42 | F377: =R[-1]C -> 5 | G377: =RC[-2]*5 -> 210 | H377: =RC[-3]*10 -> 420 | I377: 玉帝日嫦娥
A378: 376 | B378: 遇到上帝的 | C378: =R[-1]C+1 -> 376 | D378: 上帝死了 | E378: 42 | F378: =R[-1]C -> 5 | G378: =RC[-2]*5 -> 210 | H378: =RC[-3]*10 -> 420 | I378: 玉帝日嫦娥
A379: 377 | B379: 遇到上帝的 | C379: =R[-1]C+1 -> 377 | D379: 上帝死了 | E379: 42 | F379: =R[-1]C -> 5 | G379: =RC[-2]*5 -> 210 | H379: =RC[-3]*10 -> 420 | I379: 玉帝日嫦娥
A380: 378 | B380: 遇到上帝的 | C380: =R[-1]C+1 -> 378 | D380: 上帝死了 | E380: 42 | F380: =R[-1]C -> 5 | G380: =RC[-2]*5 -> 210 | H380: =RC[-3]*10 -> 420 | I380: 玉帝日嫦娥
A381: 379 | B381: 遇到上帝的 | C381: =R[-1]C+1 -> 379 | D381: 上帝死了 | E381: 42 | F381: =R[-1]C -> 5 | G381: =RC[-2]*5 -> 210 | H381: =RC[-3]*10 -> 420 | I381: 玉帝日嫦娥
A382: 380 | B382: 遇到上帝的 | C382: =R[-1]C+1 -> 380 | D382: 上帝死了 | E382: 42 | F382: =R[-1]C -> 5 | G382: =RC[-2]*5 -> 210 | H382: =RC[-3]*10 -> 420 | I382: 玉帝日嫦娥
A383: 381 | B383: 遇到上帝的 | C383: =R[-1]C+1 -> 381 | D383: 上帝死了 | E383: 43 | F383: =R[-1]C -> 5 | G383: =RC[-2]*5 -> 215 | H383: =RC[-3]*10 -> 430 | I383: 玉帝日嫦娥
A384: 382 | B384: 遇到上帝的 | C384: =R[-1]C+1 -> 382 | D384: 上帝死了 | E384: 43 | F384: =R[-1]C -> 5 | G384: =RC[-2]*5 -> 215 | H384: =RC[-3]*10 -> 430 | I384: 玉帝日嫦娥
A385: 383 | B385: 遇到上帝的 | C385: =R[-1]C+1 -> 383 | D385: 上帝死了 | E385: 43 | F385: =R[-1]C -> 5 | G385: =RC[-2]*5 -> 215 | H385: =RC[-3]*10 -> 430 | I385: 玉帝日嫦娥
A386: 384 | B386: 遇到上帝的 | C386: =R[-1]C+1 -> 384 | D386: 上帝死了 | E386: 43 | F386: =R[-1]C -> 5 | G386: =RC[-2]*5 -> 215 | H386: =RC[-3]*10 -> 430 | I386: 玉帝日嫦娥
A387: 385 | B387: 遇到上帝的 | C387: =R[-1]C+1 -> 385 | D387: 上帝死了 | E387: 43 | F387: =R[-1]C -> 5 | G387: =RC[-2]*5 -> 215 | H387: =RC[-3]*10 -> 430 | I387: 玉帝日嫦娥
A388: 386 | B388: 遇到上帝的 | C388: =R[-1]C+1 -> 386 | D388: 上帝死了 | E388: 43 | F388: =R[-1]C -> 5 | G388: =RC[-2]*5 -> 215 | H388: =RC[-3]*10 -> 430 | I388: 玉帝日嫦娥
A389: 387 | B389: 遇到上帝的 | C389: =R[-1]C+1 -> 387 | D389: 上帝死了 | E389: 43 | F389: =R[-1]C -> 5 | G389: =RC[-2]*5 -> 215 | H389: =RC[-3]*10 -> 430 | I389: 玉帝日嫦娥
A390: 388 | B390: 遇到上帝的 | C390: =R[-1]C+1 -> 388 | D390: 上帝死了 | E390: 43 | F390: =R[-1]C -> 5 | G390: =RC[-2]*5 -> 215 | H390: =RC[-3]*10 -> 430 | I390: 玉帝日嫦娥
A391: 389 | B391: 遇到上帝的 | C391: =R[-1]C+1 -> 389 | D391: 上帝死了 | E391: 43 | F391: =R[-1]C -> 5 | G391: =RC[-2]*5 -> 215 | H391: =RC[-3]*10 -> 430 | I391: 玉帝日嫦娥
A392: 390 | B392: 遇到上帝的 | C392: =R[-1]C+1 -> 390 | D392: 上帝死了 | E392: 43 | F392: =R[-1]C -> 5 | G392: =RC[-2]*5 -> 215 | H392: =RC[-3]*10 -> 430 | I392: 玉帝日嫦娥
A393: 391 | B393: 遇到上帝的 | C393: =R[-1]C+1 -> 391 | D393: 上帝死了 | E393: 44 | F393: =R[-1]C -> 5 | G393: =RC[-2]*5 -> 220 | H393: =RC[-3]*10 -> 440 | I393: 玉帝日嫦娥
A394: 392 | B394: 遇到上帝的 | C394: =R[-1]C+1 -> 392 | D394: 上帝死了 | E394: 44 | F394: =R[-1]C -> 5 | G394: =RC[-2]*5 -> 220 | H394: =RC[-3]*10 -> 440 | I394: 玉帝日嫦娥
A395: 393 | B395: 遇到上帝的 | C395: =R[-1]C+1 -> 393 | D395: 上帝死了 | E395: 44 | F395: =R[-1]C -> 5 | G395: =RC[-2]*5 -> 220 | H395: =RC[-3]*10 -> 440 | I395: 玉帝日嫦娥
A396: 394 | B396: 遇到上帝的 | C396: =R[-1]C+1 -> 394 | D396: 上帝死了 | E396: 44 | F396: =R[-1]C -> 5 | G396: =RC[-2]*5 -> 220 | H396: =RC[-3]*10 -> 440 | I396: 玉帝日嫦娥
A397: 395 | B397: 遇到上帝的 | C397: =R[-1]C+1 -> 395 | D397: 上帝死了 | E397: 44 | F397: =R[-1]C -> 5 | G397: =RC[-2]*5 -> 220 | H397: =RC[-3]*10 -> 440 | I397: 玉帝日嫦娥
A398: 396 | B398: 遇到上帝的 | C398: =R[-1]C+1 -> 396 | D398: 上帝死了 | E398: 44 | F398: =R[-1]C -> 5 | G398: =RC[-2]*5 -> 220 | H398: =RC[-3]*10 -> 440 | I398: 玉帝日嫦娥
A399: 397 | B399: 遇到上帝的 | C399: =R[-1]C+1 -> 397 | D399: 上帝死了 | E399: 44 | F399: =R[-1]C -> 5 | G399: =RC[-2]*5 -> 220 | H399: =RC[-3]*10 -> 440 | I399: 玉帝日嫦娥
A400: 398 | B400: 遇到上帝的 | C400: =R[-1]C+1 -> 398 | D400: 上帝死了 | E400: 44 | F400: =R[-1]C -> 5 | G400: =RC[-2]*5 -> 220 | H400: =RC[-3]*10 -> 440 | I400: 玉帝日嫦娥
A401: 399 | B401: 遇到上帝的 | C401: =R[-1]C+1 -> 399 | D401: 上帝死了 | E401: 44 | F401: =R[-1]C -> 5 | G401: =RC[-2]*5 -> 220 | H401: =RC[-3]*10 -> 440 | I401: 玉帝日嫦娥
A402: 400 | B402: 遇到上帝的 | C402: =R[-1]C+1 -> 400 | D402: 上帝死了 | E402: 44 | F402: =R[-1]C -> 5 | G402: =RC[-2]*5 -> 220 | H402: =RC[-3]*10 -> 440 | I402: 玉帝日嫦娥
A403: 401 | B403: 遇到上帝的 | C403: =R[-1]C+1 -> 401 | D403: 上帝死了 | E403: 45 | F403: =R[-1]C -> 5 | G403: =RC[-2]*5 -> 225 | H403: =RC[-3]*10 -> 450 | I403: 玉帝日嫦娥
A404: 402 | B404: 遇到上帝的 | C404: =R[-1]C+1 -> 402 | D404: 上帝死了 | E404: 45 | F404: =R[-1]C -> 5 | G404: =RC[-2]*5 -> 225 | H404: =RC[-3]*10 -> 450 | I404: 玉帝日嫦娥
A405: 403 | B405: 遇到上帝的 | C405: =R[-1]C+1 -> 403 | D405: 上帝死了 | E405: 45 | F405: =R[-1]C -> 5 | G405: =RC[-2]*5 -> 225 | H405: =RC[-3]*10 -> 450 | I405: 玉帝日嫦娥
A406: 404 | B406: 遇到上帝的 | C406: =R[-1]C+1 -> 404 | D406: 上帝死了 | E406: 45 | F406: =R[-1]C -> 5 | G406: =RC[-2]*5 -> 225 | H406: =RC[-3]*10 -> 450 | I406: 玉帝日嫦娥
A407: 405 | B407: 遇到上帝的 | C407: =R[-1]C+1 -> 405 | D407: 上帝死了 | E407: 45 | F407: =R[-1]C -> 5 | G407: =RC[-2]*5 -> 225 | H407: =RC[-3]*10 -> 450 | I407: 玉帝日嫦娥
A408: 406 | B408: 遇到上帝的 | C408: =R[-1]C+1 -> 406 | D408: 上帝死了 | E408: 45 | F408: =R[-1]C -> 5 | G408: =RC[-2]*5 -> 225 | H408: =RC[-3]*10 -> 450 | I408: 玉帝日嫦娥
A409: 407 | B409: 遇到上帝的 | C409: =R[-1]C+1 -> 407 | D409: 上帝死了 | E409: 45 | F409: =R[-1]C -> 5 | G409: =RC[-2]*5 -> 225 | H409: =RC[-3]*10 -> 450 | I409: 玉帝日嫦娥
A410: 408 | B410: 遇到上帝的 | C410: =R[-1]C+1 -> 408 | D410: 上帝死了 | E410: 45 | F410: =R[-1]C -> 5 | G410: =RC[-2]*5 -> 225 | H410: =RC[-3]*10 -> 450 | I410: 玉帝日嫦娥
A411: 409 | B411: 遇到上帝的 | C411: =R[-1]C+1 -> 409 | D411: 上帝死了 | E411: 45 | F411: =R[-1]C -> 5 | G411: =RC[-2]*5 -> 225 | H411: =RC[-3]*10 -> 450 | I411: 玉帝日嫦娥
A412: 410 | B412: 遇到上帝的 | C412: =R[-1]C+1 -> 410 | D412: 上帝死了 | E412: 45 | F412: =R[-1]C -> 5 | G412: =RC[-2]*5 -> 225 | H412: =RC[-3]*10 -> 450 | I412: 玉帝日嫦娥
A413: 411 | B413: 遇到上帝的 | C413: =R[-1]C+1 -> 411 | D413: 上帝死了 | E413: 46 | F413: =R[-1]C -> 5 | G413: =RC[-2]*5 -> 230 | H413: =RC[-3]*10 -> 460 | I413: 玉帝日嫦娥
A414: 412 | B414: 遇到上帝的 | C414: =R[-1]C+1 -> 412 | D414: 上帝死了 | E414: 46 | F414: =R[-1]C -> 5 | G414: =RC[-2]*5 -> 230 | H414: =RC[-3]*10 -> 460 | I414: 玉帝日嫦娥
A415: 413 | B415: 遇到上帝的 | C415: =R[-1]C+1 -> 413 | D415: 上帝死了 | E415: 46 | F415: =R[-1]C -> 5 | G415: =RC[-2]*5 -> 230 | H415: =RC[-3]*10 -> 460 | I415: 玉帝日嫦娥
A416: 414 | B416: 遇到上帝的 | C416: =R[-1]C+1 -> 414 | D416: 上帝死了 | E416: 46 | F416: =R[-1]C -> 5 | G416: =RC[-2]*5 -> 230 | H416: =RC[-3]*10 -> 460 | I416: 玉帝日嫦娥
A417: 415 | B417: 遇到上帝的 | C417: =R[-1]C+1 -> 415 | D417: 上帝死了 | E417: 46 | F417: =R[-1]C -> 5 | G417: =RC[-2]*5 -> 230 | H417: =RC[-3]*10 -> 460 | I417: 玉帝日嫦娥
A418: 416 | B418: 遇到上帝的 | C418: =R[-1]C+1 -> 416 | D418: 上帝死了 | E418: 46 | F418: =R[-1]C -> 5 | G418: =RC[-2]*5 -> 230 | H418: =RC[-3]*10 -> 460 | I418: 玉帝日嫦娥
A419: 417 | B419: 遇到上帝的 | C419: =R[-1]C+1 -> 417 | D419: 上帝死了 | E419: 46 | F419: =R[-1]C -> 5 | G419: =RC[-2]*5 -> 230 | H419: =RC[-3]*10 -> 460 | I419: 玉帝日嫦娥
A420: 418 | B420: 遇到上帝的 | C420: =R[-1]C+1 -> 418 | D420: 上帝死了 | E420: 46 | F420: =R[-1]C -> 5 | G420: =RC[-2]*5 -> 230 | H420: =RC[-3]*10 -> 460 | I420: 玉帝日嫦娥
A421: 419 | B421: 遇到上帝的 | C421: =R[-1]C+1 -> 419 | D421: 上帝死了 | E421: 46 | F421: =R[-1]C -> 5 | G421: =RC[-2]*5 -> 230 | H421: =RC[-3]*10 -> 460 | I421: 玉帝日嫦娥
A422: 420 | B422: 遇到上帝的 | C422: =R[-1]C+1 -> 420 | D422: 上帝死了 | E422: 46 | F422: =R[-1]C -> 5 | G422: =RC[-2]*5 -> 230 | H422: =RC[-3]*10 -> 460 | I422: 玉帝日嫦娥
A423: 421 | B423: 遇到上帝的 | C423: =R[-1]C+1 -> 421 | D423: 上帝死了 | E423: 47 | F423: =R[-1]C -> 5 | G423: =RC[-2]*5 -> 235 | H423: =RC[-3]*10 -> 470 | I423: 玉帝日嫦娥
A424: 422 | B424: 遇到上帝的 | C424: =R[-1]C+1 -> 422 | D424: 上帝死了 | E424: 47 | F424: =R[-1]C -> 5 | G424: =RC[-2]*5 -> 235 | H424: =RC[-3]*10 -> 470 | I424: 玉帝日嫦娥
A425: 423 | B425: 遇到上帝的 | C425: =R[-1]C+1 -> 423 | D425: 上帝死了 | E425: 47 | F425: =R[-1]C -> 5 | G425: =RC[-2]*5 -> 235 | H425: =RC[-3]*10 -> 470 | I425: 玉帝日嫦娥
A426: 424 | B426: 遇到上帝的 | C426: =R[-1]C+1 -> 424 | D426: 上帝死了 | E426: 47 | F426: =R[-1]C -> 5 | G426: =RC[-2]*5 -> 235 | H426: =RC[-3]*10 -> 470 | I426: 玉帝日嫦娥
A427: 425 | B427: 遇到上帝的 | C427: =R[-1]C+1 -> 425 | D427: 上帝死了 | E427: 47 | F427: =R[-1]C -> 5 | G427: =RC[-2]*5 -> 235 | H427: =RC[-3]*10 -> 470 | I427: 玉帝日嫦娥
A428: 426 | B428: 遇到上帝的 | C428: =R[-1]C+1 -> 426 | D428: 上帝死了 | E428: 47 | F428: =R[-1]C -> 5 | G428: =RC[-2]*5 -> 235 | H428: =RC[-3]*10 -> 470 | I428: 玉帝日嫦娥
A429: 427 | B429: 遇到上帝的 | C429: =R[-1]C+1 -> 427 | D429: 上帝死了 | E429: 47 | F429: =R[-1]C -> 5 | G429: =RC[-2]*5 -> 235 | H429: =RC[-3]*10 -> 470 | I429: 玉帝日嫦娥
A430: 428 | B430: 遇到上帝的 | C430: =R[-1]C+1 -> 428 | D430: 上帝死了 | E430: 47 | F430: =R[-1]C -> 5 | G430: =RC[-2]*5 -> 235 | H430: =RC[-3]*10 -> 470 | I430: 玉帝日嫦娥
A431: 429 | B431: 遇到上帝的 | C431: =R[-1]C+1 -> 429 | D431: 上帝死了 | E431: 47 | F431: =R[-1]C -> 5 | G431: =RC[-2]*5 -> 235 | H431: =RC[-3]*10 -> 470 | I431: 玉帝日嫦娥
A432: 430 | B432: 遇到上帝的 | C432: =R[-1]C+1 -> 430 | D432: 上帝死了 | E432: 47 | F432: =R[-1]C -> 5 | G432: =RC[-2]*5 -> 235 | H432: =RC[-3]*10 -> 470 | I432: 玉帝日嫦娥
A433: 431 | B433: 遇到上帝的 | C433: =R[-1]C+1 -> 431 | D433: 上帝死了 | E433: 48 | F433: =R[-1]C -> 5 | G433: =RC[-2]*5 -> 240 | H433: =RC[-3]*10 -> 480 | I433: 玉帝日嫦娥
A434: 432 | B434: 遇到上帝的 | C434: =R[-1]C+1 -> 432 | D434: 上帝死了 | E434: 48 | F434: =R[-1]C -> 5 | G434: =RC[-2]*5 -> 240 | H434: =RC[-3]*10 -> 480 | I434: 玉帝日嫦娥
A435: 433 | B435: 遇到上帝的 | C435: =R[-1]C+1 -> 433 | D435: 上帝死了 | E435: 48 | F435: =R[-1]C -> 5 | G435: =RC[-2]*5 -> 240 | H435: =RC[-3]*10 -> 480 | I435: 玉帝日嫦娥
A436: 434 | B436: 遇到上帝的 | C436: =R[-1]C+1 -> 434 | D436: 上帝死了 | E436: 48 | F436: =R[-1]C -> 5 | G436: =RC[-2]*5 -> 240 | H436: =RC[-3]*10 -> 480 | I436: 玉帝日嫦娥
A437: 435 | B437: 遇到上帝的 | C437: =R[-1]C+1 -> 435 | D437: 上帝死了 | E437: 48 | F437: =R[-1]C -> 5 | G437: =RC[-2]*5 -> 240 | H437: =RC[-3]*10 -> 480 | I437: 玉帝日嫦娥
A438: 436 | B438: 遇到上帝的 | C438: =R[-1]C+1 -> 436 | D438: 上帝死了 | E438: 48 | F438: =R[-1]C -> 5 | G438: =RC[-2]*5 -> 240 | H438: =RC[-3]*10 -> 480 | I438: 玉帝日嫦娥
A439: 437 | B439: 遇到上帝的 | C439: =R[-1]C+1 -> 437 | D439: 上帝死了 | E439: 48 | F439: =R[-1]C -> 5 | G439: =RC[-2]*5 -> 240 | H439: =RC[-3]*10 -> 480 | I439: 玉帝日嫦娥
A440: 438 | B440: 遇到上帝的 | C440: =R[-1]C+1 -> 438 | D440: 上帝死了 | E440: 48 | F440: =R[-1]C -> 5 | G440: =RC[-2]*5 -> 240 | H440: =RC[-3]*10 -> 480 | I440: 玉帝日嫦娥
A441: 439 | B441: 遇到上帝的 | C441: =R[-1]C+1 -> 439 | D441: 上帝死了 | E441: 48 | F441: =R[-1]C -> 5 | G441: =RC[-2]*5 -> 240 | H441: =RC[-3]*10 -> 480 | I441: 玉帝日嫦娥
A442: 440 | B442: 遇到上帝的 | C442: =R[-1]C+1 -> 440 | D442: 上帝死了 | E442: 48 | F442: =R[-1]C -> 5 | G442: =RC[-2]*5 -> 240 | H442: =RC[-3]*10 -> 480 | I442: 玉帝日嫦娥
A443: 441 | B443: 遇到上帝的 | C443: =R[-1]C+1 -> 441 | D443: 上帝死了 | E443: 49 | F443: =R[-1]C -> 5 | G443: =RC[-2]*5 -> 245 | H443: =RC[-3]*10 -> 490 | I443: 玉帝日嫦娥
A444: 442 | B444: 遇到上帝的 | C444: =R[-1]C+1 -> 442 | D444: 上帝死了 | E444: 49 | F444: =R[-1]C -> 5 | G444: =RC[-2]*5 -> 245 | H444: =RC[-3]*10 -> 490 | I444: 玉帝日嫦娥
A445: 443 | B445: 遇到上帝的 | C445: =R[-1]C+1 -> 443 | D445: 上帝死了 | E445: 49 | F445: =R[-1]C -> 5 | G445: =RC[-2]*5 -> 245 | H445: =RC[-3]*10 -> 490 | I445: 玉帝日嫦娥
A446: 444 | B446: 遇到上帝的 | C446: =R[-1]C+1 -> 444 | D446: 上帝死了 | E446: 49 | F446: =R[-1]C -> 5 | G446: =RC[-2]*5 -> 245 | H446: =RC[-3]*10 -> 490 | I446: 玉帝日嫦娥
A447: 445 | B447: 遇到上帝的 | C447: =R[-1]C+1 -> 445 | D447: 上帝死了 | E447: 49 | F447: =R[-1]C -> 5 | G447: =RC[-2]*5 -> 245 | H447: =RC[-3]*10 -> 490 | I447: 玉帝日嫦娥
A448: 446 | B448: 遇到上帝的 | C448: =R[-1]C+1 -> 446 | D448: 上帝死了 | E448: 49 | F448: =R[-1]C -> 5 | G448: =RC[-2]*5 -> 245 | H448: =RC[-3]*10 -> 490 | I448: 玉帝日嫦娥
A449: 447 | B449: 遇到上帝的 | C449: =R[-1]C+1 -> 447 | D449: 上帝死了 | E449: 49 | F449: =R[-1]C -> 5 | G449: =RC[-2]*5 -> 245 | H449: =RC[-3]*10 -> 490 | I449: 玉帝日嫦娥
A450: 448 | B450: 遇到上帝的 | C450: =R[-1]C+1 -> 448 | D450: 上帝死了 | E450: 49 | F450: =R[-1]C -> 5 | G450: =RC[-2]*5 -> 245 | H450: =RC[-3]*10 -> 490 | I450: 玉帝日嫦娥
A451: 449 | B451: 遇到上帝的 | C451: =R[-1]C+1 -> 449 | D451: 上帝死了 | E451: 49 | F451: =R[-1]C -> 5 | G451: =RC[-2]*5 -> 245 | H451: =RC[-3]*10 -> 490 | I451: 玉帝日嫦娥
A452: 450 | B452: 遇到上帝的 | C452: =R[-1]C+1 -> 450 | D452: 上帝死了 | E452: 49 | F452: =R[-1]C -> 5 | G452: =RC[-2]*5 -> 245 | H452: =RC[-3]*10 -> 490 | I452: 玉帝日嫦娥
A453: 451 | B453: 遇到上帝的 | C453: =R[-1]C+1 -> 451 | D453: 上帝死了 | E453: 50 | F453: =R[-1]C -> 5 | G453: =RC[-2]*5 -> 250 | H453: =RC[-3]*10 -> 500 | I453: 玉帝日嫦娥
A454: 452 | B454: 遇到上帝的 | C454: =R[-1]C+1 -> 452 | D454: 上帝死了 | E454: 50 | F454: =R[-1]C -> 5 | G454: =RC[-2]*5 -> 250 | H454: =RC[-3]*10 -> 500 | I454: 玉帝日嫦娥
A455: 453 | B455: 遇到上帝的 | C455: =R[-1]C+1 -> 453 | D455: 上帝死了 | E455: 50 | F455: =R[-1]C -> 5 | G455: =RC[-2]*5 -> 250 | H455: =RC[-3]*10 -> 500 | I455: 玉帝日嫦娥
A456: 454 | B456: 遇到上帝的 | C456: =R[-1]C+1 -> 454 | D456: 上帝死了 | E456: 50 | F456: =R[-1]C -> 5 | G456: =RC[-2]*5 -> 250 | H456: =RC[-3]*10 -> 500 | I456: 玉帝日嫦娥
A457: 455 | B457: 遇到上帝的 | C457: =R[-1]C+1 -> 455 | D457: 上帝死了 | E457: 50 | F457: =R[-1]C -> 5 | G457: =RC[-2]*5 -> 250 | H457: =RC[-3]*10 -> 500 | I457: 玉帝日嫦娥
A458: 456 | B458: 遇到上帝的 | C458: =R[-1]C+1 -> 456 | D458: 上帝死了 | E458: 50 | F458: =R[-1]C -> 5 | G458: =RC[-2]*5 -> 250 | H458: =RC[-3]*10 -> 500 | I458: 玉帝日嫦娥
A459: 457 | B459: 遇到上帝的 | C459: =R[-1]C+1 -> 457 | D459: 上帝死了 | E459: 50 | F459: =R[-1]C -> 5 | G459: =RC[-2]*5 -> 250 | H459: =RC[-3]*10 -> 500 | I459: 玉帝日嫦娥
A460: 458 | B460: 遇到上帝的 | C460: =R[-1]C+1 -> 458 | D460: 上帝死了 | E460: 50 | F460: =R[-1]C -> 5 | G460: =RC[-2]*5 -> 250 | H460: =RC[-3]*10 -> 500 | I460: 玉帝日嫦娥
A461: 459 | B461: 遇到上帝的 | C461: =R[-1]C+1 -> 459 | D461: 上帝死了 | E461: 50 | F461: =R[-1]C -> 5 | G461: =RC[-2]*5 -> 250 | H461: =RC[-3]*10 -> 500 | I461: 玉帝日嫦娥
A462: 460 | B462: 遇到上帝的 | C462: =R[-1]C+1 -> 460 | D462: 上帝死了 | E462: 50 | F462: =R[-1]C -> 5 | G462: =RC[-2]*5 -> 250 | H462: =RC[-3]*10 -> 500 | I462: 玉帝日嫦娥
A463: 461 | B463: 遇到上帝的 | C463: =R[-1]C+1 -> 461 | D463: 上帝死了 | E463: 51 | F463: =R[-1]C -> 5 | G463: =RC[-2]*5 -> 255 | H463: =RC[-3]*10 -> 510 | I463: 玉帝日嫦娥
A464: 462 | B464: 遇到上帝的 | C464: =R[-1]C+1 -> 462 | D464: 上帝死了 | E464: 51 | F464: =R[-1]C -> 5 | G464: =RC[-2]*5 -> 255 | H464: =RC[-3]*10 -> 510 | I464: 玉帝日嫦娥
A465: 463 | B465: 遇到上帝的 | C465: =R[-1]C+1 -> 463 | D465: 上帝死了 | E465: 51 | F465: =R[-1]C -> 5 | G465: =RC[-2]*5 -> 255 | H465: =RC[-3]*10 -> 510 | I465: 玉帝日嫦娥
A466: 464 | B466: 遇到上帝的 | C466: =R[-1]C+1 -> 464 | D466: 上帝死了 | E466: 51 | F466: =R[-1]C -> 5 | G466: =RC[-2]*5 -> 255 | H466: =RC[-3]*10 -> 510 | I466: 玉帝日嫦娥
A467: 465 | B467: 遇到上帝的 | C467: =R[-1]C+1 -> 465 | D467: 上帝死了 | E467: 51 | F467: =R[-1]C -> 5 | G467: =RC[-2]*5 -> 255 | H467: =RC[-3]*10 -> 510 | I467: 玉帝日嫦娥
A468: 466 | B468: 遇到上帝的 | C468: =R[-1]C+1 -> 466 | D468: 上帝死了 | E468: 51 | F468: =R[-1]C -> 5 | G468: =RC[-2]*5 -> 255 | H468: =RC[-3]*10 -> 510 | I468: 玉帝日嫦娥
A469: 467 | B469: 遇到上帝的 | C469: =R[-1]C+1 -> 467 | D469: 上帝死了 | E469: 51 | F469: =R[-1]C -> 5 | G469: =RC[-2]*5 -> 255 | H469: =RC[-3]*10 -> 510 | I469: 玉帝日嫦娥
A470: 468 | B470: 遇到上帝的 | C470: =R[-1]C+1 -> 468 | D470: 上帝死了 | E470: 51 | F470: =R[-1]C -> 5 | G470: =RC[-2]*5 -> 255 | H470: =RC[-3]*10 -> 510 | I470: 玉帝日嫦娥
A471: 469 | B471: 遇到上帝的 | C471: =R[-1]C+1 -> 469 | D471: 上帝死了 | E471: 51 | F471: =R[-1]C -> 5 | G471: =RC[-2]*5 -> 255 | H471: =RC[-3]*10 -> 510 | I471: 玉帝日嫦娥
A472: 470 | B472: 遇到上帝的 | C472: =R[-1]C+1 -> 470 | D472: 上帝死了 | E472: 51 | F472: =R[-1]C -> 5 | G472: =RC[-2]*5 -> 255 | H472: =RC[-3]*10 -> 510 | I472: 玉帝日嫦娥
A473: 471 | B473: 遇到上帝的 | C473: =R[-1]C+1 -> 471 | D473: 上帝死了 | E473: 52 | F473: =R[-1]C -> 5 | G473: =RC[-2]*5 -> 260 | H473: =RC[-3]*10 -> 520 | I473: 玉帝日嫦娥
A474: 472 | B474: 遇到上帝的 | C474: =R[-1]C+1 -> 472 | D474: 上帝死了 | E474: 52 | F474: =R[-1]C -> 5 | G474: =RC[-2]*5 -> 260 | H474: =RC[-3]*10 -> 520 | I474: 玉帝日嫦娥
A475: 473 | B475: 遇到上帝的 | C475: =R[-1]C+1 -> 473 | D475: 上帝死了 | E475: 52 | F475: =R[-1]C -> 5 | G475: =RC[-2]*5 -> 260 | H475: =RC[-3]*10 -> 520 | I475: 玉帝日嫦娥
A476: 474 | B476: 遇到上帝的 | C476: =R[-1]C+1 -> 474 | D476: 上帝死了 | E476: 52 | F476: =R[-1]C -> 5 | G476: =RC[-2]*5 -> 260 | H476: =RC[-3]*10 -> 520 | I476: 玉帝日嫦娥
A477: 475 | B477: 遇到上帝的 | C477: =R[-1]C+1 -> 475 | D477: 上帝死了 | E477: 52 | F477: =R[-1]C -> 5 | G477: =RC[-2]*5 -> 260 | H477: =RC[-3]*10 -> 520 | I477: 玉帝日嫦娥
A478: 476 | B478: 遇到上帝的 | C478: =R[-1]C+1 -> 476 | D478: 上帝死了 | E478: 52 | F478: =R[-1]C -> 5 | G478: =RC[-2]*5 -> 260 | H478: =RC[-3]*10 -> 520 | I478: 玉帝日嫦娥
A479: 477 | B479: 遇到上帝的 | C479: =R[-1]C+1 -> 477 | D479: 上帝死了 | E479: 52 | F479: =R[-1]C -> 5 | G479: =RC[-2]*5 -> 260 | H479: =RC[-3]*10 -> 520 | I479: 玉帝日嫦娥
A480: 478 | B480: 遇到上帝的 | C480: =R[-1]C+1 -> 478 | D480: 上帝死了 | E480: 52 | F480: =R[-1]C -> 5 | G480: =RC[-2]*5 -> 260 | H480: =RC[-3]*10 -> 520 | I480: 玉帝日嫦娥
A481: 479 | B481: 遇到上帝的 | C481: =R[-1]C+1 -> 479 | D481: 上帝死了 | E481: 52 | F481: =R[-1]C -> 5 | G481: =RC[-2]*5 -> 260 | H481: =RC[-3]*10 -> 520 | I481: 玉帝日嫦娥
A482: 480 | B482: 遇到上帝的 | C482: =R[-1]C+1 -> 480 | D482: 上帝死了 | E482: 52 | F482: =R[-1]C -> 5 | G482: =RC[-2]*5 -> 260 | H482: =RC[-3]*10 -> 520 | I482: 玉帝日嫦娥
A483: 481 | B483: 遇到上帝的 | C483: =R[-1]C+1 -> 481 | D483: 上帝死了 | E483: 53 | F483: =R[-1]C -> 5 | G483: =RC[-2]*5 -> 265 | H483: =RC[-3]*10 -> 530 | I483: 玉帝日嫦娥
A484: 482 | B484: 遇到上帝的 | C484: =R[-1]C+1 -> 482 | D484: 上帝死了 | E484: 53 | F484: =R[-1]C -> 5 | G484: =RC[-2]*5 -> 265 | H484: =RC[-3]*10 -> 530 | I484: 玉帝日嫦娥
A485: 483 | B485: 遇到上帝的 | C485: =R[-1]C+1 -> 483 | D485: 上帝死了 | E485: 53 | F485: =R[-1]C -> 5 | G485: =RC[-2]*5 -> 265 | H485: =RC[-3]*10 -> 530 | I485: 玉帝日嫦娥
A486: 484 | B486: 遇到上帝的 | C486: =R[-1]C+1 -> 484 | D486: 上帝死了 | E486: 53 | F486: =R[-1]C -> 5 | G486: =RC[-2]*5 -> 265 | H486: =RC[-3]*10 -> 530 | I486: 玉帝日嫦娥
A487: 485 | B487: 遇到上帝的 | C487: =R[-1]C+1 -> 485 | D487: 上帝死了 | E487: 53 | F487: =R[-1]C -> 5 | G487: =RC[-2]*5 -> 265 | H487: =RC[-3]*10 -> 530 | I487: 玉帝日嫦娥
A488: 486 | B488: 遇到上帝的 | C488: =R[-1]C+1 -> 486 | D488: 上帝死了 | E488: 53 | F488: =R[-1]C -> 5 | G488: =RC[-2]*5 -> 265 | H488: =RC[-3]*10 -> 530 | I488: 玉帝日嫦娥
A489: 487 | B489: 遇到上帝的 | C489: =R[-1]C+1 -> 487 | D489: 上帝死了 | E489: 53 | F489: =R[-1]C -> 5 | G489: =RC[-2]*5 -> 265 | H489: =RC[-3]*10 -> 530 | I489: 玉帝日嫦娥
A490: 488 | B490: 遇到上帝的 | C490: =R[-1]C+1 -> 488 | D490: 上帝死了 | E490: 53 | F490: =R[-1]C -> 5 | G490: =RC[-2]*5 -> 265 | H490: =RC[-3]*10 -> 530 | I490: 玉帝日嫦娥
A491: 489 | B491: 遇到上帝的 | C491: =R[-1]C+1 -> 489 | D491: 上帝死了 | E491: 53 | F491: =R[-1]C -> 5 | G491: =RC[-2]*5 -> 265 | H491: =RC[-3]*10 -> 530 | I491: 玉帝日嫦娥
A492: 490 | B492: 遇到上帝的 | C492: =R[-1]C+1 -> 490 | D492: 上帝死了 | E492: 53 | F492: =R[-1]C -> 5 | G492: =RC[-2]*5 -> 265 | H492: =RC[-3]*10 -> 530 | I492: 玉帝日嫦娥
A493: 491 | B493: 遇到上帝的 | C493: =R[-1]C+1 -> 491 | D493: 上帝死了 | E493: 54 | F493: =R[-1]C -> 5 | G493: =RC[-2]*5 -> 270 | H493: =RC[-3]*10 -> 540 | I493: 玉帝日嫦娥
A494: 492 | B494: 遇到上帝的 | C494: =R[-1]C+1 -> 492 | D494: 上帝死了 | E494: 54 | F494: =R[-1]C -> 5 | G494: =RC[-2]*5 -> 270 | H494: =RC[-3]*10 -> 540 | I494: 玉帝日嫦娥
A495: 493 | B495: 遇到上帝的 | C495: =R[-1]C+1 -> 493 | D495: 上帝死了 | E495: 54 | F495: =R[-1]C -> 5 | G495: =RC[-2]*5 -> 270 | H495: =RC[-3]*10 -> 540 | I495: 玉帝日嫦娥
A496: 494 | B496: 遇到上帝的 | C496: =R[-1]C+1 -> 494 | D496: 上帝死了 | E496: 54 | F496: =R[-1]C -> 5 | G496: =RC[-2]*5 -> 270 | H496: =RC[-3]*10 -> 540 | I496: 玉帝日嫦娥
A497: 495 | B497: 遇到上帝的 | C497: =R[-1]C+1 -> 495 | D497: 上帝死了 | E497: 54 | F497: =R[-1]C -> 5 | G497: =RC[-2]*5 -> 270 | H497: =RC[-3]*10 -> 540 | I497: 玉帝日嫦娥
A498: 496 | B498: 遇到上帝的 | C498: =R[-1]C+1 -> 496 | D498: 上帝死了 | E498: 54 | F498: =R[-1]C -> 5 | G498: =RC[-2]*5 -> 270 | H498: =RC[-3]*10 -> 540 | I498: 玉帝日嫦娥
A499: 497 | B499: 遇到上帝的 | C499: =R[-1]C+1 -> 497 | D499: 上帝死了 | E499: 54 | F499: =R[-1]C -> 5 | G499: =RC[-2]*5 -> 270 | H499: =RC[-3]*10 -> 540 | I499: 玉帝日嫦娥
A500: 498 | B500: 遇到上帝的 | C500: =R[-1]C+1 -> 498 | D500: 上帝死了 | E500: 54 | F500: =R[-1]C -> 5 | G500: =RC[-2]*5 -> 270 | H500: =RC[-3]*10 -> 540 | I500: 玉帝日嫦娥
A501: 499 | B501: 遇到上帝的 | C501: =R[-1]C+1 -> 499 | D501: 上帝死了 | E501: 54 | F501: =R[-1]C -> 5 | G501: =RC[-2]*5 -> 270 | H501: =RC[-3]*10 -> 540 | I501: 玉帝日嫦娥
A502: 500 | B502: 遇到上帝的 | C502: =R[-1]C+1 -> 500 | D502: 上帝死了 | E502: 54 | F502: =R[-1]C -> 5 | G502: =RC[-2]*5 -> 270 | H502: =RC[-3]*10 -> 540 | I502: 玉帝日嫦娥

Sheet: 大章表
A1: id | B1: 大章名称
A2: id | B2: chapter
A3: 1 | B3: 遇到上帝的
A4: 2 | B4: 遇到上帝的
A5: 3 | B5: 遇到上帝的
A6: 4 | B6: 遇到上帝的
A7: 5 | B7: 遇到上帝的
A8: 6 | B8: 遇到上帝的
A9: 7 | B9: 遇到上帝的
A10: 8 | B10: 遇到上帝的
A11: 9 | B11: 遇到上帝的
A12: 10 | B12: 遇到上帝的
A13: 11 | B13: 遇到上帝的
A14: 12 | B14: 遇到上帝的
A15: 13 | B15: 遇到上帝的
A16: 14 | B16: 遇到上帝的
A17: 15 | B17: 遇到上帝的
A18: 16 | B18: 遇到上帝的
A19: 17 | B19: 遇到上帝的
A20: 18 | B20: 遇到上帝的
A21: 19 | B21: 遇到上帝的
A22: 20 | B22: 遇到上帝的
A23: 21 | B23: 遇到上帝的
A24: 22 | B24: 遇到上帝的
A25: 23 | B25: 遇到上帝的
A26: 24 | B26: 遇到上帝的
A27: 25 | B27: 遇到上帝的
A28: 26 | B28: 遇到上帝的
A29: 27 | B29: 遇到上帝的
A30: 28 | B30: 遇到上帝的
A31: 29 | B31: 遇到上帝的
A32: 30 | B32: 遇到上帝的
A33: 31 | B33: 遇到上帝的
A34: 32 | B34: 遇到上帝的
A35: 33 | B35: 遇到上帝的
A36: 34 | B36: 遇到上帝的
A37: 35 | B37: 遇到上帝的
A38: 36 | B38: 遇到上帝的
A39: 37 | B39: 遇到上帝的
A40: 38 | B40: 遇到上帝的
A41: 39 | B41: 遇到上帝的
A42: 40 | B42: 遇到上帝的
A43: 41 | B43: 遇到上帝的
A44: 42 | B44: 遇到上帝的
A45: 43 | B45: 遇到上帝的
A46: 44 | B46: 遇到上帝的
A47: 45 | B47: 遇到上帝的
A48: 46 | B48: 遇到上帝的
A49: 47 | B49: 遇到上帝的
A50: 48 | B50: 遇到上帝的
A51: 49 | B51: 遇到上帝的
A52: 50 | B52: 遇到上帝的

Sheet: 任务扫荡产出表
A1: 大章序号 | B1: 铜板产出 | C1: 经验产出
A2: id | B2: coins_obtain | C2: exp_obtain
A3: 1 | B3: 550 | C3: 100
A4: 2 | B4: 660 | C4: 120
A5: 3 | B5: 770 | C5: 140
A6: 4 | B6: 880 | C6: 160
A7: 5 | B7: 990 | C7: 180
A8: 6 | B8: 1100 | C8: 200
A9: 7 | B9: 1210 | C9: 220
A10: 8 | B10: 1320 | C10: 240
A11: 9 | B11: 1430 | C11: 260
A12: 10 | B12: 1540 | C12: 280
A13: 11 | B13: 1650 | C13: 300
A14: 12 | B14: 1760 | C14: 320
A15: 13 | B15: 1870 | C15: 340
A16: 14 | B16: 1980 | C16: 360
A17: 15 | B17: 2090 | C17: 380
A18: 16 | B18: 2200 | C18: 400
A19: 17 | B19: 2310 | C19: 420
A20: 18 | B20: 2420 | C20: 440
A21: 19 | B21: 2530 | C21: 460
A22: 20 | B22: 2640 | C22: 480
A23: 21 | B23: 2750 | C23: 500
A24: 22 | B24: 2860 | C24: 520
A25: 23 | B25: 2970 | C25: 540
A26: 24 | B26: 3080 | C26: 560
A27: 25 | B27: 3190 | C27: 580
A28: 26 | B28: 3300 | C28: 600
A29: 27 | B29: 3410 | C29: 620
A30: 28 | B30: 3520 | C30: 640
A31: 29 | B31: 3630 | C31: 660
A32: 30 | B32: 3740 | C32: 680
A33: 31 | B33: 3850 | C33: 700
A34: 32 | B34: 3960 | C34: 720
A35: 33 | B35: 4070 | C35: 740
A36: 34 | B36: 4180 | C36: 760
A37: 35 | B37: 4290 | C37: 780
A38: 36 | B38: 4400 | C38: 800
A39: 37 | B39: 4510 | C39: 820
A40: 38 | B40: 4620 | C40: 840
A41: 39 | B41: 4730 | C41: 860
A42: 40 | B42: 4840 | C42: 880
A43: 41 | B43: 4950 | C43: 900
A44: 42 | B44: 5060 | C44: 920
A45: 43 | B45: 5170 | C45: 940
A46: 44 | B46: 5280 | C46: 960
A47: 45 | B47: 5390 | C47: 980
A48: 46 | B48: 5500 | C48: 1000
A49: 47 | B49: 5610 | C49: 1020
A50: 48 | B50: 5720 | C50: 1040
A51: 49 | B51: 5830 | C51: 1060
A52: 50 | B52: 5940 | C52: 1080

Sheet: 任务怪物属性表
A1: id | B1: 卡牌名称 | C1: 攻击力 | D1: 生命值 | E1: 闪避率 | F1: 暴击率 | G1: 技能ID
A2: id | B2: name | C2: atk | D2: hp | E2: dodge_rate | F2: crit_rate | G2: skill_id
A3: 10000 | B3: 白熊1 | C3: 50 | D3: =[数值系统.xls]卡牌基础属性参考!R[3]C[6]*0.3 -> 171.6 | E3: 10 | F3: 10 | G3: 1
A4: 10001 | B4: 白熊2 | C4: 500 | D4: =[数值系统.xls]卡牌基础属性参考!R[3]C[6]*0.3 -> 188.5884 | E4: 10 | F4: 10 | G4: 1
A5: 10001 | B5: 白熊3 | C5: =[数值系统.xls]卡牌基础属性参考!R[2]C[2]*0.7 -> 169.246 | D5: =[数值系统.xls]卡牌基础属性参考!R[2]C[6]*0.9 -> 565.7652 | E5: 10 | F5: 10 | G5: 2
A6: 10002 | B6: 白熊4 | C6: =[数值系统.xls]卡牌基础属性参考!R[2]C[2]*0.7 -> 185.832108 | D6: =[数值系统.xls]卡牌基础属性参考!R[2]C[6]*0.9 -> 621.2101896 | E6: 10 | F6: 10 | G6: 3
A7: 10003 | B7: 白熊5 | C7: =[数值系统.xls]卡牌基础属性参考!R[2]C[2]*0.7 -> 203.857822476 | D7: =[数值系统.xls]卡牌基础属性参考!R[2]C[6]*0.9 -> 681.467577991201 | E7: 10 | F7: 10 | G7: 4
A8: 10004 | B8: 白熊6 | C8: =[数值系统.xls]卡牌基础属性参考!R[2]C[2]*0.7 -> 223.428173433696 | D8: =[数值系统.xls]卡牌基础属性参考!R[2]C[6]*0.9 -> 746.888465478356 | E8: 10 | F8: 10 | G8: 5
A9: 10005 | B9: 白熊7 | C9: =[数值系统.xls]卡牌基础属性参考!R[2]C[2]*0.7 -> 244.653849909898 | D9: =[数值系统.xls]卡牌基础属性参考!R[2]C[6]*0.9 -> 817.842869698801 | E9: 10 | F9: 10 | G9: 6
A10: 10006 | B10: 白熊8 | C10: =[数值系统.xls]卡牌基础属性参考!R[2]C[2]*0.7 -> 267.651311801428 | D10: =[数值系统.xls]卡牌基础属性参考!R[2]C[6]*0.9 -> 894.720099450489 | E10: 10 | F10: 10 | G10: 7
A11: 10007 | B11: 白熊9 | C11: =[数值系统.xls]卡牌基础属性参考!R[2]C[2]*0.7 -> 292.542883798961 | D11: =[数值系统.xls]卡牌基础属性参考!R[2]C[6]*0.9 -> 977.929068699385 | E11: 10 | F11: 10 | G11: 8
A12: 10008 | B12: 白熊10 | C12: =[数值系统.xls]卡牌基础属性参考!R[2]C[2]*0.7 -> 319.456829108466 | D12: =[数值系统.xls]卡牌基础属性参考!R[2]C[6]*0.9 -> 1067.89854301973 | E12: 10 | F12: 10 | G12: 9
A13: 10009 | B13: 白熊11 | C13: =[数值系统.xls]卡牌基础属性参考!R[2]C[2]*0.7 -> 348.527400557337 | D13: =[数值系统.xls]卡牌基础属性参考!R[2]C[6]*0.9 -> 1165.07731043453 | E13: 10 | F13: 10 | G13: 10
A14: 10010 | B14: 白熊12 | C14: =[数值系统.xls]卡牌基础属性参考!R[2]C[2]*0.7 -> 379.894866607497 | D14: =[数值系统.xls]卡牌基础属性参考!R[2]C[6]*0.9 -> 1269.93426837363 | E14: 10 | F14: 10 | G14: 11
A15: 10011 | B15: 白熊13 | C15: =[数值系统.xls]卡牌基础属性参考!R[2]C[2]*0.7 -> 413.705509735565 | D15: =[数值系统.xls]卡牌基础属性参考!R[2]C[6]*0.9 -> 1382.95841825889 | E15: 10 | F15: 10 | G15: 12
A16: 10012 | B16: 白熊14 | C16: =[数值系统.xls]卡牌基础属性参考!R[2]C[2]*0.7 -> 450.111594592296 | D16: =[数值系统.xls]卡牌基础属性参考!R[2]C[6]*0.9 -> 1504.65875906567 | E16: 10 | F16: 10 | G16: 13
A17: 10013 | B17: 白熊15 | C17: =[数值系统.xls]卡牌基础属性参考!R[2]C[2]*0.7 -> 489.271303321826 | D17: =[数值系统.xls]卡牌基础属性参考!R[2]C[6]*0.9 -> 1635.56407110439 | E17: 10 | F17: 10 | G17: 14
A18: 10014 | B18: 白熊16 | C18: =[数值系统.xls]卡牌基础属性参考!R[2]C[2]*0.7 -> 531.348635407504 | D18: =[数值系统.xls]卡牌基础属性参考!R[2]C[6]*0.9 -> 1776.22258121937 | E18: 10 | F18: 10 | G18: 15
A19: 10015 | B19: 白熊17 | C19: =[数值系统.xls]卡牌基础属性参考!R[2]C[2]*0.7 -> 576.513269417143 | D19: =[数值系统.xls]卡牌基础属性参考!R[2]C[6]*0.9 -> 1927.20150062302 | E19: 10 | F19: 10 | G19: 16
A20: 10016 | B20: 白熊18 | C20: =[数值系统.xls]卡牌基础属性参考!R[2]C[2]*0.7 -> 624.940384048184 | D20: =[数值系统.xls]卡牌基础属性参考!R[2]C[6]*0.9 -> 2089.08642667536 | E20: 10 | F20: 10 | G20: 17
A21: 10017 | B21: 白熊19 | C21: =[数值系统.xls]卡牌基础属性参考!R[2]C[2]*0.7 -> 676.810435924184 | D21: =[数值系统.xls]卡牌基础属性参考!R[2]C[6]*0.9 -> 2262.48060008941 | E21: 10 | F21: 10 | G21: 18
A22: 10018 | B22: 白熊20 | C22: =[数值系统.xls]卡牌基础属性参考!R[2]C[2]*0.7 -> 732.308891669968 | D22: =[数值系统.xls]卡牌基础属性参考!R[2]C[6]*0.9 -> 2448.00400929675 | E22: 10 | F22: 10 | G22: 19
A23: 10019 | B23: 白熊21 | C23: =[数值系统.xls]卡牌基础属性参考!R[2]C[2]*0.7 -> 791.625911895238 | D23: =[数值系统.xls]卡牌基础属性参考!R[2]C[6]*0.9 -> 2646.29233404979 | E23: 10 | F23: 10 | G23: 20
A24: 10020 | B24: 白熊22 | C24: =[数值系统.xls]卡牌基础属性参考!R[2]C[2]*0.7 -> 854.955984846858 | D24: =[数值系统.xls]卡牌基础属性参考!R[2]C[6]*0.9 -> 2857.99572077378 | E24: 10 | F24: 10 | G24: 21
A25: 10021 | B25: 白熊23 | C25: =[数值系统.xls]卡牌基础属性参考!R[2]C[2]*0.7 -> 922.497507649762 | D25: =[数值系统.xls]卡牌基础属性参考!R[2]C[6]*0.9 -> 3083.77738271492 | E25: 10 | F25: 10 | G25: 22
A26: 10022 | B26: 白熊24 | C26: =[数值系统.xls]卡牌基础属性参考!R[2]C[2]*0.7 -> 994.452313246446 | D26: =[数值系统.xls]卡牌基础属性参考!R[2]C[6]*0.9 -> 3324.31201856669 | E26: 10 | F26: 10 | G26: 23
A27: 10023 | B27: 白熊25 | C27: =[数值系统.xls]卡牌基础属性参考!R[2]C[2]*0.7 -> 1071.02514136643 | D27: =[数值系统.xls]卡牌基础属性参考!R[2]C[6]*0.9 -> 3580.28404399633 | E27: 10 | F27: 10 | G27: 24
A28: 10024 | B28: 白熊26 | C28: =[数值系统.xls]卡牌基础属性参考!R[2]C[2]*0.7 -> 1152.42305211028 | D28: =[数值系统.xls]卡牌基础属性参考!R[2]C[6]*0.9 -> 3852.38563134006 | E28: 10 | F28: 10 | G28: 25
A29: 10025 | B29: 白熊27 | C29: =[数值系统.xls]卡牌基础属性参考!R[2]C[2]*0.7 -> 1238.85478101855 | D29: =[数值系统.xls]卡牌基础属性参考!R[2]C[6]*0.9 -> 4141.31455369058 | E29: 10 | F29: 10 | G29: 26
A30: 10026 | B30: 白熊28 | C30: =[数值系统.xls]卡牌基础属性参考!R[2]C[2]*0.7 -> 1330.53003481393 | D30: =[数值系统.xls]卡牌基础属性参考!R[2]C[6]*0.9 -> 4447.7718306637 | E30: 10 | F30: 10 | G30: 27
A31: 10027 | B31: 白熊29 | C31: =[数值系统.xls]卡牌基础属性参考!R[2]C[2]*0.7 -> 1427.65872735535 | D31: =[数值系统.xls]卡牌基础属性参考!R[2]C[6]*0.9 -> 4772.45917430216 | E31: 10 | F31: 10 | G31: 28
A32: 10028 | B32: 白熊30 | C32: =[数值系统.xls]卡牌基础属性参考!R[2]C[2]*0.7 -> 1530.45015572494 | D32: =[数值系统.xls]卡牌基础属性参考!R[2]C[6]*0.9 -> 5116.07623485193 | E32: 10 | F32: 10 | G32: 29
A33: 10029 | B33: 白熊31 | C33: =[数值系统.xls]卡牌基础属性参考!R[2]C[2]*0.7 -> 1639.11211678141 | D33: =[数值系统.xls]卡牌基础属性参考!R[2]C[6]*0.9 -> 5479.31764752643 | E33: 10 | F33: 10 | G33: 30
A34: 10030 | B34: 白熊32 | C34: =[数值系统.xls]卡牌基础属性参考!R[2]C[2]*0.7 -> 1753.84996495612 | D34: =[数值系统.xls]卡牌基础属性参考!R[2]C[6]*0.9 -> 5862.8698828533 | E34: 10 | F34: 10 | G34: 31
A35: 10031 | B35: 白熊33 | C35: =[数值系统.xls]卡牌基础属性参考!R[2]C[2]*0.7 -> 1874.8656125381 | D35: =[数值系统.xls]卡牌基础属性参考!R[2]C[6]*0.9 -> 6267.4079047702 | E35: 10 | F35: 10 | G35: 32
A36: 10032 | B36: 白熊34 | C36: =[数值系统.xls]卡牌基础属性参考!R[2]C[2]*0.7 -> 2002.35647419069 | D36: =[数值系统.xls]卡牌基础属性参考!R[2]C[6]*0.9 -> 6693.5916422946 | E36: 10 | F36: 10 | G36: 33
A37: 10033 | B37: 白熊35 | C37: =[数值系统.xls]卡牌基础属性参考!R[2]C[2]*0.7 -> 2136.51435796148 | D37: =[数值系统.xls]卡牌基础属性参考!R[2]C[6]*0.9 -> 7142.06228232836 | E37: 10 | F37: 10 | G37: 34
A38: 10034 | B38: 白熊36 | C38: =[数值系统.xls]卡牌基础属性参考!R[2]C[2]*0.7 -> 2277.52430558694 | D38: =[数值系统.xls]卡牌基础属性参考!R[2]C[6]*0.9 -> 7613.43839296206 | E38: 10 | F38: 10 | G38: 35
A39: 10035 | B39: 白熊37 | C39: =[数值系统.xls]卡牌基础属性参考!R[2]C[2]*0.7 -> 2425.5633854501 | D39: =[数值系统.xls]卡牌基础属性参考!R[2]C[6]*0.9 -> 8108.31188850462 | E39: 10 | F39: 10 | G39: 36
A40: 10036 | B40: 白熊38 | C40: =[数值系统.xls]卡牌基础属性参考!R[2]C[2]*0.7 -> 2580.79944211892 | D40: =[数值系统.xls]卡牌基础属性参考!R[2]C[6]*0.9 -> 8627.24384936895 | E40: 10 | F40: 10 | G40: 37
A41: 10037 | B41: 白熊39 | C41: =[数值系统.xls]卡牌基础属性参考!R[2]C[2]*0.7 -> 2743.38980697242 | D41: =[数值系统.xls]卡牌基础属性参考!R[2]C[6]*0.9 -> 9170.76021187923 | E41: 10 | F41: 10 | G41: 38
A42: 10038 | B42: 白熊40 | C42: =[数值系统.xls]卡牌基础属性参考!R[2]C[2]*0.7 -> 2913.47997500472 | D42: =[数值系统.xls]卡牌基础属性参考!R[2]C[6]*0.9 -> 9739.34734501578 | E42: 10 | F42: 10 | G42: 39
A43: 10039 | B43: 白熊41 | C43: =[数值系统.xls]卡牌基础属性参考!R[2]C[2]*0.7 -> 3091.20225348002 | D43: =[数值系统.xls]卡牌基础属性参考!R[2]C[6]*0.9 -> 10333.4475330618 | E43: 10 | F43: 10 | G43: 40
A44: 10040 | B44: 白熊42 | C44: =[数值系统.xls]卡牌基础属性参考!R[2]C[2]*0.7 -> 3276.67438868884 | D44: =[数值系统.xls]卡牌基础属性参考!R[2]C[6]*0.9 -> 10953.4543850455 | E44: 10 | F44: 10 | G44: 41
A45: 10041 | B45: 白熊43 | C45: =[数值系统.xls]卡牌基础属性参考!R[2]C[2]*0.7 -> 3469.9981776215 | D45: =[数值系统.xls]卡牌基础属性参考!R[2]C[6]*0.9 -> 11599.7081937633 | E45: 10 | F45: 10 | G45: 42
A46: 10042 | B46: 白熊44 | C46: =[数值系统.xls]卡牌基础属性参考!R[2]C[2]*0.7 -> 3671.25807192356 | D46: =[数值系统.xls]卡牌基础属性参考!R[2]C[6]*0.9 -> 12272.4912690016 | E46: 10 | F46: 10 | G46: 43
A47: 10043 | B47: 白熊45 | C47: =[数值系统.xls]卡牌基础属性参考!R[2]C[2]*0.7 -> 3880.51978202322 | D47: =[数值系统.xls]卡牌基础属性参考!R[2]C[6]*0.9 -> 12972.0232713348 | E47: 10 | F47: 10 | G47: 44
A48: 10044 | B48: 白熊46 | C48: =[数值系统.xls]卡牌基础属性参考!R[2]C[2]*0.7 -> 4097.82888981654 | D48: =[数值系统.xls]卡牌基础属性参考!R[2]C[6]*0.9 -> 13698.4565745296 | E48: 10 | F48: 10 | G48: 45
A49: 10045 | B49: 白熊47 | C49: =[数值系统.xls]卡牌基础属性参考!R[2]C[2]*0.7 -> 4323.20947875647 | D49: =[数值系统.xls]卡牌基础属性参考!R[2]C[6]*0.9 -> 14451.8716861288 | E49: 10 | F49: 10 | G49: 46
A50: 10046 | B50: 白熊48 | C50: =[数值系统.xls]卡牌基础属性参考!R[2]C[2]*0.7 -> 4556.66279060934 | D50: =[数值系统.xls]卡牌基础属性参考!R[2]C[6]*0.9 -> 15232.2727571798 | E50: 10 | F50: 10 | G50: 47
A51: 10047 | B51: 白熊49 | C51: =[数值系统.xls]卡牌基础属性参考!R[2]C[2]*0.7 -> 4798.16591851166 | D51: =[数值系统.xls]卡牌基础属性参考!R[2]C[6]*0.9 -> 16039.5832133104 | E51: 10 | F51: 10 | G51: 48
A52: 10048 | B52: 白熊50 | C52: =[数值系统.xls]卡牌基础属性参考!R[2]C[2]*0.7 -> 5047.67054627429 | D52: =[数值系统.xls]卡牌基础属性参考!R[2]C[6]*0.9 -> 16873.6415404026 | E52: 10 | F52: 10 | G52: 49
A53: 10049 | B53: 白熊51 | C53: =[数值系统.xls]卡牌基础属性参考!R[2]C[2]*0.7 -> 5305.10174413431 | D53: =[数值系统.xls]卡牌基础属性参考!R[2]C[6]*0.9 -> 17734.1972589633 | E53: 10 | F53: 10 | G53: 50

Sheet: 任务卡牌配置表
A1: id | B1: 大章 | C1: 卡牌数量 | D1: 所有卡牌 | E1: Boss卡牌 | F1: boss技能触发概率 | G1: Boss加成效果 | H1: 阵型 | I1: 每小关攻击加成 | J1: 每小关生命加成 | K1: 掉落卡牌最大数量
A2: id | B2: chepter_id | C2: card_count | D2: cards | E2: boss | F2: trigger_rate | G2: boss_attr | H2: formation | I2: point_atk_inc | J2: point_hp_inc | K2: max_drop_card_number
A3: 1 | B3: 遇到上帝的 | C3: 2 | D3: 10000#10001 | E3: 10001 | F3: 30 | G3: 30 | H3: 1,10000;2,10001 | I3: 5 | J3: 5 | K3: 1
A4: 2 | B4: 遇到上帝的 | C4: 3 | D4: 10000#10001#10002 | E4: 10001 | F4: 30 | G4: 30 | H4: 1,10000;2,10001;3,10002 | I4: 5 | J4: 5 | K4: 1
A5: 3 | B5: 遇到上帝的 | C5: 3 | D5: 10000#10001#10002 | E5: 10001 | F5: 30 | G5: 30 | H5: 1,10000;2,10001;3,10002 | I5: 5 | J5: 5 | K5: 1
A6: 4 | B6: 遇到上帝的 | C6: 3 | D6: 10000#10001#10002 | E6: 10001 | F6: 30 | G6: 30 | H6: 1,10000;2,10001;3,10002 | I6: 5 | J6: 5 | K6: 1
A7: 5 | B7: 遇到上帝的 | C7: 3 | D7: 10000#10001#10002 | E7: 10001 | F7: 30 | G7: 30 | H7: 1,10000;2,10001;3,10002 | I7: 5 | J7: 5 | K7: 1
A8: 6 | B8: 遇到上帝的 | C8: 4 | D8: 10000#10001#10002#10004 | E8: 10001 | F8: 30 | G8: 30 | H8: 1,10000;2,10001;3,10002;4,10003 | I8: 5 | J8: 5 | K8: 1
A9: 7 | B9: 遇到上帝的 | C9: 4 | D9: 10000#10001#10002#10004 | E9: 10001 | F9: 30 | G9: 30 | H9: 1,10000;2,10001;3,10002;4,10003 | I9: 5 | J9: 5 | K9: 1
A10: 8 | B10: 遇到上帝的 | C10: 4 | D10: 10000#10001#10002#10004 | E10: 10001 | F10: 30 | G10: 30 | H10: 1,10000;2,10001;3,10002;4,10003 | I10: 5 | J10: 5 | K10: 1
A11: 9 | B11: 遇到上帝的 | C11: 4 | D11: 10000#10001#10002#10004 | E11: 10001 | F11: 30 | G11: 30 | H11: 1,10000;2,10001;3,10002;4,10003 | I11: 5 | J11: 5 | K11: 1
A12: 10 | B12: 遇到上帝的 | C12: 4 | D12: 10000#10001#10002#10004 | E12: 10001 | F12: 30 | G12: 30 | H12: 1,10000;2,10001;3,10002;4,10003 | I12: 5 | J12: 5 | K12: 1
A13: 11 | B13: 遇到上帝的 | C13: 4 | D13: 10000#10001#10002#10004 | E13: 10001 | F13: 30 | G13: 30 | H13: 1,10000;2,10001;3,10002;4,10003 | I13: 5 | J13: 5 | K13: 1
A14: 12 | B14: 遇到上帝的 | C14: 4 | D14: 10000#10001#10002#10004 | E14: 10001 | F14: 30 | G14: 30 | H14: 1,10000;2,10001;3,10002;4,10003 | I14: 5 | J14: 5 | K14: 1
A15: 13 | B15: 遇到上帝的 | C15: 4 | D15: 10000#10001#10002#10004 | E15: 10001 | F15: 30 | G15: 30 | H15: 1,10000;2,10001;3,10002;4,10003 | I15: 5 | J15: 5 | K15: 1
A16: 14 | B16: 遇到上帝的 | C16: 4 | D16: 10000#10001#10002#10004 | E16: 10001 | F16: 30 | G16: 30 | H16: 1,10000;2,10001;3,10002;4,10003 | I16: 5 | J16: 5 | K16: 1
A17: 15 | B17: 遇到上帝的 | C17: 4 | D17: 10000#10001#10002#10004 | E17: 10001 | F17: 30 | G17: 30 | H17: 1,10000;2,10001;3,10002;4,10003 | I17: 5 | J17: 5 | K17: 1
A18: 16 | B18: 遇到上帝的 | C18: 5 | D18: 10000#10001#10002#10004#10005 | E18: 10001 | F18: 30 | G18: 30 | H18: 1,10000;2,10001;3,10002;4,10003;5,10004 | I18: 5 | J18: 5 | K18: 1
A19: 17 | B19: 遇到上帝的 | C19: 5 | D19: 10000#10001#10002#10004#10005 | E19: 10001 | F19: 30 | G19: 30 | H19: 1,10000;2,10001;3,10002;4,10003;5,10004 | I19: 5 | J19: 5 | K19: 1
A20: 18 | B20: 遇到上帝的 | C20: 5 | D20: 10000#10001#10002#10004#10005 | E20: 10001 | F20: 30 | G20: 30 | H20: 1,10000;2,10001;3,10002;4,10003;5,10004 | I20: 5 | J20: 5 | K20: 1
A21: 19 | B21: 遇到上帝的 | C21: 5 | D21: 10000#10001#10002#10004#10005 | E21: 10001 | F21: 30 | G21: 30 | H21: 1,10000;2,10001;3,10002;4,10003;5,10004 | I21: 5 | J21: 5 | K21: 1
A22: 20 | B22: 遇到上帝的 | C22: 5 | D22: 10000#10001#10002#10004#10005 | E22: 10001 | F22: 30 | G22: 30 | H22: 1,10000;2,10001;3,10002;4,10003;5,10004 | I22: 5 | J22: 5 | K22: 1
A23: 21 | B23: 遇到上帝的 | C23: 5 | D23: 10000#10001#10002#10004#10005 | E23: 10001 | F23: 30 | G23: 30 | H23: 1,10000;2,10001;3,10002;4,10003;5,10004 | I23: 5 | J23: 5 | K23: 1
A24: 22 | B24: 遇到上帝的 | C24: 5 | D24: 10000#10001#10002#10004#10005 | E24: 10001 | F24: 30 | G24: 30 | H24: 1,10000;2,10001;3,10002;4,10003;5,10004 | I24: 5 | J24: 5 | K24: 1
A25: 23 | B25: 遇到上帝的 | C25: 5 | D25: 10000#10001#10002#10004#10005 | E25: 10001 | F25: 30 | G25: 30 | H25: 1,10000;2,10001;3,10002;4,10003;5,10004 | I25: 5 | J25: 5 | K25: 1
A26: 24 | B26: 遇到上帝的 | C26: 5 | D26: 10000#10001#10002#10004#10005 | E26: 10001 | F26: 30 | G26: 30 | H26: 1,10000;2,10001;3,10002;4,10003;5,10004 | I26: 5 | J26: 5 | K26: 1
A27: 25 | B27: 遇到上帝的 | C27: 5 | D27: 10000#10001#10002#10004#10005 | E27: 10001 | F27: 30 | G27: 30 | H27: 1,10000;2,10001;3,10002;4,10003;5,10004 | I27: 5 | J27: 5 | K27: 1
A28: 26 | B28: 遇到上帝的 | C28: 5 | D28: 10000#10001#10002#10004#10005 | E28: 10001 | F28: 30 | G28: 30 | H28: 1,10000;2,10001;3,10002;4,10003;5,10004 | I28: 5 | J28: 5 | K28: 1
A29: 27 | B29: 遇到上帝的 | C29: 5 | D29: 10000#10001#10002#10004#10005 | E29: 10001 | F29: 30 | G29: 30 | H29: 1,10000;2,10001;3,10002;4,10003;5,10004 | I29: 5 | J29: 5 | K29: 1
A30: 28 | B30: 遇到上帝的 | C30: 5 | D30: 10000#10001#10002#10004#10005 | E30: 10001 | F30: 30 | G30: 30 | H30: 1,10000;2,10001;3,10002;4,10003;5,10004 | I30: 5 | J30: 5 | K30: 1
A31: 29 | B31: 遇到上帝的 | C31: 5 | D31: 10000#10001#10002#10004#10005 | E31: 10001 | F31: 30 | G31: 30 | H31: 1,10000;2,10001;3,10002;4,10003;5,10004 | I31: 5 | J31: 5 | K31: 1
A32: 30 | B32: 遇到上帝的 | C32: 5 | D32: 10000#10001#10002#10004#10005 | E32: 10001 | F32: 30 | G32: 30 | H32: 1,10000;2,10001;3,10002;4,10003;5,10004 | I32: 5 | J32: 5 | K32: 1
A33: 31 | B33: 遇到上帝的 | C33: 5 | D33: 10000#10001#10002#10004#10005 | E33: 10001 | F33: 30 | G33: 30 | H33: 1,10000;2,10001;3,10002;4,10003;5,10004 | I33: 5 | J33: 5 | K33: 1
A34: 32 | B34: 遇到上帝的 | C34: 5 | D34: 10000#10001#10002#10004#10005 | E34: 10001 | F34: 30 | G34: 30 | H34: 1,10000;2,10001;3,10002;4,10003;5,10004 | I34: 5 | J34: 5 | K34: 1
A35: 33 | B35: 遇到上帝的 | C35: 5 | D35: 10000#10001#10002#10004#10005 | E35: 10001 | F35: 30 | G35: 30 | H35: 1,10000;2,10001;3,10002;4,10003;5,10004 | I35: 5 | J35: 5 | K35: 1
A36: 34 | B36: 遇到上帝的 | C36: 5 | D36: 10000#10001#10002#10004#10005 | E36: 10001 | F36: 30 | G36: 30 | H36: 1,10000;2,10001;3,10002;4,10003;5,10004 | I36: 5 | J36: 5 | K36: 1
A37: 35 | B37: 遇到上帝的 | C37: 5 | D37: 10000#10001#10002#10004#10005 | E37: 10001 | F37: 30 | G37: 30 | H37: 1,10000;2,10001;3,10002;4,10003;5,10004 | I37: 5 | J37: 5 | K37: 1
A38: 36 | B38: 遇到上帝的 | C38: 5 | D38: 10000#10001#10002#10004#10005 | E38: 10001 | F38: 30 | G38: 30 | H38: 1,10000;2,10001;3,10002;4,10003;5,10004 | I38: 5 | J38: 5 | K38: 1
A39: 37 | B39: 遇到上帝的 | C39: 5 | D39: 10000#10001#10002#10004#10005 | E39: 10001 | F39: 30 | G39: 30 | H39: 1,10000;2,10001;3,10002;4,10003;5,10004 | I39: 5 | J39: 5 | K39: 1
A40: 38 | B40: 遇到上帝的 | C40: 5 | D40: 10000#10001#10002#10004#10005 | E40: 10001 | F40: 30 | G40: 30 | H40: 1,10000;2,10001;3,10002;4,10003;5,10004 | I40: 5 | J40: 5 | K40: 1
A41: 39 | B41: 遇到上帝的 | C41: 5 | D41: 10000#10001#10002#10004#10005 | E41: 10001 | F41: 30 | G41: 30 | H41: 1,10000;2,10001;3,10002;4,10003;5,10004 | I41: 5 | J41: 5 | K41: 1
A42: 40 | B42: 遇到上帝的 | C42: 5 | D42: 10000#10001#10002#10004#10005 | E42: 10001 | F42: 30 | G42: 30 | H42: 1,10000;2,10001;3,10002;4,10003;5,10004 | I42: 5 | J42: 5 | K42: 1
A43: 41 | B43: 遇到上帝的 | C43: 5 | D43: 10000#10001#10002#10004#10005 | E43: 10001 | F43: 30 | G43: 30 | H43: 1,10000;2,10001;3,10002;4,10003;5,10004 | I43: 5 | J43: 5 | K43: 1
A44: 42 | B44: 遇到上帝的 | C44: 5 | D44: 10000#10001#10002#10004#10005 | E44: 10001 | F44: 30 | G44: 30 | H44: 1,10000;2,10001;3,10002;4,10003;5,10004 | I44: 5 | J44: 5 | K44: 1
A45: 43 | B45: 遇到上帝的 | C45: 5 | D45: 10000#10001#10002#10004#10005 | E45: 10001 | F45: 30 | G45: 30 | H45: 1,10000;2,10001;3,10002;4,10003;5,10004 | I45: 5 | J45: 5 | K45: 1
A46: 44 | B46: 遇到上帝的 | C46: 5 | D46: 10000#10001#10002#10004#10005 | E46: 10001 | F46: 30 | G46: 30 | H46: 1,10000;2,10001;3,10002;4,10003;5,10004 | I46: 5 | J46: 5 | K46: 1
A47: 45 | B47: 遇到上帝的 | C47: 5 | D47: 10000#10001#10002#10004#10005 | E47: 10001 | F47: 30 | G47: 30 | H47: 1,10000;2,10001;3,10002;4,10003;5,10004 | I47: 5 | J47: 5 | K47: 1
A48: 46 | B48: 遇到上帝的 | C48: 5 | D48: 10000#10001#10002#10004#10005 | E48: 10001 | F48: 30 | G48: 30 | H48: 1,10000;2,10001;3,10002;4,10003;5,10004 | I48: 5 | J48: 5 | K48: 1
A49: 47 | B49: 遇到上帝的 | C49: 5 | D49: 10000#10001#10002#10004#10005 | E49: 10001 | F49: 30 | G49: 30 | H49: 1,10000;2,10001;3,10002;4,10003;5,10004 | I49: 5 | J49: 5 | K49: 1
A50: 48 | B50: 遇到上帝的 | C50: 5 | D50: 10000#10001#10002#10004#10005 | E50: 10001 | F50: 30 | G50: 30 | H50: 1,10000;2,10001;3,10002;4,10003;5,10004 | I50: 5 | J50: 5 | K50: 1
A51: 49 | B51: 遇到上帝的 | C51: 5 | D51: 10000#10001#10002#10004#10005 | E51: 10001 | F51: 30 | G51: 30 | H51: 1,10000;2,10001;3,10002;4,10003;5,10004 | I51: 5 | J51: 5 | K51: 1
A52: 50 | B52: 遇到上帝的 | C52: 5 | D52: 10000#10001#10002#10004#10005 | E52: 10001 | F52: 30 | G52: 30 | H52: 1,10000;2,10001;3,10002;4,10003;5,10004 | I52: 5 | J52: 5 | K52: 1

Sheet: 关卡怪物属性表
A1: id | B1: 卡牌名称 | C1: 攻击力 | D1: 生命值 | E1: 闪避率 | F1: 暴击率 | G1: 技能ID
A2: id | B2: name | C2: atk | D2: hp | E2: dodge_rate | F2: crit_rate | G2: skill_id
A3: 20001 | B3: 白熊1 | C3: 246.438125312245 | D3: 739.314375936735 | E3: 10 | F3: 10 | G3: 1
A4: 20002 | B4: 白熊2 | C4: 246.438125312245 | D4: 739.314375936735 | E4: 10 | F4: 10 | G4: 2
A5: 20003 | B5: 白熊3 | C5: 246.438125312245 | D5: 739.314375936735 | E5: 10 | F5: 10 | G5: 3
A6: 20004 | B6: 白熊4 | C6: 246.438125312245 | D6: 739.314375936735 | E6: 10 | F6: 10 | G6: 4
A7: 20005 | B7: 白熊5 | C7: 246.438125312245 | D7: 739.314375936735 | E7: 10 | F7: 10 | G7: 5
A8: 20006 | B8: 白熊6 | C8: 385.825370619497 | D8: 1157.47611185849 | E8: 10 | F8: 10 | G8: 6
A9: 20007 | B9: 白熊7 | C9: 385.825370619497 | D9: 1157.47611185849 | E9: 10 | F9: 10 | G9: 7
A10: 20008 | B10: 白熊8 | C10: 385.825370619497 | D10: 1157.47611185849 | E10: 10 | F10: 10 | G10: 8
A11: 20009 | B11: 白熊9 | C11: 385.825370619497 | D11: 1157.47611185849 | E11: 10 | F11: 10 | G11: 9
A12: 20010 | B12: 白熊10 | C12: 385.825370619497 | D12: 1157.47611185849 | E12: 10 | F12: 10 | G12: 10
A13: 20011 | B13: 白熊11 | C13: 590.031735574089 | D13: 1770.09520672227 | E13: 10 | F13: 10 | G13: 11
A14: 20012 | B14: 白熊12 | C14: 590.031735574089 | D14: 1770.09520672227 | E14: 10 | F14: 10 | G14: 12
A15: 20013 | B15: 白熊13 | C15: 590.031735574089 | D15: 1770.09520672227 | E15: 10 | F15: 10 | G15: 13
A16: 20014 | B16: 白熊14 | C16: 590.031735574089 | D16: 1770.09520672227 | E16: 10 | F16: 10 | G16: 14
A17: 20015 | B17: 白熊15 | C17: 590.031735574089 | D17: 1770.09520672227 | E17: 10 | F17: 10 | G17: 15
A18: 20016 | B18: 白熊16 | C18: 881.300687752944 | D18: 2643.90206325883 | E18: 10 | F18: 10 | G18: 16
A19: 20017 | B19: 白熊17 | C19: 881.300687752944 | D19: 2643.90206325883 | E19: 10 | F19: 10 | G19: 17
A20: 20018 | B20: 白熊18 | C20: 881.300687752944 | D20: 2643.90206325883 | E20: 10 | F20: 10 | G20: 18
A21: 20019 | B21: 白熊19 | C21: 881.300687752944 | D21: 2643.90206325883 | E21: 10 | F21: 10 | G21: 19
A22: 20020 | B22: 白熊20 | C22: 881.300687752944 | D22: 2643.90206325883 | E22: 10 | F22: 10 | G22: 20
A23: 20021 | B23: 白熊21 | C23: 1285.57813080895 | D23: 3856.73439242684 | E23: 10 | F23: 10 | G23: 21
A24: 20022 | B24: 白熊22 | C24: 1285.57813080895 | D24: 3856.73439242684 | E24: 10 | F24: 10 | G24: 22
A25: 20023 | B25: 白熊23 | C25: 1285.57813080895 | D25: 3856.73439242684 | E25: 10 | F25: 10 | G25: 23
A26: 20024 | B26: 白熊24 | C26: 1285.57813080895 | D26: 3856.73439242684 | E26: 10 | F26: 10 | G26: 24
A27: 20025 | B27: 白熊25 | C27: 1285.57813080895 | D27: 3856.73439242684 | E27: 10 | F27: 10 | G27: 25
A28: 20026 | B28: 白熊26 | C28: 1952.16369050309 | D28: 5856.49107150928 | E28: 10 | F28: 10 | G28: 26
A29: 20027 | B29: 白熊27 | C29: 1952.16369050309 | D29: 5856.49107150928 | E29: 10 | F29: 10 | G29: 27
A30: 20028 | B30: 白熊28 | C30: 1952.16369050309 | D30: 5856.49107150928 | E30: 10 | F30: 10 | G30: 28
A31: 20029 | B31: 白熊29 | C31: 1952.16369050309 | D31: 5856.49107150928 | E31: 10 | F31: 10 | G31: 29
A32: 20030 | B32: 白熊30 | C32: 1952.16369050309 | D32: 5856.49107150928 | E32: 10 | F32: 10 | G32: 30
A33: 20031 | B33: 白熊31 | C33: 2702.59397018539 | D33: 8107.78191055618 | E33: 10 | F33: 10 | G33: 31
A34: 20032 | B34: 白熊32 | C34: 2702.59397018539 | D34: 8107.78191055618 | E34: 10 | F34: 10 | G34: 32
A35: 20033 | B35: 白熊33 | C35: 2702.59397018539 | D35: 8107.78191055618 | E35: 10 | F35: 10 | G35: 33
A36: 20034 | B36: 白熊34 | C36: 2702.59397018539 | D36: 8107.78191055618 | E36: 10 | F36: 10 | G36: 34
A37: 20035 | B37: 白熊35 | C37: 2702.59397018539 | D37: 8107.78191055618 | E37: 10 | F37: 10 | G37: 35
A38: 20036 | B38: 白熊36 | C38: 3652.92175320789 | D38: 10958.7652596237 | E38: 10 | F38: 10 | G38: 36
A39: 20037 | B39: 白熊37 | C39: 3652.92175320789 | D39: 10958.7652596237 | E39: 10 | F39: 10 | G39: 37
A40: 20038 | B40: 白熊38 | C40: 3652.92175320789 | D40: 10958.7652596237 | E40: 10 | F40: 10 | G40: 38
A41: 20039 | B41: 白熊39 | C41: 3652.92175320789 | D41: 10958.7652596237 | E41: 10 | F41: 10 | G41: 39
A42: 20040 | B42: 白熊40 | C42: 3652.92175320789 | D42: 10958.7652596237 | E42: 10 | F42: 10 | G42: 40
A43: 20041 | B43: 白熊41 | C43: 4586.16923918636 | D43: 13758.5077175591 | E43: 10 | F43: 10 | G43: 41
A44: 20042 | B44: 白熊42 | C44: 4586.16923918636 | D44: 13758.5077175591 | E44: 10 | F44: 10 | G44: 42
A45: 20043 | B45: 白熊43 | C45: 4586.16923918636 | D45: 13758.5077175591 | E45: 10 | F45: 10 | G45: 43
A46: 20044 | B46: 白熊44 | C46: 4586.16923918636 | D46: 13758.5077175591 | E46: 10 | F46: 10 | G46: 44
A47: 20045 | B47: 白熊45 | C47: 4586.16923918636 | D47: 13758.5077175591 | E47: 10 | F47: 10 | G47: 45
A48: 20046 | B48: 白熊46 | C48: 5664.2267395392 | D48: 14726.9895228019 | E48: 10 | F48: 10 | G48: 46
A49: 20047 | B49: 白熊47 | C49: 5664.2267395392 | D49: 14726.9895228019 | E49: 10 | F49: 10 | G49: 47
A50: 20048 | B50: 白熊48 | C50: 5664.2267395392 | D50: 14726.9895228019 | E50: 10 | F50: 10 | G50: 48
A51: 20049 | B51: 白熊49 | C51: 5664.2267395392 | D51: 14726.9895228019 | E51: 10 | F51: 10 | G51: 49
A52: 20050 | B52: 白熊50 | C52: 5664.2267395392 | D52: 14726.9895228019 | E52: 10 | F52: 10 | G52: 50
A53: 20051 | B53: 白熊51 | C53: 7160.47009952896 | D53: 18617.2222587753 | E53: 10 | F53: 10 | G53: 51
A54: 20052 | B54: 白熊52 | C54: 7160.47009952896 | D54: 18617.2222587753 | E54: 10 | F54: 10 | G54: 52
A55: 20053 | B55: 白熊53 | C55: 7160.47009952896 | D55: 18617.2222587753 | E55: 10 | F55: 10 | G55: 53
A56: 20054 | B56: 白熊54 | C56: 7160.47009952896 | D56: 18617.2222587753 | E56: 10 | F56: 10 | G56: 54
A57: 20055 | B57: 白熊55 | C57: 7160.47009952896 | D57: 18617.2222587753 | E57: 10 | F57: 10 | G57: 55
A58: 20056 | B58: 白熊56 | C58: 8912.57093014569 | D58: 23172.6844183788 | E58: 10 | F58: 10 | G58: 56
A59: 20057 | B59: 白熊57 | C59: 8912.57093014569 | D59: 23172.6844183788 | E59: 10 | F59: 10 | G59: 57
A60: 20058 | B60: 白熊58 | C60: 8912.57093014569 | D60: 23172.6844183788 | E60: 10 | F60: 10 | G60: 58
A61: 20059 | B61: 白熊59 | C61: 8912.57093014569 | D61: 23172.6844183788 | E61: 10 | F61: 10 | G61: 59
A62: 20060 | B62: 白熊60 | C62: 8912.57093014569 | D62: 23172.6844183788 | E62: 10 | F62: 10 | G62: 60
A63: 20061 | B63: 白熊61 | C63: 10922.0702333164 | D63: 28397.3826066226 | E63: 10 | F63: 10 | G63: 61
A64: 20062 | B64: 白熊62 | C64: 10922.0702333164 | D64: 28397.3826066226 | E64: 10 | F64: 10 | G64: 62
A65: 20063 | B65: 白熊63 | C65: 10922.0702333164 | D65: 28397.3826066226 | E65: 10 | F65: 10 | G65: 63
A66: 20064 | B66: 白熊64 | C66: 10922.0702333164 | D66: 28397.3826066226 | E66: 10 | F66: 10 | G66: 64
A67: 20065 | B67: 白熊65 | C67: 10922.0702333164 | D67: 28397.3826066226 | E67: 10 | F67: 10 | G67: 65
A68: 20066 | B68: 白熊66 | C68: 13177.3147433843 | D68: 34261.0183327991 | E68: 10 | F68: 10 | G68: 66
A69: 20067 | B69: 白熊67 | C69: 13177.3147433843 | D69: 34261.0183327991 | E69: 10 | F69: 10 | G69: 67
A70: 20068 | B70: 白熊68 | C70: 13177.3147433843 | D70: 34261.0183327991 | E70: 10 | F70: 10 | G70: 68
A71: 20069 | B71: 白熊69 | C71: 13177.3147433843 | D71: 34261.0183327991 | E71: 10 | F71: 10 | G71: 69
A72: 20070 | B72: 白熊70 | C72: 13177.3147433843 | D72: 34261.0183327991 | E72: 10 | F72: 10 | G72: 70
A73: 20071 | B73: 白熊71 | C73: 15078.2365992865 | D73: 39203.4151581448 | E73: 10 | F73: 10 | G73: 71
A74: 20072 | B74: 白熊72 | C74: 15078.2365992865 | D74: 39203.4151581448 | E74: 10 | F74: 10 | G74: 72
A75: 20073 | B75: 白熊73 | C75: 15078.2365992865 | D75: 39203.4151581448 | E75: 10 | F75: 10 | G75: 73
A76: 20074 | B76: 白熊74 | C76: 15078.2365992865 | D76: 39203.4151581448 | E76: 10 | F76: 10 | G76: 74
A77: 20075 | B77: 白熊75 | C77: 15078.2365992865 | D77: 39203.4151581448 | E77: 10 | F77: 10 | G77: 75
A78: 20076 | B78: 白熊76 | C78: 17321.5574114744 | D78: 43303.893528686 | E78: 10 | F78: 10 | G78: 76
A79: 20077 | B79: 白熊77 | C79: 17321.5574114744 | D79: 43303.893528686 | E79: 10 | F79: 10 | G79: 77
A80: 20078 | B80: 白熊78 | C80: 17321.5574114744 | D80: 43303.893528686 | E80: 10 | F80: 10 | G80: 78
A81: 20079 | B81: 白熊79 | C81: 17321.5574114744 | D81: 43303.893528686 | E81: 10 | F81: 10 | G81: 79
A82: 20080 | B82: 白熊80 | C82: 17321.5574114744 | D82: 43303.893528686 | E82: 10 | F82: 10 | G82: 80
A83: 20081 | B83: 白熊81 | C83: 20153.9500980272 | D83: 50384.875245068 | E83: 10 | F83: 10 | G83: 81
A84: 20082 | B84: 白熊82 | C84: 20153.9500980272 | D84: 50384.875245068 | E84: 10 | F84: 10 | G84: 82
A85: 20083 | B85: 白熊83 | C85: 20153.9500980272 | D85: 50384.875245068 | E85: 10 | F85: 10 | G85: 83
A86: 20084 | B86: 白熊84 | C86: 20153.9500980272 | D86: 50384.875245068 | E86: 10 | F86: 10 | G86: 84
A87: 20085 | B87: 白熊85 | C87: 20153.9500980272 | D87: 50384.875245068 | E87: 10 | F87: 10 | G87: 85
A88: 20086 | B88: 白熊86 | C88: 22305.2369158813 | D88: 55763.0922897033 | E88: 10 | F88: 10 | G88: 86
A89: 20087 | B89: 白熊87 | C89: 22305.2369158813 | D89: 55763.0922897033 | E89: 10 | F89: 10 | G89: 87
A90: 20088 | B90: 白熊88 | C90: 22305.2369158813 | D90: 55763.0922897033 | E90: 10 | F90: 10 | G90: 88
A91: 20089 | B91: 白熊89 | C91: 22305.2369158813 | D91: 55763.0922897033 | E91: 10 | F91: 10 | G91: 89
A92: 20090 | B92: 白熊90 | C92: 22305.2369158813 | D92: 55763.0922897033 | E92: 10 | F92: 10 | G92: 90
A93: 20091 | B93: 白熊91 | C93: 25568.6317432965 | D93: 63921.5793582412 | E93: 10 | F93: 10 | G93: 91
A94: 20092 | B94: 白熊92 | C94: 25568.6317432965 | D94: 63921.5793582412 | E94: 10 | F94: 10 | G94: 92
A95: 20093 | B95: 白熊93 | C95: 25568.6317432965 | D95: 63921.5793582412 | E95: 10 | F95: 10 | G95: 93
A96: 20094 | B96: 白熊94 | C96: 25568.6317432965 | D96: 63921.5793582412 | E96: 10 | F96: 10 | G96: 94
A97: 20095 | B97: 白熊95 | C97: 25568.6317432965 | D97: 63921.5793582412 | E97: 10 | F97: 10 | G97: 95
A98: 20096 | B98: 白熊96 | C98: 29049.4938783147 | D98: 72623.7346957869 | E98: 10 | F98: 10 | G98: 96
A99: 20097 | B99: 白熊97 | C99: 29049.4938783147 | D99: 72623.7346957869 | E99: 10 | F99: 10 | G99: 97
A100: 20098 | B100: 白熊98 | C100: 29049.4938783147 | D100: 72623.7346957869 | E100: 10 | F100: 10 | G100: 98
A101: 20099 | B101: 白熊99 | C101: 29049.4938783147 | D101: 72623.7346957869 | E101: 10 | F101: 10 | G101: 99
A102: 20100 | B102: 白熊100 | C102: 29049.4938783147 | D102: 72623.7346957869 | E102: 10 | F102: 10 | G102: 100

Sheet: 关卡卡牌配置表
A1: id | B1: 层数 | C1: 名称 | D1: 卡牌数量 | E1: 所有卡牌id | F1: 阵型 | G1: boss卡牌id | H1: boos技能触发概率 | I1: boos技能加成效果 | J1: BOSS攻击加成 | K1: BOSS生命加成
A2: id | B2: layer | C2: name | D2: card_count | E2: cards | F2: formation | G2: boss | H2: trigger_rate | I2: boss_attr | J2: atk_inc | K2: hp_inc
A3: 1 | B3: 1 | D3: 2 | E3: 20001#20002 | F3: 1,20001;2,20002 | G3: 20001 | H3: 30 | I3: 30 | J3: 20 | K3: 30
A4: 2 | B4: 2 | D4: 2 | E4: 20001#20002 | F4: 1,20001;2,20002 | G4: 20001 | H4: 30 | I4: 30 | J4: 20 | K4: 30
A5: 3 | B5: 3 | D5: 2 | E5: 20001#20002 | F5: 1,20001;2,20002 | G5: 20001 | H5: 30 | I5: 30 | J5: 20 | K5: 30
A6: 4 | B6: 4 | D6: 2 | E6: 20001#20002 | F6: 1,20001;2,20002 | G6: 20001 | H6: 30 | I6: 30 | J6: 20 | K6: 30
A7: 5 | B7: 5 | D7: 2 | E7: 20001#20002 | F7: 1,20001;2,20002 | G7: 20001 | H7: 30 | I7: 30 | J7: 20 | K7: 30
A8: 6 | B8: 6 | D8: 3 | E8: 20001#20002#20003 | F8: 1,20001;2,20002;3,20003 | G8: 20001 | H8: 30 | I8: 30 | J8: 20 | K8: 30
A9: 7 | B9: 7 | D9: 3 | E9: 20001#20002#20003 | F9: 1,20001;2,20002;3,20003 | G9: 20001 | H9: 30 | I9: 30 | J9: 20 | K9: 30
A10: 8 | B10: 8 | D10: 3 | E10: 20001#20002#20003 | F10: 1,20001;2,20002;3,20003 | G10: 20001 | H10: 30 | I10: 30 | J10: 20 | K10: 30
A11: 9 | B11: 9 | D11: 3 | E11: 20001#20002#20003 | F11: 1,20001;2,20002;3,20003 | G11: 20001 | H11: 30 | I11: 30 | J11: 20 | K11: 30
A12: 10 | B12: 10 | D12: 3 | E12: 20001#20002#20003 | F12: 1,20001;2,20002;3,20003 | G12: 20001 | H12: 30 | I12: 30 | J12: 20 | K12: 30
A13: 11 | B13: 11 | D13: 4 | E13: 20001#20002#20003#20004 | F13: 1,20001;2,20002;3,20003;4,20004 | G13: 20001 | H13: 30 | I13: 30 | J13: 20 | K13: 30
A14: 12 | B14: 12 | D14: 4 | E14: 20001#20002#20003#20004 | F14: 1,20001;2,20002;3,20003;4,20004 | G14: 20001 | H14: 30 | I14: 30 | J14: 20 | K14: 30
A15: 13 | B15: 13 | D15: 4 | E15: 20001#20002#20003#20004 | F15: 1,20001;2,20002;3,20003;4,20004 | G15: 20001 | H15: 30 | I15: 30 | J15: 20 | K15: 30
A16: 14 | B16: 14 | D16: 4 | E16: 20001#20002#20003#20004 | F16: 1,20001;2,20002;3,20003;4,20004 | G16: 20001 | H16: 30 | I16: 30 | J16: 20 | K16: 30
A17: 15 | B17: 15 | D17: 4 | E17: 20001#20002#20003#20004 | F17: 1,20001;2,20002;3,20003;4,20004 | G17: 20001 | H17: 30 | I17: 30 | J17: 20 | K17: 30
A18: 16 | B18: 16 | D18: 4 | E18: 20001#20002#20003#20004 | F18: 1,20001;2,20002;3,20003;4,20004 | G18: 20001 | H18: 30 | I18: 30 | J18: 20 | K18: 30
A19: 17 | B19: 17 | D19: 4 | E19: 20001#20002#20003#20004 | F19: 1,20001;2,20002;3,20003;4,20004 | G19: 20001 | H19: 30 | I19: 30 | J19: 20 | K19: 30
A20: 18 | B20: 18 | D20: 4 | E20: 20001#20002#20003#20004 | F20: 1,20001;2,20002;3,20003;4,20004 | G20: 20001 | H20: 30 | I20: 30 | J20: 20 | K20: 30
A21: 19 | B21: 19 | D21: 4 | E21: 20001#20002#20003#20004 | F21: 1,20001;2,20002;3,20003;4,20004 | G21: 20001 | H21: 30 | I21: 30 | J21: 20 | K21: 30
A22: 20 | B22: 20 | D22: 4 | E22: 20001#20002#20003#20004 | F22: 1,20001;2,20002;3,20003;4,20004 | G22: 20001 | H22: 30 | I22: 30 | J22: 20 | K22: 30
A23: 21 | B23: 21 | D23: 4 | E23: 20001#20002#20003#20004 | F23: 1,20001;2,20002;3,20003;4,20004 | G23: 20001 | H23: 30 | I23: 30 | J23: 20 | K23: 30
A24: 22 | B24: 22 | D24: 4 | E24: 20001#20002#20003#20004 | F24: 1,20001;2,20002;3,20003;4,20004 | G24: 20001 | H24: 30 | I24: 30 | J24: 20 | K24: 30
A25: 23 | B25: 23 | D25: 4 | E25: 20001#20002#20003#20004 | F25: 1,20001;2,20002;3,20003;4,20004 | G25: 20001 | H25: 30 | I25: 30 | J25: 20 | K25: 30
A26: 24 | B26: 24 | D26: 4 | E26: 20001#20002#20003#20004 | F26: 1,20001;2,20002;3,20003;4,20004 | G26: 20001 | H26: 30 | I26: 30 | J26: 20 | K26: 30
A27: 25 | B27: 25 | D27: 4 | E27: 20001#20002#20003#20004 | F27: 1,20001;2,20002;3,20003;4,20004 | G27: 20001 | H27: 30 | I27: 30 | J27: 20 | K27: 30
A28: 26 | B28: 26 | D28: 5 | E28: 20001#20002#20003#20004#20005 | F28: 1,20001;2,20002;3,20003;4,20004;5,20005 | G28: 20001 | H28: 30 | I28: 30 | J28: 20 | K28: 30
A29: 27 | B29: 27 | D29: 5 | E29: 20001#20002#20003#20004#20005 | F29: 1,20001;2,20002;3,20003;4,20004;5,20005 | G29: 20001 | H29: 30 | I29: 30 | J29: 20 | K29: 30
A30: 28 | B30: 28 | D30: 5 | E30: 20001#20002#20003#20004#20005 | F30: 1,20001;2,20002;3,20003;4,20004;5,20005 | G30: 20001 | H30: 30 | I30: 30 | J30: 20 | K30: 30
A31: 29 | B31: 29 | D31: 5 | E31: 20001#20002#20003#20004#20005 | F31: 1,20001;2,20002;3,20003;4,20004;5,20005 | G31: 20001 | H31: 30 | I31: 30 | J31: 20 | K31: 30
A32: 30 | B32: 30 | D32: 5 | E32: 20001#20002#20003#20004#20005 | F32: 1,20001;2,20002;3,20003;4,20004;5,20005 | G32: 20001 | H32: 30 | I32: 30 | J32: 20 | K32: 30
A33: 31 | B33: 31 | D33: 5 | E33: 20001#20002#20003#20004#20005 | F33: 1,20001;2,20002;3,20003;4,20004;5,20005 | G33: 20001 | H33: 30 | I33: 30 | J33: 20 | K33: 30
A34: 32 | B34: 32 | D34: 5 | E34: 20001#20002#20003#20004#20005 | F34: 1,20001;2,20002;3,20003;4,20004;5,20005 | G34: 20001 | H34: 30 | I34: 30 | J34: 20 | K34: 30
A35: 33 | B35: 33 | D35: 5 | E35: 20001#20002#20003#20004#20005 | F35: 1,20001;2,20002;3,20003;4,20004;5,20005 | G35: 20001 | H35: 30 | I35: 30 | J35: 20 | K35: 30
A36: 34 | B36: 34 | D36: 5 | E36: 20001#20002#20003#20004#20005 | F36: 1,20001;2,20002;3,20003;4,20004;5,20005 | G36: 20001 | H36: 30 | I36: 30 | J36: 20 | K36: 30
A37: 35 | B37: 35 | D37: 5 | E37: 20001#20002#20003#20004#20005 | F37: 1,20001;2,20002;3,20003;4,20004;5,20005 | G37: 20001 | H37: 30 | I37: 30 | J37: 20 | K37: 30
A38: 36 | B38: 36 | D38: 5 | E38: 20001#20002#20003#20004#20005 | F38: 1,20001;2,20002;3,20003;4,20004;5,20005 | G38: 20001 | H38: 30 | I38: 30 | J38: 20 | K38: 30
A39: 37 | B39: 37 | D39: 5 | E39: 20001#20002#20003#20004#20005 | F39: 1,20001;2,20002;3,20003;4,20004;5,20005 | G39: 20001 | H39: 30 | I39: 30 | J39: 20 | K39: 30
A40: 38 | B40: 38 | D40: 5 | E40: 20001#20002#20003#20004#20005 | F40: 1,20001;2,20002;3,20003;4,20004;5,20005 | G40: 20001 | H40: 30 | I40: 30 | J40: 20 | K40: 30
A41: 39 | B41: 39 | D41: 5 | E41: 20001#20002#20003#20004#20005 | F41: 1,20001;2,20002;3,20003;4,20004;5,20005 | G41: 20001 | H41: 30 | I41: 30 | J41: 20 | K41: 30
A42: 40 | B42: 40 | D42: 5 | E42: 20001#20002#20003#20004#20005 | F42: 1,20001;2,20002;3,20003;4,20004;5,20005 | G42: 20001 | H42: 30 | I42: 30 | J42: 20 | K42: 30
A43: 41 | B43: 41 | D43: 5 | E43: 20001#20002#20003#20004#20005 | F43: 1,20001;2,20002;3,20003;4,20004;5,20005 | G43: 20001 | H43: 30 | I43: 30 | J43: 20 | K43: 30
A44: 42 | B44: 42 | D44: 5 | E44: 20001#20002#20003#20004#20005 | F44: 1,20001;2,20002;3,20003;4,20004;5,20005 | G44: 20001 | H44: 30 | I44: 30 | J44: 20 | K44: 30
A45: 43 | B45: 43 | D45: 5 | E45: 20001#20002#20003#20004#20005 | F45: 1,20001;2,20002;3,20003;4,20004;5,20005 | G45: 20001 | H45: 30 | I45: 30 | J45: 20 | K45: 30
A46: 44 | B46: 44 | D46: 5 | E46: 20001#20002#20003#20004#20005 | F46: 1,20001;2,20002;3,20003;4,20004;5,20005 | G46: 20001 | H46: 30 | I46: 30 | J46: 20 | K46: 30
A47: 45 | B47: 45 | D47: 5 | E47: 20001#20002#20003#20004#20005 | F47: 1,20001;2,20002;3,20003;4,20004;5,20005 | G47: 20001 | H47: 30 | I47: 30 | J47: 20 | K47: 30
A48: 46 | B48: 46 | D48: 5 | E48: 20001#20002#20003#20004#20005 | F48: 1,20001;2,20002;3,20003;4,20004;5,20005 | G48: 20001 | H48: 30 | I48: 30 | J48: 20 | K48: 30
A49: 47 | B49: 47 | D49: 5 | E49: 20001#20002#20003#20004#20005 | F49: 1,20001;2,20002;3,20003;4,20004;5,20005 | G49: 20001 | H49: 30 | I49: 30 | J49: 20 | K49: 30
A50: 48 | B50: 48 | D50: 5 | E50: 20001#20002#20003#20004#20005 | F50: 1,20001;2,20002;3,20003;4,20004;5,20005 | G50: 20001 | H50: 30 | I50: 30 | J50: 20 | K50: 30
A51: 49 | B51: 49 | D51: 5 | E51: 20001#20002#20003#20004#20005 | F51: 1,20001;2,20002;3,20003;4,20004;5,20005 | G51: 20001 | H51: 30 | I51: 30 | J51: 20 | K51: 30
A52: 50 | B52: 50 | D52: 5 | E52: 20001#20002#20003#20004#20005 | F52: 1,20001;2,20002;3,20003;4,20004;5,20005 | G52: 20001 | H52: 30 | I52: 30 | J52: 20 | K52: 30
A53: 51 | B53: 51 | D53: 5 | E53: 20001#20002#20003#20004#20005 | F53: 1,20001;2,20002;3,20003;4,20004;5,20005 | G53: 20001 | H53: 30 | I53: 30 | J53: 20 | K53: 30
A54: 52 | B54: 52 | D54: 5 | E54: 20001#20002#20003#20004#20005 | F54: 1,20001;2,20002;3,20003;4,20004;5,20005 | G54: 20001 | H54: 30 | I54: 30 | J54: 20 | K54: 30
A55: 53 | B55: 53 | D55: 5 | E55: 20001#20002#20003#20004#20005 | F55: 1,20001;2,20002;3,20003;4,20004;5,20005 | G55: 20001 | H55: 30 | I55: 30 | J55: 20 | K55: 30
A56: 54 | B56: 54 | D56: 5 | E56: 20001#20002#20003#20004#20005 | F56: 1,20001;2,20002;3,20003;4,20004;5,20005 | G56: 20001 | H56: 30 | I56: 30 | J56: 20 | K56: 30
A57: 55 | B57: 55 | D57: 5 | E57: 20001#20002#20003#20004#20005 | F57: 1,20001;2,20002;3,20003;4,20004;5,20005 | G57: 20001 | H57: 30 | I57: 30 | J57: 20 | K57: 30
A58: 56 | B58: 56 | D58: 5 | E58: 20001#20002#20003#20004#20005 | F58: 1,20001;2,20002;3,20003;4,20004;5,20005 | G58: 20001 | H58: 30 | I58: 30 | J58: 20 | K58: 30
A59: 57 | B59: 57 | D59: 5 | E59: 20001#20002#20003#20004#20005 | F59: 1,20001;2,20002;3,20003;4,20004;5,20005 | G59: 20001 | H59: 30 | I59: 30 | J59: 20 | K59: 30
A60: 58 | B60: 58 | D60: 5 | E60: 20001#20002#20003#20004#20005 | F60: 1,20001;2,20002;3,20003;4,20004;5,20005 | G60: 20001 | H60: 30 | I60: 30 | J60: 20 | K60: 30
A61: 59 | B61: 59 | D61: 5 | E61: 20001#20002#20003#20004#20005 | F61: 1,20001;2,20002;3,20003;4,20004;5,20005 | G61: 20001 | H61: 30 | I61: 30 | J61: 20 | K61: 30
A62: 60 | B62: 60 | D62: 5 | E62: 20001#20002#20003#20004#20005 | F62: 1,20001;2,20002;3,20003;4,20004;5,20005 | G62: 20001 | H62: 30 | I62: 30 | J62: 20 | K62: 30
A63: 61 | B63: 61 | D63: 5 | E63: 20001#20002#20003#20004#20005 | F63: 1,20001;2,20002;3,20003;4,20004;5,20005 | G63: 20001 | H63: 30 | I63: 30 | J63: 20 | K63: 30
A64: 62 | B64: 62 | D64: 5 | E64: 20001#20002#20003#20004#20005 | F64: 1,20001;2,20002;3,20003;4,20004;5,20005 | G64: 20001 | H64: 30 | I64: 30 | J64: 20 | K64: 30
A65: 63 | B65: 63 | D65: 5 | E65: 20001#20002#20003#20004#20005 | F65: 1,20001;2,20002;3,20003;4,20004;5,20005 | G65: 20001 | H65: 30 | I65: 30 | J65: 20 | K65: 30
A66: 64 | B66: 64 | D66: 5 | E66: 20001#20002#20003#20004#20005 | F66: 1,20001;2,20002;3,20003;4,20004;5,20005 | G66: 20001 | H66: 30 | I66: 30 | J66: 20 | K66: 30
A67: 65 | B67: 65 | D67: 5 | E67: 20001#20002#20003#20004#20005 | F67: 1,20001;2,20002;3,20003;4,20004;5,20005 | G67: 20001 | H67: 30 | I67: 30 | J67: 20 | K67: 30
A68: 66 | B68: 66 | D68: 5 | E68: 20001#20002#20003#20004#20005 | F68: 1,20001;2,20002;3,20003;4,20004;5,20005 | G68: 20001 | H68: 30 | I68: 30 | J68: 20 | K68: 30
A69: 67 | B69: 67 | D69: 5 | E69: 20001#20002#20003#20004#20005 | F69: 1,20001;2,20002;3,20003;4,20004;5,20005 | G69: 20001 | H69: 30 | I69: 30 | J69: 20 | K69: 30
A70: 68 | B70: 68 | D70: 5 | E70: 20001#20002#20003#20004#20005 | F70: 1,20001;2,20002;3,20003;4,20004;5,20005 | G70: 20001 | H70: 30 | I70: 30 | J70: 20 | K70: 30
A71: 69 | B71: 69 | D71: 5 | E71: 20001#20002#20003#20004#20005 | F71: 1,20001;2,20002;3,20003;4,20004;5,20005 | G71: 20001 | H71: 30 | I71: 30 | J71: 20 | K71: 30
A72: 70 | B72: 70 | D72: 5 | E72: 20001#20002#20003#20004#20005 | F72: 1,20001;2,20002;3,20003;4,20004;5,20005 | G72: 20001 | H72: 30 | I72: 30 | J72: 20 | K72: 30
A73: 71 | B73: 71 | D73: 5 | E73: 20001#20002#20003#20004#20005 | F73: 1,20001;2,20002;3,20003;4,20004;5,20005 | G73: 20001 | H73: 30 | I73: 30 | J73: 20 | K73: 30
A74: 72 | B74: 72 | D74: 5 | E74: 20001#20002#20003#20004#20005 | F74: 1,20001;2,20002;3,20003;4,20004;5,20005 | G74: 20001 | H74: 30 | I74: 30 | J74: 20 | K74: 30
A75: 73 | B75: 73 | D75: 5 | E75: 20001#20002#20003#20004#20005 | F75: 1,20001;2,20002;3,20003;4,20004;5,20005 | G75: 20001 | H75: 30 | I75: 30 | J75: 20 | K75: 30
A76: 74 | B76: 74 | D76: 5 | E76: 20001#20002#20003#20004#20005 | F76: 1,20001;2,20002;3,20003;4,20004;5,20005 | G76: 20001 | H76: 30 | I76: 30 | J76: 20 | K76: 30
A77: 75 | B77: 75 | D77: 5 | E77: 20001#20002#20003#20004#20005 | F77: 1,20001;2,20002;3,20003;4,20004;5,20005 | G77: 20001 | H77: 30 | I77: 30 | J77: 20 | K77: 30
A78: 76 | B78: 76 | D78: 5 | E78: 20001#20002#20003#20004#20005 | F78: 1,20001;2,20002;3,20003;4,20004;5,20005 | G78: 20001 | H78: 30 | I78: 30 | J78: 20 | K78: 30
A79: 77 | B79: 77 | D79: 5 | E79: 20001#20002#20003#20004#20005 | F79: 1,20001;2,20002;3,20003;4,20004;5,20005 | G79: 20001 | H79: 30 | I79: 30 | J79: 20 | K79: 30
A80: 78 | B80: 78 | D80: 5 | E80: 20001#20002#20003#20004#20005 | F80: 1,20001;2,20002;3,20003;4,20004;5,20005 | G80: 20001 | H80: 30 | I80: 30 | J80: 20 | K80: 30
A81: 79 | B81: 79 | D81: 5 | E81: 20001#20002#20003#20004#20005 | F81: 1,20001;2,20002;3,20003;4,20004;5,20005 | G81: 20001 | H81: 30 | I81: 30 | J81: 20 | K81: 30
A82: 80 | B82: 80 | D82: 5 | E82: 20001#20002#20003#20004#20005 | F82: 1,20001;2,20002;3,20003;4,20004;5,20005 | G82: 20001 | H82: 30 | I82: 30 | J82: 20 | K82: 30
A83: 81 | B83: 81 | D83: 5 | E83: 20001#20002#20003#20004#20005 | F83: 1,20001;2,20002;3,20003;4,20004;5,20005 | G83: 20001 | H83: 30 | I83: 30 | J83: 20 | K83: 30
A84: 82 | B84: 82 | D84: 5 | E84: 20001#20002#20003#20004#20005 | F84: 1,20001;2,20002;3,20003;4,20004;5,20005 | G84: 20001 | H84: 30 | I84: 30 | J84: 20 | K84: 30
A85: 83 | B85: 83 | D85: 5 | E85: 20001#20002#20003#20004#20005 | F85: 1,20001;2,20002;3,20003;4,20004;5,20005 | G85: 20001 | H85: 30 | I85: 30 | J85: 20 | K85: 30
A86: 84 | B86: 84 | D86: 5 | E86: 20001#20002#20003#20004#20005 | F86: 1,20001;2,20002;3,20003;4,20004;5,20005 | G86: 20001 | H86: 30 | I86: 30 | J86: 20 | K86: 30
A87: 85 | B87: 85 | D87: 5 | E87: 20001#20002#20003#20004#20005 | F87: 1,20001;2,20002;3,20003;4,20004;5,20005 | G87: 20001 | H87: 30 | I87: 30 | J87: 20 | K87: 30
A88: 86 | B88: 86 | D88: 5 | E88: 20001#20002#20003#20004#20005 | F88: 1,20001;2,20002;3,20003;4,20004;5,20005 | G88: 20001 | H88: 30 | I88: 30 | J88: 20 | K88: 30
A89: 87 | B89: 87 | D89: 5 | E89: 20001#20002#20003#20004#20005 | F89: 1,20001;2,20002;3,20003;4,20004;5,20005 | G89: 20001 | H89: 30 | I89: 30 | J89: 20 | K89: 30
A90: 88 | B90: 88 | D90: 5 | E90: 20001#20002#20003#20004#20005 | F90: 1,20001;2,20002;3,20003;4,20004;5,20005 | G90: 20001 | H90: 30 | I90: 30 | J90: 20 | K90: 30
A91: 89 | B91: 89 | D91: 5 | E91: 20001#20002#20003#20004#20005 | F91: 1,20001;2,20002;3,20003;4,20004;5,20005 | G91: 20001 | H91: 30 | I91: 30 | J91: 20 | K91: 30
A92: 90 | B92: 90 | D92: 5 | E92: 20001#20002#20003#20004#20005 | F92: 1,20001;2,20002;3,20003;4,20004;5,20005 | G92: 20001 | H92: 30 | I92: 30 | J92: 20 | K92: 30
A93: 91 | B93: 91 | D93: 5 | E93: 20001#20002#20003#20004#20005 | F93: 1,20001;2,20002;3,20003;4,20004;5,20005 | G93: 20001 | H93: 30 | I93: 30 | J93: 20 | K93: 30
A94: 92 | B94: 92 | D94: 5 | E94: 20001#20002#20003#20004#20005 | F94: 1,20001;2,20002;3,20003;4,20004;5,20005 | G94: 20001 | H94: 30 | I94: 30 | J94: 20 | K94: 30
A95: 93 | B95: 93 | D95: 5 | E95: 20001#20002#20003#20004#20005 | F95: 1,20001;2,20002;3,20003;4,20004;5,20005 | G95: 20001 | H95: 30 | I95: 30 | J95: 20 | K95: 30
A96: 94 | B96: 94 | D96: 5 | E96: 20001#20002#20003#20004#20005 | F96: 1,20001;2,20002;3,20003;4,20004;5,20005 | G96: 20001 | H96: 30 | I96: 30 | J96: 20 | K96: 30
A97: 95 | B97: 95 | D97: 5 | E97: 20001#20002#20003#20004#20005 | F97: 1,20001;2,20002;3,20003;4,20004;5,20005 | G97: 20001 | H97: 30 | I97: 30 | J97: 20 | K97: 30
A98: 96 | B98: 96 | D98: 5 | E98: 20001#20002#20003#20004#20005 | F98: 1,20001;2,20002;3,20003;4,20004;5,20005 | G98: 20001 | H98: 30 | I98: 30 | J98: 20 | K98: 30
A99: 97 | B99: 97 | D99: 5 | E99: 20001#20002#20003#20004#20005 | F99: 1,20001;2,20002;3,20003;4,20004;5,20005 | G99: 20001 | H99: 30 | I99: 30 | J99: 20 | K99: 30
A100: 98 | B100: 98 | D100: 5 | E100: 20001#20002#20003#20004#20005 | F100: 1,20001;2,20002;3,20003;4,20004;5,20005 | G100: 20001 | H100: 30 | I100: 30 | J100: 20 | K100: 30
A101: 99 | B101: 99 | D101: 5 | E101: 20001#20002#20003#20004#20005 | F101: 1,20001;2,20002;3,20003;4,20004;5,20005 | G101: 20001 | H101: 30 | I101: 30 | J101: 20 | K101: 30
A102: 100 | B102: 100 | D102: 5 | E102: 20001#20002#20003#20004#20005 | F102: 1,20001;2,20002;3,20003;4,20004;5,20005 | G102: 20001 | H102: 30 | I102: 30 | J102: 20 | K102: 30

Sheet: 关卡产出表
A1: 层数 | B1: 经验 | C1: 铜板 | D1: 技能点
A2: id | B2: exp | C2: coins | D2: skill_poins
A3: 1 | B3: 1.5 | C3: 20 | D3: 10
A4: 2 | B4: 1.575 | C4: 30 | D4: 15
A5: 3 | B5: 1.7325 | C5: 40 | D5: 20
A6: 4 | B6: 1.90575 | C6: 50 | D6: 25
A7: 5 | B7: 2.096325 | C7: 60 | D7: 30
A8: 6 | B8: 2.3059575 | C8: 70 | D8: 35
A9: 7 | B9: 2.53655325 | C9: 80 | D9: 40
A10: 8 | B10: 2.790208575 | C10: 90 | D10: 45
A11: 9 | B11: 3.0692294325 | C11: 100 | D11: 50
A12: 10 | B12: 3.37615237575 | C12: 110 | D12: 55
A13: 11 | B13: 3.713767613325 | C13: 120 | D13: 60
A14: 12 | B14: 4.0851443746575 | C14: 130 | D14: 65
A15: 13 | B15: 4.49365881212325 | C15: 140 | D15: 70
A16: 14 | B16: 4.94302469333558 | C16: 150 | D16: 75
A17: 15 | B17: 5.43732716266914 | C17: 160 | D17: 80
A18: 16 | B18: 5.98105987893605 | C18: 170 | D18: 85
A19: 17 | B19: 6.57916586682966 | C19: 180 | D19: 90
A20: 18 | B20: 7.23708245351263 | C20: 190 | D20: 95
A21: 19 | B21: 7.96079069886389 | C21: 200 | D21: 100
A22: 20 | B22: 8.75686976875028 | C22: 210 | D22: 105
A23: 21 | B23: 9.63255674562531 | C23: 220 | D23: 110
A24: 22 | B24: 10.5958124201878 | C24: 230 | D24: 115
A25: 23 | B25: 11.6553936622066 | C25: 240 | D25: 120
A26: 24 | B26: 12.8209330284273 | C26: 250 | D26: 125
A27: 25 | B27: 14.10302633127 | C27: 260 | D27: 130
A28: 26 | B28: 15.513328964397 | C28: 270 | D28: 135
A29: 27 | B29: 17.0646618608367 | C29: 280 | D29: 140
A30: 28 | B30: 18.7711280469204 | C30: 290 | D30: 145
A31: 29 | B31: 20.6482408516124 | C31: 300 | D31: 150
A32: 30 | B32: 22.7130649367737 | C32: 310 | D32: 155
A33: 31 | B33: 24.984371430451 | C33: 320 | D33: 160
A34: 32 | B34: 27.4828085734962 | C34: 330 | D34: 165
A35: 33 | B35: 30.2310894308458 | C35: 340 | D35: 170
A36: 34 | B36: 33.2541983739304 | C36: 350 | D36: 175
A37: 35 | B37: 36.5796182113234 | C37: 360 | D37: 180
A38: 36 | B38: 40.2375800324557 | C38: 370 | D38: 185
A39: 37 | B39: 44.2613380357013 | C39: 380 | D39: 190
A40: 38 | B40: 48.6874718392714 | C40: 390 | D40: 195
A41: 39 | B41: 53.5562190231986 | C41: 400 | D41: 200
A42: 40 | B42: 58.9118409255184 | C42: 410 | D42: 205
A43: 41 | B43: 64.8030250180703 | C43: 420 | D43: 210
A44: 42 | B44: 71.2833275198773 | C44: 430 | D44: 215
A45: 43 | B45: 78.4116602718651 | C45: 440 | D45: 220
A46: 44 | B46: 86.2528262990516 | C46: 450 | D46: 225
A47: 45 | B47: 94.8781089289567 | C47: 460 | D47: 230
A48: 46 | B48: 104.365919821852 | C48: 470 | D48: 235
A49: 47 | B49: 114.802511804038 | C49: 480 | D49: 240
A50: 48 | B50: 126.282762984441 | C50: 490 | D50: 245
A51: 49 | B51: 138.911039282886 | C51: 500 | D51: 250
A52: 50 | B52: 152.802143211174 | C52: 510 | D52: 255
A53: 51 | B53: 168.082357532292 | C53: 520 | D53: 260
A54: 52 | B54: 184.890593285521 | C54: 530 | D54: 265
A55: 53 | B55: 203.379652614073 | C55: 540 | D55: 270
A56: 54 | B56: 223.71761787548 | C56: 550 | D56: 275
A57: 55 | B57: 246.089379663028 | C57: 560 | D57: 280
A58: 56 | B58: 270.698317629331 | C58: 570 | D58: 285
A59: 57 | B59: 297.768149392264 | C59: 580 | D59: 290
A60: 58 | B60: 327.544964331491 | C60: 590 | D60: 295
A61: 59 | B61: 360.29946076464 | C61: 600 | D61: 300
A62: 60 | B62: 396.329406841104 | C62: 610 | D62: 305
A63: 61 | B63: 435.962347525214 | C63: 620 | D63: 310
A64: 62 | B64: 479.558582277736 | C64: 630 | D64: 315
A65: 63 | B65: 527.514440505509 | C65: 640 | D65: 320
A66: 64 | B66: 580.265884556061 | C66: 650 | D66: 325
A67: 65 | B67: 638.292473011667 | C67: 660 | D67: 330
A68: 66 | B68: 702.121720312833 | C68: 670 | D68: 335
A69: 67 | B69: 772.333892344116 | C69: 680 | D69: 340
A70: 68 | B70: 849.567281578528 | C70: 690 | D70: 345
A71: 69 | B71: 934.524009736381 | C71: 700 | D71: 350
A72: 70 | B72: 1027.97641071002 | C72: 710 | D72: 355
A73: 71 | B73: 1130.77405178102 | C73: 720 | D73: 360
A74: 72 | B74: 1243.85145695912 | C74: 730 | D74: 365
A75: 73 | B75: 1368.23660265504 | C75: 740 | D75: 370
A76: 74 | B76: 1505.06026292054 | C76: 750 | D76: 375
A77: 75 | B77: 1655.56628921259 | C77: 760 | D77: 380
A78: 76 | B78: 1821.12291813385 | C78: 770 | D78: 385
A79: 77 | B79: 2003.23520994724 | C79: 780 | D79: 390
A80: 78 | B80: 2203.55873094196 | C80: 790 | D80: 395
A81: 79 | B81: 2423.91460403616 | C81: 800 | D81: 400
A82: 80 | B82: 2666.30606443977 | C82: 810 | D82: 405
A83: 81 | B83: 2932.93667088375 | C83: 820 | D83: 410
A84: 82 | B84: 3226.23033797213 | C84: 830 | D84: 415
A85: 83 | B85: 3548.85337176934 | C85: 840 | D85: 420
A86: 84 | B86: 3903.73870894628 | C86: 850 | D86: 425
A87: 85 | B87: 4294.1125798409 | C87: 860 | D87: 430
A88: 86 | B88: 4723.52383782499 | C88: 870 | D88: 435
A89: 87 | B89: 5195.8762216075 | C89: 880 | D89: 440
A90: 88 | B90: 5715.46384376824 | C90: 890 | D90: 445
A91: 89 | B91: 6287.01022814507 | C91: 900 | D91: 450
A92: 90 | B92: 6915.71125095958 | C92: 910 | D92: 455
A93: 91 | B93: 7607.28237605553 | C93: 920 | D93: 460
A94: 92 | B94: 8368.01061366108 | C94: 930 | D94: 465
A95: 93 | B95: 9204.81167502719 | C95: 940 | D95: 470
A96: 94 | B96: 10125.2928425299 | C96: 950 | D96: 475
A97: 95 | B97: 11137.8221267829 | C97: 960 | D97: 480
A98: 96 | B98: 12251.6043394612 | C98: 970 | D98: 485
A99: 97 | B99: 13476.7647734073 | C99: 980 | D99: 490
A100: 98 | B100: 14824.4412507481 | C100: 990 | D100: 495
A101: 99 | B101: 16306.8853758229 | C101: 1000 | D101: 500
A102: 100 | B102: 17937.5739134051 | C102: 1010 | D102: 505

Sheet: export
A1: sheet_name | B1: export_name
A2: 玩家升级经验表 | B2: player_upgrade
A3: 任务奖励表 | B3: task
A4: 大章表 | B4: chapter
A5: 任务扫荡产出表 | B5: mop_up
A6: 任务卡牌配置表 | B6: task_config
A7: 任务怪物属性表 | B7: task_card
A8: 关卡卡牌配置表 | B8: pass_config
A9: 关卡怪物属性表 | B9: pass_card
A10: 关卡产出表 | B10: pass_reward