Sheet: 玩家升级阶段奖励配置表
A1: id | B1: 玩家等级 | C1: 奖励魔石 | D1: 奖励活力值
A2: id | B2: lv | C2: gold | D2: energy
A3: 1 | B3: 10 | C3: 20 | D3: 1000
A4: 11 | B4: =R[-1]C+5 -> 15 | C4: 25 | D4: =R[-1]C+100 -> 1100
A5: 2 | B5: =R[-1]C+5 -> 20 | C5: 50 | D5: =R[-1]C+100 -> 1200
A6: 12 | B6: =R[-1]C+5 -> 25 | C6: 55 | D6: =R[-1]C+100 -> 1300
A7: 3 | B7: =R[-1]C+5 -> 30 | C7: 70 | D7: =R[-1]C+100 -> 1400
A8: 13 | B8: =R[-1]C+5 -> 35 | C8: 75 | D8: =R[-1]C+100 -> 1500
A9: 4 | B9: =R[-1]C+5 -> 40 | C9: 90 | D9: =R[-1]C+100 -> 1600
A10: 14 | B10: =R[-1]C+5 -> 45 | C10: 95 | D10: =R[-1]C+100 -> 1700
A11: 5 | B11: =R[-1]C+5 -> 50 | C11: 100 | D11: =R[-1]C+100 -> 1800
A12: 15 | B12: =R[-1]C+5 -> 55 | C12: 120 | D12: =R[-1]C+100 -> 1900
A13: 6 | B13: =R[-1]C+5 -> 60 | C13: 150 | D13: =R[-1]C+100 -> 2000
A14: 16 | B14: =R[-1]C+5 -> 65 | C14: 180 | D14: =R[-1]C+100 -> 2100
A15: 7 | B15: =R[-1]C+5 -> 70 | C15: 200 | D15: =R[-1]C+100 -> 2200
A16: 17 | B16: =R[-1]C+5 -> 75 | C16: 230 | D16: =R[-1]C+100 -> 2300
A17: 8 | B17: =R[-1]C+5 -> 80 | C17: 260 | D17: =R[-1]C+100 -> 2400
A18: 18 | B18: =R[-1]C+5 -> 85 | C18: 280 | D18: =R[-1]C+100 -> 2500
A19: 9 | B19: =R[-1]C+5 -> 90 | C19: 300 | D19: =R[-1]C+100 -> 2600
A20: 19 | B20: =R[-1]C+5 -> 95 | C20: 400 | D20: =R[-1]C+100 -> 2700
A21: 10 | B21: 100 | C21: 500 | D21: =R[-1]C+100 -> 2800

Sheet: 新年充值奖励
A1: id | B1: 累计充值金额 | C1: 仙币 | D1: 活力点 | E1: 卡魂
A2: id | B2: cash | C2: money | D2: energy | E2: fragments
A3: 1 | B3: 66 | C3: 20000 | D3: 100 | E3: 2
A4: 2 | B4: 266 | C4: 50000 | D4: 200 | E4: 3
A5: 3 | B5: 566 | C5: 80000 | D5: 300 | E5: 5
A6: 4 | B6: 999 | C6: 100000 | D6: 800 | E6: 8
A7: 5 | B7: 1888 | C7: 200000 | D7: 1000 | E7: 12

Sheet: 开服累计登陆奖励配置表
A1: 累计登陆次数 | B1: 仙币 | C1: 活力点 | D1: 卡魂 | E1: 魔石 | F1: 卡牌奖励
A2: id | B2: money | C2: energy | D2: fragments | E2: gold | F2: card_id
A3: 1 | B3: 10000 | C3: 1000
A4: 2 | B4: =R[-1]C+5000 -> 15000 | C4: =R[-1]C+100 -> 1100
A5: 3 | B5: =R[-1]C+5000 -> 20000 | C5: =R[-1]C+100 -> 1200 | E5: 100
A6: 4 | B6: =R[-1]C+5000 -> 25000 | C6: =R[-1]C+100 -> 1300
A7: 5 | B7: =R[-1]C+5000 -> 30000 | C7: =R[-1]C+100 -> 1400 | D7: 2
A8: 6 | B8: =R[-1]C+5000 -> 35000 | C8: =R[-1]C+100 -> 1500
A9: 7 | B9: =R[-1]C+5000 -> 40000 | C9: =R[-1]C+100 -> 1600 | F9: 965
A10: 8 | B10: =R[-1]C+5000 -> 45000 | C10: =R[-1]C+100 -> 1700
A11: 9 | B11: =R[-1]C+5000 -> 50000 | C11: =R[-1]C+100 -> 1800 | E11: 150
A12: 10 | B12: =R[-1]C+5000 -> 55000 | C12: =R[-1]C+100 -> 1900
A13: 11 | B13: =R[-1]C+5000 -> 60000 | C13: =R[-1]C+100 -> 2000
A14: 12 | B14: =R[-1]C+5000 -> 65000 | C14: =R[-1]C+100 -> 2100 | D14: 3
A15: 13 | B15: =R[-1]C+5000 -> 70000 | C15: =R[-1]C+100 -> 2200
A16: 14 | B16: =R[-1]C+5000 -> 75000 | C16: =R[-1]C+100 -> 2300
A17: 15 | B17: =R[-1]C+5000 -> 80000 | C17: =R[-1]C+100 -> 2400
A18: 16 | B18: =R[-1]C+5000 -> 85000 | C18: =R[-1]C+100 -> 2500 | E18: 200
A19: 17 | B19: =R[-1]C+5000 -> 90000 | C19: =R[-1]C+100 -> 2600
A20: 18 | B20: =R[-1]C+5000 -> 95000 | C20: =R[-1]C+100 -> 2700
A21: 19 | B21: =R[-1]C+5000 -> 100000 | C21: =R[-1]C+100 -> 2800
A22: 20 | B22: =R[-1]C+5000 -> 105000 | C22: =R[-1]C+100 -> 2900
A23: 21 | B23: =R[-1]C+5000 -> 110000 | C23: =R[-1]C+100 -> 3000 | D23: 5
A24: 22 | B24: =R[-1]C+5000 -> 115000 | C24: =R[-1]C+100 -> 3100
A25: 23 | B25: =R[-1]C+5000 -> 120000 | C25: =R[-1]C+100 -> 3200
A26: 24 | B26: =R[-1]C+5000 -> 125000 | C26: =R[-1]C+100 -> 3300
A27: 25 | B27: =R[-1]C+5000 -> 130000 | C27: =R[-1]C+100 -> 3400 | E27: 250
A28: 26 | B28: =R[-1]C+5000 -> 135000 | C28: =R[-1]C+100 -> 3500
A29: 27 | B29: =R[-1]C+5000 -> 140000 | C29: =R[-1]C+100 -> 3600
A30: 28 | B30: =R[-1]C+5000 -> 145000 | C30: =R[-1]C+100 -> 3700
A31: 29 | B31: =R[-1]C+5000 -> 150000 | C31: =R[-1]C+100 -> 3800
A32: 30 | B32: =R[-1]C+5000 -> 155000 | C32: =R[-1]C+100 -> 3900 | E32: 300

Sheet: export
A1: sheet_name | B1: export_name | C1: merge_to
A2: 玩家升级阶段奖励配置表 | B2: player_upgrade_reward
A3: 新年充值奖励 | B3: new_year_rechage
A4: 开服累计登陆奖励配置表 | B4: login_count_reward