Sheet: 卡牌升级表
A1: id | B1: 卡牌等级 | C1: 升级所需经验 | D1: 升级铜板消耗 | E1: 当前等级卡牌蕴含经验
A2: id | B2: lv | C2: exp_need | D2: money_need | E2: cur_exp
A3: 0 | B3: 0 | C3: 100 | D3: 110 | E3: 0
A4: 1 | B4: 1 | C4: 110 | D4: 115 | E4: =R[-1]C+R[-1]C[-2] -> 100
A5: 2 | B5: 2 | C5: =ROUND(R[-1]C*1.11,0) -> 122 | D5: =ROUND(R[-1]C*1.157,0) -> 133 | E5: =R[-1]C+R[-1]C[-2] -> 210
A6: 3 | B6: 3 | C6: =ROUND(R[-1]C*1.11,0) -> 135 | D6: =ROUND(R[-1]C*1.157,0) -> 154 | E6: =R[-1]C+R[-1]C[-2] -> 332
A7: 4 | B7: 4 | C7: =ROUND(R[-1]C*1.11,0) -> 150 | D7: =ROUND(R[-1]C*1.157,0) -> 178 | E7: =R[-1]C+R[-1]C[-2] -> 467
A8: 5 | B8: 5 | C8: =ROUND(R[-1]C*1.11,0) -> 167 | D8: =ROUND(R[-1]C*1.157,0) -> 206 | E8: =R[-1]C+R[-1]C[-2] -> 617
A9: 6 | B9: 6 | C9: =ROUND(R[-1]C*1.11,0) -> 185 | D9: =ROUND(R[-1]C*1.157,0) -> 238 | E9: =R[-1]C+R[-1]C[-2] -> 784
A10: 7 | B10: 7 | C10: =ROUND(R[-1]C*1.11,0) -> 205 | D10: =ROUND(R[-1]C*1.157,0) -> 275 | E10: =R[-1]C+R[-1]C[-2] -> 969
A11: 8 | B11: 8 | C11: =ROUND(R[-1]C*1.11,0) -> 228 | D11: =ROUND(R[-1]C*1.157,0) -> 318 | E11: =R[-1]C+R[-1]C[-2] -> 1174
A12: 9 | B12: 9 | C12: =ROUND(R[-1]C*1.11,0) -> 253 | D12: =ROUND(R[-1]C*1.157,0) -> 368 | E12: =R[-1]C+R[-1]C[-2] -> 1402
A13: 10 | B13: 10 | C13: =ROUND(R[-1]C*1.11,0) -> 281 | D13: =ROUND(R[-1]C*1.157,0) -> 426 | E13: =R[-1]C+R[-1]C[-2] -> 1655
A14: 11 | B14: 11 | C14: =ROUND(R[-1]C*1.11,0) -> 312 | D14: =ROUND(R[-1]C*1.157,0) -> 493 | E14: =R[-1]C+R[-1]C[-2] -> 1936
A15: 12 | B15: 12 | C15: =ROUND(R[-1]C*1.11,0) -> 346 | D15: =ROUND(R[-1]C*1.157,0) -> 570 | E15: =R[-1]C+R[-1]C[-2] -> 2248
A16: 13 | B16: 13 | C16: =ROUND(R[-1]C*1.11,0) -> 384 | D16: =ROUND(R[-1]C*1.157,0) -> 659 | E16: =R[-1]C+R[-1]C[-2] -> 2594
A17: 14 | B17: 14 | C17: =ROUND(R[-1]C*1.11,0) -> 426 | D17: =ROUND(R[-1]C*1.157,0) -> 762 | E17: =R[-1]C+R[-1]C[-2] -> 2978
A18: 15 | B18: 15 | C18: =ROUND(R[-1]C*1.11,0) -> 473 | D18: =ROUND(R[-1]C*1.157,0) -> 882 | E18: =R[-1]C+R[-1]C[-2] -> 3404
A19: 16 | B19: 16 | C19: =ROUND(R[-1]C*1.11,0) -> 525 | D19: =ROUND(R[-1]C*1.157,0) -> 1020 | E19: =R[-1]C+R[-1]C[-2] -> 3877
A20: 17 | B20: 17 | C20: =ROUND(R[-1]C*1.11,0) -> 583 | D20: =ROUND(R[-1]C*1.157,0) -> 1180 | E20: =R[-1]C+R[-1]C[-2] -> 4402
A21: 18 | B21: 18 | C21: =ROUND(R[-1]C*1.11,0) -> 647 | D21: =ROUND(R[-1]C*1.157,0) -> 1365 | E21: =R[-1]C+R[-1]C[-2] -> 4985
A22: 19 | B22: 19 | C22: =ROUND(R[-1]C*1.11,0) -> 718 | D22: =ROUND(R[-1]C*1.157,0) -> 1579 | E22: =R[-1]C+R[-1]C[-2] -> 5632
A23: 20 | B23: 20 | C23: =ROUND(R[-1]C*1.11,0) -> 797 | D23: =ROUND(R[-1]C*1.157,0) -> 1827 | E23: =R[-1]C+R[-1]C[-2] -> 6350
A24: 21 | B24: 21 | C24: =ROUND(R[-1]C*1.11,0) -> 885 | D24: =ROUND(R[-1]C*1.157,0) -> 2114 | E24: =R[-1]C+R[-1]C[-2] -> 7147
A25: 22 | B25: 22 | C25: =ROUND(R[-1]C*1.11,0) -> 982 | D25: =ROUND(R[-1]C*1.157,0) -> 2446 | E25: =R[-1]C+R[-1]C[-2] -> 8032
A26: 23 | B26: 23 | C26: =ROUND(R[-1]C*1.11,0) -> 1090 | D26: =ROUND(R[-1]C*1.157,0) -> 2830 | E26: =R[-1]C+R[-1]C[-2] -> 9014
A27: 24 | B27: 24 | C27: =ROUND(R[-1]C*1.11,0) -> 1210 | D27: =ROUND(R[-1]C*1.157,0) -> 3274 | E27: =R[-1]C+R[-1]C[-2] -> 10104
A28: 25 | B28: 25 | C28: =ROUND(R[-1]C*1.11,0) -> 1343 | D28: =ROUND(R[-1]C*1.157,0) -> 3788 | E28: =R[-1]C+R[-1]C[-2] -> 11314
A29: 26 | B29: 26 | C29: =ROUND(R[-1]C*1.11,0) -> 1491 | D29: =ROUND(R[-1]C*1.157,0) -> 4383 | E29: =R[-1]C+R[-1]C[-2] -> 12657
A30: 27 | B30: 27 | C30: =ROUND(R[-1]C*1.11,0) -> 1655 | D30: =ROUND(R[-1]C*1.157,0) -> 5071 | E30: =R[-1]C+R[-1]C[-2] -> 14148
A31: 28 | B31: 28 | C31: =ROUND(R[-1]C*1.11,0) -> 1837 | D31: =ROUND(R[-1]C*1.157,0) -> 5867 | E31: =R[-1]C+R[-1]C[-2] -> 15803
A32: 29 | B32: 29 | C32: =ROUND(R[-1]C*1.11,0) -> 2039 | D32: =ROUND(R[-1]C*1.157,0) -> 6788 | E32: =R[-1]C+R[-1]C[-2] -> 17640
A33: 30 | B33: 30 | C33: =ROUND(R[-1]C*1.11,0) -> 2263 | D33: =ROUND(R[-1]C*1.157,0) -> 7854 | E33: =R[-1]C+R[-1]C[-2] -> 19679
A34: 31 | B34: 31 | C34: =ROUND(R[-1]C*1.11,0) -> 2512 | D34: =ROUND(R[-1]C*1.157,0) -> 9087 | E34: =R[-1]C+R[-1]C[-2] -> 21942
A35: 32 | B35: 32 | C35: =ROUND(R[-1]C*1.11,0) -> 2788 | D35: =ROUND(R[-1]C*1.157,0) -> 10514 | E35: =R[-1]C+R[-1]C[-2] -> 24454
A36: 33 | B36: 33 | C36: =ROUND(R[-1]C*1.11,0) -> 3095 | D36: =ROUND(R[-1]C*1.157,0) -> 12165 | E36: =R[-1]C+R[-1]C[-2] -> 27242
A37: 34 | B37: 34 | C37: =ROUND(R[-1]C*1.11,0) -> 3435 | D37: =ROUND(R[-1]C*1.157,0) -> 14075 | E37: =R[-1]C+R[-1]C[-2] -> 30337
A38: 35 | B38: 35 | C38: =ROUND(R[-1]C*1.11,0) -> 3813 | D38: =ROUND(R[-1]C*1.157,0) -> 16285 | E38: =R[-1]C+R[-1]C[-2] -> 33772
A39: 36 | B39: 36 | C39: =ROUND(R[-1]C*1.11,0) -> 4232 | D39: =ROUND(R[-1]C*1.157,0) -> 18842 | E39: =R[-1]C+R[-1]C[-2] -> 37585
A40: 37 | B40: 37 | C40: =ROUND(R[-1]C*1.11,0) -> 4698 | D40: =ROUND(R[-1]C*1.157,0) -> 21800 | E40: =R[-1]C+R[-1]C[-2] -> 41817
A41: 38 | B41: 38 | C41: =ROUND(R[-1]C*1.11,0) -> 5215 | D41: =ROUND(R[-1]C*1.157,0) -> 25223 | E41: =R[-1]C+R[-1]C[-2] -> 46515
A42: 39 | B42: 39 | C42: =ROUND(R[-1]C*1.11,0) -> 5789 | D42: =ROUND(R[-1]C*1.157,0) -> 29183 | E42: =R[-1]C+R[-1]C[-2] -> 51730
A43: 40 | B43: 40 | C43: =ROUND(R[-1]C*1.11,0) -> 6426 | D43: =ROUND(R[-1]C*1.157,0) -> 33765 | E43: =R[-1]C+R[-1]C[-2] -> 57519
A44: 41 | B44: 41 | C44: =ROUND(R[-1]C*1.11,0) -> 7133 | D44: =ROUND(R[-1]C*1.157,0) -> 39066 | E44: =R[-1]C+R[-1]C[-2] -> 63945
A45: 42 | B45: 42 | C45: =ROUND(R[-1]C*1.11,0) -> 7918 | D45: =ROUND(R[-1]C*1.157,0) -> 45199 | E45: =R[-1]C+R[-1]C[-2] -> 71078
A46: 43 | B46: 43 | C46: =ROUND(R[-1]C*1.11,0) -> 8789 | D46: =ROUND(R[-1]C*1.157,0) -> 52295 | E46: =R[-1]C+R[-1]C[-2] -> 78996
A47: 44 | B47: 44 | C47: =ROUND(R[-1]C*1.11,0) -> 9756 | D47: =ROUND(R[-1]C*1.157,0) -> 60505 | E47: =R[-1]C+R[-1]C[-2] -> 87785
A48: 45 | B48: 45 | C48: =ROUND(R[-1]C*1.11,0) -> 10829 | D48: =ROUND(R[-1]C*1.157,0) -> 70004 | E48: =R[-1]C+R[-1]C[-2] -> 97541
A49: 46 | B49: 46 | C49: =ROUND(R[-1]C*1.11,0) -> 12020 | D49: =ROUND(R[-1]C*1.157,0) -> 80995 | E49: =R[-1]C+R[-1]C[-2] -> 108370
A50: 47 | B50: 47 | C50: =ROUND(R[-1]C*1.11,0) -> 13342 | D50: =ROUND(R[-1]C*1.157,0) -> 93711 | E50: =R[-1]C+R[-1]C[-2] -> 120390
A51: 48 | B51: 48 | C51: =ROUND(R[-1]C*1.11,0) -> 14810 | D51: =ROUND(R[-1]C*1.157,0) -> 108424 | E51: =R[-1]C+R[-1]C[-2] -> 133732
A52: 49 | B52: 49 | C52: =ROUND(R[-1]C*1.11,0) -> 16439 | D52: =ROUND(R[-1]C*1.157,0) -> 125447 | E52: =R[-1]C+R[-1]C[-2] -> 148542
A53: 50 | B53: 50 | C53: =ROUND(R[-1]C*1.11,0) -> 18247 | D53: =ROUND(R[-1]C*1.157,0) -> 145142 | E53: =R[-1]C+R[-1]C[-2] -> 164981
A54: 51 | B54: 51 | C54: =ROUND(R[-1]C*1.11,0) -> 20254 | D54: =ROUND(R[-1]C*1.157,0) -> 167929 | E54: =R[-1]C+R[-1]C[-2] -> 183228
A55: 52 | B55: 52 | C55: =ROUND(R[-1]C*1.11,0) -> 22482 | D55: =ROUND(R[-1]C*1.157,0) -> 194294 | E55: =R[-1]C+R[-1]C[-2] -> 203482
A56: 53 | B56: 53 | C56: =ROUND(R[-1]C*1.11,0) -> 24955 | D56: =ROUND(R[-1]C*1.157,0) -> 224798 | E56: =R[-1]C+R[-1]C[-2] -> 225964
A57: 54 | B57: 54 | C57: =ROUND(R[-1]C*1.11,0) -> 27700 | D57: =ROUND(R[-1]C*1.157,0) -> 260091 | E57: =R[-1]C+R[-1]C[-2] -> 250919
A58: 55 | B58: 55 | C58: =ROUND(R[-1]C*1.11,0) -> 30747 | D58: =ROUND(R[-1]C*1.157,0) -> 300925 | E58: =R[-1]C+R[-1]C[-2] -> 278619
A59: 56 | B59: 56 | C59: =ROUND(R[-1]C*1.11,0) -> 34129 | D59: =ROUND(R[-1]C*1.157,0) -> 348170 | E59: =R[-1]C+R[-1]C[-2] -> 309366
A60: 57 | B60: 57 | C60: =ROUND(R[-1]C*1.11,0) -> 37883 | D60: =ROUND(R[-1]C*1.157,0) -> 402833 | E60: =R[-1]C+R[-1]C[-2] -> 343495
A61: 58 | B61: 58 | C61: =ROUND(R[-1]C*1.11,0) -> 42050 | D61: =ROUND(R[-1]C*1.157,0) -> 466078 | E61: =R[-1]C+R[-1]C[-2] -> 381378
A62: 59 | B62: 59 | C62: =ROUND(R[-1]C*1.11,0) -> 46676 | D62: =ROUND(R[-1]C*1.157,0) -> 539252 | E62: =R[-1]C+R[-1]C[-2] -> 423428
A63: 60 | B63: 60 | C63: =ROUND(R[-1]C*1.11,0) -> 51810 | D63: =ROUND(R[-1]C*1.157,0) -> 623915 | E63: =R[-1]C+R[-1]C[-2] -> 470104

Sheet: export
A1: sheet_name | B1: export_name | C1: merge_to
A2: 卡牌升级表 | B2: card_grow