Sheet: 伤害排行榜奖励配置表
A1: 排名 | B1: 荣誉点 | C1: 仙币 | D1: 活力值
A2: id | B2: honor | C2: money | D2: energy
A3: 1 | B3: 12000 | C3: 500000 | D3: 8000
A4: 2 | B4: =R[-1]C-1200 -> 10800 | C4: =R[-1]C-50000 -> 450000 | D4: 7000
A5: 3 | B5: =R[-1]C-1200 -> 9600 | C5: =R[-1]C-50000 -> 400000 | D5: 6000
A6: 4 | B6: =R[-1]C-1200 -> 8400 | C6: =R[-1]C-50000 -> 350000 | D6: 5000
A7: 5 | B7: =R[-1]C-1200 -> 7200 | C7: =R[-1]C-50000 -> 300000 | D7: 4000
A8: 6 | B8: 5000

Sheet: export
A1: sheet_name | B1: export_name
A2: 伤害排行榜奖励配置表 | B2: boss_rank_reward