Sheet: 技能配置表
A1: 技能ID | B1: 卡牌描述 | C1: 技能名称 | D1: 技能类型 | E1: 作用对象 | F1: 随机张数 | G1: 3星属性 | H1: 3星概率 | I1: 4星效果 | J1: 4星概率 | K1: 5星效果 | L1: 5星概率 | M1: 特效ID
A2: skillID | B2: describtion | C2: name | D2: magic_id | E2: scope | F2: random_num | G2: star3 | I2: star4 | K2: star5
A3: 1 | B3: 单体攻击 | C3: 1 | D3: 1 | E3: 1 | G3: 31,5 | H3: 30,5 | I3: 35,5 | J3: 35,5 | K3: 40,5 | L3: 40,5
A4: 2 | B4: 单体攻击 | C4: 2 | D4: 1 | E4: 1 | G4: 31,5 | H4: 30,5 | I4: 35,5 | J4: 35,5 | K4: 40,5 | L4: 40,5
A5: 3 | B5: 单体攻击 | C5: 3 | D5: 1 | E5: 1 | G5: 31,5 | H5: 30,5 | I5: 35,5 | J5: 35,5 | K5: 40,5 | L5: 40,5
A6: 4 | B6: 单体攻击 | C6: 4 | D6: 1 | E6: 1 | G6: 31,5 | H6: 30,5 | I6: 35,5 | J6: 35,5 | K6: 40,5 | L6: 40,5
A7: 5 | B7: 单体攻击 | C7: 5 | D7: 1 | E7: 1 | G7: 31,5 | H7: 30,5 | I7: 35,5 | J7: 35,5 | K7: 40,5 | L7: 40,5
A8: 6 | B8: 单体攻击 | C8: 6 | D8: 1 | E8: 1 | G8: 31,5 | H8: 30,5 | I8: 35,5 | J8: 35,5 | K8: 40,5 | L8: 40,5
A9: 7 | B9: 单体攻击 | C9: 7 | D9: 1 | E9: 1 | G9: 31,5 | H9: 30,5 | I9: 35,5 | J9: 35,5 | K9: 40,5 | L9: 40,5
A10: 8 | B10: 单体攻击 | C10: 8 | D10: 1 | E10: 1 | G10: 32,5 | H10: 30,5 | I10: 36,5 | J10: 35,5 | K10: 41,5 | L10: 40,5
A11: 9 | B11: 单体攻击 | C11: 9 | D11: 1 | E11: 1 | G11: 32,5 | H11: 30,5 | I11: 36,5 | J11: 35,5 | K11: 41,5 | L11: 40,5
A12: 10 | B12: 单体攻击 | C12: 10 | D12: 1 | E12: 1 | G12: 32,5 | H12: 30,5 | I12: 36,5 | J12: 35,5 | K12: 41,5 | L12: 40,5
A13: 11 | B13: 单体攻击 | C13: 11 | D13: 1 | E13: 1 | G13: 32,5 | H13: 30,5 | I13: 36,5 | J13: 35,5 | K13: 41,5 | L13: 40,5
A14: 12 | B14: 单体攻击 | C14: 12 | D14: 1 | E14: 1 | G14: 32,5 | H14: 30,5 | I14: 36,5 | J14: 35,5 | K14: 41,5 | L14: 40,5
A15: 13 | B15: 单体攻击 | C15: 13 | D15: 1 | E15: 1 | G15: 32,5 | H15: 30,5 | I15: 36,5 | J15: 35,5 | K15: 41,5 | L15: 40,5
A16: 14 | B16: 单体攻击 | C16: 14 | D16: 1 | E16: 1 | G16: 32,5 | H16: 30,5 | I16: 36,5 | J16: 35,5 | K16: 41,5 | L16: 40,5
A17: 15 | B17: 单体攻击 | C17: 15 | D17: 1 | E17: 1 | G17: 30,5 | H17: 30,5 | I17: 36,5 | J17: 35,5 | K17: 42,5 | L17: 40,5
A18: 16 | B18: 单体攻击 | C18: 16 | D18: 1 | E18: 1 | G18: 30,6 | H18: 30,5 | I18: 36,5 | J18: 35,5 | K18: 42,5 | L18: 40,5
A19: 17 | B19: 单体攻击 | C19: 17 | D19: 1 | E19: 1 | G19: 30,7 | H19: 30,5 | I19: 36,5 | J19: 35,5 | K19: 42,5 | L19: 40,5
A20: 18 | B20: 单体攻击 | C20: 18 | D20: 1 | E20: 1 | G20: 30,8 | H20: 30,5 | I20: 36,5 | J20: 35,5 | K20: 42,5 | L20: 40,5
A21: 19 | B21: 单体攻击 | C21: 19 | D21: 1 | E21: 1 | G21: 30,9 | H21: 30,5 | I21: 36,5 | J21: 35,5 | K21: 42,5 | L21: 40,5
A22: 20 | B22: 单体攻击 | C22: 20 | D22: 1 | E22: 1 | G22: 30,10 | H22: 30,5 | I22: 57,5 | J22: 35,5 | K22: 42,5 | L22: 40,5
A23: 21 | B23: 单体攻击 | C23: 21 | D23: 1 | E23: 1 | G23: 30,11 | H23: 30,5 | I23: 57,5 | J23: 35,5 | K23: 42,5 | L23: 40,5
A24: 22 | B24: 单体攻击 | C24: 22 | D24: 1 | E24: 1 | G24: 30,12 | H24: 30,5 | I24: 57,5 | J24: 35,5 | K24: 42,5 | L24: 40,5
A25: 23 | B25: 单体攻击 | C25: 23 | D25: 1 | E25: 1 | G25: 30,13 | H25: 30,5 | I25: 57,5 | J25: 35,5 | K25: 42,5 | L25: 40,5
A26: 24 | B26: 单体攻击 | C26: 24 | D26: 1 | E26: 1 | G26: 30,14 | H26: 30,5 | I26: 57,5 | J26: 35,5 | K26: 42,5 | L26: 40,5
A27: 25 | B27: 单体攻击 | C27: 25 | D27: 1 | E27: 1 | G27: 30,15 | H27: 30,5 | I27: 57,5 | J27: 35,5 | K27: 42,5 | L27: 40,5
A28: 26 | B28: AOE攻击对方前排 | C28: 26 | D28: 3 | E28: 2 | G28: -60,5 | H28: 30,5 | I28: -55,5 | J28: 35,5 | K28: -50,5 | L28: 40,5
A29: 27 | B29: AOE攻击对方前排 | C29: 27 | D29: 3 | E29: 2 | G29: -61,5 | H29: 30,5 | I29: -54,5 | J29: 35,5 | K29: -49,5 | L29: 40,5
A30: 28 | B30: AOE攻击对方前排 | C30: 28 | D30: 3 | E30: 2 | G30: -59,5 | H30: 30,5 | I30: -53,5 | J30: 35,5 | K30: -48,5 | L30: 40,5
A31: 29 | B31: AOE攻击对方后排 | C31: 29 | D31: 3 | E31: 3 | G31: -60,5 | H31: 30,5 | I31: -55,5 | J31: 35,5 | K31: -50,5 | L31: 40,5
A32: 30 | B32: AOE攻击对方后排 | C32: 30 | D32: 3 | E32: 3 | G32: -61,5 | H32: 30,5 | I32: -54,5 | J32: 35,5 | K32: -49,5 | L32: 40,5
A33: 31 | B33: AOE攻击对方后排 | C33: 31 | D33: 3 | E33: 3 | G33: -59,5 | H33: 30,5 | I33: -53,5 | J33: 35,5 | K33: -48,5 | L33: 40,5
A34: 32 | B34: AOE攻击对方纵排 | C34: 32 | D34: 3 | E34: 4 | G34: -50,5 | H34: 30,5 | I34: -45,5 | J34: 35,5 | K34: -40,5 | L34: 40,5
A35: 33 | B35: AOE攻击对方纵排 | C35: 33 | D35: 3 | E35: 4 | G35: -51,5 | H35: 30,5 | I35: -46,5 | J35: 35,5 | K35: -41,5 | L35: 40,5
A36: 34 | B36: AOE攻击对方纵排 | C36: 34 | D36: 3 | E36: 4 | G36: -49,5 | H36: 30,5 | I36: -44,5 | J36: 35,5 | K36: -39,5 | L36: 40,5
A37: 35 | B37: AOE攻击对方随机2人 | C37: 35 | D37: 3 | E37: 5 | F37: 2 | G37: -50,5 | H37: 30,5 | I37: -45,5 | J37: 35,5 | K37: -40,5 | L37: 40,5
A38: 36 | B38: AOE攻击对方随机2人 | C38: 36 | D38: 3 | E38: 5 | F38: 2 | G38: -51,5 | H38: 30,5 | I38: -46,5 | J38: 35,5 | K38: -41,5 | L38: 40,5
A39: 37 | B39: AOE攻击对方随机2人 | C39: 37 | D39: 3 | E39: 5 | F39: 2 | G39: -49,5 | H39: 30,5 | I39: -44,5 | J39: 35,5 | K39: -39,5 | L39: 40,5
A40: 38 | B40: AOE攻击对方随机3人 | C40: 38 | D40: 3 | E40: 5 | F40: 3 | G40: -59,5 | H40: 30,5 | I40: -53,5 | J40: 35,5 | K40: -48,5 | L40: 40,5
A41: 39 | B41: AOE攻击对方随机3人 | C41: 39 | D41: 3 | E41: 5 | F41: 3 | G41: -60,5 | H41: 30,5 | I41: -55,5 | J41: 35,5 | K41: -50,5 | L41: 40,5
A42: 40 | B42: AOE攻击对方随机3人 | C42: 40 | D42: 3 | E42: 5 | F42: 3 | G42: -61,5 | H42: 30,5 | I42: -54,5 | J42: 35,5 | K42: -49,5 | L42: 40,5
A43: 41 | B43: 单体加血 | C43: 41 | D43: 2 | E43: 7 | G43: 32,5 | H43: 30,5 | I43: 37,5 | J43: 35,5 | K43: 42,5 | L43: 40,5
A44: 42 | B44: 单体加血 | C44: 42 | D44: 2 | E44: 7 | G44: 30,5 | H44: 30,5 | I44: 35,5 | J44: 35,5 | K44: 40,5 | L44: 40,5
A45: 43 | B45: 单体加血 | C45: 43 | D45: 2 | E45: 7 | G45: 31,5 | H45: 30,5 | I45: 36,5 | J45: 35,5 | K45: 43,5 | L45: 40,5
A46: 44 | B46: 单体加血 | C46: 44 | D46: 2 | E46: 7 | G46: 29,5 | H46: 30,5 | I46: 34,5 | J46: 35,5 | K46: 39,5 | L46: 40,5
A47: 45 | B47: 前排加血 | C47: 45 | D47: 2 | E47: 2 | G47: 15,5 | H47: 30,5 | I47: 20,5 | J47: 35,5 | K47: 25,5 | L47: 40,5
A48: 46 | B48: 前排加血 | C48: 46 | D48: 2 | E48: 2 | G48: 16,5 | H48: 30,5 | I48: 21,5 | J48: 35,5 | K48: 26,5 | L48: 40,5
A49: 47 | B49: 后排加血 | C49: 47 | D49: 2 | E49: 3 | G49: 15,5 | H49: 30,5 | I49: 20,5 | J49: 35,5 | K49: 25,5 | L49: 40,5
A50: 48 | B50: 后排加血 | C50: 48 | D50: 2 | E50: 3 | G50: 16,5 | H50: 30,5 | I50: 21,5 | J50: 35,5 | K50: 26,5 | L50: 40,5
A51: 49 | B51: 全部加血 | C51: 49 | D51: 2 | E51: 6 | G51: 5,5 | H51: 30,5 | I51: 10,5 | J51: 35,5 | K51: 15,5 | L51: 40,5
A52: 50 | B52: 全部加血 | C52: 50 | D52: 2 | E52: 6 | G52: 6,5 | H52: 30,5 | I52: 11,5 | J52: 35,5 | K52: 16,5 | L52: 40,5
M97: 攻击型-高攻，生命一般
M102: 攻击
M103: 5
M104: 5
M105: 10
M106: 20
M107: 30
M117: 攻击
M118: 5
M119: 5
M120: 10
M121: 10
M122: 10
M152: 攻击
M153: 5
M154: 5
M155: 10
M156: 10
M157: 10
M162: 攻击
M163: 5
M164: 5
M165: 20
M166: 20
M167: 20
M172: 攻击
M173: 5
M174: 5
M175: 10
M176: 10
M177: 10
M192: 攻击
M193: 5
M194: 10
M195: 20
M196: 30
M197: 40
M212: 攻击
M213: 5
M214: 10
M215: 10
M216: 10
M217: 10
M237: 攻击
M238: 5
M239: 10
M240: 10
M241: 10
M242: 10

Sheet: 神仙卡牌信息
A1: 名称ID | B1: 名称 | C1: 星级 | D1: 等级 | E1: 攻击力 | F1: 生命值 | G1: 技能ID | H1: 卡牌组合 | I1: 组合效果 | AC1: 成长值
A2: 1 | B2: 1 | C2: 1 | D2: 1 | E2: 59 | F2: 120 | G2: 1 | O2: 攻击型 | P2: 参考基准值 | Q2: 1星攻击力 | R2: 2星攻击力 | S2: 3星攻击力 | T2: 4星攻击力 | U2: 5星攻击力 | AC2: 500
B3: 2 | C3: 2 | D3: 1 | E3: 100 | F3: 195 | Q3: 50 | R3: 80 | S3: 120 | T3: 200 | U3: 330
B4: 3 | C4: 3 | D4: 1 | E4: 149 | F4: 355 | H4: 2 | I4: 1,20 | J4: 20--30之间的百分比变化 | P4: 最高值 | Q4: 60 | R4: 100 | S4: 150 | T4: 240 | U4: 380
B5: 4 | C5: 4 | D5: 1 | E5: 238 | F5: 516 | H5: 3,9 | I5: 2,25 | J5: 都是2+3的组合模式 | Q5: 1星生命值 | R5: 2星生命值 | S5: 3星生命值 | T5: 4星生命值 | U5: 5星生命值
B6: 5 | C6: 5 | D6: 1 | E6: 378 | F6: 821 | H6: 8,4 | I6: 1,25 | J6: 因为是5张牌 | Q6: 125 | R6: 200 | S6: 360 | T6: 520 | U6: 825
A7: 2 | B7: 6 | C7: 1 | D7: 1 | E7: 45 | F7: 140 | G7: 2 | J7: 组合牌里，每张4星，额外增幅3% | O7: 防御型 | P7: 最高值 | Q7: 150 | R7: 250 | S7: 440 | T7: 600 | U7: 950
B8: 7 | C8: 2 | D8: 1 | E8: 79 | F8: 221 | J8: 每张5星，额外增幅5%
B9: 8 | C9: 3 | D9: 1 | E9: 118 | F9: 390 | H9: 2 | I9: 1,20 | J9: 3星1种组合，4星2种，5星3种 | S9: 卡牌名称
B10: 9 | C10: 4 | D10: 1 | E10: 199 | F10: 552 | H10: 3,9 | I10: 2,25 | S10: 卡牌星级
B11: 10 | C11: 5 | D11: 1 | E11: 327 | F11: 878 | H11: 8,4 | I11: 1,25 | S11: 卡牌等级
A12: 3 | B12: 11 | C12: 1 | D12: 1 | E12: 51 | F12: 129 | G12: 3 | O12: 普通成长型 | S12: 卡牌等级上限
B13: 12 | C13: 2 | D13: 1 | E13: 82 | F13: 208 | S13: 技能等级
B14: 13 | C14: 3 | D14: 1 | E14: 123 | F14: 357 | H14: 2 | I14: 1,20 | S14: 技能等级上限
B15: 14 | C15: 4 | D15: 1 | E15: 209 | F15: 526 | H15: 3,9 | I15: 2,25 | S15: 攻击力
B16: 15 | C16: 5 | D16: 1 | E16: 327 | F16: 825 | H16: 8,4 | I16: 1,25 | S16: 生命值
A17: 4 | B17: 16 | C17: 1 | D17: 1 | E17: 47 | F17: 131 | G17: 4 | O17: 普通成长型 | S17: 暴击率
B18: 17 | C18: 2 | D18: 1 | E18: 75 | F18: 211 | S18: 闪避率
B19: 18 | C19: 3 | D19: 1 | E19: 120 | F19: 367 | H19: 2 | I19: 1,20 | S19: 技能描述
B20: 19 | C20: 4 | D20: 1 | E20: 199 | F20: 530 | H20: 3,9 | I20: 2,25 | S20: 卡牌描述
B21: 20 | C21: 5 | D21: 1 | E21: 321 | F21: 829 | H21: 8,4 | I21: 1,25 | S21: 培养按钮
A22: 5 | B22: 21 | C22: 1 | D22: 1 | E22: 53 | F22: 121 | G22: 5 | O22: 普通成长型 | S22: 仙丹总量
B23: 22 | C23: 2 | D23: 1 | E23: 82 | F23: 195
B24: 23 | C24: 3 | D24: 1 | E24: 119 | F24: 354 | H24: 2 | I24: 1,20
B25: 24 | C25: 4 | D25: 1 | E25: 195 | F25: 517 | H25: 3,9 | I25: 2,25
B26: 25 | C26: 5 | D26: 1 | E26: 328 | F26: 822 | H26: 8,4 | I26: 1,25
A27: 6 | B27: 26 | C27: 1 | D27: 1 | E27: 61 | F27: 115 | G27: 6 | O27: 攻击--高攻击型，生命偏低
B28: 27 | C28: 2 | D28: 1 | E28: 95 | F28: 186
B29: 28 | C29: 3 | D29: 1 | E29: 141 | F29: 341 | H29: 2 | I29: 1,20
B30: 29 | C30: 4 | D30: 1 | E30: 234 | F30: 519 | H30: 3,9 | I30: 2,25
B31: 30 | C31: 5 | D31: 1 | E31: 375 | F31: 813 | H31: 8,4 | I31: 1,25
A32: 7 | B32: 31 | C32: 1 | D32: 1 | E32: 51 | F32: 130 | G32: 7 | O32: 攻击 | Q32: 生命 | S32: 攻击一般，生命值略高
B33: 32 | C33: 2 | D33: 1 | E33: 82 | F33: 220 | O33: 10 | P33: 上增参数 | Q33: 10 | R33: 上下参数
B34: 33 | C34: 3 | D34: 1 | E34: 123 | F34: 390 | H34: 2 | I34: 1,20 | O34: 10 | Q34: 20
B35: 34 | C35: 4 | D35: 1 | E35: 204 | F35: 550 | H35: 3,9 | I35: 2,25 | O35: 10 | Q35: 30
B36: 35 | C36: 5 | D36: 1 | E36: 336 | F36: 855 | H36: 8,4 | I36: 1,25 | O36: 10 | Q36: 30
A37: 8 | B37: 36 | C37: 1 | D37: 1 | E37: 56 | F37: 134 | G37: 8 | O37: 10 | Q37: 30
B38: 37 | C38: 2 | D38: 1 | E38: 86 | F38: 226
B39: 38 | C39: 3 | D39: 1 | E39: 129 | F39: 393 | H39: 2 | I39: 1,20
B40: 39 | C40: 4 | D40: 1 | E40: 209 | F40: 556 | H40: 3,9 | I40: 2,25
B41: 40 | C41: 5 | D41: 1 | E41: 333 | F41: 859 | H41: 8,4 | I41: 1,25
A42: 9 | B42: 41 | C42: 1 | D42: 1 | E42: 53 | F42: 139 | G42: 9
B43: 42 | C43: 2 | D43: 1 | E43: 86 | F43: 223
B44: 43 | C44: 3 | D44: 1 | E44: 127 | F44: 392 | H44: 2 | I44: 1,20
B45: 44 | C45: 4 | D45: 1 | E45: 206 | F45: 556 | H45: 3,9 | I45: 2,25
B46: 45 | C46: 5 | D46: 1 | E46: 337 | F46: 857 | H46: 8,4 | I46: 1,25
A47: 10 | B47: 46 | C47: 1 | D47: 1 | E47: 53 | F47: 140 | G47: 10
B48: 47 | C48: 2 | D48: 1 | E48: 86 | F48: 227
B49: 48 | C49: 3 | D49: 1 | E49: 129 | F49: 389 | H49: 2 | I49: 1,20
B50: 49 | C50: 4 | D50: 1 | E50: 208 | F50: 559 | H50: 3,9 | I50: 2,25
B51: 50 | C51: 5 | D51: 1 | E51: 331 | F51: 860 | H51: 8,4 | I51: 1,25
A52: 11 | B52: 51 | C52: 1 | D52: 1 | E52: 55 | F52: 120 | G52: 11 | O52: 攻击 | Q52: 生命 | S52: 攻击偏高，生命值一般
B53: 52 | C53: 2 | D53: 1 | E53: 85 | F53: 195 | O53: 10 | P53: 上增参数 | Q53: 10 | R53: 上下参数
B54: 53 | C54: 3 | D54: 1 | E54: 140 | F54: 354 | H54: 2 | I54: 1,20 | O54: 20 | Q54: 10
B55: 54 | C55: 4 | D55: 1 | E55: 235 | F55: 516 | H55: 3,9 | I55: 2,25 | O55: 30 | Q55: 10
B56: 55 | C56: 5 | D56: 1 | E56: 370 | F56: 823 | H56: 8,4 | I56: 1,25 | O56: 40 | Q56: 10
A57: 12 | B57: 56 | C57: 1 | D57: 1 | E57: 54 | F57: 125 | G57: 12 | O57: 50 | Q57: 10
B58: 57 | C58: 2 | D58: 1 | E58: 88 | F58: 190
B59: 58 | C59: 3 | D59: 1 | E59: 145 | F59: 350 | H59: 2 | I59: 1,20
B60: 59 | C60: 4 | D60: 1 | E60: 240 | F60: 515 | H60: 3,9 | I60: 2,25
B61: 60 | C61: 5 | D61: 1 | E61: 375 | F61: 821 | H61: 8,4 | I61: 1,25
A62: 13 | B62: 61 | C62: 1 | D62: 1 | E62: 58 | F62: 120 | G62: 13
B63: 62 | C63: 2 | D63: 1 | E63: 87 | F63: 192
B64: 63 | C64: 3 | D64: 1 | E64: 149 | F64: 355 | H64: 2 | I64: 1,20
B65: 64 | C65: 4 | D65: 1 | E65: 241 | F65: 511 | H65: 3,9 | I65: 2,25
B66: 65 | C66: 5 | D66: 1 | E66: 379 | F66: 828 | H66: 8,4 | I66: 1,25
A67: 14 | B67: 66 | C67: 1 | D67: 1 | E67: 51 | F67: 130 | G67: 14 | O67: 攻击 | Q67: 生命 | S67: 攻击一般，生命值一般
B68: 67 | C68: 2 | D68: 1 | E68: 81 | F68: 221 | O68: 5 | P68: 上增参数 | Q68: 10 | R68: 上增参数
B69: 68 | C69: 3 | D69: 1 | E69: 123 | F69: 375 | H69: 2 | I69: 1,20 | O69: 5 | Q69: 10
B70: 69 | C70: 4 | D70: 1 | E70: 202 | F70: 512 | H70: 3,9 | I70: 2,25 | O70: 10 | Q70: 10
B71: 70 | C71: 5 | D71: 1 | E71: 332 | F71: 815 | H71: 8,4 | I71: 1,25 | O71: 10 | Q71: 10
A72: 15 | B72: 71 | C72: 1 | D72: 1 | E72: 53 | F72: 126 | G72: 15 | O72: 10 | Q72: 10
B73: 72 | C73: 2 | D73: 1 | E73: 83 | F73: 224
B74: 73 | C74: 3 | D74: 1 | E74: 125 | F74: 374 | H74: 2 | I74: 1,20
B75: 74 | C75: 4 | D75: 1 | E75: 205 | F75: 516 | H75: 3,9 | I75: 2,25
B76: 75 | C76: 5 | D76: 1 | E76: 336 | F76: 820 | H76: 8,4 | I76: 1,25
A77: 16 | B77: 76 | D77: 1 | E77: 55 | F77: 121 | G77: 16
B78: 77 | D78: 1 | E78: 85 | F78: 228
B79: 78 | D79: 1 | E79: 126 | F79: 375 | H79: 2 | I79: 1,20
B80: 79 | D80: 1 | E80: 201 | F80: 520 | H80: 3,9 | I80: 2,25
B81: 80 | D81: 1 | E81: 330 | F81: 825 | H81: 8,4 | I81: 1,25
A82: 17 | B82: 81 | D82: 1 | E82: 56 | F82: 129 | G82: 17
B83: 82 | D83: 1 | E83: 88 | F83: 226
B84: 83 | D84: 1 | E84: 122 | F84: 375 | H84: 2 | I84: 1,20
B85: 84 | D85: 1 | E85: 203 | F85: 519 | H85: 3,9 | I85: 2,25
B86: 85 | D86: 1 | E86: 340 | F86: 830 | H86: 8,4 | I86: 1,25
A87: 18 | B87: 86 | D87: 1 | E87: 58 | F87: 122 | G87: 18
B88: 87 | D88: 1 | E88: 88 | F88: 222
B89: 88 | D89: 1 | E89: 129 | F89: 380 | H89: 2 | I89: 1,20
B90: 89 | D90: 1 | E90: 207 | F90: 524 | H90: 3,9 | I90: 2,25
B91: 90 | D91: 1 | E91: 339 | F91: 831 | H91: 8,4 | I91: 1,25
A92: 19 | B92: 91 | D92: 1 | E92: 53 | F92: 126 | G92: 19
B93: 92 | D93: 1 | E93: 83 | F93: 224
B94: 93 | D94: 1 | E94: 125 | F94: 374 | H94: 2 | I94: 1,20
B95: 94 | D95: 1 | E95: 205 | F95: 516 | H95: 3,9 | I95: 2,25
B96: 95 | D96: 1 | E96: 336 | F96: 820 | H96: 8,4 | I96: 1,25
A97: 20 | B97: 96 | D97: 1 | E97: 60 | F97: 120 | G97: 20 | N97: 攻击型-高攻，生命一般
B98: 97 | D98: 1 | E98: 100 | F98: 190
B99: 98 | D99: 1 | E99: 150 | F99: 345 | H99: 2 | I99: 1,20
B100: 99 | D100: 1 | E100: 240 | F100: 510 | H100: 3,9 | I100: 2,25
B101: 100 | D101: 1 | E101: 380 | F101: 801 | H101: 8,4 | I101: 1,25
A102: 21 | B102: 101 | D102: 1 | E102: 51 | F102: 140 | G102: 21 | N102: 攻击 | P102: 生命 | R102: 攻击偏中高，生命值一般
B103: 102 | D103: 1 | E103: 82 | F103: 230 | N103: 5 | O103: 上增参数 | P103: 20 | Q103: 上增参数
B104: 103 | D104: 1 | E104: 131 | F104: 408 | H104: 2 | I104: 1,20 | N104: 5 | P104: 30
B105: 104 | D105: 1 | E105: 222 | F105: 572 | H105: 3,9 | I105: 2,25 | N105: 10 | P105: 50
B106: 105 | D106: 1 | E106: 351 | F106: 875 | H106: 8,4 | I106: 1,25 | N106: 20 | P106: 50
A107: 22 | B107: 106 | D107: 1 | E107: 52 | F107: 141 | G107: 22 | N107: 30 | P107: 50
B108: 107 | D108: 1 | E108: 82 | F108: 232
B109: 108 | D109: 1 | E109: 135 | F109: 712 | H109: 2 | I109: 1,20
B110: 109 | D110: 1 | E110: 226 | F110: 575 | H110: 3,9 | I110: 2,25
B111: 110 | D111: 1 | E111: 353 | F111: 872 | H111: 8,4 | I111: 1,25
A112: 23 | B112: 111 | D112: 1 | E112: 55 | F112: 144 | G112: 23
B113: 112 | D113: 1 | E113: 85 | F113: 231
B114: 113 | D114: 1 | E114: 138 | F114: 711 | H114: 2 | I114: 1,20
B115: 114 | D115: 1 | E115: 227 | F115: 574 | H115: 3,9 | I115: 2,25
B116: 115 | D116: 1 | E116: 349 | F116: 873 | H116: 8,4 | I116: 1,25
A117: 24 | B117: 116 | D117: 1 | E117: 48 | F117: 145 | G117: 24 | N117: 攻击 | P117: 生命 | R117: 攻击偏低，生命偏中高型
B118: 117 | D118: 1 | E118: 75 | F118: 230 | N118: 5 | O118: 下减参数 | P118: 20 | Q118: 上增参数
B119: 118 | D119: 1 | E119: 116 | F119: 405 | H119: 2 | I119: 1,20 | N119: 5 | P119: 30
B120: 119 | D120: 1 | E120: 198 | F120: 598 | H120: 3,9 | I120: 2,25 | N120: 10 | P120: 50
B121: 120 | D121: 1 | E121: 323 | F121: 902 | H121: 8,4 | I121: 1,25 | N121: 10 | P121: 70
A122: 25 | B122: 121 | D122: 1 | E122: 46 | F122: 146 | G122: 25 | N122: 10 | P122: 90
B123: 122 | D123: 1 | E123: 76 | F123: 231
B124: 123 | D124: 1 | E124: 114 | F124: 408 | H124: 2 | I124: 1,20
B125: 124 | D125: 1 | E125: 196 | F125: 600 | H125: 3,9 | I125: 2,25
B126: 125 | D126: 1 | E126: 327 | F126: 910 | H126: 8,4 | I126: 1,25
A127: 26 | B127: 126 | D127: 1 | E127: 49 | F127: 144 | G127: 26
B128: 127 | D128: 1 | E128: 77 | F128: 238
B129: 128 | D129: 1 | E129: 112 | F129: 410 | H129: 2 | I129: 1,20
B130: 129 | D130: 1 | E130: 195 | F130: 602 | H130: 3,9 | I130: 2,25
B131: 130 | D131: 1 | E131: 327 | F131: 908 | H131: 8,4 | I131: 1,25
A132: 27 | B132: 131 | D132: 1 | E132: 42 | F132: 141 | G132: 27
B133: 132 | D133: 1 | E133: 73 | F133: 238
B134: 133 | D134: 1 | E134: 119 | F134: 412 | H134: 2 | I134: 1,20
B135: 134 | D135: 1 | E135: 203 | F135: 604 | H135: 3,9 | I135: 2,25
B136: 135 | D136: 1 | E136: 322 | F136: 908 | H136: 8,4 | I136: 1,25
A137: 28 | B137: 136 | D137: 1 | E137: 43 | F137: 140 | G137: 28
B138: 137 | D138: 1 | E138: 72 | F138: 229
B139: 138 | D139: 1 | E139: 111 | F139: 403 | H139: 2 | I139: 1,20
B140: 139 | D140: 1 | E140: 189 | F140: 592 | H140: 3,9 | I140: 2,25
B141: 140 | D141: 1 | E141: 331 | F141: 901 | H141: 8,4 | I141: 1,25
A142: 29 | B142: 141 | D142: 1 | E142: 47 | F142: 150 | G142: 29
B143: 142 | D143: 1 | E143: 79 | F143: 229
B144: 143 | D144: 1 | E144: 122 | F144: 394 | H144: 2 | I144: 1,20
B145: 144 | D145: 1 | E145: 203 | F145: 604 | H145: 3,9 | I145: 2,25
B146: 145 | D146: 1 | E146: 332 | F146: 911 | H146: 8,4 | I146: 1,25
A147: 30 | B147: 146 | D147: 1 | E147: 40 | F147: 151 | G147: 30
B148: 147 | D148: 1 | E148: 80 | F148: 232
B149: 148 | D149: 1 | E149: 119 | F149: 412 | H149: 2 | I149: 1,20
B150: 149 | D150: 1 | E150: 203 | F150: 608 | H150: 3,9 | I150: 2,25
B151: 150 | D151: 1 | E151: 333 | F151: 909 | H151: 8,4 | I151: 1,25
A152: 31 | B152: 151 | D152: 1 | E152: 50 | F152: 145 | G152: 31 | N152: 攻击 | P152: 生命 | R152: 攻击一般，生命偏高型
B153: 152 | D153: 1 | E153: 75 | F153: 243 | N153: 5 | O153: 下减参数 | P153: 20 | Q153: 上增参数
B154: 153 | D154: 1 | E154: 115 | F154: 432 | H154: 2 | I154: 1,20 | N154: 5 | P154: 30
B155: 154 | D155: 1 | E155: 192 | F155: 592 | H155: 3,9 | I155: 2,25 | N155: 10 | P155: 80
B156: 155 | D156: 1 | E156: 318 | F156: 938 | H156: 8,4 | I156: 1,25 | N156: 10 | P156: 80
A157: 32 | B157: 156 | D157: 1 | E157: 55 | F157: 144 | G157: 32 | N157: 10 | P157: 120
B158: 157 | D158: 1 | E158: 79 | F158: 242
B159: 158 | D159: 1 | E159: 117 | F159: 430 | H159: 2 | I159: 1,20
B160: 159 | D160: 1 | E160: 197 | F160: 590 | H160: 3,9 | I160: 2,25
B161: 160 | D161: 1 | E161: 320 | F161: 940 | H161: 8,4 | I161: 1,25
A162: 33 | B162: 161 | D162: 1 | E162: 56 | F162: 129 | G162: 33 | N162: 攻击 | P162: 生命 | R162: 攻击略高，生命一般
B163: 162 | D163: 1 | E163: 85 | F163: 208 | N163: 5 | O163: 下调参数 | P163: 20 | Q163: 上调参数
B164: 163 | D164: 1 | E164: 135 | F164: 355 | H164: 2 | I164: 1,20 | N164: 5 | P164: 20
B165: 164 | D165: 1 | E165: 228 | F165: 518 | H165: 3,9 | I165: 2,25 | N165: 20 | P165: 20
B166: 165 | D166: 1 | E166: 352 | F166: 830 | H166: 8,4 | I166: 1,25 | N166: 20 | P166: 20
A167: 34 | B167: 166 | D167: 1 | E167: 58 | F167: 124 | G167: 34 | N167: 20 | P167: 20
B168: 167 | D168: 1 | E168: 89 | F168: 207
B169: 168 | D169: 1 | E169: 137 | F169: 253 | H169: 2 | I169: 1,20
B170: 169 | D170: 1 | E170: 230 | F170: 515 | H170: 3,9 | I170: 2,25
B171: 170 | D171: 1 | E171: 360 | F171: 824 | H171: 8,4 | I171: 1,25
A172: 35 | B172: 171 | D172: 1 | E172: 45 | F172: 135 | G172: 35 | N172: 攻击 | P172: 生命 | R172: 攻击一般，生命很高
B173: 172 | D173: 1 | E173: 76 | F173: 236 | N173: 5 | O173: 下调参数 | P173: 20 | Q173: 上调参数
B174: 173 | D174: 1 | E174: 116 | F174: 426 | H174: 2 | I174: 1,20 | N174: 5 | P174: 30
B175: 174 | D175: 1 | E175: 204 | F175: 587 | H175: 3,9 | I175: 2,25 | N175: 10 | P175: 70
B176: 175 | D176: 1 | E176: 321 | F176: 934 | H176: 8,4 | I176: 1,25 | N176: 10 | P176: 80
A177: 36 | B177: 176 | D177: 1 | E177: 47 | F177: 132 | G177: 36 | N177: 10 | P177: 110
B178: 177 | D178: 1 | E178: 73 | F178: 230
B179: 178 | D179: 1 | E179: 112 | F179: 430 | H179: 2 | I179: 1,20
B180: 179 | D180: 1 | E180: 200 | F180: 585 | H180: 3,9 | I180: 2,25
B181: 180 | D181: 1 | E181: 329 | F181: 931 | H181: 8,4 | I181: 1,25
A182: 37 | B182: 181 | D182: 1 | E182: 43 | F182: 135 | G182: 37
B183: 182 | D183: 1 | E183: 70 | F183: 233
B184: 183 | D184: 1 | E184: 110 | F184: 431 | H184: 2 | I184: 1,20
B185: 184 | D185: 1 | E185: 207 | F185: 588 | H185: 3,9 | I185: 2,25
B186: 185 | D186: 1 | E186: 331 | F186: 934 | H186: 8,4 | I186: 1,25
A187: 38 | B187: 186 | D187: 1 | E187: 46 | F187: 130 | G187: 38
B188: 187 | D188: 1 | E188: 75 | F188: 231
B189: 188 | D189: 1 | E189: 114 | F189: 428 | H189: 2 | I189: 1,20
B190: 189 | D190: 1 | E190: 202 | F190: 565 | H190: 3,9 | I190: 2,25
B191: 190 | D191: 1 | E191: 324 | F191: 939 | H191: 8,4 | I191: 1,25
A192: 39 | B192: 191 | D192: 1 | E192: 57 | F192: 130 | G192: 39 | N192: 攻击 | P192: 生命 | R192: 攻击偏高，生命偏低
B193: 192 | D193: 1 | E193: 84 | F193: 221 | N193: 5 | O193: 上调参数 | P193: 20 | Q193: 上调参数
B194: 193 | D194: 1 | E194: 141 | F194: 385 | H194: 2 | I194: 1,20 | N194: 10 | P194: 20
B195: 194 | D195: 1 | E195: 230 | F195: 546 | H195: 3,9 | I195: 2,25 | N195: 20 | P195: 20
B196: 195 | D196: 1 | E196: 360 | F196: 852 | H196: 8,4 | I196: 1,25 | N196: 30 | P196: 20
A197: 40 | B197: 196 | D197: 1 | E197: 58 | F197: 129 | G197: 40 | N197: 40 | P197: 20
B198: 197 | D198: 1 | E198: 86 | F198: 220
B199: 198 | D199: 1 | E199: 145 | F199: 383 | H199: 2 | I199: 1,20
B200: 199 | D200: 1 | E200: 233 | F200: 542 | H200: 3,9 | I200: 2,25
B201: 200 | D201: 1 | E201: 364 | F201: 848 | H201: 8,4 | I201: 1,25
A202: 41 | B202: 201 | D202: 1 | E202: 53 | F202: 133 | G202: 41
B203: 202 | D203: 1 | E203: 82 | F203: 225
B204: 203 | D204: 1 | E204: 141 | F204: 386 | H204: 2 | I204: 1,20
B205: 204 | D205: 1 | E205: 231 | F205: 547 | H205: 3,9 | I205: 2,25
B206: 205 | D206: 1 | E206: 362 | F206: 851 | H206: 8,4 | I206: 1,25
A207: 42 | B207: 206 | D207: 1 | E207: 51 | F207: 134 | G207: 42
B208: 207 | D208: 1 | E208: 86 | F208: 221
B209: 208 | D209: 1 | E209: 149 | F209: 381 | H209: 2 | I209: 1,20
B210: 209 | D210: 1 | E210: 238 | F210: 540 | H210: 3,9 | I210: 2,25
B211: 210 | D211: 1 | E211: 366 | F211: 847 | H211: 8,4 | I211: 1,25
A212: 43 | B212: 211 | D212: 1 | E212: 56 | F212: 121 | G212: 43 | N212: 攻击 | P212: 生命 | R212: 攻击一般，生命一般
B213: 212 | D213: 1 | E213: 87 | F213: 221 | N213: 5 | O213: 上调参数 | P213: 20 | Q213: 上调参数
B214: 213 | D214: 1 | E214: 131 | F214: 382 | H214: 2 | I214: 1,20 | N214: 10 | P214: 20
B215: 214 | D215: 1 | E215: 215 | F215: 545 | H215: 3,9 | I215: 2,25 | N215: 10 | P215: 20
B216: 215 | D216: 1 | E216: 342 | F216: 849 | H216: 8,4 | I216: 1,25 | N216: 10 | P216: 20
A217: 44 | B217: 216 | D217: 1 | E217: 57 | F217: 120 | G217: 44 | N217: 10 | P217: 20
B218: 217 | D218: 1 | E218: 89 | F218: 217
B219: 218 | D219: 1 | E219: 137 | F219: 380 | H219: 2 | I219: 1,20
B220: 219 | D220: 1 | E220: 220 | F220: 550 | H220: 3,9 | I220: 2,25
B221: 220 | D221: 1 | E221: 347 | F221: 845 | H221: 8,4 | I221: 1,25
A222: 45 | B222: 221 | D222: 1 | E222: 53 | F222: 126 | G222: 45
B223: 222 | D223: 1 | E223: 92 | F223: 214
B224: 223 | D224: 1 | E224: 133 | F224: 388 | H224: 2 | I224: 1,20
B225: 224 | D225: 1 | E225: 224 | F225: 545 | H225: 3,9 | I225: 2,25
B226: 225 | D226: 1 | E226: 343 | F226: 851 | H226: 8,4 | I226: 1,25
A227: 46 | B227: 226 | D227: 1 | E227: 51 | F227: 129 | G227: 46
B228: 227 | D228: 1 | E228: 87 | F228: 211
B229: 228 | D229: 1 | E229: 133 | F229: 384 | H229: 2 | I229: 1,20
B230: 229 | D230: 1 | E230: 226 | F230: 541 | H230: 3,9 | I230: 2,25
B231: 230 | D231: 1 | E231: 344 | F231: 849 | H231: 8,4 | I231: 1,25
A232: 47 | B232: 231 | D232: 1 | E232: 59 | F232: 121 | G232: 47
B233: 232 | D233: 1 | E233: 91 | F233: 212
B234: 233 | D234: 1 | E234: 134 | F234: 386 | H234: 2 | I234: 1,20
B235: 234 | D235: 1 | E235: 222 | F235: 555 | H235: 3,9 | I235: 2,25
B236: 235 | D236: 1 | E236: 349 | F236: 841 | H236: 8,4 | I236: 1,25
A237: 48 | B237: 236 | D237: 1 | E237: 44 | F237: 130 | G237: 48 | N237: 攻击 | P237: 生命 | R237: 攻击偏低，生命偏高
B238: 237 | D238: 1 | E238: 72 | F238: 225 | N238: 5 | O238: 下调参数 | P238: 20 | Q238: 上调参数
B239: 238 | D239: 1 | E239: 113 | F239: 420 | H239: 2 | I239: 1,20 | N239: 10 | P239: 20
B240: 239 | D240: 1 | E240: 193 | F240: 595 | H240: 3,9 | I240: 2,25 | N240: 10 | P240: 60
B241: 240 | D241: 1 | E241: 321 | F241: 920 | H241: 8,4 | I241: 1,25 | N241: 10 | P241: 70
A242: 49 | B242: 241 | D242: 1 | E242: 49 | F242: 128 | G242: 49 | N242: 10 | P242: 100
B243: 242 | D243: 1 | E243: 78 | F243: 221
B244: 243 | D244: 1 | E244: 119 | F244: 591 | H244: 2 | I244: 1,20
B245: 244 | D245: 1 | E245: 192 | F245: 597 | H245: 3,9 | I245: 2,25
B246: 245 | D246: 1 | E246: 328 | F246: 915 | H246: 8,4 | I246: 1,25
A247: 50 | B247: 246 | D247: 1 | E247: 41 | F247: 132 | G247: 50
B248: 247 | D248: 1 | E248: 75 | F248: 226
B249: 248 | D249: 1 | E249: 115 | F249: 597 | H249: 2 | I249: 1,20
B250: 249 | D250: 1 | E250: 194 | F250: 593 | H250: 3,9 | I250: 2,25
B251: 250 | D251: 1 | E251: 322 | F251: 920

Sheet: 被动参考表
A2: 辅助效果属性跟星级没有关系。但是3星以上，每提升1个星级，会多一种辅助效果，5星最多3种。
A3: 卡牌初始没有暴击和闪避，这个坑现在挪到这个辅助效果里了
A5: 出生值随机范围 | B5: 1--5
A6: 这些数值都是百分比
A7: 而且都是基础属性的百分比，注意不是攻击伤害的百分比
A9: 洗练最高值 | B9: 10 | D9: 1-10变化很小其实，但小有小的好处。这样可以直观的更容易刺激玩家去追求10%这个最高值。
D10: 给他一种看起来好像很容易追求到的感觉
A11: 攻击力 | B11: 10 | D11: 可以自由洗练自己喜欢的属性类型，1，这样体验差异化更加明显一点,2.同时追求更加多样化
A12: 生命值 | B12: 10 | D12: 这种方式比每张卡牌事先固定死的方式要好。
A13: 暴击 | B13: 10
A14: 闪避 | B14: 10
A15: 减伤 | B15: 10
A18: 玩家最多可以同时拥有3种相同的属性
A19: 卡牌初始属性只有攻击力和生命值这2个，没有其他的。
A20: 最初设定的初始暴击和闪避没有了，现在挪到被动效果里。
A21: 首先这5个属性，进行随机选取，也就是每个有1/5的概率被随机到。
A22: 其次是具体的概率，如下
A23: 概率 | B23: 百分比范围
A24: 0.9 | B24: 1--5
A25: 0.07 | B25: 4--7
A26: 0.03 | B26: 8--10

Sheet: 基础属性成长表
A1: 等级 | B1: 初始参考系数 | C1: 实际增量系数
A2: 1 | B2: 1.1 | C2: 1 | F2: 当前等级属性=1级初始值*当前等级实际增量系数
A3: 2 | B3: =R[-1]C-0.001 -> 1.099 | C3: 1.1 | F3: 星级 | G3: 最高等级
A4: 3 | B4: =R[-1]C-0.001 -> 1.098 | C4: =R[-1]C*R[-1]C[-1] -> 1.2089 | F4: 1 | G4: 30
A5: 4 | B5: =R[-1]C-0.001 -> 1.097 | C5: =R[-1]C*R[-1]C[-1] -> 1.3273722 | F5: 2 | G5: 40
A6: 5 | B6: =R[-1]C-0.001 -> 1.096 | C6: =R[-1]C*R[-1]C[-1] -> 1.4561273034 | F6: 3 | G6: 50
A7: 6 | B7: =R[-1]C-0.001 -> 1.095 | C7: =R[-1]C*R[-1]C[-1] -> 1.5959155245264 | F7: 4 | G7: 55
A8: 7 | B8: =R[-1]C-0.001 -> 1.094 | C8: =R[-1]C*R[-1]C[-1] -> 1.74752749935641 | F8: 5 | G8: 60
A9: 8 | B9: =R[-1]C-0.001 -> 1.093 | C9: =R[-1]C*R[-1]C[-1] -> 1.91179508429592
A10: 9 | B10: =R[-1]C-0.001 -> 1.092 | C10: =R[-1]C*R[-1]C[-1] -> 2.08959202713544
A11: 10 | B11: =R[-1]C-0.001 -> 1.091 | C11: =R[-1]C*R[-1]C[-1] -> 2.2818344936319
A12: 11 | B12: =R[-1]C-0.001 -> 1.09 | C12: =R[-1]C*R[-1]C[-1] -> 2.4894814325524
A13: 12 | B13: =R[-1]C-0.001 -> 1.089 | C13: =R[-1]C*R[-1]C[-1] -> 2.71353476148212
A14: 13 | B14: =R[-1]C-0.001 -> 1.088 | C14: =R[-1]C*R[-1]C[-1] -> 2.95503935525404
A15: 14 | B15: =R[-1]C-0.001 -> 1.087 | C15: =R[-1]C*R[-1]C[-1] -> 3.2150828185164
A16: 15 | B16: =R[-1]C-0.001 -> 1.086 | C16: =R[-1]C*R[-1]C[-1] -> 3.49479502372733
A17: 16 | B17: =R[-1]C-0.001 -> 1.085 | C17: =R[-1]C*R[-1]C[-1] -> 3.79534739576788
A18: 17 | B18: =R[-1]C-0.001 -> 1.084 | C18: =R[-1]C*R[-1]C[-1] -> 4.11795192440816
A19: 18 | B19: =R[-1]C-0.001 -> 1.083 | C19: =R[-1]C*R[-1]C[-1] -> 4.46385988605845
A20: 19 | B20: =R[-1]C-0.001 -> 1.082 | C20: =R[-1]C*R[-1]C[-1] -> 4.83436025660131
A21: 20 | B21: =R[-1]C-0.001 -> 1.081 | C21: =R[-1]C*R[-1]C[-1] -> 5.23077779764263
A22: 21 | B22: =R[-1]C-0.001 -> 1.08 | C22: =R[-1]C*R[-1]C[-1] -> 5.6544707992517
A23: 22 | B23: =R[-1]C-0.001 -> 1.079 | C23: =R[-1]C*R[-1]C[-1] -> 6.10682846319185
A24: 23 | B24: =R[-1]C-0.001 -> 1.078 | C24: =R[-1]C*R[-1]C[-1] -> 6.58926791178402
A25: 24 | B25: =R[-1]C-0.001 -> 1.077 | C25: =R[-1]C*R[-1]C[-1] -> 7.10323080890319
A26: 25 | B26: =R[-1]C-0.001 -> 1.076 | C26: =R[-1]C*R[-1]C[-1] -> 7.65017958118875
A27: 26 | B27: =R[-1]C-0.001 -> 1.075 | C27: =R[-1]C*R[-1]C[-1] -> 8.23159322935912
A28: 27 | B28: =R[-1]C-0.001 -> 1.074 | C28: =R[-1]C*R[-1]C[-1] -> 8.84896272156107
A29: 28 | B29: =R[-1]C-0.001 -> 1.073 | C29: =R[-1]C*R[-1]C[-1] -> 9.50378596295662
A30: 29 | B30: =R[-1]C-0.001 -> 1.072 | C30: =R[-1]C*R[-1]C[-1] -> 10.1975623382525
A31: 30 | B31: =R[-1]C-0.001 -> 1.071 | C31: =R[-1]C*R[-1]C[-1] -> 10.9317868266067
A32: 31 | B32: =R[-1]C-0.001 -> 1.07 | C32: =R[-1]C*R[-1]C[-1] -> 11.7079436912958
A33: 32 | B33: =R[-1]C-0.001 -> 1.069 | C33: =R[-1]C*R[-1]C[-1] -> 12.5274997496865
A34: 33 | B34: =R[-1]C-0.001 -> 1.068 | C34: =R[-1]C*R[-1]C[-1] -> 13.391897232415
A35: 34 | B35: =R[-1]C-0.001 -> 1.067 | C35: =R[-1]C*R[-1]C[-1] -> 14.3025462442192
A36: 35 | B36: =R[-1]C-0.001 -> 1.066 | C36: =R[-1]C*R[-1]C[-1] -> 15.260816842582
A37: 36 | B37: =R[-1]C-0.001 -> 1.065 | C37: =R[-1]C*R[-1]C[-1] -> 16.2680307541924
A38: 37 | B38: =R[-1]C-0.001 -> 1.064 | C38: =R[-1]C*R[-1]C[-1] -> 17.325452753215
A39: 38 | B39: =R[-1]C-0.001 -> 1.063 | C39: =R[-1]C*R[-1]C[-1] -> 18.4342817294208
A40: 39 | B40: =R[-1]C-0.001 -> 1.062 | C40: =R[-1]C*R[-1]C[-1] -> 19.5956414783744
A41: 40 | B41: =R[-1]C-0.001 -> 1.061 | C41: =R[-1]C*R[-1]C[-1] -> 20.8105712500337
A42: 41 | B42: =R[-1]C-0.001 -> 1.06 | C42: =R[-1]C*R[-1]C[-1] -> 22.0800160962859
A43: 42 | B43: =R[-1]C-0.001 -> 1.059 | C43: =R[-1]C*R[-1]C[-1] -> 23.4048170620631
A44: 43 | B44: =R[-1]C-0.001 -> 1.058 | C44: =R[-1]C*R[-1]C[-1] -> 24.785701268725
A45: 44 | B45: =R[-1]C-0.001 -> 1.057 | C45: =R[-1]C*R[-1]C[-1] -> 26.2232719423111
A46: 45 | B46: =R[-1]C-0.001 -> 1.05600000000001 | C46: =R[-1]C*R[-1]C[-1] -> 27.717998443023
A47: 46 | B47: =R[-1]C-0.001 -> 1.05500000000001 | C47: =R[-1]C*R[-1]C[-1] -> 29.2702063558324
A48: 47 | B48: =R[-1]C-0.001 -> 1.05400000000001 | C48: =R[-1]C*R[-1]C[-1] -> 30.8800677054033
A49: 48 | B49: =R[-1]C-0.001 -> 1.05300000000001 | C49: =R[-1]C*R[-1]C[-1] -> 32.5475913614953
A50: 49 | B50: =R[-1]C-0.001 -> 1.05200000000001 | C50: =R[-1]C*R[-1]C[-1] -> 34.2726137036547
A51: 50 | B51: =R[-1]C-0.001 -> 1.05100000000001 | C51: =R[-1]C*R[-1]C[-1] -> 36.0547896162449
A52: 51 | B52: =R[-1]C-0.001 -> 1.05000000000001 | C52: =R[-1]C*R[-1]C[-1] -> 37.8935838866736
A53: 52 | B53: =R[-1]C-0.001 -> 1.04900000000001 | C53: =R[-1]C*R[-1]C[-1] -> 39.7882630810075
A54: 53 | B54: =R[-1]C-0.001 -> 1.04800000000001 | C54: =R[-1]C*R[-1]C[-1] -> 41.7378879719771
A55: 54 | B55: =R[-1]C-0.001 -> 1.04700000000001 | C55: =R[-1]C*R[-1]C[-1] -> 43.7413065946323
A56: 55 | B56: =R[-1]C-0.001 -> 1.04600000000001 | C56: =R[-1]C*R[-1]C[-1] -> 45.7971480045802
A57: 56 | B57: =R[-1]C-0.001 -> 1.04500000000001 | C57: =R[-1]C*R[-1]C[-1] -> 47.9038168127912
A58: 57 | B58: =R[-1]C-0.001 -> 1.04400000000001 | C58: =R[-1]C*R[-1]C[-1] -> 50.0594885693671
A59: 58 | B59: =R[-1]C-0.001 -> 1.04300000000001 | C59: =R[-1]C*R[-1]C[-1] -> 52.2621060664196
A60: 59 | B60: =R[-1]C-0.001 -> 1.04200000000001 | C60: =R[-1]C*R[-1]C[-1] -> 54.5093766272759
A61: 60 | B61: =R[-1]C-0.001 -> 1.04100000000001 | C61: =R[-1]C*R[-1]C[-1] -> 56.7987704456219
B62: =R[-1]C-0.001 -> 1.04000000000001 | C62: =R[-1]C*R[-1]C[-1] -> 59.1275200338928

Sheet: 任务基础奖励
A1: 任务大关ID | B1: 任务大关名称 | C1: 任务小关ID | D1: 任务小关名称 | E1: 进度层数 | F1: 体力消耗/次 | G1: 经验奖励/次 | H1: 铜板单次奖励
A2: 1 | B2: 遇到上帝的 | C2: 1 | D2: 上帝死了 | E2: 5 | F2: 5 | G2: =RC[-2]*1 -> 5 | H2: =RC[-3]*10 -> 50
C3: =R[-1]C+1 -> 2 | E3: 5 | F3: =R[-1]C -> 5 | G3: =RC[-2]*1 -> 5 | H3: =RC[-3]*10 -> 50
C4: =R[-1]C+1 -> 3 | E4: 5 | F4: =R[-1]C -> 5 | G4: =RC[-2]*1 -> 5 | H4: =RC[-3]*10 -> 50
C5: =R[-1]C+1 -> 4 | E5: 5 | F5: =R[-1]C -> 5 | G5: =RC[-2]*1 -> 5 | H5: =RC[-3]*10 -> 50
C6: =R[-1]C+1 -> 5 | E6: 5 | F6: =R[-1]C -> 5 | G6: =RC[-2]*1 -> 5 | H6: =RC[-3]*10 -> 50
C7: =R[-1]C+1 -> 6 | E7: 5 | F7: =R[-1]C -> 5 | G7: =RC[-2]*1 -> 5 | H7: =RC[-3]*10 -> 50
C8: =R[-1]C+1 -> 7 | E8: 5 | F8: =R[-1]C -> 5 | G8: =RC[-2]*1 -> 5 | H8: =RC[-3]*10 -> 50
C9: =R[-1]C+1 -> 8 | E9: 5 | F9: =R[-1]C -> 5 | G9: =RC[-2]*1 -> 5 | H9: =RC[-3]*10 -> 50
C10: =R[-1]C+1 -> 9 | E10: 5 | F10: =R[-1]C -> 5 | G10: =RC[-2]*1 -> 5 | H10: =RC[-3]*10 -> 50
C11: =R[-1]C+1 -> 10 | E11: 5 | F11: =R[-1]C -> 5 | G11: =RC[-2]*1 -> 5 | H11: =RC[-3]*10 -> 50
A12: 2 | C12: =R[-1]C+1 -> 11 | E12: 5 | F12: =R[-1]C -> 5 | G12: =RC[-2]*1 -> 5 | H12: =RC[-3]*10 -> 50
C13: =R[-1]C+1 -> 12 | E13: 5 | F13: =R[-1]C -> 5 | G13: =RC[-2]*1 -> 5 | H13: =RC[-3]*10 -> 50
C14: =R[-1]C+1 -> 13 | E14: 5 | F14: =R[-1]C -> 5 | G14: =RC[-2]*1 -> 5 | H14: =RC[-3]*10 -> 50
C15: =R[-1]C+1 -> 14 | E15: 5 | F15: =R[-1]C -> 5 | G15: =RC[-2]*1 -> 5 | H15: =RC[-3]*10 -> 50
C16: =R[-1]C+1 -> 15 | E16: 5 | F16: =R[-1]C -> 5 | G16: =RC[-2]*1 -> 5 | H16: =RC[-3]*10 -> 50
C17: =R[-1]C+1 -> 16 | E17: 5 | F17: =R[-1]C -> 5 | G17: =RC[-2]*1 -> 5 | H17: =RC[-3]*10 -> 50
C18: =R[-1]C+1 -> 17 | E18: 5 | F18: =R[-1]C -> 5 | G18: =RC[-2]*1 -> 5 | H18: =RC[-3]*10 -> 50
C19: =R[-1]C+1 -> 18 | E19: 5 | F19: =R[-1]C -> 5 | G19: =RC[-2]*1 -> 5 | H19: =RC[-3]*10 -> 50
C20: =R[-1]C+1 -> 19 | E20: 5 | F20: =R[-1]C -> 5 | G20: =RC[-2]*1 -> 5 | H20: =RC[-3]*10 -> 50
C21: =R[-1]C+1 -> 20 | E21: 5 | F21: =R[-1]C -> 5 | G21: =RC[-2]*1 -> 5 | H21: =RC[-3]*10 -> 50
A22: 3 | C22: =R[-1]C+1 -> 21 | E22: 6 | F22: =R[-1]C -> 5 | G22: =RC[-2]*2 -> 12 | H22: =RC[-3]*10 -> 60
C23: =R[-1]C+1 -> 22 | E23: 6 | F23: =R[-1]C -> 5 | G23: =RC[-2]*2 -> 12 | H23: =RC[-3]*10 -> 60
C24: =R[-1]C+1 -> 23 | E24: 6 | F24: =R[-1]C -> 5 | G24: =RC[-2]*2 -> 12 | H24: =RC[-3]*10 -> 60
C25: =R[-1]C+1 -> 24 | E25: 6 | F25: =R[-1]C -> 5 | G25: =RC[-2]*2 -> 12 | H25: =RC[-3]*10 -> 60
C26: =R[-1]C+1 -> 25 | E26: 6 | F26: =R[-1]C -> 5 | G26: =RC[-2]*2 -> 12 | H26: =RC[-3]*10 -> 60
C27: =R[-1]C+1 -> 26 | E27: 6 | F27: =R[-1]C -> 5 | G27: =RC[-2]*2 -> 12 | H27: =RC[-3]*10 -> 60
C28: =R[-1]C+1 -> 27 | E28: 6 | F28: =R[-1]C -> 5 | G28: =RC[-2]*2 -> 12 | H28: =RC[-3]*10 -> 60
C29: =R[-1]C+1 -> 28 | E29: 6 | F29: =R[-1]C -> 5 | G29: =RC[-2]*2 -> 12 | H29: =RC[-3]*10 -> 60
C30: =R[-1]C+1 -> 29 | E30: 6 | F30: =R[-1]C -> 5 | G30: =RC[-2]*2 -> 12 | H30: =RC[-3]*10 -> 60
C31: =R[-1]C+1 -> 30 | E31: 6 | F31: =R[-1]C -> 5 | G31: =RC[-2]*2 -> 12 | H31: =RC[-3]*10 -> 60
A32: 4 | C32: =R[-1]C+1 -> 31 | E32: 6 | F32: =R[-1]C -> 5 | G32: =RC[-2]*2 -> 12 | H32: =RC[-3]*10 -> 60
C33: =R[-1]C+1 -> 32 | E33: 6 | F33: =R[-1]C -> 5 | G33: =RC[-2]*2 -> 12 | H33: =RC[-3]*10 -> 60
C34: =R[-1]C+1 -> 33 | E34: 6 | F34: =R[-1]C -> 5 | G34: =RC[-2]*2 -> 12 | H34: =RC[-3]*10 -> 60
C35: =R[-1]C+1 -> 34 | E35: 6 | F35: =R[-1]C -> 5 | G35: =RC[-2]*2 -> 12 | H35: =RC[-3]*10 -> 60
C36: =R[-1]C+1 -> 35 | E36: 6 | F36: =R[-1]C -> 5 | G36: =RC[-2]*2 -> 12 | H36: =RC[-3]*10 -> 60
C37: =R[-1]C+1 -> 36 | E37: 6 | F37: =R[-1]C -> 5 | G37: =RC[-2]*2 -> 12 | H37: =RC[-3]*10 -> 60
C38: =R[-1]C+1 -> 37 | E38: 6 | F38: =R[-1]C -> 5 | G38: =RC[-2]*2 -> 12 | H38: =RC[-3]*10 -> 60
C39: =R[-1]C+1 -> 38 | E39: 6 | F39: =R[-1]C -> 5 | G39: =RC[-2]*2 -> 12 | H39: =RC[-3]*10 -> 60
C40: =R[-1]C+1 -> 39 | E40: 6 | F40: =R[-1]C -> 5 | G40: =RC[-2]*2 -> 12 | H40: =RC[-3]*10 -> 60
C41: =R[-1]C+1 -> 40 | E41: 6 | F41: =R[-1]C -> 5 | G41: =RC[-2]*2 -> 12 | H41: =RC[-3]*10 -> 60
A42: 5 | C42: =R[-1]C+1 -> 41 | E42: 7 | F42: =R[-1]C -> 5 | G42: =RC[-2]*3 -> 21 | H42: =RC[-3]*10 -> 70
C43: =R[-1]C+1 -> 42 | E43: 7 | F43: =R[-1]C -> 5 | G43: =RC[-2]*3 -> 21 | H43: =RC[-3]*10 -> 70
C44: =R[-1]C+1 -> 43 | E44: 7 | F44: =R[-1]C -> 5 | G44: =RC[-2]*3 -> 21 | H44: =RC[-3]*10 -> 70
C45: =R[-1]C+1 -> 44 | E45: 7 | F45: =R[-1]C -> 5 | G45: =RC[-2]*3 -> 21 | H45: =RC[-3]*10 -> 70
C46: =R[-1]C+1 -> 45 | E46: 7 | F46: =R[-1]C -> 5 | G46: =RC[-2]*3 -> 21 | H46: =RC[-3]*10 -> 70
C47: =R[-1]C+1 -> 46 | E47: 7 | F47: =R[-1]C -> 5 | G47: =RC[-2]*3 -> 21 | H47: =RC[-3]*10 -> 70
C48: =R[-1]C+1 -> 47 | E48: 7 | F48: =R[-1]C -> 5 | G48: =RC[-2]*3 -> 21 | H48: =RC[-3]*10 -> 70
C49: =R[-1]C+1 -> 48 | E49: 7 | F49: =R[-1]C -> 5 | G49: =RC[-2]*3 -> 21 | H49: =RC[-3]*10 -> 70
C50: =R[-1]C+1 -> 49 | E50: 7 | F50: =R[-1]C -> 5 | G50: =RC[-2]*3 -> 21 | H50: =RC[-3]*10 -> 70
C51: =R[-1]C+1 -> 50 | E51: 7 | F51: =R[-1]C -> 5 | G51: =RC[-2]*3 -> 21 | H51: =RC[-3]*10 -> 70
A52: 6 | C52: =R[-1]C+1 -> 51 | E52: 7 | F52: =R[-1]C -> 5 | G52: =RC[-2]*3 -> 21 | H52: =RC[-3]*10 -> 70
C53: =R[-1]C+1 -> 52 | E53: 7 | F53: =R[-1]C -> 5 | G53: =RC[-2]*3 -> 21 | H53: =RC[-3]*10 -> 70
C54: =R[-1]C+1 -> 53 | E54: 7 | F54: =R[-1]C -> 5 | G54: =RC[-2]*3 -> 21 | H54: =RC[-3]*10 -> 70
C55: =R[-1]C+1 -> 54 | E55: 7 | F55: =R[-1]C -> 5 | G55: =RC[-2]*3 -> 21 | H55: =RC[-3]*10 -> 70
C56: =R[-1]C+1 -> 55 | E56: 7 | F56: =R[-1]C -> 5 | G56: =RC[-2]*3 -> 21 | H56: =RC[-3]*10 -> 70
C57: =R[-1]C+1 -> 56 | E57: 7 | F57: =R[-1]C -> 5 | G57: =RC[-2]*3 -> 21 | H57: =RC[-3]*10 -> 70
C58: =R[-1]C+1 -> 57 | E58: 7 | F58: =R[-1]C -> 5 | G58: =RC[-2]*3 -> 21 | H58: =RC[-3]*10 -> 70
C59: =R[-1]C+1 -> 58 | E59: 7 | F59: =R[-1]C -> 5 | G59: =RC[-2]*3 -> 21 | H59: =RC[-3]*10 -> 70
C60: =R[-1]C+1 -> 59 | E60: 7 | F60: =R[-1]C -> 5 | G60: =RC[-2]*3 -> 21 | H60: =RC[-3]*10 -> 70
C61: =R[-1]C+1 -> 60 | E61: 7 | F61: =R[-1]C -> 5 | G61: =RC[-2]*3 -> 21 | H61: =RC[-3]*10 -> 70
A62: 7 | C62: =R[-1]C+1 -> 61 | E62: 8 | F62: =R[-1]C -> 5 | G62: =RC[-2]*4 -> 32 | H62: =RC[-3]*10 -> 80
C63: =R[-1]C+1 -> 62 | E63: 8 | F63: =R[-1]C -> 5 | G63: =RC[-2]*4 -> 32 | H63: =RC[-3]*10 -> 80
C64: =R[-1]C+1 -> 63 | E64: 8 | F64: =R[-1]C -> 5 | G64: =RC[-2]*4 -> 32 | H64: =RC[-3]*10 -> 80
C65: =R[-1]C+1 -> 64 | E65: 8 | F65: =R[-1]C -> 5 | G65: =RC[-2]*4 -> 32 | H65: =RC[-3]*10 -> 80
C66: =R[-1]C+1 -> 65 | E66: 8 | F66: =R[-1]C -> 5 | G66: =RC[-2]*4 -> 32 | H66: =RC[-3]*10 -> 80
C67: =R[-1]C+1 -> 66 | E67: 8 | F67: =R[-1]C -> 5 | G67: =RC[-2]*4 -> 32 | H67: =RC[-3]*10 -> 80
C68: =R[-1]C+1 -> 67 | E68: 8 | F68: =R[-1]C -> 5 | G68: =RC[-2]*4 -> 32 | H68: =RC[-3]*10 -> 80
C69: =R[-1]C+1 -> 68 | E69: 8 | F69: =R[-1]C -> 5 | G69: =RC[-2]*4 -> 32 | H69: =RC[-3]*10 -> 80
C70: =R[-1]C+1 -> 69 | E70: 8 | F70: =R[-1]C -> 5 | G70: =RC[-2]*4 -> 32 | H70: =RC[-3]*10 -> 80
C71: =R[-1]C+1 -> 70 | E71: 8 | F71: =R[-1]C -> 5 | G71: =RC[-2]*4 -> 32 | H71: =RC[-3]*10 -> 80
A72: 8 | C72: =R[-1]C+1 -> 71 | E72: 10 | F72: =R[-1]C -> 5 | G72: =RC[-2]*5 -> 50 | H72: =RC[-3]*10 -> 100
C73: =R[-1]C+1 -> 72 | E73: 10 | F73: =R[-1]C -> 5 | G73: =RC[-2]*5 -> 50 | H73: =RC[-3]*10 -> 100
C74: =R[-1]C+1 -> 73 | E74: 10 | F74: =R[-1]C -> 5 | G74: =RC[-2]*5 -> 50 | H74: =RC[-3]*10 -> 100
C75: =R[-1]C+1 -> 74 | E75: 10 | F75: =R[-1]C -> 5 | G75: =RC[-2]*5 -> 50 | H75: =RC[-3]*10 -> 100
C76: =R[-1]C+1 -> 75 | E76: 10 | F76: =R[-1]C -> 5 | G76: =RC[-2]*5 -> 50 | H76: =RC[-3]*10 -> 100
C77: =R[-1]C+1 -> 76 | E77: 10 | F77: =R[-1]C -> 5 | G77: =RC[-2]*5 -> 50 | H77: =RC[-3]*10 -> 100
C78: =R[-1]C+1 -> 77 | E78: 10 | F78: =R[-1]C -> 5 | G78: =RC[-2]*5 -> 50 | H78: =RC[-3]*10 -> 100
C79: =R[-1]C+1 -> 78 | E79: 10 | F79: =R[-1]C -> 5 | G79: =RC[-2]*5 -> 50 | H79: =RC[-3]*10 -> 100
C80: =R[-1]C+1 -> 79 | E80: 10 | F80: =R[-1]C -> 5 | G80: =RC[-2]*5 -> 50 | H80: =RC[-3]*10 -> 100
C81: =R[-1]C+1 -> 80 | E81: 10 | F81: =R[-1]C -> 5 | G81: =RC[-2]*5 -> 50 | H81: =RC[-3]*10 -> 100
A82: 9 | C82: =R[-1]C+1 -> 81 | E82: 12 | F82: =R[-1]C -> 5 | G82: =RC[-2]*5 -> 60 | H82: =RC[-3]*10 -> 120
C83: =R[-1]C+1 -> 82 | E83: 12 | F83: =R[-1]C -> 5 | G83: =RC[-2]*5 -> 60 | H83: =RC[-3]*10 -> 120
C84: =R[-1]C+1 -> 83 | E84: 12 | F84: =R[-1]C -> 5 | G84: =RC[-2]*5 -> 60 | H84: =RC[-3]*10 -> 120
C85: =R[-1]C+1 -> 84 | E85: 12 | F85: =R[-1]C -> 5 | G85: =RC[-2]*5 -> 60 | H85: =RC[-3]*10 -> 120
C86: =R[-1]C+1 -> 85 | E86: 12 | F86: =R[-1]C -> 5 | G86: =RC[-2]*5 -> 60 | H86: =RC[-3]*10 -> 120
C87: =R[-1]C+1 -> 86 | E87: 12 | F87: =R[-1]C -> 5 | G87: =RC[-2]*5 -> 60 | H87: =RC[-3]*10 -> 120
C88: =R[-1]C+1 -> 87 | E88: 12 | F88: =R[-1]C -> 5 | G88: =RC[-2]*5 -> 60 | H88: =RC[-3]*10 -> 120
C89: =R[-1]C+1 -> 88 | E89: 12 | F89: =R[-1]C -> 5 | G89: =RC[-2]*5 -> 60 | H89: =RC[-3]*10 -> 120
C90: =R[-1]C+1 -> 89 | E90: 12 | F90: =R[-1]C -> 5 | G90: =RC[-2]*5 -> 60 | H90: =RC[-3]*10 -> 120
C91: =R[-1]C+1 -> 90 | E91: 12 | F91: =R[-1]C -> 5 | G91: =RC[-2]*5 -> 60 | H91: =RC[-3]*10 -> 120
A92: 10 | C92: =R[-1]C+1 -> 91 | E92: 14 | F92: =R[-1]C -> 5 | G92: =RC[-2]*5 -> 70 | H92: =RC[-3]*10 -> 140
C93: =R[-1]C+1 -> 92 | E93: 14 | F93: =R[-1]C -> 5 | G93: =RC[-2]*5 -> 70 | H93: =RC[-3]*10 -> 140
C94: =R[-1]C+1 -> 93 | E94: 14 | F94: =R[-1]C -> 5 | G94: =RC[-2]*5 -> 70 | H94: =RC[-3]*10 -> 140
C95: =R[-1]C+1 -> 94 | E95: 14 | F95: =R[-1]C -> 5 | G95: =RC[-2]*5 -> 70 | H95: =RC[-3]*10 -> 140
C96: =R[-1]C+1 -> 95 | E96: 14 | F96: =R[-1]C -> 5 | G96: =RC[-2]*5 -> 70 | H96: =RC[-3]*10 -> 140
C97: =R[-1]C+1 -> 96 | E97: 14 | F97: =R[-1]C -> 5 | G97: =RC[-2]*5 -> 70 | H97: =RC[-3]*10 -> 140
C98: =R[-1]C+1 -> 97 | E98: 14 | F98: =R[-1]C -> 5 | G98: =RC[-2]*5 -> 70 | H98: =RC[-3]*10 -> 140
C99: =R[-1]C+1 -> 98 | E99: 14 | F99: =R[-1]C -> 5 | G99: =RC[-2]*5 -> 70 | H99: =RC[-3]*10 -> 140
C100: =R[-1]C+1 -> 99 | E100: 14 | F100: =R[-1]C -> 5 | G100: =RC[-2]*5 -> 70 | H100: =RC[-3]*10 -> 140
C101: =R[-1]C+1 -> 100 | E101: 14 | F101: =R[-1]C -> 5 | G101: =RC[-2]*5 -> 70 | H101: =RC[-3]*10 -> 140
A102: 11 | C102: =R[-1]C+1 -> 101 | E102: 15 | F102: =R[-1]C -> 5 | G102: =RC[-2]*5 -> 75 | H102: =RC[-3]*10 -> 150
C103: =R[-1]C+1 -> 102 | E103: 15 | F103: =R[-1]C -> 5 | G103: =RC[-2]*5 -> 75 | H103: =RC[-3]*10 -> 150
C104: =R[-1]C+1 -> 103 | E104: 15 | F104: =R[-1]C -> 5 | G104: =RC[-2]*5 -> 75 | H104: =RC[-3]*10 -> 150
C105: =R[-1]C+1 -> 104 | E105: 15 | F105: =R[-1]C -> 5 | G105: =RC[-2]*5 -> 75 | H105: =RC[-3]*10 -> 150
C106: =R[-1]C+1 -> 105 | E106: 15 | F106: =R[-1]C -> 5 | G106: =RC[-2]*5 -> 75 | H106: =RC[-3]*10 -> 150
C107: =R[-1]C+1 -> 106 | E107: 15 | F107: =R[-1]C -> 5 | G107: =RC[-2]*5 -> 75 | H107: =RC[-3]*10 -> 150
C108: =R[-1]C+1 -> 107 | E108: 15 | F108: =R[-1]C -> 5 | G108: =RC[-2]*5 -> 75 | H108: =RC[-3]*10 -> 150
C109: =R[-1]C+1 -> 108 | E109: 15 | F109: =R[-1]C -> 5 | G109: =RC[-2]*5 -> 75 | H109: =RC[-3]*10 -> 150
C110: =R[-1]C+1 -> 109 | E110: 15 | F110: =R[-1]C -> 5 | G110: =RC[-2]*5 -> 75 | H110: =RC[-3]*10 -> 150
C111: =R[-1]C+1 -> 110 | E111: 15 | F111: =R[-1]C -> 5 | G111: =RC[-2]*5 -> 75 | H111: =RC[-3]*10 -> 150
A112: 12 | C112: =R[-1]C+1 -> 111 | E112: 16 | F112: =R[-1]C -> 5 | G112: =RC[-2]*5 -> 80 | H112: =RC[-3]*10 -> 160
C113: =R[-1]C+1 -> 112 | E113: 16 | F113: =R[-1]C -> 5 | G113: =RC[-2]*5 -> 80 | H113: =RC[-3]*10 -> 160
C114: =R[-1]C+1 -> 113 | E114: 16 | F114: =R[-1]C -> 5 | G114: =RC[-2]*5 -> 80 | H114: =RC[-3]*10 -> 160
C115: =R[-1]C+1 -> 114 | E115: 16 | F115: =R[-1]C -> 5 | G115: =RC[-2]*5 -> 80 | H115: =RC[-3]*10 -> 160
C116: =R[-1]C+1 -> 115 | E116: 16 | F116: =R[-1]C -> 5 | G116: =RC[-2]*5 -> 80 | H116: =RC[-3]*10 -> 160
C117: =R[-1]C+1 -> 116 | E117: 16 | F117: =R[-1]C -> 5 | G117: =RC[-2]*5 -> 80 | H117: =RC[-3]*10 -> 160
C118: =R[-1]C+1 -> 117 | E118: 16 | F118: =R[-1]C -> 5 | G118: =RC[-2]*5 -> 80 | H118: =RC[-3]*10 -> 160
C119: =R[-1]C+1 -> 118 | E119: 16 | F119: =R[-1]C -> 5 | G119: =RC[-2]*5 -> 80 | H119: =RC[-3]*10 -> 160
C120: =R[-1]C+1 -> 119 | E120: 16 | F120: =R[-1]C -> 5 | G120: =RC[-2]*5 -> 80 | H120: =RC[-3]*10 -> 160
C121: =R[-1]C+1 -> 120 | E121: 16 | F121: =R[-1]C -> 5 | G121: =RC[-2]*5 -> 80 | H121: =RC[-3]*10 -> 160
A122: 13 | C122: =R[-1]C+1 -> 121 | E122: 17 | F122: =R[-1]C -> 5 | G122: =RC[-2]*5 -> 85 | H122: =RC[-3]*10 -> 170
C123: =R[-1]C+1 -> 122 | E123: 17 | F123: =R[-1]C -> 5 | G123: =RC[-2]*5 -> 85 | H123: =RC[-3]*10 -> 170
C124: =R[-1]C+1 -> 123 | E124: 17 | F124: =R[-1]C -> 5 | G124: =RC[-2]*5 -> 85 | H124: =RC[-3]*10 -> 170
C125: =R[-1]C+1 -> 124 | E125: 17 | F125: =R[-1]C -> 5 | G125: =RC[-2]*5 -> 85 | H125: =RC[-3]*10 -> 170
C126: =R[-1]C+1 -> 125 | E126: 17 | F126: =R[-1]C -> 5 | G126: =RC[-2]*5 -> 85 | H126: =RC[-3]*10 -> 170
C127: =R[-1]C+1 -> 126 | E127: 17 | F127: =R[-1]C -> 5 | G127: =RC[-2]*5 -> 85 | H127: =RC[-3]*10 -> 170
C128: =R[-1]C+1 -> 127 | E128: 17 | F128: =R[-1]C -> 5 | G128: =RC[-2]*5 -> 85 | H128: =RC[-3]*10 -> 170
C129: =R[-1]C+1 -> 128 | E129: 17 | F129: =R[-1]C -> 5 | G129: =RC[-2]*5 -> 85 | H129: =RC[-3]*10 -> 170
C130: =R[-1]C+1 -> 129 | E130: 17 | F130: =R[-1]C -> 5 | G130: =RC[-2]*5 -> 85 | H130: =RC[-3]*10 -> 170
C131: =R[-1]C+1 -> 130 | E131: 17 | F131: =R[-1]C -> 5 | G131: =RC[-2]*5 -> 85 | H131: =RC[-3]*10 -> 170
A132: 14 | C132: =R[-1]C+1 -> 131 | E132: 18 | F132: =R[-1]C -> 5 | G132: =RC[-2]*5 -> 90 | H132: =RC[-3]*10 -> 180
C133: =R[-1]C+1 -> 132 | E133: 18 | F133: =R[-1]C -> 5 | G133: =RC[-2]*5 -> 90 | H133: =RC[-3]*10 -> 180
C134: =R[-1]C+1 -> 133 | E134: 18 | F134: =R[-1]C -> 5 | G134: =RC[-2]*5 -> 90 | H134: =RC[-3]*10 -> 180
C135: =R[-1]C+1 -> 134 | E135: 18 | F135: =R[-1]C -> 5 | G135: =RC[-2]*5 -> 90 | H135: =RC[-3]*10 -> 180
C136: =R[-1]C+1 -> 135 | E136: 18 | F136: =R[-1]C -> 5 | G136: =RC[-2]*5 -> 90 | H136: =RC[-3]*10 -> 180
C137: =R[-1]C+1 -> 136 | E137: 18 | F137: =R[-1]C -> 5 | G137: =RC[-2]*5 -> 90 | H137: =RC[-3]*10 -> 180
C138: =R[-1]C+1 -> 137 | E138: 18 | F138: =R[-1]C -> 5 | G138: =RC[-2]*5 -> 90 | H138: =RC[-3]*10 -> 180
C139: =R[-1]C+1 -> 138 | E139: 18 | F139: =R[-1]C -> 5 | G139: =RC[-2]*5 -> 90 | H139: =RC[-3]*10 -> 180
C140: =R[-1]C+1 -> 139 | E140: 18 | F140: =R[-1]C -> 5 | G140: =RC[-2]*5 -> 90 | H140: =RC[-3]*10 -> 180
C141: =R[-1]C+1 -> 140 | E141: 18 | F141: =R[-1]C -> 5 | G141: =RC[-2]*5 -> 90 | H141: =RC[-3]*10 -> 180
A142: 15 | C142: =R[-1]C+1 -> 141 | E142: 19 | F142: =R[-1]C -> 5 | G142: =RC[-2]*5 -> 95 | H142: =RC[-3]*10 -> 190
C143: =R[-1]C+1 -> 142 | E143: 19 | F143: =R[-1]C -> 5 | G143: =RC[-2]*5 -> 95 | H143: =RC[-3]*10 -> 190
C144: =R[-1]C+1 -> 143 | E144: 19 | F144: =R[-1]C -> 5 | G144: =RC[-2]*5 -> 95 | H144: =RC[-3]*10 -> 190
C145: =R[-1]C+1 -> 144 | E145: 19 | F145: =R[-1]C -> 5 | G145: =RC[-2]*5 -> 95 | H145: =RC[-3]*10 -> 190
C146: =R[-1]C+1 -> 145 | E146: 19 | F146: =R[-1]C -> 5 | G146: =RC[-2]*5 -> 95 | H146: =RC[-3]*10 -> 190
C147: =R[-1]C+1 -> 146 | E147: 19 | F147: =R[-1]C -> 5 | G147: =RC[-2]*5 -> 95 | H147: =RC[-3]*10 -> 190
C148: =R[-1]C+1 -> 147 | E148: 19 | F148: =R[-1]C -> 5 | G148: =RC[-2]*5 -> 95 | H148: =RC[-3]*10 -> 190
C149: =R[-1]C+1 -> 148 | E149: 19 | F149: =R[-1]C -> 5 | G149: =RC[-2]*5 -> 95 | H149: =RC[-3]*10 -> 190
C150: =R[-1]C+1 -> 149 | E150: 19 | F150: =R[-1]C -> 5 | G150: =RC[-2]*5 -> 95 | H150: =RC[-3]*10 -> 190
C151: =R[-1]C+1 -> 150 | E151: 19 | F151: =R[-1]C -> 5 | G151: =RC[-2]*5 -> 95 | H151: =RC[-3]*10 -> 190
A152: 16 | C152: =R[-1]C+1 -> 151 | E152: 20 | F152: =R[-1]C -> 5 | G152: =RC[-2]*5 -> 100 | H152: =RC[-3]*10 -> 200
C153: =R[-1]C+1 -> 152 | E153: 20 | F153: =R[-1]C -> 5 | G153: =RC[-2]*5 -> 100 | H153: =RC[-3]*10 -> 200
C154: =R[-1]C+1 -> 153 | E154: 20 | F154: =R[-1]C -> 5 | G154: =RC[-2]*5 -> 100 | H154: =RC[-3]*10 -> 200
C155: =R[-1]C+1 -> 154 | E155: 20 | F155: =R[-1]C -> 5 | G155: =RC[-2]*5 -> 100 | H155: =RC[-3]*10 -> 200
C156: =R[-1]C+1 -> 155 | E156: 20 | F156: =R[-1]C -> 5 | G156: =RC[-2]*5 -> 100 | H156: =RC[-3]*10 -> 200
C157: =R[-1]C+1 -> 156 | E157: 20 | F157: =R[-1]C -> 5 | G157: =RC[-2]*5 -> 100 | H157: =RC[-3]*10 -> 200
C158: =R[-1]C+1 -> 157 | E158: 20 | F158: =R[-1]C -> 5 | G158: =RC[-2]*5 -> 100 | H158: =RC[-3]*10 -> 200
C159: =R[-1]C+1 -> 158 | E159: 20 | F159: =R[-1]C -> 5 | G159: =RC[-2]*5 -> 100 | H159: =RC[-3]*10 -> 200
C160: =R[-1]C+1 -> 159 | E160: 20 | F160: =R[-1]C -> 5 | G160: =RC[-2]*5 -> 100 | H160: =RC[-3]*10 -> 200
C161: =R[-1]C+1 -> 160 | E161: 20 | F161: =R[-1]C -> 5 | G161: =RC[-2]*5 -> 100 | H161: =RC[-3]*10 -> 200
A162: 17 | C162: =R[-1]C+1 -> 161 | E162: 21 | F162: =R[-1]C -> 5 | G162: =RC[-2]*5 -> 105 | H162: =RC[-3]*10 -> 210
C163: =R[-1]C+1 -> 162 | E163: 21 | F163: =R[-1]C -> 5 | G163: =RC[-2]*5 -> 105 | H163: =RC[-3]*10 -> 210
C164: =R[-1]C+1 -> 163 | E164: 21 | F164: =R[-1]C -> 5 | G164: =RC[-2]*5 -> 105 | H164: =RC[-3]*10 -> 210
C165: =R[-1]C+1 -> 164 | E165: 21 | F165: =R[-1]C -> 5 | G165: =RC[-2]*5 -> 105 | H165: =RC[-3]*10 -> 210
C166: =R[-1]C+1 -> 165 | E166: 21 | F166: =R[-1]C -> 5 | G166: =RC[-2]*5 -> 105 | H166: =RC[-3]*10 -> 210
C167: =R[-1]C+1 -> 166 | E167: 21 | F167: =R[-1]C -> 5 | G167: =RC[-2]*5 -> 105 | H167: =RC[-3]*10 -> 210
C168: =R[-1]C+1 -> 167 | E168: 21 | F168: =R[-1]C -> 5 | G168: =RC[-2]*5 -> 105 | H168: =RC[-3]*10 -> 210
C169: =R[-1]C+1 -> 168 | E169: 21 | F169: =R[-1]C -> 5 | G169: =RC[-2]*5 -> 105 | H169: =RC[-3]*10 -> 210
C170: =R[-1]C+1 -> 169 | E170: 21 | F170: =R[-1]C -> 5 | G170: =RC[-2]*5 -> 105 | H170: =RC[-3]*10 -> 210
C171: =R[-1]C+1 -> 170 | E171: 21 | F171: =R[-1]C -> 5 | G171: =RC[-2]*5 -> 105 | H171: =RC[-3]*10 -> 210
A172: 18 | C172: =R[-1]C+1 -> 171 | E172: 22 | F172: =R[-1]C -> 5 | G172: =RC[-2]*5 -> 110 | H172: =RC[-3]*10 -> 220
C173: =R[-1]C+1 -> 172 | E173: 22 | F173: =R[-1]C -> 5 | G173: =RC[-2]*5 -> 110 | H173: =RC[-3]*10 -> 220
C174: =R[-1]C+1 -> 173 | E174: 22 | F174: =R[-1]C -> 5 | G174: =RC[-2]*5 -> 110 | H174: =RC[-3]*10 -> 220
C175: =R[-1]C+1 -> 174 | E175: 22 | F175: =R[-1]C -> 5 | G175: =RC[-2]*5 -> 110 | H175: =RC[-3]*10 -> 220
C176: =R[-1]C+1 -> 175 | E176: 22 | F176: =R[-1]C -> 5 | G176: =RC[-2]*5 -> 110 | H176: =RC[-3]*10 -> 220
C177: =R[-1]C+1 -> 176 | E177: 22 | F177: =R[-1]C -> 5 | G177: =RC[-2]*5 -> 110 | H177: =RC[-3]*10 -> 220
C178: =R[-1]C+1 -> 177 | E178: 22 | F178: =R[-1]C -> 5 | G178: =RC[-2]*5 -> 110 | H178: =RC[-3]*10 -> 220
C179: =R[-1]C+1 -> 178 | E179: 22 | F179: =R[-1]C -> 5 | G179: =RC[-2]*5 -> 110 | H179: =RC[-3]*10 -> 220
C180: =R[-1]C+1 -> 179 | E180: 22 | F180: =R[-1]C -> 5 | G180: =RC[-2]*5 -> 110 | H180: =RC[-3]*10 -> 220
C181: =R[-1]C+1 -> 180 | E181: 22 | F181: =R[-1]C -> 5 | G181: =RC[-2]*5 -> 110 | H181: =RC[-3]*10 -> 220
A182: 19 | C182: =R[-1]C+1 -> 181 | E182: 23 | F182: =R[-1]C -> 5 | G182: =RC[-2]*5 -> 115 | H182: =RC[-3]*10 -> 230
C183: =R[-1]C+1 -> 182 | E183: 23 | F183: =R[-1]C -> 5 | G183: =RC[-2]*5 -> 115 | H183: =RC[-3]*10 -> 230
C184: =R[-1]C+1 -> 183 | E184: 23 | F184: =R[-1]C -> 5 | G184: =RC[-2]*5 -> 115 | H184: =RC[-3]*10 -> 230
C185: =R[-1]C+1 -> 184 | E185: 23 | F185: =R[-1]C -> 5 | G185: =RC[-2]*5 -> 115 | H185: =RC[-3]*10 -> 230
C186: =R[-1]C+1 -> 185 | E186: 23 | F186: =R[-1]C -> 5 | G186: =RC[-2]*5 -> 115 | H186: =RC[-3]*10 -> 230
C187: =R[-1]C+1 -> 186 | E187: 23 | F187: =R[-1]C -> 5 | G187: =RC[-2]*5 -> 115 | H187: =RC[-3]*10 -> 230
C188: =R[-1]C+1 -> 187 | E188: 23 | F188: =R[-1]C -> 5 | G188: =RC[-2]*5 -> 115 | H188: =RC[-3]*10 -> 230
C189: =R[-1]C+1 -> 188 | E189: 23 | F189: =R[-1]C -> 5 | G189: =RC[-2]*5 -> 115 | H189: =RC[-3]*10 -> 230
C190: =R[-1]C+1 -> 189 | E190: 23 | F190: =R[-1]C -> 5 | G190: =RC[-2]*5 -> 115 | H190: =RC[-3]*10 -> 230
C191: =R[-1]C+1 -> 190 | E191: 23 | F191: =R[-1]C -> 5 | G191: =RC[-2]*5 -> 115 | H191: =RC[-3]*10 -> 230
A192: 20 | C192: =R[-1]C+1 -> 191 | E192: 24 | F192: =R[-1]C -> 5 | G192: =RC[-2]*5 -> 120 | H192: =RC[-3]*10 -> 240
C193: =R[-1]C+1 -> 192 | E193: 24 | F193: =R[-1]C -> 5 | G193: =RC[-2]*5 -> 120 | H193: =RC[-3]*10 -> 240
C194: =R[-1]C+1 -> 193 | E194: 24 | F194: =R[-1]C -> 5 | G194: =RC[-2]*5 -> 120 | H194: =RC[-3]*10 -> 240
C195: =R[-1]C+1 -> 194 | E195: 24 | F195: =R[-1]C -> 5 | G195: =RC[-2]*5 -> 120 | H195: =RC[-3]*10 -> 240
C196: =R[-1]C+1 -> 195 | E196: 24 | F196: =R[-1]C -> 5 | G196: =RC[-2]*5 -> 120 | H196: =RC[-3]*10 -> 240
C197: =R[-1]C+1 -> 196 | E197: 24 | F197: =R[-1]C -> 5 | G197: =RC[-2]*5 -> 120 | H197: =RC[-3]*10 -> 240
C198: =R[-1]C+1 -> 197 | E198: 24 | F198: =R[-1]C -> 5 | G198: =RC[-2]*5 -> 120 | H198: =RC[-3]*10 -> 240
C199: =R[-1]C+1 -> 198 | E199: 24 | F199: =R[-1]C -> 5 | G199: =RC[-2]*5 -> 120 | H199: =RC[-3]*10 -> 240
C200: =R[-1]C+1 -> 199 | E200: 24 | F200: =R[-1]C -> 5 | G200: =RC[-2]*5 -> 120 | H200: =RC[-3]*10 -> 240
C201: =R[-1]C+1 -> 200 | E201: 24 | F201: =R[-1]C -> 5 | G201: =RC[-2]*5 -> 120 | H201: =RC[-3]*10 -> 240
A202: 21 | C202: =R[-1]C+1 -> 201 | E202: 25 | F202: =R[-1]C -> 5 | G202: =RC[-2]*5 -> 125 | H202: =RC[-3]*10 -> 250
C203: =R[-1]C+1 -> 202 | E203: 25 | F203: =R[-1]C -> 5 | G203: =RC[-2]*5 -> 125 | H203: =RC[-3]*10 -> 250
C204: =R[-1]C+1 -> 203 | E204: 25 | F204: =R[-1]C -> 5 | G204: =RC[-2]*5 -> 125 | H204: =RC[-3]*10 -> 250
C205: =R[-1]C+1 -> 204 | E205: 25 | F205: =R[-1]C -> 5 | G205: =RC[-2]*5 -> 125 | H205: =RC[-3]*10 -> 250
C206: =R[-1]C+1 -> 205 | E206: 25 | F206: =R[-1]C -> 5 | G206: =RC[-2]*5 -> 125 | H206: =RC[-3]*10 -> 250
C207: =R[-1]C+1 -> 206 | E207: 25 | F207: =R[-1]C -> 5 | G207: =RC[-2]*5 -> 125 | H207: =RC[-3]*10 -> 250
C208: =R[-1]C+1 -> 207 | E208: 25 | F208: =R[-1]C -> 5 | G208: =RC[-2]*5 -> 125 | H208: =RC[-3]*10 -> 250
C209: =R[-1]C+1 -> 208 | E209: 25 | F209: =R[-1]C -> 5 | G209: =RC[-2]*5 -> 125 | H209: =RC[-3]*10 -> 250
C210: =R[-1]C+1 -> 209 | E210: 25 | F210: =R[-1]C -> 5 | G210: =RC[-2]*5 -> 125 | H210: =RC[-3]*10 -> 250
C211: =R[-1]C+1 -> 210 | E211: 25 | F211: =R[-1]C -> 5 | G211: =RC[-2]*5 -> 125 | H211: =RC[-3]*10 -> 250
A212: 22 | C212: =R[-1]C+1 -> 211 | E212: 26 | F212: =R[-1]C -> 5 | G212: =RC[-2]*5 -> 130 | H212: =RC[-3]*10 -> 260
C213: =R[-1]C+1 -> 212 | E213: 26 | F213: =R[-1]C -> 5 | G213: =RC[-2]*5 -> 130 | H213: =RC[-3]*10 -> 260
C214: =R[-1]C+1 -> 213 | E214: 26 | F214: =R[-1]C -> 5 | G214: =RC[-2]*5 -> 130 | H214: =RC[-3]*10 -> 260
C215: =R[-1]C+1 -> 214 | E215: 26 | F215: =R[-1]C -> 5 | G215: =RC[-2]*5 -> 130 | H215: =RC[-3]*10 -> 260
C216: =R[-1]C+1 -> 215 | E216: 26 | F216: =R[-1]C -> 5 | G216: =RC[-2]*5 -> 130 | H216: =RC[-3]*10 -> 260
C217: =R[-1]C+1 -> 216 | E217: 26 | F217: =R[-1]C -> 5 | G217: =RC[-2]*5 -> 130 | H217: =RC[-3]*10 -> 260
C218: =R[-1]C+1 -> 217 | E218: 26 | F218: =R[-1]C -> 5 | G218: =RC[-2]*5 -> 130 | H218: =RC[-3]*10 -> 260
C219: =R[-1]C+1 -> 218 | E219: 26 | F219: =R[-1]C -> 5 | G219: =RC[-2]*5 -> 130 | H219: =RC[-3]*10 -> 260
C220: =R[-1]C+1 -> 219 | E220: 26 | F220: =R[-1]C -> 5 | G220: =RC[-2]*5 -> 130 | H220: =RC[-3]*10 -> 260
C221: =R[-1]C+1 -> 220 | E221: 26 | F221: =R[-1]C -> 5 | G221: =RC[-2]*5 -> 130 | H221: =RC[-3]*10 -> 260
A222: 23 | C222: =R[-1]C+1 -> 221 | E222: 27 | F222: =R[-1]C -> 5 | G222: =RC[-2]*5 -> 135 | H222: =RC[-3]*10 -> 270
C223: =R[-1]C+1 -> 222 | E223: 27 | F223: =R[-1]C -> 5 | G223: =RC[-2]*5 -> 135 | H223: =RC[-3]*10 -> 270
C224: =R[-1]C+1 -> 223 | E224: 27 | F224: =R[-1]C -> 5 | G224: =RC[-2]*5 -> 135 | H224: =RC[-3]*10 -> 270
C225: =R[-1]C+1 -> 224 | E225: 27 | F225: =R[-1]C -> 5 | G225: =RC[-2]*5 -> 135 | H225: =RC[-3]*10 -> 270
C226: =R[-1]C+1 -> 225 | E226: 27 | F226: =R[-1]C -> 5 | G226: =RC[-2]*5 -> 135 | H226: =RC[-3]*10 -> 270
C227: =R[-1]C+1 -> 226 | E227: 27 | F227: =R[-1]C -> 5 | G227: =RC[-2]*5 -> 135 | H227: =RC[-3]*10 -> 270
C228: =R[-1]C+1 -> 227 | E228: 27 | F228: =R[-1]C -> 5 | G228: =RC[-2]*5 -> 135 | H228: =RC[-3]*10 -> 270
C229: =R[-1]C+1 -> 228 | E229: 27 | F229: =R[-1]C -> 5 | G229: =RC[-2]*5 -> 135 | H229: =RC[-3]*10 -> 270
C230: =R[-1]C+1 -> 229 | E230: 27 | F230: =R[-1]C -> 5 | G230: =RC[-2]*5 -> 135 | H230: =RC[-3]*10 -> 270
C231: =R[-1]C+1 -> 230 | E231: 27 | F231: =R[-1]C -> 5 | G231: =RC[-2]*5 -> 135 | H231: =RC[-3]*10 -> 270
A232: 24 | C232: =R[-1]C+1 -> 231 | E232: 28 | F232: =R[-1]C -> 5 | G232: =RC[-2]*5 -> 140 | H232: =RC[-3]*10 -> 280
C233: =R[-1]C+1 -> 232 | E233: 28 | F233: =R[-1]C -> 5 | G233: =RC[-2]*5 -> 140 | H233: =RC[-3]*10 -> 280
C234: =R[-1]C+1 -> 233 | E234: 28 | F234: =R[-1]C -> 5 | G234: =RC[-2]*5 -> 140 | H234: =RC[-3]*10 -> 280
C235: =R[-1]C+1 -> 234 | E235: 28 | F235: =R[-1]C -> 5 | G235: =RC[-2]*5 -> 140 | H235: =RC[-3]*10 -> 280
C236: =R[-1]C+1 -> 235 | E236: 28 | F236: =R[-1]C -> 5 | G236: =RC[-2]*5 -> 140 | H236: =RC[-3]*10 -> 280
C237: =R[-1]C+1 -> 236 | E237: 28 | F237: =R[-1]C -> 5 | G237: =RC[-2]*5 -> 140 | H237: =RC[-3]*10 -> 280
C238: =R[-1]C+1 -> 237 | E238: 28 | F238: =R[-1]C -> 5 | G238: =RC[-2]*5 -> 140 | H238: =RC[-3]*10 -> 280
C239: =R[-1]C+1 -> 238 | E239: 28 | F239: =R[-1]C -> 5 | G239: =RC[-2]*5 -> 140 | H239: =RC[-3]*10 -> 280
C240: =R[-1]C+1 -> 239 | E240: 28 | F240: =R[-1]C -> 5 | G240: =RC[-2]*5 -> 140 | H240: =RC[-3]*10 -> 280
C241: =R[-1]C+1 -> 240 | E241: 28 | F241: =R[-1]C -> 5 | G241: =RC[-2]*5 -> 140 | H241: =RC[-3]*10 -> 280
A242: 25 | C242: =R[-1]C+1 -> 241 | E242: 29 | F242: =R[-1]C -> 5 | G242: =RC[-2]*5 -> 145 | H242: =RC[-3]*10 -> 290
C243: =R[-1]C+1 -> 242 | E243: 29 | F243: =R[-1]C -> 5 | G243: =RC[-2]*5 -> 145 | H243: =RC[-3]*10 -> 290
C244: =R[-1]C+1 -> 243 | E244: 29 | F244: =R[-1]C -> 5 | G244: =RC[-2]*5 -> 145 | H244: =RC[-3]*10 -> 290
C245: =R[-1]C+1 -> 244 | E245: 29 | F245: =R[-1]C -> 5 | G245: =RC[-2]*5 -> 145 | H245: =RC[-3]*10 -> 290
C246: =R[-1]C+1 -> 245 | E246: 29 | F246: =R[-1]C -> 5 | G246: =RC[-2]*5 -> 145 | H246: =RC[-3]*10 -> 290
C247: =R[-1]C+1 -> 246 | E247: 29 | F247: =R[-1]C -> 5 | G247: =RC[-2]*5 -> 145 | H247: =RC[-3]*10 -> 290
C248: =R[-1]C+1 -> 247 | E248: 29 | F248: =R[-1]C -> 5 | G248: =RC[-2]*5 -> 145 | H248: =RC[-3]*10 -> 290
C249: =R[-1]C+1 -> 248 | E249: 29 | F249: =R[-1]C -> 5 | G249: =RC[-2]*5 -> 145 | H249: =RC[-3]*10 -> 290
C250: =R[-1]C+1 -> 249 | E250: 29 | F250: =R[-1]C -> 5 | G250: =RC[-2]*5 -> 145 | H250: =RC[-3]*10 -> 290
C251: =R[-1]C+1 -> 250 | E251: 29 | F251: =R[-1]C -> 5 | G251: =RC[-2]*5 -> 145 | H251: =RC[-3]*10 -> 290
A252: 26 | C252: =R[-1]C+1 -> 251 | E252: 30 | F252: =R[-1]C -> 5 | G252: =RC[-2]*5 -> 150 | H252: =RC[-3]*10 -> 300
C253: =R[-1]C+1 -> 252 | E253: 30 | F253: =R[-1]C -> 5 | G253: =RC[-2]*5 -> 150 | H253: =RC[-3]*10 -> 300
C254: =R[-1]C+1 -> 253 | E254: 30 | F254: =R[-1]C -> 5 | G254: =RC[-2]*5 -> 150 | H254: =RC[-3]*10 -> 300
C255: =R[-1]C+1 -> 254 | E255: 30 | F255: =R[-1]C -> 5 | G255: =RC[-2]*5 -> 150 | H255: =RC[-3]*10 -> 300
C256: =R[-1]C+1 -> 255 | E256: 30 | F256: =R[-1]C -> 5 | G256: =RC[-2]*5 -> 150 | H256: =RC[-3]*10 -> 300
C257: =R[-1]C+1 -> 256 | E257: 30 | F257: =R[-1]C -> 5 | G257: =RC[-2]*5 -> 150 | H257: =RC[-3]*10 -> 300
C258: =R[-1]C+1 -> 257 | E258: 30 | F258: =R[-1]C -> 5 | G258: =RC[-2]*5 -> 150 | H258: =RC[-3]*10 -> 300
C259: =R[-1]C+1 -> 258 | E259: 30 | F259: =R[-1]C -> 5 | G259: =RC[-2]*5 -> 150 | H259: =RC[-3]*10 -> 300
C260: =R[-1]C+1 -> 259 | E260: 30 | F260: =R[-1]C -> 5 | G260: =RC[-2]*5 -> 150 | H260: =RC[-3]*10 -> 300
C261: =R[-1]C+1 -> 260 | E261: 30 | F261: =R[-1]C -> 5 | G261: =RC[-2]*5 -> 150 | H261: =RC[-3]*10 -> 300
A262: 27 | C262: =R[-1]C+1 -> 261 | E262: 31 | F262: =R[-1]C -> 5 | G262: =RC[-2]*5 -> 155 | H262: =RC[-3]*10 -> 310
C263: =R[-1]C+1 -> 262 | E263: 31 | F263: =R[-1]C -> 5 | G263: =RC[-2]*5 -> 155 | H263: =RC[-3]*10 -> 310
C264: =R[-1]C+1 -> 263 | E264: 31 | F264: =R[-1]C -> 5 | G264: =RC[-2]*5 -> 155 | H264: =RC[-3]*10 -> 310
C265: =R[-1]C+1 -> 264 | E265: 31 | F265: =R[-1]C -> 5 | G265: =RC[-2]*5 -> 155 | H265: =RC[-3]*10 -> 310
C266: =R[-1]C+1 -> 265 | E266: 31 | F266: =R[-1]C -> 5 | G266: =RC[-2]*5 -> 155 | H266: =RC[-3]*10 -> 310
C267: =R[-1]C+1 -> 266 | E267: 31 | F267: =R[-1]C -> 5 | G267: =RC[-2]*5 -> 155 | H267: =RC[-3]*10 -> 310
C268: =R[-1]C+1 -> 267 | E268: 31 | F268: =R[-1]C -> 5 | G268: =RC[-2]*5 -> 155 | H268: =RC[-3]*10 -> 310
C269: =R[-1]C+1 -> 268 | E269: 31 | F269: =R[-1]C -> 5 | G269: =RC[-2]*5 -> 155 | H269: =RC[-3]*10 -> 310
C270: =R[-1]C+1 -> 269 | E270: 31 | F270: =R[-1]C -> 5 | G270: =RC[-2]*5 -> 155 | H270: =RC[-3]*10 -> 310
C271: =R[-1]C+1 -> 270 | E271: 31 | F271: =R[-1]C -> 5 | G271: =RC[-2]*5 -> 155 | H271: =RC[-3]*10 -> 310
A272: 28 | C272: =R[-1]C+1 -> 271 | E272: 32 | F272: =R[-1]C -> 5 | G272: =RC[-2]*5 -> 160 | H272: =RC[-3]*10 -> 320
C273: =R[-1]C+1 -> 272 | E273: 32 | F273: =R[-1]C -> 5 | G273: =RC[-2]*5 -> 160 | H273: =RC[-3]*10 -> 320
C274: =R[-1]C+1 -> 273 | E274: 32 | F274: =R[-1]C -> 5 | G274: =RC[-2]*5 -> 160 | H274: =RC[-3]*10 -> 320
C275: =R[-1]C+1 -> 274 | E275: 32 | F275: =R[-1]C -> 5 | G275: =RC[-2]*5 -> 160 | H275: =RC[-3]*10 -> 320
C276: =R[-1]C+1 -> 275 | E276: 32 | F276: =R[-1]C -> 5 | G276: =RC[-2]*5 -> 160 | H276: =RC[-3]*10 -> 320
C277: =R[-1]C+1 -> 276 | E277: 32 | F277: =R[-1]C -> 5 | G277: =RC[-2]*5 -> 160 | H277: =RC[-3]*10 -> 320
C278: =R[-1]C+1 -> 277 | E278: 32 | F278: =R[-1]C -> 5 | G278: =RC[-2]*5 -> 160 | H278: =RC[-3]*10 -> 320
C279: =R[-1]C+1 -> 278 | E279: 32 | F279: =R[-1]C -> 5 | G279: =RC[-2]*5 -> 160 | H279: =RC[-3]*10 -> 320
C280: =R[-1]C+1 -> 279 | E280: 32 | F280: =R[-1]C -> 5 | G280: =RC[-2]*5 -> 160 | H280: =RC[-3]*10 -> 320
C281: =R[-1]C+1 -> 280 | E281: 32 | F281: =R[-1]C -> 5 | G281: =RC[-2]*5 -> 160 | H281: =RC[-3]*10 -> 320
A282: 29 | C282: =R[-1]C+1 -> 281 | E282: 33 | F282: =R[-1]C -> 5 | G282: =RC[-2]*5 -> 165 | H282: =RC[-3]*10 -> 330
C283: =R[-1]C+1 -> 282 | E283: 33 | F283: =R[-1]C -> 5 | G283: =RC[-2]*5 -> 165 | H283: =RC[-3]*10 -> 330
C284: =R[-1]C+1 -> 283 | E284: 33 | F284: =R[-1]C -> 5 | G284: =RC[-2]*5 -> 165 | H284: =RC[-3]*10 -> 330
C285: =R[-1]C+1 -> 284 | E285: 33 | F285: =R[-1]C -> 5 | G285: =RC[-2]*5 -> 165 | H285: =RC[-3]*10 -> 330
C286: =R[-1]C+1 -> 285 | E286: 33 | F286: =R[-1]C -> 5 | G286: =RC[-2]*5 -> 165 | H286: =RC[-3]*10 -> 330
C287: =R[-1]C+1 -> 286 | E287: 33 | F287: =R[-1]C -> 5 | G287: =RC[-2]*5 -> 165 | H287: =RC[-3]*10 -> 330
C288: =R[-1]C+1 -> 287 | E288: 33 | F288: =R[-1]C -> 5 | G288: =RC[-2]*5 -> 165 | H288: =RC[-3]*10 -> 330
C289: =R[-1]C+1 -> 288 | E289: 33 | F289: =R[-1]C -> 5 | G289: =RC[-2]*5 -> 165 | H289: =RC[-3]*10 -> 330
C290: =R[-1]C+1 -> 289 | E290: 33 | F290: =R[-1]C -> 5 | G290: =RC[-2]*5 -> 165 | H290: =RC[-3]*10 -> 330
C291: =R[-1]C+1 -> 290 | E291: 33 | F291: =R[-1]C -> 5 | G291: =RC[-2]*5 -> 165 | H291: =RC[-3]*10 -> 330
A292: 30 | C292: =R[-1]C+1 -> 291 | E292: 34 | F292: =R[-1]C -> 5 | G292: =RC[-2]*5 -> 170 | H292: =RC[-3]*10 -> 340
C293: =R[-1]C+1 -> 292 | E293: 34 | F293: =R[-1]C -> 5 | G293: =RC[-2]*5 -> 170 | H293: =RC[-3]*10 -> 340
C294: =R[-1]C+1 -> 293 | E294: 34 | F294: =R[-1]C -> 5 | G294: =RC[-2]*5 -> 170 | H294: =RC[-3]*10 -> 340
C295: =R[-1]C+1 -> 294 | E295: 34 | F295: =R[-1]C -> 5 | G295: =RC[-2]*5 -> 170 | H295: =RC[-3]*10 -> 340
C296: =R[-1]C+1 -> 295 | E296: 34 | F296: =R[-1]C -> 5 | G296: =RC[-2]*5 -> 170 | H296: =RC[-3]*10 -> 340
C297: =R[-1]C+1 -> 296 | E297: 34 | F297: =R[-1]C -> 5 | G297: =RC[-2]*5 -> 170 | H297: =RC[-3]*10 -> 340
C298: =R[-1]C+1 -> 297 | E298: 34 | F298: =R[-1]C -> 5 | G298: =RC[-2]*5 -> 170 | H298: =RC[-3]*10 -> 340
C299: =R[-1]C+1 -> 298 | E299: 34 | F299: =R[-1]C -> 5 | G299: =RC[-2]*5 -> 170 | H299: =RC[-3]*10 -> 340
C300: =R[-1]C+1 -> 299 | E300: 34 | F300: =R[-1]C -> 5 | G300: =RC[-2]*5 -> 170 | H300: =RC[-3]*10 -> 340
C301: =R[-1]C+1 -> 300 | E301: 34 | F301: =R[-1]C -> 5 | G301: =RC[-2]*5 -> 170 | H301: =RC[-3]*10 -> 340
A302: 31 | C302: =R[-1]C+1 -> 301 | E302: 35 | F302: =R[-1]C -> 5 | G302: =RC[-2]*5 -> 175 | H302: =RC[-3]*10 -> 350
C303: =R[-1]C+1 -> 302 | E303: 35 | F303: =R[-1]C -> 5 | G303: =RC[-2]*5 -> 175 | H303: =RC[-3]*10 -> 350
C304: =R[-1]C+1 -> 303 | E304: 35 | F304: =R[-1]C -> 5 | G304: =RC[-2]*5 -> 175 | H304: =RC[-3]*10 -> 350
C305: =R[-1]C+1 -> 304 | E305: 35 | F305: =R[-1]C -> 5 | G305: =RC[-2]*5 -> 175 | H305: =RC[-3]*10 -> 350
C306: =R[-1]C+1 -> 305 | E306: 35 | F306: =R[-1]C -> 5 | G306: =RC[-2]*5 -> 175 | H306: =RC[-3]*10 -> 350
C307: =R[-1]C+1 -> 306 | E307: 35 | F307: =R[-1]C -> 5 | G307: =RC[-2]*5 -> 175 | H307: =RC[-3]*10 -> 350
C308: =R[-1]C+1 -> 307 | E308: 35 | F308: =R[-1]C -> 5 | G308: =RC[-2]*5 -> 175 | H308: =RC[-3]*10 -> 350
C309: =R[-1]C+1 -> 308 | E309: 35 | F309: =R[-1]C -> 5 | G309: =RC[-2]*5 -> 175 | H309: =RC[-3]*10 -> 350
C310: =R[-1]C+1 -> 309 | E310: 35 | F310: =R[-1]C -> 5 | G310: =RC[-2]*5 -> 175 | H310: =RC[-3]*10 -> 350
C311: =R[-1]C+1 -> 310 | E311: 35 | F311: =R[-1]C -> 5 | G311: =RC[-2]*5 -> 175 | H311: =RC[-3]*10 -> 350
A312: 32 | C312: =R[-1]C+1 -> 311 | E312: 36 | F312: =R[-1]C -> 5 | G312: =RC[-2]*5 -> 180 | H312: =RC[-3]*10 -> 360
C313: =R[-1]C+1 -> 312 | E313: 36 | F313: =R[-1]C -> 5 | G313: =RC[-2]*5 -> 180 | H313: =RC[-3]*10 -> 360
C314: =R[-1]C+1 -> 313 | E314: 36 | F314: =R[-1]C -> 5 | G314: =RC[-2]*5 -> 180 | H314: =RC[-3]*10 -> 360
C315: =R[-1]C+1 -> 314 | E315: 36 | F315: =R[-1]C -> 5 | G315: =RC[-2]*5 -> 180 | H315: =RC[-3]*10 -> 360
C316: =R[-1]C+1 -> 315 | E316: 36 | F316: =R[-1]C -> 5 | G316: =RC[-2]*5 -> 180 | H316: =RC[-3]*10 -> 360
C317: =R[-1]C+1 -> 316 | E317: 36 | F317: =R[-1]C -> 5 | G317: =RC[-2]*5 -> 180 | H317: =RC[-3]*10 -> 360
C318: =R[-1]C+1 -> 317 | E318: 36 | F318: =R[-1]C -> 5 | G318: =RC[-2]*5 -> 180 | H318: =RC[-3]*10 -> 360
C319: =R[-1]C+1 -> 318 | E319: 36 | F319: =R[-1]C -> 5 | G319: =RC[-2]*5 -> 180 | H319: =RC[-3]*10 -> 360
C320: =R[-1]C+1 -> 319 | E320: 36 | F320: =R[-1]C -> 5 | G320: =RC[-2]*5 -> 180 | H320: =RC[-3]*10 -> 360
C321: =R[-1]C+1 -> 320 | E321: 36 | F321: =R[-1]C -> 5 | G321: =RC[-2]*5 -> 180 | H321: =RC[-3]*10 -> 360
A322: 33 | C322: =R[-1]C+1 -> 321 | E322: 37 | F322: =R[-1]C -> 5 | G322: =RC[-2]*5 -> 185 | H322: =RC[-3]*10 -> 370
C323: =R[-1]C+1 -> 322 | E323: 37 | F323: =R[-1]C -> 5 | G323: =RC[-2]*5 -> 185 | H323: =RC[-3]*10 -> 370
C324: =R[-1]C+1 -> 323 | E324: 37 | F324: =R[-1]C -> 5 | G324: =RC[-2]*5 -> 185 | H324: =RC[-3]*10 -> 370
C325: =R[-1]C+1 -> 324 | E325: 37 | F325: =R[-1]C -> 5 | G325: =RC[-2]*5 -> 185 | H325: =RC[-3]*10 -> 370
C326: =R[-1]C+1 -> 325 | E326: 37 | F326: =R[-1]C -> 5 | G326: =RC[-2]*5 -> 185 | H326: =RC[-3]*10 -> 370
C327: =R[-1]C+1 -> 326 | E327: 37 | F327: =R[-1]C -> 5 | G327: =RC[-2]*5 -> 185 | H327: =RC[-3]*10 -> 370
C328: =R[-1]C+1 -> 327 | E328: 37 | F328: =R[-1]C -> 5 | G328: =RC[-2]*5 -> 185 | H328: =RC[-3]*10 -> 370
C329: =R[-1]C+1 -> 328 | E329: 37 | F329: =R[-1]C -> 5 | G329: =RC[-2]*5 -> 185 | H329: =RC[-3]*10 -> 370
C330: =R[-1]C+1 -> 329 | E330: 37 | F330: =R[-1]C -> 5 | G330: =RC[-2]*5 -> 185 | H330: =RC[-3]*10 -> 370
C331: =R[-1]C+1 -> 330 | E331: 37 | F331: =R[-1]C -> 5 | G331: =RC[-2]*5 -> 185 | H331: =RC[-3]*10 -> 370
A332: 34 | C332: =R[-1]C+1 -> 331 | E332: 38 | F332: =R[-1]C -> 5 | G332: =RC[-2]*5 -> 190 | H332: =RC[-3]*10 -> 380
C333: =R[-1]C+1 -> 332 | E333: 38 | F333: =R[-1]C -> 5 | G333: =RC[-2]*5 -> 190 | H333: =RC[-3]*10 -> 380
C334: =R[-1]C+1 -> 333 | E334: 38 | F334: =R[-1]C -> 5 | G334: =RC[-2]*5 -> 190 | H334: =RC[-3]*10 -> 380
C335: =R[-1]C+1 -> 334 | E335: 38 | F335: =R[-1]C -> 5 | G335: =RC[-2]*5 -> 190 | H335: =RC[-3]*10 -> 380
C336: =R[-1]C+1 -> 335 | E336: 38 | F336: =R[-1]C -> 5 | G336: =RC[-2]*5 -> 190 | H336: =RC[-3]*10 -> 380
C337: =R[-1]C+1 -> 336 | E337: 38 | F337: =R[-1]C -> 5 | G337: =RC[-2]*5 -> 190 | H337: =RC[-3]*10 -> 380
C338: =R[-1]C+1 -> 337 | E338: 38 | F338: =R[-1]C -> 5 | G338: =RC[-2]*5 -> 190 | H338: =RC[-3]*10 -> 380
C339: =R[-1]C+1 -> 338 | E339: 38 | F339: =R[-1]C -> 5 | G339: =RC[-2]*5 -> 190 | H339: =RC[-3]*10 -> 380
C340: =R[-1]C+1 -> 339 | E340: 38 | F340: =R[-1]C -> 5 | G340: =RC[-2]*5 -> 190 | H340: =RC[-3]*10 -> 380
C341: =R[-1]C+1 -> 340 | E341: 38 | F341: =R[-1]C -> 5 | G341: =RC[-2]*5 -> 190 | H341: =RC[-3]*10 -> 380
A342: 35 | C342: =R[-1]C+1 -> 341 | E342: 39 | F342: =R[-1]C -> 5 | G342: =RC[-2]*5 -> 195 | H342: =RC[-3]*10 -> 390
C343: =R[-1]C+1 -> 342 | E343: 39 | F343: =R[-1]C -> 5 | G343: =RC[-2]*5 -> 195 | H343: =RC[-3]*10 -> 390
C344: =R[-1]C+1 -> 343 | E344: 39 | F344: =R[-1]C -> 5 | G344: =RC[-2]*5 -> 195 | H344: =RC[-3]*10 -> 390
C345: =R[-1]C+1 -> 344 | E345: 39 | F345: =R[-1]C -> 5 | G345: =RC[-2]*5 -> 195 | H345: =RC[-3]*10 -> 390
C346: =R[-1]C+1 -> 345 | E346: 39 | F346: =R[-1]C -> 5 | G346: =RC[-2]*5 -> 195 | H346: =RC[-3]*10 -> 390
C347: =R[-1]C+1 -> 346 | E347: 39 | F347: =R[-1]C -> 5 | G347: =RC[-2]*5 -> 195 | H347: =RC[-3]*10 -> 390
C348: =R[-1]C+1 -> 347 | E348: 39 | F348: =R[-1]C -> 5 | G348: =RC[-2]*5 -> 195 | H348: =RC[-3]*10 -> 390
C349: =R[-1]C+1 -> 348 | E349: 39 | F349: =R[-1]C -> 5 | G349: =RC[-2]*5 -> 195 | H349: =RC[-3]*10 -> 390
C350: =R[-1]C+1 -> 349 | E350: 39 | F350: =R[-1]C -> 5 | G350: =RC[-2]*5 -> 195 | H350: =RC[-3]*10 -> 390
C351: =R[-1]C+1 -> 350 | E351: 39 | F351: =R[-1]C -> 5 | G351: =RC[-2]*5 -> 195 | H351: =RC[-3]*10 -> 390
A352: 36 | C352: =R[-1]C+1 -> 351 | E352: 40 | F352: =R[-1]C -> 5 | G352: =RC[-2]*5 -> 200 | H352: =RC[-3]*10 -> 400
C353: =R[-1]C+1 -> 352 | E353: 40 | F353: =R[-1]C -> 5 | G353: =RC[-2]*5 -> 200 | H353: =RC[-3]*10 -> 400
C354: =R[-1]C+1 -> 353 | E354: 40 | F354: =R[-1]C -> 5 | G354: =RC[-2]*5 -> 200 | H354: =RC[-3]*10 -> 400
C355: =R[-1]C+1 -> 354 | E355: 40 | F355: =R[-1]C -> 5 | G355: =RC[-2]*5 -> 200 | H355: =RC[-3]*10 -> 400
C356: =R[-1]C+1 -> 355 | E356: 40 | F356: =R[-1]C -> 5 | G356: =RC[-2]*5 -> 200 | H356: =RC[-3]*10 -> 400
C357: =R[-1]C+1 -> 356 | E357: 40 | F357: =R[-1]C -> 5 | G357: =RC[-2]*5 -> 200 | H357: =RC[-3]*10 -> 400
C358: =R[-1]C+1 -> 357 | E358: 40 | F358: =R[-1]C -> 5 | G358: =RC[-2]*5 -> 200 | H358: =RC[-3]*10 -> 400
C359: =R[-1]C+1 -> 358 | E359: 40 | F359: =R[-1]C -> 5 | G359: =RC[-2]*5 -> 200 | H359: =RC[-3]*10 -> 400
C360: =R[-1]C+1 -> 359 | E360: 40 | F360: =R[-1]C -> 5 | G360: =RC[-2]*5 -> 200 | H360: =RC[-3]*10 -> 400
C361: =R[-1]C+1 -> 360 | E361: 40 | F361: =R[-1]C -> 5 | G361: =RC[-2]*5 -> 200 | H361: =RC[-3]*10 -> 400
A362: 37 | C362: =R[-1]C+1 -> 361 | E362: 41 | F362: =R[-1]C -> 5 | G362: =RC[-2]*5 -> 205 | H362: =RC[-3]*10 -> 410
C363: =R[-1]C+1 -> 362 | E363: 41 | F363: =R[-1]C -> 5 | G363: =RC[-2]*5 -> 205 | H363: =RC[-3]*10 -> 410
C364: =R[-1]C+1 -> 363 | E364: 41 | F364: =R[-1]C -> 5 | G364: =RC[-2]*5 -> 205 | H364: =RC[-3]*10 -> 410
C365: =R[-1]C+1 -> 364 | E365: 41 | F365: =R[-1]C -> 5 | G365: =RC[-2]*5 -> 205 | H365: =RC[-3]*10 -> 410
C366: =R[-1]C+1 -> 365 | E366: 41 | F366: =R[-1]C -> 5 | G366: =RC[-2]*5 -> 205 | H366: =RC[-3]*10 -> 410
C367: =R[-1]C+1 -> 366 | E367: 41 | F367: =R[-1]C -> 5 | G367: =RC[-2]*5 -> 205 | H367: =RC[-3]*10 -> 410
C368: =R[-1]C+1 -> 367 | E368: 41 | F368: =R[-1]C -> 5 | G368: =RC[-2]*5 -> 205 | H368: =RC[-3]*10 -> 410
C369: =R[-1]C+1 -> 368 | E369: 41 | F369: =R[-1]C -> 5 | G369: =RC[-2]*5 -> 205 | H369: =RC[-3]*10 -> 410
C370: =R[-1]C+1 -> 369 | E370: 41 | F370: =R[-1]C -> 5 | G370: =RC[-2]*5 -> 205 | H370: =RC[-3]*10 -> 410
C371: =R[-1]C+1 -> 370 | E371: 41 | F371: =R[-1]C -> 5 | G371: =RC[-2]*5 -> 205 | H371: =RC[-3]*10 -> 410
A372: 38 | C372: =R[-1]C+1 -> 371 | E372: 42 | F372: =R[-1]C -> 5 | G372: =RC[-2]*5 -> 210 | H372: =RC[-3]*10 -> 420
C373: =R[-1]C+1 -> 372 | E373: 42 | F373: =R[-1]C -> 5 | G373: =RC[-2]*5 -> 210 | H373: =RC[-3]*10 -> 420
C374: =R[-1]C+1 -> 373 | E374: 42 | F374: =R[-1]C -> 5 | G374: =RC[-2]*5 -> 210 | H374: =RC[-3]*10 -> 420
C375: =R[-1]C+1 -> 374 | E375: 42 | F375: =R[-1]C -> 5 | G375: =RC[-2]*5 -> 210 | H375: =RC[-3]*10 -> 420
C376: =R[-1]C+1 -> 375 | E376: 42 | F376: =R[-1]C -> 5 | G376: =RC[-2]*5 -> 210 | H376: =RC[-3]*10 -> 420
C377: =R[-1]C+1 -> 376 | E377: 42 | F377: =R[-1]C -> 5 | G377: =RC[-2]*5 -> 210 | H377: =RC[-3]*10 -> 420
C378: =R[-1]C+1 -> 377 | E378: 42 | F378: =R[-1]C -> 5 | G378: =RC[-2]*5 -> 210 | H378: =RC[-3]*10 -> 420
C379: =R[-1]C+1 -> 378 | E379: 42 | F379: =R[-1]C -> 5 | G379: =RC[-2]*5 -> 210 | H379: =RC[-3]*10 -> 420
C380: =R[-1]C+1 -> 379 | E380: 42 | F380: =R[-1]C -> 5 | G380: =RC[-2]*5 -> 210 | H380: =RC[-3]*10 -> 420
C381: =R[-1]C+1 -> 380 | E381: 42 | F381: =R[-1]C -> 5 | G381: =RC[-2]*5 -> 210 | H381: =RC[-3]*10 -> 420
A382: 39 | C382: =R[-1]C+1 -> 381 | E382: 43 | F382: =R[-1]C -> 5 | G382: =RC[-2]*5 -> 215 | H382: =RC[-3]*10 -> 430
C383: =R[-1]C+1 -> 382 | E383: 43 | F383: =R[-1]C -> 5 | G383: =RC[-2]*5 -> 215 | H383: =RC[-3]*10 -> 430
C384: =R[-1]C+1 -> 383 | E384: 43 | F384: =R[-1]C -> 5 | G384: =RC[-2]*5 -> 215 | H384: =RC[-3]*10 -> 430
C385: =R[-1]C+1 -> 384 | E385: 43 | F385: =R[-1]C -> 5 | G385: =RC[-2]*5 -> 215 | H385: =RC[-3]*10 -> 430
C386: =R[-1]C+1 -> 385 | E386: 43 | F386: =R[-1]C -> 5 | G386: =RC[-2]*5 -> 215 | H386: =RC[-3]*10 -> 430
C387: =R[-1]C+1 -> 386 | E387: 43 | F387: =R[-1]C -> 5 | G387: =RC[-2]*5 -> 215 | H387: =RC[-3]*10 -> 430
C388: =R[-1]C+1 -> 387 | E388: 43 | F388: =R[-1]C -> 5 | G388: =RC[-2]*5 -> 215 | H388: =RC[-3]*10 -> 430
C389: =R[-1]C+1 -> 388 | E389: 43 | F389: =R[-1]C -> 5 | G389: =RC[-2]*5 -> 215 | H389: =RC[-3]*10 -> 430
C390: =R[-1]C+1 -> 389 | E390: 43 | F390: =R[-1]C -> 5 | G390: =RC[-2]*5 -> 215 | H390: =RC[-3]*10 -> 430
C391: =R[-1]C+1 -> 390 | E391: 43 | F391: =R[-1]C -> 5 | G391: =RC[-2]*5 -> 215 | H391: =RC[-3]*10 -> 430
A392: 40 | C392: =R[-1]C+1 -> 391 | E392: 44 | F392: =R[-1]C -> 5 | G392: =RC[-2]*5 -> 220 | H392: =RC[-3]*10 -> 440
C393: =R[-1]C+1 -> 392 | E393: 44 | F393: =R[-1]C -> 5 | G393: =RC[-2]*5 -> 220 | H393: =RC[-3]*10 -> 440
C394: =R[-1]C+1 -> 393 | E394: 44 | F394: =R[-1]C -> 5 | G394: =RC[-2]*5 -> 220 | H394: =RC[-3]*10 -> 440
C395: =R[-1]C+1 -> 394 | E395: 44 | F395: =R[-1]C -> 5 | G395: =RC[-2]*5 -> 220 | H395: =RC[-3]*10 -> 440
C396: =R[-1]C+1 -> 395 | E396: 44 | F396: =R[-1]C -> 5 | G396: =RC[-2]*5 -> 220 | H396: =RC[-3]*10 -> 440
C397: =R[-1]C+1 -> 396 | E397: 44 | F397: =R[-1]C -> 5 | G397: =RC[-2]*5 -> 220 | H397: =RC[-3]*10 -> 440
C398: =R[-1]C+1 -> 397 | E398: 44 | F398: =R[-1]C -> 5 | G398: =RC[-2]*5 -> 220 | H398: =RC[-3]*10 -> 440
C399: =R[-1]C+1 -> 398 | E399: 44 | F399: =R[-1]C -> 5 | G399: =RC[-2]*5 -> 220 | H399: =RC[-3]*10 -> 440
C400: =R[-1]C+1 -> 399 | E400: 44 | F400: =R[-1]C -> 5 | G400: =RC[-2]*5 -> 220 | H400: =RC[-3]*10 -> 440
C401: =R[-1]C+1 -> 400 | E401: 44 | F401: =R[-1]C -> 5 | G401: =RC[-2]*5 -> 220 | H401: =RC[-3]*10 -> 440
A402: 41 | C402: =R[-1]C+1 -> 401 | E402: 45 | F402: =R[-1]C -> 5 | G402: =RC[-2]*5 -> 225 | H402: =RC[-3]*10 -> 450
C403: =R[-1]C+1 -> 402 | E403: 45 | F403: =R[-1]C -> 5 | G403: =RC[-2]*5 -> 225 | H403: =RC[-3]*10 -> 450
C404: =R[-1]C+1 -> 403 | E404: 45 | F404: =R[-1]C -> 5 | G404: =RC[-2]*5 -> 225 | H404: =RC[-3]*10 -> 450
C405: =R[-1]C+1 -> 404 | E405: 45 | F405: =R[-1]C -> 5 | G405: =RC[-2]*5 -> 225 | H405: =RC[-3]*10 -> 450
C406: =R[-1]C+1 -> 405 | E406: 45 | F406: =R[-1]C -> 5 | G406: =RC[-2]*5 -> 225 | H406: =RC[-3]*10 -> 450
C407: =R[-1]C+1 -> 406 | E407: 45 | F407: =R[-1]C -> 5 | G407: =RC[-2]*5 -> 225 | H407: =RC[-3]*10 -> 450
C408: =R[-1]C+1 -> 407 | E408: 45 | F408: =R[-1]C -> 5 | G408: =RC[-2]*5 -> 225 | H408: =RC[-3]*10 -> 450
C409: =R[-1]C+1 -> 408 | E409: 45 | F409: =R[-1]C -> 5 | G409: =RC[-2]*5 -> 225 | H409: =RC[-3]*10 -> 450
C410: =R[-1]C+1 -> 409 | E410: 45 | F410: =R[-1]C -> 5 | G410: =RC[-2]*5 -> 225 | H410: =RC[-3]*10 -> 450
C411: =R[-1]C+1 -> 410 | E411: 45 | F411: =R[-1]C -> 5 | G411: =RC[-2]*5 -> 225 | H411: =RC[-3]*10 -> 450
A412: 42 | C412: =R[-1]C+1 -> 411 | E412: 46 | F412: =R[-1]C -> 5 | G412: =RC[-2]*5 -> 230 | H412: =RC[-3]*10 -> 460
C413: =R[-1]C+1 -> 412 | E413: 46 | F413: =R[-1]C -> 5 | G413: =RC[-2]*5 -> 230 | H413: =RC[-3]*10 -> 460
C414: =R[-1]C+1 -> 413 | E414: 46 | F414: =R[-1]C -> 5 | G414: =RC[-2]*5 -> 230 | H414: =RC[-3]*10 -> 460
C415: =R[-1]C+1 -> 414 | E415: 46 | F415: =R[-1]C -> 5 | G415: =RC[-2]*5 -> 230 | H415: =RC[-3]*10 -> 460
C416: =R[-1]C+1 -> 415 | E416: 46 | F416: =R[-1]C -> 5 | G416: =RC[-2]*5 -> 230 | H416: =RC[-3]*10 -> 460
C417: =R[-1]C+1 -> 416 | E417: 46 | F417: =R[-1]C -> 5 | G417: =RC[-2]*5 -> 230 | H417: =RC[-3]*10 -> 460
C418: =R[-1]C+1 -> 417 | E418: 46 | F418: =R[-1]C -> 5 | G418: =RC[-2]*5 -> 230 | H418: =RC[-3]*10 -> 460
C419: =R[-1]C+1 -> 418 | E419: 46 | F419: =R[-1]C -> 5 | G419: =RC[-2]*5 -> 230 | H419: =RC[-3]*10 -> 460
C420: =R[-1]C+1 -> 419 | E420: 46 | F420: =R[-1]C -> 5 | G420: =RC[-2]*5 -> 230 | H420: =RC[-3]*10 -> 460
C421: =R[-1]C+1 -> 420 | E421: 46 | F421: =R[-1]C -> 5 | G421: =RC[-2]*5 -> 230 | H421: =RC[-3]*10 -> 460
A422: 43 | C422: =R[-1]C+1 -> 421 | E422: 47 | F422: =R[-1]C -> 5 | G422: =RC[-2]*5 -> 235 | H422: =RC[-3]*10 -> 470
C423: =R[-1]C+1 -> 422 | E423: 47 | F423: =R[-1]C -> 5 | G423: =RC[-2]*5 -> 235 | H423: =RC[-3]*10 -> 470
C424: =R[-1]C+1 -> 423 | E424: 47 | F424: =R[-1]C -> 5 | G424: =RC[-2]*5 -> 235 | H424: =RC[-3]*10 -> 470
C425: =R[-1]C+1 -> 424 | E425: 47 | F425: =R[-1]C -> 5 | G425: =RC[-2]*5 -> 235 | H425: =RC[-3]*10 -> 470
C426: =R[-1]C+1 -> 425 | E426: 47 | F426: =R[-1]C -> 5 | G426: =RC[-2]*5 -> 235 | H426: =RC[-3]*10 -> 470
C427: =R[-1]C+1 -> 426 | E427: 47 | F427: =R[-1]C -> 5 | G427: =RC[-2]*5 -> 235 | H427: =RC[-3]*10 -> 470
C428: =R[-1]C+1 -> 427 | E428: 47 | F428: =R[-1]C -> 5 | G428: =RC[-2]*5 -> 235 | H428: =RC[-3]*10 -> 470
C429: =R[-1]C+1 -> 428 | E429: 47 | F429: =R[-1]C -> 5 | G429: =RC[-2]*5 -> 235 | H429: =RC[-3]*10 -> 470
C430: =R[-1]C+1 -> 429 | E430: 47 | F430: =R[-1]C -> 5 | G430: =RC[-2]*5 -> 235 | H430: =RC[-3]*10 -> 470
C431: =R[-1]C+1 -> 430 | E431: 47 | F431: =R[-1]C -> 5 | G431: =RC[-2]*5 -> 235 | H431: =RC[-3]*10 -> 470
A432: 44 | C432: =R[-1]C+1 -> 431 | E432: 48 | F432: =R[-1]C -> 5 | G432: =RC[-2]*5 -> 240 | H432: =RC[-3]*10 -> 480
C433: =R[-1]C+1 -> 432 | E433: 48 | F433: =R[-1]C -> 5 | G433: =RC[-2]*5 -> 240 | H433: =RC[-3]*10 -> 480
C434: =R[-1]C+1 -> 433 | E434: 48 | F434: =R[-1]C -> 5 | G434: =RC[-2]*5 -> 240 | H434: =RC[-3]*10 -> 480
C435: =R[-1]C+1 -> 434 | E435: 48 | F435: =R[-1]C -> 5 | G435: =RC[-2]*5 -> 240 | H435: =RC[-3]*10 -> 480
C436: =R[-1]C+1 -> 435 | E436: 48 | F436: =R[-1]C -> 5 | G436: =RC[-2]*5 -> 240 | H436: =RC[-3]*10 -> 480
C437: =R[-1]C+1 -> 436 | E437: 48 | F437: =R[-1]C -> 5 | G437: =RC[-2]*5 -> 240 | H437: =RC[-3]*10 -> 480
C438: =R[-1]C+1 -> 437 | E438: 48 | F438: =R[-1]C -> 5 | G438: =RC[-2]*5 -> 240 | H438: =RC[-3]*10 -> 480
C439: =R[-1]C+1 -> 438 | E439: 48 | F439: =R[-1]C -> 5 | G439: =RC[-2]*5 -> 240 | H439: =RC[-3]*10 -> 480
C440: =R[-1]C+1 -> 439 | E440: 48 | F440: =R[-1]C -> 5 | G440: =RC[-2]*5 -> 240 | H440: =RC[-3]*10 -> 480
C441: =R[-1]C+1 -> 440 | E441: 48 | F441: =R[-1]C -> 5 | G441: =RC[-2]*5 -> 240 | H441: =RC[-3]*10 -> 480
A442: 45 | C442: =R[-1]C+1 -> 441 | E442: 49 | F442: =R[-1]C -> 5 | G442: =RC[-2]*5 -> 245 | H442: =RC[-3]*10 -> 490
C443: =R[-1]C+1 -> 442 | E443: 49 | F443: =R[-1]C -> 5 | G443: =RC[-2]*5 -> 245 | H443: =RC[-3]*10 -> 490
C444: =R[-1]C+1 -> 443 | E444: 49 | F444: =R[-1]C -> 5 | G444: =RC[-2]*5 -> 245 | H444: =RC[-3]*10 -> 490
C445: =R[-1]C+1 -> 444 | E445: 49 | F445: =R[-1]C -> 5 | G445: =RC[-2]*5 -> 245 | H445: =RC[-3]*10 -> 490
C446: =R[-1]C+1 -> 445 | E446: 49 | F446: =R[-1]C -> 5 | G446: =RC[-2]*5 -> 245 | H446: =RC[-3]*10 -> 490
C447: =R[-1]C+1 -> 446 | E447: 49 | F447: =R[-1]C -> 5 | G447: =RC[-2]*5 -> 245 | H447: =RC[-3]*10 -> 490
C448: =R[-1]C+1 -> 447 | E448: 49 | F448: =R[-1]C -> 5 | G448: =RC[-2]*5 -> 245 | H448: =RC[-3]*10 -> 490
C449: =R[-1]C+1 -> 448 | E449: 49 | F449: =R[-1]C -> 5 | G449: =RC[-2]*5 -> 245 | H449: =RC[-3]*10 -> 490
C450: =R[-1]C+1 -> 449 | E450: 49 | F450: =R[-1]C -> 5 | G450: =RC[-2]*5 -> 245 | H450: =RC[-3]*10 -> 490
C451: =R[-1]C+1 -> 450 | E451: 49 | F451: =R[-1]C -> 5 | G451: =RC[-2]*5 -> 245 | H451: =RC[-3]*10 -> 490
A452: 46 | C452: =R[-1]C+1 -> 451 | E452: 50 | F452: =R[-1]C -> 5 | G452: =RC[-2]*5 -> 250 | H452: =RC[-3]*10 -> 500
C453: =R[-1]C+1 -> 452 | E453: 50 | F453: =R[-1]C -> 5 | G453: =RC[-2]*5 -> 250 | H453: =RC[-3]*10 -> 500
C454: =R[-1]C+1 -> 453 | E454: 50 | F454: =R[-1]C -> 5 | G454: =RC[-2]*5 -> 250 | H454: =RC[-3]*10 -> 500
C455: =R[-1]C+1 -> 454 | E455: 50 | F455: =R[-1]C -> 5 | G455: =RC[-2]*5 -> 250 | H455: =RC[-3]*10 -> 500
C456: =R[-1]C+1 -> 455 | E456: 50 | F456: =R[-1]C -> 5 | G456: =RC[-2]*5 -> 250 | H456: =RC[-3]*10 -> 500
C457: =R[-1]C+1 -> 456 | E457: 50 | F457: =R[-1]C -> 5 | G457: =RC[-2]*5 -> 250 | H457: =RC[-3]*10 -> 500
C458: =R[-1]C+1 -> 457 | E458: 50 | F458: =R[-1]C -> 5 | G458: =RC[-2]*5 -> 250 | H458: =RC[-3]*10 -> 500
C459: =R[-1]C+1 -> 458 | E459: 50 | F459: =R[-1]C -> 5 | G459: =RC[-2]*5 -> 250 | H459: =RC[-3]*10 -> 500
C460: =R[-1]C+1 -> 459 | E460: 50 | F460: =R[-1]C -> 5 | G460: =RC[-2]*5 -> 250 | H460: =RC[-3]*10 -> 500
C461: =R[-1]C+1 -> 460 | E461: 50 | F461: =R[-1]C -> 5 | G461: =RC[-2]*5 -> 250 | H461: =RC[-3]*10 -> 500
A462: 47 | C462: =R[-1]C+1 -> 461 | E462: 51 | F462: =R[-1]C -> 5 | G462: =RC[-2]*5 -> 255 | H462: =RC[-3]*10 -> 510
C463: =R[-1]C+1 -> 462 | E463: 51 | F463: =R[-1]C -> 5 | G463: =RC[-2]*5 -> 255 | H463: =RC[-3]*10 -> 510
C464: =R[-1]C+1 -> 463 | E464: 51 | F464: =R[-1]C -> 5 | G464: =RC[-2]*5 -> 255 | H464: =RC[-3]*10 -> 510
C465: =R[-1]C+1 -> 464 | E465: 51 | F465: =R[-1]C -> 5 | G465: =RC[-2]*5 -> 255 | H465: =RC[-3]*10 -> 510
C466: =R[-1]C+1 -> 465 | E466: 51 | F466: =R[-1]C -> 5 | G466: =RC[-2]*5 -> 255 | H466: =RC[-3]*10 -> 510
C467: =R[-1]C+1 -> 466 | E467: 51 | F467: =R[-1]C -> 5 | G467: =RC[-2]*5 -> 255 | H467: =RC[-3]*10 -> 510
C468: =R[-1]C+1 -> 467 | E468: 51 | F468: =R[-1]C -> 5 | G468: =RC[-2]*5 -> 255 | H468: =RC[-3]*10 -> 510
C469: =R[-1]C+1 -> 468 | E469: 51 | F469: =R[-1]C -> 5 | G469: =RC[-2]*5 -> 255 | H469: =RC[-3]*10 -> 510
C470: =R[-1]C+1 -> 469 | E470: 51 | F470: =R[-1]C -> 5 | G470: =RC[-2]*5 -> 255 | H470: =RC[-3]*10 -> 510
C471: =R[-1]C+1 -> 470 | E471: 51 | F471: =R[-1]C -> 5 | G471: =RC[-2]*5 -> 255 | H471: =RC[-3]*10 -> 510
A472: 48 | C472: =R[-1]C+1 -> 471 | E472: 52 | F472: =R[-1]C -> 5 | G472: =RC[-2]*5 -> 260 | H472: =RC[-3]*10 -> 520
C473: =R[-1]C+1 -> 472 | E473: 52 | F473: =R[-1]C -> 5 | G473: =RC[-2]*5 -> 260 | H473: =RC[-3]*10 -> 520
C474: =R[-1]C+1 -> 473 | E474: 52 | F474: =R[-1]C -> 5 | G474: =RC[-2]*5 -> 260 | H474: =RC[-3]*10 -> 520
C475: =R[-1]C+1 -> 474 | E475: 52 | F475: =R[-1]C -> 5 | G475: =RC[-2]*5 -> 260 | H475: =RC[-3]*10 -> 520
C476: =R[-1]C+1 -> 475 | E476: 52 | F476: =R[-1]C -> 5 | G476: =RC[-2]*5 -> 260 | H476: =RC[-3]*10 -> 520
C477: =R[-1]C+1 -> 476 | E477: 52 | F477: =R[-1]C -> 5 | G477: =RC[-2]*5 -> 260 | H477: =RC[-3]*10 -> 520
C478: =R[-1]C+1 -> 477 | E478: 52 | F478: =R[-1]C -> 5 | G478: =RC[-2]*5 -> 260 | H478: =RC[-3]*10 -> 520
C479: =R[-1]C+1 -> 478 | E479: 52 | F479: =R[-1]C -> 5 | G479: =RC[-2]*5 -> 260 | H479: =RC[-3]*10 -> 520
C480: =R[-1]C+1 -> 479 | E480: 52 | F480: =R[-1]C -> 5 | G480: =RC[-2]*5 -> 260 | H480: =RC[-3]*10 -> 520
C481: =R[-1]C+1 -> 480 | E481: 52 | F481: =R[-1]C -> 5 | G481: =RC[-2]*5 -> 260 | H481: =RC[-3]*10 -> 520
A482: 49 | C482: =R[-1]C+1 -> 481 | E482: 53 | F482: =R[-1]C -> 5 | G482: =RC[-2]*5 -> 265 | H482: =RC[-3]*10 -> 530
C483: =R[-1]C+1 -> 482 | E483: 53 | F483: =R[-1]C -> 5 | G483: =RC[-2]*5 -> 265 | H483: =RC[-3]*10 -> 530
C484: =R[-1]C+1 -> 483 | E484: 53 | F484: =R[-1]C -> 5 | G484: =RC[-2]*5 -> 265 | H484: =RC[-3]*10 -> 530
C485: =R[-1]C+1 -> 484 | E485: 53 | F485: =R[-1]C -> 5 | G485: =RC[-2]*5 -> 265 | H485: =RC[-3]*10 -> 530
C486: =R[-1]C+1 -> 485 | E486: 53 | F486: =R[-1]C -> 5 | G486: =RC[-2]*5 -> 265 | H486: =RC[-3]*10 -> 530
C487: =R[-1]C+1 -> 486 | E487: 53 | F487: =R[-1]C -> 5 | G487: =RC[-2]*5 -> 265 | H487: =RC[-3]*10 -> 530
C488: =R[-1]C+1 -> 487 | E488: 53 | F488: =R[-1]C -> 5 | G488: =RC[-2]*5 -> 265 | H488: =RC[-3]*10 -> 530
C489: =R[-1]C+1 -> 488 | E489: 53 | F489: =R[-1]C -> 5 | G489: =RC[-2]*5 -> 265 | H489: =RC[-3]*10 -> 530
C490: =R[-1]C+1 -> 489 | E490: 53 | F490: =R[-1]C -> 5 | G490: =RC[-2]*5 -> 265 | H490: =RC[-3]*10 -> 530
C491: =R[-1]C+1 -> 490 | E491: 53 | F491: =R[-1]C -> 5 | G491: =RC[-2]*5 -> 265 | H491: =RC[-3]*10 -> 530
A492: 50 | C492: =R[-1]C+1 -> 491 | E492: 54 | F492: =R[-1]C -> 5 | G492: =RC[-2]*5 -> 270 | H492: =RC[-3]*10 -> 540
C493: =R[-1]C+1 -> 492 | E493: 54 | F493: =R[-1]C -> 5 | G493: =RC[-2]*5 -> 270 | H493: =RC[-3]*10 -> 540
C494: =R[-1]C+1 -> 493 | E494: 54 | F494: =R[-1]C -> 5 | G494: =RC[-2]*5 -> 270 | H494: =RC[-3]*10 -> 540
C495: =R[-1]C+1 -> 494 | E495: 54 | F495: =R[-1]C -> 5 | G495: =RC[-2]*5 -> 270 | H495: =RC[-3]*10 -> 540
C496: =R[-1]C+1 -> 495 | E496: 54 | F496: =R[-1]C -> 5 | G496: =RC[-2]*5 -> 270 | H496: =RC[-3]*10 -> 540
C497: =R[-1]C+1 -> 496 | E497: 54 | F497: =R[-1]C -> 5 | G497: =RC[-2]*5 -> 270 | H497: =RC[-3]*10 -> 540
C498: =R[-1]C+1 -> 497 | E498: 54 | F498: =R[-1]C -> 5 | G498: =RC[-2]*5 -> 270 | H498: =RC[-3]*10 -> 540
C499: =R[-1]C+1 -> 498 | E499: 54 | F499: =R[-1]C -> 5 | G499: =RC[-2]*5 -> 270 | H499: =RC[-3]*10 -> 540
C500: =R[-1]C+1 -> 499 | E500: 54 | F500: =R[-1]C -> 5 | G500: =RC[-2]*5 -> 270 | H500: =RC[-3]*10 -> 540
C501: =R[-1]C+1 -> 500 | E501: 54 | F501: =R[-1]C -> 5 | G501: =RC[-2]*5 -> 270 | H501: =RC[-3]*10 -> 540

Sheet: 扫荡~宝箱~战斗
A1: 任务大关 | B1: 扫荡阶段性铜板产出 | C1: 扫荡阶段性经验产出 | E1: 扫荡不消耗体力，通关的每一大关，可以进行扫荡
A2: 1 | B2: =RC[1]*5.5 -> 550 | C2: 100 | E2: 每个大关，扫荡的时候，有30%的概率产出10元宝
A3: 2 | B3: =RC[1]*5.5 -> 660 | C3: =R[-1]C+20 -> 120
A4: 3 | B4: =RC[1]*5.5 -> 770 | C4: =R[-1]C+20 -> 140
A5: 4 | B5: =RC[1]*5.5 -> 880 | C5: =R[-1]C+20 -> 160 | E5: 遇到战斗概率 | F5: 怪物卡等级 | G5: 1星概率 | H5: 2星概率 | I5: 卡蕴含经验 | J5: 具体卡牌掉落子概率
A6: 5 | B6: =RC[1]*5.5 -> 990 | C6: =R[-1]C+20 -> 180 | E6: 0.2 | F6: 1 | G6: 0.5 | H6: 0.5 | I6: 100 | J6: 0.6
A7: 6 | B7: =RC[1]*5.5 -> 1100 | C7: =R[-1]C+20 -> 200 | E7: 0.2 | F7: 2 | G7: 0.5 | H7: 0.5 | I7: 210 | J7: 0.1
A8: 7 | B8: =RC[1]*5.5 -> 1210 | C8: =R[-1]C+20 -> 220 | E8: 0.2 | F8: 3 | G8: 0.5 | H8: 0.5 | I8: 331 | J8: 0.1
A9: 8 | B9: =RC[1]*5.5 -> 1320 | C9: =R[-1]C+20 -> 240 | E9: 0.2 | F9: 4 | G9: 0.5 | H9: 0.5 | I9: 464 | J9: 0.1
A10: 9 | B10: =RC[1]*5.5 -> 1430 | C10: =R[-1]C+20 -> 260 | E10: 0.2 | F10: 5 | G10: 0.5 | H10: 0.5 | I10: 610 | J10: 0.1
A11: 10 | B11: =RC[1]*5.5 -> 1540 | C11: =R[-1]C+20 -> 280 | E11: 战斗结束，必然掉落一张卡牌
A12: 11 | B12: =RC[1]*5.5 -> 1650 | C12: =R[-1]C+20 -> 300 | E12: 怪物卡的星级，跟着任务卡牌信息走，里面配的是几星就是几星。
A13: 12 | B13: =RC[1]*5.5 -> 1760 | C13: =R[-1]C+20 -> 320 | E13: 至于具体的掉落，从怪物所上阵的卡牌里随机一张。
A14: 13 | B14: =RC[1]*5.5 -> 1870 | C14: =R[-1]C+20 -> 340
A15: 14 | B15: =RC[1]*5.5 -> 1980 | C15: =R[-1]C+20 -> 360
A16: 15 | B16: =RC[1]*5.5 -> 2090 | C16: =R[-1]C+20 -> 380 | E16: 直接出神仙卡宝箱概率 | G16: 宝箱给的卡均为1级
A17: 16 | B17: =RC[1]*5.5 -> 2200 | C17: =R[-1]C+20 -> 400 | E17: 0.05
A18: 17 | B18: =RC[1]*5.5 -> 2310 | C18: =R[-1]C+20 -> 420 | E18: 神仙卡宝箱卡星级 | F18: 子概率 | G18: 实际概率
A19: 18 | B19: =RC[1]*5.5 -> 2420 | C19: =R[-1]C+20 -> 440 | E19: 1星 | F19: 0.1 | G19: 0.005
A20: 19 | B20: =RC[1]*5.5 -> 2530 | C20: =R[-1]C+20 -> 460 | E20: 2星 | F20: 0.15 | G20: 0.0075
A21: 20 | B21: =RC[1]*5.5 -> 2640 | C21: =R[-1]C+20 -> 480 | E21: 3星 | F21: 0.7 | G21: 0.035
A22: 21 | B22: =RC[1]*5.5 -> 2750 | C22: =R[-1]C+20 -> 500 | E22: 4星 | F22: 0.05 | G22: 0.0025
A23: 22 | B23: =RC[1]*5.5 -> 2860 | C23: =R[-1]C+20 -> 520
A24: 23 | B24: =RC[1]*5.5 -> 2970 | C24: =R[-1]C+20 -> 540 | E24: 遇到宝箱概率和遇到战斗的概率，是独立概率，相加关系
A25: 24 | B25: =RC[1]*5.5 -> 3080 | C25: =R[-1]C+20 -> 560 | E25: 所以不会出现同时遇到宝箱和进入战斗
A26: 25 | B26: =RC[1]*5.5 -> 3190 | C26: =R[-1]C+20 -> 580
A27: 26 | B27: =RC[1]*5.5 -> 3300 | C27: =R[-1]C+20 -> 600
A28: 27 | B28: =RC[1]*5.5 -> 3410 | C28: =R[-1]C+20 -> 620
A29: 28 | B29: =RC[1]*5.5 -> 3520 | C29: =R[-1]C+20 -> 640
A30: 29 | B30: =RC[1]*5.5 -> 3630 | C30: =R[-1]C+20 -> 660
A31: 30 | B31: =RC[1]*5.5 -> 3740 | C31: =R[-1]C+20 -> 680
A32: 31 | B32: =RC[1]*5.5 -> 3850 | C32: =R[-1]C+20 -> 700
A33: 32 | B33: =RC[1]*5.5 -> 3960 | C33: =R[-1]C+20 -> 720
A34: 33 | B34: =RC[1]*5.5 -> 4070 | C34: =R[-1]C+20 -> 740
A35: 34 | B35: =RC[1]*5.5 -> 4180 | C35: =R[-1]C+20 -> 760
A36: 35 | B36: =RC[1]*5.5 -> 4290 | C36: =R[-1]C+20 -> 780
A37: 36 | B37: =RC[1]*5.5 -> 4400 | C37: =R[-1]C+20 -> 800
A38: 37 | B38: =RC[1]*5.5 -> 4510 | C38: =R[-1]C+20 -> 820
A39: 38 | B39: =RC[1]*5.5 -> 4620 | C39: =R[-1]C+20 -> 840
A40: 39 | B40: =RC[1]*5.5 -> 4730 | C40: =R[-1]C+20 -> 860
A41: 40 | B41: =RC[1]*5.5 -> 4840 | C41: =R[-1]C+20 -> 880
A42: 41 | B42: =RC[1]*5.5 -> 4950 | C42: =R[-1]C+20 -> 900
A43: 42 | B43: =RC[1]*5.5 -> 5060 | C43: =R[-1]C+20 -> 920
A44: 43 | B44: =RC[1]*5.5 -> 5170 | C44: =R[-1]C+20 -> 940
A45: 44 | B45: =RC[1]*5.5 -> 5280 | C45: =R[-1]C+20 -> 960
A46: 45 | B46: =RC[1]*5.5 -> 5390 | C46: =R[-1]C+20 -> 980
A47: 46 | B47: =RC[1]*5.5 -> 5500 | C47: =R[-1]C+20 -> 1000
A48: 47 | B48: =RC[1]*5.5 -> 5610 | C48: =R[-1]C+20 -> 1020
A49: 48 | B49: =RC[1]*5.5 -> 5720 | C49: =R[-1]C+20 -> 1040
A50: 49 | B50: =RC[1]*5.5 -> 5830 | C50: =R[-1]C+20 -> 1060
A51: 50 | B51: =RC[1]*5.5 -> 5940 | C51: =R[-1]C+20 -> 1080

Sheet: 任务怪物配置
A1: 任务大关 | B1: 卡牌数量 | C1: 卡牌1名称 | D1: 卡牌2名称 | E1: 卡牌3名称 | F1: 卡牌4名称 | G1: 卡牌5名称 | H1: 卡牌6名称 | I1: BOSS是哪张卡牌 | J1: 加成效果 | K1: 触发概率 | L1: 每小关攻击加成 | M1: 每小关生命加成 | N1: 掉落最多数量
A2: 1 | B2: 2 | C2: 黑熊大王 | D2: 白虎精 | I2: 黑熊 | J2: 0.3 | K2: 0.5 | L2: 0.05 | M2: 0.05 | N2: 2
A3: 2 | B3: 3 | C3: 黑熊大王 | D3: 黑熊大王 | E3: 白虎精
A4: 3 | B4: 3
A5: 4 | B5: 3
A6: 5 | B6: 3
A7: 6 | B7: 4
A8: 7 | B8: 4
A9: 8 | B9: 4
A10: 9 | B10: 3
A11: 10 | B11: 4
A12: 11 | B12: 4
A13: 12 | B13: 4
A14: 13 | B14: 4
A15: 14 | B15: 4
A16: 15 | B16: 4
A17: 16 | B17: 5
A18: 17 | B18: 5
A19: 18 | B19: 5
A20: 19 | B20: 5
A21: 20 | B21: 5
A22: 21 | B22: 5
A23: 22 | B23: 5
A24: 23 | B24: 5
A25: 24 | B25: 5
A26: 25 | B26: 5
A27: 26 | B27: 5
A28: 27 | B28: 5
A29: 28 | B29: 5
A30: 29 | B30: 5
A31: 30 | B31: 5
A32: 31 | B32: 5
A33: 32 | B33: 5
A34: 33 | B34: 5
A35: 34 | B35: 5
A36: 35 | B36: 5
A37: 36 | B37: 5
A38: 37 | B38: 5
A39: 38 | B39: 5
A40: 39 | B40: 5
A41: 40 | B41: 5
A42: 41 | B42: 5
A43: 42 | B43: 5
A44: 43 | B44: 5
A45: 44 | B45: 5
A46: 45 | B46: 5
A47: 46 | B47: 5
A48: 47 | B48: 5
A49: 48 | B49: 5
A50: 49 | B50: 5
A51: 50 | B51: 5
A53: 任务总共50大关，每关10个任务，共500个。每大关任务难度相当。
A54: 怪物有初始的10%闪避和暴击，玩家享有先手攻击的机会。
A55: 游戏初始，会给予玩家一张3星，一张4星，这是保底的，依照此来设定怪物攻击力和血量。
A56: 按照3星卡生命值和3星攻击力的70%--90%来参考配置。---任务基本不设置难度
A57: 这里的技能指的是BOSS技能，也就是，每次战斗，只有其中一张卡牌是有技能的，
A58: BOSS属性提升，每层提升5%。最高提升50%。
A59: 普通怪物攻击和生命属性每一大关保持不变，只有BOSS卡属性会变。
A60: 保持这样一个阶段性节奏变化即可。

Sheet: 任务卡牌信息
A1: 卡牌名称 | B1: 每关卡片攻击力 | C1: 每大关卡片生命值 | D1: 闪避 | E1: 暴击 | F1: 技能ID
A2: 黑熊 | B2: 50 | C2: ='C:\Users\gaobin\Desktop\[数值系统.xls]卡牌基础属性参考'!R[3]C[6]*0.3 -> 108 | D2: 10 | E2: 10 | F2: 1
A3: 白熊 | B3: ='C:\Users\gaobin\Desktop\[数值系统.xls]卡牌基础属性参考'!R[3]C[2]*0.7 -> 92.4 | C3: ='C:\Users\gaobin\Desktop\[数值系统.xls]卡牌基础属性参考'!R[3]C[6]*0.9 -> 356.4 | D3: 10 | E3: 10 | F3: 2
A4: 3 | B4: ='C:\Users\gaobin\Desktop\[数值系统.xls]卡牌基础属性参考'!R[3]C[2]*0.7 -> 101.5476 | C4: ='C:\Users\gaobin\Desktop\[数值系统.xls]卡牌基础属性参考'!R[3]C[6]*0.9 -> 391.6836 | D4: 10 | E4: 10 | F4: 3
A5: 4 | B5: ='C:\Users\gaobin\Desktop\[数值系统.xls]卡牌基础属性参考'!R[3]C[2]*0.7 -> 111.4992648 | C5: ='C:\Users\gaobin\Desktop\[数值系统.xls]卡牌基础属性参考'!R[3]C[6]*0.9 -> 430.0685928 | D5: 10 | E5: 10 | F5: 4
A6: 5 | B6: ='C:\Users\gaobin\Desktop\[数值系统.xls]卡牌基础属性参考'!R[3]C[2]*0.7 -> 122.3146934856 | C6: ='C:\Users\gaobin\Desktop\[数值系统.xls]卡牌基础属性参考'!R[3]C[6]*0.9 -> 471.7852463016 | D6: 10 | E6: 10 | F6: 5
A7: 6 | B7: ='C:\Users\gaobin\Desktop\[数值系统.xls]卡牌基础属性参考'!R[3]C[2]*0.7 -> 134.056904060218 | C7: ='C:\Users\gaobin\Desktop\[数值系统.xls]卡牌基础属性参考'!R[3]C[6]*0.9 -> 517.076629946554 | D7: 10 | E7: 10 | F7: 6
A8: 7 | B8: ='C:\Users\gaobin\Desktop\[数值系统.xls]卡牌基础属性参考'!R[3]C[2]*0.7 -> 146.792309945939 | C8: ='C:\Users\gaobin\Desktop\[数值系统.xls]卡牌基础属性参考'!R[3]C[6]*0.9 -> 566.198909791477 | D8: 10 | E8: 10 | F8: 7
A9: 8 | B9: ='C:\Users\gaobin\Desktop\[数值系统.xls]卡牌基础属性参考'!R[3]C[2]*0.7 -> 160.590787080857 | C9: ='C:\Users\gaobin\Desktop\[数值系统.xls]卡牌基础属性参考'!R[3]C[6]*0.9 -> 619.421607311877 | D9: 10 | E9: 10 | F9: 8
A10: 9 | B10: ='C:\Users\gaobin\Desktop\[数值系统.xls]卡牌基础属性参考'!R[3]C[2]*0.7 -> 175.525730279377 | C10: ='C:\Users\gaobin\Desktop\[数值系统.xls]卡牌基础属性参考'!R[3]C[6]*0.9 -> 677.027816791882 | D10: 10 | E10: 10 | F10: 9
A11: 10 | B11: ='C:\Users\gaobin\Desktop\[数值系统.xls]卡牌基础属性参考'!R[3]C[2]*0.7 -> 191.67409746508 | C11: ='C:\Users\gaobin\Desktop\[数值系统.xls]卡牌基础属性参考'!R[3]C[6]*0.9 -> 739.314375936735 | D11: 10 | E11: 10 | F11: 10
A12: 11 | B12: ='C:\Users\gaobin\Desktop\[数值系统.xls]卡牌基础属性参考'!R[3]C[2]*0.7 -> 209.116440334402 | C12: ='C:\Users\gaobin\Desktop\[数值系统.xls]卡牌基础属性参考'!R[3]C[6]*0.9 -> 806.591984146979 | D12: 10 | E12: 10 | F12: 11
A13: 12 | B13: ='C:\Users\gaobin\Desktop\[数值系统.xls]卡牌基础属性参考'!R[3]C[2]*0.7 -> 227.936919964498 | C13: ='C:\Users\gaobin\Desktop\[数值系统.xls]卡牌基础属性参考'!R[3]C[6]*0.9 -> 879.185262720208 | D13: 10 | E13: 10 | F13: 12
A14: 13 | B14: ='C:\Users\gaobin\Desktop\[数值系统.xls]卡牌基础属性参考'!R[3]C[2]*0.7 -> 248.223305841339 | C14: ='C:\Users\gaobin\Desktop\[数值系统.xls]卡牌基础属性参考'!R[3]C[6]*0.9 -> 957.432751102308 | D14: 10 | E14: 10 | F14: 13
A15: 14 | B15: ='C:\Users\gaobin\Desktop\[数值系统.xls]卡牌基础属性参考'!R[3]C[2]*0.7 -> 270.066956755377 | C15: ='C:\Users\gaobin\Desktop\[数值系统.xls]卡牌基础属性参考'!R[3]C[6]*0.9 -> 1041.68683319931 | D15: 10 | E15: 10 | F15: 14
A16: 15 | B16: ='C:\Users\gaobin\Desktop\[数值系统.xls]卡牌基础属性参考'!R[3]C[2]*0.7 -> 293.562781993095 | C16: ='C:\Users\gaobin\Desktop\[数值系统.xls]卡牌基础属性参考'!R[3]C[6]*0.9 -> 1132.31358768765 | D16: 10 | E16: 10 | F16: 15
A17: 16 | B17: ='C:\Users\gaobin\Desktop\[数值系统.xls]卡牌基础属性参考'!R[3]C[2]*0.7 -> 318.809181244502 | C17: ='C:\Users\gaobin\Desktop\[数值系统.xls]卡牌基础属性参考'!R[3]C[6]*0.9 -> 1229.69255622879 | D17: 10 | E17: 10 | F17: 16
A18: 17 | B18: ='C:\Users\gaobin\Desktop\[数值系统.xls]卡牌基础属性参考'!R[3]C[2]*0.7 -> 345.907961650285 | C18: ='C:\Users\gaobin\Desktop\[数值系统.xls]卡牌基础属性参考'!R[3]C[6]*0.9 -> 1334.21642350824 | D18: 10 | E18: 10 | F18: 17
A19: 18 | B19: ='C:\Users\gaobin\Desktop\[数值系统.xls]卡牌基础属性参考'!R[3]C[2]*0.7 -> 374.96423042891 | C19: ='C:\Users\gaobin\Desktop\[数值系统.xls]卡牌基础属性参考'!R[3]C[6]*0.9 -> 1446.29060308294 | D19: 10 | E19: 10 | F19: 18
A20: 19 | B20: ='C:\Users\gaobin\Desktop\[数值系统.xls]卡牌基础属性参考'!R[3]C[2]*0.7 -> 406.08626155451 | C20: ='C:\Users\gaobin\Desktop\[数值系统.xls]卡牌基础属性参考'!R[3]C[6]*0.9 -> 1566.33272313883 | D20: 10 | E20: 10 | F20: 19
A21: 20 | B21: ='C:\Users\gaobin\Desktop\[数值系统.xls]卡牌基础属性参考'!R[3]C[2]*0.7 -> 439.385335001981 | C21: ='C:\Users\gaobin\Desktop\[数值系统.xls]卡牌基础属性参考'!R[3]C[6]*0.9 -> 1694.77200643621 | D21: 10 | E21: 10 | F21: 20
A22: 21 | B22: ='C:\Users\gaobin\Desktop\[数值系统.xls]卡牌基础属性参考'!R[3]C[2]*0.7 -> 474.975547137142 | C22: ='C:\Users\gaobin\Desktop\[数值系统.xls]卡牌基础属性参考'!R[3]C[6]*0.9 -> 1832.04853895755 | D22: 10 | E22: 10 | F22: 21
A23: 22 | B23: ='C:\Users\gaobin\Desktop\[数值系统.xls]卡牌基础属性参考'!R[3]C[2]*0.7 -> 512.973590908115 | C23: ='C:\Users\gaobin\Desktop\[数值系统.xls]卡牌基础属性参考'!R[3]C[6]*0.9 -> 1978.61242207416 | D23: 10 | E23: 10 | F23: 22
A24: 23 | B24: ='C:\Users\gaobin\Desktop\[数值系统.xls]卡牌基础属性参考'!R[3]C[2]*0.7 -> 553.498504589857 | C24: ='C:\Users\gaobin\Desktop\[数值系统.xls]卡牌基础属性参考'!R[3]C[6]*0.9 -> 2134.92280341802 | D24: 10 | E24: 10 | F24: 23
A25: 24 | B25: ='C:\Users\gaobin\Desktop\[数值系统.xls]卡牌基础属性参考'!R[3]C[2]*0.7 -> 596.671387947867 | C25: ='C:\Users\gaobin\Desktop\[数值系统.xls]卡牌基础属性参考'!R[3]C[6]*0.9 -> 2301.44678208463 | D25: 10 | E25: 10 | F25: 24
A26: 25 | B26: ='C:\Users\gaobin\Desktop\[数值系统.xls]卡牌基础属性参考'!R[3]C[2]*0.7 -> 642.615084819855 | C26: ='C:\Users\gaobin\Desktop\[数值系统.xls]卡牌基础属性参考'!R[3]C[6]*0.9 -> 2478.65818430515 | D26: 10 | E26: 10 | F26: 25
A27: 26 | B27: ='C:\Users\gaobin\Desktop\[数值系统.xls]卡牌基础属性参考'!R[3]C[2]*0.7 -> 691.453831266166 | C27: ='C:\Users\gaobin\Desktop\[数值系统.xls]卡牌基础属性参考'!R[3]C[6]*0.9 -> 2667.03620631235 | D27: 10 | E27: 10 | F27: 26
A28: 27 | B28: ='C:\Users\gaobin\Desktop\[数值系统.xls]卡牌基础属性参考'!R[3]C[2]*0.7 -> 743.31286861113 | C28: ='C:\Users\gaobin\Desktop\[数值系统.xls]卡牌基础属性参考'!R[3]C[6]*0.9 -> 2867.06392178579 | D28: 10 | E28: 10 | F28: 27
A29: 28 | B29: ='C:\Users\gaobin\Desktop\[数值系统.xls]卡牌基础属性参考'!R[3]C[2]*0.7 -> 798.318020888356 | C29: ='C:\Users\gaobin\Desktop\[数值系统.xls]卡牌基础属性参考'!R[3]C[6]*0.9 -> 3079.22665199794 | D29: 10 | E29: 10 | F29: 28
A30: 29 | B30: ='C:\Users\gaobin\Desktop\[数值系统.xls]卡牌基础属性参考'!R[3]C[2]*0.7 -> 856.595236413208 | C30: ='C:\Users\gaobin\Desktop\[数值系统.xls]卡牌基础属性参考'!R[3]C[6]*0.9 -> 3304.0101975938 | D30: 10 | E30: 10 | F30: 29
A31: 30 | B31: ='C:\Users\gaobin\Desktop\[数值系统.xls]卡牌基础属性参考'!R[3]C[2]*0.7 -> 918.270093434962 | C31: ='C:\Users\gaobin\Desktop\[数值系统.xls]卡牌基础属性参考'!R[3]C[6]*0.9 -> 3541.89893182057 | D31: 10 | E31: 10 | F31: 30
A32: 31 | B32: ='C:\Users\gaobin\Desktop\[数值系统.xls]卡牌基础属性参考'!R[3]C[2]*0.7 -> 983.467270068847 | C32: ='C:\Users\gaobin\Desktop\[数值系统.xls]卡牌基础属性参考'!R[3]C[6]*0.9 -> 3793.37375597984 | D32: 10 | E32: 10 | F32: 31
A33: 32 | B33: ='C:\Users\gaobin\Desktop\[数值系统.xls]卡牌基础属性参考'!R[3]C[2]*0.7 -> 1052.30997897367 | C33: ='C:\Users\gaobin\Desktop\[数值系统.xls]卡牌基础属性参考'!R[3]C[6]*0.9 -> 4058.90991889844 | D33: 10 | E33: 10 | F33: 32
A34: 33 | B34: ='C:\Users\gaobin\Desktop\[数值系统.xls]卡牌基础属性参考'!R[3]C[2]*0.7 -> 1124.91936752286 | C34: ='C:\Users\gaobin\Desktop\[数值系统.xls]卡牌基础属性参考'!R[3]C[6]*0.9 -> 4338.97470330245 | D34: 10 | E34: 10 | F34: 33
A35: 34 | B35: ='C:\Users\gaobin\Desktop\[数值系统.xls]卡牌基础属性参考'!R[3]C[2]*0.7 -> 1201.41388451442 | C35: ='C:\Users\gaobin\Desktop\[数值系统.xls]卡牌基础属性参考'!R[3]C[6]*0.9 -> 4634.02498312703 | D35: 10 | E35: 10 | F35: 34
A36: 35 | B36: ='C:\Users\gaobin\Desktop\[数值系统.xls]卡牌基础属性参考'!R[3]C[2]*0.7 -> 1281.90861477689 | C36: ='C:\Users\gaobin\Desktop\[数值系统.xls]卡牌基础属性参考'!R[3]C[6]*0.9 -> 4944.50465699656 | D36: 10 | E36: 10 | F36: 35
A37: 36 | B37: ='C:\Users\gaobin\Desktop\[数值系统.xls]卡牌基础属性参考'!R[3]C[2]*0.7 -> 1366.51458335216 | C37: ='C:\Users\gaobin\Desktop\[数值系统.xls]卡牌基础属性参考'!R[3]C[6]*0.9 -> 5270.84196435835 | D37: 10 | E37: 10 | F37: 36
A38: 37 | B38: ='C:\Users\gaobin\Desktop\[数值系统.xls]卡牌基础属性参考'!R[3]C[2]*0.7 -> 1455.33803127006 | C38: ='C:\Users\gaobin\Desktop\[数值系统.xls]卡牌基础属性参考'!R[3]C[6]*0.9 -> 5613.44669204166 | D38: 10 | E38: 10 | F38: 37
A39: 38 | B39: ='C:\Users\gaobin\Desktop\[数值系统.xls]卡牌基础属性参考'!R[3]C[2]*0.7 -> 1548.47966527135 | C39: ='C:\Users\gaobin\Desktop\[数值系统.xls]卡牌基础属性参考'!R[3]C[6]*0.9 -> 5972.70728033235 | D39: 10 | E39: 10 | F39: 38
A40: 39 | B40: ='C:\Users\gaobin\Desktop\[数值系统.xls]卡牌基础属性参考'!R[3]C[2]*0.7 -> 1646.03388418345 | C40: ='C:\Users\gaobin\Desktop\[数值系统.xls]卡牌基础属性参考'!R[3]C[6]*0.9 -> 6348.98783899332 | D40: 10 | E40: 10 | F40: 39
A41: 40 | B41: ='C:\Users\gaobin\Desktop\[数值系统.xls]卡牌基础属性参考'!R[3]C[2]*0.7 -> 1748.08798500283 | C41: ='C:\Users\gaobin\Desktop\[数值系统.xls]卡牌基础属性参考'!R[3]C[6]*0.9 -> 6742.62508501093 | D41: 10 | E41: 10 | F41: 40
A42: 41 | B42: ='C:\Users\gaobin\Desktop\[数值系统.xls]卡牌基础属性参考'!R[3]C[2]*0.7 -> 1854.72135208801 | C42: ='C:\Users\gaobin\Desktop\[数值系统.xls]卡牌基础属性参考'!R[3]C[6]*0.9 -> 7153.92521519663 | D42: 10 | E42: 10 | F42: 41
A43: 42 | B43: ='C:\Users\gaobin\Desktop\[数值系统.xls]卡牌基础属性参考'!R[3]C[2]*0.7 -> 1966.0046332133 | C43: ='C:\Users\gaobin\Desktop\[数值系统.xls]卡牌基础属性参考'!R[3]C[6]*0.9 -> 7583.16072810845 | D43: 10 | E43: 10 | F43: 42
A44: 43 | B44: ='C:\Users\gaobin\Desktop\[数值系统.xls]卡牌基础属性参考'!R[3]C[2]*0.7 -> 2081.9989065729 | C44: ='C:\Users\gaobin\Desktop\[数值系统.xls]卡牌基础属性参考'!R[3]C[6]*0.9 -> 8030.56721106689 | D44: 10 | E44: 10 | F44: 43
A45: 44 | B45: ='C:\Users\gaobin\Desktop\[数值系统.xls]卡牌基础属性参考'!R[3]C[2]*0.7 -> 2202.75484315413 | C45: ='C:\Users\gaobin\Desktop\[数值系统.xls]卡牌基础属性参考'!R[3]C[6]*0.9 -> 8496.34010930881 | D45: 10 | E45: 10 | F45: 44
A46: 45 | B46: ='C:\Users\gaobin\Desktop\[数值系统.xls]卡牌基础属性参考'!R[3]C[2]*0.7 -> 2328.31186921393 | C46: ='C:\Users\gaobin\Desktop\[数值系统.xls]卡牌基础属性参考'!R[3]C[6]*0.9 -> 8980.63149553945 | D46: 10 | E46: 10 | F46: 45
A47: 46 | B47: ='C:\Users\gaobin\Desktop\[数值系统.xls]卡牌基础属性参考'!R[3]C[2]*0.7 -> 2458.69733388992 | C47: ='C:\Users\gaobin\Desktop\[数值系统.xls]卡牌基础属性参考'!R[3]C[6]*0.9 -> 9483.5468592897 | D47: 10 | E47: 10 | F47: 46
A48: 47 | B48: ='C:\Users\gaobin\Desktop\[数值系统.xls]卡牌基础属性参考'!R[3]C[2]*0.7 -> 2593.92568725388 | C48: ='C:\Users\gaobin\Desktop\[数值系统.xls]卡牌基础属性参考'!R[3]C[6]*0.9 -> 10005.1419365507 | D48: 10 | E48: 10 | F48: 47
A49: 48 | B49: ='C:\Users\gaobin\Desktop\[数值系统.xls]卡牌基础属性参考'!R[3]C[2]*0.7 -> 2733.9976743656 | C49: ='C:\Users\gaobin\Desktop\[数值系统.xls]卡牌基础属性参考'!R[3]C[6]*0.9 -> 10545.4196011245 | D49: 10 | E49: 10 | F49: 48
A50: 49 | B50: ='C:\Users\gaobin\Desktop\[数值系统.xls]卡牌基础属性参考'!R[3]C[2]*0.7 -> 2878.899551107 | C50: ='C:\Users\gaobin\Desktop\[数值系统.xls]卡牌基础属性参考'!R[3]C[6]*0.9 -> 11104.3268399841 | D50: 10 | E50: 10 | F50: 49
A51: 50 | B51: ='C:\Users\gaobin\Desktop\[数值系统.xls]卡牌基础属性参考'!R[3]C[2]*0.7 -> 3028.60232776457 | C51: ='C:\Users\gaobin\Desktop\[数值系统.xls]卡牌基础属性参考'!R[3]C[6]*0.9 -> 11681.7518356634 | D51: 10 | E51: 10 | F51: 50