Sheet: 关卡产出表
A1: 层数 | B1: 经验 | C1: 铜板 | D1: 技能点
A2: id | B2: exp | C2: money | D2: skill_point
A3: 1 | B3: 1 | C3: 1 | D3: 10
A4: 2 | B4: =R[-1]C+1 -> 2 | C4: =R[-1]C+1 -> 2 | D4: 15
A5: 3 | B5: =R[-1]C+1 -> 3 | C5: =R[-1]C+1 -> 3 | D5: 20
A6: 4 | B6: =R[-1]C+1 -> 4 | C6: =R[-1]C+1 -> 4 | D6: 25
A7: 5 | B7: =R[-1]C+1 -> 5 | C7: =R[-1]C+1 -> 5 | D7: 60
A8: 6 | B8: =R[-1]C+1 -> 6 | C8: =R[-1]C+1 -> 6 | D8: 35
A9: 7 | B9: =R[-1]C+1 -> 7 | C9: =R[-1]C+1 -> 7 | D9: 40
A10: 8 | B10: =R[-1]C+1 -> 8 | C10: =R[-1]C+1 -> 8 | D10: 45
A11: 9 | B11: =R[-1]C+1 -> 9 | C11: =R[-1]C+1 -> 9 | D11: 50
A12: 10 | B12: =R[-1]C+1 -> 10 | C12: =R[-1]C+1 -> 10 | D12: 110
A13: 11 | B13: =R[-1]C+1 -> 11 | C13: =R[-1]C+1 -> 11 | D13: 60
A14: 12 | B14: =R[-1]C+1 -> 12 | C14: =R[-1]C+1 -> 12 | D14: 65
A15: 13 | B15: =R[-1]C+1 -> 13 | C15: =R[-1]C+1 -> 13 | D15: 70
A16: 14 | B16: =R[-1]C+1 -> 14 | C16: =R[-1]C+1 -> 14 | D16: 75
A17: 15 | B17: =R[-1]C+1 -> 15 | C17: =R[-1]C+1 -> 15 | D17: 160
A18: 16 | B18: =R[-1]C+1 -> 16 | C18: =R[-1]C+1 -> 16 | D18: 85
A19: 17 | B19: =R[-1]C+1 -> 17 | C19: =R[-1]C+1 -> 17 | D19: 90
A20: 18 | B20: =R[-1]C+1 -> 18 | C20: =R[-1]C+1 -> 18 | D20: 95
A21: 19 | B21: =R[-1]C+1 -> 19 | C21: =R[-1]C+1 -> 19 | D21: 100
A22: 20 | B22: =R[-1]C+1 -> 20 | C22: =R[-1]C+1 -> 20 | D22: 210
A23: 21 | B23: =R[-1]C+1 -> 21 | C23: =R[-1]C+1 -> 21 | D23: 110
A24: 22 | B24: =R[-1]C+1 -> 22 | C24: =R[-1]C+1 -> 22 | D24: 115
A25: 23 | B25: =R[-1]C+1 -> 23 | C25: =R[-1]C+1 -> 23 | D25: 120
A26: 24 | B26: =R[-1]C+1 -> 24 | C26: =R[-1]C+1 -> 24 | D26: 125
A27: 25 | B27: =R[-1]C+1 -> 25 | C27: =R[-1]C+1 -> 25 | D27: 260
A28: 26 | B28: =R[-1]C+1 -> 26 | C28: =R[-1]C+1 -> 26 | D28: 135
A29: 27 | B29: =R[-1]C+1 -> 27 | C29: =R[-1]C+1 -> 27 | D29: 140
A30: 28 | B30: =R[-1]C+1 -> 28 | C30: =R[-1]C+1 -> 28 | D30: 145
A31: 29 | B31: =R[-1]C+1 -> 29 | C31: =R[-1]C+1 -> 29 | D31: 150
A32: 30 | B32: =R[-1]C+1 -> 30 | C32: =R[-1]C+1 -> 30 | D32: 310
A33: 31 | B33: =R[-1]C+1 -> 31 | C33: =R[-1]C+1 -> 31 | D33: 160
A34: 32 | B34: =R[-1]C+1 -> 32 | C34: =R[-1]C+1 -> 32 | D34: 165
A35: 33 | B35: =R[-1]C+1 -> 33 | C35: =R[-1]C+1 -> 33 | D35: 170
A36: 34 | B36: =R[-1]C+1 -> 34 | C36: =R[-1]C+1 -> 34 | D36: 175
A37: 35 | B37: =R[-1]C+1 -> 35 | C37: =R[-1]C+1 -> 35 | D37: 360
A38: 36 | B38: =R[-1]C+1 -> 36 | C38: =R[-1]C+1 -> 36 | D38: 185
A39: 37 | B39: =R[-1]C+1 -> 37 | C39: =R[-1]C+1 -> 37 | D39: 190
A40: 38 | B40: =R[-1]C+1 -> 38 | C40: =R[-1]C+1 -> 38 | D40: 195
A41: 39 | B41: =R[-1]C+1 -> 39 | C41: =R[-1]C+1 -> 39 | D41: 200
A42: 40 | B42: =R[-1]C+1 -> 40 | C42: =R[-1]C+1 -> 40 | D42: 410
A43: 41 | B43: =R[-1]C+1 -> 41 | C43: =R[-1]C+1 -> 41 | D43: 210
A44: 42 | B44: =R[-1]C+1 -> 42 | C44: =R[-1]C+1 -> 42 | D44: 215
A45: 43 | B45: =R[-1]C+1 -> 43 | C45: =R[-1]C+1 -> 43 | D45: 220
A46: 44 | B46: =R[-1]C+1 -> 44 | C46: =R[-1]C+1 -> 44 | D46: 225
A47: 45 | B47: =R[-1]C+1 -> 45 | C47: =R[-1]C+1 -> 45 | D47: 460
A48: 46 | B48: =R[-1]C+1 -> 46 | C48: =R[-1]C+1 -> 46 | D48: 235
A49: 47 | B49: =R[-1]C+1 -> 47 | C49: =R[-1]C+1 -> 47 | D49: 240
A50: 48 | B50: =R[-1]C+1 -> 48 | C50: =R[-1]C+1 -> 48 | D50: 245
A51: 49 | B51: =R[-1]C+1 -> 49 | C51: =R[-1]C+1 -> 49 | D51: 250
A52: 50 | B52: =R[-1]C+1 -> 50 | C52: =R[-1]C+1 -> 50 | D52: 510
A53: 51 | B53: =R[-1]C+1 -> 51 | C53: =R[-1]C+1 -> 51 | D53: 260
A54: 52 | B54: =R[-1]C+1 -> 52 | C54: =R[-1]C+1 -> 52 | D54: 265
A55: 53 | B55: =R[-1]C+1 -> 53 | C55: =R[-1]C+1 -> 53 | D55: 270
A56: 54 | B56: =R[-1]C+1 -> 54 | C56: =R[-1]C+1 -> 54 | D56: 275
A57: 55 | B57: =R[-1]C+1 -> 55 | C57: =R[-1]C+1 -> 55 | D57: 560
A58: 56 | B58: =R[-1]C+1 -> 56 | C58: =R[-1]C+1 -> 56 | D58: 285
A59: 57 | B59: =R[-1]C+1 -> 57 | C59: =R[-1]C+1 -> 57 | D59: 290
A60: 58 | B60: =R[-1]C+1 -> 58 | C60: =R[-1]C+1 -> 58 | D60: 295
A61: 59 | B61: =R[-1]C+1 -> 59 | C61: =R[-1]C+1 -> 59 | D61: 300
A62: 60 | B62: =R[-1]C+1 -> 60 | C62: =R[-1]C+1 -> 60 | D62: 610
A63: 61 | B63: =R[-1]C+1 -> 61 | C63: =R[-1]C+1 -> 61 | D63: 310
A64: 62 | B64: =R[-1]C+1 -> 62 | C64: =R[-1]C+1 -> 62 | D64: 315
A65: 63 | B65: =R[-1]C+1 -> 63 | C65: =R[-1]C+1 -> 63 | D65: 320
A66: 64 | B66: =R[-1]C+1 -> 64 | C66: =R[-1]C+1 -> 64 | D66: 325
A67: 65 | B67: =R[-1]C+1 -> 65 | C67: =R[-1]C+1 -> 65 | D67: 660
A68: 66 | B68: =R[-1]C+1 -> 66 | C68: =R[-1]C+1 -> 66 | D68: 335
A69: 67 | B69: =R[-1]C+1 -> 67 | C69: =R[-1]C+1 -> 67 | D69: 340
A70: 68 | B70: =R[-1]C+1 -> 68 | C70: =R[-1]C+1 -> 68 | D70: 345
A71: 69 | B71: =R[-1]C+1 -> 69 | C71: =R[-1]C+1 -> 69 | D71: 350
A72: 70 | B72: =R[-1]C+1 -> 70 | C72: =R[-1]C+1 -> 70 | D72: 710
A73: 71 | B73: =R[-1]C+1 -> 71 | C73: =R[-1]C+1 -> 71 | D73: 360
A74: 72 | B74: =R[-1]C+1 -> 72 | C74: =R[-1]C+1 -> 72 | D74: 365
A75: 73 | B75: =R[-1]C+1 -> 73 | C75: =R[-1]C+1 -> 73 | D75: 370
A76: 74 | B76: =R[-1]C+1 -> 74 | C76: =R[-1]C+1 -> 74 | D76: 375
A77: 75 | B77: =R[-1]C+1 -> 75 | C77: =R[-1]C+1 -> 75 | D77: 760
A78: 76 | B78: =R[-1]C+1 -> 76 | C78: =R[-1]C+1 -> 76 | D78: 385
A79: 77 | B79: =R[-1]C+1 -> 77 | C79: =R[-1]C+1 -> 77 | D79: 390
A80: 78 | B80: =R[-1]C+1 -> 78 | C80: =R[-1]C+1 -> 78 | D80: 395
A81: 79 | B81: =R[-1]C+1 -> 79 | C81: =R[-1]C+1 -> 79 | D81: 400
A82: 80 | B82: =R[-1]C+1 -> 80 | C82: =R[-1]C+1 -> 80 | D82: 810
A83: 81 | B83: =R[-1]C+1 -> 81 | C83: =R[-1]C+1 -> 81 | D83: 410
A84: 82 | B84: =R[-1]C+1 -> 82 | C84: =R[-1]C+1 -> 82 | D84: 415
A85: 83 | B85: =R[-1]C+1 -> 83 | C85: =R[-1]C+1 -> 83 | D85: 420
A86: 84 | B86: =R[-1]C+1 -> 84 | C86: =R[-1]C+1 -> 84 | D86: 425
A87: 85 | B87: =R[-1]C+1 -> 85 | C87: =R[-1]C+1 -> 85 | D87: 860
A88: 86 | B88: =R[-1]C+1 -> 86 | C88: =R[-1]C+1 -> 86 | D88: 435
A89: 87 | B89: =R[-1]C+1 -> 87 | C89: =R[-1]C+1 -> 87 | D89: 440
A90: 88 | B90: =R[-1]C+1 -> 88 | C90: =R[-1]C+1 -> 88 | D90: 445
A91: 89 | B91: =R[-1]C+1 -> 89 | C91: =R[-1]C+1 -> 89 | D91: 450
A92: 90 | B92: =R[-1]C+1 -> 90 | C92: =R[-1]C+1 -> 90 | D92: 910
A93: 91 | B93: =R[-1]C+1 -> 91 | C93: =R[-1]C+1 -> 91 | D93: 460
A94: 92 | B94: =R[-1]C+1 -> 92 | C94: =R[-1]C+1 -> 92 | D94: 465
A95: 93 | B95: =R[-1]C+1 -> 93 | C95: =R[-1]C+1 -> 93 | D95: 470
A96: 94 | B96: =R[-1]C+1 -> 94 | C96: =R[-1]C+1 -> 94 | D96: 475
A97: 95 | B97: =R[-1]C+1 -> 95 | C97: =R[-1]C+1 -> 95 | D97: 960
A98: 96 | B98: =R[-1]C+1 -> 96 | C98: =R[-1]C+1 -> 96 | D98: 485
A99: 97 | B99: =R[-1]C+1 -> 97 | C99: =R[-1]C+1 -> 97 | D99: 490
A100: 98 | B100: =R[-1]C+1 -> 98 | C100: =R[-1]C+1 -> 98 | D100: 495
A101: 99 | B101: =R[-1]C+1 -> 99 | C101: =R[-1]C+1 -> 99 | D101: 500
A102: 100 | B102: =R[-1]C+1 -> 100 | C102: =R[-1]C+1 -> 100 | D102: 1010

Sheet: export
A1: sheet_name | B1: export_name | C1: merge_to
A2: 关卡产出表 | B2: pass_reward