Sheet: 玩家升级经验表
A1: 级别 | B1: 升到下一级所需经验 | C1: 铜板 | D1: 仙丹 | E1: 技能点 | F1: 活力值 | G1: 体力点
A2: id | B2: exp | C2: money | D2: elixir | E2: skillPoint | F2: energy | G2: power
A3: 1 | B3: 40 | C3: 10000 | D3: 0 | E3: 0 | F3: 0 | G3: 10
A4: 2 | B4: 44 | C4: =R[-1]C+500 -> 10500 | D4: 0 | E4: 0 | F4: 0 | G4: 10
A5: 3 | B5: =ROUND(R[-1]C*1.106,0) -> 49 | C5: =R[-1]C+500 -> 11000 | D5: 0 | E5: 0 | F5: 0 | G5: 10
A6: 4 | B6: =ROUND(R[-1]C*1.106,0) -> 54 | C6: =R[-1]C+500 -> 11500 | D6: 0 | E6: 0 | F6: 0 | G6: 10
A7: 5 | B7: =ROUND(R[-1]C*1.106,0) -> 60 | C7: =R[-1]C+500 -> 12000 | D7: 0 | E7: 0 | F7: 0 | G7: 10
A8: 6 | B8: =ROUND(R[-1]C*1.106,0) -> 66 | C8: =R[-1]C+500 -> 12500 | D8: 0 | E8: 0 | F8: 0 | G8: 10
A9: 7 | B9: =ROUND(R[-1]C*1.106,0) -> 73 | C9: =R[-1]C+500 -> 13000 | D9: 0 | E9: 0 | F9: 0 | G9: 10
A10: 8 | B10: =ROUND(R[-1]C*1.106,0) -> 81 | C10: =R[-1]C+500 -> 13500 | D10: 0 | E10: 0 | F10: 0 | G10: 10
A11: 9 | B11: =ROUND(R[-1]C*1.106,0) -> 90 | C11: =R[-1]C+500 -> 14000 | D11: 0 | E11: 0 | F11: 0 | G11: 10
A12: 10 | B12: =ROUND(R[-1]C*1.106,0) -> 100 | C12: =R[-1]C+500 -> 14500 | D12: 1000 | E12: 0 | F12: 0 | G12: 20
A13: 11 | B13: =ROUND(R[-1]C*1.115,0) -> 112 | C13: =R[-1]C+500 -> 15000 | D13: =R[-1]C+20 -> 1020 | E13: 0 | F13: 0 | G13: 20
A14: 12 | B14: =ROUND(R[-1]C*1.115,0) -> 125 | C14: =R[-1]C+500 -> 15500 | D14: =R[-1]C+20 -> 1040 | E14: 0 | F14: 0 | G14: 20
A15: 13 | B15: =ROUND(R[-1]C*1.115,0) -> 139 | C15: =R[-1]C+500 -> 16000 | D15: =R[-1]C+20 -> 1060 | E15: 0 | F15: 0 | G15: 20
A16: 14 | B16: =ROUND(R[-1]C*1.115,0) -> 155 | C16: =R[-1]C+500 -> 16500 | D16: =R[-1]C+20 -> 1080 | E16: 0 | F16: 0 | G16: 20
A17: 15 | B17: =ROUND(R[-1]C*1.115,0) -> 173 | C17: =R[-1]C+500 -> 17000 | D17: =R[-1]C+20 -> 1100 | E17: 0 | F17: 0 | G17: 20
A18: 16 | B18: =ROUND(R[-1]C*1.115,0) -> 193 | C18: =R[-1]C+500 -> 17500 | D18: =R[-1]C+20 -> 1120 | E18: 0 | F18: 0 | G18: 20
A19: 17 | B19: =ROUND(R[-1]C*1.115,0) -> 215 | C19: =R[-1]C+500 -> 18000 | D19: =R[-1]C+20 -> 1140 | E19: 0 | F19: 0 | G19: 20
A20: 18 | B20: =ROUND(R[-1]C*1.115,0) -> 240 | C20: =R[-1]C+500 -> 18500 | D20: =R[-1]C+20 -> 1160 | E20: 0 | F20: 0 | G20: 20
A21: 19 | B21: =ROUND(R[-1]C*1.115,0) -> 268 | C21: =R[-1]C+500 -> 19000 | D21: =R[-1]C+20 -> 1180 | E21: 0 | F21: 0 | G21: 20
A22: 20 | B22: =ROUND(R[-1]C*1.115,0) -> 299 | C22: =R[-1]C+500 -> 19500 | D22: =R[-1]C+20 -> 1200 | E22: 800 | F22: 0 | G22: 30
A23: 21 | B23: =ROUND(R[-1]C*1.115,0) -> 333 | C23: =R[-1]C+500 -> 20000 | D23: =R[-1]C+20 -> 1220 | E23: =R[-1]C+10 -> 810 | F23: 0 | G23: 30
A24: 22 | B24: =ROUND(R[-1]C*1.115,0) -> 371 | C24: =R[-1]C+500 -> 20500 | D24: =R[-1]C+20 -> 1240 | E24: =R[-1]C+10 -> 820 | F24: 0 | G24: 30
A25: 23 | B25: =ROUND(R[-1]C*1.115,0) -> 414 | C25: =R[-1]C+500 -> 21000 | D25: =R[-1]C+20 -> 1260 | E25: =R[-1]C+10 -> 830 | F25: 0 | G25: 30
A26: 24 | B26: =ROUND(R[-1]C*1.115,0) -> 462 | C26: =R[-1]C+500 -> 21500 | D26: =R[-1]C+20 -> 1280 | E26: =R[-1]C+10 -> 840 | F26: 0 | G26: 30
A27: 25 | B27: =ROUND(R[-1]C*1.115,0) -> 515 | C27: =R[-1]C+500 -> 22000 | D27: =R[-1]C+20 -> 1300 | E27: =R[-1]C+10 -> 850 | F27: 0 | G27: 30
A28: 26 | B28: =ROUND(R[-1]C*1.115,0) -> 574 | C28: =R[-1]C+500 -> 22500 | D28: =R[-1]C+20 -> 1320 | E28: =R[-1]C+10 -> 860 | F28: 0 | G28: 30
A29: 27 | B29: =ROUND(R[-1]C*1.115,0) -> 640 | C29: =R[-1]C+500 -> 23000 | D29: =R[-1]C+20 -> 1340 | E29: =R[-1]C+10 -> 870 | F29: 0 | G29: 30
A30: 28 | B30: =ROUND(R[-1]C*1.115,0) -> 714 | C30: =R[-1]C+500 -> 23500 | D30: =R[-1]C+20 -> 1360 | E30: =R[-1]C+10 -> 880 | F30: 0 | G30: 30
A31: 29 | B31: =ROUND(R[-1]C*1.115,0) -> 796 | C31: =R[-1]C+500 -> 24000 | D31: =R[-1]C+20 -> 1380 | E31: =R[-1]C+10 -> 890 | F31: 0 | G31: 30
A32: 30 | B32: =ROUND(R[-1]C*1.115,0) -> 888 | C32: =R[-1]C+500 -> 24500 | D32: =R[-1]C+20 -> 1400 | E32: =R[-1]C+10 -> 900 | F32: 100 | G32: 40
A33: 31 | B33: =ROUND(R[-1]C*1.115,0) -> 990 | C33: =R[-1]C+500 -> 25000 | D33: =R[-1]C+20 -> 1420 | E33: =R[-1]C+10 -> 910 | F33: =R[-1]C+5 -> 105 | G33: 40
A34: 32 | B34: =ROUND(R[-1]C*1.115,0) -> 1104 | C34: =R[-1]C+500 -> 25500 | D34: =R[-1]C+20 -> 1440 | E34: =R[-1]C+10 -> 920 | F34: =R[-1]C+5 -> 110 | G34: 40
A35: 33 | B35: =ROUND(R[-1]C*1.115,0) -> 1231 | C35: =R[-1]C+500 -> 26000 | D35: =R[-1]C+20 -> 1460 | E35: =R[-1]C+10 -> 930 | F35: =R[-1]C+5 -> 115 | G35: 40
A36: 34 | B36: =ROUND(R[-1]C*1.115,0) -> 1373 | C36: =R[-1]C+500 -> 26500 | D36: =R[-1]C+20 -> 1480 | E36: =R[-1]C+10 -> 940 | F36: =R[-1]C+5 -> 120 | G36: 40
A37: 35 | B37: =ROUND(R[-1]C*1.115,0) -> 1531 | C37: =R[-1]C+500 -> 27000 | D37: =R[-1]C+20 -> 1500 | E37: =R[-1]C+10 -> 950 | F37: =R[-1]C+5 -> 125 | G37: 40
A38: 36 | B38: =ROUND(R[-1]C*1.115,0) -> 1707 | C38: =R[-1]C+500 -> 27500 | D38: =R[-1]C+20 -> 1520 | E38: =R[-1]C+10 -> 960 | F38: =R[-1]C+5 -> 130 | G38: 40
A39: 37 | B39: =ROUND(R[-1]C*1.115,0) -> 1903 | C39: =R[-1]C+500 -> 28000 | D39: =R[-1]C+20 -> 1540 | E39: =R[-1]C+10 -> 970 | F39: =R[-1]C+5 -> 135 | G39: 40
A40: 38 | B40: =ROUND(R[-1]C*1.115,0) -> 2122 | C40: =R[-1]C+500 -> 28500 | D40: =R[-1]C+20 -> 1560 | E40: =R[-1]C+10 -> 980 | F40: =R[-1]C+5 -> 140 | G40: 40
A41: 39 | B41: =ROUND(R[-1]C*1.115,0) -> 2366 | C41: =R[-1]C+500 -> 29000 | D41: =R[-1]C+20 -> 1580 | E41: =R[-1]C+10 -> 990 | F41: =R[-1]C+5 -> 145 | G41: 40
A42: 40 | B42: =ROUND(R[-1]C*1.115,0) -> 2638 | C42: =R[-1]C+500 -> 29500 | D42: =R[-1]C+20 -> 1600 | E42: =R[-1]C+10 -> 1000 | F42: =R[-1]C+5 -> 150 | G42: 50
A43: 41 | B43: =ROUND(R[-1]C*1.115,0) -> 2941 | C43: =R[-1]C+500 -> 30000 | D43: =R[-1]C+20 -> 1620 | E43: =R[-1]C+10 -> 1010 | F43: =R[-1]C+5 -> 155 | G43: 50
A44: 42 | B44: =ROUND(R[-1]C*1.115,0) -> 3279 | C44: =R[-1]C+500 -> 30500 | D44: =R[-1]C+20 -> 1640 | E44: =R[-1]C+10 -> 1020 | F44: =R[-1]C+5 -> 160 | G44: 50
A45: 43 | B45: =ROUND(R[-1]C*1.115,0) -> 3656 | C45: =R[-1]C+500 -> 31000 | D45: =R[-1]C+20 -> 1660 | E45: =R[-1]C+10 -> 1030 | F45: =R[-1]C+5 -> 165 | G45: 50
A46: 44 | B46: =ROUND(R[-1]C*1.115,0) -> 4076 | C46: =R[-1]C+500 -> 31500 | D46: =R[-1]C+20 -> 1680 | E46: =R[-1]C+10 -> 1040 | F46: =R[-1]C+5 -> 170 | G46: 50
A47: 45 | B47: =ROUND(R[-1]C*1.115,0) -> 4545 | C47: =R[-1]C+500 -> 32000 | D47: =R[-1]C+20 -> 1700 | E47: =R[-1]C+10 -> 1050 | F47: =R[-1]C+5 -> 175 | G47: 50
A48: 46 | B48: =ROUND(R[-1]C*1.115,0) -> 5068 | C48: =R[-1]C+500 -> 32500 | D48: =R[-1]C+20 -> 1720 | E48: =R[-1]C+10 -> 1060 | F48: =R[-1]C+5 -> 180 | G48: 50
A49: 47 | B49: =ROUND(R[-1]C*1.115,0) -> 5651 | C49: =R[-1]C+500 -> 33000 | D49: =R[-1]C+20 -> 1740 | E49: =R[-1]C+10 -> 1070 | F49: =R[-1]C+5 -> 185 | G49: 50
A50: 48 | B50: =ROUND(R[-1]C*1.115,0) -> 6301 | C50: =R[-1]C+500 -> 33500 | D50: =R[-1]C+20 -> 1760 | E50: =R[-1]C+10 -> 1080 | F50: =R[-1]C+5 -> 190 | G50: 50
A51: 49 | B51: =ROUND(R[-1]C*1.115,0) -> 7026 | C51: =R[-1]C+500 -> 34000 | D51: =R[-1]C+20 -> 1780 | E51: =R[-1]C+10 -> 1090 | F51: =R[-1]C+5 -> 195 | G51: 50
A52: 50 | B52: =ROUND(R[-1]C*1.115,0) -> 7834 | C52: =R[-1]C+500 -> 34500 | D52: =R[-1]C+20 -> 1800 | E52: =R[-1]C+10 -> 1100 | F52: =R[-1]C+5 -> 200 | G52: 60
A53: 51 | B53: =ROUND(R[-1]C*1.115,0) -> 8735 | C53: =R[-1]C+500 -> 35000 | D53: =R[-1]C+20 -> 1820 | E53: =R[-1]C+10 -> 1110 | F53: =R[-1]C+5 -> 205 | G53: 60
A54: 52 | B54: =ROUND(R[-1]C*1.115,0) -> 9740 | C54: =R[-1]C+500 -> 35500 | D54: =R[-1]C+20 -> 1840 | E54: =R[-1]C+10 -> 1120 | F54: =R[-1]C+5 -> 210 | G54: 60
A55: 53 | B55: =ROUND(R[-1]C*1.115,0) -> 10860 | C55: =R[-1]C+500 -> 36000 | D55: =R[-1]C+20 -> 1860 | E55: =R[-1]C+10 -> 1130 | F55: =R[-1]C+5 -> 215 | G55: 60
A56: 54 | B56: =ROUND(R[-1]C*1.115,0) -> 12109 | C56: =R[-1]C+500 -> 36500 | D56: =R[-1]C+20 -> 1880 | E56: =R[-1]C+10 -> 1140 | F56: =R[-1]C+5 -> 220 | G56: 60
A57: 55 | B57: =ROUND(R[-1]C*1.115,0) -> 13502 | C57: =R[-1]C+500 -> 37000 | D57: =R[-1]C+20 -> 1900 | E57: =R[-1]C+10 -> 1150 | F57: =R[-1]C+5 -> 225 | G57: 60
A58: 56 | B58: =ROUND(R[-1]C*1.115,0) -> 15055 | C58: =R[-1]C+500 -> 37500 | D58: =R[-1]C+20 -> 1920 | E58: =R[-1]C+10 -> 1160 | F58: =R[-1]C+5 -> 230 | G58: 60
A59: 57 | B59: =ROUND(R[-1]C*1.115,0) -> 16786 | C59: =R[-1]C+500 -> 38000 | D59: =R[-1]C+20 -> 1940 | E59: =R[-1]C+10 -> 1170 | F59: =R[-1]C+5 -> 235 | G59: 60
A60: 58 | B60: =ROUND(R[-1]C*1.115,0) -> 18716 | C60: =R[-1]C+500 -> 38500 | D60: =R[-1]C+20 -> 1960 | E60: =R[-1]C+10 -> 1180 | F60: =R[-1]C+5 -> 240 | G60: 60
A61: 59 | B61: =ROUND(R[-1]C*1.115,0) -> 20868 | C61: =R[-1]C+500 -> 39000 | D61: =R[-1]C+20 -> 1980 | E61: =R[-1]C+10 -> 1190 | F61: =R[-1]C+5 -> 245 | G61: 60
A62: 60 | B62: =ROUND(R[-1]C*1.115,0) -> 23268 | C62: =R[-1]C+500 -> 39500 | D62: =R[-1]C+20 -> 2000 | E62: =R[-1]C+10 -> 1200 | F62: =R[-1]C+5 -> 250 | G62: 70
A63: 61 | B63: =ROUND(R[-1]C*1.115,0) -> 25944 | C63: =R[-1]C+500 -> 40000 | D63: =R[-1]C+20 -> 2020 | E63: =R[-1]C+10 -> 1210 | F63: =R[-1]C+5 -> 255 | G63: 70
A64: 62 | B64: =ROUND(R[-1]C*1.115,0) -> 28928 | C64: =R[-1]C+500 -> 40500 | D64: =R[-1]C+20 -> 2040 | E64: =R[-1]C+10 -> 1220 | F64: =R[-1]C+5 -> 260 | G64: 70
A65: 63 | B65: =ROUND(R[-1]C*1.115,0) -> 32255 | C65: =R[-1]C+500 -> 41000 | D65: =R[-1]C+20 -> 2060 | E65: =R[-1]C+10 -> 1230 | F65: =R[-1]C+5 -> 265 | G65: 70
A66: 64 | B66: =ROUND(R[-1]C*1.115,0) -> 35964 | C66: =R[-1]C+500 -> 41500 | D66: =R[-1]C+20 -> 2080 | E66: =R[-1]C+10 -> 1240 | F66: =R[-1]C+5 -> 270 | G66: 70
A67: 65 | B67: =ROUND(R[-1]C*1.115,0) -> 40100 | C67: =R[-1]C+500 -> 42000 | D67: =R[-1]C+20 -> 2100 | E67: =R[-1]C+10 -> 1250 | F67: =R[-1]C+5 -> 275 | G67: 70
A68: 66 | B68: =ROUND(R[-1]C*1.115,0) -> 44712 | C68: =R[-1]C+500 -> 42500 | D68: =R[-1]C+20 -> 2120 | E68: =R[-1]C+10 -> 1260 | F68: =R[-1]C+5 -> 280 | G68: 70
A69: 67 | B69: =ROUND(R[-1]C*1.115,0) -> 49854 | C69: =R[-1]C+500 -> 43000 | D69: =R[-1]C+20 -> 2140 | E69: =R[-1]C+10 -> 1270 | F69: =R[-1]C+5 -> 285 | G69: 70
A70: 68 | B70: =ROUND(R[-1]C*1.115,0) -> 55587 | C70: =R[-1]C+500 -> 43500 | D70: =R[-1]C+20 -> 2160 | E70: =R[-1]C+10 -> 1280 | F70: =R[-1]C+5 -> 290 | G70: 70
A71: 69 | B71: =ROUND(R[-1]C*1.115,0) -> 61980 | C71: =R[-1]C+500 -> 44000 | D71: =R[-1]C+20 -> 2180 | E71: =R[-1]C+10 -> 1290 | F71: =R[-1]C+5 -> 295 | G71: 70
A72: 70 | B72: =ROUND(R[-1]C*1.115,0) -> 69108 | C72: =R[-1]C+500 -> 44500 | D72: =R[-1]C+20 -> 2200 | E72: =R[-1]C+10 -> 1300 | F72: =R[-1]C+5 -> 300 | G72: 80
A73: 71 | B73: =ROUND(R[-1]C*1.115,0) -> 77055 | C73: =R[-1]C+500 -> 45000 | D73: =R[-1]C+20 -> 2220 | E73: =R[-1]C+10 -> 1310 | F73: =R[-1]C+5 -> 305 | G73: 80
A74: 72 | B74: =ROUND(R[-1]C*1.115,0) -> 85916 | C74: =R[-1]C+500 -> 45500 | D74: =R[-1]C+20 -> 2240 | E74: =R[-1]C+10 -> 1320 | F74: =R[-1]C+5 -> 310 | G74: 80
A75: 73 | B75: =ROUND(R[-1]C*1.115,0) -> 95796 | C75: =R[-1]C+500 -> 46000 | D75: =R[-1]C+20 -> 2260 | E75: =R[-1]C+10 -> 1330 | F75: =R[-1]C+5 -> 315 | G75: 80
A76: 74 | B76: =ROUND(R[-1]C*1.115,0) -> 106813 | C76: =R[-1]C+500 -> 46500 | D76: =R[-1]C+20 -> 2280 | E76: =R[-1]C+10 -> 1340 | F76: =R[-1]C+5 -> 320 | G76: 80
A77: 75 | B77: =ROUND(R[-1]C*1.115,0) -> 119096 | C77: =R[-1]C+500 -> 47000 | D77: =R[-1]C+20 -> 2300 | E77: =R[-1]C+10 -> 1350 | F77: =R[-1]C+5 -> 325 | G77: 80
A78: 76 | B78: =ROUND(R[-1]C*1.115,0) -> 132792 | C78: =R[-1]C+500 -> 47500 | D78: =R[-1]C+20 -> 2320 | E78: =R[-1]C+10 -> 1360 | F78: =R[-1]C+5 -> 330 | G78: 80
A79: 77 | B79: =ROUND(R[-1]C*1.115,0) -> 148063 | C79: =R[-1]C+500 -> 48000 | D79: =R[-1]C+20 -> 2340 | E79: =R[-1]C+10 -> 1370 | F79: =R[-1]C+5 -> 335 | G79: 80
A80: 78 | B80: =ROUND(R[-1]C*1.115,0) -> 165090 | C80: =R[-1]C+500 -> 48500 | D80: =R[-1]C+20 -> 2360 | E80: =R[-1]C+10 -> 1380 | F80: =R[-1]C+5 -> 340 | G80: 80
A81: 79 | B81: =ROUND(R[-1]C*1.115,0) -> 184075 | C81: =R[-1]C+500 -> 49000 | D81: =R[-1]C+20 -> 2380 | E81: =R[-1]C+10 -> 1390 | F81: =R[-1]C+5 -> 345 | G81: 80
A82: 80 | B82: =ROUND(R[-1]C*1.115,0) -> 205244 | C82: =R[-1]C+500 -> 49500 | D82: =R[-1]C+20 -> 2400 | E82: =R[-1]C+10 -> 1400 | F82: =R[-1]C+5 -> 350 | G82: 80
A83: 81 | B83: =ROUND(R[-1]C*1.115,0) -> 228847 | C83: =R[-1]C+500 -> 50000 | D83: =R[-1]C+20 -> 2420 | E83: =R[-1]C+10 -> 1410 | F83: =R[-1]C+5 -> 355 | G83: 90
A84: 82 | B84: =ROUND(R[-1]C*1.115,0) -> 255164 | C84: =R[-1]C+500 -> 50500 | D84: =R[-1]C+20 -> 2440 | E84: =R[-1]C+10 -> 1420 | F84: =R[-1]C+5 -> 360 | G84: 90
A85: 83 | B85: =ROUND(R[-1]C*1.115,0) -> 284508 | C85: =R[-1]C+500 -> 51000 | D85: =R[-1]C+20 -> 2460 | E85: =R[-1]C+10 -> 1430 | F85: =R[-1]C+5 -> 365 | G85: 90
A86: 84 | B86: =ROUND(R[-1]C*1.115,0) -> 317226 | C86: =R[-1]C+500 -> 51500 | D86: =R[-1]C+20 -> 2480 | E86: =R[-1]C+10 -> 1440 | F86: =R[-1]C+5 -> 370 | G86: 90
A87: 85 | B87: =ROUND(R[-1]C*1.115,0) -> 353707 | C87: =R[-1]C+500 -> 52000 | D87: =R[-1]C+20 -> 2500 | E87: =R[-1]C+10 -> 1450 | F87: =R[-1]C+5 -> 375 | G87: 90
A88: 86 | B88: =ROUND(R[-1]C*1.115,0) -> 394383 | C88: =R[-1]C+500 -> 52500 | D88: =R[-1]C+20 -> 2520 | E88: =R[-1]C+10 -> 1460 | F88: =R[-1]C+5 -> 380 | G88: 90
A89: 87 | B89: =ROUND(R[-1]C*1.115,0) -> 439737 | C89: =R[-1]C+500 -> 53000 | D89: =R[-1]C+20 -> 2540 | E89: =R[-1]C+10 -> 1470 | F89: =R[-1]C+5 -> 385 | G89: 90
A90: 88 | B90: =ROUND(R[-1]C*1.115,0) -> 490307 | C90: =R[-1]C+500 -> 53500 | D90: =R[-1]C+20 -> 2560 | E90: =R[-1]C+10 -> 1480 | F90: =R[-1]C+5 -> 390 | G90: 90
A91: 89 | B91: =ROUND(R[-1]C*1.115,0) -> 546692 | C91: =R[-1]C+500 -> 54000 | D91: =R[-1]C+20 -> 2580 | E91: =R[-1]C+10 -> 1490 | F91: =R[-1]C+5 -> 395 | G91: 90
A92: 90 | B92: =ROUND(R[-1]C*1.115,0) -> 609562 | C92: =R[-1]C+500 -> 54500 | D92: =R[-1]C+20 -> 2600 | E92: =R[-1]C+10 -> 1500 | F92: =R[-1]C+5 -> 400 | G92: 100
A93: 91 | B93: =ROUND(R[-1]C*1.115,0) -> 679662 | C93: =R[-1]C+500 -> 55000 | D93: =R[-1]C+20 -> 2620 | E93: =R[-1]C+10 -> 1510 | F93: =R[-1]C+5 -> 405 | G93: 100
A94: 92 | B94: =ROUND(R[-1]C*1.115,0) -> 757823 | C94: =R[-1]C+500 -> 55500 | D94: =R[-1]C+20 -> 2640 | E94: =R[-1]C+10 -> 1520 | F94: =R[-1]C+5 -> 410 | G94: 100
A95: 93 | B95: =ROUND(R[-1]C*1.115,0) -> 844973 | C95: =R[-1]C+500 -> 56000 | D95: =R[-1]C+20 -> 2660 | E95: =R[-1]C+10 -> 1530 | F95: =R[-1]C+5 -> 415 | G95: 100
A96: 94 | B96: =ROUND(R[-1]C*1.115,0) -> 942145 | C96: =R[-1]C+500 -> 56500 | D96: =R[-1]C+20 -> 2680 | E96: =R[-1]C+10 -> 1540 | F96: =R[-1]C+5 -> 420 | G96: 100
A97: 95 | B97: =ROUND(R[-1]C*1.115,0) -> 1050492 | C97: =R[-1]C+500 -> 57000 | D97: =R[-1]C+20 -> 2700 | E97: =R[-1]C+10 -> 1550 | F97: =R[-1]C+5 -> 425 | G97: 100
A98: 96 | B98: =ROUND(R[-1]C*1.115,0) -> 1171299 | C98: =R[-1]C+500 -> 57500 | D98: =R[-1]C+20 -> 2720 | E98: =R[-1]C+10 -> 1560 | F98: =R[-1]C+5 -> 430 | G98: 100
A99: 97 | B99: =ROUND(R[-1]C*1.115,0) -> 1305998 | C99: =R[-1]C+500 -> 58000 | D99: =R[-1]C+20 -> 2740 | E99: =R[-1]C+10 -> 1570 | F99: =R[-1]C+5 -> 435 | G99: 100
A100: 98 | B100: =ROUND(R[-1]C*1.115,0) -> 1456188 | C100: =R[-1]C+500 -> 58500 | D100: =R[-1]C+20 -> 2760 | E100: =R[-1]C+10 -> 1580 | F100: =R[-1]C+5 -> 440 | G100: 100
A101: 99 | B101: =ROUND(R[-1]C*1.115,0) -> 1623650 | C101: =R[-1]C+500 -> 59000 | D101: =R[-1]C+20 -> 2780 | E101: =R[-1]C+10 -> 1590 | F101: =R[-1]C+5 -> 445 | G101: 100
A102: 100 | B102: =ROUND(R[-1]C*1.115,0) -> 1810370 | C102: =R[-1]C+500 -> 59500 | D102: =R[-1]C+20 -> 2800 | E102: =R[-1]C+10 -> 1600 | F102: =R[-1]C+5 -> 450 | G102: 100

Sheet: export
A1: sheet_name | B1: export_name | C1: merge_to
A2: 玩家升级经验表 | B2: player_upgrade