Sheet: 通关仙币奖励
A1: 小关ID | B1: 仙币奖励
A2: id | B2: money_obtain
A3: 1 | B3: 4000
A4: 2 | B4: =R[-1]C+10 -> 4010
A5: 3 | B5: =R[-1]C+10 -> 4020
A6: 4 | B6: =R[-1]C+10 -> 4030
A7: 5 | B7: =R[-1]C+10 -> 4040
A8: 6 | B8: =R[-1]C+10 -> 4050
A9: 7 | B9: =R[-1]C+10 -> 4060
A10: 8 | B10: =R[-1]C+10 -> 4070
A11: 9 | B11: =R[-1]C+10 -> 4080
A12: 10 | B12: =R[-1]C+10 -> 4090
A13: 11 | B13: =R[-1]C+10 -> 4100
A14: 12 | B14: =R[-1]C+10 -> 4110
A15: 13 | B15: =R[-1]C+10 -> 4120
A16: 14 | B16: =R[-1]C+10 -> 4130
A17: 15 | B17: =R[-1]C+10 -> 4140
A18: 16 | B18: =R[-1]C+10 -> 4150
A19: 17 | B19: =R[-1]C+10 -> 4160
A20: 18 | B20: =R[-1]C+10 -> 4170
A21: 19 | B21: =R[-1]C+10 -> 4180
A22: 20 | B22: =R[-1]C+10 -> 4190
A23: 21 | B23: =R[-1]C+10 -> 4200
A24: 22 | B24: =R[-1]C+10 -> 4210
A25: 23 | B25: =R[-1]C+10 -> 4220
A26: 24 | B26: =R[-1]C+10 -> 4230
A27: 25 | B27: =R[-1]C+10 -> 4240
A28: 26 | B28: =R[-1]C+10 -> 4250
A29: 27 | B29: =R[-1]C+10 -> 4260
A30: 28 | B30: =R[-1]C+10 -> 4270
A31: 29 | B31: =R[-1]C+10 -> 4280
A32: 30 | B32: =R[-1]C+10 -> 4290
A33: 31 | B33: =R[-1]C+10 -> 4300
A34: 32 | B34: =R[-1]C+10 -> 4310
A35: 33 | B35: =R[-1]C+10 -> 4320
A36: 34 | B36: =R[-1]C+10 -> 4330
A37: 35 | B37: =R[-1]C+10 -> 4340
A38: 36 | B38: =R[-1]C+10 -> 4350
A39: 37 | B39: =R[-1]C+10 -> 4360
A40: 38 | B40: =R[-1]C+10 -> 4370
A41: 39 | B41: =R[-1]C+10 -> 4380
A42: 40 | B42: =R[-1]C+10 -> 4390
A43: 41 | B43: =R[-1]C+10 -> 4400
A44: 42 | B44: =R[-1]C+10 -> 4410
A45: 43 | B45: =R[-1]C+10 -> 4420
A46: 44 | B46: =R[-1]C+10 -> 4430
A47: 45 | B47: =R[-1]C+10 -> 4440
A48: 46 | B48: =R[-1]C+10 -> 4450
A49: 47 | B49: =R[-1]C+10 -> 4460
A50: 48 | B50: =R[-1]C+10 -> 4470
A51: 49 | B51: =R[-1]C+10 -> 4480
A52: 50 | B52: =R[-1]C+10 -> 4490
A53: 51 | B53: =R[-1]C+10 -> 4500
A54: 52 | B54: =R[-1]C+10 -> 4510
A55: 53 | B55: =R[-1]C+10 -> 4520
A56: 54 | B56: =R[-1]C+10 -> 4530
A57: 55 | B57: =R[-1]C+10 -> 4540
A58: 56 | B58: =R[-1]C+10 -> 4550
A59: 57 | B59: =R[-1]C+10 -> 4560
A60: 58 | B60: =R[-1]C+10 -> 4570
A61: 59 | B61: =R[-1]C+10 -> 4580
A62: 60 | B62: =R[-1]C+10 -> 4590
A63: 61 | B63: =R[-1]C+10 -> 4600
A64: 62 | B64: =R[-1]C+10 -> 4610
A65: 63 | B65: =R[-1]C+10 -> 4620
A66: 64 | B66: =R[-1]C+10 -> 4630
A67: 65 | B67: =R[-1]C+10 -> 4640
A68: 66 | B68: =R[-1]C+10 -> 4650
A69: 67 | B69: =R[-1]C+10 -> 4660
A70: 68 | B70: =R[-1]C+10 -> 4670
A71: 69 | B71: =R[-1]C+10 -> 4680
A72: 70 | B72: =R[-1]C+10 -> 4690
A73: 71 | B73: =R[-1]C+10 -> 4700
A74: 72 | B74: =R[-1]C+10 -> 4710
A75: 73 | B75: =R[-1]C+10 -> 4720
A76: 74 | B76: =R[-1]C+10 -> 4730
A77: 75 | B77: =R[-1]C+10 -> 4740
A78: 76 | B78: =R[-1]C+10 -> 4750
A79: 77 | B79: =R[-1]C+10 -> 4760
A80: 78 | B80: =R[-1]C+10 -> 4770
A81: 79 | B81: =R[-1]C+10 -> 4780
A82: 80 | B82: =R[-1]C+10 -> 4790
A83: 81 | B83: =R[-1]C+10 -> 4800
A84: 82 | B84: =R[-1]C+10 -> 4810
A85: 83 | B85: =R[-1]C+10 -> 4820
A86: 84 | B86: =R[-1]C+10 -> 4830
A87: 85 | B87: =R[-1]C+10 -> 4840
A88: 86 | B88: =R[-1]C+10 -> 4850
A89: 87 | B89: =R[-1]C+10 -> 4860
A90: 88 | B90: =R[-1]C+10 -> 4870
A91: 89 | B91: =R[-1]C+10 -> 4880
A92: 90 | B92: =R[-1]C+10 -> 4890
A93: 91 | B93: =R[-1]C+10 -> 4900
A94: 92 | B94: =R[-1]C+10 -> 4910
A95: 93 | B95: =R[-1]C+10 -> 4920
A96: 94 | B96: =R[-1]C+10 -> 4930
A97: 95 | B97: =R[-1]C+10 -> 4940
A98: 96 | B98: =R[-1]C+10 -> 4950
A99: 97 | B99: =R[-1]C+10 -> 4960
A100: 98 | B100: =R[-1]C+10 -> 4970
A101: 99 | B101: =R[-1]C+10 -> 4980
A102: 100 | B102: =R[-1]C+10 -> 4990
A103: 101 | B103: =R[-1]C+10 -> 5000
A104: 102 | B104: =R[-1]C+10 -> 5010
A105: 103 | B105: =R[-1]C+10 -> 5020
A106: 104 | B106: =R[-1]C+10 -> 5030
A107: 105 | B107: =R[-1]C+10 -> 5040
A108: 106 | B108: =R[-1]C+10 -> 5050
A109: 107 | B109: =R[-1]C+10 -> 5060
A110: 108 | B110: =R[-1]C+10 -> 5070
A111: 109 | B111: =R[-1]C+10 -> 5080
A112: 110 | B112: =R[-1]C+10 -> 5090
A113: 111 | B113: =R[-1]C+10 -> 5100
A114: 112 | B114: =R[-1]C+10 -> 5110
A115: 113 | B115: =R[-1]C+10 -> 5120
A116: 114 | B116: =R[-1]C+10 -> 5130
A117: 115 | B117: =R[-1]C+10 -> 5140
A118: 116 | B118: =R[-1]C+10 -> 5150
A119: 117 | B119: =R[-1]C+10 -> 5160
A120: 118 | B120: =R[-1]C+10 -> 5170
A121: 119 | B121: =R[-1]C+10 -> 5180
A122: 120 | B122: =R[-1]C+10 -> 5190
A123: 121 | B123: =R[-1]C+10 -> 5200
A124: 122 | B124: =R[-1]C+10 -> 5210
A125: 123 | B125: =R[-1]C+10 -> 5220
A126: 124 | B126: =R[-1]C+10 -> 5230
A127: 125 | B127: =R[-1]C+10 -> 5240
A128: 126 | B128: =R[-1]C+10 -> 5250
A129: 127 | B129: =R[-1]C+10 -> 5260
A130: 128 | B130: =R[-1]C+10 -> 5270
A131: 129 | B131: =R[-1]C+10 -> 5280
A132: 130 | B132: =R[-1]C+10 -> 5290
A133: 131 | B133: =R[-1]C+10 -> 5300
A134: 132 | B134: =R[-1]C+10 -> 5310
A135: 133 | B135: =R[-1]C+10 -> 5320
A136: 134 | B136: =R[-1]C+10 -> 5330
A137: 135 | B137: =R[-1]C+10 -> 5340
A138: 136 | B138: =R[-1]C+10 -> 5350
A139: 137 | B139: =R[-1]C+10 -> 5360
A140: 138 | B140: =R[-1]C+10 -> 5370
A141: 139 | B141: =R[-1]C+10 -> 5380
A142: 140 | B142: =R[-1]C+10 -> 5390
A143: 141 | B143: =R[-1]C+10 -> 5400
A144: 142 | B144: =R[-1]C+10 -> 5410
A145: 143 | B145: =R[-1]C+10 -> 5420
A146: 144 | B146: =R[-1]C+10 -> 5430
A147: 145 | B147: =R[-1]C+10 -> 5440
A148: 146 | B148: =R[-1]C+10 -> 5450
A149: 147 | B149: =R[-1]C+10 -> 5460
A150: 148 | B150: =R[-1]C+10 -> 5470
A151: 149 | B151: =R[-1]C+10 -> 5480
A152: 150 | B152: =R[-1]C+10 -> 5490
A153: 151 | B153: =R[-1]C+10 -> 5500
A154: 152 | B154: =R[-1]C+10 -> 5510
A155: 153 | B155: =R[-1]C+10 -> 5520
A156: 154 | B156: =R[-1]C+10 -> 5530
A157: 155 | B157: =R[-1]C+10 -> 5540
A158: 156 | B158: =R[-1]C+10 -> 5550
A159: 157 | B159: =R[-1]C+10 -> 5560
A160: 158 | B160: =R[-1]C+10 -> 5570
A161: 159 | B161: =R[-1]C+10 -> 5580
A162: 160 | B162: =R[-1]C+10 -> 5590
A163: 161 | B163: =R[-1]C+10 -> 5600
A164: 162 | B164: =R[-1]C+10 -> 5610
A165: 163 | B165: =R[-1]C+10 -> 5620
A166: 164 | B166: =R[-1]C+10 -> 5630
A167: 165 | B167: =R[-1]C+10 -> 5640
A168: 166 | B168: =R[-1]C+10 -> 5650
A169: 167 | B169: =R[-1]C+10 -> 5660
A170: 168 | B170: =R[-1]C+10 -> 5670
A171: 169 | B171: =R[-1]C+10 -> 5680
A172: 170 | B172: =R[-1]C+10 -> 5690
A173: 171 | B173: =R[-1]C+10 -> 5700
A174: 172 | B174: =R[-1]C+10 -> 5710
A175: 173 | B175: =R[-1]C+10 -> 5720
A176: 174 | B176: =R[-1]C+10 -> 5730
A177: 175 | B177: =R[-1]C+10 -> 5740
A178: 176 | B178: =R[-1]C+10 -> 5750
A179: 177 | B179: =R[-1]C+10 -> 5760
A180: 178 | B180: =R[-1]C+10 -> 5770
A181: 179 | B181: =R[-1]C+10 -> 5780
A182: 180 | B182: =R[-1]C+10 -> 5790
A183: 181 | B183: =R[-1]C+10 -> 5800
A184: 182 | B184: =R[-1]C+10 -> 5810
A185: 183 | B185: =R[-1]C+10 -> 5820
A186: 184 | B186: =R[-1]C+10 -> 5830
A187: 185 | B187: =R[-1]C+10 -> 5840
A188: 186 | B188: =R[-1]C+10 -> 5850
A189: 187 | B189: =R[-1]C+10 -> 5860
A190: 188 | B190: =R[-1]C+10 -> 5870
A191: 189 | B191: =R[-1]C+10 -> 5880
A192: 190 | B192: =R[-1]C+10 -> 5890
A193: 191 | B193: =R[-1]C+10 -> 5900
A194: 192 | B194: =R[-1]C+10 -> 5910
A195: 193 | B195: =R[-1]C+10 -> 5920
A196: 194 | B196: =R[-1]C+10 -> 5930
A197: 195 | B197: =R[-1]C+10 -> 5940
A198: 196 | B198: =R[-1]C+10 -> 5950
A199: 197 | B199: =R[-1]C+10 -> 5960
A200: 198 | B200: =R[-1]C+10 -> 5970
A201: 199 | B201: =R[-1]C+10 -> 5980
A202: 200 | B202: =R[-1]C+10 -> 5990
A203: 201 | B203: =R[-1]C+10 -> 6000
A204: 202 | B204: =R[-1]C+10 -> 6010
A205: 203 | B205: =R[-1]C+10 -> 6020
A206: 204 | B206: =R[-1]C+10 -> 6030
A207: 205 | B207: =R[-1]C+10 -> 6040
A208: 206 | B208: =R[-1]C+10 -> 6050
A209: 207 | B209: =R[-1]C+10 -> 6060
A210: 208 | B210: =R[-1]C+10 -> 6070
A211: 209 | B211: =R[-1]C+10 -> 6080
A212: 210 | B212: =R[-1]C+10 -> 6090
A213: 211 | B213: =R[-1]C+10 -> 6100
A214: 212 | B214: =R[-1]C+10 -> 6110
A215: 213 | B215: =R[-1]C+10 -> 6120
A216: 214 | B216: =R[-1]C+10 -> 6130
A217: 215 | B217: =R[-1]C+10 -> 6140
A218: 216 | B218: =R[-1]C+10 -> 6150
A219: 217 | B219: =R[-1]C+10 -> 6160
A220: 218 | B220: =R[-1]C+10 -> 6170
A221: 219 | B221: =R[-1]C+10 -> 6180
A222: 220 | B222: =R[-1]C+10 -> 6190
A223: 221 | B223: =R[-1]C+10 -> 6200
A224: 222 | B224: =R[-1]C+10 -> 6210
A225: 223 | B225: =R[-1]C+10 -> 6220
A226: 224 | B226: =R[-1]C+10 -> 6230
A227: 225 | B227: =R[-1]C+10 -> 6240
A228: 226 | B228: =R[-1]C+10 -> 6250
A229: 227 | B229: =R[-1]C+10 -> 6260
A230: 228 | B230: =R[-1]C+10 -> 6270
A231: 229 | B231: =R[-1]C+10 -> 6280
A232: 230 | B232: =R[-1]C+10 -> 6290
A233: 231 | B233: =R[-1]C+10 -> 6300
A234: 232 | B234: =R[-1]C+10 -> 6310
A235: 233 | B235: =R[-1]C+10 -> 6320
A236: 234 | B236: =R[-1]C+10 -> 6330
A237: 235 | B237: =R[-1]C+10 -> 6340
A238: 236 | B238: =R[-1]C+10 -> 6350
A239: 237 | B239: =R[-1]C+10 -> 6360
A240: 238 | B240: =R[-1]C+10 -> 6370
A241: 239 | B241: =R[-1]C+10 -> 6380
A242: 240 | B242: =R[-1]C+10 -> 6390
A243: 241 | B243: =R[-1]C+10 -> 6400
A244: 242 | B244: =R[-1]C+10 -> 6410
A245: 243 | B245: =R[-1]C+10 -> 6420
A246: 244 | B246: =R[-1]C+10 -> 6430
A247: 245 | B247: =R[-1]C+10 -> 6440
A248: 246 | B248: =R[-1]C+10 -> 6450
A249: 247 | B249: =R[-1]C+10 -> 6460
A250: 248 | B250: =R[-1]C+10 -> 6470
A251: 249 | B251: =R[-1]C+10 -> 6480
A252: 250 | B252: =R[-1]C+10 -> 6490
A253: 251 | B253: =R[-1]C+10 -> 6500
A254: 252 | B254: =R[-1]C+10 -> 6510
A255: 253 | B255: =R[-1]C+10 -> 6520
A256: 254 | B256: =R[-1]C+10 -> 6530
A257: 255 | B257: =R[-1]C+10 -> 6540
A258: 256 | B258: =R[-1]C+10 -> 6550
A259: 257 | B259: =R[-1]C+10 -> 6560
A260: 258 | B260: =R[-1]C+10 -> 6570
A261: 259 | B261: =R[-1]C+10 -> 6580
A262: 260 | B262: =R[-1]C+10 -> 6590
A263: 261 | B263: =R[-1]C+10 -> 6600
A264: 262 | B264: =R[-1]C+10 -> 6610
A265: 263 | B265: =R[-1]C+10 -> 6620
A266: 264 | B266: =R[-1]C+10 -> 6630
A267: 265 | B267: =R[-1]C+10 -> 6640
A268: 266 | B268: =R[-1]C+10 -> 6650
A269: 267 | B269: =R[-1]C+10 -> 6660
A270: 268 | B270: =R[-1]C+10 -> 6670
A271: 269 | B271: =R[-1]C+10 -> 6680
A272: 270 | B272: =R[-1]C+10 -> 6690
A273: 271 | B273: =R[-1]C+10 -> 6700
A274: 272 | B274: =R[-1]C+10 -> 6710
A275: 273 | B275: =R[-1]C+10 -> 6720
A276: 274 | B276: =R[-1]C+10 -> 6730
A277: 275 | B277: =R[-1]C+10 -> 6740
A278: 276 | B278: =R[-1]C+10 -> 6750
A279: 277 | B279: =R[-1]C+10 -> 6760
A280: 278 | B280: =R[-1]C+10 -> 6770
A281: 279 | B281: =R[-1]C+10 -> 6780
A282: 280 | B282: =R[-1]C+10 -> 6790
A283: 281 | B283: =R[-1]C+10 -> 6800
A284: 282 | B284: =R[-1]C+10 -> 6810
A285: 283 | B285: =R[-1]C+10 -> 6820
A286: 284 | B286: =R[-1]C+10 -> 6830
A287: 285 | B287: =R[-1]C+10 -> 6840
A288: 286 | B288: =R[-1]C+10 -> 6850
A289: 287 | B289: =R[-1]C+10 -> 6860
A290: 288 | B290: =R[-1]C+10 -> 6870
A291: 289 | B291: =R[-1]C+10 -> 6880
A292: 290 | B292: =R[-1]C+10 -> 6890
A293: 291 | B293: =R[-1]C+10 -> 6900
A294: 292 | B294: =R[-1]C+10 -> 6910
A295: 293 | B295: =R[-1]C+10 -> 6920
A296: 294 | B296: =R[-1]C+10 -> 6930
A297: 295 | B297: =R[-1]C+10 -> 6940
A298: 296 | B298: =R[-1]C+10 -> 6950
A299: 297 | B299: =R[-1]C+10 -> 6960
A300: 298 | B300: =R[-1]C+10 -> 6970
A301: 299 | B301: =R[-1]C+10 -> 6980
A302: 300 | B302: =R[-1]C+10 -> 6990
A303: 301 | B303: =R[-1]C+10 -> 7000
A304: 302 | B304: =R[-1]C+10 -> 7010
A305: 303 | B305: =R[-1]C+10 -> 7020
A306: 304 | B306: =R[-1]C+10 -> 7030
A307: 305 | B307: =R[-1]C+10 -> 7040
A308: 306 | B308: =R[-1]C+10 -> 7050
A309: 307 | B309: =R[-1]C+10 -> 7060
A310: 308 | B310: =R[-1]C+10 -> 7070
A311: 309 | B311: =R[-1]C+10 -> 7080
A312: 310 | B312: =R[-1]C+10 -> 7090
A313: 311 | B313: =R[-1]C+10 -> 7100
A314: 312 | B314: =R[-1]C+10 -> 7110
A315: 313 | B315: =R[-1]C+10 -> 7120
A316: 314 | B316: =R[-1]C+10 -> 7130
A317: 315 | B317: =R[-1]C+10 -> 7140
A318: 316 | B318: =R[-1]C+10 -> 7150
A319: 317 | B319: =R[-1]C+10 -> 7160
A320: 318 | B320: =R[-1]C+10 -> 7170
A321: 319 | B321: =R[-1]C+10 -> 7180
A322: 320 | B322: =R[-1]C+10 -> 7190
A323: 321 | B323: =R[-1]C+10 -> 7200
A324: 322 | B324: =R[-1]C+10 -> 7210
A325: 323 | B325: =R[-1]C+10 -> 7220
A326: 324 | B326: =R[-1]C+10 -> 7230
A327: 325 | B327: =R[-1]C+10 -> 7240
A328: 326 | B328: =R[-1]C+10 -> 7250
A329: 327 | B329: =R[-1]C+10 -> 7260
A330: 328 | B330: =R[-1]C+10 -> 7270
A331: 329 | B331: =R[-1]C+10 -> 7280
A332: 330 | B332: =R[-1]C+10 -> 7290
A333: 331 | B333: =R[-1]C+10 -> 7300
A334: 332 | B334: =R[-1]C+10 -> 7310
A335: 333 | B335: =R[-1]C+10 -> 7320
A336: 334 | B336: =R[-1]C+10 -> 7330
A337: 335 | B337: =R[-1]C+10 -> 7340
A338: 336 | B338: =R[-1]C+10 -> 7350
A339: 337 | B339: =R[-1]C+10 -> 7360
A340: 338 | B340: =R[-1]C+10 -> 7370
A341: 339 | B341: =R[-1]C+10 -> 7380
A342: 340 | B342: =R[-1]C+10 -> 7390
A343: 341 | B343: =R[-1]C+10 -> 7400
A344: 342 | B344: =R[-1]C+10 -> 7410
A345: 343 | B345: =R[-1]C+10 -> 7420
A346: 344 | B346: =R[-1]C+10 -> 7430
A347: 345 | B347: =R[-1]C+10 -> 7440
A348: 346 | B348: =R[-1]C+10 -> 7450
A349: 347 | B349: =R[-1]C+10 -> 7460
A350: 348 | B350: =R[-1]C+10 -> 7470
A351: 349 | B351: =R[-1]C+10 -> 7480
A352: 350 | B352: =R[-1]C+10 -> 7490
A353: 351 | B353: =R[-1]C+10 -> 7500
A354: 352 | B354: =R[-1]C+10 -> 7510
A355: 353 | B355: =R[-1]C+10 -> 7520
A356: 354 | B356: =R[-1]C+10 -> 7530
A357: 355 | B357: =R[-1]C+10 -> 7540
A358: 356 | B358: =R[-1]C+10 -> 7550
A359: 357 | B359: =R[-1]C+10 -> 7560
A360: 358 | B360: =R[-1]C+10 -> 7570
A361: 359 | B361: =R[-1]C+10 -> 7580
A362: 360 | B362: =R[-1]C+10 -> 7590
A363: 361 | B363: =R[-1]C+10 -> 7600
A364: 362 | B364: =R[-1]C+10 -> 7610
A365: 363 | B365: =R[-1]C+10 -> 7620
A366: 364 | B366: =R[-1]C+10 -> 7630
A367: 365 | B367: =R[-1]C+10 -> 7640
A368: 366 | B368: =R[-1]C+10 -> 7650
A369: 367 | B369: =R[-1]C+10 -> 7660
A370: 368 | B370: =R[-1]C+10 -> 7670
A371: 369 | B371: =R[-1]C+10 -> 7680
A372: 370 | B372: =R[-1]C+10 -> 7690
A373: 371 | B373: =R[-1]C+10 -> 7700
A374: 372 | B374: =R[-1]C+10 -> 7710
A375: 373 | B375: =R[-1]C+10 -> 7720
A376: 374 | B376: =R[-1]C+10 -> 7730
A377: 375 | B377: =R[-1]C+10 -> 7740
A378: 376 | B378: =R[-1]C+10 -> 7750
A379: 377 | B379: =R[-1]C+10 -> 7760
A380: 378 | B380: =R[-1]C+10 -> 7770
A381: 379 | B381: =R[-1]C+10 -> 7780
A382: 380 | B382: =R[-1]C+10 -> 7790
A383: 381 | B383: =R[-1]C+10 -> 7800
A384: 382 | B384: =R[-1]C+10 -> 7810
A385: 383 | B385: =R[-1]C+10 -> 7820
A386: 384 | B386: =R[-1]C+10 -> 7830
A387: 385 | B387: =R[-1]C+10 -> 7840
A388: 386 | B388: =R[-1]C+10 -> 7850
A389: 387 | B389: =R[-1]C+10 -> 7860
A390: 388 | B390: =R[-1]C+10 -> 7870
A391: 389 | B391: =R[-1]C+10 -> 7880
A392: 390 | B392: =R[-1]C+10 -> 7890
A393: 391 | B393: =R[-1]C+10 -> 7900
A394: 392 | B394: =R[-1]C+10 -> 7910
A395: 393 | B395: =R[-1]C+10 -> 7920
A396: 394 | B396: =R[-1]C+10 -> 7930
A397: 395 | B397: =R[-1]C+10 -> 7940
A398: 396 | B398: =R[-1]C+10 -> 7950
A399: 397 | B399: =R[-1]C+10 -> 7960
A400: 398 | B400: =R[-1]C+10 -> 7970
A401: 399 | B401: =R[-1]C+10 -> 7980
A402: 400 | B402: =R[-1]C+10 -> 7990
A403: 401 | B403: =R[-1]C+10 -> 8000
A404: 402 | B404: =R[-1]C+10 -> 8010
A405: 403 | B405: =R[-1]C+10 -> 8020
A406: 404 | B406: =R[-1]C+10 -> 8030
A407: 405 | B407: =R[-1]C+10 -> 8040
A408: 406 | B408: =R[-1]C+10 -> 8050
A409: 407 | B409: =R[-1]C+10 -> 8060
A410: 408 | B410: =R[-1]C+10 -> 8070
A411: 409 | B411: =R[-1]C+10 -> 8080
A412: 410 | B412: =R[-1]C+10 -> 8090
A413: 411 | B413: =R[-1]C+10 -> 8100
A414: 412 | B414: =R[-1]C+10 -> 8110
A415: 413 | B415: =R[-1]C+10 -> 8120
A416: 414 | B416: =R[-1]C+10 -> 8130
A417: 415 | B417: =R[-1]C+10 -> 8140
A418: 416 | B418: =R[-1]C+10 -> 8150
A419: 417 | B419: =R[-1]C+10 -> 8160
A420: 418 | B420: =R[-1]C+10 -> 8170
A421: 419 | B421: =R[-1]C+10 -> 8180
A422: 420 | B422: =R[-1]C+10 -> 8190
A423: 421 | B423: =R[-1]C+10 -> 8200
A424: 422 | B424: =R[-1]C+10 -> 8210
A425: 423 | B425: =R[-1]C+10 -> 8220
A426: 424 | B426: =R[-1]C+10 -> 8230
A427: 425 | B427: =R[-1]C+10 -> 8240
A428: 426 | B428: =R[-1]C+10 -> 8250
A429: 427 | B429: =R[-1]C+10 -> 8260
A430: 428 | B430: =R[-1]C+10 -> 8270
A431: 429 | B431: =R[-1]C+10 -> 8280
A432: 430 | B432: =R[-1]C+10 -> 8290
A433: 431 | B433: =R[-1]C+10 -> 8300
A434: 432 | B434: =R[-1]C+10 -> 8310
A435: 433 | B435: =R[-1]C+10 -> 8320
A436: 434 | B436: =R[-1]C+10 -> 8330
A437: 435 | B437: =R[-1]C+10 -> 8340
A438: 436 | B438: =R[-1]C+10 -> 8350
A439: 437 | B439: =R[-1]C+10 -> 8360
A440: 438 | B440: =R[-1]C+10 -> 8370
A441: 439 | B441: =R[-1]C+10 -> 8380
A442: 440 | B442: =R[-1]C+10 -> 8390
A443: 441 | B443: =R[-1]C+10 -> 8400
A444: 442 | B444: =R[-1]C+10 -> 8410
A445: 443 | B445: =R[-1]C+10 -> 8420
A446: 444 | B446: =R[-1]C+10 -> 8430
A447: 445 | B447: =R[-1]C+10 -> 8440
A448: 446 | B448: =R[-1]C+10 -> 8450
A449: 447 | B449: =R[-1]C+10 -> 8460
A450: 448 | B450: =R[-1]C+10 -> 8470
A451: 449 | B451: =R[-1]C+10 -> 8480
A452: 450 | B452: =R[-1]C+10 -> 8490
A453: 451 | B453: =R[-1]C+10 -> 8500
A454: 452 | B454: =R[-1]C+10 -> 8510
A455: 453 | B455: =R[-1]C+10 -> 8520
A456: 454 | B456: =R[-1]C+10 -> 8530
A457: 455 | B457: =R[-1]C+10 -> 8540
A458: 456 | B458: =R[-1]C+10 -> 8550
A459: 457 | B459: =R[-1]C+10 -> 8560
A460: 458 | B460: =R[-1]C+10 -> 8570
A461: 459 | B461: =R[-1]C+10 -> 8580
A462: 460 | B462: =R[-1]C+10 -> 8590
A463: 461 | B463: =R[-1]C+10 -> 8600
A464: 462 | B464: =R[-1]C+10 -> 8610
A465: 463 | B465: =R[-1]C+10 -> 8620
A466: 464 | B466: =R[-1]C+10 -> 8630
A467: 465 | B467: =R[-1]C+10 -> 8640
A468: 466 | B468: =R[-1]C+10 -> 8650
A469: 467 | B469: =R[-1]C+10 -> 8660
A470: 468 | B470: =R[-1]C+10 -> 8670
A471: 469 | B471: =R[-1]C+10 -> 8680
A472: 470 | B472: =R[-1]C+10 -> 8690
A473: 471 | B473: =R[-1]C+10 -> 8700
A474: 472 | B474: =R[-1]C+10 -> 8710
A475: 473 | B475: =R[-1]C+10 -> 8720
A476: 474 | B476: =R[-1]C+10 -> 8730
A477: 475 | B477: =R[-1]C+10 -> 8740
A478: 476 | B478: =R[-1]C+10 -> 8750
A479: 477 | B479: =R[-1]C+10 -> 8760
A480: 478 | B480: =R[-1]C+10 -> 8770
A481: 479 | B481: =R[-1]C+10 -> 8780
A482: 480 | B482: =R[-1]C+10 -> 8790
A483: 481 | B483: =R[-1]C+10 -> 8800
A484: 482 | B484: =R[-1]C+10 -> 8810
A485: 483 | B485: =R[-1]C+10 -> 8820
A486: 484 | B486: =R[-1]C+10 -> 8830
A487: 485 | B487: =R[-1]C+10 -> 8840
A488: 486 | B488: =R[-1]C+10 -> 8850
A489: 487 | B489: =R[-1]C+10 -> 8860
A490: 488 | B490: =R[-1]C+10 -> 8870
A491: 489 | B491: =R[-1]C+10 -> 8880
A492: 490 | B492: =R[-1]C+10 -> 8890
A493: 491 | B493: =R[-1]C+10 -> 8900
A494: 492 | B494: =R[-1]C+10 -> 8910
A495: 493 | B495: =R[-1]C+10 -> 8920
A496: 494 | B496: =R[-1]C+10 -> 8930
A497: 495 | B497: =R[-1]C+10 -> 8940
A498: 496 | B498: =R[-1]C+10 -> 8950
A499: 497 | B499: =R[-1]C+10 -> 8960
A500: 498 | B500: =R[-1]C+10 -> 8970
A501: 499 | B501: =R[-1]C+10 -> 8980
A502: 500 | B502: =R[-1]C+10 -> 8990

Sheet: export
A1: sheet_name | B1: export_name | C1: merge_to
A2: 通关仙币奖励 | B2: task_through_reward