Sheet: 任务奖励表
A1: id | B1: 章名称 | C1: 小节序号 | D1: 小节名称 | E1: 进度层数 | F1: 每次消耗体力 | G1: 每次奖励经验 | H1: 每次奖励铜板 | I1: 小节描述
A2: id | B2: chapter_id | C2: section_id | D2: section_name | E2: points | F2: power_consume | G2: exp_obtain | H2: coins_obtain | I2: description
A3: 1 | B3: 鬼门关 | C3: 1 | D3: 鬼门关 | E3: 3 | F3: 5 | G3: 3 | H3: 80 | I3: 一声长叹，后羿的心中充满愤懑。自嫦娥撇下他独自奔月之后，他一直都买不起像样的房，现在还住茅屋，而且还是小产权。
A4: 2 | B4: 鬼门关 | C4: =R[-1]C+1 -> 2 | D4: 鬼门关 | E4: 4 | F4: =R[-1]C -> 5 | G4: 4 | H4: =R[-1]C+8 -> 88 | I4: 嚓，嚓，吴刚劈砍桂树的声音有节奏的穿过宫墙，敲打着嫦娥寂寞的心房。她忍不住的问自己：这样的坚持是否还有意义？
A5: 3 | B5: 鬼门关 | C5: =R[-1]C+1 -> 3 | D5: 鬼门关 | E5: 5 | F5: =R[-1]C -> 5 | G5: 5 | H5: =R[-1]C+8 -> 96 | I5: 作为后羿的兄弟，我不能做那种事情，绝对不能！吴刚望着面前的篝火，平静的从烤架上撕下了一条兔腿。
A6: 4 | B6: 鬼门关 | C6: =R[-1]C+1 -> 4 | D6: 鬼门关 | E6: 5 | F6: =R[-1]C -> 5 | G6: 5 | H6: =R[-1]C+8 -> 104 | I6: 二郎神为了体察民情，派哮天犬下凡，他从事各个职业以后，最终选择了一个非常有前途的职业：小区保安
A7: 5 | B7: 鬼门关 | C7: =R[-1]C+1 -> 5 | D7: 鬼门关 | E7: 5 | F7: =R[-1]C -> 5 | G7: 6 | H7: =R[-1]C+8 -> 112 | I7: 没有人知道，当年女娲娘娘补天所用的最后一块石头，其实并不是石头，而是她自己的心。
A8: 6 | B8: 鬼门关 | C8: =R[-1]C+1 -> 6 | D8: 鬼门关 | E8: 5 | F8: =R[-1]C -> 5 | G8: 6 | H8: =R[-1]C+8 -> 120 | I8: 每次当何仙姑和吕洞宾在一起遨游的时候，没有人知道铁拐李与张果老的痛。
A9: 7 | B9: 鬼门关 | C9: =R[-1]C+1 -> 7 | D9: 鬼门关 | E9: 5 | F9: =R[-1]C -> 5 | G9: 7 | H9: =R[-1]C+8 -> 128 | I9: 其实天上的神仙和人间百姓一样，都需要买房，买不起的那就租，租不起的那就睡南天门去。
A10: 8 | B10: 鬼门关 | C10: =R[-1]C+1 -> 8 | D10: 鬼门关 | E10: 5 | F10: =R[-1]C -> 5 | G10: 7 | H10: =R[-1]C+8 -> 136 | I10: 自从月老发现人间开始流行一对多或多对一或多对多这种男女关系之后，他不知道自己该如何搭线了，最近他在考虑退休的事。
A11: 9 | B11: 鬼门关 | C11: =R[-1]C+1 -> 9 | D11: 鬼门关 | E11: 5 | F11: =R[-1]C -> 5 | G11: 7 | H11: =R[-1]C+8 -> 144 | I11: 跟随牛郎多年的那头牛，是头公牛，不过可以产奶。
A12: 10 | B12: 鬼门关 | C12: =R[-1]C+1 -> 10 | D12: 鬼门关 | E12: 5 | F12: =R[-1]C -> 5 | G12: 7 | H12: =R[-1]C+8 -> 152 | I12: 织女其实并不恨王母，她总觉得两人在一起呢，容易事儿多，时间长了会影响夫妻感情，所以还是保持一定距离比较好。
A13: 11 | B13: 炼狱谷 | C13: 1 | D13: 炼狱谷 | E13: 6 | F13: =R[-1]C -> 5 | G13: 9 | H13: =R[-1]C+8 -> 160 | I13: 牛郎兴奋地跟织女说：“我昨晚梦到你啦！”“呵呵，梦到我们在干嘛？”牛郎：“没干，只是一起牵着手！” 织女：“。。。”
A14: 12 | B14: 炼狱谷 | C14: =R[-1]C+1 -> 2 | D14: 炼狱谷 | E14: 6 | F14: =R[-1]C -> 5 | G14: 9 | H14: =R[-1]C+8 -> 168 | I14: 很多神仙都劝二郎神说现在世道变了，神仙也流行找小三了，你也找一个吧。二郎神淡淡一笑说不必了，我有哮天犬了。
A15: 13 | B15: 炼狱谷 | C15: =R[-1]C+1 -> 3 | D15: 炼狱谷 | E15: 6 | F15: =R[-1]C -> 5 | G15: 9 | H15: =R[-1]C+8 -> 176 | I15: 很多人都痛恨妲己。其实，她不过是找了一个有权有势的高官，仅此而已。怎么，难道你们竟然会觉得这种情况不正常么。
A16: 14 | B16: 炼狱谷 | C16: =R[-1]C+1 -> 4 | D16: 炼狱谷 | E16: 6 | F16: =R[-1]C -> 5 | G16: 9 | H16: =R[-1]C+8 -> 184 | I16: 在哮天犬的眼里，每个神仙都是一条母狗，除了二郎神。
A17: 15 | B17: 炼狱谷 | C17: =R[-1]C+1 -> 5 | D17: 炼狱谷 | E17: 6 | F17: =R[-1]C -> 5 | G17: 9 | H17: =R[-1]C+8 -> 192 | I17: 悟空当年取经功德圆满之后，他就返回了花果山，和沙僧一起合伙开了一家绿色天然饮品店，生意一直很好。
A18: 16 | B18: 炼狱谷 | C18: =R[-1]C+1 -> 6 | D18: 炼狱谷 | E18: 6 | F18: =R[-1]C -> 5 | G18: 10 | H18: =R[-1]C+8 -> 200 | I18: 玉帝其实是一个非常豪迈的帝，晚上睡不着的时候，他总会约上如来和菩萨，来到嫦娥住的地方，几个人花前月下，引吭高歌。
A19: 17 | B19: 炼狱谷 | C19: =R[-1]C+1 -> 7 | D19: 炼狱谷 | E19: 6 | F19: =R[-1]C -> 5 | G19: 10 | H19: =R[-1]C+8 -> 208 | I19: 仙界每年都会举行一次峰会，讨论关于修仙之道相关事宜。会议由西天如来发起，观音菩萨一般不参加，她说没啥意思。
A20: 18 | B20: 炼狱谷 | C20: =R[-1]C+1 -> 8 | D20: 炼狱谷 | E20: 6 | F20: =R[-1]C -> 5 | G20: 10 | H20: =R[-1]C+8 -> 216 | I20: 雷震子的翅膀其实是可以拔下来的。
A21: 19 | B21: 炼狱谷 | C21: =R[-1]C+1 -> 9 | D21: 炼狱谷 | E21: 6 | F21: =R[-1]C -> 5 | G21: 11 | H21: =R[-1]C+8 -> 224 | I21: 土行孙的土遁术后来被玉帝一道禁令收回去了，因为他总喜欢半夜到处乱遁。
A22: 20 | B22: 炼狱谷 | C22: =R[-1]C+1 -> 10 | D22: 炼狱谷 | E22: 6 | F22: =R[-1]C -> 5 | G22: 11 | H22: =R[-1]C+8 -> 232 | I22: 黑白无常其实是阎王的私生子，他们是一对双胞胎。
A23: 21 | B23: 噬心峰 | C23: 1 | D23: 噬心峰 | E23: 7 | F23: =R[-1]C -> 5 | G23: 12 | H23: =R[-1]C+8 -> 240 | I23: 真正的地狱其实不是十八层，而是上下两层，复式的。
A24: 22 | B24: 噬心峰 | C24: =R[-1]C+1 -> 2 | D24: 噬心峰 | E24: 7 | F24: =R[-1]C -> 5 | G24: 12 | H24: =R[-1]C+8 -> 248 | I24: 花果山常年供奉着一颗晶龙珠，那是紫霞仙子的一滴眼泪。
A25: 23 | B25: 噬心峰 | C25: =R[-1]C+1 -> 3 | D25: 噬心峰 | E25: 7 | F25: =R[-1]C -> 5 | G25: 12 | H25: =R[-1]C+8 -> 256 | I25: 猪八戒的真神不是猪，是驴。
A26: 24 | B26: 噬心峰 | C26: =R[-1]C+1 -> 4 | D26: 噬心峰 | E26: 7 | F26: =R[-1]C -> 5 | G26: 12 | H26: =R[-1]C+8 -> 264 | I26: 西天取经，每一次遇到妖怪，悟空都忍不住的想要呐喊，如来，我就XXX了，你能不要这样一次一只怪一次一只怪的折磨我么。
A27: 25 | B27: 噬心峰 | C27: =R[-1]C+1 -> 5 | D27: 噬心峰 | E27: 7 | F27: =R[-1]C -> 5 | G27: 12 | H27: =R[-1]C+8 -> 272 | I27: 流沙河盛产金沙，质地优良，晶莹剔透。据说这是由昔日唐僧师徒四人取经途中留下来的大便风干而成。
A28: 26 | B28: 噬心峰 | C28: =R[-1]C+1 -> 6 | D28: 噬心峰 | E28: 8 | F28: =R[-1]C -> 5 | G28: 12 | H28: =R[-1]C+8 -> 280 | I28: 每次唐僧有艳遇，深恋唐僧的悟空心中都在滴血啊！因此，每次孙悟空都会在唐僧和美女最关键的时刻，掏出棒子，棒打鸳鸯！
A29: 27 | B29: 噬心峰 | C29: =R[-1]C+1 -> 7 | D29: 噬心峰 | E29: 8 | F29: =R[-1]C -> 5 | G29: 12 | H29: =R[-1]C+8 -> 288 | I29: 唐僧师徒取经归来，皇帝大喜，分别派人带八戒、白龙马、悟空和沙僧去吃喝赌抽，自己陪着唐僧去……
A30: 28 | B30: 噬心峰 | C30: =R[-1]C+1 -> 8 | D30: 噬心峰 | E30: 8 | F30: =R[-1]C -> 5 | G30: 12 | H30: =R[-1]C+8 -> 296 | I30: 红孩儿其实不是个小孩，按年龄来看，他比牛魔王大个三岁左右。他之所以长成那样是因为他就是那个样子。
A31: 29 | B31: 噬心峰 | C31: =R[-1]C+1 -> 9 | D31: 噬心峰 | E31: 8 | F31: =R[-1]C -> 5 | G31: 12 | H31: =R[-1]C+8 -> 304 | I31: 对于唐僧师徒四人历经九九八十一难还虐不死的剧情，如来是这样评价的：“汝甚屌，汝亲属可知否？”
A32: 30 | B32: 噬心峰 | C32: =R[-1]C+1 -> 10 | D32: 噬心峰 | E32: 8 | F32: =R[-1]C -> 5 | G32: 12 | H32: =R[-1]C+8 -> 312 | I32: 玉帝问如来：“这几百年来的修行，你到底坚持了些什么？”如来斩钉截铁地说：“单身！”
A33: 31 | B33: 绝情池 | C33: 1 | D33: 绝情池 | E33: 9 | F33: =R[-1]C -> 5 | G33: 12 | H33: =R[-1]C+8 -> 320 | I33: 土地公是仙界最富裕的神仙，他掌管着整个仙界的土地审批大权。在地价疯长的这年头，有了地，你就有了幸福。
A34: 32 | B34: 绝情池 | C34: =R[-1]C+1 -> 2 | D34: 绝情池 | E34: 9 | F34: =R[-1]C -> 5 | G34: 12 | H34: =R[-1]C+8 -> 328 | I34: 哮天犬原本是有生育能力的，后来跟着二郎神参与沉香劈山救母这件事的时候，被沉香一斧头劈掉了狗蛋，从此变为一只阉狗。
A35: 33 | B35: 绝情池 | C35: =R[-1]C+1 -> 3 | D35: 绝情池 | E35: 9 | F35: =R[-1]C -> 5 | G35: 12 | H35: =R[-1]C+8 -> 336 | I35: 昔日取经路过女儿国，三藏和女儿国的女王其实种下了幸福的果子。瓜熟落地之后，发现是个男孩，女王为之取名唐伯虎。
A36: 34 | B36: 绝情池 | C36: =R[-1]C+1 -> 4 | D36: 绝情池 | E36: 9 | F36: =R[-1]C -> 5 | G36: 12 | H36: =R[-1]C+8 -> 344 | I36: 凌霄大殿主体建筑主要是大理石，它的地板则以花岗岩为主。卧室则铺以通体的瓷砖，主要是玉帝喜欢亮亮的那种感觉。
A37: 35 | B37: 绝情池 | C37: =R[-1]C+1 -> 5 | D37: 绝情池 | E37: 9 | F37: =R[-1]C -> 5 | G37: 12 | H37: =R[-1]C+8 -> 352 | I37: 常年守在南天门附近的两个天兵，一个叫阳骏，一个叫刘胜，他们的感情极深。
A38: 36 | B38: 绝情池 | C38: =R[-1]C+1 -> 6 | D38: 绝情池 | E38: 10 | F38: =R[-1]C -> 5 | G38: 12 | H38: =R[-1]C+8 -> 360 | I38: 其实天上的神仙大多都羡慕人间生活。因为在天上就算有权也没有太多可发挥的空间，而在人间，那就完全不一样了。
A39: 37 | B39: 绝情池 | C39: =R[-1]C+1 -> 7 | D39: 绝情池 | E39: 10 | F39: =R[-1]C -> 5 | G39: 12 | H39: =R[-1]C+8 -> 368 | I39: 很多神仙都想把哮天犬煮了吃，甚至包括玉帝，不过每次看到二郎神与哮天犬在一起的那种感觉，他们又没有胃口了，不敢吃。
A40: 38 | B40: 绝情池 | C40: =R[-1]C+1 -> 8 | D40: 绝情池 | E40: 10 | F40: =R[-1]C -> 5 | G40: 12 | H40: =R[-1]C+8 -> 376 | I40: 铁拐李其实并不是拐子，他这么搞，主要是为了追求一个造型。说白了，主要就是给何仙姑看的。
A41: 39 | B41: 绝情池 | C41: =R[-1]C+1 -> 9 | D41: 绝情池 | E41: 10 | F41: =R[-1]C -> 5 | G41: 12 | H41: =R[-1]C+8 -> 384 | I41: 张果老之所以总是倒骑着驴，是因为那驴的眼睛长在屁股上。
A42: 40 | B42: 绝情池 | C42: =R[-1]C+1 -> 10 | D42: 绝情池 | E42: 10 | F42: =R[-1]C -> 5 | G42: 12 | H42: =R[-1]C+8 -> 392 | I42: 土行孙今天买了两个包子吃，可是一口咬下居然没有馅儿，于是问老板，老板说：“我们还没有掌握核心科技。。”
A43: 41 | B43: 哭丧岩 | C43: 1 | D43: 哭丧岩 | E43: 11 | F43: =R[-1]C -> 5 | G43: 21 | H43: =R[-1]C+8 -> 400 | I43: 巨灵神以体型巨大儿闻名仙界，大家送了他一个友善的绰号，奥特曼。
A44: 42 | B44: 哭丧岩 | C44: =R[-1]C+1 -> 2 | D44: 哭丧岩 | E44: 11 | F44: =R[-1]C -> 5 | G44: 21 | H44: =R[-1]C+8 -> 408 | I44: 盘古当年开天辟地的时候，他用了三年六个月十五天八小时二十五分三十六秒。我们可以想象，盘古爷劈的有多么辛苦。
A45: 43 | B45: 哭丧岩 | C45: =R[-1]C+1 -> 3 | D45: 哭丧岩 | E45: 11 | F45: =R[-1]C -> 5 | G45: 21 | H45: =R[-1]C+8 -> 416 | I45: 白素贞变形为白蛇的时候，许多人都说大概有十多米长。但真正长度其实是八百六十七米，法海整整量了两天两夜。
A46: 44 | B46: 哭丧岩 | C46: =R[-1]C+1 -> 4 | D46: 哭丧岩 | E46: 11 | F46: =R[-1]C -> 5 | G46: 21 | H46: =R[-1]C+8 -> 424 | I46: 相对于白蛇的这个长度，小青就短了很多，她只有不到一米。不过这个法海倒是没有量过。
A47: 45 | B47: 哭丧岩 | C47: =R[-1]C+1 -> 5 | D47: 哭丧岩 | E47: 11 | F47: =R[-1]C -> 5 | G47: 21 | H47: =R[-1]C+8 -> 432 | I47: 其实白素贞被关在雷锋塔里的日子并没有那么糟糕，每周法海都会找个时间叫上许仙和小青，四个人在塔顶打麻将。
A48: 46 | B48: 哭丧岩 | C48: =R[-1]C+1 -> 6 | D48: 哭丧岩 | E48: 12 | F48: =R[-1]C -> 5 | G48: 21 | H48: =R[-1]C+8 -> 440 | I48: 混沌之初，女娲娘娘造人的时候，她其实捏了两个男泥人，一个女泥人。这也是当今许多男子娶不到媳妇的根本原因。
A49: 47 | B49: 哭丧岩 | C49: =R[-1]C+1 -> 7 | D49: 哭丧岩 | E49: 12 | F49: =R[-1]C -> 5 | G49: 21 | H49: =R[-1]C+8 -> 448 | I49: 求子峰，其实是当年盘古爷掉落在凡间的斧柄碎片。男人们都希望能够祈得盘古爷那怕一丝丝的雄风，让老婆满意以及满足。
A50: 48 | B50: 哭丧岩 | C50: =R[-1]C+1 -> 8 | D50: 哭丧岩 | E50: 12 | F50: =R[-1]C -> 5 | G50: 21 | H50: =R[-1]C+8 -> 456 | I50: 金箍棒最早是大禹手中的武器，是昔日大禹治水横扫妖魔鬼怪的利器。只是后来不知怎么的居然到了大圣的手中。
A51: 49 | B51: 哭丧岩 | C51: =R[-1]C+1 -> 9 | D51: 哭丧岩 | E51: 12 | F51: =R[-1]C -> 5 | G51: 21 | H51: =R[-1]C+8 -> 464 | I51: 嫦娥思念后羿，但更多的是忍不住的经常想起天蓬元帅来，想着想着就忍不住会浑身发烫。她不知道是为什么。
A52: 50 | B52: 哭丧岩 | C52: =R[-1]C+1 -> 10 | D52: 哭丧岩 | E52: 12 | F52: =R[-1]C -> 5 | G52: 21 | H52: =R[-1]C+8 -> 472 | I52: 当八戒结束取经回到高老庄的时候，他悲哀的发现高老庄在未经他同意的情况下，已经被强行拆除。
A53: 51 | B53: 杏花村 | C53: 1 | D53: 杏花村 | E53: 13 | F53: =R[-1]C -> 5 | G53: 21 | H53: =R[-1]C+8 -> 480 | I53: 沙僧结束取经之后，他惊讶的发现，他秃了了数百年的脑袋，又重新长出了乌黑粗硬卷曲的毛发来。
A54: 52 | B54: 杏花村 | C54: =R[-1]C+1 -> 2 | D54: 杏花村 | E54: 13 | F54: =R[-1]C -> 5 | G54: 21 | H54: =R[-1]C+8 -> 488 | I54: 玉帝和王母其实在结婚后第二天就离婚了，这是仙界一个公开的秘密。
A55: 53 | B55: 杏花村 | C55: =R[-1]C+1 -> 3 | D55: 杏花村 | E55: 13 | F55: =R[-1]C -> 5 | G55: 21 | H55: =R[-1]C+8 -> 496 | I55: 大部分时间里，其实太上老君不是在炼丹，而是在烤地瓜。对于人间这一美味，老君非常喜欢。
A56: 54 | B56: 杏花村 | C56: =R[-1]C+1 -> 4 | D56: 杏花村 | E56: 13 | F56: =R[-1]C -> 5 | G56: 21 | H56: =R[-1]C+8 -> 504 | I56: 八仙从来就没有过海的行为，事实上他们几乎都没有到过海边。因为他们八人中，有七人先天怕水，看到水波就头晕恶心。
A57: 55 | B57: 杏花村 | C57: =R[-1]C+1 -> 5 | D57: 杏花村 | E57: 13 | F57: =R[-1]C -> 5 | G57: 21 | H57: =R[-1]C+8 -> 512 | I57: 神仙从来不吃早餐，也不吃午餐，也不吃晚餐，不过他们吃宵夜。
A58: 56 | B58: 杏花村 | C58: =R[-1]C+1 -> 6 | D58: 杏花村 | E58: 14 | F58: =R[-1]C -> 5 | G58: 21 | H58: =R[-1]C+8 -> 520 | I58: 观音菩萨的那个圣水瓶，产地源于人间，具体地址是景德镇。
A59: 57 | B59: 杏花村 | C59: =R[-1]C+1 -> 7 | D59: 杏花村 | E59: 14 | F59: =R[-1]C -> 5 | G59: 21 | H59: =R[-1]C+8 -> 528 | I59: 仙界中第二号人物，其实是太白金星，这个专门传布玉帝命令的老头。这老头是个正派人。
A60: 58 | B60: 杏花村 | C60: =R[-1]C+1 -> 8 | D60: 杏花村 | E60: 14 | F60: =R[-1]C -> 5 | G60: 21 | H60: =R[-1]C+8 -> 536 | I60: 菩提老祖的元神并不是葡萄。那只是星爷电影中的一个桥段。
A61: 59 | B61: 杏花村 | C61: =R[-1]C+1 -> 9 | D61: 杏花村 | E61: 14 | F61: =R[-1]C -> 5 | G61: 21 | H61: =R[-1]C+8 -> 544 | I61: 夸父当年为何一定要去追日，累死累活的最后还是没有追上。玉帝曾召集众仙讨论过这个问题，最后结果是不知道。
A62: 60 | B62: 杏花村 | C62: =R[-1]C+1 -> 10 | D62: 杏花村 | E62: 14 | F62: =R[-1]C -> 5 | G62: 21 | H62: =R[-1]C+8 -> 552 | I62: 跟随着南极仙翁的那只仙鹤，最开始是母的，后来变成了公的，再后来又变成了母的，据说这是跟着仙翁的阶段性喜好来变的。
A63: 61 | B63: 窦娥冢 | C63: 1 | D63: 窦娥冢 | E63: 15 | F63: =R[-1]C -> 5 | G63: 32 | H63: =R[-1]C+8 -> 560 | I63: 天庭也需要供电的，也需要照明的，但因为电母的电压最近一直不稳，所以老跳闸。这让玉帝一直很不爽。
A64: 62 | B64: 窦娥冢 | C64: =R[-1]C+1 -> 2 | D64: 窦娥冢 | E64: 15 | F64: =R[-1]C -> 5 | G64: 32 | H64: =R[-1]C+8 -> 568 | I64: 雷公是个好男人，电母脾气很暴，动不动就用电锥子扎他，但任凭电母怎么扎，扎的多用力，雷公哼都不哼一声。
A65: 63 | B65: 窦娥冢 | C65: =R[-1]C+1 -> 3 | D65: 窦娥冢 | E65: 15 | F65: =R[-1]C -> 5 | G65: 32 | H65: =R[-1]C+8 -> 576 | I65: 人参果其实并不是果实，严格来说它也是神仙。但毫无疑问，它可以算作天庭最惨的仙了，因为它生来就是被吃的。
A66: 64 | B66: 窦娥冢 | C66: =R[-1]C+1 -> 4 | D66: 窦娥冢 | E66: 15 | F66: =R[-1]C -> 5 | G66: 32 | H66: =R[-1]C+8 -> 584 | I66: 七仙女作为天庭最为耀眼的璀璨舞者，她们很寂寞，她们一直渴望能够有自己的另一半。但是，唉……说什么好呢？
A67: 65 | B67: 窦娥冢 | C67: =R[-1]C+1 -> 5 | D67: 窦娥冢 | E67: 15 | F67: =R[-1]C -> 5 | G67: 32 | H67: =R[-1]C+8 -> 592 | I67: 据野史记载，刘彦昌在三圣母被压到华山下之后，到处找女人睡觉。所以，我认为，三圣母在感情这件事上，严重看走了眼。
A68: 66 | B68: 窦娥冢 | C68: =R[-1]C+1 -> 6 | D68: 窦娥冢 | E68: 16 | F68: =R[-1]C -> 5 | G68: 32 | H68: =R[-1]C+8 -> 600 | I68: 宝莲灯之所以有无穷的威力，是因为灯芯是如来门下弟子青霞仙子的化身。我又不禁的想起了紫霞，想起了至尊宝，唉……
A69: 67 | B69: 窦娥冢 | C69: =R[-1]C+1 -> 7 | D69: 窦娥冢 | E69: 16 | F69: =R[-1]C -> 5 | G69: 32 | H69: =R[-1]C+8 -> 608 | I69: 仙史记载，狐狸精其实是托塔李天王的情人。从实际情况来看，这应该是真的。
A70: 68 | B70: 窦娥冢 | C70: =R[-1]C+1 -> 8 | D70: 窦娥冢 | E70: 16 | F70: =R[-1]C -> 5 | G70: 32 | H70: =R[-1]C+8 -> 616 | I70: 仙史记载，悟空上任弼马温这一段时间内，天庭总共失去了九万八千六百七十二匹天马，最后仅剩下了两匹马驹子。骇人听闻。
A71: 69 | B71: 窦娥冢 | C71: =R[-1]C+1 -> 9 | D71: 窦娥冢 | E71: 16 | F71: =R[-1]C -> 5 | G71: 32 | H71: =R[-1]C+8 -> 624 | I71: 阎罗王最大的癖好，就是吃刚刚来到阴间的灵魂，尤其是青壮年男女的灵魂。天上地下，这家伙大概是最狠的了。
A72: 70 | B72: 窦娥冢 | C72: =R[-1]C+1 -> 10 | D72: 窦娥冢 | E72: 16 | F72: =R[-1]C -> 5 | G72: 32 | H72: =R[-1]C+8 -> 632 | I72: 作为阎王身边的得力鬼将，牛头继承了阎王喜吃的特性，他喜欢吃和牛相关的任何东西，牛筋，牛皮，牛毛，牛鞭，牛粪，等等。
A73: 71 | B73: 柳风堂 | C73: 1 | D73: 柳风堂 | E73: 17 | F73: =R[-1]C -> 5 | G73: 50 | H73: =R[-1]C+8 -> 640 | I73: 作为阎王身边的得力鬼将，马面并没有继承阎王喜吃的特性，但却创立了另外一种个性，他喜欢被人骑。
A74: 72 | B74: 柳风堂 | C74: =R[-1]C+1 -> 2 | D74: 柳风堂 | E74: 17 | F74: =R[-1]C -> 5 | G74: 50 | H74: =R[-1]C+8 -> 648 | I74: 从鬼门关距离阎罗殿，大概是十公里的距离。打车的话也就是个起步价。
A75: 73 | B75: 柳风堂 | C75: =R[-1]C+1 -> 3 | D75: 柳风堂 | E75: 17 | F75: =R[-1]C -> 5 | G75: 50 | H75: =R[-1]C+8 -> 656 | I75: 很多人都以为南天门下去就是人间，其实不然。南天门和鬼门关是直通的。
A76: 74 | B76: 柳风堂 | C76: =R[-1]C+1 -> 4 | D76: 柳风堂 | E76: 17 | F76: =R[-1]C -> 5 | G76: 50 | H76: =R[-1]C+8 -> 664 | I76: 关于人间百姓生活房价过高的这个问题，玉帝和众仙有过专门的讨论，大家最后一致认为，它会稳定的越来越高。
A77: 75 | B77: 柳风堂 | C77: =R[-1]C+1 -> 5 | D77: 柳风堂 | E77: 17 | F77: =R[-1]C -> 5 | G77: 50 | H77: =R[-1]C+8 -> 672 | I77: 姜子牙现在基本不怎么垂钓了，他现在改用渔网了。
A78: 76 | B78: 柳风堂 | C78: =R[-1]C+1 -> 6 | D78: 柳风堂 | E78: 18 | F78: =R[-1]C -> 5 | G78: 50 | H78: =R[-1]C+8 -> 680 | I78: 很多人可能不知道，吕洞宾有一个很著名的徒孙，叫王重阳，他获得过首届华山论剑的冠军。
A79: 77 | B79: 柳风堂 | C79: =R[-1]C+1 -> 7 | D79: 柳风堂 | E79: 18 | F79: =R[-1]C -> 5 | G79: 50 | H79: =R[-1]C+8 -> 688 | I79: 作为游走于天地的降龙尊者，济公羡煞了众神仙。主要是因为他到地面吃的喝的啥都可以，而且玉帝还不怪他，爽爆了。
A80: 78 | B80: 柳风堂 | C80: =R[-1]C+1 -> 8 | D80: 柳风堂 | E80: 18 | F80: =R[-1]C -> 5 | G80: 50 | H80: =R[-1]C+8 -> 696 | I80: 冷面判官作为地狱的行刑官，他无论在鬼界还是仙界都是一个风云人物，主要是因为他长的非常俊秀，像陈老师。
A81: 79 | B81: 柳风堂 | C81: =R[-1]C+1 -> 9 | D81: 柳风堂 | E81: 18 | F81: =R[-1]C -> 5 | G81: 50 | H81: =R[-1]C+8 -> 704 | I81: 三藏西天取经遇到了很多妖怪，但唯一一个并不是真正想吃他的只有狐狸精，因为狐狸姐姐相信真爱，渴望真爱，拥抱真爱。
A82: 80 | B82: 柳风堂 | C82: =R[-1]C+1 -> 10 | D82: 柳风堂 | E82: 18 | F82: =R[-1]C -> 5 | G82: 50 | H82: =R[-1]C+8 -> 712 | I82: 十八罗汉中，最猛的是沉思罗汉，因为他永远都在闭目沉思，从没睁开过眼睛。甚至连如来都在怀疑他究竟是在修行还是睡觉。
A83: 81 | B83: 陶然居 | C83: 1 | D83: 陶然居 | E83: 19 | F83: =R[-1]C -> 5 | G83: 60 | H83: =R[-1]C+8 -> 720 | I83: 千里眼作为神仙中看的最远的大仙，他一直都觉得很累，也一直觉得有些尴尬，他觉得他看到的有些太多了。
A84: 82 | B84: 陶然居 | C84: =R[-1]C+1 -> 2 | D84: 陶然居 | E84: 19 | F84: =R[-1]C -> 5 | G84: 60 | H84: =R[-1]C+8 -> 728 | I84: 最近嫦娥发现广寒宫的玉兔日益减少，与此同时，她发现吴刚的嘴巴上总是沾着一些兔毛……
A85: 83 | B85: 陶然居 | C85: =R[-1]C+1 -> 3 | D85: 陶然居 | E85: 19 | F85: =R[-1]C -> 5 | G85: 60 | H85: =R[-1]C+8 -> 736 | I85: 每个进入鬼门关的灵魂，都要喝下孟婆的孟婆汤，这样他才能彻底了断人间的恩爱情仇，心平气和的到地狱去死。
A86: 84 | B86: 陶然居 | C86: =R[-1]C+1 -> 4 | D86: 陶然居 | E86: 19 | F86: =R[-1]C -> 5 | G86: 60 | H86: =R[-1]C+8 -> 744 | I86: 太阳神与火神这两哥们经常会闹矛盾，主要的争执焦点就在于，谁的火更热更猛更牛逼。
A87: 85 | B87: 陶然居 | C87: =R[-1]C+1 -> 5 | D87: 陶然居 | E87: 19 | F87: =R[-1]C -> 5 | G87: 60 | H87: =R[-1]C+8 -> 752 | I87: 土行孙既是惧留孙大仙的徒弟，同时也是他的私生子。当然，这个没人知道是正常的，大家都知道了，那不就出事了么。
A88: 86 | B88: 陶然居 | C88: =R[-1]C+1 -> 6 | D88: 陶然居 | E88: 20 | F88: =R[-1]C -> 5 | G88: 60 | H88: =R[-1]C+8 -> 760 | I88: 根据玉帝统计，仙界岁数最大的不是老寿星南极仙翁，而是守蟠桃园的那个神仙婆婆。
A89: 87 | B89: 陶然居 | C89: =R[-1]C+1 -> 7 | D89: 陶然居 | E89: 20 | F89: =R[-1]C -> 5 | G89: 60 | H89: =R[-1]C+8 -> 768 | I89: 众仙一致认为每次宴席吃的最多的就是二郎神了，因为他带着哮天犬。这只狗的饭量毫无疑问是逆天的。
A90: 88 | B90: 陶然居 | C90: =R[-1]C+1 -> 8 | D90: 陶然居 | E90: 20 | F90: =R[-1]C -> 5 | G90: 60 | H90: =R[-1]C+8 -> 776 | I90: 哮天犬不像普通狗一样，到处撒尿留记号。因为它的下体已经被沉香一斧劈坏了，所以它彻底丧失了这个功能。
A91: 89 | B91: 陶然居 | C91: =R[-1]C+1 -> 9 | D91: 陶然居 | E91: 20 | F91: =R[-1]C -> 5 | G91: 60 | H91: =R[-1]C+8 -> 784 | I91: 悟空有七十二般变化，如来比他多十倍。但如来却很羡慕悟空，因为悟空可以随便变，而他却不能。
A92: 90 | B92: 陶然居 | C92: =R[-1]C+1 -> 10 | D92: 陶然居 | E92: 20 | F92: =R[-1]C -> 5 | G92: 60 | H92: =R[-1]C+8 -> 792 | I92: 观音菩萨圣水瓶里的水其实很新鲜，菩萨每天早晨起床后都会换上新鲜的自来水，所以是可以喝的。
A93: 91 | B93: 忘情河 | C93: 1 | D93: 忘情河 | E93: 21 | F93: =R[-1]C -> 5 | G93: 70 | H93: =R[-1]C+8 -> 800 | I93: 最近十八罗汉中的长腿罗汉被辞退了。他在本届神仙田径大赛中用力过猛，造成小腿粉碎性骨折，所以不可能再随意变长了。
A94: 92 | B94: 忘情河 | C94: =R[-1]C+1 -> 2 | D94: 忘情河 | E94: 21 | F94: =R[-1]C -> 5 | G94: 70 | H94: =R[-1]C+8 -> 808 | I94: 如来最近招了一名新罗汉，叫高音罗汉。他的特点是声音高，可直通九霄云外天地三界。如来觉得他很牛逼。
A95: 93 | B95: 忘情河 | C95: =R[-1]C+1 -> 3 | D95: 忘情河 | E95: 21 | F95: =R[-1]C -> 5 | G95: 70 | H95: =R[-1]C+8 -> 816 | I95: 玉帝最近打算对七仙女进行扩招。他感觉人有点太少了，跳舞的时候氛围不够浓烈。他跟王母商量后，决定再找四十二个。
A96: 94 | B96: 忘情河 | C96: =R[-1]C+1 -> 4 | D96: 忘情河 | E96: 21 | F96: =R[-1]C -> 5 | G96: 70 | H96: =R[-1]C+8 -> 824 | I96: 蟠桃园最近发生了一件奇怪的事情，所有的桃子都有两个核，双核的。王母一直在怀疑，这桃子难道也有什么奸情么。
A97: 95 | B97: 忘情河 | C97: =R[-1]C+1 -> 5 | D97: 忘情河 | E97: 21 | F97: =R[-1]C -> 5 | G97: 70 | H97: =R[-1]C+8 -> 832 | I97: 关于至尊宝和紫霞仙子的故事，其实是有另外一个结局：他们成功的走进了婚姻的殿堂，并生有一子，取名为至尊宝宝。
A98: 96 | B98: 忘情河 | C98: =R[-1]C+1 -> 6 | D98: 忘情河 | E98: 22 | F98: =R[-1]C -> 5 | G98: 70 | H98: =R[-1]C+8 -> 840 | I98: 牛魔王一直怀疑铁扇公主与至尊宝有奸情，其实那不叫奸情，那是光明正大的真爱。
A99: 97 | B99: 忘情河 | C99: =R[-1]C+1 -> 7 | D99: 忘情河 | E99: 22 | F99: =R[-1]C -> 5 | G99: 70 | H99: =R[-1]C+8 -> 848 | I99: 红孩儿和东海三太子是结义兄弟，感情一直很深。当年哪吒抽三太子的龙筋时，红孩儿亲眼看着他被一根筋一根筋的抽死。
A100: 98 | B100: 忘情河 | C100: =R[-1]C+1 -> 8 | D100: 忘情河 | E100: 22 | F100: =R[-1]C -> 5 | G100: 70 | H100: =R[-1]C+8 -> 856 | I100: 许多神仙对嫦娥的祖籍身世一直很感兴趣，平日私下里也聊这个话题。按照玉帝的说法，嫦娥祖籍应该是黑龙江哈尔滨。
A101: 99 | B101: 忘情河 | C101: =R[-1]C+1 -> 9 | D101: 忘情河 | E101: 22 | F101: =R[-1]C -> 5 | G101: 70 | H101: =R[-1]C+8 -> 864 | I101: 赤脚大仙的脚气比较重。自从上次在凌霄殿当场将二郎神熏晕之后，玉帝就很少让他上朝了。
A102: 100 | B102: 忘情河 | C102: =R[-1]C+1 -> 10 | D102: 忘情河 | E102: 22 | F102: =R[-1]C -> 5 | G102: 70 | H102: =R[-1]C+8 -> 872 | I102: 陪着三藏走西天的那匹白龙马，其实是母马，这个三藏是知道的。三藏还给她起了另外一个名字，叫阿梅。
A103: 101 | B103: 南天门 | C103: 1 | D103: 南天门 | E103: 23 | F103: =R[-1]C -> 5 | G103: 75 | H103: =R[-1]C+8 -> 880 | I103: 原本牛郎织女相会，王母是给安排了鹊桥的。但是后来发现牛郎有恐高症，所以就只能把鹊桥给撤了。
A104: 102 | B104: 南天门 | C104: =R[-1]C+1 -> 2 | D104: 南天门 | E104: 23 | F104: =R[-1]C -> 5 | G104: 75 | H104: =R[-1]C+8 -> 888 | I104: 神仙其实对人间文化都挺有兴趣的，比如玉帝喜欢唐诗，王母喜欢宋词，七仙女喜欢元曲，二郎神喜欢金瓶梅。
A105: 103 | B105: 南天门 | C105: =R[-1]C+1 -> 3 | D105: 南天门 | E105: 23 | F105: =R[-1]C -> 5 | G105: 75 | H105: =R[-1]C+8 -> 896 | I105: 天上也会闹干旱的，没有水气，就算雷公电母再努力，那也没得下。最近银河的水位明显低了很多。
A106: 104 | B106: 南天门 | C106: =R[-1]C+1 -> 4 | D106: 南天门 | E106: 23 | F106: =R[-1]C -> 5 | G106: 75 | H106: =R[-1]C+8 -> 904 | I106: 天庭其实是有集市的，和人间许多村镇一样，都是每个月的初一和十五这两天。
A107: 105 | B107: 南天门 | C107: =R[-1]C+1 -> 5 | D107: 南天门 | E107: 23 | F107: =R[-1]C -> 5 | G107: 75 | H107: =R[-1]C+8 -> 912 | I107: 天庭集市卖的最好的是织女的织锦绸缎，而织锦中最受欢迎的首推纯棉底裤。因为神仙都没见过，看着新鲜。
A108: 106 | B108: 南天门 | C108: =R[-1]C+1 -> 6 | D108: 南天门 | E108: 24 | F108: =R[-1]C -> 5 | G108: 75 | H108: =R[-1]C+8 -> 920 | I108: 虾兵蟹将其实不是一个统称，而是两个小神仙的名称。是双胞胎，虽然无论从哪个角度看，虾和蟹都不可能成为兄弟。
A109: 107 | B109: 南天门 | C109: =R[-1]C+1 -> 7 | D109: 南天门 | E109: 24 | F109: =R[-1]C -> 5 | G109: 75 | H109: =R[-1]C+8 -> 928 | I109: 花果山的水果是不喷农药的，所以口感非常好，味道堪比王母后院的蟠桃。
A110: 108 | B110: 南天门 | C110: =R[-1]C+1 -> 8 | D110: 南天门 | E110: 24 | F110: =R[-1]C -> 5 | G110: 75 | H110: =R[-1]C+8 -> 936 | I110: 高老庄被强拆之后，八戒在另外一个地方新建了一所宅院，门匾上写着“强拆死全家”。
A111: 109 | B111: 南天门 | C111: =R[-1]C+1 -> 9 | D111: 南天门 | E111: 24 | F111: =R[-1]C -> 5 | G111: 75 | H111: =R[-1]C+8 -> 944 | I111: 沙僧住的地方和八戒的新宅院离的很近。经常晚上没事的时候他们两个会凑一起喝个小酒，慨叹当年西天取经的不容易。
A112: 110 | B112: 南天门 | C112: =R[-1]C+1 -> 10 | D112: 南天门 | E112: 24 | F112: =R[-1]C -> 5 | G112: 75 | H112: =R[-1]C+8 -> 952 | I112: 如果让悟空重新选择，就算在五指山下再压上五百年，他也不会跟唐僧去取经。他说，太XX的折腾人了。
A113: 111 | B113: 凌霄殿 | C113: 1 | D113: 凌霄殿 | E113: 25 | F113: =R[-1]C -> 5 | G113: 80 | H113: =R[-1]C+8 -> 960 | I113: 由于终年累月的坐在蒲团上进行修行，很多神仙都坐骨增生。
A114: 112 | B114: 凌霄殿 | C114: =R[-1]C+1 -> 2 | D114: 凌霄殿 | E114: 25 | F114: =R[-1]C -> 5 | G114: 80 | H114: =R[-1]C+8 -> 968 | I114: 每年仙界都会举行一次仙法大会，旨在检验各路神仙这一年来的修仙成果。上一年的冠军是，哮天犬。
A115: 113 | B115: 凌霄殿 | C115: =R[-1]C+1 -> 3 | D115: 凌霄殿 | E115: 25 | F115: =R[-1]C -> 5 | G115: 80 | H115: =R[-1]C+8 -> 976 | I115: 神仙不同与凡人，都是耳聪目明之仙，有个什么动静能很快感觉到。所以后来玉帝定了一条新的天规：晚上尽量不要声音太大。
A116: 114 | B116: 凌霄殿 | C116: =R[-1]C+1 -> 4 | D116: 凌霄殿 | E116: 25 | F116: =R[-1]C -> 5 | G116: 80 | H116: =R[-1]C+8 -> 984 | I116: 黑白无常最近迷上了一个很有意思的游戏，叫捉迷藏。每天晚饭后，他们都会拉上阎王他们玩上一把。
A117: 115 | B117: 凌霄殿 | C117: =R[-1]C+1 -> 5 | D117: 凌霄殿 | E117: 25 | F117: =R[-1]C -> 5 | G117: 80 | H117: =R[-1]C+8 -> 992 | I117: 很多人都认为阎罗王是包拯的化身。其实阎王自己很清楚，他和包拯连毛的关系都没有，他甚至都没有听说过这个人。
A118: 116 | B118: 凌霄殿 | C118: =R[-1]C+1 -> 6 | D118: 凌霄殿 | E118: 26 | F118: =R[-1]C -> 5 | G118: 80 | H118: =R[-1]C+8 -> 1000 | I118: 三界神仙中，最黑的是阎罗王，最白的是牡丹仙子，最黄的，大家一致认为是二郎神。
A119: 117 | B119: 凌霄殿 | C119: =R[-1]C+1 -> 7 | D119: 凌霄殿 | E119: 26 | F119: =R[-1]C -> 5 | G119: 80 | H119: =R[-1]C+8 -> 1008 | I119: 许多人可能不知道，其实阎王是有家室的人，他的妻子叫黑玫瑰。是一个比阎罗王更黑的温柔女子，黑的发亮。
A120: 118 | B120: 凌霄殿 | C120: =R[-1]C+1 -> 8 | D120: 凌霄殿 | E120: 26 | F120: =R[-1]C -> 5 | G120: 80 | H120: =R[-1]C+8 -> 1016 | I120: 玉帝很喜欢音乐，其本人也是一个很有音乐天赋的。最近他迷上了民族风，口头禅经常是：哟，哟，切克闹。
A121: 119 | B121: 凌霄殿 | C121: =R[-1]C+1 -> 9 | D121: 凌霄殿 | E121: 26 | F121: =R[-1]C -> 5 | G121: 80 | H121: =R[-1]C+8 -> 1024 | I121: 和日游神相比，夜游神总是比较烦躁。因为在夜里巡游的时候，他经常遇到许多谈情说爱的散仙，弄的他很尴尬。
A122: 120 | B122: 凌霄殿 | C122: =R[-1]C+1 -> 10 | D122: 凌霄殿 | E122: 26 | F122: =R[-1]C -> 5 | G122: 80 | H122: =R[-1]C+8 -> 1032 | I122: 为了整顿仙风，玉帝今日发布了禁肖令。所有神仙夜里无事一律不能出来，有事也不能随便出来，那些夜猫子们，该消停了。
A123: 121 | B123: 冷月宫 | C123: 1 | D123: 冷月宫 | E123: 27 | F123: =R[-1]C -> 5 | G123: 85 | H123: =R[-1]C+8 -> 1040 | I123: 唐僧显然对于那些有拖延症的妖怪们受够了，每次抓到他，那些怪一定会说：大王，你看要不等抓到那孙猴子，再吃唐僧肉？
A124: 122 | B124: 冷月宫 | C124: =R[-1]C+1 -> 2 | D124: 冷月宫 | E124: 27 | F124: =R[-1]C -> 5 | G124: 85 | H124: =R[-1]C+8 -> 1048 | I124: 贪污受贿不仅仅是人间的一个正常情况，在仙界也是如此。作为玉帝身边的红人，太白金星家中堆满了各路神仙送来的仙币。
A125: 123 | B125: 冷月宫 | C125: =R[-1]C+1 -> 3 | D125: 冷月宫 | E125: 27 | F125: =R[-1]C -> 5 | G125: 85 | H125: =R[-1]C+8 -> 1056 | I125: 托塔天王李靖最近离婚了，这在仙界引起了不小的震撼。按李天王自己的说法，是妻子太强势了。
A126: 124 | B126: 冷月宫 | C126: =R[-1]C+1 -> 4 | D126: 冷月宫 | E126: 27 | F126: =R[-1]C -> 5 | G126: 85 | H126: =R[-1]C+8 -> 1064 | I126: 最近仙界的违章建筑特别多，为了彻底消除这一现象，玉帝任命巨灵神为拆迁队队长，只要发现违章建筑，往死里拆。
A127: 125 | B127: 冷月宫 | C127: =R[-1]C+1 -> 5 | D127: 冷月宫 | E127: 27 | F127: =R[-1]C -> 5 | G127: 85 | H127: =R[-1]C+8 -> 1072 | I127: 二郎神一直很屌，许多散仙一直在不停的上访，希望告倒这个仙界恶霸，但总是到不了玉帝跟前就被压了下去。唉……
A128: 126 | B128: 冷月宫 | C128: =R[-1]C+1 -> 6 | D128: 冷月宫 | E128: 28 | F128: =R[-1]C -> 5 | G128: 85 | H128: =R[-1]C+8 -> 1080 | I128: 作为玉帝最宠爱的仙界勇士，二郎神飞扬跋扈到了极致。他的口头禅是：我的底盘我做主！
A129: 127 | B129: 冷月宫 | C129: =R[-1]C+1 -> 7 | D129: 冷月宫 | E129: 28 | F129: =R[-1]C -> 5 | G129: 85 | H129: =R[-1]C+8 -> 1088 | I129: 地狱万千恶鬼中，最厉害的大概就属黑罗刹了。他就相当于监狱中的黑老大。就连阎罗王，都得让着他三分。
A130: 128 | B130: 冷月宫 | C130: =R[-1]C+1 -> 8 | D130: 冷月宫 | E130: 28 | F130: =R[-1]C -> 5 | G130: 85 | H130: =R[-1]C+8 -> 1096 | I130: 黄泉路是进入鬼门关之后的一条路，很远，很荒凉。当你走到这条路上的时候，你只有一种感觉，那就是，绝望。
A131: 129 | B131: 冷月宫 | C131: =R[-1]C+1 -> 9 | D131: 冷月宫 | E131: 28 | F131: =R[-1]C -> 5 | G131: 85 | H131: =R[-1]C+8 -> 1104 | I131: 许多人都会好奇那碗让人忘掉来世今生的孟婆汤到底是什么味道，按照阎王的说法，跟河南烩面馆的胡辣汤味道差不多。
A132: 130 | B132: 冷月宫 | C132: =R[-1]C+1 -> 10 | D132: 冷月宫 | E132: 28 | F132: =R[-1]C -> 5 | G132: 85 | H132: =R[-1]C+8 -> 1112 | I132: 相传孟婆就是那位哭倒万里长城的孟姜女。此传闻不知是真是假，但有一点是真的，孟婆不是老婆婆，而是一位绝色美人。
A133: 131 | B133: 蟠桃园 | C133: 1 | D133: 蟠桃园 | E133: 29 | F133: =R[-1]C -> 5 | G133: 90 | H133: =R[-1]C+8 -> 1120 | I133: 玉帝最近晚上老是失眠，就算好不容易睡着了也是梦多，盗汗。作为仙界最高领袖，其实他的压力也是蛮大的。
A134: 132 | B134: 蟠桃园 | C134: =R[-1]C+1 -> 2 | D134: 蟠桃园 | E134: 29 | F134: =R[-1]C -> 5 | G134: 90 | H134: =R[-1]C+8 -> 1128 | I134: 前几天南天门突然莫名其妙的倒塌了，这直接切断了仙界与地狱之间的通道，目前还在抢修，倒塌原因不明。
A135: 133 | B135: 蟠桃园 | C135: =R[-1]C+1 -> 3 | D135: 蟠桃园 | E135: 29 | F135: =R[-1]C -> 5 | G135: 90 | H135: =R[-1]C+8 -> 1136 | I135: 其实不光二郎神养宠物，其他许多神仙也会养，比如太上老君最近就养了一条藏獒。
A136: 134 | B136: 蟠桃园 | C136: =R[-1]C+1 -> 4 | D136: 蟠桃园 | E136: 29 | F136: =R[-1]C -> 5 | G136: 90 | H136: =R[-1]C+8 -> 1144 | I136: 凌霄宝殿没有我们想象中的那么开阔，甚至面积挺小的，满打满算大概也就九十平。之所以搞这么小据说是玉帝的意思。
A137: 135 | B137: 蟠桃园 | C137: =R[-1]C+1 -> 5 | D137: 蟠桃园 | E137: 29 | F137: =R[-1]C -> 5 | G137: 90 | H137: =R[-1]C+8 -> 1152 | I137: 因为最近的水质污染过于严重，河神直接染病，不治而亡。
A138: 136 | B138: 蟠桃园 | C138: =R[-1]C+1 -> 6 | D138: 蟠桃园 | E138: 30 | F138: =R[-1]C -> 5 | G138: 90 | H138: =R[-1]C+8 -> 1160 | I138: 绝大多数神仙下凡之后，最喜欢做的一件事是足疗。只有赤脚大仙除外，因为他的脚气神仙都受不了，更何况凡人。
A139: 137 | B139: 蟠桃园 | C139: =R[-1]C+1 -> 7 | D139: 蟠桃园 | E139: 30 | F139: =R[-1]C -> 5 | G139: 90 | H139: =R[-1]C+8 -> 1168 | I139: 哮天犬最近怀上了。二郎神一直很紧张，他自己也不确定这是不是和他有关。
A140: 138 | B140: 蟠桃园 | C140: =R[-1]C+1 -> 8 | D140: 蟠桃园 | E140: 30 | F140: =R[-1]C -> 5 | G140: 90 | H140: =R[-1]C+8 -> 1176 | I140: 太上老君的炼丹炉近日突然发生了爆炸，老君被严重烧伤当场疼的嗷嗷直叫。后经过调查，是炼丹炉质量有问题。
A141: 139 | B141: 蟠桃园 | C141: =R[-1]C+1 -> 9 | D141: 蟠桃园 | E141: 30 | F141: =R[-1]C -> 5 | G141: 90 | H141: =R[-1]C+8 -> 1184 | I141: 对于近来人间流行的各种拼爹事件，神仙们也经常在一起讨论。他们一致认为，这种爹，应及早让阎王收了他。
A142: 140 | B142: 蟠桃园 | C142: =R[-1]C+1 -> 10 | D142: 蟠桃园 | E142: 30 | F142: =R[-1]C -> 5 | G142: 90 | H142: =R[-1]C+8 -> 1192 | I142: 玉帝一直不太相信地沟油有那么大的危害，他特地让文曲星下凡体验了一回，结果文曲星差点拉肚子拉死在人间。
A143: 141 | B143: 王母峰 | C143: 1 | D143: 王母峰 | E143: 31 | F143: =R[-1]C -> 5 | G143: 95 | H143: =R[-1]C+8 -> 1200 | I143: 关于人间房价一直过高的这个事儿，玉帝隔三差五的就着急众仙进行讨论，但每次结果都很一致，那就是，绝不会降下来的。
A144: 142 | B144: 王母峰 | C144: =R[-1]C+1 -> 2 | D144: 王母峰 | E144: 31 | F144: =R[-1]C -> 5 | G144: 95 | H144: =R[-1]C+8 -> 1208 | I144: 牛郎闲来无事就在银河边上开辟了一块地，专门种各种蔬菜，豆角，西红柿，黄瓜，辣椒，等等。他把这个叫做：菜篮子工程。
A145: 143 | B145: 王母峰 | C145: =R[-1]C+1 -> 3 | D145: 王母峰 | E145: 31 | F145: =R[-1]C -> 5 | G145: 95 | H145: =R[-1]C+8 -> 1216 | I145: 太乙真人常年居住在火焰山脚下，他希望能够早日炼成火云掌，在来年的仙界法术大赛中一展身手。
A146: 144 | B146: 王母峰 | C146: =R[-1]C+1 -> 4 | D146: 王母峰 | E146: 31 | F146: =R[-1]C -> 5 | G146: 95 | H146: =R[-1]C+8 -> 1224 | I146: 红孩儿的三味真火是他的成名绝技。不过虽然练就了这法术，不过他的脑子也被烧坏了，所以他脑子有问题。
A147: 145 | B147: 王母峰 | C147: =R[-1]C+1 -> 5 | D147: 王母峰 | E147: 31 | F147: =R[-1]C -> 5 | G147: 95 | H147: =R[-1]C+8 -> 1232 | I147: 白骨精并非我们想象中的那么阴森恐怖，恰恰相反，无论身材还是相貌，她们甚至堪比嫦娥。
A148: 146 | B148: 王母峰 | C148: =R[-1]C+1 -> 6 | D148: 王母峰 | E148: 32 | F148: =R[-1]C -> 5 | G148: 95 | H148: =R[-1]C+8 -> 1240 | I148: 一千个人的眼中有一千个哈姆雷特。一千个神仙的眼中有一千个嫦娥。
A149: 147 | B149: 王母峰 | C149: =R[-1]C+1 -> 7 | D149: 王母峰 | E149: 32 | F149: =R[-1]C -> 5 | G149: 95 | H149: =R[-1]C+8 -> 1248 | I149: “现在想想还是包办婚姻好，自由恋爱根本就没人要啊！”赤脚大仙拖着他散发着脚气的大脚，哀叹道。。。
A150: 148 | B150: 王母峰 | C150: =R[-1]C+1 -> 8 | D150: 王母峰 | E150: 32 | F150: =R[-1]C -> 5 | G150: 95 | H150: =R[-1]C+8 -> 1256 | I150: 土地公是所有神仙中最矮的，据说身高不到一尺。一千个土地公叠起来，刚好到巨灵神的裤裆。
A151: 149 | B151: 王母峰 | C151: =R[-1]C+1 -> 9 | D151: 王母峰 | E151: 32 | F151: =R[-1]C -> 5 | G151: 95 | H151: =R[-1]C+8 -> 1264 | I151: 如来一直希望能够到凡间走一走，实际体验一下凡人的生活。但这很难实现，因为他官太大了。
A152: 150 | B152: 王母峰 | C152: =R[-1]C+1 -> 10 | D152: 王母峰 | E152: 32 | F152: =R[-1]C -> 5 | G152: 95 | H152: =R[-1]C+8 -> 1272 | I152: 八戒刚刚新建起来的宅子又被强行拆掉了。八戒有些绝望了，老子跟随唐三藏西天取经那么辛苦，自己造个宅子也不行么。
A153: 151 | B153: 流沙河 | C153: 1 | D153: 流沙河 | E153: 33 | F153: =R[-1]C -> 5 | G153: 100 | H153: =R[-1]C+8 -> 1280 | I153: 土行孙近日将举行大婚，迎娶七仙女中最小的那位，也是最漂亮的。仙子说了，她就喜欢这种畸形的，看着就特刺激。
A154: 152 | B154: 流沙河 | C154: =R[-1]C+1 -> 2 | D154: 流沙河 | E154: 33 | F154: =R[-1]C -> 5 | G154: 100 | H154: =R[-1]C+8 -> 1288 | I154: 八戒问悟净：“你猜猜我口袋里有多少颗糖，猜对了我两颗都给你吃！”悟净顿了顿：“五…五颗！”
A155: 153 | B155: 流沙河 | C155: =R[-1]C+1 -> 3 | D155: 流沙河 | E155: 33 | F155: =R[-1]C -> 5 | G155: 100 | H155: =R[-1]C+8 -> 1296 | I155: 并非所有的神仙出行都是脚踏七色云彩，云彩作为仙界最高档次的出行工具，那都是经过佛祖加持的。
A156: 154 | B156: 流沙河 | C156: =R[-1]C+1 -> 4 | D156: 流沙河 | E156: 33 | F156: =R[-1]C -> 5 | G156: 100 | H156: =R[-1]C+8 -> 1304 | I156: 降龙和伏虎其实不是两个神仙，而是一个神仙，一个同时长着龙头和虎头的怪仙。
A157: 155 | B157: 流沙河 | C157: =R[-1]C+1 -> 5 | D157: 流沙河 | E157: 33 | F157: =R[-1]C -> 5 | G157: 100 | H157: =R[-1]C+8 -> 1312 | I157: 许多人都认为阎罗王是地狱的老大，但实际上，泰山神东岳大帝才是冥界的真正主宰，最高之神。
A158: 156 | B158: 流沙河 | C158: =R[-1]C+1 -> 6 | D158: 流沙河 | E158: 34 | F158: =R[-1]C -> 5 | G158: 100 | H158: =R[-1]C+8 -> 1320 | I158: 阎罗殿设有五宫十殿三十六王，每个人各司其职，共同协助阎王掌管整个鬼界。
A159: 157 | B159: 流沙河 | C159: =R[-1]C+1 -> 7 | D159: 流沙河 | E159: 34 | F159: =R[-1]C -> 5 | G159: 100 | H159: =R[-1]C+8 -> 1328 | I159: 人生在世，最好不要随意杀生，否则等你到了地狱的时候，所有被你杀过的牲畜都会轮番折磨你，让你苦不堪言。
A160: 158 | B160: 流沙河 | C160: =R[-1]C+1 -> 8 | D160: 流沙河 | E160: 34 | F160: =R[-1]C -> 5 | G160: 100 | H160: =R[-1]C+8 -> 1336 | I160: 轮回转世的时间其实很长，按照人间时间来算，一个人从生到死再到生，这样一个轮回大概需要上亿年。
A161: 159 | B161: 流沙河 | C161: =R[-1]C+1 -> 9 | D161: 流沙河 | E161: 34 | F161: =R[-1]C -> 5 | G161: 100 | H161: =R[-1]C+8 -> 1344 | I161: 许多人都以为天上的十八罗汉就是少林寺的十八罗汉，这完全就是两个概念。
A162: 160 | B162: 流沙河 | C162: =R[-1]C+1 -> 10 | D162: 流沙河 | E162: 34 | F162: =R[-1]C -> 5 | G162: 100 | H162: =R[-1]C+8 -> 1352 | I162: 仙界五大战神之中，大地战神法术最高，而北极战神则最为睿智。
A163: 161 | B163: 五指山 | C163: 1 | D163: 五指山 | E163: 35 | F163: =R[-1]C -> 5 | G163: 105 | H163: =R[-1]C+8 -> 1360 | I163: 北斗星君其实不是一个人，而是七个神仙，北斗七星中，每一颗星都是一位大仙。
A164: 162 | B164: 五指山 | C164: =R[-1]C+1 -> 2 | D164: 五指山 | E164: 35 | F164: =R[-1]C -> 5 | G164: 105 | H164: =R[-1]C+8 -> 1368 | I164: 关于八仙中曹国舅的名字来历，玉帝是这么说的，他是一个叫曹国的人的舅舅。
A165: 163 | B165: 五指山 | C165: =R[-1]C+1 -> 3 | D165: 五指山 | E165: 35 | F165: =R[-1]C -> 5 | G165: 105 | H165: =R[-1]C+8 -> 1376 | I165: 其实盘古爷当年开天辟地的时候，并非一蹴而就。而是劈了很久很久才将混沌天地劈开，很辛苦。
A166: 164 | B166: 五指山 | C166: =R[-1]C+1 -> 4 | D166: 五指山 | E166: 35 | F166: =R[-1]C -> 5 | G166: 105 | H166: =R[-1]C+8 -> 1384 | I166: 天聋地哑附在万物，生育万物，是天父和地母，可以说是万物赖以生存繁衍之根本。在仙界地位极高。
A167: 165 | B167: 五指山 | C167: =R[-1]C+1 -> 5 | D167: 五指山 | E167: 35 | F167: =R[-1]C -> 5 | G167: 105 | H167: =R[-1]C+8 -> 1392 | I167: 九头鸟原本是一只神鸟，后来因为听说魂气可以让自己羽毛更漂亮，便逐渐由神格沦落为收人魂气的妖鸟。都是美丽惹的祸。
A168: 166 | B168: 五指山 | C168: =R[-1]C+1 -> 6 | D168: 五指山 | E168: 36 | F168: =R[-1]C -> 5 | G168: 105 | H168: =R[-1]C+8 -> 1400 | I168: 通天教主可以算是仙界中最为特殊的一位大仙，他辈分极高，法术极强，且又亦正亦邪。玉帝拿他很头疼，不知道该怎么办。
A169: 167 | B169: 五指山 | C169: =R[-1]C+1 -> 7 | D169: 五指山 | E169: 36 | F169: =R[-1]C -> 5 | G169: 105 | H169: =R[-1]C+8 -> 1408 | I169: 月老真的老了，最近经常在搭线的时候手一哆嗦就搞错了。这导致人间许多男子在洞房完了之后才发现女的不是自己媳妇。
A170: 168 | B170: 五指山 | C170: =R[-1]C+1 -> 8 | D170: 五指山 | E170: 36 | F170: =R[-1]C -> 5 | G170: 105 | H170: =R[-1]C+8 -> 1416 | I170: 神仙崇尚清心寡欲，无欲而修。所以在仙界是禁止吃肉的。唯独巨灵神除外，他说，不让我吃肉，我宁愿现在就下地狱。
A171: 169 | B171: 五指山 | C171: =R[-1]C+1 -> 9 | D171: 五指山 | E171: 36 | F171: =R[-1]C -> 5 | G171: 105 | H171: =R[-1]C+8 -> 1424 | I171: 因为气候干旱，蟠桃园里的桃子发育不良。迫不得已，王母将每年一次的蟠桃盛会改为每一万年一次。
A172: 170 | B172: 五指山 | C172: =R[-1]C+1 -> 10 | D172: 五指山 | E172: 36 | F172: =R[-1]C -> 5 | G172: 105 | H172: =R[-1]C+8 -> 1432 | I172: 土行孙发朋友圈：我在南天门公厕忘记带纸巾啦，谁来救我？玉帝看到此信息，不慌不忙，默默地点了个赞！
A173: 171 | B173: 女儿国 | C173: 1 | D173: 女儿国 | E173: 37 | F173: =R[-1]C -> 5 | G173: 110 | H173: =R[-1]C+8 -> 1440 | I173: 在饮食方面，神仙各自喜好不同。南华大仙喜食蔬菜，战神刑天喜使水果，二郎神喜食臊子面，玉帝喜食四川火锅。
A174: 172 | B174: 女儿国 | C174: =R[-1]C+1 -> 2 | D174: 女儿国 | E174: 37 | F174: =R[-1]C -> 5 | G174: 110 | H174: =R[-1]C+8 -> 1448 | I174: 在修行方面，每个神仙的方式不同。最具特色的是赤脚大仙，他的修行方式是抠脚丫子，一边扣一边闻。
A175: 173 | B175: 女儿国 | C175: =R[-1]C+1 -> 3 | D175: 女儿国 | E175: 37 | F175: =R[-1]C -> 5 | G175: 110 | H175: =R[-1]C+8 -> 1456 | I175: 白虎神君作为四大守护神兽之一，最近显得有些烦躁。因为他脑袋上的那个王字也不知道什么时候被谁给扣掉了。
A176: 174 | B176: 女儿国 | C176: =R[-1]C+1 -> 4 | D176: 女儿国 | E176: 37 | F176: =R[-1]C -> 5 | G176: 110 | H176: =R[-1]C+8 -> 1464 | I176: 鹿角大仙化身为一只梅花鹿下凡体察民生的时候，不小心被一群猎手逮住，割掉了双角。这让他痛不欲生。
A177: 175 | B177: 女儿国 | C177: =R[-1]C+1 -> 5 | D177: 女儿国 | E177: 37 | F177: =R[-1]C -> 5 | G177: 110 | H177: =R[-1]C+8 -> 1472 | I177: 凡间百姓有钱人越来越多，对貂绒需求量越来越大，为了防止仙貂绝种，玉帝今日下令，所有仙貂，永远不能出现在凡间。
A178: 176 | B178: 女儿国 | C178: =R[-1]C+1 -> 6 | D178: 女儿国 | E178: 38 | F178: =R[-1]C -> 5 | G178: 110 | H178: =R[-1]C+8 -> 1480 | I178: 玉帝总共有三处行宫，一处是凌霄殿，一处是琼华宫，还有一处是用来度假的，在蓬莱。
A179: 177 | B179: 女儿国 | C179: =R[-1]C+1 -> 7 | D179: 女儿国 | E179: 38 | F179: =R[-1]C -> 5 | G179: 110 | H179: =R[-1]C+8 -> 1488 | I179: 其实蓬莱原本属于蓬莱仙子的，但是后来这地方被玉帝看上了，所以仙子只好搬出去。领导的话必须要听，不管你是人还是神。
A180: 178 | B180: 女儿国 | C180: =R[-1]C+1 -> 8 | D180: 女儿国 | E180: 38 | F180: =R[-1]C -> 5 | G180: 110 | H180: =R[-1]C+8 -> 1496 | I180: 修行之余，神仙们一般也会组织一些娱乐活动，比如足球，篮球，乒乓球，手球，橄榄球，网球，台球，高尔夫，等等。
A181: 179 | B181: 女儿国 | C181: =R[-1]C+1 -> 9 | D181: 女儿国 | E181: 38 | F181: =R[-1]C -> 5 | G181: 110 | H181: =R[-1]C+8 -> 1504 | I181: 托塔天王最喜欢的课外活动是，做仰卧起坐。李天王对自己的体型非常看重。尤其是腹肌这一块，他总是希望能够再雕刻雕刻。
A182: 180 | B182: 女儿国 | C182: =R[-1]C+1 -> 10 | D182: 女儿国 | E182: 38 | F182: =R[-1]C -> 5 | G182: 110 | H182: =R[-1]C+8 -> 1512 | I182: 三圣母最近打算再婚了。这一次，二郎神不打算再把亲妹子压在华山下了，他也想通了，这玩意也就那么个事，不需要太较真。
A183: 181 | B183: 曲女城 | C183: 1 | D183: 曲女城 | E183: 39 | F183: =R[-1]C -> 5 | G183: 115 | H183: =R[-1]C+8 -> 1520 | I183: 地狱判官钟馗最近向阎王提出，他不想晚上一个人睡，理由是他怕鬼。阎王愣了半天，不知道该如何回答他。
A184: 182 | B184: 曲女城 | C184: =R[-1]C+1 -> 2 | D184: 曲女城 | E184: 39 | F184: =R[-1]C -> 5 | G184: 115 | H184: =R[-1]C+8 -> 1528 | I184: 铁拐李很喜欢画画，尤喜画美女图，只不过每次那女的看起来都很像何仙姑。这让吕洞宾很不爽，你这是把老子完全忽略了么。
A185: 183 | B185: 曲女城 | C185: =R[-1]C+1 -> 3 | D185: 曲女城 | E185: 39 | F185: =R[-1]C -> 5 | G185: 115 | H185: =R[-1]C+8 -> 1536 | I185: 关于人间主要的娱乐活动，玉帝召集众仙经过慎重讨论，得出如下结论：第一是足球，第二是篮球，第三是躺尸。
A186: 184 | B186: 曲女城 | C186: =R[-1]C+1 -> 4 | D186: 曲女城 | E186: 39 | F186: =R[-1]C -> 5 | G186: 115 | H186: =R[-1]C+8 -> 1544 | I186: 无花大仙是仙界最为特殊的一位大仙，因为他只有下半身，而且平日里都是穿肉色丝袜。玉帝一直觉得哪里不对劲。。。
A187: 185 | B187: 曲女城 | C187: =R[-1]C+1 -> 5 | D187: 曲女城 | E187: 39 | F187: =R[-1]C -> 5 | G187: 115 | H187: =R[-1]C+8 -> 1552 | I187: 玉帝一直人为八仙中的吕洞宾和韩湘子感觉总有点怪怪的，最近，吕与韩高调宣布出柜的消息验证了他的这种感觉。
A188: 186 | B188: 曲女城 | C188: =R[-1]C+1 -> 6 | D188: 曲女城 | E188: 40 | F188: =R[-1]C -> 5 | G188: 115 | H188: =R[-1]C+8 -> 1560 | I188: 几乎仙界所有的仙女都对吴刚常年劈砍桂树所练出来的雄健体魄充满了兴趣，她们都希望能够亲手摸一摸，甚至包括王母在内。
A189: 187 | B189: 曲女城 | C189: =R[-1]C+1 -> 7 | D189: 曲女城 | E189: 40 | F189: =R[-1]C -> 5 | G189: 115 | H189: =R[-1]C+8 -> 1568 | I189: 邓婵玉当初下嫁给土行孙，这完全就是姜子牙的主意，如此一个大美人跟着这么一个孙子，白瞎了。
A190: 188 | B190: 曲女城 | C190: =R[-1]C+1 -> 8 | D190: 曲女城 | E190: 40 | F190: =R[-1]C -> 5 | G190: 115 | H190: =R[-1]C+8 -> 1576 | I190: 西王母和王母既不是一个神仙，也不是姐妹，他们之间完全没有联系，而且西王母是的男的。
A191: 189 | B191: 曲女城 | C191: =R[-1]C+1 -> 9 | D191: 曲女城 | E191: 40 | F191: =R[-1]C -> 5 | G191: 115 | H191: =R[-1]C+8 -> 1584 | I191: 玉兔看着吴刚面前冒着青烟的烧烤架，它忍不住的留下了眼泪，再这么吃下去，广寒宫的兔子就完蛋了。
A192: 190 | B192: 曲女城 | C192: =R[-1]C+1 -> 10 | D192: 曲女城 | E192: 40 | F192: =R[-1]C -> 5 | G192: 115 | H192: =R[-1]C+8 -> 1592 | I192: 作为神仙中出了名的医仙，牡丹仙子每天她都会下凡人间，广施恩泽，救苦救难。她是百姓心中真正的菩萨。
A193: 191 | B193: 天竺寺 | C193: 1 | D193: 天竺寺 | E193: 41 | F193: =R[-1]C -> 5 | G193: 120 | H193: =R[-1]C+8 -> 1600 | I193: 百花仙子穿的衣服是由一百朵玫瑰花织成的，织的天衣无缝。二郎神盯了八百多年，还是没有发现漏点。
A194: 192 | B194: 天竺寺 | C194: =R[-1]C+1 -> 2 | D194: 天竺寺 | E194: 41 | F194: =R[-1]C -> 5 | G194: 120 | H194: =R[-1]C+8 -> 1608 | I194: 百花仙子和花神是两个神仙，花神几乎和百花仙子一样的年轻貌美，但事实上花神是百花仙子她妈。
A195: 193 | B195: 天竺寺 | C195: =R[-1]C+1 -> 3 | D195: 天竺寺 | E195: 41 | F195: =R[-1]C -> 5 | G195: 120 | H195: =R[-1]C+8 -> 1616 | I195: 很多人不知道，其实神仙中是有床神的，而且地位很高。所以，如果床上生活有问题的，大家可以拜一拜。
A196: 194 | B196: 天竺寺 | C196: =R[-1]C+1 -> 4 | D196: 天竺寺 | E196: 41 | F196: =R[-1]C -> 5 | G196: 120 | H196: =R[-1]C+8 -> 1624 | I196: 宓妃是仙女当中另一位绝色佳人，其美貌程度不亚于嫦娥。据说当时帮她整容的那个医生已经被灭口。
A197: 195 | B197: 天竺寺 | C197: =R[-1]C+1 -> 5 | D197: 天竺寺 | E197: 41 | F197: =R[-1]C -> 5 | G197: 120 | H197: =R[-1]C+8 -> 1632 | I197: 精卫平均一天可以往大海里填三十颗石子，龙王算过，照这个速度，它要想填平大海，大概需要八亿亿亿亿亿年零九个月。
A198: 196 | B198: 天竺寺 | C198: =R[-1]C+1 -> 6 | D198: 天竺寺 | E198: 42 | F198: =R[-1]C -> 5 | G198: 120 | H198: =R[-1]C+8 -> 1640 | I198: 大禹治水，功德无量，流芳百世。但很多人可能不知道，其实大禹不会游泳，而且很怕水，简直怕的要命。
A199: 197 | B199: 天竺寺 | C199: =R[-1]C+1 -> 7 | D199: 天竺寺 | E199: 42 | F199: =R[-1]C -> 5 | G199: 120 | H199: =R[-1]C+8 -> 1648 | I199: 最近天庭扩招，来了很多新人。附近餐馆都是人满为患，很多神仙甚至不得不下凡去用餐。所以玉帝决定盖一个食堂。
A200: 198 | B200: 天竺寺 | C200: =R[-1]C+1 -> 8 | D200: 天竺寺 | E200: 42 | F200: =R[-1]C -> 5 | G200: 120 | H200: =R[-1]C+8 -> 1656 | I200: 最近龟神有些烦，因饭量日益增加，再加上头部吸收营养能力过强，导致他的头越来越大。现在晚上睡觉都缩不回去了。
A201: 199 | B201: 天竺寺 | C201: =R[-1]C+1 -> 9 | D201: 天竺寺 | E201: 42 | F201: =R[-1]C -> 5 | G201: 120 | H201: =R[-1]C+8 -> 1664 | I201: 哪吒的风火轮因为使用频率过高，所以已经被彻底烧坏了，现在基本上也就是当个旱冰鞋来穿。
A202: 200 | B202: 天竺寺 | C202: =R[-1]C+1 -> 10 | D202: 天竺寺 | E202: 42 | F202: =R[-1]C -> 5 | G202: 120 | H202: =R[-1]C+8 -> 1672 | I202: 孟姜女当年的一哭，不仅哭倒了万里长城，也哭碎了玉帝的心。这是他唯一一次动过凡心，不过这个事王母是不知道的。
A203: 201 | B203: 圣女峰 | C203: 1 | D203: 圣女峰 | E203: 43 | F203: =R[-1]C -> 5 | G203: 125 | H203: =R[-1]C+8 -> 1680 | I203: 玉帝最近打算恢复八戒天蓬元帅的职位。少了这么一个喜欢调戏妇女的元帅，玉帝总觉得生活变得枯燥了很多。
A204: 202 | B204: 圣女峰 | C204: =R[-1]C+1 -> 2 | D204: 圣女峰 | E204: 43 | F204: =R[-1]C -> 5 | G204: 125 | H204: =R[-1]C+8 -> 1688 | I204: 人间空气污染指数的上升，直接影响了仙界的空气质量，南天门最近空气的PM指数已经达到了800多，属重度雾霾。
A205: 203 | B205: 圣女峰 | C205: =R[-1]C+1 -> 3 | D205: 圣女峰 | E205: 43 | F205: =R[-1]C -> 5 | G205: 125 | H205: =R[-1]C+8 -> 1696 | I205: 近日新造的各大仙宫陆续出现了漏水现象，玉帝已下令彻查此事，严格控制房屋质量，确保神仙的基本生活品质。
A206: 204 | B206: 圣女峰 | C206: =R[-1]C+1 -> 4 | D206: 圣女峰 | E206: 43 | F206: =R[-1]C -> 5 | G206: 125 | H206: =R[-1]C+8 -> 1704 | I206: 许多神仙都非常喜欢人间的足球这项运动。最近这一届世界杯他们打算化身成球迷前往巴西到现场去看一看。
A207: 205 | B207: 圣女峰 | C207: =R[-1]C+1 -> 5 | D207: 圣女峰 | E207: 43 | F207: =R[-1]C -> 5 | G207: 125 | H207: =R[-1]C+8 -> 1712 | I207: 对于人间流行天杀的这个称呼，玉帝很不喜欢，感觉气氛不太对，所以他打算把这三个字永久删除掉。
A208: 206 | B208: 圣女峰 | C208: =R[-1]C+1 -> 6 | D208: 圣女峰 | E208: 44 | F208: =R[-1]C -> 5 | G208: 125 | H208: =R[-1]C+8 -> 1720 | I208: 前些日子二郎神发现哮天犬长了个痔疮，这让他有些惴惴不安，他不知道这是不是和他有关系。
A209: 207 | B209: 圣女峰 | C209: =R[-1]C+1 -> 7 | D209: 圣女峰 | E209: 44 | F209: =R[-1]C -> 5 | G209: 125 | H209: =R[-1]C+8 -> 1728 | I209: 凌霄殿的豆腐渣工程最近才被发现，主要是因为蜘蛛侠发射出来的蜘蛛丝抠下了一大块墙皮，华丽丽的摔死了。。
A210: 208 | B210: 圣女峰 | C210: =R[-1]C+1 -> 8 | D210: 圣女峰 | E210: 44 | F210: =R[-1]C -> 5 | G210: 125 | H210: =R[-1]C+8 -> 1736 | I210: 王母娘娘心系三界，她经常督促各路神仙，多到人间去走一走看一看，体验下百姓疾苦，真相往往都是在基层。
A211: 209 | B211: 圣女峰 | C211: =R[-1]C+1 -> 9 | D211: 圣女峰 | E211: 44 | F211: =R[-1]C -> 5 | G211: 125 | H211: =R[-1]C+8 -> 1744 | I211: 身为一代鬼王，修罗王一直想争阎罗王这个位子，众鬼纷纷提醒阎王爷要留神。阎王淡淡一笑说没事老子早就干腻了。
A212: 210 | B212: 圣女峰 | C212: =R[-1]C+1 -> 10 | D212: 圣女峰 | E212: 44 | F212: =R[-1]C -> 5 | G212: 125 | H212: =R[-1]C+8 -> 1752 | I212: 地狱里是可以看到阳光的，每天中午，阎王都会带着众鬼将在森罗大殿晒晒太阳，聊聊天，整体氛围是很温馨的。
A213: 211 | B213: 空灵泉 | C213: 1 | D213: 空灵泉 | E213: 45 | F213: =R[-1]C -> 5 | G213: 130 | H213: =R[-1]C+8 -> 1760 | I213: 第二界廉政大会在天庭召开。会上玉帝作出了重要指示，他希望各神仙能够认真学习，研究部署，贯彻落实，并拥有大局观。
A214: 212 | B214: 空灵泉 | C214: =R[-1]C+1 -> 2 | D214: 空灵泉 | E214: 45 | F214: =R[-1]C -> 5 | G214: 130 | H214: =R[-1]C+8 -> 1768 | I214: 近日召开的全体神仙扩大性精神会议上，观音菩萨首次提出，建立神仙党员制度，凡表现优秀的神仙，均有机会成为党员。
A215: 213 | B215: 空灵泉 | C215: =R[-1]C+1 -> 3 | D215: 空灵泉 | E215: 45 | F215: =R[-1]C -> 5 | G215: 130 | H215: =R[-1]C+8 -> 1776 | I215: 前几天土行孙与猪八戒，赤脚大仙，蓬莱大仙，太上老君，他们五个因感情深厚决定义结金兰，并号称五虎上将。
A216: 214 | B216: 空灵泉 | C216: =R[-1]C+1 -> 4 | D216: 空灵泉 | E216: 45 | F216: =R[-1]C -> 5 | G216: 130 | H216: =R[-1]C+8 -> 1784 | I216: 作为仙界首位医术高超的仙女，牡丹仙子首创中医针灸概念，以针运气，以针养气，成功的解除了众多神仙的风湿之痛。
A217: 215 | B217: 空灵泉 | C217: =R[-1]C+1 -> 5 | D217: 空灵泉 | E217: 45 | F217: =R[-1]C -> 5 | G217: 130 | H217: =R[-1]C+8 -> 1792 | I217: 越来越多的神仙沦为了房奴，高额的房贷让他们喘不过起来，他们甚至觉得他们和地上的凡人没什么区别。
A218: 216 | B218: 空灵泉 | C218: =R[-1]C+1 -> 6 | D218: 空灵泉 | E218: 46 | F218: =R[-1]C -> 5 | G218: 130 | H218: =R[-1]C+8 -> 1800 | I218: 最近仙界房地产市场泡沫越来越大，玉帝指示各部门，没事的时候大家研究一下，务必保障众神仙的基本生活品质。
A219: 217 | B219: 空灵泉 | C219: =R[-1]C+1 -> 7 | D219: 空灵泉 | E219: 46 | F219: =R[-1]C -> 5 | G219: 130 | H219: =R[-1]C+8 -> 1808 | I219: 南天童子昨晚跳楼自尽，魂飞魄散。他成为了第一个因还不起房贷而自杀的神仙。据说他那套两居室已经还了九千多年了。
A220: 218 | B220: 空灵泉 | C220: =R[-1]C+1 -> 8 | D220: 空灵泉 | E220: 46 | F220: =R[-1]C -> 5 | G220: 130 | H220: =R[-1]C+8 -> 1816 | I220: 九天杀童最近喜欢上了人间的烧烤，尤其最喜欢吃一种叫鸡肾的东西，没事的时候他就溜下凡间，烤个几千串吃一吃。
A221: 219 | B221: 空灵泉 | C221: =R[-1]C+1 -> 9 | D221: 空灵泉 | E221: 46 | F221: =R[-1]C -> 5 | G221: 130 | H221: =R[-1]C+8 -> 1824 | I221: 最近玉帝新换了一名御厨，叫欧阳卵。他非常擅长做又麻又辣的菜。玉帝最近口味比较重，所以他很喜欢这个欧阳卵。
A222: 220 | B222: 空灵泉 | C222: =R[-1]C+1 -> 10 | D222: 空灵泉 | E222: 46 | F222: =R[-1]C -> 5 | G222: 130 | H222: =R[-1]C+8 -> 1832 | I222: 吴刚打算这几天向玉帝申请下凡一趟，看看他的兄弟后羿。老这么让他守着，孤男寡女的，也不是那么个事。
A223: 221 | B223: 莲花池 | C223: 1 | D223: 莲花池 | E223: 47 | F223: =R[-1]C -> 5 | G223: 135 | H223: =R[-1]C+8 -> 1840 | I223: 后羿打算结婚了，他感觉就这么和嫦娥耗下去也不是个事，再说一个在天上，一个在地下，想要复合估计是没戏了。
A224: 222 | B224: 莲花池 | C224: =R[-1]C+1 -> 2 | D224: 莲花池 | E224: 47 | F224: =R[-1]C -> 5 | G224: 135 | H224: =R[-1]C+8 -> 1848 | I224: 听到后羿在凡间打算结婚的消息，嫦娥哭了整整三天三夜，无论如何，她对后羿是真心的。
A225: 223 | B225: 莲花池 | C225: =R[-1]C+1 -> 3 | D225: 莲花池 | E225: 47 | F225: =R[-1]C -> 5 | G225: 135 | H225: =R[-1]C+8 -> 1856 | I225: 听到后羿在凡间打算结婚的消息后，吴刚一直在想，这是不是意味着他可以做点什么了。
A226: 224 | B226: 莲花池 | C226: =R[-1]C+1 -> 4 | D226: 莲花池 | E226: 47 | F226: =R[-1]C -> 5 | G226: 135 | H226: =R[-1]C+8 -> 1864 | I226: 仙界前些日子好多神仙都患上了禽流感，大家纷纷把目光对准了二郎神的哮天犬，大家都觉得是时候该对这畜生做点什么了。
A227: 225 | B227: 莲花池 | C227: =R[-1]C+1 -> 5 | D227: 莲花池 | E227: 47 | F227: =R[-1]C -> 5 | G227: 135 | H227: =R[-1]C+8 -> 1872 | I227: 其实大多数神仙过的都比较清贫，神仙也分好多种，有强有弱，有好有坏，有富有穷。这和人间基本上是差不多的。
A228: 226 | B228: 莲花池 | C228: =R[-1]C+1 -> 6 | D228: 莲花池 | E228: 48 | F228: =R[-1]C -> 5 | G228: 135 | H228: =R[-1]C+8 -> 1880 | I228: 第七届神仙田径大赛圆满结束，第三名是土行孙，第二名是九华仙子，第一名是哮天犬。
A229: 227 | B229: 莲花池 | C229: =R[-1]C+1 -> 7 | D229: 莲花池 | E229: 48 | F229: =R[-1]C -> 5 | G229: 135 | H229: =R[-1]C+8 -> 1888 | I229: 神仙当中不乏众多球迷，其中北斗七星君是皇马球迷，牛魔王和铁扇公主最喜欢梅西，而玉帝则是奥尼尔最忠实的粉丝。
A230: 228 | B230: 莲花池 | C230: =R[-1]C+1 -> 8 | D230: 莲花池 | E230: 48 | F230: =R[-1]C -> 5 | G230: 135 | H230: =R[-1]C+8 -> 1896 | I230: 七仙女分别是：红衣仙女、素衣仙女、青衣仙女、皂衣仙女、紫衣仙女、黄衣仙女、绿衣仙女。她们其实并不是玉帝的女儿。
A231: 229 | B231: 莲花池 | C231: =R[-1]C+1 -> 9 | D231: 莲花池 | E231: 48 | F231: =R[-1]C -> 5 | G231: 135 | H231: =R[-1]C+8 -> 1904 | I231: 太华山的赤精子最近和九宫山的普贤真人干上了，这两个八竿子打不着边的神仙也能干起来，说明神仙也过的越来越浮躁了。
A232: 230 | B232: 莲花池 | C232: =R[-1]C+1 -> 10 | D232: 莲花池 | E232: 48 | F232: =R[-1]C -> 5 | G232: 135 | H232: =R[-1]C+8 -> 1912 | I232: 第十七届青歌大赛成功落幕，巨灵神以一首充满深情的《让我们一次爱个够》勇夺桂冠。玉帝点评说唱出陕北民歌味儿了。
A233: 231 | B233: 极乐界 | C233: 1 | D233: 极乐界 | E233: 49 | F233: =R[-1]C -> 5 | G233: 140 | H233: =R[-1]C+8 -> 1920 | I233: 因为仙流量过大，天庭最近打算在南天门对面新建一道北天门，以此来缓解交通压力。
A234: 232 | B234: 极乐界 | C234: =R[-1]C+1 -> 2 | D234: 极乐界 | E234: 49 | F234: =R[-1]C -> 5 | G234: 140 | H234: =R[-1]C+8 -> 1928 | I234: 人间到天庭的距离其实不算太远，悟空踩着云彩，大概要飞半个小时，这样比照下来，差不多相当于要坐半个月飞机的时间。
A235: 233 | B235: 极乐界 | C235: =R[-1]C+1 -> 3 | D235: 极乐界 | E235: 49 | F235: =R[-1]C -> 5 | G235: 140 | H235: =R[-1]C+8 -> 1936 | I235: 不要羡慕神仙，做个凡人没什么不好的，仙有仙的苦楚，而人有人的幸福。各自都有各自的活法。
A236: 234 | B236: 极乐界 | C236: =R[-1]C+1 -> 4 | D236: 极乐界 | E236: 49 | F236: =R[-1]C -> 5 | G236: 140 | H236: =R[-1]C+8 -> 1944 | I236: 正在外地旅游的悟空听到了一个不幸的消息，他花果山的饮品店和猪八戒的高老庄一样，也被强行拆掉了。
A237: 235 | B237: 极乐界 | C237: =R[-1]C+1 -> 5 | D237: 极乐界 | E237: 49 | F237: =R[-1]C -> 5 | G237: 140 | H237: =R[-1]C+8 -> 1952 | I237: 羊角大仙近日喜得贵子，大仙为其取名为，羊羊羊。
A238: 236 | B238: 极乐界 | C238: =R[-1]C+1 -> 6 | D238: 极乐界 | E238: 50 | F238: =R[-1]C -> 5 | G238: 140 | H238: =R[-1]C+8 -> 1960 | I238: 玉帝最近打算废除禁止神仙恋爱的这条规定。他看不到这一条规定有任何意义，人可以相爱，神为什么就不可以。
A239: 237 | B239: 极乐界 | C239: =R[-1]C+1 -> 7 | D239: 极乐界 | E239: 50 | F239: =R[-1]C -> 5 | G239: 140 | H239: =R[-1]C+8 -> 1968 | I239: 作为仙界的乐官，五音大仙最近创作了一首叫做《最美仙侠风》的歌曲。此歌节奏明快，旋律优美，深得众仙的喜爱。
A240: 238 | B240: 极乐界 | C240: =R[-1]C+1 -> 8 | D240: 极乐界 | E240: 50 | F240: =R[-1]C -> 5 | G240: 140 | H240: =R[-1]C+8 -> 1976 | I240: 作为仙界最具艺术才华的仙子，文曲星最近创作了一首叫做《欧巴江南赛》的诗词，该诗以感情强烈而迅速风靡仙界。
A241: 239 | B241: 极乐界 | C241: =R[-1]C+1 -> 9 | D241: 极乐界 | E241: 50 | F241: =R[-1]C -> 5 | G241: 140 | H241: =R[-1]C+8 -> 1984 | I241: 因为舞姿过于出色，七仙女中的青衣仙子近日被王母娘娘授以樱桃小丸子的一级大仙封号。
A242: 240 | B242: 极乐界 | C242: =R[-1]C+1 -> 10 | D242: 极乐界 | E242: 50 | F242: =R[-1]C -> 5 | G242: 140 | H242: =R[-1]C+8 -> 1992 | I242: 牛郎家的那头牛最近早产，生下了两头小牛犊，牛郎为其命名为，牛丽丽和牛青青。
A243: 241 | B243: 苦难谷 | C243: 1 | D243: 苦难谷 | E243: 51 | F243: =R[-1]C -> 5 | G243: 145 | H243: =R[-1]C+8 -> 2000 | I243: 在近日召开的艺术指导会议上，文曲星指出，艺术不能脱离生活，要以贴近众仙日常情感为线索，坚定不移的走群众路线。
A244: 242 | B244: 苦难谷 | C244: =R[-1]C+1 -> 2 | D244: 苦难谷 | E244: 51 | F244: =R[-1]C -> 5 | G244: 145 | H244: =R[-1]C+8 -> 2008 | I244: 最近经常有神仙偷偷下凡去炒股，玉帝对此觉得很恼火，其实是因为他炒股输光了积蓄。。。
A245: 243 | B245: 苦难谷 | C245: =R[-1]C+1 -> 3 | D245: 苦难谷 | E245: 51 | F245: =R[-1]C -> 5 | G245: 145 | H245: =R[-1]C+8 -> 2016 | I245: 下一届奥运会，王母打算亲临现场看一看，她很喜欢看游泳，尤其喜欢那个龙王三太子。
A246: 244 | B246: 苦难谷 | C246: =R[-1]C+1 -> 4 | D246: 苦难谷 | E246: 51 | F246: =R[-1]C -> 5 | G246: 145 | H246: =R[-1]C+8 -> 2024 | I246: 雷公最近想换个工作，天天打雷，天天打雷，快烦死了。
A247: 245 | B247: 苦难谷 | C247: =R[-1]C+1 -> 5 | D247: 苦难谷 | E247: 51 | F247: =R[-1]C -> 5 | G247: 145 | H247: =R[-1]C+8 -> 2032 | I247: 电母是仙界长的最丑的仙女，但也是最会保养的仙女。最近她打算再去呵护一下头发，做一个离子烫，拉个直板。
A248: 246 | B248: 苦难谷 | C248: =R[-1]C+1 -> 6 | D248: 苦难谷 | E248: 52 | F248: =R[-1]C -> 5 | G248: 145 | H248: =R[-1]C+8 -> 2040 | I248: 没有人知道法海的痛苦，也没有人能理解他对许仙的感情。当他看到白素贞和许仙在一起的那一刻，他的心，碎了。
A249: 247 | B249: 苦难谷 | C249: =R[-1]C+1 -> 7 | D249: 苦难谷 | E249: 52 | F249: =R[-1]C -> 5 | G249: 145 | H249: =R[-1]C+8 -> 2048 | I249: 唐僧师徒四人取经归来之后，最幸运的当属白龙马。因为只有他家的宅院没有被巨灵神强拆过。
A250: 248 | B250: 苦难谷 | C250: =R[-1]C+1 -> 8 | D250: 苦难谷 | E250: 52 | F250: =R[-1]C -> 5 | G250: 145 | H250: =R[-1]C+8 -> 2056 | I250: 因为经常性的熬夜，二郎神三只眼睛的近视度数高达三千多度，额头上的那只天眼基本上已经废掉了。
A251: 249 | B251: 苦难谷 | C251: =R[-1]C+1 -> 9 | D251: 苦难谷 | E251: 52 | F251: =R[-1]C -> 5 | G251: 145 | H251: =R[-1]C+8 -> 2064 | I251: 曾有神仙向玉帝提出在人间弄一个常驻办事处，玉帝听了忍不住哈哈大笑，笑完之后他说好这个提议不错，洗洗睡吧。
A252: 250 | B252: 苦难谷 | C252: =R[-1]C+1 -> 10 | D252: 苦难谷 | E252: 52 | F252: =R[-1]C -> 5 | G252: 145 | H252: =R[-1]C+8 -> 2072 | I252: 因为刑罚过于残暴，地狱最近经常发生群鬼暴乱事件。对此，阎王对众刑官表示，再严厉一点，谁不服当场就废了他。
A253: 251 | B253: 盘丝洞 | C253: 1 | D253: 盘丝洞 | E253: 53 | F253: =R[-1]C -> 5 | G253: 150 | H253: =R[-1]C+8 -> 2080 | I253: 整个地狱，皮肤保养的最好的当属钟馗，这得益于他每天吸食灵魂。据统计他大概一天吸食九百多万个魂魄。
A254: 252 | B254: 盘丝洞 | C254: =R[-1]C+1 -> 2 | D254: 盘丝洞 | E254: 53 | F254: =R[-1]C -> 5 | G254: 150 | H254: =R[-1]C+8 -> 2088 | I254: 黄飞虎最近迷上了人体雕塑，他希望能够在不就的未来举办一次个人雕塑展，名字都想好了，叫：我的灵魂我的肉。
A255: 253 | B255: 盘丝洞 | C255: =R[-1]C+1 -> 3 | D255: 盘丝洞 | E255: 53 | F255: =R[-1]C -> 5 | G255: 150 | H255: =R[-1]C+8 -> 2096 | I255: 王母娘娘其实是一个京剧迷，她曾降入凡间化身普通戏子，师从京剧大师梅兰芳。不过这事只有玉帝知道。
A256: 254 | B256: 盘丝洞 | C256: =R[-1]C+1 -> 4 | D256: 盘丝洞 | E256: 53 | F256: =R[-1]C -> 5 | G256: 150 | H256: =R[-1]C+8 -> 2104 | I256: 由于进来环境污染严重，气候严重异常，东海经常是动不动的就刮台风。老龙王躺在龙宫里晃来晃去，一会就晕吐了。
A257: 255 | B257: 盘丝洞 | C257: =R[-1]C+1 -> 5 | D257: 盘丝洞 | E257: 53 | F257: =R[-1]C -> 5 | G257: 150 | H257: =R[-1]C+8 -> 2112 | I257: 花果山饮品店被拆除后，悟空潜心修行三十年，终于悟出了第七十三种仙术变化。他打算最近再搞一次大闹天宫。
A258: 256 | B258: 盘丝洞 | C258: =R[-1]C+1 -> 6 | D258: 盘丝洞 | E258: 54 | F258: =R[-1]C -> 5 | G258: 150 | H258: =R[-1]C+8 -> 2120 | I258: 因生活清贫，修行苦闷，许多神仙选择到凡间经商。玉帝知道后立刻发布一道天规：一旦发现官员经商，无须上报，直接弄死。
A259: 257 | B259: 盘丝洞 | C259: =R[-1]C+1 -> 7 | D259: 盘丝洞 | E259: 54 | F259: =R[-1]C -> 5 | G259: 150 | H259: =R[-1]C+8 -> 2128 | I259: 闻名三界的孟婆汤秘方近日曝光，众仙这才发现原来配方如此简单：大蒜，香菜，土豆，萝卜，外加一碗清水，仅此而已。
A260: 258 | B260: 盘丝洞 | C260: =R[-1]C+1 -> 8 | D260: 盘丝洞 | E260: 54 | F260: =R[-1]C -> 5 | G260: 150 | H260: =R[-1]C+8 -> 2136 | I260: 为了防止走光，众仙女在腾云驾雾的时候很少穿那种刻意飘的起来的迷你裙，一律改穿紧身包臀牛仔短裤了。
A261: 259 | B261: 盘丝洞 | C261: =R[-1]C+1 -> 9 | D261: 盘丝洞 | E261: 54 | F261: =R[-1]C -> 5 | G261: 150 | H261: =R[-1]C+8 -> 2144 | I261: 别人问二郎神有没有女朋友，他总说：“现在没有。”这样的回答显然机智地掩盖了过去也没有的事实。。。
A262: 260 | B262: 盘丝洞 | C262: =R[-1]C+1 -> 10 | D262: 盘丝洞 | E262: 54 | F262: =R[-1]C -> 5 | G262: 150 | H262: =R[-1]C+8 -> 2152 | I262: 织女开了一家网店，一开始生意不好，后来经过不断努力向身边的人发各种广告，终于有一天，她被所有人拉黑了。
A263: 261 | B263: 斗战堂 | C263: 1 | D263: 斗战堂 | E263: 55 | F263: =R[-1]C -> 5 | G263: 155 | H263: =R[-1]C+8 -> 2160 | I263: 天庭所有仙女中玉帝最满意的是北极仙子。据玉帝的目测，她的三围是十八十八十八。玉帝说，我就喜欢这样的，越瘦越好。
A264: 262 | B264: 斗战堂 | C264: =R[-1]C+1 -> 2 | D264: 斗战堂 | E264: 55 | F264: =R[-1]C -> 5 | G264: 155 | H264: =R[-1]C+8 -> 2168 | I264: 最近传闻有一个内裤外穿的男子从人间竟然直接飞到了天庭。这件事让玉帝产生了深深的危机感，这让神仙以后还怎么混？
A265: 263 | B265: 斗战堂 | C265: =R[-1]C+1 -> 3 | D265: 斗战堂 | E265: 55 | F265: =R[-1]C -> 5 | G265: 155 | H265: =R[-1]C+8 -> 2176 | I265: 第二届经济扩大会议上，众仙一致通过了关于成立天庭自由贸易区的决议。会议特别强调，要按照人类经济特区的模式来搞。
A266: 264 | B266: 斗战堂 | C266: =R[-1]C+1 -> 4 | D266: 斗战堂 | E266: 55 | F266: =R[-1]C -> 5 | G266: 155 | H266: =R[-1]C+8 -> 2184 | I266: 针对老是有神仙不上早朝的这种现象，玉帝经过慎重考虑后，宣布：以后大伙都不用来上朝了。
A267: 265 | B267: 斗战堂 | C267: =R[-1]C+1 -> 5 | D267: 斗战堂 | E267: 55 | F267: =R[-1]C -> 5 | G267: 155 | H267: =R[-1]C+8 -> 2192 | I267: 仙女们没事的时候也喜欢八卦，比如吴刚的胸大肌好性感哦，巨灵神的臀大肌好性感哦，南天大仙的腿大肌好性感哦，等等。
A268: 266 | B268: 斗战堂 | C268: =R[-1]C+1 -> 6 | D268: 斗战堂 | E268: 56 | F268: =R[-1]C -> 5 | G268: 155 | H268: =R[-1]C+8 -> 2200 | I268: 在西天取经结束后，悟空已经把金箍棒还给了东海龙王，毕竟那玩意老塞在耳朵里，怪痒痒。
A269: 267 | B269: 斗战堂 | C269: =R[-1]C+1 -> 7 | D269: 斗战堂 | E269: 56 | F269: =R[-1]C -> 5 | G269: 155 | H269: =R[-1]C+8 -> 2208 | I269: 鬼界，人界，神界，其实除了这三界之外，还存在一界，虚空界，只有修行极深的大仙方可进入虚空界。普通小仙是没门的。
A270: 268 | B270: 斗战堂 | C270: =R[-1]C+1 -> 8 | D270: 斗战堂 | E270: 56 | F270: =R[-1]C -> 5 | G270: 155 | H270: =R[-1]C+8 -> 2216 | I270: 通灵仙女其实并不想当神仙，她觉得做神仙很枯燥，也很无趣。她最大的愿望是，下凡当一名服装设计师。
A271: 269 | B271: 斗战堂 | C271: =R[-1]C+1 -> 9 | D271: 斗战堂 | E271: 56 | F271: =R[-1]C -> 5 | G271: 155 | H271: =R[-1]C+8 -> 2224 | I271: 仙界最高的山，是五指山；最深的洞，是霄云洞；最高的树，是蟠桃树；最美的云，是王母脚下的七彩祥云。
A272: 270 | B272: 斗战堂 | C272: =R[-1]C+1 -> 10 | D272: 斗战堂 | E272: 56 | F272: =R[-1]C -> 5 | G272: 155 | H272: =R[-1]C+8 -> 2232 | I272: 近日太上老君成功炼制出了一种可以随意改变性别的丹药。不过为了防止引起三界大混乱，玉帝禁止他进行批量生产。
A273: 271 | B273: 圣佛村 | C273: 1 | D273: 圣佛村 | E273: 57 | F273: =R[-1]C -> 5 | G273: 160 | H273: =R[-1]C+8 -> 2240 | I273: 长安城最近发大水，死伤无数。玉皇大帝得知后亲临凡间，面对痛不欲生的人民，玉帝意味深长的说了一句：“这就叫报应！”
A274: 272 | B274: 圣佛村 | C274: =R[-1]C+1 -> 2 | D274: 圣佛村 | E274: 57 | F274: =R[-1]C -> 5 | G274: 160 | H274: =R[-1]C+8 -> 2248 | I274: 八戒和嫦娥大婚的第二天早上，嫦娥特地为八戒准备了早餐。但是八戒告诉他：“我不可以空腹吃早餐的！”
A275: 273 | B275: 圣佛村 | C275: =R[-1]C+1 -> 3 | D275: 圣佛村 | E275: 57 | F275: =R[-1]C -> 5 | G275: 160 | H275: =R[-1]C+8 -> 2256 | I275: 孙悟空当初之所以学火眼金睛，其实是为了看七仙女洗澡。
A276: 274 | B276: 圣佛村 | C276: =R[-1]C+1 -> 4 | D276: 圣佛村 | E276: 57 | F276: =R[-1]C -> 5 | G276: 160 | H276: =R[-1]C+8 -> 2264 | I276: 孙悟空自从取完西经之后以为自己不用再降妖除魔了，直到有一天他在电视上看到中国好嗓音的吴莫愁。
A277: 275 | B277: 圣佛村 | C277: =R[-1]C+1 -> 5 | D277: 圣佛村 | E277: 57 | F277: =R[-1]C -> 5 | G277: 160 | H277: =R[-1]C+8 -> 2272 | I277: 织女有奖问答环节：“水快冷猜一个英语",答案揭晓：“西瓜”。
A278: 276 | B278: 圣佛村 | C278: =R[-1]C+1 -> 6 | D278: 圣佛村 | E278: 58 | F278: =R[-1]C -> 5 | G278: 160 | H278: =R[-1]C+8 -> 2280 | I278: 大家都在说六耳猕猴非常凶猛，上天入地，无所不能，悟空听后只能用两个字形容他的感受：“呵呵”
A279: 277 | B279: 圣佛村 | C279: =R[-1]C+1 -> 7 | D279: 圣佛村 | E279: 58 | F279: =R[-1]C -> 5 | G279: 160 | H279: =R[-1]C+8 -> 2288 | I279: 哪吒不仅会喷火，其实他也很爱喝水。
A280: 278 | B280: 圣佛村 | C280: =R[-1]C+1 -> 8 | D280: 圣佛村 | E280: 58 | F280: =R[-1]C -> 5 | G280: 160 | H280: =R[-1]C+8 -> 2296 | I280: 人们总误以为白蛇和青蛇是好姐妹，其实他们是好基友来的。
A281: 279 | B281: 圣佛村 | C281: =R[-1]C+1 -> 9 | D281: 圣佛村 | E281: 58 | F281: =R[-1]C -> 5 | G281: 160 | H281: =R[-1]C+8 -> 2304 | I281: 人们时常不解为什么雷震子鼻子比别人长。直到后来皮诺曹告诉我们：“说谎鼻子会变长哟”。
A282: 280 | B282: 圣佛村 | C282: =R[-1]C+1 -> 10 | D282: 圣佛村 | E282: 58 | F282: =R[-1]C -> 5 | G282: 160 | H282: =R[-1]C+8 -> 2312 | I282: 唐僧从来不吃肉，直到有一天他也为了长生不老偷偷抠下自己的脚皮吃下。。。
A283: 281 | B283: 紫霞谷 | C283: 1 | D283: 紫霞谷 | E283: 59 | F283: =R[-1]C -> 5 | G283: 165 | H283: =R[-1]C+8 -> 2320 | I283: 白龙马自从在网上认识了韩国棒子团后，就把自己变成了中国金枪鱼。
A284: 282 | B284: 紫霞谷 | C284: =R[-1]C+1 -> 2 | D284: 紫霞谷 | E284: 59 | F284: =R[-1]C -> 5 | G284: 165 | H284: =R[-1]C+8 -> 2328 | I284: 天庭的蟠桃不仅有长命百岁的作用，还有清凉降火的功效，夏日必备好产品哟。
A285: 283 | B285: 紫霞谷 | C285: =R[-1]C+1 -> 3 | D285: 紫霞谷 | E285: 59 | F285: =R[-1]C -> 5 | G285: 165 | H285: =R[-1]C+8 -> 2336 | I285: 上天是公平的，它给了你很丑的外表，一定也会给你很低的智商，以免让你看起来显得不协调。
A286: 284 | B286: 紫霞谷 | C286: =R[-1]C+1 -> 4 | D286: 紫霞谷 | E286: 59 | F286: =R[-1]C -> 5 | G286: 165 | H286: =R[-1]C+8 -> 2344 | I286: 为什么神仙们喜欢留胡子，因为他们都拜关二哥。
A287: 285 | B287: 紫霞谷 | C287: =R[-1]C+1 -> 5 | D287: 紫霞谷 | E287: 59 | F287: =R[-1]C -> 5 | G287: 165 | H287: =R[-1]C+8 -> 2352 | I287: 话说在天庭找不到工作的人，都喜欢混入凡间当城管。
A288: 286 | B288: 紫霞谷 | C288: =R[-1]C+1 -> 6 | D288: 紫霞谷 | E288: 60 | F288: =R[-1]C -> 5 | G288: 165 | H288: =R[-1]C+8 -> 2360 | I288: 神仙买苹果从来不买一颗两颗，他们告诉凡人，买苹果要买四袋五袋。
A289: 287 | B289: 紫霞谷 | C289: =R[-1]C+1 -> 7 | D289: 紫霞谷 | E289: 60 | F289: =R[-1]C -> 5 | G289: 165 | H289: =R[-1]C+8 -> 2368 | I289: 玉帝终于在南海深处发现几百年前不明失踪的那匹龙马，而遗体旁边貌似是一架飞机的残骸。玉帝好像明白了什么。。。
A290: 288 | B290: 紫霞谷 | C290: =R[-1]C+1 -> 8 | D290: 紫霞谷 | E290: 60 | F290: =R[-1]C -> 5 | G290: 165 | H290: =R[-1]C+8 -> 2376 | I290: “我掌控你们的现在，你们嘲笑我的未来”我是玉皇大帝，我为自己带盐。
A291: 289 | B291: 紫霞谷 | C291: =R[-1]C+1 -> 9 | D291: 紫霞谷 | E291: 60 | F291: =R[-1]C -> 5 | G291: 165 | H291: =R[-1]C+8 -> 2384 | I291: 牛郎和织女在分开了千千万万年之后，牛郎终于练就了超级无敌右手。
A292: 290 | B292: 紫霞谷 | C292: =R[-1]C+1 -> 10 | D292: 紫霞谷 | E292: 60 | F292: =R[-1]C -> 5 | G292: 165 | H292: =R[-1]C+8 -> 2392 | I292: 白骨精从小爱吃泡菜，因此悟空特别喜欢她，有天白骨精问他：“为什么你那么喜欢我？”悟空告诉她：“因为你是棒子”。
A293: 291 | B293: 思念池 | C293: 1 | D293: 思念池 | E293: 61 | F293: =R[-1]C -> 5 | G293: 170 | H293: =R[-1]C+8 -> 2400 | I293: 玉帝的御厨决定下凡到人间学一学新的厨艺，最近玉帝喜欢上了川菜火锅。厨哥决定下凡到四川成都一行。
A294: 292 | B294: 思念池 | C294: =R[-1]C+1 -> 2 | D294: 思念池 | E294: 61 | F294: =R[-1]C -> 5 | G294: 170 | H294: =R[-1]C+8 -> 2408 | I294: 御厨到成都后，他发现这才是真正的人间天堂啊。不仅菜好吃，而且漂亮妹子多，一个个水格灵灵，嫩白嫩白，看着相当有感觉。
A295: 293 | B295: 思念池 | C295: =R[-1]C+1 -> 3 | D295: 思念池 | E295: 61 | F295: =R[-1]C -> 5 | G295: 170 | H295: =R[-1]C+8 -> 2416 | I295: 很少有神仙能够触觉到音乐对灵魂产生的那种撞击。赤脚大仙除外，每次他一边抠脚一边听着凤凰传奇的歌时，都会热泪盈眶。
A296: 294 | B296: 思念池 | C296: =R[-1]C+1 -> 4 | D296: 思念池 | E296: 61 | F296: =R[-1]C -> 5 | G296: 170 | H296: =R[-1]C+8 -> 2424 | I296: 人间奥特曼打小怪兽科幻电影的盛行，让玉帝意识到，神仙修行的步伐必须加快了，否则有朝一日很可能直接干到天庭来。
A297: 295 | B297: 思念池 | C297: =R[-1]C+1 -> 5 | D297: 思念池 | E297: 61 | F297: =R[-1]C -> 5 | G297: 170 | H297: =R[-1]C+8 -> 2432 | I297: 对于人间最近流行的XX手机，玉帝和王母其实都知道这个事情，也私底下试用过，用过之后他们的结论是，这玩意也能火？
A298: 296 | B298: 思念池 | C298: =R[-1]C+1 -> 6 | D298: 思念池 | E298: 62 | F298: =R[-1]C -> 5 | G298: 170 | H298: =R[-1]C+8 -> 2440 | I298: 观看《泰坦尼克号》，是牛郎和织女每年七夕的固定节目。只是每次快要看到杰克沉入大海时，两人都终于撑不住双双睡了过去。
A299: 297 | B299: 思念池 | C299: =R[-1]C+1 -> 7 | D299: 思念池 | E299: 62 | F299: =R[-1]C -> 5 | G299: 170 | H299: =R[-1]C+8 -> 2448 | I299: 为了看看在凡间究竟有多大的人气，玉帝来到凡间参加相亲节目。当他说出我是玉帝时，所有人都灭灯了。。。
A300: 298 | B300: 思念池 | C300: =R[-1]C+1 -> 8 | D300: 思念池 | E300: 62 | F300: =R[-1]C -> 5 | G300: 170 | H300: =R[-1]C+8 -> 2456 | I300: 一乞丐哭道：可怜下我吧，我都记不清上次吃饭是什么时候了！济公看着可怜，安慰道：“别急，慢慢想，一定可以想起来的”
A301: 299 | B301: 思念池 | C301: =R[-1]C+1 -> 9 | D301: 思念池 | E301: 62 | F301: =R[-1]C -> 5 | G301: 170 | H301: =R[-1]C+8 -> 2464 | I301: 土地公近日对笑面罗汉提出了抗议，每次人间供奉的东西还没等人家走出寺庙，罗汉拿过来两口就吃掉，这神仙还要不要做了。
A302: 300 | B302: 思念池 | C302: =R[-1]C+1 -> 10 | D302: 思念池 | E302: 62 | F302: =R[-1]C -> 5 | G302: 170 | H302: =R[-1]C+8 -> 2472 | I302: 八戒很质疑的问悟空为啥可以大闹天宫如今却打不赢小怪？悟空瞪道：“你TM账号被封500年试试。”
A303: 301 | B303: 五华山 | C303: 1 | D303: 五华山 | E303: 63 | F303: =R[-1]C -> 5 | G303: 175 | H303: =R[-1]C+8 -> 2480 | I303: 最近染上烟瘾的神仙越来越多，这让玉帝很郁闷，什么时候神仙也沦落到凡人的地步了，神仙难道也就这么容易堕落么？
A304: 302 | B304: 五华山 | C304: =R[-1]C+1 -> 2 | D304: 五华山 | E304: 63 | F304: =R[-1]C -> 5 | G304: 175 | H304: =R[-1]C+8 -> 2488 | I304: 张果老问铁拐李，这个世界上男女之间有纯粹的友谊吗？铁拐李说：“只要长得丑，四海皆朋友！”
A305: 303 | B305: 五华山 | C305: =R[-1]C+1 -> 3 | D305: 五华山 | E305: 63 | F305: =R[-1]C -> 5 | G305: 175 | H305: =R[-1]C+8 -> 2496 | I305: 如来问唐僧：“如果用二十年的寿命换取一个愿望，你会许什么愿？”唐僧：“请让我长生不老吧！”
A306: 304 | B306: 五华山 | C306: =R[-1]C+1 -> 4 | D306: 五华山 | E306: 63 | F306: =R[-1]C -> 5 | G306: 175 | H306: =R[-1]C+8 -> 2504 | I306: 人间有房姐，仙界同样也有。最近爆出东华仙人名下有三百多套房，玉帝知道这个消息后，直接晕了过去。
A307: 305 | B307: 五华山 | C307: =R[-1]C+1 -> 5 | D307: 五华山 | E307: 63 | F307: =R[-1]C -> 5 | G307: 175 | H307: =R[-1]C+8 -> 2512 | I307: 人间霸王李爸爸近日上天受封，鉴于他儿子独特的开创性的表现，玉帝决定封他为：少年之爹。
A308: 306 | B308: 五华山 | C308: =R[-1]C+1 -> 6 | D308: 五华山 | E308: 64 | F308: =R[-1]C -> 5 | G308: 175 | H308: =R[-1]C+8 -> 2520 | I308: 风流少年陈老师近日上天受封，鉴于他在男女关系方面所作出的有益探索，玉帝决定封他为：妇女之友。
A309: 307 | B309: 五华山 | C309: =R[-1]C+1 -> 7 | D309: 五华山 | E309: 64 | F309: =R[-1]C -> 5 | G309: 175 | H309: =R[-1]C+8 -> 2528 | I309: 东海老龙王的长孙深海蛟龙，近日在游泳的时候因为没有穿救生衣，不慎被淹死。
A310: 308 | B310: 五华山 | C310: =R[-1]C+1 -> 8 | D310: 五华山 | E310: 64 | F310: =R[-1]C -> 5 | G310: 175 | H310: =R[-1]C+8 -> 2536 | I310: 在七仙女的倡导下，众仙最近也开始练瑜伽，以深化修行之道。但因为用力过猛，经常发生一些断胳膊断腿的事儿。
A311: 309 | B311: 五华山 | C311: =R[-1]C+1 -> 9 | D311: 五华山 | E311: 64 | F311: =R[-1]C -> 5 | G311: 175 | H311: =R[-1]C+8 -> 2544 | I311: 针对仙界最近不稳定的经济形势，财神组织召开了经济扩大会议，会议一致通过，今年务必要把仙界的GDP增幅控制在7%以下。
A312: 310 | B312: 五华山 | C312: =R[-1]C+1 -> 10 | D312: 五华山 | E312: 64 | F312: =R[-1]C -> 5 | G312: 175 | H312: =R[-1]C+8 -> 2552 | I312: 为了进一步刺激仙界经济的发展，财神决定再次增发三万亿仙币，以此来平衡市场相对紧张的供需关系。
A313: 311 | B313: 尘缘地 | C313: 1 | D313: 尘缘地 | E313: 65 | F313: =R[-1]C -> 5 | G313: 180 | H313: =R[-1]C+8 -> 2560 | I313: 马老大近日入狱受罚，鉴于他在IT界一贯的坚定的卓有成效的垄断行为，阎王决定，放了他，让他返回人间，继续垄断下去。
A314: 312 | B314: 尘缘地 | C314: =R[-1]C+1 -> 2 | D314: 尘缘地 | E314: 65 | F314: =R[-1]C -> 5 | G314: 180 | H314: =R[-1]C+8 -> 2568 | I314: 巨灵神再也熬不了天上的生活了，他想要实现自我价值，经过一番考虑，终于去参加了狂野格斗比赛。
A315: 313 | B315: 尘缘地 | C315: =R[-1]C+1 -> 3 | D315: 尘缘地 | E315: 65 | F315: =R[-1]C -> 5 | G315: 180 | H315: =R[-1]C+8 -> 2576 | I315: 又到了一年一度的旅游季节，这一次，大家一致同意，到阿尔卑斯山去滑雪，体验雪花的柔美，享受尖叫的快感。
A316: 314 | B316: 尘缘地 | C316: =R[-1]C+1 -> 4 | D316: 尘缘地 | E316: 65 | F316: =R[-1]C -> 5 | G316: 180 | H316: =R[-1]C+8 -> 2584 | I316: 太乙真人下凡，要办签证。真人说我是神仙，签证官冷笑一声说那也得办。真人怒说我要送你下地狱。于是真人进了警察局。
A317: 315 | B317: 尘缘地 | C317: =R[-1]C+1 -> 5 | D317: 尘缘地 | E317: 65 | F317: =R[-1]C -> 5 | G317: 180 | H317: =R[-1]C+8 -> 2592 | I317: 羊角大仙近日又喜得了一贵子。思索良久，大仙为其取名为：羊驼。
A318: 316 | B318: 尘缘地 | C318: =R[-1]C+1 -> 6 | D318: 尘缘地 | E318: 66 | F318: =R[-1]C -> 5 | G318: 180 | H318: =R[-1]C+8 -> 2600 | I318: 最近仙界红白喜事不少，南天童子也因此苦不堪言，最近他给出的份子钱是他每个月薪水的16倍。
A319: 317 | B319: 尘缘地 | C319: =R[-1]C+1 -> 7 | D319: 尘缘地 | E319: 66 | F319: =R[-1]C -> 5 | G319: 180 | H319: =R[-1]C+8 -> 2608 | I319: 当织女听到牛郎出轨，而且还是跟巨灵神的消息后，她忍不住流下了震惊的泪水。
A320: 318 | B320: 尘缘地 | C320: =R[-1]C+1 -> 8 | D320: 尘缘地 | E320: 66 | F320: =R[-1]C -> 5 | G320: 180 | H320: =R[-1]C+8 -> 2616 | I320: 土行孙经过种种的路线计划，终于遁地潜进一家银行，面对几千万的现金，土行孙因为密集恐惧症而突然冷静了下来。。。
A321: 319 | B321: 尘缘地 | C321: =R[-1]C+1 -> 9 | D321: 尘缘地 | E321: 66 | F321: =R[-1]C -> 5 | G321: 180 | H321: =R[-1]C+8 -> 2624 | I321: 如来和玉帝见面，口头禅就是，你被猴打过。老说老说，玉帝终于有一天忍不住爆发了，我就XXX了，我被猴打过又怎么了。
A322: 320 | B322: 尘缘地 | C322: =R[-1]C+1 -> 10 | D322: 尘缘地 | E322: 66 | F322: =R[-1]C -> 5 | G322: 180 | H322: =R[-1]C+8 -> 2632 | I322: 对于人间流行的民工讨薪难事件，众神仙一致决定，将诅咒系法术注入民工体内，使其可对欠薪者全家造成灭门伤害。
A323: 321 | B323: 了然原 | C323: 1 | D323: 了然原 | E323: 67 | F323: =R[-1]C -> 5 | G323: 185 | H323: =R[-1]C+8 -> 2640 | I323: 如果单纯只是为了修仙而修仙，那很容易走火入魔。灵宝真人闭关修仙二十年，最后修成了一傻子，整天只会喊好饿啊好饿。
A324: 322 | B324: 了然原 | C324: =R[-1]C+1 -> 2 | D324: 了然原 | E324: 67 | F324: =R[-1]C -> 5 | G324: 185 | H324: =R[-1]C+8 -> 2648 | I324: 关于人间垄断企业相关的争议，神仙们表达了一个基本的观点，那就是：干得漂亮！
A325: 323 | B325: 了然原 | C325: =R[-1]C+1 -> 3 | D325: 了然原 | E325: 67 | F325: =R[-1]C -> 5 | G325: 185 | H325: =R[-1]C+8 -> 2656 | I325: 最近不仅人间家庭暴力事件屡屡上演，就连仙界也是如此。牛魔王那么大一块头，被铁扇公主打的现在和七仙女差不多体型了。
A326: 324 | B326: 了然原 | C326: =R[-1]C+1 -> 4 | D326: 了然原 | E326: 67 | F326: =R[-1]C -> 5 | G326: 185 | H326: =R[-1]C+8 -> 2664 | I326: 玉帝今日打款给二郎神，手一抖不小心多打了个0，玉帝着急地叫二郎神把多打的钱还给他，结果二郎神果断把他拉黑了。。。
A327: 325 | B327: 了然原 | C327: =R[-1]C+1 -> 5 | D327: 了然原 | E327: 67 | F327: =R[-1]C -> 5 | G327: 185 | H327: =R[-1]C+8 -> 2672 | I327: 因为生活拮据，后羿不得不在晚上出来摆摊卖烧烤。不过很不幸，他的烧烤基本上都被城管给吃掉了。当然，白吃。
A328: 326 | B328: 了然原 | C328: =R[-1]C+1 -> 6 | D328: 了然原 | E328: 68 | F328: =R[-1]C -> 5 | G328: 185 | H328: =R[-1]C+8 -> 2680 | I328: 因为生活的太压抑，最近牛犊子仙人发布言论声称要炸南天门，炸凌霄殿，炸玉帝，炸王母。很快，他就被弄死了。
A329: 327 | B329: 了然原 | C329: =R[-1]C+1 -> 7 | D329: 了然原 | E329: 68 | F329: =R[-1]C -> 5 | G329: 185 | H329: =R[-1]C+8 -> 2688 | I329: 人间流行毒奶粉，仙界最近也开始流行。玉帝很迷惘，什么时候神仙也开始喝奶粉了。
A330: 328 | B330: 了然原 | C330: =R[-1]C+1 -> 8 | D330: 了然原 | E330: 68 | F330: =R[-1]C -> 5 | G330: 185 | H330: =R[-1]C+8 -> 2696 | I330: 道德真君是仙界中最没有道德素养的一个道德大仙。
A331: 329 | B331: 了然原 | C331: =R[-1]C+1 -> 9 | D331: 了然原 | E331: 68 | F331: =R[-1]C -> 5 | G331: 185 | H331: =R[-1]C+8 -> 2704 | I331: 仙界同样富豪众多，而且懂得享受。最近财神爷就下凡购置了一艘超级豪华游轮，没事的时候就从给天上下来玩一会。
A332: 330 | B332: 了然原 | C332: =R[-1]C+1 -> 10 | D332: 了然原 | E332: 68 | F332: =R[-1]C -> 5 | G332: 185 | H332: =R[-1]C+8 -> 2712 | I332: 后羿是仙界中公认的屌丝，二郎神是仙界公认的高富帅，而嫦娥，则是仙界中公认的可以进行深度开发的一个原始美人。
A333: 331 | B333: 那烂陀 | C333: 1 | D333: 那烂陀 | E333: 69 | F333: =R[-1]C -> 5 | G333: 190 | H333: =R[-1]C+8 -> 2720 | I333: 人类越来越牛逼，造出来的飞机飞的越来越高，也越来越快。这一定程度干扰了天庭的正常交通。
A334: 332 | B334: 那烂陀 | C334: =R[-1]C+1 -> 2 | D334: 那烂陀 | E334: 69 | F334: =R[-1]C -> 5 | G334: 190 | H334: =R[-1]C+8 -> 2728 | I334: 突然间，神仙开始流行纹身，雷公胸部纹了条龙，电母手臂纹了条凤，二郎神臀部纹了条狗，巨灵神腹部纹了条蚯蚓。
A335: 333 | B335: 那烂陀 | C335: =R[-1]C+1 -> 3 | D335: 那烂陀 | E335: 69 | F335: =R[-1]C -> 5 | G335: 190 | H335: =R[-1]C+8 -> 2736 | I335: 最近仙界掀起移民狂潮，许多神仙打算移民到西天菩萨那边，据说那里各方面条件都好。当然，这些神仙很快就被玉帝弄死了。
A336: 334 | B336: 那烂陀 | C336: =R[-1]C+1 -> 4 | D336: 那烂陀 | E336: 69 | F336: =R[-1]C -> 5 | G336: 190 | H336: =R[-1]C+8 -> 2744 | I336: 第七届仙界好嗓音冠军鲁一发，演唱曲目《死了都要唱》，他撕心裂肺般的嗓音震的几位导师当场休克。他其实是巨灵的化身。
A337: 335 | B337: 那烂陀 | C337: =R[-1]C+1 -> 5 | D337: 那烂陀 | E337: 69 | F337: =R[-1]C -> 5 | G337: 190 | H337: =R[-1]C+8 -> 2752 | I337: 喜马拉雅之神最近打算搬家了，因为喜马拉山每年都在变暖，每年都在变矮，他无法忍受这一状况，但却又无可奈何。
A338: 336 | B338: 那烂陀 | C338: =R[-1]C+1 -> 6 | D338: 那烂陀 | E338: 70 | F338: =R[-1]C -> 5 | G338: 190 | H338: =R[-1]C+8 -> 2760 | I338: 玉帝最近打算改变一下星系的基本规则，让地球绕着月亮转一段时间，老是绕着太阳转，他看着头晕。
A339: 337 | B339: 那烂陀 | C339: =R[-1]C+1 -> 7 | D339: 那烂陀 | E339: 70 | F339: =R[-1]C -> 5 | G339: 190 | H339: =R[-1]C+8 -> 2768 | I339: 天界就神仙该不该吃肉这事请教如来，如来说，荤即是素，素即是荤，何必分清。众仙大喜说那就是可以吃？如来说不可以。
A340: 338 | B340: 那烂陀 | C340: =R[-1]C+1 -> 8 | D340: 那烂陀 | E340: 70 | F340: =R[-1]C -> 5 | G340: 190 | H340: =R[-1]C+8 -> 2776 | I340: 有一种神仙，一生中只有在买东西的时候才会被叫“帅哥”，他就是张果老。。。
A341: 339 | B341: 那烂陀 | C341: =R[-1]C+1 -> 9 | D341: 那烂陀 | E341: 70 | F341: =R[-1]C -> 5 | G341: 190 | H341: =R[-1]C+8 -> 2784 | I341: 仙界想举办足球大赛，但是土行孙被禁止参加，他很郁闷：“最多我不用土遁可以了吧？”
A342: 340 | B342: 那烂陀 | C342: =R[-1]C+1 -> 10 | D342: 那烂陀 | E342: 70 | F342: =R[-1]C -> 5 | G342: 190 | H342: =R[-1]C+8 -> 2792 | I342: 财神手下火焰大仙近日携带近5亿的仙币潜逃至西方极乐世界。这事件在仙界引起了极大震动。玉帝批示，务必要彻查此事。
A343: 341 | B343: 生死场 | C343: 1 | D343: 生死场 | E343: 71 | F343: =R[-1]C -> 5 | G343: 195 | H343: =R[-1]C+8 -> 2800 | I343: 地狱高层最近发生了人事变动，大刑官钟馗被开除。原因是他调戏女鬼。这让阎罗王很恼火，你这TMD是有多饥渴。
A344: 342 | B344: 生死场 | C344: =R[-1]C+1 -> 2 | D344: 生死场 | E344: 71 | F344: =R[-1]C -> 5 | G344: 195 | H344: =R[-1]C+8 -> 2808 | I344: 仙界工资最高的是玉帝身边的红人太白金星，很多人都想认这个老头做干儿子！
A345: 343 | B345: 生死场 | C345: =R[-1]C+1 -> 3 | D345: 生死场 | E345: 71 | F345: =R[-1]C -> 5 | G345: 195 | H345: =R[-1]C+8 -> 2816 | I345: 都说男人有钱就变坏，吴刚这才领悟到当时嫦娥跟他说的话：“你是个好人！”
A346: 344 | B346: 生死场 | C346: =R[-1]C+1 -> 4 | D346: 生死场 | E346: 71 | F346: =R[-1]C -> 5 | G346: 195 | H346: =R[-1]C+8 -> 2824 | I346: 外星人确实存在，他们经常组团光临天庭，与众神仙讨论修仙之道。
A347: 345 | B347: 生死场 | C347: =R[-1]C+1 -> 5 | D347: 生死场 | E347: 71 | F347: =R[-1]C -> 5 | G347: 195 | H347: =R[-1]C+8 -> 2832 | I347: 关于宇宙本身是否有寿命这个话题，玉帝的观点是，就算有，宇宙也一定是比我先死。
A348: 346 | B348: 生死场 | C348: =R[-1]C+1 -> 6 | D348: 生死场 | E348: 72 | F348: =R[-1]C -> 5 | G348: 195 | H348: =R[-1]C+8 -> 2840 | I348: 人间最近手机游戏很火，但大部分都是三国武侠题材。对此玉帝觉得有些恼火，难道神仙的地位人间这些货色都比不上么。
A349: 347 | B349: 生死场 | C349: =R[-1]C+1 -> 7 | D349: 生死场 | E349: 72 | F349: =R[-1]C -> 5 | G349: 195 | H349: =R[-1]C+8 -> 2848 | I349: 灵异事件其实没那么玄乎，不过是一些还没有被黑白无常收走的孤魂野鬼而已，他们都是善良的鬼，没什么好怕的。
A350: 348 | B350: 生死场 | C350: =R[-1]C+1 -> 8 | D350: 生死场 | E350: 72 | F350: =R[-1]C -> 5 | G350: 195 | H350: =R[-1]C+8 -> 2856 | I350: 创新对于神仙来说同样重要。比如姜子牙将垂钓的修行方式改为拳击，而二郎神则采用了一种比较休闲的修仙方式，遛狗。
A351: 349 | B351: 生死场 | C351: =R[-1]C+1 -> 9 | D351: 生死场 | E351: 72 | F351: =R[-1]C -> 5 | G351: 195 | H351: =R[-1]C+8 -> 2864 | I351: 所有神仙中，普通话最差的当属南海仙人，因为他祖籍是海南黎族。他说的话，大家基本都是在猜，都听清楚那是不可能的了。
A352: 350 | B352: 生死场 | C352: =R[-1]C+1 -> 10 | D352: 生死场 | E352: 72 | F352: =R[-1]C -> 5 | G352: 195 | H352: =R[-1]C+8 -> 2872 | I352: 太白金星向玉帝建议，以后搞个签到制度，凡是不来上朝的，一律扣仙币。玉帝打了个呵欠说，算了吧，我自己都懒得上朝。
A353: 351 | B353: 龙须地 | C353: 1 | D353: 龙须地 | E353: 73 | F353: =R[-1]C -> 5 | G353: 200 | H353: =R[-1]C+8 -> 2880 | I353: 在今年仙界的“下基层，察民情”活动中，北天仙人荣获第一。因为他自从下到凡间之后，就再也没有回来，消失了。
A354: 352 | B354: 龙须地 | C354: =R[-1]C+1 -> 2 | D354: 龙须地 | E354: 73 | F354: =R[-1]C -> 5 | G354: 200 | H354: =R[-1]C+8 -> 2888 | I354: 每年七夕，法海都会坐在雷锋塔顶，点上一支香烟，45度角仰望星空，陷入沉思中，为什么许仙喜欢的是白素贞，而不是他。
A355: 353 | B355: 龙须地 | C355: =R[-1]C+1 -> 3 | D355: 龙须地 | E355: 73 | F355: =R[-1]C -> 5 | G355: 200 | H355: =R[-1]C+8 -> 2896 | I355: 作为仙界首富，财神赵公明的总资产已经达到了7800亿仙币，这相当于整个人间500年的总产值。
A356: 354 | B356: 龙须地 | C356: =R[-1]C+1 -> 4 | D356: 龙须地 | E356: 73 | F356: =R[-1]C -> 5 | G356: 200 | H356: =R[-1]C+8 -> 2904 | I356: 对于人间这些国家领导人，玉帝最欣赏的就是朝鲜金三胖，因为他觉得三胖最特别的地方就在于，他是如此的令人无语。
A357: 355 | B357: 龙须地 | C357: =R[-1]C+1 -> 5 | D357: 龙须地 | E357: 73 | F357: =R[-1]C -> 5 | G357: 200 | H357: =R[-1]C+8 -> 2912 | I357: 娱乐圈最近很混乱，二郎神一直蠢蠢欲动，他在想，都这样没有底线没有节操了，干脆让老子下去一次性全给潜了得了。
A358: 356 | B358: 龙须地 | C358: =R[-1]C+1 -> 6 | D358: 龙须地 | E358: 74 | F358: =R[-1]C -> 5 | G358: 200 | H358: =R[-1]C+8 -> 2920 | I358: 在观看完今年人间一年一度的世界模特大赛之后，玉帝主要的感受是，都穿那么紧的比基尼，勒的不疼么。
A359: 357 | B359: 龙须地 | C359: =R[-1]C+1 -> 7 | D359: 龙须地 | E359: 74 | F359: =R[-1]C -> 5 | G359: 200 | H359: =R[-1]C+8 -> 2928 | I359: 仙界最近很流行整容塑体这一套，毫无疑问，紫衣仙女是最为耀眼的一个。她的三围在整容后成功的变为1-250-1。
A360: 358 | B360: 龙须地 | C360: =R[-1]C+1 -> 8 | D360: 龙须地 | E360: 74 | F360: =R[-1]C -> 5 | G360: 200 | H360: =R[-1]C+8 -> 2936 | I360: 日游神最近从人间收集到了许多明星的靓照。最近他打算在仙界开一间整容医院，照片作为整容后的照片打广告。
A361: 359 | B361: 龙须地 | C361: =R[-1]C+1 -> 9 | D361: 龙须地 | E361: 74 | F361: =R[-1]C -> 5 | G361: 200 | H361: =R[-1]C+8 -> 2944 | I361: 韩剧很热，韩流来袭，众仙女一整个夏天都在思密达中度过。她们尤其喜欢棒子们演戏时的那个噢？噢？的嘟嘴表情。
A362: 360 | B362: 龙须地 | C362: =R[-1]C+1 -> 10 | D362: 龙须地 | E362: 74 | F362: =R[-1]C -> 5 | G362: 200 | H362: =R[-1]C+8 -> 2952 | I362: 最近凡间的后羿又传来了消息，由于城管的介入，烧烤摊成功关闭。他思虑良久后，加入了城管组织。
A363: 361 | B363: 南华峰 | C363: 1 | D363: 南华峰 | E363: 75 | F363: =R[-1]C -> 5 | G363: 205 | H363: =R[-1]C+8 -> 2960 | I363: 紫霞仙子不忍看着人间农村众多留守儿童和老人受苦，她将自己的全部法术倾注于人间，护佑这些孩子和老人的健康与快乐。
A364: 362 | B364: 南华峰 | C364: =R[-1]C+1 -> 2 | D364: 南华峰 | E364: 75 | F364: =R[-1]C -> 5 | G364: 205 | H364: =R[-1]C+8 -> 2968 | I364: 二郎神最近出版了一本写真画册，名为《我与哮天犬》。该画册受到了众仙的热捧，因为大家都想知道他们是怎么生活的。
A365: 363 | B365: 南华峰 | C365: =R[-1]C+1 -> 3 | D365: 南华峰 | E365: 75 | F365: =R[-1]C -> 5 | G365: 205 | H365: =R[-1]C+8 -> 2976 | I365: 其实神仙也是有男女之分的，只是这个性别区分度可能没有人间那么高，那么夸张。
A366: 364 | B366: 南华峰 | C366: =R[-1]C+1 -> 4 | D366: 南华峰 | E366: 75 | F366: =R[-1]C -> 5 | G366: 205 | H366: =R[-1]C+8 -> 2984 | I366: 老龙王真的老了，不仅晕船，而且恐高，最近上天那一次，好几次差点从云彩上掉下来。他觉得他应该退休了。
A367: 365 | B367: 南华峰 | C367: =R[-1]C+1 -> 5 | D367: 南华峰 | E367: 75 | F367: =R[-1]C -> 5 | G367: 205 | H367: =R[-1]C+8 -> 2992 | I367: 托塔李天王的那座塔，其实是用东海三太子的皮和筋做成的。
A368: 366 | B368: 南华峰 | C368: =R[-1]C+1 -> 6 | D368: 南华峰 | E368: 76 | F368: =R[-1]C -> 5 | G368: 205 | H368: =R[-1]C+8 -> 3000 | I368: 白素贞并没有被压到雷锋塔下，而是一直住在雷峰塔的顶层，东南朝向，落地窗，全海景，堪称奢侈。
A369: 367 | B369: 南华峰 | C369: =R[-1]C+1 -> 7 | D369: 南华峰 | E369: 76 | F369: =R[-1]C -> 5 | G369: 205 | H369: =R[-1]C+8 -> 3008 | I369: 星爷很久不拍片了，这让众神仙非常遗憾，昔日的济癫，何时才能够回来呢？
A370: 368 | B370: 南华峰 | C370: =R[-1]C+1 -> 8 | D370: 南华峰 | E370: 76 | F370: =R[-1]C -> 5 | G370: 205 | H370: =R[-1]C+8 -> 3016 | I370: 近日众仙列出了一份最喜欢吃的人间美食。排名前三的分别是山西臊子面，河北驴肉火烧，凉拌黄瓜。
A371: 369 | B371: 南华峰 | C371: =R[-1]C+1 -> 9 | D371: 南华峰 | E371: 76 | F371: =R[-1]C -> 5 | G371: 205 | H371: =R[-1]C+8 -> 3024 | I371: 每年的中秋节，玉帝都会召集众仙前往月宫，大家一起坐在桂树下，吃着烤兔肉，喝着瑶池水，观看嫦娥的精彩演出。
A372: 370 | B372: 南华峰 | C372: =R[-1]C+1 -> 10 | D372: 南华峰 | E372: 76 | F372: =R[-1]C -> 5 | G372: 205 | H372: =R[-1]C+8 -> 3032 | I372: 最近仙界莫名其妙的多了许多妖魔鬼魂，玉帝怀疑阎罗王是不是有叛逆之心，想夺他的位子。
A373: 371 | B373: 黑虎山 | C373: 1 | D373: 黑虎山 | E373: 77 | F373: =R[-1]C -> 5 | G373: 210 | H373: =R[-1]C+8 -> 3040 | I373: 牛魔王最近喜得贵子，思虑良久，他最终为这个牛犊子起名为牛牪犇。
A374: 372 | B374: 黑虎山 | C374: =R[-1]C+1 -> 2 | D374: 黑虎山 | E374: 77 | F374: =R[-1]C -> 5 | G374: 210 | H374: =R[-1]C+8 -> 3048 | I374: 人间的后羿近日再传喜讯，他已经成功的结婚了。妻子叫丽丽。
A375: 373 | B375: 黑虎山 | C375: =R[-1]C+1 -> 3 | D375: 黑虎山 | E375: 77 | F375: =R[-1]C -> 5 | G375: 210 | H375: =R[-1]C+8 -> 3056 | I375: 后羿其实并不是他自己的真是名字，那只是一个代号。他真正的名字叫刘德龙。
A376: 374 | B376: 黑虎山 | C376: =R[-1]C+1 -> 4 | D376: 黑虎山 | E376: 77 | F376: =R[-1]C -> 5 | G376: 210 | H376: =R[-1]C+8 -> 3064 | I376: 在忍受了数百年的寂寞苦修后，法海的情愫终于爆发，近日，他高调宣布出柜。
A377: 375 | B377: 黑虎山 | C377: =R[-1]C+1 -> 5 | D377: 黑虎山 | E377: 77 | F377: =R[-1]C -> 5 | G377: 210 | H377: =R[-1]C+8 -> 3072 | I377: 张果老的驴最近产下一驹子，张老喜不胜喜，他为其取名为果果。大家都说果果长的很像张果老。
A378: 376 | B378: 黑虎山 | C378: =R[-1]C+1 -> 6 | D378: 黑虎山 | E378: 78 | F378: =R[-1]C -> 5 | G378: 210 | H378: =R[-1]C+8 -> 3080 | I378: 财神最近受到了玉帝的点名批评。因为他私自下凡在紫荆城中购置了76套四合院，直接使得紫荆城乱了套。
A379: 377 | B379: 黑虎山 | C379: =R[-1]C+1 -> 7 | D379: 黑虎山 | E379: 78 | F379: =R[-1]C -> 5 | G379: 210 | H379: =R[-1]C+8 -> 3088 | I379: 近日传闻雷公有了外遇，电母听到这个消息后，发了疯一样用电锥子戳雷公。若不是众仙阻拦及时，雷公一定被活活戳死。
A380: 378 | B380: 黑虎山 | C380: =R[-1]C+1 -> 8 | D380: 黑虎山 | E380: 78 | F380: =R[-1]C -> 5 | G380: 210 | H380: =R[-1]C+8 -> 3096 | I380: 后羿坐在窗边，仰望月空，曾经的山盟海誓是如此的深刻，你若下嫁他人，我必袈裟裹体。
A381: 379 | B381: 黑虎山 | C381: =R[-1]C+1 -> 9 | D381: 黑虎山 | E381: 78 | F381: =R[-1]C -> 5 | G381: 210 | H381: =R[-1]C+8 -> 3104 | I381: 盘古爷自从开天辟地之后，他便一直在西天苍山沉睡。据说每过一亿年，盘古爷才会睁眼一次。
A382: 380 | B382: 黑虎山 | C382: =R[-1]C+1 -> 10 | D382: 黑虎山 | E382: 78 | F382: =R[-1]C -> 5 | G382: 210 | H382: =R[-1]C+8 -> 3112 | I382: 悟空被压在五指山下的时候，唐僧每天都在给他送饭。送了整整五百年的饭，而且每次都是蛋炒饭。悟空已经要吃吐了。
A383: 381 | B383: 妖风洞 | C383: 1 | D383: 妖风洞 | E383: 79 | F383: =R[-1]C -> 5 | G383: 215 | H383: =R[-1]C+8 -> 3120 | I383: 玉帝希望能够推选出一个仙界吉祥物，以此来代表仙界的正义与仁爱。最终大家选出的是王母蟠桃园中的小蝴蝶。
A384: 382 | B384: 妖风洞 | C384: =R[-1]C+1 -> 2 | D384: 妖风洞 | E384: 79 | F384: =R[-1]C -> 5 | G384: 215 | H384: =R[-1]C+8 -> 3128 | I384: 玉帝最近喜欢上了人间的一款叫《撸啊撸》游戏，没事的时候他总会拉上太白金星太上老君一起组队撸两把。
A385: 383 | B385: 妖风洞 | C385: =R[-1]C+1 -> 3 | D385: 妖风洞 | E385: 79 | F385: =R[-1]C -> 5 | G385: 215 | H385: =R[-1]C+8 -> 3136 | I385: 流沙河因为气候干旱，最近已经完全枯干。
A386: 384 | B386: 妖风洞 | C386: =R[-1]C+1 -> 4 | D386: 妖风洞 | E386: 79 | F386: =R[-1]C -> 5 | G386: 215 | H386: =R[-1]C+8 -> 3144 | I386: 南天门守卫最近发现了了一架F117隐形飞机经常在附近晃荡，经过一番激战，南天门守卫重伤。
A387: 385 | B387: 妖风洞 | C387: =R[-1]C+1 -> 5 | D387: 妖风洞 | E387: 79 | F387: =R[-1]C -> 5 | G387: 215 | H387: =R[-1]C+8 -> 3152 | I387: 南海龙宫的蟹黄大将最近在潜水时不幸发生意外，窒息身亡。
A388: 386 | B388: 妖风洞 | C388: =R[-1]C+1 -> 6 | D388: 妖风洞 | E388: 80 | F388: =R[-1]C -> 5 | G388: 215 | H388: =R[-1]C+8 -> 3160 | I388: 关于人间最近发生的法官集体嫖娼事件，众仙的意见是：没什么大惊小怪的，这只是他们的一次正常娱乐活动罢了。
A389: 387 | B389: 妖风洞 | C389: =R[-1]C+1 -> 7 | D389: 妖风洞 | E389: 80 | F389: =R[-1]C -> 5 | G389: 215 | H389: =R[-1]C+8 -> 3168 | I389: 南天仙女最近因为减肥过度而昏厥数天，醒来以后变成了植物人。
A390: 388 | B390: 妖风洞 | C390: =R[-1]C+1 -> 8 | D390: 妖风洞 | E390: 80 | F390: =R[-1]C -> 5 | G390: 215 | H390: =R[-1]C+8 -> 3176 | I390: 为了更好的化身人间进行民情体察，土行孙打算去蓝翔技校学习一门在人间能真正用得上的技术。
A391: 389 | B391: 妖风洞 | C391: =R[-1]C+1 -> 9 | D391: 妖风洞 | E391: 80 | F391: =R[-1]C -> 5 | G391: 215 | H391: =R[-1]C+8 -> 3184 | I391: 一直以来，太上老君都偷偷地把仙丹卖给凡间，还特意包装成一种叫巧克力的玩意。。。
A392: 390 | B392: 妖风洞 | C392: =R[-1]C+1 -> 10 | D392: 妖风洞 | E392: 80 | F392: =R[-1]C -> 5 | G392: 215 | H392: =R[-1]C+8 -> 3192 | I392: 西楚霸王归天之后，他被玉帝封为仁义武大帝。刘邦归天之后，阎罗王每天都会打上他半个小时。
A393: 391 | B393: 大乘愚 | C393: 1 | D393: 大乘愚 | E393: 81 | F393: =R[-1]C -> 5 | G393: 220 | H393: =R[-1]C+8 -> 3200 | I393: 因为吴刚吃的玉兔太多，嫦娥上诉到了玉帝那里。玉帝叹了口气说，你知道么，他吃的其实不是兔肉，是寂寞，是孤苦。
A394: 392 | B394: 大乘愚 | C394: =R[-1]C+1 -> 2 | D394: 大乘愚 | E394: 81 | F394: =R[-1]C -> 5 | G394: 220 | H394: =R[-1]C+8 -> 3208 | I394: 孙大圣身上的猴毛总共是三千七百六十五根，其实没有我们想象的那么多。他的毛是比较粗硬的那种类型。
A395: 393 | B395: 大乘愚 | C395: =R[-1]C+1 -> 3 | D395: 大乘愚 | E395: 81 | F395: =R[-1]C -> 5 | G395: 220 | H395: =R[-1]C+8 -> 3216 | I395: 筹备多年的北天门工程近日在仙界启动。仙界多年来堵塞的交通将获得有效缓解。
A396: 394 | B396: 大乘愚 | C396: =R[-1]C+1 -> 4 | D396: 大乘愚 | E396: 81 | F396: =R[-1]C -> 5 | G396: 220 | H396: =R[-1]C+8 -> 3224 | I396: 九头鸟因为最近屡犯天规，被处以砍头刑罚，最近被砍的只剩下一颗脑袋了。
A397: 395 | B397: 大乘愚 | C397: =R[-1]C+1 -> 5 | D397: 大乘愚 | E397: 81 | F397: =R[-1]C -> 5 | G397: 220 | H397: =R[-1]C+8 -> 3232 | I397: 夏之妺喜、商之妲己、周之褒姒以及春秋之骊姬，被称为古代四大妖姬。事实上，她们是四姐妹。
A398: 396 | B398: 大乘愚 | C398: =R[-1]C+1 -> 6 | D398: 大乘愚 | E398: 82 | F398: =R[-1]C -> 5 | G398: 220 | H398: =R[-1]C+8 -> 3240 | I398: 张果老的毛驴越来越老，渐渐的已经骑不动了，而小毛驴果果又没有完全长大，这让他很发愁，以后出行骑什么呢？
A399: 397 | B399: 大乘愚 | C399: =R[-1]C+1 -> 7 | D399: 大乘愚 | E399: 82 | F399: =R[-1]C -> 5 | G399: 220 | H399: =R[-1]C+8 -> 3248 | I399: 北海龙王很清楚，美人鱼其实不是上半身人下半身鱼，而是上半身鱼下半身人。
A400: 398 | B400: 大乘愚 | C400: =R[-1]C+1 -> 8 | D400: 大乘愚 | E400: 82 | F400: =R[-1]C -> 5 | G400: 220 | H400: =R[-1]C+8 -> 3256 | I400: 铁扇公主在牛魔王生日那天，下凡去找孙悟空玩去了。不过这事现在牛魔王还不知道。
A401: 399 | B401: 大乘愚 | C401: =R[-1]C+1 -> 9 | D401: 大乘愚 | E401: 82 | F401: =R[-1]C -> 5 | G401: 220 | H401: =R[-1]C+8 -> 3264 | I401: 哪吒的风火轮因为使用频率过高，所以已经被彻底烧坏了，现在基本上也就是当个旱冰鞋来穿。
A402: 400 | B402: 大乘愚 | C402: =R[-1]C+1 -> 10 | D402: 大乘愚 | E402: 82 | F402: =R[-1]C -> 5 | G402: 220 | H402: =R[-1]C+8 -> 3272 | I402: 由于人间台风频繁，造成损失过于严重。风神近日被玉帝免职，并打到地狱。
A403: 401 | B403: 普陀寺 | C403: 1 | D403: 普陀寺 | E403: 83 | F403: =R[-1]C -> 5 | G403: 225 | H403: =R[-1]C+8 -> 3280 | I403: 北斗七星君最近打算和七仙女结对子，不过这遭到了王母的反对，她意思是，这事儿啊，动静太大了啊，影响不太好啊。
A404: 402 | B404: 普陀寺 | C404: =R[-1]C+1 -> 2 | D404: 普陀寺 | E404: 83 | F404: =R[-1]C -> 5 | G404: 225 | H404: =R[-1]C+8 -> 3288 | I404: 人间百姓生活苦不堪言，摆不起摊，买不起房，很多人甚至吃不饱饭。玉帝用力吸了一口烟，忍不住陷入深深的沉思之中。
A405: 403 | B405: 普陀寺 | C405: =R[-1]C+1 -> 3 | D405: 普陀寺 | E405: 83 | F405: =R[-1]C -> 5 | G405: 225 | H405: =R[-1]C+8 -> 3296 | I405: 对于凡间里专家盛行的这个事，玉帝的观点是，应该把这事儿告诉阎王，让他在地狱里尽快一次性解决。
A406: 404 | B406: 普陀寺 | C406: =R[-1]C+1 -> 4 | D406: 普陀寺 | E406: 83 | F406: =R[-1]C -> 5 | G406: 225 | H406: =R[-1]C+8 -> 3304 | I406: 沙僧每次在喊大师兄、二师兄，师父被抓走了，心里都想着我的师弟呀，你在哪里。
A407: 405 | B407: 普陀寺 | C407: =R[-1]C+1 -> 5 | D407: 普陀寺 | E407: 83 | F407: =R[-1]C -> 5 | G407: 225 | H407: =R[-1]C+8 -> 3312 | I407: 当年女娲造人只是为了日后天漏了有人可以帮忙补上，而把人分为男女只是为了干活不累。
A408: 406 | B408: 普陀寺 | C408: =R[-1]C+1 -> 6 | D408: 普陀寺 | E408: 84 | F408: =R[-1]C -> 5 | G408: 225 | H408: =R[-1]C+8 -> 3320 | I408: 当年唐僧取经路上有那么多神仙或家属下界为妖，是因为天宫收入太低，他们想下海赚外快。
A409: 407 | B409: 普陀寺 | C409: =R[-1]C+1 -> 7 | D409: 普陀寺 | E409: 84 | F409: =R[-1]C -> 5 | G409: 225 | H409: =R[-1]C+8 -> 3328 | I409: 据说后羿射日的时候，其中一个偷偷给他塞了一大笔钱，所以最后的那个日被留了下来。
A410: 408 | B410: 普陀寺 | C410: =R[-1]C+1 -> 8 | D410: 普陀寺 | E410: 84 | F410: =R[-1]C -> 5 | G410: 225 | H410: =R[-1]C+8 -> 3336 | I410: 王母娘娘好客，每逢佳节，常常宴请各路神仙聚会吃蟠桃、喝茅台，随便收些礼物。
A411: 409 | B411: 普陀寺 | C411: =R[-1]C+1 -> 9 | D411: 普陀寺 | E411: 84 | F411: =R[-1]C -> 5 | G411: 225 | H411: =R[-1]C+8 -> 3344 | I411: 百花仙子对每种花都再熟悉不过了，不管是桃花荷花，还是牡丹兰花，抑或是菊花。
A412: 410 | B412: 普陀寺 | C412: =R[-1]C+1 -> 10 | D412: 普陀寺 | E412: 84 | F412: =R[-1]C -> 5 | G412: 225 | H412: =R[-1]C+8 -> 3352 | I412: 由于唐僧有恐高症，所以观音要求龙王三太子不能变成龙，只能变成马。
A413: 411 | B413: 三界门 | C413: 1 | D413: 三界门 | E413: 85 | F413: =R[-1]C -> 5 | G413: 230 | H413: =R[-1]C+8 -> 3360 | I413: 97号草的价格一升再升，唐僧压力特别大，所以他到处游说，想方设法想把他的宝贵坐骑白龙马给出售了。
A414: 412 | B414: 三界门 | C414: =R[-1]C+1 -> 2 | D414: 三界门 | E414: 85 | F414: =R[-1]C -> 5 | G414: 230 | H414: =R[-1]C+8 -> 3368 | I414: 唐僧他们去西天是为了上访，想让玉帝下台，所以一路上玉帝派了各路神仙装成妖魔鬼怪进行阻挠。
A415: 413 | B415: 三界门 | C415: =R[-1]C+1 -> 3 | D415: 三界门 | E415: 85 | F415: =R[-1]C -> 5 | G415: 230 | H415: =R[-1]C+8 -> 3376 | I415: 有小道消息称，愚公把花果山移走了，不过不知道移到了什么地方，这个可能是天庭机密吧，不宜对外公开。
A416: 414 | B416: 三界门 | C416: =R[-1]C+1 -> 4 | D416: 三界门 | E416: 85 | F416: =R[-1]C -> 5 | G416: 230 | H416: =R[-1]C+8 -> 3384 | I416: 猪八戒和高俅是一对好基友，猪八戒随唐僧去西天取经后，高俅趁机将高老庄强行占为己有，并改名为高老庄。
A417: 415 | B417: 三界门 | C417: =R[-1]C+1 -> 5 | D417: 三界门 | E417: 85 | F417: =R[-1]C -> 5 | G417: 230 | H417: =R[-1]C+8 -> 3392 | I417: 玉帝觉得天庭的市容市貌越来越差，所以他决定再组建一支城管部队，这次由二郎神担任队长，哮天犬担任副队长。
A418: 416 | B418: 三界门 | C418: =R[-1]C+1 -> 6 | D418: 三界门 | E418: 86 | F418: =R[-1]C -> 5 | G418: 230 | H418: =R[-1]C+8 -> 3400 | I418: 雷公是A型血，电母是B型血，所以每天晚上电母都睡的很香，而雷公则被蚊子叮的完全睡不着，这就是血型的魅力。
A419: 417 | B419: 三界门 | C419: =R[-1]C+1 -> 7 | D419: 三界门 | E419: 86 | F419: =R[-1]C -> 5 | G419: 230 | H419: =R[-1]C+8 -> 3408 | I419: 因为长年久坐龙椅，玉帝经常大腿发麻，医仙说他这是腰间盘突出，脊椎压住神经了，需要做手术动刀子才行。
A420: 418 | B420: 三界门 | C420: =R[-1]C+1 -> 8 | D420: 三界门 | E420: 86 | F420: =R[-1]C -> 5 | G420: 230 | H420: =R[-1]C+8 -> 3416 | I420: 由于憋了数百年了，能量过大。所以人间的后羿近日腰疼的厉害，医生说悠着点兄弟，别太猛了。。
A421: 419 | B421: 三界门 | C421: =R[-1]C+1 -> 9 | D421: 三界门 | E421: 86 | F421: =R[-1]C -> 5 | G421: 230 | H421: =R[-1]C+8 -> 3424 | I421: 一个月的时间，土行孙的身高由之前的0.5米暴增到1.7米，这让他喜极而泣。憋了数千年了，终于TMD开始正常发育了。
A422: 420 | B422: 三界门 | C422: =R[-1]C+1 -> 10 | D422: 三界门 | E422: 86 | F422: =R[-1]C -> 5 | G422: 230 | H422: =R[-1]C+8 -> 3432 | I422: 因为长的太高，巨灵神的膝盖终于不堪重负，他近日患上了严重的关节炎，医仙说他很有可能整个下体坏死。
A423: 421 | B423: 七尘斋 | C423: 1 | D423: 七尘斋 | E423: 87 | F423: =R[-1]C -> 5 | G423: 235 | H423: =R[-1]C+8 -> 3440 | I423: 由于气候反常，牡丹仙子的牡丹园里，所有花一眼之间全部变成了向日葵。仙子坐在园子里，忍不住流下了伤心的泪水。
A424: 422 | B424: 七尘斋 | C424: =R[-1]C+1 -> 2 | D424: 七尘斋 | E424: 87 | F424: =R[-1]C -> 5 | G424: 235 | H424: =R[-1]C+8 -> 3448 | I424: 菩提老祖被视为仙界里最没有节操的一个神仙，原因不详。
A425: 423 | B425: 七尘斋 | C425: =R[-1]C+1 -> 3 | D425: 七尘斋 | E425: 87 | F425: =R[-1]C -> 5 | G425: 235 | H425: =R[-1]C+8 -> 3456 | I425: 由于品性端庄，尔雅大方。嫦娥仙子最近被玉帝任命为天庭德育大队辅导员，专门负责神仙们的心理健康。
A426: 424 | B426: 七尘斋 | C426: =R[-1]C+1 -> 4 | D426: 七尘斋 | E426: 87 | F426: =R[-1]C -> 5 | G426: 235 | H426: =R[-1]C+8 -> 3464 | I426: 铁拐李最近被查出颈部以上瘫痪，张果老问其是什么病症，铁拐李说:“就是脑残，没得治。。。”
A427: 425 | B427: 七尘斋 | C427: =R[-1]C+1 -> 5 | D427: 七尘斋 | E427: 87 | F427: =R[-1]C -> 5 | G427: 235 | H427: =R[-1]C+8 -> 3472 | I427: 在近日的仙术结业考试中，托塔天王作弊被发现，玉帝雷霆震怒，剥脱他天王的称号，并没收了他的天塔神器。
A428: 426 | B428: 七尘斋 | C428: =R[-1]C+1 -> 6 | D428: 七尘斋 | E428: 88 | F428: =R[-1]C -> 5 | G428: 235 | H428: =R[-1]C+8 -> 3480 | I428: 云中子是仙界最擅炼器之人，番天印、捆仙绳、风火轮等大名鼎鼎的道具都曾被仿制过，他算得上是盗版的始祖。
A429: 427 | B429: 七尘斋 | C429: =R[-1]C+1 -> 7 | D429: 七尘斋 | E429: 88 | F429: =R[-1]C -> 5 | G429: 235 | H429: =R[-1]C+8 -> 3488 | I429: 生活的压力越来越大，仙界中的单身越来越多了，房子，车子，妻子都已经成为了他们生命中无法承受之重。
A430: 428 | B430: 七尘斋 | C430: =R[-1]C+1 -> 8 | D430: 七尘斋 | E430: 88 | F430: =R[-1]C -> 5 | G430: 235 | H430: =R[-1]C+8 -> 3496 | I430: 最近人间重走西天路的这个旅游路线很火。悟空看的又想哭又想笑，人的想法，他真的猜不透耶。
A431: 429 | B431: 七尘斋 | C431: =R[-1]C+1 -> 9 | D431: 七尘斋 | E431: 88 | F431: =R[-1]C -> 5 | G431: 235 | H431: =R[-1]C+8 -> 3504 | I431: 守望在奈何桥边的孟婆近日提出离职，看过了人间太多的生死悲欢与离合，她的内心已无法承受这份沉重。
A432: 430 | B432: 七尘斋 | C432: =R[-1]C+1 -> 10 | D432: 七尘斋 | E432: 88 | F432: =R[-1]C -> 5 | G432: 235 | H432: =R[-1]C+8 -> 3512 | I432: 泰森近日受邀上天参加第二届神仙拳击大赛，在被问到夺冠后的感触时，泰森微微一笑说，shit，so easy。
A433: 431 | B433: 众生琅 | C433: 1 | D433: 众生琅 | E433: 89 | F433: =R[-1]C -> 5 | G433: 240 | H433: =R[-1]C+8 -> 3520 | I433: 文曲星创业了，发明了一种叫复读机的玩意，有了他，玉帝再也不用担心众仙的学习了。。。
A434: 432 | B434: 众生琅 | C434: =R[-1]C+1 -> 2 | D434: 众生琅 | E434: 89 | F434: =R[-1]C -> 5 | G434: 240 | H434: =R[-1]C+8 -> 3528 | I434: 南极仙翁的那只仙鹤最近掉毛掉的很厉害，太上老君看过之后说，这是精气过盛所导致，它需要发泄。
A435: 433 | B435: 众生琅 | C435: =R[-1]C+1 -> 3 | D435: 众生琅 | E435: 89 | F435: =R[-1]C -> 5 | G435: 240 | H435: =R[-1]C+8 -> 3536 | I435: 哮天犬近日成功产下一小狗崽，而且还是公的。二郎神狂喜之余，为其取名为杨哮天。
A436: 434 | B436: 众生琅 | C436: =R[-1]C+1 -> 4 | D436: 众生琅 | E436: 89 | F436: =R[-1]C -> 5 | G436: 240 | H436: =R[-1]C+8 -> 3544 | I436: 济公其实并非什么降龙尊者，事实上连罗汉都不是，他其实是天界掌管雨的大神，俗称雨师。
A437: 435 | B437: 众生琅 | C437: =R[-1]C+1 -> 5 | D437: 众生琅 | E437: 89 | F437: =R[-1]C -> 5 | G437: 240 | H437: =R[-1]C+8 -> 3552 | I437: 仙界英文说的最好的是太乙真人，据说他已经过了专8了，托福雅思都是满分。
A438: 436 | B438: 众生琅 | C438: =R[-1]C+1 -> 6 | D438: 众生琅 | E438: 90 | F438: =R[-1]C -> 5 | G438: 240 | H438: =R[-1]C+8 -> 3560 | I438: 太乙真人是仙界英文说的最好的神仙，但最具语言天赋的却是嫦娥仙子。所有的人语，鸟语，她都懂。这都是寂寞的苦劳。
A439: 437 | B439: 众生琅 | C439: =R[-1]C+1 -> 7 | D439: 众生琅 | E439: 90 | F439: =R[-1]C -> 5 | G439: 240 | H439: =R[-1]C+8 -> 3568 | I439: 由于长年累月的战斗不息，刑天战神近日终于病倒了。太上老君说了，没别的，就是累的。
A440: 438 | B440: 众生琅 | C440: =R[-1]C+1 -> 8 | D440: 众生琅 | E440: 90 | F440: =R[-1]C -> 5 | G440: 240 | H440: =R[-1]C+8 -> 3576 | I440: 沉香当年劈山救母的时候，悟空其实是有帮助的，否则以沉香的力量，尚不足以劈开华山的。
A441: 439 | B441: 众生琅 | C441: =R[-1]C+1 -> 9 | D441: 众生琅 | E441: 90 | F441: =R[-1]C -> 5 | G441: 240 | H441: =R[-1]C+8 -> 3584 | I441: 有人说沉香当年劈山救母的斧头，就是盘古爷当年开天辟地的那把。这是真的。
A442: 440 | B442: 众生琅 | C442: =R[-1]C+1 -> 10 | D442: 众生琅 | E442: 90 | F442: =R[-1]C -> 5 | G442: 240 | H442: =R[-1]C+8 -> 3592 | I442: 人间传说中的四不像神兽，它的原型是天上的风神箕伯。虽长相奇特，人面鸟身，但作为蚩尤大帝的师弟，他的地位极其尊贵。
A443: 441 | B443: 万年羲 | C443: 1 | D443: 万年羲 | E443: 91 | F443: =R[-1]C -> 5 | G443: 245 | H443: =R[-1]C+8 -> 3600 | I443: 因为过度嗜酒，铁拐李得了肝硬化，并最终导致下半身彻底瘫痪。于是他告别了随他多年的铁拐，坐上了轮椅。
A444: 442 | B444: 万年羲 | C444: =R[-1]C+1 -> 2 | D444: 万年羲 | E444: 91 | F444: =R[-1]C -> 5 | G444: 245 | H444: =R[-1]C+8 -> 3608 | I444: 由于常年不和，八仙近日发布天庭通告：我们散伙了。
A445: 443 | B445: 万年羲 | C445: =R[-1]C+1 -> 3 | D445: 万年羲 | E445: 91 | F445: =R[-1]C -> 5 | G445: 245 | H445: =R[-1]C+8 -> 3616 | I445: 作为天蓬元帅，八戒当年是主管银河的，而且他性侵嫦娥也不是一次两次了。只不过凌霄殿那次不幸被玉帝看到了而已。
A446: 444 | B446: 万年羲 | C446: =R[-1]C+1 -> 4 | D446: 万年羲 | E446: 91 | F446: =R[-1]C -> 5 | G446: 245 | H446: =R[-1]C+8 -> 3624 | I446: 在砍了八万年的桂树之后，吴刚近日终于向玉帝提出，要下凡去。他说，我无法忍受这份煎熬了，我已经到极限了。
A447: 445 | B447: 万年羲 | C447: =R[-1]C+1 -> 5 | D447: 万年羲 | E447: 91 | F447: =R[-1]C -> 5 | G447: 245 | H447: =R[-1]C+8 -> 3632 | I447: 被批准下凡的吴刚传来了消息，一夜之间，凡间的森林绿地都夷为平地。显然他已经砍树砍上瘾了，根本停不下来。
A448: 446 | B448: 万年羲 | C448: =R[-1]C+1 -> 6 | D448: 万年羲 | E448: 92 | F448: =R[-1]C -> 5 | G448: 245 | H448: =R[-1]C+8 -> 3640 | I448: 女人想发脾气的时候你真的不得不服，就拿织女来说，就因为西红柿炒蛋是要先吃蛋还是先吃西红柿这个话题也能吵起来。
A449: 447 | B449: 万年羲 | C449: =R[-1]C+1 -> 7 | D449: 万年羲 | E449: 92 | F449: =R[-1]C -> 5 | G449: 245 | H449: =R[-1]C+8 -> 3648 | I449: 仙界最近天气炎热，大家提议一起到银河系来个集体游泳，让嫦娥仙子为大家当场示范28个游泳动作。玉帝当场拍板表示赞成。
A450: 448 | B450: 万年羲 | C450: =R[-1]C+1 -> 8 | D450: 万年羲 | E450: 92 | F450: =R[-1]C -> 5 | G450: 245 | H450: =R[-1]C+8 -> 3656 | I450: 在近日举行的第27届天庭马拉松大赛中，北天仙童一头栽倒在终点线上，成为了仙界第一位牺牲在长跑线上的神仙。
A451: 449 | B451: 万年羲 | C451: =R[-1]C+1 -> 9 | D451: 万年羲 | E451: 92 | F451: =R[-1]C -> 5 | G451: 245 | H451: =R[-1]C+8 -> 3664 | I451: 天上存在一个神。它能上天遁地，脱离物理定律的束缚，拥有惊人的质量与速度，这就是以后用在凡间教科书上面的“小滑块”。
A452: 450 | B452: 万年羲 | C452: =R[-1]C+1 -> 10 | D452: 万年羲 | E452: 92 | F452: =R[-1]C -> 5 | G452: 245 | H452: =R[-1]C+8 -> 3672 | I452: 龙王因为悟空大闹龙宫抢走金箍棒的事情留下了很大的心理阴影，求阴影的面积。
A453: 451 | B453: 玲珑痷 | C453: 1 | D453: 玲珑痷 | E453: 93 | F453: =R[-1]C -> 5 | G453: 250 | H453: =R[-1]C+8 -> 3680 | I453: 作为仙界块头最大也最丑的大神，巨灵神近日也有了自己的女神：地狱八婆，作为定情礼，巨灵神送了她一枚八百克拉的钻戒。
A454: 452 | B454: 玲珑痷 | C454: =R[-1]C+1 -> 2 | D454: 玲珑痷 | E454: 93 | F454: =R[-1]C -> 5 | G454: 250 | H454: =R[-1]C+8 -> 3688 | I454: 王母感慨凡间的女子都被各种奢侈品给迷惑了。“真是悲哀啊！”王母拿起身边的LV包包，站起来走了。。
A455: 453 | B455: 玲珑痷 | C455: =R[-1]C+1 -> 3 | D455: 玲珑痷 | E455: 93 | F455: =R[-1]C -> 5 | G455: 250 | H455: =R[-1]C+8 -> 3696 | I455: 菩萨近日主持召开了一次天庭祈福大会，为苦难的人间百姓送去平安，送去健康，送去福分。人们啊，过的真的是太不容易了。
A456: 454 | B456: 玲珑痷 | C456: =R[-1]C+1 -> 4 | D456: 玲珑痷 | E456: 93 | F456: =R[-1]C -> 5 | G456: 250 | H456: =R[-1]C+8 -> 3704 | I456: 黄飞虎近日下凡后悲哀的发现，作为万兽之王，他的徒子徒孙已经濒临灭绝。于是他不禁的悲声大哭了整整一天一夜。
A457: 455 | B457: 玲珑痷 | C457: =R[-1]C+1 -> 5 | D457: 玲珑痷 | E457: 93 | F457: =R[-1]C -> 5 | G457: 250 | H457: =R[-1]C+8 -> 3712 | I457: 托塔天王最新打造的天塔十分的霸气威武，而且更重要的是，这塔是佛祖开过光的。
A458: 456 | B458: 玲珑痷 | C458: =R[-1]C+1 -> 6 | D458: 玲珑痷 | E458: 94 | F458: =R[-1]C -> 5 | G458: 250 | H458: =R[-1]C+8 -> 3720 | I458: 善财童子在天庭上学期间可是一个学霸来的，年年拿奖学金，于是一毕业就被保送到观音的单位下工作！
A459: 457 | B459: 玲珑痷 | C459: =R[-1]C+1 -> 7 | D459: 玲珑痷 | E459: 94 | F459: =R[-1]C -> 5 | G459: 250 | H459: =R[-1]C+8 -> 3728 | I459: 作为昔日佛祖修行过的地方，五华山成为凡间百姓心中的朝拜圣地，他们在山脚下三步一跪拜，祈求佛祖能够为他带来安宁。
A460: 458 | B460: 玲珑痷 | C460: =R[-1]C+1 -> 8 | D460: 玲珑痷 | E460: 94 | F460: =R[-1]C -> 5 | G460: 250 | H460: =R[-1]C+8 -> 3736 | I460: 由于地球板块运动过于剧烈，火焰山早在上个世纪就变成了汪洋大海。
A461: 459 | B461: 玲珑痷 | C461: =R[-1]C+1 -> 9 | D461: 玲珑痷 | E461: 94 | F461: =R[-1]C -> 5 | G461: 250 | H461: =R[-1]C+8 -> 3744 | I461: 许多人都在议论悟空铁扇公主以及牛魔王之间的关系，但这一切其实都是那么的荒唐无聊。铁扇公主爱的从来都是那头老牛。
A462: 460 | B462: 玲珑痷 | C462: =R[-1]C+1 -> 10 | D462: 玲珑痷 | E462: 94 | F462: =R[-1]C -> 5 | G462: 250 | H462: =R[-1]C+8 -> 3752 | I462: 想到人间众多受苦受难的孤儿，王母总会忍不住黯然伤神。她纵然可以降福与这些可怜的孩子，也无法改变人性的那份冷漠。
A463: 461 | B463: 相生殿 | C463: 1 | D463: 相生殿 | E463: 95 | F463: =R[-1]C -> 5 | G463: 255 | H463: =R[-1]C+8 -> 3760 | I463: 八戒抚摸着床边的九齿钉钯，充满感伤。五年前他就很难挥得动这神器了。其实无论是人还是神，终究都会有老去的那一天。
A464: 462 | B464: 相生殿 | C464: =R[-1]C+1 -> 2 | D464: 相生殿 | E464: 95 | F464: =R[-1]C -> 5 | G464: 255 | H464: =R[-1]C+8 -> 3768 | I464: 取经归来之后，唐僧师徒四人就各奔东西。只有在每年的八月十五，他们才会聚在花果山，把酒笑言，畅谈昔日西天取经之事。
A465: 463 | B465: 相生殿 | C465: =R[-1]C+1 -> 3 | D465: 相生殿 | E465: 95 | F465: =R[-1]C -> 5 | G465: 255 | H465: =R[-1]C+8 -> 3776 | I465: 天聋地哑两位大仙作为人间众生的天父和地母，其实他们既不聋也不哑，而且在仙界位极尊贵。
A466: 464 | B466: 相生殿 | C466: =R[-1]C+1 -> 4 | D466: 相生殿 | E466: 95 | F466: =R[-1]C -> 5 | G466: 255 | H466: =R[-1]C+8 -> 3784 | I466: 极光大仙的武器是一把激光刀。这刀是大仙最近下凡时从人民医院里拿走的，经过开光，这刀成为仙界最为锋利的神器。
A467: 465 | B467: 相生殿 | C467: =R[-1]C+1 -> 5 | D467: 相生殿 | E467: 95 | F467: =R[-1]C -> 5 | G467: 255 | H467: =R[-1]C+8 -> 3792 | I467: 人间总喜欢把寺庙里供奉的十八罗汉雕刻的面目狰狞，其实众罗汉皆是眉清目秀之人，尤其是笑面罗汉，长的很像布拉德皮特。
A468: 466 | B468: 相生殿 | C468: =R[-1]C+1 -> 6 | D468: 相生殿 | E468: 96 | F468: =R[-1]C -> 5 | G468: 255 | H468: =R[-1]C+8 -> 3800 | I468: 雷震子最近不小心被自己电死了，原因是他在泡澡的时候过于激动，于是用力过猛不小心发电了。。。
A469: 467 | B469: 相生殿 | C469: =R[-1]C+1 -> 7 | D469: 相生殿 | E469: 96 | F469: =R[-1]C -> 5 | G469: 255 | H469: =R[-1]C+8 -> 3808 | I469: 没有人能够理解五音仙子对音乐的狂热。在她看来，好的音乐不仅仅是一种声音，更是发自灵魂深处的一种低语，一种回音。
A470: 468 | B470: 相生殿 | C470: =R[-1]C+1 -> 8 | D470: 相生殿 | E470: 96 | F470: =R[-1]C -> 5 | G470: 255 | H470: =R[-1]C+8 -> 3816 | I470: 南天门的那条路被装上了红绿灯，那些飙车党，以后你们就乖乖的慢慢飞吧！
A471: 469 | B471: 相生殿 | C471: =R[-1]C+1 -> 9 | D471: 相生殿 | E471: 96 | F471: =R[-1]C -> 5 | G471: 255 | H471: =R[-1]C+8 -> 3824 | I471: 哮天犬的狗崽，羊角大仙的羊羊羊，牛魔王的牛牪犇，因为关系一直很好，所以前些日子它们结为了盟兄弟。
A472: 470 | B472: 相生殿 | C472: =R[-1]C+1 -> 10 | D472: 相生殿 | E472: 96 | F472: =R[-1]C -> 5 | G472: 255 | H472: =R[-1]C+8 -> 3832 | I472: 因为同样的酷爱音乐，九天杀童与土行孙最近组成了一个乐队，叫“暴力火车”，主打民族风。
A473: 471 | B473: 罗汉堂 | C473: 1 | D473: 罗汉堂 | E473: 97 | F473: =R[-1]C -> 5 | G473: 260 | H473: =R[-1]C+8 -> 3840 | I473: UFO近日途径南天门时与南天门神发生了纠纷，双方展开了一番激战，最后以南天门神一脚将UFO踩个稀巴烂而告终。
A474: 472 | B474: 罗汉堂 | C474: =R[-1]C+1 -> 2 | D474: 罗汉堂 | E474: 97 | F474: =R[-1]C -> 5 | G474: 260 | H474: =R[-1]C+8 -> 3848 | I474: 天尊下凡在一家高级餐馆吃了一颗茶叶蛋，没有钱还，被拽进派出所。
A475: 473 | B475: 罗汉堂 | C475: =R[-1]C+1 -> 3 | D475: 罗汉堂 | E475: 97 | F475: =R[-1]C -> 5 | G475: 260 | H475: =R[-1]C+8 -> 3856 | I475: 为了更好的研究女性心理，吴刚与牛郎以及托塔李天王成立了一家专门的研究机构，名为“妇女之夜”。
A476: 474 | B476: 罗汉堂 | C476: =R[-1]C+1 -> 4 | D476: 罗汉堂 | E476: 97 | F476: =R[-1]C -> 5 | G476: 260 | H476: =R[-1]C+8 -> 3864 | I476: 洞庭仙人永远都无法忘记昔日在凡间与那帮难兄难弟走过的日子。苦难，能够让人铭记。
A477: 475 | B477: 罗汉堂 | C477: =R[-1]C+1 -> 5 | D477: 罗汉堂 | E477: 97 | F477: =R[-1]C -> 5 | G477: 260 | H477: =R[-1]C+8 -> 3872 | I477: 凡人问，为何我烦恼多。佛祖说，你没放下。凡人问怎样才能放下，佛祖说，修仙。凡人说可我修不成啊，佛祖说，那算了。
A478: 476 | B478: 罗汉堂 | C478: =R[-1]C+1 -> 6 | D478: 罗汉堂 | E478: 98 | F478: =R[-1]C -> 5 | G478: 260 | H478: =R[-1]C+8 -> 3880 | I478: 对于人间的艺术品，二郎神最欣赏的只有两个，一个是达芬奇的《蒙娜丽莎》。另外一个是动画片《黑猫警长》。
A479: 477 | B479: 罗汉堂 | C479: =R[-1]C+1 -> 7 | D479: 罗汉堂 | E479: 98 | F479: =R[-1]C -> 5 | G479: 260 | H479: =R[-1]C+8 -> 3888 | I479: 为什么神仙都能飘着走呢？一些人认为，神仙的鞋里有机关！所以他们管修仙也叫修鞋，联盟的人对此种说法表示很费解。
A480: 478 | B480: 罗汉堂 | C480: =R[-1]C+1 -> 8 | D480: 罗汉堂 | E480: 98 | F480: =R[-1]C -> 5 | G480: 260 | H480: =R[-1]C+8 -> 3896 | I480: 从前有座山，山里有座庙，庙里有台电脑，电脑前面做了一位程序猿，叫阿日隆~
A481: 479 | B481: 罗汉堂 | C481: =R[-1]C+1 -> 9 | D481: 罗汉堂 | E481: 98 | F481: =R[-1]C -> 5 | G481: 260 | H481: =R[-1]C+8 -> 3904 | I481: 孙悟空：“听说下界最近出现了一个新的战斗种族，叫程序猿？不知是不是从我大花果山跑出去的，战斗力跟俺比起来怎样？”
A482: 480 | B482: 罗汉堂 | C482: =R[-1]C+1 -> 10 | D482: 罗汉堂 | E482: 98 | F482: =R[-1]C -> 5 | G482: 260 | H482: =R[-1]C+8 -> 3912 | I482: 猪八戒：“最近怎么老有那么多人喊，要成为火影的男人，要成为海贼王的男人？脑残么，俺只要成为白富美的男人。
A483: 481 | B483: 七仙居 | C483: 1 | D483: 七仙居 | E483: 99 | F483: =R[-1]C -> 5 | G483: 265 | H483: =R[-1]C+8 -> 3920 | I483: 知道道教三观是哪三观么？人生观，世界观，价值观！
A484: 482 | B484: 七仙居 | C484: =R[-1]C+1 -> 2 | D484: 七仙居 | E484: 99 | F484: =R[-1]C -> 5 | G484: 265 | H484: =R[-1]C+8 -> 3928 | I484: 铁扇公主：“告诉你们多少次了，不要叫我牛夫人，叫我公主大人！”
A485: 483 | B485: 七仙居 | C485: =R[-1]C+1 -> 3 | D485: 七仙居 | E485: 99 | F485: =R[-1]C -> 5 | G485: 265 | H485: =R[-1]C+8 -> 3936 | I485: 近日人间对微博上的大V开始了严格的整顿。为了避免节外生枝，玉帝带领众仙集体封博，返回天庭。
A486: 484 | B486: 七仙居 | C486: =R[-1]C+1 -> 4 | D486: 七仙居 | E486: 99 | F486: =R[-1]C -> 5 | G486: 265 | H486: =R[-1]C+8 -> 3944 | I486: 华山老仙在近日登山的时候不慎从山顶一直滚到山脚，造成了全身粉碎性骨折。玉帝看了后叹了口气说，让阎王收了吧。
A487: 485 | B487: 七仙居 | C487: =R[-1]C+1 -> 5 | D487: 七仙居 | E487: 99 | F487: =R[-1]C -> 5 | G487: 265 | H487: =R[-1]C+8 -> 3952 | I487: 作为那些年一起住过的基友，吴刚与后羿之间有着一种我们常人难以理解的情感，他们是真兄弟。
A488: 486 | B488: 七仙居 | C488: =R[-1]C+1 -> 6 | D488: 七仙居 | E488: 100 | F488: =R[-1]C -> 5 | G488: 265 | H488: =R[-1]C+8 -> 3960 | I488: 没有人可以理解嫦娥独守广寒宫的那种寂寞与煎熬，甚至包括嫦娥自己，她也一直在问自己，这样的坚持还有意义吗？
A489: 487 | B489: 七仙居 | C489: =R[-1]C+1 -> 7 | D489: 七仙居 | E489: 100 | F489: =R[-1]C -> 5 | G489: 265 | H489: =R[-1]C+8 -> 3968 | I489: 最近二郎神跟巨灵神在讨论要不要灭了人间大学，重铸教育制度。理由是，上大学简直就是在浪费生命。
A490: 488 | B490: 七仙居 | C490: =R[-1]C+1 -> 8 | D490: 七仙居 | E490: 100 | F490: =R[-1]C -> 5 | G490: 265 | H490: =R[-1]C+8 -> 3976 | I490: 为了节约开支，财神最近制定了一条新规：神仙到人间出差，差旅费一律不能超过300仙币，否则不给报。
A491: 489 | B491: 七仙居 | C491: =R[-1]C+1 -> 9 | D491: 七仙居 | E491: 100 | F491: =R[-1]C -> 5 | G491: 265 | H491: =R[-1]C+8 -> 3984 | I491: 在连续通宵加班两周之后，木瓜道长终于猝死在了岗位上，这引起玉帝的高度重视，他随即颁布了新规：不准把人加班加死。
A492: 490 | B492: 七仙居 | C492: =R[-1]C+1 -> 10 | D492: 七仙居 | E492: 100 | F492: =R[-1]C -> 5 | G492: 265 | H492: =R[-1]C+8 -> 3992 | I492: 作为战斗力最高的大神，九天杀童的绝招是：玉石俱焚。所以玉帝经常跟众仙说别惹他，他的绝杀我们是惹不起的。
A493: 491 | B493: 封神山 | C493: 1 | D493: 封神山 | E493: 101 | F493: =R[-1]C -> 5 | G493: 270 | H493: =R[-1]C+8 -> 4000 | I493: 作为南天门的守护天神，哼哈二将数千年如一日，始终在忠心耿耿的看守着仙界大门。他们无愧于仙界劳模这个光荣称号。
A494: 492 | B494: 封神山 | C494: =R[-1]C+1 -> 2 | D494: 封神山 | E494: 101 | F494: =R[-1]C -> 5 | G494: 270 | H494: =R[-1]C+8 -> 4008 | I494: 近日西天菩萨全家来到天庭做客，玉帝以全羊宴进行款待。羊角大仙吃的泪流满面。
A495: 493 | B495: 封神山 | C495: =R[-1]C+1 -> 3 | D495: 封神山 | E495: 101 | F495: =R[-1]C -> 5 | G495: 270 | H495: =R[-1]C+8 -> 4016 | I495: 牛魔王最爱吃的东西，就是牛肉，尤其是爆炒牛肝。
A496: 494 | B496: 封神山 | C496: =R[-1]C+1 -> 4 | D496: 封神山 | E496: 101 | F496: =R[-1]C -> 5 | G496: 270 | H496: =R[-1]C+8 -> 4024 | I496: 在出嫁女儿猪小小的那一天，八戒哭成了泪人。他到现在才真正懂得了什么才是心痛的感觉。
A497: 495 | B497: 封神山 | C497: =R[-1]C+1 -> 5 | D497: 封神山 | E497: 101 | F497: =R[-1]C -> 5 | G497: 270 | H497: =R[-1]C+8 -> 4032 | I497: 有时候坐在花果山顶，看着身边众多的小猴儿嬉戏玩耍，不知道为什么，悟空总有一种寂寞萧索的感觉。也许他真的已经老了。
A498: 496 | B498: 封神山 | C498: =R[-1]C+1 -> 6 | D498: 封神山 | E498: 102 | F498: =R[-1]C -> 5 | G498: 270 | H498: =R[-1]C+8 -> 4040 | I498: 针对牛郎最近的出轨事件，众神仙一致的意见是，极度正常。对岸放着那么好的一个媳妇，一年才能见一次面，换谁都抓狂。
A499: 497 | B499: 封神山 | C499: =R[-1]C+1 -> 7 | D499: 封神山 | E499: 102 | F499: =R[-1]C -> 5 | G499: 270 | H499: =R[-1]C+8 -> 4048 | I499: 唐僧取经结束后，写了一本书，叫《那些天一起上过的西天》，但是这本书被一个叫西天的人告了！
A500: 498 | B500: 封神山 | C500: =R[-1]C+1 -> 8 | D500: 封神山 | E500: 102 | F500: =R[-1]C -> 5 | G500: 270 | H500: =R[-1]C+8 -> 4056 | I500: 作为最失败的房奴，海灵子近日跳海自尽。他那一套五十多平的单身公寓，迄今为止还了三万年的贷款，接下来还要还五万年。
A501: 499 | B501: 封神山 | C501: =R[-1]C+1 -> 9 | D501: 封神山 | E501: 102 | F501: =R[-1]C -> 5 | G501: 270 | H501: =R[-1]C+8 -> 4064 | I501: 看着窗外桂树下吴刚孤独的背影，嫦娥突然间产生了一丝的迷惘。两人这么多年来的苦苦坚持，到底有何意义呢？
A502: 500 | B502: 封神山 | C502: =R[-1]C+1 -> 10 | D502: 封神山 | E502: 102 | F502: =R[-1]C -> 5 | G502: 270 | H502: =R[-1]C+8 -> 4072 | I502: 神仙和人类一样，有生有死，有爱有恨，有高贵也有卑微，有欢笑也有泪水。他们和我们唯一的区别是，他们生活在天上。

Sheet: export
A1: sheet_name | B1: export_name | C1: merge_to
A2: 任务奖励表 | B2: task