Sheet: 每轮基础奖励
A1: id | B1: 等级 | C1: 仙币 | D1: 经验卡 | E1: 体力点
A2: id | B2: lv | C2: money | D2: exp_card | E2: powerValue
A3: 1 | B3: 20 | C3: 5000 | D3: 10 | E3: 10
A4: 2 | B4: =R[-1]C+5 -> 25 | C4: =R[-1]C+5000 -> 10000 | D4: =R[-1]C+1 -> 11 | E4: =R[-1]C+5 -> 15
A5: 3 | B5: =R[-1]C+5 -> 30 | C5: =R[-1]C+5000 -> 15000 | D5: =R[-1]C+1 -> 12 | E5: =R[-1]C+5 -> 20
A6: 4 | B6: =R[-1]C+5 -> 35 | C6: =R[-1]C+5000 -> 20000 | D6: =R[-1]C+1 -> 13 | E6: =R[-1]C+5 -> 25
A7: 5 | B7: =R[-1]C+5 -> 40 | C7: =R[-1]C+5000 -> 25000 | D7: =R[-1]C+1 -> 14 | E7: =R[-1]C+5 -> 30
A8: 6 | B8: =R[-1]C+5 -> 45 | C8: =R[-1]C+5000 -> 30000 | D8: =R[-1]C+1 -> 15 | E8: =R[-1]C+5 -> 35
A9: 7 | B9: =R[-1]C+5 -> 50 | C9: =R[-1]C+5000 -> 35000 | D9: =R[-1]C+1 -> 16 | E9: =R[-1]C+5 -> 40
A10: 8 | B10: =R[-1]C+5 -> 55 | C10: =R[-1]C+5000 -> 40000 | D10: =R[-1]C+1 -> 17 | E10: =R[-1]C+5 -> 45
A11: 9 | B11: =R[-1]C+5 -> 60 | C11: =R[-1]C+5000 -> 45000 | D11: =R[-1]C+1 -> 18 | E11: =R[-1]C+5 -> 50
A12: 10 | B12: =R[-1]C+5 -> 65 | C12: =R[-1]C+5000 -> 50000 | D12: =R[-1]C+1 -> 19 | E12: =R[-1]C+5 -> 55
A13: 11 | B13: =R[-1]C+5 -> 70 | C13: =R[-1]C+5000 -> 55000 | D13: =R[-1]C+1 -> 20 | E13: =R[-1]C+5 -> 60
A14: 12 | B14: =R[-1]C+5 -> 75 | C14: =R[-1]C+5000 -> 60000 | D14: =R[-1]C+1 -> 21 | E14: =R[-1]C+5 -> 65
A15: 13 | B15: =R[-1]C+5 -> 80 | C15: =R[-1]C+5000 -> 65000 | D15: =R[-1]C+1 -> 22 | E15: =R[-1]C+5 -> 70
A16: 14 | B16: =R[-1]C+5 -> 85 | C16: =R[-1]C+5000 -> 70000 | D16: =R[-1]C+1 -> 23 | E16: =R[-1]C+5 -> 75
A17: 15 | B17: =R[-1]C+5 -> 90 | C17: =R[-1]C+5000 -> 75000 | D17: =R[-1]C+1 -> 24 | E17: =R[-1]C+5 -> 80
A18: 16 | B18: =R[-1]C+5 -> 95 | C18: =R[-1]C+5000 -> 80000 | D18: =R[-1]C+1 -> 25 | E18: =R[-1]C+5 -> 85
A19: 17 | B19: =R[-1]C+5 -> 100 | C19: =R[-1]C+5000 -> 85000 | D19: =R[-1]C+1 -> 26 | E19: =R[-1]C+5 -> 90

Sheet: 每轮奖励
A1: 轮次 | B1: 奖励类型 | C1: 数量下限 | D1: 数量上限
A2: id | B2: type | C2: num_min | D2: num_max
A3: 1 | B3: fragments | C3: 1 | D3: 2
A4: 2 | B4: gold | C4: 100 | D4: 200
A5: 3 | B5: elixir | C5: 20000 | D5: 30000
A6: 4 | B6: superHonor | C6: 1 | D6: 2
A7: 5 | B7: energy | C7: 5000 | D7: 7000

Sheet: 探索获得奖励类型
A1: id | B1: 奖励类型 | C1: 说明
A2: id | B2: reward_type | C2: desc
A3: 1 | B3: card | C3: 神仙卡
A4: 2 | B4: exp_card | C4: 经验元灵
A5: 3 | B5: spirit | C5: 灵气
A6: 4 | B6: gold | C6: 魔石

Sheet: export
A1: sheet_name | B1: export_name | C1: merge_to
A2: 每轮基础奖励 | B2: turn_reward_base
A3: 每轮奖励 | B3: turn_reward
A4: 探索获得奖励类型 | B4: turn_reward_type