Sheet: 任务怪物属性表
A1: id | B1: 卡牌名称 | C1: 攻击力 | D1: 生命值 | E1: 闪避率 | F1: 暴击率
A2: id | B2: card_id | C2: atk | D2: hp | E2: dodge_rate | F2: crit_rate
A3: 10000 | B3: 灯笼怪1 | C3: 50 | D3: 113 | E3: 0 | F3: 0
A4: 10001 | B4: 龅牙兔2 | C4: 80 | D4: 130 | E4: 0 | F4: 0
A5: 10002 | B5: 乌龟精3 | C5: 90 | D5: 150 | E5: 0 | F5: 0
A6: 10003 | B6: 卖茶怪4 | C6: 95 | D6: 155 | E6: 0 | F6: 0
A7: 10004 | B7: 白骨精5 | C7: 95 | D7: 155 | E7: 0 | F7: 0
A8: 10005 | B8: 蛤蟆怪6 | C8: 95 | D8: 155 | E8: 0 | F8: 0
A9: 10006 | B9: 树精7 | C9: 100 | D9: 160 | E9: 0 | F9: 0
A10: 10007 | B10: 黑熊精8 | C10: 100 | D10: 160 | E10: 0 | F10: 0
A11: 10008 | B11: 狐狸精9 | C11: 100 | D11: 160 | E11: 0 | F11: 0
A12: 10009 | B12: 水晶魔灵10 | C12: 110 | D12: 170 | E12: 0 | F12: 0
A13: 10010 | B13: 大脸猫妖11 | C13: 110 | D13: 170 | E13: 0 | F13: 0
A14: 10011 | B14: 野猪妖12 | C14: 200 | D14: 520 | E14: 0 | F14: 0
A15: 10012 | B15: 猩猩巨魔13 | C15: =R[-1]C+35 -> 235 | D15: =R[-1]C+35 -> 555 | E15: 0 | F15: 0
A16: 10013 | B16: 猴儿精14 | C16: =R[-1]C+35 -> 270 | D16: =R[-1]C+20 -> 575 | E16: 0 | F16: 0
A17: 10014 | B17: 巨蟒怪15 | C17: =R[-1]C+35 -> 305 | D17: =R[-1]C+20 -> 595 | E17: 0 | F17: 0
A18: 10015 | B18: 地狱小鬼16 | C18: =R[-1]C+35 -> 340 | D18: =R[-1]C+20 -> 615 | E18: 0 | F18: 0
A19: 10016 | B19: 狮子怪17 | C19: =R[-1]C+35 -> 375 | D19: =R[-1]C+20 -> 635 | E19: 0 | F19: 0
A20: 10017 | B20: 蚊子怪18 | C20: =R[-1]C+35 -> 410 | D20: =R[-1]C+20 -> 655 | E20: 0 | F20: 0
A21: 10018 | B21: 火焰怪19 | C21: =R[-1]C+35 -> 445 | D21: =R[-1]C+20 -> 675 | E21: 0 | F21: 0
A22: 10019 | B22: 河童怪20 | C22: =R[-1]C+35 -> 480 | D22: =R[-1]C+20 -> 695 | E22: 0 | F22: 0
A23: 10020 | B23: 独角兽21 | C23: =R[-1]C+35 -> 515 | D23: =R[-1]C+20 -> 715 | E23: 0 | F23: 0
A24: 10021 | B24: 人鱼怪22 | C24: 600 | D24: 900 | E24: 0 | F24: 0
A25: 10022 | B25: 巨齿狼王23 | C25: 600 | D25: 1100 | E25: 0 | F25: 0
A26: 10023 | B26: 双头牛怪24 | C26: 600 | D26: 1200 | E26: 0 | F26: 0
A27: 10024 | B27: 长矛鼠怪25 | C27: 600 | D27: 1300 | E27: 0 | F27: 0
A28: 10025 | B28: 小狗怪26 | C28: 600 | D28: 1400 | E28: 0 | F28: 0
A29: 10026 | B29: 大狗怪27 | C29: 600 | D29: 1500 | E29: 0 | F29: 0
A30: 10027 | B30: 蝙蝠怪28 | C30: 600 | D30: 1500 | E30: 0 | F30: 0
A31: 10028 | B31: 蟠桃怪29 | C31: 600 | D31: 1500 | E31: 0 | F31: 0
A32: 10029 | B32: 僵尸怪30 | C32: 600 | D32: 1500 | E32: 0 | F32: 0
A33: 10030 | B33: 宫灯怪31 | C33: 600 | D33: 1500 | E33: 0 | F33: 0
A34: 10031 | B34: 挂科怪32 | C34: 700 | D34: 1800 | E34: 0 | F34: 0
A35: 10032 | B35: 自习怪33 | C35: =R[-1]C+20 -> 720 | D35: =R[-1]C+40 -> 1840 | E35: 0 | F35: 0
A36: 10033 | B36: 灯笼怪34 | C36: =R[-1]C+20 -> 740 | D36: =R[-1]C+40 -> 1880 | E36: 0 | F36: 0
A37: 10034 | B37: 龅牙兔35 | C37: =R[-1]C+20 -> 760 | D37: =R[-1]C+40 -> 1920 | E37: 0 | F37: 0
A38: 10035 | B38: 乌龟精36 | C38: =R[-1]C+20 -> 780 | D38: =R[-1]C+40 -> 1960 | E38: 0 | F38: 0
A39: 10036 | B39: 卖茶怪37 | C39: =R[-1]C+20 -> 800 | D39: =R[-1]C+40 -> 2000 | E39: 0 | F39: 0
A40: 10037 | B40: 白骨精38 | C40: =R[-1]C+20 -> 820 | D40: =R[-1]C+40 -> 2040 | E40: 0 | F40: 0
A41: 10038 | B41: 蛤蟆怪39 | C41: =R[-1]C+20 -> 840 | D41: =R[-1]C+40 -> 2080 | E41: 0 | F41: 0
A42: 10039 | B42: 树精40 | C42: =R[-1]C+20 -> 860 | D42: =R[-1]C+40 -> 2120 | E42: 0 | F42: 0
A43: 10040 | B43: 黑熊精41 | C43: =R[-1]C+30 -> 890 | D43: =R[-1]C+50 -> 2170 | E43: 5 | F43: 5
A44: 10041 | B44: 狐狸精42 | C44: =R[-1]C+30 -> 920 | D44: =R[-1]C+50 -> 2220 | E44: 5 | F44: 5
A45: 10042 | B45: 水晶魔灵43 | C45: =R[-1]C+30 -> 950 | D45: =R[-1]C+50 -> 2270 | E45: 5 | F45: 5
A46: 10043 | B46: 大脸猫妖44 | C46: =R[-1]C+30 -> 980 | D46: =R[-1]C+40 -> 2310 | E46: 5 | F46: 5
A47: 10044 | B47: 野猪妖45 | C47: =R[-1]C+30 -> 1010 | D47: =R[-1]C+50 -> 2360 | E47: 5 | F47: 5
A48: 10045 | B48: 猩猩巨魔46 | C48: =R[-1]C+30 -> 1040 | D48: =R[-1]C+50 -> 2410 | E48: 5 | F48: 5
A49: 10046 | B49: 猴儿精47 | C49: =R[-1]C+30 -> 1070 | D49: =R[-1]C+50 -> 2460 | E49: 5 | F49: 5
A50: 10047 | B50: 巨蟒怪48 | C50: =R[-1]C+30 -> 1100 | D50: =R[-1]C+50 -> 2510 | E50: 5 | F50: 5
A51: 10048 | B51: 地狱小鬼49 | C51: =R[-1]C+30 -> 1130 | D51: =R[-1]C+50 -> 2560 | E51: 5 | F51: 5
A52: 10049 | B52: 狮子怪50 | C52: =R[-1]C+30 -> 1160 | D52: =R[-1]C+50 -> 2610 | E52: 5 | F52: 5
A53: 10050 | B53: 蚊子怪51 | C53: =R[-1]C+30 -> 1190 | D53: =R[-1]C+50 -> 2660 | E53: 5 | F53: 5
A54: 10051 | B54: 火焰怪52 | C54: =R[-1]C+30 -> 1220 | D54: =R[-1]C+50 -> 2710 | E54: 5 | F54: 5
A55: 10052 | B55: 河童怪53 | C55: =R[-1]C+30 -> 1250 | D55: =R[-1]C+50 -> 2760 | E55: 5 | F55: 5
A56: 10053 | B56: 独角兽54 | C56: =R[-1]C+30 -> 1280 | D56: =R[-1]C+50 -> 2810 | E56: 5 | F56: 5
A57: 10054 | B57: 人鱼怪55 | C57: =R[-1]C+30 -> 1310 | D57: =R[-1]C+50 -> 2860 | E57: 5 | F57: 5
A58: 10055 | B58: 巨齿狼王56 | C58: =R[-1]C+30 -> 1340 | D58: =R[-1]C+50 -> 2910 | E58: 5 | F58: 5
A59: 10056 | B59: 双头牛怪57 | C59: =R[-1]C+30 -> 1370 | D59: =R[-1]C+50 -> 2960 | E59: 5 | F59: 5
A60: 10057 | B60: 长矛鼠怪58 | C60: =R[-1]C+30 -> 1400 | D60: =R[-1]C+50 -> 3010 | E60: 5 | F60: 5
A61: 10058 | B61: 小狗怪59 | C61: =R[-1]C+30 -> 1430 | D61: =R[-1]C+50 -> 3060 | E61: 5 | F61: 5
A62: 10059 | B62: 大狗怪60 | C62: =R[-1]C+30 -> 1460 | D62: =R[-1]C+50 -> 3110 | E62: 5 | F62: 5
A63: 10060 | B63: 蝙蝠怪61 | C63: =R[-1]C+30 -> 1490 | D63: =R[-1]C+50 -> 3160 | E63: 5 | F63: 5
A64: 10061 | B64: 蟠桃怪62 | C64: =R[-1]C+30 -> 1520 | D64: =R[-1]C+50 -> 3210 | E64: 5 | F64: 5
A65: 10062 | B65: 僵尸怪63 | C65: =R[-1]C+30 -> 1550 | D65: =R[-1]C+50 -> 3260 | E65: 5 | F65: 5
A66: 10063 | B66: 宫灯怪64 | C66: =R[-1]C+30 -> 1580 | D66: =R[-1]C+50 -> 3310 | E66: 5 | F66: 5
A67: 10064 | B67: 挂科怪65 | C67: =R[-1]C+30 -> 1610 | D67: =R[-1]C+50 -> 3360 | E67: 5 | F67: 5
A68: 10065 | B68: 自习怪66 | C68: =R[-1]C+30 -> 1640 | D68: =R[-1]C+50 -> 3410 | E68: 5 | F68: 5
A69: 10066 | B69: 灯笼怪67 | C69: =R[-1]C+30 -> 1670 | D69: =R[-1]C+50 -> 3460 | E69: 5 | F69: 5
A70: 10067 | B70: 龅牙兔68 | C70: =R[-1]C+30 -> 1700 | D70: =R[-1]C+50 -> 3510 | E70: 5 | F70: 5
A71: 10068 | B71: 乌龟精69 | C71: =R[-1]C+30 -> 1730 | D71: =R[-1]C+50 -> 3560 | E71: 5 | F71: 5
A72: 10069 | B72: 卖茶怪70 | C72: =R[-1]C+30 -> 1760 | D72: =R[-1]C+50 -> 3610 | E72: 5 | F72: 5
A73: 10070 | B73: 白骨精71 | C73: =R[-1]C+30 -> 1790 | D73: =R[-1]C+50 -> 3660 | E73: 5 | F73: 5
A74: 10071 | B74: 蛤蟆怪72 | C74: =R[-1]C+30 -> 1820 | D74: =R[-1]C+50 -> 3710 | E74: 5 | F74: 5
A75: 10072 | B75: 树精73 | C75: =R[-1]C+30 -> 1850 | D75: =R[-1]C+50 -> 3760 | E75: 5 | F75: 5
A76: 10073 | B76: 黑熊精74 | C76: =R[-1]C+30 -> 1880 | D76: =R[-1]C+50 -> 3810 | E76: 5 | F76: 5
A77: 10074 | B77: 狐狸精75 | C77: =R[-1]C+30 -> 1910 | D77: =R[-1]C+50 -> 3860 | E77: 5 | F77: 5
A78: 10075 | B78: 水晶魔灵76 | C78: =R[-1]C+30 -> 1940 | D78: =R[-1]C+50 -> 3910 | E78: 5 | F78: 5
A79: 10076 | B79: 大脸猫妖77 | C79: =R[-1]C+30 -> 1970 | D79: =R[-1]C+50 -> 3960 | E79: 5 | F79: 5
A80: 10077 | B80: 野猪妖78 | C80: =R[-1]C+30 -> 2000 | D80: =R[-1]C+50 -> 4010 | E80: 5 | F80: 5
A81: 10078 | B81: 猩猩巨魔79 | C81: =R[-1]C+30 -> 2030 | D81: =R[-1]C+50 -> 4060 | E81: 5 | F81: 5
A82: 10079 | B82: 猴儿精80 | C82: =R[-1]C+30 -> 2060 | D82: =R[-1]C+50 -> 4110 | E82: 5 | F82: 5
A83: 10080 | B83: 巨蟒怪81 | C83: =R[-1]C+30 -> 2090 | D83: =R[-1]C+50 -> 4160 | E83: 5 | F83: 5
A84: 10081 | B84: 地狱小鬼82 | C84: =R[-1]C+30 -> 2120 | D84: =R[-1]C+50 -> 4210 | E84: 5 | F84: 5
A85: 10082 | B85: 狮子怪83 | C85: =R[-1]C+30 -> 2150 | D85: =R[-1]C+50 -> 4260 | E85: 5 | F85: 5
A86: 10083 | B86: 蚊子怪84 | C86: =R[-1]C+30 -> 2180 | D86: =R[-1]C+50 -> 4310 | E86: 5 | F86: 5
A87: 10084 | B87: 火焰怪85 | C87: =R[-1]C+30 -> 2210 | D87: =R[-1]C+50 -> 4360 | E87: 5 | F87: 5
A88: 10085 | B88: 河童怪86 | C88: =R[-1]C+30 -> 2240 | D88: =R[-1]C+50 -> 4410 | E88: 5 | F88: 5
A89: 10086 | B89: 独角兽87 | C89: =R[-1]C+30 -> 2270 | D89: =R[-1]C+50 -> 4460 | E89: 5 | F89: 5
A90: 10087 | B90: 人鱼怪88 | C90: =R[-1]C+30 -> 2300 | D90: =R[-1]C+50 -> 4510 | E90: 5 | F90: 5
A91: 10088 | B91: 巨齿狼王89 | C91: =R[-1]C+30 -> 2330 | D91: =R[-1]C+50 -> 4560 | E91: 5 | F91: 5
A92: 10089 | B92: 双头牛怪90 | C92: =R[-1]C+30 -> 2360 | D92: =R[-1]C+50 -> 4610 | E92: 5 | F92: 5
A93: 10090 | B93: 长矛鼠怪91 | C93: =R[-1]C+30 -> 2390 | D93: =R[-1]C+50 -> 4660 | E93: 5 | F93: 5
A94: 10091 | B94: 小狗怪92 | C94: =R[-1]C+30 -> 2420 | D94: =R[-1]C+50 -> 4710 | E94: 5 | F94: 5
A95: 10092 | B95: 大狗怪93 | C95: =R[-1]C+30 -> 2450 | D95: =R[-1]C+50 -> 4760 | E95: 5 | F95: 5
A96: 10093 | B96: 蝙蝠怪94 | C96: =R[-1]C+30 -> 2480 | D96: =R[-1]C+50 -> 4810 | E96: 5 | F96: 5
A97: 10094 | B97: 蟠桃怪95 | C97: =R[-1]C+30 -> 2510 | D97: =R[-1]C+50 -> 4860 | E97: 5 | F97: 5
A98: 10095 | B98: 僵尸怪96 | C98: =R[-1]C+30 -> 2540 | D98: =R[-1]C+50 -> 4910 | E98: 5 | F98: 5
A99: 10096 | B99: 宫灯怪97 | C99: =R[-1]C+30 -> 2570 | D99: =R[-1]C+50 -> 4960 | E99: 5 | F99: 5
A100: 10097 | B100: 挂科怪98 | C100: =R[-1]C+30 -> 2600 | D100: =R[-1]C+50 -> 5010 | E100: 5 | F100: 5
A101: 10098 | B101: 自习怪99 | C101: =R[-1]C+30 -> 2630 | D101: =R[-1]C+50 -> 5060 | E101: 5 | F101: 5
A102: 10099 | B102: 灯笼怪100 | C102: =R[-1]C+30 -> 2660 | D102: =R[-1]C+50 -> 5110 | E102: 5 | F102: 5
A103: 10100 | B103: 龅牙兔101 | C103: =R[-1]C+30 -> 2690 | D103: =R[-1]C+50 -> 5160 | E103: 5 | F103: 5
A104: 10101 | B104: 乌龟精102 | C104: =R[-1]C+30 -> 2720 | D104: =R[-1]C+50 -> 5210 | E104: 5 | F104: 5
A105: 10102 | B105: 卖茶怪103 | C105: =R[-1]C+30 -> 2750 | D105: =R[-1]C+50 -> 5260 | E105: 5 | F105: 5
A106: 10103 | B106: 白骨精104 | C106: =R[-1]C+30 -> 2780 | D106: =R[-1]C+50 -> 5310 | E106: 5 | F106: 5
A107: 10104 | B107: 蛤蟆怪105 | C107: =R[-1]C+30 -> 2810 | D107: =R[-1]C+50 -> 5360 | E107: 5 | F107: 5
A108: 10105 | B108: 树精106 | C108: =R[-1]C+30 -> 2840 | D108: =R[-1]C+50 -> 5410 | E108: 5 | F108: 5
A109: 10106 | B109: 黑熊精107 | C109: =R[-1]C+30 -> 2870 | D109: =R[-1]C+50 -> 5460 | E109: 5 | F109: 5
A110: 10107 | B110: 狐狸精108 | C110: =R[-1]C+30 -> 2900 | D110: =R[-1]C+50 -> 5510 | E110: 5 | F110: 5
A111: 10108 | B111: 水晶魔灵109 | C111: =R[-1]C+30 -> 2930 | D111: =R[-1]C+50 -> 5560 | E111: 5 | F111: 5
A112: 10109 | B112: 大脸猫妖110 | C112: =R[-1]C+30 -> 2960 | D112: =R[-1]C+50 -> 5610 | E112: 5 | F112: 5
A113: 10110 | B113: 野猪妖111 | C113: =R[-1]C+30 -> 2990 | D113: =R[-1]C+50 -> 5660 | E113: 5 | F113: 5
A114: 10111 | B114: 猩猩巨魔112 | C114: =R[-1]C+30 -> 3020 | D114: =R[-1]C+50 -> 5710 | E114: 5 | F114: 5
A115: 10112 | B115: 猴儿精113 | C115: =R[-1]C+30 -> 3050 | D115: =R[-1]C+50 -> 5760 | E115: 5 | F115: 5
A116: 10113 | B116: 巨蟒怪114 | C116: =R[-1]C+30 -> 3080 | D116: =R[-1]C+50 -> 5810 | E116: 5 | F116: 5
A117: 10114 | B117: 地狱小鬼115 | C117: =R[-1]C+30 -> 3110 | D117: =R[-1]C+50 -> 5860 | E117: 5 | F117: 5
A118: 10115 | B118: 狮子怪116 | C118: =R[-1]C+30 -> 3140 | D118: =R[-1]C+50 -> 5910 | E118: 5 | F118: 5
A119: 10116 | B119: 蚊子怪117 | C119: =R[-1]C+30 -> 3170 | D119: =R[-1]C+50 -> 5960 | E119: 5 | F119: 5
A120: 10117 | B120: 火焰怪118 | C120: =R[-1]C+30 -> 3200 | D120: =R[-1]C+50 -> 6010 | E120: 5 | F120: 5
A121: 10118 | B121: 河童怪119 | C121: =R[-1]C+30 -> 3230 | D121: =R[-1]C+50 -> 6060 | E121: 5 | F121: 5
A122: 10119 | B122: 独角兽120 | C122: =R[-1]C+30 -> 3260 | D122: =R[-1]C+50 -> 6110 | E122: 5 | F122: 5
A123: 10120 | B123: 人鱼怪121 | C123: =R[-1]C+30 -> 3290 | D123: =R[-1]C+50 -> 6160 | E123: 5 | F123: 5
A124: 10121 | B124: 巨齿狼王122 | C124: =R[-1]C+30 -> 3320 | D124: =R[-1]C+50 -> 6210 | E124: 5 | F124: 5
A125: 10122 | B125: 双头牛怪123 | C125: =R[-1]C+30 -> 3350 | D125: =R[-1]C+50 -> 6260 | E125: 5 | F125: 5
A126: 10123 | B126: 长矛鼠怪124 | C126: =R[-1]C+30 -> 3380 | D126: =R[-1]C+50 -> 6310 | E126: 5 | F126: 5
A127: 10124 | B127: 小狗怪125 | C127: =R[-1]C+30 -> 3410 | D127: =R[-1]C+50 -> 6360 | E127: 5 | F127: 5
A128: 10125 | B128: 大狗怪126 | C128: =R[-1]C+30 -> 3440 | D128: =R[-1]C+50 -> 6410 | E128: 5 | F128: 5
A129: 10126 | B129: 蝙蝠怪127 | C129: =R[-1]C+30 -> 3470 | D129: =R[-1]C+50 -> 6460 | E129: 5 | F129: 5
A130: 10127 | B130: 蟠桃怪128 | C130: =R[-1]C+30 -> 3500 | D130: =R[-1]C+50 -> 6510 | E130: 5 | F130: 5
A131: 10128 | B131: 僵尸怪129 | C131: =R[-1]C+30 -> 3530 | D131: =R[-1]C+50 -> 6560 | E131: 5 | F131: 5
A132: 10129 | B132: 宫灯怪130 | C132: =R[-1]C+30 -> 3560 | D132: =R[-1]C+50 -> 6610 | E132: 5 | F132: 5
A133: 10130 | B133: 挂科怪131 | C133: =R[-1]C+30 -> 3590 | D133: =R[-1]C+50 -> 6660 | E133: 5 | F133: 5
A134: 10131 | B134: 自习怪132 | C134: =R[-1]C+30 -> 3620 | D134: =R[-1]C+50 -> 6710 | E134: 5 | F134: 5
A135: 10132 | B135: 灯笼怪133 | C135: =R[-1]C+30 -> 3650 | D135: =R[-1]C+50 -> 6760 | E135: 5 | F135: 5
A136: 10133 | B136: 龅牙兔134 | C136: =R[-1]C+30 -> 3680 | D136: =R[-1]C+50 -> 6810 | E136: 5 | F136: 5
A137: 10134 | B137: 乌龟精135 | C137: =R[-1]C+30 -> 3710 | D137: =R[-1]C+50 -> 6860 | E137: 5 | F137: 5
A138: 10135 | B138: 卖茶怪136 | C138: =R[-1]C+30 -> 3740 | D138: =R[-1]C+50 -> 6910 | E138: 5 | F138: 5
A139: 10136 | B139: 白骨精137 | C139: =R[-1]C+30 -> 3770 | D139: =R[-1]C+50 -> 6960 | E139: 5 | F139: 5
A140: 10137 | B140: 蛤蟆怪138 | C140: =R[-1]C+30 -> 3800 | D140: =R[-1]C+50 -> 7010 | E140: 5 | F140: 5
A141: 10138 | B141: 树精139 | C141: =R[-1]C+30 -> 3830 | D141: =R[-1]C+50 -> 7060 | E141: 5 | F141: 5
A142: 10139 | B142: 黑熊精140 | C142: =R[-1]C+30 -> 3860 | D142: =R[-1]C+50 -> 7110 | E142: 5 | F142: 5
A143: 10140 | B143: 狐狸精141 | C143: =R[-1]C+30 -> 3890 | D143: =R[-1]C+50 -> 7160 | E143: 5 | F143: 5
A144: 10141 | B144: 水晶魔灵142 | C144: =R[-1]C+30 -> 3920 | D144: =R[-1]C+50 -> 7210 | E144: 5 | F144: 5
A145: 10142 | B145: 大脸猫妖143 | C145: =R[-1]C+30 -> 3950 | D145: =R[-1]C+50 -> 7260 | E145: 5 | F145: 5
A146: 10143 | B146: 野猪妖144 | C146: =R[-1]C+30 -> 3980 | D146: =R[-1]C+50 -> 7310 | E146: 5 | F146: 5
A147: 10144 | B147: 猩猩巨魔145 | C147: =R[-1]C+30 -> 4010 | D147: =R[-1]C+50 -> 7360 | E147: 5 | F147: 5
A148: 10145 | B148: 猴儿精146 | C148: =R[-1]C+30 -> 4040 | D148: =R[-1]C+50 -> 7410 | E148: 5 | F148: 5
A149: 10146 | B149: 巨蟒怪147 | C149: =R[-1]C+30 -> 4070 | D149: =R[-1]C+50 -> 7460 | E149: 5 | F149: 5
A150: 10147 | B150: 地狱小鬼148 | C150: =R[-1]C+30 -> 4100 | D150: =R[-1]C+50 -> 7510 | E150: 5 | F150: 5
A151: 10148 | B151: 狮子怪149 | C151: =R[-1]C+30 -> 4130 | D151: =R[-1]C+50 -> 7560 | E151: 5 | F151: 5
A152: 10149 | B152: 蚊子怪150 | C152: =R[-1]C+30 -> 4160 | D152: =R[-1]C+50 -> 7610 | E152: 5 | F152: 5
A153: 10150 | B153: 火焰怪151 | C153: =R[-1]C+30 -> 4190 | D153: =R[-1]C+50 -> 7660 | E153: 5 | F153: 5
A154: 10151 | B154: 河童怪152 | C154: =R[-1]C+30 -> 4220 | D154: =R[-1]C+50 -> 7710 | E154: 5 | F154: 5
A155: 10152 | B155: 独角兽153 | C155: =R[-1]C+30 -> 4250 | D155: =R[-1]C+50 -> 7760 | E155: 5 | F155: 5
A156: 10153 | B156: 人鱼怪154 | C156: =R[-1]C+30 -> 4280 | D156: =R[-1]C+50 -> 7810 | E156: 5 | F156: 5
A157: 10154 | B157: 巨齿狼王155 | C157: =R[-1]C+30 -> 4310 | D157: =R[-1]C+50 -> 7860 | E157: 5 | F157: 5
A158: 10155 | B158: 双头牛怪156 | C158: =R[-1]C+30 -> 4340 | D158: =R[-1]C+50 -> 7910 | E158: 5 | F158: 5
A159: 10156 | B159: 长矛鼠怪157 | C159: =R[-1]C+30 -> 4370 | D159: =R[-1]C+50 -> 7960 | E159: 5 | F159: 5
A160: 10157 | B160: 小狗怪158 | C160: =R[-1]C+30 -> 4400 | D160: =R[-1]C+50 -> 8010 | E160: 5 | F160: 5
A161: 10158 | B161: 大狗怪159 | C161: =R[-1]C+30 -> 4430 | D161: =R[-1]C+50 -> 8060 | E161: 5 | F161: 5
A162: 10159 | B162: 蝙蝠怪160 | C162: =R[-1]C+30 -> 4460 | D162: =R[-1]C+50 -> 8110 | E162: 5 | F162: 5
A163: 10160 | B163: 蟠桃怪161 | C163: =R[-1]C+30 -> 4490 | D163: =R[-1]C+50 -> 8160 | E163: 5 | F163: 5
A164: 10161 | B164: 僵尸怪162 | C164: =R[-1]C+30 -> 4520 | D164: =R[-1]C+50 -> 8210 | E164: 5 | F164: 5
A165: 10162 | B165: 宫灯怪163 | C165: =R[-1]C+30 -> 4550 | D165: =R[-1]C+50 -> 8260 | E165: 5 | F165: 5
A166: 10163 | B166: 挂科怪164 | C166: =R[-1]C+30 -> 4580 | D166: =R[-1]C+50 -> 8310 | E166: 5 | F166: 5
A167: 10164 | B167: 自习怪165 | C167: =R[-1]C+30 -> 4610 | D167: =R[-1]C+50 -> 8360 | E167: 5 | F167: 5
A168: 10165 | B168: 灯笼怪166 | C168: =R[-1]C+30 -> 4640 | D168: =R[-1]C+50 -> 8410 | E168: 5 | F168: 5
A169: 10166 | B169: 龅牙兔167 | C169: =R[-1]C+30 -> 4670 | D169: =R[-1]C+50 -> 8460 | E169: 5 | F169: 5
A170: 10167 | B170: 乌龟精168 | C170: =R[-1]C+30 -> 4700 | D170: =R[-1]C+50 -> 8510 | E170: 5 | F170: 5
A171: 10168 | B171: 卖茶怪169 | C171: =R[-1]C+30 -> 4730 | D171: =R[-1]C+50 -> 8560 | E171: 5 | F171: 5
A172: 10169 | B172: 白骨精170 | C172: =R[-1]C+30 -> 4760 | D172: =R[-1]C+50 -> 8610 | E172: 5 | F172: 5
A173: 10170 | B173: 蛤蟆怪171 | C173: =R[-1]C+30 -> 4790 | D173: =R[-1]C+50 -> 8660 | E173: 5 | F173: 5
A174: 10171 | B174: 树精172 | C174: =R[-1]C+30 -> 4820 | D174: =R[-1]C+50 -> 8710 | E174: 5 | F174: 5
A175: 10172 | B175: 黑熊精173 | C175: =R[-1]C+30 -> 4850 | D175: =R[-1]C+50 -> 8760 | E175: 5 | F175: 5
A176: 10173 | B176: 狐狸精174 | C176: =R[-1]C+30 -> 4880 | D176: =R[-1]C+50 -> 8810 | E176: 5 | F176: 5
A177: 10174 | B177: 水晶魔灵175 | C177: =R[-1]C+30 -> 4910 | D177: =R[-1]C+50 -> 8860 | E177: 5 | F177: 5
A178: 10175 | B178: 大脸猫妖176 | C178: =R[-1]C+30 -> 4940 | D178: =R[-1]C+50 -> 8910 | E178: 5 | F178: 5
A179: 10176 | B179: 野猪妖177 | C179: =R[-1]C+30 -> 4970 | D179: =R[-1]C+50 -> 8960 | E179: 5 | F179: 5
A180: 10177 | B180: 猩猩巨魔178 | C180: =R[-1]C+30 -> 5000 | D180: =R[-1]C+50 -> 9010 | E180: 5 | F180: 5
A181: 10178 | B181: 猴儿精179 | C181: =R[-1]C+30 -> 5030 | D181: =R[-1]C+50 -> 9060 | E181: 5 | F181: 5
A182: 10179 | B182: 巨蟒怪180 | C182: =R[-1]C+30 -> 5060 | D182: =R[-1]C+50 -> 9110 | E182: 5 | F182: 5
A183: 10180 | B183: 地狱小鬼181 | C183: =R[-1]C+30 -> 5090 | D183: =R[-1]C+50 -> 9160 | E183: 5 | F183: 5
A184: 10181 | B184: 狮子怪182 | C184: =R[-1]C+30 -> 5120 | D184: =R[-1]C+50 -> 9210 | E184: 5 | F184: 5
A185: 10182 | B185: 蚊子怪183 | C185: =R[-1]C+30 -> 5150 | D185: =R[-1]C+50 -> 9260 | E185: 5 | F185: 5
A186: 10183 | B186: 火焰怪184 | C186: =R[-1]C+30 -> 5180 | D186: =R[-1]C+50 -> 9310 | E186: 5 | F186: 5
A187: 10184 | B187: 河童怪185 | C187: =R[-1]C+30 -> 5210 | D187: =R[-1]C+50 -> 9360 | E187: 5 | F187: 5
A188: 10185 | B188: 独角兽186 | C188: =R[-1]C+30 -> 5240 | D188: =R[-1]C+50 -> 9410 | E188: 5 | F188: 5
A189: 10186 | B189: 人鱼怪187 | C189: =R[-1]C+30 -> 5270 | D189: =R[-1]C+50 -> 9460 | E189: 5 | F189: 5
A190: 10187 | B190: 巨齿狼王188 | C190: =R[-1]C+30 -> 5300 | D190: =R[-1]C+50 -> 9510 | E190: 5 | F190: 5
A191: 10188 | B191: 双头牛怪189 | C191: =R[-1]C+30 -> 5330 | D191: =R[-1]C+50 -> 9560 | E191: 5 | F191: 5
A192: 10189 | B192: 长矛鼠怪190 | C192: =R[-1]C+30 -> 5360 | D192: =R[-1]C+50 -> 9610 | E192: 5 | F192: 5
A193: 10190 | B193: 小狗怪191 | C193: =R[-1]C+30 -> 5390 | D193: =R[-1]C+50 -> 9660 | E193: 5 | F193: 5
A194: 10191 | B194: 大狗怪192 | C194: =R[-1]C+30 -> 5420 | D194: =R[-1]C+50 -> 9710 | E194: 5 | F194: 5
A195: 10192 | B195: 蝙蝠怪193 | C195: =R[-1]C+30 -> 5450 | D195: =R[-1]C+50 -> 9760 | E195: 5 | F195: 5
A196: 10193 | B196: 蟠桃怪194 | C196: =R[-1]C+30 -> 5480 | D196: =R[-1]C+50 -> 9810 | E196: 5 | F196: 5
A197: 10194 | B197: 僵尸怪195 | C197: =R[-1]C+30 -> 5510 | D197: =R[-1]C+50 -> 9860 | E197: 5 | F197: 5
A198: 10195 | B198: 宫灯怪196 | C198: =R[-1]C+30 -> 5540 | D198: =R[-1]C+50 -> 9910 | E198: 5 | F198: 5
A199: 10196 | B199: 挂科怪197 | C199: =R[-1]C+30 -> 5570 | D199: =R[-1]C+50 -> 9960 | E199: 5 | F199: 5
A200: 10197 | B200: 自习怪198 | C200: =R[-1]C+30 -> 5600 | D200: =R[-1]C+50 -> 10010 | E200: 5 | F200: 5
A201: 10198 | B201: 灯笼怪199 | C201: =R[-1]C+30 -> 5630 | D201: =R[-1]C+50 -> 10060 | E201: 5 | F201: 5
A202: 10199 | B202: 龅牙兔200 | C202: =R[-1]C+30 -> 5660 | D202: =R[-1]C+50 -> 10110 | E202: 5 | F202: 5
A203: 10200 | B203: 乌龟精201 | C203: =R[-1]C+30 -> 5690 | D203: =R[-1]C+50 -> 10160 | E203: 5 | F203: 5
A204: 10201 | B204: 卖茶怪202 | C204: =R[-1]C+30 -> 5720 | D204: =R[-1]C+50 -> 10210 | E204: 5 | F204: 5
A205: 10202 | B205: 白骨精203 | C205: =R[-1]C+30 -> 5750 | D205: =R[-1]C+50 -> 10260 | E205: 5 | F205: 5
A206: 10203 | B206: 蛤蟆怪204 | C206: =R[-1]C+30 -> 5780 | D206: =R[-1]C+50 -> 10310 | E206: 5 | F206: 5
A207: 10204 | B207: 树精205 | C207: =R[-1]C+30 -> 5810 | D207: =R[-1]C+50 -> 10360 | E207: 5 | F207: 5
A208: 10205 | B208: 黑熊精206 | C208: =R[-1]C+30 -> 5840 | D208: =R[-1]C+50 -> 10410 | E208: 5 | F208: 5
A209: 10206 | B209: 狐狸精207 | C209: =R[-1]C+30 -> 5870 | D209: =R[-1]C+50 -> 10460 | E209: 5 | F209: 5
A210: 10207 | B210: 水晶魔灵208 | C210: =R[-1]C+30 -> 5900 | D210: =R[-1]C+50 -> 10510 | E210: 5 | F210: 5
A211: 10208 | B211: 大脸猫妖209 | C211: =R[-1]C+30 -> 5930 | D211: =R[-1]C+50 -> 10560 | E211: 5 | F211: 5
A212: 10209 | B212: 野猪妖210 | C212: =R[-1]C+30 -> 5960 | D212: =R[-1]C+50 -> 10610 | E212: 5 | F212: 5
A213: 10210 | B213: 猩猩巨魔211 | C213: =R[-1]C+30 -> 5990 | D213: =R[-1]C+50 -> 10660 | E213: 5 | F213: 5
A214: 10211 | B214: 猴儿精212 | C214: =R[-1]C+30 -> 6020 | D214: =R[-1]C+50 -> 10710 | E214: 5 | F214: 5
A215: 10212 | B215: 巨蟒怪213 | C215: =R[-1]C+30 -> 6050 | D215: =R[-1]C+50 -> 10760 | E215: 5 | F215: 5
A216: 10213 | B216: 地狱小鬼214 | C216: =R[-1]C+30 -> 6080 | D216: =R[-1]C+50 -> 10810 | E216: 5 | F216: 5
A217: 10214 | B217: 狮子怪215 | C217: =R[-1]C+30 -> 6110 | D217: =R[-1]C+50 -> 10860 | E217: 5 | F217: 5
A218: 10215 | B218: 蚊子怪216 | C218: =R[-1]C+30 -> 6140 | D218: =R[-1]C+50 -> 10910 | E218: 5 | F218: 5
A219: 10216 | B219: 火焰怪217 | C219: =R[-1]C+30 -> 6170 | D219: =R[-1]C+50 -> 10960 | E219: 5 | F219: 5
A220: 10217 | B220: 河童怪218 | C220: =R[-1]C+30 -> 6200 | D220: =R[-1]C+50 -> 11010 | E220: 5 | F220: 5
A221: 10218 | B221: 独角兽219 | C221: =R[-1]C+30 -> 6230 | D221: =R[-1]C+50 -> 11060 | E221: 5 | F221: 5
A222: 10219 | B222: 人鱼怪220 | C222: =R[-1]C+30 -> 6260 | D222: =R[-1]C+50 -> 11110 | E222: 5 | F222: 5
A223: 10220 | B223: 巨齿狼王221 | C223: =R[-1]C+30 -> 6290 | D223: =R[-1]C+50 -> 11160 | E223: 5 | F223: 5
A224: 10221 | B224: 双头牛怪222 | C224: =R[-1]C+30 -> 6320 | D224: =R[-1]C+50 -> 11210 | E224: 5 | F224: 5
A225: 10222 | B225: 长矛鼠怪223 | C225: =R[-1]C+30 -> 6350 | D225: =R[-1]C+50 -> 11260 | E225: 5 | F225: 5
A226: 10223 | B226: 小狗怪224 | C226: =R[-1]C+30 -> 6380 | D226: =R[-1]C+50 -> 11310 | E226: 5 | F226: 5
A227: 10224 | B227: 大狗怪225 | C227: =R[-1]C+30 -> 6410 | D227: =R[-1]C+50 -> 11360 | E227: 5 | F227: 5
A228: 10225 | B228: 蝙蝠怪226 | C228: =R[-1]C+30 -> 6440 | D228: =R[-1]C+50 -> 11410 | E228: 5 | F228: 5
A229: 10226 | B229: 蟠桃怪227 | C229: =R[-1]C+30 -> 6470 | D229: =R[-1]C+50 -> 11460 | E229: 5 | F229: 5
A230: 10227 | B230: 僵尸怪228 | C230: =R[-1]C+30 -> 6500 | D230: =R[-1]C+50 -> 11510 | E230: 5 | F230: 5
A231: 10228 | B231: 宫灯怪229 | C231: =R[-1]C+30 -> 6530 | D231: =R[-1]C+50 -> 11560 | E231: 5 | F231: 5
A232: 10229 | B232: 挂科怪230 | C232: =R[-1]C+30 -> 6560 | D232: =R[-1]C+50 -> 11610 | E232: 5 | F232: 5
A233: 10230 | B233: 自习怪231 | C233: =R[-1]C+30 -> 6590 | D233: =R[-1]C+50 -> 11660 | E233: 5 | F233: 5
A234: 10231 | B234: 灯笼怪232 | C234: =R[-1]C+30 -> 6620 | D234: =R[-1]C+50 -> 11710 | E234: 5 | F234: 5
A235: 10232 | B235: 龅牙兔233 | C235: =R[-1]C+30 -> 6650 | D235: =R[-1]C+50 -> 11760 | E235: 5 | F235: 5
A236: 10233 | B236: 乌龟精234 | C236: =R[-1]C+30 -> 6680 | D236: =R[-1]C+50 -> 11810 | E236: 5 | F236: 5
A237: 10234 | B237: 卖茶怪235 | C237: =R[-1]C+30 -> 6710 | D237: =R[-1]C+50 -> 11860 | E237: 5 | F237: 5
A238: 10235 | B238: 白骨精236 | C238: =R[-1]C+30 -> 6740 | D238: =R[-1]C+50 -> 11910 | E238: 5 | F238: 5
A239: 10236 | B239: 蛤蟆怪237 | C239: =R[-1]C+30 -> 6770 | D239: =R[-1]C+50 -> 11960 | E239: 5 | F239: 5
A240: 10237 | B240: 树精238 | C240: =R[-1]C+30 -> 6800 | D240: =R[-1]C+50 -> 12010 | E240: 5 | F240: 5
A241: 10238 | B241: 黑熊精239 | C241: =R[-1]C+30 -> 6830 | D241: =R[-1]C+50 -> 12060 | E241: 5 | F241: 5
A242: 10239 | B242: 狐狸精240 | C242: =R[-1]C+30 -> 6860 | D242: =R[-1]C+50 -> 12110 | E242: 5 | F242: 5
A243: 10240 | B243: 水晶魔灵241 | C243: =R[-1]C+30 -> 6890 | D243: =R[-1]C+50 -> 12160 | E243: 5 | F243: 5
A244: 10241 | B244: 大脸猫妖242 | C244: =R[-1]C+30 -> 6920 | D244: =R[-1]C+50 -> 12210 | E244: 5 | F244: 5
A245: 10242 | B245: 野猪妖243 | C245: =R[-1]C+30 -> 6950 | D245: =R[-1]C+50 -> 12260 | E245: 5 | F245: 5
A246: 10243 | B246: 猩猩巨魔244 | C246: =R[-1]C+30 -> 6980 | D246: =R[-1]C+50 -> 12310 | E246: 5 | F246: 5
A247: 10244 | B247: 猴儿精245 | C247: =R[-1]C+30 -> 7010 | D247: =R[-1]C+50 -> 12360 | E247: 5 | F247: 5
A248: 10245 | B248: 巨蟒怪246 | C248: =R[-1]C+30 -> 7040 | D248: =R[-1]C+50 -> 12410 | E248: 5 | F248: 5
A249: 10246 | B249: 地狱小鬼247 | C249: =R[-1]C+30 -> 7070 | D249: =R[-1]C+50 -> 12460 | E249: 5 | F249: 5
A250: 10247 | B250: 狮子怪248 | C250: =R[-1]C+30 -> 7100 | D250: =R[-1]C+50 -> 12510 | E250: 5 | F250: 5
A251: 10248 | B251: 蚊子怪249 | C251: =R[-1]C+30 -> 7130 | D251: =R[-1]C+50 -> 12560 | E251: 5 | F251: 5
A252: 10249 | B252: 火焰怪250 | C252: =R[-1]C+30 -> 7160 | D252: =R[-1]C+50 -> 12610 | E252: 5 | F252: 5
A253: 10250 | B253: 河童怪251 | C253: =R[-1]C+30 -> 7190 | D253: =R[-1]C+50 -> 12660 | E253: 5 | F253: 5
A254: 10251 | B254: 独角兽252 | C254: =R[-1]C+30 -> 7220 | D254: =R[-1]C+50 -> 12710 | E254: 5 | F254: 5
A255: 10252 | B255: 人鱼怪253 | C255: =R[-1]C+30 -> 7250 | D255: =R[-1]C+50 -> 12760 | E255: 5 | F255: 5
A256: 10253 | B256: 巨齿狼王254 | C256: =R[-1]C+30 -> 7280 | D256: =R[-1]C+50 -> 12810 | E256: 5 | F256: 5
A257: 10254 | B257: 双头牛怪255 | C257: =R[-1]C+30 -> 7310 | D257: =R[-1]C+50 -> 12860 | E257: 5 | F257: 5
A258: 10255 | B258: 长矛鼠怪256 | C258: =R[-1]C+30 -> 7340 | D258: =R[-1]C+50 -> 12910 | E258: 5 | F258: 5
A259: 10256 | B259: 小狗怪257 | C259: =R[-1]C+30 -> 7370 | D259: =R[-1]C+50 -> 12960 | E259: 5 | F259: 5
A260: 10257 | B260: 大狗怪258 | C260: =R[-1]C+30 -> 7400 | D260: =R[-1]C+50 -> 13010 | E260: 5 | F260: 5
A261: 10258 | B261: 蝙蝠怪259 | C261: =R[-1]C+30 -> 7430 | D261: =R[-1]C+50 -> 13060 | E261: 5 | F261: 5
A262: 10259 | B262: 蟠桃怪260 | C262: =R[-1]C+30 -> 7460 | D262: =R[-1]C+50 -> 13110 | E262: 5 | F262: 5
A263: 10260 | B263: 僵尸怪261 | C263: =R[-1]C+30 -> 7490 | D263: =R[-1]C+50 -> 13160 | E263: 5 | F263: 5
A264: 10261 | B264: 宫灯怪262 | C264: =R[-1]C+30 -> 7520 | D264: =R[-1]C+50 -> 13210 | E264: 5 | F264: 5
A265: 10262 | B265: 挂科怪263 | C265: =R[-1]C+30 -> 7550 | D265: =R[-1]C+50 -> 13260 | E265: 5 | F265: 5
A266: 10263 | B266: 自习怪264 | C266: =R[-1]C+30 -> 7580 | D266: =R[-1]C+50 -> 13310 | E266: 5 | F266: 5
A267: 10264 | B267: 灯笼怪265 | C267: =R[-1]C+30 -> 7610 | D267: =R[-1]C+50 -> 13360 | E267: 5 | F267: 5
A268: 10265 | B268: 龅牙兔266 | C268: =R[-1]C+30 -> 7640 | D268: =R[-1]C+50 -> 13410 | E268: 5 | F268: 5
A269: 10266 | B269: 乌龟精267 | C269: =R[-1]C+30 -> 7670 | D269: =R[-1]C+50 -> 13460 | E269: 5 | F269: 5
A270: 10267 | B270: 卖茶怪268 | C270: =R[-1]C+30 -> 7700 | D270: =R[-1]C+50 -> 13510 | E270: 5 | F270: 5
A271: 10268 | B271: 白骨精269 | C271: =R[-1]C+30 -> 7730 | D271: =R[-1]C+50 -> 13560 | E271: 5 | F271: 5
A272: 10269 | B272: 蛤蟆怪270 | C272: =R[-1]C+30 -> 7760 | D272: =R[-1]C+50 -> 13610 | E272: 5 | F272: 5
A273: 10270 | B273: 树精271 | C273: =R[-1]C+30 -> 7790 | D273: =R[-1]C+50 -> 13660 | E273: 5 | F273: 5
A274: 10271 | B274: 黑熊精272 | C274: =R[-1]C+30 -> 7820 | D274: =R[-1]C+50 -> 13710 | E274: 5 | F274: 5
A275: 10272 | B275: 狐狸精273 | C275: =R[-1]C+30 -> 7850 | D275: =R[-1]C+50 -> 13760 | E275: 5 | F275: 5
A276: 10273 | B276: 水晶魔灵274 | C276: =R[-1]C+30 -> 7880 | D276: =R[-1]C+50 -> 13810 | E276: 5 | F276: 5
A277: 10274 | B277: 大脸猫妖275 | C277: =R[-1]C+30 -> 7910 | D277: =R[-1]C+50 -> 13860 | E277: 5 | F277: 5
A278: 10275 | B278: 野猪妖276 | C278: =R[-1]C+30 -> 7940 | D278: =R[-1]C+50 -> 13910 | E278: 5 | F278: 5
A279: 10276 | B279: 猩猩巨魔277 | C279: =R[-1]C+30 -> 7970 | D279: =R[-1]C+50 -> 13960 | E279: 5 | F279: 5
A280: 10277 | B280: 猴儿精278 | C280: =R[-1]C+30 -> 8000 | D280: =R[-1]C+50 -> 14010 | E280: 5 | F280: 5
A281: 10278 | B281: 巨蟒怪279 | C281: =R[-1]C+30 -> 8030 | D281: =R[-1]C+50 -> 14060 | E281: 5 | F281: 5
A282: 10279 | B282: 地狱小鬼280 | C282: =R[-1]C+30 -> 8060 | D282: =R[-1]C+50 -> 14110 | E282: 5 | F282: 5
A283: 10280 | B283: 狮子怪281 | C283: =R[-1]C+30 -> 8090 | D283: =R[-1]C+50 -> 14160 | E283: 5 | F283: 5
A284: 10281 | B284: 蚊子怪282 | C284: =R[-1]C+30 -> 8120 | D284: =R[-1]C+50 -> 14210 | E284: 5 | F284: 5
A285: 10282 | B285: 火焰怪283 | C285: =R[-1]C+30 -> 8150 | D285: =R[-1]C+50 -> 14260 | E285: 5 | F285: 5
A286: 10283 | B286: 河童怪284 | C286: =R[-1]C+30 -> 8180 | D286: =R[-1]C+50 -> 14310 | E286: 5 | F286: 5
A287: 10284 | B287: 独角兽285 | C287: =R[-1]C+30 -> 8210 | D287: =R[-1]C+50 -> 14360 | E287: 5 | F287: 5
A288: 10285 | B288: 人鱼怪286 | C288: =R[-1]C+30 -> 8240 | D288: =R[-1]C+50 -> 14410 | E288: 5 | F288: 5
A289: 10286 | B289: 巨齿狼王287 | C289: =R[-1]C+30 -> 8270 | D289: =R[-1]C+50 -> 14460 | E289: 5 | F289: 5
A290: 10287 | B290: 双头牛怪288 | C290: =R[-1]C+30 -> 8300 | D290: =R[-1]C+50 -> 14510 | E290: 5 | F290: 5
A291: 10288 | B291: 长矛鼠怪289 | C291: =R[-1]C+30 -> 8330 | D291: =R[-1]C+50 -> 14560 | E291: 5 | F291: 5
A292: 10289 | B292: 小狗怪290 | C292: =R[-1]C+30 -> 8360 | D292: =R[-1]C+50 -> 14610 | E292: 5 | F292: 5
A293: 10290 | B293: 大狗怪291 | C293: =R[-1]C+30 -> 8390 | D293: =R[-1]C+50 -> 14660 | E293: 5 | F293: 5
A294: 10291 | B294: 蝙蝠怪292 | C294: =R[-1]C+30 -> 8420 | D294: =R[-1]C+50 -> 14710 | E294: 5 | F294: 5
A295: 10292 | B295: 蟠桃怪293 | C295: =R[-1]C+30 -> 8450 | D295: =R[-1]C+50 -> 14760 | E295: 5 | F295: 5
A296: 10293 | B296: 僵尸怪294 | C296: =R[-1]C+30 -> 8480 | D296: =R[-1]C+50 -> 14810 | E296: 5 | F296: 5
A297: 10294 | B297: 宫灯怪295 | C297: =R[-1]C+30 -> 8510 | D297: =R[-1]C+50 -> 14860 | E297: 5 | F297: 5
A298: 10295 | B298: 挂科怪296 | C298: =R[-1]C+30 -> 8540 | D298: =R[-1]C+50 -> 14910 | E298: 5 | F298: 5
A299: 10296 | B299: 自习怪297 | C299: =R[-1]C+30 -> 8570 | D299: =R[-1]C+50 -> 14960 | E299: 5 | F299: 5
A300: 10297 | B300: 灯笼怪298 | C300: =R[-1]C+30 -> 8600 | D300: =R[-1]C+50 -> 15010 | E300: 5 | F300: 5
A301: 10298 | B301: 龅牙兔299 | C301: =R[-1]C+30 -> 8630 | D301: =R[-1]C+50 -> 15060 | E301: 5 | F301: 5
A302: 10299 | B302: 乌龟精300 | C302: =R[-1]C+30 -> 8660 | D302: =R[-1]C+50 -> 15110 | E302: 5 | F302: 5
A303: 10300 | B303: 卖茶怪301 | C303: =R[-1]C+30 -> 8690 | D303: =R[-1]C+50 -> 15160 | E303: 5 | F303: 5
A304: 10301 | B304: 白骨精302 | C304: =R[-1]C+30 -> 8720 | D304: =R[-1]C+50 -> 15210 | E304: 5 | F304: 5
A305: 10302 | B305: 蛤蟆怪303 | C305: =R[-1]C+30 -> 8750 | D305: =R[-1]C+50 -> 15260 | E305: 5 | F305: 5
A306: 10303 | B306: 树精304 | C306: =R[-1]C+30 -> 8780 | D306: =R[-1]C+50 -> 15310 | E306: 5 | F306: 5
A307: 10304 | B307: 黑熊精305 | C307: =R[-1]C+30 -> 8810 | D307: =R[-1]C+50 -> 15360 | E307: 5 | F307: 5
A308: 10305 | B308: 狐狸精306 | C308: =R[-1]C+30 -> 8840 | D308: =R[-1]C+50 -> 15410 | E308: 5 | F308: 5
A309: 10306 | B309: 水晶魔灵307 | C309: =R[-1]C+30 -> 8870 | D309: =R[-1]C+50 -> 15460 | E309: 5 | F309: 5
A310: 10307 | B310: 大脸猫妖308 | C310: =R[-1]C+30 -> 8900 | D310: =R[-1]C+50 -> 15510 | E310: 5 | F310: 5
A311: 10308 | B311: 野猪妖309 | C311: =R[-1]C+30 -> 8930 | D311: =R[-1]C+50 -> 15560 | E311: 5 | F311: 5
A312: 10309 | B312: 猩猩巨魔310 | C312: =R[-1]C+30 -> 8960 | D312: =R[-1]C+50 -> 15610 | E312: 5 | F312: 5
A313: 10310 | B313: 猴儿精311 | C313: =R[-1]C+30 -> 8990 | D313: =R[-1]C+50 -> 15660 | E313: 5 | F313: 5
A314: 10311 | B314: 巨蟒怪312 | C314: =R[-1]C+30 -> 9020 | D314: =R[-1]C+50 -> 15710 | E314: 5 | F314: 5
A315: 10312 | B315: 地狱小鬼313 | C315: =R[-1]C+30 -> 9050 | D315: =R[-1]C+50 -> 15760 | E315: 5 | F315: 5
A316: 10313 | B316: 狮子怪314 | C316: =R[-1]C+30 -> 9080 | D316: =R[-1]C+50 -> 15810 | E316: 5 | F316: 5
A317: 10314 | B317: 蚊子怪315 | C317: =R[-1]C+30 -> 9110 | D317: =R[-1]C+50 -> 15860 | E317: 5 | F317: 5
A318: 10315 | B318: 火焰怪316 | C318: =R[-1]C+30 -> 9140 | D318: =R[-1]C+50 -> 15910 | E318: 5 | F318: 5
A319: 10316 | B319: 河童怪317 | C319: =R[-1]C+30 -> 9170 | D319: =R[-1]C+50 -> 15960 | E319: 5 | F319: 5
A320: 10317 | B320: 独角兽318 | C320: =R[-1]C+30 -> 9200 | D320: =R[-1]C+50 -> 16010 | E320: 5 | F320: 5
A321: 10318 | B321: 人鱼怪319 | C321: =R[-1]C+30 -> 9230 | D321: =R[-1]C+50 -> 16060 | E321: 5 | F321: 5
A322: 10319 | B322: 巨齿狼王320 | C322: =R[-1]C+30 -> 9260 | D322: =R[-1]C+50 -> 16110 | E322: 5 | F322: 5
A323: 10320 | B323: 双头牛怪321 | C323: =R[-1]C+30 -> 9290 | D323: =R[-1]C+50 -> 16160 | E323: 5 | F323: 5
A324: 10321 | B324: 长矛鼠怪322 | C324: =R[-1]C+30 -> 9320 | D324: =R[-1]C+50 -> 16210 | E324: 5 | F324: 5
A325: 10322 | B325: 小狗怪323 | C325: =R[-1]C+30 -> 9350 | D325: =R[-1]C+50 -> 16260 | E325: 5 | F325: 5
A326: 10323 | B326: 大狗怪324 | C326: =R[-1]C+30 -> 9380 | D326: =R[-1]C+50 -> 16310 | E326: 5 | F326: 5
A327: 10324 | B327: 蝙蝠怪325 | C327: =R[-1]C+30 -> 9410 | D327: =R[-1]C+50 -> 16360 | E327: 5 | F327: 5
A328: 10325 | B328: 蟠桃怪326 | C328: =R[-1]C+30 -> 9440 | D328: =R[-1]C+50 -> 16410 | E328: 5 | F328: 5
A329: 10326 | B329: 僵尸怪327 | C329: =R[-1]C+30 -> 9470 | D329: =R[-1]C+50 -> 16460 | E329: 5 | F329: 5
A330: 10327 | B330: 宫灯怪328 | C330: =R[-1]C+30 -> 9500 | D330: =R[-1]C+50 -> 16510 | E330: 5 | F330: 5
A331: 10328 | B331: 挂科怪329 | C331: =R[-1]C+30 -> 9530 | D331: =R[-1]C+50 -> 16560 | E331: 5 | F331: 5
A332: 10329 | B332: 自习怪330 | C332: =R[-1]C+30 -> 9560 | D332: =R[-1]C+50 -> 16610 | E332: 5 | F332: 5
A333: 10330 | B333: 灯笼怪331 | C333: =R[-1]C+30 -> 9590 | D333: =R[-1]C+50 -> 16660 | E333: 5 | F333: 5
A334: 10331 | B334: 龅牙兔332 | C334: =R[-1]C+30 -> 9620 | D334: =R[-1]C+50 -> 16710 | E334: 5 | F334: 5
A335: 10332 | B335: 乌龟精333 | C335: =R[-1]C+30 -> 9650 | D335: =R[-1]C+50 -> 16760 | E335: 5 | F335: 5
A336: 10333 | B336: 卖茶怪334 | C336: =R[-1]C+30 -> 9680 | D336: =R[-1]C+50 -> 16810 | E336: 5 | F336: 5
A337: 10334 | B337: 白骨精335 | C337: =R[-1]C+30 -> 9710 | D337: =R[-1]C+50 -> 16860 | E337: 5 | F337: 5
A338: 10335 | B338: 蛤蟆怪336 | C338: =R[-1]C+30 -> 9740 | D338: =R[-1]C+50 -> 16910 | E338: 5 | F338: 5
A339: 10336 | B339: 树精337 | C339: =R[-1]C+30 -> 9770 | D339: =R[-1]C+50 -> 16960 | E339: 5 | F339: 5
A340: 10337 | B340: 黑熊精338 | C340: =R[-1]C+30 -> 9800 | D340: =R[-1]C+50 -> 17010 | E340: 5 | F340: 5
A341: 10338 | B341: 狐狸精339 | C341: =R[-1]C+30 -> 9830 | D341: =R[-1]C+50 -> 17060 | E341: 5 | F341: 5
A342: 10339 | B342: 水晶魔灵340 | C342: =R[-1]C+30 -> 9860 | D342: =R[-1]C+50 -> 17110 | E342: 5 | F342: 5
A343: 10340 | B343: 大脸猫妖341 | C343: =R[-1]C+30 -> 9890 | D343: =R[-1]C+50 -> 17160 | E343: 5 | F343: 5
A344: 10341 | B344: 野猪妖342 | C344: =R[-1]C+30 -> 9920 | D344: =R[-1]C+50 -> 17210 | E344: 5 | F344: 5
A345: 10342 | B345: 猩猩巨魔343 | C345: =R[-1]C+30 -> 9950 | D345: =R[-1]C+50 -> 17260 | E345: 5 | F345: 5
A346: 10343 | B346: 猴儿精344 | C346: =R[-1]C+30 -> 9980 | D346: =R[-1]C+50 -> 17310 | E346: 5 | F346: 5
A347: 10344 | B347: 巨蟒怪345 | C347: =R[-1]C+30 -> 10010 | D347: =R[-1]C+50 -> 17360 | E347: 5 | F347: 5
A348: 10345 | B348: 地狱小鬼346 | C348: =R[-1]C+30 -> 10040 | D348: =R[-1]C+50 -> 17410 | E348: 5 | F348: 5
A349: 10346 | B349: 狮子怪347 | C349: =R[-1]C+30 -> 10070 | D349: =R[-1]C+50 -> 17460 | E349: 5 | F349: 5
A350: 10347 | B350: 蚊子怪348 | C350: =R[-1]C+30 -> 10100 | D350: =R[-1]C+50 -> 17510 | E350: 5 | F350: 5
A351: 10348 | B351: 火焰怪349 | C351: =R[-1]C+30 -> 10130 | D351: =R[-1]C+50 -> 17560 | E351: 5 | F351: 5
A352: 10349 | B352: 河童怪350 | C352: =R[-1]C+30 -> 10160 | D352: =R[-1]C+50 -> 17610 | E352: 5 | F352: 5
A353: 10350 | B353: 独角兽351 | C353: =R[-1]C+30 -> 10190 | D353: =R[-1]C+50 -> 17660 | E353: 5 | F353: 5
A354: 10351 | B354: 人鱼怪352 | C354: =R[-1]C+30 -> 10220 | D354: =R[-1]C+50 -> 17710 | E354: 5 | F354: 5
A355: 10352 | B355: 巨齿狼王353 | C355: =R[-1]C+30 -> 10250 | D355: =R[-1]C+50 -> 17760 | E355: 5 | F355: 5
A356: 10353 | B356: 双头牛怪354 | C356: =R[-1]C+30 -> 10280 | D356: =R[-1]C+50 -> 17810 | E356: 5 | F356: 5
A357: 10354 | B357: 长矛鼠怪355 | C357: =R[-1]C+30 -> 10310 | D357: =R[-1]C+50 -> 17860 | E357: 5 | F357: 5
A358: 10355 | B358: 小狗怪356 | C358: =R[-1]C+30 -> 10340 | D358: =R[-1]C+50 -> 17910 | E358: 5 | F358: 5
A359: 10356 | B359: 大狗怪357 | C359: =R[-1]C+30 -> 10370 | D359: =R[-1]C+50 -> 17960 | E359: 5 | F359: 5
A360: 10357 | B360: 蝙蝠怪358 | C360: =R[-1]C+30 -> 10400 | D360: =R[-1]C+50 -> 18010 | E360: 5 | F360: 5
A361: 10358 | B361: 蟠桃怪359 | C361: =R[-1]C+30 -> 10430 | D361: =R[-1]C+50 -> 18060 | E361: 5 | F361: 5
A362: 10359 | B362: 僵尸怪360 | C362: =R[-1]C+30 -> 10460 | D362: =R[-1]C+50 -> 18110 | E362: 5 | F362: 5
A363: 10360 | B363: 宫灯怪361 | C363: =R[-1]C+30 -> 10490 | D363: =R[-1]C+50 -> 18160 | E363: 5 | F363: 5
A364: 10361 | B364: 挂科怪362 | C364: =R[-1]C+30 -> 10520 | D364: =R[-1]C+50 -> 18210 | E364: 5 | F364: 5
A365: 10362 | B365: 自习怪363 | C365: =R[-1]C+30 -> 10550 | D365: =R[-1]C+50 -> 18260 | E365: 5 | F365: 5
A366: 10363 | B366: 灯笼怪364 | C366: =R[-1]C+30 -> 10580 | D366: =R[-1]C+50 -> 18310 | E366: 5 | F366: 5
A367: 10364 | B367: 龅牙兔365 | C367: =R[-1]C+30 -> 10610 | D367: =R[-1]C+50 -> 18360 | E367: 5 | F367: 5
A368: 10365 | B368: 乌龟精366 | C368: =R[-1]C+30 -> 10640 | D368: =R[-1]C+50 -> 18410 | E368: 5 | F368: 5
A369: 10366 | B369: 卖茶怪367 | C369: =R[-1]C+30 -> 10670 | D369: =R[-1]C+50 -> 18460 | E369: 5 | F369: 5
A370: 10367 | B370: 白骨精368 | C370: =R[-1]C+30 -> 10700 | D370: =R[-1]C+50 -> 18510 | E370: 5 | F370: 5
A371: 10368 | B371: 蛤蟆怪369 | C371: =R[-1]C+30 -> 10730 | D371: =R[-1]C+50 -> 18560 | E371: 5 | F371: 5
A372: 10369 | B372: 树精370 | C372: =R[-1]C+30 -> 10760 | D372: =R[-1]C+50 -> 18610 | E372: 5 | F372: 5
A373: 10370 | B373: 黑熊精371 | C373: =R[-1]C+30 -> 10790 | D373: =R[-1]C+50 -> 18660 | E373: 5 | F373: 5
A374: 10371 | B374: 狐狸精372 | C374: =R[-1]C+30 -> 10820 | D374: =R[-1]C+50 -> 18710 | E374: 5 | F374: 5
A375: 10372 | B375: 水晶魔灵373 | C375: =R[-1]C+30 -> 10850 | D375: =R[-1]C+50 -> 18760 | E375: 5 | F375: 5
A376: 10373 | B376: 大脸猫妖374 | C376: =R[-1]C+30 -> 10880 | D376: =R[-1]C+50 -> 18810 | E376: 5 | F376: 5
A377: 10374 | B377: 野猪妖375 | C377: =R[-1]C+30 -> 10910 | D377: =R[-1]C+50 -> 18860 | E377: 5 | F377: 5
A378: 10375 | B378: 猩猩巨魔376 | C378: =R[-1]C+30 -> 10940 | D378: =R[-1]C+50 -> 18910 | E378: 5 | F378: 5
A379: 10376 | B379: 猴儿精377 | C379: =R[-1]C+30 -> 10970 | D379: =R[-1]C+50 -> 18960 | E379: 5 | F379: 5
A380: 10377 | B380: 巨蟒怪378 | C380: =R[-1]C+30 -> 11000 | D380: =R[-1]C+50 -> 19010 | E380: 5 | F380: 5
A381: 10378 | B381: 地狱小鬼379 | C381: =R[-1]C+30 -> 11030 | D381: =R[-1]C+50 -> 19060 | E381: 5 | F381: 5
A382: 10379 | B382: 狮子怪380 | C382: =R[-1]C+30 -> 11060 | D382: =R[-1]C+50 -> 19110 | E382: 5 | F382: 5
A383: 10380 | B383: 蚊子怪381 | C383: =R[-1]C+30 -> 11090 | D383: =R[-1]C+50 -> 19160 | E383: 5 | F383: 5
A384: 10381 | B384: 火焰怪382 | C384: =R[-1]C+30 -> 11120 | D384: =R[-1]C+50 -> 19210 | E384: 5 | F384: 5
A385: 10382 | B385: 河童怪383 | C385: =R[-1]C+30 -> 11150 | D385: =R[-1]C+50 -> 19260 | E385: 5 | F385: 5
A386: 10383 | B386: 独角兽384 | C386: =R[-1]C+30 -> 11180 | D386: =R[-1]C+50 -> 19310 | E386: 5 | F386: 5
A387: 10384 | B387: 人鱼怪385 | C387: =R[-1]C+30 -> 11210 | D387: =R[-1]C+50 -> 19360 | E387: 5 | F387: 5
A388: 10385 | B388: 巨齿狼王386 | C388: =R[-1]C+30 -> 11240 | D388: =R[-1]C+50 -> 19410 | E388: 5 | F388: 5
A389: 10386 | B389: 双头牛怪387 | C389: =R[-1]C+30 -> 11270 | D389: =R[-1]C+50 -> 19460 | E389: 5 | F389: 5
A390: 10387 | B390: 长矛鼠怪388 | C390: =R[-1]C+30 -> 11300 | D390: =R[-1]C+50 -> 19510 | E390: 5 | F390: 5
A391: 10388 | B391: 小狗怪389 | C391: =R[-1]C+30 -> 11330 | D391: =R[-1]C+50 -> 19560 | E391: 5 | F391: 5
A392: 10389 | B392: 大狗怪390 | C392: =R[-1]C+30 -> 11360 | D392: =R[-1]C+50 -> 19610 | E392: 5 | F392: 5
A393: 10390 | B393: 蝙蝠怪391 | C393: =R[-1]C+30 -> 11390 | D393: =R[-1]C+50 -> 19660 | E393: 5 | F393: 5
A394: 10391 | B394: 蟠桃怪392 | C394: =R[-1]C+30 -> 11420 | D394: =R[-1]C+50 -> 19710 | E394: 5 | F394: 5
A395: 10392 | B395: 僵尸怪393 | C395: =R[-1]C+30 -> 11450 | D395: =R[-1]C+50 -> 19760 | E395: 5 | F395: 5
A396: 10393 | B396: 宫灯怪394 | C396: =R[-1]C+30 -> 11480 | D396: =R[-1]C+50 -> 19810 | E396: 5 | F396: 5
A397: 10394 | B397: 挂科怪395 | C397: =R[-1]C+30 -> 11510 | D397: =R[-1]C+50 -> 19860 | E397: 5 | F397: 5
A398: 10395 | B398: 自习怪396 | C398: =R[-1]C+30 -> 11540 | D398: =R[-1]C+50 -> 19910 | E398: 5 | F398: 5
A399: 10396 | B399: 灯笼怪397 | C399: =R[-1]C+30 -> 11570 | D399: =R[-1]C+50 -> 19960 | E399: 5 | F399: 5
A400: 10397 | B400: 龅牙兔398 | C400: =R[-1]C+30 -> 11600 | D400: =R[-1]C+50 -> 20010 | E400: 5 | F400: 5
A401: 10398 | B401: 乌龟精399 | C401: =R[-1]C+30 -> 11630 | D401: =R[-1]C+50 -> 20060 | E401: 5 | F401: 5
A402: 10399 | B402: 卖茶怪400 | C402: =R[-1]C+30 -> 11660 | D402: =R[-1]C+50 -> 20110 | E402: 5 | F402: 5
A403: 10400 | B403: 白骨精401 | C403: =R[-1]C+30 -> 11690 | D403: =R[-1]C+50 -> 20160 | E403: 5 | F403: 5
A404: 10401 | B404: 蛤蟆怪402 | C404: =R[-1]C+30 -> 11720 | D404: =R[-1]C+50 -> 20210 | E404: 5 | F404: 5
A405: 10402 | B405: 树精403 | C405: =R[-1]C+30 -> 11750 | D405: =R[-1]C+50 -> 20260 | E405: 5 | F405: 5
A406: 10403 | B406: 黑熊精404 | C406: =R[-1]C+30 -> 11780 | D406: =R[-1]C+50 -> 20310 | E406: 5 | F406: 5
A407: 10404 | B407: 狐狸精405 | C407: =R[-1]C+30 -> 11810 | D407: =R[-1]C+50 -> 20360 | E407: 5 | F407: 5
A408: 10405 | B408: 水晶魔灵406 | C408: =R[-1]C+30 -> 11840 | D408: =R[-1]C+50 -> 20410 | E408: 5 | F408: 5
A409: 10406 | B409: 大脸猫妖407 | C409: =R[-1]C+30 -> 11870 | D409: =R[-1]C+50 -> 20460 | E409: 5 | F409: 5
A410: 10407 | B410: 野猪妖408 | C410: =R[-1]C+30 -> 11900 | D410: =R[-1]C+50 -> 20510 | E410: 5 | F410: 5
A411: 10408 | B411: 猩猩巨魔409 | C411: =R[-1]C+30 -> 11930 | D411: =R[-1]C+50 -> 20560 | E411: 5 | F411: 5
A412: 10409 | B412: 猴儿精410 | C412: =R[-1]C+30 -> 11960 | D412: =R[-1]C+50 -> 20610 | E412: 5 | F412: 5
A413: 10410 | B413: 巨蟒怪411 | C413: =R[-1]C+30 -> 11990 | D413: =R[-1]C+50 -> 20660 | E413: 5 | F413: 5
A414: 10411 | B414: 地狱小鬼412 | C414: =R[-1]C+30 -> 12020 | D414: =R[-1]C+50 -> 20710 | E414: 5 | F414: 5
A415: 10412 | B415: 狮子怪413 | C415: =R[-1]C+30 -> 12050 | D415: =R[-1]C+50 -> 20760 | E415: 5 | F415: 5
A416: 10413 | B416: 蚊子怪414 | C416: =R[-1]C+30 -> 12080 | D416: =R[-1]C+50 -> 20810 | E416: 5 | F416: 5
A417: 10414 | B417: 火焰怪415 | C417: =R[-1]C+30 -> 12110 | D417: =R[-1]C+50 -> 20860 | E417: 5 | F417: 5
A418: 10415 | B418: 河童怪416 | C418: =R[-1]C+30 -> 12140 | D418: =R[-1]C+50 -> 20910 | E418: 5 | F418: 5
A419: 10416 | B419: 独角兽417 | C419: =R[-1]C+30 -> 12170 | D419: =R[-1]C+50 -> 20960 | E419: 5 | F419: 5
A420: 10417 | B420: 人鱼怪418 | C420: =R[-1]C+30 -> 12200 | D420: =R[-1]C+50 -> 21010 | E420: 5 | F420: 5
A421: 10418 | B421: 巨齿狼王419 | C421: =R[-1]C+30 -> 12230 | D421: =R[-1]C+50 -> 21060 | E421: 5 | F421: 5
A422: 10419 | B422: 双头牛怪420 | C422: =R[-1]C+30 -> 12260 | D422: =R[-1]C+50 -> 21110 | E422: 5 | F422: 5
A423: 10420 | B423: 长矛鼠怪421 | C423: =R[-1]C+30 -> 12290 | D423: =R[-1]C+50 -> 21160 | E423: 5 | F423: 5
A424: 10421 | B424: 小狗怪422 | C424: =R[-1]C+30 -> 12320 | D424: =R[-1]C+50 -> 21210 | E424: 5 | F424: 5
A425: 10422 | B425: 大狗怪423 | C425: =R[-1]C+30 -> 12350 | D425: =R[-1]C+50 -> 21260 | E425: 5 | F425: 5
A426: 10423 | B426: 蝙蝠怪424 | C426: =R[-1]C+30 -> 12380 | D426: =R[-1]C+50 -> 21310 | E426: 5 | F426: 5
A427: 10424 | B427: 蟠桃怪425 | C427: =R[-1]C+30 -> 12410 | D427: =R[-1]C+50 -> 21360 | E427: 5 | F427: 5
A428: 10425 | B428: 僵尸怪426 | C428: =R[-1]C+30 -> 12440 | D428: =R[-1]C+50 -> 21410 | E428: 5 | F428: 5
A429: 10426 | B429: 宫灯怪427 | C429: =R[-1]C+30 -> 12470 | D429: =R[-1]C+50 -> 21460 | E429: 5 | F429: 5
A430: 10427 | B430: 挂科怪428 | C430: =R[-1]C+30 -> 12500 | D430: =R[-1]C+50 -> 21510 | E430: 5 | F430: 5
A431: 10428 | B431: 自习怪429 | C431: =R[-1]C+30 -> 12530 | D431: =R[-1]C+50 -> 21560 | E431: 5 | F431: 5
A432: 10429 | B432: 灯笼怪430 | C432: =R[-1]C+30 -> 12560 | D432: =R[-1]C+50 -> 21610 | E432: 5 | F432: 5
A433: 10430 | B433: 龅牙兔431 | C433: =R[-1]C+30 -> 12590 | D433: =R[-1]C+50 -> 21660 | E433: 5 | F433: 5
A434: 10431 | B434: 乌龟精432 | C434: =R[-1]C+30 -> 12620 | D434: =R[-1]C+50 -> 21710 | E434: 5 | F434: 5
A435: 10432 | B435: 卖茶怪433 | C435: =R[-1]C+30 -> 12650 | D435: =R[-1]C+50 -> 21760 | E435: 5 | F435: 5
A436: 10433 | B436: 白骨精434 | C436: =R[-1]C+30 -> 12680 | D436: =R[-1]C+50 -> 21810 | E436: 5 | F436: 5
A437: 10434 | B437: 蛤蟆怪435 | C437: =R[-1]C+30 -> 12710 | D437: =R[-1]C+50 -> 21860 | E437: 5 | F437: 5
A438: 10435 | B438: 树精436 | C438: =R[-1]C+30 -> 12740 | D438: =R[-1]C+50 -> 21910 | E438: 5 | F438: 5
A439: 10436 | B439: 黑熊精437 | C439: =R[-1]C+30 -> 12770 | D439: =R[-1]C+50 -> 21960 | E439: 5 | F439: 5
A440: 10437 | B440: 狐狸精438 | C440: =R[-1]C+30 -> 12800 | D440: =R[-1]C+50 -> 22010 | E440: 5 | F440: 5
A441: 10438 | B441: 水晶魔灵439 | C441: =R[-1]C+30 -> 12830 | D441: =R[-1]C+50 -> 22060 | E441: 5 | F441: 5
A442: 10439 | B442: 大脸猫妖440 | C442: =R[-1]C+30 -> 12860 | D442: =R[-1]C+50 -> 22110 | E442: 5 | F442: 5
A443: 10440 | B443: 野猪妖441 | C443: =R[-1]C+30 -> 12890 | D443: =R[-1]C+50 -> 22160 | E443: 5 | F443: 5
A444: 10441 | B444: 猩猩巨魔442 | C444: =R[-1]C+30 -> 12920 | D444: =R[-1]C+50 -> 22210 | E444: 5 | F444: 5
A445: 10442 | B445: 猴儿精443 | C445: =R[-1]C+30 -> 12950 | D445: =R[-1]C+50 -> 22260 | E445: 5 | F445: 5
A446: 10443 | B446: 巨蟒怪444 | C446: =R[-1]C+30 -> 12980 | D446: =R[-1]C+50 -> 22310 | E446: 5 | F446: 5
A447: 10444 | B447: 地狱小鬼445 | C447: =R[-1]C+30 -> 13010 | D447: =R[-1]C+50 -> 22360 | E447: 5 | F447: 5
A448: 10445 | B448: 狮子怪446 | C448: =R[-1]C+30 -> 13040 | D448: =R[-1]C+50 -> 22410 | E448: 5 | F448: 5
A449: 10446 | B449: 蚊子怪447 | C449: =R[-1]C+30 -> 13070 | D449: =R[-1]C+50 -> 22460 | E449: 5 | F449: 5
A450: 10447 | B450: 火焰怪448 | C450: =R[-1]C+30 -> 13100 | D450: =R[-1]C+50 -> 22510 | E450: 5 | F450: 5
A451: 10448 | B451: 河童怪449 | C451: =R[-1]C+30 -> 13130 | D451: =R[-1]C+50 -> 22560 | E451: 5 | F451: 5
A452: 10449 | B452: 独角兽450 | C452: =R[-1]C+30 -> 13160 | D452: =R[-1]C+50 -> 22610 | E452: 5 | F452: 5
A453: 10450 | B453: 人鱼怪451 | C453: =R[-1]C+30 -> 13190 | D453: =R[-1]C+50 -> 22660 | E453: 5 | F453: 5
A454: 10451 | B454: 巨齿狼王452 | C454: =R[-1]C+30 -> 13220 | D454: =R[-1]C+50 -> 22710 | E454: 5 | F454: 5
A455: 10452 | B455: 双头牛怪453 | C455: =R[-1]C+30 -> 13250 | D455: =R[-1]C+50 -> 22760 | E455: 5 | F455: 5
A456: 10453 | B456: 长矛鼠怪454 | C456: =R[-1]C+30 -> 13280 | D456: =R[-1]C+50 -> 22810 | E456: 5 | F456: 5
A457: 10454 | B457: 小狗怪455 | C457: =R[-1]C+30 -> 13310 | D457: =R[-1]C+50 -> 22860 | E457: 5 | F457: 5
A458: 10455 | B458: 大狗怪456 | C458: =R[-1]C+30 -> 13340 | D458: =R[-1]C+50 -> 22910 | E458: 5 | F458: 5
A459: 10456 | B459: 蝙蝠怪457 | C459: =R[-1]C+30 -> 13370 | D459: =R[-1]C+50 -> 22960 | E459: 5 | F459: 5
A460: 10457 | B460: 蟠桃怪458 | C460: =R[-1]C+30 -> 13400 | D460: =R[-1]C+50 -> 23010 | E460: 5 | F460: 5
A461: 10458 | B461: 僵尸怪459 | C461: =R[-1]C+30 -> 13430 | D461: =R[-1]C+50 -> 23060 | E461: 5 | F461: 5
A462: 10459 | B462: 宫灯怪460 | C462: =R[-1]C+30 -> 13460 | D462: =R[-1]C+50 -> 23110 | E462: 5 | F462: 5
A463: 10460 | B463: 挂科怪461 | C463: =R[-1]C+30 -> 13490 | D463: =R[-1]C+50 -> 23160 | E463: 5 | F463: 5
A464: 10461 | B464: 自习怪462 | C464: =R[-1]C+30 -> 13520 | D464: =R[-1]C+50 -> 23210 | E464: 5 | F464: 5
A465: 10462 | B465: 灯笼怪463 | C465: =R[-1]C+30 -> 13550 | D465: =R[-1]C+50 -> 23260 | E465: 5 | F465: 5
A466: 10463 | B466: 龅牙兔464 | C466: =R[-1]C+30 -> 13580 | D466: =R[-1]C+50 -> 23310 | E466: 5 | F466: 5
A467: 10464 | B467: 乌龟精465 | C467: =R[-1]C+30 -> 13610 | D467: =R[-1]C+50 -> 23360 | E467: 5 | F467: 5
A468: 10465 | B468: 卖茶怪466 | C468: =R[-1]C+30 -> 13640 | D468: =R[-1]C+50 -> 23410 | E468: 5 | F468: 5
A469: 10466 | B469: 白骨精467 | C469: =R[-1]C+30 -> 13670 | D469: =R[-1]C+50 -> 23460 | E469: 5 | F469: 5
A470: 10467 | B470: 蛤蟆怪468 | C470: =R[-1]C+30 -> 13700 | D470: =R[-1]C+50 -> 23510 | E470: 5 | F470: 5
A471: 10468 | B471: 树精469 | C471: =R[-1]C+30 -> 13730 | D471: =R[-1]C+50 -> 23560 | E471: 5 | F471: 5
A472: 10469 | B472: 黑熊精470 | C472: =R[-1]C+30 -> 13760 | D472: =R[-1]C+50 -> 23610 | E472: 5 | F472: 5
A473: 10470 | B473: 狐狸精471 | C473: =R[-1]C+30 -> 13790 | D473: =R[-1]C+50 -> 23660 | E473: 5 | F473: 5
A474: 10471 | B474: 水晶魔灵472 | C474: =R[-1]C+30 -> 13820 | D474: =R[-1]C+50 -> 23710 | E474: 5 | F474: 5
A475: 10472 | B475: 大脸猫妖473 | C475: =R[-1]C+30 -> 13850 | D475: =R[-1]C+50 -> 23760 | E475: 5 | F475: 5
A476: 10473 | B476: 野猪妖474 | C476: =R[-1]C+30 -> 13880 | D476: =R[-1]C+50 -> 23810 | E476: 5 | F476: 5
A477: 10474 | B477: 猩猩巨魔475 | C477: =R[-1]C+30 -> 13910 | D477: =R[-1]C+50 -> 23860 | E477: 5 | F477: 5
A478: 10475 | B478: 猴儿精476 | C478: =R[-1]C+30 -> 13940 | D478: =R[-1]C+50 -> 23910 | E478: 5 | F478: 5
A479: 10476 | B479: 巨蟒怪477 | C479: =R[-1]C+30 -> 13970 | D479: =R[-1]C+50 -> 23960 | E479: 5 | F479: 5
A480: 10477 | B480: 地狱小鬼478 | C480: =R[-1]C+30 -> 14000 | D480: =R[-1]C+50 -> 24010 | E480: 5 | F480: 5
A481: 10478 | B481: 狮子怪479 | C481: =R[-1]C+30 -> 14030 | D481: =R[-1]C+50 -> 24060 | E481: 5 | F481: 5
A482: 10479 | B482: 蚊子怪480 | C482: =R[-1]C+30 -> 14060 | D482: =R[-1]C+50 -> 24110 | E482: 5 | F482: 5
A483: 10480 | B483: 火焰怪481 | C483: =R[-1]C+30 -> 14090 | D483: =R[-1]C+50 -> 24160 | E483: 5 | F483: 5
A484: 10481 | B484: 河童怪482 | C484: =R[-1]C+30 -> 14120 | D484: =R[-1]C+50 -> 24210 | E484: 5 | F484: 5
A485: 10482 | B485: 独角兽483 | C485: =R[-1]C+30 -> 14150 | D485: =R[-1]C+50 -> 24260 | E485: 5 | F485: 5
A486: 10483 | B486: 人鱼怪484 | C486: =R[-1]C+30 -> 14180 | D486: =R[-1]C+50 -> 24310 | E486: 5 | F486: 5
A487: 10484 | B487: 巨齿狼王485 | C487: =R[-1]C+30 -> 14210 | D487: =R[-1]C+50 -> 24360 | E487: 5 | F487: 5
A488: 10485 | B488: 双头牛怪486 | C488: =R[-1]C+30 -> 14240 | D488: =R[-1]C+50 -> 24410 | E488: 5 | F488: 5
A489: 10486 | B489: 长矛鼠怪487 | C489: =R[-1]C+30 -> 14270 | D489: =R[-1]C+50 -> 24460 | E489: 5 | F489: 5
A490: 10487 | B490: 小狗怪488 | C490: =R[-1]C+30 -> 14300 | D490: =R[-1]C+50 -> 24510 | E490: 5 | F490: 5
A491: 10488 | B491: 大狗怪489 | C491: =R[-1]C+30 -> 14330 | D491: =R[-1]C+50 -> 24560 | E491: 5 | F491: 5
A492: 10489 | B492: 蝙蝠怪490 | C492: =R[-1]C+30 -> 14360 | D492: =R[-1]C+50 -> 24610 | E492: 5 | F492: 5
A493: 10490 | B493: 蟠桃怪491 | C493: =R[-1]C+30 -> 14390 | D493: =R[-1]C+50 -> 24660 | E493: 5 | F493: 5
A494: 10491 | B494: 僵尸怪492 | C494: =R[-1]C+30 -> 14420 | D494: =R[-1]C+50 -> 24710 | E494: 5 | F494: 5
A495: 10492 | B495: 宫灯怪493 | C495: =R[-1]C+30 -> 14450 | D495: =R[-1]C+50 -> 24760 | E495: 5 | F495: 5
A496: 10493 | B496: 挂科怪494 | C496: =R[-1]C+30 -> 14480 | D496: =R[-1]C+50 -> 24810 | E496: 5 | F496: 5
A497: 10494 | B497: 自习怪495 | C497: =R[-1]C+30 -> 14510 | D497: =R[-1]C+50 -> 24860 | E497: 5 | F497: 5
A498: 10495 | B498: 巨齿狼王496 | C498: =R[-1]C+30 -> 14540 | D498: =R[-1]C+50 -> 24910 | E498: 5 | F498: 5
A499: 10496 | B499: 双头牛怪497 | C499: =R[-1]C+30 -> 14570 | D499: =R[-1]C+50 -> 24960 | E499: 5 | F499: 5
A500: 10497 | B500: 长矛鼠怪498 | C500: =R[-1]C+30 -> 14600 | D500: =R[-1]C+50 -> 25010 | E500: 5 | F500: 5
A501: 10498 | B501: 小狗怪499 | C501: =R[-1]C+30 -> 14630 | D501: =R[-1]C+50 -> 25060 | E501: 5 | F501: 5
A502: 10499 | B502: 大狗怪500 | C502: =R[-1]C+30 -> 14660 | D502: =R[-1]C+50 -> 25110 | E502: 5 | F502: 5
A503: 10500 | B503: 蝙蝠怪501 | C503: =R[-1]C+30 -> 14690 | D503: =R[-1]C+50 -> 25160 | E503: 5 | F503: 5

Sheet: export
A1: sheet_name | B1: export_name | C1: merge_to
A2: 任务怪物属性表 | B2: task_card