Sheet: 任务扫荡产出表
A1: 大章序号 | B1: 仙币产出
A2: id | B2: money_obtain
A3: 1 | B3: 6000
A4: 2 | B4: =R[-1]C+50 -> 6050
A5: 3 | B5: =R[-1]C+50 -> 6100
A6: 4 | B6: =R[-1]C+50 -> 6150
A7: 5 | B7: =R[-1]C+50 -> 6200
A8: 6 | B8: =R[-1]C+50 -> 6250
A9: 7 | B9: =R[-1]C+50 -> 6300
A10: 8 | B10: =R[-1]C+50 -> 6350
A11: 9 | B11: =R[-1]C+50 -> 6400
A12: 10 | B12: =R[-1]C+50 -> 6450
A13: 11 | B13: =R[-1]C+50 -> 6500
A14: 12 | B14: =R[-1]C+50 -> 6550
A15: 13 | B15: =R[-1]C+50 -> 6600
A16: 14 | B16: =R[-1]C+50 -> 6650
A17: 15 | B17: =R[-1]C+50 -> 6700
A18: 16 | B18: =R[-1]C+50 -> 6750
A19: 17 | B19: =R[-1]C+50 -> 6800
A20: 18 | B20: =R[-1]C+50 -> 6850
A21: 19 | B21: =R[-1]C+50 -> 6900
A22: 20 | B22: =R[-1]C+50 -> 6950
A23: 21 | B23: =R[-1]C+50 -> 7000
A24: 22 | B24: =R[-1]C+50 -> 7050
A25: 23 | B25: =R[-1]C+50 -> 7100
A26: 24 | B26: =R[-1]C+50 -> 7150
A27: 25 | B27: =R[-1]C+50 -> 7200
A28: 26 | B28: =R[-1]C+50 -> 7250
A29: 27 | B29: =R[-1]C+50 -> 7300
A30: 28 | B30: =R[-1]C+50 -> 7350
A31: 29 | B31: =R[-1]C+50 -> 7400
A32: 30 | B32: =R[-1]C+50 -> 7450
A33: 31 | B33: =R[-1]C+50 -> 7500
A34: 32 | B34: =R[-1]C+50 -> 7550
A35: 33 | B35: =R[-1]C+50 -> 7600
A36: 34 | B36: =R[-1]C+50 -> 7650
A37: 35 | B37: =R[-1]C+50 -> 7700
A38: 36 | B38: =R[-1]C+50 -> 7750
A39: 37 | B39: =R[-1]C+50 -> 7800
A40: 38 | B40: =R[-1]C+50 -> 7850
A41: 39 | B41: =R[-1]C+50 -> 7900
A42: 40 | B42: =R[-1]C+50 -> 7950
A43: 41 | B43: =R[-1]C+50 -> 8000
A44: 42 | B44: =R[-1]C+50 -> 8050
A45: 43 | B45: =R[-1]C+50 -> 8100
A46: 44 | B46: =R[-1]C+50 -> 8150
A47: 45 | B47: =R[-1]C+50 -> 8200
A48: 46 | B48: =R[-1]C+50 -> 8250
A49: 47 | B49: =R[-1]C+50 -> 8300
A50: 48 | B50: =R[-1]C+50 -> 8350
A51: 49 | B51: =R[-1]C+50 -> 8400
A52: 50 | B52: =R[-1]C+50 -> 8450

Sheet: export
A1: sheet_name | B1: export_name | C1: merge_to
A2: 任务扫荡产出表 | B2: wipe_out