Sheet: 成长计划
A1: id | B1: 领取等级 | C1: 领取数量
A2: id | B2: lv | C2: gold
A3: 1 | B3: 25 | C3: 100
A4: 2 | B4: =R[-1]C+5 -> 30 | C4: =R[-1]C+50 -> 150
A5: 3 | B5: =R[-1]C+5 -> 35 | C5: =R[-1]C+50 -> 200
A6: 4 | B6: =R[-1]C+5 -> 40 | C6: =R[-1]C+50 -> 250
A7: 5 | B7: =R[-1]C+5 -> 45 | C7: =R[-1]C+50 -> 300
A8: 6 | B8: =R[-1]C+5 -> 50 | C8: =R[-1]C+50 -> 350
A9: 7 | B9: =R[-1]C+5 -> 55 | C9: =R[-1]C+50 -> 400
A10: 8 | B10: =R[-1]C+5 -> 60 | C10: =R[-1]C+50 -> 450
A11: 9 | B11: =R[-1]C+5 -> 65 | C11: =R[-1]C+50 -> 500
A12: 10 | B12: =R[-1]C+5 -> 70 | C12: 550
A13: 11 | B13: =R[-1]C+5 -> 75 | C13: 630

Sheet: export
A1: sheet_name | B1: export_name | C1: merge_to
A2: 成长计划 | B2: growth_plan