Sheet: vip特权
A1: vip等级 | B1: 每日免费寻宝次数+ | C1: 每日体力购买次数+ | D1: 每日送出祝福次数+ | E1: 每日收到祝福次数+ | F1: 每日灵气采集次数+ | G1: 每日有奖竞技购买次数+ | H1: 每日经验副本购买次数 | I1: 好友上限+ | J1: 描述信息
A2: id | B2: lottery_free_count | C2: buy_power_count | D2: give_bless_count | E2: receive_bless_count | F2: spirit_collect_count | G2: challenge_buy_count | H2: exp_instance_count | I2: friend_count | J2: description
A3: 0 | B3: 0 | C3: 0 | D3: 0 | E3: 0 | F3: 0 | G3: 0 | H3: 0 | I3: 0
A4: 1 | B4: 1 | C4: 1 | D4: 0 | E4: 0 | F4: 0 | G4: 0 | H4: 0 | I4: 0
A5: 2 | B5: 1 | C5: 2 | D5: 1 | E5: 1 | F5: 1 | G5: 0 | H5: 0 | I5: 0
A6: 3 | B6: 2 | C6: 3 | D6: 2 | E6: 2 | F6: 2 | G6: 5 | H6: 0 | I6: 0
A7: 4 | B7: 2 | C7: 4 | D7: 3 | E7: 3 | F7: 3 | G7: =R[-1]C+5 -> 10 | H7: 1 | I7: 5
A8: 5 | B8: 3 | C8: 5 | D8: 4 | E8: 4 | F8: 4 | G8: =R[-1]C+5 -> 15 | H8: 1 | I8: =R[-1]C+5 -> 10
A9: 6 | B9: 4 | C9: 6 | D9: 5 | E9: 5 | F9: 5 | G9: =R[-1]C+5 -> 20 | H9: 2 | I9: =R[-1]C+5 -> 15
A10: 7 | B10: 5 | C10: 7 | D10: 6 | E10: 6 | F10: 6 | G10: =R[-1]C+5 -> 25 | H10: 2 | I10: =R[-1]C+5 -> 20
A11: 8 | B11: 6 | C11: 8 | D11: 7 | E11: 7 | F11: 7 | G11: =R[-1]C+5 -> 30 | H11: 3 | I11: =R[-1]C+5 -> 25
A12: 9 | B12: 7 | C12: 9 | D12: 8 | E12: 8 | F12: 8 | G12: =R[-1]C+5 -> 35 | H12: 4 | I12: =R[-1]C+5 -> 30
A13: 10 | B13: 8 | C13: 10 | D13: 9 | E13: 9 | F13: 9 | G13: =R[-1]C+5 -> 40 | H13: 5 | I13: =R[-1]C+5 -> 35
A14: 11 | B14: 9 | C14: 11 | D14: 10 | E14: 10 | F14: 10 | G14: =R[-1]C+5 -> 45 | H14: 5 | I14: =R[-1]C+5 -> 40
A15: 12 | B15: 10 | C15: 12 | D15: 11 | E15: 11 | F15: 11 | G15: =R[-1]C+5 -> 50 | H15: 5 | I15: =R[-1]C+5 -> 45

Sheet: export
A1: sheet_name | B1: export_name | C1: merge_to
A2: vip特权 | B2: vip_privilege