Sheet: vip礼包赠品
A1: id | B1: 活力点 | C1: 铜板 | D1: 技能点 | E1: 仙丹 | F1: 卡魂 | G1: 经验元灵 | H1: 礼包现价 | I1: 礼包原价
A2: id | B2: energy | C2: money | D2: skillPoint | E2: elixir | F2: fragments | G2: exp_card | H2: price | I2: true_price
A3: 1 | B3: 3000 | C3: 100000 | D3: 0 | E3: 0 | F3: 0 | G3: 0 | H3: 18 | I3: 66
A4: 2 | B4: =R[-1]C+1000 -> 4000 | C4: =R[-1]C+50000 -> 150000 | D4: 10000 | E4: 0 | F4: 0 | G4: 0 | H4: 58 | I4: 195
A5: 3 | B5: =R[-1]C+1000 -> 5000 | C5: =R[-1]C+50000 -> 200000 | D5: =R[-1]C+10000 -> 20000 | E5: 10000 | F5: =R[-1]C+1 -> 1 | G5: 10 | H5: 88 | I5: 246
A6: 4 | B6: =R[-1]C+1000 -> 6000 | C6: =R[-1]C+50000 -> 250000 | D6: =R[-1]C+10000 -> 30000 | E6: =R[-1]C+10000 -> 20000 | F6: =R[-1]C+1 -> 2 | G6: =R[-1]C+10 -> 20 | H6: 188 | I6: 569
A7: 5 | B7: =R[-1]C+1000 -> 7000 | C7: =R[-1]C+50000 -> 300000 | D7: =R[-1]C+10000 -> 40000 | E7: =R[-1]C+10000 -> 30000 | F7: =R[-1]C+1 -> 3 | G7: =R[-1]C+10 -> 30 | H7: 288 | I7: 726
A8: 6 | B8: =R[-1]C+1000 -> 8000 | C8: =R[-1]C+50000 -> 350000 | D8: =R[-1]C+10000 -> 50000 | E8: =R[-1]C+10000 -> 40000 | F8: =R[-1]C+1 -> 4 | G8: =R[-1]C+10 -> 40 | H8: 388 | I8: 1080
A9: 7 | B9: =R[-1]C+1000 -> 9000 | C9: =R[-1]C+50000 -> 400000 | D9: =R[-1]C+10000 -> 60000 | E9: =R[-1]C+10000 -> 50000 | F9: =R[-1]C+1 -> 5 | G9: =R[-1]C+10 -> 50 | H9: 488 | I9: 1368
A10: 8 | B10: =R[-1]C+1000 -> 10000 | C10: =R[-1]C+50000 -> 450000 | D10: =R[-1]C+10000 -> 70000 | E10: =R[-1]C+10000 -> 60000 | F10: =R[-1]C+1 -> 6 | G10: =R[-1]C+10 -> 60 | H10: 588 | I10: 1989
A11: 9 | B11: =R[-1]C+1000 -> 11000 | C11: =R[-1]C+50000 -> 500000 | D11: =R[-1]C+10000 -> 80000 | E11: =R[-1]C+10000 -> 70000 | F11: =R[-1]C+1 -> 7 | G11: =R[-1]C+10 -> 70 | H11: 688 | I11: 2366
A12: 10 | B12: =R[-1]C+1000 -> 12000 | C12: =R[-1]C+50000 -> 550000 | D12: =R[-1]C+10000 -> 90000 | E12: =R[-1]C+10000 -> 80000 | F12: =R[-1]C+1 -> 8 | G12: =R[-1]C+10 -> 80 | H12: 788 | I12: 2899
A13: 11 | B13: =R[-1]C+1000 -> 13000 | C13: =R[-1]C+50000 -> 600000 | D13: =R[-1]C+10000 -> 100000 | E13: =R[-1]C+10000 -> 90000 | F13: =R[-1]C+1 -> 9 | G13: =R[-1]C+10 -> 90 | H13: 888 | I13: 3288
A14: 12 | B14: =R[-1]C+1000 -> 14000 | C14: =R[-1]C+50000 -> 650000 | D14: =R[-1]C+10000 -> 110000 | E14: =R[-1]C+10000 -> 100000 | F14: =R[-1]C+1 -> 10 | G14: =R[-1]C+10 -> 100 | H14: 999 | I14: 3986

Sheet: export
A1: sheet_name | B1: export_name | C1: merge_to
A2: vip礼包赠品 | B2: vip_box