Sheet: vip每日登陆奖励
A1: id | B1: 仙币 | C1: 仙丹 | D1: 活力 | E1: 7级经验元灵
A2: id | B2: money | C2: elixir | D2: energy | E2: exp_card
A3: 1 | B3: 20000 | C3: 3000 | D3: 0 | E3: 10
A4: 2 | B4: =R[-1]C+20000 -> 40000 | C4: =R[-1]C+1000 -> 4000 | D4: =R[-1]C+200 -> 200 | E4: =R[-1]C+5 -> 15
A5: 3 | B5: =R[-1]C+20000 -> 60000 | C5: =R[-1]C+1000 -> 5000 | D5: =R[-1]C+200 -> 400 | E5: =R[-1]C+5 -> 20
A6: 4 | B6: =R[-1]C+20000 -> 80000 | C6: =R[-1]C+1000 -> 6000 | D6: =R[-1]C+200 -> 600 | E6: =R[-1]C+5 -> 25
A7: 5 | B7: =R[-1]C+20000 -> 100000 | C7: =R[-1]C+1000 -> 7000 | D7: =R[-1]C+200 -> 800 | E7: =R[-1]C+5 -> 30
A8: 6 | B8: =R[-1]C+20000 -> 120000 | C8: =R[-1]C+1000 -> 8000 | D8: =R[-1]C+200 -> 1000 | E8: =R[-1]C+5 -> 35
A9: 7 | B9: =R[-1]C+20000 -> 140000 | C9: =R[-1]C+1000 -> 9000 | D9: =R[-1]C+200 -> 1200 | E9: =R[-1]C+5 -> 40
A10: 8 | B10: =R[-1]C+20000 -> 160000 | C10: =R[-1]C+1000 -> 10000 | D10: =R[-1]C+200 -> 1400 | E10: =R[-1]C+5 -> 45
A11: 9 | B11: =R[-1]C+20000 -> 180000 | C11: =R[-1]C+1000 -> 11000 | D11: =R[-1]C+200 -> 1600 | E11: =R[-1]C+5 -> 50
A12: 10 | B12: =R[-1]C+20000 -> 200000 | C12: =R[-1]C+1000 -> 12000 | D12: =R[-1]C+200 -> 1800 | E12: =R[-1]C+5 -> 55
A13: 11 | B13: =R[-1]C+20000 -> 220000 | C13: =R[-1]C+1000 -> 13000 | D13: =R[-1]C+200 -> 2000 | E13: =R[-1]C+5 -> 60
A14: 12 | B14: =R[-1]C+20000 -> 240000 | C14: =R[-1]C+1000 -> 14000 | D14: =R[-1]C+200 -> 2200 | E14: =R[-1]C+5 -> 65

Sheet: export
A1: sheet_name | B1: export_name | C1: merge_to
A2: vip每日登陆奖励 | B2: vip_daily_reward